,agenda_item,text,speaker,number_p,number_w,chair,language_ps,ps
8, 7. Elezzjoni tal-President tal-Parlament Ewropew,"− Koleżanki i Koledzy, wysocy przedstawiciele Rady, Panie Przewodniczący Komisji Europejskiej, Panie i Panowie Komisarze, Panie i Panowie! Dzisiaj jest 14 lipca, święto narodowe Francji, 220 lat po rewolucji. Gratulujemy naszym koleżankom i kolegom.(oklaski)Przesłaniem rewolucji były 3 słowa: wolność, równość, braterstwo. Każde z nich brzmi silnie i pewnie w dzisiejszej Unii Europejskiej. To wielki dzień, przede wszystkim w wymiarze symbolicznym. Przedstawiciel kraju Europy Środkowo-Wschodniej przejmuje z woli waszej, europosłów, odpowiedzialność za przewodniczenie Parlamentowi. Pozwólcie mi na osobistą uwagę. Kiedyś, przed laty, marzyłem, aby być posłem na polski sejm, gdy Polska odzyska wolność. Dzisiaj obejmuję funkcję przewodniczącego Parlamentu Europejskiego, o czym kiedyś w moim kraju nie śmiałem nawet marzyć. Tak zmienia się nasza Europa.(oklaski)Ten wybór traktuję jako znak dla naszych krajów: Estonii, Łotwy, Litwy, Polski, Czech, Słowacji, Węgier, Słowenii, Rumunii i Bułgarii. Traktuję też jako wyraz hołdu dla milionów obywateli naszych krajów, którzy nie poddali się złowrogiemu systemowi. Czuję się reprezentantem wszystkich tych krajów. (oklaski)Dwadzieścia lat temu, latem 1989 roku, Solidarność wygrała bój o wolną, demokratyczną Polskę, co dało początek Jesieni Ludów w Europie i zburzeniu muru berlińskiego. Kiedyś my, po jednej stronie żelaznej kurtyny, walczyliśmy o wolność i demokrację; wy, po drugiej stronie, pomagaliście nam działaniami politycznymi i małymi, ale jakże ważnymi gestami, manifestując poparcie, śląc paczki z pomocą – i udało się. We were successful. Od pięciu lat wspólnie budujemy zjednoczoną Europę. Nie ma nas i was, możemy mocno powiedzieć –to jest nasza wspólna Europa. Mówiłem o odpowiedzialności. Każdy z nas, europosłów, dostał do ręki trochę władzy, ale władza to przede wszystkim odpowiedzialność za obywateli. Ja czuję na sobie tę odpowiedzialność. Obywatele Unii zaufali nam. W sprawach wielkich musimy stać na straży demokracji. W sprawach podstawowych mieszkańcy Europy oczekują od nas, polityków, że wyjdziemy z kryzysu, i musimy natychmiast się tym zająć. Chcą mieć pracę, sprawa zatrudnienia to jest nasze podstawowe zadanie. Nasi wyborcy chcą mieć pewność, że jak odkręcą kurek z gazem, to gaz popłynie – dlatego tak ważne jest bezpieczeństwo energetyczne. Nasi obywatele obawiają się, że dosięgną nas skutki zmian klimatycznych, jak w Azji, Afryce czy na Pacyfiku. Musimy temu przeciwdziałać. Europejczycy wiedzą, że pokój i stabilność zależy nie tylko od nas. Dlatego ważny jest rejon Morza Śródziemnego, partnerstwo wschodnie i Ameryka Łacińska, ale także strategiczne partnerstwo ze Stanami Zjednoczonymi oraz rosnącymi potęgami światowymi. Aby to wszystko nam się udało, musimy mieć traktat lizboński, bo musimy być w Unii dobrze zorganizowani i sprawni, także w Parlamencie Europejskim.Trzydzieści lat temu nasz Parlament został po raz pierwszy wybrany w wyborach bezpośrednich. Jego przewodniczącą została kobieta, Francuzka Simone Veil. Musimy pamiętać, aby kobietom stwarzać takie warunki, by mogły się w pełni realizować w działalności publicznej i zawodowej bez konieczności rezygnowania z macierzyństwa i życia rodzinnego. Wtedy Simone Veil powiedziała: „Państwa członkowskie stoją przed trzema wielkimi wyzwaniami: wyzwaniem pokoju, wyzwaniem wolności i wyzwaniem dobrobytu.“ Jasne jest, że można im skutecznie stawić czoła jedynie w wymiarze europejskim. Po trzydziestu latach to są także nasze dzisiejsze wyzwania. Musimy im sprostać. Koleżanki i Koledzy! Szczegóły programu mojej dwuipółletniej kadencji chciałbym przedstawić wam pod dyskusję w specjalnym wystąpieniu podczas sesji wrześniowej w Strasburgu. Chciałem teraz zwrócić się do mojego poprzednika, Hansa-Gerta Pötteringa. Hans-Gert, to szczególny moment. Znamy się od 10 lat. Dzisiaj przekazujesz mi najwyższy urząd w Parlamencie Europejskim. W imieniu wszystkich koleżanek i kolegów dziękuję Ci za wielki szacunek, jaki uzyskałeś dla naszej izby, za kulturę i klasę w polityce.(oklaski)Na pamiątkę przekazuję ci figurkę świętej Barbary, opiekunki górników, wykonanej z jednego kawałka węgla. Dar Solidarności z mojego regionu, Śląska. Jeszcze raz wielkie gratulacje i życzenia na przyszłość. Dziękujemy! (Zgromadzenie oklaskuje mówcę na stojąco)",−,15,597,not_available,"['mlt', 'mlt', 'mlt', 'mlt', 'mlt', 'mlt', 'mlt', 'mlt', 'mlt', 'mlt', 'mlt', 'mlt', 'mlt', 'mlt', 'mlt']","['− Koleżanki i Koledzy, wysocy przedstawiciele Rady, Panie Przewodniczący Komisji Europejskiej, Panie i Panowie Komisarze, Panie i Panowie! Dzisiaj jest 14 lipca, święto narodowe Francji, 220 lat po rewolucji. Gratulujemy naszym koleżankom i kolegom.', '(oklaski)', 'Przesłaniem rewolucji były 3 słowa: wolność, równość, braterstwo. Każde z nich brzmi silnie i pewnie w dzisiejszej Unii Europejskiej. To wielki dzień, przede wszystkim w wymiarze symbolicznym. Przedstawiciel kraju Europy Środkowo-Wschodniej przejmuje z woli waszej, europosłów, odpowiedzialność za przewodniczenie Parlamentowi. ', 'Pozwólcie mi na osobistą uwagę. Kiedyś, przed laty, marzyłem, aby być posłem na polski sejm, gdy Polska odzyska wolność. Dzisiaj obejmuję funkcję przewodniczącego Parlamentu Europejskiego, o czym kiedyś w moim kraju nie śmiałem nawet marzyć. Tak zmienia się nasza Europa.', '(oklaski)', 'Ten wybór traktuję jako znak dla naszych krajów: Estonii, Łotwy, Litwy, Polski, Czech, Słowacji, Węgier, Słowenii, Rumunii i Bułgarii. Traktuję też jako wyraz hołdu dla milionów obywateli naszych krajów, którzy nie poddali się złowrogiemu systemowi. Czuję się reprezentantem wszystkich tych krajów. ', '(oklaski)', 'Dwadzieścia lat temu, latem 1989 roku, Solidarność wygrała bój o wolną, demokratyczną Polskę, co dało początek Jesieni Ludów w Europie i zburzeniu muru berlińskiego. Kiedyś my, po jednej stronie żelaznej kurtyny, walczyliśmy o wolność i demokrację; wy, po drugiej stronie, pomagaliście nam działaniami politycznymi i małymi, ale jakże ważnymi gestami, manifestując poparcie, śląc paczki z pomocą – i udało się. We were successful. Od pięciu lat wspólnie budujemy zjednoczoną Europę. Nie ma nas i was, możemy mocno powiedzieć –to jest nasza wspólna Europa. ', 'Mówiłem o odpowiedzialności. Każdy z nas, europosłów, dostał do ręki trochę władzy, ale władza to przede wszystkim odpowiedzialność za obywateli. Ja czuję na sobie tę odpowiedzialność. Obywatele Unii zaufali nam. W sprawach wielkich musimy stać na straży demokracji. W sprawach podstawowych mieszkańcy Europy oczekują od nas, polityków, że wyjdziemy z kryzysu, i musimy natychmiast się tym zająć. Chcą mieć pracę, sprawa zatrudnienia to jest nasze podstawowe zadanie. Nasi wyborcy chcą mieć pewność, że jak odkręcą kurek z gazem, to gaz popłynie – dlatego tak ważne jest bezpieczeństwo energetyczne. Nasi obywatele obawiają się, że dosięgną nas skutki zmian klimatycznych, jak w Azji, Afryce czy na Pacyfiku. Musimy temu przeciwdziałać. Europejczycy wiedzą, że pokój i stabilność zależy nie tylko od nas. Dlatego ważny jest rejon Morza Śródziemnego, partnerstwo wschodnie i Ameryka Łacińska, ale także strategiczne partnerstwo ze Stanami Zjednoczonymi oraz rosnącymi potęgami światowymi. Aby to wszystko nam się udało, musimy mieć traktat lizboński, bo musimy być w Unii dobrze zorganizowani i sprawni, także w Parlamencie Europejskim.', 'Trzydzieści lat temu nasz Parlament został po raz pierwszy wybrany w wyborach bezpośrednich. Jego przewodniczącą została kobieta, Francuzka Simone Veil. Musimy pamiętać, aby kobietom stwarzać takie warunki, by mogły się w pełni realizować w działalności publicznej i zawodowej bez konieczności rezygnowania z macierzyństwa i życia rodzinnego. Wtedy Simone Veil powiedziała: „Państwa członkowskie stoją przed trzema wielkimi wyzwaniami: wyzwaniem pokoju, wyzwaniem wolności i wyzwaniem dobrobytu.“ Jasne jest, że można im skutecznie stawić czoła jedynie w wymiarze europejskim. Po trzydziestu latach to są także nasze dzisiejsze wyzwania. Musimy im sprostać. ', 'Koleżanki i Koledzy! Szczegóły programu mojej dwuipółletniej kadencji chciałbym przedstawić wam pod dyskusję w specjalnym wystąpieniu podczas sesji wrześniowej w Strasburgu. ', 'Chciałem teraz zwrócić się do mojego poprzednika, Hansa-Gerta Pötteringa. Hans-Gert, to szczególny moment. Znamy się od 10 lat. Dzisiaj przekazujesz mi najwyższy urząd w Parlamencie Europejskim. W imieniu wszystkich koleżanek i kolegów dziękuję Ci za wielki szacunek, jaki uzyskałeś dla naszej izby, za kulturę i klasę w polityce.', '(oklaski)', 'Na pamiątkę przekazuję ci figurkę świętej Barbary, opiekunki górników, wykonanej z jednego kawałka węgla. Dar Solidarności z mojego regionu, Śląska. Jeszcze raz wielkie gratulacje i życzenia na przyszłość. Dziękujemy! ', '(Zgromadzenie oklaskuje mówcę na stojąco)']"
9, 7. Elezzjoni tal-President tal-Parlament Ewropew,"  Joseph Daul,  au nom du groupe PPE. – Monsieur le Président, ce n'était pas prévu, mais c'est une joie – je crois – pour tous ici de ne plus avoir d'Europe de l'Est ni de l'Ouest pour la première fois dans ce Parlement. Nous avons simplement une Europe par le symbole de notre Président qui est à la tribune aujourd'hui.(Applaudissements) C'est cela l'unité, c'est cela aussi nos responsabilités, comme tu l'as dit précédemment, mon cher Jerzy Buzek. Oublier l'Est et l'Ouest, dans les deux années et demi de ta présidence, et ne parler que d'une seule Europe, voilà ce que je souhaite pour toi et pour l'Europe.","Joseph Daul,",3,119,not_available,"['mlt', 'mlt', 'mlt']","[""  Joseph Daul,  au nom du groupe PPE. – Monsieur le Président, ce n'était pas prévu, mais c'est une joie – je crois – pour tous ici de ne plus avoir d'Europe de l'Est ni de l'Ouest pour la première fois dans ce Parlement. Nous avons simplement une Europe par le symbole de notre Président qui est à la tribune aujourd'hui."", '(Applaudissements)', "" C'est cela l'unité, c'est cela aussi nos responsabilités, comme tu l'as dit précédemment, mon cher Jerzy Buzek. Oublier l'Est et l'Ouest, dans les deux années et demi de ta présidence, et ne parler que d'une seule Europe, voilà ce que je souhaite pour toi et pour l'Europe.""]"
10, 7. Elezzjoni tal-President tal-Parlament Ewropew,"  Martin Schulz,  im Namen der S&D-Fraktion. – Herr Präsident! Ich gratuliere Ihnen im Namen unserer Fraktion zu Ihrer Wahl. Wir haben diese Wahl unterstützt. Und auch wenn man mit dem Begriff „historischer Moment“ sicher sehr vorsichtig umgehen sollte, erlaube ich mir zu sagen, dass Ihre Wahl zum Präsidenten des Europäischen Parlaments ein historischer Moment ist. (Beifall)Denn dass 20 Jahre nach dem Fall der Berliner Mauer, sechs Jahre nach dem Beitritt Ihres Landes und vieler anderer mittel- und osteuropäischer Länder zur Europäischen Union – übrigens ein Prozess, den Sie als Premierminister Ihres Landes selbst eingeleitet hatten, weil ja die Beitrittsverhandlungen in Ihrer Regierungszeit aufgenommen wurden –, dass 20 Jahre nach der Überwindung der Teilung der Welt in zwei waffenstarrende Blöcke, nach der Überwindung der stalinistischen Diktaturen die Staaten, die 40 Jahre länger unter diesen Diktaturen haben leiden müssen, als der westliche Teil Europas unter den faschistischen Diktaturen hat leiden müssen, die Tatsache, dass es 20 Jahre später selbstverständlich ist, dass polnische Abgeordnete, ungarische Abgeordnete, baltische Abgeordnete, Tschechen, Slowaken, Abgeordnete aus welchen Ländern auch immer mit Franzosen, Portugiesen, Finnen oder Deutschen, Österreichern oder Italienern gemeinsam in dieser Versammlung sitzen und dass wir in einem Wahlakt von freier, geheimer und gleicher Wahl einen Repräsentanten der Solidarnośź, einen demokratisch gewählten Regierungschef Polens an die Spitze dieser Versammlung wählen können, das ist in meinen Augen ein historischer Moment, der beweist, dass Europa – dieser große Kontinent, in dem sich 27 Staaten zur EU zusammengeschlossen haben – tatsächlich etwas repräsentiert, nämlich, dass der Traum von Demokratie und Freiheit Wirklichkeit werden kann, wenn man ihn nicht nur träumt, sondern wenn man sich aktiv dafür einsetzt, wie Sie es in Ihrem Leben getan haben! Deshalb glaube ich, dass Ihre Präsidentschaft auch ein Appell an uns alle ist und dass die Werte, auf denen diese Union gegründet wurde, die Werte sind, die die Diktatoren in die Enge getrieben haben und die Diktaturen überwunden haben. Dass diese Werte Ihre Präsidentschaft begleiten mögen, ist der Wunsch unserer Fraktion. Mein aufrichtiger Glückwunsch, Herr Buzek!    (Beifall)","Martin Schulz,",5,331,not_available,"['mlt', 'mlt', 'mlt', 'mlt', 'mlt']","['  Martin Schulz,  im Namen der S&D-Fraktion. – Herr Präsident! Ich gratuliere Ihnen im Namen unserer Fraktion zu Ihrer Wahl. Wir haben diese Wahl unterstützt. Und auch wenn man mit dem Begriff „historischer Moment“ sicher sehr vorsichtig umgehen sollte, erlaube ich mir zu sagen, dass Ihre Wahl zum Präsidenten des Europäischen Parlaments ein historischer Moment ist. ', '(Beifall)', 'Denn dass 20 Jahre nach dem Fall der Berliner Mauer, sechs Jahre nach dem Beitritt Ihres Landes und vieler anderer mittel- und osteuropäischer Länder zur Europäischen Union – übrigens ein Prozess, den Sie als Premierminister Ihres Landes selbst eingeleitet hatten, weil ja die Beitrittsverhandlungen in Ihrer Regierungszeit aufgenommen wurden –, dass 20 Jahre nach der Überwindung der Teilung der Welt in zwei waffenstarrende Blöcke, nach der Überwindung der stalinistischen Diktaturen die Staaten, die 40 Jahre länger unter diesen Diktaturen haben leiden müssen, als der westliche Teil Europas unter den faschistischen Diktaturen hat leiden müssen, die Tatsache, dass es 20 Jahre später selbstverständlich ist, dass polnische Abgeordnete, ungarische Abgeordnete, baltische Abgeordnete, Tschechen, Slowaken, Abgeordnete aus welchen Ländern auch immer mit Franzosen, Portugiesen, Finnen oder Deutschen, Österreichern oder Italienern gemeinsam in dieser Versammlung sitzen und dass wir in einem Wahlakt von freier, geheimer und gleicher Wahl einen Repräsentanten der Solidarnośź, einen demokratisch gewählten Regierungschef Polens an die Spitze dieser Versammlung wählen können, das ist in meinen Augen ein historischer Moment, der beweist, dass Europa – dieser große Kontinent, in dem sich 27 Staaten zur EU zusammengeschlossen haben – tatsächlich etwas repräsentiert, nämlich, dass der Traum von Demokratie und Freiheit Wirklichkeit werden kann, wenn man ihn nicht nur träumt, sondern wenn man sich aktiv dafür einsetzt, wie Sie es in Ihrem Leben getan haben! ', 'Deshalb glaube ich, dass Ihre Präsidentschaft auch ein Appell an uns alle ist und dass die Werte, auf denen diese Union gegründet wurde, die Werte sind, die die Diktatoren in die Enge getrieben haben und die Diktaturen überwunden haben. Dass diese Werte Ihre Präsidentschaft begleiten mögen, ist der Wunsch unserer Fraktion. Mein aufrichtiger Glückwunsch, Herr Buzek!    ', '(Beifall)']"
11, 7. Elezzjoni tal-President tal-Parlament Ewropew,"  Guy Verhofstadt,  on behalf of the ALDE Group. – Mr President, first of all congratulations from the Liberal and Democratic Group on your election. I can tell you that you have the full support of the Liberal and Democratic Group for the forthcoming years in your work. Your work, from our point of view, means the creation of a more integrated European Union and a European Union that uses the community method.You have become President at a very difficult time: we have to ratify the Lisbon Treaty; we have to find a single strategy against the economic and financial crisis. It is a huge task in which you have the full support of our group. You should know that you have behind you a large pro-European majority in this Parliament. You should be aware of that.(Applause)The only request we have is to use it, this large pro-European majority. To go forward with Europe and also to say what you have to say in the European Council, that you know so well – as I do. I hope that you can make your voice heard there and have more ‘Europe’ in that institution also.(Applause)","Guy Verhofstadt,",5,197,not_available,"['mlt', 'mlt', 'mlt', 'mlt', 'mlt']","['  Guy Verhofstadt,  on behalf of the ALDE Group. – Mr President, first of all congratulations from the Liberal and Democratic Group on your election. I can tell you that you have the full support of the Liberal and Democratic Group for the forthcoming years in your work. Your work, from our point of view, means the creation of a more integrated European Union and a European Union that uses the community method.', 'You have become President at a very difficult time: we have to ratify the Lisbon Treaty; we have to find a single strategy against the economic and financial crisis. It is a huge task in which you have the full support of our group. You should know that you have behind you a large pro-European majority in this Parliament. You should be aware of that.', '(Applause)', 'The only request we have is to use it, this large pro-European majority. To go forward with Europe and also to say what you have to say in the European Council, that you know so well – as I do. I hope that you can make your voice heard there and have more ‘Europe’ in that institution also.', '(Applause)']"
12, 7. Elezzjoni tal-President tal-Parlament Ewropew,"  Rebecca Harms,  im Namen der Verts/ALE-Fraktion. – Herr Präsident! Auch ich möchte mich im Namen meiner Fraktion den Glückwünschen der Vorredner anschließen. Wir teilen die Freude über diesen Moment. Ich denke, dass Sie ein bisschen untertrieben haben, Herr Präsident, wenn Sie sagen, es ist eine Ehre für Sie, diese Position anzunehmen, in die wir Sie heute gewählt haben. Es ist vielmehr eine Ehre für uns – jedenfalls aus Sicht der grünen Fraktion –,  dass wir Sie zum Präsidenten bekommen. Sie haben sich mit Ihrem gesamten politischen Leben das verdient, was Sie jetzt tun werden, und wir alle setzen große Hoffnungen in Sie. Ich bin mir nicht sicher, ob es gelingt, in zweieinhalb Jahren das Trennende, das es in der Europäischen Union noch zwischen Ost und West gibt, zu überwinden, aber ich glaube, dass wir mit Ihnen an der Spitze dieses Hauses die Brücken zwischen Ost und West stärken können. Ich wünsche mir persönlich, dass gerade den Kollegen aus Westeuropa deutlich wird, dass Polen mitten auf dem Kontinent liegt, dass Sie aus einem Land im Zentrum des Kontinents stammen und dass die Arbeit in Richtung Osten sehr viel intensiver erfolgen muss als bisher. Sie bringen dafür die allerbesten Voraussetzungen mit. Ich habe mich sehr gefreut, dass Sie gesagt haben, die Nähe zum Bürger muss gesucht werden. Da sind wir als grüne Fraktion immer bei Ihnen. Europa nach innen zu stärken, ist das Eine, aber Europa auch größer zu denken, ist das Andere. Gestatten Sie mir, noch einen persönlichen Wunsch zu äußern: Nachdem ich Sie ja in den Zeiten der Orangen Revolution auf den Straßen und Plätzen Kiews besonders gut – und auch dort noch als sehr mutigen Politiker – kennengelernt habe, lassen Sie uns bei der Ostorientierung die Ukraine nicht vergessen. Auch dort müssen wieder bessere Zeiten kommen! Was ich mir persönlich wünschen würde: Wenn die europäischen Fußballmeisterschaften stattfinden – und das ist ja nicht mehr lange hin – die in Polen und in der Ukraine ausgetragen werden, lassen Sie uns zusammen das eine oder andere Spiel anschauen!Ich wünsche Ihnen viel Erfolg für Ihre Arbeit!(Beifall)","Rebecca Harms,",6,341,not_available,"['mlt', 'mlt', 'mlt', 'mlt', 'mlt', 'mlt']","['  Rebecca Harms,  im Namen der Verts/ALE-Fraktion. – Herr Präsident! Auch ich möchte mich im Namen meiner Fraktion den Glückwünschen der Vorredner anschließen. Wir teilen die Freude über diesen Moment. ', 'Ich denke, dass Sie ein bisschen untertrieben haben, Herr Präsident, wenn Sie sagen, es ist eine Ehre für Sie, diese Position anzunehmen, in die wir Sie heute gewählt haben. Es ist vielmehr eine Ehre für uns – jedenfalls aus Sicht der grünen Fraktion –,  dass wir Sie zum Präsidenten bekommen. Sie haben sich mit Ihrem gesamten politischen Leben das verdient, was Sie jetzt tun werden, und wir alle setzen große Hoffnungen in Sie. Ich bin mir nicht sicher, ob es gelingt, in zweieinhalb Jahren das Trennende, das es in der Europäischen Union noch zwischen Ost und West gibt, zu überwinden, aber ich glaube, dass wir mit Ihnen an der Spitze dieses Hauses die Brücken zwischen Ost und West stärken können. ', 'Ich wünsche mir persönlich, dass gerade den Kollegen aus Westeuropa deutlich wird, dass Polen mitten auf dem Kontinent liegt, dass Sie aus einem Land im Zentrum des Kontinents stammen und dass die Arbeit in Richtung Osten sehr viel intensiver erfolgen muss als bisher. Sie bringen dafür die allerbesten Voraussetzungen mit. Ich habe mich sehr gefreut, dass Sie gesagt haben, die Nähe zum Bürger muss gesucht werden. Da sind wir als grüne Fraktion immer bei Ihnen. Europa nach innen zu stärken, ist das Eine, aber Europa auch größer zu denken, ist das Andere. ', 'Gestatten Sie mir, noch einen persönlichen Wunsch zu äußern: Nachdem ich Sie ja in den Zeiten der Orangen Revolution auf den Straßen und Plätzen Kiews besonders gut – und auch dort noch als sehr mutigen Politiker – kennengelernt habe, lassen Sie uns bei der Ostorientierung die Ukraine nicht vergessen. Auch dort müssen wieder bessere Zeiten kommen! Was ich mir persönlich wünschen würde: Wenn die europäischen Fußballmeisterschaften stattfinden – und das ist ja nicht mehr lange hin – die in Polen und in der Ukraine ausgetragen werden, lassen Sie uns zusammen das eine oder andere Spiel anschauen!', 'Ich wünsche Ihnen viel Erfolg für Ihre Arbeit!', '(Beifall)']"
13, 7. Elezzjoni tal-President tal-Parlament Ewropew,"  Timothy Kirkhope,  on behalf of the ECR Group. – Mr President, may I congratulate you on your presidency and in particular welcome the fact that in your remarks you have referred to history – and others have referred to it as well. You certainly seem to be someone who will value the freedoms which this House wishes to have: the freedom of expression, but also the freedoms of looking ahead, of change and reform in Europe, and that this House must change and reform with Europe.The fact that you have a history of which you are proud, and rightfully so, from 1980 in Solidarność and onwards, where you brought Poland into NATO and then started the negotiations for membership of the European Union, you are someone who can embrace the changes that Europe needs now.We welcome you. We will do our very best to help you in the job that you have taken on.(Applause)","Timothy Kirkhope,",4,155,not_available,"['mlt', 'mlt', 'mlt', 'mlt']","['  Timothy Kirkhope,  on behalf of the ECR Group. – Mr President, may I congratulate you on your presidency and in particular welcome the fact that in your remarks you have referred to history – and others have referred to it as well. You certainly seem to be someone who will value the freedoms which this House wishes to have: the freedom of expression, but also the freedoms of looking ahead, of change and reform in Europe, and that this House must change and reform with Europe.', 'The fact that you have a history of which you are proud, and rightfully so, from 1980 in Solidarność and onwards, where you brought Poland into NATO and then started the negotiations for membership of the European Union, you are someone who can embrace the changes that Europe needs now.', 'We welcome you. We will do our very best to help you in the job that you have taken on.', '(Applause)']"
