,agenda_item,text,speaker,number_p,number_w,chair,language_ps,ps
0, 1. Ftuħ tas-seduta (l-ewwel seduta tal-Parlament ġdid elett),VORSITZ: HANS-GERT PÖTTERING  (Die Sitzung wird um 10.05 Uhr eröffnet),VORSITZ: HANS-GERT PÖTTERING,2,12,not_available,"['mlt', 'mlt']","['VORSITZ: HANS-GERT PÖTTERING  ', '(Die Sitzung wird um 10.05 Uhr eröffnet)']"
1, 1. Ftuħ tas-seduta (l-ewwel seduta tal-Parlament ġdid elett),"  Der Präsident. −   Liebe Kolleginnen und Kollegen! Gemäß dem Akt zur Einführung allgemeiner unmittelbarer Wahlen der Abgeordneten des Europäischen Parlaments erkläre ich die erste Sitzung des Europäischen Parlaments nach den Wahlen für eröffnet.(Beifall)Ich darf Sie bitten, sich zur Europahymne von Ihren Plätzen zu erheben. ***Liebe Kolleginnen und Kollegen! Ich darf Sie herzlich zur ersten Sitzung des Europäischen Parlaments nach der Wahl begrüßen und Sie alle beglückwünschen: die wiedergewählten Kolleginnen und Kollegen und die erstmalig gewählten Kolleginnen und Kollegen. Etwas weniger als die Hälfte der 736 Abgeordneten sind erstmalig ins Europäische Parlament gewählt worden. Besonders erfreulich ist, dass 35 % der Abgeordneten Frauen sind – ein Anteil, der im Europäischen Parlament noch nie so hoch war!(Beifall)170 Millionen Bürgerinnen und Bürger haben sich an der Wahl beteiligt und unsere Arbeit dient einem großen Ziel: der Einigung unseres Kontinents! Vergessen wir bei der Arbeit nie: Die Europäische Union beruht auf Werten. Die Würde des Menschen, die Menschenrechte, die Freiheit, die Demokratie, das Recht, der Frieden sind Grundlage unseres Handelns. Wir sind durch Solidarität verbunden. Ich bitte Sie, dass wir uns immer von Respekt und Achtung für einander leiten lassen. Wenn dies der Fall ist, werden wir erfolgreich sein. Gehen wir jetzt an unsere Arbeit! ",Der Präsident. −,7,202,not_available,"['mlt', 'mlt', 'mlt', 'mlt', 'mlt', 'mlt', 'mlt']","['  Der Präsident. −   Liebe Kolleginnen und Kollegen! Gemäß dem Akt zur Einführung allgemeiner unmittelbarer Wahlen der Abgeordneten des Europäischen Parlaments erkläre ich die erste Sitzung des Europäischen Parlaments nach den Wahlen für eröffnet.', '(Beifall)', 'Ich darf Sie bitten, sich zur Europahymne von Ihren Plätzen zu erheben. ', '***', 'Liebe Kolleginnen und Kollegen! Ich darf Sie herzlich zur ersten Sitzung des Europäischen Parlaments nach der Wahl begrüßen und Sie alle beglückwünschen: die wiedergewählten Kolleginnen und Kollegen und die erstmalig gewählten Kolleginnen und Kollegen. Etwas weniger als die Hälfte der 736 Abgeordneten sind erstmalig ins Europäische Parlament gewählt worden. Besonders erfreulich ist, dass 35 % der Abgeordneten Frauen sind – ein Anteil, der im Europäischen Parlament noch nie so hoch war!', '(Beifall)', '170 Millionen Bürgerinnen und Bürger haben sich an der Wahl beteiligt und unsere Arbeit dient einem großen Ziel: der Einigung unseres Kontinents! Vergessen wir bei der Arbeit nie: Die Europäische Union beruht auf Werten. Die Würde des Menschen, die Menschenrechte, die Freiheit, die Demokratie, das Recht, der Frieden sind Grundlage unseres Handelns. Wir sind durch Solidarität verbunden. Ich bitte Sie, dass wir uns immer von Respekt und Achtung für einander leiten lassen. Wenn dies der Fall ist, werden wir erfolgreich sein. Gehen wir jetzt an unsere Arbeit! ']"
2, 7. Elezzjoni tal-President tal-Parlament Ewropew,"  Der Präsident. −   Wir müssen heute Morgen gemäß den Bestimmungen unserer Geschäftsordnung zur Wahl des Präsidenten schreiten. Gemäß Artikel 13 der Geschäftsordnung müssen die Kandidaturen für das Amt des Präsidenten unseres Parlaments mit dem Einverständnis der Betroffenen von einer Fraktion oder von mindestens 40 Abgeordneten eingereicht werden. Ich habe unter den in der Geschäftsordnung vorgesehenen Bedingungen folgende Kandidaturen für das Amt des Präsidenten des Europäischen Parlaments erhalten:Herr Jerzy BuzekFrau Eva-Britt Svensson	Die Kandidaten haben mir mitgeteilt, dass sie mit ihrer Kandidatur einverstanden sind. Die beiden Kandidaten werden sich jetzt kurz vorstellen und ich darf zunächst Frau Eva-Britt Svensson bitten, dies zu tun.",Der Präsident. −,5,104,not_available,"['mlt', 'mlt', 'mlt', 'mlt', 'mlt']","['  Der Präsident. −   Wir müssen heute Morgen gemäß den Bestimmungen unserer Geschäftsordnung zur Wahl des Präsidenten schreiten. Gemäß Artikel 13 der Geschäftsordnung müssen die Kandidaturen für das Amt des Präsidenten unseres Parlaments mit dem Einverständnis der Betroffenen von einer Fraktion oder von mindestens 40 Abgeordneten eingereicht werden. ', 'Ich habe unter den in der Geschäftsordnung vorgesehenen Bedingungen folgende Kandidaturen für das Amt des Präsidenten des Europäischen Parlaments erhalten:', 'Herr Jerzy Buzek', 'Frau Eva-Britt Svensson\t', 'Die Kandidaten haben mir mitgeteilt, dass sie mit ihrer Kandidatur einverstanden sind. Die beiden Kandidaten werden sich jetzt kurz vorstellen und ich darf zunächst Frau Eva-Britt Svensson bitten, dies zu tun.']"
3, 7. Elezzjoni tal-President tal-Parlament Ewropew,"  Eva-Britt Svensson  (GUE/NGL). -   Herr talman! Värderade kolleger! Jag vill gratulera alla mina kolleger till det förtroende som har visats er från medborgarna i era respektive medlemsstater. Det är ett stort förtroende och därmed också ett stort ansvar för att vi alla ska motsvara våra medborgares förväntningar och krav på nödvändiga förändringar samt bygga ett medborgarnas Europa. Demokratin, rätten att välja sina förtroendevalda, är det viktigaste instrumentet som våra medborgare har. För att kunna tala om en verklig demokrati, krävs det mer än rätten att rösta. Det krävs öppenhet, det krävs offentlighet, och det kräver en öppen debatt.Därför vill jag säga att det är oerhört viktigt att vi nu ser till att reformera förfarandet för första behandlingen. Vi måste ta parlamentets förtroende på allvar och visa den öppenhet som krävs även när det gäller förfarandet för första behandlingen.Kolleger, vi står inför stora utmaningar: en ekonomisk kris med en ökad arbetslöshet, ett ökat utanförskap och social otrygghet. Vi har en klimatkris som redan har skapat klimatflyktingar. Som vanligt drabbas de fattigaste först och hårdast. Vi ser ett EU och en värld med orättvisor och fattigdom. Det finns emellertid politiska lösningar på dessa kriser, men det kräver en förändrad politik. Den politik som förts hittills har inte löst de problem som vi har ansvaret för att lösa. Tvärtom har den på många områden bidragit till att skapa kriserna.Vi behöver en förändrad politik. Vi behöver en politik för ett socialt Europa, en politik som driver löntagarnas rättigheter mot social dumpning. Vi behöver en politik som hindrar social utslagning och fattigdom. Vi behöver en politik som tillvaratar alla medborgares delaktighet. Vi behöver en politik som icke diskriminerar någon medborgare, oavsett om vi talar om etnicitet, funktionshinder, kön, ålder eller sexuell läggning. Jag vill se ett EU som värnar alla sina medborgares intressen.Jag vill ha och se en politik som skapar nya jobb – nya, gröna jobb. Det behövs investeringar i grön teknik som – förutom att de skapar de nödvändiga nya jobben – även bidrar till att skapa tillväxt och ser till att stoppa klimatförändringarna, vilket är en av de absolut viktigaste uppgifterna för mänskligheten och för Europa.Jag vill se ett EU som tar sitt ansvar för en rättvis och ansvarsfull internationell handel. Jag vill se ett EU med en human asyl- och invandringspolitik, som skyddar immigranterna och deras rättigheter. Jag vill se ett mångfaldens Europa. Det är så vi skapar utveckling. Jag vill se ett mångfaldens Europa, där vi värnar varje medborgare. Jag vill se ett Europa, ett EU, som tar sitt ansvar när det gäller mänskliga rättigheter. När våra mänskliga rättigheter förtrycks, oavsett var i världen det sker, kan vi aldrig, aldrig, kompromissa. Dessa rättigheter är okränkbara. Det gäller varje människa. Oavsett om det handlar om yttrandefrihet, offentlighet, personlig integritet osv. är de mänskliga rättigheterna okränkbara. Det är vårt ansvar, kära kolleger, att stå upp för de mänskliga rättigheterna, var i världen de än hotas.Jag gläder mig åt informationen från talmannen att valet i juni ökade kvinnorepresentationen i parlamentet. Det har kunnat ske tack vare ett gemensamt arbete för både män och kvinnor. Vi har arbetat tillsammans för att öka kvinnorepresentationen. Nu tar vi ytterligare ett steg. Nu ser vi till att kvinnors inflytande ökas även när det gäller de förtroendeuppdrag som parlamentet och EU:s övriga institutioner har. Nu har vi möjligheten. Tillsammans, mina vänner och kolleger, kan vi visa våra medborgare i Europa att vi tar ansvaret och visa hur ett modernt, mångfaldens samhälle växer fram.I dag har var och en av er makten över valsedeln. Ni har i dag makten att ge en stark signal till våra medborgare om att vi nu bygger medborgarnas Europa, ett socialt Europa, att visa både våra medborgare och vår omvärld att EU är berett att ta sitt ansvar för global rättvisa, för mänskliga rättigheter och för globalt miljöansvar, och att visa den makt vi har med vår valsedel att ge den signal som Europas medborgare förväntar sig av detta parlament.(Applåder)",Eva-Britt Svensson  (GUE/NGL). -,9,663,not_available,"['mlt', 'mlt', 'mlt', 'mlt', 'mlt', 'mlt', 'mlt', 'mlt', 'mlt']","['  Eva-Britt Svensson  (GUE/NGL). -   Herr talman! Värderade kolleger! Jag vill gratulera alla mina kolleger till det förtroende som har visats er från medborgarna i era respektive medlemsstater. Det är ett stort förtroende och därmed också ett stort ansvar för att vi alla ska motsvara våra medborgares förväntningar och krav på nödvändiga förändringar samt bygga ett medborgarnas Europa. Demokratin, rätten att välja sina förtroendevalda, är det viktigaste instrumentet som våra medborgare har. För att kunna tala om en verklig demokrati, krävs det mer än rätten att rösta. Det krävs öppenhet, det krävs offentlighet, och det kräver en öppen debatt.', 'Därför vill jag säga att det är oerhört viktigt att vi nu ser till att reformera förfarandet för första behandlingen. Vi måste ta parlamentets förtroende på allvar och visa den öppenhet som krävs även när det gäller förfarandet för första behandlingen.', 'Kolleger, vi står inför stora utmaningar: en ekonomisk kris med en ökad arbetslöshet, ett ökat utanförskap och social otrygghet. Vi har en klimatkris som redan har skapat klimatflyktingar. Som vanligt drabbas de fattigaste först och hårdast. Vi ser ett EU och en värld med orättvisor och fattigdom. Det finns emellertid politiska lösningar på dessa kriser, men det kräver en förändrad politik. Den politik som förts hittills har inte löst de problem som vi har ansvaret för att lösa. Tvärtom har den på många områden bidragit till att skapa kriserna.', 'Vi behöver en förändrad politik. Vi behöver en politik för ett socialt Europa, en politik som driver löntagarnas rättigheter mot social dumpning. Vi behöver en politik som hindrar social utslagning och fattigdom. Vi behöver en politik som tillvaratar alla medborgares delaktighet. Vi behöver en politik som icke diskriminerar någon medborgare, oavsett om vi talar om etnicitet, funktionshinder, kön, ålder eller sexuell läggning. Jag vill se ett EU som värnar alla sina medborgares intressen.', 'Jag vill ha och se en politik som skapar nya jobb – nya, gröna jobb. Det behövs investeringar i grön teknik som – förutom att de skapar de nödvändiga nya jobben – även bidrar till att skapa tillväxt och ser till att stoppa klimatförändringarna, vilket är en av de absolut viktigaste uppgifterna för mänskligheten och för Europa.', 'Jag vill se ett EU som tar sitt ansvar för en rättvis och ansvarsfull internationell handel. Jag vill se ett EU med en human asyl- och invandringspolitik, som skyddar immigranterna och deras rättigheter. Jag vill se ett mångfaldens Europa. Det är så vi skapar utveckling. Jag vill se ett mångfaldens Europa, där vi värnar varje medborgare. Jag vill se ett Europa, ett EU, som tar sitt ansvar när det gäller mänskliga rättigheter. När våra mänskliga rättigheter förtrycks, oavsett var i världen det sker, kan vi aldrig, aldrig, kompromissa. Dessa rättigheter är okränkbara. Det gäller varje människa. Oavsett om det handlar om yttrandefrihet, offentlighet, personlig integritet osv. är de mänskliga rättigheterna okränkbara. Det är vårt ansvar, kära kolleger, att stå upp för de mänskliga rättigheterna, var i världen de än hotas.', 'Jag gläder mig åt informationen från talmannen att valet i juni ökade kvinnorepresentationen i parlamentet. Det har kunnat ske tack vare ett gemensamt arbete för både män och kvinnor. Vi har arbetat tillsammans för att öka kvinnorepresentationen. Nu tar vi ytterligare ett steg. Nu ser vi till att kvinnors inflytande ökas även när det gäller de förtroendeuppdrag som parlamentet och EU:s övriga institutioner har. Nu har vi möjligheten. Tillsammans, mina vänner och kolleger, kan vi visa våra medborgare i Europa att vi tar ansvaret och visa hur ett modernt, mångfaldens samhälle växer fram.', 'I dag har var och en av er makten över valsedeln. Ni har i dag makten att ge en stark signal till våra medborgare om att vi nu bygger medborgarnas Europa, ett socialt Europa, att visa både våra medborgare och vår omvärld att EU är berett att ta sitt ansvar för global rättvisa, för mänskliga rättigheter och för globalt miljöansvar, och att visa den makt vi har med vår valsedel att ge den signal som Europas medborgare förväntar sig av detta parlament.', '(Applåder)']"
4, 7. Elezzjoni tal-President tal-Parlament Ewropew,"  Jerzy Buzek  (PPE). -   Panie Przewodniczący, Panie i Panowie przedstawiciele Rady i Komisji, szanowne Koleżanki i Koledzy! Przede wszystkim gratulujemy sobie, że spotkaliśmy się na tej sali. Jesteśmy reprezentantami pół miliarda mieszkańców naszego kontynentu – to wielka odpowiedzialność. Chciałem powiedzieć wam parę słów o sobie. Z zawodu jestem naukowcem. Działalność polityczną rozpocząłem w 1980 roku w związku zawodowym Solidarność, który walczył o wolność i walczył o prawa człowieka i obywatela (oklaski). Walka o prawa człowieka i obywatela była zawsze moją podstawową zasadą działania. W latach 1997-2001 byłem premierem polskiego rządu. Przez 4 lata negocjowaliśmy udział Polski w strukturach Unii Europejskiej. Od 2004 roku jestem w Parlamencie Europejskim. Zajmowałem się badaniami, innowacjami, nowymi technologiami, potem bezpieczeństwem energetycznym, także zmianami klimatycznymi i przeciwdziałaniem tym zmianom oraz partnerstwem wschodnim. Tak się złożyło, że te wszystkie wymienione przed chwilą sprawy są także naszymi priorytetami na najbliższą kadencję. Musimy pamiętać, że tkwimy dzisiaj w kryzysie i nasi mieszkańcy oczekują, że przede wszystkim z tym się uporamy. Musimy także pamiętać, że powinniśmy usprawnić działalność Parlamentu, co już się zaczęło – dzięki akcjom w ostatnich latach. Temu wszystkiemu możemy zaradzić tylko wtedy, jeśli będziemy mieli przyjęty traktat lizboński. To właśnie nam pomoże, to uczyni nas bardziej sprawnymi, lepiej działającymi, umożliwi nam również działania na arenie międzynarodowej. Mamy swoje zobowiązania: Morze Śródziemne, partnerstwo wschodnie, Ameryka Łacińska, strategiczny sojusz ze Stanami Zjednoczonymi i rosnącymi potęgami na świecie. To są nasze wielkie wyzwania. I dlatego traktat lizboński daje nam do ręki nadzwyczajne narzędzie do ich realizacji.Na koniec chciałem wam powiedzieć, że najważniejszy kryzys, który mamy do przezwyciężenia, to kryzys (przyznajmy to, chociaż to trudne) braku zaufania do nas ze strony obywateli. Mówmy sobie takie słowa, które są czasami cierpkie, bo one nam pozwalają przezwyciężyć nasze słabości. Nasi obywatele często nas nie rozumieją. Zróbmy wszystko, żeby to się zmieniło. To przede wszystkim zależy od nas, członków Parlamentu Europejskiego, bo my co tydzień przyjeżdżamy z naszych regionów, a na koniec tygodnia rozjeżdżamy się po całej Europie, bo wiemy najlepiej, co ich boli i na co liczą, dlatego tego życzmy sobie najbardziej, wtedy łatwiej będzie nam sprostać zadaniom, które przed nami stoją.  (oklaski)",Jerzy Buzek  (PPE). -,5,349,not_available,"['mlt', 'mlt', 'mlt', 'mlt', 'mlt']","['  Jerzy Buzek  (PPE). -   Panie Przewodniczący, Panie i Panowie przedstawiciele Rady i Komisji, szanowne Koleżanki i Koledzy! Przede wszystkim gratulujemy sobie, że spotkaliśmy się na tej sali. Jesteśmy reprezentantami pół miliarda mieszkańców naszego kontynentu – to wielka odpowiedzialność. ', 'Chciałem powiedzieć wam parę słów o sobie. Z zawodu jestem naukowcem. Działalność polityczną rozpocząłem w 1980 roku w związku zawodowym Solidarność, który walczył o wolność i walczył o prawa człowieka i obywatela (oklaski). Walka o prawa człowieka i obywatela była zawsze moją podstawową zasadą działania. W latach 1997-2001 byłem premierem polskiego rządu. Przez 4 lata negocjowaliśmy udział Polski w strukturach Unii Europejskiej. Od 2004 roku jestem w Parlamencie Europejskim. Zajmowałem się badaniami, innowacjami, nowymi technologiami, potem bezpieczeństwem energetycznym, także zmianami klimatycznymi i przeciwdziałaniem tym zmianom oraz partnerstwem wschodnim. Tak się złożyło, że te wszystkie wymienione przed chwilą sprawy są także naszymi priorytetami na najbliższą kadencję. ', 'Musimy pamiętać, że tkwimy dzisiaj w kryzysie i nasi mieszkańcy oczekują, że przede wszystkim z tym się uporamy. Musimy także pamiętać, że powinniśmy usprawnić działalność Parlamentu, co już się zaczęło – dzięki akcjom w ostatnich latach. Temu wszystkiemu możemy zaradzić tylko wtedy, jeśli będziemy mieli przyjęty traktat lizboński. To właśnie nam pomoże, to uczyni nas bardziej sprawnymi, lepiej działającymi, umożliwi nam również działania na arenie międzynarodowej. Mamy swoje zobowiązania: Morze Śródziemne, partnerstwo wschodnie, Ameryka Łacińska, strategiczny sojusz ze Stanami Zjednoczonymi i rosnącymi potęgami na świecie. To są nasze wielkie wyzwania. I dlatego traktat lizboński daje nam do ręki nadzwyczajne narzędzie do ich realizacji.', 'Na koniec chciałem wam powiedzieć, że najważniejszy kryzys, który mamy do przezwyciężenia, to kryzys (przyznajmy to, chociaż to trudne) braku zaufania do nas ze strony obywateli. Mówmy sobie takie słowa, które są czasami cierpkie, bo one nam pozwalają przezwyciężyć nasze słabości. Nasi obywatele często nas nie rozumieją. Zróbmy wszystko, żeby to się zmieniło. To przede wszystkim zależy od nas, członków Parlamentu Europejskiego, bo my co tydzień przyjeżdżamy z naszych regionów, a na koniec tygodnia rozjeżdżamy się po całej Europie, bo wiemy najlepiej, co ich boli i na co liczą, dlatego tego życzmy sobie najbardziej, wtedy łatwiej będzie nam sprostać zadaniom, które przed nami stoją.  ', '(oklaski)']"
5, 7. Elezzjoni tal-President tal-Parlament Ewropew,"  Der Präsident. −   Ich gebe nun das Wahlergebnis bekannt.Anzahl der Wähler: 713Nicht ausgefüllte oder ungültige Stimmzettel: 69Abgegebene Stimmen: 644Absolute Mehrheit: 323Es erhielt Jerzy Buzek: 555 Stimmen.(Lebhafter und andauernder Beifall)Auf Frau Eva-Britt Svensson entfielen 89 Stimmen.(Beifall)Damit hat Jerzy Buzek die absolute Mehrheit der abgegebenen Stimmen erhalten. Ich darf das, was ich eben versucht habe, in polnischer Sprache zu sagen, in meiner eigenen Sprache wiederholen: Ich beglückwünsche Jerzy Buzek ganz, ganz herzlich zu seiner überzeugenden Wahl, wünsche ihm alles Gute für diese wunderbare Aufgabe, die er jetzt übernehmen wird, und ich darf ihn bitten, hier auf dem Präsidentensessel Platz zu nehmen.(Beifall)",Der Präsident. −,11,105,not_available,"['mlt', 'mlt', 'mlt', 'mlt', 'mlt', 'mlt', 'mlt', 'mlt', 'mlt', 'mlt', 'mlt']","['  Der Präsident. −   Ich gebe nun das Wahlergebnis bekannt.', 'Anzahl der Wähler: 713', 'Nicht ausgefüllte oder ungültige Stimmzettel: 69', 'Abgegebene Stimmen: 644', 'Absolute Mehrheit: 323', 'Es erhielt Jerzy Buzek: 555 Stimmen.', '(Lebhafter und andauernder Beifall)', 'Auf Frau Eva-Britt Svensson entfielen 89 Stimmen.', '(Beifall)', 'Damit hat Jerzy Buzek die absolute Mehrheit der abgegebenen Stimmen erhalten. Ich darf das, was ich eben versucht habe, in polnischer Sprache zu sagen, in meiner eigenen Sprache wiederholen: Ich beglückwünsche Jerzy Buzek ganz, ganz herzlich zu seiner überzeugenden Wahl, wünsche ihm alles Gute für diese wunderbare Aufgabe, die er jetzt übernehmen wird, und ich darf ihn bitten, hier auf dem Präsidentensessel Platz zu nehmen.', '(Beifall)']"
6, 7. Elezzjoni tal-President tal-Parlament Ewropew,PRZEWODNICZY: JERZY BUZEK  Przewodniczący,PRZEWODNICZY: JERZY BUZEK,1,4,not_available,['mlt'],['PRZEWODNICZY: JERZY BUZEK  Przewodniczący']
7, 7. Elezzjoni tal-President tal-Parlament Ewropew,"  President. −   Dear colleagues, thank you for electing me President of the European Parliament. For me it is both an enormous challenge and a great honour. Thank you to those who voted for me; I will do everything not to disappoint your trust. For those of you who did not vote for me, I will try to convince you to me. I wish to work with all of you, regardless of political conventions. I count on your support.Thank you, Mrs Svensson, for taking part in this election and for our discussions. To our colleagues, Mario Mauro and Graham Watson, who stood as candidates, and resigned early in order to strengthen the unity of our House, this was a profound gesture.Mario, I know how important for you human rights are. In my homeland, Solidarność was born, a great movement for human rights, …(Applause)…which was possible thanks to the lesson of John Paul II. For me, human rights will also be a priority.Graham, you spoke about the necessity of change in the European Parliament, of the need for reform, of the need to involve in the European project our citizens, who are becoming more and more indifferent. I will make sure that, together, we will do everything we can to change this.(Applause)",President. −,7,214,not_available,"['mlt', 'mlt', 'mlt', 'mlt', 'mlt', 'mlt', 'mlt']","['  President. −   Dear colleagues, thank you for electing me President of the European Parliament. For me it is both an enormous challenge and a great honour. Thank you to those who voted for me; I will do everything not to disappoint your trust. For those of you who did not vote for me, I will try to convince you to me. I wish to work with all of you, regardless of political conventions. I count on your support.', 'Thank you, Mrs Svensson, for taking part in this election and for our discussions. To our colleagues, Mario Mauro and Graham Watson, who stood as candidates, and resigned early in order to strengthen the unity of our House, this was a profound gesture.', 'Mario, I know how important for you human rights are. In my homeland, Solidarność was born, a great movement for human rights, …', '(Applause)', '…which was possible thanks to the lesson of John Paul II. For me, human rights will also be a priority.', 'Graham, you spoke about the necessity of change in the European Parliament, of the need for reform, of the need to involve in the European project our citizens, who are becoming more and more indifferent. I will make sure that, together, we will do everything we can to change this.', '(Applause)']"
