,agenda_item,text,speaker,number_p,number_w,chair,language_ps,ps
64, 15. Ħtiġijiet rigward is-saħħa tal-annimali li japplikaw għall-moviment mhux kummerċjali tal-pets (dibattitu),"  John Dalli,  Member of the Commission. − Mr President, I would like to thank the Committee on the Environment, Public Health and Food Safety for its work on this dossier. I would especially like to thank the rapporteur, Ms de Brún, for her efforts to reach an agreement on this issue, which is a sensitive one for some Member States. We also appreciate that, apart from the issues involved, she had to steer the process through the difficult part on delegated acts. Thank you very much.I am pleased that the intense discussions held between the three institutions have resulted in a compromise text that fully reflects the technical measures proposed by the Commission and also addresses the necessary adaptation of the proposals to the Lisbon Treaty in a way that is acceptable to the Commission. Indeed, our joint work has been complicated and slowed down by this alignment. Nevertheless, the Council is now in a position to ensure that this work is finalised on time.Before a vote is taken on the compromise text, I am pleased to confirm that the Commission does not intend to propose a further prolongation of the transitional regime, which will come to an end on 31 December 2011. This means that fully harmonised rules will be in place from 1 January 2012. However, the Commission does intend to propose a revision of the regulation in its entirety before 30 June 2011 and, in particular, the aspects of delegated and implementing acts.As regards the notification of delegated acts, the Commission will also take account of the periods of recess of the institutions in order to ensure that the European Parliament and the Council are able to exercise their prerogatives within the time limits laid down in the relevant legislative acts.Finally, I can confirm the Commission’s commitment, jointly expressed with Parliament and the Council, that the provisions of this regulation shall be without prejudice to any further position of the institutions as regards the implementation of Article 290 of the Treaty on the Functioning of the European Union or individual legislative acts containing such provisions. I hope Parliament will support the compromise text, which I firmly believe properly addresses all concerns raised by this House.","John Dalli,",5,372,not_available,"['mlt', 'mlt', 'mlt', 'mlt', 'mlt']","['  John Dalli,  Member of the Commission. − Mr President, I would like to thank the Committee on the Environment, Public Health and Food Safety for its work on this dossier. I would especially like to thank the rapporteur, Ms de Brún, for her efforts to reach an agreement on this issue, which is a sensitive one for some Member States. We also appreciate that, apart from the issues involved, she had to steer the process through the difficult part on delegated acts. Thank you very much.', 'I am pleased that the intense discussions held between the three institutions have resulted in a compromise text that fully reflects the technical measures proposed by the Commission and also addresses the necessary adaptation of the proposals to the Lisbon Treaty in a way that is acceptable to the Commission. Indeed, our joint work has been complicated and slowed down by this alignment. Nevertheless, the Council is now in a position to ensure that this work is finalised on time.', 'Before a vote is taken on the compromise text, I am pleased to confirm that the Commission does not intend to propose a further prolongation of the transitional regime, which will come to an end on 31 December 2011. This means that fully harmonised rules will be in place from 1 January 2012. However, the Commission does intend to propose a revision of the regulation in its entirety before 30 June 2011 and, in particular, the aspects of delegated and implementing acts.', 'As regards the notification of delegated acts, the Commission will also take account of the periods of recess of the institutions in order to ensure that the European Parliament and the Council are able to exercise their prerogatives within the time limits laid down in the relevant legislative acts.', 'Finally, I can confirm the Commission’s commitment, jointly expressed with Parliament and the Council, that the provisions of this regulation shall be without prejudice to any further position of the institutions as regards the implementation of Article 290 of the Treaty on the Functioning of the European Union or individual legislative acts containing such provisions. I hope Parliament will support the compromise text, which I firmly believe properly addresses all concerns raised by this House.']"
65, 15. Ħtiġijiet rigward is-saħħa tal-annimali li japplikaw għall-moviment mhux kummerċjali tal-pets (dibattitu),"  Christofer Fjellner,  för PPE-gruppen. – Herr talman, herr kommissionsledamot! Detta är ett väldigt viktigt betänkande, dels för att det handlar om hur vi ska underlätta för den som har husdjur i Europa att kunna röra sig över gränserna, dels för att det handlar om hur vi kan förhindra att sjukdomar som finns bland våra husdjur sprids på ett farligt sätt runt om i Europa.Som svensk ledamot i Europaparlamentet är jag särskilt intresserad av denna fråga, för det finns två sjukdomar som vi som tur är inte har i Sverige än så länge , nämligen den så kallade dvärgbandmasken och, framför allt, rabies.Under behandlingen av detta förslag har jag vid ett antal tillfällen varit orolig för att vi ska behöva tumma på de regler vi har i Sverige, på ett sätt som gör att dvärgbandmask och rabies skulle kunna komma till Sverige. Det skulle få otroliga konsekvenser, inte minst för hur vi utnyttjar den så kallade allemansrätten i Sverige, det vill säga hur vi har möjlighet att röra oss fritt i skog och mark.Jag är väldigt glad att i dag kunna konstatera att Sverige, åtminstone under en övergångsperiod, får behålla de undantag vi har och som kan säkra att vi inte får in dessa sjukdomar.Det var inte givet under hela processen. Ända in i slutet förekom en debatt om kommittéförfarandet som åtminstone jag var orolig skulle skapa en osäkerhet och en lucka i tillämpningen av förfarandet som skulle innebära en risk för att dessa sjukdomar kan komma till Sverige.Jag vill verkligen tacka alla som har arbetat hårt med att hitta lösningar för att dels säkra möjligheten för husdjur att röra sig i Europa, dels säkra de undantag som de länder som idag saknar sjukdomar får behålla, på ett sätt som gör att vi inte behöver vara oroliga någonstans i Europa för att få nya sjukdomar p.g.a. detta förslag. Tack så mycket till föredraganden, rådet och kommissionsledamoten.","Christofer Fjellner,",6,321,not_available,"['mlt', 'mlt', 'mlt', 'mlt', 'mlt', 'mlt']","['  Christofer Fjellner,  för PPE-gruppen. – Herr talman, herr kommissionsledamot! Detta är ett väldigt viktigt betänkande, dels för att det handlar om hur vi ska underlätta för den som har husdjur i Europa att kunna röra sig över gränserna, dels för att det handlar om hur vi kan förhindra att sjukdomar som finns bland våra husdjur sprids på ett farligt sätt runt om i Europa.', 'Som svensk ledamot i Europaparlamentet är jag särskilt intresserad av denna fråga, för det finns två sjukdomar som vi som tur är inte har i Sverige än så länge , nämligen den så kallade dvärgbandmasken och, framför allt, rabies.', 'Under behandlingen av detta förslag har jag vid ett antal tillfällen varit orolig för att vi ska behöva tumma på de regler vi har i Sverige, på ett sätt som gör att dvärgbandmask och rabies skulle kunna komma till Sverige. Det skulle få otroliga konsekvenser, inte minst för hur vi utnyttjar den så kallade allemansrätten i Sverige, det vill säga hur vi har möjlighet att röra oss fritt i skog och mark.', 'Jag är väldigt glad att i dag kunna konstatera att Sverige, åtminstone under en övergångsperiod, får behålla de undantag vi har och som kan säkra att vi inte får in dessa sjukdomar.', 'Det var inte givet under hela processen. Ända in i slutet förekom en debatt om kommittéförfarandet som åtminstone jag var orolig skulle skapa en osäkerhet och en lucka i tillämpningen av förfarandet som skulle innebära en risk för att dessa sjukdomar kan komma till Sverige.', 'Jag vill verkligen tacka alla som har arbetat hårt med att hitta lösningar för att dels säkra möjligheten för husdjur att röra sig i Europa, dels säkra de undantag som de länder som idag saknar sjukdomar får behålla, på ett sätt som gör att vi inte behöver vara oroliga någonstans i Europa för att få nya sjukdomar p.g.a. detta förslag. Tack så mycket till föredraganden, rådet och kommissionsledamoten.']"
66, 15. Ħtiġijiet rigward is-saħħa tal-annimali li japplikaw għall-moviment mhux kummerċjali tal-pets (dibattitu),"  Linda McAvan,  on behalf of the S&D Group. – Mr President, can I start by thanking Mrs de Brún, who took on this dossier expecting it to be fairly expeditious. It then became very complicated as we found ourselves negotiating whole new delegated acts without precedents for future acts, so congratulations to her and to the Council and Commission. Commissioner, one of your first tasks here is to find a solution.A lot of the debate has been about the technical aspects of this legislation, but it is an important piece of legislation for lots of citizens, being about moving their pet freely around the EU. When we first adopted this legislation a few years ago there was a lot of support for it, but we have this transitional period, which Mr Fjellner has mentioned, which is important to prevent diseases spreading to states that do not have those diseases.I welcome the Commission’s support for extending the transitional period so that, when we do have the new legislation, all countries will have the same legislation. We will by that point have much higher levels of animal health and animal welfare across the EU.On the comitology issue, our group supports the compromise that has been negotiated. We think that Parliament should have parity – equality – with the Council in legislation. The whole issue was about the expert groups and who these experts should be. What we would like to say is that when we talk about experts being consulted this has to refer to all experts, and the Commission will be looking with experts from the Member States, from non-governmental organisations, and also those perhaps which the European Parliament is recommending.I am very pleased that we have this agreement. It enables the transitional period to be agreed in time for when the derogation runs out, and we look forward to hearing the Commission’s new proposals for the future legislation.","Linda McAvan,",5,323,not_available,"['mlt', 'mlt', 'mlt', 'mlt', 'mlt']","['  Linda McAvan,  on behalf of the S&D Group. – Mr President, can I start by thanking Mrs de Brún, who took on this dossier expecting it to be fairly expeditious. It then became very complicated as we found ourselves negotiating whole new delegated acts without precedents for future acts, so congratulations to her and to the Council and Commission. Commissioner, one of your first tasks here is to find a solution.', 'A lot of the debate has been about the technical aspects of this legislation, but it is an important piece of legislation for lots of citizens, being about moving their pet freely around the EU. When we first adopted this legislation a few years ago there was a lot of support for it, but we have this transitional period, which Mr Fjellner has mentioned, which is important to prevent diseases spreading to states that do not have those diseases.', 'I welcome the Commission’s support for extending the transitional period so that, when we do have the new legislation, all countries will have the same legislation. We will by that point have much higher levels of animal health and animal welfare across the EU.', 'On the comitology issue, our group supports the compromise that has been negotiated. We think that Parliament should have parity – equality – with the Council in legislation. The whole issue was about the expert groups and who these experts should be. What we would like to say is that when we talk about experts being consulted this has to refer to all experts, and the Commission will be looking with experts from the Member States, from non-governmental organisations, and also those perhaps which the European Parliament is recommending.', 'I am very pleased that we have this agreement. It enables the transitional period to be agreed in time for when the derogation runs out, and we look forward to hearing the Commission’s new proposals for the future legislation.']"
67, 15. Ħtiġijiet rigward is-saħħa tal-annimali li japplikaw għall-moviment mhux kummerċjali tal-pets (dibattitu),"  Adina-Ioana Vălean,  on behalf of the ALDE Group. – Mr President, let us recall that free movement has been one of the fundamental pillars of the single European market, which aims to achieve increased competition and larger economies of scale and confers on the EU its main power of attraction. Over time, the ability of people to move freely within the EU has become not only a basic component of the internal market but a fundamental right.By removing the barriers created by different national provisions and regulations, European citizens, as well as businesses, can thrive. Likewise, the possibility for EU citizens to carry their pets with them, without being subjected to specific national regulations and standards, is important, as it can significantly reduce their travel efforts and costs. I am pleased that the Commission proposal points in that direction.I welcome the general-regime passport, which will harmonise the animal health measures and controls that will facilitate the free movement of pet animals. At the same time, I agree that we need to guarantee a high level of protection for human and animal health. This transitional regime will allow more time for the right infrastructure and staff to be in place. So, under this argument, Parliament will certainly vote tomorrow to prolong the transitional regime for some Member States until the end of 2011, as these countries allegedly need to take specific health risks into account.However, this is not the first time that some Member States have been allowed to apply more stringent health requirements than others. Initially, the transitional period lasted until July 2008. Then the transitional period was extended to 2010. Now we have agreed to a new prolongation. Thus, while I have some sympathy for the fears of the Member States who consider that their pet population is more prone to certain diseases, and I understand that the proposed prolongation would be simultaneously completed with EU-funded vaccination programmes to eliminate sylvatic rabies in some Member States, I believe that this should be the last extension of the special treatment enjoyed by these countries. We all know that asymmetrical measures and opt-outs will not bring the full benefits of the internal market in this area. So let us all agree that this transitional regime needs to be eliminated and that a level playing field has to be ensured as soon as possible.Interestingly enough, the more contentious issue in this report has not been the content that has sparked heated debate among us on how to apply the new Lisbon Treaty provisions regarding the comitology procedure. This is the first codecision file where these provisions are to be put into practice. Given Parliament’s extended powers under the new Treaty, it was crucial for us that this particular regulation did not set a precedent for future decisions.In this regard I welcome the written statement which was agreed between Parliament and the Council during the trialogue, stating that this file should not be treated as a precedent.","Adina-Ioana Vălean,",6,503,not_available,"['mlt', 'mlt', 'mlt', 'mlt', 'mlt', 'mlt']","['  Adina-Ioana Vălean,  on behalf of the ALDE Group. – Mr President, let us recall that free movement has been one of the fundamental pillars of the single European market, which aims to achieve increased competition and larger economies of scale and confers on the EU its main power of attraction. Over time, the ability of people to move freely within the EU has become not only a basic component of the internal market but a fundamental right.', 'By removing the barriers created by different national provisions and regulations, European citizens, as well as businesses, can thrive. Likewise, the possibility for EU citizens to carry their pets with them, without being subjected to specific national regulations and standards, is important, as it can significantly reduce their travel efforts and costs. I am pleased that the Commission proposal points in that direction.', 'I welcome the general-regime passport, which will harmonise the animal health measures and controls that will facilitate the free movement of pet animals. At the same time, I agree that we need to guarantee a high level of protection for human and animal health. This transitional regime will allow more time for the right infrastructure and staff to be in place. So, under this argument, Parliament will certainly vote tomorrow to prolong the transitional regime for some Member States until the end of 2011, as these countries allegedly need to take specific health risks into account.', 'However, this is not the first time that some Member States have been allowed to apply more stringent health requirements than others. Initially, the transitional period lasted until July 2008. Then the transitional period was extended to 2010. Now we have agreed to a new prolongation. Thus, while I have some sympathy for the fears of the Member States who consider that their pet population is more prone to certain diseases, and I understand that the proposed prolongation would be simultaneously completed with EU-funded vaccination programmes to eliminate sylvatic rabies in some Member States, I believe that this should be the last extension of the special treatment enjoyed by these countries. We all know that asymmetrical measures and opt-outs will not bring the full benefits of the internal market in this area. So let us all agree that this transitional regime needs to be eliminated and that a level playing field has to be ensured as soon as possible.', 'Interestingly enough, the more contentious issue in this report has not been the content that has sparked heated debate among us on how to apply the new Lisbon Treaty provisions regarding the comitology procedure. This is the first codecision file where these provisions are to be put into practice. Given Parliament’s extended powers under the new Treaty, it was crucial for us that this particular regulation did not set a precedent for future decisions.', 'In this regard I welcome the written statement which was agreed between Parliament and the Council during the trialogue, stating that this file should not be treated as a precedent.']"
68, 15. Ħtiġijiet rigward is-saħħa tal-annimali li japplikaw għall-moviment mhux kummerċjali tal-pets (dibattitu),"  James Nicholson,  on behalf of the ECR Group. – Mr President, first of all let me begin by thanking the rapporteur for all her hard work on this report. What many of us felt at the beginning would be a dossier which would not cause us much of a problem turned out to be an awful lot more tricky than we thought. Unfortunately the rapporteur had to take the brunt of most of the negotiations, but she certainly had to work very hard to ensure this report got through within the necessary time frame, which was very important as we were under pressure to secure the extension of her derogation which was due to run out in June of this year.In my opinion this is a small but vital piece of legislation which will protect those areas and those countries that are concerned by the threat of rabies; the disease continues to occur in some parts of the EU, and hopefully by the end of 2011 vaccination programmes will have proved successful in eradicating the disease once and for all.Until then, however, we have found a way which allows us to continue to enforce our own stricter requirements under the transitional period before we move, in line with other EU Member States, to the general regime.","James Nicholson,",4,217,not_available,"['mlt', 'mlt', 'mlt', 'mlt']","['  James Nicholson,  on behalf of the ECR Group. – Mr President, first of all let me begin by thanking the rapporteur for all her hard work on this report. What many of us felt at the beginning would be a dossier which would not cause us much of a problem turned out to be an awful lot more tricky than we thought. ', 'Unfortunately the rapporteur had to take the brunt of most of the negotiations, but she certainly had to work very hard to ensure this report got through within the necessary time frame, which was very important as we were under pressure to secure the extension of her derogation which was due to run out in June of this year.', 'In my opinion this is a small but vital piece of legislation which will protect those areas and those countries that are concerned by the threat of rabies; the disease continues to occur in some parts of the EU, and hopefully by the end of 2011 vaccination programmes will have proved successful in eradicating the disease once and for all.', 'Until then, however, we have found a way which allows us to continue to enforce our own stricter requirements under the transitional period before we move, in line with other EU Member States, to the general regime.']"
69, 15. Ħtiġijiet rigward is-saħħa tal-annimali li japplikaw għall-moviment mhux kummerċjali tal-pets (dibattitu),"  Anna Rosbach,  for EFD-Gruppen. – Hr. formand! Tak, Bairbre de Brún for dit enorme arbejde med opdateringen af denne tekniske forordning om at rejse med sit kæledyr inden for EU's grænser. For mange almindelige familier er det en udfordring med alle de vaccinationer og papirskriverier, man skal igennem, inden alle familiens medlemmer kan tage på ferie sammen. Men det er nødvendigt, for nogle lande kæmper en hård og årelang kamp mod ukontrollable dyresygdomme. Tiltagene er mange: Karantæner af forskellig varighed, dobbelttjek hos dyrlæger både før og efter en rejse afhængig af rejselandet, omkostningsintensiv tvangsvaccinering af vilde dyr på landsplan for blot at nævne nogle få. Så jeg kan godt forstå, at nogle medlemslande er bange for at slække på deres strenge nationale bestemmelser, og jeg ser det som en nødvendighed, at vi respekterer deres høje sikkerhedskrav, og ville ønske, at andre ville følge efter. Derfor vil jeg gerne her spørge Kommissionen, om ikke det måske alligevel var en god ide at gennemføre en veterinær grænsekontrol, hvor man som kæledyrsejer viser, at dyret, man medbringer, er fri for farlige sygdomme, at det har sine vaccinationer og papirer i orden i forhold til rejselandet. Det giver også en mulighed for at kontrollere svine- og andre dyretransporter, der ikke opfylder EU-kravene, ligesom indsmugling af alt for unge hundehvalpe og kattekillinger også kan opdages ved en grænsekontrol.","Anna Rosbach,",2,225,not_available,"['mlt', 'mlt']","[""  Anna Rosbach,  for EFD-Gruppen. – Hr. formand! Tak, Bairbre de Brún for dit enorme arbejde med opdateringen af denne tekniske forordning om at rejse med sit kæledyr inden for EU's grænser. For mange almindelige familier er det en udfordring med alle de vaccinationer og papirskriverier, man skal igennem, inden alle familiens medlemmer kan tage på ferie sammen. Men det er nødvendigt, for nogle lande kæmper en hård og årelang kamp mod ukontrollable dyresygdomme. Tiltagene er mange: Karantæner af forskellig varighed, dobbelttjek hos dyrlæger både før og efter en rejse afhængig af rejselandet, omkostningsintensiv tvangsvaccinering af vilde dyr på landsplan for blot at nævne nogle få. Så jeg kan godt forstå, at nogle medlemslande er bange for at slække på deres strenge nationale bestemmelser, og jeg ser det som en nødvendighed, at vi respekterer deres høje sikkerhedskrav, og ville ønske, at andre ville følge efter. "", 'Derfor vil jeg gerne her spørge Kommissionen, om ikke det måske alligevel var en god ide at gennemføre en veterinær grænsekontrol, hvor man som kæledyrsejer viser, at dyret, man medbringer, er fri for farlige sygdomme, at det har sine vaccinationer og papirer i orden i forhold til rejselandet. Det giver også en mulighed for at kontrollere svine- og andre dyretransporter, der ikke opfylder EU-kravene, ligesom indsmugling af alt for unge hundehvalpe og kattekillinger også kan opdages ved en grænsekontrol.']"
