,agenda_item,text,speaker,number_p,number_w,chair,language_ps,ps
109," 16. Reviżjoni tad-""Direttiva dwar il-Vjaġġi Kollox Kompriż"" (dibattitu)","  Karin Kadenbach  (S&D). -   Herr Präsident, Herr Kommissar! Ich bin Mutter einer großen Familie und habe in langen Jahren gelernt, Kataloge zu lesen. Das ist eine große Herausforderung, eine Herausforderung, der manches Mal auch die Beschäftigten in den Reisebüros nicht gewachsen sind. Daher wünsche ich mir von dieser neuen Richtlinie wirkliche Wahlfreiheit als Konsumentin. Wahlfreiheit werde ich nur dann haben, wenn Vergleichbarkeit gegeben ist, wenn ich Kriterien habe, die ich miteinander vergleichen kann.Eines dieser Kriterien ist für mich das Alter der Kinder. Egal welcher Reiseveranstalter – es gibt Kinderfestpreise. Da sind einmal Sechsjährige betroffen, dann Zehnjährige, das nächste Mal Zwölfjährige. Bei den einzelnen Veranstaltern ist das erste Kind nicht so viel wert wie das zweite, und das dritte und vierte gibt es erst gar nicht. Es wäre wichtig zum Schutz der Konsumenten – aber auch zum Schutz der Reisebüros und der Veranstalter –, dass ich als Konsumentin weiß, was ich kaufe, indem ich mich im Vorfeld wirklich gut informiert fühle und vergleichbare Kriterien habe.",Karin Kadenbach  (S&D). -,2,162,not_available,"['mlt', 'mlt']","['  Karin Kadenbach  (S&D). -   Herr Präsident, Herr Kommissar! Ich bin Mutter einer großen Familie und habe in langen Jahren gelernt, Kataloge zu lesen. Das ist eine große Herausforderung, eine Herausforderung, der manches Mal auch die Beschäftigten in den Reisebüros nicht gewachsen sind. Daher wünsche ich mir von dieser neuen Richtlinie wirkliche Wahlfreiheit als Konsumentin. Wahlfreiheit werde ich nur dann haben, wenn Vergleichbarkeit gegeben ist, wenn ich Kriterien habe, die ich miteinander vergleichen kann.', 'Eines dieser Kriterien ist für mich das Alter der Kinder. Egal welcher Reiseveranstalter – es gibt Kinderfestpreise. Da sind einmal Sechsjährige betroffen, dann Zehnjährige, das nächste Mal Zwölfjährige. Bei den einzelnen Veranstaltern ist das erste Kind nicht so viel wert wie das zweite, und das dritte und vierte gibt es erst gar nicht. Es wäre wichtig zum Schutz der Konsumenten – aber auch zum Schutz der Reisebüros und der Veranstalter –, dass ich als Konsumentin weiß, was ich kaufe, indem ich mich im Vorfeld wirklich gut informiert fühle und vergleichbare Kriterien habe.']"
110," 16. Reviżjoni tad-""Direttiva dwar il-Vjaġġi Kollox Kompriż"" (dibattitu)","  Catherine Stihler  (S&D). -   Mr President, I would like to add my support to what colleagues have said on the rights of disabled travellers, what Ms Kadenbach said about children, the issue of fire safety in hotels and, in particular, the issue of sprinkler safety in all EU hotels, and the need to future-proof the new proposal. Who could have predicted the rate of change that we have seen in the past 20 years? There are, however, two specific issues that I would like to raise.We have heard about the issue of credit-card charging, and there has been discussion on hidden charges. However, airline and travel companies are exploiting the fact that more people use their credit cards to book due to the protection they receive from using them, by placing double credit-card charges for each leg of our journey or placing credit-card charges on passengers for one online booking. You might have one online booking, but you are charged four times for using your credit card because you have four passengers involved. Commissioner, could you please look at this in order that people are protected.There is, finally, the issue of bankruptcy. In Scotland we saw the demise of Globespan, and we must ensure that people are compensated and that no one loses out. After all, this is the biggest budget expense many families have in a year and they expect us to protect them. We need to do more, so, thank you, Commissioner.",Catherine Stihler  (S&D). -,3,250,not_available,"['mlt', 'mlt', 'mlt']","['  Catherine Stihler  (S&D). -   Mr President, I would like to add my support to what colleagues have said on the rights of disabled travellers, what Ms Kadenbach said about children, the issue of fire safety in hotels and, in particular, the issue of sprinkler safety in all EU hotels, and the need to future-proof the new proposal. Who could have predicted the rate of change that we have seen in the past 20 years? There are, however, two specific issues that I would like to raise.', 'We have heard about the issue of credit-card charging, and there has been discussion on hidden charges. However, airline and travel companies are exploiting the fact that more people use their credit cards to book due to the protection they receive from using them, by placing double credit-card charges for each leg of our journey or placing credit-card charges on passengers for one online booking. You might have one online booking, but you are charged four times for using your credit card because you have four passengers involved. Commissioner, could you please look at this in order that people are protected.', 'There is, finally, the issue of bankruptcy. In Scotland we saw the demise of Globespan, and we must ensure that people are compensated and that no one loses out. After all, this is the biggest budget expense many families have in a year and they expect us to protect them. We need to do more, so, thank you, Commissioner.']"
111," 16. Reviżjoni tad-""Direttiva dwar il-Vjaġġi Kollox Kompriż"" (dibattitu)","  Zigmantas Balčytis  (S&D). -   Kelionių rinka per pastaruosius du dešimtmečius vystėsi labai dinamiškai. Vis daugiau žmonių patys susikomplektuoja keliones pirkdami paslaugas iš skirtingų operatorių ir paslaugų tiekėjų. Tačiau dabar galiojančios direktyvos nuostatos šiems naujiems kelionių paketams netaikomos, o tai reiškia, kad mūsų piliečiai keliauja nesaugiai. Manau, kad peržiūrint direktyvą būtina kuo tiksliau apibrėžti jos taikymo sritį, ir neturėtume leisti, kad nelanksčios taisyklės paliktų mūsų piliečius be tinkamos apsaugos. Be to, turi būti išspręstas ir atsakomybės klausimas tais atvejais, kai bankrutuoja oro vežėjai ar kelionių paslaugų tiekėjai. Per pastarąjį dešimtmetį bankrutavo daugiau nei 70 aviakompanijų, palikdamos keliautojus visiškoje nežinioje. Todėl manau,  kad šis klausimas turi būti aiškiai akcentuojamas peržiūrint direktyvos nuostatas. ",Zigmantas Balčytis  (S&D). -,1,110,not_available,['mlt'],"['  Zigmantas Balčytis  (S&D). -   Kelionių rinka per pastaruosius du dešimtmečius vystėsi labai dinamiškai. Vis daugiau žmonių patys susikomplektuoja keliones pirkdami paslaugas iš skirtingų operatorių ir paslaugų tiekėjų. Tačiau dabar galiojančios direktyvos nuostatos šiems naujiems kelionių paketams netaikomos, o tai reiškia, kad mūsų piliečiai keliauja nesaugiai. Manau, kad peržiūrint direktyvą būtina kuo tiksliau apibrėžti jos taikymo sritį, ir neturėtume leisti, kad nelanksčios taisyklės paliktų mūsų piliečius be tinkamos apsaugos. Be to, turi būti išspręstas ir atsakomybės klausimas tais atvejais, kai bankrutuoja oro vežėjai ar kelionių paslaugų tiekėjai. Per pastarąjį dešimtmetį bankrutavo daugiau nei 70 aviakompanijų, palikdamos keliautojus visiškoje nežinioje. Todėl manau,  kad šis klausimas turi būti aiškiai akcentuojamas peržiūrint direktyvos nuostatas. ']"
112," 16. Reviżjoni tad-""Direttiva dwar il-Vjaġġi Kollox Kompriż"" (dibattitu)","  John Dalli,  Member of the Commission. − Mr President, I have listened to the views of the honourable Members with great interest. Many of you have affirmed the direction being taken by the Commission. Others have underlined and emphasised many points that we have noted to make sure that they are all taken into consideration in the deliberations and discussions that we will be having on this revision of the Directive. I would like to assure you that the Commission takes these issues very seriously and is determined to find the best solutions for the way forward.We are now in the middle of a consultation process. We are analysing the feedback we gathered from the recent online public consultation. Consumers, businesses, organisations and Member States have all contributed. Moreover, I can inform you that the Commission will host a stakeholders’ workshop on 22 April 2010. This workshop will focus on possible policy options for the revision of the Package Travel Directive, including all the issues that have been mentioned during this debate. I must stress that it is as yet too early to decide the way forward. It is essential to respect the impact assessment procedure. However, I am determined that any action should aim at ensuring a high level of protection to the EU’s citizens.Before I close, may I once again thank all those present for contributing to this debate. Thank you very much.","John Dalli,",3,237,not_available,"['mlt', 'mlt', 'mlt']","['  John Dalli,  Member of the Commission. − Mr President, I have listened to the views of the honourable Members with great interest. Many of you have affirmed the direction being taken by the Commission. Others have underlined and emphasised many points that we have noted to make sure that they are all taken into consideration in the deliberations and discussions that we will be having on this revision of the Directive. I would like to assure you that the Commission takes these issues very seriously and is determined to find the best solutions for the way forward.', 'We are now in the middle of a consultation process. We are analysing the feedback we gathered from the recent online public consultation. Consumers, businesses, organisations and Member States have all contributed. Moreover, I can inform you that the Commission will host a stakeholders’ workshop on 22 April 2010. This workshop will focus on possible policy options for the revision of the Package Travel Directive, including all the issues that have been mentioned during this debate. I must stress that it is as yet too early to decide the way forward. It is essential to respect the impact assessment procedure. However, I am determined that any action should aim at ensuring a high level of protection to the EU’s citizens.', 'Before I close, may I once again thank all those present for contributing to this debate. Thank you very much.']"
113," 16. Reviżjoni tad-""Direttiva dwar il-Vjaġġi Kollox Kompriż"" (dibattitu)",  Elnök. −   A vitát lezárom.,Elnök. −,1,4,not_available,['mlt'],['  Elnök. −   A vitát lezárom.']
114, 17. Tassazzjoni tat-tranżazzjonijiet finanzjarji (dibattitu),"  Elnök. −   A következő pont a Sharon Bowles által a Gazdasági és Monetáris Bizottság nevében a Bizottsághoz intézett, a Pénzügyi tranzakciók után kivetendő adókról szóló szóbeli választ igénylő kérdésről folytatott vita (O-0025/2010 - B7-0019/2010)",Elnök. −,1,36,not_available,['mlt'],"['  Elnök. −   A következő pont a Sharon Bowles által a Gazdasági és Monetáris Bizottság nevében a Bizottsághoz intézett, a Pénzügyi tranzakciók után kivetendő adókról szóló szóbeli választ igénylő kérdésről folytatott vita (O-0025/2010 - B7-0019/2010)']"
115, 17. Tassazzjoni tat-tranżazzjonijiet finanzjarji (dibattitu),"  Edward Scicluna,  author. − Mr President, the ECON Committee has put forward this question and resolution because some careful thinking has to be done. Last year the committee discussed financial transaction taxes with Commissioner Kovács, who, like many, said he found the idea attractive, and we made it clear then that it would be a good idea to investigate how it would work, including the infrastructure for it.Since then, the Commission has been investigating the subject, and we are highlighting here the large range of questions needing to be answered. There have been calls, including in the G20 last September, to make the financial sector pay for setting up stability funds and recompense for the damage that they have caused to the real economy. President Barroso has suggested using a global financial levy to fund environmental projects. The original Tobin Tax idea of using a financial transaction tax for development aid has also strongly resurfaced.It is not the intention of this resolution to bring pressure to bear in any one direction, other than for answers and impact assessments, but of course we have many who are strong advocates of transaction taxes and many who have equally strong reservations about them. Nowadays, it does seem highly likely that the collection of a transaction tax is easier, even at international level, given the electronic nature of many transactions, but it is also impossible to ignore the fact that there are more alternative competing destinations for the proceeds of any tax.One idea concerning the tax is that nobody would notice because it is so small in each instance. On the other hand, others suggest it should be used to deter excessive transactions. It seems to my committee that if the end amount collected is large – and the sums suggest so – then somebody somewhere will actually be paying. Many financial transactions are intermediate, not like end sales, so the intermediaries – banks and the like – will bear the tax. But surely the extra costs – for that is what they are – will simply be passed on to the end user. Some may say that does not matter. However, there are also other ways that taxation could be raised within financial services.Then there is the question of who is to collect the tax and who is to decide how it is used. Here there is even the ‘no taxation without representation’ issue. If the tax is collected in London for a derivative transaction that is uncosted, to somewhere else in the world, who says where to spend it? This question may be easier to answer if it goes to a financial stability cause in which the payers are obviously participating than if it is to go outside the financial sphere, such as to environmental projects or development aid. All these things have an international element, both on the paying side and on the spending side. We probably cannot do all these things and have all these benefits, so at the very least choices have to be made about what we are trying to fix, the method by which it is to be done and the primary purpose of the tax.Finally, indeed, are we right to mix regulation with tax-raising? Are these truly complementary?","Edward Scicluna,",6,541,not_available,"['mlt', 'mlt', 'mlt', 'mlt', 'mlt', 'mlt']","['  Edward Scicluna,  author. − Mr President, the ECON Committee has put forward this question and resolution because some careful thinking has to be done. Last year the committee discussed financial transaction taxes with Commissioner Kovács, who, like many, said he found the idea attractive, and we made it clear then that it would be a good idea to investigate how it would work, including the infrastructure for it.', 'Since then, the Commission has been investigating the subject, and we are highlighting here the large range of questions needing to be answered. There have been calls, including in the G20 last September, to make the financial sector pay for setting up stability funds and recompense for the damage that they have caused to the real economy. President Barroso has suggested using a global financial levy to fund environmental projects. The original Tobin Tax idea of using a financial transaction tax for development aid has also strongly resurfaced.', 'It is not the intention of this resolution to bring pressure to bear in any one direction, other than for answers and impact assessments, but of course we have many who are strong advocates of transaction taxes and many who have equally strong reservations about them. Nowadays, it does seem highly likely that the collection of a transaction tax is easier, even at international level, given the electronic nature of many transactions, but it is also impossible to ignore the fact that there are more alternative competing destinations for the proceeds of any tax.', 'One idea concerning the tax is that nobody would notice because it is so small in each instance. On the other hand, others suggest it should be used to deter excessive transactions. It seems to my committee that if the end amount collected is large – and the sums suggest so – then somebody somewhere will actually be paying. Many financial transactions are intermediate, not like end sales, so the intermediaries – banks and the like – will bear the tax. But surely the extra costs – for that is what they are – will simply be passed on to the end user. Some may say that does not matter. However, there are also other ways that taxation could be raised within financial services.', 'Then there is the question of who is to collect the tax and who is to decide how it is used. Here there is even the ‘no taxation without representation’ issue. If the tax is collected in London for a derivative transaction that is uncosted, to somewhere else in the world, who says where to spend it? This question may be easier to answer if it goes to a financial stability cause in which the payers are obviously participating than if it is to go outside the financial sphere, such as to environmental projects or development aid. All these things have an international element, both on the paying side and on the spending side. We probably cannot do all these things and have all these benefits, so at the very least choices have to be made about what we are trying to fix, the method by which it is to be done and the primary purpose of the tax.', 'Finally, indeed, are we right to mix regulation with tax-raising? Are these truly complementary?']"
116, 17. Tassazzjoni tat-tranżazzjonijiet finanzjarji (dibattitu),"  Algirdas Šemeta,  Member of the Commission. − Mr President, I am happy to contribute to this important debate on the innovative financing instruments and answer this oral question.Regarding the options for the introduction of a general financial transaction tax, the Commission intends, as announced in its EU 2020 strategy, to contribute to the debate on innovative financing at global level.It is currently working on defining and assessing different approaches, one of these being a general financial transaction tax (FTT). The ‘financial crisis responsibility fee’ proposed in the US and the ‘stability fee’ on certain assets of banks, as introduced in Sweden, are other ones.As far as the FTT is concerned, it is clear that the options today differ from the initial discussions on the Tobin Tax, as it would cover a broader base of financial products.Concerning the advantages and drawbacks of the introduction of the general FTT, the Commission believes that, in assessing the different instruments, it is important to avoid the accumulation of initiatives that could be detrimental to the financial sector, and to ensure that the new initiatives do not result in the relocation of transactions to other regions, which would have a negative impact on Europe’s competitiveness.Regarding the possibility of implementing a general FTT in the EU if our main partners do not introduce such a tax, I would like to remind you that the IMF is also, in parallel to the work of the Commission, examining options, including a global financial transactions levy.This demonstrates that the subject is of a global nature and the Commission believes that the best way to tackle this issue is to find global and coordinated solutions. This is our first and preferred option.Concerning the use of tax as a complementary regulatory tool in the context of financial market reforms, I can confirm that the Commission is considering complementarities between the tax and regulatory instruments and will pay attention to the cumulative impact of these two types of instruments on the ability of the financial sector to support economic recovery.Regarding the possibility of making the financial system long-term oriented with the introduction of a general FTT, the Commission is not aware of clear data or studies on the relationship between such a tax and the maturity structure of financial intermediation.Concerning the allocation of revenues generated by a FTT, as the analysis on innovative financing is still ongoing, I think coming to any conclusions about revenue sharing and allocation would be premature. Let me, nevertheless, emphasise that the potential revenues of a general FTT would be very asymmetric, probably located in only a few countries that have the largest financial centres. This asymmetry points to the need for global solutions, including about the sharing and allocation of revenue.Finally, the timing of the different initiatives. As a first step, the Commission’s services are currently examining the issue of innovative financing instruments overall. The Commission will also take into account the conclusions of our main international partners in order to identify the options with the most potential. It is on this basis that, in a second step, concrete proposals with a detailed impact assessment might be launched, in line with the Commission’s standard approach on better regulation.","Algirdas Šemeta,",11,545,not_available,"['mlt', 'mlt', 'mlt', 'mlt', 'mlt', 'mlt', 'mlt', 'mlt', 'mlt', 'mlt', 'mlt']","['  Algirdas Šemeta,  Member of the Commission. − Mr President, I am happy to contribute to this important debate on the innovative financing instruments and answer this oral question.', 'Regarding the options for the introduction of a general financial transaction tax, the Commission intends, as announced in its EU 2020 strategy, to contribute to the debate on innovative financing at global level.', 'It is currently working on defining and assessing different approaches, one of these being a general financial transaction tax (FTT). The ‘financial crisis responsibility fee’ proposed in the US and the ‘stability fee’ on certain assets of banks, as introduced in Sweden, are other ones.', 'As far as the FTT is concerned, it is clear that the options today differ from the initial discussions on the Tobin Tax, as it would cover a broader base of financial products.', 'Concerning the advantages and drawbacks of the introduction of the general FTT, the Commission believes that, in assessing the different instruments, it is important to avoid the accumulation of initiatives that could be detrimental to the financial sector, and to ensure that the new initiatives do not result in the relocation of transactions to other regions, which would have a negative impact on Europe’s competitiveness.', 'Regarding the possibility of implementing a general FTT in the EU if our main partners do not introduce such a tax, I would like to remind you that the IMF is also, in parallel to the work of the Commission, examining options, including a global financial transactions levy.', 'This demonstrates that the subject is of a global nature and the Commission believes that the best way to tackle this issue is to find global and coordinated solutions. This is our first and preferred option.', 'Concerning the use of tax as a complementary regulatory tool in the context of financial market reforms, I can confirm that the Commission is considering complementarities between the tax and regulatory instruments and will pay attention to the cumulative impact of these two types of instruments on the ability of the financial sector to support economic recovery.', 'Regarding the possibility of making the financial system long-term oriented with the introduction of a general FTT, the Commission is not aware of clear data or studies on the relationship between such a tax and the maturity structure of financial intermediation.', 'Concerning the allocation of revenues generated by a FTT, as the analysis on innovative financing is still ongoing, I think coming to any conclusions about revenue sharing and allocation would be premature. Let me, nevertheless, emphasise that the potential revenues of a general FTT would be very asymmetric, probably located in only a few countries that have the largest financial centres. This asymmetry points to the need for global solutions, including about the sharing and allocation of revenue.', 'Finally, the timing of the different initiatives. As a first step, the Commission’s services are currently examining the issue of innovative financing instruments overall. The Commission will also take into account the conclusions of our main international partners in order to identify the options with the most potential. It is on this basis that, in a second step, concrete proposals with a detailed impact assessment might be launched, in line with the Commission’s standard approach on better regulation.']"
