,agenda_item,text,speaker,number_p,number_w,chair,language_ps,ps
151, 18. Implimentazzjoni taż-Żona ta' Pagamenti Uniċi bl-Euro (SEPA) (dibattitu),"  Jean-Paul Gauzès,  au nom du groupe PPE. – Monsieur le Président, Monsieur le Commissaire, je ne doute pas de votre détermination et vous avez, par les éléments que vous venez de donner, déjà fourni une réponse à la plupart des questions que nous nous posions et que pose cette résolution.Je rappellerai simplement que la difficulté du sujet tient au fait que le SEPA est une initiative des établissements de paiement, essentiellement des établissements bancaires, et que la directive sur les services de paiement, dont j'avais l'honneur d'être le rapporteur, a eu pour objet notamment de permettre de trouver et de définir les instruments juridiques nécessaires pour mettre en place ce système européen des paiements. Elle avait aussi pour objectif d'améliorer la concurrence dans le domaine des paiements, le titre II prévoyant la création d'établissements de paiement qui devaient ainsi rompre le monopole des banques.Cette naissance compliquée explique certainement une partie du retard mais c'est bien vrai, et vous l'avez dit, les établissements de services de paiement, les établissements bancaires ont certainement montré un peu de réticence à mettre en œuvre ce dispositif. Il y a une explication, c'est le coût. Pour vous donner une idée – mais vous le savez certainement –, en France par exemple, le coût de la mise en place du SEPA est supérieur au coût du passage à l'euro.Il y a eu aussi cette question des commissions d'interchange qui mérite d'être abordée en ayant deux éléments à l'esprit: le premier, vous l'avez rappelé, c'est celui de la conformité aux règles de concurrence mais le deuxième élément, qu'il ne faut pas négliger, c'est que le service de paiement est une activité commerciale des établissements de paiement et qu'à ce titre, il faut une juste rémunération. Ce qui a été condamné, c'est la possibilité de fixer unilatéralement, arbitrairement, sans référence, des marges interbancaires qui apparaissaient, à juste titre, excessives.Monsieur le Commissaire, nous comptons sur vous pour que cette avancée qui a été la création du marché unique des paiements se traduise dans un très proche avenir par une mise en place des instruments européens de virement et de débit direct.","Jean-Paul Gauzès,",5,372,not_available,"['mlt', 'mlt', 'mlt', 'mlt', 'mlt']","['  Jean-Paul Gauzès,  au nom du groupe PPE. – Monsieur le Président, Monsieur le Commissaire, je ne doute pas de votre détermination et vous avez, par les éléments que vous venez de donner, déjà fourni une réponse à la plupart des questions que nous nous posions et que pose cette résolution.', ""Je rappellerai simplement que la difficulté du sujet tient au fait que le SEPA est une initiative des établissements de paiement, essentiellement des établissements bancaires, et que la directive sur les services de paiement, dont j'avais l'honneur d'être le rapporteur, a eu pour objet notamment de permettre de trouver et de définir les instruments juridiques nécessaires pour mettre en place ce système européen des paiements. Elle avait aussi pour objectif d'améliorer la concurrence dans le domaine des paiements, le titre II prévoyant la création d'établissements de paiement qui devaient ainsi rompre le monopole des banques."", ""Cette naissance compliquée explique certainement une partie du retard mais c'est bien vrai, et vous l'avez dit, les établissements de services de paiement, les établissements bancaires ont certainement montré un peu de réticence à mettre en œuvre ce dispositif. Il y a une explication, c'est le coût. Pour vous donner une idée – mais vous le savez certainement –, en France par exemple, le coût de la mise en place du SEPA est supérieur au coût du passage à l'euro."", ""Il y a eu aussi cette question des commissions d'interchange qui mérite d'être abordée en ayant deux éléments à l'esprit: le premier, vous l'avez rappelé, c'est celui de la conformité aux règles de concurrence mais le deuxième élément, qu'il ne faut pas négliger, c'est que le service de paiement est une activité commerciale des établissements de paiement et qu'à ce titre, il faut une juste rémunération. Ce qui a été condamné, c'est la possibilité de fixer unilatéralement, arbitrairement, sans référence, des marges interbancaires qui apparaissaient, à juste titre, excessives."", 'Monsieur le Commissaire, nous comptons sur vous pour que cette avancée qui a été la création du marché unique des paiements se traduise dans un très proche avenir par une mise en place des instruments européens de virement et de débit direct.']"
152, 18. Implimentazzjoni taż-Żona ta' Pagamenti Uniċi bl-Euro (SEPA) (dibattitu),"  Udo Bullmann,  im Namen der S&D-Fraktion. – Herr Präsident! Herr Kommissar, der Einheitliche Europäische Zahlungsverkehrsraum ist ein wichtiges, ja ein zentrales Instrument des europäischen Binnenmarktes. Dem Kollegen Gauzès sei Dank, dass wir es auf den Weg gebracht haben. Meine Fraktion steht voll dahinter und möchte es funktionstüchtig sehen. Ich persönlich habe auch nichts dagegen, wenn wir ein Enddatum für den Übergang festlegen, wobei es mir auf drei oder vier oder fünf Monate nicht so sehr ankommt wie auf den Umstand, dass es dann wirklich funktioniert.Zum wirklichen Funktionieren gehören zwei Dinge. Das ist erstens der Aufruf an die Industrie: Es muss endverbraucherfreundlich sein. Wir können uns kein Rumoren, wir können uns keinen heimlichen Widerstand, wir können uns kein Dem-alten-System-Nachtrauern leisten in diesen Zeiten. Deswegen muss es funktionstüchtig sein, auch im Sinne derjenigen, die es am Ende benutzen müssen.Zweitens, es muss natürlich auch im Interesse der Wirtschaft funktionieren. Da will ich einen Punkt ansprechen, der immer noch ein Stein des Anstoßes ist, nämlich die Frage, wie Lastschriften im Innerbankenverkehr abgerechnet werden. Hier scheint die Wirtschaft noch nicht in der Lage zu sein, ein vernünftiges Modell vorzuschlagen. Da hakt es noch, da klemmt es noch, und wenn die Wirtschaft nicht in der Lage ist, ein gemeinsames Modell zu präsentieren, das innerhalb der Europäischen Union funktioniert, dann muss die Kommission – und das steht auch in diesem Entschließungsantrag – innerhalb einer bestimmten Frist, wir sagen: noch in diesem Jahr, einen konkreten Vorschlag unterbreiten. Denn es darf nicht sein, dass wir der Wirtschaft gegenübertreten und ein Enddatum zum Übergang verlangen, aber nicht die Initiative ergreifen, um die Widerstände zu beseitigen, die die Zahlungsdienstleister durch Eigenregie offenbar nicht in der Lage sind zu überwinden. Hier brauchen wir eine gemeinschaftliche Initiative, dann kann das insgesamt funktionieren. Das wäre unser Ansatz für die Diskussion.","Udo Bullmann,",3,300,not_available,"['mlt', 'mlt', 'mlt']","['  Udo Bullmann,  im Namen der S&D-Fraktion. – Herr Präsident! Herr Kommissar, der Einheitliche Europäische Zahlungsverkehrsraum ist ein wichtiges, ja ein zentrales Instrument des europäischen Binnenmarktes. Dem Kollegen Gauzès sei Dank, dass wir es auf den Weg gebracht haben. Meine Fraktion steht voll dahinter und möchte es funktionstüchtig sehen. Ich persönlich habe auch nichts dagegen, wenn wir ein Enddatum für den Übergang festlegen, wobei es mir auf drei oder vier oder fünf Monate nicht so sehr ankommt wie auf den Umstand, dass es dann wirklich funktioniert.', 'Zum wirklichen Funktionieren gehören zwei Dinge. Das ist erstens der Aufruf an die Industrie: Es muss endverbraucherfreundlich sein. Wir können uns kein Rumoren, wir können uns keinen heimlichen Widerstand, wir können uns kein Dem-alten-System-Nachtrauern leisten in diesen Zeiten. Deswegen muss es funktionstüchtig sein, auch im Sinne derjenigen, die es am Ende benutzen müssen.', 'Zweitens, es muss natürlich auch im Interesse der Wirtschaft funktionieren. Da will ich einen Punkt ansprechen, der immer noch ein Stein des Anstoßes ist, nämlich die Frage, wie Lastschriften im Innerbankenverkehr abgerechnet werden. Hier scheint die Wirtschaft noch nicht in der Lage zu sein, ein vernünftiges Modell vorzuschlagen. Da hakt es noch, da klemmt es noch, und wenn die Wirtschaft nicht in der Lage ist, ein gemeinsames Modell zu präsentieren, das innerhalb der Europäischen Union funktioniert, dann muss die Kommission – und das steht auch in diesem Entschließungsantrag – innerhalb einer bestimmten Frist, wir sagen: noch in diesem Jahr, einen konkreten Vorschlag unterbreiten. Denn es darf nicht sein, dass wir der Wirtschaft gegenübertreten und ein Enddatum zum Übergang verlangen, aber nicht die Initiative ergreifen, um die Widerstände zu beseitigen, die die Zahlungsdienstleister durch Eigenregie offenbar nicht in der Lage sind zu überwinden. Hier brauchen wir eine gemeinschaftliche Initiative, dann kann das insgesamt funktionieren. Das wäre unser Ansatz für die Diskussion.']"
153, 18. Implimentazzjoni taż-Żona ta' Pagamenti Uniċi bl-Euro (SEPA) (dibattitu),"  Martin Ehrenhauser,  im Namen der NI-Fraktion. – Herr Präsident! Es ist gut, dass wir den Euro haben. Kleine Länder wie mein Heimatland Österreich wären ansonsten schon während der Finanzkrise 2007 massiv unter Druck geraten. Die andere Seite der Euro-Münze ist jedoch die fehlende Konsequenz und die fehlende Verantwortlichkeit, und hier gibt es natürlich einige Fragen an die Kommission. Erstens: Wer ist verantwortlich für das Kontrolldefizit des Euro-Systems? Zweitens: Wer ist verantwortlich dafür, dass die falschen Budgetzahlen aus Griechenland nicht schon früher erkannt wurden? Drittens: Ist es nicht so, dass wir heute über Griechenland sprechen, aber das eigentliche Problem Spanien ist? Viertens: Kann die EU-Kommission garantieren, dass Spanien keine falschen Budgetzahlen liefert, und was macht sie dazu?Ich fordere Aufklärung und Transparenz und vor allem, dass jene Personen, die Verantwortung tragen, auch schlussendlich zur Rechenschaft gezogen werden. Denn nur dann, wenn diese Personen auch tatsächlich verantwortlich gemacht werden, kann man dafür garantieren, dass schlussendlich die Spielregeln konsequent eingehalten werden.","Martin Ehrenhauser,",3,161,not_available,"['mlt', 'mlt', 'mlt']","['  Martin Ehrenhauser,  im Namen der NI-Fraktion. – Herr Präsident! Es ist gut, dass wir den Euro haben. Kleine Länder wie mein Heimatland Österreich wären ansonsten schon während der Finanzkrise 2007 massiv unter Druck geraten. ', 'Die andere Seite der Euro-Münze ist jedoch die fehlende Konsequenz und die fehlende Verantwortlichkeit, und hier gibt es natürlich einige Fragen an die Kommission. Erstens: Wer ist verantwortlich für das Kontrolldefizit des Euro-Systems? Zweitens: Wer ist verantwortlich dafür, dass die falschen Budgetzahlen aus Griechenland nicht schon früher erkannt wurden? Drittens: Ist es nicht so, dass wir heute über Griechenland sprechen, aber das eigentliche Problem Spanien ist? Viertens: Kann die EU-Kommission garantieren, dass Spanien keine falschen Budgetzahlen liefert, und was macht sie dazu?', 'Ich fordere Aufklärung und Transparenz und vor allem, dass jene Personen, die Verantwortung tragen, auch schlussendlich zur Rechenschaft gezogen werden. Denn nur dann, wenn diese Personen auch tatsächlich verantwortlich gemacht werden, kann man dafür garantieren, dass schlussendlich die Spielregeln konsequent eingehalten werden.']"
154, 18. Implimentazzjoni taż-Żona ta' Pagamenti Uniċi bl-Euro (SEPA) (dibattitu),"  Markus Ferber  (PPE). -   Herr Präsident, Herr Kommissar, liebe Kolleginnen und Kollegen! Zunächst einmal ist es richtig, dass zu einer gemeinsamen, einer einheitlichen Währung auch einheitliche Verfahren gehören. Es ist richtig, darüber nachzudenken, wie wir den einheitlichen Verfahren, die sich ja noch nicht überall im Europäischen Zahlungsverkehrsraum durchgesetzt haben, etwas mehr Geltung verschaffen.Auf der anderen Seite sage ich ganz deutlich, dass wir das Regelbuch noch an ein paar Stellen anpassen müssen. Ich komme selber aus einem Land, wo das Lastschriftverfahren ein sehr weit verbreitetes Verfahren ist, um die Abwicklung von bestimmten Zahlungen, die regelmäßig anfallen, zu erleichtern.Das Verfahren, das momentan im Regelbuch vorgesehen ist, ist ein sehr bürokratisches, ein sehr kompliziertes Verfahren, und deswegen würde ich mich sehr freuen, Herr Kommissar, wenn im Hinblick auf ein Enddatum – das wir ja alle wollen – gerade dieser Bereich noch einmal angegangen wird. Auf der einen Seite darf keine Betrugsanfälligkeit bestehen – das ist ein Problem im grenzüberschreitenden Bereich –, auf der anderen Seite aber sollten auch jede kommunale Gebühr, die hier abgebucht wird, jedes Zeitschriftenabonnement, jeder Versicherungsbeitrag, die Handy-Rechnung usw. weiterhin in einem einfachen Verfahren von den Unternehmen eingezogen werden können.Das wäre meine Bitte, es steht auch eine entsprechende Passage in unserem Entschließungsantrag zu diesem Thema, damit wir einen Beitrag dazu leisten, dass Verfahren, die sich in Mitgliedstaaten bewährt haben, auch nach der endgültigen Einführung des Einheitlichen Zahlungsverkehrsraums gewährleistet werden können.",Markus Ferber  (PPE). -,4,229,not_available,"['mlt', 'mlt', 'mlt', 'mlt']","['  Markus Ferber  (PPE). -   Herr Präsident, Herr Kommissar, liebe Kolleginnen und Kollegen! Zunächst einmal ist es richtig, dass zu einer gemeinsamen, einer einheitlichen Währung auch einheitliche Verfahren gehören. Es ist richtig, darüber nachzudenken, wie wir den einheitlichen Verfahren, die sich ja noch nicht überall im Europäischen Zahlungsverkehrsraum durchgesetzt haben, etwas mehr Geltung verschaffen.', 'Auf der anderen Seite sage ich ganz deutlich, dass wir das Regelbuch noch an ein paar Stellen anpassen müssen. Ich komme selber aus einem Land, wo das Lastschriftverfahren ein sehr weit verbreitetes Verfahren ist, um die Abwicklung von bestimmten Zahlungen, die regelmäßig anfallen, zu erleichtern.', 'Das Verfahren, das momentan im Regelbuch vorgesehen ist, ist ein sehr bürokratisches, ein sehr kompliziertes Verfahren, und deswegen würde ich mich sehr freuen, Herr Kommissar, wenn im Hinblick auf ein Enddatum – das wir ja alle wollen – gerade dieser Bereich noch einmal angegangen wird. Auf der einen Seite darf keine Betrugsanfälligkeit bestehen – das ist ein Problem im grenzüberschreitenden Bereich –, auf der anderen Seite aber sollten auch jede kommunale Gebühr, die hier abgebucht wird, jedes Zeitschriftenabonnement, jeder Versicherungsbeitrag, die Handy-Rechnung usw. weiterhin in einem einfachen Verfahren von den Unternehmen eingezogen werden können.', 'Das wäre meine Bitte, es steht auch eine entsprechende Passage in unserem Entschließungsantrag zu diesem Thema, damit wir einen Beitrag dazu leisten, dass Verfahren, die sich in Mitgliedstaaten bewährt haben, auch nach der endgültigen Einführung des Einheitlichen Zahlungsverkehrsraums gewährleistet werden können.']"
155, 18. Implimentazzjoni taż-Żona ta' Pagamenti Uniċi bl-Euro (SEPA) (dibattitu),"  Othmar Karas  (PPE). -   Herr Präsident, meine Damen und Herren! Wir sind uns wohl alle darin einig, dass wir die Antworten des Herrn Kommissar auf die Anfrage für gut und richtig befinden und uns dafür bedanken. Sie entsprechen den Zielsetzungen des Europäischen Parlaments.Als Zweites möchte ich hier einmal sagen: Die Methode der Selbstregulierung im Bankenbereich, die wir  bei SEPA gewählt haben, ist eine Methode, bei der die Organe gut arbeiten und sich mehrere hundert Banken in kürzester Zeit in den SEPA-Raum eingebracht haben. SEPA ist Teil des Binnenmarkts, der SEPA-Raum ist größer als der Euroraum, aber er ist nicht fertig. Ich trete sehr massiv für ein einheitliches rechtsverbindliches Abschlussdatum ein, weil ich hoffe, dass wir mit einem solchen Datum auch den Druck erhöhen, die offenen Fragen zu regeln, und die Rechtsverbindlichkeit, die einheitliche Umsetzung auf den Weg bringen.  Dadurch könnten  alle Beteiligten noch einmal auf den Tisch  legen, was noch alles zu tun ist. Das gemeinsame Datum ist notwendig, um den SEPA-Raum so rasch, so effizient und so binnenmarkttauglich wie möglich umzusetzen.",Othmar Karas  (PPE). -,2,175,not_available,"['mlt', 'mlt']","['  Othmar Karas  (PPE). -   Herr Präsident, meine Damen und Herren! Wir sind uns wohl alle darin einig, dass wir die Antworten des Herrn Kommissar auf die Anfrage für gut und richtig befinden und uns dafür bedanken. Sie entsprechen den Zielsetzungen des Europäischen Parlaments.', 'Als Zweites möchte ich hier einmal sagen: Die Methode der Selbstregulierung im Bankenbereich, die wir  bei SEPA gewählt haben, ist eine Methode, bei der die Organe gut arbeiten und sich mehrere hundert Banken in kürzester Zeit in den SEPA-Raum eingebracht haben. SEPA ist Teil des Binnenmarkts, der SEPA-Raum ist größer als der Euroraum, aber er ist nicht fertig. Ich trete sehr massiv für ein einheitliches rechtsverbindliches Abschlussdatum ein, weil ich hoffe, dass wir mit einem solchen Datum auch den Druck erhöhen, die offenen Fragen zu regeln, und die Rechtsverbindlichkeit, die einheitliche Umsetzung auf den Weg bringen.  Dadurch könnten  alle Beteiligten noch einmal auf den Tisch  legen, was noch alles zu tun ist. Das gemeinsame Datum ist notwendig, um den SEPA-Raum so rasch, so effizient und so binnenmarkttauglich wie möglich umzusetzen.']"
156, 18. Implimentazzjoni taż-Żona ta' Pagamenti Uniċi bl-Euro (SEPA) (dibattitu),"  David Casa  (PPE). -   Mr President, SEPA is a commendable initiative that will undoubtedly be of great benefit in improving the efficiency of cross-border payments and turning the fragmented national markets for euro payments into a single domestic one, by enabling customers to make cashless euro payments to anyone located anywhere in the area using a single bank account and a single set of payment instruments.Another major benefit will result from the reduction of the overall costs to the European economy of moving capital around the region, which is estimated today at two to three per cent of the total gross domestic product. We must remember that the end goal of SEPA was to create a truly domestic payments environment all around Europe, and it is understandable that achieving such an ambitious goal is by no means easy, especially when considering the unfortunate necessity of finding compromises between the often conflicting interests of the pan-European banking community. The economic crisis has only hindered the process of implementing SEPA standards; this is a costly process and the banks have understandably had other, more urgent priorities in recent times. An analysis of the current situation should be carried out and, I think, a realistic timetable set as soon as possible. It is now essential that a legally binding deadline for migration to the use of SEPA instruments be established, as my colleague Mr Karas has just said. It is unacceptable that to date there is no concrete schedule in place. The notion that domestic standards should be allowed to run in parallel with SEPA is inefficient and counterproductive. I therefore call on you, Mr Commissioner, and the Commission, to bring certainty to this already fragile sector and ensure that a legally binding end-date for migration to SEPA instruments is finally set. ",David Casa  (PPE). -,5,302,not_available,"['mlt', 'mlt', 'mlt', 'mlt', 'mlt']","['  David Casa  (PPE). -   Mr President, SEPA is a commendable initiative that will undoubtedly be of great benefit in improving the efficiency of cross-border payments and turning the fragmented national markets for euro payments into a single domestic one, by enabling customers to make cashless euro payments to anyone located anywhere in the area using a single bank account and a single set of payment instruments.', 'Another major benefit will result from the reduction of the overall costs to the European economy of moving capital around the region, which is estimated today at two to three per cent of the total gross domestic product. We must remember that the end goal of SEPA was to create a truly domestic payments environment all around Europe, and it is understandable that achieving such an ambitious goal is by no means easy, especially when considering the unfortunate necessity of finding compromises between the often conflicting interests of the pan-European banking community. ', 'The economic crisis has only hindered the process of implementing SEPA standards; this is a costly process and the banks have understandably had other, more urgent priorities in recent times. An analysis of the current situation should be carried out and, I think, a realistic timetable set as soon as possible. ', 'It is now essential that a legally binding deadline for migration to the use of SEPA instruments be established, as my colleague Mr Karas has just said. It is unacceptable that to date there is no concrete schedule in place. The notion that domestic standards should be allowed to run in parallel with SEPA is inefficient and counterproductive. ', 'I therefore call on you, Mr Commissioner, and the Commission, to bring certainty to this already fragile sector and ensure that a legally binding end-date for migration to SEPA instruments is finally set. ']"
157, 18. Implimentazzjoni taż-Żona ta' Pagamenti Uniċi bl-Euro (SEPA) (dibattitu),"  Elena Băsescu  (PPE). -   Doresc să vă informez că ţara mea, România, face paşi importanţi în ceea ce priveşte implementarea şi migrarea la SEPA. În luna octombrie 2009, Directiva 64/2007/CE privind serviciile de plată în cadrul pieţei a fost transpusă în legislaţia românească. Încă din 2007, Asociaţia Română a Băncilor, membră a Consiliului European al Plăţilor, şi-a asumat rolul de organizaţie-suport pentru aderare la schemele SEPA. Astfel, finalizarea migrării la SEPA Credit Transfer se va face până la data adoptării monedei euro, în timp ce, până acum, doar cinci bănci au în plan să adere la SEPA Direct Debit în următorii trei ani. Administraţia publică joacă un rol-cheie în ceea ce priveşte migrarea la SEPA. Instituţiile publice, împreună cu serviciile de utilităţi, telecom şi cele de asigurare pot realiza masa critică necesară pentru a intensifica procesul de migrare la SEPA. Ministerul Finanţelor Publice din România a anunţat că va adera la schemele SEPA odată cu adoptarea monedei euro. Vă mulţumesc.",Elena Băsescu  (PPE). -,3,164,not_available,"['mlt', 'mlt', 'mlt']","['  Elena Băsescu  (PPE). -   Doresc să vă informez că ţara mea, România, face paşi importanţi în ceea ce priveşte implementarea şi migrarea la SEPA. În luna octombrie 2009, Directiva 64/2007/CE privind serviciile de plată în cadrul pieţei a fost transpusă în legislaţia românească. Încă din 2007, Asociaţia Română a Băncilor, membră a Consiliului European al Plăţilor, şi-a asumat rolul de organizaţie-suport pentru aderare la schemele SEPA. Astfel, finalizarea migrării la SEPA Credit Transfer se va face până la data adoptării monedei euro, în timp ce, până acum, doar cinci bănci au în plan să adere la SEPA Direct Debit în următorii trei ani. ', 'Administraţia publică joacă un rol-cheie în ceea ce priveşte migrarea la SEPA. Instituţiile publice, împreună cu serviciile de utilităţi, telecom şi cele de asigurare pot realiza masa critică necesară pentru a intensifica procesul de migrare la SEPA. Ministerul Finanţelor Publice din România a anunţat că va adera la schemele SEPA odată cu adoptarea monedei euro. ', 'Vă mulţumesc.']"
