,agenda_item,text,speaker,number_p,number_w,chair,language_ps,ps
148, 6. Hääletuse kohta selgituste andmine,"  Charles Tannock  (PPE-DE),  kirjalikult. − Kõnealune raport mainib Hiina kasvavat kaubandust Taiwaniga, mida ma tervitan. President Ma juhtimisel on Taiwan teinud suuri edusamme kaubandussuhete normaliseerimise suunas Hiinaga ning püüde suunas lõpetada takistav hoiak, mida Pekingi kommunistlikud valitsejad on varem ärisuhete suhtes Taiwaniga võtnud.Ent et Taiwanist integreeruks kunagi täielikult Kagu-Aasia regionaalsete majandustega, on tal vaja pääseda rahvusvahelistesse organisatsioonidesse, hoolimata sellest, kas teda tunnustatakse iseseisva suveräänse riigina või mitte.Arvestades erinevaid tervishoiupaanikaid Ida-Aasias viimastel aastatel, mis on seotud kaupade ja inimeste liikumisega - nagu näiteks SARS, linnugripp ja melamiinpiima skandaal, on oluline, et Taiwanile antaks vaatleja staatus Maailma Tervishoiuassamblees. Taoline käik arendaks väinaülest kaubandust, tõstaks kvaliteedistandardeid regioonis ja kõrgendaks Taiwani positsiooni rahvusvahelisel areenil.See, kuidas Hiina on kasutanud erimeelsusi Taiwaniga poliitilisteks mängudeks rahvatervise küsimustes, on taunitav. Samamoodi on häbiväärne vaikus, mida nii paljud inimesed Euroopas Hiina-poolse surve tõttu jätkavad.Hääletasin antud raporti poolt. ","Charles Tannock  (PPE-DE),",5,144,not_available,"['est', 'est', 'est', 'est', 'est']","['  Charles Tannock  (PPE-DE),  kirjalikult. − Kõnealune raport mainib Hiina kasvavat kaubandust Taiwaniga, mida ma tervitan. President Ma juhtimisel on Taiwan teinud suuri edusamme kaubandussuhete normaliseerimise suunas Hiinaga ning püüde suunas lõpetada takistav hoiak, mida Pekingi kommunistlikud valitsejad on varem ärisuhete suhtes Taiwaniga võtnud.', 'Ent et Taiwanist integreeruks kunagi täielikult Kagu-Aasia regionaalsete majandustega, on tal vaja pääseda rahvusvahelistesse organisatsioonidesse, hoolimata sellest, kas teda tunnustatakse iseseisva suveräänse riigina või mitte.', 'Arvestades erinevaid tervishoiupaanikaid Ida-Aasias viimastel aastatel, mis on seotud kaupade ja inimeste liikumisega - nagu näiteks SARS, linnugripp ja melamiinpiima skandaal, on oluline, et Taiwanile antaks vaatleja staatus Maailma Tervishoiuassamblees. Taoline käik arendaks väinaülest kaubandust, tõstaks kvaliteedistandardeid regioonis ja kõrgendaks Taiwani positsiooni rahvusvahelisel areenil.', 'See, kuidas Hiina on kasutanud erimeelsusi Taiwaniga poliitilisteks mängudeks rahvatervise küsimustes, on taunitav. Samamoodi on häbiväärne vaikus, mida nii paljud inimesed Euroopas Hiina-poolse surve tõttu jätkavad.', 'Hääletasin antud raporti poolt. ']"
149, 7. Hääletuse parandused ja hääletuskavatsused: vt protokoll,(Istung katkestati kell 12.35 ja jätkus kell 15.00.) ,unknown,1,10,not_available,['est'],['(Istung katkestati kell 12.35 ja jätkus kell 15.00.) ']
150, 7. Hääletuse parandused ja hääletuskavatsused: vt protokoll,ISTUNGI JUHATAJA: Rodi KRATSA-TSAGAROPOULOU Asepresident,ISTUNGI JUHATAJA: Rodi KRATSA-TSAGAROPOULOU,1,6,not_available,['est'],['ISTUNGI JUHATAJA: Rodi KRATSA-TSAGAROPOULOU Asepresident']
151, 11.1. Olukord Sri Lankal,  Juhataja.   – Päevakorra järgmine punkt on nelja resolutsiooni ettepaneku arutelu olukorra kohta Sri Lankal.(1),Juhataja.,1,14,not_available,['est'],['  Juhataja.   – Päevakorra järgmine punkt on nelja resolutsiooni ettepaneku arutelu olukorra kohta Sri Lankal.(1)']
152, 11.1. Olukord Sri Lankal,"  Tobias Pflüger,  autor. – (DE) Proua juhataja, Sri Lanka põhjaosas leiab hetkel aset humanitaarkatastroof, mis pälvib suhteliselt vähe tähelepanu. Sri Lanka sõjavägi teostab rünnakuid tsiviilelanikkonnale, mida võiks kirjeldada isegi massimõrvadena. Tule alla on sattunud isegi haigla ning humanitaarorganisatsioonide sõnul on üleüldine olukord katastroofiline. Punane Rist on häiret andnud.Olukord Sri Lankal on eskalteerunud ning Euroopa Liit pole selles süüta, kuna lasi põhja läbirääkimised, mida peeti Norra juhtimisel seoses LTTE lülitamisega ELi terrorismiorganisatsioonide loendisse. See tähendas, et ka läbirääkimised Euroopa Liidu piires polnud enam võimalikud.Sri Lankal enesel ei ole enam olemas trükivabadust. Hiljuti sai surma ajakirjanik. Saksa suursaadikut, kes tema matustel kõneles, kirjeldas president inimesena, kel tuleks riigist lahkuda. Ta polnud teinud muud kui kirjeldanud olukorda täpselt.Räägitakse tuhandetest põgenikest põhjas ning pean tegema täiesti selgeks, et kogu olukord on selline, millele tuleks meil palju rohkem tähelepanu pöörata. Euroopa Liit peaks astuma palju selgemini välja selle vastu, mida Sri Lanka valitsus hetkel teeb. Nii Sri Lanka sõjaväe kui LTTE poolsed rünnakud on valed; selge on, et pihta saavad just peamiselt tsiviilisikud.Meil on tarvis aidata põhjas lõksujäänud inimesi ja saavutada viivitamatu relvarahu, kuna on täiesti selge, et seal tapetakse väga suurel arvul tsiviilisikuid. See on vastuvõetamatu ning Euroopa Liit jagab süüd selle eest, kui ei väljenda palju selgemalt, et toetus Sri Lanka valitsusele peab lõppema. ","Tobias Pflüger,",5,214,not_available,"['ger', 'ger', 'ger', 'ger', 'ger']","['  Tobias Pflüger,  autor. – (DE) Proua juhataja, Sri Lanka põhjaosas leiab hetkel aset humanitaarkatastroof, mis pälvib suhteliselt vähe tähelepanu. Sri Lanka sõjavägi teostab rünnakuid tsiviilelanikkonnale, mida võiks kirjeldada isegi massimõrvadena. Tule alla on sattunud isegi haigla ning humanitaarorganisatsioonide sõnul on üleüldine olukord katastroofiline. Punane Rist on häiret andnud.', 'Olukord Sri Lankal on eskalteerunud ning Euroopa Liit pole selles süüta, kuna lasi põhja läbirääkimised, mida peeti Norra juhtimisel seoses LTTE lülitamisega ELi terrorismiorganisatsioonide loendisse. See tähendas, et ka läbirääkimised Euroopa Liidu piires polnud enam võimalikud.', 'Sri Lankal enesel ei ole enam olemas trükivabadust. Hiljuti sai surma ajakirjanik. Saksa suursaadikut, kes tema matustel kõneles, kirjeldas president inimesena, kel tuleks riigist lahkuda. Ta polnud teinud muud kui kirjeldanud olukorda täpselt.', 'Räägitakse tuhandetest põgenikest põhjas ning pean tegema täiesti selgeks, et kogu olukord on selline, millele tuleks meil palju rohkem tähelepanu pöörata. Euroopa Liit peaks astuma palju selgemini välja selle vastu, mida Sri Lanka valitsus hetkel teeb. Nii Sri Lanka sõjaväe kui LTTE poolsed rünnakud on valed; selge on, et pihta saavad just peamiselt tsiviilisikud.', 'Meil on tarvis aidata põhjas lõksujäänud inimesi ja saavutada viivitamatu relvarahu, kuna on täiesti selge, et seal tapetakse väga suurel arvul tsiviilisikuid. See on vastuvõetamatu ning Euroopa Liit jagab süüd selle eest, kui ei väljenda palju selgemalt, et toetus Sri Lanka valitsusele peab lõppema. ']"
153, 11.1. Olukord Sri Lankal,"  Charles Tannock,  autor. − Proua juhataja, Sri Lanka verine kodusõda näib lõpuks lõpule jõudmas olevat. LTTE, mille EL on terrorismiorganisatsioonina musta nimekirja kandnud, peab nüüd kindlasti relvad maha panema ja alistuma. EL ja teised kaaseesistujad on soovitanud LTTE-l tungivalt seda teha. LTTE reageering näitab meile, kas tamilite parimad huvid on tegelikult nende eesmärgiks.LTTE kasutab oma variorganisatsioone Euroopas maksimaalseks propagandaefektiks ning kogub raha rahvusvahelise väljapressimisega. Osad LTTE võitlejad võivad isegi üritada Euroopa Liidu piires varjupaika taotleda.Kogu selle metsiku 26-aastase kodusõja jooksul on LTTE võtnud esmakasutusele jõledaid terroristlikke taktikaid, nagu enesetapupommitamised, mida nüüd kasutatakse – kahjuks – paljudes teistes maailma osades. Sri Lanka sõjaväel on seetõttu tulnud rakendada kõiki tema käsutuses olevaid vahendeid, et kõnealust brutaalset relvastatud vastuhakku kahjutuks teha. Ent selge on, et kannatanute statistika, mida väidab LTTE, on olnud liialdatud. Osa on nüüd tagasi võetud, näiteks Agence Presse’i lugu 300 tsiviilisiku tapmisest pärast seda, kui väidetav autor eitas selle kirjutamist. Sellele vaatamata on tsiviilisikute surm sõjatsoonis traagiline, ükskõik millal ja ükskõik kus see ka aset ei leiaks.Selge on, et Sri Lanka relvajõud ei saa ka väita määrimata ajalugu, kuid nad pole üritanud meelega tsiviilisikuid ära kasutada ja neid ohtu seada, nagu seda on väidetavalt LTTE teinud.Selleks, et sõda tõesti varsti läbi oleks, on oluline, et Sri Lanka pööraks oma tähelepanu nüüd konfliktijärgsele desarmeerimisele, demobilisatsioonile ja reintegreerimisele. Tamilite marginaliseerimine singali enamuse arvelt tuleb lahendada viivitamatult ja jäävalt, et kindlustada stabiilne ja jätkusuutlik paljurahvuseline piirkondlik detsentraliseeritud ühiskond.EL peaks samuti kindlustama, et Sri Lanka käsutusse antaks ressursid konfliktijärgse arengu toetamiseks. Kuigi peaksime toetama valitsuse amnestiapakkumist enamikule LTTE liikmetest, on eluliselt oluline, et ühelgi kõige tõsisemate sõjakurjategude eest vastutajal ei lubataks karistamatult pääseda. ","Charles Tannock,",6,274,not_available,"['est', 'est', 'est', 'est', 'est', 'est']","['  Charles Tannock,  autor. − Proua juhataja, Sri Lanka verine kodusõda näib lõpuks lõpule jõudmas olevat. LTTE, mille EL on terrorismiorganisatsioonina musta nimekirja kandnud, peab nüüd kindlasti relvad maha panema ja alistuma. EL ja teised kaaseesistujad on soovitanud LTTE-l tungivalt seda teha. LTTE reageering näitab meile, kas tamilite parimad huvid on tegelikult nende eesmärgiks.', 'LTTE kasutab oma variorganisatsioone Euroopas maksimaalseks propagandaefektiks ning kogub raha rahvusvahelise väljapressimisega. Osad LTTE võitlejad võivad isegi üritada Euroopa Liidu piires varjupaika taotleda.', 'Kogu selle metsiku 26-aastase kodusõja jooksul on LTTE võtnud esmakasutusele jõledaid terroristlikke taktikaid, nagu enesetapupommitamised, mida nüüd kasutatakse – kahjuks – paljudes teistes maailma osades. Sri Lanka sõjaväel on seetõttu tulnud rakendada kõiki tema käsutuses olevaid vahendeid, et kõnealust brutaalset relvastatud vastuhakku kahjutuks teha. Ent selge on, et kannatanute statistika, mida väidab LTTE, on olnud liialdatud. Osa on nüüd tagasi võetud, näiteks Agence Presse’i lugu 300 tsiviilisiku tapmisest pärast seda, kui väidetav autor eitas selle kirjutamist. Sellele vaatamata on tsiviilisikute surm sõjatsoonis traagiline, ükskõik millal ja ükskõik kus see ka aset ei leiaks.', 'Selge on, et Sri Lanka relvajõud ei saa ka väita määrimata ajalugu, kuid nad pole üritanud meelega tsiviilisikuid ära kasutada ja neid ohtu seada, nagu seda on väidetavalt LTTE teinud.', 'Selleks, et sõda tõesti varsti läbi oleks, on oluline, et Sri Lanka pööraks oma tähelepanu nüüd konfliktijärgsele desarmeerimisele, demobilisatsioonile ja reintegreerimisele. Tamilite marginaliseerimine singali enamuse arvelt tuleb lahendada viivitamatult ja jäävalt, et kindlustada stabiilne ja jätkusuutlik paljurahvuseline piirkondlik detsentraliseeritud ühiskond.', 'EL peaks samuti kindlustama, et Sri Lanka käsutusse antaks ressursid konfliktijärgse arengu toetamiseks. Kuigi peaksime toetama valitsuse amnestiapakkumist enamikule LTTE liikmetest, on eluliselt oluline, et ühelgi kõige tõsisemate sõjakurjategude eest vastutajal ei lubataks karistamatult pääseda. ']"
154, 11.1. Olukord Sri Lankal,"  Marios Matsakis,  autor. − Proua juhataja, Sri Lankat on vaevanud sisemine sõdimine aastakümneid. Antud traagiline olukord tekkis peamiselt põhja separatistlike vastuhakujõudude ja Sri Lanka sõjaväe vahelise relvastatud konflikti tagajärjel. Kõnealuse sõdimise jooksul sai surma ja vigastada tuhandeid süüta tsiviilisikuid ning hävinud on palju vara, infrastruktuuri ning keskkonda.Antud kahetsusväärset asjade seisu on teravdanud viimastel kuudel peamiselt valitsuse mastaapne sõjaline rünnak Tamili Tiigrite vastu. Sri Lankast saabuvad teated osutavad, et teatud piirkondades on olukord viimastel nädalatel traagiliselt halvenenud, nii et sajad tsiviilisikud on ümberasustatud ja sõdimise kätte jäänud. Amnesty International’i andmetel on esinenud rahvusvaheliste konventsioonide ja inimõiguste rikkumisi nii valitsuse kui Tamili Tiigrite poolt.Tuleb tunnistada, et on väga raske taolistes oludes täiesti kindel olla, kes mõnes Sri Lanka traagilises sündmuses süüdi on, kuid peame kutsuma mõlemat poolt üles olema vaoshoitud ning pöörama äärmist tähelepanu ja avaldama austust süüta tsiviilisikutele ning pidama kinni sõjatavadest.Kuna Sri Lanka valitsusel on olukorras käes jäme ots ja riigis on rahvusvaheliselt tunnustatud ametivõim, peab meie üleskutse tingimata ja loogiliselt minema peamiselt neile. Samal ajal peame kutsuma üles Tamili Tiigrite juhte kinni pidama rahvusvahelise kogukonna üleskutsetest, kasutama ära valitsuse amnestiapakkumist, loobuma vägivallast ning taotlema oma eesmärkide saavutamist poliitilise dialoogi teel.Peame samuti jälle tungivalt teatama, et sõdimine probleeme ei lahenda ning et kestva rahu ja stabiilsuse saab saavutada ainult läbirääkimiste laua ääres, mis tuleb vältimatult varem hiljem. Nendel läbirääkimistel peavad mõlemad pooled kompromisse tegema ning leida tuleb lahendus, mis on selle ilusa riigi kodanike hüvanguks. Loodame, et käesoleva resolutsiooni kaudu aitame vähendada Sri Lanka rahva kannatusi ning saavutada selles riigis hädavajalik rahu. ","Marios Matsakis,",5,256,not_available,"['est', 'est', 'est', 'est', 'est']","['  Marios Matsakis,  autor. − Proua juhataja, Sri Lankat on vaevanud sisemine sõdimine aastakümneid. Antud traagiline olukord tekkis peamiselt põhja separatistlike vastuhakujõudude ja Sri Lanka sõjaväe vahelise relvastatud konflikti tagajärjel. Kõnealuse sõdimise jooksul sai surma ja vigastada tuhandeid süüta tsiviilisikuid ning hävinud on palju vara, infrastruktuuri ning keskkonda.', 'Antud kahetsusväärset asjade seisu on teravdanud viimastel kuudel peamiselt valitsuse mastaapne sõjaline rünnak Tamili Tiigrite vastu. Sri Lankast saabuvad teated osutavad, et teatud piirkondades on olukord viimastel nädalatel traagiliselt halvenenud, nii et sajad tsiviilisikud on ümberasustatud ja sõdimise kätte jäänud. Amnesty International’i andmetel on esinenud rahvusvaheliste konventsioonide ja inimõiguste rikkumisi nii valitsuse kui Tamili Tiigrite poolt.', 'Tuleb tunnistada, et on väga raske taolistes oludes täiesti kindel olla, kes mõnes Sri Lanka traagilises sündmuses süüdi on, kuid peame kutsuma mõlemat poolt üles olema vaoshoitud ning pöörama äärmist tähelepanu ja avaldama austust süüta tsiviilisikutele ning pidama kinni sõjatavadest.', 'Kuna Sri Lanka valitsusel on olukorras käes jäme ots ja riigis on rahvusvaheliselt tunnustatud ametivõim, peab meie üleskutse tingimata ja loogiliselt minema peamiselt neile. Samal ajal peame kutsuma üles Tamili Tiigrite juhte kinni pidama rahvusvahelise kogukonna üleskutsetest, kasutama ära valitsuse amnestiapakkumist, loobuma vägivallast ning taotlema oma eesmärkide saavutamist poliitilise dialoogi teel.', 'Peame samuti jälle tungivalt teatama, et sõdimine probleeme ei lahenda ning et kestva rahu ja stabiilsuse saab saavutada ainult läbirääkimiste laua ääres, mis tuleb vältimatult varem hiljem. Nendel läbirääkimistel peavad mõlemad pooled kompromisse tegema ning leida tuleb lahendus, mis on selle ilusa riigi kodanike hüvanguks. Loodame, et käesoleva resolutsiooni kaudu aitame vähendada Sri Lanka rahva kannatusi ning saavutada selles riigis hädavajalik rahu. ']"
155, 11.1. Olukord Sri Lankal,"  Robert Evans,  autor. − Proua juhataja, antud parlamendi sotsialistide fraktsioon keeldub ametlikult osalemast käesoleval Sri Lanka hääletusel. Eelmisel kuul pidas parlament põhjalikku arutelu olukorra kohta Gazas koos nõukogu ja komisjoni avaldustega. Sinses täiskogus omistame Sri Lankale sama tähtsust ning arvame, et ta väärib võrdset ja korralikku arutelu, kuid kahetsusväärselt pole meid selles seisukohas mitte ükski teine fraktsioon toetanud.Tänane lühike arutelu peotäie inimestega neljapäeva pärastlõunal on solvang tuhandetele inimestele, kes on Sri Lanka põhjaosas rünnaku all ja suremas. Tahtsime kutsuda üles, nagu USA ja Ühendkuningriigi ühisdeklaratsioonis Washingtonist selle nädalal alguses, viivitamatule ja tingimusteta mõlemapoolsele relvarahule, kuid PPE keeldus seda teksti lisamast.Tahtsime tingimusteta hukka mõista haiglate ja humanitaarabitöötajate pommitamist, kuid härra Van Orden, kes rääkis PPE nimel, keeldus seda hukka mõistmast. Just seepärast pole seda resolutsioonis teie ees. Temale – ja eeldatavasti lisaks ka doktor Tannockile – on kõik, mis Sri Lanka valitsus ütleb, fakt ning peaaegu kõik humanitaarabiorganisatsioonid koha peal, Punasest Ristist ÜROni, võib tähele panemata jätta. Amnesty International’il on täna andmeid , et Sri Lanka sõjavägi võib olla süüdi sõjakurjategudes haiglas kassettpommide kasutamise eest – Amnesty International’i andmetel oli tegemist 16-tunnise pommitamisega.PSE soovis samuti hukka mõista ajakirjanike ja teiste meediatöötajate mõrvamise valitsuse agentide poolt. Resolutsiooni lõik 4 palub valitsusel – selsamal Sri Lanka valitsusel – uurida oma tõsiseid inimõiguste rikkumisi.Kolleegid, mõned teist tahavad seostada end ja oma fraktsioone selliste seisukohtadega, ent meie mitte. Hääletage käesoleva teksti poolt ning te andestate haiglate rünnakud ja jätate tähelepanemata väidetavad sõjakuriteod. Märgin, et härra Van Ordenil pole olnud isegi julgust siin seista ja oma verist kätetööd kaitsta, kuid ma pole eriti üllatunud. Meie läbirääkimistel ta ei võtnud tõsiselt ja naeris välja kui propagandistlikud süüdistused väidetavad Sri Lanka sõdurite poolsed vägistamised, nii et mida veel oodata võiks?Lähis-Idas olid miljonid inimesed – sealhulgas paljud juudid – nördinud selle üle, mida Iisrael Gazaga tegi, kuid see ei teinud neist Hamasi toetajaid. Kurb on, et kõik, kes ei toeta Sri Lanka valitsust, sildistatakse terrorismi kaitsjana ja LTTE toetajana.Ent meie ettepanek oli LTTE ja nende taktikate suhtes kriitiline. Mõistame nende rünnakud hukka ega taha, et nemad, Tamili Tiigrid, istuksid läbirääkimiste laua ümber, kuid käesolev sõda peab lõppema viivitamatult. Valitsus peab lõpetama oma sõjakampaania, mis on toonud – nagu teised on öelnud – humanitaarkatastroofi sadadele tuhandetele tavalistele inimestele saare põhjaosas.Kurb on, et käesolev resolutsioon ei kutsu üles viivitamatult sõdimist lõpetama, seega me seda lähenemist tänasel hääletusel osalemisega ei kinnita. Peame end lahus hoidma, austatud juhataja ja kolleegid, käesolevast ettepanekust ning soovitan kõigil teistel, kellel on samad vaated, teha sama. ","Robert Evans,",8,409,not_available,"['est', 'est', 'est', 'est', 'est', 'est', 'est', 'est']","['  Robert Evans,  autor. − Proua juhataja, antud parlamendi sotsialistide fraktsioon keeldub ametlikult osalemast käesoleval Sri Lanka hääletusel. Eelmisel kuul pidas parlament põhjalikku arutelu olukorra kohta Gazas koos nõukogu ja komisjoni avaldustega. Sinses täiskogus omistame Sri Lankale sama tähtsust ning arvame, et ta väärib võrdset ja korralikku arutelu, kuid kahetsusväärselt pole meid selles seisukohas mitte ükski teine fraktsioon toetanud.', 'Tänane lühike arutelu peotäie inimestega neljapäeva pärastlõunal on solvang tuhandetele inimestele, kes on Sri Lanka põhjaosas rünnaku all ja suremas. Tahtsime kutsuda üles, nagu USA ja Ühendkuningriigi ühisdeklaratsioonis Washingtonist selle nädalal alguses, viivitamatule ja tingimusteta mõlemapoolsele relvarahule, kuid PPE keeldus seda teksti lisamast.', 'Tahtsime tingimusteta hukka mõista haiglate ja humanitaarabitöötajate pommitamist, kuid härra Van Orden, kes rääkis PPE nimel, keeldus seda hukka mõistmast. Just seepärast pole seda resolutsioonis teie ees. Temale – ja eeldatavasti lisaks ka doktor Tannockile – on kõik, mis Sri Lanka valitsus ütleb, fakt ning peaaegu kõik humanitaarabiorganisatsioonid koha peal, Punasest Ristist ÜROni, võib tähele panemata jätta. Amnesty International’il on täna andmeid , et Sri Lanka sõjavägi võib olla süüdi sõjakurjategudes haiglas kassettpommide kasutamise eest – Amnesty International’i andmetel oli tegemist 16-tunnise pommitamisega.', 'PSE soovis samuti hukka mõista ajakirjanike ja teiste meediatöötajate mõrvamise valitsuse agentide poolt. Resolutsiooni lõik 4 palub valitsusel – selsamal Sri Lanka valitsusel – uurida oma tõsiseid inimõiguste rikkumisi.', 'Kolleegid, mõned teist tahavad seostada end ja oma fraktsioone selliste seisukohtadega, ent meie mitte. Hääletage käesoleva teksti poolt ning te andestate haiglate rünnakud ja jätate tähelepanemata väidetavad sõjakuriteod. Märgin, et härra Van Ordenil pole olnud isegi julgust siin seista ja oma verist kätetööd kaitsta, kuid ma pole eriti üllatunud. Meie läbirääkimistel ta ei võtnud tõsiselt ja naeris välja kui propagandistlikud süüdistused väidetavad Sri Lanka sõdurite poolsed vägistamised, nii et mida veel oodata võiks?', 'Lähis-Idas olid miljonid inimesed – sealhulgas paljud juudid – nördinud selle üle, mida Iisrael Gazaga tegi, kuid see ei teinud neist Hamasi toetajaid. Kurb on, et kõik, kes ei toeta Sri Lanka valitsust, sildistatakse terrorismi kaitsjana ja LTTE toetajana.', 'Ent meie ettepanek oli LTTE ja nende taktikate suhtes kriitiline. Mõistame nende rünnakud hukka ega taha, et nemad, Tamili Tiigrid, istuksid läbirääkimiste laua ümber, kuid käesolev sõda peab lõppema viivitamatult. Valitsus peab lõpetama oma sõjakampaania, mis on toonud – nagu teised on öelnud – humanitaarkatastroofi sadadele tuhandetele tavalistele inimestele saare põhjaosas.', 'Kurb on, et käesolev resolutsioon ei kutsu üles viivitamatult sõdimist lõpetama, seega me seda lähenemist tänasel hääletusel osalemisega ei kinnita. Peame end lahus hoidma, austatud juhataja ja kolleegid, käesolevast ettepanekust ning soovitan kõigil teistel, kellel on samad vaated, teha sama. ']"
