,agenda_item,text,speaker,number_p,number_w,chair,language_ps,ps
34, 4. Põllumajandussaaduste ja -toodete teavitamis- ja müügiedendusmeetmed (arutelu) ,"  Petya Stavrevа,  fraktsiooni PPE-DE nimel. – (BG) Härra juhataja, volinik, daamid ja härrad, sooviksin õnnitleda raportööri, härra Dumitriut, käesoleva objektiivse raporti puhul, mis kajastab ühenduse kõnealuse sektori tegelikke vajadusi Euroopa tootjate müügi edendamise osas.Raport sisaldab meetmeid, mis aitavad avada uusi turgusid ja teha meie põllumajandustootjate toodangu kasumlikuks. Antud poliitika rahuldab liikmesriikide vajadusi, kes soovivad edendada oma põllumajandustoodangu müüki nii ühenduse tarbijate kui kolmandate riikide seas.Raport annab suurepärase võimaluse rõhutada kvaliteeti, toiteväärtust, tootmismeetodeid ja toodetud toidu ohutust. Toetan raportööri ettepanekut pakkuda huvitatud riikidele võimalust esitada infokavasid kolmandatele riikidele, kui viimastel antud võimalust pole.Kõnealune muudatus lubab Euroopa riikidel laiendada antud kavades ettenähtud meetmete praktilist rakendusala ning taotleda rahvusvahelistelt organisatsioonidelt abi nende rakendamisel. Arvan, et antud programmide kujundamise protsessi jooksul tuleks võtta arvesse olulist rolli, mida etendavad igas riigis liidud ja tööstusorganisatsioonid, kellel on objektiivne pilt sellest, mis igas tööstuses toimub.Peame märkima ära teatavate rahvusvaheliste organite olulisust konkreetsete ELi regioonide jaoks tüüpiliste toidukaupade spetsiifiliste omaduste ja eeliste müügi edendamisel. Toetan raportööri ettepanekut tõsta ühenduse finantsosaluse protsendimäära, nii et saaks pakkuda täiendavat abi liikmesriikides valitud projektidele. Soovitan teil tungivalt härra Dumitriu raportit toetada. ","Petya Stavrevа,",5,183,not_available,"['bul', 'bul', 'bul', 'bul', 'bul']","['  Petya Stavrevа,  fraktsiooni PPE-DE nimel. – (BG) Härra juhataja, volinik, daamid ja härrad, sooviksin õnnitleda raportööri, härra Dumitriut, käesoleva objektiivse raporti puhul, mis kajastab ühenduse kõnealuse sektori tegelikke vajadusi Euroopa tootjate müügi edendamise osas.', 'Raport sisaldab meetmeid, mis aitavad avada uusi turgusid ja teha meie põllumajandustootjate toodangu kasumlikuks. Antud poliitika rahuldab liikmesriikide vajadusi, kes soovivad edendada oma põllumajandustoodangu müüki nii ühenduse tarbijate kui kolmandate riikide seas.', 'Raport annab suurepärase võimaluse rõhutada kvaliteeti, toiteväärtust, tootmismeetodeid ja toodetud toidu ohutust. Toetan raportööri ettepanekut pakkuda huvitatud riikidele võimalust esitada infokavasid kolmandatele riikidele, kui viimastel antud võimalust pole.', 'Kõnealune muudatus lubab Euroopa riikidel laiendada antud kavades ettenähtud meetmete praktilist rakendusala ning taotleda rahvusvahelistelt organisatsioonidelt abi nende rakendamisel. Arvan, et antud programmide kujundamise protsessi jooksul tuleks võtta arvesse olulist rolli, mida etendavad igas riigis liidud ja tööstusorganisatsioonid, kellel on objektiivne pilt sellest, mis igas tööstuses toimub.', 'Peame märkima ära teatavate rahvusvaheliste organite olulisust konkreetsete ELi regioonide jaoks tüüpiliste toidukaupade spetsiifiliste omaduste ja eeliste müügi edendamisel. Toetan raportööri ettepanekut tõsta ühenduse finantsosaluse protsendimäära, nii et saaks pakkuda täiendavat abi liikmesriikides valitud projektidele. Soovitan teil tungivalt härra Dumitriu raportit toetada. ']"
35, 4. Põllumajandussaaduste ja -toodete teavitamis- ja müügiedendusmeetmed (arutelu) ,"  Bogdan Golik,  fraktsiooni PSE nimel. – (PL) Härra juhataja, volinik, õnnitlen siiralt hr Dumitriut hea raporti puhul, mis on jätkuks varem koostatud raportitele, milles rääkisime müügiedendusest ja Euroopa Liidu poolt eraldatud rahasummadest müügiedenduseks kolmandates riikides.Põllumajandussaaduste ja -toodete teavitamis- ja müügiedendusmeetmed siseturul ja kolmandates riikides etendavad tohutut rolli brändi „Valmistatud Euroopas“ positiivse maine loomiseks. Olen seda ammu rõhutanud ning mitu aastat aktiivselt tegutsenud jõupingutustes lihtsustada kogu teavitamise ja müügiedenduse süsteemi. Oma sõnavõttudes olen korduvalt rõhutanud vajadust propageerida kolmandate riikide turgudel brändi „Valmistatud Euroopas“. Eriti õigustatud on see tänastes formaalsetes ja õiguslikes tingimustes.Kooskõlas Hongkongis peetud kuuenda WTO ministrite konverentsi deklaratsiooniga kõrvaldatakse aastal 2013 igasuguste ekspordidotatsioonide ja võrdväärse mõjuga ekspordimeetmete põhimõtete kasutamine. Pidades silmas kolmandate riikide turgudel tehtavate müügiedenduskampaaniate korraldamise keerukat iseloomu ning taoliste meetmete kõrgemaid kulusid märkimisväärsete vahemaade puhul, iseäranis Aasias või Ameerikas, ei tekitanud müügiedendustegevuste tugimehhanism kutseühingutes eriti huvi.Euroopa Komisjoni ettepanek võimaldab nende tegevust stimuleerida. Liikmesriikides teostatavad müügiedenduskavad pakuvad võimalust üksustel koos töötada, kui neil pole õnnestunud korraldada ja rahastada neid tegevusi omal käel. Sellele vaatamata tuleks jätkata jõupingutusi ühenduse protsentuaalse osa suurendamiseks antud liiki projekti rahastamisel. Mainin näitena Ameerika Ühendriike, kus kulutatakse müügiedendustegevustele mitu korda enam kui on kogu raha, mis eraldatakse veini ja muude toodete edendatavatele tegevustele terves Euroopa Liidus.Põllumajandussaduste ja -toodete kaubandusvoo liberaliseerimisele vaatamata võib olla ühenduse toodangu müügiedenduse toetamise vahend kolmandate riikide turgudel ainuke kasutadaolev instrument, mis on kooskõlas WTO Doha arengukava vooru põllumajanduse raamkokkuleppega. Bränd „Valmistatud Euroopas“ on võimalus säilitada konkurentsivõimet ning pikemas perspektiivis isegi tugevdada Euroopa põllumajandus- ja toidukaupade atraktiivsust ning laiendada nende turgu.Sooviksin tänada komisjoni antud meetmete eest, millest oleme parlamendis korduvalt kõnelnud ning mis on kaasa arvatud, ja iseäranis kutseühingute panuse vähendamise eest 20%-lt 10%-le ning müügiedendustegevuseks kasutada olevate vahendite suurendamise eest. ","Bogdan Golik,",6,285,not_available,"['pol', 'pol', 'pol', 'pol', 'pol', 'pol']","['  Bogdan Golik,  fraktsiooni PSE nimel. – (PL) Härra juhataja, volinik, õnnitlen siiralt hr Dumitriut hea raporti puhul, mis on jätkuks varem koostatud raportitele, milles rääkisime müügiedendusest ja Euroopa Liidu poolt eraldatud rahasummadest müügiedenduseks kolmandates riikides.', 'Põllumajandussaaduste ja -toodete teavitamis- ja müügiedendusmeetmed siseturul ja kolmandates riikides etendavad tohutut rolli brändi „Valmistatud Euroopas“ positiivse maine loomiseks. Olen seda ammu rõhutanud ning mitu aastat aktiivselt tegutsenud jõupingutustes lihtsustada kogu teavitamise ja müügiedenduse süsteemi. Oma sõnavõttudes olen korduvalt rõhutanud vajadust propageerida kolmandate riikide turgudel brändi „Valmistatud Euroopas“. Eriti õigustatud on see tänastes formaalsetes ja õiguslikes tingimustes.', 'Kooskõlas Hongkongis peetud kuuenda WTO ministrite konverentsi deklaratsiooniga kõrvaldatakse aastal 2013 igasuguste ekspordidotatsioonide ja võrdväärse mõjuga ekspordimeetmete põhimõtete kasutamine. Pidades silmas kolmandate riikide turgudel tehtavate müügiedenduskampaaniate korraldamise keerukat iseloomu ning taoliste meetmete kõrgemaid kulusid märkimisväärsete vahemaade puhul, iseäranis Aasias või Ameerikas, ei tekitanud müügiedendustegevuste tugimehhanism kutseühingutes eriti huvi.', 'Euroopa Komisjoni ettepanek võimaldab nende tegevust stimuleerida. Liikmesriikides teostatavad müügiedenduskavad pakuvad võimalust üksustel koos töötada, kui neil pole õnnestunud korraldada ja rahastada neid tegevusi omal käel. Sellele vaatamata tuleks jätkata jõupingutusi ühenduse protsentuaalse osa suurendamiseks antud liiki projekti rahastamisel. Mainin näitena Ameerika Ühendriike, kus kulutatakse müügiedendustegevustele mitu korda enam kui on kogu raha, mis eraldatakse veini ja muude toodete edendatavatele tegevustele terves Euroopa Liidus.', 'Põllumajandussaduste ja -toodete kaubandusvoo liberaliseerimisele vaatamata võib olla ühenduse toodangu müügiedenduse toetamise vahend kolmandate riikide turgudel ainuke kasutadaolev instrument, mis on kooskõlas WTO Doha arengukava vooru põllumajanduse raamkokkuleppega. Bränd „Valmistatud Euroopas“ on võimalus säilitada konkurentsivõimet ning pikemas perspektiivis isegi tugevdada Euroopa põllumajandus- ja toidukaupade atraktiivsust ning laiendada nende turgu.', 'Sooviksin tänada komisjoni antud meetmete eest, millest oleme parlamendis korduvalt kõnelnud ning mis on kaasa arvatud, ja iseäranis kutseühingute panuse vähendamise eest 20%-lt 10%-le ning müügiedendustegevuseks kasutada olevate vahendite suurendamise eest. ']"
36, 4. Põllumajandussaaduste ja -toodete teavitamis- ja müügiedendusmeetmed (arutelu) ,"  Seán Ó Neachtain,  fraktsiooni UEN nimel. – (GA) Härra juhataja, tervitan soojalt härra Dumitriu raportit ning sooviksin õnnitleda tehtud töö puhul.Käesolev eelarve annab liikmesriikidele suurepärase võimaluse leida turgusid nii Euroopa sees kui väljaspool. Iirimaalt tulnuna sooviksin öelda, et meie tervislike, värskete toiduainete müümine maailma turgudel, iseäranis Aasias, on meile Iirimaal suureks abiks. Ent nagu mu kolleegidki, sooviksin öelda, et näen siin paremat võimalust käesoleva eelarvega seonduvate eeskirjade lihtsustamiseks, nii et kaubanduse rahavarule ligipääsemine oleks praegusest lihtsam ning muidugi tuleb eelarvet ka suurendada, nagu on öeldud. See on väga oluline, mitte ainult liikmesriikidele, vaid Euroopale tervikuna. ","Seán Ó Neachtain,",2,95,not_available,"['gla', 'gla']","['  Seán Ó Neachtain,  fraktsiooni UEN nimel. – (GA) Härra juhataja, tervitan soojalt härra Dumitriu raportit ning sooviksin õnnitleda tehtud töö puhul.', 'Käesolev eelarve annab liikmesriikidele suurepärase võimaluse leida turgusid nii Euroopa sees kui väljaspool. Iirimaalt tulnuna sooviksin öelda, et meie tervislike, värskete toiduainete müümine maailma turgudel, iseäranis Aasias, on meile Iirimaal suureks abiks. Ent nagu mu kolleegidki, sooviksin öelda, et näen siin paremat võimalust käesoleva eelarvega seonduvate eeskirjade lihtsustamiseks, nii et kaubanduse rahavarule ligipääsemine oleks praegusest lihtsam ning muidugi tuleb eelarvet ka suurendada, nagu on öeldud. See on väga oluline, mitte ainult liikmesriikidele, vaid Euroopale tervikuna. ']"
37, 4. Põllumajandussaaduste ja -toodete teavitamis- ja müügiedendusmeetmed (arutelu) ,"  Friedrich-Wilhelm Graefe zu Baringdorf,  fraktsiooni Verts/ALE nimel. – (DE) Härra juhataja, volinik, nõustun teiega, et reklaam on oluline. Ent reklaam luuakse mitte ainult professionaalsete rünnakute, vaid ka sündmuste tulemusena regioonis, kust toiduained pärit on.Kui maailm seostab meid veiste spongioosse entsefalopaatiaga, kui oleme muutnud oma vapilooma hulluks või kui, nagu praegu, väljastavad riigid toodete tagasikutseid dioksiiniprobleemi tõttu – mis muidugi ka maailmas levib – ning kui teleuudistes ümber maailma näidatakse miljoneid hukatud haigeid kariloomi, kujutab see endast teatavat liiki reklaami: negatiivset reklaami.Peame olema siinkohal ettevaatlikud, et vältida vastuolu. Ühest küljest räägime headest toodetest, kuid teisest küljest on negatiivseid teateid – kuid me teeme selle kallal tööd, nagu oleme äsja arutelust ning meie järeldustest näinud.Kui soovime reklaamida väljaspool – jah, õige, meil on mõjuv põhjus seda teha, kuna meil on head tooted – ei taha ma, et tegemist oleks üldistatud reklaamiga, vaid Euroopa mitmekesisust näitava reklaamiga. Nagu teate, on meil Saksamaal olukord, kus föderaalne konstitutsioonikohus on teinud otsuse teatavat liiki, kohustusliku lõivuga kohustusliku reklaami vastu. Selles juhiti tähelepanu, et reklaam, mis ei erista üksikuid omadusi, ei tõsta müüki ning et selle asemel on oluline, et üksikud tootjad saaksid reklaamida oma konkreetseid tooteid.Lisaks on üha olulisem – mitte ainult Euroopas, vaid väljaspool – kirjeldada mitte ainult lõpptoote kvaliteeti, vaid ka protsessi kvaliteeti. Milline on olukord loomakaitse, keskkonna, koostisainete, põllumajanduse struktuuri, õiglase kaubanduse osas? Need on kõik kriteeriumid, mis ei mõjuta ilmtingimata lõpptoote kvaliteeti, kuid on muutumas üha olulisemaks tarbijaile. Peame selle seetõttu ka oma reklaami lülitama ning mõistma, et Euroopa maine maailmas selle tulemusena paraneb. ","Friedrich-Wilhelm Graefe zu Baringdorf,",5,250,not_available,"['ger', 'ger', 'ger', 'ger', 'ger']","['  Friedrich-Wilhelm Graefe zu Baringdorf,  fraktsiooni Verts/ALE nimel. – (DE) Härra juhataja, volinik, nõustun teiega, et reklaam on oluline. Ent reklaam luuakse mitte ainult professionaalsete rünnakute, vaid ka sündmuste tulemusena regioonis, kust toiduained pärit on.', 'Kui maailm seostab meid veiste spongioosse entsefalopaatiaga, kui oleme muutnud oma vapilooma hulluks või kui, nagu praegu, väljastavad riigid toodete tagasikutseid dioksiiniprobleemi tõttu – mis muidugi ka maailmas levib – ning kui teleuudistes ümber maailma näidatakse miljoneid hukatud haigeid kariloomi, kujutab see endast teatavat liiki reklaami: negatiivset reklaami.', 'Peame olema siinkohal ettevaatlikud, et vältida vastuolu. Ühest küljest räägime headest toodetest, kuid teisest küljest on negatiivseid teateid – kuid me teeme selle kallal tööd, nagu oleme äsja arutelust ning meie järeldustest näinud.', 'Kui soovime reklaamida väljaspool – jah, õige, meil on mõjuv põhjus seda teha, kuna meil on head tooted – ei taha ma, et tegemist oleks üldistatud reklaamiga, vaid Euroopa mitmekesisust näitava reklaamiga. Nagu teate, on meil Saksamaal olukord, kus föderaalne konstitutsioonikohus on teinud otsuse teatavat liiki, kohustusliku lõivuga kohustusliku reklaami vastu. Selles juhiti tähelepanu, et reklaam, mis ei erista üksikuid omadusi, ei tõsta müüki ning et selle asemel on oluline, et üksikud tootjad saaksid reklaamida oma konkreetseid tooteid.', 'Lisaks on üha olulisem – mitte ainult Euroopas, vaid väljaspool – kirjeldada mitte ainult lõpptoote kvaliteeti, vaid ka protsessi kvaliteeti. Milline on olukord loomakaitse, keskkonna, koostisainete, põllumajanduse struktuuri, õiglase kaubanduse osas? Need on kõik kriteeriumid, mis ei mõjuta ilmtingimata lõpptoote kvaliteeti, kuid on muutumas üha olulisemaks tarbijaile. Peame selle seetõttu ka oma reklaami lülitama ning mõistma, et Euroopa maine maailmas selle tulemusena paraneb. ']"
38, 4. Põllumajandussaaduste ja -toodete teavitamis- ja müügiedendusmeetmed (arutelu) ,"  Ilda Figueiredo,  fraktsiooni GUE/NGL nimel. – (PT) Härra juhataja, volinik, daamid ja härrad, meil on tarvis silmas pidada, et oluline on parandada põllumajandussaaduste ja -toodete teavitamis- ja müügiedendusmeetmete tingimusi ja toetust nii Euroopa Liidus kui ka kolmandates riikides, laiendades Euroopa Komisjoni esitatud ettepanekute ulatust.Seetõttu toetame raportööri ning põllumajanduse ja maaelu arengu komisjoni ettepanekuid, nimelt neid, mis on suunatud suuremale sekkumisele ning kutseühingute ja sektoris tegutsevate organisatsioonide rolli tugevdamisele, pidades silmas nende asjatundlikkust ning olulist osa, mida nad etendavad kvaliteedijuhtimise kindlustamisel, sealhulgas kava koostava liikmesriigi liidud ja organisatsioonid, ja lisaks ka ühenduse finantsosaluse protsendi tõstmist. Oluline on, et leidub täiendavat abi, eriti liikmesriikide valitud projektide jaoks.Samamoodi arvame, et teavitamis- ja müügiedendustegevusest kolmandates riikides peaks olema kasu muudele olulistele toodetele peale oliiviõli ja oliivide, rõhuasetusega päritolunimetuste või kaitstud geograafiline tähistega veinidele. Ses suhtes mainin samuti siinkohal põllumajandusettevõtjate liitude olulist rolli, rõhuasetusega veinikeldritele ja teistele väikeste ja keskmise suurusega põllumajandusettevõtjate liitudele, kelle eksistents on fundamentaalse tähtsusega nende põllumajandusettevõtjate taimekasvatussaaduste voo kindlustamisel, kes omal käel ellu jääda ei suudaks.Veel kord kutsuksin üles tõhustama tuge, et antud põllumajandusettevõtjate liidud suudaksid täielikult täita oma rolli perepõllumajanduse toetamisel ning nende toodetava kõrgkvaliteetsete põllumajandussaaduste ja -toodete propageerimisel, mis on olulised meie riikide elanikkonna tervisliku toidusedeli tagamiseks.Seetõttu hääletame käesoleva raporti poolt. ","Ilda Figueiredo,",5,206,not_available,"['por', 'por', 'por', 'por', 'por']","['  Ilda Figueiredo,  fraktsiooni GUE/NGL nimel. – (PT) Härra juhataja, volinik, daamid ja härrad, meil on tarvis silmas pidada, et oluline on parandada põllumajandussaaduste ja -toodete teavitamis- ja müügiedendusmeetmete tingimusi ja toetust nii Euroopa Liidus kui ka kolmandates riikides, laiendades Euroopa Komisjoni esitatud ettepanekute ulatust.', 'Seetõttu toetame raportööri ning põllumajanduse ja maaelu arengu komisjoni ettepanekuid, nimelt neid, mis on suunatud suuremale sekkumisele ning kutseühingute ja sektoris tegutsevate organisatsioonide rolli tugevdamisele, pidades silmas nende asjatundlikkust ning olulist osa, mida nad etendavad kvaliteedijuhtimise kindlustamisel, sealhulgas kava koostava liikmesriigi liidud ja organisatsioonid, ja lisaks ka ühenduse finantsosaluse protsendi tõstmist. Oluline on, et leidub täiendavat abi, eriti liikmesriikide valitud projektide jaoks.', 'Samamoodi arvame, et teavitamis- ja müügiedendustegevusest kolmandates riikides peaks olema kasu muudele olulistele toodetele peale oliiviõli ja oliivide, rõhuasetusega päritolunimetuste või kaitstud geograafiline tähistega veinidele. Ses suhtes mainin samuti siinkohal põllumajandusettevõtjate liitude olulist rolli, rõhuasetusega veinikeldritele ja teistele väikeste ja keskmise suurusega põllumajandusettevõtjate liitudele, kelle eksistents on fundamentaalse tähtsusega nende põllumajandusettevõtjate taimekasvatussaaduste voo kindlustamisel, kes omal käel ellu jääda ei suudaks.', 'Veel kord kutsuksin üles tõhustama tuge, et antud põllumajandusettevõtjate liidud suudaksid täielikult täita oma rolli perepõllumajanduse toetamisel ning nende toodetava kõrgkvaliteetsete põllumajandussaaduste ja -toodete propageerimisel, mis on olulised meie riikide elanikkonna tervisliku toidusedeli tagamiseks.', 'Seetõttu hääletame käesoleva raporti poolt. ']"
39, 4. Põllumajandussaaduste ja -toodete teavitamis- ja müügiedendusmeetmed (arutelu) ,"  Witold Tomczak,  fraktsiooni IND/DEM nimel. – (PL) Härra juhataja, volinik, Euroopa Liit on paljude põllumajandussaaduste ja -toodete oluline eksportija, kuid ELi põllumajanduse tuleviku määrab tarbimine siseturul. Selle stimuleerimine võib tuua kasu põllumajandusettevõtjatele, tarbijatele ja tervetele majandustele.Paljudes liikmesriikides ei ole terviseks oluliste toidukaupade tarbimine kõrge ning selle kasv teavitamise ja müügiedenduse teel on väga soovitav. Ent on oluline, et ELi põllumajandusettevõtjad ning iseäranis väikesed ja keskmise suurusega põllumajandusettevõtted, mis moodustavad 95% kõikidest põllumajandusettevõtetest, saavad kõnealustest kavadest kasu.Antud kavad peaks rikastama tarbijate teadmisi tervislikust toitumisest ning samas jätma valiku neile. Just seepärast tasub ära järgmiste sammude astumine: konsultatsioonide korraldamine tervisliku toitumise valdkonna spetsialistidega ning müüjate koolitamine, kes peaks olema tervisliku toitumise asjus tarbijate nõuandjateks. Edendatavate toodete tervisehüvesid ja toitude tootmist puudutava info hea esitlus on oluline. Toiduetikettidel olev info on ebapiisav.Suurte toiduainekontsernide masstoodetud toidu propageerimine võib kõnealust kava ohustada, kuna nemad suudavad panna kokku tulemuslikke kavasid ja nende käsutuses on parimad spetsialistid. Ent kas see ei kompromiteeri kõrgkvaliteetsete toitude edendamist?Samuti on väga oluline toodetel oleva aegumiskuupäeva loetavus, nagu ka tarbijate teadlikkus tooteetikettidel leitava info tähendusest. ","Witold Tomczak,",5,177,not_available,"['pol', 'pol', 'pol', 'pol', 'pol']","['  Witold Tomczak,  fraktsiooni IND/DEM nimel. – (PL) Härra juhataja, volinik, Euroopa Liit on paljude põllumajandussaaduste ja -toodete oluline eksportija, kuid ELi põllumajanduse tuleviku määrab tarbimine siseturul. Selle stimuleerimine võib tuua kasu põllumajandusettevõtjatele, tarbijatele ja tervetele majandustele.', 'Paljudes liikmesriikides ei ole terviseks oluliste toidukaupade tarbimine kõrge ning selle kasv teavitamise ja müügiedenduse teel on väga soovitav. Ent on oluline, et ELi põllumajandusettevõtjad ning iseäranis väikesed ja keskmise suurusega põllumajandusettevõtted, mis moodustavad 95% kõikidest põllumajandusettevõtetest, saavad kõnealustest kavadest kasu.', 'Antud kavad peaks rikastama tarbijate teadmisi tervislikust toitumisest ning samas jätma valiku neile. Just seepärast tasub ära järgmiste sammude astumine: konsultatsioonide korraldamine tervisliku toitumise valdkonna spetsialistidega ning müüjate koolitamine, kes peaks olema tervisliku toitumise asjus tarbijate nõuandjateks. Edendatavate toodete tervisehüvesid ja toitude tootmist puudutava info hea esitlus on oluline. Toiduetikettidel olev info on ebapiisav.', 'Suurte toiduainekontsernide masstoodetud toidu propageerimine võib kõnealust kava ohustada, kuna nemad suudavad panna kokku tulemuslikke kavasid ja nende käsutuses on parimad spetsialistid. Ent kas see ei kompromiteeri kõrgkvaliteetsete toitude edendamist?', 'Samuti on väga oluline toodetel oleva aegumiskuupäeva loetavus, nagu ka tarbijate teadlikkus tooteetikettidel leitava info tähendusest. ']"
