,agenda_item,text,speaker,number_p,number_w,chair,language_ps,ps
0, 1. Istungi algus,ISTUNGI JUHATAJA: Alejo VIDAL-QUADRAS Asepresident,ISTUNGI JUHATAJA: Alejo VIDAL-QUADRAS,1,6,not_available,['est'],['ISTUNGI JUHATAJA: Alejo VIDAL-QUADRAS Asepresident']
1, 3. Sööda turuleviimine ja kasutamine (arutelu) ,"  Juhataja.   – Päevakorra järgmine punkt on härra Graefe zu Baringdorfi raport (A6-0407/2008) põllumajanduse ja maaelu arengu komisjoni nimel, mis käsitleb ettepanekut võtta vastu Euroopa Parlamendi ja nõukogu määrus sööda turuleviimise ja kasutamise kohta (COM(2008)0124 – C6-0128/2008 – 2008/0050(COD)). ",Juhataja.,1,43,not_available,['est'],"['  Juhataja.   – Päevakorra järgmine punkt on härra Graefe zu Baringdorfi raport (A6-0407/2008) põllumajanduse ja maaelu arengu komisjoni nimel, mis käsitleb ettepanekut võtta vastu Euroopa Parlamendi ja nõukogu määrus sööda turuleviimise ja kasutamise kohta (COM(2008)0124 – C6-0128/2008 – 2008/0050(COD)). ']"
2, 3. Sööda turuleviimine ja kasutamine (arutelu) ,"  Friedrich-Wilhelm Graefe zu Baringdorf,  raportöör. – (DE) Härra juhataja, volinik, arutame täna seda, mida tuntakse „avatud deklaratsioonina“. See puudutab sööda kui tervisliku toidu baasi läbipaistvust tarbijate jaoks ning segajõusööda ostjatele ülevaate andmist selle kohta, mida neile tarnitakse.Tee on olnud pikk, kuid kui võtame antud määruse täna vastu, loodan, et see viib asjad eduka lõpuni, ning sooviksin tänada komisjoni, kes on meid nendes küsimustes suuresti aidanud oma konstruktiivse tööga. Komisjon puutus kokku parlamendipoolse absoluutse poliitilise tahtega suruda antud avatud deklaratsioon läbi ning koges samuti jonnakat, ent õiglast arutelu nõukoguga. Võime tulemuste üle uhkust tunda.Vaadakem lühidalt ajalugu. Meil oli veiste spongioosse entsefalopaatia kriis ning 1997. aastal andis ajutine uurimiskomisjon välja oma lõpliku raporti, milles parlament nõudis avalikku deklaratsiooni. Komisjon esitles ettepanekut, millest hiljem sai direktiiv 2002/2/EÜ. Nõukoguga saavutatud kompromissi kaudu – see läbis kõik organid – surus direktiiv läbi avaliku deklaratsiooni, mis tähendas, et märgistuslehed peavad avaldama söödatoorained hälbega ± 15% ning nõudmisel tuleb esitada täpne koostis.See oli pigem direktiiv kui määrus ning liikmesriigid rakendasid seda ellu ainult väga kõhklevalt, kui üldse. Söödatööstus esitas Euroopa Kohtule hagi ning kohus väljastas järgmise esmaklassilise kinnituse: välja arvatud täpne info, polnud antud direktiiv vaidlustatav. Seejärel võtsime seda kohtuotsust parlamendis täiendaval protseduuril arvesse ja oleme nüüd asjad lõpule viinud käesoleva määruse kujul. Mul oli au iga kord raportööriks olla ning kogu selle pika perioodi jooksul nautisin ma äärmiselt intensiivset usaldusel rajanevat koostööd komisjoniga.Nüüd on meil tulemus, mille nimel on kõvasti, ent õiglaselt võideldud ja mille üle võime tunda uhkust. Samuti on ilmne, et see on pälvinud antud täiskogu ning fraktsioonide enamuse toetuse. Muudatusi pole, millest järeldan, et antud määrus võetakse tõepoolest suure enamusega vastu. Seetõttu on meil hea määrus, mis teeb avatud deklaratsiooni teoks kolmes järgus – te teate, mis need on – esiteks komponendid kahanevas protsentuaalses järjekorras; teiseks info esitamine söödaettevõtetele hälbega ± 15% – selles suhtes pole me antud õigusaktis sätestanud intellektuaalse omandiõiguse reservatsiooni, vaid pigem viidanud üldistele seadustele – ning kolmandaks täpse info esitamine ametivõimudele. Soovin tähelepanu juhtida ka sellele, et me oleme üles seadnud registri. Euroopa Liidus ei söödeta loomi ega lisata söödale komponente ilma neid avalikustamata, kuna need tuleb registrisse kanda. See on oluline mitte ainult järelevalve teostajatele, vaid ka üldsusele ja klientidele. Raportööri seisukohast võin seega öelda, et olen tulemusega tervikuna väga rahul. ","Friedrich-Wilhelm Graefe zu Baringdorf,",6,371,not_available,"['ger', 'ger', 'ger', 'ger', 'ger', 'ger']","['  Friedrich-Wilhelm Graefe zu Baringdorf,  raportöör. – (DE) Härra juhataja, volinik, arutame täna seda, mida tuntakse „avatud deklaratsioonina“. See puudutab sööda kui tervisliku toidu baasi läbipaistvust tarbijate jaoks ning segajõusööda ostjatele ülevaate andmist selle kohta, mida neile tarnitakse.', 'Tee on olnud pikk, kuid kui võtame antud määruse täna vastu, loodan, et see viib asjad eduka lõpuni, ning sooviksin tänada komisjoni, kes on meid nendes küsimustes suuresti aidanud oma konstruktiivse tööga. Komisjon puutus kokku parlamendipoolse absoluutse poliitilise tahtega suruda antud avatud deklaratsioon läbi ning koges samuti jonnakat, ent õiglast arutelu nõukoguga. Võime tulemuste üle uhkust tunda.', 'Vaadakem lühidalt ajalugu. Meil oli veiste spongioosse entsefalopaatia kriis ning 1997. aastal andis ajutine uurimiskomisjon välja oma lõpliku raporti, milles parlament nõudis avalikku deklaratsiooni. Komisjon esitles ettepanekut, millest hiljem sai direktiiv 2002/2/EÜ. Nõukoguga saavutatud kompromissi kaudu – see läbis kõik organid – surus direktiiv läbi avaliku deklaratsiooni, mis tähendas, et märgistuslehed peavad avaldama söödatoorained hälbega ± 15% ning nõudmisel tuleb esitada täpne koostis.', 'See oli pigem direktiiv kui määrus ning liikmesriigid rakendasid seda ellu ainult väga kõhklevalt, kui üldse. Söödatööstus esitas Euroopa Kohtule hagi ning kohus väljastas järgmise esmaklassilise kinnituse: välja arvatud täpne info, polnud antud direktiiv vaidlustatav. Seejärel võtsime seda kohtuotsust parlamendis täiendaval protseduuril arvesse ja oleme nüüd asjad lõpule viinud käesoleva määruse kujul. Mul oli au iga kord raportööriks olla ning kogu selle pika perioodi jooksul nautisin ma äärmiselt intensiivset usaldusel rajanevat koostööd komisjoniga.', 'Nüüd on meil tulemus, mille nimel on kõvasti, ent õiglaselt võideldud ja mille üle võime tunda uhkust. Samuti on ilmne, et see on pälvinud antud täiskogu ning fraktsioonide enamuse toetuse. Muudatusi pole, millest järeldan, et antud määrus võetakse tõepoolest suure enamusega vastu. Seetõttu on meil hea määrus, mis teeb avatud deklaratsiooni teoks kolmes järgus – te teate, mis need on – esiteks komponendid kahanevas protsentuaalses järjekorras; teiseks info esitamine söödaettevõtetele hälbega ± 15% – selles suhtes pole me antud õigusaktis sätestanud intellektuaalse omandiõiguse reservatsiooni, vaid pigem viidanud üldistele seadustele – ning kolmandaks täpse info esitamine ametivõimudele. ', 'Soovin tähelepanu juhtida ka sellele, et me oleme üles seadnud registri. Euroopa Liidus ei söödeta loomi ega lisata söödale komponente ilma neid avalikustamata, kuna need tuleb registrisse kanda. See on oluline mitte ainult järelevalve teostajatele, vaid ka üldsusele ja klientidele. Raportööri seisukohast võin seega öelda, et olen tulemusega tervikuna väga rahul. ']"
3, 3. Sööda turuleviimine ja kasutamine (arutelu) ,"  Androulla Vassiliou,  komisjoni liige. − Härra juhataja, esmalt sooviksin tänada põllumajanduse ja maaelu arengu komisjoni kõnealuse toimikuga tehtud töö eest ning eriti raportööri, härra Graefe zu Baringdorfi ja lisaks ka variraportööre, kes kõik etendasid olulist rolli.Härra Graefe zu Baringdorf on suutnud läbirääkimiste jooksul juhtida arutelusid oskuslikult ning me oleme talle väga tänulikud.Kompromisspakett säilitab ELis saavutatud kõrge söödaohutustaseme. See saavutab õige tasakaalu tarbijakaitse ning intellektuaalse omandiõiguse vahel. See kõrvaldab bioproteiinide puhul turueelse kinnitamise koorma, kaasajastab sööda märgistuslehti tarbijale mõeldud õige info kaudu ning seab kaasreguleerimise seaduslike protseduuride keskmesse. See parandab turu läbipaistvust uute söötamaterjalide teavitussüsteemi kaudu, aitab ELi söödamajanduses kaasa innovatsioonile ning konkurentsivõimelisusele ja tähistab konkreetset sammu söödakasutajate eksitamise vastu, olgu nad põllumajandustootjad või lemmikloomaomanikud.Läbirääkimiste tulemuseks on teile hääletamiseks esitatud kompromisspakett, mis kujutab endast olemasoleva õigusraamistiku lihtsustamist ja kaasajastamist. Niinimetatud „avatud deklaratsiooni“ puudutavad sätted võimaldavad kaasaegsemat tüüpi märgistuslehti. Toiduloomadele segujõusööta lisatud söödamaterjalid tuleb märgistada kaalu järgi kahanevas järjekorras.Sellele lisaks tuleb näidata esiletõstetud söödamaterjalide kaalu täpne protsent ning see puudutab ka vabatahtlikke märgistuslehti.Lisaks saab teatud segujõusööta puudutavat infot siirata pädevatelt ametivõimudelt ostjatele pakilisuse põhjustel, nii parandab säte tarbija jaoks vastava info kättesaadavust taolistel juhtudel, nagu sööda saastumise juhtumid.Antud kontekstis teeb komisjon järgnevad deklaratsioonid. Esiteks näevad komisjon ja selle teenistused ette selleks, et söödamaterjalide ja segajõusööda hälbeid puudutavat Lisa 3 teadusliku ja tehnilise arenguga kohandada, kõnealuse Lisa läbivaatamise. Antud kontekstis vaatab komisjon samuti läbi teatud söödamaterjalid, mille niiskussisaldus on üle 50%.Teiseks uurib komisjon seoses söödalisandite märgistamisega, kas sööda märgistuslehtede kaudu info avaldamise põhimõtted võivad kohalduda loomasöötades kasutatavate söödalisandite määrusest lähtuvalt ka söödalisanditele ja eelsegudele.Lõpuks mõistab komisjon, et igasuguste inimeste ja loomade tervise ning keskkonnaga seonduvate hädaolukordade hulka võivad kuuluda muuseas hooletus, rahvusvaheline pettus või kuriteosündmused. ","Androulla Vassiliou,",9,279,not_available,"['est', 'est', 'est', 'est', 'est', 'est', 'est', 'est', 'est']","['  Androulla Vassiliou,  komisjoni liige. − Härra juhataja, esmalt sooviksin tänada põllumajanduse ja maaelu arengu komisjoni kõnealuse toimikuga tehtud töö eest ning eriti raportööri, härra Graefe zu Baringdorfi ja lisaks ka variraportööre, kes kõik etendasid olulist rolli.', 'Härra Graefe zu Baringdorf on suutnud läbirääkimiste jooksul juhtida arutelusid oskuslikult ning me oleme talle väga tänulikud.', 'Kompromisspakett säilitab ELis saavutatud kõrge söödaohutustaseme. See saavutab õige tasakaalu tarbijakaitse ning intellektuaalse omandiõiguse vahel. See kõrvaldab bioproteiinide puhul turueelse kinnitamise koorma, kaasajastab sööda märgistuslehti tarbijale mõeldud õige info kaudu ning seab kaasreguleerimise seaduslike protseduuride keskmesse. See parandab turu läbipaistvust uute söötamaterjalide teavitussüsteemi kaudu, aitab ELi söödamajanduses kaasa innovatsioonile ning konkurentsivõimelisusele ja tähistab konkreetset sammu söödakasutajate eksitamise vastu, olgu nad põllumajandustootjad või lemmikloomaomanikud.', 'Läbirääkimiste tulemuseks on teile hääletamiseks esitatud kompromisspakett, mis kujutab endast olemasoleva õigusraamistiku lihtsustamist ja kaasajastamist. Niinimetatud „avatud deklaratsiooni“ puudutavad sätted võimaldavad kaasaegsemat tüüpi märgistuslehti. Toiduloomadele segujõusööta lisatud söödamaterjalid tuleb märgistada kaalu järgi kahanevas järjekorras.', 'Sellele lisaks tuleb näidata esiletõstetud söödamaterjalide kaalu täpne protsent ning see puudutab ka vabatahtlikke märgistuslehti.', 'Lisaks saab teatud segujõusööta puudutavat infot siirata pädevatelt ametivõimudelt ostjatele pakilisuse põhjustel, nii parandab säte tarbija jaoks vastava info kättesaadavust taolistel juhtudel, nagu sööda saastumise juhtumid.', 'Antud kontekstis teeb komisjon järgnevad deklaratsioonid. Esiteks näevad komisjon ja selle teenistused ette selleks, et söödamaterjalide ja segajõusööda hälbeid puudutavat Lisa 3 teadusliku ja tehnilise arenguga kohandada, kõnealuse Lisa läbivaatamise. Antud kontekstis vaatab komisjon samuti läbi teatud söödamaterjalid, mille niiskussisaldus on üle 50%.', 'Teiseks uurib komisjon seoses söödalisandite märgistamisega, kas sööda märgistuslehtede kaudu info avaldamise põhimõtted võivad kohalduda loomasöötades kasutatavate söödalisandite määrusest lähtuvalt ka söödalisanditele ja eelsegudele.', 'Lõpuks mõistab komisjon, et igasuguste inimeste ja loomade tervise ning keskkonnaga seonduvate hädaolukordade hulka võivad kuuluda muuseas hooletus, rahvusvaheline pettus või kuriteosündmused. ']"
4, 3. Sööda turuleviimine ja kasutamine (arutelu) ,"  Albert Deß,  fraktsiooni PPE-DE nimel. – (DE) Härra juhataja, volinik, daamid ja härrad, sooviksin avaldada Euroopa Rahvapartei (Kristlike Demokraatide) ja Euroopa Demokraatide fraktsiooni nimel südamlikku tänu raportöörile, härra Graefe zu Baringdorfile. Arvan, et antud raporti suhtes rakendatud lähenemine on käesolevas täiskogus parlamentaarse töö eeskujuks.Tänane hääletus ei kätke muudatusi, kuna selle kallal tehtud töö oli tehniliselt väga tugev ning hõlmas kogu poliitilise spektri. Arvan, et saadud tulemus on selline, mille üle uhkust tunda. See kujutab endast tasakaalustatud tulemust, mis kaitseb nii põllumajandustootjate kui söödakasutajate, söödavalmistajate ning toiduahela kõikide muude lülide huve.See parandab läbipaistust ning minu fraktsioon hindab iseäranis kõrgelt, et seati üles register, kuhu tuleb kanda sööta segatavad toorained. Toiduskandaale esineb üha jälle ning isegi uus seadus ei hoia seda ära, kuna Euroopa eeskirjad pole mõeldud kuritegevuse ennetamiseks; ent need eeskirjad aitavad tagada, et siis, kui need skandaalid tõesti tekivad, on kergem avastada, mis ained on sööta sisse segatud.Samuti kiidan heaks, et söödavalmistajad võivad esitada täiendavat infot vabatahtlikul alusel, ning pean suurepäraseks ettepanekuks seda, et kui nad taolist infot esitavad, peab see olema teaduslikult tõestatud. Minu arvamus on, et antud uus söödaseadus parandab märkimisväärselt kaitset ning et kahanev järjekord võimaldab põllumajandustootjatel näha iga söödakomponendi proportsioone ning otsustada, mis on nende loomade jaoks parim sööt, ja valida vastavalt.Kordan oma tänusõnu kõigile neile, kes aitasid kaasa, et teha sellest niivõrd hea raport. ","Albert Deß,",5,223,not_available,"['ger', 'ger', 'ger', 'ger', 'ger']","['  Albert Deß,  fraktsiooni PPE-DE nimel. – (DE) Härra juhataja, volinik, daamid ja härrad, sooviksin avaldada Euroopa Rahvapartei (Kristlike Demokraatide) ja Euroopa Demokraatide fraktsiooni nimel südamlikku tänu raportöörile, härra Graefe zu Baringdorfile. Arvan, et antud raporti suhtes rakendatud lähenemine on käesolevas täiskogus parlamentaarse töö eeskujuks.', 'Tänane hääletus ei kätke muudatusi, kuna selle kallal tehtud töö oli tehniliselt väga tugev ning hõlmas kogu poliitilise spektri. Arvan, et saadud tulemus on selline, mille üle uhkust tunda. See kujutab endast tasakaalustatud tulemust, mis kaitseb nii põllumajandustootjate kui söödakasutajate, söödavalmistajate ning toiduahela kõikide muude lülide huve.', 'See parandab läbipaistust ning minu fraktsioon hindab iseäranis kõrgelt, et seati üles register, kuhu tuleb kanda sööta segatavad toorained. Toiduskandaale esineb üha jälle ning isegi uus seadus ei hoia seda ära, kuna Euroopa eeskirjad pole mõeldud kuritegevuse ennetamiseks; ent need eeskirjad aitavad tagada, et siis, kui need skandaalid tõesti tekivad, on kergem avastada, mis ained on sööta sisse segatud.', 'Samuti kiidan heaks, et söödavalmistajad võivad esitada täiendavat infot vabatahtlikul alusel, ning pean suurepäraseks ettepanekuks seda, et kui nad taolist infot esitavad, peab see olema teaduslikult tõestatud. Minu arvamus on, et antud uus söödaseadus parandab märkimisväärselt kaitset ning et kahanev järjekord võimaldab põllumajandustootjatel näha iga söödakomponendi proportsioone ning otsustada, mis on nende loomade jaoks parim sööt, ja valida vastavalt.', 'Kordan oma tänusõnu kõigile neile, kes aitasid kaasa, et teha sellest niivõrd hea raport. ']"
5, 3. Sööda turuleviimine ja kasutamine (arutelu) ,"  Rosa Miguélez Ramos,  fraktsiooni PSE nimel. – (ES) Härra juhataja, volinik, nagu olen juba teinud põllumajanduse ja maaelu arengu komisjonis, sooviksin esiteks soovida raportöörile, variraportööridele teistest fraktsioonidest ja samuti komisjonile teostatud töö puhul õnne.Kõnealune töö on lubanud meil jõuda kokkuleppele esimesel lugemisel ja on olnud lisaks suurepäraseks sissetöötamisprotsessiks kaasotsustamise protseduurile, millest saab meie parlamendikomisjonis lähitulevikus üldine tava.Daamid ja härrad, hetkel reguleerib loomade, sealhulgas lemmikloomade sööta ja segujõusööta – ühenduse tasandil 50 miljardi euro suurust kaubandust kujutavat valdkonda – puudutavaid seaduseid mitu direktiivi ning oma 50 muudatust ja rakendusakti.Seadusandluse lihtsustamine ja selle harmoniseeritud kohaldamine on põhieesmärkideks, mille antud määrus kahtlemata saavutab.Parlamendi põllumajanduse ja maaelu arengu komisjon on juba 2006. aastal arutanud loomasööda turuleviimist. Meile kõigile meenub, et palusime ühehäälselt Euroopa Komisjonil edaspidi üritada leida õiglane tasakaal põllumajandustootjate huvide, mis puudutavad söödakomponentide kohta üksikasjaliku info saamist, ning tööstusepoolsete huvide, mis puudutavad oskusteabe küllaldast kaitset, vahel.Komisjoni ettepaneku peamiste tundlike punktide – toorainete lahtise deklaratsiooni ja ühenduse toorainete loendi loomise – osas saavutatud kompromiss kajastab minu arvates antud tasakaalu hästi. Selle tõenduseks on, kuivõrd hästi kompromiss kõigi kaasatute poolt vastu on võetud.Tegelikult kaitseb kompromiss lahtise deklaratsiooni abil ostjate õigusi teavitamisele ning valmistajate õigusi oskusteabe endale hoidmisele, osutades, et infot tuleks esitada, piiramata 2004. aasta intellektuaalse omandiõiguse direktiivi.Pole kahtlustki, daamid ja härrad, et tarnija ja kasutaja vahelises usaldussuhtes peakids olema valemid teada, kuid poleks loogiline kohustada retsepti andmist esimesele sisseastuvale kliendile. Paljud meist on olnud aastaid Coca-Cola tarbijad. Kuigi me selle retsepti ei tea, ei tähenda see, et me kahtleks, kas toote omadustest kinni peetakse ning tervishoiustandardeid järgitakse.Euroopa Kohtu eelnevalt mainitud otsus sätestab rangelt, et tervise kaitsmise eesmärk ei õigusta kohustust teavitada kliente nendepoolsel nõudmisel sööda täpsest koostisest.Ometigi pean teile meenutama, et pädeval ametivõimul on ligipääs täpsele koostisele igal ajal ning vastavalt saavutatud kompromissi sätetele tähendab mis tahes inimeste või loomade tervise või keskkonnaga seonduv hädaolukord, et ostjatel on ligipääs asjassepuutuva sööda koostise täpsele infole, kui on võetud arvesse nii valmistajate kui ostjate õigustatud huvid.Hea märgistuslehtede tava loend jääb antud valdkonnas tegutsejatele vabatahtlikuks, ilma et muutuks millalgi segajõusöötade tootmise toorainete positiivseks loendiks, kuna see kujutab endast midagi, mida nõutud pole.Seadustesse kuulub Euroopa Parlamendi nõudel uus lisa, mis sisaldab loendit loomasööda toorainetest, mille turuleviimine või kasutamine on keelatud või piiratud. Tegemist on infoga, olgu see lisa või loend, mida komisjon võib uuendada.Euroopa Parlamendi sotsialistide fraktsioon, keda esindan, toetab saavutatud kompromissi, ega pole esitanud täiskogu istungi päevakorda muudatusi. Oleme täielikult täna käesolevas täiskogus esitatud seisukoha poolt ning sellisena hääletame selle poolt. ","Rosa Miguélez Ramos,",13,412,not_available,"['spa', 'spa', 'spa', 'spa', 'spa', 'spa', 'spa', 'spa', 'spa', 'spa', 'spa', 'spa', 'spa']","['  Rosa Miguélez Ramos,  fraktsiooni PSE nimel. – (ES) Härra juhataja, volinik, nagu olen juba teinud põllumajanduse ja maaelu arengu komisjonis, sooviksin esiteks soovida raportöörile, variraportööridele teistest fraktsioonidest ja samuti komisjonile teostatud töö puhul õnne.', 'Kõnealune töö on lubanud meil jõuda kokkuleppele esimesel lugemisel ja on olnud lisaks suurepäraseks sissetöötamisprotsessiks kaasotsustamise protseduurile, millest saab meie parlamendikomisjonis lähitulevikus üldine tava.', 'Daamid ja härrad, hetkel reguleerib loomade, sealhulgas lemmikloomade sööta ja segujõusööta – ühenduse tasandil 50 miljardi euro suurust kaubandust kujutavat valdkonda – puudutavaid seaduseid mitu direktiivi ning oma 50 muudatust ja rakendusakti.', 'Seadusandluse lihtsustamine ja selle harmoniseeritud kohaldamine on põhieesmärkideks, mille antud määrus kahtlemata saavutab.', 'Parlamendi põllumajanduse ja maaelu arengu komisjon on juba 2006. aastal arutanud loomasööda turuleviimist. Meile kõigile meenub, et palusime ühehäälselt Euroopa Komisjonil edaspidi üritada leida õiglane tasakaal põllumajandustootjate huvide, mis puudutavad söödakomponentide kohta üksikasjaliku info saamist, ning tööstusepoolsete huvide, mis puudutavad oskusteabe küllaldast kaitset, vahel.', 'Komisjoni ettepaneku peamiste tundlike punktide – toorainete lahtise deklaratsiooni ja ühenduse toorainete loendi loomise – osas saavutatud kompromiss kajastab minu arvates antud tasakaalu hästi. Selle tõenduseks on, kuivõrd hästi kompromiss kõigi kaasatute poolt vastu on võetud.', 'Tegelikult kaitseb kompromiss lahtise deklaratsiooni abil ostjate õigusi teavitamisele ning valmistajate õigusi oskusteabe endale hoidmisele, osutades, et infot tuleks esitada, piiramata 2004. aasta intellektuaalse omandiõiguse direktiivi.', 'Pole kahtlustki, daamid ja härrad, et tarnija ja kasutaja vahelises usaldussuhtes peakids olema valemid teada, kuid poleks loogiline kohustada retsepti andmist esimesele sisseastuvale kliendile. Paljud meist on olnud aastaid Coca-Cola tarbijad. Kuigi me selle retsepti ei tea, ei tähenda see, et me kahtleks, kas toote omadustest kinni peetakse ning tervishoiustandardeid järgitakse.', 'Euroopa Kohtu eelnevalt mainitud otsus sätestab rangelt, et tervise kaitsmise eesmärk ei õigusta kohustust teavitada kliente nendepoolsel nõudmisel sööda täpsest koostisest.', 'Ometigi pean teile meenutama, et pädeval ametivõimul on ligipääs täpsele koostisele igal ajal ning vastavalt saavutatud kompromissi sätetele tähendab mis tahes inimeste või loomade tervise või keskkonnaga seonduv hädaolukord, et ostjatel on ligipääs asjassepuutuva sööda koostise täpsele infole, kui on võetud arvesse nii valmistajate kui ostjate õigustatud huvid.', 'Hea märgistuslehtede tava loend jääb antud valdkonnas tegutsejatele vabatahtlikuks, ilma et muutuks millalgi segajõusöötade tootmise toorainete positiivseks loendiks, kuna see kujutab endast midagi, mida nõutud pole.', 'Seadustesse kuulub Euroopa Parlamendi nõudel uus lisa, mis sisaldab loendit loomasööda toorainetest, mille turuleviimine või kasutamine on keelatud või piiratud. Tegemist on infoga, olgu see lisa või loend, mida komisjon võib uuendada.', 'Euroopa Parlamendi sotsialistide fraktsioon, keda esindan, toetab saavutatud kompromissi, ega pole esitanud täiskogu istungi päevakorda muudatusi. Oleme täielikult täna käesolevas täiskogus esitatud seisukoha poolt ning sellisena hääletame selle poolt. ']"
