,agenda_item,text,speaker,number_p,number_w,chair,language_ps,ps
94, 6. Hääletuse kohta selgituste andmine,"  Nils Lundgren  (IND/DEM),  kirjalikult. − (SV) Antud raport sisaldab mitut punkti, mida toetan täielikult, nagu näiteks tõsiasi, et varjupaigataotlejaid tuleks kohelda väärikalt ning et alati tuleks tagada inimõigused. Mitmele vastuvõtukeskusele suunatud kriitika on õigustatud. Paljud Euroopa riigid ei täida varjupaigataotlejate ja põgenike väärika vastuvõtu nõuet.Ent raport sisaldab punkte, mida ma toetada ei saa. Raporti sisuliseks eesmärgiks on, et ELil peaks olema ühine sisserände- ja varjupaigapoliitika. Muuhulgas kutsub see teisi liikmesriike üles toetama neid ELi riike, keda „sisserände väljakutsed puudutavad enim“. June List arvab, et varjupaiga- ja sisserändepoliitika on liikmesriikide asi tingimusel, et austatakse rahvusvahelisi konventsioone ja leppeid. Ühine sisserände- ja varjupaigapoliitika ähvardaks viia „Euroopa kindluse“ tekkeni, mille selgeid märke näeme juba täna. ","Nils Lundgren  (IND/DEM),",2,113,not_available,"['est', 'est']","['  Nils Lundgren  (IND/DEM),  kirjalikult. − (SV) Antud raport sisaldab mitut punkti, mida toetan täielikult, nagu näiteks tõsiasi, et varjupaigataotlejaid tuleks kohelda väärikalt ning et alati tuleks tagada inimõigused. Mitmele vastuvõtukeskusele suunatud kriitika on õigustatud. Paljud Euroopa riigid ei täida varjupaigataotlejate ja põgenike väärika vastuvõtu nõuet.', 'Ent raport sisaldab punkte, mida ma toetada ei saa. Raporti sisuliseks eesmärgiks on, et ELil peaks olema ühine sisserände- ja varjupaigapoliitika. Muuhulgas kutsub see teisi liikmesriike üles toetama neid ELi riike, keda „sisserände väljakutsed puudutavad enim“. June List arvab, et varjupaiga- ja sisserändepoliitika on liikmesriikide asi tingimusel, et austatakse rahvusvahelisi konventsioone ja leppeid. Ühine sisserände- ja varjupaigapoliitika ähvardaks viia „Euroopa kindluse“ tekkeni, mille selgeid märke näeme juba täna. ']"
95, 6. Hääletuse kohta selgituste andmine,"  Mairead McGuinness  (PPE-DE),  kirjalikult. − Jäin antud raporti hääletusel erapooletuks, kuna Iirimaa ei osalenud 2003. aasta direktiivi vastuvõtmises.Taolise seisukoha peamine põhjus puudutab varjupaigataotlejate ligipääsu tööturule.Varjupaigataotlejate tööturule sisenemise keelu taaskehtestab hetkel Dáili käes olev eelnõu. ","Mairead McGuinness  (PPE-DE),",3,36,not_available,"['est', 'est', 'est']","['  Mairead McGuinness  (PPE-DE),  kirjalikult. − Jäin antud raporti hääletusel erapooletuks, kuna Iirimaa ei osalenud 2003. aasta direktiivi vastuvõtmises.', 'Taolise seisukoha peamine põhjus puudutab varjupaigataotlejate ligipääsu tööturule.', 'Varjupaigataotlejate tööturule sisenemise keelu taaskehtestab hetkel Dáili käes olev eelnõu. ']"
96, 6. Hääletuse kohta selgituste andmine,"  Athanasios Pafilis  (GUE/NGL),  kirjalikult. – (EL) Raport ei kajasta põgenike ja sisserändajate kogetavate armetute tingimuste tegelikku ulatust ELi liikmesriikide kinnipidamiskeskustes. Ta piirdub traagiliste tingimuste märkimisega, milles nad ellu jäävad, kuid omistab need ELi direktiivide viletsale kohaldamisele.Seega ühest küljest toetab ta ELi ja valitsuste üldiseid sisserändevastaseid seadusi ja poliitikaid, nagu sätestatud rändepaktis ning Dublini varjupaigasüsteemis, ning teisest küljest protestib selle ebainimlike tagajärgede vastu. On solvav Euroopa „ühesuunalise tänava“ poliitiliste võimude poolt, kes hääletasid Euroopa Parlamendis direktiivide poolt, mis peale kõige muu sätestavad „illegaalsete“ sisserändajate kinnipidamise tervelt 18 kuuks, väljendada antud raportis oma eeldatavat kahetsust nende ebainimlike kinnipidamistingimuste üle ning kutsuda üles, et neist kinni ei peetaks.Euroopa Parlamendi „krokodillipisarad“ ei saa vabastada ELi ebainimliku, ekspluateeriva poliitika süüst. Isegi kõige fundamentaalsemaid meetmeid, rääkimata sisserändajate ja põgenike korraliku toetamise meetmetest ja nende õiguste kaitse meetmetest, saab rakendada ellu ainult ELi poliitika ja ELi struktuuri enese vastandamise ja ümberpööramisega. ","Athanasios Pafilis  (GUE/NGL),",3,146,not_available,"['gre', 'gre', 'gre']","['  Athanasios Pafilis  (GUE/NGL),  kirjalikult. – (EL) Raport ei kajasta põgenike ja sisserändajate kogetavate armetute tingimuste tegelikku ulatust ELi liikmesriikide kinnipidamiskeskustes. Ta piirdub traagiliste tingimuste märkimisega, milles nad ellu jäävad, kuid omistab need ELi direktiivide viletsale kohaldamisele.', 'Seega ühest küljest toetab ta ELi ja valitsuste üldiseid sisserändevastaseid seadusi ja poliitikaid, nagu sätestatud rändepaktis ning Dublini varjupaigasüsteemis, ning teisest küljest protestib selle ebainimlike tagajärgede vastu. On solvav Euroopa „ühesuunalise tänava“ poliitiliste võimude poolt, kes hääletasid Euroopa Parlamendis direktiivide poolt, mis peale kõige muu sätestavad „illegaalsete“ sisserändajate kinnipidamise tervelt 18 kuuks, väljendada antud raportis oma eeldatavat kahetsust nende ebainimlike kinnipidamistingimuste üle ning kutsuda üles, et neist kinni ei peetaks.', 'Euroopa Parlamendi „krokodillipisarad“ ei saa vabastada ELi ebainimliku, ekspluateeriva poliitika süüst. Isegi kõige fundamentaalsemaid meetmeid, rääkimata sisserändajate ja põgenike korraliku toetamise meetmetest ja nende õiguste kaitse meetmetest, saab rakendada ellu ainult ELi poliitika ja ELi struktuuri enese vastandamise ja ümberpööramisega. ']"
97, 6. Hääletuse kohta selgituste andmine,"  Dimitrios Papadimoulis  (GUE/NGL),  kirjalikult. – (EL) Liikmesriigid, sealhulgas Kreeka, peavad tegema enam, kasutades ära Euroopa Parlamendi nõudmisi ja ettepanekuid. Euroopa Parlament süüdistab riikide suhtumist vaestesse sisserändajatesse, kes iga päev oma eluga riskides ELi väravaist sisse käivad.Riigid, nagu Kreeka, kes on ELi välispiiridel, peaks kaotama ära Eli poolt pakutava potentsiaalse abi ning üritama põgenike ja varjupaigataotlejate õiguste austamise alusel tagada neile inimlikud vastuvõtutingimused.Isegi vastuvõetamatuid „allahindlusi“ arvestades, mida komisjon ja nõukogu on „Euroopa kindlusele“ viivat rada jätkates hiljuti sisserändajate õiguste osas kinkinud, on Kreeka tublisti allpool ühenduse nõudmisi põhiõiguste kaitsele. ","Dimitrios Papadimoulis  (GUE/NGL),",3,90,not_available,"['gre', 'gre', 'gre']","['  Dimitrios Papadimoulis  (GUE/NGL),  kirjalikult. – (EL) Liikmesriigid, sealhulgas Kreeka, peavad tegema enam, kasutades ära Euroopa Parlamendi nõudmisi ja ettepanekuid. Euroopa Parlament süüdistab riikide suhtumist vaestesse sisserändajatesse, kes iga päev oma eluga riskides ELi väravaist sisse käivad.', 'Riigid, nagu Kreeka, kes on ELi välispiiridel, peaks kaotama ära Eli poolt pakutava potentsiaalse abi ning üritama põgenike ja varjupaigataotlejate õiguste austamise alusel tagada neile inimlikud vastuvõtutingimused.', 'Isegi vastuvõetamatuid „allahindlusi“ arvestades, mida komisjon ja nõukogu on „Euroopa kindlusele“ viivat rada jätkates hiljuti sisserändajate õiguste osas kinkinud, on Kreeka tublisti allpool ühenduse nõudmisi põhiõiguste kaitsele. ']"
98, 6. Hääletuse kohta selgituste andmine,"  Luís Queiró  (PPE-DE),  kirjalikult. – (PT) Varjupaiga andmine on riigi ja terve kogukonna viimane žest, millega võetakse omaks suutmatus kaitsta inimõigusi globaalselt, ning siiski tahe selle väärtusskaala alusel toimida.Seda reguleeriv süsteem peab seetõttu olema sissrändest selgelt eraldi. Mida enam üritame mõistet laiendada, lülitades sisse asjakohatut, seda vähem väärtust tal on ning segadus saab õigustatud varjupaigataotlejaid ainult kahjustada. Seetõttu on oluline, et reeglid oleks selged, protseduurid kiired ja kohtlemine väärikas kõikides oludes. Isegi kui on vaja meetmeid ja variante koordineerida, ei tekita varjupaik arvude, suuruse ja mõiste poolest samu probleeme nagu sisseränne, isegi mitte piirideta piirkonnas. Liikmesriikidel on oma traditsioonid varjupaiga suhtes ning seda erinevust ei tohiks kahe silma vahele jätta eelmainitud koordineerimise raames.Mis puudutab varjupaigataotlejatesse, kelle taotlus on lükatud võib tuleks lükata tagasi, siis antud mõiste, mis on suuremeelse, kuid kitsa varjupaiga arusaama tagajärg, ei saa põhjustada vähem inimlikkust inimeste vastuvõtus ja kohtlemises, kes on alati kaitsetud oma seisundi tõttu. ","Luís Queiró  (PPE-DE),",3,152,not_available,"['por', 'por', 'por']","['  Luís Queiró  (PPE-DE),  kirjalikult. – (PT) Varjupaiga andmine on riigi ja terve kogukonna viimane žest, millega võetakse omaks suutmatus kaitsta inimõigusi globaalselt, ning siiski tahe selle väärtusskaala alusel toimida.', 'Seda reguleeriv süsteem peab seetõttu olema sissrändest selgelt eraldi. Mida enam üritame mõistet laiendada, lülitades sisse asjakohatut, seda vähem väärtust tal on ning segadus saab õigustatud varjupaigataotlejaid ainult kahjustada. Seetõttu on oluline, et reeglid oleks selged, protseduurid kiired ja kohtlemine väärikas kõikides oludes. Isegi kui on vaja meetmeid ja variante koordineerida, ei tekita varjupaik arvude, suuruse ja mõiste poolest samu probleeme nagu sisseränne, isegi mitte piirideta piirkonnas. Liikmesriikidel on oma traditsioonid varjupaiga suhtes ning seda erinevust ei tohiks kahe silma vahele jätta eelmainitud koordineerimise raames.', 'Mis puudutab varjupaigataotlejatesse, kelle taotlus on lükatud võib tuleks lükata tagasi, siis antud mõiste, mis on suuremeelse, kuid kitsa varjupaiga arusaama tagajärg, ei saa põhjustada vähem inimlikkust inimeste vastuvõtus ja kohtlemises, kes on alati kaitsetud oma seisundi tõttu. ']"
99, 6. Hääletuse kohta selgituste andmine,"  Luca Romagnoli  (NI),  kirjalikult. – (IT) Hääletasin proua Roure’i raporti vastu, mis käsitleb Euroopa Liidus varjupaigataotlejate ja põgenike vastuvõtu miinimumnõudmisi sätestava direktiivi 2003/9/EÜ rakendamist. Tõepoolest, kuigi taunin tõsiasja, et osad külaskäigud on näidanud, et olemasolevaid direktiive rakendati viletsalt või jäeti kohaldamata teatud liikmesriikides, ei ole nõus raportööri väitega, et vastuvõtutingimuste taseme osas on hulk puudusi.Lisaks pole ma nõus, et teatud liikmesriikides rajatud avatud majutuskeskused on madala mahutavusega ega näi rahuldavat siserändajate vajadusi. Viimasena ei ole ma nõus üleskutsega, et prioriteediks seataks varjupaigataotlejate vastuvõtt avatud vastuvõtukeskustes, mitte aga suletud üksustes. ","Luca Romagnoli  (NI),",2,92,not_available,"['ita', 'ita']","['  Luca Romagnoli  (NI),  kirjalikult. – (IT) Hääletasin proua Roure’i raporti vastu, mis käsitleb Euroopa Liidus varjupaigataotlejate ja põgenike vastuvõtu miinimumnõudmisi sätestava direktiivi 2003/9/EÜ rakendamist. Tõepoolest, kuigi taunin tõsiasja, et osad külaskäigud on näidanud, et olemasolevaid direktiive rakendati viletsalt või jäeti kohaldamata teatud liikmesriikides, ei ole nõus raportööri väitega, et vastuvõtutingimuste taseme osas on hulk puudusi.', 'Lisaks pole ma nõus, et teatud liikmesriikides rajatud avatud majutuskeskused on madala mahutavusega ega näi rahuldavat siserändajate vajadusi. Viimasena ei ole ma nõus üleskutsega, et prioriteediks seataks varjupaigataotlejate vastuvõtt avatud vastuvõtukeskustes, mitte aga suletud üksustes. ']"
100, 6. Hääletuse kohta selgituste andmine,"  Michel Teychenné  (PSE),  kirjalikult. – (FR) Tänu antud raportile kinnitab Euroopa Parlament taas oma pühendumust põhiõigustele, nagu näiteks õigus väärikusele. On vastuvõetamatu, et Euroopa Liidus eneses ei ole sisserändajate ja varjupaigataotlejate vastuvõtutingimused eeskujulikud.Euroopa Parlamendi liikmete külaskäigud kinnipidamiskeskustesse 2005 – 2008 on võimaldanud kõnealuse raporti koostamise proua Roure’i juhtimisel. Raport paljastab Euroopa sisserändajate kinnipidamissüsteemi eiramiste ulatust, näidates sõrmega probleemidele, mis puudutavat õigusnõu, arstiabi, hügieeni, juhuslikke vahekordi ja infot.Seetõttu on tegemist häirekellaga, mida Euroopa Parlament täna lööb. Liikmesriigid peavad seda tähele panema ning võimalusel kohaldama olemasolevaid „vastuvõtu“ ja „korra“ direktiive nii pea kui võimalik või tegema edusamme nende rakendamisel. ","Michel Teychenné  (PSE),",3,98,not_available,"['fra', 'fra', 'fra']","['  Michel Teychenné  (PSE),  kirjalikult. – (FR) Tänu antud raportile kinnitab Euroopa Parlament taas oma pühendumust põhiõigustele, nagu näiteks õigus väärikusele. On vastuvõetamatu, et Euroopa Liidus eneses ei ole sisserändajate ja varjupaigataotlejate vastuvõtutingimused eeskujulikud.', 'Euroopa Parlamendi liikmete külaskäigud kinnipidamiskeskustesse 2005 – 2008 on võimaldanud kõnealuse raporti koostamise proua Roure’i juhtimisel. Raport paljastab Euroopa sisserändajate kinnipidamissüsteemi eiramiste ulatust, näidates sõrmega probleemidele, mis puudutavat õigusnõu, arstiabi, hügieeni, juhuslikke vahekordi ja infot.', 'Seetõttu on tegemist häirekellaga, mida Euroopa Parlament täna lööb. Liikmesriigid peavad seda tähele panema ning võimalusel kohaldama olemasolevaid „vastuvõtu“ ja „korra“ direktiive nii pea kui võimalik või tegema edusamme nende rakendamisel. ']"
101, 6. Hääletuse kohta selgituste andmine,"  Glyn Ford  (PSE),  kirjalikult. − Euroopa Parlamendi tööpartei fraktsioon jäi antud raporti suhtes erapooletuks, mitte sellepärast, et oleme Euroopa VKEde rolli tõhustamise vastu rahvusvahelises kaubanduses, vaid sellepärast, et proua Muscardini on valmistanud Trooja hobuse, mis sisaldab eneses vastuvõetamatuid seisukohti kaubanduskaitsemeetmete osas.Oleme pettunud, et komisjon on pannud läbivaatamise kõrvale, kuna on tekkinud raskused konsensuse saavutamisega jätkamise osas. Meie seisukoht on jätkuvalt, et on kiiresti vaja muuta ühenduse kaubanduskaitserežiimi, nii et see arvestaks paremini globaalse majanduse arengutega. Reformi puudumine tähendab, et meie tööstus pole valmis, et ära kasutada globaliseerumise hüvesid. Kuigi tervitame eesistujariigi Tšehhi poolset kaubanduskaitsemeetmete lülitamist töökavasse, ei ole see piisav. ","Glyn Ford  (PSE),",2,100,not_available,"['est', 'est']","['  Glyn Ford  (PSE),  kirjalikult. − Euroopa Parlamendi tööpartei fraktsioon jäi antud raporti suhtes erapooletuks, mitte sellepärast, et oleme Euroopa VKEde rolli tõhustamise vastu rahvusvahelises kaubanduses, vaid sellepärast, et proua Muscardini on valmistanud Trooja hobuse, mis sisaldab eneses vastuvõetamatuid seisukohti kaubanduskaitsemeetmete osas.', 'Oleme pettunud, et komisjon on pannud läbivaatamise kõrvale, kuna on tekkinud raskused konsensuse saavutamisega jätkamise osas. Meie seisukoht on jätkuvalt, et on kiiresti vaja muuta ühenduse kaubanduskaitserežiimi, nii et see arvestaks paremini globaalse majanduse arengutega. Reformi puudumine tähendab, et meie tööstus pole valmis, et ära kasutada globaliseerumise hüvesid. Kuigi tervitame eesistujariigi Tšehhi poolset kaubanduskaitsemeetmete lülitamist töökavasse, ei ole see piisav. ']"
102, 6. Hääletuse kohta selgituste andmine,"  Bruno Gollnisch  (NI),  kirjalikult. – (FR) Hääletasime proua Muscardini VKEde rolli suurendamise raporti poolt. Tegemist on Euroopa Liidu kaubanduspoliitika karmi kriitikaga, kuigi see on sõnastatud leebes ja tehnokraatlikus keeles, mis on käesolevale täiskogule südamelähedane.Kaetud on kõik: suurte ettevõtete vajadustele keskendatud poliitikad; välisturgudele ligipääsu soodustamise meetmete ja kolmandate riikide poolse vastastikuse kohaldamise tagamise nõrkus; raskused väikeettevõtete kaubanduskaitsemeetmete hindamisel; geograafiliste päritolutähiste võltsimise ja ebaseadusliku või petturliku kasutamise vastaste meetmete ekslikkus ja nii edasi.Tõepoolest on Euroopa Liidul aeg lakata ohverdamast oma ettevõtteid ja töötajaid konkurentsivõimelisuse ja vaba kaubanduse altaril, mis on maailmas viljelemiseks ainuke. On aeg toetada VKEsid ekspordiäris, tõesti kaitsta neid ebaausa konkurentsi vastu ning teha seda, mis on õigustatud, meie turgude kaitseks.Tõsiasi on, et jäädes ettevõtete globaliseerumisele kui eesmärgile omaette pühendunuks, jätkab raportöör süsteemi propageerimist, mis rajaneb kaupade, teenuste, kapitali ja tööjõu liikumise absoluutsel vabadusel – süsteem, mis on viinud meid sügavasse majanduslikku, finants- ja sotsiaalsesse kriisi, süsteem, millega Euroopa Liit peab täielikult lõpparve tegema. ","Bruno Gollnisch  (NI),",4,155,not_available,"['fra', 'fra', 'fra', 'fra']","['  Bruno Gollnisch  (NI),  kirjalikult. – (FR) Hääletasime proua Muscardini VKEde rolli suurendamise raporti poolt. Tegemist on Euroopa Liidu kaubanduspoliitika karmi kriitikaga, kuigi see on sõnastatud leebes ja tehnokraatlikus keeles, mis on käesolevale täiskogule südamelähedane.', 'Kaetud on kõik: suurte ettevõtete vajadustele keskendatud poliitikad; välisturgudele ligipääsu soodustamise meetmete ja kolmandate riikide poolse vastastikuse kohaldamise tagamise nõrkus; raskused väikeettevõtete kaubanduskaitsemeetmete hindamisel; geograafiliste päritolutähiste võltsimise ja ebaseadusliku või petturliku kasutamise vastaste meetmete ekslikkus ja nii edasi.', 'Tõepoolest on Euroopa Liidul aeg lakata ohverdamast oma ettevõtteid ja töötajaid konkurentsivõimelisuse ja vaba kaubanduse altaril, mis on maailmas viljelemiseks ainuke. On aeg toetada VKEsid ekspordiäris, tõesti kaitsta neid ebaausa konkurentsi vastu ning teha seda, mis on õigustatud, meie turgude kaitseks.', 'Tõsiasi on, et jäädes ettevõtete globaliseerumisele kui eesmärgile omaette pühendunuks, jätkab raportöör süsteemi propageerimist, mis rajaneb kaupade, teenuste, kapitali ja tööjõu liikumise absoluutsel vabadusel – süsteem, mis on viinud meid sügavasse majanduslikku, finants- ja sotsiaalsesse kriisi, süsteem, millega Euroopa Liit peab täielikult lõpparve tegema. ']"
103, 6. Hääletuse kohta selgituste andmine,"  Pedro Guerreiro  (GUE/NGL),  kirjalikult. − (PT) Pole juhuslik, et parlamendivalimiste lähenedes ilmuvad välja resolutsioonid, mis üritavad võtta tagasi ELi poolt (iseäranis viimasel 5 aastal) vastuvõetud poliitikate vastutusalasid väga tõsise olukorra osas, milles mikro-, väike- ja keskmise suurusega ettevõtted end üldiselt leiavad, eriti Portugalis.Just väiksed ja keskmise suurusega ja mitte suured rahvusvahelised ettevõtted on Eli poolt propageeritava turu liberaliseerimise ohvrid (justkui raamistik, kus „tugevaimate ellujäämine“ valitseb, võiks toimida nende kasuks). On palju väikseid ja keskmise suurusega ettevõtteid, kes „osalevad“ „rahvusvahelises kaubanduses“ oma sõltuvuse tõttu suurtest rahvusvahelistest ettevõtetest, kelle tarbeks nad toodavad hindade eest, mis tihti tootmiskuludele ei vasta.Kahtlemata on tarvis pakkuda (ja rakendada) kaubanduskaitsemeetmeid, intellektuaalset omandiõigust, põllumajandussaaduste ja -toodete päritolunimetusi ja geograafilisi tähiseid ning toetada väikeste ja keskmise suurusega ettevõtete rahvusvaheliseks muutumist.Miks siis enamik parlamendis esindatud poliitilisi jõude, mis vastavad komisjonis ELi nõukogus esindatud enamusele, ei võta vastu päritolu tähistamise määrust, ei kohalda imporditud toodetele samu ohutus- ja kaitsestandardeid, mis on nõutavad ELis toodetavate toodete puhul, ei kausta 2007. – 2013. aasta finantsraamistikku tootmise ja tööhõive kaitseks, mis toetaks väikseid ja keskmise suurusega ettevõtteid? ","Pedro Guerreiro  (GUE/NGL),",4,175,not_available,"['por', 'por', 'por', 'por']","['  Pedro Guerreiro  (GUE/NGL),  kirjalikult. − (PT) Pole juhuslik, et parlamendivalimiste lähenedes ilmuvad välja resolutsioonid, mis üritavad võtta tagasi ELi poolt (iseäranis viimasel 5 aastal) vastuvõetud poliitikate vastutusalasid väga tõsise olukorra osas, milles mikro-, väike- ja keskmise suurusega ettevõtted end üldiselt leiavad, eriti Portugalis.', 'Just väiksed ja keskmise suurusega ja mitte suured rahvusvahelised ettevõtted on Eli poolt propageeritava turu liberaliseerimise ohvrid (justkui raamistik, kus „tugevaimate ellujäämine“ valitseb, võiks toimida nende kasuks). On palju väikseid ja keskmise suurusega ettevõtteid, kes „osalevad“ „rahvusvahelises kaubanduses“ oma sõltuvuse tõttu suurtest rahvusvahelistest ettevõtetest, kelle tarbeks nad toodavad hindade eest, mis tihti tootmiskuludele ei vasta.', 'Kahtlemata on tarvis pakkuda (ja rakendada) kaubanduskaitsemeetmeid, intellektuaalset omandiõigust, põllumajandussaaduste ja -toodete päritolunimetusi ja geograafilisi tähiseid ning toetada väikeste ja keskmise suurusega ettevõtete rahvusvaheliseks muutumist.', 'Miks siis enamik parlamendis esindatud poliitilisi jõude, mis vastavad komisjonis ELi nõukogus esindatud enamusele, ei võta vastu päritolu tähistamise määrust, ei kohalda imporditud toodetele samu ohutus- ja kaitsestandardeid, mis on nõutavad ELis toodetavate toodete puhul, ei kausta 2007. – 2013. aasta finantsraamistikku tootmise ja tööhõive kaitseks, mis toetaks väikseid ja keskmise suurusega ettevõtteid? ']"
104, 6. Hääletuse kohta selgituste andmine,"  Małgorzata Handzlik  (PPE-DE),  kirjalikult. – (PL) Mul on väga hea meel, et Euroopa Parlament on võtnud vastu proua Muscardini raporti, mille kallal oli mul juhust töötada siseturu ja tarbijakaitse komisjoni konsultandina. Hetkel räägitakse palju väikeste ja keskmise suurusega ettevõtete tingimuste parandamisest Euroopa Liidu siseturul, eriti kavandatava väikeettevõtete algatuse kontekstis.Väiksed ja keskmise suurusega ettevõtted moodustavad üle 99% kõikidest ettevõtetest Euroopas. Ent riiklikke piire ületav äritegevus on pigem suurte ettevõtete pärusmaa. Vaevalt 8% väikestest ja keskmise suurusega ettevõtetest ekspordivad oma riiklikest piiridest kaugemale. Kui aga räägime äritegevusest väljaspool Euroopa Liidu piire, astub selle sammu vaevalt 3% ettevõtteist.Me ei tohiks unustada, et rahvusvaheliseks muutunud ettevõtted näitavad üles suurt innovatsioonisuutlikkust. Ning innovatiivsus on Euroopa majanduse konkurentsivõimelisuse ja kasvu võtmeks. Seetõttu loodan, et siseturupoliitikad pakuvad VKEdele täies ulatuses soodustusi, mida ühine turg toob, ning võimaluse, et nad rajavad aluse VKEde tegevuse rahvusvaheliseks muutumisele. Väiksed ja keskmise suurusega ettevõtted peaks samuti saama suuremat toetust liikmesriikidelt ja Euroopa Komisjonilt valdkondades, kuhu kuuluvad ekspordi soodustamine või potentsiaalsete kaubanduspartnerite otsimine, iseäranis turgu juhtivate toodete ja teenuste ning uute tehnoloogiate osas. ","Małgorzata Handzlik  (PPE-DE),",3,173,not_available,"['pol', 'pol', 'pol']","['  Małgorzata Handzlik  (PPE-DE),  kirjalikult. – (PL) Mul on väga hea meel, et Euroopa Parlament on võtnud vastu proua Muscardini raporti, mille kallal oli mul juhust töötada siseturu ja tarbijakaitse komisjoni konsultandina. Hetkel räägitakse palju väikeste ja keskmise suurusega ettevõtete tingimuste parandamisest Euroopa Liidu siseturul, eriti kavandatava väikeettevõtete algatuse kontekstis.', 'Väiksed ja keskmise suurusega ettevõtted moodustavad üle 99% kõikidest ettevõtetest Euroopas. Ent riiklikke piire ületav äritegevus on pigem suurte ettevõtete pärusmaa. Vaevalt 8% väikestest ja keskmise suurusega ettevõtetest ekspordivad oma riiklikest piiridest kaugemale. Kui aga räägime äritegevusest väljaspool Euroopa Liidu piire, astub selle sammu vaevalt 3% ettevõtteist.', 'Me ei tohiks unustada, et rahvusvaheliseks muutunud ettevõtted näitavad üles suurt innovatsioonisuutlikkust. Ning innovatiivsus on Euroopa majanduse konkurentsivõimelisuse ja kasvu võtmeks. Seetõttu loodan, et siseturupoliitikad pakuvad VKEdele täies ulatuses soodustusi, mida ühine turg toob, ning võimaluse, et nad rajavad aluse VKEde tegevuse rahvusvaheliseks muutumisele. Väiksed ja keskmise suurusega ettevõtted peaks samuti saama suuremat toetust liikmesriikidelt ja Euroopa Komisjonilt valdkondades, kuhu kuuluvad ekspordi soodustamine või potentsiaalsete kaubanduspartnerite otsimine, iseäranis turgu juhtivate toodete ja teenuste ning uute tehnoloogiate osas. ']"
