,agenda_item,text,speaker,number_p,number_w,chair,language_ps,ps
173, 9. Selgitused hääletuse kohta,"  Elena Oana Antonescu  (PPE),  kirjalikult. – (RO) Euroopa Liit töötas ÜRO inimõiguste nõukogu sisseseadmise nimel ning on võtnud endale koos liikmesriikidega eesmärgi mängida aktiivset ja kõrge profiiliga rolli tõhusa asutuse toetamise nimel, mis käsitleb inimõigustega seotud aktuaalseid küsimusi. Lissaboni lepinguga loodud uus institutsiooniline struktuur annab võimaluse suurendada ELi meetmete sidusust, nähtavust ja usutavust ÜRO inimõiguste nõukogus. Sel põhjusel on oluline, et EL võtaks inimõiguste nõukogu 13. istungjärgul arutatavate teemade puhul ühise seisukoha. EL peab avaldama kindlat ja tõhusat mõju ÜRO laiendatud süsteemis ning jääma kindlaks ühise seisukoha leidmisele. EL peab suurendama ka paindlikkust seoses vähemoluliste küsimustega, et võimaldada kiiremat ja tõhusamat reageerimist tähtsamaid probleeme käsitlevates aruteludes. Ennekõike peab EL aktiivselt püüdlema inimõiguste nõukogu spetsiaalsete mehhanismide loomise poole, et reageerida inimõiguste kriisidele Iraanis, Afganistanis, Iraagis ja Jeemenis. ","Elena Oana Antonescu  (PPE),",1,125,not_available,['rum'],"['  Elena Oana Antonescu  (PPE),  kirjalikult. – (RO) Euroopa Liit töötas ÜRO inimõiguste nõukogu sisseseadmise nimel ning on võtnud endale koos liikmesriikidega eesmärgi mängida aktiivset ja kõrge profiiliga rolli tõhusa asutuse toetamise nimel, mis käsitleb inimõigustega seotud aktuaalseid küsimusi. Lissaboni lepinguga loodud uus institutsiooniline struktuur annab võimaluse suurendada ELi meetmete sidusust, nähtavust ja usutavust ÜRO inimõiguste nõukogus. Sel põhjusel on oluline, et EL võtaks inimõiguste nõukogu 13. istungjärgul arutatavate teemade puhul ühise seisukoha. EL peab avaldama kindlat ja tõhusat mõju ÜRO laiendatud süsteemis ning jääma kindlaks ühise seisukoha leidmisele. EL peab suurendama ka paindlikkust seoses vähemoluliste küsimustega, et võimaldada kiiremat ja tõhusamat reageerimist tähtsamaid probleeme käsitlevates aruteludes. Ennekõike peab EL aktiivselt püüdlema inimõiguste nõukogu spetsiaalsete mehhanismide loomise poole, et reageerida inimõiguste kriisidele Iraanis, Afganistanis, Iraagis ja Jeemenis. ']"
174, 9. Selgitused hääletuse kohta,"  Zigmantas Balčytis  (S&D),  kirjalikult. – Paljudes riikides rikutakse endiselt inimõigusi ning kahjuks ei vasta rahvusvaheline kogukond vahetevahel tõsistele rikkumistele aegsasti ja vajalikul viisil. Meil puudub koordineeritud lähenemine rahvusvahelisel tasandil. ELi roll maailmas on viimastel kümnenditel palju olulisemaks muutunud ning Lissaboni lepinguga loodud Euroopa välisteenistusega kaasnev uus lähenemisviis võib aidata liidul tegutseda palju tulemuslikumalt ülemaailmsete ja inimõiguste rikkumise probleemide sidusal, järjekindlal ja tõhusal lahendamisel. ELil on nüüd suurepärane võimalus oma rolli tugevdamiseks ÜRO inimõiguste nõukogus ning liit peaks kasutama kõiki sellega kaasnevaid võimalusi, et suurendada ELi meetmete nähtavust ja usutavust inimõiguste valdkonnas. ","Zigmantas Balčytis  (S&D),",1,91,not_available,['est'],"['  Zigmantas Balčytis  (S&D),  kirjalikult. – Paljudes riikides rikutakse endiselt inimõigusi ning kahjuks ei vasta rahvusvaheline kogukond vahetevahel tõsistele rikkumistele aegsasti ja vajalikul viisil. Meil puudub koordineeritud lähenemine rahvusvahelisel tasandil. ELi roll maailmas on viimastel kümnenditel palju olulisemaks muutunud ning Lissaboni lepinguga loodud Euroopa välisteenistusega kaasnev uus lähenemisviis võib aidata liidul tegutseda palju tulemuslikumalt ülemaailmsete ja inimõiguste rikkumise probleemide sidusal, järjekindlal ja tõhusal lahendamisel. ELil on nüüd suurepärane võimalus oma rolli tugevdamiseks ÜRO inimõiguste nõukogus ning liit peaks kasutama kõiki sellega kaasnevaid võimalusi, et suurendada ELi meetmete nähtavust ja usutavust inimõiguste valdkonnas. ']"
175, 9. Selgitused hääletuse kohta,"  Mara Bizzotto  (EFD),  kirjalikult. – (IT) Täiskogul hääletamiseks esitatud kompromissresolutsioon sisaldab kahjuks tekstiosasid, mille tõttu ma selle poolt hääletada ei saa. Resolutsiooni tekst tunnistab, et ÜRO inimõiguste nõukogu kui poliitilise organi puhul esineb äärmusliku politiseerimise oht. Arvan siiski, et oleksime saanud veelgi enamat öelda, eriti arvestades sellega, et meil on tegemist paljude jaoks väga tundliku ja olulise inimõiguste teemaga. Teksti lugedes panin selles tähele ühte kahetsusväärset nõrkust, mis ei pruugi olla nõrkus poliitilise diplomaatia seisukohalt, kuid on seda kindlasti väärtuste seisukohalt. Nimelt puudub kindlameelsus seoses kriitikaga teada-tuntud aspektide suhtes, mis teevad inimõiguste nõukogu nii vastuoluliseks organiks. Oleksime võinud olla kindlasti palju otsustavamad ning esitada vastuväiteid seoses Iraani kandideerimisega järgmistel nõukogu valimistel. Puudub kindel viide nõukogu mõttetule koosseisule, milles on liiga palju liikmeid, kes sobivad seoses inimõigustega vaevu teisi õpetama ja kellel on veel vähem õigust selles valdkonnas teiste üle kohtu mõistmiseks või otsustamiseks. Seetõttu hoidusin ma hääletusest ning väljendan sellega oma skeptilisust seoses resolutsiooni tekstiga. Hoidun hääletusest ka lootuses, et parlament võtab peast diplomaadimütsi – parlament ei pea olema diplomaatiline – ning astub uljamalt võitlusesse väärtuste ja inimõiguste kaitsmise nimel. ","Mara Bizzotto  (EFD),",1,178,not_available,['ita'],"['  Mara Bizzotto  (EFD),  kirjalikult. – (IT) Täiskogul hääletamiseks esitatud kompromissresolutsioon sisaldab kahjuks tekstiosasid, mille tõttu ma selle poolt hääletada ei saa. Resolutsiooni tekst tunnistab, et ÜRO inimõiguste nõukogu kui poliitilise organi puhul esineb äärmusliku politiseerimise oht. Arvan siiski, et oleksime saanud veelgi enamat öelda, eriti arvestades sellega, et meil on tegemist paljude jaoks väga tundliku ja olulise inimõiguste teemaga. Teksti lugedes panin selles tähele ühte kahetsusväärset nõrkust, mis ei pruugi olla nõrkus poliitilise diplomaatia seisukohalt, kuid on seda kindlasti väärtuste seisukohalt. Nimelt puudub kindlameelsus seoses kriitikaga teada-tuntud aspektide suhtes, mis teevad inimõiguste nõukogu nii vastuoluliseks organiks. Oleksime võinud olla kindlasti palju otsustavamad ning esitada vastuväiteid seoses Iraani kandideerimisega järgmistel nõukogu valimistel. Puudub kindel viide nõukogu mõttetule koosseisule, milles on liiga palju liikmeid, kes sobivad seoses inimõigustega vaevu teisi õpetama ja kellel on veel vähem õigust selles valdkonnas teiste üle kohtu mõistmiseks või otsustamiseks. Seetõttu hoidusin ma hääletusest ning väljendan sellega oma skeptilisust seoses resolutsiooni tekstiga. Hoidun hääletusest ka lootuses, et parlament võtab peast diplomaadimütsi – parlament ei pea olema diplomaatiline – ning astub uljamalt võitlusesse väärtuste ja inimõiguste kaitsmise nimel. ']"
176, 9. Selgitused hääletuse kohta,"  Nikolaos Chountis  (GUE/NGL),  kirjalikult. – (EL) Vaatamata asjaolule, et resolutsiooni ettepanekus on positiivseid elemente, hoidusin hääletusest, sest Euroopa Ühendatud Vasakpoolsete / Põhjamaade Roheliste Vasakpoolsete liitfraktsiooni olulised muudatusettepanekud hääletati maha, mille tulemusena oli resolutsiooni sisu ebapiisav. Euroopa Liit peab toetama ÜRO jõupingutusi, mille eesmärgiks on tagada inimõiguste austamine kõikjal maailmas. EL peab veelgi kindlamini sedalaadi algatustes esiplaanile astuma, sest tänapäeva autokraatlikes režiimides on saanud normiks kapitalistlikku vägivalda rakendavad inimõiguste rikkumised ühiskonnavaenulike poliitikate pealesurumisel. Euroopa Liit peab vaatama üle oma suhted Iisraeli riigiga ning võtma kindlasti arvesse Iisraeli sõjalisi operatsioone Palestiina territooriumil ning rünnakuid palestiinlaste õiguste vastu, mille hulka kuulub ka õigus oma kodumaale. Euroopa Liit peab taanduma USA nn demokraatia eksportimise kampaaniatest ning looma rahvusvaheliste suhete raamistiku, milles peetakse lugu rahvusvahelisest õigusest ning milles ÜRO roll palju suurem on. ","Nikolaos Chountis  (GUE/NGL),",1,127,not_available,['gre'],"['  Nikolaos Chountis  (GUE/NGL),  kirjalikult. – (EL) Vaatamata asjaolule, et resolutsiooni ettepanekus on positiivseid elemente, hoidusin hääletusest, sest Euroopa Ühendatud Vasakpoolsete / Põhjamaade Roheliste Vasakpoolsete liitfraktsiooni olulised muudatusettepanekud hääletati maha, mille tulemusena oli resolutsiooni sisu ebapiisav. Euroopa Liit peab toetama ÜRO jõupingutusi, mille eesmärgiks on tagada inimõiguste austamine kõikjal maailmas. EL peab veelgi kindlamini sedalaadi algatustes esiplaanile astuma, sest tänapäeva autokraatlikes režiimides on saanud normiks kapitalistlikku vägivalda rakendavad inimõiguste rikkumised ühiskonnavaenulike poliitikate pealesurumisel. Euroopa Liit peab vaatama üle oma suhted Iisraeli riigiga ning võtma kindlasti arvesse Iisraeli sõjalisi operatsioone Palestiina territooriumil ning rünnakuid palestiinlaste õiguste vastu, mille hulka kuulub ka õigus oma kodumaale. Euroopa Liit peab taanduma USA nn demokraatia eksportimise kampaaniatest ning looma rahvusvaheliste suhete raamistiku, milles peetakse lugu rahvusvahelisest õigusest ning milles ÜRO roll palju suurem on. ']"
177, 9. Selgitused hääletuse kohta,"  Anna Maria Corazza Bildt, Christofer Fjellner, Gunnar Hökmark ja Anna Ibrisagic  (PPE),  kirjalikult. – (SV) Täna, 25. veebruaril 2010, hääletasid Rootsi konservatiivid ÜRO inimõiguste nõukogu 13. istungjärgu kohta käiva Euroopa Parlamendi resolutsiooni ühisettepaneku poolt (B7-0123/2010). Tahame aga siiski märkida, et ELi liikmesriike tuleb kutsuda üles mõistma üldiselt hukka kõiki inimõiguste rikkumisi. Samuti on kahetsusväärne, et ÜRO inimõiguste nõukogu ei ole suutnud tegeleda piisavalt kiiresti tõsiste inimõigusi puudutavate olukordadega muudes riikides, mida resolutsioonis ei nimetatud, muu hulgas ka Kuubal. ","Anna Maria Corazza Bildt, Christofer Fjellner, Gunnar Hökmark ja Anna Ibrisagic  (PPE),",1,79,not_available,['swe'],"['  Anna Maria Corazza Bildt, Christofer Fjellner, Gunnar Hökmark ja Anna Ibrisagic  (PPE),  kirjalikult. – (SV) Täna, 25. veebruaril 2010, hääletasid Rootsi konservatiivid ÜRO inimõiguste nõukogu 13. istungjärgu kohta käiva Euroopa Parlamendi resolutsiooni ühisettepaneku poolt (B7-0123/2010). Tahame aga siiski märkida, et ELi liikmesriike tuleb kutsuda üles mõistma üldiselt hukka kõiki inimõiguste rikkumisi. Samuti on kahetsusväärne, et ÜRO inimõiguste nõukogu ei ole suutnud tegeleda piisavalt kiiresti tõsiste inimõigusi puudutavate olukordadega muudes riikides, mida resolutsioonis ei nimetatud, muu hulgas ka Kuubal. ']"
178, 9. Selgitused hääletuse kohta,"  Vasilica Viorica Dăncilă  (S&D),  kirjalikult. – (RO) Pean rõhutama, et maailmas õiglase ja kestva rahu saavutamise oluline eeltingimus on see, kõik osalised järgivad igas olukorras rahvusvahelist inimõiguste õigust ja rahvusvahelist humanitaarõigust.Minu arvates tagaks Euroopa Liidu tasemel ELi välisasjade ja julgeolekupoliitika kõrge esindaja ning liikmesriikide kooskõlastatud ühist kindlat seisukohta nõudev tegutsemine rahvusvahelised inimõiguste õigusaktid ja rahvusvahelise humanitaarõiguse rikkujate vastutuselevõtmise. ","Vasilica Viorica Dăncilă  (S&D),",2,59,not_available,"['rum', 'rum']","['  Vasilica Viorica Dăncilă  (S&D),  kirjalikult. – (RO) Pean rõhutama, et maailmas õiglase ja kestva rahu saavutamise oluline eeltingimus on see, kõik osalised järgivad igas olukorras rahvusvahelist inimõiguste õigust ja rahvusvahelist humanitaarõigust.', 'Minu arvates tagaks Euroopa Liidu tasemel ELi välisasjade ja julgeolekupoliitika kõrge esindaja ning liikmesriikide kooskõlastatud ühist kindlat seisukohta nõudev tegutsemine rahvusvahelised inimõiguste õigusaktid ja rahvusvahelise humanitaarõiguse rikkujate vastutuselevõtmise. ']"
179, 9. Selgitused hääletuse kohta,"  Proinsias De Rossa  (S&D),  kirjalikult. – Hääletasin ÜRO soolise võrdõiguslikkuse tegevusprogrammi käsitleva resolutsiooni poolt, milles on tuvastatud peamised sammud, mis on vajalikud naiste ja meeste võrdõiguslikkuse tagamise strateegiliste eesmärkide saavutamiseks Euroopa Liidus. Komisjon peab kindlasti suurendama oma pingutusi seoses võrreldavate andmete kogumisega tegevusprogrammi järelmeetmete kriitiliste näitajate kohta ning tõlgendama neid soolise võrdõiguslikkuse süvalaiendamise algatuste korrapärasteks läbivaatamisteks eri poliitikavaldkondades. Eriti oluline on jälgimine ning tegutsemine, lähtudes vaesuse, vägivalla ja tütarlaste vajaduste soolisest mõõtmest. Järelmeetmed komisjoni naiste ja meeste võrdõiguslikkuse juhistele 2006–2010 peavad võtma arvesse majanduskriisi ja kliimamuutuse pikaajalisi tagajärgi vananevas ja etniliselt mitmekesisemaks muutuvas ühiskonnas. Seksuaal- ja reproduktiivtervist ning nendega seonduvaid õigusi tuleb tunnistada ja edendada Euroopas ja samuti ülamaailmsel tasandil. Euroopa Liit peab ühinema konventsiooniga naiste diskrimineerimise kõigi vormide likvideerimise kohta vastavalt Lissaboni lepinguga kehtestatud uuele õigusraamistikule. ","Proinsias De Rossa  (S&D),",1,128,not_available,['est'],"['  Proinsias De Rossa  (S&D),  kirjalikult. – Hääletasin ÜRO soolise võrdõiguslikkuse tegevusprogrammi käsitleva resolutsiooni poolt, milles on tuvastatud peamised sammud, mis on vajalikud naiste ja meeste võrdõiguslikkuse tagamise strateegiliste eesmärkide saavutamiseks Euroopa Liidus. Komisjon peab kindlasti suurendama oma pingutusi seoses võrreldavate andmete kogumisega tegevusprogrammi järelmeetmete kriitiliste näitajate kohta ning tõlgendama neid soolise võrdõiguslikkuse süvalaiendamise algatuste korrapärasteks läbivaatamisteks eri poliitikavaldkondades. Eriti oluline on jälgimine ning tegutsemine, lähtudes vaesuse, vägivalla ja tütarlaste vajaduste soolisest mõõtmest. Järelmeetmed komisjoni naiste ja meeste võrdõiguslikkuse juhistele 2006–2010 peavad võtma arvesse majanduskriisi ja kliimamuutuse pikaajalisi tagajärgi vananevas ja etniliselt mitmekesisemaks muutuvas ühiskonnas. Seksuaal- ja reproduktiivtervist ning nendega seonduvaid õigusi tuleb tunnistada ja edendada Euroopas ja samuti ülamaailmsel tasandil. Euroopa Liit peab ühinema konventsiooniga naiste diskrimineerimise kõigi vormide likvideerimise kohta vastavalt Lissaboni lepinguga kehtestatud uuele õigusraamistikule. ']"
180, 9. Selgitused hääletuse kohta,"  Edite Estrela  (S&D),  kirjalikult. – (PT) Hääletasin ÜRO inimõiguste nõukogu 13. istungjärgu kohta käiva Euroopa Parlamendi resolutsiooni ühisettepaneku poolt. ELi uus institutsiooniline struktuur pakub ainulaadset võimalust suurendada ÜRO inimõiguste nõukogus ELi meetmete sidusust, nähtavust ja usutavust. Liidu välisasjade ja julgeolekupoliitika kõrge esindaja tegevused aitavad samuti kaasa ELi võimele teha koostööd teistesse rühmitustesse kuuluvate riikidega, et lõpetada inimõiguste rikkumised, kaasa arvatud just naiste ja laste vastu suunatud vägivald. ","Edite Estrela  (S&D),",1,67,not_available,['por'],"['  Edite Estrela  (S&D),  kirjalikult. – (PT) Hääletasin ÜRO inimõiguste nõukogu 13. istungjärgu kohta käiva Euroopa Parlamendi resolutsiooni ühisettepaneku poolt. ELi uus institutsiooniline struktuur pakub ainulaadset võimalust suurendada ÜRO inimõiguste nõukogus ELi meetmete sidusust, nähtavust ja usutavust. Liidu välisasjade ja julgeolekupoliitika kõrge esindaja tegevused aitavad samuti kaasa ELi võimele teha koostööd teistesse rühmitustesse kuuluvate riikidega, et lõpetada inimõiguste rikkumised, kaasa arvatud just naiste ja laste vastu suunatud vägivald. ']"
181, 9. Selgitused hääletuse kohta,"  Diogo Feio  (PPE),  kirjalikult. – (PT) Inimõiguste nõukogu politiseerimine ning jätkuv hoiak nende suhtes, kes on võtnud kindlama seisukoha seoses inimõiguste rikkumiste hukkamõistmisega eri maailma osades, õigustavad nõukogu struktuuri ja tööviisi muutmist. Väljakuulutatud Iraani kandideerimine on järjekordne märk, et kõne all oleva organi tegevussuund ei ole piisavalt usutav ja ohutu ning et minevikus korduvalt inimõiguste rikkumisi toime pannud riigid saavad kasutada oma liikmestaatust nõukogus, et end oma rikkumiste süüst puhtaks pesta.Euroopa Liit peab osalema aktiivselt inimõiguste nõukogu töös, olles samas teadlik selle piirangutest ja probleemidest, ning esindama tasakaalukat, kuid samas ranget ja nõudlikku vaadet seoses sellega, mida austus inimõiguste vastu tähendama peab. Kui EL sellega hakkama saab, tuleb see toime ka oma enda vastutusega selles valdkonnas. ","Diogo Feio  (PPE),",2,116,not_available,"['por', 'por']","['  Diogo Feio  (PPE),  kirjalikult. – (PT) Inimõiguste nõukogu politiseerimine ning jätkuv hoiak nende suhtes, kes on võtnud kindlama seisukoha seoses inimõiguste rikkumiste hukkamõistmisega eri maailma osades, õigustavad nõukogu struktuuri ja tööviisi muutmist. Väljakuulutatud Iraani kandideerimine on järjekordne märk, et kõne all oleva organi tegevussuund ei ole piisavalt usutav ja ohutu ning et minevikus korduvalt inimõiguste rikkumisi toime pannud riigid saavad kasutada oma liikmestaatust nõukogus, et end oma rikkumiste süüst puhtaks pesta.', 'Euroopa Liit peab osalema aktiivselt inimõiguste nõukogu töös, olles samas teadlik selle piirangutest ja probleemidest, ning esindama tasakaalukat, kuid samas ranget ja nõudlikku vaadet seoses sellega, mida austus inimõiguste vastu tähendama peab. Kui EL sellega hakkama saab, tuleb see toime ka oma enda vastutusega selles valdkonnas. ']"
182, 9. Selgitused hääletuse kohta,"  José Manuel Fernandes  (PPE),  kirjalikult. – (PT) Inimõiguste nõukogu (UNHRC) on üldistele inimõigustele spetsialiseerunud platvorm ja inimõigustega tegelev erifoorum ÜRO süsteemis. Inimõiguste universaalsuse austamine, edendamine ja kaitsmine on osa ELi õiguslikust, eetilisest ja kultuurilisest acquis’st ning üks liidu ühtsuse ja terviklikkuse nurgakividest.Olen kindel, et ELi liikmesriigid seisavad aktiivselt vastu igasugustele katsetele kahandada inimõiguste universaalsuse, lahutamatuse ja vastastikuse sõltuvuse põhimõtte tähtsust. Kutsun ELi liikmesriike üles osalema aktiivselt iga-aastasel interaktiivsel arutelul puuetega inimeste õiguste üle ning iga-aastasel kohtumisel lapse õiguste teemal … Tahan rõhutada, kui tähtis on inimõiguste nõukogu 13. istungjärk, kuhu on oodata valitsuste ministreid ja teisi kõrgetasemelisi esindajaid. Istungjärgu päevakorda kuulub majandus- ja finantskriis ning Ühendatud Rahvaste Organisatsiooni deklaratsioon inimõigustealase hariduse ja koolituse kohta. Lõpetuseks, tunnen heameelt selle üle, et Ameerika Ühendriigid osalevad jälle ÜRO organite töös ning et nad valiti inimõiguste nõukogu liikmeks, samuti nende tehtud konstruktiivse töö üle ÜRO Peaassamblee 64. istungjärgul seoses sõnavabadusega. ","José Manuel Fernandes  (PPE),",2,148,not_available,"['por', 'por']","['  José Manuel Fernandes  (PPE),  kirjalikult. – (PT) Inimõiguste nõukogu (UNHRC) on üldistele inimõigustele spetsialiseerunud platvorm ja inimõigustega tegelev erifoorum ÜRO süsteemis. Inimõiguste universaalsuse austamine, edendamine ja kaitsmine on osa ELi õiguslikust, eetilisest ja kultuurilisest acquis’st ning üks liidu ühtsuse ja terviklikkuse nurgakividest.', 'Olen kindel, et ELi liikmesriigid seisavad aktiivselt vastu igasugustele katsetele kahandada inimõiguste universaalsuse, lahutamatuse ja vastastikuse sõltuvuse põhimõtte tähtsust. Kutsun ELi liikmesriike üles osalema aktiivselt iga-aastasel interaktiivsel arutelul puuetega inimeste õiguste üle ning iga-aastasel kohtumisel lapse õiguste teemal … Tahan rõhutada, kui tähtis on inimõiguste nõukogu 13. istungjärk, kuhu on oodata valitsuste ministreid ja teisi kõrgetasemelisi esindajaid. Istungjärgu päevakorda kuulub majandus- ja finantskriis ning Ühendatud Rahvaste Organisatsiooni deklaratsioon inimõigustealase hariduse ja koolituse kohta. Lõpetuseks, tunnen heameelt selle üle, et Ameerika Ühendriigid osalevad jälle ÜRO organite töös ning et nad valiti inimõiguste nõukogu liikmeks, samuti nende tehtud konstruktiivse töö üle ÜRO Peaassamblee 64. istungjärgul seoses sõnavabadusega. ']"
183, 9. Selgitused hääletuse kohta,"  Ilda Figueiredo  (GUE/NGL),  kirjalikult. – (PT) Oleme igati nõus raportis nimetatud inimõiguste universaalsuse, lahutamatuse ja vastastikuse sõltuvuse põhimõttega. Samade eelduste alusel tuleb aga rõhutada andestamatut vasturääkivust, mida väljendab ühelt poolt nimetatud seisukoht ja teiselt poolt kapitalistliku süsteemi tekitatud kriisist tingitud tõsine rünnak töötajate ja inimeste õiguste vastu, mille hulka kuulub kõrge töötuse tase, kasvav vaesus ja üha raskem juurdepääs kvaliteetsetele ja taskukohastele avalikele teenustele. Kahjuks ei võtnud suurem osa parlamendiliikmetest seda vasturääkivust piisavalt arvesse.Meil on kahju, et meie fraktsiooni muudatusettepanekud tagasi lükati. Nende hulgas olid ka järgmised:– juhib tähelepanu sellele, et ÜRO liikmesriigid peaksid edendama toiduainetega varustamise sõltumatust ja toiduga kindlustatust kui vaesuse ja tööpuuduse vähendamise vahendit;– avaldab rahulolu, et ÜRO inimõiguste ülemvoliniku raport Hondurases pärast riigipööret toimunud inimõigusrikkumiste kohta on võetud 13. istungjärgu päevakorda; palub ELi liikmesriikidel toetada riigipöörde ranget hukkamõistmist ning demokraatia ja õigusriigi taastamist Hondurases ja selle nimel töötada;– avaldab muret seoses olukorraga Colombias, eriti seoses tuhandete tuvastamata surnukehade avastamisega. ","Ilda Figueiredo  (GUE/NGL),",5,154,not_available,"['por', 'por', 'por', 'por', 'por']","['  Ilda Figueiredo  (GUE/NGL),  kirjalikult. – (PT) Oleme igati nõus raportis nimetatud inimõiguste universaalsuse, lahutamatuse ja vastastikuse sõltuvuse põhimõttega. Samade eelduste alusel tuleb aga rõhutada andestamatut vasturääkivust, mida väljendab ühelt poolt nimetatud seisukoht ja teiselt poolt kapitalistliku süsteemi tekitatud kriisist tingitud tõsine rünnak töötajate ja inimeste õiguste vastu, mille hulka kuulub kõrge töötuse tase, kasvav vaesus ja üha raskem juurdepääs kvaliteetsetele ja taskukohastele avalikele teenustele. Kahjuks ei võtnud suurem osa parlamendiliikmetest seda vasturääkivust piisavalt arvesse.', 'Meil on kahju, et meie fraktsiooni muudatusettepanekud tagasi lükati. Nende hulgas olid ka järgmised:', '– juhib tähelepanu sellele, et ÜRO liikmesriigid peaksid edendama toiduainetega varustamise sõltumatust ja toiduga kindlustatust kui vaesuse ja tööpuuduse vähendamise vahendit;', '– avaldab rahulolu, et ÜRO inimõiguste ülemvoliniku raport Hondurases pärast riigipööret toimunud inimõigusrikkumiste kohta on võetud 13. istungjärgu päevakorda; palub ELi liikmesriikidel toetada riigipöörde ranget hukkamõistmist ning demokraatia ja õigusriigi taastamist Hondurases ja selle nimel töötada;', '– avaldab muret seoses olukorraga Colombias, eriti seoses tuhandete tuvastamata surnukehade avastamisega. ']"
184, 9. Selgitused hääletuse kohta,"  Sylvie Guillaume  (S&D),  kirjalikult. – (FR) Hääletasin ÜRO inimõiguste nõukogu 13. istungjärgu kohta käiva Euroopa Parlamendi resolutsiooni poolt kõigepealt selleks, et tervitada algatust võtta nõukogu istungjärgu päevakorda majandus- ja finantskriisi mõju kõigi inimõiguste teostamisele. Samuti arvan, et ELil peab olema kindel ühine seisukoht Gaza ja Lõuna-Iisraeli konflikti käsitleva teabe kogumise ülesande järelmeetmete küsimuses. Seoses sellega on igati oluline Goldstone’i aruandes toodud soovituste rakendamine. Viimaks väljendan oma muret seoses Iraani kandideerimisega 2010. aasta mais toimuvatel ÜRO inimõiguste nõukogu valimistel. EL peab tegema kõik endast oleneva, et takistada inimõiguste nõukogusse selliste riikide valimist, kus inimõiguste olukord on kaheldav. ","Sylvie Guillaume  (S&D),",1,98,not_available,['fra'],"['  Sylvie Guillaume  (S&D),  kirjalikult. – (FR) Hääletasin ÜRO inimõiguste nõukogu 13. istungjärgu kohta käiva Euroopa Parlamendi resolutsiooni poolt kõigepealt selleks, et tervitada algatust võtta nõukogu istungjärgu päevakorda majandus- ja finantskriisi mõju kõigi inimõiguste teostamisele. Samuti arvan, et ELil peab olema kindel ühine seisukoht Gaza ja Lõuna-Iisraeli konflikti käsitleva teabe kogumise ülesande järelmeetmete küsimuses. Seoses sellega on igati oluline Goldstone’i aruandes toodud soovituste rakendamine. Viimaks väljendan oma muret seoses Iraani kandideerimisega 2010. aasta mais toimuvatel ÜRO inimõiguste nõukogu valimistel. EL peab tegema kõik endast oleneva, et takistada inimõiguste nõukogusse selliste riikide valimist, kus inimõiguste olukord on kaheldav. ']"
