,agenda_item,text,speaker,number_p,number_w,chair,language_ps,ps
86, 6. Eelmise istungi protokolli kinnitamine,"  Véronique De Keyser  (S&D).   – (FR) Austatud juhataja! Ma ei hakka uuesti rääkima eile siin täiskogul aset leidnud kahetsusväärsest ja parlamendile mitteväärilisest vahejuhtumist, kus Herman van Rompuyd solvati. Euroopa Ülemkogu alaline eesistuja suudab väga hästi enda eest seista, kuid ma ei kannata, et keegi siin täiskogul minu riigi kohta ütleb, et see ei ole riik. Minu riik on Euroopa Liidu asutajariik ning võtab peagi enda kanda eesistujariigi kohustused. Ma ei mõista, kuidas võib keegi siin täiskogul nii madalale langeda ja selliseid asju öelda ning ma nõuan vabandust, austatud juhataja!(Aplaus) ",Véronique De Keyser  (S&D).,2,90,not_available,"['fra', 'fra']","['  Véronique De Keyser  (S&D).   – (FR) Austatud juhataja! Ma ei hakka uuesti rääkima eile siin täiskogul aset leidnud kahetsusväärsest ja parlamendile mitteväärilisest vahejuhtumist, kus Herman van Rompuyd solvati. Euroopa Ülemkogu alaline eesistuja suudab väga hästi enda eest seista, kuid ma ei kannata, et keegi siin täiskogul minu riigi kohta ütleb, et see ei ole riik. Minu riik on Euroopa Liidu asutajariik ning võtab peagi enda kanda eesistujariigi kohustused. Ma ei mõista, kuidas võib keegi siin täiskogul nii madalale langeda ja selliseid asju öelda ning ma nõuan vabandust, austatud juhataja!', '(Aplaus) ']"
87, 6. Eelmise istungi protokolli kinnitamine,"  Gerard Batten  (EFD).   – Austatud juhataja! Soovin teha kodukorda puudutava märkuse lähtudes samast kodukorrapunktist, millest ka eelmine sõnavõtja lähtus, kui ta mu kolleegist Nigel Faragest rääkis.Seda nimetatakse poliitikaks. Te määrisite meie riikidele pähe Lissaboni lepingu ilma inimestelt nõu küsimata ja kui mu kolleeg ütleb selle kohta siis midagi ja see inimestele ei meeldi, siis nad kaebavad. Seda nimetatakse poliitikaks. See oli meie riigis enne seda, kui Euroopa Liit meie demokraatia hävitas, nii et harjuge sellega, et peate kuulma siin vastumeelseid seisukohti. ",Gerard Batten  (EFD).,2,81,not_available,"['est', 'est']","['  Gerard Batten  (EFD).   – Austatud juhataja! Soovin teha kodukorda puudutava märkuse lähtudes samast kodukorrapunktist, millest ka eelmine sõnavõtja lähtus, kui ta mu kolleegist Nigel Faragest rääkis.', 'Seda nimetatakse poliitikaks. Te määrisite meie riikidele pähe Lissaboni lepingu ilma inimestelt nõu küsimata ja kui mu kolleeg ütleb selle kohta siis midagi ja see inimestele ei meeldi, siis nad kaebavad. Seda nimetatakse poliitikaks. See oli meie riigis enne seda, kui Euroopa Liit meie demokraatia hävitas, nii et harjuge sellega, et peate kuulma siin vastumeelseid seisukohti. ']"
88, 6. Eelmise istungi protokolli kinnitamine,  Juhataja.   – Gerard Batten! Eelmine avaldus oli vastus eile parlamendis öeldule ning see esitati vastava kodukorra artikli kohaselt. Tegemist ei olnud kodukorda puudutava märkusega. Seega oli teie kodukorda puudutav märkus kohatu. ,Juhataja.,1,30,not_available,['est'],['  Juhataja.   – Gerard Batten! Eelmine avaldus oli vastus eile parlamendis öeldule ning see esitati vastava kodukorra artikli kohaselt. Tegemist ei olnud kodukorda puudutava märkusega. Seega oli teie kodukorda puudutav märkus kohatu. ']
89, 7. Hääletused,  Juhataja.   − Järgmine päevakorrapunkt on hääletused.(Hääletustulemused ja muud üksikasjad: vt protokoll) ,Juhataja.,2,11,not_available,"['est', 'est']","['  Juhataja.   − Järgmine päevakorrapunkt on hääletused.', '(Hääletustulemused ja muud üksikasjad: vt protokoll) ']"
90, 7.2. Olukord Ukrainas (B7-0116/2010) ,–Enne hääletust lõike 4a üle ,unknown,1,5,not_available,['est'],['–Enne hääletust lõike 4a üle ']
91, 7.2. Olukord Ukrainas (B7-0116/2010) ,"  Cristian Dan Preda,  fraktsiooni PPE nimel. – (FR) Austatud juhataja! Soovin esitada järgmise muudatusettepaneku: „kutsub Ukraina ametivõime üles, pidades silmas, et Ukraina on ratifitseerinud Euroopa Nõukogu vähemusrahvuste kaitse raamkonventsiooni ning Euroopa regionaal- või vähemuskeelte harta, püüdma rohkem abistada vähemusrahvusi Ukrainas, kaasates neid kogukondi enam riigi poliitilistesse arengutesse ning edendades piisavalt nende õigust omandada haridust vähemuskeeltes”.Põhjus on väga lihtne: peame kasutama valimistejärgset konteksti rõhutamaks, et ELi välispoliitika aluseks on austus inimõiguste, sealhulgas ka vähemuste õiguste vastu. ","Cristian Dan Preda,",2,75,not_available,"['fra', 'fra']","['  Cristian Dan Preda,  fraktsiooni PPE nimel. – (FR) Austatud juhataja! Soovin esitada järgmise muudatusettepaneku: „kutsub Ukraina ametivõime üles, pidades silmas, et Ukraina on ratifitseerinud Euroopa Nõukogu vähemusrahvuste kaitse raamkonventsiooni ning Euroopa regionaal- või vähemuskeelte harta, püüdma rohkem abistada vähemusrahvusi Ukrainas, kaasates neid kogukondi enam riigi poliitilistesse arengutesse ning edendades piisavalt nende õigust omandada haridust vähemuskeeltes”.', 'Põhjus on väga lihtne: peame kasutama valimistejärgset konteksti rõhutamaks, et ELi välispoliitika aluseks on austus inimõiguste, sealhulgas ka vähemuste õiguste vastu. ']"
92, 7.2. Olukord Ukrainas (B7-0116/2010) ,"  Michael Gahler,  fraktsiooni PPE nimel. – (DE) Austatud juhataja! Kui minu suuline muudatusettepanek vastu võetakse, ei ole vaja osade kaupa hääletada. Muudatusettepanek on järgmine. „kutsub komisjoni üles põhjalikult ühtlustama riiklikku näidisprogrammi ajavahemikuks 2011–2013 assotsieerimiskavaga”. (DE) Originaaltekstis on sõnastus täpselt vastupidine, mis on vale. ","Michael Gahler,",3,43,not_available,"['ger', 'ger', 'ger']","['  Michael Gahler,  fraktsiooni PPE nimel. – (DE) Austatud juhataja! Kui minu suuline muudatusettepanek vastu võetakse, ei ole vaja osade kaupa hääletada. Muudatusettepanek on järgmine. ', '„kutsub komisjoni üles põhjalikult ühtlustama riiklikku näidisprogrammi ajavahemikuks 2011–2013 assotsieerimiskavaga”. ', '(DE) Originaaltekstis on sõnastus täpselt vastupidine, mis on vale. ']"
93, 7.2. Olukord Ukrainas (B7-0116/2010) ,"  Michael Gahler,  fraktsiooni PPE nimel. – (DE) Austatud juhataja! Teen kõigest faktilise paranduse. Uus sõnastus on õige. Originaaltekstis on aga vale viide. Ma ei pea seda ette lugema, sest muudatusettepanek on teil kirjalikul kujul olemas. ","Michael Gahler,",1,34,not_available,['ger'],"['  Michael Gahler,  fraktsiooni PPE nimel. – (DE) Austatud juhataja! Teen kõigest faktilise paranduse. Uus sõnastus on õige. Originaaltekstis on aga vale viide. Ma ei pea seda ette lugema, sest muudatusettepanek on teil kirjalikul kujul olemas. ']"
94," 7.3. Parlamendi prioriteedid ÜRO Inimõiguste Nõukogu istungjärgul (Genf, 1.–26. märts 2010) (B7-0119/2010) ", – Enne hääletust: ,unknown,1,2,not_available,['est'],[' – Enne hääletust: ']
95," 7.3. Parlamendi prioriteedid ÜRO Inimõiguste Nõukogu istungjärgul (Genf, 1.–26. märts 2010) (B7-0119/2010) ","  José Ignacio Salafranca Sánchez-Neyra  (PPE).   – (ES) Austatud juhataja! Eilsel arutelul seoses resolutsiooni ettepanekuga, mille üle me nüüd hääletame, väljendasime oma kurbust Orlando Zapata Tamayo surma pärast. 42-aastane Zapata Tamayo oli ehitaja ja Kuuba poliitvang, kes suri pärast näljastreiki ning aastatepikkust meelevaldset, ebaõiglast, ebainimlikku ja julma vangistust.Eile mõistis volinik Georgieva siin täiskogul selle juhtumi väga jõuliselt hukka. Kutsun teid, austatud juhataja, parlamendi nimel üles saatma oma kaastundeavaldused Orlando Zapata Tamayo perele, keda isegi Orlando Zapata matustel taga kiusatakse.Palun teil väljendada Kuuba ametivõimudele oma ranget hukkamõistmist seoses surmajuhtumiga, mida oleks saanud ära hoida ja mida Kuuba Inimõiguste ja Rahvusliku Lepituskomisjoni juht Elizardo Sánchez õigluseks maskeeritud mõrvaks nimetas. Ma loodan, austatud juhataja, et selle surma tõttu hakkavad mõtlema need, kes tahavad heast tahtest või lihtsalt naiivsusest muuta nõukogu ühist ja auväärset seisukohta, millega tahetakse siduda igasugused arengud paremuse poole seoses Kuubaga kohe inimõiguste ja põhivabadustega, mida aga endiselt rikutakse, nagu me nägime.(Aplaus) ",José Ignacio Salafranca Sánchez-Neyra  (PPE).,4,154,not_available,"['spa', 'spa', 'spa', 'spa']","['  José Ignacio Salafranca Sánchez-Neyra  (PPE).   – (ES) Austatud juhataja! Eilsel arutelul seoses resolutsiooni ettepanekuga, mille üle me nüüd hääletame, väljendasime oma kurbust Orlando Zapata Tamayo surma pärast. 42-aastane Zapata Tamayo oli ehitaja ja Kuuba poliitvang, kes suri pärast näljastreiki ning aastatepikkust meelevaldset, ebaõiglast, ebainimlikku ja julma vangistust.', 'Eile mõistis volinik Georgieva siin täiskogul selle juhtumi väga jõuliselt hukka. Kutsun teid, austatud juhataja, parlamendi nimel üles saatma oma kaastundeavaldused Orlando Zapata Tamayo perele, keda isegi Orlando Zapata matustel taga kiusatakse.', 'Palun teil väljendada Kuuba ametivõimudele oma ranget hukkamõistmist seoses surmajuhtumiga, mida oleks saanud ära hoida ja mida Kuuba Inimõiguste ja Rahvusliku Lepituskomisjoni juht Elizardo Sánchez õigluseks maskeeritud mõrvaks nimetas. Ma loodan, austatud juhataja, et selle surma tõttu hakkavad mõtlema need, kes tahavad heast tahtest või lihtsalt naiivsusest muuta nõukogu ühist ja auväärset seisukohta, millega tahetakse siduda igasugused arengud paremuse poole seoses Kuubaga kohe inimõiguste ja põhivabadustega, mida aga endiselt rikutakse, nagu me nägime.', '(Aplaus) ']"
96," 7.3. Parlamendi prioriteedid ÜRO Inimõiguste Nõukogu istungjärgul (Genf, 1.–26. märts 2010) (B7-0119/2010) ","  Elmar Brok  (PPE).   – (DE) Austatud juhataja, head kolleegid! Teen suulise muudatusettepaneku panna osade kaupa hääletusele järgmine teksti osa lõikes 10: „peab asjakohatuks lisada nimetatud kontseptsioon rassismi, rassilist diskrimineerimist, ksenofoobiat ja kõiki diskrimineerimise vorme käsitlevasse täiendavate normide protokolli”. See väga oluline osa nõuab osade kaupa hääletust, sest ma ei mõista, miks me need asjad omavahel seome ja ei ütle selgelt välja, et peame võitlema usuvähemuste diskrimineerimise vastu sama innukalt kui kõikide teiste diskrimineerimise liikide vastu. See, et meetmed usuvähemuste diskrimineerimise vastu võitlemiseks on vähem rangemad, on vastuvõetamatu. Seepärast peaks meil olema võimalus selle üle osade kaupa hääletada. ",Elmar Brok  (PPE).,1,96,not_available,['ger'],"['  Elmar Brok  (PPE).   – (DE) Austatud juhataja, head kolleegid! Teen suulise muudatusettepaneku panna osade kaupa hääletusele järgmine teksti osa lõikes 10: „peab asjakohatuks lisada nimetatud kontseptsioon rassismi, rassilist diskrimineerimist, ksenofoobiat ja kõiki diskrimineerimise vorme käsitlevasse täiendavate normide protokolli”. See väga oluline osa nõuab osade kaupa hääletust, sest ma ei mõista, miks me need asjad omavahel seome ja ei ütle selgelt välja, et peame võitlema usuvähemuste diskrimineerimise vastu sama innukalt kui kõikide teiste diskrimineerimise liikide vastu. See, et meetmed usuvähemuste diskrimineerimise vastu võitlemiseks on vähem rangemad, on vastuvõetamatu. Seepärast peaks meil olema võimalus selle üle osade kaupa hääletada. ']"
97," 7.3. Parlamendi prioriteedid ÜRO Inimõiguste Nõukogu istungjärgul (Genf, 1.–26. märts 2010) (B7-0119/2010) ","  Elmar Brok  (PPE).   – (DE) Austatud juhataja! Soovin osade kaupa hääletust ka seoses sõnade „ELi seisukohtadesse” kustutamisega viimasest lausest. Tekst kõlaks siis järgmiselt: „nõuab, et soovitused ja sellega seotud märkused kaasataks ELi dialoogidesse mõlema osapoolega, samuti mitmepoolsetel foorumitel”. Sõnad „ELi seisukohtadesse” oleksid kustutatud. Palun panna antud punkt osade kaupa hääletusele. ",Elmar Brok  (PPE).,1,49,not_available,['ger'],"['  Elmar Brok  (PPE).   – (DE) Austatud juhataja! Soovin osade kaupa hääletust ka seoses sõnade „ELi seisukohtadesse” kustutamisega viimasest lausest. Tekst kõlaks siis järgmiselt: „nõuab, et soovitused ja sellega seotud märkused kaasataks ELi dialoogidesse mõlema osapoolega, samuti mitmepoolsetel foorumitel”. Sõnad „ELi seisukohtadesse” oleksid kustutatud. Palun panna antud punkt osade kaupa hääletusele. ']"
98, 9. Selgitused hääletuse kohta,  Juhataja.   − Järgmine päevakorrapunkt on suulised selgitused hääletuse kohta. ,Juhataja.,1,8,not_available,['est'],['  Juhataja.   − Järgmine päevakorrapunkt on suulised selgitused hääletuse kohta. ']
99, 9. Selgitused hääletuse kohta,"  Zoltán Balczó  (NI).   – Austatud juhataja! Kas saaksime teha kaheminutilise pausi sel ajal, kui inimesed istungisaalist lahkuvad? Või siis üheminutilise pausi? ",Zoltán Balczó  (NI).,1,20,not_available,['est'],"['  Zoltán Balczó  (NI).   – Austatud juhataja! Kas saaksime teha kaheminutilise pausi sel ajal, kui inimesed istungisaalist lahkuvad? Või siis üheminutilise pausi? ']"
100, 9. Selgitused hääletuse kohta,Raport: Adina-Ioana Vălean (A7-0016/2010) ,Raport: Adina-Ioana Vălean (A7-0016/2010),1,7,not_available,['est'],['Raport: Adina-Ioana Vălean (A7-0016/2010) ']
101, 9. Selgitused hääletuse kohta,"  Zoltán Balczó  (NI).   – (HU) Määruse eesmärk on positiivne: koguda liikmesriikidelt teavet seoses energeetika infrastruktuuriga, organiseerida andmed ning teha need ühenduse tasandil majandusjõududele kättesaadavaks. Sellega sekkub määrus turu toimimisse, mis on väga hea. Parlament aga võttis vastu sellega vastandliku algatuse ning läheb isegi nii kaugele, et suhtub sellesse kui määruse poliitilisse eesmärki. Tsiteerin: „Kõik liidu tasandil kavandatavad või võetavad meetmed peaksid olema neutraalsed ega tohiks segada turu toimimist”. Suurem osa parlamendiliikmetest ei ole õppinud midagi ülemaailmsest finants- ja majanduskriisist. Parlament kaitseb neoliberaalseid dogmasid ning isegi antud strateegilises valdkonnas usaldab parlament turu enesekontrollisüsteemi. See on vastuvõetamatu ning seepärast hääletasin ma resolutsiooni vastu. ",Zoltán Balczó  (NI).,1,100,not_available,['hun'],"['  Zoltán Balczó  (NI).   – (HU) Määruse eesmärk on positiivne: koguda liikmesriikidelt teavet seoses energeetika infrastruktuuriga, organiseerida andmed ning teha need ühenduse tasandil majandusjõududele kättesaadavaks. Sellega sekkub määrus turu toimimisse, mis on väga hea. Parlament aga võttis vastu sellega vastandliku algatuse ning läheb isegi nii kaugele, et suhtub sellesse kui määruse poliitilisse eesmärki. Tsiteerin: „Kõik liidu tasandil kavandatavad või võetavad meetmed peaksid olema neutraalsed ega tohiks segada turu toimimist”. Suurem osa parlamendiliikmetest ei ole õppinud midagi ülemaailmsest finants- ja majanduskriisist. Parlament kaitseb neoliberaalseid dogmasid ning isegi antud strateegilises valdkonnas usaldab parlament turu enesekontrollisüsteemi. See on vastuvõetamatu ning seepärast hääletasin ma resolutsiooni vastu. ']"
102, 9. Selgitused hääletuse kohta,  Peter Jahr  (PPE).   – (DE) Austatud juhataja! Toimiv infrastruktuur Euroopa Liidus on otsustav tegur jõukuse mõistliku kasvu tagamiseks. Toiduainetega kindlustatuse ning ühise välis- ja julgeolekupoliitika kõrval mängib väga tähtsat rolli ka energiapoliitika. Ainuüksi sel põhjusel peab Euroopa Parlament osalema kindlasti siin arutelus ning kasutama ka oma kaasotsustamisõigust. Seetõttu kutsun ma komisjoni üles lõpetama oma poliitilist blokaadi ning andma parlamendile kaasotsustamisõigust. ,Peter Jahr  (PPE).,1,59,not_available,['ger'],['  Peter Jahr  (PPE).   – (DE) Austatud juhataja! Toimiv infrastruktuur Euroopa Liidus on otsustav tegur jõukuse mõistliku kasvu tagamiseks. Toiduainetega kindlustatuse ning ühise välis- ja julgeolekupoliitika kõrval mängib väga tähtsat rolli ka energiapoliitika. Ainuüksi sel põhjusel peab Euroopa Parlament osalema kindlasti siin arutelus ning kasutama ka oma kaasotsustamisõigust. Seetõttu kutsun ma komisjoni üles lõpetama oma poliitilist blokaadi ning andma parlamendile kaasotsustamisõigust. ']
103, 9. Selgitused hääletuse kohta,"  Ryszard Czarnecki  (ECR).   – (PL) Austatud juhataja! Minu sõnavõtt tuleb lühike. Kogu idee on üpris hea. Eriti meeldib mulle ökoloogilise aspekti rõhutamine. Sellest rääkides peame olema järjepidevad. Ökoloogilised ja keskkonnakaitse küsimused moodustasidki kõige olulisemad faktilised argumendid, millele tugines vastuseis Põhja-Euroopa gaasijuhtme ideele. Need igati õigustatud, praktilised ja teaduslikult põhjendatud argumendid lükati aga kõrvale, sest poliitilised põhjused võitsid. Arvan, et kõne all olevat projekti toetades ei tohi me olla poliitikas silmakirjalikud. Põhja-Euroopa gaasijuhtme puhul unustasid selle aga paljud Euroopa Liidu liikmesriigid ja paljud fraktsioonid. ",Ryszard Czarnecki  (ECR).,1,84,not_available,['pol'],"['  Ryszard Czarnecki  (ECR).   – (PL) Austatud juhataja! Minu sõnavõtt tuleb lühike. Kogu idee on üpris hea. Eriti meeldib mulle ökoloogilise aspekti rõhutamine. Sellest rääkides peame olema järjepidevad. Ökoloogilised ja keskkonnakaitse küsimused moodustasidki kõige olulisemad faktilised argumendid, millele tugines vastuseis Põhja-Euroopa gaasijuhtme ideele. Need igati õigustatud, praktilised ja teaduslikult põhjendatud argumendid lükati aga kõrvale, sest poliitilised põhjused võitsid. Arvan, et kõne all olevat projekti toetades ei tohi me olla poliitikas silmakirjalikud. Põhja-Euroopa gaasijuhtme puhul unustasid selle aga paljud Euroopa Liidu liikmesriigid ja paljud fraktsioonid. ']"
104, 9. Selgitused hääletuse kohta,"  Jaroslav Paška  (EFD).   – (SK) 2009. aasta alguses sai selgeks, et Euroopa Liit ja liikmesriigid ei suuda aidata üksteist elektri või gaasiga varustamise katkemise korral. Oli selge, et elektrivõrgud läänes ja idas ei ole omavahel seotud, neil on erinevad parameetrid ja need ei ühildu omavahel.Seepärast on väga hea, et riigid ja võrkude operaatorid peavad esitama Euroopa Komisjonile olulist teavet oma energiaga varustamise võimete kohta. Komisjon saab siis nende andmete alusel hinnata võrkude ja ELi energia varustuskindluse poliitika kitsaskohti ning teavitada üksikuid riike nende energiasüsteemide reservvõimsusest. Sellest seisukohast lähtudes arvan ma, et me peame toetama nõukogu ja komisjoni algatust seoses teabe esitamise ja kogumisega energiavaldkonnas Euroopa Liidu kasuks. ",Jaroslav Paška  (EFD).,2,107,not_available,"['slo', 'slo']","['  Jaroslav Paška  (EFD).   – (SK) 2009. aasta alguses sai selgeks, et Euroopa Liit ja liikmesriigid ei suuda aidata üksteist elektri või gaasiga varustamise katkemise korral. Oli selge, et elektrivõrgud läänes ja idas ei ole omavahel seotud, neil on erinevad parameetrid ja need ei ühildu omavahel.', 'Seepärast on väga hea, et riigid ja võrkude operaatorid peavad esitama Euroopa Komisjonile olulist teavet oma energiaga varustamise võimete kohta. Komisjon saab siis nende andmete alusel hinnata võrkude ja ELi energia varustuskindluse poliitika kitsaskohti ning teavitada üksikuid riike nende energiasüsteemide reservvõimsusest. Sellest seisukohast lähtudes arvan ma, et me peame toetama nõukogu ja komisjoni algatust seoses teabe esitamise ja kogumisega energiavaldkonnas Euroopa Liidu kasuks. ']"
105, 9. Selgitused hääletuse kohta,Resolutsiooni ettepanek RC-B7-0116/2010,Resolutsiooni ettepanek RC-B7-0116/2010,1,6,not_available,['est'],['Resolutsiooni ettepanek RC-B7-0116/2010']
106, 9. Selgitused hääletuse kohta,"  Viktor Uspaskich  (ALDE).   – (LT) Tahan ennekõike rõhutada oma toetust Ukrainale seoses demokraatlike valmiste korraldamisega ning inimestele võimaluse andmisega oma vaba tahet väljendada. Tunnen Ukrainat hästi ja näen seetõttu, et mitte ainult valitsus, vaid ka riigi ühiskond on aktiivselt liikumas demokraatia ja demokraatlike institutsioonide asutamise poole. Loodan ka, et need valimised toovad Ukraina lähemale Euroopa Liidule ning aitavad ehk kaasa ka ELi ja Venemaa koostöö tugevdamisele. Mul on samuti hea meel selle üle, et varsti võib isegi üks Nõukogude Liidu järgne riik saada viisavabaduse Euroopa Liitu reisimiseks. ",Viktor Uspaskich  (ALDE).,1,86,not_available,['lit'],"['  Viktor Uspaskich  (ALDE).   – (LT) Tahan ennekõike rõhutada oma toetust Ukrainale seoses demokraatlike valmiste korraldamisega ning inimestele võimaluse andmisega oma vaba tahet väljendada. Tunnen Ukrainat hästi ja näen seetõttu, et mitte ainult valitsus, vaid ka riigi ühiskond on aktiivselt liikumas demokraatia ja demokraatlike institutsioonide asutamise poole. Loodan ka, et need valimised toovad Ukraina lähemale Euroopa Liidule ning aitavad ehk kaasa ka ELi ja Venemaa koostöö tugevdamisele. Mul on samuti hea meel selle üle, et varsti võib isegi üks Nõukogude Liidu järgne riik saada viisavabaduse Euroopa Liitu reisimiseks. ']"
107, 9. Selgitused hääletuse kohta,"  Jarosław Kalinowski  (PPE).   – (PL) Austatud juhataja! Resolutsioon seoses olukorraga Ukrainas on tasakaalustatud ning annab objektiivse ülevaate sealsest reaalsest olukorrast. Saame nüüd vaid soovida Ukrainale edu seoses majandusprobleemidest ning samuti Ukraina geopoliitilistest läbikukkumisest tingitud ühiskondlikust lõhest ülesaamisel.Tahan juhtida ka tähelepanu ametist lahkuva Ukraina presidendi Viktor Juštšenko otsusele anda Stefan Banderale Ukraina rahvuskangelase tiitel ning tema määrusele, millega ta tunnustab kahe natsionalistliku organisatsiooni, Ukraina Natsionalistide Organisatsiooni ja Ukraina Vastupanuarmee, osalemist võitluses Ukraina vabaduse eest. Nii Stefan Bandera kui ka nimetatud organisatsioonid on vastutavad etnilise puhastuse ja muude jõleduste eest, mida 1940ndatel tänapäeva Lääne-Ukrainas poola rahvusest elanikkonna vastu toime pandi. Natsionalistid mõrvasid 120 000 poolakat. Soovides Ukrainale kõike head, loodan ma siiski, et ekstreemse ja kuritegeliku natsionalismi ülistamist mõistetakse hukka. ",Jarosław Kalinowski  (PPE).,2,119,not_available,"['pol', 'pol']","['  Jarosław Kalinowski  (PPE).   – (PL) Austatud juhataja! Resolutsioon seoses olukorraga Ukrainas on tasakaalustatud ning annab objektiivse ülevaate sealsest reaalsest olukorrast. Saame nüüd vaid soovida Ukrainale edu seoses majandusprobleemidest ning samuti Ukraina geopoliitilistest läbikukkumisest tingitud ühiskondlikust lõhest ülesaamisel.', 'Tahan juhtida ka tähelepanu ametist lahkuva Ukraina presidendi Viktor Juštšenko otsusele anda Stefan Banderale Ukraina rahvuskangelase tiitel ning tema määrusele, millega ta tunnustab kahe natsionalistliku organisatsiooni, Ukraina Natsionalistide Organisatsiooni ja Ukraina Vastupanuarmee, osalemist võitluses Ukraina vabaduse eest. Nii Stefan Bandera kui ka nimetatud organisatsioonid on vastutavad etnilise puhastuse ja muude jõleduste eest, mida 1940ndatel tänapäeva Lääne-Ukrainas poola rahvusest elanikkonna vastu toime pandi. Natsionalistid mõrvasid 120 000 poolakat. Soovides Ukrainale kõike head, loodan ma siiski, et ekstreemse ja kuritegeliku natsionalismi ülistamist mõistetakse hukka. ']"
108, 9. Selgitused hääletuse kohta,"  Elżbieta Katarzyna Łukacijewska  (PPE).   – (PL) Austatud juhtaja! Mul oli meeldiv võimalus osaleda Euroopa Parlamendi vaatlejana Ukraina presidendivalimiste esimesel voorul. Pean tunnistama, et ukrainlased said sellest katsumusest üle. Vaatamata viimasel hetkel tehtud muudatustele valimisnormides toimusid valimised väga läbipaistvalt ja demokraatlikult.Täna vajab Ukraina poliitilist, administratiivset ja majanduslikku stabiilsust. Seepärast peaksime ukrainlaste demokraatlikku valikut austama ning toetama ja kiirendama meetmeid, mis aitavad Ukrainal olemasolevaid probleeme lahendada. Euroopa Liit peab andma selgesti mõista, et uks Ukraina ühinemisele Euroopa Liiduga on avatud. Kui Euroopa Liit on Ukrainast tõepoolest huvitatud, siis peaks olema esimeseks sammuks viisavabaduse kehtestamine ukrainlastele. Loodan, et tänase resolutsiooni vastuvõtmine aitab kiirendada nende ideede teokstegemist. Sel põhjusel hääletasin ma resolutsiooni vastuvõtmise poolt. ",Elżbieta Katarzyna Łukacijewska  (PPE).,2,110,not_available,"['pol', 'pol']","['  Elżbieta Katarzyna Łukacijewska  (PPE).   – (PL) Austatud juhtaja! Mul oli meeldiv võimalus osaleda Euroopa Parlamendi vaatlejana Ukraina presidendivalimiste esimesel voorul. Pean tunnistama, et ukrainlased said sellest katsumusest üle. Vaatamata viimasel hetkel tehtud muudatustele valimisnormides toimusid valimised väga läbipaistvalt ja demokraatlikult.', 'Täna vajab Ukraina poliitilist, administratiivset ja majanduslikku stabiilsust. Seepärast peaksime ukrainlaste demokraatlikku valikut austama ning toetama ja kiirendama meetmeid, mis aitavad Ukrainal olemasolevaid probleeme lahendada. Euroopa Liit peab andma selgesti mõista, et uks Ukraina ühinemisele Euroopa Liiduga on avatud. Kui Euroopa Liit on Ukrainast tõepoolest huvitatud, siis peaks olema esimeseks sammuks viisavabaduse kehtestamine ukrainlastele. Loodan, et tänase resolutsiooni vastuvõtmine aitab kiirendada nende ideede teokstegemist. Sel põhjusel hääletasin ma resolutsiooni vastuvõtmise poolt. ']"
