,agenda_item,text,speaker,number_p,number_w,chair,language_ps,ps
0, 1. Osaistungjärgu avamine,ISTUNGI JUHATAJA: Miguel Angel MARTÍNEZ MARTÍNEZ asepresident,ISTUNGI JUHATAJA: Miguel Angel MARTÍNEZ MARTÍNEZ,1,7,not_available,['est'],['ISTUNGI JUHATAJA: Miguel Angel MARTÍNEZ MARTÍNEZ asepresident']
1, 1. Osaistungjärgu avamine,"  María Muñiz De Urquiza  (S&D).   – (ES) Austatud juhataja! Suure töökoormuse tõttu siin täiskogul ei olnud eile võimalik mainida Orlando Zapata juhtumit, kes alles hiljuti suri ja keda Hispaania delegatsioon siiralt leinab. Ta suri pika näljastreigi järel. Ta on esimene nn südametunnistuse vang, kes Kuubas viimase 40 aasta jooksul surnud on, ning siinkohal nõuame kõikide selliste vangide vabastamist Kuubas ja ülejäänud maailmas! Väljendame ka oma solidaarsust tema perele ja Kuuba rahvale, kes on teel pluralismi ja arengu suunas.Sellest väga kurvast sündmusest võiks saada ajend läbirääkimiste alustamiseks, mille eesmärgiks on Euroopa Liidu ja Kuuba suhete arendamine, kus põhjalik kahepoolne raamistik loob aluse alalisteks konstruktiivseteks läbirääkimisteks inimõiguste teemal, mis leiavad aset sarnaselt teistele Euroopa Liidu kokkulepetele kolmandate riikidega. ",María Muñiz De Urquiza  (S&D).,2,117,not_available,"['spa', 'spa']","['  María Muñiz De Urquiza  (S&D).   – (ES) Austatud juhataja! Suure töökoormuse tõttu siin täiskogul ei olnud eile võimalik mainida Orlando Zapata juhtumit, kes alles hiljuti suri ja keda Hispaania delegatsioon siiralt leinab. Ta suri pika näljastreigi järel. Ta on esimene nn südametunnistuse vang, kes Kuubas viimase 40 aasta jooksul surnud on, ning siinkohal nõuame kõikide selliste vangide vabastamist Kuubas ja ülejäänud maailmas! Väljendame ka oma solidaarsust tema perele ja Kuuba rahvale, kes on teel pluralismi ja arengu suunas.', 'Sellest väga kurvast sündmusest võiks saada ajend läbirääkimiste alustamiseks, mille eesmärgiks on Euroopa Liidu ja Kuuba suhete arendamine, kus põhjalik kahepoolne raamistik loob aluse alalisteks konstruktiivseteks läbirääkimisteks inimõiguste teemal, mis leiavad aset sarnaselt teistele Euroopa Liidu kokkulepetele kolmandate riikidega. ']"
2, 4. Roheline raamat ühise kalanduspoliitika reformi kohta (arutelu) ,  Juhataja.   – Järgmine päevakorrapunkt on Maria do Céu Patrão Nevesi kalanduskomisjoni nimel koostatud raport (A7-0014/2010) ühise kalanduspoliitika reformi käsitleva rohelise raamatu kohta (KOM(2009)0163 – 2009/2106(INI)). ,Juhataja.,1,29,not_available,['est'],['  Juhataja.   – Järgmine päevakorrapunkt on Maria do Céu Patrão Nevesi kalanduskomisjoni nimel koostatud raport (A7-0014/2010) ühise kalanduspoliitika reformi käsitleva rohelise raamatu kohta (KOM(2009)0163 – 2009/2106(INI)). ']
3, 4. Roheline raamat ühise kalanduspoliitika reformi kohta (arutelu) ,"  Maria do Céu Patrão Neves,  raportöör. – (PT) Lubage mul öelda kõigepealt paar sõna 50 kalurist koosnevale rühmale, kes nüüd istungisaali jõudma peaks, et jälgida käimasolevat arutelu ja hääletust seoses kõne all oleva raportiga.Arvan, et võin rääkida kõikide oma kalanduskomisjoni kolleegide nimel, kes tegid raportiga kõvasti tööd, ja öelda, et mul on väga hea meel tänase päeva üle, kus me oma raporti parlamendile arutlemiseks ja hääletamiseks esitame. Miks? Sest ühine kalanduspoliitika on üks Euroopa Liidu juhtpoliitikaid. Kalanduspoliitika algus oli väga raske – ametlikult pandi sellele alus 80ndatel ning esimene reform toimus 2002. aastal. Praeguseks on meile selged mõned olulisemad probleemid, mis juba tol ajal leiti (liigne püügivõimsus, ülepüük ja üleinvesteerimine, mis ei paistnud olevat võrdne kogu ELi ulatuses), sest need probleemid on siiani lahendamata.Selline on lähtepositsiooniks uuele reformile, mis peab olema ulatuslik ja intensiivne ning mida kalandussektor juba pikka aega oodanud on.Milline peaks meie raporti järgi olema selle reformi suund? Esiteks peab seoses aluspõhimõtetega valitsema tasakaal keskkonna-, sotsiaalsete ja majanduslike aspektide vahel. Keskkonnaaspektid on vajalikud kalavarude säilitamiseks, sotsiaalsed aspektid tagavad kalapüügiga seotud elukutsete arenemise ja väärikuse ning majanduslikud aspektid annavad tööstusele seoses sissetulekuga garantiid. Ilma nende kolme aspektita jaotab Euroopa Liit oma püügikohad või vähemalt selliseid püügikohad, mis oleksid jätkusuutlikud ning suudaksid areneda, mis on see, mida me kõik tahame.Kuidas on võimalik rakendada neid üldpõhimõtteid, mille eesmärgiks on kalapüügi vähendamine, kasumi suurendamine ja kalavarude säilitamine? Raportis on toodud välja teatud aluspõhimõtted, nagu investeeringud detsentraliseerimisse, kaluritele ja tervele kalandussektorile paremate võimaluste loomine ning neile otsuste tegemiseks volituste andmine ja nende suurem kaasamine kalapüügi haldamises, millega on võimalik rakendada ka vastavuse tagamise ja vastutuse poliitikat. Lisaks veel vajadus eristada väikesi ja tööstuslikke laevastikke ning rakendada mõlema puhul omaette õigusakte; vajadus hinnata juhtimismudeleid, mis sobivad paremini eri püügipiirkondade ja kalavarude jaoks; turu tugevdamise tähtsus kalapüügiga, mis on suunatud lisandväärtust andvatele toodetele ja esmamüügihindade tõstmisele. Toetuste sidumine heade tavadega; laevastiku kaasajastamise reguleerimine seoses ohutuse ja hügieeniga; ökoloogiliselt jätkusuutliku vesiviljeluse arendamine Euroopa Liidus. Muude kalapüügi või kala töötlemisega seotud sektorite arendamine. Tähelepanuta ei tohi jätta ka naiste kasvavat rolli kalandussektoris ning samuti nõudeid seoses kolmandatest riikidest ELi imporditavate kalandustoodetega, millele peavad kehtima samad nõuded, mis kehtivad meie omatoodetele. See tähendab sertifitseerimist, märgistamist, jälgitavust ning püügipiirkondade integreerimist Euroopa merenduspoliitikaga selle mahu suurendamise laiemas kontekstis.Lõpetuseks soovin öelda, et täna esitatud raport valmis tänu kõikide kalanduskomisjoni liikmete ühisele tööle ning eriti tänu variraportööridele, kellega me tihedat koostööd tegime. Tänan samuti komisjoni, Euroopa Parlamendi sekretariaati, Euroopa Rahvapartei (kristlike demokraatide) fraktsiooni nõustajat ja teiste fraktsioonide nõustajaid ning loomulikult oma kabinetti ja assistenti! Täna esitatud raport valmis tõelise koostöö tulemusena ning me loodame, et see siin täna ka vastu võetakse. ","Maria do Céu Patrão Neves,",6,432,not_available,"['por', 'por', 'por', 'por', 'por', 'por']","['  Maria do Céu Patrão Neves,  raportöör. – (PT) Lubage mul öelda kõigepealt paar sõna 50 kalurist koosnevale rühmale, kes nüüd istungisaali jõudma peaks, et jälgida käimasolevat arutelu ja hääletust seoses kõne all oleva raportiga.', 'Arvan, et võin rääkida kõikide oma kalanduskomisjoni kolleegide nimel, kes tegid raportiga kõvasti tööd, ja öelda, et mul on väga hea meel tänase päeva üle, kus me oma raporti parlamendile arutlemiseks ja hääletamiseks esitame. Miks? Sest ühine kalanduspoliitika on üks Euroopa Liidu juhtpoliitikaid. Kalanduspoliitika algus oli väga raske – ametlikult pandi sellele alus 80ndatel ning esimene reform toimus 2002. aastal. Praeguseks on meile selged mõned olulisemad probleemid, mis juba tol ajal leiti (liigne püügivõimsus, ülepüük ja üleinvesteerimine, mis ei paistnud olevat võrdne kogu ELi ulatuses), sest need probleemid on siiani lahendamata.', 'Selline on lähtepositsiooniks uuele reformile, mis peab olema ulatuslik ja intensiivne ning mida kalandussektor juba pikka aega oodanud on.', 'Milline peaks meie raporti järgi olema selle reformi suund? Esiteks peab seoses aluspõhimõtetega valitsema tasakaal keskkonna-, sotsiaalsete ja majanduslike aspektide vahel. Keskkonnaaspektid on vajalikud kalavarude säilitamiseks, sotsiaalsed aspektid tagavad kalapüügiga seotud elukutsete arenemise ja väärikuse ning majanduslikud aspektid annavad tööstusele seoses sissetulekuga garantiid. Ilma nende kolme aspektita jaotab Euroopa Liit oma püügikohad või vähemalt selliseid püügikohad, mis oleksid jätkusuutlikud ning suudaksid areneda, mis on see, mida me kõik tahame.', 'Kuidas on võimalik rakendada neid üldpõhimõtteid, mille eesmärgiks on kalapüügi vähendamine, kasumi suurendamine ja kalavarude säilitamine? Raportis on toodud välja teatud aluspõhimõtted, nagu investeeringud detsentraliseerimisse, kaluritele ja tervele kalandussektorile paremate võimaluste loomine ning neile otsuste tegemiseks volituste andmine ja nende suurem kaasamine kalapüügi haldamises, millega on võimalik rakendada ka vastavuse tagamise ja vastutuse poliitikat. Lisaks veel vajadus eristada väikesi ja tööstuslikke laevastikke ning rakendada mõlema puhul omaette õigusakte; vajadus hinnata juhtimismudeleid, mis sobivad paremini eri püügipiirkondade ja kalavarude jaoks; turu tugevdamise tähtsus kalapüügiga, mis on suunatud lisandväärtust andvatele toodetele ja esmamüügihindade tõstmisele. Toetuste sidumine heade tavadega; laevastiku kaasajastamise reguleerimine seoses ohutuse ja hügieeniga; ökoloogiliselt jätkusuutliku vesiviljeluse arendamine Euroopa Liidus. Muude kalapüügi või kala töötlemisega seotud sektorite arendamine. Tähelepanuta ei tohi jätta ka naiste kasvavat rolli kalandussektoris ning samuti nõudeid seoses kolmandatest riikidest ELi imporditavate kalandustoodetega, millele peavad kehtima samad nõuded, mis kehtivad meie omatoodetele. See tähendab sertifitseerimist, märgistamist, jälgitavust ning püügipiirkondade integreerimist Euroopa merenduspoliitikaga selle mahu suurendamise laiemas kontekstis.', 'Lõpetuseks soovin öelda, et täna esitatud raport valmis tänu kõikide kalanduskomisjoni liikmete ühisele tööle ning eriti tänu variraportööridele, kellega me tihedat koostööd tegime. Tänan samuti komisjoni, Euroopa Parlamendi sekretariaati, Euroopa Rahvapartei (kristlike demokraatide) fraktsiooni nõustajat ja teiste fraktsioonide nõustajaid ning loomulikult oma kabinetti ja assistenti! Täna esitatud raport valmis tõelise koostöö tulemusena ning me loodame, et see siin täna ka vastu võetakse. ']"
4, 4. Roheline raamat ühise kalanduspoliitika reformi kohta (arutelu) ,"  Juan Carlos Martín Fragueiro,  nõukogu eesistuja. – (ES) Austatud juhataja! Ka eesistujariik tervitab käimasolevat arutelu Euroopa Parlamendis, kuna tegemist on olulise panusega nõuandemenetlusse seoses kõne all oleva rohelise raamatuga ning seetõttu peaks komisjon võtma oma õigusloomega seotud ettepanekute koostamisel kindlasti arvesse Euroopa Parlamendi panuseid.Ka nõukogu kavatseb tutvuda hoolikalt kõikide parlamendi arvamustega, et õigusloomega seotud ettepanekud lõpuks läbi vaadata ning seadusandliku tavamenetluse raames vastu võtta.2009. aasta aprillis esitatud roheline raamat käsitleb ühise kalanduspoliitika mitmesuguseid struktuurilisi kitsaskohti, nagu liigne püügivõimsus, selgete eesmärkide puudumine, lühiajaliste otsuste tegemine, sektoris vastutuse puudumine ja üldiselt kehv õigusnormidest kinnipidamine.Rohelises raamatus on esitatud ka võimalikud lahendused nimetatud struktuuriliste kitsaskohtade kõrvaldamiseks ning dokumendis käsitletakse ka teisi olulisi probleeme, nagu erikord tööstuslikele laevastikele ja väikesemahulistele rannapüügi laevastikele, raiskamine, suhteline stabiilsus, ülekantavad kalapüügiõigused, tugevam turuorientatsioon, ühise kalanduspoliitika integreerimine laiemasse merenduspoliitika konteksti, riiklik rahastamine ja ühise kalanduspoliitika välismõõde.Nõukogus uurivad liikmesriigid nii omaette kui ka ühiselt väga üksikasjalikult kõikide asjaomaste küsimuste aspekte. Esimene aruteluetapp lõppes 2009. aasta detsembris ja komisjon sai 1700 ettepanekut ning on siiani pidanud üle 125 kohtumise ja seminari.Teisel etapil, mis algab selle aasta 1. septembril, analüüsitakse tehtud panuseid ja arutletakse peamiste ideede üle. Jaanuaris korraldas komisjon seminare seoses reformi tähtsaimate elementidega ja kalanduse õigustepõhiste juhtimissüsteemidega ning isegi täna toimub seminar seoses väikesemahulise kalapüügiga. Mõju hinnatakse märtsis. Euroopa Kalandusfondi ja tulevast finantsperspektiivi käsitletakse aprillis, seejärel välismõõdet mais ning raiskamist ja selektiivsust juunis.2. ja 3. mail peetakse eesistujariigi ja komisjoni ühine konverents LA Coruña provintsis. Konverentsil käsitletakse kolme reformi põhielementi, milleks on juhtimine, kalavarude haldamine ja suure- ning väikesemahulise kalapüügi eristamine.4. ja 5. mail kohtuvad ministrid Vigos, kus tutvutakse konverentsi tulemustega, ning võimalik, et juunis lisab nõukogu oma päevakorda mitteametliku arutelu seoses võimalikke muudatusi käsitleva töödokumendiga.Kolmandal etapil, mis algab 2010. aasta teisel poolel, esitab komisjon valge raamatu ning seejärel neli õigusloomega seotud ettepanekut: algmäärus, uus komisjoni teatus, tehnilised meetmed ja uus määrus seoses rahastamisega. Eesmärgiks on alustada reformitud ühise kalanduspoliitika rakendamist 2013. aasta 1. jaanuarist.Nõukogu ei ole veel kindlat seisukohta võtnud ning teeb ametliku otsuse komisjonilt 2011. aastal saadud ettepanekute alusel ning õigusloomemenetluse eeskirjadest lähtudes. ","Juan Carlos Martín Fragueiro,",10,342,not_available,"['spa', 'spa', 'spa', 'spa', 'spa', 'spa', 'spa', 'spa', 'spa', 'spa']","['  Juan Carlos Martín Fragueiro,  nõukogu eesistuja. – (ES) Austatud juhataja! Ka eesistujariik tervitab käimasolevat arutelu Euroopa Parlamendis, kuna tegemist on olulise panusega nõuandemenetlusse seoses kõne all oleva rohelise raamatuga ning seetõttu peaks komisjon võtma oma õigusloomega seotud ettepanekute koostamisel kindlasti arvesse Euroopa Parlamendi panuseid.', 'Ka nõukogu kavatseb tutvuda hoolikalt kõikide parlamendi arvamustega, et õigusloomega seotud ettepanekud lõpuks läbi vaadata ning seadusandliku tavamenetluse raames vastu võtta.', '2009. aasta aprillis esitatud roheline raamat käsitleb ühise kalanduspoliitika mitmesuguseid struktuurilisi kitsaskohti, nagu liigne püügivõimsus, selgete eesmärkide puudumine, lühiajaliste otsuste tegemine, sektoris vastutuse puudumine ja üldiselt kehv õigusnormidest kinnipidamine.', 'Rohelises raamatus on esitatud ka võimalikud lahendused nimetatud struktuuriliste kitsaskohtade kõrvaldamiseks ning dokumendis käsitletakse ka teisi olulisi probleeme, nagu erikord tööstuslikele laevastikele ja väikesemahulistele rannapüügi laevastikele, raiskamine, suhteline stabiilsus, ülekantavad kalapüügiõigused, tugevam turuorientatsioon, ühise kalanduspoliitika integreerimine laiemasse merenduspoliitika konteksti, riiklik rahastamine ja ühise kalanduspoliitika välismõõde.', 'Nõukogus uurivad liikmesriigid nii omaette kui ka ühiselt väga üksikasjalikult kõikide asjaomaste küsimuste aspekte. Esimene aruteluetapp lõppes 2009. aasta detsembris ja komisjon sai 1700 ettepanekut ning on siiani pidanud üle 125 kohtumise ja seminari.', 'Teisel etapil, mis algab selle aasta 1. septembril, analüüsitakse tehtud panuseid ja arutletakse peamiste ideede üle. Jaanuaris korraldas komisjon seminare seoses reformi tähtsaimate elementidega ja kalanduse õigustepõhiste juhtimissüsteemidega ning isegi täna toimub seminar seoses väikesemahulise kalapüügiga. Mõju hinnatakse märtsis. Euroopa Kalandusfondi ja tulevast finantsperspektiivi käsitletakse aprillis, seejärel välismõõdet mais ning raiskamist ja selektiivsust juunis.', '2. ja 3. mail peetakse eesistujariigi ja komisjoni ühine konverents LA Coruña provintsis. Konverentsil käsitletakse kolme reformi põhielementi, milleks on juhtimine, kalavarude haldamine ja suure- ning väikesemahulise kalapüügi eristamine.', '4. ja 5. mail kohtuvad ministrid Vigos, kus tutvutakse konverentsi tulemustega, ning võimalik, et juunis lisab nõukogu oma päevakorda mitteametliku arutelu seoses võimalikke muudatusi käsitleva töödokumendiga.', 'Kolmandal etapil, mis algab 2010. aasta teisel poolel, esitab komisjon valge raamatu ning seejärel neli õigusloomega seotud ettepanekut: algmäärus, uus komisjoni teatus, tehnilised meetmed ja uus määrus seoses rahastamisega. Eesmärgiks on alustada reformitud ühise kalanduspoliitika rakendamist 2013. aasta 1. jaanuarist.', 'Nõukogu ei ole veel kindlat seisukohta võtnud ning teeb ametliku otsuse komisjonilt 2011. aastal saadud ettepanekute alusel ning õigusloomemenetluse eeskirjadest lähtudes. ']"
5, 4. Roheline raamat ühise kalanduspoliitika reformi kohta (arutelu) ,"  Maria Damanaki,  komisjoni liige. – Austatud juhataja! Kuna see on minu esimene sõnavõtt täiskogul volinikuna parlamendiliikmete ees, siis tahaksin ma esmalt tänada teid võimaluse eest siin sõna võtta! Mul on suur au olla siin teie ees ning arutleda ühise kalanduspoliitika reformi üle, mis on üks tähtsamaid teemasid kogu kalandussektori jaoks. Õnnitlen raportööri Maria do Céu Patrão Nevesit tehtud töö eest, mille tulemusena on kõik erinevad seisukohad ühte järjekindlasse dokumenti kokku toodud. Ma olen igati nõus, et meie poliitika vajab selles esinevate struktuuriprobleemide lahendamiseks põhjalikku reformi. Nagu te kõik teate, ei olnud viimane reform 2002. aastal piisavalt edukas.Nüüd peame lahendama kõik minevikus tuvastatud kitsaskohad, et aidata saavutada keskkonna-, sotsiaalsest ja majandusliku aspektist lähtudes paremaid tulemusi. Avalik arutelu näitas selgesti, et reformil on laialdane toetus. Loomulikult ei saa ma vastata täna kõikidele küsimustele hääletamiseks esitatud raportis. Sellele vaatamata jätan ma meelde teie kompromissmuudatusettepanekud seoses jätkusuutlikkuse, ületootmise, väikesemahulise kalapüügi, horisontaalse detsentraliseerimise, saagi vette tagasi laskmise tava kaotamise, uute kalanduskokkulepete ja rakendamisega kalandussektoris. Olen teile konstruktiivsete ettepanekute pärast väga tänulik!Tahaksin rõhutada kahte spetsiifilist teemat. Esiteks riigi rahastamine. Minu arvates peame paremate tulemuste saavutamiseks suunama oma toetused oma poliitika eesmärkidele. Näiteks uute kalalaevade ehitamise toetamise asemel peaksime toetama uuendust seoses selektiivsuse ja keskkonnahoidlikkusega ning aitama tootjaorganisatsioonidel tuleviku väljakutseteks valmistuda.Teiseks jagan ma teie seisukohti seoses sotsiaalse mõõtmega: me tahame, et kalandussektor looks atraktiivseid ja turvalisi töökohti. Ootan väga nendel teemadel teie ettepanekuid.Tutvustan teile ka meie järgmisi samme. Komisjon koostab kokkuvõtva aruande möödunud aastal peetud arutelude kohta, mis aitab meil koostada ettepanekuid uue poliitika jaoks. Korraldame seminare, et arutleda sidusrühmadega, institutsioonidega ja liikmesriikidega kindlate teemade üle. Koos eesistujariigi Hispaaniaga peetakse mais ulatuslik konverents ühise kalanduspoliitika reformi teemal.Ma tean, ja seda mainiti ka eelnevas sõnavõtus, et just praegusel hetkel toimub komisjonis tehniline seminar, millest võtavad osa esindajad tervest Euroopast. Mul on kahju, et teie sellest seminarist osa võtta ei saa. Seminar korraldati juba mõnda aega tagasi. Edaspidi teen ma kõik, mis minu võimuses, et vältida kohtumiste aegade kattumist.Kogu selle sisendi alusel hakkame 2010. aasta lõpus töötama välja oma ettepanekuid, mille komisjon 2011. aasta kevadel vastu võtab. See suur arutelude protsess kulmineerub väga viljaka aruteluga siin Euroopa Parlamendis. Nii saate te kaasseadusandjatena mängida tähtsat rolli uue poliitika kujundamises koos komisjoniga. Ootan igati meie tulevast koostööd! ","Maria Damanaki,",7,371,not_available,"['est', 'est', 'est', 'est', 'est', 'est', 'est']","['  Maria Damanaki,  komisjoni liige. – Austatud juhataja! Kuna see on minu esimene sõnavõtt täiskogul volinikuna parlamendiliikmete ees, siis tahaksin ma esmalt tänada teid võimaluse eest siin sõna võtta! Mul on suur au olla siin teie ees ning arutleda ühise kalanduspoliitika reformi üle, mis on üks tähtsamaid teemasid kogu kalandussektori jaoks. Õnnitlen raportööri Maria do Céu Patrão Nevesit tehtud töö eest, mille tulemusena on kõik erinevad seisukohad ühte järjekindlasse dokumenti kokku toodud. Ma olen igati nõus, et meie poliitika vajab selles esinevate struktuuriprobleemide lahendamiseks põhjalikku reformi. Nagu te kõik teate, ei olnud viimane reform 2002. aastal piisavalt edukas.', 'Nüüd peame lahendama kõik minevikus tuvastatud kitsaskohad, et aidata saavutada keskkonna-, sotsiaalsest ja majandusliku aspektist lähtudes paremaid tulemusi. Avalik arutelu näitas selgesti, et reformil on laialdane toetus. Loomulikult ei saa ma vastata täna kõikidele küsimustele hääletamiseks esitatud raportis. Sellele vaatamata jätan ma meelde teie kompromissmuudatusettepanekud seoses jätkusuutlikkuse, ületootmise, väikesemahulise kalapüügi, horisontaalse detsentraliseerimise, saagi vette tagasi laskmise tava kaotamise, uute kalanduskokkulepete ja rakendamisega kalandussektoris. Olen teile konstruktiivsete ettepanekute pärast väga tänulik!', 'Tahaksin rõhutada kahte spetsiifilist teemat. Esiteks riigi rahastamine. Minu arvates peame paremate tulemuste saavutamiseks suunama oma toetused oma poliitika eesmärkidele. Näiteks uute kalalaevade ehitamise toetamise asemel peaksime toetama uuendust seoses selektiivsuse ja keskkonnahoidlikkusega ning aitama tootjaorganisatsioonidel tuleviku väljakutseteks valmistuda.', 'Teiseks jagan ma teie seisukohti seoses sotsiaalse mõõtmega: me tahame, et kalandussektor looks atraktiivseid ja turvalisi töökohti. Ootan väga nendel teemadel teie ettepanekuid.', 'Tutvustan teile ka meie järgmisi samme. Komisjon koostab kokkuvõtva aruande möödunud aastal peetud arutelude kohta, mis aitab meil koostada ettepanekuid uue poliitika jaoks. Korraldame seminare, et arutleda sidusrühmadega, institutsioonidega ja liikmesriikidega kindlate teemade üle. Koos eesistujariigi Hispaaniaga peetakse mais ulatuslik konverents ühise kalanduspoliitika reformi teemal.', 'Ma tean, ja seda mainiti ka eelnevas sõnavõtus, et just praegusel hetkel toimub komisjonis tehniline seminar, millest võtavad osa esindajad tervest Euroopast. Mul on kahju, et teie sellest seminarist osa võtta ei saa. Seminar korraldati juba mõnda aega tagasi. Edaspidi teen ma kõik, mis minu võimuses, et vältida kohtumiste aegade kattumist.', 'Kogu selle sisendi alusel hakkame 2010. aasta lõpus töötama välja oma ettepanekuid, mille komisjon 2011. aasta kevadel vastu võtab. See suur arutelude protsess kulmineerub väga viljaka aruteluga siin Euroopa Parlamendis. Nii saate te kaasseadusandjatena mängida tähtsat rolli uue poliitika kujundamises koos komisjoniga. Ootan igati meie tulevast koostööd! ']"
