,agenda_item,text,speaker,number_p,number_w,chair,language_ps,ps
40, 4. Roheline raamat ühise kalanduspoliitika reformi kohta (arutelu) ,"  Raül Romeva i Rueda  (Verts/ALE).   – (ES) Austatud juhataja! Ka mina tahan rõhutada punkte, mille kohta paljud meist arvavad, et need peaksid igal juhul lõplikus raportis, mille üle me hääletame, olemas olema.Need punktid on järgmised: ettevaatusprintsiip, mis on väga tähtis ja kindlasti vajalik; püügivõimsuse vähendamine, mida on kiireimas korras vaja; riigi toetuste poliitika piiramine ning viimaks kontrollmeetmete täiustamine ja range ning puhta südamega karistuse määramine seaduserikkujatele, kes käituvad valesti ning õhutavad ka teisi nii käituma. Samuti peame edendama jätkusuutliku varustuse kasutamist ja jätkusuutlikku kalapüüki, mis tähendab, et peame tegema edusamme seoses väikesemahulise kalapüügi määratlemisega, kuna see vajab kahtlemata selgemat defineerimist.Tahan veel rõhutada naiste rolli ning tunnustust, mida nad oma töö eest vajavad. Seoses selle aspektiga on esitatud ka mitu muudatusettepanekut.Viimaks tahan veel öelda, et minu arvates tuleb rõhutada ning nõuda suuremat sidusust ja vastutust kalanduskokkulepetes kolmandate riikidega. Seda nõuavad näiteks kokkulepped Maroko ja Guineaga. ",Raül Romeva i Rueda  (Verts/ALE).,4,147,not_available,"['spa', 'spa', 'spa', 'spa']","['  Raül Romeva i Rueda  (Verts/ALE).   – (ES) Austatud juhataja! Ka mina tahan rõhutada punkte, mille kohta paljud meist arvavad, et need peaksid igal juhul lõplikus raportis, mille üle me hääletame, olemas olema.', 'Need punktid on järgmised: ettevaatusprintsiip, mis on väga tähtis ja kindlasti vajalik; püügivõimsuse vähendamine, mida on kiireimas korras vaja; riigi toetuste poliitika piiramine ning viimaks kontrollmeetmete täiustamine ja range ning puhta südamega karistuse määramine seaduserikkujatele, kes käituvad valesti ning õhutavad ka teisi nii käituma. Samuti peame edendama jätkusuutliku varustuse kasutamist ja jätkusuutlikku kalapüüki, mis tähendab, et peame tegema edusamme seoses väikesemahulise kalapüügi määratlemisega, kuna see vajab kahtlemata selgemat defineerimist.', 'Tahan veel rõhutada naiste rolli ning tunnustust, mida nad oma töö eest vajavad. Seoses selle aspektiga on esitatud ka mitu muudatusettepanekut.', 'Viimaks tahan veel öelda, et minu arvates tuleb rõhutada ning nõuda suuremat sidusust ja vastutust kalanduskokkulepetes kolmandate riikidega. Seda nõuavad näiteks kokkulepped Maroko ja Guineaga. ']"
41, 4. Roheline raamat ühise kalanduspoliitika reformi kohta (arutelu) ,"  Werner Kuhn  (PPE).   – (DE) Austatud juhataja, head kolleegid! Kõigepealt soovin ma kõike head volinik Maria Damanakile! Ootame juba väga meie tulevast koostööd! Tahan tänada ka Maria do Céu Patrão Nevesit, kes tuli läbirääkimiste korraldamisega suurepäraselt toime!Kõige tähtsam on, et esindatud peavad olema ka väikese kalandussektoriga riigid. Juba mainiti, et Saksamaa jaoks mängib otsustavat rolli suhteline stabiilsus. Loomulikult oleme kõik veendunud selles, et kalavarude kaitsmine ja nende jätkusuutlikkuse tagamine on hädavajalik, et need jääksid püsima tasemele, millega oleks tagatud meie kalanduse olemaolu ka tulevikus. Sellegipoolest ei tohi me arutleda ainult keskkondlike ja majanduslike aspektide üle. Peame käsitlema ka mõnede liikide, nagu kormoranide ja hüljeste liigset kaitsmist, mida juba mainiti.Euroopa rannajoon on tuhandeid kilomeetreid pikk ning paljudes piirkondades on traditsiooniliselt levinud just väikesemahuline kalapüük, millest sõltub paljude sealsete perede elatis. Lisaks sellele mängib nendes piirkondades väga tähtsat rolli ka turism. Kõige sellega tuleb arvestada. Ma usun, et see roheline raamat on väga hea lahendus, mis võimaldab meil koos komisjoniga asjad kaugemale viia…(Istungi juhataja katkestas sõnavõtu) ",Werner Kuhn  (PPE).,4,166,not_available,"['ger', 'ger', 'ger', 'ger']","['  Werner Kuhn  (PPE).   – (DE) Austatud juhataja, head kolleegid! Kõigepealt soovin ma kõike head volinik Maria Damanakile! Ootame juba väga meie tulevast koostööd! Tahan tänada ka Maria do Céu Patrão Nevesit, kes tuli läbirääkimiste korraldamisega suurepäraselt toime!', 'Kõige tähtsam on, et esindatud peavad olema ka väikese kalandussektoriga riigid. Juba mainiti, et Saksamaa jaoks mängib otsustavat rolli suhteline stabiilsus. Loomulikult oleme kõik veendunud selles, et kalavarude kaitsmine ja nende jätkusuutlikkuse tagamine on hädavajalik, et need jääksid püsima tasemele, millega oleks tagatud meie kalanduse olemaolu ka tulevikus. Sellegipoolest ei tohi me arutleda ainult keskkondlike ja majanduslike aspektide üle. Peame käsitlema ka mõnede liikide, nagu kormoranide ja hüljeste liigset kaitsmist, mida juba mainiti.', 'Euroopa rannajoon on tuhandeid kilomeetreid pikk ning paljudes piirkondades on traditsiooniliselt levinud just väikesemahuline kalapüük, millest sõltub paljude sealsete perede elatis. Lisaks sellele mängib nendes piirkondades väga tähtsat rolli ka turism. Kõige sellega tuleb arvestada. Ma usun, et see roheline raamat on väga hea lahendus, mis võimaldab meil koos komisjoniga asjad kaugemale viia…', '(Istungi juhataja katkestas sõnavõtu) ']"
42, 4. Roheline raamat ühise kalanduspoliitika reformi kohta (arutelu) ,"  Czesław Adam Siekierski  (PPE).   – (PL) Ühine kalanduspoliitika peab sobitama ökoloogilised ja keskkondlikud eesmärgid püügimahtudega ning samuti kalandusega tegelevate perede tööhõive- ja elukvaliteedi küsimustega. Püügivõimsus tuleb kohandada ressursside tasemega, mis on määratletud vastavalt uusimatele teaduslikele järeldustele ja asjatundjate teadmistele. Jätkusuutlike püügikvootide kasutuselvõtmisega peab kaasnema toetuse andmine kalapüügiga tegelevatele kogukondadele eri valdkondades, nagu investeeringud, kaasajastamine ja sotsiaalsed küsimused, arvestades ka pikema perspektiiviga.Ühine kalanduspoliitika peab võtma arvesse ka eri piirkondade ja merede omapärasid. Seetõttu on vaja suurendada piirkondlike nõuandekomisjonide pädevusi, mis peavad tegema tihedat koostööd liikmesriikide kalandust haldavate asutustega ning Euroopa Komisjoniga. Viimaks on vaja tugevdada ka kalurite organiseeritust ning parandada ahelat kala püüdmisest kala müügini eesmärgiga tõsta kalatoodete standardeid ja kvaliteeti. ",Czesław Adam Siekierski  (PPE).,2,110,not_available,"['pol', 'pol']","['  Czesław Adam Siekierski  (PPE).   – (PL) Ühine kalanduspoliitika peab sobitama ökoloogilised ja keskkondlikud eesmärgid püügimahtudega ning samuti kalandusega tegelevate perede tööhõive- ja elukvaliteedi küsimustega. Püügivõimsus tuleb kohandada ressursside tasemega, mis on määratletud vastavalt uusimatele teaduslikele järeldustele ja asjatundjate teadmistele. Jätkusuutlike püügikvootide kasutuselvõtmisega peab kaasnema toetuse andmine kalapüügiga tegelevatele kogukondadele eri valdkondades, nagu investeeringud, kaasajastamine ja sotsiaalsed küsimused, arvestades ka pikema perspektiiviga.', 'Ühine kalanduspoliitika peab võtma arvesse ka eri piirkondade ja merede omapärasid. Seetõttu on vaja suurendada piirkondlike nõuandekomisjonide pädevusi, mis peavad tegema tihedat koostööd liikmesriikide kalandust haldavate asutustega ning Euroopa Komisjoniga. Viimaks on vaja tugevdada ka kalurite organiseeritust ning parandada ahelat kala püüdmisest kala müügini eesmärgiga tõsta kalatoodete standardeid ja kvaliteeti. ']"
43, 4. Roheline raamat ühise kalanduspoliitika reformi kohta (arutelu) ,"  Seán Kelly  (PPE).   – Austatud juhataja! Ligikaudu kuus kuud kestnud ametiaja jooksul Euroopa Parlamendi liikmena ei ole ma kohanud veel vihasemaid inimesi kui minu valimisringkonna kalurid.On selge, et nende jaoks ei ole ühine kalanduspoliitika toiminud. Seetõttu on eelseisev reform väga teretulnud. Ma arvan, et me kõik oleme nõus, et kalavarude kaitsmine on väga oluline, kuid peame kaitsma ka rannikukogukondi ning need kaks ei ole tingimata teineteist välistavad. Vajame häält, mis räägiks väikekalurite poolt.Nagu Andrew Henry William Brons mainis, tuleb võtta kasutusele ka uusi tehnoloogiaid, eriti tehnoloogiaid saagi vette tagasi laskmise probleemi lahendamiseks, mida ta samuti mainis. Sellega muudaksime väga palju.Viimaks tuleb käsitleda ka kogu teadusuuringute küsimust. Tendentsiks on võtta kõiki teadusuuringuid või teaduslikke tõendeid puhta kulla pähe. Nagu Alain Cadec ütles, peavad teaduslikud tõendid olema vaieldamatud, objektiivsed ja ajakohased. ",Seán Kelly  (PPE).,4,131,not_available,"['est', 'est', 'est', 'est']","['  Seán Kelly  (PPE).   – Austatud juhataja! Ligikaudu kuus kuud kestnud ametiaja jooksul Euroopa Parlamendi liikmena ei ole ma kohanud veel vihasemaid inimesi kui minu valimisringkonna kalurid.', 'On selge, et nende jaoks ei ole ühine kalanduspoliitika toiminud. Seetõttu on eelseisev reform väga teretulnud. Ma arvan, et me kõik oleme nõus, et kalavarude kaitsmine on väga oluline, kuid peame kaitsma ka rannikukogukondi ning need kaks ei ole tingimata teineteist välistavad. Vajame häält, mis räägiks väikekalurite poolt.', 'Nagu Andrew Henry William Brons mainis, tuleb võtta kasutusele ka uusi tehnoloogiaid, eriti tehnoloogiaid saagi vette tagasi laskmise probleemi lahendamiseks, mida ta samuti mainis. Sellega muudaksime väga palju.', 'Viimaks tuleb käsitleda ka kogu teadusuuringute küsimust. Tendentsiks on võtta kõiki teadusuuringuid või teaduslikke tõendeid puhta kulla pähe. Nagu Alain Cadec ütles, peavad teaduslikud tõendid olema vaieldamatud, objektiivsed ja ajakohased. ']"
44, 4. Roheline raamat ühise kalanduspoliitika reformi kohta (arutelu) ,"  Juan Carlos Martín Fragueiro,  nõukogu eesistuja. – (ES) Austatud juhataja! Tahan veel kord tänada Maria do Céu Patrão Nevesit tehtud töö eest!Seni nõukogus peetud arutelude kohta võin öelda, et ministrid on toetanud üksmeelselt reformi seoses eeskirjade lihtsustamisega, piirkondade rolli tähtsuse tõstmisega ning otsuste tegemise detsentraliseerimisega, välja arvatud seoses strateegiliste elementide ja põhimõtetega, ning nad on nõus, et kindlasti on vaja vähendada saagi vette tagasi laskmist, liigset püügivõimsust ja ülepüüki.Spetsiifilised punktid, seoses millega on seni üksmeel saavutatud, on järgmised: praegu kehtivate 12-meremiilise tsooni eeskirjade säilitamine; ressursside haldamine pikemas perspektiivis; kalandussektori asjatundjate suurem kaasamine; turustiimulid, nagu märgistamine ja sertifikaadid, kalurite üldise kasumimäära tõstmiseks; toetuste kasutamine vaid erimeetmetena liigse püügivõimsuse vähendamiseks; teadusuuringute tähtsus kalanduspoliitika seisukohalt; vesiviljeluse integreerimine; ühise kalanduspoliitika ja integreeritud merenduspoliitika suhe ning vajadus säilitada ja täiustada Euroopa Liidu tegevusi rahvusvahelisel tasandil.Praeguseks on aruteludes ilmnenud eri seisukohad seoses järgmiste aspektidega: suhteline stabiilsus, praegune kogupüügi ja kvootide süsteem ning ülekantavate püügikvootide kasutamine, püügikoormuse piiramise kasutamine haldusvahendina, meetodid saagi vette tagasi laskmise, liigse püügivõimsuse ja ülepüügi vähendamiseks, rahastamine ja selle jaotumine ning suurem toetus väikesemahulisele kalapüügile ja rannikukogukondadele.Nagu ma juba oma esialgses sõnavõtus ütlesin, ei ole nõukogu veel seisukohta võtnud ning ei kavatse teha ametlikku otsust enne järgmist aastat, kui komisjon on esitanud ametlikult oma õigusloomega seotud ettepanekud.Lõpuks tahan ma ka tervitada kalandussektori esindajaid, kes meil siin täna külas on. ","Juan Carlos Martín Fragueiro,",6,221,not_available,"['spa', 'spa', 'spa', 'spa', 'spa', 'spa']","['  Juan Carlos Martín Fragueiro,  nõukogu eesistuja. – (ES) Austatud juhataja! Tahan veel kord tänada Maria do Céu Patrão Nevesit tehtud töö eest!', 'Seni nõukogus peetud arutelude kohta võin öelda, et ministrid on toetanud üksmeelselt reformi seoses eeskirjade lihtsustamisega, piirkondade rolli tähtsuse tõstmisega ning otsuste tegemise detsentraliseerimisega, välja arvatud seoses strateegiliste elementide ja põhimõtetega, ning nad on nõus, et kindlasti on vaja vähendada saagi vette tagasi laskmist, liigset püügivõimsust ja ülepüüki.', 'Spetsiifilised punktid, seoses millega on seni üksmeel saavutatud, on järgmised: praegu kehtivate 12-meremiilise tsooni eeskirjade säilitamine; ressursside haldamine pikemas perspektiivis; kalandussektori asjatundjate suurem kaasamine; turustiimulid, nagu märgistamine ja sertifikaadid, kalurite üldise kasumimäära tõstmiseks; toetuste kasutamine vaid erimeetmetena liigse püügivõimsuse vähendamiseks; teadusuuringute tähtsus kalanduspoliitika seisukohalt; vesiviljeluse integreerimine; ühise kalanduspoliitika ja integreeritud merenduspoliitika suhe ning vajadus säilitada ja täiustada Euroopa Liidu tegevusi rahvusvahelisel tasandil.', 'Praeguseks on aruteludes ilmnenud eri seisukohad seoses järgmiste aspektidega: suhteline stabiilsus, praegune kogupüügi ja kvootide süsteem ning ülekantavate püügikvootide kasutamine, püügikoormuse piiramise kasutamine haldusvahendina, meetodid saagi vette tagasi laskmise, liigse püügivõimsuse ja ülepüügi vähendamiseks, rahastamine ja selle jaotumine ning suurem toetus väikesemahulisele kalapüügile ja rannikukogukondadele.', 'Nagu ma juba oma esialgses sõnavõtus ütlesin, ei ole nõukogu veel seisukohta võtnud ning ei kavatse teha ametlikku otsust enne järgmist aastat, kui komisjon on esitanud ametlikult oma õigusloomega seotud ettepanekud.', 'Lõpuks tahan ma ka tervitada kalandussektori esindajaid, kes meil siin täna külas on. ']"
45, 4. Roheline raamat ühise kalanduspoliitika reformi kohta (arutelu) ,"  Maria Damanaki,  komisjoni liige. – Austatud juhataja! Ma tänan kõiki parlamendiliikmeid nende panuse eest! Nii suur sõnavõttude arv on väga julgustav.Panin tähele, et kõige enam mainiti jätkusuutlikkust ning seega saabki jätkusuutlikkus üldise üksmeele aluseks ja raamistikuks. Ma ei saa vastata kõikidele esitatud küsimustele, aga tahaksin rõhutada mõningaid prioriteete.Üks prioriteet on väikesemahuline kalapüük ja rannapiirkonnad. Kinnitan, et ma võtan sellel teemal tehtud kommentaare väga tõsiselt. Tahan samuti kinnitada, et ma ei kavatse kehtestada rangeid meetmeid ja eeskirju seoses harrastuskalapüügiga.Teiseks prioriteediks on piirkondlikkus. Olen meelsasti valmis arutlema teiega üksikasjalikumalt selle põhimõtte rakendamise üle, sest sellel teemal on meil palju rääkida.Nagu ma aru sain, oli seoses ülekantavate kalapüügiõiguste teemaga seoses palju arutelusid ja argumente. Ma ei tea, kuidas hääletamine läheb, kuid me ei saa probleemi tähelepanuta jätta. Mitmed liikmesriigid on seda süsteemi juba rakendamas. Minu ettepanek on korraldada konkreetne selleteemaline arutelu näiteks kalanduskomisjonis. Ülekantavate kalapüügiõigustega seotud läbirääkimised ei ole veel lõppenud ning seetõttu saame pidada sellel teemal korraliku arutelu – ma näen, et Carmen Fraga Estévez on siin – saame korraldada hea arutelu, et kogu probleem endale selgeks teha.Mainin veel mõningaid prioriteete: võrdsed võimalused Vahemeres ja muudes piirkondades seoses teiste riikide kaluritega – jah, see on õige, peame seda tegema, et kindlustada meie kaluritele aus konkurents. Lisaks veel saagi vette tagasi laskmise lõpetamine ja märgistamine.Need on meie prioriteedid. Kokkuvõtteks tahan veel rõhutada, et vajame uut kalanduskokkulepete vormi ning selle juurde kuulub ka inimõiguste klausel. Tänan teid kommentaaride eest! Minu arvates ei ole dialoog kaugeltki veel lõppenud. Sellega algab meie suurepärane arutelu. ","Maria Damanaki,",7,250,not_available,"['est', 'est', 'est', 'est', 'est', 'est', 'est']","['  Maria Damanaki,  komisjoni liige. – Austatud juhataja! Ma tänan kõiki parlamendiliikmeid nende panuse eest! Nii suur sõnavõttude arv on väga julgustav.', 'Panin tähele, et kõige enam mainiti jätkusuutlikkust ning seega saabki jätkusuutlikkus üldise üksmeele aluseks ja raamistikuks. Ma ei saa vastata kõikidele esitatud küsimustele, aga tahaksin rõhutada mõningaid prioriteete.', 'Üks prioriteet on väikesemahuline kalapüük ja rannapiirkonnad. Kinnitan, et ma võtan sellel teemal tehtud kommentaare väga tõsiselt. Tahan samuti kinnitada, et ma ei kavatse kehtestada rangeid meetmeid ja eeskirju seoses harrastuskalapüügiga.', 'Teiseks prioriteediks on piirkondlikkus. Olen meelsasti valmis arutlema teiega üksikasjalikumalt selle põhimõtte rakendamise üle, sest sellel teemal on meil palju rääkida.', 'Nagu ma aru sain, oli seoses ülekantavate kalapüügiõiguste teemaga seoses palju arutelusid ja argumente. Ma ei tea, kuidas hääletamine läheb, kuid me ei saa probleemi tähelepanuta jätta. Mitmed liikmesriigid on seda süsteemi juba rakendamas. Minu ettepanek on korraldada konkreetne selleteemaline arutelu näiteks kalanduskomisjonis. Ülekantavate kalapüügiõigustega seotud läbirääkimised ei ole veel lõppenud ning seetõttu saame pidada sellel teemal korraliku arutelu – ma näen, et Carmen Fraga Estévez on siin – saame korraldada hea arutelu, et kogu probleem endale selgeks teha.', 'Mainin veel mõningaid prioriteete: võrdsed võimalused Vahemeres ja muudes piirkondades seoses teiste riikide kaluritega – jah, see on õige, peame seda tegema, et kindlustada meie kaluritele aus konkurents. Lisaks veel saagi vette tagasi laskmise lõpetamine ja märgistamine.', 'Need on meie prioriteedid. Kokkuvõtteks tahan veel rõhutada, et vajame uut kalanduskokkulepete vormi ning selle juurde kuulub ka inimõiguste klausel. Tänan teid kommentaaride eest! Minu arvates ei ole dialoog kaugeltki veel lõppenud. Sellega algab meie suurepärane arutelu. ']"
46, 4. Roheline raamat ühise kalanduspoliitika reformi kohta (arutelu) ,"  Maria do Céu Patrão Neves,  raportöör. – (PT) Tänan kõiki kohalviibijaid ja ka kõiki neid, kes kõne all olevat protsessi ikka jätkuvalt toetavad! See protsess kestab ikka veel ja nagu lugupeetud volinik äsja ütles, peame oma jõupingutusi jätkama, kui me oma eesmärgid saavutada tahame.Olen aus ja tunnistan, et võimatu on koostada raportit, millega kõik rahule jäävad. Paljud ütlevad, et raport ei läinud seoses teatud aspektidega piisavalt kaugele, kuid teised ütlevad jälle, et see on seoses teiste, või isegi samade, aspektidega liiga kaugele läinud. Ma arvan, et hetkel on kõige tähtsam rõhutada, et suutsin kõne all oleva raportiga luua kõige tähtsamate probleemide vahel hea tasakaalu ja ulatusliku üksmeele ning et üldiselt on raportiga loodud võimalused ja potentsiaal andmaks piisavat vastust kalandussektori vajadustele, et mitte öelda nõudmistele.Nõnda nagu me Carmen Fraga Estévezi eesistumise all kalanduskomisjonis töötasime, nii loodan ma, et me saame ka nüüd selle tööga samas komisjonis jätkata, kuid nüüd juba laiemas ulatuses koos nõukogu ja Euroopa Komisjoniga, et teha sama intensiivset tööd seoses õigusloomega seotud ettepanekutega.Olen veendunud, et kui jätkame töötamist sellises meeskonnavaimus ja kindla arusaamisega, et peame arvestama kõikide probleemidega, mis suure Euroopa Liidu eri piirkondades olulised on, ja et kui me üritame vastata tõhusalt kõikidele kalandussektori vajadustele meie suures majandusvööndis, siis teeme selle sektori heaks väga head tööd. Seda silmas pidades pühendume vajalike tingimuste loomisele selleks, et kalandussektor muutuks põhimõtteliselt jätkusuutlikuks ning saaks areneda pikemas perspektiivis. ","Maria do Céu Patrão Neves,",4,230,not_available,"['por', 'por', 'por', 'por']","['  Maria do Céu Patrão Neves,  raportöör. – (PT) Tänan kõiki kohalviibijaid ja ka kõiki neid, kes kõne all olevat protsessi ikka jätkuvalt toetavad! See protsess kestab ikka veel ja nagu lugupeetud volinik äsja ütles, peame oma jõupingutusi jätkama, kui me oma eesmärgid saavutada tahame.', 'Olen aus ja tunnistan, et võimatu on koostada raportit, millega kõik rahule jäävad. Paljud ütlevad, et raport ei läinud seoses teatud aspektidega piisavalt kaugele, kuid teised ütlevad jälle, et see on seoses teiste, või isegi samade, aspektidega liiga kaugele läinud. Ma arvan, et hetkel on kõige tähtsam rõhutada, et suutsin kõne all oleva raportiga luua kõige tähtsamate probleemide vahel hea tasakaalu ja ulatusliku üksmeele ning et üldiselt on raportiga loodud võimalused ja potentsiaal andmaks piisavat vastust kalandussektori vajadustele, et mitte öelda nõudmistele.', 'Nõnda nagu me Carmen Fraga Estévezi eesistumise all kalanduskomisjonis töötasime, nii loodan ma, et me saame ka nüüd selle tööga samas komisjonis jätkata, kuid nüüd juba laiemas ulatuses koos nõukogu ja Euroopa Komisjoniga, et teha sama intensiivset tööd seoses õigusloomega seotud ettepanekutega.', 'Olen veendunud, et kui jätkame töötamist sellises meeskonnavaimus ja kindla arusaamisega, et peame arvestama kõikide probleemidega, mis suure Euroopa Liidu eri piirkondades olulised on, ja et kui me üritame vastata tõhusalt kõikidele kalandussektori vajadustele meie suures majandusvööndis, siis teeme selle sektori heaks väga head tööd. Seda silmas pidades pühendume vajalike tingimuste loomisele selleks, et kalandussektor muutuks põhimõtteliselt jätkusuutlikuks ning saaks areneda pikemas perspektiivis. ']"
47, 4. Roheline raamat ühise kalanduspoliitika reformi kohta (arutelu) ,  Juhataja.   – Arutelu on lõppenud.Hääletamine toimub täna kell 11.30.Kirjalikud avaldused (kodukorra artikkel 149) ,Juhataja.,3,15,not_available,"['est', 'est', 'est']","['  Juhataja.   – Arutelu on lõppenud.', 'Hääletamine toimub täna kell 11.30.', 'Kirjalikud avaldused (kodukorra artikkel 149) ']"
48, 4. Roheline raamat ühise kalanduspoliitika reformi kohta (arutelu) ,"  Vito Bonsignore  (PPE),  kirjalikult. – (IT) Kõigepealt õnnitleme raportööri Maria do Céu Patrão Nevesit suurepärase töö eest, mida ta seni teinud on, ning samuti hääletuse positiivse tulemuse eest!Loodame, et roheline raamat, mis peagi meie komisjoni jõuab, on eelmänguks valge raamatu peatsele täiskogu istungile jõudmisele. Euroopa on alati kalandussektorist huvitatud olnud. Usume siiski, et peame investeerima veel rohkem teadusuuringutesse, eriti kalandussektoris, kaasa arvatud ka järgmises raamprogrammis. Usume ka, et kalandussektoris tuleb kvootide süsteemi paindlikkuse suurendamise ning kontrollimise ja kalavarudega seotud suurema vastutuse kaudu parandada teadlikkust eeskirjadest.Tahame lisaks kolmandate riikidega tugevamaid partnerlussuhteid, et võidelda seadusevastase kalapüügiga, ning paremat koostööd Vahemere piirkonna riikidega, et reguleerida otsustavalt kalandust sellistes piirkondades nagu Vahemeri, mis on olnud alati erinevate tsivilisatsioonid ja kultuuride häll.Viimaks ütlen, et oleme nõus uuendamist käsitlevate sätetega lõikes 23, eelkõige väikesemahuliste laevastike osas, kuid me tahaksime seoses sellega saada siiski rohkem andmeid. Mis puudutab lõikeid 62 ja 63, mis käsitlevad kalandussektori kutseõpet, siis tahaksime me ka siin saada selgitusi, eelkõige väikesemahulise kalapüügi puhul, mis laevastike haldamise eeskirjade rangemaks muutmise korral kõige enam kannataks. ","Vito Bonsignore  (PPE),",4,172,not_available,"['ita', 'ita', 'ita', 'ita']","['  Vito Bonsignore  (PPE),  kirjalikult. – (IT) Kõigepealt õnnitleme raportööri Maria do Céu Patrão Nevesit suurepärase töö eest, mida ta seni teinud on, ning samuti hääletuse positiivse tulemuse eest!', 'Loodame, et roheline raamat, mis peagi meie komisjoni jõuab, on eelmänguks valge raamatu peatsele täiskogu istungile jõudmisele. Euroopa on alati kalandussektorist huvitatud olnud. Usume siiski, et peame investeerima veel rohkem teadusuuringutesse, eriti kalandussektoris, kaasa arvatud ka järgmises raamprogrammis. Usume ka, et kalandussektoris tuleb kvootide süsteemi paindlikkuse suurendamise ning kontrollimise ja kalavarudega seotud suurema vastutuse kaudu parandada teadlikkust eeskirjadest.', 'Tahame lisaks kolmandate riikidega tugevamaid partnerlussuhteid, et võidelda seadusevastase kalapüügiga, ning paremat koostööd Vahemere piirkonna riikidega, et reguleerida otsustavalt kalandust sellistes piirkondades nagu Vahemeri, mis on olnud alati erinevate tsivilisatsioonid ja kultuuride häll.', 'Viimaks ütlen, et oleme nõus uuendamist käsitlevate sätetega lõikes 23, eelkõige väikesemahuliste laevastike osas, kuid me tahaksime seoses sellega saada siiski rohkem andmeid. Mis puudutab lõikeid 62 ja 63, mis käsitlevad kalandussektori kutseõpet, siis tahaksime me ka siin saada selgitusi, eelkõige väikesemahulise kalapüügi puhul, mis laevastike haldamise eeskirjade rangemaks muutmise korral kõige enam kannataks. ']"
