,agenda_item,text,speaker,number_p,number_w,chair,language_ps,ps
0, 1. Apertura de la sesión,PRESIDE: Alejo VIDAL-QUADRAS Vicepresidente,PRESIDE: Alejo VIDAL-QUADRAS,1,5,not_available,['spa'],['PRESIDE: Alejo VIDAL-QUADRAS Vicepresidente']
1, 6. Programa de cooperación audiovisual con profesionales de terceros países MEDIA Mundus (debate) ,"  Presidente. -   El primer punto del orden del día es el informe de Ruth Hieronymi, en nombre de Comisión de Cultura y Educación, sobre la propuesta de Decisión del Parlamento Europeo y del Consejo por la que se establece un programa de cooperación audiovisual con profesionales de terceros países MEDIA Mundus (COM(2008)0892 - C6-0011/2009 - 2008/0258(COD)) (A6-0260/2009).  ",Presidente. -,1,62,not_available,['spa'],"['  Presidente. -   El primer punto del orden del día es el informe de Ruth Hieronymi, en nombre de Comisión de Cultura y Educación, sobre la propuesta de Decisión del Parlamento Europeo y del Consejo por la que se establece un programa de cooperación audiovisual con profesionales de terceros países MEDIA Mundus (COM(2008)0892 - C6-0011/2009 - 2008/0258(COD)) (A6-0260/2009).  ']"
2, 6. Programa de cooperación audiovisual con profesionales de terceros países MEDIA Mundus (debate) ,"  Ruth Hieronymi,  ponente. − (DE) Señor Presidente, señora Comisaria, Señorías, me complace especialmente que hayamos logrado redactar y adoptar un nuevo programa de apoyo para películas europeas y para la cultura y economía de la Unión Europea y del mundo en un breve espacio de tiempo –únicamente seis meses– y antes de que termine esta legislatura.Esto sólo ha sido posible porque se ha producido una cooperación excepcionalmente buena, por la que me gustaría expresar mi más sincero agradecimiento. Muchas gracias, Comisaria. La propuesta de la Comisión sobre el establecimiento del programa MEDIA Mundus fue una propuesta excelente. Existió una excelente cooperación con la Presidencia checa y en la Comisión de Cultura y Educación la cooperación fue insuperable. Sólo así fue posible lograr este objetivo en tan poco tiempo.La promoción de las películas europeas a través del programa MEDIA ha tenido mucho éxito en la Unión Europea durante unos quince años. El 90 % de las películas europeas proyectadas fuera de su país de origen se promocionan mediante el programa MEDIA. Sin embargo, hasta ahora el programa sólo promovía proyectos en Europa y este programa de promoción ya no es adecuado en un momento de globalización de los mercados y de nuevas tecnologías.Aparecen nuevas oportunidades, pero también nuevos desafíos. El programa MEDIA Mundus que debatimos hoy es una respuesta fantástica. Es una respuesta a las oportunidades ofrecidas a la industria cinematográfica europea por parte de los nuevos mercados fuera de Europa. También es una respuesta a la necesidad y a las oportunidades de usar la promoción de películas y las propias películas para apoyar y fomentar el diálogo intercultural.Por ello, me gustaría expresar mi agradecimiento a la puesta en marcha de los proyectos pilotos de MEDIA Mundus. Se dispuso de 7 millones de euros. Quedó claro que había una gran demanda. Se apoyó la formación, el marketing y la distribución en redes globales a través de los proyectos pilotos y, en concreto, los mercados audiovisuales emergentes del mundo –la India, Brasil, Corea del Sur, Canadá– presentaron proyectos extraordinarios.A este respecto, con el voto de la Comisión de Cultura y Educación estamos encantados de votar a favor de la propuesta. Me gustaría pedir a todo el Parlamento que vote «sí» para apoyar este programa durante los próximos años con una cantidad apropiada de fondos que permitan lograr el objetivo de apoyar la promoción de películas europeas como embajadoras de nuestros valores culturales.Éste es mi último discurso en el Parlamento Europeo. Me siento muy afortunada por haber podido completar el programa con su apoyo y me gustaría transmitir mi propio mensaje. Cuando se trate de trabajos futuros, por favor recuerden que los bienes culturales de Europa no deben ser simplemente bienes económicos, sino que deben seguir siendo bienes culturales y económicos.Me gustaría dar las gracias especialmente a mis colegas de la Comisión de Cultura y Educación, de las secretarías y a usted, Comisaria, y a su Director General al mando, Gregory Paulger, por los diez años de excelente cooperación en el campo audiovisual. Muchas gracias. ","Ruth Hieronymi,",8,507,not_available,"['ger', 'ger', 'ger', 'ger', 'ger', 'ger', 'ger', 'ger']","['  Ruth Hieronymi,  ponente. − (DE) Señor Presidente, señora Comisaria, Señorías, me complace especialmente que hayamos logrado redactar y adoptar un nuevo programa de apoyo para películas europeas y para la cultura y economía de la Unión Europea y del mundo en un breve espacio de tiempo –únicamente seis meses– y antes de que termine esta legislatura.', 'Esto sólo ha sido posible porque se ha producido una cooperación excepcionalmente buena, por la que me gustaría expresar mi más sincero agradecimiento. Muchas gracias, Comisaria. La propuesta de la Comisión sobre el establecimiento del programa MEDIA Mundus fue una propuesta excelente. Existió una excelente cooperación con la Presidencia checa y en la Comisión de Cultura y Educación la cooperación fue insuperable. Sólo así fue posible lograr este objetivo en tan poco tiempo.', 'La promoción de las películas europeas a través del programa MEDIA ha tenido mucho éxito en la Unión Europea durante unos quince años. El 90 % de las películas europeas proyectadas fuera de su país de origen se promocionan mediante el programa MEDIA. Sin embargo, hasta ahora el programa sólo promovía proyectos en Europa y este programa de promoción ya no es adecuado en un momento de globalización de los mercados y de nuevas tecnologías.', 'Aparecen nuevas oportunidades, pero también nuevos desafíos. El programa MEDIA Mundus que debatimos hoy es una respuesta fantástica. Es una respuesta a las oportunidades ofrecidas a la industria cinematográfica europea por parte de los nuevos mercados fuera de Europa. También es una respuesta a la necesidad y a las oportunidades de usar la promoción de películas y las propias películas para apoyar y fomentar el diálogo intercultural.', 'Por ello, me gustaría expresar mi agradecimiento a la puesta en marcha de los proyectos pilotos de MEDIA Mundus. Se dispuso de 7 millones de euros. Quedó claro que había una gran demanda. Se apoyó la formación, el marketing y la distribución en redes globales a través de los proyectos pilotos y, en concreto, los mercados audiovisuales emergentes del mundo –la India, Brasil, Corea del Sur, Canadá– presentaron proyectos extraordinarios.', 'A este respecto, con el voto de la Comisión de Cultura y Educación estamos encantados de votar a favor de la propuesta. Me gustaría pedir a todo el Parlamento que vote «sí» para apoyar este programa durante los próximos años con una cantidad apropiada de fondos que permitan lograr el objetivo de apoyar la promoción de películas europeas como embajadoras de nuestros valores culturales.', 'Éste es mi último discurso en el Parlamento Europeo. Me siento muy afortunada por haber podido completar el programa con su apoyo y me gustaría transmitir mi propio mensaje. Cuando se trate de trabajos futuros, por favor recuerden que los bienes culturales de Europa no deben ser simplemente bienes económicos, sino que deben seguir siendo bienes culturales y económicos.', 'Me gustaría dar las gracias especialmente a mis colegas de la Comisión de Cultura y Educación, de las secretarías y a usted, Comisaria, y a su Director General al mando, Gregory Paulger, por los diez años de excelente cooperación en el campo audiovisual. Muchas gracias. ']"
3, 6. Programa de cooperación audiovisual con profesionales de terceros países MEDIA Mundus (debate) ,"  Viviane Reding,  Miembro de la Comisión. − Señor Presidente, no podría estar más de acuerdo con lo que la señora Hieronymi ha dicho, y estos diez años de trabajo conjunto con ella y con otros miembros de la Comisión de Cultura y Educación han sido muy eficientes y, desde un punto de vista personal, muy enriquecedores. Por ello, gracias a todos, independientemente del partido al que pertenezcan, los que han trabajado realmente para que la cultura se convierta en algo importante y pueda hablar a las personas.Estoy muy contenta de que el Parlamento haya realizado algunas propuestas sobre este informe, que son aclaraciones y simplificaciones, que han mejorado la propuesta que yo había puesto sobre la mesa.Como saben, la acción preparatoria MEDIA Internacional ha sido la base para desarrollar MEDIA Mundus y, en este contexto, también agradezco que el Parlamento me concediese 2 millones de euros en 2008 y 5 millones de euros en 2009 para financiar la acción preparatoria.MEDIA Mundus empezará en 2011 y será la continuación de MEDIA Internacional. Su objetivo es reforzar las relaciones culturales y comerciales entre los profesionales de la industria cinematográfica europea y los del resto del mundo. El concepto de MEDIA Mundus es nuevo, ambicioso e innovador, ya que promueve la cooperación entre profesionales, algo que sucede normalmente en los programas europeos y, al contrario que en los programas ya existentes, también se basa en el beneficio mutuo, no sólo para nuestros realizadores sino además para los realizadores de terceros países, en diferentes campos. El primero de ellos es la formación, que incluye a alumnos y formadores europeos y de terceros países. Mejorará el acceso a los mercados de terceros países y creará confianza y relaciones comerciales a largo plazo: esto es normal. Cuando uno se ha sentado en los cursos de formación de la industria del cine con alguien de Asia, alguien de África o de América, está claro que, más adelante en su vida profesional, surge el impulso de trabajar juntos.Por eso también apoyamos la organización de foros para poner en marcha coproducciones internacionales. Los formamos juntos y, posteriormente, esperamos que esos profesionales empiecen a trabajar juntos. Por tanto, necesitamos los foros para poner en marcha coproducciones internacionales.A continuación, tenemos que mejorar la distribución, la circulación y la visibilidad de las artes audiovisuales europeas en terceros países. Ésa es una situación que siempre favorece a las personas de terceros países que viven en Europa. Éste es un buen ejemplo de una Europa que no es una Europa fortaleza sino una Europa abierta, una Europa que da, que toma, que comparte.Tenemos que mejorar la demanda pública de contenidos audiovisuales diversos desde el punto de vista cultural, para conseguir que los jóvenes, el público joven sobre todo, vean películas europeas.Tengo plena confianza en que MEDIA Mundus aumentará las opciones de los consumidores, de forma que la gente pueda ver películas europeas. Aportará diversidad cultural a los mercados europeos al traer más películas de calidad de los mercados más pequeños de fuera de Europa a Europa y ofrecerá una oportunidad a las películas europeas en el mercado internacional. Por tanto, creará nuevas oportunidades de negocio para los profesionales de Europa y del mundo. Por supuesto, ésta es una contribución económica muy importante. Es una cuestión de competitividad, pero sobre todo es una cuestión de diversidad cultural –nuestra diversidad cultural–, que es nuestro bien más preciado, y de la diversidad cultural de aquellos que viven en otros continentes, que es su bien más especial. Compartir esos bienes supone una maravillosa oportunidad y será posible gracias a MEDIA Mundus. ","Viviane Reding,",8,599,not_available,"['spa', 'spa', 'spa', 'spa', 'spa', 'spa', 'spa', 'spa']","['  Viviane Reding,  Miembro de la Comisión. − Señor Presidente, no podría estar más de acuerdo con lo que la señora Hieronymi ha dicho, y estos diez años de trabajo conjunto con ella y con otros miembros de la Comisión de Cultura y Educación han sido muy eficientes y, desde un punto de vista personal, muy enriquecedores. Por ello, gracias a todos, independientemente del partido al que pertenezcan, los que han trabajado realmente para que la cultura se convierta en algo importante y pueda hablar a las personas.', 'Estoy muy contenta de que el Parlamento haya realizado algunas propuestas sobre este informe, que son aclaraciones y simplificaciones, que han mejorado la propuesta que yo había puesto sobre la mesa.', 'Como saben, la acción preparatoria MEDIA Internacional ha sido la base para desarrollar MEDIA Mundus y, en este contexto, también agradezco que el Parlamento me concediese 2 millones de euros en 2008 y 5 millones de euros en 2009 para financiar la acción preparatoria.', 'MEDIA Mundus empezará en 2011 y será la continuación de MEDIA Internacional. Su objetivo es reforzar las relaciones culturales y comerciales entre los profesionales de la industria cinematográfica europea y los del resto del mundo. El concepto de MEDIA Mundus es nuevo, ambicioso e innovador, ya que promueve la cooperación entre profesionales, algo que sucede normalmente en los programas europeos y, al contrario que en los programas ya existentes, también se basa en el beneficio mutuo, no sólo para nuestros realizadores sino además para los realizadores de terceros países, en diferentes campos. El primero de ellos es la formación, que incluye a alumnos y formadores europeos y de terceros países. Mejorará el acceso a los mercados de terceros países y creará confianza y relaciones comerciales a largo plazo: esto es normal. Cuando uno se ha sentado en los cursos de formación de la industria del cine con alguien de Asia, alguien de África o de América, está claro que, más adelante en su vida profesional, surge el impulso de trabajar juntos.', 'Por eso también apoyamos la organización de foros para poner en marcha coproducciones internacionales. Los formamos juntos y, posteriormente, esperamos que esos profesionales empiecen a trabajar juntos. Por tanto, necesitamos los foros para poner en marcha coproducciones internacionales.', 'A continuación, tenemos que mejorar la distribución, la circulación y la visibilidad de las artes audiovisuales europeas en terceros países. Ésa es una situación que siempre favorece a las personas de terceros países que viven en Europa. Éste es un buen ejemplo de una Europa que no es una Europa fortaleza sino una Europa abierta, una Europa que da, que toma, que comparte.', 'Tenemos que mejorar la demanda pública de contenidos audiovisuales diversos desde el punto de vista cultural, para conseguir que los jóvenes, el público joven sobre todo, vean películas europeas.', 'Tengo plena confianza en que MEDIA Mundus aumentará las opciones de los consumidores, de forma que la gente pueda ver películas europeas. Aportará diversidad cultural a los mercados europeos al traer más películas de calidad de los mercados más pequeños de fuera de Europa a Europa y ofrecerá una oportunidad a las películas europeas en el mercado internacional. Por tanto, creará nuevas oportunidades de negocio para los profesionales de Europa y del mundo. Por supuesto, ésta es una contribución económica muy importante. Es una cuestión de competitividad, pero sobre todo es una cuestión de diversidad cultural –nuestra diversidad cultural–, que es nuestro bien más preciado, y de la diversidad cultural de aquellos que viven en otros continentes, que es su bien más especial. Compartir esos bienes supone una maravillosa oportunidad y será posible gracias a MEDIA Mundus. ']"
4, 6. Programa de cooperación audiovisual con profesionales de terceros países MEDIA Mundus (debate) ,"  Doris Pack,  en nombre del Grupo del PPE-DE. – (DE) Señor Presidente, señora Comisaria, señora Hieronymi, el programa MEDIA Mundus es un proyecto que se basa en una idea original de nuestra Comisión, la Comisión de Cultura y Educación. Fue ahí donde vio la luz, por decirlo de alguna manera. Ante todo, le ofrecimos nuestro decidido respaldo y lleva, por supuesto, el sello no sólo de la Comisaria sino también de la señora Hieronymi, a quienes todos los miembros de la Comisión de Cultura y Educación estuvimos encantados de apoyar.Hemos aprendido muchísimo del proyecto Erasmus Mundus, que abrió las puertas a nuestros estudiantes que deseaban ir a terceros países y viceversa. En el contexto de la globalización, esto es necesario en realidad y MEDIA Mundus camina en la misma dirección en lo que se refiere a los realizadores. Es un maravilloso ejemplo de cómo se puede organizar un diálogo intercultural en este campo, que, por supuesto, tiene un aspecto comercial, aunque también, y ante todo, supone un diálogo cultural.MEDIA Mundus también apoyará y pondrá en marcha la Convención de la UNESCO que promueve la diversidad cultural en Europa y por todo el mundo, estableciendo el diálogo y marcando un equilibrio entre los intereses económicos.Con MEDIA Mundus, por supuesto, reforzamos la movilidad de nuestras películas, realizadores y estudiantes y, al final, sucede lo que Wim Wenders nos repite una y otra vez, a saber, le damos a Europa una nueva cara, hacemos realidad el sueño europeo. Se nos ha transmitido el sueño americano a través de las películas durante décadas y todavía ocurre en la actualidad. Si finalmente conseguimos llevar el sueño europeo al mundo en cooperación con terceros países, a través de imágenes, habremos hecho mucho más por estabilizar la Unión Europea de lo que habríamos conseguido por muchos otros medios.Si trabajamos juntos en el mundo globalizado actual, seremos capaces de hacer retroceder en cierta medida a los estadounidenses en el mercado mundial y describiremos nuestro sueño un poco mejor. Estoy segura de que contaremos con el apoyo de terceros países, quizás Corea del Sur o países de Sudamérica, a los que de hecho queremos ayudar haciendo que sus producciones a pequeña escala resulten más visibles en el mercado europeo.A fin de cuentas, éste es un proyecto que ayuda a ambas partes. Ayuda a los terceros países y a la industria cinematográfica europea. Ya era hora de que ocurriera esto. MEDIA Mundus es, en mi opinión, la respuesta apropiada a los desafíos globales técnicos y socio-económicos. Me gustaría acabar diciendo: «Aquello que refuerce nuestra diversidad, reforzará nuestra identidad». ","Doris Pack,",6,434,not_available,"['ger', 'ger', 'ger', 'ger', 'ger', 'ger']","['  Doris Pack,  en nombre del Grupo del PPE-DE. – (DE) Señor Presidente, señora Comisaria, señora Hieronymi, el programa MEDIA Mundus es un proyecto que se basa en una idea original de nuestra Comisión, la Comisión de Cultura y Educación. Fue ahí donde vio la luz, por decirlo de alguna manera. Ante todo, le ofrecimos nuestro decidido respaldo y lleva, por supuesto, el sello no sólo de la Comisaria sino también de la señora Hieronymi, a quienes todos los miembros de la Comisión de Cultura y Educación estuvimos encantados de apoyar.', 'Hemos aprendido muchísimo del proyecto Erasmus Mundus, que abrió las puertas a nuestros estudiantes que deseaban ir a terceros países y viceversa. En el contexto de la globalización, esto es necesario en realidad y MEDIA Mundus camina en la misma dirección en lo que se refiere a los realizadores. Es un maravilloso ejemplo de cómo se puede organizar un diálogo intercultural en este campo, que, por supuesto, tiene un aspecto comercial, aunque también, y ante todo, supone un diálogo cultural.', 'MEDIA Mundus también apoyará y pondrá en marcha la Convención de la UNESCO que promueve la diversidad cultural en Europa y por todo el mundo, estableciendo el diálogo y marcando un equilibrio entre los intereses económicos.', 'Con MEDIA Mundus, por supuesto, reforzamos la movilidad de nuestras películas, realizadores y estudiantes y, al final, sucede lo que Wim Wenders nos repite una y otra vez, a saber, le damos a Europa una nueva cara, hacemos realidad el sueño europeo. Se nos ha transmitido el sueño americano a través de las películas durante décadas y todavía ocurre en la actualidad. Si finalmente conseguimos llevar el sueño europeo al mundo en cooperación con terceros países, a través de imágenes, habremos hecho mucho más por estabilizar la Unión Europea de lo que habríamos conseguido por muchos otros medios.', 'Si trabajamos juntos en el mundo globalizado actual, seremos capaces de hacer retroceder en cierta medida a los estadounidenses en el mercado mundial y describiremos nuestro sueño un poco mejor. Estoy segura de que contaremos con el apoyo de terceros países, quizás Corea del Sur o países de Sudamérica, a los que de hecho queremos ayudar haciendo que sus producciones a pequeña escala resulten más visibles en el mercado europeo.', 'A fin de cuentas, éste es un proyecto que ayuda a ambas partes. Ayuda a los terceros países y a la industria cinematográfica europea. Ya era hora de que ocurriera esto. MEDIA Mundus es, en mi opinión, la respuesta apropiada a los desafíos globales técnicos y socio-económicos. Me gustaría acabar diciendo: «Aquello que refuerce nuestra diversidad, reforzará nuestra identidad». ']"
