,agenda_item,text,speaker,number_p,number_w,chair,language_ps,ps
159, 10. Explicaciones de voto,"  Philip Bradbourn  (PPE-DE),  por escrito. − Los conservadores británicos creen que, aunque la cooperación transfronteriza en la justicia penal es importante, el informe pretende crear un espacio legal común a escala de la UE, lo que comprometería notablemente las tradiciones de aquellos países que basan su sistema legal en el derecho consuetudinario. Por tanto, no podemos apoyar esta propuesta. ","Philip Bradbourn  (PPE-DE),",1,59,not_available,['spa'],"['  Philip Bradbourn  (PPE-DE),  por escrito. − Los conservadores británicos creen que, aunque la cooperación transfronteriza en la justicia penal es importante, el informe pretende crear un espacio legal común a escala de la UE, lo que comprometería notablemente las tradiciones de aquellos países que basan su sistema legal en el derecho consuetudinario. Por tanto, no podemos apoyar esta propuesta. ']"
160, 10. Explicaciones de voto,"  Martin Callanan  (PPE-DE),  por escrito. − La justicia penal es con toda razón responsabilidad de los Estados miembros de la UE. Puedo aceptar que los Estados miembros tengan que cooperar en asuntos transnacionales relacionados con la justicia penal, pero no acepto que se cree un espacio penal en la UE. Ampliar la denominada «competencia» de la UE a la justicia penal sería una intrusión injustificada e inaceptable en la soberanía británica. La gente de mi región del noreste de Inglaterra quiere que la legislación penal la hagan parlamentarios británicos a los que poder pedir cuentas y que la apliquen jueces británicos.Que la UE pretenda extender sus competencias a espacios hasta ahora reservados a los Estados miembros en exclusiva muestra el verdadero objetivo de la UE: crear un superestado federal. La gente de mi región no quiere que eso ocurra. Rechazan la sabiduría convencional de una unión cada vez mayor y quieren ver un sistema más abierto y más flexible de cooperación intergubernamental. Espero que el nuevo grupo del que formarán parte los conservadores británicos en el próximo parlamento sea capaz de hacer lo que la mayoría de los británicos quieren de Europa. ","Martin Callanan  (PPE-DE),",2,193,not_available,"['spa', 'spa']","['  Martin Callanan  (PPE-DE),  por escrito. − La justicia penal es con toda razón responsabilidad de los Estados miembros de la UE. Puedo aceptar que los Estados miembros tengan que cooperar en asuntos transnacionales relacionados con la justicia penal, pero no acepto que se cree un espacio penal en la UE. Ampliar la denominada «competencia» de la UE a la justicia penal sería una intrusión injustificada e inaceptable en la soberanía británica. La gente de mi región del noreste de Inglaterra quiere que la legislación penal la hagan parlamentarios británicos a los que poder pedir cuentas y que la apliquen jueces británicos.', 'Que la UE pretenda extender sus competencias a espacios hasta ahora reservados a los Estados miembros en exclusiva muestra el verdadero objetivo de la UE: crear un superestado federal. La gente de mi región no quiere que eso ocurra. Rechazan la sabiduría convencional de una unión cada vez mayor y quieren ver un sistema más abierto y más flexible de cooperación intergubernamental. Espero que el nuevo grupo del que formarán parte los conservadores británicos en el próximo parlamento sea capaz de hacer lo que la mayoría de los británicos quieren de Europa. ']"
161, 10. Explicaciones de voto,"  Carl Lang  (NI),  por escrito. – (FR) Con la excusa de combatir organizaciones mafiosas y el crimen organizado en general, los eurócratas de Bruselas quieren imponer aún más sus perspectivas federalistas, que destruyen naciones, pueblos e identidades.De hecho, aunque todo el mundo sabe que cada Estado miembro de la UE tiene sus propias leyes, tradiciones jurídicas y códigos, aquí tenemos un nuevo asalto de estos fanáticos eurofederalistas que adquiere la forma de su deseo de crear una «cultura judicial europea».Para establecer esta cultura, lo siguiente debería ser crear por consiguiente una Escuela Jurídica Europea, una academia sobre legislación europea para jueces, fiscales, abogados defensores y todos aquellos que participan en la administración de justicia.¿Y las escuelas jurídicas nacionales? ¿Y las inextricables diferencias entre las legislaciones que provienen del derecho consuetudinario y las que provienen del derecho escrito?Obviamente, no se ofrece una respuesta.En la práctica, serán los sistemas judicial y penal en su totalidad de los Estados miembros los que desaparecerán ante esta armonización forzada –es decir, una armonización descendente.Estos aprendices de mago de Europa no han comprendido una cosa: sólo las naciones-Estado, los principales componentes de Europa, serán capaces de enriquecerla y devolverle al lugar que merece ocupar en el mundo.Europa no debe construirse a expensas de sus naciones y sus pueblos. ","Carl Lang  (NI),",8,219,not_available,"['fra', 'fra', 'fra', 'fra', 'fra', 'fra', 'fra', 'fra']","['  Carl Lang  (NI),  por escrito. – (FR) Con la excusa de combatir organizaciones mafiosas y el crimen organizado en general, los eurócratas de Bruselas quieren imponer aún más sus perspectivas federalistas, que destruyen naciones, pueblos e identidades.', 'De hecho, aunque todo el mundo sabe que cada Estado miembro de la UE tiene sus propias leyes, tradiciones jurídicas y códigos, aquí tenemos un nuevo asalto de estos fanáticos eurofederalistas que adquiere la forma de su deseo de crear una «cultura judicial europea».', 'Para establecer esta cultura, lo siguiente debería ser crear por consiguiente una Escuela Jurídica Europea, una academia sobre legislación europea para jueces, fiscales, abogados defensores y todos aquellos que participan en la administración de justicia.', '¿Y las escuelas jurídicas nacionales? ¿Y las inextricables diferencias entre las legislaciones que provienen del derecho consuetudinario y las que provienen del derecho escrito?', 'Obviamente, no se ofrece una respuesta.', 'En la práctica, serán los sistemas judicial y penal en su totalidad de los Estados miembros los que desaparecerán ante esta armonización forzada –es decir, una armonización descendente.', 'Estos aprendices de mago de Europa no han comprendido una cosa: sólo las naciones-Estado, los principales componentes de Europa, serán capaces de enriquecerla y devolverle al lugar que merece ocupar en el mundo.', 'Europa no debe construirse a expensas de sus naciones y sus pueblos. ']"
162, 10. Explicaciones de voto,"  Jan Andersson, Göran Färm, Inger Segelström y Åsa Westlund  (PSE),  por escrito. − (SV) El Parlamento votó hoy un informe sobre el impacto del Tratado de Lisboa sobre el desarrollo del equilibrio institucional de la Unión Europea. El informe propone que los miembros adicionales que se concederán a Suecia y a otros Estados miembros si el Tratado de Lisboa entra en vigor sean elegidos ya en las próximas elecciones al Parlamento Europeo y, a continuación, se les conceda el estatus de observadores en el Parlamento. Además, el informe también propone que la designación del nuevo Presidente de la Comisión se lleve a cabo de conformidad con el Tratado de Lisboa. Esto significa que el Presidente elegido debería reflejar la mayoría política dentro del Parlamento Europeo y que la elección del candidato debería ir precedida de un debate entre el Consejo y los grupos políticos del Parlamento.Hemos optado por votar a favor de este informe porque el Parlamento Europeo necesita prepararse para poder poner en práctica los cambios que tendrán lugar relacionados con su trabajo si el Tratado de Lisboa entra en vigor. Sin embargo, nuestros votos no deberían ser considerados como un intento de restar importancia a los procesos de ratificación de los Estados miembros individuales. Respetamos totalmente el derecho de cada Estado miembro de decidir por sí mismo a la hora de ratificar o no el Tratado de Lisboa. ","Jan Andersson, Göran Färm, Inger Segelström y Åsa Westlund  (PSE),",2,230,not_available,"['swe', 'swe']","['  Jan Andersson, Göran Färm, Inger Segelström y Åsa Westlund  (PSE),  por escrito. − (SV) El Parlamento votó hoy un informe sobre el impacto del Tratado de Lisboa sobre el desarrollo del equilibrio institucional de la Unión Europea. El informe propone que los miembros adicionales que se concederán a Suecia y a otros Estados miembros si el Tratado de Lisboa entra en vigor sean elegidos ya en las próximas elecciones al Parlamento Europeo y, a continuación, se les conceda el estatus de observadores en el Parlamento. Además, el informe también propone que la designación del nuevo Presidente de la Comisión se lleve a cabo de conformidad con el Tratado de Lisboa. Esto significa que el Presidente elegido debería reflejar la mayoría política dentro del Parlamento Europeo y que la elección del candidato debería ir precedida de un debate entre el Consejo y los grupos políticos del Parlamento.', 'Hemos optado por votar a favor de este informe porque el Parlamento Europeo necesita prepararse para poder poner en práctica los cambios que tendrán lugar relacionados con su trabajo si el Tratado de Lisboa entra en vigor. Sin embargo, nuestros votos no deberían ser considerados como un intento de restar importancia a los procesos de ratificación de los Estados miembros individuales. Respetamos totalmente el derecho de cada Estado miembro de decidir por sí mismo a la hora de ratificar o no el Tratado de Lisboa. ']"
163, 10. Explicaciones de voto,"  Edite Estrela  (PSE),  por escrito. – (PT) He votado a favor del informe sobre el impacto del Tratado de Lisboa sobre el desarrollo del equilibrio institucional en la Unión Europea. Este informe analiza el impacto del Tratado de Lisboa sobre el desarrollo del equilibrio institucional en la UE. Destaca la importancia de poner en práctica las disposiciones nuevas y de realizar los primeros nombramientos.La posible entrada en vigor del Tratado de Lisboa a finales de 2009 hace necesario un acuerdo político entre el Consejo y el Parlamento Europeo para garantizar que el procedimiento de elección del siguiente Presidente de la Comisión y para el nombramiento de la futura Comisión respete, en cualquier caso, la esencia de los nuevos poderes que dicho tratado le otorga al Parlamento Europeo sobre esta cuestión.Como consecuencia, el informe establece una serie de recomendaciones destinadas a desarrollar un equilibrio institucional y destaca que el Tratado de Lisboa fortalece cada una de las instituciones europeas en su área de competencia. ","Edite Estrela  (PSE),",3,164,not_available,"['por', 'por', 'por']","['  Edite Estrela  (PSE),  por escrito. – (PT) He votado a favor del informe sobre el impacto del Tratado de Lisboa sobre el desarrollo del equilibrio institucional en la Unión Europea. Este informe analiza el impacto del Tratado de Lisboa sobre el desarrollo del equilibrio institucional en la UE. Destaca la importancia de poner en práctica las disposiciones nuevas y de realizar los primeros nombramientos.', 'La posible entrada en vigor del Tratado de Lisboa a finales de 2009 hace necesario un acuerdo político entre el Consejo y el Parlamento Europeo para garantizar que el procedimiento de elección del siguiente Presidente de la Comisión y para el nombramiento de la futura Comisión respete, en cualquier caso, la esencia de los nuevos poderes que dicho tratado le otorga al Parlamento Europeo sobre esta cuestión.', 'Como consecuencia, el informe establece una serie de recomendaciones destinadas a desarrollar un equilibrio institucional y destaca que el Tratado de Lisboa fortalece cada una de las instituciones europeas en su área de competencia. ']"
164, 10. Explicaciones de voto,"  Pedro Guerreiro  (GUE/NGL),  por escrito. – (PT) Esta resolución forma parte de un conjunto de cinco resoluciones, adoptadas hoy por mayoría en el Parlamento, que muestran el desprecio más claro posible a la voluntad expresada de forma democrática y soberana por los pueblos francés, neerlandés e irlandés, que rechazaron en referendos la Constitución Europea y su «hermano gemelo», el conocido como Tratado de Lisboa. Ésta es también una de las diversas iniciativas que intentan imponer el inaceptable borrador del Tratado.En lugar de desechar de una vez por todas el Tratado de Lisboa, el Parlamento Europeo vuelve a adoptar una resolución que glorifica el equilibrio institucional antidemocrático de la Unión Europea propuesto por la resolución, ocultando el hecho de que, entre otros ejemplos:- transfiere poderes de soberanía del pueblo portugués a las instituciones supranacionales de la UE, dominadas por las grandes potencias, como por ejemplo la gestión de los recursos biológicos marinos de nuestra zona económica exclusiva;- extiende la aplicación de la norma de la mayoría en la toma de decisiones, lo que reforzará el dominio de las grandes potencias y evitará que Portugal vete decisiones que vayan contra el interés nacional;- aumenta la eliminación de autoridad de las instituciones democráticas nacionales (las únicas que proceden directamente de la voluntad democrática del pueblo), de la que podemos encontrar un ejemplo en la transferencia de competencias desde los Parlamentos nacionales, que están perdiendo la capacidad para adoptar decisiones en áreas fundamentales y que se están convirtiendo en una especie de organismo asesor sin el derecho de veto a las decisiones comunitarias que vayan contra los intereses nacionales. ","Pedro Guerreiro  (GUE/NGL),",5,266,not_available,"['por', 'por', 'por', 'por', 'por']","['  Pedro Guerreiro  (GUE/NGL),  por escrito. – (PT) Esta resolución forma parte de un conjunto de cinco resoluciones, adoptadas hoy por mayoría en el Parlamento, que muestran el desprecio más claro posible a la voluntad expresada de forma democrática y soberana por los pueblos francés, neerlandés e irlandés, que rechazaron en referendos la Constitución Europea y su «hermano gemelo», el conocido como Tratado de Lisboa. Ésta es también una de las diversas iniciativas que intentan imponer el inaceptable borrador del Tratado.', 'En lugar de desechar de una vez por todas el Tratado de Lisboa, el Parlamento Europeo vuelve a adoptar una resolución que glorifica el equilibrio institucional antidemocrático de la Unión Europea propuesto por la resolución, ocultando el hecho de que, entre otros ejemplos:', '- transfiere poderes de soberanía del pueblo portugués a las instituciones supranacionales de la UE, dominadas por las grandes potencias, como por ejemplo la gestión de los recursos biológicos marinos de nuestra zona económica exclusiva;', '- extiende la aplicación de la norma de la mayoría en la toma de decisiones, lo que reforzará el dominio de las grandes potencias y evitará que Portugal vete decisiones que vayan contra el interés nacional;', '- aumenta la eliminación de autoridad de las instituciones democráticas nacionales (las únicas que proceden directamente de la voluntad democrática del pueblo), de la que podemos encontrar un ejemplo en la transferencia de competencias desde los Parlamentos nacionales, que están perdiendo la capacidad para adoptar decisiones en áreas fundamentales y que se están convirtiendo en una especie de organismo asesor sin el derecho de veto a las decisiones comunitarias que vayan contra los intereses nacionales. ']"
165, 10. Explicaciones de voto,"  Nils Lundgren  (IND/DEM),  por escrito. – (SV) El Tratado de Lisboa, que es idéntico en un 96 % al borrador del Tratado Constitucional, fue rechazado en el referendo de Irlanda. Antes de eso, el borrador del Tratado Constitucional fue rechazado en los referendos de Francia y de los Países Bajos.La mayoría de este Parlamento se niega a reconocer sus derrotas políticas. Constituye un delito escandaloso contra los principios democráticos y un ejemplo igualmente escandaloso de la arrogancia del poder que caracteriza a la cooperación en la UE.No sirve de nada que en el apartado 4 del informe del señor Dehaene se declare (cito textualmente): «Acoge favorablemente que el Tratado de Lisboa estipule que el Consejo Europeo puede, por unanimidad y previa aprobación del Parlamento Europeo, siempre que no se oponga un Parlamento nacional, ampliar la decisión por mayoría cualificada y el procedimiento legislativo ordinario a ámbitos en los que aún no se aplican».A pesar de que los votantes de muchos Estados miembros son claramente escépticos con una Unión cada vez más supranacional, la mayoría federalista del Parlamento Europeo indica la posibilidad de crear una Unión aún más supranacional bajo el Tratado de Lisboa y transferir aún más competencias a la UE sin tener que acordar un nuevo tratado.He votado en contra del informe. ","Nils Lundgren  (IND/DEM),",5,216,not_available,"['swe', 'swe', 'swe', 'swe', 'swe']","['  Nils Lundgren  (IND/DEM),  por escrito. – (SV) El Tratado de Lisboa, que es idéntico en un 96 % al borrador del Tratado Constitucional, fue rechazado en el referendo de Irlanda. Antes de eso, el borrador del Tratado Constitucional fue rechazado en los referendos de Francia y de los Países Bajos.', 'La mayoría de este Parlamento se niega a reconocer sus derrotas políticas. Constituye un delito escandaloso contra los principios democráticos y un ejemplo igualmente escandaloso de la arrogancia del poder que caracteriza a la cooperación en la UE.', 'No sirve de nada que en el apartado 4 del informe del señor Dehaene se declare (cito textualmente): «Acoge favorablemente que el Tratado de Lisboa estipule que el Consejo Europeo puede, por unanimidad y previa aprobación del Parlamento Europeo, siempre que no se oponga un Parlamento nacional, ampliar la decisión por mayoría cualificada y el procedimiento legislativo ordinario a ámbitos en los que aún no se aplican».', 'A pesar de que los votantes de muchos Estados miembros son claramente escépticos con una Unión cada vez más supranacional, la mayoría federalista del Parlamento Europeo indica la posibilidad de crear una Unión aún más supranacional bajo el Tratado de Lisboa y transferir aún más competencias a la UE sin tener que acordar un nuevo tratado.', 'He votado en contra del informe. ']"
166, 10. Explicaciones de voto,"  Jan Andersson, Göran Färm, Inger Segelström y Åsa Westlund  (PSE),  por escrito. − (SV) El Parlamento ha votado hoy sobre un informe relativo al desarrollo de las relaciones entre el Parlamento Europeo y los Parlamentos nacionales bajo el Tratado de Lisboa. Este informe acoge positivamente las nuevas competencias que el Tratado de Lisboa acordará a los Parlamentos nacionales. También investiga las posibilidades para un futuro desarrollo de las relaciones entre el Parlamento Europeo y los Parlamentos nacionales.Hemos optado por votar a favor de este informe porque el Parlamento Europeo necesita prepararse para poder poner en práctica los cambios que tendrán lugar relacionados con su trabajo si el Tratado de Lisboa entra en vigor. Sin embargo, nuestros votos no deberían ser considerados como un intento de restar importancia a los procesos de ratificación de los Estados miembros individuales. Respetamos totalmente el derecho de cada Estado miembro de decidir por sí mismo a la hora de ratificar o no el Tratado de Lisboa. ","Jan Andersson, Göran Färm, Inger Segelström y Åsa Westlund  (PSE),",2,161,not_available,"['spa', 'spa']","['  Jan Andersson, Göran Färm, Inger Segelström y Åsa Westlund  (PSE),  por escrito. − (SV) El Parlamento ha votado hoy sobre un informe relativo al desarrollo de las relaciones entre el Parlamento Europeo y los Parlamentos nacionales bajo el Tratado de Lisboa. Este informe acoge positivamente las nuevas competencias que el Tratado de Lisboa acordará a los Parlamentos nacionales. También investiga las posibilidades para un futuro desarrollo de las relaciones entre el Parlamento Europeo y los Parlamentos nacionales.', 'Hemos optado por votar a favor de este informe porque el Parlamento Europeo necesita prepararse para poder poner en práctica los cambios que tendrán lugar relacionados con su trabajo si el Tratado de Lisboa entra en vigor. Sin embargo, nuestros votos no deberían ser considerados como un intento de restar importancia a los procesos de ratificación de los Estados miembros individuales. Respetamos totalmente el derecho de cada Estado miembro de decidir por sí mismo a la hora de ratificar o no el Tratado de Lisboa. ']"
167, 10. Explicaciones de voto,"  Edite Estrela  (PSE),  por escrito. – (PT) He votado a favor del informe del señor Brok. Este informe acoge positivamente las nuevas competencias que el Tratado de Lisboa otorgará a los Parlamentos nacionales y examina las posibilidades de futura cooperación entre los Parlamentos nacionales y el Parlamento Europeo.La adopción del Tratado de Lisboa en la República Checa supone un paso importante hacia su rápida entrada en vigor. Este informe demuestra la importancia de este nuevo Tratado de la Unión Europea. ","Edite Estrela  (PSE),",2,80,not_available,"['por', 'por']","['  Edite Estrela  (PSE),  por escrito. – (PT) He votado a favor del informe del señor Brok. Este informe acoge positivamente las nuevas competencias que el Tratado de Lisboa otorgará a los Parlamentos nacionales y examina las posibilidades de futura cooperación entre los Parlamentos nacionales y el Parlamento Europeo.', 'La adopción del Tratado de Lisboa en la República Checa supone un paso importante hacia su rápida entrada en vigor. Este informe demuestra la importancia de este nuevo Tratado de la Unión Europea. ']"
168, 10. Explicaciones de voto,"  Bruno Gollnisch  (NI  ), por escrito. – (FR) Hemos votado en contra de este informe, en primer lugar, porque carece de propósito: el Tratado de Lisboa no existe; fue rechazado en tres referendos.Votamos en contra, en segundo lugar, porque recomienda la subordinación de los Parlamentos nacionales al Parlamento Europeo: este último, seguro de la fortaleza de su superioridad y, sin duda, su insoportable arrogancia, ofrecería su apoyo a los Parlamentos nacionales –formados a su entender, sin duda, por filisteos e idiotas– para examinar los textos europeos. ¿Es esto apoyo o presión? Se invitaría a sí mismo a los plenos de los Parlamentos nacionales; jugaría el papel de asesor; influiría en cómo los parlamentos transponen los textos para potenciar la uniformidad; se haría valer para asegurarse de que se debaten los presupuestos de defensa... ¿Les dictaría también cómo deberían controlar a los gobiernos y sus actividades en el Consejo?Por último, votamos en contra del informe porque se basa en una hipocresía doble: los Parlamentos nacionales no han obtenido nada aparte de un derecho muy difícil de ejecutar y, por tanto, ineficaz para supervisar el respeto del principio de subsidiariedad; este principio es una ilusión, ya que muchas competencias supuestamente exclusivas de la UE se han consagrado y la definición de subsidiariedad, tal y como se recoge en los Tratados, fomenta de hecho las competencias de Bruselas. ",Bruno Gollnisch  (NI,3,225,not_available,"['spa', 'spa', 'spa']","['  Bruno Gollnisch  (NI  ), por escrito. – (FR) Hemos votado en contra de este informe, en primer lugar, porque carece de propósito: el Tratado de Lisboa no existe; fue rechazado en tres referendos.', 'Votamos en contra, en segundo lugar, porque recomienda la subordinación de los Parlamentos nacionales al Parlamento Europeo: este último, seguro de la fortaleza de su superioridad y, sin duda, su insoportable arrogancia, ofrecería su apoyo a los Parlamentos nacionales –formados a su entender, sin duda, por filisteos e idiotas– para examinar los textos europeos. ¿Es esto apoyo o presión? Se invitaría a sí mismo a los plenos de los Parlamentos nacionales; jugaría el papel de asesor; influiría en cómo los parlamentos transponen los textos para potenciar la uniformidad; se haría valer para asegurarse de que se debaten los presupuestos de defensa... ¿Les dictaría también cómo deberían controlar a los gobiernos y sus actividades en el Consejo?', 'Por último, votamos en contra del informe porque se basa en una hipocresía doble: los Parlamentos nacionales no han obtenido nada aparte de un derecho muy difícil de ejecutar y, por tanto, ineficaz para supervisar el respeto del principio de subsidiariedad; este principio es una ilusión, ya que muchas competencias supuestamente exclusivas de la UE se han consagrado y la definición de subsidiariedad, tal y como se recoge en los Tratados, fomenta de hecho las competencias de Bruselas. ']"
