,agenda_item,text,speaker,number_p,number_w,chair,language_ps,ps
35, 8. Asignación de franjas horarias en los aeropuertos comunitarios (debate) ,"  Presidente.   – El siguiente punto es el informe de Paolo Costa, en nombre de la Comisión de Transportes y Turismo, sobre la propuesta de Reglamento del Parlamento Europeo y del Consejo por el que se modifica el Reglamento (CEE) nº 95/93 relativo a normas comunes para la asignación de franjas horarias en los aeropuertos comunitarios (COM(2009)0121 – C6-0097/2009 - 2009/0042(COD)) (A6-0274/2009). ",Presidente.,1,67,not_available,['spa'],"['  Presidente.   – El siguiente punto es el informe de Paolo Costa, en nombre de la Comisión de Transportes y Turismo, sobre la propuesta de Reglamento del Parlamento Europeo y del Consejo por el que se modifica el Reglamento (CEE) nº 95/93 relativo a normas comunes para la asignación de franjas horarias en los aeropuertos comunitarios (COM(2009)0121 – C6-0097/2009 - 2009/0042(COD)) (A6-0274/2009). ']"
36, 8. Asignación de franjas horarias en los aeropuertos comunitarios (debate) ,"  Paolo Costa,  ponente. – (IT) Señor Presidente, Señor Tajani, Señorías, tengo el placer de abrir este debate con una conclusión, por decirlo así, al recomendar en esta ocasión que la Cámara adopte la enmienda presentada por mí y por todo el grupo de representantes de la comisión, para concluir este informe en primera lectura y así obtener la aprobación del reglamento.Lo hacemos con un gran sentido de la responsabilidad. Creo que el Vicepresidente Tajani estará de acuerdo con que la forma en que hemos intentado responder a una necesidad y una dificultad objetivas de las aerolíneas en este momento –al permitirles conservar sus franjas horarias incluso aunque no las usen durante la temporada veraniega este año– es una medida necesaria, aunque muy tosca, una medida que hay que pulir.Hay que pulirla porque hemos visto, en el breve periodo de tiempo que se ha permitido para este debate, que existen diferentes intereses, todos legítimos, entre las compañías aéreas, que hay compañías esperando para sustituir a otras, en las que las primeras son incapaces de cumplir con sus compromisos, que existen ahora intereses bien diferenciados entre las compañías aéreas y los aeropuertos, algo que no ocurría no hace mucho tiempo, y sobre todo que existen los intereses de los pasajeros, muy especialmente aquellos a los que atienden aeropuertos y compañías aéreas en las regiones ultraperiféricas, que serían los más perjudicados si la elección de conservar o eliminar franjas horarias dependiese exclusivamente de su rentabilidad para las compañías afectadas.Estas son cuestiones que hemos podido abordar muy rápidamente, pero que hemos dejado sobre la mesa. Fundamentalmente, también creímos que debíamos abordar el problema fundamental, el de considerar las franjas horarias, como debíamos, como bienes públicos que se pueden asignar o conceder a operadores privados como las compañías aéreas y los aeropuertos, pero que no se pueden transferir en propiedad.Éste es un tema muy delicado que creo que deberemos volver a tratar. Debo decir que la razón, o el compromiso encomiable, si lo prefieren, que subyace tras nuestra rápida adopción de la propuesta tal y como se presenta aquí es la de asegurarnos de que la Comisión cumplirá con su palabra de volver a tratar este tema de forma más reflexiva y más en profundidad para tratar de resolver de una vez por todas una cuestión que es crucial, no sólo para superar la crisis actual sino también para completar el proceso de reestructuración y liberalización del mercado aéreo global y para construir un mejor mercado aéreo en Europa.Por ello, al combinar los requisitos actuales con las necesidades a más largo plazo, creo que puedo recomendar que se apruebe este informe.Yo también, en los veinte segundos que me quedan, señor Presidente, voy a aprovechar este ambiente de último día de clase para dar las gracias a mis compañeros y a aquellos con quienes he tenido la ocasión de trabajar en los últimos diez años, ya que estoy encantado de terminar mi último día en Estrasburgo con mi última, pero de ninguna de las formas menos importante, contribución. ","Paolo Costa,",7,507,not_available,"['ita', 'ita', 'ita', 'ita', 'ita', 'ita', 'ita']","['  Paolo Costa,  ponente. – (IT) Señor Presidente, Señor Tajani, Señorías, tengo el placer de abrir este debate con una conclusión, por decirlo así, al recomendar en esta ocasión que la Cámara adopte la enmienda presentada por mí y por todo el grupo de representantes de la comisión, para concluir este informe en primera lectura y así obtener la aprobación del reglamento.', 'Lo hacemos con un gran sentido de la responsabilidad. Creo que el Vicepresidente Tajani estará de acuerdo con que la forma en que hemos intentado responder a una necesidad y una dificultad objetivas de las aerolíneas en este momento –al permitirles conservar sus franjas horarias incluso aunque no las usen durante la temporada veraniega este año– es una medida necesaria, aunque muy tosca, una medida que hay que pulir.', 'Hay que pulirla porque hemos visto, en el breve periodo de tiempo que se ha permitido para este debate, que existen diferentes intereses, todos legítimos, entre las compañías aéreas, que hay compañías esperando para sustituir a otras, en las que las primeras son incapaces de cumplir con sus compromisos, que existen ahora intereses bien diferenciados entre las compañías aéreas y los aeropuertos, algo que no ocurría no hace mucho tiempo, y sobre todo que existen los intereses de los pasajeros, muy especialmente aquellos a los que atienden aeropuertos y compañías aéreas en las regiones ultraperiféricas, que serían los más perjudicados si la elección de conservar o eliminar franjas horarias dependiese exclusivamente de su rentabilidad para las compañías afectadas.', 'Estas son cuestiones que hemos podido abordar muy rápidamente, pero que hemos dejado sobre la mesa. Fundamentalmente, también creímos que debíamos abordar el problema fundamental, el de considerar las franjas horarias, como debíamos, como bienes públicos que se pueden asignar o conceder a operadores privados como las compañías aéreas y los aeropuertos, pero que no se pueden transferir en propiedad.', 'Éste es un tema muy delicado que creo que deberemos volver a tratar. Debo decir que la razón, o el compromiso encomiable, si lo prefieren, que subyace tras nuestra rápida adopción de la propuesta tal y como se presenta aquí es la de asegurarnos de que la Comisión cumplirá con su palabra de volver a tratar este tema de forma más reflexiva y más en profundidad para tratar de resolver de una vez por todas una cuestión que es crucial, no sólo para superar la crisis actual sino también para completar el proceso de reestructuración y liberalización del mercado aéreo global y para construir un mejor mercado aéreo en Europa.', 'Por ello, al combinar los requisitos actuales con las necesidades a más largo plazo, creo que puedo recomendar que se apruebe este informe.', 'Yo también, en los veinte segundos que me quedan, señor Presidente, voy a aprovechar este ambiente de último día de clase para dar las gracias a mis compañeros y a aquellos con quienes he tenido la ocasión de trabajar en los últimos diez años, ya que estoy encantado de terminar mi último día en Estrasburgo con mi última, pero de ninguna de las formas menos importante, contribución. ']"
37, 8. Asignación de franjas horarias en los aeropuertos comunitarios (debate) ,"  Presidente. -   Gracias, señor Costa, y también felicidades por su buen trabajo. Su nombre queda ligado a una serie de importantes informes y, por lo tanto, su esfuerzo también forma parte de la historia del Parlamento en los últimos años.  ",Presidente. -,1,39,not_available,['spa'],"['  Presidente. -   Gracias, señor Costa, y también felicidades por su buen trabajo. Su nombre queda ligado a una serie de importantes informes y, por lo tanto, su esfuerzo también forma parte de la historia del Parlamento en los últimos años.  ']"
38, 8. Asignación de franjas horarias en los aeropuertos comunitarios (debate) ,"  Antonio Tajani,  Vicepresidente de la Comisión. – (IT) Señor Presidente, honorables Miembros, nuevamente, como antiguo miembro de esta Cámara, me gustaría dar las gracias a la Comisión de Transportes y Turismo y a su presidente por su productivo trabajo cuando yo era eurodiputado y por la cooperación mostrada desde que fui honrado con el nombramiento, aprobado por el Parlamento, como Comisario Europeo de Transportes. Esta fructífera asociación, señorías, se puede ver de nuevo hoy y, por tanto, debo dar las gracias al Parlamento una vez más, especialmente a la comisión de transportes, presidida por el señor Costa, por la rapidez con que han tratado la propuesta de la Comisión Europea sobre franjas horarias.Varios acontecimientos –la crisis económica, la crisis financiera, el nuevo virus de la gripe A– están agravando la situación de la industria del transporte aéreo y esta situación demuestra lo urgentes e indispensables que son las medidas de apoyo, no sólo para las compañías aéreas, sino también para sus empleados.Visto esto, comparto la preocupación del señor Costa. La propuesta de la Comisión no es una solución definitiva. Es quizás una propuesta que pretende resolver una emergencia, pero que habrá que volver a revisar detenidamente para volver a diseñar todo el sistema; de hecho, el 15 de abril, respondiendo a las preocupaciones y a los comentarios del señor Costa, le informé, como presidente de la comisión, que la Dirección General de Energía y Transportes de la Comisión ya se está preparando para presentar lo antes posible una propuesta que revise el reglamento.La norma que regula el uso de las franjas horarias ya se ha suspendido dos veces en el pasado para abordar crisis. Es una respuesta global a una crisis global, una respuesta que claramente no afecta a uno o dos Estados miembros sino que afecta al sistema de transporte aéreo de toda la Unión Europea, y se trata de medidas que ya se adoptaron en las circunstancias más graves –los ataques del 11 de septiembre y la crisis del SARS (síndrome respiratorio agudo grave). La crisis que golpea hoy a la industria del transporte aéreo es probablemente más grave que aquellas y todavía no tenemos indicios de cuando vamos a empezar a ver mejoras.La realidad es que el tráfico disminuye de forma continua. La suspensión de la norma «úsenlo o piérdanlo» durante la temporada veraniega beneficiará a todas las compañías, europeas o no, sin discriminaciones, es más, como han señalado la IATA y muchas compañías no europeas. Estoy seguro de que esta medida, que se aplicará durante un tiempo limitado y es una excepción –de hecho, la suspensión estará en vigor del 29 de marzo al 26 de octubre de este año para permitir entonces que se conserven las franjas horarias para la temporada veraniega del año que viene–, ofrecerá cierto respiro a todas las compañías, permitiéndoles abordar la caída de la demanda.También evitará situaciones paradójicas como el caso actual en el que las compañías se ven obligadas a volar con aviones vacíos para no perder sus franjas horarias, algo que considero totalmente inaceptable, no sólo desde una perspectiva medioambiental sino también como algo en detrimento de las finanzas de las compañías aéreas... y sabemos que cuando un negocio tiene dificultades, también las tienen sus trabajadores.Estoy convencido de que esta medida es necesaria y urgente y, por tanto, no puedo dejar de apoyar el compromiso alcanzado entre el Parlamento y el Consejo, que permitirá que la propuesta se apruebe inmediatamente. Por esta razón, me gustaría volver a darle las gracias al presidente de la comisión de transportes y al Parlamento en su conjunto. ","Antonio Tajani,",7,600,not_available,"['ita', 'ita', 'ita', 'ita', 'ita', 'ita', 'ita']","['  Antonio Tajani,  Vicepresidente de la Comisión. – (IT) Señor Presidente, honorables Miembros, nuevamente, como antiguo miembro de esta Cámara, me gustaría dar las gracias a la Comisión de Transportes y Turismo y a su presidente por su productivo trabajo cuando yo era eurodiputado y por la cooperación mostrada desde que fui honrado con el nombramiento, aprobado por el Parlamento, como Comisario Europeo de Transportes. Esta fructífera asociación, señorías, se puede ver de nuevo hoy y, por tanto, debo dar las gracias al Parlamento una vez más, especialmente a la comisión de transportes, presidida por el señor Costa, por la rapidez con que han tratado la propuesta de la Comisión Europea sobre franjas horarias.', 'Varios acontecimientos –la crisis económica, la crisis financiera, el nuevo virus de la gripe A– están agravando la situación de la industria del transporte aéreo y esta situación demuestra lo urgentes e indispensables que son las medidas de apoyo, no sólo para las compañías aéreas, sino también para sus empleados.', 'Visto esto, comparto la preocupación del señor Costa. La propuesta de la Comisión no es una solución definitiva. Es quizás una propuesta que pretende resolver una emergencia, pero que habrá que volver a revisar detenidamente para volver a diseñar todo el sistema; de hecho, el 15 de abril, respondiendo a las preocupaciones y a los comentarios del señor Costa, le informé, como presidente de la comisión, que la Dirección General de Energía y Transportes de la Comisión ya se está preparando para presentar lo antes posible una propuesta que revise el reglamento.', 'La norma que regula el uso de las franjas horarias ya se ha suspendido dos veces en el pasado para abordar crisis. Es una respuesta global a una crisis global, una respuesta que claramente no afecta a uno o dos Estados miembros sino que afecta al sistema de transporte aéreo de toda la Unión Europea, y se trata de medidas que ya se adoptaron en las circunstancias más graves –los ataques del 11 de septiembre y la crisis del SARS (síndrome respiratorio agudo grave). La crisis que golpea hoy a la industria del transporte aéreo es probablemente más grave que aquellas y todavía no tenemos indicios de cuando vamos a empezar a ver mejoras.', 'La realidad es que el tráfico disminuye de forma continua. La suspensión de la norma «úsenlo o piérdanlo» durante la temporada veraniega beneficiará a todas las compañías, europeas o no, sin discriminaciones, es más, como han señalado la IATA y muchas compañías no europeas. Estoy seguro de que esta medida, que se aplicará durante un tiempo limitado y es una excepción –de hecho, la suspensión estará en vigor del 29 de marzo al 26 de octubre de este año para permitir entonces que se conserven las franjas horarias para la temporada veraniega del año que viene–, ofrecerá cierto respiro a todas las compañías, permitiéndoles abordar la caída de la demanda.', 'También evitará situaciones paradójicas como el caso actual en el que las compañías se ven obligadas a volar con aviones vacíos para no perder sus franjas horarias, algo que considero totalmente inaceptable, no sólo desde una perspectiva medioambiental sino también como algo en detrimento de las finanzas de las compañías aéreas... y sabemos que cuando un negocio tiene dificultades, también las tienen sus trabajadores.', 'Estoy convencido de que esta medida es necesaria y urgente y, por tanto, no puedo dejar de apoyar el compromiso alcanzado entre el Parlamento y el Consejo, que permitirá que la propuesta se apruebe inmediatamente. Por esta razón, me gustaría volver a darle las gracias al presidente de la comisión de transportes y al Parlamento en su conjunto. ']"
39, 8. Asignación de franjas horarias en los aeropuertos comunitarios (debate) ,"  Georg Jarzembowski,  en nombre del Grupo del PPE-DE. – (DE) Señor Presidente, señor Tajani, Señorías, el Grupo del Partido Popular Europeo (Demócrata-Cristianos) y de los Demócratas Europeos apoya la suspensión excepcional de la norma del uso mínimo del 80 % para los derechos de despegue y aterrizaje en los aeropuertos concedidos a las compañías aéreas para el programa de vuelos del verano de 2010. Gracias al ponente, el señor Costa, por la forma rápida y eficaz en que ha gestionado este expediente.La suspensión hace ahora posible que las compañías aéreas descarten vuelos en función de la caída de la demanda más allá del uso mínimo previsto sin perder sus derechos de despegue y aterrizaje para la próxima temporada. En mi opinión, está justificado como medida excepcional, por un periodo de tiempo, como dijo el Vicepresidente, porque se ha producido una caída imprevisible del número de viajeros debido a la crisis económica y financiera y porque las compañías aéreas todavía no pueden predecir como van a evolucionar las cifras de viajeros en el futuro. La suspensión también ayuda a proteger el medio ambiente, ya que, de lo contrario, las compañías aéreas se sienten obligadas a poner en el aire aviones semivacíos para mantener sus franjas horarias.Señor Presidente, señor Vicepresidente, al principio el Grupo del PPE-DE rechazó el reglamento que usted había propuesto para autorizar a la Comisión, sin una genuina decisión conjunta con el Parlamento, a solicitar la suspensión de la norma sencillamente en el procedimiento de la Comisión. Creemos que, si pretende hacer una propuesta similar para el plan de vuelo invernal, el Parlamento tendrá que examinarla cuidadosamente, porque tendremos que considerar los intereses de las muy diversas compañías aéreas así como, aún más cuidadosamente, los intereses de los aeropuertos y de los pasajeros. Decimos «sí» a una suspensión excepcional, pero «no» a la posibilidad de la extensión sin la participación del Parlamento.Con toda sinceridad, creo que, ahora que la gripe porcina no parece tan virulenta como se temió inicialmente, las compañías aéreas podrán en última instancia anticipar las posibles cifras y relaciones de pasajeros de los próximos años. Debemos esperar a que las compañías aéreas presente planes realistas para que los aeropuertos tengan la oportunidad de ofrecer las franjas horarias que no se utilicen a otras compañías. Somos los primeros interesados en que los aeropuertos puedan usar sus capacidades defendiendo los intereses de sus clientes, los pasajeros. Tengo un comentario más sobre la nueva revisión fundamental de la Directiva de las franjas horarias. Creo que las franjas horarias pertenecen al público y no a los aeropuertos o a las compañías aéreas y por eso debemos prestar especial atención a esta cuestión en el futuro.Señor Presidente, Señorías, puesto que este debate, este pleno y mi actividad parlamentaria se acercan a su fin, permítanme expresar mi más sincero agradecimiento a mis colegas de la Comisión de Transportes y Turismo y a su secretaría, así como al presidente de dicha comisión y al Vicepresidente de la Comisión y a todo su equipo de la Dirección General de Transportes. Hemos pasado los últimos cinco años trabajando juntos defendiendo los intereses de los ciudadanos de la Unión Europea. Mantendré mis dedos cruzados por ustedes para que los próximos cinco años traigan más de lo mismo. La Comisión de Transportes y Turismo es una comisión importante y les doy las gracias a todos por su excelente cooperación. ","Georg Jarzembowski,",5,567,not_available,"['ger', 'ger', 'ger', 'ger', 'ger']","['  Georg Jarzembowski,  en nombre del Grupo del PPE-DE. – (DE) Señor Presidente, señor Tajani, Señorías, el Grupo del Partido Popular Europeo (Demócrata-Cristianos) y de los Demócratas Europeos apoya la suspensión excepcional de la norma del uso mínimo del 80 % para los derechos de despegue y aterrizaje en los aeropuertos concedidos a las compañías aéreas para el programa de vuelos del verano de 2010. Gracias al ponente, el señor Costa, por la forma rápida y eficaz en que ha gestionado este expediente.', 'La suspensión hace ahora posible que las compañías aéreas descarten vuelos en función de la caída de la demanda más allá del uso mínimo previsto sin perder sus derechos de despegue y aterrizaje para la próxima temporada. En mi opinión, está justificado como medida excepcional, por un periodo de tiempo, como dijo el Vicepresidente, porque se ha producido una caída imprevisible del número de viajeros debido a la crisis económica y financiera y porque las compañías aéreas todavía no pueden predecir como van a evolucionar las cifras de viajeros en el futuro. La suspensión también ayuda a proteger el medio ambiente, ya que, de lo contrario, las compañías aéreas se sienten obligadas a poner en el aire aviones semivacíos para mantener sus franjas horarias.', 'Señor Presidente, señor Vicepresidente, al principio el Grupo del PPE-DE rechazó el reglamento que usted había propuesto para autorizar a la Comisión, sin una genuina decisión conjunta con el Parlamento, a solicitar la suspensión de la norma sencillamente en el procedimiento de la Comisión. Creemos que, si pretende hacer una propuesta similar para el plan de vuelo invernal, el Parlamento tendrá que examinarla cuidadosamente, porque tendremos que considerar los intereses de las muy diversas compañías aéreas así como, aún más cuidadosamente, los intereses de los aeropuertos y de los pasajeros. Decimos «sí» a una suspensión excepcional, pero «no» a la posibilidad de la extensión sin la participación del Parlamento.', 'Con toda sinceridad, creo que, ahora que la gripe porcina no parece tan virulenta como se temió inicialmente, las compañías aéreas podrán en última instancia anticipar las posibles cifras y relaciones de pasajeros de los próximos años. Debemos esperar a que las compañías aéreas presente planes realistas para que los aeropuertos tengan la oportunidad de ofrecer las franjas horarias que no se utilicen a otras compañías. Somos los primeros interesados en que los aeropuertos puedan usar sus capacidades defendiendo los intereses de sus clientes, los pasajeros. Tengo un comentario más sobre la nueva revisión fundamental de la Directiva de las franjas horarias. Creo que las franjas horarias pertenecen al público y no a los aeropuertos o a las compañías aéreas y por eso debemos prestar especial atención a esta cuestión en el futuro.', 'Señor Presidente, Señorías, puesto que este debate, este pleno y mi actividad parlamentaria se acercan a su fin, permítanme expresar mi más sincero agradecimiento a mis colegas de la Comisión de Transportes y Turismo y a su secretaría, así como al presidente de dicha comisión y al Vicepresidente de la Comisión y a todo su equipo de la Dirección General de Transportes. Hemos pasado los últimos cinco años trabajando juntos defendiendo los intereses de los ciudadanos de la Unión Europea. Mantendré mis dedos cruzados por ustedes para que los próximos cinco años traigan más de lo mismo. La Comisión de Transportes y Turismo es una comisión importante y les doy las gracias a todos por su excelente cooperación. ']"
40, 8. Asignación de franjas horarias en los aeropuertos comunitarios (debate) ,"  Presidente.   − Gracias, señor Jarzembowski, y mucha suerte, mucha fortuna y mucha felicidad para los próximos años y en sus próximas actividades. ",Presidente.,1,21,not_available,['spa'],"['  Presidente.   − Gracias, señor Jarzembowski, y mucha suerte, mucha fortuna y mucha felicidad para los próximos años y en sus próximas actividades. ']"
