,agenda_item,text,speaker,number_p,number_w,chair,language_ps,ps
19, 2. Relaciones UE/Túnez (debate) ,"  Cristian Dan Preda  (PPE).   – (FR) Señor Presidente, como ya se ha puesto de relieve, Túnez es un socio importante para la UE, y también se ha mencionado el importantísimo papel que desempeña el ámbito social en Túnez. Quisiera añadir a ello una serie de aspectos políticos significativos, porque, como ya se ha dicho, Túnez es una sociedad que practica una política pluripartidista, si bien de forma limitada, con una cuota para la oposición, sin lugar a dudas, pero en todo caso una política pluripartidista. También se ha mencionado la cuestión de la igualdad de género.En todos nuestros países, en los países de Europa, todas las opiniones políticas coexisten con la libertad de prensa y ahí es donde reside la diferencia, en realidad, porque en Túnez tal libertad existe, pero es limitada, y de hecho hay periodistas que tienen problemas.Y surge la siguiente pregunta: ¿podría un rapprochement a la Union Europea aumentar esa libertad o no? En mi opinión, un rapprochement a la UE ayudaría a Túnez a complementar el progreso social alcanzado con avances políticos extremadamente importantes. ",Cristian Dan Preda  (PPE).,3,179,not_available,"['fra', 'fra', 'fra']","['  Cristian Dan Preda  (PPE).   – (FR) Señor Presidente, como ya se ha puesto de relieve, Túnez es un socio importante para la UE, y también se ha mencionado el importantísimo papel que desempeña el ámbito social en Túnez. Quisiera añadir a ello una serie de aspectos políticos significativos, porque, como ya se ha dicho, Túnez es una sociedad que practica una política pluripartidista, si bien de forma limitada, con una cuota para la oposición, sin lugar a dudas, pero en todo caso una política pluripartidista. También se ha mencionado la cuestión de la igualdad de género.', 'En todos nuestros países, en los países de Europa, todas las opiniones políticas coexisten con la libertad de prensa y ahí es donde reside la diferencia, en realidad, porque en Túnez tal libertad existe, pero es limitada, y de hecho hay periodistas que tienen problemas.', 'Y surge la siguiente pregunta: ¿podría un rapprochement a la Union Europea aumentar esa libertad o no? En mi opinión, un rapprochement a la UE ayudaría a Túnez a complementar el progreso social alcanzado con avances políticos extremadamente importantes. ']"
20, 2. Relaciones UE/Túnez (debate) ,"  Harlem Désir  (S&D).   – (FR) Señor Presidente, señora Comisaria, usted ha expresado la esperanza de que Túnez avance en los ámbitos de la reforma democrática y la libertad de expresión. Tiene razón al hacerlo, ya que ello es acorde con el acuerdo de asociación y los compromisos que Túnez ha asumido ante la Unión Europea.Por esto, me sorprenden mucho los comentarios tanto del señor Baudis como del señor Michel, que parecen animarla a usted a ignorar ese aspecto de nuestra relación y cooperación con Túnez y, en último término, a abandonar el artículo 2 del acuerdo de asociación.Además, queda un largo trecho por recorrer antes de que se cumplan dichos compromisos, a juzgar por la situación, que ya ha mencionado mi colega, señora Guillaume, del periodista independiente Taoufik Ben Brik, que está en la cárcel desde el pasado mes de octubre, tras un juicio en el que sus abogados y el procedimiento violaron totalmente la ley. Además de esa denegación inaceptable de libertad, su salud se está deteriorando y su régimen de visitas se ha restringido.Por eso le pregunto, señora Comisaria si la Comisión tiene la intención de intervenir en el marco del Consejo de Asociación para solicitar la inmediata puesta en libertad del señor Ben Brik y garantizar que su situación y estado de salud se tengan en cuenta, al menos por motivos humanitarios? ",Harlem Désir  (S&D).,4,228,not_available,"['fra', 'fra', 'fra', 'fra']","['  Harlem Désir  (S&D).   – (FR) Señor Presidente, señora Comisaria, usted ha expresado la esperanza de que Túnez avance en los ámbitos de la reforma democrática y la libertad de expresión. Tiene razón al hacerlo, ya que ello es acorde con el acuerdo de asociación y los compromisos que Túnez ha asumido ante la Unión Europea.', 'Por esto, me sorprenden mucho los comentarios tanto del señor Baudis como del señor Michel, que parecen animarla a usted a ignorar ese aspecto de nuestra relación y cooperación con Túnez y, en último término, a abandonar el artículo 2 del acuerdo de asociación.', 'Además, queda un largo trecho por recorrer antes de que se cumplan dichos compromisos, a juzgar por la situación, que ya ha mencionado mi colega, señora Guillaume, del periodista independiente Taoufik Ben Brik, que está en la cárcel desde el pasado mes de octubre, tras un juicio en el que sus abogados y el procedimiento violaron totalmente la ley. Además de esa denegación inaceptable de libertad, su salud se está deteriorando y su régimen de visitas se ha restringido.', 'Por eso le pregunto, señora Comisaria si la Comisión tiene la intención de intervenir en el marco del Consejo de Asociación para solicitar la inmediata puesta en libertad del señor Ben Brik y garantizar que su situación y estado de salud se tengan en cuenta, al menos por motivos humanitarios? ']"
21, 2. Relaciones UE/Túnez (debate) ,"  Malika Benarab-Attou  (Verts/ALE).   – (FR) Señor Presidente, el 14 de enero me reuní con miembros de la delegación de Túnez y mantuvimos una conversación franca y debatimos nuestras opiniones respectivas.Como franco-argelina, estoy comprometida con el Magreb y hago campaña por un Magreb unido, pluralista y democrático. Para mí, la cuestión de los derechos humanos reviste una importancia crucial y es uno de los valores fundamentales de la Unión Europea. El debate sobre esta cuestión, tal como se ve en Túnez, es crucial y relevante.Ayer por la mañana, estuve con la esposa del señor Ben Brik, que está en huelga de hambre, y también con activistas de la Red Euromediterránea de Derechos Humanos, y estoy preocupada. Parece que la vida del señor Ben Brik corre peligro debido a su enfermedad y a las condiciones de su detención. Estoy segura de que son ustedes conscientes de que si este temor llegara a convertirse en realidad, la responsabilidad recaería plenamente sobre los hombros de las autoridades tunecinas.Además de las relaciones comerciales, debemos tener en cuenta las cuestiones sociales. El fenómeno de los jóvenes tunecinos que se arrojan al Mediterráneo es resultado de una sociedad cerrada que no ofrece perspectiva alguna a los jóvenes. La protección frente al fundamentalismo y los imperativos económicos no deberían servir de pretexto para ignorar los derechos humanos. Ahora es crucial que se realicen verdaderos avances en el ámbito de los derechos humanos. No estamos hablando aquí de dogmatismo moralista sino de una situación urgente que la Unión Europea debe ayudar a solucionar. ",Malika Benarab-Attou  (Verts/ALE).,4,259,not_available,"['fra', 'fra', 'fra', 'fra']","['  Malika Benarab-Attou  (Verts/ALE).   – (FR) Señor Presidente, el 14 de enero me reuní con miembros de la delegación de Túnez y mantuvimos una conversación franca y debatimos nuestras opiniones respectivas.', 'Como franco-argelina, estoy comprometida con el Magreb y hago campaña por un Magreb unido, pluralista y democrático. Para mí, la cuestión de los derechos humanos reviste una importancia crucial y es uno de los valores fundamentales de la Unión Europea. El debate sobre esta cuestión, tal como se ve en Túnez, es crucial y relevante.', 'Ayer por la mañana, estuve con la esposa del señor Ben Brik, que está en huelga de hambre, y también con activistas de la Red Euromediterránea de Derechos Humanos, y estoy preocupada. Parece que la vida del señor Ben Brik corre peligro debido a su enfermedad y a las condiciones de su detención. Estoy segura de que son ustedes conscientes de que si este temor llegara a convertirse en realidad, la responsabilidad recaería plenamente sobre los hombros de las autoridades tunecinas.', 'Además de las relaciones comerciales, debemos tener en cuenta las cuestiones sociales. El fenómeno de los jóvenes tunecinos que se arrojan al Mediterráneo es resultado de una sociedad cerrada que no ofrece perspectiva alguna a los jóvenes. La protección frente al fundamentalismo y los imperativos económicos no deberían servir de pretexto para ignorar los derechos humanos. Ahora es crucial que se realicen verdaderos avances en el ámbito de los derechos humanos. No estamos hablando aquí de dogmatismo moralista sino de una situación urgente que la Unión Europea debe ayudar a solucionar. ']"
22, 2. Relaciones UE/Túnez (debate) ,"  Alf Svensson  (PPE).   – (SV) A los países del Norte de África se les mete a menudo en el mismo saco y eso, a mi modo de ver, le hace un flaco favor a Túnez.Se ha mencionado la igualdad. En comparación con muchos otros países árabes, Túnez es una excepción al contar con una legislación que protege a los niños y también a las mujeres. Como ya se ha señalado, en las universidades tunecinas hay más mujeres que hombres y el nivel de vida ha mejorado. La infraestructura del país está en buenas condiciones. Desde las elecciones, el Parlamento ha elegido, o designado, un comité de derechos humanos.La voluntad de Túnez de cooperar con la UE es una oportunidad que deberíamos recibir con los brazos abiertos. Ahora que una delegación de Túnes visita Bruselas y Estrasburgo y solicita apoyo en su labor de promoción de los derechos humanos y para mejorar y profundizar su relación con la UE, considero que sería contrario a los principios comunitarios no dar una respuesta positiva a esas peticiones y no estrechar las relaciones. ",Alf Svensson  (PPE).,3,180,not_available,"['swe', 'swe', 'swe']","['  Alf Svensson  (PPE).   – (SV) A los países del Norte de África se les mete a menudo en el mismo saco y eso, a mi modo de ver, le hace un flaco favor a Túnez.', 'Se ha mencionado la igualdad. En comparación con muchos otros países árabes, Túnez es una excepción al contar con una legislación que protege a los niños y también a las mujeres. Como ya se ha señalado, en las universidades tunecinas hay más mujeres que hombres y el nivel de vida ha mejorado. La infraestructura del país está en buenas condiciones. Desde las elecciones, el Parlamento ha elegido, o designado, un comité de derechos humanos.', 'La voluntad de Túnez de cooperar con la UE es una oportunidad que deberíamos recibir con los brazos abiertos. Ahora que una delegación de Túnes visita Bruselas y Estrasburgo y solicita apoyo en su labor de promoción de los derechos humanos y para mejorar y profundizar su relación con la UE, considero que sería contrario a los principios comunitarios no dar una respuesta positiva a esas peticiones y no estrechar las relaciones. ']"
23, 2. Relaciones UE/Túnez (debate) ,"  Rosario Crocetta  (S&D).   – (IT) Señor Presidente, Señorías, yo que visito Túnez dos o tres veces al año desde 1982 y que, como católico, fue a misa el 6 de enero, como hago habitualmente, me resulta muy difícil pensar que Túnez es un país que coarta la libertad religiosa.Claro que hay problemas pero, por amor de Dios, no observemos a estos países, países que tratan de avanzar, a través del prisma de los países occidentales, ya que si aplicáramos ese parámetro, un parámetro que alguien está aplicando esta mañana con respecto a Túnez, algunos países europeos verían probablemente denegado su ingreso en la Unión Europea, ya que la violencia y denegación de libertad que existe en ellos es mucho mayor que en Túnez.Por tanto, la cuestión se plantea como resultado de un hecho concreto, y es que estamos ante un país que ha abolido el fundamentalismo islámico, que se está esforzando por desarrollar una política de cooperación y de paz con Europa, que está tratando de evolucionar. Naturalmente hay problemas, pero yo creo que la manera de resolverlos es reforzando el diálogo y la amistad y ayudando a esos países a avanzar. ",Rosario Crocetta  (S&D).,3,194,not_available,"['ita', 'ita', 'ita']","['  Rosario Crocetta  (S&D).   – (IT) Señor Presidente, Señorías, yo que visito Túnez dos o tres veces al año desde 1982 y que, como católico, fue a misa el 6 de enero, como hago habitualmente, me resulta muy difícil pensar que Túnez es un país que coarta la libertad religiosa.', 'Claro que hay problemas pero, por amor de Dios, no observemos a estos países, países que tratan de avanzar, a través del prisma de los países occidentales, ya que si aplicáramos ese parámetro, un parámetro que alguien está aplicando esta mañana con respecto a Túnez, algunos países europeos verían probablemente denegado su ingreso en la Unión Europea, ya que la violencia y denegación de libertad que existe en ellos es mucho mayor que en Túnez.', 'Por tanto, la cuestión se plantea como resultado de un hecho concreto, y es que estamos ante un país que ha abolido el fundamentalismo islámico, que se está esforzando por desarrollar una política de cooperación y de paz con Europa, que está tratando de evolucionar. Naturalmente hay problemas, pero yo creo que la manera de resolverlos es reforzando el diálogo y la amistad y ayudando a esos países a avanzar. ']"
24, 2. Relaciones UE/Túnez (debate) ,"  Neelie Kroes,  Miembro de la Comisión. – Señor Presidente, doy gracias a Sus Señorías por ser tan abiertos y directos y por hacer sus comentarios de tal forma que, a pesar de que determinados grupos tienen planteamientos diferentes, todos insisten en cómo podemos encontrar una solución.Dicho esto, para empezar quiero hacer una observación en respuesta a la declaración del señor Désir con respecto a una observación de Louis Michel. Estoy segura de que Louis Michel puede hablar por si mismo, pero estuvimos en el mismo equipo en una vida anterior, por así decirlo, así que sé cuál es su posición sobre esta cuestión. Si el señor Désir dice que la propuesta es que no hagamos nada, no es esa la impresión que yo tengo, y espero sinceramente que mi observación inicial tampoco les haya dado a ustedes esa impresión.Efectivamente, hay una diferencia de enfoque. Algunos simplemente piden un diálogo en pie de igualdad, como hace el señor Kasoulides. Ha habido llamamientos al establecimiento de vínculos de amistad. Todos esos planteamientos implican sentarse a una mesa y debatir, tratando de llegar a un entendimiento mutuo en torno a la forma de resolver un par de cuestiones sobre las que todos estamos de acuerdo. No hay duda alguna al respecto, ya que los derechos humanos y la libertad de expresión son, desde luego, una parte esencial y muy importante de todo acuerdo.Dicho esto, quisiera abordar un par de cuestiones que se han planteado. En primer lugar, el refuerzo de las instituciones. Lo que tratamos de fomentar y alentar en todas las reuniones que se celebran o están previstas para los próximos meses es el establecimiento de un diálogo periódico como medio de lograr avances esenciales en los ámbitos de los derechos humanos y la democracia.A lo largo de los dos próximes meses se va a reunir la Subcomisión de Derechos Humanos y pueden ustedes estar seguros de que el diálogo será sustancial y se plantearán cuestiones que a todos nos preocupan y la forma de abordarlas.En cuanto a la violación de los derechos humanos en Túnez, los oradores se han referido varias veces al hecho de que Túnez ha sido criticado por su trayectoria en la esfera de los derechos humanos. Desde las elecciones presidenciales y legislativas celebradas en el mes de octubre del pasado año, se ha recrudecido la represión contra los partidos de la oposición, los periodistas y los activistas de derechos humanos. La comunidad internacional ha dejado muy claro que ese tipo de comportamiento de las autoridades es inaceptable y contrario a los compromisos internacionales de Túnez. Así pues, para reiterar lo que ya he dicho, dentro de la Unión Europea no debería haber malentendido alguno: los compromisos son los compromisos y debemos mantenernos en esa línea.Efectivamente, Túnez debe mostrar un compromiso más sólido con valores comunes fundamentales, como el respeto de los derechos humanos, la democracia y el Estado de Derecho. Además, debería respetar también sus propios compromisos internacionales en ese ámbito. La Comisión seguirá adelante con su política de compromiso y diálogo en torno a esas cuestiones, en particular en el marco de los órganos creados en virtud del acuerdo de asociación.Al mismo tiempo, la Unión Europea está brindando apoyo con el fin de mejorar la gobernanza y fomentar las reformas en el ámbito de la justicia, mediante la cooperación y la asistencia  técnica. Nuestra prioridad consiste en avanzar con Túnez en ese ámbito, por ejemplo, mediante la promoción activa de los activistas de derechos humanos y las organizaciones de la sociedad civil en el marco del Instrumento Europeo para la Democracia y los Derechos Humanos.También se están realizando esfuerzos en el ámbito de la cooperación judicial. La UE destina 17,5 millones de euros para financiar un proyecto de asistencia técnica destinado a modernizar el poder judicial. Algunos diputados de esta Cámara lo han criticado, ya que financia el sistema judicial del Presidente de Túnez.El proyecto tiene diversos componentes. Incluye la formación de jueces y abogados, asistencia técnica a los tribunales, infraestructura y mejora de la información a los ciudadanos. Una vez que finalice el proyecto, evaluaremos los resultados. Desde luego estoy de acuerdo en que la labor en ese ámbito nos expone a determinados riesgos políticos. No obstante, si queremos fomentar las reformas, tenemos que actuar, ya que, de lo contrario, la cooperación de la UE quedará limitada únicamente al sector económico. Todos estamos de acuerdo en que ése no es el planteamiento adecuado, y seríamos incoherentes con los objetivos de nuestra propia política general en lo que respecta a las relaciones con Túnez.En cuanto a la cuestión que plantearon la señora Flautre y la señora Vergiat, el estatuto avanzado de Túnez, considero que se debería dar prioridad a la continuación y al refuerzo del diálogo con Túnez. Somos conscientes de que es un aliado importante de la UE en la región y de que ha realizado avances importantes en cuanto a la modernización económica y social. Tal vez todo dependa de cómo vemos la botella, si medio llena o medio vacía. Dicho esto, consideramos que tenemos que proseguir con nuestra política de apoyo a las fuerzas de Túnez que trabajan para lograr la modernización política, económica y social del país. Estamos a favor de las propuestas de Túnez con miras a reforzar la relación entre ambos socios. El Consejo y la Comisión analizarán detenidamente estas cuestiones y estoy dispuesta a informarles de todas las novedades que se produzcan.Por otra parte, aunque reforzar las relaciones con Túnez va en interés de la UE, creo que conceder el estatuto avanzado debería entrañar un fuerte compromiso por parte de Túnez con respecto a los derechos humanos y la gobernanza, así que no habrá «barra libre». ","Neelie Kroes,",12,958,not_available,"['spa', 'spa', 'spa', 'spa', 'spa', 'spa', 'spa', 'spa', 'spa', 'spa', 'spa', 'spa']","['  Neelie Kroes,  Miembro de la Comisión. – Señor Presidente, doy gracias a Sus Señorías por ser tan abiertos y directos y por hacer sus comentarios de tal forma que, a pesar de que determinados grupos tienen planteamientos diferentes, todos insisten en cómo podemos encontrar una solución.', 'Dicho esto, para empezar quiero hacer una observación en respuesta a la declaración del señor Désir con respecto a una observación de Louis Michel. Estoy segura de que Louis Michel puede hablar por si mismo, pero estuvimos en el mismo equipo en una vida anterior, por así decirlo, así que sé cuál es su posición sobre esta cuestión. Si el señor Désir dice que la propuesta es que no hagamos nada, no es esa la impresión que yo tengo, y espero sinceramente que mi observación inicial tampoco les haya dado a ustedes esa impresión.', 'Efectivamente, hay una diferencia de enfoque. Algunos simplemente piden un diálogo en pie de igualdad, como hace el señor Kasoulides. Ha habido llamamientos al establecimiento de vínculos de amistad. Todos esos planteamientos implican sentarse a una mesa y debatir, tratando de llegar a un entendimiento mutuo en torno a la forma de resolver un par de cuestiones sobre las que todos estamos de acuerdo. No hay duda alguna al respecto, ya que los derechos humanos y la libertad de expresión son, desde luego, una parte esencial y muy importante de todo acuerdo.', 'Dicho esto, quisiera abordar un par de cuestiones que se han planteado. En primer lugar, el refuerzo de las instituciones. Lo que tratamos de fomentar y alentar en todas las reuniones que se celebran o están previstas para los próximos meses es el establecimiento de un diálogo periódico como medio de lograr avances esenciales en los ámbitos de los derechos humanos y la democracia.', 'A lo largo de los dos próximes meses se va a reunir la Subcomisión de Derechos Humanos y pueden ustedes estar seguros de que el diálogo será sustancial y se plantearán cuestiones que a todos nos preocupan y la forma de abordarlas.', 'En cuanto a la violación de los derechos humanos en Túnez, los oradores se han referido varias veces al hecho de que Túnez ha sido criticado por su trayectoria en la esfera de los derechos humanos. Desde las elecciones presidenciales y legislativas celebradas en el mes de octubre del pasado año, se ha recrudecido la represión contra los partidos de la oposición, los periodistas y los activistas de derechos humanos. La comunidad internacional ha dejado muy claro que ese tipo de comportamiento de las autoridades es inaceptable y contrario a los compromisos internacionales de Túnez. Así pues, para reiterar lo que ya he dicho, dentro de la Unión Europea no debería haber malentendido alguno: los compromisos son los compromisos y debemos mantenernos en esa línea.', 'Efectivamente, Túnez debe mostrar un compromiso más sólido con valores comunes fundamentales, como el respeto de los derechos humanos, la democracia y el Estado de Derecho. Además, debería respetar también sus propios compromisos internacionales en ese ámbito. La Comisión seguirá adelante con su política de compromiso y diálogo en torno a esas cuestiones, en particular en el marco de los órganos creados en virtud del acuerdo de asociación.', 'Al mismo tiempo, la Unión Europea está brindando apoyo con el fin de mejorar la gobernanza y fomentar las reformas en el ámbito de la justicia, mediante la cooperación y la asistencia  técnica. Nuestra prioridad consiste en avanzar con Túnez en ese ámbito, por ejemplo, mediante la promoción activa de los activistas de derechos humanos y las organizaciones de la sociedad civil en el marco del Instrumento Europeo para la Democracia y los Derechos Humanos.', 'También se están realizando esfuerzos en el ámbito de la cooperación judicial. La UE destina 17,5 millones de euros para financiar un proyecto de asistencia técnica destinado a modernizar el poder judicial. Algunos diputados de esta Cámara lo han criticado, ya que financia el sistema judicial del Presidente de Túnez.', 'El proyecto tiene diversos componentes. Incluye la formación de jueces y abogados, asistencia técnica a los tribunales, infraestructura y mejora de la información a los ciudadanos. Una vez que finalice el proyecto, evaluaremos los resultados. Desde luego estoy de acuerdo en que la labor en ese ámbito nos expone a determinados riesgos políticos. No obstante, si queremos fomentar las reformas, tenemos que actuar, ya que, de lo contrario, la cooperación de la UE quedará limitada únicamente al sector económico. Todos estamos de acuerdo en que ése no es el planteamiento adecuado, y seríamos incoherentes con los objetivos de nuestra propia política general en lo que respecta a las relaciones con Túnez.', 'En cuanto a la cuestión que plantearon la señora Flautre y la señora Vergiat, el estatuto avanzado de Túnez, considero que se debería dar prioridad a la continuación y al refuerzo del diálogo con Túnez. Somos conscientes de que es un aliado importante de la UE en la región y de que ha realizado avances importantes en cuanto a la modernización económica y social. Tal vez todo dependa de cómo vemos la botella, si medio llena o medio vacía. Dicho esto, consideramos que tenemos que proseguir con nuestra política de apoyo a las fuerzas de Túnez que trabajan para lograr la modernización política, económica y social del país. Estamos a favor de las propuestas de Túnez con miras a reforzar la relación entre ambos socios. El Consejo y la Comisión analizarán detenidamente estas cuestiones y estoy dispuesta a informarles de todas las novedades que se produzcan.', 'Por otra parte, aunque reforzar las relaciones con Túnez va en interés de la UE, creo que conceder el estatuto avanzado debería entrañar un fuerte compromiso por parte de Túnez con respecto a los derechos humanos y la gobernanza, así que no habrá «barra libre». ']"
25, 2. Relaciones UE/Túnez (debate) ,  Presidente.   – Se cierra el debate.Declaraciones por escrito (artículo 149 del Reglamento) ,Presidente.,2,12,not_available,"['spa', 'spa']","['  Presidente.   – Se cierra el debate.', 'Declaraciones por escrito (artículo 149 del Reglamento) ']"
