,agenda_item,text,speaker,number_p,number_w,chair,language_ps,ps
43, 3.1. Ataques recientes contra las minorías religiosas en Egipto y en Malasia,"  Eija-Riitta Korhola  (PPE). -  (FI) Señor Presidente, hemos escuchado de varias fuentes noticias preocupantes sobre crímenes cometidos contra cristianos en Egipto y en Malasia. Con respecto a Malasia, quisiera decir en primer lugar que nos preocupan profundamente los ataques a las iglesias en un país que tradicionalmente ha sido tolerante y moderado.En segundo lugar, me gustaría mencionar la labor ejemplar de las organizaciones no gubernamentales islámicas en nombre de la tolerancia religiosa. Las declaraciones del Primer Ministro de Malasia sobre el uso del nombre de Alá provocaron una demostración de descontento público hacia las comunidades cristianas. Sin embargo, la actitud ejemplar de las ONG islámicas y la postura pública de firmeza ante las declaraciones del Primer Ministro calmaron la situación. Es de lamentar que no lo hayamos reflejado en nuestra resolución definitiva, ya que, en mi opinión, apenas prestamos atención a situaciones positivas. ¿Acaso no deberían ser alabados los musulmanes cuando hay motivos para ello?La tolerancia religiosa debe ser fomentada tanto por quienes ostentan el poder político como por la comunidad. Es igualmente importante ser conscientes de que se han cometido errores, como también lo es reconocer el progreso realizado y prestar apoyo para seguir avanzando. ",Eija-Riitta Korhola  (PPE). -,3,198,not_available,"['fin', 'fin', 'fin']","['  Eija-Riitta Korhola  (PPE). -  (FI) Señor Presidente, hemos escuchado de varias fuentes noticias preocupantes sobre crímenes cometidos contra cristianos en Egipto y en Malasia. Con respecto a Malasia, quisiera decir en primer lugar que nos preocupan profundamente los ataques a las iglesias en un país que tradicionalmente ha sido tolerante y moderado.', 'En segundo lugar, me gustaría mencionar la labor ejemplar de las organizaciones no gubernamentales islámicas en nombre de la tolerancia religiosa. Las declaraciones del Primer Ministro de Malasia sobre el uso del nombre de Alá provocaron una demostración de descontento público hacia las comunidades cristianas. Sin embargo, la actitud ejemplar de las ONG islámicas y la postura pública de firmeza ante las declaraciones del Primer Ministro calmaron la situación. Es de lamentar que no lo hayamos reflejado en nuestra resolución definitiva, ya que, en mi opinión, apenas prestamos atención a situaciones positivas. ¿Acaso no deberían ser alabados los musulmanes cuando hay motivos para ello?', 'La tolerancia religiosa debe ser fomentada tanto por quienes ostentan el poder político como por la comunidad. Es igualmente importante ser conscientes de que se han cometido errores, como también lo es reconocer el progreso realizado y prestar apoyo para seguir avanzando. ']"
44, 3.1. Ataques recientes contra las minorías religiosas en Egipto y en Malasia,"  Dominique Baudis  (PPE).   – (FR) Señor Presidente, los actos cometidos por criminales fanáticos, que han asesinado a varios cristianos en Egipto, no pueden atribuirse a toda una población y a su Gobierno. Sería injusto considerar responsable a Egipto y a los egipcios de esta masacre terrible, cuyos autores serán juzgados.¡No debemos confundir los actos de un criminal con la política de un país entero! No debemos medir por el mismo rasero a los fánaticos y a una población entera. Por último, al tratar de interponernos entre los cristianos cristianos y sus compatriotas musulmanes, estamos echando más leña al fuego de los extremistas, quienes desean presentar a los cristianos orientales como agentes de Occidente. ",Dominique Baudis  (PPE).,2,113,not_available,"['fra', 'fra']","['  Dominique Baudis  (PPE).   – (FR) Señor Presidente, los actos cometidos por criminales fanáticos, que han asesinado a varios cristianos en Egipto, no pueden atribuirse a toda una población y a su Gobierno. Sería injusto considerar responsable a Egipto y a los egipcios de esta masacre terrible, cuyos autores serán juzgados.', '¡No debemos confundir los actos de un criminal con la política de un país entero! No debemos medir por el mismo rasero a los fánaticos y a una población entera. Por último, al tratar de interponernos entre los cristianos cristianos y sus compatriotas musulmanes, estamos echando más leña al fuego de los extremistas, quienes desean presentar a los cristianos orientales como agentes de Occidente. ']"
45, 3.1. Ataques recientes contra las minorías religiosas en Egipto y en Malasia,"  László Tőkés  (PPE). -  (HU) Hay una noticia muy reciente sobre la detención hace unos días, a manos del régimen egipcio, de varios activistas de los derechos de los coptos, que viajaban hacia el lugar de los crímenes que ocurrieron en el asentamiento de Nag Hammadi, para defender y apoyar a las comunidades cristianas coptas del lugar, que vieron como asesinaban a varios de sus miembros el día de Navidad. Las autoridades egipcias, que mantienen una actitud parcial a favor de la mayoría musulmana, están tratando de restar importancia a los actos violentos cometidos contra la minoría copta y están bloqueando el derecho legítimo de los cristianos, manifestando con ello un sesgo discriminatorio hacia una de las partes involucradas. La administración de los Estados Unidos se ha pronunciado de manera inequívoca en contra de esta actitud. Sabiendo que la comunidad cristiana copta, considerada nativa de Egipto, ha sido sometida a menudo, durante más de 1 500 años, a una cruel opresión, la Unión Europea debería defenderla con más vigor y sin las ambigüedades que caracterizan a su posición actual. ",László Tőkés  (PPE). -,1,178,not_available,['hun'],"['  László Tőkés  (PPE). -  (HU) Hay una noticia muy reciente sobre la detención hace unos días, a manos del régimen egipcio, de varios activistas de los derechos de los coptos, que viajaban hacia el lugar de los crímenes que ocurrieron en el asentamiento de Nag Hammadi, para defender y apoyar a las comunidades cristianas coptas del lugar, que vieron como asesinaban a varios de sus miembros el día de Navidad. Las autoridades egipcias, que mantienen una actitud parcial a favor de la mayoría musulmana, están tratando de restar importancia a los actos violentos cometidos contra la minoría copta y están bloqueando el derecho legítimo de los cristianos, manifestando con ello un sesgo discriminatorio hacia una de las partes involucradas. La administración de los Estados Unidos se ha pronunciado de manera inequívoca en contra de esta actitud. Sabiendo que la comunidad cristiana copta, considerada nativa de Egipto, ha sido sometida a menudo, durante más de 1 500 años, a una cruel opresión, la Unión Europea debería defenderla con más vigor y sin las ambigüedades que caracterizan a su posición actual. ']"
46, 3.1. Ataques recientes contra las minorías religiosas en Egipto y en Malasia,"  Anna Záborská  (PPE).   – (SK) Gracias por prestar atención de nuevo a las violaciones de la libertad religiosa en determinados países, como ocurrió en 2007 y 2008. Me pregunto si es la debilidad o la indeferencia de la UE lo que le impide fomentar de manera más sistemática el respeto de los derechos humanos en esa zona. Seguimos escuchando las mismas quejas y proponiendo las mismas medidas.Egipto y Malasia son dos de los países en los que los cristianos viven en condiciones extremadamente peligrosas, soportan persecuciones, son expulsados de sus hogares, son objeto de desapariciones y asesinatos, y sus iglesias se clausuran. Esto ocurre tanto en el Magreb como en Irán, la India, China, Pakistán y otros muchos países. Normalmente los cristianos son perseguidos por grupos extremistas. Ahora bien, esta persecución representa un peligro para todos: cristianos, judíos y musulmanes. Solicito a los representantes de la UE y a las delegaciones del Parlamento Europeo que aprovechen todas las oportunidades para mejorar el diálogo, la tolerancia religiosa y el respeto y la coexistencia de culturas diferentes. ",Anna Záborská  (PPE).,2,175,not_available,"['slo', 'slo']","['  Anna Záborská  (PPE).   – (SK) Gracias por prestar atención de nuevo a las violaciones de la libertad religiosa en determinados países, como ocurrió en 2007 y 2008. Me pregunto si es la debilidad o la indeferencia de la UE lo que le impide fomentar de manera más sistemática el respeto de los derechos humanos en esa zona. Seguimos escuchando las mismas quejas y proponiendo las mismas medidas.', 'Egipto y Malasia son dos de los países en los que los cristianos viven en condiciones extremadamente peligrosas, soportan persecuciones, son expulsados de sus hogares, son objeto de desapariciones y asesinatos, y sus iglesias se clausuran. Esto ocurre tanto en el Magreb como en Irán, la India, China, Pakistán y otros muchos países. Normalmente los cristianos son perseguidos por grupos extremistas. Ahora bien, esta persecución representa un peligro para todos: cristianos, judíos y musulmanes. Solicito a los representantes de la UE y a las delegaciones del Parlamento Europeo que aprovechen todas las oportunidades para mejorar el diálogo, la tolerancia religiosa y el respeto y la coexistencia de culturas diferentes. ']"
47, 3.1. Ataques recientes contra las minorías religiosas en Egipto y en Malasia,"  Mitro Repo  (S&D). -  (FI) Señor Presidente, me preocupa especialmente la situación en Egipto, debido a su trasfondo histórico, étnico y político. En realidad, los cristianos coptos siguen siendo una minoría considerable. En Egipto, aproximadamente el 10% de la población, ocho millones, son cristianos coptos y precisamente por ese motivo se trata de una antigua mayoría. Ellos están orgullosos de ello y de su tradición cristiana oriental. Por eso, la provocación que tuvo lugar durante la celebración de la Navidad el pasado mes de enero fue especialmente flagrante y premeditada. Además, muchos coptos han sido presionados con violencia para cambiar sus creencias y ha habido casos de violación y otros delitos.La situación en Egipto es un ejemplo nocivo para otros países donde existe la posibilidad de que ocurra la misma espiral de venganza, y precisamente por ese motivo la UE debe estar vigilante, intervenir inmediatamente cuando haya problemas y subrayar la importancia del diálogo pacífico entre grupos religiosos. ",Mitro Repo  (S&D). -,2,159,not_available,"['fin', 'fin']","['  Mitro Repo  (S&D). -  (FI) Señor Presidente, me preocupa especialmente la situación en Egipto, debido a su trasfondo histórico, étnico y político. En realidad, los cristianos coptos siguen siendo una minoría considerable. En Egipto, aproximadamente el 10% de la población, ocho millones, son cristianos coptos y precisamente por ese motivo se trata de una antigua mayoría. Ellos están orgullosos de ello y de su tradición cristiana oriental. Por eso, la provocación que tuvo lugar durante la celebración de la Navidad el pasado mes de enero fue especialmente flagrante y premeditada. Además, muchos coptos han sido presionados con violencia para cambiar sus creencias y ha habido casos de violación y otros delitos.', 'La situación en Egipto es un ejemplo nocivo para otros países donde existe la posibilidad de que ocurra la misma espiral de venganza, y precisamente por ese motivo la UE debe estar vigilante, intervenir inmediatamente cuando haya problemas y subrayar la importancia del diálogo pacífico entre grupos religiosos. ']"
48, 3.1. Ataques recientes contra las minorías religiosas en Egipto y en Malasia,"  Ivo Vajgl  (ALDE). -  (SL) Cuando se comete un asesinato, especialmente por motivos religiosos, desde luego no nos queda otro remedio que rechazarlo horrorizados y condenarlo.No obstante, este nuevo incidente, este nuevo crimen en Oriente Medio es, en realidad, una prueba de la situación en general, de la actual intolerancia ante la libertad religiosa y la falta de respeto hacia los que son diferentes. Es decir, hay muchos lugares en los que no se respetan los valores religiosos.El motivo por el que el Grupo de la Alianza de los Liberales y Demócratas por Europa ha propuesto aplazar este debate o, más bien, que los debates sobre el respeto de los derechos humanos y las libertades religiosas en Egipto y en Malasia se celebren por separado, es porque hay que tratar este tema con mucho cuidado y considerar cada país por separado. Egipto no es desde luego uno de los peores ejemplos de intolerancia religiosa. Antes bien al contrario. ",Ivo Vajgl  (ALDE). -,3,159,not_available,"['slv', 'slv', 'slv']","['  Ivo Vajgl  (ALDE). -  (SL) Cuando se comete un asesinato, especialmente por motivos religiosos, desde luego no nos queda otro remedio que rechazarlo horrorizados y condenarlo.', 'No obstante, este nuevo incidente, este nuevo crimen en Oriente Medio es, en realidad, una prueba de la situación en general, de la actual intolerancia ante la libertad religiosa y la falta de respeto hacia los que son diferentes. Es decir, hay muchos lugares en los que no se respetan los valores religiosos.', 'El motivo por el que el Grupo de la Alianza de los Liberales y Demócratas por Europa ha propuesto aplazar este debate o, más bien, que los debates sobre el respeto de los derechos humanos y las libertades religiosas en Egipto y en Malasia se celebren por separado, es porque hay que tratar este tema con mucho cuidado y considerar cada país por separado. Egipto no es desde luego uno de los peores ejemplos de intolerancia religiosa. Antes bien al contrario. ']"
49, 3.1. Ataques recientes contra las minorías religiosas en Egipto y en Malasia,"  Charles Tannock  (ECR). -   Señor Presidente, desgraciadamente, en el mundo islámico hay un clima general de creciente militancia jihadista en contra sobre todo de las comunidades no musulmanas, lo que sobre todo y más frecuentemente se refiere a los cristianos.Los coptos, que representan a una de las iglesias cristianas más antiguas del mundo, cuentan con una nutrida diáspora en Londres, a la que yo represento. Sus líderes se han dirigido a mí para quejarse del lamentable empeoramiento de la situación en Egipto, orquestada por los Hermanos Musulmanes. A pesar de los enormes esfuerzos realizados por el gobierno del Presidente Mubarak para protegerlos, la situación se ha deteriorado.Asistimos a historias similares en el caso de los cristianos asirios en Irak, los cristianos de Palestina y Pakistán y ahora, por vez primera, incluso en Malasia.Esta Cámara ha ignorado –durante demasiado tiempo, creo yo– los derechos de la minoría cristiana en el resto del mundo, si bien ellos acuden a la Unión Europea y a los Estados Unidos en busca de protección. Por tanto, me satisface esta resolución. ",Charles Tannock  (ECR). -,4,177,not_available,"['spa', 'spa', 'spa', 'spa']","['  Charles Tannock  (ECR). -   Señor Presidente, desgraciadamente, en el mundo islámico hay un clima general de creciente militancia jihadista en contra sobre todo de las comunidades no musulmanas, lo que sobre todo y más frecuentemente se refiere a los cristianos.', 'Los coptos, que representan a una de las iglesias cristianas más antiguas del mundo, cuentan con una nutrida diáspora en Londres, a la que yo represento. Sus líderes se han dirigido a mí para quejarse del lamentable empeoramiento de la situación en Egipto, orquestada por los Hermanos Musulmanes. A pesar de los enormes esfuerzos realizados por el gobierno del Presidente Mubarak para protegerlos, la situación se ha deteriorado.', 'Asistimos a historias similares en el caso de los cristianos asirios en Irak, los cristianos de Palestina y Pakistán y ahora, por vez primera, incluso en Malasia.', 'Esta Cámara ha ignorado –durante demasiado tiempo, creo yo– los derechos de la minoría cristiana en el resto del mundo, si bien ellos acuden a la Unión Europea y a los Estados Unidos en busca de protección. Por tanto, me satisface esta resolución. ']"
50, 3.1. Ataques recientes contra las minorías religiosas en Egipto y en Malasia,"  Gerard Batten  (EFD). -   Señor Presidente, la persecución de los cristianos y de otras minorías religiosas está aumentando en los países islámicos. A los cristianos, que viven en países como Egipto y en la zona del Mediterráneo desde hace casi dos mil años, cada vez se les persigue más y se les expulsa de sus patrias ancestrales. Esto se debe al poder creciente del fundamentalismo intolerante y de la ideología islámica extremista: el islamofascismo.La persecución de las minorías cristianas y otras en el mundo islámico reciben escasa atención en los medios de comunicación occidentales. Los medios de comunicación no sólo deberían informar de los casos de persecución cuando suceden sino que también deberían explicar al público en general los motivos por los que suceden. Deberían explicar quiénes son sus autores: básicamente, musulmanes fanáticos; y por qué lo hacen: a causa de los rasgos de intolerancia y violencia que a veces pueden detectarse en la ideología islámica.Los gobiernos democráticos de todo el mundo deberían ejercer la máxima presión diplomática posible sobre países como Egipto a fin de eliminar esa persecución intolerable. ",Gerard Batten  (EFD). -,3,181,not_available,"['spa', 'spa', 'spa']","['  Gerard Batten  (EFD). -   Señor Presidente, la persecución de los cristianos y de otras minorías religiosas está aumentando en los países islámicos. A los cristianos, que viven en países como Egipto y en la zona del Mediterráneo desde hace casi dos mil años, cada vez se les persigue más y se les expulsa de sus patrias ancestrales. Esto se debe al poder creciente del fundamentalismo intolerante y de la ideología islámica extremista: el islamofascismo.', 'La persecución de las minorías cristianas y otras en el mundo islámico reciben escasa atención en los medios de comunicación occidentales. Los medios de comunicación no sólo deberían informar de los casos de persecución cuando suceden sino que también deberían explicar al público en general los motivos por los que suceden. Deberían explicar quiénes son sus autores: básicamente, musulmanes fanáticos; y por qué lo hacen: a causa de los rasgos de intolerancia y violencia que a veces pueden detectarse en la ideología islámica.', 'Los gobiernos democráticos de todo el mundo deberían ejercer la máxima presión diplomática posible sobre países como Egipto a fin de eliminar esa persecución intolerable. ']"
