,agenda_item,text,speaker,number_p,number_w,chair,language_ps,ps
42, 6. Orientamenti transitori riguardanti le procedure in materia di bilancio in vista dell’entrata in vigore del trattato di Lisbona (discussione),"  Göran Färm,  a nome del gruppo S&D. – (SV) Signor Presidente, il trattato di Lisbona porterà notevoli cambiamenti, soprattutto nel settore del bilancio. Come molti onorevoli colleghi hanno indicato, il cambiamento più importante riguarda l’eliminazione della distinzione tra spese obbligatorie e non obbligatorie. Il Parlamento europeo avrà potere di codecisione sul bilancio in toto nonché una nuova e semplificata procedura di bilancio. Il trattato è ora pronto e approvato, ma questo non significa si possa passare direttamente alla nuova procedura.In primo luogo, vi è pieno accordo sulla decisione di mettere in atto la procedura di bilancio per quest’anno in ottemperanza ai vecchi regolamenti poiché cambiare nel corso della lettura del bilancio potrebbe creare confusione. In secondo luogo, prima di poter applicare totalmente il nuovo trattato, è necessario raggiungere un accordo interistituzionale. Abbiamo bisogno di un aggiornamento del regolamento finanziario, di un nuovo bilancio, ri-negoziato e a lungo termine, e di un quadro finanziario pluriennale, in quanto parte di questa nuova legislazione. Tutto questo ovviamente richiede tempo. Per poter iniziare a lavorare sul bilancio nel 2010, sono necessari orientamenti transitori. Vorrei cogliere quest’opportunità per ringraziare il presidente della commissione per i bilanci, l’onorevole Lamassoure, che ha preso l’iniziativa per questa relazione, redatta in tempi record, continuando a cooperare strettamente con i vari gruppi della commissione. Le esprimo, ancora una volta, i miei ringraziamenti.  Nella relazione sono stati inclusi diversi pareri sulla natura delle nuove soluzioni permanenti. In particolare noi socialdemocratici abbiamo proposto alcuni pareri, il più importante questi dei quali è assicurare che i nuovi poteri del Parlamento siano applicati anche durante il periodo di transizione. Le nuove proposte da discutere devono condurre ad un nuovo accordo interistituzionale e l’aggiornamento del regolamento finanziario deve essere visto come un pacchetto per raggiungere un buon livello di funzionalità senza sovrapposizioni e problemi di interpretazione. Mi auguro che nell’odierno dialogo a tre, si riesca a raggiungere un accordo sulle questioni indicate. Per concludere, vorrei ricordare che i cambiamenti derivanti per la procedura di bilancio rappresentano un buon esempio di semplificazione e di riduzione delle procedure burocratiche, di cui l’Unione europea ha estremamente bisogno. ","Göran Färm,",5,359,not_available,"['swe', 'swe', 'swe', 'swe', 'swe']","['  Göran Färm,  a nome del gruppo S&D. – (SV) Signor Presidente, il trattato di Lisbona porterà notevoli cambiamenti, soprattutto nel settore del bilancio. Come molti onorevoli colleghi hanno indicato, il cambiamento più importante riguarda l’eliminazione della distinzione tra spese obbligatorie e non obbligatorie. Il Parlamento europeo avrà potere di codecisione sul bilancio in toto nonché una nuova e semplificata procedura di bilancio. Il trattato è ora pronto e approvato, ma questo non significa si possa passare direttamente alla nuova procedura.', 'In primo luogo, vi è pieno accordo sulla decisione di mettere in atto la procedura di bilancio per quest’anno in ottemperanza ai vecchi regolamenti poiché cambiare nel corso della lettura del bilancio potrebbe creare confusione. In secondo luogo, prima di poter applicare totalmente il nuovo trattato, è necessario raggiungere un accordo interistituzionale. Abbiamo bisogno di un aggiornamento del regolamento finanziario, di un nuovo bilancio, ri-negoziato e a lungo termine, e di un quadro finanziario pluriennale, in quanto parte di questa nuova legislazione. ', 'Tutto questo ovviamente richiede tempo. Per poter iniziare a lavorare sul bilancio nel 2010, sono necessari orientamenti transitori. Vorrei cogliere quest’opportunità per ringraziare il presidente della commissione per i bilanci, l’onorevole Lamassoure, che ha preso l’iniziativa per questa relazione, redatta in tempi record, continuando a cooperare strettamente con i vari gruppi della commissione. Le esprimo, ancora una volta, i miei ringraziamenti.  ', 'Nella relazione sono stati inclusi diversi pareri sulla natura delle nuove soluzioni permanenti. In particolare noi socialdemocratici abbiamo proposto alcuni pareri, il più importante questi dei quali è assicurare che i nuovi poteri del Parlamento siano applicati anche durante il periodo di transizione. Le nuove proposte da discutere devono condurre ad un nuovo accordo interistituzionale e l’aggiornamento del regolamento finanziario deve essere visto come un pacchetto per raggiungere un buon livello di funzionalità senza sovrapposizioni e problemi di interpretazione. ', 'Mi auguro che nell’odierno dialogo a tre, si riesca a raggiungere un accordo sulle questioni indicate. Per concludere, vorrei ricordare che i cambiamenti derivanti per la procedura di bilancio rappresentano un buon esempio di semplificazione e di riduzione delle procedure burocratiche, di cui l’Unione europea ha estremamente bisogno. ']"
43, 6. Orientamenti transitori riguardanti le procedure in materia di bilancio in vista dell’entrata in vigore del trattato di Lisbona (discussione),"  Anne E. Jensen,  a nome del gruppo ALDE. – (DA) Signor Presidente, vorrei iniziare il mio intervento affermando il mio piacere nel vedere l'attuazione del trattato di Lisbona, un trattato che conferisce più poteri al Parlamento per quanto riguarda il bilancio e che modifica la metodologia di adozione del bilancio annuale dell’Unione europea. Ci troviamo in una fase di transizione in cui il bilancio per il 2010 verrà adottato seguendo il precedente trattato, ma la sua attuazione sarà seguita e monitorata secondo le disposizioni dal nuovo trattato. In qualunque modo questo si risolva in pratica, si è già compiuto un primo passo con la relazione dell’onorevole Lamassoure, che vorrei ringraziare per aver preso l’iniziativa tanto rapidamente. Il gruppo dell’Alleanza dei Democratici e dei Liberali per l’Europa sostiene senza riserve questa relazione, che indica le modalità per occuparsi dei bilanci rettificativi, i trasferimenti e altre questioni già menzionate. Il gruppo Europa della Libertà e della Democrazia ha presentato diversi emendamenti per proporre l’abolizione dei bilanci rettificativi e dei trasferimenti, mozioni che il gruppo ALDE voterà a sfavore. Concordiamo con l’onorevole Lamassoure sul fatto che il numero di bilanci rettificativi dovrebbe essere ridotto; tuttavia, il verificarsi di eventi inattesi nel corso di un anno potrebbe rendere necessario il ricorso a tale strumento che, inoltre, è a disposizione dei parlamenti nazionali. E’ possibile apportare modifiche nel corso dell’anno, mentre il crescente numero di richieste di denaro da parte del Fondo europeo di adeguamento alla globalizzazione, combinato con l’elevato numero di licenziamenti porteranno, ovviamente, alla necessità di diversi bilanci rettificativi. Non dovremmo eliminare la possibilità di effettuare trasferimenti tra conti. dato che vi sono regolamenti ben precisi per quanto riguarda l’ammontare dei trasferimenti e le modalità per svolgerli. Non possono, infatti, essere condotti a piacimento della Commissione, ma è necessario interrogare il Parlamento e il Consiglio prima.  La relazioni indica che anche il regolamento finanziario e l’accordo interistituzionale dovrebbero essere emendati e mi auguro, personalmente, di ricevere a breve una proposta dalla Commissione in tal senso. ","Anne E. Jensen,",3,343,not_available,"['dan', 'dan', 'dan']","[""  Anne E. Jensen,  a nome del gruppo ALDE. – (DA) Signor Presidente, vorrei iniziare il mio intervento affermando il mio piacere nel vedere l'attuazione del trattato di Lisbona, un trattato che conferisce più poteri al Parlamento per quanto riguarda il bilancio e che modifica la metodologia di adozione del bilancio annuale dell’Unione europea. Ci troviamo in una fase di transizione in cui il bilancio per il 2010 verrà adottato seguendo il precedente trattato, ma la sua attuazione sarà seguita e monitorata secondo le disposizioni dal nuovo trattato. In qualunque modo questo si risolva in pratica, si è già compiuto un primo passo con la relazione dell’onorevole Lamassoure, che vorrei ringraziare per aver preso l’iniziativa tanto rapidamente. Il gruppo dell’Alleanza dei Democratici e dei Liberali per l’Europa sostiene senza riserve questa relazione, che indica le modalità per occuparsi dei bilanci rettificativi, i trasferimenti e altre questioni già menzionate. "", 'Il gruppo Europa della Libertà e della Democrazia ha presentato diversi emendamenti per proporre l’abolizione dei bilanci rettificativi e dei trasferimenti, mozioni che il gruppo ALDE voterà a sfavore. Concordiamo con l’onorevole Lamassoure sul fatto che il numero di bilanci rettificativi dovrebbe essere ridotto; tuttavia, il verificarsi di eventi inattesi nel corso di un anno potrebbe rendere necessario il ricorso a tale strumento che, inoltre, è a disposizione dei parlamenti nazionali. E’ possibile apportare modifiche nel corso dell’anno, mentre il crescente numero di richieste di denaro da parte del Fondo europeo di adeguamento alla globalizzazione, combinato con l’elevato numero di licenziamenti porteranno, ovviamente, alla necessità di diversi bilanci rettificativi. Non dovremmo eliminare la possibilità di effettuare trasferimenti tra conti. dato che vi sono regolamenti ben precisi per quanto riguarda l’ammontare dei trasferimenti e le modalità per svolgerli. Non possono, infatti, essere condotti a piacimento della Commissione, ma è necessario interrogare il Parlamento e il Consiglio prima.  ', 'La relazioni indica che anche il regolamento finanziario e l’accordo interistituzionale dovrebbero essere emendati e mi auguro, personalmente, di ricevere a breve una proposta dalla Commissione in tal senso. ']"
44, 6. Orientamenti transitori riguardanti le procedure in materia di bilancio in vista dell’entrata in vigore del trattato di Lisbona (discussione),"  Helga Trüpel,  a nome del gruppo Verts/ALE. – (DE) Signor Presidente, signor Commissario, a nome del gruppo Verde/Alleanza libera europea, vorrei dichiarare apertamente il nostro sostegno al mandato del presidente della commissione per i bilanci, l’onorevole Lamassoure. Siamo convinti che guiderà con risolutezza e in maniera eccellente questo periodo di transizione che ci troviamo, ora, ad affrontare. Siamo coscienti del fatto che, nel corso della transizione dal trattato di Nizza al trattato di Lisbona, che tutti stiamo aspettando e di cui tutti abbiamo bisogno per rendere l’Europa più democratica e trasparente, vi sia bisogno di regole precise.La commissione per i bilanci, insieme al Consiglio e altri, è responsabile della redazione del bilancio europeo e ribadiamo al Consiglio la nostra ferma volontà di salvaguardare e rafforzare i nostri diritti di deputati. Non permetteremo, e vale anche per le negoziazioni guidate dall’onorevole Lamassoure, che tali diritti vengano in qualche modo ridotti, poiché siamo certi che non vi debba essere alcun passaggio di potere al Consiglio.  Vorrei ricordare che è assolutamente necessario, occupandosi dei nuovi bilanci per i prossimi cinque anni, che il bilancio europeo sia redatto congiuntamente dagli Stati membri e dal Parlamento europeo in uno spirito davvero europeo. Solo allora potremo avere un’Europa orientata verso il futuro. Gradirei anche ricordare che, per quanto attiene ai regolamenti finanziari, che il denaro è deve essere stanziato agli Stati membri e al loro interno in modo sicuro, per evitare qualsiasi tipo di abuso. Non vi devono essere scandali o frodi, ma i regolamenti finanziari deveno essere resi più semplici e trasparenti affinché i programmi europei non creino problemi a livello locale e raggiungano effettivamente i cittadini. E’ questo il modo in cui dovremmo formulare la politica europea di bilancio per i cinque anni a venire. ","Helga Trüpel,",3,297,not_available,"['ger', 'ger', 'ger']","['  Helga Trüpel,  a nome del gruppo Verts/ALE. – (DE) Signor Presidente, signor Commissario, a nome del gruppo Verde/Alleanza libera europea, vorrei dichiarare apertamente il nostro sostegno al mandato del presidente della commissione per i bilanci, l’onorevole Lamassoure. Siamo convinti che guiderà con risolutezza e in maniera eccellente questo periodo di transizione che ci troviamo, ora, ad affrontare. Siamo coscienti del fatto che, nel corso della transizione dal trattato di Nizza al trattato di Lisbona, che tutti stiamo aspettando e di cui tutti abbiamo bisogno per rendere l’Europa più democratica e trasparente, vi sia bisogno di regole precise.', 'La commissione per i bilanci, insieme al Consiglio e altri, è responsabile della redazione del bilancio europeo e ribadiamo al Consiglio la nostra ferma volontà di salvaguardare e rafforzare i nostri diritti di deputati. Non permetteremo, e vale anche per le negoziazioni guidate dall’onorevole Lamassoure, che tali diritti vengano in qualche modo ridotti, poiché siamo certi che non vi debba essere alcun passaggio di potere al Consiglio.  ', 'Vorrei ricordare che è assolutamente necessario, occupandosi dei nuovi bilanci per i prossimi cinque anni, che il bilancio europeo sia redatto congiuntamente dagli Stati membri e dal Parlamento europeo in uno spirito davvero europeo. Solo allora potremo avere un’Europa orientata verso il futuro. Gradirei anche ricordare che, per quanto attiene ai regolamenti finanziari, che il denaro è deve essere stanziato agli Stati membri e al loro interno in modo sicuro, per evitare qualsiasi tipo di abuso. Non vi devono essere scandali o frodi, ma i regolamenti finanziari deveno essere resi più semplici e trasparenti affinché i programmi europei non creino problemi a livello locale e raggiungano effettivamente i cittadini. E’ questo il modo in cui dovremmo formulare la politica europea di bilancio per i cinque anni a venire. ']"
45, 6. Orientamenti transitori riguardanti le procedure in materia di bilancio in vista dell’entrata in vigore del trattato di Lisbona (discussione),"  Marta Andreasen,  a nome del gruppo EFD. – (EN) Signor Presidente, in seguito alla relazione dell’onorevole Guy-Quint dell’aprile 2008, il nuovo quadro normativo concernente le questioni finanziarie dovrebbe essere pronto per l’adozione. Tutte le istituzioni concordano sulla necessità di farlo in modo da evitare lacune giuridiche e non dovremmo, quindi, avere bisogno di orientamenti transitori per quanto riguarda le questioni di bilancio. La relazione presentata dall’onorevole Lamassoure pone l’accento sull’approvazione dei bilanci rettificativi e dei trasferimenti, che costituiscono pratiche rischiose e non appropriate evidenziando una mancanza di professionalità per quanto concerne le procedure di pianificazione e di bilancio, e che si riveleranno ancor più rischiose in un periodo di transizione.  L’attuale numero di bilanci rettificativi è elevato e non rispetta le condizioni stabilite dall’articolo 37 del regolamento finanziario. Anche l’attuale numero di trasferimenti è elevato, ma la situazione sarebbe diversa se vi fosse una migliore comprensione delle necessità dei diversi settori nei differenti paesi. In qualità di membro della commissione per i bilanci, mi sconvolge vedere come quasi tutta la commissione, me esclusa, approvi queste richieste di trasferimento.Non ritengo debbano essere approvati dei bilanci rettificativi nel corso di questo periodo di transizione e tutti gli sforzi dovrebbero concentrarsi sull’adozione di un quadro normativo al fine di evitare, in futuro, danni agli interessi dei contribuenti. ","Marta Andreasen,",6,225,not_available,"['eng', 'eng', 'eng', 'eng', 'eng', 'eng']","['  Marta Andreasen,  a nome del gruppo EFD. – (EN) Signor Presidente, in seguito alla relazione dell’onorevole Guy-Quint dell’aprile 2008, il nuovo quadro normativo concernente le questioni finanziarie dovrebbe essere pronto per l’adozione. Tutte le istituzioni concordano sulla necessità di farlo in modo da evitare lacune giuridiche e non dovremmo, quindi, avere bisogno di orientamenti transitori per quanto riguarda le questioni di bilancio. ', 'La relazione presentata dall’onorevole Lamassoure pone l’accento sull’approvazione dei bilanci rettificativi e dei trasferimenti, che costituiscono pratiche rischiose e non appropriate evidenziando una mancanza di professionalità per quanto concerne le procedure di pianificazione e di bilancio, e che si riveleranno ancor più rischiose in un periodo di transizione.  ', 'L’attuale numero di bilanci rettificativi è elevato e non rispetta le condizioni stabilite dall’articolo 37 del regolamento finanziario. ', 'Anche l’attuale numero di trasferimenti è elevato, ma la situazione sarebbe diversa se vi fosse una migliore comprensione delle necessità dei diversi settori nei differenti paesi. ', 'In qualità di membro della commissione per i bilanci, mi sconvolge vedere come quasi tutta la commissione, me esclusa, approvi queste richieste di trasferimento.', 'Non ritengo debbano essere approvati dei bilanci rettificativi nel corso di questo periodo di transizione e tutti gli sforzi dovrebbero concentrarsi sull’adozione di un quadro normativo al fine di evitare, in futuro, danni agli interessi dei contribuenti. ']"
46, 6. Orientamenti transitori riguardanti le procedure in materia di bilancio in vista dell’entrata in vigore del trattato di Lisbona (discussione),"  Daniël van der Stoep  (NI).   – (NL) Signor Presidente, il partito olandese per la libertà (PVV) siede per la prima al Parlamento europeo ed è sconvolgente notare questo atteggiamento mercenario assunto dai membri di questa Camera. Il Parlamento europeo assomiglia ad un anti-parlamento. L’obiettivo sembra essere quello di tirar fuori più denaro possibile dalle tasche dei cittadini e lavoratori dell’Europa e, in particolare, dei Paesi Bassi.  Sono stati spesi miliardi su questioni care alla sinistra, quali il clima e gli aiuti allo sviluppo, mentre nei Paesi Bassi i cittadini non sono ricevono adeguate cure negli ospedali, l’età minima per la pensione statale di anzianità (AOW) è stata innalzata a 67 anni e le forze di polizia sono costrette ad operare tagli al personali. Signor Presidente, questo Parlamento esiste per i cittadini, ma si occupa invece dei suoi schemi politicamente corretti, stravaganti e di quelli dei suoi compagni elitisti.  Sfortunatamente, gli irlandesi hanno approvato l’abominevole trattato di Lisbona, ma hanno almeno avuto la possibilità di scegliere. Il PPV considera vergognoso il fatto che questo terrificante trattato sia stato fatto ingoiare a forza agli olandesi. Questa è purtroppo la realtà e dovremo imparare a conviverci. Il PVV coopera in maniera costruttiva con questa Camera, eppure non possiamo essere d’accordo con questa relazione. I Paesi Bassi sono i più importanti contribuenti netti per cittadino e vogliamo che questa situazione cambi molto presto. La mia richiesta al relatore è di includere nella relazione una dichiarazione per richiedere al Parlamento europeo di invitare il Consiglio a porre fine il più rapidamente possibile alla perdurante condizione dei Paesi Bassi, in quanto maggior contribuente netto per cittadino.Se questo verrà dichiarato nella relazione, allora nel corso della votazione odierna vi saranno quattro luci verdi in più accese in questa Camera. Mi sembra un’opportunità d’oro per il relatore. Vorrei anche aggiungere che ci esprimiamo a favore degli emendamenti presentati dal gruppo Europa della Libertà e della Democrazia. ",Daniël van der Stoep  (NI).,5,326,not_available,"['dut', 'dut', 'dut', 'dut', 'dut']","['  Daniël van der Stoep  (NI).   – (NL) Signor Presidente, il partito olandese per la libertà (PVV) siede per la prima al Parlamento europeo ed è sconvolgente notare questo atteggiamento mercenario assunto dai membri di questa Camera. Il Parlamento europeo assomiglia ad un anti-parlamento. L’obiettivo sembra essere quello di tirar fuori più denaro possibile dalle tasche dei cittadini e lavoratori dell’Europa e, in particolare, dei Paesi Bassi.  ', 'Sono stati spesi miliardi su questioni care alla sinistra, quali il clima e gli aiuti allo sviluppo, mentre nei Paesi Bassi i cittadini non sono ricevono adeguate cure negli ospedali, l’età minima per la pensione statale di anzianità (AOW) è stata innalzata a 67 anni e le forze di polizia sono costrette ad operare tagli al personali. Signor Presidente, questo Parlamento esiste per i cittadini, ma si occupa invece dei suoi schemi politicamente corretti, stravaganti e di quelli dei suoi compagni elitisti.  ', 'Sfortunatamente, gli irlandesi hanno approvato l’abominevole trattato di Lisbona, ma hanno almeno avuto la possibilità di scegliere. Il PPV considera vergognoso il fatto che questo terrificante trattato sia stato fatto ingoiare a forza agli olandesi. Questa è purtroppo la realtà e dovremo imparare a conviverci. ', 'Il PVV coopera in maniera costruttiva con questa Camera, eppure non possiamo essere d’accordo con questa relazione. I Paesi Bassi sono i più importanti contribuenti netti per cittadino e vogliamo che questa situazione cambi molto presto. La mia richiesta al relatore è di includere nella relazione una dichiarazione per richiedere al Parlamento europeo di invitare il Consiglio a porre fine il più rapidamente possibile alla perdurante condizione dei Paesi Bassi, in quanto maggior contribuente netto per cittadino.', 'Se questo verrà dichiarato nella relazione, allora nel corso della votazione odierna vi saranno quattro luci verdi in più accese in questa Camera. Mi sembra un’opportunità d’oro per il relatore. Vorrei anche aggiungere che ci esprimiamo a favore degli emendamenti presentati dal gruppo Europa della Libertà e della Democrazia. ']"
