,agenda_item,text,speaker,number_p,number_w,chair,language_ps,ps
13, 5. Attività del Mediatore europeo (2008) (discussione),"  Erminia Mazzoni  (PPE).   – Signor Presidente, onorevoli colleghi, volevo ringraziare, come presidente della commissione petizioni, a nome di tutti i componenti della commissione, il Mediatore per l'attività svolta e per la puntuale relazione svolta. Vorrei ringraziare l'onorevole Paliadeli per il contributo eccellente che ha dato ai lavori della nostra commissione e tutti coloro che hanno partecipato alla discussione, perché dimostrano l'interesse e l'attenzione affinché questi strumenti di democrazia e di partecipazione siano implementati e raggiungano l'obiettivo che si prefiggono nei trattati.L'esame della relazione 2008 del Mediatore europeo ci testimonia che, purtroppo, il principio sancito nell'articolo 41 della Carta dei diritti fondamentali è ancora lontano dall'obiettivo della sua compiuta applicazione. Il diritto esercitato da 3 406 cittadini europei nel corso del 2008, per denunciare al Mediatore casi di cattiva amministrazione, dimostra un livello crescente di insoddisfazione, considerato che nel 2007 la cifra era di 3 211. Io credo che questo numero debba essere comparato con il grado di conoscenza e di consapevolezza e quindi ribadisco, contrariamente a quanto sostenuto dal collega che prima è intervenuto, che queste cifre testimoniano un grado elevato di insoddisfazione da parte dei cittadini. Ed è parzialmente consolatorio rilevare che di queste cifre solo una parte sia stata ritenuta di competenza del Mediatore europeo, perché buona parte dei reclami non acquisiti dal Mediatore europeo sono stati trasferiti ad altri organismi, tra cui anche la commissione petizioni che io presiedo.Quello di cui dobbiamo farci carico – credo – come istituzioni europee e in particolare come Parlamento, è anche la percezione della correttezza amministrativa, quanto siano percepite le nostre istituzioni come corrette. Fermo restando comunque il positivo riscontro di una maggiore funzionalità del Mediatore europeo, visti i maggiori numeri dei casi risolti fruttuosamente, noi come Parlamento cui sono state indirizzate circa il 10% delle denunce e come commissione alla quale è stato indirizzato il 60%...(Il Presidente richiama l'oratore al tempo di parola)Allora, mi permetto solo di aggiungere – visto che aveva concesso qualche tempo in più a qualcun altro, pensavo di potermi permettere qualche secondo in più Presidente, in qualità anche di presidente – che queste istituzioni hanno il dovere di andare avanti sulla strada del miglioramento di questi strumenti di democrazia e di partecipazione, perché abbiamo anche il trattato di Lisbona che introduce l'iniziativa popolare. Io credo che noi dobbiamo migliorare, senza modificarle, le funzioni di questi organismi; abbiamo il dovere di migliorare l'efficacia e la produttività degli strumenti che abbiamo dato ai cittadini, se vogliamo realmente contribuire a costruire l'Europa dei popoli. ",Erminia Mazzoni  (PPE).,5,426,not_available,"['ita', 'ita', 'ita', 'ita', 'ita']","[""  Erminia Mazzoni  (PPE).   – Signor Presidente, onorevoli colleghi, volevo ringraziare, come presidente della commissione petizioni, a nome di tutti i componenti della commissione, il Mediatore per l'attività svolta e per la puntuale relazione svolta. Vorrei ringraziare l'onorevole Paliadeli per il contributo eccellente che ha dato ai lavori della nostra commissione e tutti coloro che hanno partecipato alla discussione, perché dimostrano l'interesse e l'attenzione affinché questi strumenti di democrazia e di partecipazione siano implementati e raggiungano l'obiettivo che si prefiggono nei trattati."", ""L'esame della relazione 2008 del Mediatore europeo ci testimonia che, purtroppo, il principio sancito nell'articolo 41 della Carta dei diritti fondamentali è ancora lontano dall'obiettivo della sua compiuta applicazione. Il diritto esercitato da 3 406 cittadini europei nel corso del 2008, per denunciare al Mediatore casi di cattiva amministrazione, dimostra un livello crescente di insoddisfazione, considerato che nel 2007 la cifra era di 3 211. Io credo che questo numero debba essere comparato con il grado di conoscenza e di consapevolezza e quindi ribadisco, contrariamente a quanto sostenuto dal collega che prima è intervenuto, che queste cifre testimoniano un grado elevato di insoddisfazione da parte dei cittadini. Ed è parzialmente consolatorio rilevare che di queste cifre solo una parte sia stata ritenuta di competenza del Mediatore europeo, perché buona parte dei reclami non acquisiti dal Mediatore europeo sono stati trasferiti ad altri organismi, tra cui anche la commissione petizioni che io presiedo."", 'Quello di cui dobbiamo farci carico – credo – come istituzioni europee e in particolare come Parlamento, è anche la percezione della correttezza amministrativa, quanto siano percepite le nostre istituzioni come corrette. Fermo restando comunque il positivo riscontro di una maggiore funzionalità del Mediatore europeo, visti i maggiori numeri dei casi risolti fruttuosamente, noi come Parlamento cui sono state indirizzate circa il 10% delle denunce e come commissione alla quale è stato indirizzato il 60%...', ""(Il Presidente richiama l'oratore al tempo di parola)"", ""Allora, mi permetto solo di aggiungere – visto che aveva concesso qualche tempo in più a qualcun altro, pensavo di potermi permettere qualche secondo in più Presidente, in qualità anche di presidente – che queste istituzioni hanno il dovere di andare avanti sulla strada del miglioramento di questi strumenti di democrazia e di partecipazione, perché abbiamo anche il trattato di Lisbona che introduce l'iniziativa popolare. Io credo che noi dobbiamo migliorare, senza modificarle, le funzioni di questi organismi; abbiamo il dovere di migliorare l'efficacia e la produttività degli strumenti che abbiamo dato ai cittadini, se vogliamo realmente contribuire a costruire l'Europa dei popoli. ""]"
14, 5. Attività del Mediatore europeo (2008) (discussione),"  Kinga Göncz  (S&D).   – (HU) In qualità di membro della commissione per le petizioni, vorrei intervenire, sottolineando che il Mediatore europeo ha svolto il suo lavoro in modo molto equilibrato nel redigere la relazione annuale, che sostengo pienamente.Considero estremamente importante che il Mediatore europeo abbia tentato di ridurre il tempo di gestione dei casi. Dopotutto, sappiamo che se un cittadino presenta una denuncia, dal punto di vista della fiducia, è fondamentale che la pratica venga gestita rapidamente, affinché il ricorrente riceva tempestivamente una risposta. Sappiamo anche che il Mediatore europeo non ha la facoltà di gestire la maggior parte delle denunce. In questa prospettiva, nel prossimo futuro, sarà prioritario fornire ai cittadini dell’Unione europea quante più informazioni possibili in merito alle istituzioni da contattare per le diverse questioni.La cooperazione tra la Commissione e il Mediatore europeo è stata molto positiva e spero che lo stesso avvenga in futuro. ",Kinga Göncz  (S&D).,3,151,not_available,"['hun', 'hun', 'hun']","['  Kinga Göncz  (S&D).   – (HU) In qualità di membro della commissione per le petizioni, vorrei intervenire, sottolineando che il Mediatore europeo ha svolto il suo lavoro in modo molto equilibrato nel redigere la relazione annuale, che sostengo pienamente.', 'Considero estremamente importante che il Mediatore europeo abbia tentato di ridurre il tempo di gestione dei casi. Dopotutto, sappiamo che se un cittadino presenta una denuncia, dal punto di vista della fiducia, è fondamentale che la pratica venga gestita rapidamente, affinché il ricorrente riceva tempestivamente una risposta. Sappiamo anche che il Mediatore europeo non ha la facoltà di gestire la maggior parte delle denunce. In questa prospettiva, nel prossimo futuro, sarà prioritario fornire ai cittadini dell’Unione europea quante più informazioni possibili in merito alle istituzioni da contattare per le diverse questioni.', 'La cooperazione tra la Commissione e il Mediatore europeo è stata molto positiva e spero che lo stesso avvenga in futuro. ']"
15, 5. Attività del Mediatore europeo (2008) (discussione),"  Marian Harkin  (ALDE).   – (EN) Signor Presidente, vorrei congratularmi con la relatrice per la sua relazione molto completa e con il Mediatore europeo e i suoi collaboratori. Il servizio migliora ogni anno; davvero un ottimo lavoro.Ad ogni modo, quando si legge una relazione e si concorda con il contenuto, ma le motivazioni comprendono un paragrafo fondamentale che vi interessa direttamente, non si può ignorarlo. Sto facendo naturalmente riferimento al paragrafo in cui il Mediatore europeo critica il Parlamento perché nel 2005, rifiutò una richiesta di accesso alle informazioni riguardanti gli assegni elargiti agli europarlamentari maltesi. Il problema reale era che, accettando la richiesta, si sarebbero dovute rivelare altre informazioni relative agli assegni per tutti gli europarlamentari.Per quanto mi riguarda, si tratta di denaro pubblico e i cittadini hanno il diritto di sapere come queste risorse vengono spese. Abbiamo pubblicato gli importi pagati agli agricoltori nell’ambito della PAC, ma non pubblichiamo ancora le nostre spese di viaggio e altre indennità. Dal mio punto di vista, si tratta spese legittime, legate allo svolgimento del nostro lavoro a nome dei cittadini. Gli assegni per i miei collaboratori, per l’ufficio, per i viaggi, eccetera, sono totalmente legittimi e legate al mio incarico di rappresentanza dei miei elettori, non devo scusarmi e non ho bisogno di nascondere questi costi.Non sto suggerendo di violare la privacy dei miei collaboratori, questo non deve accadere; dico solamente che, se neghiamo le informazioni sui nostri assegni e le nostre spese, i cittadini vedranno il Parlamento come un’istituzione che predica la trasparenza ma non la mette pratica.So che i membri possono pubblicare le proprie spese sul loro sito web personale, e lo fanno, ma noi, come Parlamento abbiamo la responsabilità di rendere queste informazioni accessibili. Posso forse sembrare eccessivamente moralista, ma non è così. Dico semplicemente che questo accesso ci sarà, ed è meglio che il Parlamento lo sostenga piuttosto che vederselo imporre. ",Marian Harkin  (ALDE).,6,319,not_available,"['eng', 'eng', 'eng', 'eng', 'eng', 'eng']","['  Marian Harkin  (ALDE).   – (EN) Signor Presidente, vorrei congratularmi con la relatrice per la sua relazione molto completa e con il Mediatore europeo e i suoi collaboratori. Il servizio migliora ogni anno; davvero un ottimo lavoro.', 'Ad ogni modo, quando si legge una relazione e si concorda con il contenuto, ma le motivazioni comprendono un paragrafo fondamentale che vi interessa direttamente, non si può ignorarlo. ', 'Sto facendo naturalmente riferimento al paragrafo in cui il Mediatore europeo critica il Parlamento perché nel 2005, rifiutò una richiesta di accesso alle informazioni riguardanti gli assegni elargiti agli europarlamentari maltesi. Il problema reale era che, accettando la richiesta, si sarebbero dovute rivelare altre informazioni relative agli assegni per tutti gli europarlamentari.', 'Per quanto mi riguarda, si tratta di denaro pubblico e i cittadini hanno il diritto di sapere come queste risorse vengono spese. Abbiamo pubblicato gli importi pagati agli agricoltori nell’ambito della PAC, ma non pubblichiamo ancora le nostre spese di viaggio e altre indennità. Dal mio punto di vista, si tratta spese legittime, legate allo svolgimento del nostro lavoro a nome dei cittadini. Gli assegni per i miei collaboratori, per l’ufficio, per i viaggi, eccetera, sono totalmente legittimi e legate al mio incarico di rappresentanza dei miei elettori, non devo scusarmi e non ho bisogno di nascondere questi costi.', 'Non sto suggerendo di violare la privacy dei miei collaboratori, questo non deve accadere; dico solamente che, se neghiamo le informazioni sui nostri assegni e le nostre spese, i cittadini vedranno il Parlamento come un’istituzione che predica la trasparenza ma non la mette pratica.', 'So che i membri possono pubblicare le proprie spese sul loro sito web personale, e lo fanno, ma noi, come Parlamento abbiamo la responsabilità di rendere queste informazioni accessibili. Posso forse sembrare eccessivamente moralista, ma non è così. Dico semplicemente che questo accesso ci sarà, ed è meglio che il Parlamento lo sostenga piuttosto che vederselo imporre. ']"
16, 5. Attività del Mediatore europeo (2008) (discussione),"  Oriol Junqueras Vies  (Verts/ALE).   – (ES) Signor Presidente, in qualità di membro della commissione per le petizioni, vorrei aggiungere un paio di osservazioni sull’emendamento discusso dal nostro gruppo in merito alla relazione Paliadeli sulla relazione annuale relativa alle attività del Mediatore europeo.Dal nostro punto di vista, anziché aumentare e rafforzare il ruolo del Mediatore, la definizione di cattiva amministrazione proposta nella risoluzione potrebbe avere l’effetto contrario. In primo luogo, questa definizione, essendo eccessivamente debole e vaga, rende difficile determinare i casi in cui il Mediatore europeo può o deve intervenire e indebolisce così la sua capacità di azione. In secondo luogo, forse ancora più importante, la definizione accorda al Mediatore una capacità di intervento che le istituzioni possono considerare discrezionale, perché non propriamente definita e regolamentata.Per questi motivi, riteniamo che la definizione di cattiva amministrazione contenuta nel nostro emendamento e discussa dal mio gruppo, il gruppo Verde/Alleanza libera europea, sia più dettagliata e concisa; costituirebbe dunque una base molto più appropriata per un’azione attiva ed efficace, e sarebbe di più facile comprensione per le istituzioni e per i cittadini. ",Oriol Junqueras Vies  (Verts/ALE).,3,185,not_available,"['spa', 'spa', 'spa']","['  Oriol Junqueras Vies  (Verts/ALE).   – (ES) Signor Presidente, in qualità di membro della commissione per le petizioni, vorrei aggiungere un paio di osservazioni sull’emendamento discusso dal nostro gruppo in merito alla relazione Paliadeli sulla relazione annuale relativa alle attività del Mediatore europeo.', 'Dal nostro punto di vista, anziché aumentare e rafforzare il ruolo del Mediatore, la definizione di cattiva amministrazione proposta nella risoluzione potrebbe avere l’effetto contrario. In primo luogo, questa definizione, essendo eccessivamente debole e vaga, rende difficile determinare i casi in cui il Mediatore europeo può o deve intervenire e indebolisce così la sua capacità di azione. In secondo luogo, forse ancora più importante, la definizione accorda al Mediatore una capacità di intervento che le istituzioni possono considerare discrezionale, perché non propriamente definita e regolamentata.', 'Per questi motivi, riteniamo che la definizione di cattiva amministrazione contenuta nel nostro emendamento e discussa dal mio gruppo, il gruppo Verde/Alleanza libera europea, sia più dettagliata e concisa; costituirebbe dunque una base molto più appropriata per un’azione attiva ed efficace, e sarebbe di più facile comprensione per le istituzioni e per i cittadini. ']"
17, 5. Attività del Mediatore europeo (2008) (discussione),"  Oldřich Vlasák  (ECR).   – (CS) Signor Presidente, signor Mediatore, onorevoli colleghi, stimo profondamente le attività del difensore civico europeo, ma riscontro comunque tre problemi principali nelle attività di questo ufficio. In primo luogo, l’informazione: la maggior parte dei cittadini dell’Unione europea, non sa dell’esistenza del Mediatore europeo, e non conosce quindi nemmeno le sue attività né i problemi che possono essere portati alla sua attenzione. I fatti sono piuttosto chiari: quasi il 90 per cento delle denunce presentate dai miei connazionali della Repubblica Ceca non rientrava nelle competenze del Mediatore europeo e la situazione non è diversa per gli altri Stati membri. Il Parlamento europeo, pertanto, sta proponendo un’ampia campagna d’informazione, ma non sono sicuro, che stiamo curando la malattia giusta.Il secondo luogo, i costi: ogni istituzione pubblica ha un prezzo, ogni nuova istituzione comporta un aumento di burocrazia con cui i cittadini devono convivere e che devono cercare di gestire. E’ pertanto necessario capire se il denaro investito dai contribuenti ha portato ai risultati desiderati. Lo scorso anno, i miei concittadini hanno presentato al Mediatore europeo 66 delle 800 denunce totali che rientravano nelle sue competenze. Questi casi sono stati trattati da 70 funzionari e sono costati ai contribuenti 9 milioni di euro: ogni causa costa oltre 10 000 euro e, dal mio punto di vista, è eccessivo.In terzo luogo, la sussidiarietà. In qualità di ex sindaco, mi ha dato fastidio leggere che uno dei pochi casi risolti dal Mediatore europeo riguardava il documento di programmazione sulle comunicazioni ad alta velocità del piccolo distretto di Břeclav. Mi sembra completamente inutile, poiché i problemi locali dovrebbero essere affrontati a livello locale e non qui a Bruxelles o a Strasburgo. Onorevoli colleghi, se avessi l’incarico di questa istituzione, garantirei un’azione giudiziosa, con i minori costi possibili e soprattutto senza abusi né ampliamenti dei propri poteri e della burocrazia. Vorrei concludere augurando al Mediatore europeo di ottenere risultati positivi. ",Oldřich Vlasák  (ECR).,3,325,not_available,"['cze', 'cze', 'cze']","['  Oldřich Vlasák  (ECR).   – (CS) Signor Presidente, signor Mediatore, onorevoli colleghi, stimo profondamente le attività del difensore civico europeo, ma riscontro comunque tre problemi principali nelle attività di questo ufficio. In primo luogo, l’informazione: la maggior parte dei cittadini dell’Unione europea, non sa dell’esistenza del Mediatore europeo, e non conosce quindi nemmeno le sue attività né i problemi che possono essere portati alla sua attenzione. I fatti sono piuttosto chiari: quasi il 90 per cento delle denunce presentate dai miei connazionali della Repubblica Ceca non rientrava nelle competenze del Mediatore europeo e la situazione non è diversa per gli altri Stati membri. Il Parlamento europeo, pertanto, sta proponendo un’ampia campagna d’informazione, ma non sono sicuro, che stiamo curando la malattia giusta.', 'Il secondo luogo, i costi: ogni istituzione pubblica ha un prezzo, ogni nuova istituzione comporta un aumento di burocrazia con cui i cittadini devono convivere e che devono cercare di gestire. E’ pertanto necessario capire se il denaro investito dai contribuenti ha portato ai risultati desiderati. Lo scorso anno, i miei concittadini hanno presentato al Mediatore europeo 66 delle 800 denunce totali che rientravano nelle sue competenze. Questi casi sono stati trattati da 70 funzionari e sono costati ai contribuenti 9 milioni di euro: ogni causa costa oltre 10 000 euro e, dal mio punto di vista, è eccessivo.', 'In terzo luogo, la sussidiarietà. In qualità di ex sindaco, mi ha dato fastidio leggere che uno dei pochi casi risolti dal Mediatore europeo riguardava il documento di programmazione sulle comunicazioni ad alta velocità del piccolo distretto di Břeclav. Mi sembra completamente inutile, poiché i problemi locali dovrebbero essere affrontati a livello locale e non qui a Bruxelles o a Strasburgo. Onorevoli colleghi, se avessi l’incarico di questa istituzione, garantirei un’azione giudiziosa, con i minori costi possibili e soprattutto senza abusi né ampliamenti dei propri poteri e della burocrazia. Vorrei concludere augurando al Mediatore europeo di ottenere risultati positivi. ']"
18, 5. Attività del Mediatore europeo (2008) (discussione),"  Nikolaos Chountis  (GUE/NGL).   – (EL) Signor Presidente, sostengo la relazione dell’onorevole Paliadeli e voterò a favore; vorrei anche congratularmi con il signor Diamandouros per il lavoro svolto. Tengo a sottolineare che molti cittadini europei si trovano spesso ad affrontare quelli che noi, con un eufemismo, definiamo episodi di cattiva amministrazione, e che, in pratica, li privano dei loro diritti fondamentali. Dal mio punto di vista, questi casi non sono dovuti alla burocrazia o a negligenza, ma sono causati da errori o politiche sbagliate adottate dalle istituzioni dell’Unione europea. Il ricorso al Mediatore europeo fornisce ai cittadini la possibilità di far valere i propri diritti.Per il Parlamento, unico organo rappresentativo dell’Unione europea a elezione diretta, è importante fornire sostegno politico al lavoro del Mediatore, per limitare, laddove possibile, i casi di cattiva amministrazione. Dalla relazione annuale e dallo specifico lavoro dell’attuale Mediatore europeo emerge chiaramente che grazie al sostegno del Parlamento, il difensore europeo sarà in grado di svolgere il proprio lavoro in modo più efficace.Si richiede quindi un impegno volto a fornire più informazioni ai cittadini in merito al ruolo e ai poteri del Mediatore europeo affinché possano ricorrervi in caso di violazione dei diritti fondamentali. ",Nikolaos Chountis  (GUE/NGL).,3,202,not_available,"['gre', 'gre', 'gre']","['  Nikolaos Chountis  (GUE/NGL).   – (EL) Signor Presidente, sostengo la relazione dell’onorevole Paliadeli e voterò a favore; vorrei anche congratularmi con il signor Diamandouros per il lavoro svolto. Tengo a sottolineare che molti cittadini europei si trovano spesso ad affrontare quelli che noi, con un eufemismo, definiamo episodi di cattiva amministrazione, e che, in pratica, li privano dei loro diritti fondamentali. Dal mio punto di vista, questi casi non sono dovuti alla burocrazia o a negligenza, ma sono causati da errori o politiche sbagliate adottate dalle istituzioni dell’Unione europea. Il ricorso al Mediatore europeo fornisce ai cittadini la possibilità di far valere i propri diritti.', 'Per il Parlamento, unico organo rappresentativo dell’Unione europea a elezione diretta, è importante fornire sostegno politico al lavoro del Mediatore, per limitare, laddove possibile, i casi di cattiva amministrazione. Dalla relazione annuale e dallo specifico lavoro dell’attuale Mediatore europeo emerge chiaramente che grazie al sostegno del Parlamento, il difensore europeo sarà in grado di svolgere il proprio lavoro in modo più efficace.', 'Si richiede quindi un impegno volto a fornire più informazioni ai cittadini in merito al ruolo e ai poteri del Mediatore europeo affinché possano ricorrervi in caso di violazione dei diritti fondamentali. ']"
