,agenda_item,text,speaker,number_p,number_w,chair,language_ps,ps
87, 11. Dichiarazioni di voto (proseguimento),"  Ian Hudghton  (Verts/ALE),  per iscritto. – (EN) Gli interventi finalizzati alla liberalizzazione dei visti per i cittadini dei Balcani sono ben accetti. Mentre prosegue il processo di stabilizzazione e associazione e questi paesi passano da potenziali candidati a candidati ufficiali, sembra opportuno che i loro cittadini godano di una maggiore libertà di circolazione. Esprimo pieno appoggio all’emendamento presentato a nome del mio gruppo. In precedenza questa Assemblea ha invitato tutti gli Stati membri dell’Unione a riconoscere l’indipendenza del Kosovo ed è opportuno che le misure e i controlli posti in atto dalla Serbia nelle zone di confine con il Kosovo siano gli stessi di quelli adottati all’interno di altri confini internazionalmente riconosciuti. ","Ian Hudghton  (Verts/ALE),",1,116,not_available,['eng'],"['  Ian Hudghton  (Verts/ALE),  per iscritto. – (EN) Gli interventi finalizzati alla liberalizzazione dei visti per i cittadini dei Balcani sono ben accetti. Mentre prosegue il processo di stabilizzazione e associazione e questi paesi passano da potenziali candidati a candidati ufficiali, sembra opportuno che i loro cittadini godano di una maggiore libertà di circolazione. Esprimo pieno appoggio all’emendamento presentato a nome del mio gruppo. In precedenza questa Assemblea ha invitato tutti gli Stati membri dell’Unione a riconoscere l’indipendenza del Kosovo ed è opportuno che le misure e i controlli posti in atto dalla Serbia nelle zone di confine con il Kosovo siano gli stessi di quelli adottati all’interno di altri confini internazionalmente riconosciuti. ']"
88, 11. Dichiarazioni di voto (proseguimento),"  Isabella Lövin  (Verts/ALE),  per iscritto. – (SV) Sono a favore all’agevolazione della circolazione dei cittadini di paesi terzi nell’Unione europea, compresi i cittadini dei Balcani, e avrei quindi voluto appoggiare la relazione. Purtroppo gli emendamenti per l’inserimento dei dati biometrici nel passaporto, con il conseguente rischio di una mancanza di certezza del diritto e di una violazione della riservatezza, mi hanno portata ad astenermi dalla votazione finale. ","Isabella Lövin  (Verts/ALE),",1,70,not_available,['swe'],"['  Isabella Lövin  (Verts/ALE),  per iscritto. – (SV) Sono a favore all’agevolazione della circolazione dei cittadini di paesi terzi nell’Unione europea, compresi i cittadini dei Balcani, e avrei quindi voluto appoggiare la relazione. Purtroppo gli emendamenti per l’inserimento dei dati biometrici nel passaporto, con il conseguente rischio di una mancanza di certezza del diritto e di una violazione della riservatezza, mi hanno portata ad astenermi dalla votazione finale. ']"
89, 11. Dichiarazioni di voto (proseguimento),"  Jean-Luc Mélenchon  (GUE/NGL),  per iscritto. – (FR) Ci rifiutiamo di convalidare l’esenzione dal visto richiesta da Serbia, Macedonia, Montenegro, Albania e Bosnia-Erzegovina.Respingiamo questa relazione perché non accettiamo l’imposizione del riconoscimento de facto del Kosovo come Stato.Spagna, Cipro, Grecia, Romania, Slovacchia e Bulgaria si sono strenuamente opposte, quindi all’UE manca ancora una posizione comune al riguardo. L’avvio dei negoziati con il Kosovo per la liberalizzazione dei visti, come richiesto nella relazione, presuppone il riconoscimento della creazione dello Stato del Kosovo, nella totale inosservanza del diritto internazionale. ","Jean-Luc Mélenchon  (GUE/NGL),",3,93,not_available,"['fra', 'fra', 'fra']","['  Jean-Luc Mélenchon  (GUE/NGL),  per iscritto. – (FR) Ci rifiutiamo di convalidare l’esenzione dal visto richiesta da Serbia, Macedonia, Montenegro, Albania e Bosnia-Erzegovina.', 'Respingiamo questa relazione perché non accettiamo l’imposizione del riconoscimento de facto del Kosovo come Stato.', 'Spagna, Cipro, Grecia, Romania, Slovacchia e Bulgaria si sono strenuamente opposte, quindi all’UE manca ancora una posizione comune al riguardo. L’avvio dei negoziati con il Kosovo per la liberalizzazione dei visti, come richiesto nella relazione, presuppone il riconoscimento della creazione dello Stato del Kosovo, nella totale inosservanza del diritto internazionale. ']"
90, 11. Dichiarazioni di voto (proseguimento),"  Nuno Melo  (PPE),  per iscritto. – (PT) Nonostante il mio voto favorevole alla relazione, ritengo che questo processo vada attentamente monitorato. L’introduzione dell’esenzione dall’obbligo di visto per i cittadini di questi paesi ci spinge a essere chiari sulle modalità attuative. In particolare, non dobbiamo dimenticare la necessità della lotta all’immigrazione, alla tratta di esseri umani e alla criminalità organizzata.Per i suddetti motivi giustifico pienamente la cautela mostrata dal gruppo del Partito Popolare Europeo (Democratico Cristiano) nei confronti dell’Albania e della Bosnia-Erzegovina e ribadisco l’esigenza di tenere sotto stretta osservazione i paesi ai quali è stata concessa la possibilità di esenzione dall’obbligo di visto. La sicurezza delle frontiere europee deve mirare agli interessi della politica dell’Unione, perché facilitando gli ingressi rischiamo di mostrarci incapaci di rispettare e applicare le norme comunitarie. ","Nuno Melo  (PPE),",2,139,not_available,"['por', 'por']","['  Nuno Melo  (PPE),  per iscritto. – (PT) Nonostante il mio voto favorevole alla relazione, ritengo che questo processo vada attentamente monitorato. L’introduzione dell’esenzione dall’obbligo di visto per i cittadini di questi paesi ci spinge a essere chiari sulle modalità attuative. In particolare, non dobbiamo dimenticare la necessità della lotta all’immigrazione, alla tratta di esseri umani e alla criminalità organizzata.', 'Per i suddetti motivi giustifico pienamente la cautela mostrata dal gruppo del Partito Popolare Europeo (Democratico Cristiano) nei confronti dell’Albania e della Bosnia-Erzegovina e ribadisco l’esigenza di tenere sotto stretta osservazione i paesi ai quali è stata concessa la possibilità di esenzione dall’obbligo di visto. La sicurezza delle frontiere europee deve mirare agli interessi della politica dell’Unione, perché facilitando gli ingressi rischiamo di mostrarci incapaci di rispettare e applicare le norme comunitarie. ']"
91, 11. Dichiarazioni di voto (proseguimento),"  Willy Meyer  (GUE/NGL),  per iscritto. – (ES) Non sono contrario alla liberalizzazione dei visti per i paesi dei Balcani occidentali, ma ho comunque votato contro la relazione Fajon in quanto ritengo inaccettabile pensare di includere il Kosovo finché non ne sarà riconosciuta l’indipendenza. Nel quadro del diritto internazionale, l’indipendenza del Kosovo è un atto illegale e l’Unione non può quindi negoziare alcun aspetto della liberalizzazione dei visti con un territorio illegalmente indipendente. Votare a favore della relazione Fajon comporta il riconoscimento indiretto dell’indipendenza del Kosovo ed è inaccettabile, così come lo è l’obbligo dei dati biometrici per il rilascio del visto. ","Willy Meyer  (GUE/NGL),",1,106,not_available,['spa'],"['  Willy Meyer  (GUE/NGL),  per iscritto. – (ES) Non sono contrario alla liberalizzazione dei visti per i paesi dei Balcani occidentali, ma ho comunque votato contro la relazione Fajon in quanto ritengo inaccettabile pensare di includere il Kosovo finché non ne sarà riconosciuta l’indipendenza. Nel quadro del diritto internazionale, l’indipendenza del Kosovo è un atto illegale e l’Unione non può quindi negoziare alcun aspetto della liberalizzazione dei visti con un territorio illegalmente indipendente. Votare a favore della relazione Fajon comporta il riconoscimento indiretto dell’indipendenza del Kosovo ed è inaccettabile, così come lo è l’obbligo dei dati biometrici per il rilascio del visto. ']"
92, 11. Dichiarazioni di voto (proseguimento),"  Andreas Mölzer  (NI),  per iscritto. – (DE) Se da un lato accogliamo con favore l’abolizione dell’obbligo di visto per la Serbia, il Montenegro e la Macedonia, essendo la raccomandazione della Commissione il risultato di un’attenta valutazione e della conformità ai requisiti stabiliti, dall’altro respingiamo l’inclusione della Bosnia-Erzegovina e dell’Albania perché si correrebbe il rischio di aprire le porte alla criminalità organizzata, alla tratta di esseri umani e all’immigrazione. Dato che allo stato attuale il Kosovo è in grado di sostenere il proprio governo soltanto grazie al cospicuo contributo dell’Unione europea, i negoziati per l’esenzione dal visto sono inutili. Occorre comunicare con maggiore efficacia i fondamenti delle suddette decisioni e mettere in chiaro con Albania, Kosovo e Bosnia-Erzegovina che devono impegnarsi ancora molto per poter entrare in Europa. ","Andreas Mölzer  (NI),",1,137,not_available,['ger'],"['  Andreas Mölzer  (NI),  per iscritto. – (DE) Se da un lato accogliamo con favore l’abolizione dell’obbligo di visto per la Serbia, il Montenegro e la Macedonia, essendo la raccomandazione della Commissione il risultato di un’attenta valutazione e della conformità ai requisiti stabiliti, dall’altro respingiamo l’inclusione della Bosnia-Erzegovina e dell’Albania perché si correrebbe il rischio di aprire le porte alla criminalità organizzata, alla tratta di esseri umani e all’immigrazione. Dato che allo stato attuale il Kosovo è in grado di sostenere il proprio governo soltanto grazie al cospicuo contributo dell’Unione europea, i negoziati per l’esenzione dal visto sono inutili. Occorre comunicare con maggiore efficacia i fondamenti delle suddette decisioni e mettere in chiaro con Albania, Kosovo e Bosnia-Erzegovina che devono impegnarsi ancora molto per poter entrare in Europa. ']"
93, 11. Dichiarazioni di voto (proseguimento),"  Franz Obermayr  (NI),  per iscritto. – (DE) Le condizioni e le possibilità di agevolare il rilascio del visto sono state discusse per cinque Stati dei Balcani occidentali: Albania, Bosnia-Erzegovina, ex Repubblica iugoslava di Macedonia, Montenegro e Serbia. Stando alla proposta della Commissione, Macedonia, Montenegro e Serbia hanno conseguito la maggior parte degli obiettivi e saranno pertanto esentati dall’obbligo di visto. La relazione fa anche riferimento ai progressi compiuti in Albania e in Bosnia-Erzegovina, nonché al loro conseguente ingresso “sicuro” nell’elenco degli Stati esenti dall’obbligo di visto nel prossimo futuro. Data la potenziale immigrazione illegale proveniente da questi paesi, nonché le allarmanti tendenze islamiche radicali, segnatamente in Bosnia-Erzegovina e in Albania, voto contro l’adozione della relazione. Aggiungo inoltre che il mio paese di origine, l’Austria, ne risulterebbe compromesso in modo particolare a causa della vicinanza geografica ai Balcani occidentali. L’obbligo di visto per gli Stati in questione rappresenta una forma di controllo sull’immigrazione indesiderata ed è quindi opportuno mantenerlo, almeno per il momento. ","Franz Obermayr  (NI),",1,171,not_available,['ger'],"['  Franz Obermayr  (NI),  per iscritto. – (DE) Le condizioni e le possibilità di agevolare il rilascio del visto sono state discusse per cinque Stati dei Balcani occidentali: Albania, Bosnia-Erzegovina, ex Repubblica iugoslava di Macedonia, Montenegro e Serbia. Stando alla proposta della Commissione, Macedonia, Montenegro e Serbia hanno conseguito la maggior parte degli obiettivi e saranno pertanto esentati dall’obbligo di visto. La relazione fa anche riferimento ai progressi compiuti in Albania e in Bosnia-Erzegovina, nonché al loro conseguente ingresso “sicuro” nell’elenco degli Stati esenti dall’obbligo di visto nel prossimo futuro. Data la potenziale immigrazione illegale proveniente da questi paesi, nonché le allarmanti tendenze islamiche radicali, segnatamente in Bosnia-Erzegovina e in Albania, voto contro l’adozione della relazione. Aggiungo inoltre che il mio paese di origine, l’Austria, ne risulterebbe compromesso in modo particolare a causa della vicinanza geografica ai Balcani occidentali. L’obbligo di visto per gli Stati in questione rappresenta una forma di controllo sull’immigrazione indesiderata ed è quindi opportuno mantenerlo, almeno per il momento. ']"
94, 11. Dichiarazioni di voto (proseguimento),"  Carl Schlyter  (Verts/ALE),  per iscritto. – (SV) Sono a favore all’agevolazione della circolazione dei cittadini di paesi terzi nell’Unione europea, compresi i cittadini dei Balcani, e avrei quindi voluto appoggiare la relazione. Purtroppo gli emendamenti per l’inserimento dei dati biometrici nel passaporto, con il conseguente rischio di una mancanza di certezza del diritto e di una violazione della riservatezza, mi hanno portata ad astenermi dalla votazione finale.","Carl Schlyter  (Verts/ALE),",1,70,not_available,['swe'],"['  Carl Schlyter  (Verts/ALE),  per iscritto. – (SV) Sono a favore all’agevolazione della circolazione dei cittadini di paesi terzi nell’Unione europea, compresi i cittadini dei Balcani, e avrei quindi voluto appoggiare la relazione. Purtroppo gli emendamenti per l’inserimento dei dati biometrici nel passaporto, con il conseguente rischio di una mancanza di certezza del diritto e di una violazione della riservatezza, mi hanno portata ad astenermi dalla votazione finale.']"
95, 11. Dichiarazioni di voto (proseguimento),"  Marie-Christine Vergiat  (GUE/NGL),  per iscritto. – (FR) Sostengo l’abolizione del visto per soggiorni di breve durata e ho quindi votato a favore della relazione Fajon, considerandola un passo avanti nella giusta direzione. Grazie a questo provvedimento gran parte dei cittadini di quei paesi non dovrà più espletare le formalità amministrative richieste dalle ambasciate per il rilascio dei visti.Mi rammarico tuttavia che tale esenzione si applichi solamente ai titolari di passaporti biometrici, che ritengo incompatibili con la tutela dei dati personali e della riservatezza.Mi scandalizza altresì che soltanto due delle tre comunità della Bosnia-Erzegovina, segnatamente i serbi e i croati, beneficeranno di tale provvedimento e che i residenti del Kosovo ne rimarranno esclusi.Lo status di cittadino europeo non va sfruttato per sollevare la questione dello status degli Stati membri, e ancora meno per rinfocolare tensioni già forti.Nei Balcani tutti i cittadini dell’Unione europea vanno trattati alla pari e la libera circolazione delle persone deve restare un diritto fondamentale in Europa. ","Marie-Christine Vergiat  (GUE/NGL),",5,167,not_available,"['fra', 'fra', 'fra', 'fra', 'fra']","['  Marie-Christine Vergiat  (GUE/NGL),  per iscritto. – (FR) Sostengo l’abolizione del visto per soggiorni di breve durata e ho quindi votato a favore della relazione Fajon, considerandola un passo avanti nella giusta direzione. Grazie a questo provvedimento gran parte dei cittadini di quei paesi non dovrà più espletare le formalità amministrative richieste dalle ambasciate per il rilascio dei visti.', 'Mi rammarico tuttavia che tale esenzione si applichi solamente ai titolari di passaporti biometrici, che ritengo incompatibili con la tutela dei dati personali e della riservatezza.', 'Mi scandalizza altresì che soltanto due delle tre comunità della Bosnia-Erzegovina, segnatamente i serbi e i croati, beneficeranno di tale provvedimento e che i residenti del Kosovo ne rimarranno esclusi.', 'Lo status di cittadino europeo non va sfruttato per sollevare la questione dello status degli Stati membri, e ancora meno per rinfocolare tensioni già forti.', 'Nei Balcani tutti i cittadini dell’Unione europea vanno trattati alla pari e la libera circolazione delle persone deve restare un diritto fondamentale in Europa. ']"
96, 11. Dichiarazioni di voto (proseguimento),"  Regina Bastos  (PPE),  per iscritto. – (PT) Scopo della proposta della Commissione è creare un nuovo strumento europeo di microfinanziamento per l’occupazione che offrirà ai disoccupati un nuovo inizio e spianerà la strada ad alcuni dei gruppi più svantaggiati, compresi i giovani in Europa, per avviare in proprio un’attività. Questo strumento estenderà la portata del sostegno finanziario destinato in particolare ai nuovi imprenditori nell’attuale contesto caratterizzato da crediti molto limitati. Non posso tuttavia approvare la proposta della Commissione di ridistribuire parte del bilancio (100 milioni di euro) da Progress, un programma comunitario per l’occupazione e la solidarietà sociale, a questo strumento europeo di microfinanziamento. La ridistribuzione delle somme attinte da Progress manderebbe il segnale sbagliato, dato che il programma si rivolge ai gruppi sociali più vulnerabili. Lo strumento europeo di microfinanziamento necessita di una linea di bilancio separata. ","Regina Bastos  (PPE),",1,141,not_available,['por'],"['  Regina Bastos  (PPE),  per iscritto. – (PT) Scopo della proposta della Commissione è creare un nuovo strumento europeo di microfinanziamento per l’occupazione che offrirà ai disoccupati un nuovo inizio e spianerà la strada ad alcuni dei gruppi più svantaggiati, compresi i giovani in Europa, per avviare in proprio un’attività. Questo strumento estenderà la portata del sostegno finanziario destinato in particolare ai nuovi imprenditori nell’attuale contesto caratterizzato da crediti molto limitati. Non posso tuttavia approvare la proposta della Commissione di ridistribuire parte del bilancio (100 milioni di euro) da Progress, un programma comunitario per l’occupazione e la solidarietà sociale, a questo strumento europeo di microfinanziamento. La ridistribuzione delle somme attinte da Progress manderebbe il segnale sbagliato, dato che il programma si rivolge ai gruppi sociali più vulnerabili. Lo strumento europeo di microfinanziamento necessita di una linea di bilancio separata. ']"
97, 11. Dichiarazioni di voto (proseguimento),"  David Casa  (PPE),  per iscritto. – (EN) Lo strumento di microfinanziamento è ancora all’esame del Parlamento, e non risulta quindi chiaro se i fondi da rendere disponibili debbano provenire da Progress. Per questo motivo è indispensabile che la Commissione si astenga dallo stanziamento di fondi, attualmente destinati al programma Progress. Ho quindi votato a favore della risoluzione. ","David Casa  (PPE),",1,57,not_available,['eng'],"['  David Casa  (PPE),  per iscritto. – (EN) Lo strumento di microfinanziamento è ancora all’esame del Parlamento, e non risulta quindi chiaro se i fondi da rendere disponibili debbano provenire da Progress. Per questo motivo è indispensabile che la Commissione si astenga dallo stanziamento di fondi, attualmente destinati al programma Progress. Ho quindi votato a favore della risoluzione. ']"
98, 11. Dichiarazioni di voto (proseguimento),"  Proinsias De Rossa  (S&D),  per iscritto. – (EN) Ho votato a favore di questa risoluzione in opposizione alla proposta della Commissione in merito al programma di lavoro annuale di Progress per il 2010; la Commissione ha chiaramente abusato del suo potere nel tentativo di ridistribuire le risorse di bilancio destinate a Progress allo strumento di microfinanziamento prima che il Parlamento si fosse pronunciato. La Commissione deve rispettare la prerogativa del Parlamento e aspettare che tutte e tre le istituzioni – Parlamento, Consiglio e Commissione – abbiano raggiunto un accordo sullo strumento di microfinanziamento prima di presentare un progetto per il programma di lavoro annuale di Progress. ","Proinsias De Rossa  (S&D),",1,104,not_available,['eng'],"['  Proinsias De Rossa  (S&D),  per iscritto. – (EN) Ho votato a favore di questa risoluzione in opposizione alla proposta della Commissione in merito al programma di lavoro annuale di Progress per il 2010; la Commissione ha chiaramente abusato del suo potere nel tentativo di ridistribuire le risorse di bilancio destinate a Progress allo strumento di microfinanziamento prima che il Parlamento si fosse pronunciato. La Commissione deve rispettare la prerogativa del Parlamento e aspettare che tutte e tre le istituzioni – Parlamento, Consiglio e Commissione – abbiano raggiunto un accordo sullo strumento di microfinanziamento prima di presentare un progetto per il programma di lavoro annuale di Progress. ']"
99, 11. Dichiarazioni di voto (proseguimento),"  Ilda Figueiredo  (GUE/NGL),  per iscritto. – (PT) Abbiamo votato a favore della risoluzione di comune accordo con la commissione per l’occupazione e gli affari sociali, che ha contestato la posizione della Commissione europea di stornare denaro da Progress per incanalarlo in un programma di microfinanziamento. Se la Commissione vuole istituire un sistema di microfinanziamento, deve farlo con nuove risorse e non a scapito di Progress.A ogni buon conto, dato che il Parlamento deve ancora esaminare le proposte relative allo strumento di microfinanziamento avanzate dalla Commissione, quest’ultima deve astenersi dall’adozione di provvedimenti specifici in merito al finanziamento del programma Progress fino alla conclusione del relativo iter legislativo.Quanto detto spiega la netta opposizione all’adozione del progetto di decisione della Commissione relativo al programma di lavoro annuale di Progress per il 2010 e all’elenco delle attività per settore.Riteniamo inoltre che la Commissione debba ritirare il progetto di decisione e presentare una nuova proposta. ","Ilda Figueiredo  (GUE/NGL),",4,158,not_available,"['por', 'por', 'por', 'por']","['  Ilda Figueiredo  (GUE/NGL),  per iscritto. – (PT) Abbiamo votato a favore della risoluzione di comune accordo con la commissione per l’occupazione e gli affari sociali, che ha contestato la posizione della Commissione europea di stornare denaro da Progress per incanalarlo in un programma di microfinanziamento. Se la Commissione vuole istituire un sistema di microfinanziamento, deve farlo con nuove risorse e non a scapito di Progress.', 'A ogni buon conto, dato che il Parlamento deve ancora esaminare le proposte relative allo strumento di microfinanziamento avanzate dalla Commissione, quest’ultima deve astenersi dall’adozione di provvedimenti specifici in merito al finanziamento del programma Progress fino alla conclusione del relativo iter legislativo.', 'Quanto detto spiega la netta opposizione all’adozione del progetto di decisione della Commissione relativo al programma di lavoro annuale di Progress per il 2010 e all’elenco delle attività per settore.', 'Riteniamo inoltre che la Commissione debba ritirare il progetto di decisione e presentare una nuova proposta. ']"
100, 11. Dichiarazioni di voto (proseguimento),"  Lívia Járóka  (PPE),  per iscritto. – (HU) Onorevoli colleghi, nell’attuale congiuntura economica globale assumono particolare rilevanza quegli strumenti finanziari semplici in grado di sostenere le imprese o i gruppi sociali svantaggiati, in particolare nelle regioni sottosviluppate. Anche il sistema del microcredito, presente in numerosi paesi e continenti, ha dimostrato come una formazione e un controllo adeguati possano aiutare i gruppi più vulnerabili, costretti ad affrontare gravi difficoltà nel mondo del lavoro. Lo strumento di microfinanziamento Progress, proposto dalla Commissione, potrebbe rappresentare un’iniziativa importante per assolvere alla funzione di reinserimento dei gruppi socialmente emarginati. Finché la procedura di codecisione tra Commissione e Parlamento non sarà avviata e il bilancio disponibile per lo strumento di microfinanziamento non sarà chiarito, è opportuno che la Commissione ritiri la proposta relativa al programma di lavoro annuale di Progress per il 2010, evitando di mettere i colegislatori davanti al fatto compiuto. Una volta conclusa la procedura di codecisione, il Parlamento sarà in grado di adottare una decisione libera e responsabile su questo cruciale argomento. ","Lívia Járóka  (PPE),",1,169,not_available,['hun'],"['  Lívia Járóka  (PPE),  per iscritto. – (HU) Onorevoli colleghi, nell’attuale congiuntura economica globale assumono particolare rilevanza quegli strumenti finanziari semplici in grado di sostenere le imprese o i gruppi sociali svantaggiati, in particolare nelle regioni sottosviluppate. Anche il sistema del microcredito, presente in numerosi paesi e continenti, ha dimostrato come una formazione e un controllo adeguati possano aiutare i gruppi più vulnerabili, costretti ad affrontare gravi difficoltà nel mondo del lavoro. Lo strumento di microfinanziamento Progress, proposto dalla Commissione, potrebbe rappresentare un’iniziativa importante per assolvere alla funzione di reinserimento dei gruppi socialmente emarginati. Finché la procedura di codecisione tra Commissione e Parlamento non sarà avviata e il bilancio disponibile per lo strumento di microfinanziamento non sarà chiarito, è opportuno che la Commissione ritiri la proposta relativa al programma di lavoro annuale di Progress per il 2010, evitando di mettere i colegislatori davanti al fatto compiuto. Una volta conclusa la procedura di codecisione, il Parlamento sarà in grado di adottare una decisione libera e responsabile su questo cruciale argomento. ']"
