,agenda_item,text,speaker,number_p,number_w,chair,language_ps,ps
0, 1. Apertura della seduta,PRESIDENZA DELL’ON. ROUČEK Vicepresidente,PRESIDENZA DELL’ON. ROUČEK,1,5,not_available,['ita'],['PRESIDENZA DELL’ON. ROUČEK Vicepresidente']
1, 5. Attività del Mediatore europeo (2008) (discussione),"  Presidente.   – L’ordine del giorno reca la relazione dell’onorevole Paliadeli, a nome della commissione per le petizioni, sulla relazione annuale sulle attività del Mediatore europeo nel 2008 [2009/2088(INI)]. ",Presidente.,1,31,not_available,['ita'],"['  Presidente.   – L’ordine del giorno reca la relazione dell’onorevole Paliadeli, a nome della commissione per le petizioni, sulla relazione annuale sulle attività del Mediatore europeo nel 2008 [2009/2088(INI)]. ']"
2, 5. Attività del Mediatore europeo (2008) (discussione),"  Chrysoula Paliadeli,  relatore. – (EL) Signor Presidente, onorevoli colleghi, signor Commissario, il 21 aprile 2009 il Mediatore europeo ha presentato la relazione annuale sulle sue attività del 2008 al presidente uscente del Parlamento europeo, Hans-Gert Poettering. Il 14 settembre dello stesso anno, Nikiforos Diamandouros ha sottoposto il contenuto della stessa relazione alla commissione per le petizioni, che mi aveva già incaricata di redigere una relazione, approvata all’unanimità dai membri della commissione in data 1 ottobre 2009.La relazione scritta è costituita da due documenti: una breve panoramica di sei pagine e una versione estesa e dettagliata sulle attività del Mediatore europeo, le statistiche e la loro accurata interpretazione, per il miglioramento della procedura e delle migliori pratiche.I dati e risultati presentati nei due documenti sono di facile consultazione, grazie ad esempi illustrativi che aiutano il lettore a comprendere, valutare e utilizzare il testo.A differenza delle precedenti, questa relazione risulta maggiormente comprensibile e utile, grazie alla nuova modalità di presentazione dei dati statistici e alla valutazione dei risultati, poiché si spinge oltre i limiti della semplice registrazione e affronta questioni politiche e metodi di miglioramento.Nel 2008, il Mediatore ha archiviato un numero record di indagini, la maggior parte delle quali riguardava la Commissione europea, mentre solo poche erano relative all’amministrazione del Parlamento europeo. La mancanza di trasparenza è risultata essere la tipologia più comune di cattiva amministrazione; un terzo dei casi è stato chiuso mediante un accordo a favore del ricorrente; ancora meno sono state le cause in cui il Mediatore europeo ha dovuto rivolgere critiche alle istituzioni amministrative coinvolte, e ancora meno sono stati i casi di richiesta di un’opinione dettagliata. In un unico caso è stata presentata al Parlamento una relazione speciale, che a portato a una risoluzione speciale a favore del ricorrente. Nel 2008, il Mediatore europeo ha concluso un’indagine di propria iniziativa sui pagamenti in ritardo della Commissione; in seguito a questa indagine, sono state adottate misure per limitare i pagamenti in ritardo ed è stata annunciata una nuova indagine. La priorità del Mediatore era garantire il rispetto dei diritti dei cittadini europei, al fine di rafforzare la loro fiducia nelle istituzioni.Questo obiettivo è stato perseguito tramite il miglioramento della qualità delle informazioni sui diritti dei cittadini fornite attraverso la rete europea dei mediatori. Al contempo, il Mediatore europeo, per mezzo delle consuete pratiche per la risoluzione delle questioni imposte dal suo ruolo istituzionale, ha rafforzato i contatti con i membri e i funzionari delle istituzioni europee, promuovendo la cultura dei servizi nell’amministrazione dell’Unione, e contribuendo pertanto all’obiettivo generale di rispetto reciproco tra i cittadini e le istituzioni europee. Un risultato tangibile di questa campagna è stato l’aumento del numero di petizioni nel 2008, indice del fatto che sempre più cittadini europei sono venuti a conoscenza dell’istituzione del Mediatore e vi hanno fatto ricorso per questioni di buona amministrazione, operazioni amministrative e altri servizi dell’Unione europea.Il sito web del Mediatore è stato aggiornato regolarmente nel corso del 2008 affinché potesse essere un servizio moderno, dinamico e interattivo. In conclusione di questa prima fase della relazione orale sulla relazione annuale del Mediatore europeo, ci aspettiamo che l’attività costruttiva con il Parlamento europeo continui allo stesso modo, affinché questa istituzione possa diventare un modello di buona amministrazione per le autorità nazionali e possa continuare a fungere da canale di comunicazione tra istituzioni europee e cittadini.","Chrysoula Paliadeli,",7,572,not_available,"['gre', 'gre', 'gre', 'gre', 'gre', 'gre', 'gre']","['  Chrysoula Paliadeli,  relatore. – (EL) Signor Presidente, onorevoli colleghi, signor Commissario, il 21 aprile 2009 il Mediatore europeo ha presentato la relazione annuale sulle sue attività del 2008 al presidente uscente del Parlamento europeo, Hans-Gert Poettering. Il 14 settembre dello stesso anno, Nikiforos Diamandouros ha sottoposto il contenuto della stessa relazione alla commissione per le petizioni, che mi aveva già incaricata di redigere una relazione, approvata all’unanimità dai membri della commissione in data 1 ottobre 2009.', 'La relazione scritta è costituita da due documenti: una breve panoramica di sei pagine e una versione estesa e dettagliata sulle attività del Mediatore europeo, le statistiche e la loro accurata interpretazione, per il miglioramento della procedura e delle migliori pratiche.', 'I dati e risultati presentati nei due documenti sono di facile consultazione, grazie ad esempi illustrativi che aiutano il lettore a comprendere, valutare e utilizzare il testo.', 'A differenza delle precedenti, questa relazione risulta maggiormente comprensibile e utile, grazie alla nuova modalità di presentazione dei dati statistici e alla valutazione dei risultati, poiché si spinge oltre i limiti della semplice registrazione e affronta questioni politiche e metodi di miglioramento.', 'Nel 2008, il Mediatore ha archiviato un numero record di indagini, la maggior parte delle quali riguardava la Commissione europea, mentre solo poche erano relative all’amministrazione del Parlamento europeo. La mancanza di trasparenza è risultata essere la tipologia più comune di cattiva amministrazione; un terzo dei casi è stato chiuso mediante un accordo a favore del ricorrente; ancora meno sono state le cause in cui il Mediatore europeo ha dovuto rivolgere critiche alle istituzioni amministrative coinvolte, e ancora meno sono stati i casi di richiesta di un’opinione dettagliata. In un unico caso è stata presentata al Parlamento una relazione speciale, che a portato a una risoluzione speciale a favore del ricorrente. Nel 2008, il Mediatore europeo ha concluso un’indagine di propria iniziativa sui pagamenti in ritardo della Commissione; in seguito a questa indagine, sono state adottate misure per limitare i pagamenti in ritardo ed è stata annunciata una nuova indagine. La priorità del Mediatore era garantire il rispetto dei diritti dei cittadini europei, al fine di rafforzare la loro fiducia nelle istituzioni.', 'Questo obiettivo è stato perseguito tramite il miglioramento della qualità delle informazioni sui diritti dei cittadini fornite attraverso la rete europea dei mediatori. Al contempo, il Mediatore europeo, per mezzo delle consuete pratiche per la risoluzione delle questioni imposte dal suo ruolo istituzionale, ha rafforzato i contatti con i membri e i funzionari delle istituzioni europee, promuovendo la cultura dei servizi nell’amministrazione dell’Unione, e contribuendo pertanto all’obiettivo generale di rispetto reciproco tra i cittadini e le istituzioni europee. Un risultato tangibile di questa campagna è stato l’aumento del numero di petizioni nel 2008, indice del fatto che sempre più cittadini europei sono venuti a conoscenza dell’istituzione del Mediatore e vi hanno fatto ricorso per questioni di buona amministrazione, operazioni amministrative e altri servizi dell’Unione europea.', 'Il sito web del Mediatore è stato aggiornato regolarmente nel corso del 2008 affinché potesse essere un servizio moderno, dinamico e interattivo. In conclusione di questa prima fase della relazione orale sulla relazione annuale del Mediatore europeo, ci aspettiamo che l’attività costruttiva con il Parlamento europeo continui allo stesso modo, affinché questa istituzione possa diventare un modello di buona amministrazione per le autorità nazionali e possa continuare a fungere da canale di comunicazione tra istituzioni europee e cittadini.']"
