,agenda_item,text,speaker,number_p,number_w,chair,language_ps,ps
36, 12. Intervenções de um minuto sobre questões políticas importantes,"  Zigmantas Balčytis  (S&D).   - (EN) Senhor Presidente, gostaria de chamar a sua atenção para a situação na fronteira oriental dos Estados Bálticos. Há muitos anos já que, antes do Natal, se verifica um contínuo bloqueio de camiões, oriundos de todas as partes da Europa, nas fronteiras externas orientais da União Europeia.Esta situação provoca sérios problemas tanto às transportadoras, como às empresas da União Europeia. Provoca ainda mais tensão nas relações entre a União Europeia e países terceiros seus vizinhos. Creio que o recentemente criado Serviço Europeu de Acção Externa deverá reagir a esta situação e cooperar mais activamente com os países terceiros em questão, para resolver este problema. ",Zigmantas Balčytis  (S&D).,2,109,not_available,"['por', 'por']","['  Zigmantas Balčytis  (S&D).   - (EN) Senhor Presidente, gostaria de chamar a sua atenção para a situação na fronteira oriental dos Estados Bálticos. Há muitos anos já que, antes do Natal, se verifica um contínuo bloqueio de camiões, oriundos de todas as partes da Europa, nas fronteiras externas orientais da União Europeia.', 'Esta situação provoca sérios problemas tanto às transportadoras, como às empresas da União Europeia. Provoca ainda mais tensão nas relações entre a União Europeia e países terceiros seus vizinhos. Creio que o recentemente criado Serviço Europeu de Acção Externa deverá reagir a esta situação e cooperar mais activamente com os países terceiros em questão, para resolver este problema. ']"
37, 12. Intervenções de um minuto sobre questões políticas importantes,"  Nicole Kiil-Nielsen  (Verts/ALE).   - (FR) Senhor Presidente, Senhoras e Senhores Deputados, a faixa de Gaza está a ser ameaçada de estrangulação. Submetida a um rigoroso bloqueio israelita desde 2007, em 2009 a população de Gaza sofreu um ataque sangrento que levou à realização imediata do Relatório Goldstone, que condenou totalmente as autoridades militares israelitas, acusadas de crimes de guerra. Hoje, foram as autoridades egípcias que decidiram construir uma barreira metálica subterrânea, de modo a evitar que qualquer abastecimento passe através dos túneis. Quando se porá um ponto final neste castigo colectivo imposto a homens, mulheres e crianças, cujo sofrimento está a ser manipulado num teatro politico de uma época diferente?A União Europeia tem de agir. A União Europeia possui todos os trunfos como principal parceiro económico de Israel e principal contribuinte da ajuda aos Territórios Palestinianos. O Governo israelita só aceitará mudar de política sob pressão da comunidade internacional. A UE pode ter um papel decisivo no restabelecimento do processo de paz e na criação de um Estado palestiniano independente e soberano dentro das fronteiras estabelecidas em 1967, com Jerusalém Oriental como sua capital. ",Nicole Kiil-Nielsen  (Verts/ALE).,4,186,not_available,"['fra', 'fra', 'fra', 'fra']","['  Nicole Kiil-Nielsen  (Verts/ALE).   - (FR) Senhor Presidente, Senhoras e Senhores Deputados, a faixa de Gaza está a ser ameaçada de estrangulação. Submetida a um rigoroso bloqueio israelita desde 2007, em 2009 a população de Gaza sofreu um ataque sangrento que levou à realização imediata do Relatório Goldstone, que condenou totalmente as autoridades militares israelitas, acusadas de crimes de guerra. ', 'Hoje, foram as autoridades egípcias que decidiram construir uma barreira metálica subterrânea, de modo a evitar que qualquer abastecimento passe através dos túneis. Quando se porá um ponto final neste castigo colectivo imposto a homens, mulheres e crianças, cujo sofrimento está a ser manipulado num teatro politico de uma época diferente?', 'A União Europeia tem de agir. A União Europeia possui todos os trunfos como principal parceiro económico de Israel e principal contribuinte da ajuda aos Territórios Palestinianos. O Governo israelita só aceitará mudar de política sob pressão da comunidade internacional. ', 'A UE pode ter um papel decisivo no restabelecimento do processo de paz e na criação de um Estado palestiniano independente e soberano dentro das fronteiras estabelecidas em 1967, com Jerusalém Oriental como sua capital. ']"
38, 12. Intervenções de um minuto sobre questões políticas importantes,"  Jaroslav Paška  (EFD).   - (SK) Senhor Presidente, no final do ano passado, a República Eslovaca foi gratuita, descarada e repetidamente caluniada por deputados da República da Hungria por causa da adopção de uma lei que, alegadamente, priva os húngaros que vivem na Eslováquia dos seus direitos.Enquanto estavam a ser espalhados na Hungria boatos infundados acerca de uma lei fabricada pela Eslováquia, a República Eslovaca recorreu ao Alto-Comissário para as Minorias Nacionais, Knut Vollebæk, solicitando-lhe que fizesse uma avaliação objectiva da legislação efectivamente aprovada na Eslováquia. No início deste ano, a 4 de Janeiro de 2010, o Alto-Comissário para as Minorias Nacionais da OSCE, Knut Vollebæk, emitiu uma importante declaração respeitante à Lei sobre a Língua Oficial. A sua importante declaração confirmou que a lei sobre a língua oficial cumpre os compromissos internacionais assumidos pela República Eslovaca. Afirma que a lei cumpre, também, as normas internacionais e pretende atingir um objectivo legítimo. Afirma ainda explicitamente que as medidas tomadas para promover a língua oficial não prejudicam os direitos linguísticos das pessoas que pertencem às minorias nacionais. O Alto-Comissário para as Minorias Nacionais da OSCE, Knut Vollebæk, louvou a República Eslovaca. ",Jaroslav Paška  (EFD).,2,193,not_available,"['slo', 'slo']","['  Jaroslav Paška  (EFD).   - (SK) Senhor Presidente, no final do ano passado, a República Eslovaca foi gratuita, descarada e repetidamente caluniada por deputados da República da Hungria por causa da adopção de uma lei que, alegadamente, priva os húngaros que vivem na Eslováquia dos seus direitos.', 'Enquanto estavam a ser espalhados na Hungria boatos infundados acerca de uma lei fabricada pela Eslováquia, a República Eslovaca recorreu ao Alto-Comissário para as Minorias Nacionais, Knut Vollebæk, solicitando-lhe que fizesse uma avaliação objectiva da legislação efectivamente aprovada na Eslováquia. No início deste ano, a 4 de Janeiro de 2010, o Alto-Comissário para as Minorias Nacionais da OSCE, Knut Vollebæk, emitiu uma importante declaração respeitante à Lei sobre a Língua Oficial. A sua importante declaração confirmou que a lei sobre a língua oficial cumpre os compromissos internacionais assumidos pela República Eslovaca. Afirma que a lei cumpre, também, as normas internacionais e pretende atingir um objectivo legítimo. Afirma ainda explicitamente que as medidas tomadas para promover a língua oficial não prejudicam os direitos linguísticos das pessoas que pertencem às minorias nacionais. O Alto-Comissário para as Minorias Nacionais da OSCE, Knut Vollebæk, louvou a República Eslovaca. ']"
39, 12. Intervenções de um minuto sobre questões políticas importantes,"  Hans-Peter Martin  (NI).   - (DE) Senhor Presidente, a maioria dos Estados-Membros da União Europeia está, também, a viver um terramoto devastador, terramoto que não é, contudo, reconhecível, à superfície. Refiro-me à perturbação continuada dos mercados financeiros. Agora soubemos que num banco da Caríntia que faliu ou passou para a responsabilidade do Estado, havia também fundos da UE em circulação. Exijo que o OLAF proceda à devida investigação. Sob a nova Presidência, talvez haja uma possibilidade de este organismo poder actuar de forma um pouco mais independente do que anteriormente.Neste contexto, gostaria igualmente de trazer à atenção do Senhor Presidente um estudo realizado pelo Observatório Europeu para as PME sobre a ""captive Commission"", ou seja, sobre este problema fulcral persistente: nomeadamente, o de grandes empresas terem uma representação excessivamente forte nos grupos de peritos que, na realidade, deveriam estar a procurar soluções para nos proteger de tais perturbações. As pequenas e médias empresas, já para não mencionar as associações de consumidores e os sindicatos, pouco ou nada podem fazer. Geralmente, o rácio nestes grupos de peritos é de 80 para 20, o que tem de ser alterado, quanto antes. ",Hans-Peter Martin  (NI).,2,191,not_available,"['ger', 'ger']","['  Hans-Peter Martin  (NI).   - (DE) Senhor Presidente, a maioria dos Estados-Membros da União Europeia está, também, a viver um terramoto devastador, terramoto que não é, contudo, reconhecível, à superfície. Refiro-me à perturbação continuada dos mercados financeiros. Agora soubemos que num banco da Caríntia que faliu ou passou para a responsabilidade do Estado, havia também fundos da UE em circulação. Exijo que o OLAF proceda à devida investigação. Sob a nova Presidência, talvez haja uma possibilidade de este organismo poder actuar de forma um pouco mais independente do que anteriormente.', 'Neste contexto, gostaria igualmente de trazer à atenção do Senhor Presidente um estudo realizado pelo Observatório Europeu para as PME sobre a ""captive Commission"", ou seja, sobre este problema fulcral persistente: nomeadamente, o de grandes empresas terem uma representação excessivamente forte nos grupos de peritos que, na realidade, deveriam estar a procurar soluções para nos proteger de tais perturbações. As pequenas e médias empresas, já para não mencionar as associações de consumidores e os sindicatos, pouco ou nada podem fazer. Geralmente, o rácio nestes grupos de peritos é de 80 para 20, o que tem de ser alterado, quanto antes. ']"
40, 12. Intervenções de um minuto sobre questões políticas importantes,"  Gay Mitchell  (PPE).   - (EN) Senhor Presidente, gostaria de me juntar aos colegas deputados que levantaram a questão do Haiti. Sei bem que teremos um debate sobre este problema durante o período de sessões, mas há um aspecto em particular que desejo levantar agora e que é o facto de os Estados Unidos estarem muito mais bem organizados. De facto, encontram-se mais perto da região do que a União Europeia. Os Estados-Membros, individualmente, responderam muito bem. Temos, por exemplo, a Força Aérea belga destacada lá perto.Somos os maiores doadores de ajuda do mundo e, no que respeita à ajuda humanitária, devemos ser eficientes nesse contributo. Creio ser altura, ao abrigo do novo Tratado de Lisboa, de considerar a possibilidade de ter, numa base contínua, uma equipa sempre a postos por um período de seis meses, que inclua grandes e pequenos Estados-Membros, capaz de prestar ajuda humanitária onde for necessário, de comum acordo entre as instituições. Não tem de ser o mesmo grupo a estar a postos para cada período de seis meses, poderá mudar com a Presidência, mas deveria haver um grupo sempre a postos, para que pudéssemos prestar ajuda sob uma bandeira humanitária da União Europeia. ",Gay Mitchell  (PPE).,2,200,not_available,"['por', 'por']","['  Gay Mitchell  (PPE).   - (EN) Senhor Presidente, gostaria de me juntar aos colegas deputados que levantaram a questão do Haiti. Sei bem que teremos um debate sobre este problema durante o período de sessões, mas há um aspecto em particular que desejo levantar agora e que é o facto de os Estados Unidos estarem muito mais bem organizados. De facto, encontram-se mais perto da região do que a União Europeia. Os Estados-Membros, individualmente, responderam muito bem. Temos, por exemplo, a Força Aérea belga destacada lá perto.', 'Somos os maiores doadores de ajuda do mundo e, no que respeita à ajuda humanitária, devemos ser eficientes nesse contributo. Creio ser altura, ao abrigo do novo Tratado de Lisboa, de considerar a possibilidade de ter, numa base contínua, uma equipa sempre a postos por um período de seis meses, que inclua grandes e pequenos Estados-Membros, capaz de prestar ajuda humanitária onde for necessário, de comum acordo entre as instituições. Não tem de ser o mesmo grupo a estar a postos para cada período de seis meses, poderá mudar com a Presidência, mas deveria haver um grupo sempre a postos, para que pudéssemos prestar ajuda sob uma bandeira humanitária da União Europeia. ']"
41, 12. Intervenções de um minuto sobre questões políticas importantes,"  Proinsias De Rossa  (S&D).   - (EN) Senhor Presidente, devemos rever urgentemente a nossa exortação a Israel – e quando digo ""nós"", refiro-me ao Parlamento, ao Conselho e à Comissão – para pôr um ponto final ao cerco de Gaza.Há um ano, morreram mais de 1 400 pessoas na guerra na Faixa de Gaza, a maior parte civis, incluindo mais de 300 crianças. Contudo, o Estado de Israel continua a não permitir a reconstrução das habitações, empresas, serviços de assistência médica e o fornecimento de água potável, saneamento e electricidade, ao mesmo tempo que bloqueia o abastecimento adequado de alimentos.A Europa deve, igualmente, intervir para impedir a expulsão do jornalista Jared Malsin, cidadão americano e insistir em que lhe seja permitido continuar a realizar o seu trabalho na Ma’an, uma agência noticiosa sem fins lucrativos na Cisjordânia.A Comissão congelou o acordo das pescas com a Guiné, porque as acções governamentais nesse país tiveram como consequência a morte de 150 manifestantes. Porque tratamos Israel de modo diferente? Chegou a hora de a Europa dizer a Israel que a nossa paciência está a chegar ao fim e que têm de cumprir a legislação internacional em matéria de direitos humanos, incluindo o direito da imprensa livre de não estar sujeita à interferência governamental. ",Proinsias De Rossa  (S&D).,4,212,not_available,"['eng', 'eng', 'eng', 'eng']","['  Proinsias De Rossa  (S&D).   - (EN) Senhor Presidente, devemos rever urgentemente a nossa exortação a Israel – e quando digo ""nós"", refiro-me ao Parlamento, ao Conselho e à Comissão – para pôr um ponto final ao cerco de Gaza.', 'Há um ano, morreram mais de 1 400 pessoas na guerra na Faixa de Gaza, a maior parte civis, incluindo mais de 300 crianças. Contudo, o Estado de Israel continua a não permitir a reconstrução das habitações, empresas, serviços de assistência médica e o fornecimento de água potável, saneamento e electricidade, ao mesmo tempo que bloqueia o abastecimento adequado de alimentos.', 'A Europa deve, igualmente, intervir para impedir a expulsão do jornalista Jared Malsin, cidadão americano e insistir em que lhe seja permitido continuar a realizar o seu trabalho na Ma’an, uma agência noticiosa sem fins lucrativos na Cisjordânia.', 'A Comissão congelou o acordo das pescas com a Guiné, porque as acções governamentais nesse país tiveram como consequência a morte de 150 manifestantes. Porque tratamos Israel de modo diferente? Chegou a hora de a Europa dizer a Israel que a nossa paciência está a chegar ao fim e que têm de cumprir a legislação internacional em matéria de direitos humanos, incluindo o direito da imprensa livre de não estar sujeita à interferência governamental. ']"
42, 12. Intervenções de um minuto sobre questões políticas importantes,"  Ilda Figueiredo  (GUE/NGL).   - Senhor Presidente, em Novembro passado a Comissão Europeia lançou uma campanha pública sobre a Estratégia da União Europeia até 2020, que dará seguimento à chamada Estratégia de Lisboa, cujos objectivos, como é conhecido, foram tão propagandeados na época e não foram atingidos, como o provam o aumento do desemprego e da pobreza.A consulta pública decorreu até ao final da semana passada, ou seja, até 15 de Janeiro, num momento em que ainda estamos no processo de audição dos comissários indigitados para a nova Comissão, a qual apenas iniciará funções em Fevereiro próximo.Assim, que sentido tem terminar uma consulta pública sobre um documento tão importante, numa fase destas em que a nova Comissão Europeia não entrou em funções? É uma questão que deve ser revista e, para isso, solicito-lhe, Senhor Presidente, toda a sua atenção, propondo à Comissão Europeia que reveja a sua posição. ",Ilda Figueiredo  (GUE/NGL).,3,150,not_available,"['por', 'por', 'por']","['  Ilda Figueiredo  (GUE/NGL).   - Senhor Presidente, em Novembro passado a Comissão Europeia lançou uma campanha pública sobre a Estratégia da União Europeia até 2020, que dará seguimento à chamada Estratégia de Lisboa, cujos objectivos, como é conhecido, foram tão propagandeados na época e não foram atingidos, como o provam o aumento do desemprego e da pobreza.', 'A consulta pública decorreu até ao final da semana passada, ou seja, até 15 de Janeiro, num momento em que ainda estamos no processo de audição dos comissários indigitados para a nova Comissão, a qual apenas iniciará funções em Fevereiro próximo.', 'Assim, que sentido tem terminar uma consulta pública sobre um documento tão importante, numa fase destas em que a nova Comissão Europeia não entrou em funções? É uma questão que deve ser revista e, para isso, solicito-lhe, Senhor Presidente, toda a sua atenção, propondo à Comissão Europeia que reveja a sua posição. ']"
43, 12. Intervenções de um minuto sobre questões políticas importantes,"  György Schöpflin  (PPE).   - (EN) Senhor Presidente, a Presidência espanhola está, de facto, a lançar uma nova instituição na União Europeia – a Trio-Presidência. Houve, claro, Trios anteriores, mas este é o primeiro a elaborar um programa coordenado e, igualmente, o primeiro ao abrigo do Tratado de Lisboa. Os outros dois Estados-Membros que compõem a Trio-Presidência são a Bélgica e a Hungria.Do ponto de vista da Hungria, o que é particularmente valioso na nova instituição é a oportunidade de oferecermos a nossa própria contribuição diferenciada para o processo. Entre outras questões a resolver pela Trio-Presidência e de particular interesse, está o crescente problema da escassez de água na Europa. Pela primeira vez na sua história, a Europa está a enfrentar uma potencial escassez de água. Dada a sua localização estratégica, a Hungria está numa posição privilegiada para colocar este problema na agenda de trabalhos da União Europeia. ",György Schöpflin  (PPE).,2,150,not_available,"['eng', 'eng']","['  György Schöpflin  (PPE).   - (EN) Senhor Presidente, a Presidência espanhola está, de facto, a lançar uma nova instituição na União Europeia – a Trio-Presidência. Houve, claro, Trios anteriores, mas este é o primeiro a elaborar um programa coordenado e, igualmente, o primeiro ao abrigo do Tratado de Lisboa. Os outros dois Estados-Membros que compõem a Trio-Presidência são a Bélgica e a Hungria.', 'Do ponto de vista da Hungria, o que é particularmente valioso na nova instituição é a oportunidade de oferecermos a nossa própria contribuição diferenciada para o processo. Entre outras questões a resolver pela Trio-Presidência e de particular interesse, está o crescente problema da escassez de água na Europa. Pela primeira vez na sua história, a Europa está a enfrentar uma potencial escassez de água. Dada a sua localização estratégica, a Hungria está numa posição privilegiada para colocar este problema na agenda de trabalhos da União Europeia. ']"
44, 12. Intervenções de um minuto sobre questões políticas importantes,"  Nick Griffin  (NI).   - (EN) Senhor Presidente, há dois meses, o meu círculo eleitoral foi atingido por inundações catastróficas. Enganadoramente atribuída às alterações climáticas, a verdadeira razão da devastação da cidade de Cockermouth foi a privatização/roubo dos serviços públicos impostos pela União Europeia. A gestão adequada dos reservatórios foi substituída pela negligência da United Utilities com o objectivo de reduzir despesas, levando a que as margens de segurança fossem ignoradas e uma situação de pânico conduzisse à decisão de abrir comportas e provocar, por erro humano, um dilúvio sobre a cidade.O facto de um só homem corajoso ter morrido nas inundações foi quase um milagre, mas este tipo de desastres aumentará de frequência à medida que cada vez mais serviços públicos são saqueados por empresas gananciosas. Por último, os eleitores do meu círculo eleitoral estão chocados por não irem receber um cêntimo do Fundo de Solidariedade da União Europeia, porque o Reino Unido não pode candidatar-se a tal, a menos que os danos sejam superiores a 3 mil milhões de euros. Dado que a Grã-Bretanha não se situa numa zona sísmica, é quase impossível conceber um desastre que pudesse desencadear esse pagamento, por isso, os contribuintes britânicos – que contribuem com uma quantia desproporcionada para os fundos – não têm nenhuma hipótese realista de beneficiar dos mesmos. Que solidariedade! Queremos o nosso dinheiro de volta! ",Nick Griffin  (NI).,3,226,not_available,"['eng', 'eng', 'eng']","['  Nick Griffin  (NI).   - (EN) Senhor Presidente, há dois meses, o meu círculo eleitoral foi atingido por inundações catastróficas. Enganadoramente atribuída às alterações climáticas, a verdadeira razão da devastação da cidade de Cockermouth foi a privatização/roubo dos serviços públicos impostos pela União Europeia. A gestão adequada dos reservatórios foi substituída pela negligência da United Utilities com o objectivo de reduzir despesas, levando a que as margens de segurança fossem ignoradas e uma situação de pânico conduzisse à decisão de abrir comportas e provocar, por erro humano, um dilúvio sobre a cidade.', 'O facto de um só homem corajoso ter morrido nas inundações foi quase um milagre, mas este tipo de desastres aumentará de frequência à medida que cada vez mais serviços públicos são saqueados por empresas gananciosas. ', 'Por último, os eleitores do meu círculo eleitoral estão chocados por não irem receber um cêntimo do Fundo de Solidariedade da União Europeia, porque o Reino Unido não pode candidatar-se a tal, a menos que os danos sejam superiores a 3 mil milhões de euros. Dado que a Grã-Bretanha não se situa numa zona sísmica, é quase impossível conceber um desastre que pudesse desencadear esse pagamento, por isso, os contribuintes britânicos – que contribuem com uma quantia desproporcionada para os fundos – não têm nenhuma hipótese realista de beneficiar dos mesmos. Que solidariedade! Queremos o nosso dinheiro de volta! ']"
45, 12. Intervenções de um minuto sobre questões políticas importantes,"  Presidente.   – Gostaria de explicar que estou, também, a tomar nota se os senhores deputados fizeram ou não intervenções de um minuto no último período de sessões ou nos dois últimos períodos de sessões: também estes períodos foram considerados. Contudo, uma vez que o Grupo ALDE não fez provavelmente um número suficiente de intervenções, o último orador será o senhor deputado Gallagher. ",Presidente.,1,61,not_available,['por'],"['  Presidente.   – Gostaria de explicar que estou, também, a tomar nota se os senhores deputados fizeram ou não intervenções de um minuto no último período de sessões ou nos dois últimos períodos de sessões: também estes períodos foram considerados. Contudo, uma vez que o Grupo ALDE não fez provavelmente um número suficiente de intervenções, o último orador será o senhor deputado Gallagher. ']"
