,agenda_item,text,speaker,number_p,number_w,chair,language_ps,ps
54, 12. Priprave na Evropski svet (11. in 12. december 2008) (razprava) ,"  Ilda Figueiredo  (GUE/NGL),  v pisni obliki. – (PT) Voditelji Evropske unije ne sprejemajo rezultatov glasovanja edinega referenduma, ki ga je bilo mogoče izvesti – ker je tako zahtevala njihova lastna nacionalna ustava – o osnutku Lizbonske pogodbe, na katerem so ljudje ponovili odločitev PROTI, ki so jo glede evropske ustave že sprejeli v Franciji in na Nizozemskem. Znova opažamo, da se z odnosom, ki je protidemokratičen in izraža popolno nespoštovanje glasovanja državljanov, vračajo pritiski in izsiljevanje, da bi Irsko prisilili v izvedbo novega referenduma ali – še slabše – spremembo svoje nacionalne ustave in se tako izognili referendumom in ljudskemu glasovanju. Ponovno glasno protestiramo proti takemu stališču.Teh politik se je treba po nujnem postopku znebiti. Za Portugalsko in Evropo želimo novo smer, kjer bo prednost namenjena ljudem, izboljšanju skupne blaginje in spoštovanju dostojanstva vseh, ki ustvarjajo bogastvo. Ta nova smer mora zavrniti tisto, kar predsednik Sarkozy imenuje prenovo kapitalizma in reči ne politiki ekonomske in monetarne unije ter s tem povezanemu Paktu za stabilnost in lažni avtonomiji Evropske centralne banke (ECB). Do tega v skladu s tako imenovanim „načrtom za oživitev gospodarstva“ ne bo prišlo. ","Ilda Figueiredo  (GUE/NGL),",2,182,not_available,"['por', 'por']","['  Ilda Figueiredo  (GUE/NGL),  v pisni obliki. – (PT) Voditelji Evropske unije ne sprejemajo rezultatov glasovanja edinega referenduma, ki ga je bilo mogoče izvesti – ker je tako zahtevala njihova lastna nacionalna ustava – o osnutku Lizbonske pogodbe, na katerem so ljudje ponovili odločitev PROTI, ki so jo glede evropske ustave že sprejeli v Franciji in na Nizozemskem. Znova opažamo, da se z odnosom, ki je protidemokratičen in izraža popolno nespoštovanje glasovanja državljanov, vračajo pritiski in izsiljevanje, da bi Irsko prisilili v izvedbo novega referenduma ali – še slabše – spremembo svoje nacionalne ustave in se tako izognili referendumom in ljudskemu glasovanju. Ponovno glasno protestiramo proti takemu stališču.', 'Teh politik se je treba po nujnem postopku znebiti. Za Portugalsko in Evropo želimo novo smer, kjer bo prednost namenjena ljudem, izboljšanju skupne blaginje in spoštovanju dostojanstva vseh, ki ustvarjajo bogastvo. Ta nova smer mora zavrniti tisto, kar predsednik Sarkozy imenuje prenovo kapitalizma in reči ne politiki ekonomske in monetarne unije ter s tem povezanemu Paktu za stabilnost in lažni avtonomiji Evropske centralne banke (ECB). Do tega v skladu s tako imenovanim „načrtom za oživitev gospodarstva“ ne bo prišlo. ']"
55, 12. Priprave na Evropski svet (11. in 12. december 2008) (razprava) ,"  Pedro Guerreiro  (GUE/NGL),  v pisni obliki. – (PT) Bližnje zasedanje Evropskega sveta bo še ena faza v nesprejemljivem procesu vsiljevanja osnutka pogodbe, ki so jo narodi Evropi zavrnili že trikrat.Namesto, da bi spoštovale voljo ljudi v Franciji, na Nizozemskem in Irskem, so institucije Evropske unije (Evropski parlament, Svet in Komisija) pokazale, da je njihov pravi značaj protidemokratičen, ko so vztrajale pri nadaljevanju procesa (parlamentarne) ratifikacije osnutka pogodbe (ki je do sedaj niso zaključili le še v Nemčiji, na Poljskem in v Češki republiki) in se vselej „kot kuge “ izogibale izvedbe referendumov (kot tistega, ki je nedavno potekal na Švedskem).Velika podjetja v Evropi in izvajalci njihovih politik – desni in socialdemokrati – ignorirajo neodvisno in demokratično izraženo voljo Ircev, ker jih želijo „izolirati“, da bi nanje lažje pritiskali in jih izsiljevali ter jim vsilili nov referendum, podobno kot v primeru Pogodbe iz Nice.Pogledati je treba le nesprejemljiv predlog resolucije z dne 17. novembra 2008 Odbora za (tako imenovane) ustavne zadeve EP, ki „ponavlja in potrjuje svojo podporo Pogodbi“ (kakor da bi za to bil pristojen ...) in „nujnost njene ratifikacije v državah članicah … v najkrajšem možnem času“.EU je pokazala svojo pravo barvo! ","Pedro Guerreiro  (GUE/NGL),",5,192,not_available,"['por', 'por', 'por', 'por', 'por']","['  Pedro Guerreiro  (GUE/NGL),  v pisni obliki. – (PT) Bližnje zasedanje Evropskega sveta bo še ena faza v nesprejemljivem procesu vsiljevanja osnutka pogodbe, ki so jo narodi Evropi zavrnili že trikrat.', 'Namesto, da bi spoštovale voljo ljudi v Franciji, na Nizozemskem in Irskem, so institucije Evropske unije (Evropski parlament, Svet in Komisija) pokazale, da je njihov pravi značaj protidemokratičen, ko so vztrajale pri nadaljevanju procesa (parlamentarne) ratifikacije osnutka pogodbe (ki je do sedaj niso zaključili le še v Nemčiji, na Poljskem in v Češki republiki) in se vselej „kot kuge “ izogibale izvedbe referendumov (kot tistega, ki je nedavno potekal na Švedskem).', 'Velika podjetja v Evropi in izvajalci njihovih politik – desni in socialdemokrati – ignorirajo neodvisno in demokratično izraženo voljo Ircev, ker jih želijo „izolirati“, da bi nanje lažje pritiskali in jih izsiljevali ter jim vsilili nov referendum, podobno kot v primeru Pogodbe iz Nice.', 'Pogledati je treba le nesprejemljiv predlog resolucije z dne 17. novembra 2008 Odbora za (tako imenovane) ustavne zadeve EP, ki „ponavlja in potrjuje svojo podporo Pogodbi“ (kakor da bi za to bil pristojen ...) in „nujnost njene ratifikacije v državah članicah … v najkrajšem možnem času“.', 'EU je pokazala svojo pravo barvo! ']"
56, 12. Priprave na Evropski svet (11. in 12. december 2008) (razprava) ,"  Tunne Kelam  (PPE-DE),  v pisni obliki. – Svet in Komisijo bi rad spomnil, da EU temelji na osnovnih vrednotah, kot so demokracija, načela pravne države in spoštovanje človekovih pravic.Zato močno obsojam duh, v katerem je potekal nedavni vrh EU-Rusija v Nici. Ni sprejemljivo, da bo vse spet po starem, kot da ni nobene druge možnosti.Vključevanje zaščite človekovih pravic v njene zunanje politike in spoštovanje načel pravne države sta temelja vseh odnosov s tretjimi državami.Rusija ne more biti izjema, zlasti zato, ker po agresiji nad Gruzijo ni izpolnila vseh pogojev iz sporazuma.Skrbi me, da EU ne bo izgubila ugleda resnega in neodvisnega akterja v mednarodnih zadevah. Poleg tega lahko neodločnost EU, da postavi jasne meje glede vnaprej načrtovane kršitve mednarodnih norm vedenja, Rusijo spodbudi, da v prihodnosti izvede podobno agresijo.Zato resno pozivam Komisijo in Svet, da dobro premislita o svoji odločitvi o nadaljevanju po starem, kot da se ni nič zgodilo. ","Tunne Kelam  (PPE-DE),",6,156,not_available,"['slv', 'slv', 'slv', 'slv', 'slv', 'slv']","['  Tunne Kelam  (PPE-DE),  v pisni obliki. – Svet in Komisijo bi rad spomnil, da EU temelji na osnovnih vrednotah, kot so demokracija, načela pravne države in spoštovanje človekovih pravic.', 'Zato močno obsojam duh, v katerem je potekal nedavni vrh EU-Rusija v Nici. Ni sprejemljivo, da bo vse spet po starem, kot da ni nobene druge možnosti.', 'Vključevanje zaščite človekovih pravic v njene zunanje politike in spoštovanje načel pravne države sta temelja vseh odnosov s tretjimi državami.', 'Rusija ne more biti izjema, zlasti zato, ker po agresiji nad Gruzijo ni izpolnila vseh pogojev iz sporazuma.', 'Skrbi me, da EU ne bo izgubila ugleda resnega in neodvisnega akterja v mednarodnih zadevah. Poleg tega lahko neodločnost EU, da postavi jasne meje glede vnaprej načrtovane kršitve mednarodnih norm vedenja, Rusijo spodbudi, da v prihodnosti izvede podobno agresijo.', 'Zato resno pozivam Komisijo in Svet, da dobro premislita o svoji odločitvi o nadaljevanju po starem, kot da se ni nič zgodilo. ']"
57, 12. Priprave na Evropski svet (11. in 12. december 2008) (razprava) ,"  Rareş-Lucian Niculescu  (PPE-DE),  v pisni obliki. – (RO) Spregovoril bi rad o nedavnem sporočilu Komisije v zvezi z načrtom EU za oživitev gospodarstva.Poudariti želim pomen nekaterih določb v tem načrtu, zlasti tistih, ki zadevajo sprejem ukrepov za izboljšanje energetske učinkovitosti v obstoječih domovih in javnih zgradbah.Komisija je napovedala, da bo predlagala spremembo ureditve strukturnih skladov v podporo tem ukrepom, da bi razširila razpoložljive možnosti na tem področju.Menim, da je izredno pomembno, če je namen te spremembe uporaba sredstev iz Evropskega sklada za regionalni razvoj za izboljšanje stanovanjskih razmer in zvišanje sedanje 2 % stopnje. ","Rareş-Lucian Niculescu  (PPE-DE),",4,97,not_available,"['rum', 'rum', 'rum', 'rum']","['  Rareş-Lucian Niculescu  (PPE-DE),  v pisni obliki. – (RO) Spregovoril bi rad o nedavnem sporočilu Komisije v zvezi z načrtom EU za oživitev gospodarstva.', 'Poudariti želim pomen nekaterih določb v tem načrtu, zlasti tistih, ki zadevajo sprejem ukrepov za izboljšanje energetske učinkovitosti v obstoječih domovih in javnih zgradbah.', 'Komisija je napovedala, da bo predlagala spremembo ureditve strukturnih skladov v podporo tem ukrepom, da bi razširila razpoložljive možnosti na tem področju.', 'Menim, da je izredno pomembno, če je namen te spremembe uporaba sredstev iz Evropskega sklada za regionalni razvoj za izboljšanje stanovanjskih razmer in zvišanje sedanje 2 % stopnje. ']"
58, 13. Prihodnja globalna ureditev finančnih trgov in načrt EU za oživitev gospodarstva (razprava) ,"  Predsednica  . – Pozdravljamo študente iz Evropske univerze v Rimu, ki so prisotni na galeriji.Naslednja točka je vprašanje za ustni odgovor z razpravo, naslovljeno Svetu in Komisiji o prihodnji globalni ureditvi finančnih trgov in načrtu EU za oživitev gospodarstva (O-0124/2008 – B6-0487/2008) in (O-0125/2008 – B6-0488/2008). ",Predsednica,2,51,not_available,"['slv', 'slv']","['  Predsednica  . – Pozdravljamo študente iz Evropske univerze v Rimu, ki so prisotni na galeriji.', 'Naslednja točka je vprašanje za ustni odgovor z razpravo, naslovljeno Svetu in Komisiji o prihodnji globalni ureditvi finančnih trgov in načrtu EU za oživitev gospodarstva (O-0124/2008 – B6-0487/2008) in (O-0125/2008 – B6-0488/2008). ']"
59, 13. Prihodnja globalna ureditev finančnih trgov in načrt EU za oživitev gospodarstva (razprava) ,"  Pervenche Berès,  avtorica. – (FR) Gospod predsednik, gospod Alumnia, gospod Novelli, gospod Barroso, nedavno smo slišali, da je prišel čas, ko mora Komisija podrezati države članice. Če je to strategija Komisije, ste dobrodošli tu v Parlamentu, pri izvajanju take strategije pa boste imeli našo popolno podporo.Za nas je trenutni problem povezan s stopnjo sodelovanja med državami članicami. Prepogosto se dogaja, da se ugotovi nujnost nastalega položaja in se izvede primerjava med nacionalnimi rešitvami, ki se nato preoblikujejo v evropsko rešitev. Mislimo, da moramo ravnati drugače, če želimo naše vire bolje izkoristiti.Kar zadeva mednarodno finančno ureditev, se je sestal vrh G20 in določil prihodnje roke. V zvezi z včeraj sprejetimi sklepi Sveta Ecofin mi je padla v oči ena stvar in sicer, da v njegovih sklepih ni mandata za Komisijo. Zato pozivam Svet, da mi pove, kako namerava uveljaviti svoje predloge, predvsem glede boja proti nesodelovanju nekaterih sodnih oblasti in določitve vloge MDS v odnosih do drugih mednarodnih finančnih institucij.Želim tudi, da nam Svet in Komisija povesta, katere so naslednje faze glede na sprejet časovni razpored, in pod kakšnimi pogoji bi se Parlament vključil v te razprave, saj sem prepričana, da je to pravi način ravnanja za zagotovitev evropske dinamike.V zvezi z načrtom za oživitev gospodarstva se omenja številka 1,5 %. V primerjavi s številkami, ki so krožile pred tem, je to treba obravnavati kot korak v pravi smeri. Bo to zadostovalo, gre zares za 1,5 % ali pa le za preimenovanje že načrtovanih izdatkov? To bo morali podrobneje preučiti.Podala pa bi rada tri pripombe glede samega načrta. Prvič, če ne bo resničnega usklajevanja v smislu pogodbe, v smislu člena 99, ki države članice poziva, naj svoje gospodarske politike obravnavajo kot vprašanja skupnega interesa, ne bomo uspeli. Presenečena sem, ko vidim, kot izhaja tudi iz sklepov včerajšnjega Sveta Ecofin, da se ta metoda še vedno ne uporablja. Usklajevanje gospodarskih politik v tej kritični fazi ne more zajemati le načrtov za oživitev, ki jih posredujejo države članice, o katerih najprej razpravljajo njihove vlade, nato pa jih oceni Komisija. To ne zadostuje.Drugič, preseneča me, ko vidim, da v tem dokumentu ni omenjena možnost okrevanja, čeprav vem, da ni združljiva s Pogodbo v njenem sedanjem stanju, vendar ni omenjena več niti ideja, ki je občasno krožila, in po mojem mnenju povsem upravičeno, o možnem združevanju dolgov držav članic v območju evra.Če Komisija želi biti drzna, je sedaj čas za odpiranje razprave o tem. Morda Svet tega predloga ne bo takoj podprl, toda glede na vaše dosedanje aktivnosti v tem parlamentu sem skoraj prepričana, da boste uspeli pridobiti podporo v Parlamentu, zato se splača nadaljevati v tej smeri.Tretje vprašanje zadeva delovna mesta in plače. Pravkar ste omenili pomembnost ciljev v smislu delovnih mest. Ne pozabite, da morajo to biti visokokakovostna delovna mesta ali pa ne bomo dosegli ciljev, ki smo jih opredelili v naši lizbonski strategiji.Na koncu bi želela podati pripombo še glede Evropske investicijske banke. Zadolžena je za veliko nalog, mi pa moramo spremljati način, po katerem banke same izvajajo te storitve in orodja, ki so ponovno na voljo, saj morajo MSP uporabljati bančni sistem, če želijo dostop do njih. Dobro vemo, kako krhek je bančni sistem, zato vas pozivam, da to vprašanje dobro preučite, vse nas pa, da se učimo iz preteklih napak ali z drugimi besedami, opredelimo javno porabo, ki bo koristna za naše dolgoročne cilje na usklajen način, ali pa bo javna poraba nekoristna. ","Pervenche Berès,",10,571,not_available,"['fra', 'fra', 'fra', 'fra', 'fra', 'fra', 'fra', 'fra', 'fra', 'fra']","['  Pervenche Berès,  avtorica. – (FR) Gospod predsednik, gospod Alumnia, gospod Novelli, gospod Barroso, nedavno smo slišali, da je prišel čas, ko mora Komisija podrezati države članice. Če je to strategija Komisije, ste dobrodošli tu v Parlamentu, pri izvajanju take strategije pa boste imeli našo popolno podporo.', 'Za nas je trenutni problem povezan s stopnjo sodelovanja med državami članicami. Prepogosto se dogaja, da se ugotovi nujnost nastalega položaja in se izvede primerjava med nacionalnimi rešitvami, ki se nato preoblikujejo v evropsko rešitev. Mislimo, da moramo ravnati drugače, če želimo naše vire bolje izkoristiti.', 'Kar zadeva mednarodno finančno ureditev, se je sestal vrh G20 in določil prihodnje roke. V zvezi z včeraj sprejetimi sklepi Sveta Ecofin mi je padla v oči ena stvar in sicer, da v njegovih sklepih ni mandata za Komisijo. Zato pozivam Svet, da mi pove, kako namerava uveljaviti svoje predloge, predvsem glede boja proti nesodelovanju nekaterih sodnih oblasti in določitve vloge MDS v odnosih do drugih mednarodnih finančnih institucij.', 'Želim tudi, da nam Svet in Komisija povesta, katere so naslednje faze glede na sprejet časovni razpored, in pod kakšnimi pogoji bi se Parlament vključil v te razprave, saj sem prepričana, da je to pravi način ravnanja za zagotovitev evropske dinamike.', 'V zvezi z načrtom za oživitev gospodarstva se omenja številka 1,5 %. V primerjavi s številkami, ki so krožile pred tem, je to treba obravnavati kot korak v pravi smeri. Bo to zadostovalo, gre zares za 1,5 % ali pa le za preimenovanje že načrtovanih izdatkov? To bo morali podrobneje preučiti.', 'Podala pa bi rada tri pripombe glede samega načrta. Prvič, če ne bo resničnega usklajevanja v smislu pogodbe, v smislu člena 99, ki države članice poziva, naj svoje gospodarske politike obravnavajo kot vprašanja skupnega interesa, ne bomo uspeli. Presenečena sem, ko vidim, kot izhaja tudi iz sklepov včerajšnjega Sveta Ecofin, da se ta metoda še vedno ne uporablja. Usklajevanje gospodarskih politik v tej kritični fazi ne more zajemati le načrtov za oživitev, ki jih posredujejo države članice, o katerih najprej razpravljajo njihove vlade, nato pa jih oceni Komisija. To ne zadostuje.', 'Drugič, preseneča me, ko vidim, da v tem dokumentu ni omenjena možnost okrevanja, čeprav vem, da ni združljiva s Pogodbo v njenem sedanjem stanju, vendar ni omenjena več niti ideja, ki je občasno krožila, in po mojem mnenju povsem upravičeno, o možnem združevanju dolgov držav članic v območju evra.', 'Če Komisija želi biti drzna, je sedaj čas za odpiranje razprave o tem. Morda Svet tega predloga ne bo takoj podprl, toda glede na vaše dosedanje aktivnosti v tem parlamentu sem skoraj prepričana, da boste uspeli pridobiti podporo v Parlamentu, zato se splača nadaljevati v tej smeri.', 'Tretje vprašanje zadeva delovna mesta in plače. Pravkar ste omenili pomembnost ciljev v smislu delovnih mest. Ne pozabite, da morajo to biti visokokakovostna delovna mesta ali pa ne bomo dosegli ciljev, ki smo jih opredelili v naši lizbonski strategiji.', 'Na koncu bi želela podati pripombo še glede Evropske investicijske banke. Zadolžena je za veliko nalog, mi pa moramo spremljati način, po katerem banke same izvajajo te storitve in orodja, ki so ponovno na voljo, saj morajo MSP uporabljati bančni sistem, če želijo dostop do njih. Dobro vemo, kako krhek je bančni sistem, zato vas pozivam, da to vprašanje dobro preučite, vse nas pa, da se učimo iz preteklih napak ali z drugimi besedami, opredelimo javno porabo, ki bo koristna za naše dolgoročne cilje na usklajen način, ali pa bo javna poraba nekoristna. ']"
60, 13. Prihodnja globalna ureditev finančnih trgov in načrt EU za oživitev gospodarstva (razprava) ,"  Predsednica  . – Ponovno pozdravljamo našega predsednika Sveta, gospoda Novellija, ki je bil eden od poslancev v letih 1999 do 2002, če se prav spominjam. ",Predsednica,1,23,not_available,['slv'],"['  Predsednica  . – Ponovno pozdravljamo našega predsednika Sveta, gospoda Novellija, ki je bil eden od poslancev v letih 1999 do 2002, če se prav spominjam. ']"
