,agenda_item,text,speaker,number_p,number_w,chair,language_ps,ps
0, 1. Nadaljevanje zasedanja,PREDSEDSTVO: GOSPOD PÖTTERING predsednik (Seja se je začela ob 15.00.) ,PREDSEDSTVO: GOSPOD PÖTTERING,2,11,not_available,"['slv', 'slv']","['PREDSEDSTVO: GOSPOD PÖTTERING predsednik', ' (Seja se je začela ob 15.00.) ']"
1, 1. Nadaljevanje zasedanja,"  Predsednik. −   Razglašam, da se zasedanje Evropskega parlamenta, ki je bilo prekinjeno v četrtek, 20. novembra 2008, nadaljuje. ",Predsednik. −,1,17,not_available,['slv'],"['  Predsednik. −   Razglašam, da se zasedanje Evropskega parlamenta, ki je bilo prekinjeno v četrtek, 20. novembra 2008, nadaljuje. ']"
2, 5. Izjave predsedstva,"  Predsednik. −   Pred tednom dni, 26. novembra, je v Mumbaju v Indiji prišlo do vrste usklajenih terorističnih napadov. Po podatkih indijskega notranjega ministrstva je v strašnih napadih življenje izgubilo skoraj 190 ljudi, 22 od njih je bilo tujcev. V napadih je bilo ranjenih 200 ljudi, preživetje številnih pa je še vedno negotovo.V imenu Evropskega parlamenta bi želel glede tega nesmiselnega napada na nedolžne ljudi izraziti ogorčenje, vsem družinam preminulih pa izreči globoko sožalje.Vsem, ki so bili v napadih ranjeni, in njihovim družinam želim zagotoviti našo podporo in iskreno sožalje.Evropski parlament močno obsoja te teroristične napade in želi v tem času žalovanja izkazati solidarnost z Indijo, njenimi ljudmi in organi. Danes smo v srcu vsi Indijci.Terorizem je neposreden napad na svobodo, človekove pravice in demokracijo. Terorizem je poskus rušenja naših vrednot s samovoljnim nasiljem – vrednot, ki nas združujejo v Evropski uniji in državah članicah.Gospe in gospodje, veste, da je bila delegacija Odbora za mednarodno trgovino Evropskega parlamenta v Mumbaju prav v času napadov.Sredi žalovanja zaradi tragičnih napadov pa hkrati čutimo tudi veselje in olajšanje, da so vsi člani parlamentarne delegacije, ki je bila tam na poti, spet z nami, živi in zdravi, saj so bili nekateri člani delegacije Evropskega parlamenta v hotelih, ki so bili v času napadov prizadeti in so bili v neposredni smrtni nevarnosti.Vsem izražam ponovno dobrodošlico v Bruslju. Gospe in gospodje, v naši sredini še zlasti pozdravljam: Ignasija Guardansa, ki je vodil delegacijo, Daniela Casparyja, Bélo Glattfelderja, Syeda Kamalla, Sajjada Karima, Eriko Mann, Jana Tadeusza Masiela in Mio De Vits. Čudovito je, da ste spet z nami.(Aplavz)Prav tako sem vesel, da so spet z nami naslednji člani Evropskega parlamenta, zato prav tako toplo pozdravljam: Alberta Rodasa, Christopherja Forda, Levento Csaszi in Vladymyrja Dedobbeleerja ter člane političnih skupin Ariello Rouby in Barbaro Melis kot tudi tolmača Vincenta Capeta iz Evropskega parlamenta in samostojna tolmača Karen Twidle in Michaela Hilla.(Aplavz)Vsem nam je odleglo, da ste vsi v redu, in upam, da si boste kmalu tudi duševno opomogli od te strašne izkušnje.Posebno zahvalo in priznanje namenjam ljudem v Indiji, tistim, ki so vam kljub negotovim lokalnim razmeram nudili zaščito in pomoč.Prav tako se zahvaljujem konzulatom držav članic Evropske unije, ki so v skladu s črko in duhom evropske pogodbe pokazali solidarnost in vam v takšnih razmerah nudili pomoč.Naj vas pri tem vse spomnim, da se vsi državljani Evropske unije, katerih matična država nima predstavništva v danem okolju – kot velja tudi za Mumbaj – lahko obrnejo na konzulat katerekoli države članice EU. Takšne situacije predstavljajo pristen izraz močne solidarnosti med narodi Evropske unije.(Aplavz)Kolegi poslanci, danes so naše misli namenjene zlasti vsem žrtvam napadov v Indiji in njihovim družinam. Njihova smrt in okoliščine, ki so do nje pripeljale, so zločin, ki je povsem nesprejemljiv.Na terorizem – ne glede na to, kje in kdo ga izvaja – se je treba odzvati z odločnimi ukrepi ter solidarnostjo. Evropska unija se z mednarodno skupnostjo bori proti vsem oblikam terorizma.Pri tem nas vodijo naša načela pravne države. Boj proti terorizmu je mogoče voditi le v skladu z načeli, ki jih zagovarjamo.⁂",Predsednik. −,22,518,not_available,"['slv', 'slv', 'slv', 'slv', 'slv', 'slv', 'slv', 'slv', 'slv', 'slv', 'slv', 'slv', 'slv', 'slv', 'slv', 'slv', 'slv', 'slv', 'slv', 'slv', 'slv', 'slv']","['  Predsednik. −   Pred tednom dni, 26. novembra, je v Mumbaju v Indiji prišlo do vrste usklajenih terorističnih napadov. Po podatkih indijskega notranjega ministrstva je v strašnih napadih življenje izgubilo skoraj 190 ljudi, 22 od njih je bilo tujcev. V napadih je bilo ranjenih 200 ljudi, preživetje številnih pa je še vedno negotovo.', 'V imenu Evropskega parlamenta bi želel glede tega nesmiselnega napada na nedolžne ljudi izraziti ogorčenje, vsem družinam preminulih pa izreči globoko sožalje.', 'Vsem, ki so bili v napadih ranjeni, in njihovim družinam želim zagotoviti našo podporo in iskreno sožalje.', 'Evropski parlament močno obsoja te teroristične napade in želi v tem času žalovanja izkazati solidarnost z Indijo, njenimi ljudmi in organi. Danes smo v srcu vsi Indijci.', 'Terorizem je neposreden napad na svobodo, človekove pravice in demokracijo. Terorizem je poskus rušenja naših vrednot s samovoljnim nasiljem – vrednot, ki nas združujejo v Evropski uniji in državah članicah.', 'Gospe in gospodje, veste, da je bila delegacija Odbora za mednarodno trgovino Evropskega parlamenta v Mumbaju prav v času napadov.', 'Sredi žalovanja zaradi tragičnih napadov pa hkrati čutimo tudi veselje in olajšanje, da so vsi člani ', 'parlamentarne delegacije, ki je bila tam na poti, spet z nami, živi in zdravi, saj so bili nekateri člani delegacije Evropskega parlamenta v hotelih, ki so bili v času napadov prizadeti in so bili v neposredni smrtni nevarnosti.', 'Vsem izražam ponovno dobrodošlico v Bruslju. ', 'Gospe in gospodje, v naši sredini še zlasti pozdravljam: Ignasija Guardansa, ki je vodil delegacijo, Daniela Casparyja, Bélo Glattfelderja, Syeda Kamalla, Sajjada Karima, Eriko Mann, Jana Tadeusza Masiela in Mio De Vits. Čudovito je, da ste spet z nami.', '(Aplavz)', 'Prav tako sem vesel, da so spet z nami naslednji člani Evropskega parlamenta, zato prav tako toplo pozdravljam: Alberta Rodasa, Christopherja Forda, Levento Csaszi in Vladymyrja Dedobbeleerja ter člane političnih skupin Ariello Rouby in Barbaro Melis kot tudi tolmača Vincenta Capeta iz Evropskega parlamenta in samostojna tolmača Karen Twidle in Michaela Hilla.', '(Aplavz)', 'Vsem nam je odleglo, da ste vsi v redu, in upam, da si boste kmalu tudi duševno opomogli od te strašne izkušnje.', 'Posebno zahvalo in priznanje namenjam ljudem v Indiji, tistim, ki so vam kljub negotovim lokalnim razmeram nudili zaščito in pomoč.', 'Prav tako se zahvaljujem konzulatom držav članic Evropske unije, ki so v skladu s črko in duhom evropske pogodbe pokazali solidarnost in vam v takšnih razmerah nudili pomoč.', 'Naj vas pri tem vse spomnim, da se vsi državljani Evropske unije, katerih matična država nima predstavništva v danem okolju – kot velja tudi za Mumbaj – lahko obrnejo na konzulat katerekoli države članice EU. Takšne situacije predstavljajo pristen izraz močne solidarnosti med narodi Evropske unije.', '(Aplavz)', 'Kolegi poslanci, danes so naše misli namenjene zlasti vsem žrtvam napadov v Indiji in njihovim družinam. Njihova smrt in okoliščine, ki so do nje pripeljale, so zločin, ki je povsem nesprejemljiv.', 'Na terorizem – ne glede na to, kje in kdo ga izvaja – se je treba odzvati z odločnimi ukrepi ter solidarnostjo. Evropska unija se z mednarodno skupnostjo bori proti vsem oblikam terorizma.', 'Pri tem nas vodijo naša načela pravne države. Boj proti terorizmu je mogoče voditi le v skladu z načeli, ki jih zagovarjamo.', '⁂']"
3, 10. Razpored dela,"  Predsednik. −   Končna različica osnutka dnevnega reda za to delno zasedanje, ki jo je na svojem sestanku v četrtek, 20. novembra 2008, v skladu s členoma 130 in 131 poslovnika sestavila konferenca predsednikov, je bila razposlana. Zahtevano je bilo, da se osnutek spremeni, kot sledi:SredaKonfederalna skupina Evropske združene levice/Zelene nordijske levice in Skupina Zelenih/Evropske svobodne zveze predlagata odlog glasovanja o poročilu gospe De Keyser o sodelovanju Države Izrael v programih Skupnosti kot tudi glasovanja o predlogu resolucije o isti temi. ",Predsednik. −,3,82,not_available,"['slv', 'slv', 'slv']","['  Predsednik. −   Končna različica osnutka dnevnega reda za to delno zasedanje, ki jo je na svojem sestanku v četrtek, 20. novembra 2008, v skladu s členoma 130 in 131 poslovnika sestavila konferenca predsednikov, je bila razposlana. Zahtevano je bilo, da se osnutek spremeni, kot sledi:', 'Sreda', 'Konfederalna skupina Evropske združene levice/Zelene nordijske levice in Skupina Zelenih/Evropske svobodne zveze predlagata odlog glasovanja o poročilu gospe De Keyser o sodelovanju Države Izrael v programih Skupnosti kot tudi glasovanja o predlogu resolucije o isti temi. ']"
4, 10. Razpored dela,"  Francis Wurtz,  v imenu skupine GUE/NGL. – (FR) Gospod predsednik, naša zahteva temelji na zelo jasnem dejstvu, ki je znano vsem. Konec preteklega maja je uradna delegacija našega parlamenta, ki je predstavljala vse politične skupine, šla v Izrael in obiskala palestinska ozemlja, vključno z Gazo.Na podlagi opažanj na kraju samem so ob koncu obiska soglasno sprejeli izjavo. Ta izjava vsebuje naslednje: „Močno smo prepričani, da brez resnih znakov dobre volje, prevedenih v oprijemljive izboljšave na kraju samem, še ni pravi čas za nadgradnjo odnosov EU-Izrael“. (FR) Od takrat takšnih znakov ni bilo opaziti, prav nasprotno. Zato menimo, da bi danes poslali zelo slab signal, če bi glasovali za priporočilo Sveta.Moja skupina predlaga, da odložimo glasovanje, dokler v izraelski politiki in na kraju samem ne dobimo dokazil o teh slavnih znakih, ki jih je soglasno zahtevala delegacija, ki je pred nekaj meseci zastopala naš parlament.","Francis Wurtz,",5,147,not_available,"['fra', 'fra', 'fra', 'fra', 'fra']","['  Francis Wurtz,  v imenu skupine GUE/NGL. – (FR) Gospod predsednik, naša zahteva temelji na zelo jasnem dejstvu, ki je znano vsem. Konec preteklega maja je uradna delegacija našega parlamenta, ki je predstavljala vse politične skupine, šla v Izrael in obiskala palestinska ozemlja, vključno z Gazo.', 'Na podlagi opažanj na kraju samem so ob koncu obiska soglasno sprejeli izjavo. Ta izjava vsebuje naslednje: ', '„Močno smo prepričani, da brez resnih znakov dobre volje, prevedenih v oprijemljive izboljšave na kraju samem, še ni pravi čas za nadgradnjo odnosov EU-Izrael“. ', '(FR) Od takrat takšnih znakov ni bilo opaziti, prav nasprotno. Zato menimo, da bi danes poslali zelo slab signal, če bi glasovali za priporočilo Sveta.', 'Moja skupina predlaga, da odložimo glasovanje, dokler v izraelski politiki in na kraju samem ne dobimo dokazil o teh slavnih znakih, ki jih je soglasno zahtevala delegacija, ki je pred nekaj meseci zastopala naš parlament.']"
5, 10. Razpored dela,"  Daniel Cohn-Bendit,  v imenu skupine Verts/ALE. – (DE) Gospod predsednik, gospe in gospodje, včasih moramo sprejeti zelo težke odločitve. Mislim, da so spori, ki jih imamo mi v Evropi – tu v tem parlamentu – glede Izraela in Palestine vedno zelo težavni.Ko sprejemamo odločitve, ne smemo pozabiti na samo vizijo. Pogubno bi bilo, če bi ta parlament glasoval proti predlogu o krepitvi vezi med Izraelom in Evropskim parlamentom. Ponavljam, bilo bi pogubno, če bi glasovali proti. Vendar bi bilo prav tako pogubno ta predlog podpreti, saj vsi vemo, kako težke in občutljive so razmere. V Izraelu sem bil pred 14 dnevi in sem sam videl, da niti Izraelci niti Palestinci ne vedo, kako naprej. Pogubno bi bilo, če bi z odklonilnim stališčem povečali razočaranje Izraelcev. Prav tako pa bi bilo pogubno s pritrdilnim stališčem povečati razočaranje Palestincev. Zatorej bomo, če smo inteligentni, glasovanje odložili. Kajti še vedno se moramo pogovarjati in moramo delovati. Včasih je bolj inteligentno v miru nadaljevati razpravo kot pa čustveno in prehitro sprejeti odločitev, ki prizadene ali razočara bodisi eno bodisi drugo stran.V Evropi imamo posredovalno funkcijo, ki jo moramo obdržati. Zato predlagamo odlog tega glasovanja. Biti inteligenten včasih pomeni počakati. ","Daniel Cohn-Bendit,",3,196,not_available,"['ger', 'ger', 'ger']","['  Daniel Cohn-Bendit,  v imenu skupine Verts/ALE. – (DE) Gospod predsednik, gospe in gospodje, včasih moramo sprejeti zelo težke odločitve. Mislim, da so spori, ki jih imamo mi v Evropi – tu v tem parlamentu – glede Izraela in Palestine vedno zelo težavni.', 'Ko sprejemamo odločitve, ne smemo pozabiti na samo vizijo. Pogubno bi bilo, če bi ta parlament glasoval proti predlogu o krepitvi vezi med Izraelom in Evropskim parlamentom. Ponavljam, bilo bi pogubno, če bi glasovali proti. Vendar bi bilo prav tako pogubno ta predlog podpreti, saj vsi vemo, kako težke in občutljive so razmere. V Izraelu sem bil pred 14 dnevi in sem sam videl, da niti Izraelci niti Palestinci ne vedo, kako naprej. Pogubno bi bilo, če bi z odklonilnim stališčem povečali razočaranje Izraelcev. Prav tako pa bi bilo pogubno s pritrdilnim stališčem povečati razočaranje Palestincev. Zatorej bomo, če smo inteligentni, glasovanje odložili. Kajti še vedno se moramo pogovarjati in moramo delovati. Včasih je bolj inteligentno v miru nadaljevati razpravo kot pa čustveno in prehitro sprejeti odločitev, ki prizadene ali razočara bodisi eno bodisi drugo stran.', 'V Evropi imamo posredovalno funkcijo, ki jo moramo obdržati. Zato predlagamo odlog tega glasovanja. Biti inteligenten včasih pomeni počakati. ']"
6, 10. Razpored dela,"  José Ignacio Salafranca Sánchez-Neyra,  v imenu skupine PPE-DE. – (ES) Gospod predsednik, s tem v zvezi moram omeniti, da je Odbor za zunanje zadeve Parlamenta, vključno s poročevalko, gospo de Keyser, v glavnem glasoval za poročilo gospe de Keyser.Kot smo včeraj na sestanku izraelske zunanje ministrice z Odborom za zunanje zadeve rekli, razumemo veliko zaskrbljenost tega parlamenta glede poniževanja in razočaranja, ki ju trpijo ljudje v Palestini.In prav to so razlogi, gospod predsednik, zaradi katerih menimo, da bi ta parlament moral zavzeti stališče v obliki resolucije. Napovem lahko, da bo moja politična skupina sprejela spremembe, ki jih je levica predlagala glede vzpostavitve odnosa. Pri tem ne gre za nadgradnjo odnosov z Izraelom, gospod Wurtz, temveč je to glasovanje za resolucijo in privolitev, da se Evropski parlament glede na pooblastila, ki mu jih dajejo pogodbe, posveti pogajanjem, ki jih vodijo Evropska komisija in 27 držav članic.Zato, gospod predsednik, menimo, da mora Evropski parlament zavzeti trdno stališče glede miru – miru na bližnjem in srednjem vzhodu – in dati soglasje za sklenitev sporazuma o znanstvenem in tehnološkem sodelovanju z Izraelom. To točko je zato treba obdržati na dnevnem redu, kot je odločila konferenca predsednikov političnih skupin. ","José Ignacio Salafranca Sánchez-Neyra,",4,196,not_available,"['spa', 'spa', 'spa', 'spa']","['  José Ignacio Salafranca Sánchez-Neyra,  v imenu skupine PPE-DE. – (ES) Gospod predsednik, s tem v zvezi moram omeniti, da je Odbor za zunanje zadeve Parlamenta, vključno s poročevalko, gospo de Keyser, v glavnem glasoval za poročilo gospe de Keyser.', 'Kot smo včeraj na sestanku izraelske zunanje ministrice z Odborom za zunanje zadeve rekli, razumemo veliko zaskrbljenost tega parlamenta glede poniževanja in razočaranja, ki ju trpijo ljudje v Palestini.', 'In prav to so razlogi, gospod predsednik, zaradi katerih menimo, da bi ta parlament moral zavzeti stališče v obliki resolucije. Napovem lahko, da bo moja politična skupina sprejela spremembe, ki jih je levica predlagala glede vzpostavitve odnosa. Pri tem ne gre za nadgradnjo odnosov z Izraelom, gospod Wurtz, temveč je to glasovanje za resolucijo in privolitev, da se Evropski parlament glede na pooblastila, ki mu jih dajejo pogodbe, posveti pogajanjem, ki jih vodijo Evropska komisija in 27 držav članic.', 'Zato, gospod predsednik, menimo, da mora Evropski parlament zavzeti trdno stališče glede miru – miru na bližnjem in srednjem vzhodu – in dati soglasje za sklenitev sporazuma o znanstvenem in tehnološkem sodelovanju z Izraelom. To točko je zato treba obdržati na dnevnem redu, kot je odločila konferenca predsednikov političnih skupin. ']"
7, 11. Dobrodošlica,"  Predsednik. −   Gospe in gospodje, v veliko zadovoljstvo mi je, da vam lahko povem, da se nam je na častni galeriji pridružila skupina visokih cerkvenih dostojanstvenikov in predstavnikov civilne družbe iz Bolgarije pod vodstvom njegove visokosti metropolita Domicijana iz Vidina. Naši gostje se udeležujejo seminarja o kulturni raznolikosti v Evropi, ki bo 4. decembra potekal tu, v Evropskem parlamentu. Toplo vas pozdravljam v Evropskem parlamentu v zadnjem mesecu Evropskega leta medkulturnega dialoga. Dobrodošli v Evropskem parlamentu.(Aplavz) ",Predsednik. −,2,76,not_available,"['slv', 'slv']","['  Predsednik. −   Gospe in gospodje, v veliko zadovoljstvo mi je, da vam lahko povem, da se nam je na častni galeriji pridružila skupina visokih cerkvenih dostojanstvenikov in predstavnikov civilne družbe iz Bolgarije pod vodstvom njegove visokosti metropolita Domicijana iz Vidina. Naši gostje se udeležujejo seminarja o kulturni raznolikosti v Evropi, ki bo 4. decembra potekal tu, v Evropskem parlamentu. Toplo vas pozdravljam v Evropskem parlamentu v zadnjem mesecu Evropskega leta medkulturnega dialoga. Dobrodošli v Evropskem parlamentu.', '(Aplavz) ']"
8, 12. Priprave na Evropski svet (11. in 12. december 2008) (razprava) ,  Predsednik. −   Naslednja točka so izjave Sveta in Komisije o pripravah na Evropski svet 11. in 12. decembra 2008. ,Predsednik. −,1,18,not_available,['slv'],['  Predsednik. −   Naslednja točka so izjave Sveta in Komisije o pripravah na Evropski svet 11. in 12. decembra 2008. ']
