,agenda_item,text,speaker,number_p,number_w,chair,language_ps,ps
36, 3. Stanje pogajanj o podnebnem in energetskem svežnju (razprava),"  Andreas Mölzer  (NI). -  (DE) Gospod predsednik, Evropa se segreva hitreje od svetovnega povprečja. V enem desetletju, kakor veste, so se poškodbe, ki so posledica naravnih katastrof, podvojile na skoraj 14 milijonov letno. Zato moramo dobro premisliti, kakšni bodo naši naslednji koraki. Prav tu imamo še vedno težave.Če pomislimo na razbremenitve v trgovanju z emisijami, ne smemo pozabiti na to, da so energetske združbe porabniku brez sramu zaračunale brezplačna potrdila zato, da bi si prislužile dodatne dohodke. Ne smemo dovoliti, da se to ponovi. Ne potrebujemo nobene nepremišljene bliskovite reakcije več, pa tudi spodletelih načrtov kot je bil tisti z biogorivom ne. Domnevna ničelna stopnja emisij električnih vozil je neuporabna, če energija izvira iz premogovnih elektrarn.Vendar je po mojem mnenju precej nesmiselno v teh okoliščinah povzdigovati jedrsko energijo kot okolju prijazno. Če bi milijarde, ki vsako leto izpuhtijo za to, uporabili za obnovljive vire energije, morda ne bi imeli več nikakršnih težav z energijo in bi bili na področju zmanjševanja CO2 gotovo velik korak naprej.Poleg tega si moramo v zvezi s tem zapomniti, da moramo dolgoročno spodbujati subvencioniranje javnega prometa in prevoza blaga po železnici. ",Andreas Mölzer  (NI). -,4,187,not_available,"['ger', 'ger', 'ger', 'ger']","['  Andreas Mölzer  (NI). -  (DE) Gospod predsednik, Evropa se segreva hitreje od svetovnega povprečja. V enem desetletju, kakor veste, so se poškodbe, ki so posledica naravnih katastrof, podvojile na skoraj 14 milijonov letno. Zato moramo dobro premisliti, kakšni bodo naši naslednji koraki. Prav tu imamo še vedno težave.', 'Če pomislimo na razbremenitve v trgovanju z emisijami, ne smemo pozabiti na to, da so energetske združbe porabniku brez sramu zaračunale brezplačna potrdila zato, da bi si prislužile dodatne dohodke. Ne smemo dovoliti, da se to ponovi. Ne potrebujemo nobene nepremišljene bliskovite reakcije več, pa tudi spodletelih načrtov kot je bil tisti z biogorivom ne. Domnevna ničelna stopnja emisij električnih vozil je neuporabna, če energija izvira iz premogovnih elektrarn.', 'Vendar je po mojem mnenju precej nesmiselno v teh okoliščinah povzdigovati jedrsko energijo kot okolju prijazno. Če bi milijarde, ki vsako leto izpuhtijo za to, uporabili za obnovljive vire energije, morda ne bi imeli več nikakršnih težav z energijo in bi bili na področju zmanjševanja CO2 gotovo velik korak naprej.', 'Poleg tega si moramo v zvezi s tem zapomniti, da moramo dolgoročno spodbujati subvencioniranje javnega prometa in prevoza blaga po železnici. ']"
37, 3. Stanje pogajanj o podnebnem in energetskem svežnju (razprava),"  Péter Olajos  (PPE-DE).   – (HU) Hvala, gospod predsednik. Vsi si prizadevamo ustaviti podnebne spremembe, preprečiti svetovno ekološko katastrofo, ki grozi človeštvu. Seveda vemo, da ima to za posledico resne stroške, ki jih bomo državljani morali prej ali slej plačati na takšen ali drugačen način.Vemo tudi, da kasneje ko ukrepamo, večja bo škoda, bolj nespremenljivi bodo procesi in več bomo morali plačati. Vprašanje je po eni strani, če smo dovolj pogumni, da bi ukrepali prvi in se temu primerno tudi žrtvovali, po drugi strani pa, kako bomo breme porazdelili med različne družbene in gospodarske akterje.Zakonodajni sveženj, ki ga imamo pred seboj, kaže, da se Evropska unija zavezuje k ukrepanju, in hkrati dokazuje, da je žal tudi pristranska, nestanovitna in ob izvajanju uporablja dvojne standarde. Nekaterim državam članicam v letu 2020 dovoljuje višjo raven emisij kot jo za leto 2011 določajo kjotski cilji. Medtem pa se drugim, ki so že uspešne, ne daje ustreznih spodbud.Zakaj si zatiskamo oči ob dejstvu, da nekaterim državam članicam niti malo ni mar za to, kar obljubijo, medtem ko druge pristanejo na neznanska odrekanja? Prav tako nerazumljivo je, zakaj bi morale industrije cementa zmanjšati za dvakrat več kot industrija odpadkov ali promet. Minister, junaška vlada ni tista, ki drzne podjetjem odmeriti strogo kazen, pač pa tista, ki je ravno tako stroga tudi do sebe. Pametna vlada ni tista, ki denar državljanov pod Mehanizmom čistega razvoja (CDM) odnese v tujino, pač pa tista, ki vlaga doma, v EU, in zmanjšuje našo odvisnost od energije z novimi, tržnimi, čistimi tehnologijami.Trenutna svetovna gospodarska recesija ni nikakršen povod za to, da nam ne bi uspelo ukrepati, nasprotno, daje nam priložnost za preboj. Zgodovinska odgovornost in priložnost pomenita tudi vodilno vlogo v tej tretji industrijski revoluciji. Zahvaljujem se vam za pozornost. ",Péter Olajos  (PPE-DE).,5,293,not_available,"['hun', 'hun', 'hun', 'hun', 'hun']","['  Péter Olajos  (PPE-DE).   – (HU) Hvala, gospod predsednik. Vsi si prizadevamo ustaviti podnebne spremembe, preprečiti svetovno ekološko katastrofo, ki grozi človeštvu. Seveda vemo, da ima to za posledico resne stroške, ki jih bomo državljani morali prej ali slej plačati na takšen ali drugačen način.', 'Vemo tudi, da kasneje ko ukrepamo, večja bo škoda, bolj nespremenljivi bodo procesi in več bomo morali plačati. Vprašanje je po eni strani, če smo dovolj pogumni, da bi ukrepali prvi in se temu primerno tudi žrtvovali, po drugi strani pa, kako bomo breme porazdelili med različne družbene in gospodarske akterje.', 'Zakonodajni sveženj, ki ga imamo pred seboj, kaže, da se Evropska unija zavezuje k ukrepanju, in hkrati dokazuje, da je žal tudi pristranska, nestanovitna in ob izvajanju uporablja dvojne standarde. Nekaterim državam članicam v letu 2020 dovoljuje višjo raven emisij kot jo za leto 2011 določajo kjotski cilji. Medtem pa se drugim, ki so že uspešne, ne daje ustreznih spodbud.', 'Zakaj si zatiskamo oči ob dejstvu, da nekaterim državam članicam niti malo ni mar za to, kar obljubijo, medtem ko druge pristanejo na neznanska odrekanja? Prav tako nerazumljivo je, zakaj bi morale industrije cementa zmanjšati za dvakrat več kot industrija odpadkov ali promet. Minister, junaška vlada ni tista, ki drzne podjetjem odmeriti strogo kazen, pač pa tista, ki je ravno tako stroga tudi do sebe. Pametna vlada ni tista, ki denar državljanov pod Mehanizmom čistega razvoja (CDM) odnese v tujino, pač pa tista, ki vlaga doma, v EU, in zmanjšuje našo odvisnost od energije z novimi, tržnimi, čistimi tehnologijami.', 'Trenutna svetovna gospodarska recesija ni nikakršen povod za to, da nam ne bi uspelo ukrepati, nasprotno, daje nam priložnost za preboj. Zgodovinska odgovornost in priložnost pomenita tudi vodilno vlogo v tej tretji industrijski revoluciji. Zahvaljujem se vam za pozornost. ']"
38, 3. Stanje pogajanj o podnebnem in energetskem svežnju (razprava),"  Guido Sacconi  (PSE). -  (IT) Gospod predsednik, gospe in gospodje, zahvaljujem se svojim poslanskim kolegom, v prvi vrsti predsedniku naše skupine, gospodu Schultzu, ki je upravičeno poudaril rezultate, ki smo jih prejšnji ponedeljek dosegli s sporazumom o uredbi, ki je določila zahtevo za zmanjšanje emisij CO2 motornih vozil.Želel bi pojasniti, zakaj sem namerno in v dogovoru s francoskim predsedstvom, ki je opravilo imenitno delo – želel bi zgolj na neuraden način reči – zakaj, če ostanem pri temi vozil, sem pospešil zagotovitev tega sporazuma – pospešil sem vožnjo, če tako rečem. Iz dveh razlogov: prvič, ker se mi je zdelo pomembno sprostiti sveženj vsaj glede enega vprašanja, da bi pokazali, da je dejansko mogoče – težko, a mogoče – združiti različne potrebe: po eni strani varstvo okolja in boj proti podnebnim spremembam, po drugi strani pa gospodarska razsežnost konkurenčnosti in socialna vprašanja ter zaposlitev. Zavedamo se, v kakšni krizi je danes avtomobilska industrija, in da smo to smo počeli zdaj, je izjemno dober znak.Toda vožnjo sem pospešil tudi iz drugega razloga. Zdelo se mi je, da bi bilo precej bolje dokument zaključiti pred Evropskim svetom naslednji teden, saj tako – če smem odkrito reči – nihče ne bi mogel vanj vtakniti nosu. Noben voditelj države ali vlade se ne bo mogel dotakniti te uredbe. Govorim kolegom poslancem, ki so, kot gospod Davies, kritizirali ta sporazum, niso pa razumeli, da bi bilo precej bolje, če bi tudi druge dokumente – kot je dokument gospoda Daviesa, v kateri so že navedeni pogoji za dosego sporazuma – že zaključili. Nekaj bi vam rad rekel, gospod Borloo, če mi dovolite še trenutek: tu nam ne uspe vedno doseči soglasja, zato zberite pogum, ne dovolite, da se ponovi, kar se je zgodilo včeraj na razpravi o obnovljivih virih, ko je ena država, žal moja, vložila svoj veto na predlog in s tem onemogočila sporazum. ",Guido Sacconi  (PSE). -,3,301,not_available,"['ita', 'ita', 'ita']","['  Guido Sacconi  (PSE). -  (IT) Gospod predsednik, gospe in gospodje, zahvaljujem se svojim poslanskim kolegom, v prvi vrsti predsedniku naše skupine, gospodu Schultzu, ki je upravičeno poudaril rezultate, ki smo jih prejšnji ponedeljek dosegli s sporazumom o uredbi, ki je določila zahtevo za zmanjšanje emisij CO2 motornih vozil.', 'Želel bi pojasniti, zakaj sem namerno in v dogovoru s francoskim predsedstvom, ki je opravilo imenitno delo – želel bi zgolj na neuraden način reči – zakaj, če ostanem pri temi vozil, sem pospešil zagotovitev tega sporazuma – pospešil sem vožnjo, če tako rečem. Iz dveh razlogov: prvič, ker se mi je zdelo pomembno sprostiti sveženj vsaj glede enega vprašanja, da bi pokazali, da je dejansko mogoče – težko, a mogoče – združiti različne potrebe: po eni strani varstvo okolja in boj proti podnebnim spremembam, po drugi strani pa gospodarska razsežnost konkurenčnosti in socialna vprašanja ter zaposlitev. Zavedamo se, v kakšni krizi je danes avtomobilska industrija, in da smo to smo počeli zdaj, je izjemno dober znak.', 'Toda vožnjo sem pospešil tudi iz drugega razloga. Zdelo se mi je, da bi bilo precej bolje dokument zaključiti pred Evropskim svetom naslednji teden, saj tako – če smem odkrito reči – nihče ne bi mogel vanj vtakniti nosu. Noben voditelj države ali vlade se ne bo mogel dotakniti te uredbe. Govorim kolegom poslancem, ki so, kot gospod Davies, kritizirali ta sporazum, niso pa razumeli, da bi bilo precej bolje, če bi tudi druge dokumente – kot je dokument gospoda Daviesa, v kateri so že navedeni pogoji za dosego sporazuma – že zaključili. Nekaj bi vam rad rekel, gospod Borloo, če mi dovolite še trenutek: tu nam ne uspe vedno doseči soglasja, zato zberite pogum, ne dovolite, da se ponovi, kar se je zgodilo včeraj na razpravi o obnovljivih virih, ko je ena država, žal moja, vložila svoj veto na predlog in s tem onemogočila sporazum. ']"
39, 3. Stanje pogajanj o podnebnem in energetskem svežnju (razprava),"  Johannes Lebech  (ALDE). -  (DA) Gospod predsednik, sodelovanje v pogajanjih o podnebnem svežnju me je prevzelo, najprej v odboru, potem pa v trialogu, v katerih sem udeležen v vlogi poročevalca v senci za direktivo o skupnih prizadevanjih. V Parlamentu smo izkazali veliko sposobnost za doseganje kompromisov in snovanje zamisli, ki lahko izboljšajo predloge Komisije, saj se jasno zavedamo, da se bomo morali, če ne bomo imeli resnega sporazuma, ki bo nasledil kjotskega, na srečanju v Köbenhavnu oborožiti z visoko zastavljenim predlogom.Zdaj čakamo na Svet. Rad bi navedel nekaj ključnih problemov. Pomembno je, da Svet razume, da mora, če si države članice želijo prožnosti, obstajati jamstvo za doseganje ciljev, ki bi se odražalo s poročili in s posledicami, če se ciljev ne bi doseglo. Prazne obljube ne bodo zavirale globalnega segrevanja. Jasno mora biti tudi, da ne moremo kar iztržiti našega celotnega zmanjšanja izven EU, pač pa se mora biti večina naših prizadevanj strniti v Evropi. Kar koli drugega ni ne resno ne verjetno, če hočemo dejansko doseči mednarodni podnebni sporazum, saj bi takšno vedenje lahko dajalo vtis, da smo že storili svoje in ne moremo storiti ničesar več. Na podoben način ne smemo trpeti pomanjkanja zanimanja za modernizacijo energetske tehnologije in moramo s tem svežnjem zagotoviti napredovanje v prihodnost, v kateri bomo svojo uporabo energije osnovali na oblikah energije, ki so CO2 nevtralne. Lani so voditelji držav in vlad EU obljubili, da bodo igrali vodilno vlogo na podnebni fronti – to izraža zavezo. Parlament je pripravljen. Zdaj mora Svet izraziti svojo voljo do doseganja rezultatov, da se bomo lahko skupaj veselili najboljšega darila letošnjega božiča, podnebnega svežnja. ",Johannes Lebech  (ALDE). -,2,266,not_available,"['dan', 'dan']","['  Johannes Lebech  (ALDE). -  (DA) Gospod predsednik, sodelovanje v pogajanjih o podnebnem svežnju me je prevzelo, najprej v odboru, potem pa v trialogu, v katerih sem udeležen v vlogi poročevalca v senci za direktivo o skupnih prizadevanjih. V Parlamentu smo izkazali veliko sposobnost za doseganje kompromisov in snovanje zamisli, ki lahko izboljšajo predloge Komisije, saj se jasno zavedamo, da se bomo morali, če ne bomo imeli resnega sporazuma, ki bo nasledil kjotskega, na srečanju v Köbenhavnu oborožiti z visoko zastavljenim predlogom.', 'Zdaj čakamo na Svet. Rad bi navedel nekaj ključnih problemov. Pomembno je, da Svet razume, da mora, če si države članice želijo prožnosti, obstajati jamstvo za doseganje ciljev, ki bi se odražalo s poročili in s posledicami, če se ciljev ne bi doseglo. Prazne obljube ne bodo zavirale globalnega segrevanja. Jasno mora biti tudi, da ne moremo kar iztržiti našega celotnega zmanjšanja izven EU, pač pa se mora biti večina naših prizadevanj strniti v Evropi. Kar koli drugega ni ne resno ne verjetno, če hočemo dejansko doseči mednarodni podnebni sporazum, saj bi takšno vedenje lahko dajalo vtis, da smo že storili svoje in ne moremo storiti ničesar več. Na podoben način ne smemo trpeti pomanjkanja zanimanja za modernizacijo energetske tehnologije in moramo s tem svežnjem zagotoviti napredovanje v prihodnost, v kateri bomo svojo uporabo energije osnovali na oblikah energije, ki so CO2 nevtralne. Lani so voditelji držav in vlad EU obljubili, da bodo igrali vodilno vlogo na podnebni fronti – to izraža zavezo. Parlament je pripravljen. Zdaj mora Svet izraziti svojo voljo do doseganja rezultatov, da se bomo lahko skupaj veselili najboljšega darila letošnjega božiča, podnebnega svežnja. ']"
40, 3. Stanje pogajanj o podnebnem in energetskem svežnju (razprava),PREDSEDSTVO: GOSPOD DOS SANTOS podpredsednik,PREDSEDSTVO: GOSPOD DOS SANTOS,1,5,not_available,['slv'],['PREDSEDSTVO: GOSPOD DOS SANTOS podpredsednik']
41, 3. Stanje pogajanj o podnebnem in energetskem svežnju (razprava),"  Caroline Lucas  (Verts/ALE). -   Gospod predsednik, čutim jezo in razočaranje kot vsi ljudje, ki upravičeno kritizirajo tiste v tem Parlamentu in Svetu, ki skušajo uničiti naše zaupanje v visoko zastavljeni podnebni in energetski sveženj.EU zdaj spodbija lastno zavezo za 30 % in skuša nadomestiti večino prizadevanj za zmanjševanje, ki jih je določila sama, s čimer krha potrebe po dražbah v energetskem sektorju in skoraj vseh drugih industrijah, saj tako postavlja standarde za učinkovitost vozil, ki so skoraj slabši kot so trenutni, in se ji kazensko ne uspeva zavezati za sklade, ki so namenjeni solidarnosti z deželami v razvoju. Vse to pomeni, da je podnebni sveženj EU videti vedno bolj prazen, evropskim politikom pa ne bomo odpustili za tako velikanski neuspeh političnega vodstva.Želim kljubovati enemu nazor, ki ste ga danes večkrat ponovili. Ni nam treba izbirati med reševanjem gospodarske krize in reševanjem podnebne krize. Gospodarsko krizo bi morali izkoristiti kot priložnost, da popolnoma preoblikujemo žarišče in smer našega gospodarstva in iz njega naredimo pristno trajnostno gospodarstvo, ki bo dejansko prineslo okoljske in gospodarske koristi. Gre za odločilno preizkušnjo za celoten projekt EU in ne za preizkušnjo, pri kateri si lahko privoščimo spodleteti. ",Caroline Lucas  (Verts/ALE). -,3,192,not_available,"['slv', 'slv', 'slv']","['  Caroline Lucas  (Verts/ALE). -   Gospod predsednik, čutim jezo in razočaranje kot vsi ljudje, ki upravičeno kritizirajo tiste v tem Parlamentu in Svetu, ki skušajo uničiti naše zaupanje v visoko zastavljeni podnebni in energetski sveženj.', 'EU zdaj spodbija lastno zavezo za 30 % in skuša nadomestiti večino prizadevanj za zmanjševanje, ki jih je določila sama, s čimer krha potrebe po dražbah v energetskem sektorju in skoraj vseh drugih industrijah, saj tako postavlja standarde za učinkovitost vozil, ki so skoraj slabši kot so trenutni, in se ji kazensko ne uspeva zavezati za sklade, ki so namenjeni solidarnosti z deželami v razvoju. Vse to pomeni, da je podnebni sveženj EU videti vedno bolj prazen, evropskim politikom pa ne bomo odpustili za tako velikanski neuspeh političnega vodstva.', 'Želim kljubovati enemu nazor, ki ste ga danes večkrat ponovili. Ni nam treba izbirati med reševanjem gospodarske krize in reševanjem podnebne krize. Gospodarsko krizo bi morali izkoristiti kot priložnost, da popolnoma preoblikujemo žarišče in smer našega gospodarstva in iz njega naredimo pristno trajnostno gospodarstvo, ki bo dejansko prineslo okoljske in gospodarske koristi. Gre za odločilno preizkušnjo za celoten projekt EU in ne za preizkušnjo, pri kateri si lahko privoščimo spodleteti. ']"
42, 3. Stanje pogajanj o podnebnem in energetskem svežnju (razprava),"  Mieczysław Edmund Janowski  (UEN).   – (PL) Gospod predsednik, danes razpravljamo o energiji in varstvu okolja. Vpliv emisije toplogrednih plinov na podnebne spremembe je resničen, četudi se druge dejavnike trenutno podcenjuje.Rad bi poudaril, da moramo biti na tem področju dejavni globalno. Kakšna bo sicer posledica naših izrazitih omejevanj emisij, če druge države ne bodo ravno tako dejavne? Enostavno bo evropsko blago postalo nekonkurenčno in naše trge bodo prevzeli tisti, ki niso uvedli tovrstnih omejitev.Upoštevati moramo tudi okoliščine držav kot je Poljska, katerih industrija električne energije v večini temelji na premogu. Primerno bi bilo priznati velikanski napredek v zmanjšanju emisij ogljika, ki so ga v zadnjih letih dosegle te države.Energetski in podnebni sveženj mora biti zato razumen in obenem prežet z duhom vzajemne pomoči. Moral bi biti tudi inovativen, podpirati gospodarstvo in okolje in pa zagotavljati varnost in inovacije, kar je v času velikega gospodarskega upada še posebej pomembno. ",Mieczysław Edmund Janowski  (UEN).,4,149,not_available,"['pol', 'pol', 'pol', 'pol']","['  Mieczysław Edmund Janowski  (UEN).   – (PL) Gospod predsednik, danes razpravljamo o energiji in varstvu okolja. Vpliv emisije toplogrednih plinov na podnebne spremembe je resničen, četudi se druge dejavnike trenutno podcenjuje.', 'Rad bi poudaril, da moramo biti na tem področju dejavni globalno. Kakšna bo sicer posledica naših izrazitih omejevanj emisij, če druge države ne bodo ravno tako dejavne? Enostavno bo evropsko blago postalo nekonkurenčno in naše trge bodo prevzeli tisti, ki niso uvedli tovrstnih omejitev.', 'Upoštevati moramo tudi okoliščine držav kot je Poljska, katerih industrija električne energije v večini temelji na premogu. Primerno bi bilo priznati velikanski napredek v zmanjšanju emisij ogljika, ki so ga v zadnjih letih dosegle te države.', 'Energetski in podnebni sveženj mora biti zato razumen in obenem prežet z duhom vzajemne pomoči. Moral bi biti tudi inovativen, podpirati gospodarstvo in okolje in pa zagotavljati varnost in inovacije, kar je v času velikega gospodarskega upada še posebej pomembno. ']"
43, 3. Stanje pogajanj o podnebnem in energetskem svežnju (razprava),"  Eva-Britt Svensson  (GUE/NGL). -  (SV) Gospod predsednik, marca 2007 so voditelji vlad EU obljubili, da bo EU do leta 2020 zmanjšala svoje emisije toplogrednih plinov za vsaj 20 %. Ta zaveza sama po sebi ni dovolj, da bi ustavila segrevanje na magični meji 2 ºC, kakor je v skladu z raziskavami potrebno. Vendar je šlo za obljubo našim državljanom in korak v pravo smer. Zato zdaj zelo zaskrbljeno opazujem, kako orodje za doseganje tega cilja, podnebnega svežnja, z vsakim dnem, ki gre mimo, postaja vse bolj nebogljeno.Prejšnji ponedeljek je francosko predsedstvo z velikimi skupinami Parlamenta doseglo neuradni sporazum o tem, kako bomo zmanjšali emisije ogljika pri vozilih. Sklep je zelo enostavno povzeti: avtomobilska industrija posluje kot običajno. Povsem nepojmljivo! Že leta 1995 je Komisija predlagala, da se emisije ogljikovega dioksida omeji na 120 g. Zdaj, 13 let kasneje, je cilj spet spremenjen. To je posledica vseh vrzeli v zakonu, ki se odražajo v postopnem uvajanju števila avtomobilov, ki morajo izpolnjevati pogoje, ter neučinkovitih denarnih kazni.Dovolj imam tega, da poslušam, kako je finančna kriza izgovor za to, da ne prevzamemo odgovornosti za vpliv podnebnih sprememb. Avtomobilska industrija je imela več kot desetletje za to, da bi se preusmerila k bolj zeleni tehnologiji. To ni posledica finančne krize, pač pa posledica nenehne prekomerne proizvodnje in nesposobnosti avtomobilske industrije, da bi kaj spremenila.Tudi pogajanja o trženju z emisijami so že v zaključnih stopnjah. Niti za podnebne spremembe ne kažejo dobro. Projekti Mehanizma čistega razvoja (CDM) so značilen primer. Seveda moramo podpirati podnebne projekte v državah v razvoju, toda združiti jih moramo z našim lastnim zmanjšanjem emisij, ne pa jih nadomestiti. ",Eva-Britt Svensson  (GUE/NGL). -,4,270,not_available,"['swe', 'swe', 'swe', 'swe']","['  Eva-Britt Svensson  (GUE/NGL). -  (SV) Gospod predsednik, marca 2007 so voditelji vlad EU obljubili, da bo EU do leta 2020 zmanjšala svoje emisije toplogrednih plinov za vsaj 20 %. Ta zaveza sama po sebi ni dovolj, da bi ustavila segrevanje na magični meji 2 ºC, kakor je v skladu z raziskavami potrebno. Vendar je šlo za obljubo našim državljanom in korak v pravo smer. Zato zdaj zelo zaskrbljeno opazujem, kako orodje za doseganje tega cilja, podnebnega svežnja, z vsakim dnem, ki gre mimo, postaja vse bolj nebogljeno.', 'Prejšnji ponedeljek je francosko predsedstvo z velikimi skupinami Parlamenta doseglo neuradni sporazum o tem, kako bomo zmanjšali emisije ogljika pri vozilih. Sklep je zelo enostavno povzeti: avtomobilska industrija posluje kot običajno. Povsem nepojmljivo! Že leta 1995 je Komisija predlagala, da se emisije ogljikovega dioksida omeji na 120 g. Zdaj, 13 let kasneje, je cilj spet spremenjen. To je posledica vseh vrzeli v zakonu, ki se odražajo v postopnem uvajanju števila avtomobilov, ki morajo izpolnjevati pogoje, ter neučinkovitih denarnih kazni.', 'Dovolj imam tega, da poslušam, kako je finančna kriza izgovor za to, da ne prevzamemo odgovornosti za vpliv podnebnih sprememb. Avtomobilska industrija je imela več kot desetletje za to, da bi se preusmerila k bolj zeleni tehnologiji. To ni posledica finančne krize, pač pa posledica nenehne prekomerne proizvodnje in nesposobnosti avtomobilske industrije, da bi kaj spremenila.', 'Tudi pogajanja o trženju z emisijami so že v zaključnih stopnjah. Niti za podnebne spremembe ne kažejo dobro. Projekti Mehanizma čistega razvoja (CDM) so značilen primer. Seveda moramo podpirati podnebne projekte v državah v razvoju, toda združiti jih moramo z našim lastnim zmanjšanjem emisij, ne pa jih nadomestiti. ']"
44, 3. Stanje pogajanj o podnebnem in energetskem svežnju (razprava),"  Sylwester Chruszcz  (NI).   – (PL) Gospod predsednik, pod krinko veličastnih ciljev varovanja okolja, najbogatejše države in podjetja vsiljujejo podnebni sveženj, ki bo prizadel manj premožne države Evropske unije. V okviru svetovne krize se napada pridobivanje rude in proizvodnjo električne energije v državah, vključno s Poljsko, na račun oviranja gospodarske rasti in povzročanja množičnega odpuščanja. Tudi jaz podpiram omejevanje emisij ogljika v Evropi in po svetu, a ne za vsako ceno.Ne moremo čez noč zapreti premogovnih termoelektrarn ali premogovnikov. Ni še prepozno, da bi poiskali razumen kompromis, ki ga bodo lahko sprejele vse države. Toda tovrstni kompromis bo mogoč le, če bomo upoštevali posebne značilnosti nacionalnih gospodarstev. V nasprotnem primeru bomo imeli opravka z diktatom in krivico, v to pa ne smemo privoliti. ",Sylwester Chruszcz  (NI).,2,122,not_available,"['pol', 'pol']","['  Sylwester Chruszcz  (NI).   – (PL) Gospod predsednik, pod krinko veličastnih ciljev varovanja okolja, najbogatejše države in podjetja vsiljujejo podnebni sveženj, ki bo prizadel manj premožne države Evropske unije. V okviru svetovne krize se napada pridobivanje rude in proizvodnjo električne energije v državah, vključno s Poljsko, na račun oviranja gospodarske rasti in povzročanja množičnega odpuščanja. Tudi jaz podpiram omejevanje emisij ogljika v Evropi in po svetu, a ne za vsako ceno.', 'Ne moremo čez noč zapreti premogovnih termoelektrarn ali premogovnikov. Ni še prepozno, da bi poiskali razumen kompromis, ki ga bodo lahko sprejele vse države. Toda tovrstni kompromis bo mogoč le, če bomo upoštevali posebne značilnosti nacionalnih gospodarstev. V nasprotnem primeru bomo imeli opravka z diktatom in krivico, v to pa ne smemo privoliti. ']"
