,agenda_item,text,speaker,number_p,number_w,chair,language_ps,ps
116, 8. Obrazložitev glasovanja,"  Jean-Pierre Audy  (PPE-DE).  – (FR) Gospa predsednica, s sklicevanjem na člen 202a našega Poslovnika smo med plenarnim zasedanjem glasovali, da se evropska himna odigra na uradnih sejah. Zanima me, gospa predsednica, zakaj himna ni bila zaigrana, ko smo pozdravili njegovo svetost dalajlamo. ",Jean-Pierre Audy  (PPE-DE).,1,43,not_available,['fra'],"['  Jean-Pierre Audy  (PPE-DE).  – (FR) Gospa predsednica, s sklicevanjem na člen 202a našega Poslovnika smo med plenarnim zasedanjem glasovali, da se evropska himna odigra na uradnih sejah. Zanima me, gospa predsednica, zakaj himna ni bila zaigrana, ko smo pozdravili njegovo svetost dalajlamo. ']"
117, 8. Obrazložitev glasovanja,"  Predsednica. -   Poizvedela bom in vam posredovala odgovor, gospod Audy.",Predsednica. -,1,9,not_available,['slv'],"['  Predsednica. -   Poizvedela bom in vam posredovala odgovor, gospod Audy.']"
118, 8. Obrazložitev glasovanja,"  Glyn Ford  (PSE),  v pisni obliki. − Čestitam mojemu kolegi za ta Sporazum z Republiko Korejo o sodelovanju pri protikonkurenčnih dejavnostih. Poslanci gotovo vedo, da se s Korejo trenutno pogajamo o sporazumu o prosti trgovini. Podpirata ga tako vlada kot opozicija v Seulu in ta Parlament, saj je podprl predhodno poročilo gospoda Martina in s tem načeloma pokazal svoje strinjanje. Obe strani si želita zaključiti dogovor pred naslednjimi junijskimi evropskimi volitvami. Današnji dogovor nam lahko v tem postopku samo pomaga, tudi če priznamo, da obstajajo še nekatera zapletena vprašanja, kot so avtomobili in pravila o poreklu v zvezi z industrijskim kompleksom Kaesong. ","Glyn Ford  (PSE),",1,101,not_available,['slv'],"['  Glyn Ford  (PSE),  v pisni obliki. − Čestitam mojemu kolegi za ta Sporazum z Republiko Korejo o sodelovanju pri protikonkurenčnih dejavnostih. Poslanci gotovo vedo, da se s Korejo trenutno pogajamo o sporazumu o prosti trgovini. Podpirata ga tako vlada kot opozicija v Seulu in ta Parlament, saj je podprl predhodno poročilo gospoda Martina in s tem načeloma pokazal svoje strinjanje. Obe strani si želita zaključiti dogovor pred naslednjimi junijskimi evropskimi volitvami. Današnji dogovor nam lahko v tem postopku samo pomaga, tudi če priznamo, da obstajajo še nekatera zapletena vprašanja, kot so avtomobili in pravila o poreklu v zvezi z industrijskim kompleksom Kaesong. ']"
119, 8. Obrazložitev glasovanja,"  Genowefa Grabowska  (PSE),  v pisni obliki. – (PL) Svetovna gospodarstva so vse bolj medsebojno povezana, mednarodna trgovina narašča zelo hitro in neposredne tuje naložbe so vse pogostejše. Zato v celoti podpiram poročilo Davida Martina, ki priporoča sprejetje Sporazuma med EU in Južno Korejo o sodelovanju pri protikonkurenčnih dejavnostih. Sporazum se sklada s predhodnimi ukrepi EU na tem področju in dopolnjuje sporazume, podpisane že na začetku devetdesetih let prejšnjega stoletja z Združenimi državami (1991), Kanado (1999) in Japonsko (2003). Sporazum s Korejo bo prispeval k učinkovitemu izvajanju predpisov o konkurenčnosti, in sicer s spodbujanjem sodelovanja med agencijami za varstvo konkurence in zmanjšanjem verjetnosti sporov.Med drugim predpisuje obveznost zagotavljanja informacij o izvedbenih ukrepih, ki jih uresničujejo agencije za varstvo konkurence in ki bi lahko vplivali na materialne interese druge stranke. Dobro je, da sporazum uvaja določbe o vzajemni pomoči, usklajevanju izvedbenih ukrepov, izmenjavi informacij in zajamčeni zaupnosti. Koreja je četrta največja trgovska partnerica EU zunaj Evrope, EU pa je največji tuj investitor v Koreji. Če upoštevamo vse večji pomen partnerstva med dvema državama, se zdi povsem upravičeno, da se Koreja uvrsti med druge tri partnerice, s katerimi je EU sklenila sporazume v okviru protikonkurenčnih dejavnosti.","Genowefa Grabowska  (PSE),",2,193,not_available,"['pol', 'pol']","['  Genowefa Grabowska  (PSE),  v pisni obliki. – (PL) Svetovna gospodarstva so vse bolj medsebojno povezana, mednarodna trgovina narašča zelo hitro in neposredne tuje naložbe so vse pogostejše. Zato v celoti podpiram poročilo Davida Martina, ki priporoča sprejetje Sporazuma med EU in Južno Korejo o sodelovanju pri protikonkurenčnih dejavnostih. Sporazum se sklada s predhodnimi ukrepi EU na tem področju in dopolnjuje sporazume, podpisane že na začetku devetdesetih let prejšnjega stoletja z Združenimi državami (1991), Kanado (1999) in Japonsko (2003). Sporazum s Korejo bo prispeval k učinkovitemu izvajanju predpisov o konkurenčnosti, in sicer s spodbujanjem sodelovanja med agencijami za varstvo konkurence in zmanjšanjem verjetnosti sporov.', 'Med drugim predpisuje obveznost zagotavljanja informacij o izvedbenih ukrepih, ki jih uresničujejo agencije za varstvo konkurence in ki bi lahko vplivali na materialne interese druge stranke. Dobro je, da sporazum uvaja določbe o vzajemni pomoči, usklajevanju izvedbenih ukrepov, izmenjavi informacij in zajamčeni zaupnosti. Koreja je četrta največja trgovska partnerica EU zunaj Evrope, EU pa je največji tuj investitor v Koreji. Če upoštevamo vse večji pomen partnerstva med dvema državama, se zdi povsem upravičeno, da se Koreja uvrsti med druge tri partnerice, s katerimi je EU sklenila sporazume v okviru protikonkurenčnih dejavnosti.']"
120, 8. Obrazložitev glasovanja,"  Pedro Guerreiro  (GUE/NGL),  v pisni obliki. − (PT) Republika Koreja je četrta največja neevropska trgovinska partnerica EU in EU je največji vlagatelj v Republiki Koreji.S tem sporazumom se želi zagotoviti „medsebojno priznavanje konkurenčnega prava med Evropsko skupnostjo in Južno Korejo“ kot „najučinkovitejši način za reševanje protikonkurenčnega ravnanja“, s čimer se želi zmanjšati „uporaba trgovinskih obrambnih instrumentov med obema strankama“, kot tistih, ki so že bili sprejeti v Združenih državah (1991), Kanadi (1999) in na Japonskem (2003).Toda Evropski parlament se osredotoča na razmislek, da bi moral biti ta sporazum napisan „v smislu splošnega okvira obstoječih sporazumov med Evropsko skupnostjo in Republiko Korejo in tistih, o katerih se sedaj pogaja, zlati v smislu pogajanja glede možnega sporazuma o svobodni trgovini“, in sicer, ter kot tudi poudarja poročevalec, ob upoštevanju „težav, do katerih je prišlo pri ostalih dvostranskih in medregionalnih trgovinskih pogajanjih“.Z drugimi besedami, Evropski parlament se zavzema za „povečan dostop do trga“ s katastrofalnimi posledicami za industrijo in delovna mesta v, na primer, pomorski gradnji in sektorju za popravila na Portugalskem, in za njegovo skoraj popolno uničenje.Zato glasujemo proti.","Pedro Guerreiro  (GUE/NGL),",5,181,not_available,"['por', 'por', 'por', 'por', 'por']","['  Pedro Guerreiro  (GUE/NGL),  v pisni obliki. − (PT) Republika Koreja je četrta največja neevropska trgovinska partnerica EU in EU je največji vlagatelj v Republiki Koreji.', 'S tem sporazumom se želi zagotoviti „medsebojno priznavanje konkurenčnega prava med Evropsko skupnostjo in Južno Korejo“ kot „najučinkovitejši način za reševanje protikonkurenčnega ravnanja“, s čimer se želi zmanjšati „uporaba trgovinskih obrambnih instrumentov med obema strankama“, kot tistih, ki so že bili sprejeti v Združenih državah (1991), Kanadi (1999) in na Japonskem (2003).', 'Toda Evropski parlament se osredotoča na razmislek, da bi moral biti ta sporazum napisan „v smislu splošnega okvira obstoječih sporazumov med Evropsko skupnostjo in Republiko Korejo in tistih, o katerih se sedaj pogaja, zlati v smislu pogajanja glede možnega sporazuma o svobodni trgovini“, in sicer, ter kot tudi poudarja poročevalec, ob upoštevanju „težav, do katerih je prišlo pri ostalih dvostranskih in medregionalnih trgovinskih pogajanjih“.', 'Z drugimi besedami, Evropski parlament se zavzema za „povečan dostop do trga“ s katastrofalnimi posledicami za industrijo in delovna mesta v, na primer, pomorski gradnji in sektorju za popravila na Portugalskem, in za njegovo skoraj popolno uničenje.', 'Zato glasujemo proti.']"
121, 8. Obrazložitev glasovanja,"  David Martin  (PSE),  v pisni obliki. − Upam, da bosta moje poročilo in predlog Komisije zagotovila bistveno izboljšanje za Korejo in EU. Koreja je četrta največja neevropska trgovinska partnerica, zato je pomembno, da imamo protikonkurenčne varovalne ukrepe. ","David Martin  (PSE),",1,36,not_available,['slv'],"['  David Martin  (PSE),  v pisni obliki. − Upam, da bosta moje poročilo in predlog Komisije zagotovila bistveno izboljšanje za Korejo in EU. Koreja je četrta največja neevropska trgovinska partnerica, zato je pomembno, da imamo protikonkurenčne varovalne ukrepe. ']"
122, 8. Obrazložitev glasovanja,"  Andreas Mölzer  (NI),  v pisni obliki. − (DE) Četrto največje gospodarstvo v Aziji pesti mednarodna finančna kriza. Spomini na azijsko valutno krizo iz leta 1997 se spet obujajo. Medtem ko je po eni strani vlada Južne Koreje danes bolj samozavestna zaradi tega, ker so bili ukrepi hitro sprejeti, pa sedaj obstaja kriza tudi v Evropi in ZDA, kar dela položaj nekoliko bolj resen. Kljub temu OECD meni, da si bo Koreja v bližnji prihodnosti opomogla, vse šibkejši von bo spodbudil izvoz in stimulacijski ukrepi bodo povečali domače povpraševanje.Gospodarski odnosi med EU in Korejo bi morali zato ostati nedotaknjeni, zaradi česar je smiselno določiti nekatera temeljna pravila kljub zapleteni naravi sedanjega položaja. Vse pogosteje se v gospodarskih sporazumih zaščitijo le interesi vlagateljev, zato mora EU skrbeti za to, da se predpisi zaposlovanja ter socialni in okoljski standardi prav tako upoštevajo v zadostni meri. To ni jasno navedeno v poročilu, ki je podlaga našemu glasovanju, zaradi česar sem se pri glasovanju vzdržal. ","Andreas Mölzer  (NI),",2,160,not_available,"['slv', 'slv']","['  Andreas Mölzer  (NI),  v pisni obliki. − (DE) Četrto največje gospodarstvo v Aziji pesti mednarodna finančna kriza. Spomini na azijsko valutno krizo iz leta 1997 se spet obujajo. Medtem ko je po eni strani vlada Južne Koreje danes bolj samozavestna zaradi tega, ker so bili ukrepi hitro sprejeti, pa sedaj obstaja kriza tudi v Evropi in ZDA, kar dela položaj nekoliko bolj resen. Kljub temu OECD meni, da si bo Koreja v bližnji prihodnosti opomogla, vse šibkejši von bo spodbudil izvoz in stimulacijski ukrepi bodo povečali domače povpraševanje.', 'Gospodarski odnosi med EU in Korejo bi morali zato ostati nedotaknjeni, zaradi česar je smiselno določiti nekatera temeljna pravila kljub zapleteni naravi sedanjega položaja. Vse pogosteje se v gospodarskih sporazumih zaščitijo le interesi vlagateljev, zato mora EU skrbeti za to, da se predpisi zaposlovanja ter socialni in okoljski standardi prav tako upoštevajo v zadostni meri. To ni jasno navedeno v poročilu, ki je podlaga našemu glasovanju, zaradi česar sem se pri glasovanju vzdržal. ']"
123, 8. Obrazložitev glasovanja,"  Rovana Plumb  (PSE),  v pisni obliki. – (RO) Glasovala sem za to poročilo, saj bo sporazum prispeval k učinkoviti uporabi konkurenčne zakonodaje s spodbujanjem sodelovanja med pristojnimi organi in z zmanjšanjem možnosti za izbruh konfliktov.Koreja je četrta največja neevropska trgovinska partnerica in EU je največji vlagatelj v Koreji.Ob upoštevanju vse večjega pomena tega partnerstva se zdi ustrezno, da se Koreja doda k trem ostalim partnerjem, s katerimi ima EU sporazume glede sodelovanja pri protikonkurenčnih ukrepih.Sporazum predvideva priglasitev ukrepov, ki so bili sprejeti s strani organa za konkurenco za izvrševanje zakonodaje, kar bi lahko vplivalo na pomembne interese druge strani, medsebojno pomoč, vključno z možnostjo, da ena stran zahteva od druge, da sprejme izvršilne ukrepe, in usklajevanje dejavnosti izvrševanja kot tudi izmenjave informacij. Prav tako obstajajo ukrepi glede zaupnosti.Širše moramo poudariti pomen večstranske trgovine in konkurenčnih pravil za doseganje svobodnih in čezmejnih trgov.","Rovana Plumb  (PSE),",5,145,not_available,"['rum', 'rum', 'rum', 'rum', 'rum']","['  Rovana Plumb  (PSE),  v pisni obliki. – (RO) Glasovala sem za to poročilo, saj bo sporazum prispeval k učinkoviti uporabi konkurenčne zakonodaje s spodbujanjem sodelovanja med pristojnimi organi in z zmanjšanjem možnosti za izbruh konfliktov.', 'Koreja je četrta največja neevropska trgovinska partnerica in EU je največji vlagatelj v Koreji.', 'Ob upoštevanju vse večjega pomena tega partnerstva se zdi ustrezno, da se Koreja doda k trem ostalim partnerjem, s katerimi ima EU sporazume glede sodelovanja pri protikonkurenčnih ukrepih.', 'Sporazum predvideva priglasitev ukrepov, ki so bili sprejeti s strani organa za konkurenco za izvrševanje zakonodaje, kar bi lahko vplivalo na pomembne interese druge strani, medsebojno pomoč, vključno z možnostjo, da ena stran zahteva od druge, da sprejme izvršilne ukrepe, in usklajevanje dejavnosti izvrševanja kot tudi izmenjave informacij. Prav tako obstajajo ukrepi glede zaupnosti.', 'Širše moramo poudariti pomen večstranske trgovine in konkurenčnih pravil za doseganje svobodnih in čezmejnih trgov.']"
124, 8. Obrazložitev glasovanja,"  Luca Romagnoli  (NI),  v pisni obliki. − (IT) Glasoval sem za poročila gospoda Martina o sklenitvi sporazuma med Korejo in Evropsko skupnostjo glede sodelovanja pri protikonkurenčnih dejavnostih. Odobravam razlago, na kateri temelji poročilo, in verjamem, da bo ta konkurenčni sporazum za današnje razmere bolj bistven instrument bolj kot kdaj koli, saj se trgovina, zlasti z azijskimi državami, povečuje tako v kakovosti kot pomenu. Ob upoštevanju razlik med evropskim gospodarskim sistemom in sistemom evropskih trgovinskih partneric, vključno s Korejo, in zlasti razlik med proizvodnimi stroški in predpisi za varovanje domačih potrošnikov v teh državah, predstavlja sporazum med organi za konkurenco korak naprej pri varovanju naši podjetij in blaga pred nevarnostmi, s katerimi se soočajo v današnjem globalnem okolju. ","Luca Romagnoli  (NI),",1,116,not_available,['ita'],"['  Luca Romagnoli  (NI),  v pisni obliki. − (IT) Glasoval sem za poročila gospoda Martina o sklenitvi sporazuma med Korejo in Evropsko skupnostjo glede sodelovanja pri protikonkurenčnih dejavnostih. Odobravam razlago, na kateri temelji poročilo, in verjamem, da bo ta konkurenčni sporazum za današnje razmere bolj bistven instrument bolj kot kdaj koli, saj se trgovina, zlasti z azijskimi državami, povečuje tako v kakovosti kot pomenu. Ob upoštevanju razlik med evropskim gospodarskim sistemom in sistemom evropskih trgovinskih partneric, vključno s Korejo, in zlasti razlik med proizvodnimi stroški in predpisi za varovanje domačih potrošnikov v teh državah, predstavlja sporazum med organi za konkurenco korak naprej pri varovanju naši podjetij in blaga pred nevarnostmi, s katerimi se soočajo v današnjem globalnem okolju. ']"
125, 8. Obrazložitev glasovanja,"  Marian Zlotea  (PPE-DE),  v pisni obliki. – (RO) Glasoval sem za to poročilo, ker menim, da je zelo pomembno, da vzpostavimo tržne povezave, ki so v skladu z načeli konkurence, ne le v Koreji, pač pa tudi v drugih državah zunaj EU. Spodbujati moramo sodelovanje med pristojnimi organi in se s tem izogniti verjetnosti izbruha konfliktov.Kot sem dejal in kot je tudi bilo ponovljeno v mnenju Odbora za notranji trg in varstvo potrošnikov ter izglasovano ta teden, moramo evropskim državljanom ponuditi veliko bolj raznolik razpon poslovnih priložnosti in zagotoviti, da vsi dvostranski sporazumi s tretjimi državami spoštujejo pravice potrošnikov in načela konkurence. ","Marian Zlotea  (PPE-DE),",2,103,not_available,"['rum', 'rum']","['  Marian Zlotea  (PPE-DE),  v pisni obliki. – (RO) Glasoval sem za to poročilo, ker menim, da je zelo pomembno, da vzpostavimo tržne povezave, ki so v skladu z načeli konkurence, ne le v Koreji, pač pa tudi v drugih državah zunaj EU. Spodbujati moramo sodelovanje med pristojnimi organi in se s tem izogniti verjetnosti izbruha konfliktov.', 'Kot sem dejal in kot je tudi bilo ponovljeno v mnenju Odbora za notranji trg in varstvo potrošnikov ter izglasovano ta teden, moramo evropskim državljanom ponuditi veliko bolj raznolik razpon poslovnih priložnosti in zagotoviti, da vsi dvostranski sporazumi s tretjimi državami spoštujejo pravice potrošnikov in načela konkurence. ']"
126, 8. Obrazložitev glasovanja,"  Šarūnas Birutis,  v pisni obliki. – (LT) Večletni načrt upravljanja staleža sleda na zahodu Škotske je dobrodošel.Verjamem, da bi spremljanje ribiških plovil z licenco, ki imajo dovoljenje za ribarjenje na zadevnem področju, moralo biti opravljeno z uporabo elektronskih ladijskih dnevnikov in da bi države članice zastave morale poslati poročila o ulovu na nadzorni center ribištva vsak dan. Plovila, ki imajo dovoljenje za ribarjenje na enem področju, ne bi smela v istem ribolovnem potovanju ribariti na nobenem drugem področju kot na zahodu Škotske.Pomembno je, da se podatki razvijejo za to, da služijo kot osnova znanstveni oceni glede staleža sleda na zahodu Škotske. Poleg obstoječih akustičnih raziskav, ki se opravljajo za to, da se določijo kazalci presežka odraslih sledov, podpiram pilotno raziskovalno mrežo leta 2008 in 2009, ki nam bo omogočila določiti ustreznost in učinkovitost te metode in zagotoviti drug, neodvisen kazalec presežka sleda na področju zahodne Škotske; pozdravljam to pobudo. Prav tako se strinjam s Komisijo glede dejstva, da bi bilo treba načrt upravljanja prenoviti vsaka štiri leta in upoštevati priporočilo Znanstvenega, tehničnega in gospodarskega odbora za ribištvo (STECF). Toda če bodo predlagane kakršne koli spremembe po tem pregledu, je treba o njih razpravljati z regionalnim svetovalnim svetom za pelagične staleže in Evropskim parlamentom. ","Šarūnas Birutis,",3,204,not_available,"['lit', 'lit', 'lit']","['  Šarūnas Birutis,  v pisni obliki. – (LT) Večletni načrt upravljanja staleža sleda na zahodu Škotske je dobrodošel.', 'Verjamem, da bi spremljanje ribiških plovil z licenco, ki imajo dovoljenje za ribarjenje na zadevnem področju, moralo biti opravljeno z uporabo elektronskih ladijskih dnevnikov in da bi države članice zastave morale poslati poročila o ulovu na nadzorni center ribištva vsak dan. Plovila, ki imajo dovoljenje za ribarjenje na enem področju, ne bi smela v istem ribolovnem potovanju ribariti na nobenem drugem področju kot na zahodu Škotske.', 'Pomembno je, da se podatki razvijejo za to, da služijo kot osnova znanstveni oceni glede staleža sleda na zahodu Škotske. Poleg obstoječih akustičnih raziskav, ki se opravljajo za to, da se določijo kazalci presežka odraslih sledov, podpiram pilotno raziskovalno mrežo leta 2008 in 2009, ki nam bo omogočila določiti ustreznost in učinkovitost te metode in zagotoviti drug, neodvisen kazalec presežka sleda na področju zahodne Škotske; pozdravljam to pobudo. Prav tako se strinjam s Komisijo glede dejstva, da bi bilo treba načrt upravljanja prenoviti vsaka štiri leta in upoštevati priporočilo Znanstvenega, tehničnega in gospodarskega odbora za ribištvo (STECF). Toda če bodo predlagane kakršne koli spremembe po tem pregledu, je treba o njih razpravljati z regionalnim svetovalnim svetom za pelagične staleže in Evropskim parlamentom. ']"
127, 8. Obrazložitev glasovanja,"  Avril Doyle  (PPE-DE),  v pisni obliki. − Poročilo člana Parlamenta Stevensona o upravljanju staležev sleda na zahodni obali Škotske predstavlja večletni načrt. Ta temelji na obstoječih sporazumih o sledu v Severnem morju z Norveško za ohranitev trajnostne ribolovne industrije z vzpostavitvijo zgornje in spodnje meje, ki je odvisna od celotne velikosti staleža.STECF in ICES sta svetovala, da je mogoče trajnostno ribištvo ohraniti z upravljanjem letne smrtnosti (merjenje ulovov) pri 0,25, ko je velikost staleža nad 75 000 ton, in pri 0,20, ko velikost staleža pade pod 75 000 ton, toda ostane nad 50 000 ton. Komisija predlaga, da če bi velikost drstitvenih staležev padla pod 50 000 ton, bi začela veljati popolna omejitev lova na sled, kar bi omogočilo obnovitev populacije in regeneracijo ter ohranitev staleža, kar bi zagotovilo preživetje in prihodnost ribiške industrije, ki je odvisna od ohranjanja staležev rib.Irska je neposredno vpletena v ta predlog z irskimi teritorialnimi vodami na severozahodu Donegala, ki spada v vprašljivo območje. Z namenom, da bi ohranili ribiško industrijo, je bistvenega pomena, da se izvedba tega poročila začne čim prej, da se zmanjša razdor za ribištvo. ","Avril Doyle  (PPE-DE),",3,187,not_available,"['slv', 'slv', 'slv']","['  Avril Doyle  (PPE-DE),  v pisni obliki. − Poročilo člana Parlamenta Stevensona o upravljanju staležev sleda na zahodni obali Škotske predstavlja večletni načrt. Ta temelji na obstoječih sporazumih o sledu v Severnem morju z Norveško za ohranitev trajnostne ribolovne industrije z vzpostavitvijo zgornje in spodnje meje, ki je odvisna od celotne velikosti staleža.', 'STECF in ICES sta svetovala, da je mogoče trajnostno ribištvo ohraniti z upravljanjem letne smrtnosti (merjenje ulovov) pri 0,25, ko je velikost staleža nad 75 000 ton, in pri 0,20, ko velikost staleža pade pod 75 000 ton, toda ostane nad 50 000 ton. Komisija predlaga, da če bi velikost drstitvenih staležev padla pod 50 000 ton, bi začela veljati popolna omejitev lova na sled, kar bi omogočilo obnovitev populacije in regeneracijo ter ohranitev staleža, kar bi zagotovilo preživetje in prihodnost ribiške industrije, ki je odvisna od ohranjanja staležev rib.', 'Irska je neposredno vpletena v ta predlog z irskimi teritorialnimi vodami na severozahodu Donegala, ki spada v vprašljivo območje. Z namenom, da bi ohranili ribiško industrijo, je bistvenega pomena, da se izvedba tega poročila začne čim prej, da se zmanjša razdor za ribištvo. ']"
128, 8. Obrazložitev glasovanja,"  Dumitru Oprea  (PPE-DE),  v pisni obliki. – (RO) To poročilo zahteva posebno pozornost ob upoštevanju globalne krize, ki zahteva odgovorne in zmerne ravni potrošnje.Kot rezultat reforme skupne ribiške politike leta 2002 so bili skupaj z načrti za oživitev izvedeni večletni načrti za ribolovne vire, ki so v interesu Skupnosti.Dejansko je bil precedens ustvarjen s sporazumom o večletnem upravljanju, ki je bil podpisan z Norveško leta 1997 in je zadeval staleže sledu. Sporazum je prinesel zadovoljive rezultate. Če bi predlagani ukrepi bili realizirani, bi pomenili boljše načrtovanje ribištva in ribolovnih dejavnosti. Zato bi bilo več elementov, ki bi jamčili za sklad za ribištvo, celotni dovoljeni ulov in posebna ribolovna dovoljenja.Še zlasti pomemben vidik je pristop k tej dejavnosti, ki temelji na ekosistemu, in zato jamči, da bo izkoriščanje izvedeno na odgovoren način kar zadeva vrste, od katerih so mnoge na robu popolnega izginotja. Poleg tega je to treba pretvoriti v dejavnost, ki se opravlja pod trajnostnimi okoljskimi, gospodarskimi in družbenimi pogoji. ","Dumitru Oprea  (PPE-DE),",5,163,not_available,"['rum', 'rum', 'rum', 'rum', 'rum']","['  Dumitru Oprea  (PPE-DE),  v pisni obliki. – (RO) To poročilo zahteva posebno pozornost ob upoštevanju globalne krize, ki zahteva odgovorne in zmerne ravni potrošnje.', 'Kot rezultat reforme skupne ribiške politike leta 2002 so bili skupaj z načrti za oživitev izvedeni večletni načrti za ribolovne vire, ki so v interesu Skupnosti.', 'Dejansko je bil precedens ustvarjen s sporazumom o večletnem upravljanju, ki je bil podpisan z Norveško leta 1997 in je zadeval staleže sledu. Sporazum je prinesel zadovoljive rezultate. ', 'Če bi predlagani ukrepi bili realizirani, bi pomenili boljše načrtovanje ribištva in ribolovnih dejavnosti. Zato bi bilo več elementov, ki bi jamčili za sklad za ribištvo, celotni dovoljeni ulov in posebna ribolovna dovoljenja.', 'Še zlasti pomemben vidik je pristop k tej dejavnosti, ki temelji na ekosistemu, in zato jamči, da bo izkoriščanje izvedeno na odgovoren način kar zadeva vrste, od katerih so mnoge na robu popolnega izginotja. Poleg tega je to treba pretvoriti v dejavnost, ki se opravlja pod trajnostnimi okoljskimi, gospodarskimi in družbenimi pogoji. ']"
129, 8. Obrazložitev glasovanja,"  Jean-Pierre Audy  (PPE-DE),  v pisni obliki. – (FR) Na podlagi poročila gospe Grabowske sem glasovala za predlog uredbe Sveta glede pristojnosti, veljavnega prava, priznavanja in izvrševanja odločb ter sodelovanja v zvezi s preživninskimi obveznostmi v okviru ponovnega posvetovanja. Podpiram poročevalko, ki je naredila vse, kar je bilo v njeni moči, da je končno besedilo na razpolago pred koncem leta, tako da lahko imajo evropski državljani od njega koristi čim prej in delim njeno stališče, da bi Komisija morala še naprej delati na izvršilnih postopkih. ","Jean-Pierre Audy  (PPE-DE),",1,85,not_available,['fra'],"['  Jean-Pierre Audy  (PPE-DE),  v pisni obliki. – (FR) Na podlagi poročila gospe Grabowske sem glasovala za predlog uredbe Sveta glede pristojnosti, veljavnega prava, priznavanja in izvrševanja odločb ter sodelovanja v zvezi s preživninskimi obveznostmi v okviru ponovnega posvetovanja. Podpiram poročevalko, ki je naredila vse, kar je bilo v njeni moči, da je končno besedilo na razpolago pred koncem leta, tako da lahko imajo evropski državljani od njega koristi čim prej in delim njeno stališče, da bi Komisija morala še naprej delati na izvršilnih postopkih. ']"
