,agenda_item,text,speaker,number_p,number_w,chair,language_ps,ps
113, 15. Sodelovanje Države Izrael v programih Skupnosti – Sodelovanje Države Izrael v programih Skupnosti (razprava) ,"  Véronique De Keyser,  poročevalka. – (FR) Gospod predsednik, na plenarnem zasedanju smo zaprosili za preložitev glasovanja in vesela sem glede tega, vendar menim, da moram kot poročevalka podati pojasnilo.Kot je gospod Salafranca prej poudaril, je res, da je 6. novembra Odbor Evropskega parlamenta za zunanje zadeve sprejel dva predloga o sodelovanju Izraela v programih Skupnosti: prvi je bil privolitev, drugi pa resolucija. Oba predloga sta bila sprejeta z ogromno večino – glasovanje o resoluciji je dejansko bilo soglasno.Kakšna je bila vsebina teh besedil in kakšno sporočilo je Odbor za zunanje zadeve želel poslati Izraelu? Privolitev je bila pozitivna: strinjala se je s sodelovanjem Izraela v programu Skupnosti, upoštevaje dejstvo, da je že sodeloval v sedmem okvirnem programu za raziskave in razvoj, da je njegova prošnja zadevala le program za „inovacije in tehnologijo“, da imajo vse članice sosedske politike pravico zaprositi za sodelovanje in da to ni pomenilo posebne prednosti Izraelu niti ponovne ocene njegovega političnega statusa.Sporazumi o pridružitvi temeljijo na spoštovanju človekovih pravic. Poslanci so zato želeli zagotoviti političen okvir za to privolitev v obliki zelo odločne resolucije, ki poziva k priznavanju začasnega pridružitvenega sporazuma med Evropsko unijo in Palestinsko osvobodilno organizacijo (PLO), večjemu nadzoru in sankcioniranju uvoza izraelskih proizvodov z okupiranih ozemelj v okviru sistema preferencialnega uvoza in uporabi rezultatov znanstvenega sodelovanja v civilne namene. Komisija mora pripraviti letno poročilo, ki bo Parlamentu omogočilo oceno izpolnjevanja teh pogojev. Skratka, resolucija je bila pozitivna, a odločna, in bila je rezultat dolgih pogajanj z različnimi stranmi, ki so pokazale izjemno zavezanost doseženemu kompromisu, za kar se jim zahvaljujem.Zakaj se torej sedaj obotavljamo, izražamo pomisleke in konec koncev prelagamo glasovanje? Pravzaprav zato, gospod predsednik, ker je humanitarna situacija v Gazi postala neznosna. Ko je delegacija Evropskega parlamenta, katere članica sem bila, zgodaj poleti obiskala Gazo, so življenjske razmere tamkajšnjih ljudi že bile alarmantne; druga delegacija je novembra obiskala okupirana ozemlja in se vrnila s popolnoma enakim poročilom. Nič se ne premakne, stanje je katastrofalno in Hamasa blokada še zdaleč ni oslabila, ampak ga je radikalizirala.Pred tremi dnevi je Louis Michel povedal, da je stalna zapora mejnih prehodov v Gazi neke vrste kolektivna kazen za palestinsko civilno prebivalstvo, v nasprotju z mednarodnim humanitarnim pravom: naš komisar je to povedal. Agencija Združenih narodov za pomoč in zaposlovanje (UNRWA), agencija, ki dela z begunci v Gazi, je poslala pozive za pomoč, podobno kot so to storile Oxfam, Amnesty International, Médecins sans frontières in številne NVO, ki trenutno niti ne morejo uporabljati prehoda Erez.Prav danes sem izvedela, da se je naš instrument Pegase v Gazi popolnoma zaustavil, da ne more več zagotoviti oskrbe z energijo, da se plače in pokojnine uradnikom palestinskih oblasti ne izplačujejo in da so zaustavljena tudi plačila najrevnejšim ljudem. Tudi UNRWA je morala prekiniti svoj program pomoči za najrevnejše ljudi v Gazi. To je nesprejemljivo, gospod predsednik, tega ni mogoče dovoliti in zato sem proti svoji volji podprla preložitev tega glasovanja.Prav sedaj poteka razprava na ravni Sveta o politični „nadgradnji“ Izraela v izredni naglici in popolni nejasnosti; in prav ta priložnost za nadgradnjo je tista, ki danes, prav sedaj, izstopa iz političnega konteksta regije in zaradi katere od državljanov dobivamo na stotine in stotine sporočil po elektronski pošti. Svet mora zato izboljšati preglednost v zvezi z razpravami, ki trenutno potekajo in odgovarjati državljanom Evrope.Kar zadeva Parlament, je danes popolnoma jasno: želimo humane življenjske razmere za Palestince in konec blokade Gaze. Ta blokada Hamasa ne slabi, ampak povzroča nevzdržno trpljenje nedolžnih ljudi, od katerih, mimogrede povedano, je na volitvah leta 2006 polovica glasovala za Fatah. To glasovanje je dejansko še vedno veljavno. Izraelu ponujamo roko, toda osnovnim vrednotam, na katerih je zgrajena Evropska unija, se ne bomo odrekli. Žogica je sedaj na izraelski strani.To priložnost bom izkoristila – in opravičujem se, gospod predsednik, ta čas lahko odštejete od mojih dveh minut kasneje – to priložnost bom izkoristila za obsodbo političnega pritiska, žaljivk in obtožb antisemitizma, uperjenih v poslance, ki so se zavzeli le za mir in pravičnost. Prav tako bi želela izraziti spoštovanje vsem našim judovskim prijateljem, v Izraelu in drugje, tem novim pokončnim ljudem, ki si v izredno težkih razmerah tudi želijo miru in pozivajo k spoštovanju mednarodnega prava. Stopimo skupaj, da bi to dosegli. Ustaviti moramo obleganje Gaze, uporaba vojaške sile pri tem, kot je bilo mogoče slišati, pa bi bila popolna norost. ","Véronique De Keyser,",10,717,not_available,"['fra', 'fra', 'fra', 'fra', 'fra', 'fra', 'fra', 'fra', 'fra', 'fra']","['  Véronique De Keyser,  poročevalka. – (FR) Gospod predsednik, na plenarnem zasedanju smo zaprosili za preložitev glasovanja in vesela sem glede tega, vendar menim, da moram kot poročevalka podati pojasnilo.', 'Kot je gospod Salafranca prej poudaril, je res, da je 6. novembra Odbor Evropskega parlamenta za zunanje zadeve sprejel dva predloga o sodelovanju Izraela v programih Skupnosti: prvi je bil privolitev, drugi pa resolucija. Oba predloga sta bila sprejeta z ogromno večino – glasovanje o resoluciji je dejansko bilo soglasno.', 'Kakšna je bila vsebina teh besedil in kakšno sporočilo je Odbor za zunanje zadeve želel poslati Izraelu? Privolitev je bila pozitivna: strinjala se je s sodelovanjem Izraela v programu Skupnosti, upoštevaje dejstvo, da je že sodeloval v sedmem okvirnem programu za raziskave in razvoj, da je njegova prošnja zadevala le program za „inovacije in tehnologijo“, da imajo vse članice sosedske politike pravico zaprositi za sodelovanje in da to ni pomenilo posebne prednosti Izraelu niti ponovne ocene njegovega političnega statusa.', 'Sporazumi o pridružitvi temeljijo na spoštovanju človekovih pravic. Poslanci so zato želeli zagotoviti političen okvir za to privolitev v obliki zelo odločne resolucije, ki poziva k priznavanju začasnega pridružitvenega sporazuma med Evropsko unijo in Palestinsko osvobodilno organizacijo (PLO), večjemu nadzoru in sankcioniranju uvoza izraelskih proizvodov z okupiranih ozemelj v okviru sistema preferencialnega uvoza in uporabi rezultatov znanstvenega sodelovanja v civilne namene. Komisija mora pripraviti letno poročilo, ki bo Parlamentu omogočilo oceno izpolnjevanja teh pogojev. Skratka, resolucija je bila pozitivna, a odločna, in bila je rezultat dolgih pogajanj z različnimi stranmi, ki so pokazale izjemno zavezanost doseženemu kompromisu, za kar se jim zahvaljujem.', 'Zakaj se torej sedaj obotavljamo, izražamo pomisleke in konec koncev prelagamo glasovanje? Pravzaprav zato, gospod predsednik, ker je humanitarna situacija v Gazi postala neznosna. Ko je delegacija Evropskega parlamenta, katere članica sem bila, zgodaj poleti obiskala Gazo, so življenjske razmere tamkajšnjih ljudi že bile alarmantne; druga delegacija je novembra obiskala okupirana ozemlja in se vrnila s popolnoma enakim poročilom. Nič se ne premakne, stanje je katastrofalno in Hamasa blokada še zdaleč ni oslabila, ampak ga je radikalizirala.', 'Pred tremi dnevi je Louis Michel povedal, da je stalna zapora mejnih prehodov v Gazi neke vrste kolektivna kazen za palestinsko civilno prebivalstvo, v nasprotju z mednarodnim humanitarnim pravom: naš komisar je to povedal. Agencija Združenih narodov za pomoč in zaposlovanje (UNRWA), agencija, ki dela z begunci v Gazi, je poslala pozive za pomoč, podobno kot so to storile Oxfam, Amnesty International, Médecins sans frontières in številne NVO, ki trenutno niti ne morejo uporabljati prehoda Erez.', 'Prav danes sem izvedela, da se je naš instrument Pegase v Gazi popolnoma zaustavil, da ne more več zagotoviti oskrbe z energijo, da se plače in pokojnine uradnikom palestinskih oblasti ne izplačujejo in da so zaustavljena tudi plačila najrevnejšim ljudem. Tudi UNRWA je morala prekiniti svoj program pomoči za najrevnejše ljudi v Gazi. To je nesprejemljivo, gospod predsednik, tega ni mogoče dovoliti in zato sem proti svoji volji podprla preložitev tega glasovanja.', 'Prav sedaj poteka razprava na ravni Sveta o politični „nadgradnji“ Izraela v izredni naglici in popolni nejasnosti; in prav ta priložnost za nadgradnjo je tista, ki danes, prav sedaj, izstopa iz političnega konteksta regije in zaradi katere od državljanov dobivamo na stotine in stotine sporočil po elektronski pošti. Svet mora zato izboljšati preglednost v zvezi z razpravami, ki trenutno potekajo in odgovarjati državljanom Evrope.', 'Kar zadeva Parlament, je danes popolnoma jasno: želimo humane življenjske razmere za Palestince in konec blokade Gaze. Ta blokada Hamasa ne slabi, ampak povzroča nevzdržno trpljenje nedolžnih ljudi, od katerih, mimogrede povedano, je na volitvah leta 2006 polovica glasovala za Fatah. To glasovanje je dejansko še vedno veljavno. Izraelu ponujamo roko, toda osnovnim vrednotam, na katerih je zgrajena Evropska unija, se ne bomo odrekli. Žogica je sedaj na izraelski strani.', 'To priložnost bom izkoristila – in opravičujem se, gospod predsednik, ta čas lahko odštejete od mojih dveh minut kasneje – to priložnost bom izkoristila za obsodbo političnega pritiska, žaljivk in obtožb antisemitizma, uperjenih v poslance, ki so se zavzeli le za mir in pravičnost. Prav tako bi želela izraziti spoštovanje vsem našim judovskim prijateljem, v Izraelu in drugje, tem novim pokončnim ljudem, ki si v izredno težkih razmerah tudi želijo miru in pozivajo k spoštovanju mednarodnega prava. Stopimo skupaj, da bi to dosegli. Ustaviti moramo obleganje Gaze, uporaba vojaške sile pri tem, kot je bilo mogoče slišati, pa bi bila popolna norost. ']"
114, 15. Sodelovanje Države Izrael v programih Skupnosti – Sodelovanje Države Izrael v programih Skupnosti (razprava) ,"  Jean-Pierre Jouyet,  predsednik Sveta. − (FR) Gospod predsednik, gospod Verheugen, gospa De Keyser, gospe in gospodje, začel bi rad z zahvalo gospe De Keyser za to odlično poročilo. Tako kot ona sem tudi jaz prej opazil, da je večina v Parlamentu glasovala za preložitev glasovanja iz razlogov, ki jih je navedla.Stališče Sveta je, da je sodelovanje Izraela v programu Skupnosti treba obravnavati s perspektive izboljšanja dvostranskih odnosov Unije z Izraelom in s tem v zvezi je Svet poslal signal 16. junija na 8. Pridružitvenem svetu z Izraelom. To izboljšanje je v skladu s krepitvijo evropske sosedske politike.Svet je prepričan, da bo to izboljšanje koristno za obe strani in da ni le v interesu države, ki jo približujemo evropski družini. Koristno je tudi za interese Evrope, saj nam omogoča, da vzpostavimo tesnejše povezave in večje zaupanje z novimi segmenti izraelskega prebivalstva, kot so študentje, raziskovalci, poslovneži ali strokovnjaki.Evropa bo tako lahko zagotovila konkreten dokaz o koristih večstranskega sodelovanja v smislu miru in blagostanja. Gospe De Keyser bi rad povedal, da imajo takšne izkušnje svojo ceno v regiji, kot je Srednji vzhod. Evropa bo lahko resnico sporočala v močnejšem in bolj verodostojnem jeziku, kar bo zagotavljajo večje zaupanje.V zvezi s tem sem dobro prisluhnil izraženim pričakovanjem, kot je povedala gospa De Keyser, znotraj Odbora za zunanje zadeve. Pri tem imam seveda v mislih sporočilo, ki ga je omenila, o popolni in takojšnji zamrznitvi naseljevanja, o nujnosti napredka v mirovnem procesu s palestinskimi oblastmi, o ukinitvi omejitev za prebivalstvo v Gazi in na Zahodnem bregu ter o nujnem izboljšanju usode ljudi v Gazi, ki so prizadeti zaradi blokade, o čemer se je nedavno lahko prepričala delegacija Evropskega parlamenta.Prepričani ste lahko, gospe in gospodje, da ima enaka pričakovanja tudi Svet in verjamem, da tudi Komisija. V zvezi s tem je v deklaraciji z dne 16. junija 2008 nekaj zelo jasnih izjav o političnem kontekstu glede nadgradnje in sporočilih, ki jih Evropa namerava ob tej priložnosti poslati Izraelu.Kot veste, drži, da Izrael ta sporočila pozna že leta. Sam sodim med tiste, ki obžalujejo, da se tem sporočilom ni bolje prisluhnilo, toda stava, ki jo je Svet izvedel junija, je bila izkoristiti izboljšanje dvostranskih odnosov za pošiljanje močnejših sporočil, na višjo raven in večjemu številu različnih sogovornikov. To počne Svet.Omenjeno je bilo tudi, da je vabilo Evrope glede sodelovanja v nekaterih programih Skupnosti namenjeno ne samo Izraelu, ampak vsem državam v okviru sosedske politike, tudi iz te regije.Gospod predsednik, gospod Verheugen, gospe in gospodje, Evropski parlament ima danes priložnost, da prispeva k procesu regionalnega sodelovanja, ki ga je uvedla Evropa v regiji, pomembni za njeno lastno varnost in blagostanje.Upam, da boste, ko bo prišel čas, glede na današnje glasovanje, upoštevali priporočilo, ki ga je podala vaša poročevalka in da boste v resoluciji, ki jo želite sprejeti v isti povezavi s stališči, podanimi o tej temi, na robu Pridružitvenega sveta, podprli stališča, za katera je predsedstvo prepričano, da odražajo pametno ravnovesje, ki je dolgo časa dozorevalo med vladami držav članic in ki je namenjeno miru in stabilnosti v regiji. ","Jean-Pierre Jouyet,",10,511,not_available,"['fra', 'fra', 'fra', 'fra', 'fra', 'fra', 'fra', 'fra', 'fra', 'fra']","['  Jean-Pierre Jouyet,  predsednik Sveta. − (FR) Gospod predsednik, gospod Verheugen, gospa De Keyser, gospe in gospodje, začel bi rad z zahvalo gospe De Keyser za to odlično poročilo. Tako kot ona sem tudi jaz prej opazil, da je večina v Parlamentu glasovala za preložitev glasovanja iz razlogov, ki jih je navedla.', 'Stališče Sveta je, da je sodelovanje Izraela v programu Skupnosti treba obravnavati s perspektive izboljšanja dvostranskih odnosov Unije z Izraelom in s tem v zvezi je Svet poslal signal 16. junija na 8. Pridružitvenem svetu z Izraelom. To izboljšanje je v skladu s krepitvijo evropske sosedske politike.', 'Svet je prepričan, da bo to izboljšanje koristno za obe strani in da ni le v interesu države, ki jo približujemo evropski družini. Koristno je tudi za interese Evrope, saj nam omogoča, da vzpostavimo tesnejše povezave in večje zaupanje z novimi segmenti izraelskega prebivalstva, kot so študentje, raziskovalci, poslovneži ali strokovnjaki.', 'Evropa bo tako lahko zagotovila konkreten dokaz o koristih večstranskega sodelovanja v smislu miru in blagostanja. Gospe De Keyser bi rad povedal, da imajo takšne izkušnje svojo ceno v regiji, kot je Srednji vzhod. Evropa bo lahko resnico sporočala v močnejšem in bolj verodostojnem jeziku, kar bo zagotavljajo večje zaupanje.', 'V zvezi s tem sem dobro prisluhnil izraženim pričakovanjem, kot je povedala gospa De Keyser, znotraj Odbora za zunanje zadeve. Pri tem imam seveda v mislih sporočilo, ki ga je omenila, o popolni in takojšnji zamrznitvi naseljevanja, o nujnosti napredka v mirovnem procesu s palestinskimi oblastmi, o ukinitvi omejitev za prebivalstvo v Gazi in na Zahodnem bregu ter o nujnem izboljšanju usode ljudi v Gazi, ki so prizadeti zaradi blokade, o čemer se je nedavno lahko prepričala delegacija Evropskega parlamenta.', 'Prepričani ste lahko, gospe in gospodje, da ima enaka pričakovanja tudi Svet in verjamem, da tudi Komisija. V zvezi s tem je v deklaraciji z dne 16. junija 2008 nekaj zelo jasnih izjav o političnem kontekstu glede nadgradnje in sporočilih, ki jih Evropa namerava ob tej priložnosti poslati Izraelu.', 'Kot veste, drži, da Izrael ta sporočila pozna že leta. Sam sodim med tiste, ki obžalujejo, da se tem sporočilom ni bolje prisluhnilo, toda stava, ki jo je Svet izvedel junija, je bila izkoristiti izboljšanje dvostranskih odnosov za pošiljanje močnejših sporočil, na višjo raven in večjemu številu različnih sogovornikov. To počne Svet.', 'Omenjeno je bilo tudi, da je vabilo Evrope glede sodelovanja v nekaterih programih Skupnosti namenjeno ne samo Izraelu, ampak vsem državam v okviru sosedske politike, tudi iz te regije.', 'Gospod predsednik, gospod Verheugen, gospe in gospodje, Evropski parlament ima danes priložnost, da prispeva k procesu regionalnega sodelovanja, ki ga je uvedla Evropa v regiji, pomembni za njeno lastno varnost in blagostanje.', 'Upam, da boste, ko bo prišel čas, glede na današnje glasovanje, upoštevali priporočilo, ki ga je podala vaša poročevalka in da boste v resoluciji, ki jo želite sprejeti v isti povezavi s stališči, podanimi o tej temi, na robu Pridružitvenega sveta, podprli stališča, za katera je predsedstvo prepričano, da odražajo pametno ravnovesje, ki je dolgo časa dozorevalo med vladami držav članic in ki je namenjeno miru in stabilnosti v regiji. ']"
115, 15. Sodelovanje Države Izrael v programih Skupnosti – Sodelovanje Države Izrael v programih Skupnosti (razprava) ,"  Günter Verheugen,  podpredsednik Komisije. − (DE) Gospod predsednik, predsednik Sveta, gospe in gospodje, decembra 2006 je Komisija predlagala celovito vključevanje partnerjev v evropsko sosedsko politiko pri izvajanju nekaterih politik in v vrsto programov Skupnosti. V ospredju naših razmišljanj so bila področja, kot so raziskave in razvoj, inovacije, konkurenčnost, varstvo potrošnikov in informacijska družba, če omenim le nekatere.Svet je o tem predlogu večkrat razpravljal. Marca 2007 je podprl predlog Komisije o tem, da bi vsem partnerskim državam bilo omogočeno sodelovanje v nekaterih programih Skupnosti.Izrael je prva od naših partnerskih držav v okviru sosedske politike, ki je letos uradno sklenila protokol k okvirnemu sporazumu z Evropsko skupnostjo o splošnih načelih njenega sodelovanja v programih Skupnosti.Komisija pozdravlja ta rezultat, ker poudarja naše dolgo, tesno sodelovanje z našim partnerjem Izraelom. Od leta 1995 Izrael polno sodeluje v okvirnem programu za raziskave in razvoj. Z leti je to tesno sodelovanje privedlo do številnih skupnih projektov, mimogrede povedano, s pomembnimi rezultati, ki sem jih sam videl na licu mesta lani v Izraelu.Zaradi visoke kakovosti izraelskih raziskovalcev in izraelskih univerz je Izrael izredno zanimiv in cenjen partner. Tudi na področju inovacij je prispevek Izraela lahko velik, kar je koristno za obe strani, saj bomo v srednjeročnem obdobju odprti za mnogo tesnejše industrijsko sodelovanje. Dialog, s katerim sva začela takratni predsednik vlade Olmert in jaz med podjetji iz EU in Izraela, je medtem postal dobro utečen in daje rezultate.Poleg tega Izrael že sodeluje v programu za podjetništvo in inovacije, enem od treh stebrov našega programa za konkurenčnost in integracijo. To je program, ki je zlasti pomemben za mala in srednje velika podjetja. Obe strani povezujeta velika pričakovanja in upe z okrepljenim sodelovanjem. Zadnji Pridružitveni svet EU-Izrael lansko leto je zato poudaril, da želi okrepiti odnose z Izraelom na osnovi skupnega akcijskega načrta.Naše odnose je nedvomno mogoče razširiti. Vse, kar pripomore k temu, da se ljudje lažje sestajajo, da se zbirajo novinarji, umetniki, raziskovalci in podjetniki, vse, kar služi dialogu in spodbuja medsebojno razumevanje, si zasluži naše brezpogojne podpore. To bo pozitivno vplivalo na naš trenutni dialog o človekovih pravicah.Nadaljnja krepitev naših odnosov z Izraelom, središčem evropske sosedske politike, je strateški interes Evropske unije. Sklep Sveta, o katerem danes tu poteka razprava, temu kontekstu ustreza in pomeni pomemben prispevek h krepitvi našega sodelovanja z Izraelom. Zato vas pozivam, gospe in gospodje, da osnutek resolucije podprete in glasujete za predlog Komisije. ","Günter Verheugen,",8,398,not_available,"['ger', 'ger', 'ger', 'ger', 'ger', 'ger', 'ger', 'ger']","['  Günter Verheugen,  podpredsednik Komisije. − (DE) Gospod predsednik, predsednik Sveta, gospe in gospodje, decembra 2006 je Komisija predlagala celovito vključevanje partnerjev v evropsko sosedsko politiko pri izvajanju nekaterih politik in v vrsto programov Skupnosti. V ospredju naših razmišljanj so bila področja, kot so raziskave in razvoj, inovacije, konkurenčnost, varstvo potrošnikov in informacijska družba, če omenim le nekatere.', 'Svet je o tem predlogu večkrat razpravljal. Marca 2007 je podprl predlog Komisije o tem, da bi vsem partnerskim državam bilo omogočeno sodelovanje v nekaterih programih Skupnosti.', 'Izrael je prva od naših partnerskih držav v okviru sosedske politike, ki je letos uradno sklenila protokol k okvirnemu sporazumu z Evropsko skupnostjo o splošnih načelih njenega sodelovanja v programih Skupnosti.', 'Komisija pozdravlja ta rezultat, ker poudarja naše dolgo, tesno sodelovanje z našim partnerjem Izraelom. Od leta 1995 Izrael polno sodeluje v okvirnem programu za raziskave in razvoj. Z leti je to tesno sodelovanje privedlo do številnih skupnih projektov, mimogrede povedano, s pomembnimi rezultati, ki sem jih sam videl na licu mesta lani v Izraelu.', 'Zaradi visoke kakovosti izraelskih raziskovalcev in izraelskih univerz je Izrael izredno zanimiv in cenjen partner. Tudi na področju inovacij je prispevek Izraela lahko velik, kar je koristno za obe strani, saj bomo v srednjeročnem obdobju odprti za mnogo tesnejše industrijsko sodelovanje. Dialog, s katerim sva začela takratni predsednik vlade Olmert in jaz med podjetji iz EU in Izraela, je medtem postal dobro utečen in daje rezultate.', 'Poleg tega Izrael že sodeluje v programu za podjetništvo in inovacije, enem od treh stebrov našega programa za konkurenčnost in integracijo. To je program, ki je zlasti pomemben za mala in srednje velika podjetja. Obe strani povezujeta velika pričakovanja in upe z okrepljenim sodelovanjem. Zadnji Pridružitveni svet EU-Izrael lansko leto je zato poudaril, da želi okrepiti odnose z Izraelom na osnovi skupnega akcijskega načrta.', 'Naše odnose je nedvomno mogoče razširiti. Vse, kar pripomore k temu, da se ljudje lažje sestajajo, da se zbirajo novinarji, umetniki, raziskovalci in podjetniki, vse, kar služi dialogu in spodbuja medsebojno razumevanje, si zasluži naše brezpogojne podpore. To bo pozitivno vplivalo na naš trenutni dialog o človekovih pravicah.', 'Nadaljnja krepitev naših odnosov z Izraelom, središčem evropske sosedske politike, je strateški interes Evropske unije. Sklep Sveta, o katerem danes tu poteka razprava, temu kontekstu ustreza in pomeni pomemben prispevek h krepitvi našega sodelovanja z Izraelom. Zato vas pozivam, gospe in gospodje, da osnutek resolucije podprete in glasujete za predlog Komisije. ']"
