,agenda_item,text,speaker,number_p,number_w,chair,language_ps,ps
197, 18. Enominutni govori o zadevah političnega pomena,"  Sylwester Chruszcz  (NI). -  (PL) Gospod predsednik, Parlament bi rad opozoril na izreden dogodek, ki se je zgodil julija lani v kraju Brody v Ukrajini. Tam so odkrili spomenik v čast morilski galicijski diviziji Waffen SS. Zdi se mi neverjetno škandalozno, da v 21. stoletju, v času sprave med narodi, skupina ljudi z odkrito nacionalističnimi in fašističnimi nagnjenji poveličuje morilsko enoto, ki je odgovorna za smrt milijonov Evropejcev, vključno mojih sodržavljanov, ki so izginili v obdobju 1943-1945 kot del načrtovanega genocida v zahodni Ukrajini.Nobenega dvoma ni, da večino Ukrajincev to skrbi tako kot mene. Mislim tudi, da ukrajinske oblasti ne morejo ostati brezbrižne ob tem škandaloznem poskusu pisanja zgodovine na novo. Pozivam tudi Parlament in EU institucije …(Predsednik je prekinil govornika) ",Sylwester Chruszcz  (NI). -,3,122,not_available,"['pol', 'pol', 'pol']","['  Sylwester Chruszcz  (NI). -  (PL) Gospod predsednik, Parlament bi rad opozoril na izreden dogodek, ki se je zgodil julija lani v kraju Brody v Ukrajini. Tam so odkrili spomenik v čast morilski galicijski diviziji Waffen SS. Zdi se mi neverjetno škandalozno, da v 21. stoletju, v času sprave med narodi, skupina ljudi z odkrito nacionalističnimi in fašističnimi nagnjenji poveličuje morilsko enoto, ki je odgovorna za smrt milijonov Evropejcev, vključno mojih sodržavljanov, ki so izginili v obdobju 1943-1945 kot del načrtovanega genocida v zahodni Ukrajini.', 'Nobenega dvoma ni, da večino Ukrajincev to skrbi tako kot mene. Mislim tudi, da ukrajinske oblasti ne morejo ostati brezbrižne ob tem škandaloznem poskusu pisanja zgodovine na novo. Pozivam tudi Parlament in EU institucije …', '(Predsednik je prekinil govornika) ']"
198, 18. Enominutni govori o zadevah političnega pomena,"  Anna Záborská  (PPE-DE). -  (SK) Dne 10. decembra bomo po celem svetu praznovali 60. obletnico sprejetja Splošne deklaracije o človekovih pravicah. Jutri bo naš parlament obiskala Njegova svetost dalajlama. Kitajska je ena od držav, ki so podpisale to deklaracijo, pa vendar krši človekove pravice moških, žensk in otrok.Kot predsednica Odbora za pravice žensk in enakost spolov bi vas rada spomnila na politiko enega otroka, ki je jasen dokaz totalitarne in nedemokratične narave režima na Kitajskem. Ta politika jasno krši številne človekove pravice. Naj naštejem le nekatere med njimi: ubijanje neželenih deklic zaradi izbiranja spola, trgovina z ljudmi in spolno suženjstvo, kraja otrok, zanikanje pravnega obstoja otrok iz drugih in nadaljnjih nosečnosti, zapuščeni otroci, nasilje nad nosečimi ženskami, prisiljeni splavi, težave po splavu in samomori žensk. Demokratični svet bi moral jasno izraziti svoje zadržke do Kitajske politike in spremljati …",Anna Záborská  (PPE-DE). -,2,139,not_available,"['slo', 'slo']","['  Anna Záborská  (PPE-DE). -  (SK) Dne 10. decembra bomo po celem svetu praznovali 60. obletnico sprejetja Splošne deklaracije o človekovih pravicah. Jutri bo naš parlament obiskala Njegova svetost dalajlama. Kitajska je ena od držav, ki so podpisale to deklaracijo, pa vendar krši človekove pravice moških, žensk in otrok.', 'Kot predsednica Odbora za pravice žensk in enakost spolov bi vas rada spomnila na politiko enega otroka, ki je jasen dokaz totalitarne in nedemokratične narave režima na Kitajskem. Ta politika jasno krši številne človekove pravice. Naj naštejem le nekatere med njimi: ubijanje neželenih deklic zaradi izbiranja spola, trgovina z ljudmi in spolno suženjstvo, kraja otrok, zanikanje pravnega obstoja otrok iz drugih in nadaljnjih nosečnosti, zapuščeni otroci, nasilje nad nosečimi ženskami, prisiljeni splavi, težave po splavu in samomori žensk. Demokratični svet bi moral jasno izraziti svoje zadržke do Kitajske politike in spremljati …']"
199, 18. Enominutni govori o zadevah političnega pomena,"  Silvia-Adriana Ţicău  (PSE).   – (RO) V Romuniji je levica zmagala na volitvah, ker je dobila največje število glasov in najvišji odstotek na nedeljskih volitvah. To je dejstvo, ki ga ne smemo ignorirati ali izkrivljati.3. december je mednarodni dan invalidov. Ena od štirih družin ima invalida med svojimi člani. V tej gospodarski in finančni krizi skoraj vsak dan slišimo novice o tisočih presežnih delavcih v državah članicah. V tako težkem vzdušju se razmere za invalide še slabšajo.Kako bodo invalidi lahko našli delo, ki jim bo omogočalo, da bodo s svojo plačo dostojno živeli, ko tisoči drugih ljudi brez invalidnosti izgublja delo? Pozivam Komisijo, da nujno sprejme posebne ukrepe, namenjene podpori invalidov.Posebno pozornost je treba nameniti redkim okoliščinam, ki vodijo do fizične ali mentalne invalidnosti ... Upam, da bomo v letu 2009, letu inovacij, več vlagali v razvoj, namenjen opredelitvi …(Predsednik je prekinil govornika) ",Silvia-Adriana Ţicău  (PSE).,5,144,not_available,"['rum', 'rum', 'rum', 'rum', 'rum']","['  Silvia-Adriana Ţicău  (PSE).   – (RO) V Romuniji je levica zmagala na volitvah, ker je dobila največje število glasov in najvišji odstotek na nedeljskih volitvah. To je dejstvo, ki ga ne smemo ignorirati ali izkrivljati.', '3. december je mednarodni dan invalidov. Ena od štirih družin ima invalida med svojimi člani. V tej gospodarski in finančni krizi skoraj vsak dan slišimo novice o tisočih presežnih delavcih v državah članicah. V tako težkem vzdušju se razmere za invalide še slabšajo.', 'Kako bodo invalidi lahko našli delo, ki jim bo omogočalo, da bodo s svojo plačo dostojno živeli, ko tisoči drugih ljudi brez invalidnosti izgublja delo? Pozivam Komisijo, da nujno sprejme posebne ukrepe, namenjene podpori invalidov.', 'Posebno pozornost je treba nameniti redkim okoliščinam, ki vodijo do fizične ali mentalne invalidnosti ... Upam, da bomo v letu 2009, letu inovacij, več vlagali v razvoj, namenjen opredelitvi …', '(Predsednik je prekinil govornika) ']"
200, 18. Enominutni govori o zadevah političnega pomena,"  Colm Burke  (PPE-DE). -   Gospod predsednik, vse države EU bi morale imeti zakonodajo, ki bi prepovedovala pohabljanje ženskih spolnih organov. Sprejeti je treba tudi ukrepe, ki bi bili namenjeni potrebam žensk in deklic iz novih držav, iz katerih prihajajo delavci migranti, pri katerih je tveganje za PŽSO veliko.Pozdravljam nedavno zavezo Irske, da bo kot ena od 15 držav članic EU uvedla nacionalni akcijski načrt o PŽSO. Ocenjuje se, da na Irskem živi več kot 2500 žensk, ki so bile v drugih državah izpostavljene PŽSO. Irski načrt poudarja tveganja, ki jih PŽSO predstavlja za ženske in deklice, in opredeljuje cilje politike, ki se loteva njegovih škodljivih posledic.Številke tudi kažejo, da je od 9624 žensk, ki zdaj živijo na Irskem, prvotno pa izhajajo iz držav, v katerih se izvaja PŽSO, 26,9 % žensk bilo izpostavljenih neki obliki pohabljanja ženskih spolnih organov. Za izkoreninjenje tega je nujno sprejeti zakon, ki bo izrecno prepovedoval PŽSO. ",Colm Burke  (PPE-DE). -,3,153,not_available,"['slv', 'slv', 'slv']","['  Colm Burke  (PPE-DE). -   Gospod predsednik, vse države EU bi morale imeti zakonodajo, ki bi prepovedovala pohabljanje ženskih spolnih organov. Sprejeti je treba tudi ukrepe, ki bi bili namenjeni potrebam žensk in deklic iz novih držav, iz katerih prihajajo delavci migranti, pri katerih je tveganje za PŽSO veliko.', 'Pozdravljam nedavno zavezo Irske, da bo kot ena od 15 držav članic EU uvedla nacionalni akcijski načrt o PŽSO. Ocenjuje se, da na Irskem živi več kot 2500 žensk, ki so bile v drugih državah izpostavljene PŽSO. Irski načrt poudarja tveganja, ki jih PŽSO predstavlja za ženske in deklice, in opredeljuje cilje politike, ki se loteva njegovih škodljivih posledic.', 'Številke tudi kažejo, da je od 9624 žensk, ki zdaj živijo na Irskem, prvotno pa izhajajo iz držav, v katerih se izvaja PŽSO, 26,9 % žensk bilo izpostavljenih neki obliki pohabljanja ženskih spolnih organov. Za izkoreninjenje tega je nujno sprejeti zakon, ki bo izrecno prepovedoval PŽSO. ']"
201, 18. Enominutni govori o zadevah političnega pomena,"  Csaba Sógor  (PPE-DE).   – (HU) Pravi dialog med kulturami in ljudstvi obstaja, ko vsi lahko svobodno uporabljajo svoj materni jezik in uveljavljajo svoje individualne ali kolektivne pravice. Danes in jutri Evropski parlament izraža solidarnost s Tibetanci. Več kot 500 ljudi se je pridružilo tihi demonstraciji v imenu svobode Tibetancev, da uporabljajo svoj materni jezik, prakticirajo svojo vero in uživajo pravo avtonomijo.Tudi v EU so tradicionalne narodnostne manjšine, ki ne morejo študirati ali svobodno uporabljati svojega maternega jezika, in ki nimajo kulturne ali ozemeljske avtonomije. Še več, nekatere države so ponovno uvedle pojem kolektivne krivde, ki spominja na drugo svetovno vojno, druge pa se želijo še vedno sklicevati na komunistične zakone iz štiridesetih let 20. stoletja pri jamčenju pravic tradicionalnim narodnostnim manjšinam.Ravnanje EU v imenu manjšin, ki živijo na Kitajskem ozemlju, je lahko učinkovito, če ...(Predsednik je prekinil govornika) ",Csaba Sógor  (PPE-DE).,4,140,not_available,"['hun', 'hun', 'hun', 'hun']","['  Csaba Sógor  (PPE-DE).   – (HU) Pravi dialog med kulturami in ljudstvi obstaja, ko vsi lahko svobodno uporabljajo svoj materni jezik in uveljavljajo svoje individualne ali kolektivne pravice. Danes in jutri Evropski parlament izraža solidarnost s Tibetanci. Več kot 500 ljudi se je pridružilo tihi demonstraciji v imenu svobode Tibetancev, da uporabljajo svoj materni jezik, prakticirajo svojo vero in uživajo pravo avtonomijo.', 'Tudi v EU so tradicionalne narodnostne manjšine, ki ne morejo študirati ali svobodno uporabljati svojega maternega jezika, in ki nimajo kulturne ali ozemeljske avtonomije. Še več, nekatere države so ponovno uvedle pojem kolektivne krivde, ki spominja na drugo svetovno vojno, druge pa se želijo še vedno sklicevati na komunistične zakone iz štiridesetih let 20. stoletja pri jamčenju pravic tradicionalnim narodnostnim manjšinam.', 'Ravnanje EU v imenu manjšin, ki živijo na Kitajskem ozemlju, je lahko učinkovito, če ...', '(Predsednik je prekinil govornika) ']"
202, 18. Enominutni govori o zadevah političnega pomena,"  Zita Pleštinská  (PPE-DE). -  (SK) Živimo v obdobju velikih priložnosti, pa tudi velikih nevarnosti. Človek je sposoben uničevati veliko hitreje kot graditi. Teroristični napadi v indijskem Mumbaju, ki so zahtevali življenja dvesto nedolžnih civilistov, nam ponovno kažejo, da človeška sposobnost uničevanja nima meja. Terorizem je nova vojna brez meja in brez front, tako da strah pred jedrskim in biološkim orožjem ni brez osnove.Evropa je vzorec sobivanja ljudi različnih kultur in ver. Krščanska dediščina nalaga Evropi odgovornost za svetovni mir in možnost, da postane vir upanja za mirno sobivanje in vzajemno spoštovanje. Zato Papež Benedikt XVI v svoji knjigi Benediktova Evropa: V krizi kultur ponuja Evropi niz priporočil. Upam, da Evropa teh priporočil ne bo ignorirala, ampak jih bo upoštevala. ",Zita Pleštinská  (PPE-DE). -,2,120,not_available,"['slo', 'slo']","['  Zita Pleštinská  (PPE-DE). -  (SK) Živimo v obdobju velikih priložnosti, pa tudi velikih nevarnosti. Človek je sposoben uničevati veliko hitreje kot graditi. Teroristični napadi v indijskem Mumbaju, ki so zahtevali življenja dvesto nedolžnih civilistov, nam ponovno kažejo, da človeška sposobnost uničevanja nima meja. Terorizem je nova vojna brez meja in brez front, tako da strah pred jedrskim in biološkim orožjem ni brez osnove.', 'Evropa je vzorec sobivanja ljudi različnih kultur in ver. Krščanska dediščina nalaga Evropi odgovornost za svetovni mir in možnost, da postane vir upanja za mirno sobivanje in vzajemno spoštovanje. Zato Papež Benedikt XVI v svoji knjigi Benediktova Evropa: V krizi kultur ponuja Evropi niz priporočil. Upam, da Evropa teh priporočil ne bo ignorirala, ampak jih bo upoštevala. ']"
203, 18. Enominutni govori o zadevah političnega pomena,"  Avril Doyle  (PPE-DE). -   Gospod predsednik, promet sektorja recikliranja v Evropski uniji znaša 24 milijard EUR in zaposluje okoli 500 000 ljudi. V njem je 60 000 podjetij, delež EU v svetovnem gospodarstvu predelave smeti in recikliranja pa znaša okoli 50 %.Vendar pa je zdaj zaradi padca cen recikliranega materiala na svetovnem trgu ta sektor v krizi in za podjetja s področja predelave smeti postaja nadaljnje poslovanje ekonomsko nesprejemljivo. Glede na pomen tega sektorja za trajnostno potrošnjo in proizvodnjo v EU bi rada pozvala Komisijo, da naj brez odlašanja izvaja priporočila iz poročila svoje projektne skupine o recikliranju, ki je bilo napisano med pripravo sporočila „Pobuda za vodilni trg za Evropo“. ",Avril Doyle  (PPE-DE). -,3,111,not_available,"['slv', 'slv', 'slv']","['  Avril Doyle  (PPE-DE). -   Gospod predsednik, promet sektorja recikliranja v Evropski uniji znaša 24 milijard EUR in zaposluje okoli 500 000 ljudi. V njem je 60 000 podjetij, delež EU v svetovnem gospodarstvu predelave smeti in recikliranja pa znaša okoli 50 %.', 'Vendar pa je zdaj zaradi padca cen recikliranega materiala na svetovnem trgu ta sektor v krizi in za podjetja s področja predelave smeti postaja nadaljnje poslovanje ekonomsko nesprejemljivo. ', 'Glede na pomen tega sektorja za trajnostno potrošnjo in proizvodnjo v EU bi rada pozvala Komisijo, da naj brez odlašanja izvaja priporočila iz poročila svoje projektne skupine o recikliranju, ki je bilo napisano med pripravo sporočila „Pobuda za vodilni trg za Evropo“. ']"
204, 18. Enominutni govori o zadevah političnega pomena,  Predsednik  . – S tem smo zaključili s to točko. ,Predsednik,1,8,not_available,['slv'],['  Predsednik  . – S tem smo zaključili s to točko. ']
205, 19. Instrument za hitro odzivanje na hitro naraščajoče cene hrane v državah v razvoju (razprava) ,"  Predsednik  . – Naslednja točka je poročilo (A6-0396/2008) gospoda Mitchella, v imenu Odbora za razvoj o instrumentu za hitro odzivanje na hitro naraščajoče cene hrane v državah v razvoju (COM(2008)0450 – C6-0280/2008 – 2008/0149(COD)). ",Predsednik,1,38,not_available,['slv'],"['  Predsednik  . – Naslednja točka je poročilo (A6-0396/2008) gospoda Mitchella, v imenu Odbora za razvoj o instrumentu za hitro odzivanje na hitro naraščajoče cene hrane v državah v razvoju (COM(2008)0450 – C6-0280/2008 – 2008/0149(COD)). ']"
206, 19. Instrument za hitro odzivanje na hitro naraščajoče cene hrane v državah v razvoju (razprava) ,"  Gay Mitchell,  poročevalec. − Gospod predsednik, ko je zaradi naraščajočih cen hrane prišlo do nemirov v nekaterih državah, je Komisija predlagala instrument za hrano, s pomočjo katerega bi uporabili 1 milijardo EUR iz preostanka denarja za kmetijske subvencije, da bi omilili razmere v državah v razvoju prek kmetijskih proizvodnih sredstev in varnostnih mrež za izredne razmere. V tej obliki naj bi bila to v celoti dodatna sredstva k obstoječim razvojnim sredstvom. Zdaj, pet mesecev kasneje, imamo to milijardo, vendar v popolnoma drugačni obliki, kot je bilo prvotno predvideno.Dva petka nazaj sem bil s kolegi iz Odbora za proračun in iz Sveta na proračunskem usklajevalnem sestanku, kjer smo končno uspeli doseči kompromis glede financiranja uredbe o instrumentu za hrano. Zadnja razhajanja pa so zgladili naslednji ponedeljek na trialogu med Parlamentom, Komisijo in Svetom.Končni kompromis glede financiranja je: 1 milijarda EUR, ki bi jo financirali v triletnem obdobju 2008-2010 prek instrumenta prožnosti v višini 420 milijonov EUR; s prerazporejanjem v okviru razdelka 4 „Zunanji ukrepi” bi prišli do nadaljnjih 240 milijonov EUR; s povečanjem rezerve za nujno pomoč pa bi dobili 240 milijonov EUR za leto 2008. To povečanje pa zahteva revizijo medinstitucionalnega sporazuma. To je dodatni znesek poleg 100 milijonov EUR iz obstoječih rezerv za nujno pomoč. Ker se rezerva za nujno pomoč financira iz prispevkov držav članic, bo dopolnilno financiranje dodatno le, če države članice ne bodo nadomestile svojih prispevkov z ustreznim zmanjšanjem nacionalnih sredstev.Odbor za zunanje zadeve in nekateri drugi naj ne bi bili zadovoljni z delnim financiranjem tega iz Sklada za stabilnost. Mogoče Odbor za zunanje zadeve ni zadovoljen, vendar je to verjetno najboljša rešitev, ki jo je bilo v danih okoliščinah mogoče doseči.Čeprav podpiram kompromis, ki smo ga zdaj dosegli, sem omenil tudi pomanjkljivosti glede procesa in izida, ker bi bil rad pošten in opozoril – kot sem to storil v preteklosti – na smešne razmere, ko vlade po celem svetu dajejo milijarde dolarjev za pomoč bankam, zelo težko pa se med 27 državami članicami in proračunom Unije najde 1 milijardo EUR za najrevnejše ljudi na svetu.Mislim, da smo naredili največ, kar se je dalo narediti v stotih dneh. Našli smo denar in pripravili uredbo, ne gre pa za milijardo, ki bi bila v celoti dodatna. V poročilu je zapisano dejstvo, da so kompromisno besedilo vse države članice že sprejele na Coreperju, in da so že vključeni bistveni elementi iz mojega poročila in spremembe mojih kolegov iz Odbora za razvoj. Uredba je časovno omejena. Zdaj traja do konca leta 2010. Osredotoča se na reševanje kratkoročne krize; njeni cilji so spodbuditi kmetijsko proizvodnjo. Nasprotuje razpršitvi sredstev in omejuje njihovo porabo na omejen seznam prednostnih držav. Razširja tudi obseg možnih izvajalskih organizacij in zagotavlja parlamentarno odgovornost. K uredbi sta priloženi dve izjavi, ki pomagata zagotoviti njeno pravilno izvajanje.Konec koncev mislim, da smo naredili največ, kar je bilo mogoče doseči med Svetom, Parlamentom in Komisijo. To smo storili v stotih dneh. Zakon smo pripeljali pred Parlament. Jutri bomo o njem glasovali. Dogovor je že dosežen. Našli smo denar. V tem kontekstu bi se rad zahvalil za sodelovanje Svetu in Komisiji, zlasti komisarju Michelu, ki si je res želel, da bi bila to dodatna sredstva.Zahvalil bi se rad tudi sekretariatu Odbora za razvoj, zlasti Guidu Van Hecknu in Anne McLauchlan, iz moje pisarne pa Eoin Ó Seanáin in Oliverju O’Callaghanu, ki sta mi zelo pomagala. Na koncu koncev mislim, da smo dobro delali in naredili največ, kar smo lahko. ","Gay Mitchell,",9,574,not_available,"['slv', 'slv', 'slv', 'slv', 'slv', 'slv', 'slv', 'slv', 'slv']","['  Gay Mitchell,  poročevalec. − Gospod predsednik, ko je zaradi naraščajočih cen hrane prišlo do nemirov v nekaterih državah, je Komisija predlagala instrument za hrano, s pomočjo katerega bi uporabili 1 milijardo EUR iz preostanka denarja za kmetijske subvencije, da bi omilili razmere v državah v razvoju prek kmetijskih proizvodnih sredstev in varnostnih mrež za izredne razmere. V tej obliki naj bi bila to v celoti dodatna sredstva k obstoječim razvojnim sredstvom. Zdaj, pet mesecev kasneje, imamo to milijardo, vendar v popolnoma drugačni obliki, kot je bilo prvotno predvideno.', 'Dva petka nazaj sem bil s kolegi iz Odbora za proračun in iz Sveta na proračunskem usklajevalnem sestanku, kjer smo končno uspeli doseči kompromis glede financiranja uredbe o instrumentu za hrano. Zadnja razhajanja pa so zgladili naslednji ponedeljek na trialogu med Parlamentom, Komisijo in Svetom.', 'Končni kompromis glede financiranja je: 1 milijarda EUR, ki bi jo financirali v triletnem obdobju 2008-2010 prek instrumenta prožnosti v višini 420 milijonov EUR; s prerazporejanjem v okviru razdelka 4 „Zunanji ukrepi” bi prišli do nadaljnjih 240 milijonov EUR; s povečanjem rezerve za nujno pomoč pa bi dobili 240 milijonov EUR za leto 2008. To povečanje pa zahteva revizijo medinstitucionalnega sporazuma. To je dodatni znesek poleg 100 milijonov EUR iz obstoječih rezerv za nujno pomoč. Ker se rezerva za nujno pomoč financira iz prispevkov držav članic, bo dopolnilno financiranje dodatno le, če države članice ne bodo nadomestile svojih prispevkov z ustreznim zmanjšanjem nacionalnih sredstev.', 'Odbor za zunanje zadeve in nekateri drugi naj ne bi bili zadovoljni z delnim financiranjem tega iz Sklada za stabilnost. Mogoče Odbor za zunanje zadeve ni zadovoljen, vendar je to verjetno najboljša rešitev, ki jo je bilo v danih okoliščinah mogoče doseči.', 'Čeprav podpiram kompromis, ki smo ga zdaj dosegli, sem omenil tudi pomanjkljivosti glede procesa in izida, ker bi bil rad pošten in opozoril – kot sem to storil v preteklosti – na smešne razmere, ko vlade po celem svetu dajejo milijarde dolarjev za pomoč bankam, zelo težko pa se med 27 državami članicami in proračunom Unije najde 1 milijardo EUR za najrevnejše ljudi na svetu.', 'Mislim, da smo naredili največ, kar se je dalo narediti v stotih dneh. Našli smo denar in pripravili uredbo, ne gre pa za milijardo, ki bi bila v celoti dodatna. V poročilu je zapisano dejstvo, da so kompromisno besedilo vse države članice že sprejele na Coreperju, in da so že vključeni bistveni elementi iz mojega poročila in spremembe mojih kolegov iz Odbora za razvoj. ', 'Uredba je časovno omejena. Zdaj traja do konca leta 2010. Osredotoča se na reševanje kratkoročne krize; njeni cilji so spodbuditi kmetijsko proizvodnjo. Nasprotuje razpršitvi sredstev in omejuje njihovo porabo na omejen seznam prednostnih držav. Razširja tudi obseg možnih izvajalskih organizacij in zagotavlja parlamentarno odgovornost. K uredbi sta priloženi dve izjavi, ki pomagata zagotoviti njeno pravilno izvajanje.', 'Konec koncev mislim, da smo naredili največ, kar je bilo mogoče doseči med Svetom, Parlamentom in Komisijo. To smo storili v stotih dneh. Zakon smo pripeljali pred Parlament. Jutri bomo o njem glasovali. Dogovor je že dosežen. Našli smo denar. V tem kontekstu bi se rad zahvalil za sodelovanje Svetu in Komisiji, zlasti komisarju Michelu, ki si je res želel, da bi bila to dodatna sredstva.', 'Zahvalil bi se rad tudi sekretariatu Odbora za razvoj, zlasti Guidu Van Hecknu in Anne McLauchlan, iz moje pisarne pa Eoin Ó Seanáin in Oliverju O’Callaghanu, ki sta mi zelo pomagala. Na koncu koncev mislim, da smo dobro delali in naredili največ, kar smo lahko. ']"
207, 19. Instrument za hitro odzivanje na hitro naraščajoče cene hrane v državah v razvoju (razprava) ,"  Predsednik  . – Hvala, gospod Mitchell, čestitam vam za vaše poročilo in za res pomembno in občudovanja vredno temo, ki bo pripomogla k večjemu ugledu Evropskega parlamenta v svetu kot dejavnika napredka in solidarnosti.Zdaj predajam besedo komisarju Michelu. Kot gospa Oviir, gospa Goudin in jaz, se je pravkar vrnil iz druge strani sveta, 14 000 km daleč, in nam bo v imenu Komisije poročal o sestanku, ki smo ga imeli med Skupno parlamentarno skupščino AKP-EU. Vidim, da ste danes v dobri formi, gospod komisar. ",Predsednik,2,84,not_available,"['slv', 'slv']","['  Predsednik  . – Hvala, gospod Mitchell, čestitam vam za vaše poročilo in za res pomembno in občudovanja vredno temo, ki bo pripomogla k večjemu ugledu Evropskega parlamenta v svetu kot dejavnika napredka in solidarnosti.', 'Zdaj predajam besedo komisarju Michelu. Kot gospa Oviir, gospa Goudin in jaz, se je pravkar vrnil iz druge strani sveta, 14 000 km daleč, in nam bo v imenu Komisije poročal o sestanku, ki smo ga imeli med Skupno parlamentarno skupščino AKP-EU. Vidim, da ste danes v dobri formi, gospod komisar. ']"
