,agenda_item,text,speaker,number_p,number_w,chair,language_ps,ps
34, 4. Ukrepi za informiranje o kmetijskih proizvodih in njihovo promocijo na notranjem trgu in v tretjih državah (razprava) ,"  Petja Stavrevа,  v imenu skupine PPE-DE. – (BG) Gospod predsednik, komisarka, gospe in gospodje, rada bi čestitala poročevalcu, gospodu Dumitriuju, za njegovo objektivno poročilo, ki odraža resnične potrebe tega sektorja Skupnosti glede promocije evropskih proizvajalcev.Poročilo vsebuje ukrepe, ki bodo pomagali odpreti nove trge in pripomogli, da bodo kmetijski proizvodi naših kmetov prinašali dobiček. Ta politika izpolnjuje dejanske potrebe držav članic, ki želijo promocijo svoje kmetijske proizvodnje pri potrošnikih v Skupnosti in v tretjih državah.Zagotavlja odlično priložnost, da se poudarijo kakovost, prehranska vrednost, proizvodne metode in varnost pridelane hrane. Podpiram predlog poročevalca, ki ponuja priložnost zainteresiranim državam, da predstavijo programe informiranja za tretje države, če jih te nimajo.Ta sprememba bo omogočila evropskim državam, da bodo razširile praktični obseg ukrepov, ki so predvideni v teh programih, in poiskale pomoč za njihovo izvajanje pri mednarodnih organizacijah. Verjamem, da bi bilo treba v procesu oblikovanja teh programov upoštevati pomembno vlogo, ki jo imajo združenja in panožne organizacije v posameznih državah, ki imajo objektivni pogled na to, kaj se dogaja v posameznih dejavnostih.Upoštevati moramo pomen nekaterih mednarodnih organov pri promociji posameznih značilnosti in prednosti živilskih izdelkov, ki so značilni za nekatere regije v EU. Podpiram predlog poročevalca za povečanje stopnje odstotka finančne udeležbe Skupnosti, tako da bo mogoče zagotoviti dodatno pomoč za projekte, ki jih bodo izbrale države članice. Pozivam vas, da podprete poročilo gospoda Dumitriuja. ","Petja Stavrevа,",5,225,not_available,"['bul', 'bul', 'bul', 'bul', 'bul']","['  Petja Stavrevа,  v imenu skupine PPE-DE. – (BG) Gospod predsednik, komisarka, gospe in gospodje, rada bi čestitala poročevalcu, gospodu Dumitriuju, za njegovo objektivno poročilo, ki odraža resnične potrebe tega sektorja Skupnosti glede promocije evropskih proizvajalcev.', 'Poročilo vsebuje ukrepe, ki bodo pomagali odpreti nove trge in pripomogli, da bodo kmetijski proizvodi naših kmetov prinašali dobiček. Ta politika izpolnjuje dejanske potrebe držav članic, ki želijo promocijo svoje kmetijske proizvodnje pri potrošnikih v Skupnosti in v tretjih državah.', 'Zagotavlja odlično priložnost, da se poudarijo kakovost, prehranska vrednost, proizvodne metode in varnost pridelane hrane. Podpiram predlog poročevalca, ki ponuja priložnost zainteresiranim državam, da predstavijo programe informiranja za tretje države, če jih te nimajo.', 'Ta sprememba bo omogočila evropskim državam, da bodo razširile praktični obseg ukrepov, ki so predvideni v teh programih, in poiskale pomoč za njihovo izvajanje pri mednarodnih organizacijah. Verjamem, da bi bilo treba v procesu oblikovanja teh programov upoštevati pomembno vlogo, ki jo imajo združenja in panožne organizacije v posameznih državah, ki imajo objektivni pogled na to, kaj se dogaja v posameznih dejavnostih.', 'Upoštevati moramo pomen nekaterih mednarodnih organov pri promociji posameznih značilnosti in prednosti živilskih izdelkov, ki so značilni za nekatere regije v EU. Podpiram predlog poročevalca za povečanje stopnje odstotka finančne udeležbe Skupnosti, tako da bo mogoče zagotoviti dodatno pomoč za projekte, ki jih bodo izbrale države članice. Pozivam vas, da podprete poročilo gospoda Dumitriuja. ']"
35, 4. Ukrepi za informiranje o kmetijskih proizvodih in njihovo promocijo na notranjem trgu in v tretjih državah (razprava) ,"  Bogdan Golik,  v imenu skupine PSE. – (PL) Gospod predsednik, komisar, iskreno čestitam gospodu Dumitriuju za dobro poročilo, nadaljevanje poročil, ki so bila sestavljena pred tem, v katerih smo govorili o promociji in zneskih denarja, dodeljenih za promocijo Evropske unije v tretjih državah.Ukrepi za informiranje o kmetijskih proizvodih in njihovo promocijo na notranjem trgu in v tretjih državah imajo veliko vlogo pri ustvarjanju pozitivne podobe znamke „Proizvedeno v Evropi“. To že dolgo poudarjam in že nekaj let si aktivno prizadevam za poenostavitev celotnega sistema informiranja in promocije. V svojih govorih nenehno poudarjam potrebo po promociji znamke „Proizvedeno v Evropi“ na trgih tretjih držav. To je še posebno legitimno v današnjih formalnih in pravnih razmerah.V skladu z Deklaracijo šeste ministrske konference STO v Hongkongu bo leta 2013 odpravljena uporaba vseh oblik izvoznih subvencij in vseh ureditev izvoznih ukrepov z enakim učinkom. Glede na zapleteno naravo organiziranja promocijskih kampanj na trgih tretjih držav in višje stroške takih ukrepov na znatne razdalje, zlasti v Aziji in Ameriki, mehanizmi za podporo promocijskih dejavnosti niso pritegnili veliko interesa med trgovinskimi organizacijami.Prodlog Evropske komisije omogoča spodbujanje njihove dejavnosti. Promocijski programi, ki jih izvajajo države članice, ponujajo podjetjem priložnost za skupno delovanje, kadar jim ne uspe, da bi sama vodila in financirala te dejavnosti. Kljub temu je treba nadaljevati s prizadevanji za povečanje odstotnega deleža Skupnosti pri financiranju tovrstnih projektov. Kot primer bom navedel Združene države Amerike, kjer se za promocijske dejavnosti porabi nekajkrat več, kot je celotna vsota denarja, namenjenega za vino in dejavnosti na področju drugih promocijskih izdelkov v vsej Evropski uniji.Kljub liberalizaciji komercialnega toka kmetijskih proizvodov, je instrument za podporo promocije proizvodnje Skupnosti na trgih tretjih držav morda edino razpoložljivo orodje, ki je v skladu s smernicami Okvirnega kmetijskega sporazuma Razvojne agende STO iz Dohe. Promocija znamke „Proizvedeno v Evropi“ je priložnost za ohranitev konkurenčnosti in v daljšem časovnem obdobju celo za okrepitev privlačnosti evropskih kmetijskih in živilskih proizvodov in za razširitev njihovega trga.Rad bi se zahvalil Komisiji za te ukrepe, o katerih smo v Parlamentu večkrat govorili in so zdaj vključeni, predvsem pa za zmanjšanje prispevkov trgovinskih organizacij z 20 % na 10 % in za povečanje sredstev, ki so na voljo za promocijsko dejavnost. ","Bogdan Golik,",6,364,not_available,"['pol', 'pol', 'pol', 'pol', 'pol', 'pol']","['  Bogdan Golik,  v imenu skupine PSE. – (PL) Gospod predsednik, komisar, iskreno čestitam gospodu Dumitriuju za dobro poročilo, nadaljevanje poročil, ki so bila sestavljena pred tem, v katerih smo govorili o promociji in zneskih denarja, dodeljenih za promocijo Evropske unije v tretjih državah.', 'Ukrepi za informiranje o kmetijskih proizvodih in njihovo promocijo na notranjem trgu in v tretjih državah imajo veliko vlogo pri ustvarjanju pozitivne podobe znamke „Proizvedeno v Evropi“. To že dolgo poudarjam in že nekaj let si aktivno prizadevam za poenostavitev celotnega sistema informiranja in promocije. V svojih govorih nenehno poudarjam potrebo po promociji znamke „Proizvedeno v Evropi“ na trgih tretjih držav. To je še posebno legitimno v današnjih formalnih in pravnih razmerah.', 'V skladu z Deklaracijo šeste ministrske konference STO v Hongkongu bo leta 2013 odpravljena uporaba vseh oblik izvoznih subvencij in vseh ureditev izvoznih ukrepov z enakim učinkom. Glede na zapleteno naravo organiziranja promocijskih kampanj na trgih tretjih držav in višje stroške takih ukrepov na znatne razdalje, zlasti v Aziji in Ameriki, mehanizmi za podporo promocijskih dejavnosti niso pritegnili veliko interesa med trgovinskimi organizacijami.', 'Prodlog Evropske komisije omogoča spodbujanje njihove dejavnosti. Promocijski programi, ki jih izvajajo države članice, ponujajo podjetjem priložnost za skupno delovanje, kadar jim ne uspe, da bi sama vodila in financirala te dejavnosti. Kljub temu je treba nadaljevati s prizadevanji za povečanje odstotnega deleža Skupnosti pri financiranju tovrstnih projektov. Kot primer bom navedel Združene države Amerike, kjer se za promocijske dejavnosti porabi nekajkrat več, kot je celotna vsota denarja, namenjenega za vino in dejavnosti na področju drugih promocijskih izdelkov v vsej Evropski uniji.', 'Kljub liberalizaciji komercialnega toka kmetijskih proizvodov, je instrument za podporo promocije proizvodnje Skupnosti na trgih tretjih držav morda edino razpoložljivo orodje, ki je v skladu s smernicami Okvirnega kmetijskega sporazuma Razvojne agende STO iz Dohe. Promocija znamke „Proizvedeno v Evropi“ je priložnost za ohranitev konkurenčnosti in v daljšem časovnem obdobju celo za okrepitev privlačnosti evropskih kmetijskih in živilskih proizvodov in za razširitev njihovega trga.', 'Rad bi se zahvalil Komisiji za te ukrepe, o katerih smo v Parlamentu večkrat govorili in so zdaj vključeni, predvsem pa za zmanjšanje prispevkov trgovinskih organizacij z 20 % na 10 % in za povečanje sredstev, ki so na voljo za promocijsko dejavnost. ']"
36, 4. Ukrepi za informiranje o kmetijskih proizvodih in njihovo promocijo na notranjem trgu in v tretjih državah (razprava) ,"  Seán Ó Neachtain  , v imenu skupine UEN. – (GA) Gospod predsednik, toplo pozdravljam poročilo gospoda Dumitriuja in bi mu rad čestital za opravljeno delo.Ta proračun daje državam članicam odlično priložnost, da najdejo trge znotraj in zunaj Evrope. Ker prihajam iz Irske, bi rad rekel, da je nam na Irskem prodaja naših zdravih, svežih živilskih proizvodov na svetovnih trgih, zlasti v Aziji, v veliko pomoč. Tako kot moji kolegi pa bi rad rekel, da vidim tu boljšo priložnost v poenostavitvi pravil, ki se nanašajo na ta proračun, tako da bo dostop do zaloge denarja za trgovanje lažji kot je zdaj, povečati pa se mora seveda tudi proračun, kot je bilo rečeno. To je zelo pomembno, ne le za države članice, temveč za Evropo kot celoto. ",Seán Ó Neachtain,3,124,not_available,"['gla', 'gla', 'gla']","['  Seán Ó Neachtain  , v imenu skupine UEN. – (GA) Gospod predsednik, toplo pozdravljam poročilo gospoda Dumitriuja in bi mu rad čestital za opravljeno delo.', 'Ta proračun daje državam članicam odlično priložnost, da najdejo trge znotraj in zunaj Evrope. Ker prihajam iz Irske, bi rad rekel, da je nam na Irskem prodaja naših zdravih, svežih živilskih proizvodov na svetovnih trgih, zlasti v Aziji, v veliko pomoč. ', 'Tako kot moji kolegi pa bi rad rekel, da vidim tu boljšo priložnost v poenostavitvi pravil, ki se nanašajo na ta proračun, tako da bo dostop do zaloge denarja za trgovanje lažji kot je zdaj, povečati pa se mora seveda tudi proračun, kot je bilo rečeno. To je zelo pomembno, ne le za države članice, temveč za Evropo kot celoto. ']"
37, 4. Ukrepi za informiranje o kmetijskih proizvodih in njihovo promocijo na notranjem trgu in v tretjih državah (razprava) ,"  Friedrich-Wilhelm Graefe zu Baringdorf,  v imenu skupine Verts/ALE. – (DE) Gospod predsednik, komisarka, soglašam z vama, da je oglaševanje pomembno. Kljub temu pa oglaševanje ni le posledica strokovnih kampanj, temveč tudi dogodkov v regiji, iz katere izvira hrana.Ko nas svet povezuje z BSE, ko smo našo grboslovno žival spremenili v noro ali ko države, kot zdaj, objavljajo odpoklic izdelkov zaradi problemov z dioksinom, kar seveda spet gre okrog sveta, in ko se milijoni zaklanih bolnih krav prikazujejo na televizijskih novicah po vsem svetu, je tudi to vrsta oglaševanja, negativnega oglaševanja.Tu moramo paziti, da se bomo izognili nasprotjem. Po eni strani govorimo o dobrih proizvodih, po drugi strani pa so tu negativna poročila. Vendar se ukvarjamo s tem, kot smo pravkar videli v razpravi, in glede na to, kaj smo sklenili.Če želimo oglaševati na zunanji ravni, da, to je v redu, imamo dober razlog, da to počnemo, ker imamo dobre proizvode, nočem pa, da je to splošno oglaševanje, temveč oglaševanje, ki kaže evropsko raznolikost. Kot veste, imamo zdaj v Nemčiji situacijo, ko je Zvezno ustavno sodišče presodilo proti vrsti obveznega oglaševanja z obvezno dajatvijo. Opozorilo je, da oglaševanje, ki ne razlikuje med posameznimi vrstami kakovosti, ne povečuje prodaje in da je namesto tega pomembno, da so posamezni proizvajalci sposobni oglaševati svoje značilne proizvode.Poleg tega je vedno pomembneje, ne le znotraj Evrope, ampak tudi zunaj nje, da se ne opisuje samo kakovosti končnega proizvoda, ampak tudi kakovost procesa. Kakšno je stanje glede zaščite živali, okolja, sestavin, strukture kmetovanja, poštene trgovine? Vse to so merila, za katera ni nujno, da vplivajo na kakovost končnega proizvoda, vendar postajajo vse pomembnejša za potrošnike. Torej moramo tudi to vključiti v naše oglaševanje in poskrbeti, da se bo ugled Evrope v svetu zaradi tega še bolj povečal. ","Friedrich-Wilhelm Graefe zu Baringdorf,",5,295,not_available,"['ger', 'ger', 'ger', 'ger', 'ger']","['  Friedrich-Wilhelm Graefe zu Baringdorf,  v imenu skupine Verts/ALE. – (DE) Gospod predsednik, komisarka, soglašam z vama, da je oglaševanje pomembno. Kljub temu pa oglaševanje ni le posledica strokovnih kampanj, temveč tudi dogodkov v regiji, iz katere izvira hrana.', 'Ko nas svet povezuje z BSE, ko smo našo grboslovno žival spremenili v noro ali ko države, kot zdaj, objavljajo odpoklic izdelkov zaradi problemov z dioksinom, kar seveda spet gre okrog sveta, in ko se milijoni zaklanih bolnih krav prikazujejo na televizijskih novicah po vsem svetu, je tudi to vrsta oglaševanja, negativnega oglaševanja.', 'Tu moramo paziti, da se bomo izognili nasprotjem. Po eni strani govorimo o dobrih proizvodih, po drugi strani pa so tu negativna poročila. Vendar se ukvarjamo s tem, kot smo pravkar videli v razpravi, in glede na to, kaj smo sklenili.', 'Če želimo oglaševati na zunanji ravni, da, to je v redu, imamo dober razlog, da to počnemo, ker imamo dobre proizvode, nočem pa, da je to splošno oglaševanje, temveč oglaševanje, ki kaže evropsko raznolikost. Kot veste, imamo zdaj v Nemčiji situacijo, ko je Zvezno ustavno sodišče presodilo proti vrsti obveznega oglaševanja z obvezno dajatvijo. Opozorilo je, da oglaševanje, ki ne razlikuje med posameznimi vrstami kakovosti, ne povečuje prodaje in da je namesto tega pomembno, da so posamezni proizvajalci sposobni oglaševati svoje značilne proizvode.', 'Poleg tega je vedno pomembneje, ne le znotraj Evrope, ampak tudi zunaj nje, da se ne opisuje samo kakovosti končnega proizvoda, ampak tudi kakovost procesa. Kakšno je stanje glede zaščite živali, okolja, sestavin, strukture kmetovanja, poštene trgovine? Vse to so merila, za katera ni nujno, da vplivajo na kakovost končnega proizvoda, vendar postajajo vse pomembnejša za potrošnike. Torej moramo tudi to vključiti v naše oglaševanje in poskrbeti, da se bo ugled Evrope v svetu zaradi tega še bolj povečal. ']"
38, 4. Ukrepi za informiranje o kmetijskih proizvodih in njihovo promocijo na notranjem trgu in v tretjih državah (razprava) ,"  Ilda Figueiredo,  v imenu skupine GUE/NGL. – (PT) Gospod predsednik, komisarka, gospe in gospodje, ne smemo pozabiti, da je pomembno, da se izboljšajo razmere in podprejo ukrepi za informiranje o kmetijskih proizvodih in njihovo promocijo v Evropski uniji in tretjih državah ter da se razširi obseg predlogov, ki jih je predstavila Evropska komisija.Zato podpiramo predloge poročevalca in Odbora za kmetijstvo in razvoj podeželja, predvsem tiste, ki so namenjeni večji intervenciji in krepitvi vloge trgovinskih združenj in organizacij, ki poslujejo v sektorju, v zvezi z njihovim strokovnim znanjem in pomembno vlogo, ki jo imajo tudi pri zagotavljanju nadzora kakovosti, vključno z združenji in organizacijami držav članic, ki sestavljajo program, pa tudi tiste o povečanju odstotka finančne soudeležbe Skupnosti. Pomembno je, da obstaja dodatna pomoč, zlasti za projekte, ki jih izberejo države članice.Podobno smo prepričani, da bi morale promocijske in oglaševalske akcije v tretjih državah poleg oljčnega olja in oljk koristiti še drugim pomembnim proizvodom, s poudarkom na vinih z označbo porekla ali zaščiteno geografsko označbo. V tem smislu bom tu omenila tudi pomembno vlogo kmečkih zvez, predvsem zadružnih vinskih kleti in drugih združenj malih in srednje velikih kmetov, katerih obstoj je temelj za zagotavljanje pretoka pridelka kmetov, ki sami od sebe ne bodo sposobni preživeti.Še enkrat pozivam k večji podpori teh organizacij kmetov, da bodo zmožne v celoti izpolniti svojo vlogo ohranjanja družinskega kmetovanja in promocije visokokakovostnih kmetijskih proizvodov, ki jih pridelujejo in so bistveni pri zagotavljanju zdrave prehrane za prebivalce naših držav.Zato bomo glasovali za to poročilo. ","Ilda Figueiredo,",5,251,not_available,"['por', 'por', 'por', 'por', 'por']","['  Ilda Figueiredo,  v imenu skupine GUE/NGL. – (PT) Gospod predsednik, komisarka, gospe in gospodje, ne smemo pozabiti, da je pomembno, da se izboljšajo razmere in podprejo ukrepi za informiranje o kmetijskih proizvodih in njihovo promocijo v Evropski uniji in tretjih državah ter da se razširi obseg predlogov, ki jih je predstavila Evropska komisija.', 'Zato podpiramo predloge poročevalca in Odbora za kmetijstvo in razvoj podeželja, predvsem tiste, ki so namenjeni večji intervenciji in krepitvi vloge trgovinskih združenj in organizacij, ki poslujejo v sektorju, v zvezi z njihovim strokovnim znanjem in pomembno vlogo, ki jo imajo tudi pri zagotavljanju nadzora kakovosti, vključno z združenji in organizacijami držav članic, ki sestavljajo program, pa tudi tiste o povečanju odstotka finančne soudeležbe Skupnosti. Pomembno je, da obstaja dodatna pomoč, zlasti za projekte, ki jih izberejo države članice.', 'Podobno smo prepričani, da bi morale promocijske in oglaševalske akcije v tretjih državah poleg oljčnega olja in oljk koristiti še drugim pomembnim proizvodom, s poudarkom na vinih z označbo porekla ali zaščiteno geografsko označbo. V tem smislu bom tu omenila tudi pomembno vlogo kmečkih zvez, predvsem zadružnih vinskih kleti in drugih združenj malih in srednje velikih kmetov, katerih obstoj je temelj za zagotavljanje pretoka pridelka kmetov, ki sami od sebe ne bodo sposobni preživeti.', 'Še enkrat pozivam k večji podpori teh organizacij kmetov, da bodo zmožne v celoti izpolniti svojo vlogo ohranjanja družinskega kmetovanja in promocije visokokakovostnih kmetijskih proizvodov, ki jih pridelujejo in so bistveni pri zagotavljanju zdrave prehrane za prebivalce naših držav.', 'Zato bomo glasovali za to poročilo. ']"
39, 4. Ukrepi za informiranje o kmetijskih proizvodih in njihovo promocijo na notranjem trgu in v tretjih državah (razprava) ,"  Witold Tomczak,  v imenu skupine IND/DEM. – (PL) Gospod predsednik, komisar, Evropska unija je pomembna izvoznica številnih kmetijskih proizvodov, a prihodnost kmetijstva EU bo odvisna od porabe na notranjem trgu. Spodbujanje tega lahko koristi kmetom, potrošnikom in celotnemu gospodarstvu.V številnih državah članicah poraba živilskih proizvodov, ki so bistveni za zdravje, ni visoka in je zelo zaželeno, da bi se z dobrim informiranjem in promocijo povečala. Vendar je pomembno, da bi imeli kmetje EU korist od programov, o katerih razpravljamo, in zlasti male in srednje velike kmetije, ki obsegajo 95 % vseh kmetij.Ti programi bi morali obogatiti znanje potrošnikov o zdravem prehranjevanju in jim hkrati pustiti izbiro. Zato je vredno sprejeti naslednje korake: organizirati posvetovanja s strokovnjaki na področju zdrave prehrane in usposabljanje prodajalcev, ki bi morali biti tudi svetovalci potrošnikom v zvezi z zdravo prehrano. Bistvena je dobra predstavitev informacij o koristih promoviranih proizvodov za zdravje in o načinu pridelave hrane. Informacije na oznakah živil ne zadoščajo.Ta program lahko ogrozi promocija hrane, ki jo serijsko proizvajajo velika živilska podjetja, ki lahko pripravijo učinkovite programe in imajo na voljo najboljše strokovnjake. Vendar, ali ne bo to potem ogrozilo promocije visokokakovostne hrane?Zelo pomembna je tudi čitljivost datuma izteka veljavnosti na proizvodih, pa tudi dvig ozaveščenosti potrošnikov o pomembnosti vseh informacij, ki jih je mogoče najti na oznaki proizvoda. ","Witold Tomczak,",5,219,not_available,"['pol', 'pol', 'pol', 'pol', 'pol']","['  Witold Tomczak,  v imenu skupine IND/DEM. – (PL) Gospod predsednik, komisar, Evropska unija je pomembna izvoznica številnih kmetijskih proizvodov, a prihodnost kmetijstva EU bo odvisna od porabe na notranjem trgu. Spodbujanje tega lahko koristi kmetom, potrošnikom in celotnemu gospodarstvu.', 'V številnih državah članicah poraba živilskih proizvodov, ki so bistveni za zdravje, ni visoka in je zelo zaželeno, da bi se z dobrim informiranjem in promocijo povečala. Vendar je pomembno, da bi imeli kmetje EU korist od programov, o katerih razpravljamo, in zlasti male in srednje velike kmetije, ki obsegajo 95 % vseh kmetij.', 'Ti programi bi morali obogatiti znanje potrošnikov o zdravem prehranjevanju in jim hkrati pustiti izbiro. Zato je vredno sprejeti naslednje korake: organizirati posvetovanja s strokovnjaki na področju zdrave prehrane in usposabljanje prodajalcev, ki bi morali biti tudi svetovalci potrošnikom v zvezi z zdravo prehrano. Bistvena je dobra predstavitev informacij o koristih promoviranih proizvodov za zdravje in o načinu pridelave hrane. Informacije na oznakah živil ne zadoščajo.', 'Ta program lahko ogrozi promocija hrane, ki jo serijsko proizvajajo velika živilska podjetja, ki lahko pripravijo učinkovite programe in imajo na voljo najboljše strokovnjake. Vendar, ali ne bo to potem ogrozilo promocije visokokakovostne hrane?', 'Zelo pomembna je tudi čitljivost datuma izteka veljavnosti na proizvodih, pa tudi dvig ozaveščenosti potrošnikov o pomembnosti vseh informacij, ki jih je mogoče najti na oznaki proizvoda. ']"
