,agenda_item,text,speaker,number_p,number_w,chair,language_ps,ps
0, 1. Otvoritev seje,PREDSEDSTVO: GOSPOD VIDAL-QUADRAS Podpredsednik,PREDSEDSTVO: GOSPOD VIDAL-QUADRAS,1,5,not_available,['slv'],['PREDSEDSTVO: GOSPOD VIDAL-QUADRAS Podpredsednik']
1, 3. Dajanje krme v promet in njena uporaba (razprava) ,  Predsednik.   – Naslednja točka je poročilo (A6-0407/2008) gospoda Graefeja zu Baringdorfa v imenu Odbora za kmetijstvo in razvoj podeželja o predlogu Uredbe Evropskega parlamenta in Sveta o dajanju krme v promet in njeni uporabi (COM(2008)0124 – C6-0128/2008 – 2008/0050(COD)) ,Predsednik.,1,44,not_available,['slv'],['  Predsednik.   – Naslednja točka je poročilo (A6-0407/2008) gospoda Graefeja zu Baringdorfa v imenu Odbora za kmetijstvo in razvoj podeželja o predlogu Uredbe Evropskega parlamenta in Sveta o dajanju krme v promet in njeni uporabi (COM(2008)0124 – C6-0128/2008 – 2008/0050(COD)) ']
2, 3. Dajanje krme v promet in njena uporaba (razprava) ,"  Friedrich-Wilhelm Graefe zu Baringdorf,  poročevalec. – (DE) Gospod predsednik, komisarka, danes se pogovarjamo o tem, kar je znano kot „odprta deklaracija“. Gre za preglednost v zvezi s krmo, ki je podlaga za zdravo hrano za potrošnike, in za to, da bi kupci krmnih mešanic dobili pregled nad tem, kaj se jim dobavlja.Pot je bila dolga, a če bomo danes sprejeli to uredbo, upam, da bo to pripeljalo zadeve do uspešnega konca, in rad bi se zahvalil Komisiji, ki nam je veliko pomagala s konstruktivnim delom pri teh vprašanjih. Komisija je naletela na absolutno politično voljo Parlamenta, da se prebije skozi to odprto deklaracijo, in se soočila z nepopustljivo, a pošteno razpravo s Svetom. Lahko smo ponosni na rezultate.Pa poglejmo na hitro zgodovino. Imeli smo krizo BSE in leta 1997 je začasni preiskovalni odbor izdal končno poročilo, v katerem je Parlament zahteval to odprto deklaracijo. Komisija je predstavila predlog, ki je pozneje postal Direktiva 2002/2/ES. V kompromisu s Svetom (predlog so obravnavali vsi organi) je Direktiva uvedla odprto deklaracijo, ki pomeni, da je treba na oznakah navajati sestavine s toleranco ±15 % in na zahtevo zagotoviti natančno sestavo.To je bila bolj direktiva kot uredba in države članice so jo izvedle z velikim obotavljanjem ali pa sploh ne. Industrija krmil je sprožila postopek pred Sodiščem Evropskih skupnosti, ki je dalo naslednjo prvorazredno potrditev: razen natančnih informacij, zakonitost te direktive ni sporna. To odločitev smo potem upoštevali pri nadaljnjem postopku v Parlamentu in smo zdaj pripeljali stvari do zaključka v obliki te uredbe. V čast mi je, da sem bil ves čas poročevalec in da sem bil v tem dolgem obdobju deležen intenzivnega sodelovanja s Komisijo, ki je temeljilo na zaupanju.Danes imamo rezultat, za katerega smo se bojevali trdo, a pošteno in na katerega smo lahko ponosni. Očitno je tudi, da uživa podporo večine v tem parlamentu in skupinah. Ker ni nobenih sprememb, sklepam, da bo ta uredba sprejeta z res veliko večino. Torej imamo dobro uredbo, ki prinaša odprto deklaracijo v treh stopnjah, ki jih poznate, prvič, sestavine v padajočem vrstnem redu glede na odstotek, drugič, zagotovitev informacij za nosilce dejavnosti poslovanja s krmo s toleranco ±15 % (v tem smislu v tej zakonodaji nismo določili pridržka za pravice intelektualne lastnine, ampak smo se raje sklicevali na splošno zakonodajo) in tretjič, zagotovitev natančnih informacij za oblasti.Rad bi poudaril tudi, da smo vzpostavili register. V Evropski uniji zdaj ne bo več krmljenja in dodajanja sestavin, ki ne bi bile objavljene, saj morajo biti vključene v register. To ni pomembno le za nadzorne organe, temveč tudi za javnost in uporabnike. S stališča poročevalca lahko torej rečem, da sem zelo zadovoljen s splošnim rezultatom. ","Friedrich-Wilhelm Graefe zu Baringdorf,",6,444,not_available,"['ger', 'ger', 'ger', 'ger', 'ger', 'ger']","['  Friedrich-Wilhelm Graefe zu Baringdorf,  poročevalec. – (DE) Gospod predsednik, komisarka, danes se pogovarjamo o tem, kar je znano kot „odprta deklaracija“. Gre za preglednost v zvezi s krmo, ki je podlaga za zdravo hrano za potrošnike, in za to, da bi kupci krmnih mešanic dobili pregled nad tem, kaj se jim dobavlja.', 'Pot je bila dolga, a če bomo danes sprejeli to uredbo, upam, da bo to pripeljalo zadeve do uspešnega konca, in rad bi se zahvalil Komisiji, ki nam je veliko pomagala s konstruktivnim delom pri teh vprašanjih. Komisija je naletela na absolutno politično voljo Parlamenta, da se prebije skozi to odprto deklaracijo, in se soočila z nepopustljivo, a pošteno razpravo s Svetom. Lahko smo ponosni na rezultate.', 'Pa poglejmo na hitro zgodovino. Imeli smo krizo BSE in leta 1997 je začasni preiskovalni odbor izdal končno poročilo, v katerem je Parlament zahteval to odprto deklaracijo. Komisija je predstavila predlog, ki je pozneje postal Direktiva 2002/2/ES. V kompromisu s Svetom (predlog so obravnavali vsi organi) je Direktiva uvedla odprto deklaracijo, ki pomeni, da je treba na oznakah navajati sestavine s toleranco ±15 % in na zahtevo zagotoviti natančno sestavo.', 'To je bila bolj direktiva kot uredba in države članice so jo izvedle z velikim obotavljanjem ali pa sploh ne. Industrija krmil je sprožila postopek pred Sodiščem Evropskih skupnosti, ki je dalo naslednjo prvorazredno potrditev: razen natančnih informacij, zakonitost te direktive ni sporna. To odločitev smo potem upoštevali pri nadaljnjem postopku v Parlamentu in smo zdaj pripeljali stvari do zaključka v obliki te uredbe. V čast mi je, da sem bil ves čas poročevalec in da sem bil v tem dolgem obdobju deležen intenzivnega sodelovanja s Komisijo, ki je temeljilo na zaupanju.', 'Danes imamo rezultat, za katerega smo se bojevali trdo, a pošteno in na katerega smo lahko ponosni. Očitno je tudi, da uživa podporo večine v tem parlamentu in skupinah. Ker ni nobenih sprememb, sklepam, da bo ta uredba sprejeta z res veliko večino. Torej imamo dobro uredbo, ki prinaša odprto deklaracijo v treh stopnjah, ki jih poznate, prvič, sestavine v padajočem vrstnem redu glede na odstotek, drugič, zagotovitev informacij za nosilce dejavnosti poslovanja s krmo s toleranco ±15 % (v tem smislu v tej zakonodaji nismo določili pridržka za pravice intelektualne lastnine, ampak smo se raje sklicevali na splošno zakonodajo) in tretjič, zagotovitev natančnih informacij za oblasti.', 'Rad bi poudaril tudi, da smo vzpostavili register. V Evropski uniji zdaj ne bo več krmljenja in dodajanja sestavin, ki ne bi bile objavljene, saj morajo biti vključene v register. To ni pomembno le za nadzorne organe, temveč tudi za javnost in uporabnike. S stališča poročevalca lahko torej rečem, da sem zelo zadovoljen s splošnim rezultatom. ']"
3, 3. Dajanje krme v promet in njena uporaba (razprava) ,"  Androula Vassiliou,  članica Komisije. − Gospod predsednik, najprej bi se rada zahvalila Odboru za kmetijstvo in razvoj podeželja za njegovo delo pri tem dokumentu in zlasti poročevalcu gospodu Graefeju zu Baringdorfu, pa tudi vsem poročevalcem v senci, ki so imeli pomembno vlogo.Gospodu Graefeju zu Baringdorfu je uspelo z veliko spretnostjo usmerjati razprave med pogajanji in smo mu zelo hvaležni.Kompromisni paket ohranja visoko raven varnosti krmil, ki je bila dosežena v EU. Našel je pravo ravnotežje med varstvom potrošnikov in pravicami intelektualne lastnine. Odpravlja breme postopka izdaje dovoljenj pred dajanjem v promet za bioproteine, posodablja označevanje krmil z ustreznim obveščanjem strank in postavlja koregulacijo v središče zakonodajnih postopkov. Izboljšuje preglednost trga s sistemom obveščanja za nova posamična krmila, pospešuje inovacije in konkurenčnost v poslovanju s krmo in označuje konkretne ukrepe proti zavajanju uporabnikov krmil, najsi bodo kmetje ali lastniki hišnih ljubljenčkov.Rezultat pogajanj je kompromisni paket, predložen v glasovanje, ki pomeni poenostavitev in posodobitev sedanjega zakonodajnega okvira. Določbe o tako imenovani „odprti deklaraciji“ dopuščajo sodobnejšo obliko označevanja. Posamična krmila, vključena v krmne mešanice za živali za proizvodnjo hrane, morajo biti označena v padajočem vrstnem redu glede na težo.Poleg tega pa je treba navesti natančen utežni odstotek za poudarjena posamična krmila in v primeru prostovoljnega označevanja.Še več, določba, da se lahko nekatere informacije v zvezi s krmnimi mešanicami zaradi nujnosti prenesejo iz pristojnih organov na kupce, izboljšuje primernost informacij za uporabnike v primerih, kot so izredni primeri kontaminacije krme.V tem smislu Komisija sprejema naslednje izjave. Prvič, Komisija in njene službe razmišljajo, da bi preučili Prilogo III o tolerancah glede označevanja sestave posamičnih krmil in krmnih mešanic, da bi jo prilagodili znanstvenemu in tehničnemu razvoju. V tem kontekstu bo Komisija upoštevala tudi nekatera posamična krmila z vsebnostjo vlage, ki presega 50 %.Drugič, glede označevanja dodatkov bo Komisija preučila, ali se lahko načela obveščanja z označevanjem krme uporabljajo tudi za dodatke in premikse z dovoljenjem na podlagi Uredbe o dodatkih za uporabo v prehrani živali.Nazadnje, Komisija razume, da lahko nujni primeri v zvezi z zdravjem ljudi in živali ter okoljem vključujejo nujne primere, ki med drugim nastanejo zaradi malomarnosti, mednarodnih goljufij ali kaznivih dejanj. ","Androula Vassiliou,",9,355,not_available,"['slv', 'slv', 'slv', 'slv', 'slv', 'slv', 'slv', 'slv', 'slv']","['  Androula Vassiliou,  članica Komisije. − Gospod predsednik, najprej bi se rada zahvalila Odboru za kmetijstvo in razvoj podeželja za njegovo delo pri tem dokumentu in zlasti poročevalcu gospodu Graefeju zu Baringdorfu, pa tudi vsem poročevalcem v senci, ki so imeli pomembno vlogo.', 'Gospodu Graefeju zu Baringdorfu je uspelo z veliko spretnostjo usmerjati razprave med pogajanji in smo mu zelo hvaležni.', 'Kompromisni paket ohranja visoko raven varnosti krmil, ki je bila dosežena v EU. Našel je pravo ravnotežje med varstvom potrošnikov in pravicami intelektualne lastnine. Odpravlja breme postopka izdaje dovoljenj pred dajanjem v promet za bioproteine, posodablja označevanje krmil z ustreznim obveščanjem strank in postavlja koregulacijo v središče zakonodajnih postopkov. Izboljšuje preglednost trga s sistemom obveščanja za nova posamična krmila, pospešuje inovacije in konkurenčnost v poslovanju s krmo in označuje konkretne ukrepe proti zavajanju uporabnikov krmil, najsi bodo kmetje ali lastniki hišnih ljubljenčkov.', 'Rezultat pogajanj je kompromisni paket, predložen v glasovanje, ki pomeni poenostavitev in posodobitev sedanjega zakonodajnega okvira. Določbe o tako imenovani „odprti deklaraciji“ dopuščajo sodobnejšo obliko označevanja. Posamična krmila, vključena v krmne mešanice za živali za proizvodnjo hrane, morajo biti označena v padajočem vrstnem redu glede na težo.', 'Poleg tega pa je treba navesti natančen utežni odstotek za poudarjena posamična krmila in v primeru prostovoljnega označevanja.', 'Še več, določba, da se lahko nekatere informacije v zvezi s krmnimi mešanicami zaradi nujnosti prenesejo iz pristojnih organov na kupce, izboljšuje primernost informacij za uporabnike v primerih, kot so izredni primeri kontaminacije krme.', 'V tem smislu Komisija sprejema naslednje izjave. Prvič, Komisija in njene službe razmišljajo, da bi preučili Prilogo III o tolerancah glede označevanja sestave posamičnih krmil in krmnih mešanic, da bi jo prilagodili znanstvenemu in tehničnemu razvoju. V tem kontekstu bo Komisija upoštevala tudi nekatera posamična krmila z vsebnostjo vlage, ki presega 50 %.', 'Drugič, glede označevanja dodatkov bo Komisija preučila, ali se lahko načela obveščanja z označevanjem krme uporabljajo tudi za dodatke in premikse z dovoljenjem na podlagi Uredbe o dodatkih za uporabo v prehrani živali.', 'Nazadnje, Komisija razume, da lahko nujni primeri v zvezi z zdravjem ljudi in živali ter okoljem vključujejo nujne primere, ki med drugim nastanejo zaradi malomarnosti, mednarodnih goljufij ali kaznivih dejanj. ']"
4, 3. Dajanje krme v promet in njena uporaba (razprava) ,"  Albert Deß,  v imenu skupine PPE-DE. – (DE) Gospod predsednik, komisarka, gospe in gospodje, v imenu skupine Evropske ljudske stranke (Krščanskih demokratov) in Evropskih demokratov ter v svojem imenu bi se rad najtopleje zahvalil našemu poročevalcu, gospodu Graefeju zu Baringdorfu. Prepričan sem, da je pristop v tem poročilu vzorčni primer parlamentarnega dela v tem parlamentu.Današnje glasovanje ne vključuje nobenih sprememb, ker je bilo delo tehnično zelo premišljeno in je vključevalo celotni politični spekter. Prepričan sem, da je to eden od rezultatov, na katerega smo lahko ponosni. To je uravnotežen rezultat, ki varuje interese kmetov kot uporabnikov krme, proizvajalcev krme in vseh drugih členov v prehranjevalni verigi.Izboljšuje preglednost in moja skupina pripisuje še posebno velik pomen vzpostavitvi registra, v katerega morajo biti vpisane surovine, ki se primešajo v krmo. Vsake toliko časa se pojavijo škandali v zvezi s hrano in tudi nova zakonodaja tega ne bo preprečila, saj nobeno evropsko pravilo ni oblikovano tako, da bi preprečilo kaznivo dejavnost, vendar bodo ta pravila pomagala zagotavljati, da bo takrat, ko se bodo ti škandali pojavili, lažje odkriti, katere sestavine so bile primešane.Mislim tudi, da je dobro, da lahko proizvajalci krme prostovoljno zagotovijo dodatne informacije, in menim, da je odličen predlog, da morajo biti take informacije, če jih navajajo, znanstveno dokazane. Prepričan sem, da ta novi zakon o krmi znatno izboljšuje varstvo in da padajoči vrstni red omogoča kmetom, da vidijo deleže posameznih sestavin krme in katera krma je najboljša za njihove živali in jo ustrezno izberejo.Še enkrat se zahvaljujem vsem tistim, ki so prispevali k oblikovanju tega dobrega poročila. ","Albert Deß,",5,261,not_available,"['ger', 'ger', 'ger', 'ger', 'ger']","['  Albert Deß,  v imenu skupine PPE-DE. – (DE) Gospod predsednik, komisarka, gospe in gospodje, v imenu skupine Evropske ljudske stranke (Krščanskih demokratov) in Evropskih demokratov ter v svojem imenu bi se rad najtopleje zahvalil našemu poročevalcu, gospodu Graefeju zu Baringdorfu. Prepričan sem, da je pristop v tem poročilu vzorčni primer parlamentarnega dela v tem parlamentu.', 'Današnje glasovanje ne vključuje nobenih sprememb, ker je bilo delo tehnično zelo premišljeno in je vključevalo celotni politični spekter. Prepričan sem, da je to eden od rezultatov, na katerega smo lahko ponosni. To je uravnotežen rezultat, ki varuje interese kmetov kot uporabnikov krme, proizvajalcev krme in vseh drugih členov v prehranjevalni verigi.', 'Izboljšuje preglednost in moja skupina pripisuje še posebno velik pomen vzpostavitvi registra, v katerega morajo biti vpisane surovine, ki se primešajo v krmo. Vsake toliko časa se pojavijo škandali v zvezi s hrano in tudi nova zakonodaja tega ne bo preprečila, saj nobeno evropsko pravilo ni oblikovano tako, da bi preprečilo kaznivo dejavnost, vendar bodo ta pravila pomagala zagotavljati, da bo takrat, ko se bodo ti škandali pojavili, lažje odkriti, katere sestavine so bile primešane.', 'Mislim tudi, da je dobro, da lahko proizvajalci krme prostovoljno zagotovijo dodatne informacije, in menim, da je odličen predlog, da morajo biti take informacije, če jih navajajo, znanstveno dokazane. Prepričan sem, da ta novi zakon o krmi znatno izboljšuje varstvo in da padajoči vrstni red omogoča kmetom, da vidijo deleže posameznih sestavin krme in katera krma je najboljša za njihove živali in jo ustrezno izberejo.', 'Še enkrat se zahvaljujem vsem tistim, ki so prispevali k oblikovanju tega dobrega poročila. ']"
5, 3. Dajanje krme v promet in njena uporaba (razprava) ,"  Rosa Miguélez Ramos,  v imenu skupine PSE. – (ES) Gospod predsednik, komisarka, kot sem že storila v Odboru za kmetijstvo in razvoj podeželja, bi rada najprej čestitala poročevalcu, poročevalcem v senci iz drugih političnih skupin in tudi Svetu za opravljeno delo.To delo nam je omogočilo, da smo dosegli sporazum na prvi obravnavi, poleg tega pa je bil to odličen uvajalni proces za postopek soodločanja, ki bo v bližnji prihodnosti standardna praksa našega odbora.Gospe in gospodje, danes ureja zakonodajo o gibanju surovin za krmo in krmne mešanice za živali, tudi hišne ljubljenčke (sektor, ki pomeni približno 50 milijard EUR v trgovini na ravni Skupnosti), nekaj direktiv in kakšnih 50 sprememb in izvedbenih aktov.Poenostavitev zakonodaje in njena usklajena uporaba sta glavna cilja, ki bosta nedvomno dosežena s to uredbo.Parlamentarni Odbor za kmetijstvo in razvoj podeželja je že leta 2006 razpravljal o dajanju živalske krme v promet. Vsi se bomo spomnili, da smo soglasno prosili Evropsko komisijo, naj skuša v prihodnjih pregledih najti pošteno ravnovesje med interesi kmetov pri pridobivanju podrobnih informacij o sestavinah krme in interesi industrije pri zagotavljanju zadostnega varstva njenega znanja in izkušenj.Kompromis, dosežen o glavnih občutljivih točkah predloga Komisije, to sta odprta deklaracija o surovinah in oblikovanje seznama Komisije za surovine, je po mojem mnenju dober odraz tega ravnotežja. Dokaz tega je odobravanje, ki ga je kompromis dobil pri vseh sodelujočih.Z odprto deklaracijo je kompromis pravzaprav zavaroval pravice kupcev, da so informirani, in proizvajalcev, da ohranijo lastništvo svojega znanja in izkušenj, z navedbo, da se informacije zagotovijo brez poseganja v direktivo o pravicah intelektualne lastnine iz leta 2004.Ni dvoma, gospe in gospodje, da morajo biti v odnosu zaupanja med dobaviteljem in uporabnikom znane formule, vendar ne bi bilo logično, da bi bilo obvezno dati recept prvi stranki, ki bi prišla skozi vrata. Številni od nas že dolga leta pijemo coca-colo. Čeprav ne poznamo njenega recepta, to ne pomeni, da dvomimo, da so upoštevane značilnosti proizvoda in da so spoštovani zdravstveni standardi.Prej omenjeni sklep Sodišča Evropskih skupnosti izrecno določa, da obveznost informiranja kupcev o natančni sestavi krme, če to zahtevajo, ni utemeljena z zaželenim ciljem varovanja zdravja.Ob tem, ko to pravim, vas moram spomniti, da bodo imeli pristojni organi kadar koli dostop do točne sestave in, kot je določeno v doseženem kompromisu, bo vsak nujni primer v zvezi z zdravjem ljudi in živali ali okoljem pomenil, da bodo imeli kupci dostop do točnih informacij o sestavi zadevne krme, potem ko bodo upoštevani legitimni interesi proizvajalcev in kupcev.Seznam dobrih praks označevanja ostaja za strokovnjake v sektorju prostovoljen in nikakor ni postal pozitivni seznam surovin za proizvodnjo krmnih mešanic, ker to ni nekaj, kar bi se zahtevalo.Zakonodaja bo na zahtevo Evropskega parlamenta vključila novo prilogo s seznamom surovin za živalsko krmo, katerih dajanje na trg je prepovedano ali omejeno. Informacije v prilogi ali seznamu lahko Komisija posodablja.Skupina socialdemokratov v Evropskem parlamentu, ki jo zastopam, podpira doseženi kompromis in ni vložila nobene spremembe za plenarno zasedanje. V celoti podpiramo stališče, ki je bilo danes predstavljeno v tem parlamentu in tako bomo glasovali za. ","Rosa Miguélez Ramos,",13,512,not_available,"['spa', 'spa', 'spa', 'spa', 'spa', 'spa', 'spa', 'spa', 'spa', 'spa', 'spa', 'spa', 'spa']","['  Rosa Miguélez Ramos,  v imenu skupine PSE. – (ES) Gospod predsednik, komisarka, kot sem že storila v Odboru za kmetijstvo in razvoj podeželja, bi rada najprej čestitala poročevalcu, poročevalcem v senci iz drugih političnih skupin in tudi Svetu za opravljeno delo.', 'To delo nam je omogočilo, da smo dosegli sporazum na prvi obravnavi, poleg tega pa je bil to odličen uvajalni proces za postopek soodločanja, ki bo v bližnji prihodnosti standardna praksa našega odbora.', 'Gospe in gospodje, danes ureja zakonodajo o gibanju surovin za krmo in krmne mešanice za živali, tudi hišne ljubljenčke (sektor, ki pomeni približno 50 milijard EUR v trgovini na ravni Skupnosti), nekaj direktiv in kakšnih 50 sprememb in izvedbenih aktov.', 'Poenostavitev zakonodaje in njena usklajena uporaba sta glavna cilja, ki bosta nedvomno dosežena s to uredbo.', 'Parlamentarni Odbor za kmetijstvo in razvoj podeželja je že leta 2006 razpravljal o dajanju živalske krme v promet. Vsi se bomo spomnili, da smo soglasno prosili Evropsko komisijo, naj skuša v prihodnjih pregledih najti pošteno ravnovesje med interesi kmetov pri pridobivanju podrobnih informacij o sestavinah krme in interesi industrije pri zagotavljanju zadostnega varstva njenega znanja in izkušenj.', 'Kompromis, dosežen o glavnih občutljivih točkah predloga Komisije, to sta odprta deklaracija o surovinah in oblikovanje seznama Komisije za surovine, je po mojem mnenju dober odraz tega ravnotežja. Dokaz tega je odobravanje, ki ga je kompromis dobil pri vseh sodelujočih.', 'Z odprto deklaracijo je kompromis pravzaprav zavaroval pravice kupcev, da so informirani, in proizvajalcev, da ohranijo lastništvo svojega znanja in izkušenj, z navedbo, da se informacije zagotovijo brez poseganja v direktivo o pravicah intelektualne lastnine iz leta 2004.', 'Ni dvoma, gospe in gospodje, da morajo biti v odnosu zaupanja med dobaviteljem in uporabnikom znane formule, vendar ne bi bilo logično, da bi bilo obvezno dati recept prvi stranki, ki bi prišla skozi vrata. Številni od nas že dolga leta pijemo coca-colo. Čeprav ne poznamo njenega recepta, to ne pomeni, da dvomimo, da so upoštevane značilnosti proizvoda in da so spoštovani zdravstveni standardi.', 'Prej omenjeni sklep Sodišča Evropskih skupnosti izrecno določa, da obveznost informiranja kupcev o natančni sestavi krme, če to zahtevajo, ni utemeljena z zaželenim ciljem varovanja zdravja.', 'Ob tem, ko to pravim, vas moram spomniti, da bodo imeli pristojni organi kadar koli dostop do točne sestave in, kot je določeno v doseženem kompromisu, bo vsak nujni primer v zvezi z zdravjem ljudi in živali ali okoljem pomenil, da bodo imeli kupci dostop do točnih informacij o sestavi zadevne krme, potem ko bodo upoštevani legitimni interesi proizvajalcev in kupcev.', 'Seznam dobrih praks označevanja ostaja za strokovnjake v sektorju prostovoljen in nikakor ni postal pozitivni seznam surovin za proizvodnjo krmnih mešanic, ker to ni nekaj, kar bi se zahtevalo.', 'Zakonodaja bo na zahtevo Evropskega parlamenta vključila novo prilogo s seznamom surovin za živalsko krmo, katerih dajanje na trg je prepovedano ali omejeno. Informacije v prilogi ali seznamu lahko Komisija posodablja.', 'Skupina socialdemokratov v Evropskem parlamentu, ki jo zastopam, podpira doseženi kompromis in ni vložila nobene spremembe za plenarno zasedanje. V celoti podpiramo stališče, ki je bilo danes predstavljeno v tem parlamentu in tako bomo glasovali za. ']"
