,agenda_item,text,speaker,number_p,number_w,chair,language_ps,ps
153, 11.1. Razmere na Šrilanki,"  Charles Tannock,  avtor. − Gospa predsednica, zdi se, da se šrilanška krvava državljanska vojna približuje koncu. LTTE, ki jih je EU dala na črno listo kot teroristično organizacijo, morajo zdaj zares odložiti orožje in se predati. EU in drugi sopredsedujoči so pozvali LTTE, naj to storijo. Odziv LTTE nam bo pokazal, ali imajo v srcu res najboljše interese Tamilcev.LTTE uporabljajo svoje frontne organizacije v Evropi za največji možni učinek propagande in zbiranje denarja z mednarodnim izsiljevanjem. Nekateri bojevniki LTTE lahko celo poskusijo zaprositi za azil v Evropski uniji.Ves čas te krute 26-letne državljanske vojne so LTTE utirali pot krutim terorističnim taktikam, kot so samomorilski bombni napadi, ki se zdaj, na žalost, uporabljajo v številnih delih sveta. Šrilanška vojska je zato morala uporabiti vsa sredstva, ki jih je imela na voljo, da je preprečevala to brutalno vstajo. Vendar je jasno, da so številke o žrtvah, na katere se sklicujejo LTTE, pretirane. Nekateri, na primer Agence Presse, so zdaj umaknili zgodbo o 300 ubitih civilistih, potem ko je domnevni avtor zanikal avtorstvo. Kakor koli, smrt civilistov v vojnem območju je vedno tragična, pa ni važno, kdaj in kje se pojavi.Jasno je, da si tudi šrilanške oborožene sile ne morejo lastiti brezmadežne kartoteke, vendar niso namenoma izkoriščale civilistov in jim škodovale tako, kot so to domnevno počeli LTTE.Če naj bi se vojna res kmalu končala, je bistveno, da Šrilanka zdaj po spopadu usmeri pozornost na razorožitev, demobilizacijo in ponovno združitev. Odrinjenost Tamilcev na rob družbe na račun večinskih Singalcev je treba nujno in trajno reševati, da bi zagotovili stabilno in trajnostno večetnično družbo z regionalnim prenosom pristojnosti.EU bi morala poskrbeti tudi za to, da so Šrilanki dana na voljo sredstva v podporo razvoju po spopadu. Čeprav moramo podpirati vladno ponudbo za pomilostitev večine LTTE, je bistveno, da se nikomur, ki je odgovoren za najhujše vojne zločine, ne bo dovolilo, da bi jo odnesel nekaznovan. ","Charles Tannock,",6,316,not_available,"['slv', 'slv', 'slv', 'slv', 'slv', 'slv']","['  Charles Tannock,  avtor. − Gospa predsednica, zdi se, da se šrilanška krvava državljanska vojna približuje koncu. LTTE, ki jih je EU dala na črno listo kot teroristično organizacijo, morajo zdaj zares odložiti orožje in se predati. EU in drugi sopredsedujoči so pozvali LTTE, naj to storijo. Odziv LTTE nam bo pokazal, ali imajo v srcu res najboljše interese Tamilcev.', 'LTTE uporabljajo svoje frontne organizacije v Evropi za največji možni učinek propagande in zbiranje denarja z mednarodnim izsiljevanjem. Nekateri bojevniki LTTE lahko celo poskusijo zaprositi za azil v Evropski uniji.', 'Ves čas te krute 26-letne državljanske vojne so LTTE utirali pot krutim terorističnim taktikam, kot so samomorilski bombni napadi, ki se zdaj, na žalost, uporabljajo v številnih delih sveta. Šrilanška vojska je zato morala uporabiti vsa sredstva, ki jih je imela na voljo, da je preprečevala to brutalno vstajo. Vendar je jasno, da so številke o žrtvah, na katere se sklicujejo LTTE, pretirane. Nekateri, na primer Agence Presse, so zdaj umaknili zgodbo o 300 ubitih civilistih, potem ko je domnevni avtor zanikal avtorstvo. Kakor koli, smrt civilistov v vojnem območju je vedno tragična, pa ni važno, kdaj in kje se pojavi.', 'Jasno je, da si tudi šrilanške oborožene sile ne morejo lastiti brezmadežne kartoteke, vendar niso namenoma izkoriščale civilistov in jim škodovale tako, kot so to domnevno počeli LTTE.', 'Če naj bi se vojna res kmalu končala, je bistveno, da Šrilanka zdaj po spopadu usmeri pozornost na razorožitev, demobilizacijo in ponovno združitev. Odrinjenost Tamilcev na rob družbe na račun večinskih Singalcev je treba nujno in trajno reševati, da bi zagotovili stabilno in trajnostno večetnično družbo z regionalnim prenosom pristojnosti.', 'EU bi morala poskrbeti tudi za to, da so Šrilanki dana na voljo sredstva v podporo razvoju po spopadu. Čeprav moramo podpirati vladno ponudbo za pomilostitev večine LTTE, je bistveno, da se nikomur, ki je odgovoren za najhujše vojne zločine, ne bo dovolilo, da bi jo odnesel nekaznovan. ']"
154, 11.1. Razmere na Šrilanki,"  Marios Matsakis,  avtor. − Gospa predsednica, Šrilanko so desetletja pestili notranji boji. Ta tragičen položaj je nastal kot posledica oboroženega spopada predvsem med separatističnimi uporniškimi silami na severu in šrilanško vojsko. Med tem bojevanjem je bilo ubitih in ranjenih na tisoče nedolžnih ljudi in povzročeno je bilo veliko uničevanja lastnine, infrastrukture in okolja.To žalostno stanje dogodkov se je v zadnjih mesecih stopnjevalo, v glavnem zaradi obsežne vladne vojaške ofenzive proti Tamilskim tigrom. Poročila, ki prihajajo iz Šrilanke, navajajo, da se je položaj v nekaterih območjih v zadnjih tednih tragično poslabšal, s stotinami notranje razseljenih civilistov, ki so se znašli v bojih. Po podatkih Amnesty International so se dogajale kršitve mednarodnih konvencij in človekovih pravic na obeh straneh, pri vladnih silah in Tamilskih tigrih.Priznati je treba, da je v takšnih okoliščinah zelo težko biti povsem prepričan, koga je treba kriviti za tragične dogodke v Šrilanki, vendar moramo pozvati obe strani, da se zadržita in se kar najbolj posvetita nedolžnim civilistom in jih upoštevata ter spoštujeta vojne konvencije.Ker ima šrilanška vlada roko nad stanjem in je mednarodno priznana oblast v državi, mora biti po nujnosti in logiki naš poziv usmerjen predvsem k njej. Hkrati moramo pozvati voditelje Tamilskih tigrov, naj spoštujejo pozive mednarodne skupnosti, izkoristijo vladno ponudbo pomilostitve, se odpovedo nasilju in skušajo doseči svoje cilje s političnim dialogom.Še enkrat moramo poudariti nasvet, da bojevanje ne rešuje problemov in da je trajen mir in stabilnost mogoče doseči samo za pogajalsko mizo, kar se bo prej ali slej neizogibno zgodilo. V teh pogajanjih bodo potrebni kompromisi na obeh straneh in našla se bo rešitev, ki bo koristila državljanom te čudovite dežele. Upamo, da bomo s to resolucijo pomagali zmanjšati trpljenje šrilanškega ljudstva in dosegli tako potreben mir v tej državi. ","Marios Matsakis,",5,290,not_available,"['slv', 'slv', 'slv', 'slv', 'slv']","['  Marios Matsakis,  avtor. − Gospa predsednica, Šrilanko so desetletja pestili notranji boji. Ta tragičen položaj je nastal kot posledica oboroženega spopada predvsem med separatističnimi uporniškimi silami na severu in šrilanško vojsko. Med tem bojevanjem je bilo ubitih in ranjenih na tisoče nedolžnih ljudi in povzročeno je bilo veliko uničevanja lastnine, infrastrukture in okolja.', 'To žalostno stanje dogodkov se je v zadnjih mesecih stopnjevalo, v glavnem zaradi obsežne vladne vojaške ofenzive proti Tamilskim tigrom. Poročila, ki prihajajo iz Šrilanke, navajajo, da se je položaj v nekaterih območjih v zadnjih tednih tragično poslabšal, s stotinami notranje razseljenih civilistov, ki so se znašli v bojih. Po podatkih Amnesty International so se dogajale kršitve mednarodnih konvencij in človekovih pravic na obeh straneh, pri vladnih silah in Tamilskih tigrih.', 'Priznati je treba, da je v takšnih okoliščinah zelo težko biti povsem prepričan, koga je treba kriviti za tragične dogodke v Šrilanki, vendar moramo pozvati obe strani, da se zadržita in se kar najbolj posvetita nedolžnim civilistom in jih upoštevata ter spoštujeta vojne konvencije.', 'Ker ima šrilanška vlada roko nad stanjem in je mednarodno priznana oblast v državi, mora biti po nujnosti in logiki naš poziv usmerjen predvsem k njej. Hkrati moramo pozvati voditelje Tamilskih tigrov, naj spoštujejo pozive mednarodne skupnosti, izkoristijo vladno ponudbo pomilostitve, se odpovedo nasilju in skušajo doseči svoje cilje s političnim dialogom.', 'Še enkrat moramo poudariti nasvet, da bojevanje ne rešuje problemov in da je trajen mir in stabilnost mogoče doseči samo za pogajalsko mizo, kar se bo prej ali slej neizogibno zgodilo. V teh pogajanjih bodo potrebni kompromisi na obeh straneh in našla se bo rešitev, ki bo koristila državljanom te čudovite dežele. Upamo, da bomo s to resolucijo pomagali zmanjšati trpljenje šrilanškega ljudstva in dosegli tako potreben mir v tej državi. ']"
155, 11.1. Razmere na Šrilanki,"  Robert Evans,  avtor. − Gospa predsednica, skupina socialdemokratov v tem parlamentu uradno zavrača sodelovanje pri tem glasovanju o Šrilanki. Prejšnji mesec je imel Parlament celovito razpravo z izjavama Sveta in Komisije o položaju v Gazi. Na tej strani Parlamenta dajemo enak pomen Šrilanki in smo prepričani, da si zasluži enako in ustrezno razpravo, vendar obžalujem, da nas ni niti ena druga skupina podprla v tem stališču.Kratka razprava danes popoldne s peščico ljudi v četrtek je žalitev za tisoče napadenih ljudi, ki umirajo na severu Šrilanke. Hoteli smo, tako kot pri skupni izjavi ZDA in Združenega kraljestva iz Washingtona na začetku tega tedna, pozvati k takojšnji in brezpogojni prekinitvi ognja na obeh straneh, vendar je PPE zavrnila vključitev tega v besedilo.Hoteli smo brez pridržkov obsoditi bombardiranje bolnišnic in borcev za človekove pravice, a gospod Van Orden, ki se pogaja za PPE, tega ni hotel obsoditi. Zato tega ni v resoluciji, ki jo imate pred seboj. Zanj in verjetno tudi za dr. Tannocka je vse, kar pravi šrilanška vlada, dejstvo in se lahko vse humanitarne organizacije, od Rdečega križa do ZN, odpustijo. Amnesty International danes omenja, da bi bila lahko šrilanška vojska kriva vojnih zločinov zaradi uporabe kasetnih bomb na bolnišnicah, po navedbah Amnesty International v 16-urnem bombardiranju.PSE je hotela obsoditi tudi pomore novinarjev in drugih predstavnikov medijev s strani vladnih agentov. Odstavek 4 resolucije naproša vlado, prav to isto šrilanško vlado, naj razišče svoje lastne kršitve človekovih pravic.Kolegi, nekaterim od vas je morda prav, če vas in vaše skupine povezujejo s tovrstnimi razmišljanji, no, nam pa ni. Glasujte za to besedilo in oprostili boste napade na bolnišnice in prezrli obtožbe o vojnih zločinih. Opazil sem, da se gospod Van Orden ni upal stopiti sem in zagovarjati svojega prekletega izdelka, vendar sem rahlo presenečen. V naših pogajanjih je samo zavračal in se posmehoval domnevam o posiljevanju s strani šrilanških vojakov, kaj bi torej lahko pričakovali?Na Bližnjem vzhodu so milijoni ljudi, tudi številni judi, ogorčeni nad tem, kar je storil Izrael Gazi, pa zaradi tega še niso privrženci Hamasa. Žalostno, a vsakdo, ki ne podpira šrilanške vlade, je označen za zagovornika terorizma in privrženca LTTE.Vseeno pa je naš predlog kritičen do LTTE in njihovih taktik. Obsojamo njihove napade in bi radi, da Tamilski tigri sedejo za pogajalsko mizo, vendar se mora ta vojna takoj končati. Vlada mora ustaviti svojo vojaško kampanjo, ki je povzročila, kot so že drugi povedali, humanitarno katastrofo na tisoče navadnih ljudi na severu otoka.Na žalost ta resolucija ne poziva k takojšnjemu koncu bojev, zato ne bomo podprli tega pristopa z udeležbo na današnjem glasovanju. Predsednik in kolegi, ograjujemo se od tega predloga in pozivam vse druge z enakimi pogledi, da storijo enako. ","Robert Evans,",8,450,not_available,"['slv', 'slv', 'slv', 'slv', 'slv', 'slv', 'slv', 'slv']","['  Robert Evans,  avtor. − Gospa predsednica, skupina socialdemokratov v tem parlamentu uradno zavrača sodelovanje pri tem glasovanju o Šrilanki. Prejšnji mesec je imel Parlament celovito razpravo z izjavama Sveta in Komisije o položaju v Gazi. Na tej strani Parlamenta dajemo enak pomen Šrilanki in smo prepričani, da si zasluži enako in ustrezno razpravo, vendar obžalujem, da nas ni niti ena druga skupina podprla v tem stališču.', 'Kratka razprava danes popoldne s peščico ljudi v četrtek je žalitev za tisoče napadenih ljudi, ki umirajo na severu Šrilanke. Hoteli smo, tako kot pri skupni izjavi ZDA in Združenega kraljestva iz Washingtona na začetku tega tedna, pozvati k takojšnji in brezpogojni prekinitvi ognja na obeh straneh, vendar je PPE zavrnila vključitev tega v besedilo.', 'Hoteli smo brez pridržkov obsoditi bombardiranje bolnišnic in borcev za človekove pravice, a gospod Van Orden, ki se pogaja za PPE, tega ni hotel obsoditi. Zato tega ni v resoluciji, ki jo imate pred seboj. Zanj in verjetno tudi za dr. Tannocka je vse, kar pravi šrilanška vlada, dejstvo in se lahko vse humanitarne organizacije, od Rdečega križa do ZN, odpustijo. Amnesty International danes omenja, da bi bila lahko šrilanška vojska kriva vojnih zločinov zaradi uporabe kasetnih bomb na bolnišnicah, po navedbah Amnesty International v 16-urnem bombardiranju.', 'PSE je hotela obsoditi tudi pomore novinarjev in drugih predstavnikov medijev s strani vladnih agentov. Odstavek 4 resolucije naproša vlado, prav to isto šrilanško vlado, naj razišče svoje lastne kršitve človekovih pravic.', 'Kolegi, nekaterim od vas je morda prav, če vas in vaše skupine povezujejo s tovrstnimi razmišljanji, no, nam pa ni. Glasujte za to besedilo in oprostili boste napade na bolnišnice in prezrli obtožbe o vojnih zločinih. Opazil sem, da se gospod Van Orden ni upal stopiti sem in zagovarjati svojega prekletega izdelka, vendar sem rahlo presenečen. V naših pogajanjih je samo zavračal in se posmehoval domnevam o posiljevanju s strani šrilanških vojakov, kaj bi torej lahko pričakovali?', 'Na Bližnjem vzhodu so milijoni ljudi, tudi številni judi, ogorčeni nad tem, kar je storil Izrael Gazi, pa zaradi tega še niso privrženci Hamasa. Žalostno, a vsakdo, ki ne podpira šrilanške vlade, je označen za zagovornika terorizma in privrženca LTTE.', 'Vseeno pa je naš predlog kritičen do LTTE in njihovih taktik. Obsojamo njihove napade in bi radi, da Tamilski tigri sedejo za pogajalsko mizo, vendar se mora ta vojna takoj končati. Vlada mora ustaviti svojo vojaško kampanjo, ki je povzročila, kot so že drugi povedali, humanitarno katastrofo na tisoče navadnih ljudi na severu otoka.', 'Na žalost ta resolucija ne poziva k takojšnjemu koncu bojev, zato ne bomo podprli tega pristopa z udeležbo na današnjem glasovanju. Predsednik in kolegi, ograjujemo se od tega predloga in pozivam vse druge z enakimi pogledi, da storijo enako. ']"
156, 11.1. Razmere na Šrilanki,"  Raül Romeva i Rueda,  avtor. − (ES) Za začetek bom povedal, da dokončno dogovorjena resolucija ni niti malo takšna, kot bi jo jaz pripravil. Prepričan sem, da ji škodi pretirana samovšečnost v zvezi z vlado v Colombu. Bojim se, da je to še en primer poenostavljanja, kriminalizacije in nadaljnjega preganjanja skupine s preprosto utemeljitvijo, da je to teroristična skupina. V resnici so stvari mnogo bolj zapletene.Kljub temu res verjamem, da je sedanji položaj takšen, da bi moral Parlament poslati jasna sporočila o nekaterih vprašanjih. Na primer, ena od ključnih točk, za katero menim, da bi jo bilo treba poudariti, je poziv Tokia, da morata obe strani, torej LTTE (Osvobodilni tigri tamilskega Eelama) in vlada, razumeti, da se je treba dogovoriti za prekinitev ognja, da bo možen prihod humanitarne pomoči in da se bodo lahko evakuirali ranjeni in bolni.Drugič, mislim, da je bistveno, da se spomnimo, da vojaška rešitev ni možna, gospod Tannock. To se ne more zgoditi, to preprosto ni mogoče.Zdaj je torej čas za pogajanje o pogojih glede prenehanja nasilja, demobilizaciji in razorožitvi. A da bi se to zgodilo, si vlada ne sme več prizadevati za vojaško zmago, ker s tem samo podaljšuje trpljenje številnih ljudi.Poteza dobre volje bi bila na primer, če bi dovolili neodvisnim medijem in humanitarnemu osebju, da pridejo na sever.Poleg tega pa sem v zvezi s splošnim sistemom preferencialov plus, GSP Plus, eden tistih, ki menijo, da ga ne bi smeli nikoli dodeliti državi, kakršna je Šrilanka, glede na resne in nenehne kršitve temeljnih človekovih pravic v državi, številne od teh kršitev pa spodbujajo vladne oblasti. Mislim, da bi morali resno razmisliti o odprtju poglobljene razprave o ustreznosti uporabe tega preferenčnega okvira in predvsem o posledicah, ki jih ima za številne skupine, tudi za delavce.Iz teh razlogov pozivam Evropsko komisijo, da opravi preiskavo na mestu samem in ugotovi učinke ukrepa in ga po potrebi revidira. ","Raül Romeva i Rueda,",7,315,not_available,"['spa', 'spa', 'spa', 'spa', 'spa', 'spa', 'spa']","['  Raül Romeva i Rueda,  avtor. − (ES) Za začetek bom povedal, da dokončno dogovorjena resolucija ni niti malo takšna, kot bi jo jaz pripravil. Prepričan sem, da ji škodi pretirana samovšečnost v zvezi z vlado v Colombu. Bojim se, da je to še en primer poenostavljanja, kriminalizacije in nadaljnjega preganjanja skupine s preprosto utemeljitvijo, da je to teroristična skupina. V resnici so stvari mnogo bolj zapletene.', 'Kljub temu res verjamem, da je sedanji položaj takšen, da bi moral Parlament poslati jasna sporočila o nekaterih vprašanjih. Na primer, ena od ključnih točk, za katero menim, da bi jo bilo treba poudariti, je poziv Tokia, da morata obe strani, torej LTTE (Osvobodilni tigri tamilskega Eelama) in vlada, razumeti, da se je treba dogovoriti za prekinitev ognja, da bo možen prihod humanitarne pomoči in da se bodo lahko evakuirali ranjeni in bolni.', 'Drugič, mislim, da je bistveno, da se spomnimo, da vojaška rešitev ni možna, gospod Tannock. To se ne more zgoditi, to preprosto ni mogoče.', 'Zdaj je torej čas za pogajanje o pogojih glede prenehanja nasilja, demobilizaciji in razorožitvi. A da bi se to zgodilo, si vlada ne sme več prizadevati za vojaško zmago, ker s tem samo podaljšuje trpljenje številnih ljudi.', 'Poteza dobre volje bi bila na primer, če bi dovolili neodvisnim medijem in humanitarnemu osebju, da pridejo na sever.', 'Poleg tega pa sem v zvezi s splošnim sistemom preferencialov plus, GSP Plus, eden tistih, ki menijo, da ga ne bi smeli nikoli dodeliti državi, kakršna je Šrilanka, glede na resne in nenehne kršitve temeljnih človekovih pravic v državi, številne od teh kršitev pa spodbujajo vladne oblasti. Mislim, da bi morali resno razmisliti o odprtju poglobljene razprave o ustreznosti uporabe tega preferenčnega okvira in predvsem o posledicah, ki jih ima za številne skupine, tudi za delavce.', 'Iz teh razlogov pozivam Evropsko komisijo, da opravi preiskavo na mestu samem in ugotovi učinke ukrepa in ga po potrebi revidira. ']"
157, 11.1. Razmere na Šrilanki,"  Ewa Tomaszewska,  avtorica. – (PL) Gospa predsednica, državljanska vojna v Šrilanki traja 25 let. V sporu je umrlo več kot 70 000 ljudi. Danes plačuje strašno ceno te vojne med šrilanško vladno vojsko in silami Tamilskih tigrov na območju približno 300 km2 okrog 250 000 civilistov. Od sredine januarja je na območju spopada umrlo na stotine nemočnih ljudi. V času, ko je bolnišnico bombardiralo topništvo, je bilo v njej okrog 500 ljudi.Po navedbah Mednarodnega Rdečega križa so granate zadevale pediatrični oddelek. Prestrašeni ljudje se bojijo bežati kljub 48-urni prekinitvi ognja, ki jo je objavila vlada. Bojijo se smrti ali poškodbe. Obe strani v spopadu sta usmerili pozornost na kršitve človekovih pravic, ki jih je zagrešila druga stran, in obe strani sta kršili te pravice. Vlada napoveduje, da je blizu zmaga nad Tamilci. Ljudje, ki so ujeti v zanko med obema vojskama, morda ne bodo živeli tako dolgo, da bi dočakali konec sovražnosti.Pozivamo obe strani spopada, da čimbolj zmanjšata civilne izgube in začneta mirovna pogajanja. ","Ewa Tomaszewska,",3,166,not_available,"['pol', 'pol', 'pol']","['  Ewa Tomaszewska,  avtorica. – (PL) Gospa predsednica, državljanska vojna v Šrilanki traja 25 let. V sporu je umrlo več kot 70 000 ljudi. Danes plačuje strašno ceno te vojne med šrilanško vladno vojsko in silami Tamilskih tigrov na območju približno 300 km2 okrog 250 000 civilistov. Od sredine januarja je na območju spopada umrlo na stotine nemočnih ljudi. V času, ko je bolnišnico bombardiralo topništvo, je bilo v njej okrog 500 ljudi.', 'Po navedbah Mednarodnega Rdečega križa so granate zadevale pediatrični oddelek. Prestrašeni ljudje se bojijo bežati kljub 48-urni prekinitvi ognja, ki jo je objavila vlada. Bojijo se smrti ali poškodbe. Obe strani v spopadu sta usmerili pozornost na kršitve človekovih pravic, ki jih je zagrešila druga stran, in obe strani sta kršili te pravice. Vlada napoveduje, da je blizu zmaga nad Tamilci. Ljudje, ki so ujeti v zanko med obema vojskama, morda ne bodo živeli tako dolgo, da bi dočakali konec sovražnosti.', 'Pozivamo obe strani spopada, da čimbolj zmanjšata civilne izgube in začneta mirovna pogajanja. ']"
158, 11.1. Razmere na Šrilanki,"  Thomas Mann,  v imenu skupine PPE-DE. – (DE) Gospa predsednica, kot član delegacije SAARC sem lahko nekajkrat obiskal Šrilanko. Sam sem videl na terenu, koliko je prebivalstvo pretrpelo zaradi državljanske vojne, ki traja že 25 let in je zahtevala 70 000 življenj. Boji med vladnimi silami in LTTE se še naprej stopnjujejo. Veliki deli na severu so prišli pod nadzor in utrdbe tamilskih upornikov so zavzete.Kar so mi takrat povedale organizacije za človekove pravice v Colombu in Jaffni, se je na žalost vedno znova potrdilo: „vojna je institucija“. Humanitarne razmere so zaskrbljujoče. Obstaja na tisoče beguncev. Manjka medicinske oskrbe in hrane. Organizacijam za pomoč je treba dati neomejen dostop do civilnega prebivalstva med prekinitvijo ognja, za katero se je treba dogovoriti. Vlada je določila koridorje za olajšanje evakuacije civilistov iz bojnih območij; nepojmljivo je, da Tamilski tigri niso upoštevali te varne cone, da še naprej obstreljujejo in uporabljajo ljudi kot človeške ščite.Tokijska skupina, ki jo sestavljajo Japonska, Združene države, Norveška in Evropska unija, je pozvala vodstvo LTTE, naj se končno pogovori s šrilanško vlado o podrobnostih glede prekinitve ognja. Začetek mirovnega procesa je v interesu vseh, tudi Tamilcev. Izrecno pozdravljam odločitev vlade, da izpolni zahteve 13. spremembe šrilanške ustave in izroči pristojni pokrajinski svet izvoljenim predstavnikom na severu in vzhodu. Pričakujemo tudi, da bo spoštovala zagotovilo o skrbni, nevtralni preiskavi kršitev človekovih pravic, o katerih smo pravkar razpravljali, in kršitev svobode tiska. Varnost in stabilnost za Šrilančane ne bi smele ostati neuresničljive sanje. ","Thomas Mann,",3,245,not_available,"['ger', 'ger', 'ger']","['  Thomas Mann,  v imenu skupine PPE-DE. – (DE) Gospa predsednica, kot član delegacije SAARC sem lahko nekajkrat obiskal Šrilanko. Sam sem videl na terenu, koliko je prebivalstvo pretrpelo zaradi državljanske vojne, ki traja že 25 let in je zahtevala 70 000 življenj. Boji med vladnimi silami in LTTE se še naprej stopnjujejo. Veliki deli na severu so prišli pod nadzor in utrdbe tamilskih upornikov so zavzete.', 'Kar so mi takrat povedale organizacije za človekove pravice v Colombu in Jaffni, se je na žalost vedno znova potrdilo: „vojna je institucija“. Humanitarne razmere so zaskrbljujoče. Obstaja na tisoče beguncev. Manjka medicinske oskrbe in hrane. Organizacijam za pomoč je treba dati neomejen dostop do civilnega prebivalstva med prekinitvijo ognja, za katero se je treba dogovoriti. Vlada je določila koridorje za olajšanje evakuacije civilistov iz bojnih območij; nepojmljivo je, da Tamilski tigri niso upoštevali te varne cone, da še naprej obstreljujejo in uporabljajo ljudi kot človeške ščite.', 'Tokijska skupina, ki jo sestavljajo Japonska, Združene države, Norveška in Evropska unija, je pozvala vodstvo LTTE, naj se končno pogovori s šrilanško vlado o podrobnostih glede prekinitve ognja. Začetek mirovnega procesa je v interesu vseh, tudi Tamilcev. Izrecno pozdravljam odločitev vlade, da izpolni zahteve 13. spremembe šrilanške ustave in izroči pristojni pokrajinski svet izvoljenim predstavnikom na severu in vzhodu. Pričakujemo tudi, da bo spoštovala zagotovilo o skrbni, nevtralni preiskavi kršitev človekovih pravic, o katerih smo pravkar razpravljali, in kršitev svobode tiska. Varnost in stabilnost za Šrilančane ne bi smele ostati neuresničljive sanje. ']"
