,agenda_item,text,speaker,number_p,number_w,chair,language_ps,ps
94, 6. Obrazložitev glasovanja,"  Nils Lundgren  (IND/DEM),  v pisni obliki. − (SV) To poročilo vsebuje več točk, ki jih v celoti podpiram, na primer dejstvo, da je treba prosilce za azil obravnavati spoštljivo in jim vedno zagotoviti človekove pravice. Kritika, usmerjena v številne tako imenovane sprejemne centre, je upravičena. Številne evropske države niso sposobne na spoštljiv način sprejeti prosilcev za azil in beguncev.Vendar vsebuje poročilo nekaj točk, ki jih ne morem podpreti. Bistveni cilj poročila je, da bi morala imeti EU skupno politiko priseljevanja in azila. Med drugim poziva države članice, naj podprejo tiste države EU, ki se „soočajo z največjimi izzivi priseljevanja“. Junijska lista meni, da je politika azila in priseljevanja stvar držav članic, pod pogojem, da se spoštujejo mednarodne konvencije in sporazumi. Skupna politika priseljevanja in azila bi povzročila tveganje nastanka „trdnjave Evrope“, o čemer se danes že kažejo jasni znaki. ","Nils Lundgren  (IND/DEM),",2,140,not_available,"['slv', 'slv']","['  Nils Lundgren  (IND/DEM),  v pisni obliki. − (SV) To poročilo vsebuje več točk, ki jih v celoti podpiram, na primer dejstvo, da je treba prosilce za azil obravnavati spoštljivo in jim vedno zagotoviti človekove pravice. Kritika, usmerjena v številne tako imenovane sprejemne centre, je upravičena. Številne evropske države niso sposobne na spoštljiv način sprejeti prosilcev za azil in beguncev.', 'Vendar vsebuje poročilo nekaj točk, ki jih ne morem podpreti. Bistveni cilj poročila je, da bi morala imeti EU skupno politiko priseljevanja in azila. Med drugim poziva države članice, naj podprejo tiste države EU, ki se „soočajo z največjimi izzivi priseljevanja“. Junijska lista meni, da je politika azila in priseljevanja stvar držav članic, pod pogojem, da se spoštujejo mednarodne konvencije in sporazumi. Skupna politika priseljevanja in azila bi povzročila tveganje nastanka „trdnjave Evrope“, o čemer se danes že kažejo jasni znaki. ']"
95, 6. Obrazložitev glasovanja,"  Mairead McGuinness  (PPE-DE),  v pisni obliki. − Vzdržala sem se glasovanja o tem poročilu, ker Irska ni sodelovala pri sprejetju Direktive iz leta 2003.Glavni razlog za to stališče se nanaša na dostop prosilcev za azil do trga dela.Prepoved prosilcem za azil, da bi vstopili na trg dela, naj bi bila ponovno sprejeta v zakonu, ki ga trenutno obravnava predstavniški dom Dáil. ","Mairead McGuinness  (PPE-DE),",3,63,not_available,"['slv', 'slv', 'slv']","['  Mairead McGuinness  (PPE-DE),  v pisni obliki. − Vzdržala sem se glasovanja o tem poročilu, ker Irska ni sodelovala pri sprejetju Direktive iz leta 2003.', 'Glavni razlog za to stališče se nanaša na dostop prosilcev za azil do trga dela.', 'Prepoved prosilcem za azil, da bi vstopili na trg dela, naj bi bila ponovno sprejeta v zakonu, ki ga trenutno obravnava predstavniški dom Dáil. ']"
96, 6. Obrazložitev glasovanja,"  Athanasios Pafilis  (GUE/NGL),  v pisni obliki. – (EL) Poročilo ne odraža resničnega obsega obupnih razmer, ki jih doživljajo begunci in priseljenci v sprejemnih centrih in centrih za pridržanje v državah članicah EU. Omejuje se na omembo tragičnih razmer, v katerih preživijo, vendar jih pripisuje slabemu izvajanju direktiv EU.Tako po eni strani podpira celotno zakonodajo in politiko EU in vlad proti priseljevanju, kot je določena v paktu o priseljevanju in dublinskem sistemu za azil, po drugi strani pa nasprotuje njenim nehumanim rezultatom. To je najmanj žaljivo za politične sile „enosmerne ceste“ v Evropo, ki so v Evropskem parlamentu glasovale za direktivo, ki je ne glede na vse drugo poskrbela za pridržanje „nezakonitih“ priseljencev za celih 18 mesecev, da bi v tem poročilu izrazile svoje domnevno obžalovanje zaradi nehumanih razmer pridržanja in pozvale, naj se jih ne pridržuje.„Krokodilje solze“ Evropskega parlamenta ne morejo odvezati krivde EU za nehumano, izkoriščevalsko politiko. Celo najbolj temeljni ukrepi, da ne govorimo o ukrepih prave podpore za priseljence in begunce ter ukrepih za varovanje njihovih pravic, se lahko izvedejo samo s soočenjem in spremembo politike EU in strukture EU same. ","Athanasios Pafilis  (GUE/NGL),",3,185,not_available,"['gre', 'gre', 'gre']","['  Athanasios Pafilis  (GUE/NGL),  v pisni obliki. – (EL) Poročilo ne odraža resničnega obsega obupnih razmer, ki jih doživljajo begunci in priseljenci v sprejemnih centrih in centrih za pridržanje v državah članicah EU. Omejuje se na omembo tragičnih razmer, v katerih preživijo, vendar jih pripisuje slabemu izvajanju direktiv EU.', 'Tako po eni strani podpira celotno zakonodajo in politiko EU in vlad proti priseljevanju, kot je določena v paktu o priseljevanju in dublinskem sistemu za azil, po drugi strani pa nasprotuje njenim nehumanim rezultatom. To je najmanj žaljivo za politične sile „enosmerne ceste“ v Evropo, ki so v Evropskem parlamentu glasovale za direktivo, ki je ne glede na vse drugo poskrbela za pridržanje „nezakonitih“ priseljencev za celih 18 mesecev, da bi v tem poročilu izrazile svoje domnevno obžalovanje zaradi nehumanih razmer pridržanja in pozvale, naj se jih ne pridržuje.', '„Krokodilje solze“ Evropskega parlamenta ne morejo odvezati krivde EU za nehumano, izkoriščevalsko politiko. Celo najbolj temeljni ukrepi, da ne govorimo o ukrepih prave podpore za priseljence in begunce ter ukrepih za varovanje njihovih pravic, se lahko izvedejo samo s soočenjem in spremembo politike EU in strukture EU same. ']"
97, 6. Obrazložitev glasovanja,"  Dimitrios Papadimoulis  (GUE/NGL),  v pisni obliki. – (EL) Države članice, tudi Grčija, morajo storiti več z uporabo zahtev in predlogov Evropskega parlamenta. Evropski parlament obsoja stališče vlad do ubogih priseljencev, ki dnevno prihajajo skozi vrata EU in tvegajo svoje življenje.Države, kot je Grčija, ki ležijo na zunanjih mejah EU, bi morale izkoristiti možno pomoč, ki jo ponuja EU, in se potruditi, da bi zagotovile humane razmere za sprejem beguncev in prosilcev za azil na podlagi spoštovanja njihovih pravic.Tudi ob nesprejemljivih „zmanjšanjih“, ki sta jih Komisija in Svet v zadnjem času odobrila v zvezi s pravicami priseljencev, ki nadaljujejo svojo pot proti „trdnjavi Evropi“, je Grčija precej pod standardi Skupnosti glede varstva temeljnih pravic. ","Dimitrios Papadimoulis  (GUE/NGL),",3,115,not_available,"['gre', 'gre', 'gre']","['  Dimitrios Papadimoulis  (GUE/NGL),  v pisni obliki. – (EL) Države članice, tudi Grčija, morajo storiti več z uporabo zahtev in predlogov Evropskega parlamenta. Evropski parlament obsoja stališče vlad do ubogih priseljencev, ki dnevno prihajajo skozi vrata EU in tvegajo svoje življenje.', 'Države, kot je Grčija, ki ležijo na zunanjih mejah EU, bi morale izkoristiti možno pomoč, ki jo ponuja EU, in se potruditi, da bi zagotovile humane razmere za sprejem beguncev in prosilcev za azil na podlagi spoštovanja njihovih pravic.', 'Tudi ob nesprejemljivih „zmanjšanjih“, ki sta jih Komisija in Svet v zadnjem času odobrila v zvezi s pravicami priseljencev, ki nadaljujejo svojo pot proti „trdnjavi Evropi“, je Grčija precej pod standardi Skupnosti glede varstva temeljnih pravic. ']"
98, 6. Obrazložitev glasovanja,"  Luís Queiró  (PPE-DE),  v pisni obliki. – (PT) Odobritev azila je skrajna gesta države in celotne skupnosti, sprejem nezmožnosti, da bi branili človekove pravice globalno, in volja, da kljub temu delujejo v skladu s to lestvico vrednot.Sistem, ki ureja azil, mora biti zato jasno ločen od priseljevanja. Bolj ko se trudimo razširiti koncept, vključno s tem, kar se ne nanaša nanj, manj vrednosti bo imel in zmeda lahko samo škodi legitimnim prosilcem za azil. Zato je pomembno, da so pravila jasna, postopki hitri in obravnava spoštljiva v vseh okoliščinah. Čeprav obstaja potreba po koordinaciji ukrepov in možnosti, azil v smislu števila, velikosti in vsebinskih pogojev ne odpira enakih vprašanj kot priseljevanje, niti na območju brez meja. Države članice imajo lastno tradicijo v zvezi z azilom in te razlike ne bi smeli spregledati v okviru prej omenjene koordinacije.Prosilcem za azil, ki jim je prošnja bila ali še bo zavrnjena, ta koncept, kot rezultat splošnega, a ozkega pojma azila ne more povzročiti nič manjše humanosti pri sprejemu in obravnavi, gre pa za ljudi, ki so bili vedno ranljivi zaradi svojega stanja. ","Luís Queiró  (PPE-DE),",3,181,not_available,"['por', 'por', 'por']","['  Luís Queiró  (PPE-DE),  v pisni obliki. – (PT) Odobritev azila je skrajna gesta države in celotne skupnosti, sprejem nezmožnosti, da bi branili človekove pravice globalno, in volja, da kljub temu delujejo v skladu s to lestvico vrednot.', 'Sistem, ki ureja azil, mora biti zato jasno ločen od priseljevanja. Bolj ko se trudimo razširiti koncept, vključno s tem, kar se ne nanaša nanj, manj vrednosti bo imel in zmeda lahko samo škodi legitimnim prosilcem za azil. Zato je pomembno, da so pravila jasna, postopki hitri in obravnava spoštljiva v vseh okoliščinah. Čeprav obstaja potreba po koordinaciji ukrepov in možnosti, azil v smislu števila, velikosti in vsebinskih pogojev ne odpira enakih vprašanj kot priseljevanje, niti na območju brez meja. Države članice imajo lastno tradicijo v zvezi z azilom in te razlike ne bi smeli spregledati v okviru prej omenjene koordinacije.', 'Prosilcem za azil, ki jim je prošnja bila ali še bo zavrnjena, ta koncept, kot rezultat splošnega, a ozkega pojma azila ne more povzročiti nič manjše humanosti pri sprejemu in obravnavi, gre pa za ljudi, ki so bili vedno ranljivi zaradi svojega stanja. ']"
99, 6. Obrazložitev glasovanja,"  Luca Romagnoli  (NI),  v pisni obliki. – (IT) Glasoval sem proti poročilu gospe Roure o izvajanju Direktive 2003/9/ES, ki določa minimalne standarde za sprejem prosilcev za azil in beguncev v Evropski uniji. Čeprav res obžalujem dejstvo, da so nekateri obiski pokazali, da se sedanje direktive slabo izvajajo ali da jih nekatere države članice ne uporabljajo, se ne strinjam s trditvijo poročevalke, da obstajajo številne pomanjkljivosti v zvezi z ravnijo pogojev sprejema.Poleg tega se ne strinjam, da imajo odprti namestitveni centri, ki so jih uvedle nekatere države članice, majhno zmogljivost in da ne izpolnjujejo potreb priseljencev. Nazadnje, ne strinjam se s pozivom, da je treba dati prednost sprejemanju prosilcev za azil v odprtih sprejemnih centrih namesto v zaprtih enotah. ","Luca Romagnoli  (NI),",2,120,not_available,"['ita', 'ita']","['  Luca Romagnoli  (NI),  v pisni obliki. – (IT) Glasoval sem proti poročilu gospe Roure o izvajanju Direktive 2003/9/ES, ki določa minimalne standarde za sprejem prosilcev za azil in beguncev v Evropski uniji. Čeprav res obžalujem dejstvo, da so nekateri obiski pokazali, da se sedanje direktive slabo izvajajo ali da jih nekatere države članice ne uporabljajo, se ne strinjam s trditvijo poročevalke, da obstajajo številne pomanjkljivosti v zvezi z ravnijo pogojev sprejema.', 'Poleg tega se ne strinjam, da imajo odprti namestitveni centri, ki so jih uvedle nekatere države članice, majhno zmogljivost in da ne izpolnjujejo potreb priseljencev. Nazadnje, ne strinjam se s pozivom, da je treba dati prednost sprejemanju prosilcev za azil v odprtih sprejemnih centrih namesto v zaprtih enotah. ']"
100, 6. Obrazložitev glasovanja,"  Michel Teychenné  (PSE),  v pisni obliki. – (FR) Zaradi tega poročila je Evropski parlament ponovno potrdil svojo zavezanost temeljnim pravicam, kakršna je pravica do dostojanstva. Ni sprejemljivo, da znotraj same Evropske unije pogoji sprejema priseljencev in prosilcev za azil niso zgledni.Obiski poslancev Evropskega parlamenta v centrih za pridržanje med letoma 2005 in 2008 so omogočili sestavo tega poročila pod vodstvom gospe Roure. Poročilo razkriva obseg nepravilnosti v sistemu pridržanja priseljencev v Evropo in s prstom kaže na probleme v zvezi s pravnim svetovanjem, medicinsko oskrbo, higieno, promiskuiteto in informacijami.Zato je alarmantno, da danes Evropski parlament to preverja. Države članice morajo to upoštevati in, kadar je potrebno, čimprej uporabiti obstoječe direktive o sprejemu in postopkih ali pa izboljšati njihovo izvajanje. ","Michel Teychenné  (PSE),",3,120,not_available,"['fra', 'fra', 'fra']","['  Michel Teychenné  (PSE),  v pisni obliki. – (FR) Zaradi tega poročila je Evropski parlament ponovno potrdil svojo zavezanost temeljnim pravicam, kakršna je pravica do dostojanstva. Ni sprejemljivo, da znotraj same Evropske unije pogoji sprejema priseljencev in prosilcev za azil niso zgledni.', 'Obiski poslancev Evropskega parlamenta v centrih za pridržanje med letoma 2005 in 2008 so omogočili sestavo tega poročila pod vodstvom gospe Roure. Poročilo razkriva obseg nepravilnosti v sistemu pridržanja priseljencev v Evropo in s prstom kaže na probleme v zvezi s pravnim svetovanjem, medicinsko oskrbo, higieno, promiskuiteto in informacijami.', 'Zato je alarmantno, da danes Evropski parlament to preverja. Države članice morajo to upoštevati in, kadar je potrebno, čimprej uporabiti obstoječe direktive o sprejemu in postopkih ali pa izboljšati njihovo izvajanje. ']"
101, 6. Obrazložitev glasovanja,"  Glyn Ford  (PSE),  v pisni obliki. − Laburistična stranka Evropskega parlamenta se je vzdržala ob tem poročilu, ne zato, ker bi nasprotovali krepitvi vloge evropskih MSP v mednarodni trgovini, temveč zato, ker je gospa Muscardini ustvarila trojanskega konja, ki vsebuje nesprejemljiva stališča o instrumentih trgovinske zaščite.Razočarani smo, da je Komisija odložila pregled zaradi težav pri zagotovitvi soglasja za nadaljnjo pot. Naše stališče ostaja, da je nujno treba spremeniti režim trgovinske zaščite v Skupnosti, tako da bo bolj upoštevan razvoj svetovnega gospodarstva. To, da ni reforme, pomeni, da je naša industrija slabo pripravljena na izkoriščanje prednosti globalizacije. Čeprav pozdravljamo, da je češko predsedstvo vključilo v delovni program izboljšanje preglednosti instrumentov trgovinske zaščite, to ni dovolj. ","Glyn Ford  (PSE),",2,114,not_available,"['slv', 'slv']","['  Glyn Ford  (PSE),  v pisni obliki. − Laburistična stranka Evropskega parlamenta se je vzdržala ob tem poročilu, ne zato, ker bi nasprotovali krepitvi vloge evropskih MSP v mednarodni trgovini, temveč zato, ker je gospa Muscardini ustvarila trojanskega konja, ki vsebuje nesprejemljiva stališča o instrumentih trgovinske zaščite.', 'Razočarani smo, da je Komisija odložila pregled zaradi težav pri zagotovitvi soglasja za nadaljnjo pot. Naše stališče ostaja, da je nujno treba spremeniti režim trgovinske zaščite v Skupnosti, tako da bo bolj upoštevan razvoj svetovnega gospodarstva. To, da ni reforme, pomeni, da je naša industrija slabo pripravljena na izkoriščanje prednosti globalizacije. Čeprav pozdravljamo, da je češko predsedstvo vključilo v delovni program izboljšanje preglednosti instrumentov trgovinske zaščite, to ni dovolj. ']"
102, 6. Obrazložitev glasovanja,"  Bruno Gollnisch  (NI),  v pisni obliki. – (FR) Glasovali smo za poročilo gospe Muscardini o MSP. To poročilo je ostra kritika trgovinske politike Evropske unije, čeprav je podano v umirjenem in tehnokratskem jeziku, ki je všeč temu parlamentu.Zajema vse: politike, osredotočene na potrebe velikih podjetij; šibkost ukrepov, ki spodbujajo dostop do zunanjih trgov in zagotavljajo uporabo vzajemnosti v tretjih državah; težave pri dostopu malih podjetij do instrumentov trgovinske zaščite; zmotljivost ukrepov za zaščito pred ponarejanjem in nezakonito ali goljufivo uporabo geografskih oznak porekla in tako dalje.Res je čas, da Evropska unija neha žrtvovati svoja podjetja in delavce na oltarju oblike konkurenčnosti in proste trgovine, ki jo prakticira edina na svetu. Čas je, da podpre MSP v izvoznem poslovanju, da jih zares zaščiti pred nelojalno konkurenco in stori, kar je razumno za zaščito naših trgov.Dejstvo je, da z ohranjanjem zavezanosti globalizaciji podjetij, ki je namen sama sebi, poročevalka nadaljuje s promocijo sistema, ki temelji na absolutno prostem pretoku blaga, storitev, kapitala in delovne sile, sistemu, ki nas je pripeljal v globoko gospodarsko, finančno in socialno krizo, sistemu, s katerim mora Evropska unija dokončno prenehati. ","Bruno Gollnisch  (NI),",4,185,not_available,"['fra', 'fra', 'fra', 'fra']","['  Bruno Gollnisch  (NI),  v pisni obliki. – (FR) Glasovali smo za poročilo gospe Muscardini o MSP. To poročilo je ostra kritika trgovinske politike Evropske unije, čeprav je podano v umirjenem in tehnokratskem jeziku, ki je všeč temu parlamentu.', 'Zajema vse: politike, osredotočene na potrebe velikih podjetij; šibkost ukrepov, ki spodbujajo dostop do zunanjih trgov in zagotavljajo uporabo vzajemnosti v tretjih državah; težave pri dostopu malih podjetij do instrumentov trgovinske zaščite; zmotljivost ukrepov za zaščito pred ponarejanjem in nezakonito ali goljufivo uporabo geografskih oznak porekla in tako dalje.', 'Res je čas, da Evropska unija neha žrtvovati svoja podjetja in delavce na oltarju oblike konkurenčnosti in proste trgovine, ki jo prakticira edina na svetu. Čas je, da podpre MSP v izvoznem poslovanju, da jih zares zaščiti pred nelojalno konkurenco in stori, kar je razumno za zaščito naših trgov.', 'Dejstvo je, da z ohranjanjem zavezanosti globalizaciji podjetij, ki je namen sama sebi, poročevalka nadaljuje s promocijo sistema, ki temelji na absolutno prostem pretoku blaga, storitev, kapitala in delovne sile, sistemu, ki nas je pripeljal v globoko gospodarsko, finančno in socialno krizo, sistemu, s katerim mora Evropska unija dokončno prenehati. ']"
103, 6. Obrazložitev glasovanja,"  Pedro Guerreiro  (GUE/NGL),  v pisni obliki. − (PT) Ni naključje, da se s približevanjem volitev v Parlament zdi, da skušajo resolucije preklicati odgovornost politik, ki jih je sprejela EU (zlasti v zadnjih 5 letih), glede zelo resnega stanja, v katerem so se na splošno znašla mikro, mala in srednje velika podjetja, predvsem na Portugalskem.Mala in srednje velika podjetja, ne pa velike nadnacionalne družbe, so žrtve liberalizacije trga, ki jo je pospeševala EU (kot da bi okvir pravila „preživetja najbolj prilagojenega“ lahko deloval v njihovo korist). Obstaja veliko malih in srednje velikih podjetij, ki „sodelujejo“ v „mednarodni trgovini“ zaradi svoje odvisnosti od glavnih nadnacionalnih družb, za katere proizvajajo po cenah, ki pogosto ne ustrezajo proizvodnim stroškom.Nedvomno je treba zagotoviti (in izvajati) instrumente trgovinske zaščite, pravice intelektualne lastnine, označbe porekla in geografske označbe kmetijskih proizvodov in podpirati internacionalizacijo malih in srednje velikih podjetij.Zakaj torej večina političnih sil, zastopanih v Parlamentu, ki ustreza večini zastopanih v Komisiji in Svetu EU, ne sprejme uredbe o označevanju porekla, ne uporablja za uvožene proizvode enakih standardov varnosti in varstva, kot se zahtevajo za proizvode, proizvedene v EU, ne uporablja finančnega okvira 2007–2013 za varovanje proizvodnje in zaposlovanja, ki podpira mala in srednje velika podjetja? ","Pedro Guerreiro  (GUE/NGL),",4,202,not_available,"['por', 'por', 'por', 'por']","['  Pedro Guerreiro  (GUE/NGL),  v pisni obliki. − (PT) Ni naključje, da se s približevanjem volitev v Parlament zdi, da skušajo resolucije preklicati odgovornost politik, ki jih je sprejela EU (zlasti v zadnjih 5 letih), glede zelo resnega stanja, v katerem so se na splošno znašla mikro, mala in srednje velika podjetja, predvsem na Portugalskem.', 'Mala in srednje velika podjetja, ne pa velike nadnacionalne družbe, so žrtve liberalizacije trga, ki jo je pospeševala EU (kot da bi okvir pravila „preživetja najbolj prilagojenega“ lahko deloval v njihovo korist). Obstaja veliko malih in srednje velikih podjetij, ki „sodelujejo“ v „mednarodni trgovini“ zaradi svoje odvisnosti od glavnih nadnacionalnih družb, za katere proizvajajo po cenah, ki pogosto ne ustrezajo proizvodnim stroškom.', 'Nedvomno je treba zagotoviti (in izvajati) instrumente trgovinske zaščite, pravice intelektualne lastnine, označbe porekla in geografske označbe kmetijskih proizvodov in podpirati internacionalizacijo malih in srednje velikih podjetij.', 'Zakaj torej večina političnih sil, zastopanih v Parlamentu, ki ustreza večini zastopanih v Komisiji in Svetu EU, ne sprejme uredbe o označevanju porekla, ne uporablja za uvožene proizvode enakih standardov varnosti in varstva, kot se zahtevajo za proizvode, proizvedene v EU, ne uporablja finančnega okvira 2007–2013 za varovanje proizvodnje in zaposlovanja, ki podpira mala in srednje velika podjetja? ']"
104, 6. Obrazložitev glasovanja,"  Małgorzata Handzlik  (PPE-DE),  v pisni obliki. – (PL) Zelo sem vesela, da je Evropski parlament sprejel poročilo gospe Muscardini, pri katerem sem imela možnost delati kot svetovalka Odbora za notranji trg in varstvo potrošnikov. Zdaj se veliko govori o izboljšanju razmer za mala in srednje velika podjetja na notranjem trgu Evropske unije, zlasti v okviru predlaganega Zakona o malem gospodarstvu.Mala in srednje velika podjetja predstavljajo več kot 99 % vseh podjetij v Evropi. Vendar je opravljanje dejavnosti, ki prečka nacionalne meje, bolj domena velikih podjetij. Samo 8 % malih in srednje velikih podjetij izvaža v namembne kraje prek nacionalnih meja. Če pa govorimo o opravljanju dejavnosti prek meja Evropske unije, je ta korak naredilo zgolj 3 % podjetij.Ne smemo pozabiti, da kažejo mednarodna podjetja veliko inovativno zmogljivost. In inovativnost je ključ do konkurenčnosti in rasti evropskega gospodarstva. Zato upam, da bodo politike notranjega trga ponudile MSP celoten niz koristi, ki jih prinaša skupni trg, in, če bo mogoče, postavile temelje za internacionalizacijo dejavnosti MSP. Mala in srednje velika podjetja bi morala dobiti tudi večjo podporo držav članic in Evropske komisije na področjih, ki vključujejo pospeševanje izvoza ali iskanje potencialnih trgovinskih partnerjev, zlasti v zvezi z vodilnimi proizvodi in storitvami ter novimi tehnologijami. ","Małgorzata Handzlik  (PPE-DE),",3,201,not_available,"['pol', 'pol', 'pol']","['  Małgorzata Handzlik  (PPE-DE),  v pisni obliki. – (PL) Zelo sem vesela, da je Evropski parlament sprejel poročilo gospe Muscardini, pri katerem sem imela možnost delati kot svetovalka Odbora za notranji trg in varstvo potrošnikov. Zdaj se veliko govori o izboljšanju razmer za mala in srednje velika podjetja na notranjem trgu Evropske unije, zlasti v okviru predlaganega Zakona o malem gospodarstvu.', 'Mala in srednje velika podjetja predstavljajo več kot 99 % vseh podjetij v Evropi. Vendar je opravljanje dejavnosti, ki prečka nacionalne meje, bolj domena velikih podjetij. Samo 8 % malih in srednje velikih podjetij izvaža v namembne kraje prek nacionalnih meja. Če pa govorimo o opravljanju dejavnosti prek meja Evropske unije, je ta korak naredilo zgolj 3 % podjetij.', 'Ne smemo pozabiti, da kažejo mednarodna podjetja veliko inovativno zmogljivost. In inovativnost je ključ do konkurenčnosti in rasti evropskega gospodarstva. Zato upam, da bodo politike notranjega trga ponudile MSP celoten niz koristi, ki jih prinaša skupni trg, in, če bo mogoče, postavile temelje za internacionalizacijo dejavnosti MSP. Mala in srednje velika podjetja bi morala dobiti tudi večjo podporo držav članic in Evropske komisije na področjih, ki vključujejo pospeševanje izvoza ali iskanje potencialnih trgovinskih partnerjev, zlasti v zvezi z vodilnimi proizvodi in storitvami ter novimi tehnologijami. ']"
