,agenda_item,text,speaker,number_p,number_w,chair,language_ps,ps
59, 12. Priprave na Evropski svet (25. - 26. marec 2010) (razprava) ,"  José Manuel Fernandes  (PPE),  v pisni obliki. – (PT) Pri projektu Evrope gre za mir, socialno dobrobit, svobodo in rast. Služila je kot primer v smislu svojega socialnega modela in je prav tako prevzela vodilno vlogo pri okoljskih vprašanjih, kar nima primere v svetovnem merilu. Gospodarska, finančna in socialna kriza, s katerimi se trenutno srečujemo, zahtevajo skupen odgovor na evropski ravni. Kriza v Grčiji in napad na evro zahtevata skupen odgovor, na žalost pa ta zamuja. Možno in zaželeno je, da najdemo evropsko rešitev, da bi se izognili trenutnim špekulativnim napadom na evro.EU ima kredibilnost in likvidnost. Če se zahtevano usklajevanje vzpostavi na evropski ravni, bi to moralo biti dovolj za hitro pomiritev trga in pokritje stroškov posojil, ki jih Grčija potrebuje. To je čas, ki zahteva solidarnost med državami članicami in evropskimi institucijami. Gre tudi za dolžnost. Treba je upati, da bo prihajajoči Evropski svet sprejel ukrepe za doseganje integrirane in usklajene solidarnosti. Tak odnos je potreben, če se evropski projekt želi pomakniti naprej. Rešitve za spremljanje primanjkljaja vsake države članice je treba poiskati kasneje. ","José Manuel Fernandes  (PPE),",3,176,not_available,"['por', 'por', 'por']","['  José Manuel Fernandes  (PPE),  v pisni obliki. – (PT) Pri projektu Evrope gre za mir, socialno dobrobit, svobodo in rast. Služila je kot primer v smislu svojega socialnega modela in je prav tako prevzela vodilno vlogo pri okoljskih vprašanjih, kar nima primere v svetovnem merilu. ', 'Gospodarska, finančna in socialna kriza, s katerimi se trenutno srečujemo, zahtevajo skupen odgovor na evropski ravni. Kriza v Grčiji in napad na evro zahtevata skupen odgovor, na žalost pa ta zamuja. Možno in zaželeno je, da najdemo evropsko rešitev, da bi se izognili trenutnim špekulativnim napadom na evro.', 'EU ima kredibilnost in likvidnost. Če se zahtevano usklajevanje vzpostavi na evropski ravni, bi to moralo biti dovolj za hitro pomiritev trga in pokritje stroškov posojil, ki jih Grčija potrebuje. To je čas, ki zahteva solidarnost med državami članicami in evropskimi institucijami. Gre tudi za dolžnost. Treba je upati, da bo prihajajoči Evropski svet sprejel ukrepe za doseganje integrirane in usklajene solidarnosti. Tak odnos je potreben, če se evropski projekt želi pomakniti naprej. Rešitve za spremljanje primanjkljaja vsake države članice je treba poiskati kasneje. ']"
60, 12. Priprave na Evropski svet (25. - 26. marec 2010) (razprava) ,"  Ilda Figueiredo  (GUE/NGL),  v pisni obliki. – (PT) Resnost socialnih problemov, ki jih je čutiti v različnih državah članicah EU, vključno z brezposelnostjo, pomanjkanjem varnosti zaposlitve in revščino, zahteva, da spomladanski Evropski svet poda resen in temeljit odgovor. Vendar se bojimo, da so njegovi odgovori usmerjeni predvsem na domnevno vzdržnost javnih financ, medtem ko zanemarja ukrepe, usmerjene na socialno vzdržnost.Odgovor na položaj v Grčiji je pomembna zadeva, ker kar se tam dogaja, je v nasprotju z vsem, kar se je trobilo glede vrlin evra in blagoslova biti v območju evra: biti na čelu močne valute bogatih držav. Rečeno je bilo, da bo članstvo v evrskem območju varovalo pred finančnimi krizami, ker se bo taka država lahko izogibala posojilom in prejemala denar od Mednarodnega denarnega sklada.Začetna kriza je zadostovala za prikaz, da v območju evra ni prave solidarnosti in da tako imenovana gospodarska in socialna kohezija ni nič drugega kot propaganda, uporabljena v volilnih kampanjah. Zdaj gospa Merklova celo grozi, da bodo države članice, ki ne izpolnjujejo zahtev Pakta za stabilnost, kot je med drugim Grčija, izključene iz območja evra, in ob tem pozablja, da je Nemčija velika koristnica politik, ki temeljijo na močnem evru...(Obrazložitev glasovanja je bila skrajšana v skladu s členom 170 Poslovnika)","Ilda Figueiredo  (GUE/NGL),",4,207,not_available,"['por', 'por', 'por', 'por']","['  Ilda Figueiredo  (GUE/NGL),  v pisni obliki. – (PT) Resnost socialnih problemov, ki jih je čutiti v različnih državah članicah EU, vključno z brezposelnostjo, pomanjkanjem varnosti zaposlitve in revščino, zahteva, da spomladanski Evropski svet poda resen in temeljit odgovor. Vendar se bojimo, da so njegovi odgovori usmerjeni predvsem na domnevno vzdržnost javnih financ, medtem ko zanemarja ukrepe, usmerjene na socialno vzdržnost.', 'Odgovor na položaj v Grčiji je pomembna zadeva, ker kar se tam dogaja, je v nasprotju z vsem, kar se je trobilo glede vrlin evra in blagoslova biti v območju evra: biti na čelu močne valute bogatih držav. Rečeno je bilo, da bo članstvo v evrskem območju varovalo pred finančnimi krizami, ker se bo taka država lahko izogibala posojilom in prejemala denar od Mednarodnega denarnega sklada.', 'Začetna kriza je zadostovala za prikaz, da v območju evra ni prave solidarnosti in da tako imenovana gospodarska in socialna kohezija ni nič drugega kot propaganda, uporabljena v volilnih kampanjah. Zdaj gospa Merklova celo grozi, da bodo države članice, ki ne izpolnjujejo zahtev Pakta za stabilnost, kot je med drugim Grčija, izključene iz območja evra, in ob tem pozablja, da je Nemčija velika koristnica politik, ki temeljijo na močnem evru...', '(Obrazložitev glasovanja je bila skrajšana v skladu s členom 170 Poslovnika)']"
61, 12. Priprave na Evropski svet (25. - 26. marec 2010) (razprava) ,"  Othmar Karas  (PPE),  v pisni obliki. – (DE) Gospodarska in finančna kriza ter Grčija zahtevajo evropsko ukrepanje. Javnim prepirom je treba narediti konec. Od vrha pričakujemo skupen odgovor. „Da“ pravimo varčevalnemu in reformnemu programu grške vlade – Grčija je trdno odločena, da bo naredila to domačo nalogo in zadostila evropskim pravilom. Prav tako pravimo „da“ posojanju denarja, kjer bi reformni program v nasprotnem primeru bil ogrožen. Prav gotovo pa pravimo „ne“ kaznim in izključitvi države iz območja evra. To bi ustvarilo le verižni učinek, ki bi vodil v izgubo zaupanja trgov. Prav tako pravimo „da“ predlogu komisarja Rehna, da Komisija predhodno odobri osnutek proračunov. Proračunske in gospodarske podatke morata pregledati Eurostat in Komisija. Zahtevam strogo pregledovanje knjig v vseh državah članicah na osnovi skupnega seznama meril. Davčne sisteme in tiste davčne stopnje, ki se nanašajo na notranji trg, je treba uskladiti, prav tako pa gospodarske, proračunske in socialne politike. Zahtevam načrtovalni odbor „Evropa 2020“, ki bo vključeval Komisijo, države članice, Evropsko investicijsko banko, Evropsko centralno banko in Eurostat. Zato pozivam voditelje držav ali vlad, da združijo evropsko pripravljenost za jasno dokumentiranje ukrepov. Grčija je primer, iz katerega se mora Evropa kaj naučiti. Sklepe je treba potegniti na lokalni, evropski in svetovni ravni. Več evropskega sodelovanja in manj nacionalnega egoizma so na dnevnem redu. ","Othmar Karas  (PPE),",1,211,not_available,['ger'],"['  Othmar Karas  (PPE),  v pisni obliki. – (DE) Gospodarska in finančna kriza ter Grčija zahtevajo evropsko ukrepanje. Javnim prepirom je treba narediti konec. Od vrha pričakujemo skupen odgovor. „Da“ pravimo varčevalnemu in reformnemu programu grške vlade – Grčija je trdno odločena, da bo naredila to domačo nalogo in zadostila evropskim pravilom. Prav tako pravimo „da“ posojanju denarja, kjer bi reformni program v nasprotnem primeru bil ogrožen. Prav gotovo pa pravimo „ne“ kaznim in izključitvi države iz območja evra. To bi ustvarilo le verižni učinek, ki bi vodil v izgubo zaupanja trgov. Prav tako pravimo „da“ predlogu komisarja Rehna, da Komisija predhodno odobri osnutek proračunov. Proračunske in gospodarske podatke morata pregledati Eurostat in Komisija. Zahtevam strogo pregledovanje knjig v vseh državah članicah na osnovi skupnega seznama meril. Davčne sisteme in tiste davčne stopnje, ki se nanašajo na notranji trg, je treba uskladiti, prav tako pa gospodarske, proračunske in socialne politike. Zahtevam načrtovalni odbor „Evropa 2020“, ki bo vključeval Komisijo, države članice, Evropsko investicijsko banko, Evropsko centralno banko in Eurostat. Zato pozivam voditelje držav ali vlad, da združijo evropsko pripravljenost za jasno dokumentiranje ukrepov. Grčija je primer, iz katerega se mora Evropa kaj naučiti. Sklepe je treba potegniti na lokalni, evropski in svetovni ravni. Več evropskega sodelovanja in manj nacionalnega egoizma so na dnevnem redu. ']"
62, 12. Priprave na Evropski svet (25. - 26. marec 2010) (razprava) ,"  Ivari Padar  (S&D),  v pisni obliki. – Govoril bi rad o Evropski digitalni agendi. Številke Komisije kažejo, da obstajajo ovire za enotni digitalni trg: samo 7 % spletnih transakcij je čezmejnih. Čeprav internet in ustrezni infrastrukturni cilji služijo kot soliden predpogoj za nadaljnji razvoj, morajo izboljšanje infrastrukture dopolnjevati vzpostavitev vseevropskega regulativnega okvira, uporaba storitev in razširitev veščin IKT. Do leta 2020 je treba ustvariti enotno in varno območje evropskih e-storitev. Državljanom EU bi predstavljalo lahek in varen dostop do vseh digitalnih storitev, tako javnih kot komercialnih. Države članice bi morale razviti nacionalne načrte za prehod na digitalne javne storitve. Posebno pozornost je treba posvetiti spodbujanju udeležbe nižjih socialno-ekonomskih skupin, saj bodo te najverjetneje izključene iz digitalne družbe. Za čezmejno e-avtentifikacijo in digitalne podpise mora biti značilna pravna in tehnična medobratovalnost, tako da čezmejno e-avtentifikacijo lahko uporabijo vsi ponudniki storitev ter potrošniki v Evropi. Celostni pristop k trgu digitalnih storitev bi moral vključevati znižanje preostale razdrobljenosti finančnih storitev, logistike, varstva potrošnikov in intelektualne lastnine. Treba je postaviti 100 % cilj, da bodo državljani imeli dostop in možnost uporabe e-storitev. ","Ivari Padar  (S&D),",1,181,not_available,['slv'],"['  Ivari Padar  (S&D),  v pisni obliki. – Govoril bi rad o Evropski digitalni agendi. Številke Komisije kažejo, da obstajajo ovire za enotni digitalni trg: samo 7 % spletnih transakcij je čezmejnih. Čeprav internet in ustrezni infrastrukturni cilji služijo kot soliden predpogoj za nadaljnji razvoj, morajo izboljšanje infrastrukture dopolnjevati vzpostavitev vseevropskega regulativnega okvira, uporaba storitev in razširitev veščin IKT. Do leta 2020 je treba ustvariti enotno in varno območje evropskih e-storitev. Državljanom EU bi predstavljalo lahek in varen dostop do vseh digitalnih storitev, tako javnih kot komercialnih. Države članice bi morale razviti nacionalne načrte za prehod na digitalne javne storitve. Posebno pozornost je treba posvetiti spodbujanju udeležbe nižjih socialno-ekonomskih skupin, saj bodo te najverjetneje izključene iz digitalne družbe. Za čezmejno e-avtentifikacijo in digitalne podpise mora biti značilna pravna in tehnična medobratovalnost, tako da čezmejno e-avtentifikacijo lahko uporabijo vsi ponudniki storitev ter potrošniki v Evropi. Celostni pristop k trgu digitalnih storitev bi moral vključevati znižanje preostale razdrobljenosti finančnih storitev, logistike, varstva potrošnikov in intelektualne lastnine. Treba je postaviti 100 % cilj, da bodo državljani imeli dostop in možnost uporabe e-storitev. ']"
63, 12. Priprave na Evropski svet (25. - 26. marec 2010) (razprava) ,"  Georgios Papastamkos  (PPE),  v pisni obliki. – (EL) Strašna finančna kriza v Grčiji in finančno neravnovesje v drugih državah članicah območja evra postavljajo vprašanja o statični in dinamični moči same strukture EMU. Ni dvoma, da je ponovna vzpostavitev javnih financ v državi članici evrskega območja njena odgovornost. Vendar je finančna kriza prinesla povezavo med popolno, enotno monetarno unijo in na prvi pogled nepopolno gospodarsko unijo EU. Poudarila je nujno potrebo po vzpostavitvi politično usmerjenega evropskega gospodarskega upravljanja, po evropeizaciji gospodarske politike in gospodarskega tveganja, po pokritju strukturnih primanjkljajev EMU, za več Evrope in za usklajeno in na solidarnosti temelječe evropsko ukrepanje. Kar potrebujemo, je evropski podporni mehanizem, Evropski denarni sklad, opremljen s potrebnimi sredstvi in zmožnostjo za posredovanje. Za zaščito skupne valute pred špekulacijami je potrebno usklajeno posredovanje. Potreben je podroben pregled delovanja trga s posli kreditnih zamenjav. Evropski svet je pozvan, naj poda temeljne odgovore na krizo v območju evra in izrazi pravo solidarnost z Grčijo za premagovanje finančne krize. Grčija ne prosjači. Zahteva, da izgubljeni prihodki grških državljanov ne smejo izginiti v žepih mednarodnih špekulantov. ","Georgios Papastamkos  (PPE),",1,176,not_available,['gre'],"['  Georgios Papastamkos  (PPE),  v pisni obliki. – (EL) Strašna finančna kriza v Grčiji in finančno neravnovesje v drugih državah članicah območja evra postavljajo vprašanja o statični in dinamični moči same strukture EMU. Ni dvoma, da je ponovna vzpostavitev javnih financ v državi članici evrskega območja njena odgovornost. Vendar je finančna kriza prinesla povezavo med popolno, enotno monetarno unijo in na prvi pogled nepopolno gospodarsko unijo EU. Poudarila je nujno potrebo po vzpostavitvi politično usmerjenega evropskega gospodarskega upravljanja, po evropeizaciji gospodarske politike in gospodarskega tveganja, po pokritju strukturnih primanjkljajev EMU, za več Evrope in za usklajeno in na solidarnosti temelječe evropsko ukrepanje. Kar potrebujemo, je evropski podporni mehanizem, Evropski denarni sklad, opremljen s potrebnimi sredstvi in zmožnostjo za posredovanje. Za zaščito skupne valute pred špekulacijami je potrebno usklajeno posredovanje. Potreben je podroben pregled delovanja trga s posli kreditnih zamenjav. Evropski svet je pozvan, naj poda temeljne odgovore na krizo v območju evra in izrazi pravo solidarnost z Grčijo za premagovanje finančne krize. Grčija ne prosjači. Zahteva, da izgubljeni prihodki grških državljanov ne smejo izginiti v žepih mednarodnih špekulantov. ']"
64, 12. Priprave na Evropski svet (25. - 26. marec 2010) (razprava) ,"  Rovana Plumb  (S&D),  v pisni obliki. – (RO) V trenutni gospodarski in socialni krizi v kombinaciji s podnebno krizo je EU pripravila novo strategijo za naslednjih 10 let. Strategija EU 2020 mora pomagati ustvariti bolj vključujočo Evropo z gospodarstvom, ki je povezano in okolju prijazno. Razvoj raziskav in inovacij mora postati prednostna naloga, ki nam bo pomagala v boju zoper učinke podnebnih sprememb in ustvariti zelena, pametna delovna mesta. Zaradi tega morajo zastavljeni cilji biti obvezni, da bi zagotovili trajnostno rast in razvoj bolj vključujočega trga dela ter dostojnih pogojev za življenje državljanov. ","Rovana Plumb  (S&D),",1,93,not_available,['rum'],"['  Rovana Plumb  (S&D),  v pisni obliki. – (RO) V trenutni gospodarski in socialni krizi v kombinaciji s podnebno krizo je EU pripravila novo strategijo za naslednjih 10 let. Strategija EU 2020 mora pomagati ustvariti bolj vključujočo Evropo z gospodarstvom, ki je povezano in okolju prijazno. Razvoj raziskav in inovacij mora postati prednostna naloga, ki nam bo pomagala v boju zoper učinke podnebnih sprememb in ustvariti zelena, pametna delovna mesta. Zaradi tega morajo zastavljeni cilji biti obvezni, da bi zagotovili trajnostno rast in razvoj bolj vključujočega trga dela ter dostojnih pogojev za življenje državljanov. ']"
65, 12. Priprave na Evropski svet (25. - 26. marec 2010) (razprava) ,"  Richard Seeber  (PPE),  v pisni obliki. – (DE) EU lahko uspe le, če vemo, v katero smer želimo, ko gre za gospodarsko in socialno politiko. Zaradi tega je treba posebno pozornost nameniti pripravi strategije 2020. Države članice morajo predstaviti jasne koncepte, vizije in ideje. Priprava strategije za naslednjih 10 let je gotovo ambiciozna naloga, vendar si je treba zapomniti, da ne gre za končne podrobnosti. EU se mora vprašati, kam se želi umestiti in kakšne prednostne naloge si bo zastavila. Cilj, ki bi dolgoročno prav tako dal pozitivne socialne in gospodarske posledice, bi bila ustanovitev trajnostne mešanice energetskih virov za Evropo. Na tem področju je potreben ponovni premislek, ne le zaradi vedno slabše dobave fosilnih goriv in vpliva na podnebje, ki ga imajo neobnovljivi viri energije. Evropa mora prav tako prevzeti vodilno vlogo, ko gre za okolju prijazne tehnologije. Menim, da jedrska energija ni najbolj primerna za vodenje Evrope v trajnostno energetsko prihodnost. ","Richard Seeber  (PPE),",1,152,not_available,['ger'],"['  Richard Seeber  (PPE),  v pisni obliki. – (DE) EU lahko uspe le, če vemo, v katero smer želimo, ko gre za gospodarsko in socialno politiko. Zaradi tega je treba posebno pozornost nameniti pripravi strategije 2020. Države članice morajo predstaviti jasne koncepte, vizije in ideje. Priprava strategije za naslednjih 10 let je gotovo ambiciozna naloga, vendar si je treba zapomniti, da ne gre za končne podrobnosti. EU se mora vprašati, kam se želi umestiti in kakšne prednostne naloge si bo zastavila. Cilj, ki bi dolgoročno prav tako dal pozitivne socialne in gospodarske posledice, bi bila ustanovitev trajnostne mešanice energetskih virov za Evropo. Na tem področju je potreben ponovni premislek, ne le zaradi vedno slabše dobave fosilnih goriv in vpliva na podnebje, ki ga imajo neobnovljivi viri energije. Evropa mora prav tako prevzeti vodilno vlogo, ko gre za okolju prijazne tehnologije. Menim, da jedrska energija ni najbolj primerna za vodenje Evrope v trajnostno energetsko prihodnost. ']"
66, 12. Priprave na Evropski svet (25. - 26. marec 2010) (razprava) ,"  Czesław Adam Siekierski  (PPE),  v pisni obliki. – (PL) Namen zasedanja Evropskega sveta, ki se začne jutri, je predvsem razpravljati o splošnem okviru nove strategije Evropa 2020 in oceniti izhod iz gospodarske krize ter položaj Grčije ter drugih držav območja evra. Gre za teme, ki so tesno povezane, saj je strategija Unije za gospodarsko rast in zaposlovanje povezana s temi vprašanji. Pri oceni trenutnega položaja moramo odgovoriti na vprašanja, kako se upoštevajo načela Pakta za stabilnost in rast v različnih državah in kje je bila Evropska komisija pri vsem tem? Predpostavljamo lahko, da bodo na strategijo Evropa 2020 voditelji držav ali vlad držav članic gledali na različne načine. To je posledica precejšnjih konfliktov med interesi različnih držav, ki prihajajo iz razlik v stopnjah razvoja. Iz očitnih razlogov se bodo države iz zadnjih dveh širitev, vendar ne te države, borile za večji poudarek kohezijski politiki, razvoju infrastrukture in kmetijstva, čeprav ne smemo pozabiti na inovacije in nove tehnologije. Uspešen razvoj Evrope in vrnitev na pot rasti v naslednjem desetletju bo enako odvisen od uresničevanja ciljev strategije, ki jo vsebujejo predlogi Komisije, pa tudi od nadaljevanja bolj tradicionalnih politik. Da bi se Unija lahko spopadla s težkimi izzivi na svetovni ravni, mora najprej zmanjšati notranje razlike, tega pa ne moremo doseči brez spoštovanja načela solidarnosti pogodbe. ","Czesław Adam Siekierski  (PPE),",1,213,not_available,['pol'],"['  Czesław Adam Siekierski  (PPE),  v pisni obliki. – (PL) Namen zasedanja Evropskega sveta, ki se začne jutri, je predvsem razpravljati o splošnem okviru nove strategije Evropa 2020 in oceniti izhod iz gospodarske krize ter položaj Grčije ter drugih držav območja evra. Gre za teme, ki so tesno povezane, saj je strategija Unije za gospodarsko rast in zaposlovanje povezana s temi vprašanji. Pri oceni trenutnega položaja moramo odgovoriti na vprašanja, kako se upoštevajo načela Pakta za stabilnost in rast v različnih državah in kje je bila Evropska komisija pri vsem tem? Predpostavljamo lahko, da bodo na strategijo Evropa 2020 voditelji držav ali vlad držav članic gledali na različne načine. To je posledica precejšnjih konfliktov med interesi različnih držav, ki prihajajo iz razlik v stopnjah razvoja. Iz očitnih razlogov se bodo države iz zadnjih dveh širitev, vendar ne te države, borile za večji poudarek kohezijski politiki, razvoju infrastrukture in kmetijstva, čeprav ne smemo pozabiti na inovacije in nove tehnologije. Uspešen razvoj Evrope in vrnitev na pot rasti v naslednjem desetletju bo enako odvisen od uresničevanja ciljev strategije, ki jo vsebujejo predlogi Komisije, pa tudi od nadaljevanja bolj tradicionalnih politik. Da bi se Unija lahko spopadla s težkimi izzivi na svetovni ravni, mora najprej zmanjšati notranje razlike, tega pa ne moremo doseči brez spoštovanja načela solidarnosti pogodbe. ']"
67, 12. Priprave na Evropski svet (25. - 26. marec 2010) (razprava) ,"  Silvia-Adriana Ţicău  (S&D),  v pisni obliki. – (RO) Glavna tema spomladanskega Evropskega sveta je strategija EU 2020. Na začetku tega leta je stopnja brezposelnosti dosegla 10 %, medtem ko je številka v državah, kot sta Španija in Latvija, dosegla 20 %. 67 % evropskih državljanov meni, da so izgube delovnih mest njihova glavna skrb. Glavna skrb evropskih voditeljev mora biti ohranitev obstoječih delovnih mest in ustvarjanje novih, da bi evropskim državljanom omogočili dostojno življenje. Ta cilj se lahko zajamči le z večjimi vlaganji v gospodarski in socialni razvoj, prometno in energetsko infrastrukturo, kmetijstvo, razvoj, izobraževanje in zdravje. Točno to je razlog, da mora Evropski svet posebno pozornost nameniti industrijski politiki EU. V skladu z evropskimi statistikami je v primerjavi z decembrom leta 2009 januarja leta 2010 industrijska proizvodnja padla za 2 % na območju evra in za 0,2 % na ravni EU-27. Na ravni Skupnosti industrija ustvari 26,4 % BDP, toda obstajajo države članice, kjer industrijska proizvodnja prispeva le 14 % BDP. Evropska unija mora obdržati svojo svetovno konkurenčnost. Da bi to dosegli, moramo delovna mesta in industrijsko proizvodnjo ohraniti v Evropski uniji, ne pa je premestiti v tretje države. ","Silvia-Adriana Ţicău  (S&D),",1,187,not_available,['rum'],"['  Silvia-Adriana Ţicău  (S&D),  v pisni obliki. – (RO) Glavna tema spomladanskega Evropskega sveta je strategija EU 2020. Na začetku tega leta je stopnja brezposelnosti dosegla 10 %, medtem ko je številka v državah, kot sta Španija in Latvija, dosegla 20 %. 67 % evropskih državljanov meni, da so izgube delovnih mest njihova glavna skrb. Glavna skrb evropskih voditeljev mora biti ohranitev obstoječih delovnih mest in ustvarjanje novih, da bi evropskim državljanom omogočili dostojno življenje. Ta cilj se lahko zajamči le z večjimi vlaganji v gospodarski in socialni razvoj, prometno in energetsko infrastrukturo, kmetijstvo, razvoj, izobraževanje in zdravje. Točno to je razlog, da mora Evropski svet posebno pozornost nameniti industrijski politiki EU. V skladu z evropskimi statistikami je v primerjavi z decembrom leta 2009 januarja leta 2010 industrijska proizvodnja padla za 2 % na območju evra in za 0,2 % na ravni EU-27. Na ravni Skupnosti industrija ustvari 26,4 % BDP, toda obstajajo države članice, kjer industrijska proizvodnja prispeva le 14 % BDP. Evropska unija mora obdržati svojo svetovno konkurenčnost. Da bi to dosegli, moramo delovna mesta in industrijsko proizvodnjo ohraniti v Evropski uniji, ne pa je premestiti v tretje države. ']"
68, 12. Priprave na Evropski svet (25. - 26. marec 2010) (razprava) ,PREDSEDSTVO: GOSPOD MARTÍNEZ MARTÍNEZ podpredsednik,PREDSEDSTVO: GOSPOD MARTÍNEZ MARTÍNEZ,1,5,not_available,['slv'],['PREDSEDSTVO: GOSPOD MARTÍNEZ MARTÍNEZ podpredsednik']
69, 13. Oblikovanje pobude evropskih državljanov na podlagi člena 11(4) Pogodbe o Evropski uniji (razprava) ,"  Predsednik. -   Naslednja točka je izjava Sveta in Odbora za razvoj pobude evropskih državljanov na podlagi člena 11(4) Pogodbe o Evropski uniji.Dovolite, da toplo pozdravim skupino poročevalcev iz moje regije, Castile-La Mancha v Španiji, ki so bili na galeriji za tisk in trenutno obiskujejo institucije EU. ",Predsednik. -,2,48,not_available,"['slv', 'slv']","['  Predsednik. -   Naslednja točka je izjava Sveta in Odbora za razvoj pobude evropskih državljanov na podlagi člena 11(4) Pogodbe o Evropski uniji.', 'Dovolite, da toplo pozdravim skupino poročevalcev iz moje regije, Castile-La Mancha v Španiji, ki so bili na galeriji za tisk in trenutno obiskujejo institucije EU. ']"
