,agenda_item,text,speaker,number_p,number_w,chair,language_ps,ps
215, 18. Politika kakovosti kmetijskih proizvodov: katera strategija je prava? (razprava) ,"  Dacian Cioloş,  član Komisije. – (FR) Gospa predsednica, gospod Scottà, gospe in gospodje, ključni element, ki oblikuje evropski kmetijski in kmetijsko-živilski model na mednarodni ravni, je po mojem mnenju ravno njegova politika kakovosti in raznolikosti. Zato bo politika kakovosti v kmetijsko-živilskem sektorju ena izmed prednostnih nalog mojega mandata, ena izmed mojih glavnih prednostnih nalog, takoj za reformo skupne kmetijske politike po obdobju 2013.Politika kmetijsko-živilske kakovosti ni le dokaz, da se evropski kmeti odzivajo na pričakovanja evropskih potrošnikov, ampak lahko pripomore tudi k temu, da se bo evropski kmetijsko-živilski sektor umestil na mednarodni trg.Če naj politika kakovosti izpolni cilje, potrebujemo okvir, ki bo jasen, celovit, dobro oblikovan, enostavno prepoznaven s strani potrošnikov in kolikor je mogoče celovit in zadosten. Nameravam oblikovati vsebino politike kakovosti in zagotoviti, da bi bila dostopnejša tako kmetom, ki morajo imeti od nje koristi, kot tudi potrošnikom, ne da bi pri tem žrtvovali njeno vsebino ali da bi ji odvzeli celotno vsebino.Politika kakovosti potrošnikom predstavlja garancijo, prav tako pa kmetom predstavlja dodatno vrednost; glede tega se popolnoma strinjam z gospodom Scotto. Lahko pripomore k ohranjanju raznolikosti našega kmetijstva in sicer na konkurenčen način, saj so kmetije, ki lahko prodajajo svoje izdelke, konkurenčne. Če lahko živijo od tega, kar proizvajajo, so konkurenčne in če lahko prodajajo izdelke z visoko dodano vrednost, so še konkurenčnejša, čeprav gre občasno za male kmetije.Zato verjamem, da lahko politika kakovosti v nekaterih pokrajinah pomaga k večji konkurenčnosti kmetij. Na ta način lahko politika kakovosti, razvoj lokalnih trgov, zmanjšanje razdalj pri prevozu hrane ter neposreden in tesnejši stik med potrošniki in proizvajalci, zagotovijo dobre rezultate ravno z namenom povečanja konkurenčnosti nekaterih oblik kmetovanja, ki imajo trenutno relativno majhen tržni delež. Evropski kmeti se že trudijo, da bi dobavljali varne proizvode, s tem ko uporabljajo tehnike, ki upoštevajo okolje in dobro počutje živali.Razprava o tem, kako bi to lahko postalo očitnejše s pomočjo sistema označevanja, je uporabna in dobrodošla, poročilo pa k temu prispeva nekatere elemente in zamisli. Verjamem, da morajo predmet razprav, ki bodo potekale v sklopu skupne kmetijske politike po letu 2013, biti tudi te povezave med standardi, ki jih vzdržujejo kmetje in politiko označevanja kakovosti.Verjamem, da moramo razviti in izdelati instrumente v zvezi s komunikacijsko politiko, komunikacijo tako z evropskimi kmeti, kot tudi z evropskimi potrošniki, predvsem pa tudi s komunikacijo na mednarodni ravni. Naš sistem kakovosti je lahko dober ambasador našega kmetijsko-živilskega modela in tudi naše skupne kmetijske politike.Na koncu želim povedati, da je bilo poročilo gospoda Scotte pripravljeno ravno ob pravem času. Kot veste, namerava Komisija do konca 2010 predstaviti zakonodajni paket o politiki kakovosti. Poročilo, ki ga je danes predstavil gospod Scottà in o katerem bo tekla razprava, vključuje nekatera vprašanja, ideje in predloge, ki so skladni s tem, sam pa si bom koliko bo le mogoče prizadeval, da jih bom upošteval, ko vam bom predstavil zakonodajne predloge.Poročevalcu in članom parlamentarnih odborov, ki so sodelovali pri tem poročilu, želim čestitati in z veseljem pričakujem vaše poglede in predloge. ","Dacian Cioloş,",9,501,not_available,"['fra', 'fra', 'fra', 'fra', 'fra', 'fra', 'fra', 'fra', 'fra']","['  Dacian Cioloş,  član Komisije. – (FR) Gospa predsednica, gospod Scottà, gospe in gospodje, ključni element, ki oblikuje evropski kmetijski in kmetijsko-živilski model na mednarodni ravni, je po mojem mnenju ravno njegova politika kakovosti in raznolikosti. Zato bo politika kakovosti v kmetijsko-živilskem sektorju ena izmed prednostnih nalog mojega mandata, ena izmed mojih glavnih prednostnih nalog, takoj za reformo skupne kmetijske politike po obdobju 2013.', 'Politika kmetijsko-živilske kakovosti ni le dokaz, da se evropski kmeti odzivajo na pričakovanja evropskih potrošnikov, ampak lahko pripomore tudi k temu, da se bo evropski kmetijsko-živilski sektor umestil na mednarodni trg.', 'Če naj politika kakovosti izpolni cilje, potrebujemo okvir, ki bo jasen, celovit, dobro oblikovan, enostavno prepoznaven s strani potrošnikov in kolikor je mogoče celovit in zadosten. Nameravam oblikovati vsebino politike kakovosti in zagotoviti, da bi bila dostopnejša tako kmetom, ki morajo imeti od nje koristi, kot tudi potrošnikom, ne da bi pri tem žrtvovali njeno vsebino ali da bi ji odvzeli celotno vsebino.', 'Politika kakovosti potrošnikom predstavlja garancijo, prav tako pa kmetom predstavlja dodatno vrednost; glede tega se popolnoma strinjam z gospodom Scotto. Lahko pripomore k ohranjanju raznolikosti našega kmetijstva in sicer na konkurenčen način, saj so kmetije, ki lahko prodajajo svoje izdelke, konkurenčne. Če lahko živijo od tega, kar proizvajajo, so konkurenčne in če lahko prodajajo izdelke z visoko dodano vrednost, so še konkurenčnejša, čeprav gre občasno za male kmetije.', 'Zato verjamem, da lahko politika kakovosti v nekaterih pokrajinah pomaga k večji konkurenčnosti kmetij. Na ta način lahko politika kakovosti, razvoj lokalnih trgov, zmanjšanje razdalj pri prevozu hrane ter neposreden in tesnejši stik med potrošniki in proizvajalci, zagotovijo dobre rezultate ravno z namenom povečanja konkurenčnosti nekaterih oblik kmetovanja, ki imajo trenutno relativno majhen tržni delež. Evropski kmeti se že trudijo, da bi dobavljali varne proizvode, s tem ko uporabljajo tehnike, ki upoštevajo okolje in dobro počutje živali.', 'Razprava o tem, kako bi to lahko postalo očitnejše s pomočjo sistema označevanja, je uporabna in dobrodošla, poročilo pa k temu prispeva nekatere elemente in zamisli. Verjamem, da morajo predmet razprav, ki bodo potekale v sklopu skupne kmetijske politike po letu 2013, biti tudi te povezave med standardi, ki jih vzdržujejo kmetje in politiko označevanja kakovosti.', 'Verjamem, da moramo razviti in izdelati instrumente v zvezi s komunikacijsko politiko, komunikacijo tako z evropskimi kmeti, kot tudi z evropskimi potrošniki, predvsem pa tudi s komunikacijo na mednarodni ravni. Naš sistem kakovosti je lahko dober ambasador našega kmetijsko-živilskega modela in tudi naše skupne kmetijske politike.', 'Na koncu želim povedati, da je bilo poročilo gospoda Scotte pripravljeno ravno ob pravem času. Kot veste, namerava Komisija do konca 2010 predstaviti zakonodajni paket o politiki kakovosti. Poročilo, ki ga je danes predstavil gospod Scottà in o katerem bo tekla razprava, vključuje nekatera vprašanja, ideje in predloge, ki so skladni s tem, sam pa si bom koliko bo le mogoče prizadeval, da jih bom upošteval, ko vam bom predstavil zakonodajne predloge.', 'Poročevalcu in članom parlamentarnih odborov, ki so sodelovali pri tem poročilu, želim čestitati in z veseljem pričakujem vaše poglede in predloge. ']"
216, 18. Politika kakovosti kmetijskih proizvodov: katera strategija je prava? (razprava) ,"  Esther Herranz García,  pripravljavka mnenja Odbora za okolje, javno zdravje in varnost hrane. – (ES) Gospa predsednica, najprej se želim zahvaliti gospodu Scotti za odlično spretnost pri pogajanjih v zvezi s tem poročilom. Resnično je bilo pravo zadovoljstvo delati z njim in ostalimi govorniki iz parlamentarnih skupin.Ponosni smo na stališče, ki ga bomo izkazali na jutrišnjem glasovanju v Parlamentu in glede poročila, kot je to, ki zagovarja kakovost ter se zavezuje razvoju in krepitvi podeželja, ne le kot dokaz tradicionalne evropske kulture, ampak kot resnična sredstva za ustvarjanje blaginje in delovnih mest. Gre za delovna mesta, ki jih zelo potrebujemo v času te gospodarske krize in tako dinamičnih razmer z vidika stopnje zaposlenosti v nekaterih državah članicah.Poleg tega smo veseli zaščite, ki jo ohranja Parlament in stališča, ki ga ohranja Odbor za kmetijstvo in razvoj podeželja, kar je tudi jasno izjavil, pri zagotavljanju kvalitete najvišjih standardov. Glede najvišjih standardov se seveda zavezujemo k ohranjanju razlike med označbo geografskega porekla in zaščiteno geografsko označbo. Zavračamo idejo o zniževanju kakovosti, hkrati pa želimo, da je proizvodnja v EU deležna pozornosti in da je cenjena.Navdušena sem nad tem, kar je povedal gospod Cioloş. Seveda je bilo lepo slišati, kako je govoril o zavezah za prihodnost evropskega kmetijskega okolja. Seveda upamo, da bo prisluhnil glasu Parlamenta, ki se bo odražal na jutrišnjem glasovanju.Upajmo, da se ne bo nikoli več ponovilo, da bi Evropska komisija prehitela Parlament s prepovedjo stvari, kot so na primer tržni standardi za sadje in zelenjavo, ki so močno škodili evropski svobodni konkurenci.Želimo, da se neravnovesja na trgu odpravijo, prav tako pa se želimo zavezati kakovosti, raznolikosti, varnosti hrane in pravemu obsegu proizvodnje.Poleg tega želimo, da se proizvodnja v EU ter kakovost kmetijstva in proizvodnja živil v EU zaščitita v Svetovni trgovinski organizaciji. V zvezi s tem se zanašamo tudi na delo gospoda Cioloşa, saj naši evropski proizvajalci in potrošniki ne morejo še naprej ostati nezaščiteni. ","Esther Herranz García,",7,320,not_available,"['spa', 'spa', 'spa', 'spa', 'spa', 'spa', 'spa']","['  Esther Herranz García,  pripravljavka mnenja Odbora za okolje, javno zdravje in varnost hrane. – (ES) Gospa predsednica, najprej se želim zahvaliti gospodu Scotti za odlično spretnost pri pogajanjih v zvezi s tem poročilom. Resnično je bilo pravo zadovoljstvo delati z njim in ostalimi govorniki iz parlamentarnih skupin.', 'Ponosni smo na stališče, ki ga bomo izkazali na jutrišnjem glasovanju v Parlamentu in glede poročila, kot je to, ki zagovarja kakovost ter se zavezuje razvoju in krepitvi podeželja, ne le kot dokaz tradicionalne evropske kulture, ampak kot resnična sredstva za ustvarjanje blaginje in delovnih mest. Gre za delovna mesta, ki jih zelo potrebujemo v času te gospodarske krize in tako dinamičnih razmer z vidika stopnje zaposlenosti v nekaterih državah članicah.', 'Poleg tega smo veseli zaščite, ki jo ohranja Parlament in stališča, ki ga ohranja Odbor za kmetijstvo in razvoj podeželja, kar je tudi jasno izjavil, pri zagotavljanju kvalitete najvišjih standardov. Glede najvišjih standardov se seveda zavezujemo k ohranjanju razlike med označbo geografskega porekla in zaščiteno geografsko označbo. Zavračamo idejo o zniževanju kakovosti, hkrati pa želimo, da je proizvodnja v EU deležna pozornosti in da je cenjena.', 'Navdušena sem nad tem, kar je povedal gospod Cioloş. Seveda je bilo lepo slišati, kako je govoril o zavezah za prihodnost evropskega kmetijskega okolja. Seveda upamo, da bo prisluhnil glasu Parlamenta, ki se bo odražal na jutrišnjem glasovanju.', 'Upajmo, da se ne bo nikoli več ponovilo, da bi Evropska komisija prehitela Parlament s prepovedjo stvari, kot so na primer tržni standardi za sadje in zelenjavo, ki so močno škodili evropski svobodni konkurenci.', 'Želimo, da se neravnovesja na trgu odpravijo, prav tako pa se želimo zavezati kakovosti, raznolikosti, varnosti hrane in pravemu obsegu proizvodnje.', 'Poleg tega želimo, da se proizvodnja v EU ter kakovost kmetijstva in proizvodnja živil v EU zaščitita v Svetovni trgovinski organizaciji. V zvezi s tem se zanašamo tudi na delo gospoda Cioloşa, saj naši evropski proizvajalci in potrošniki ne morejo še naprej ostati nezaščiteni. ']"
217, 18. Politika kakovosti kmetijskih proizvodov: katera strategija je prava? (razprava) ,"  Giovanni La Via,  v imenu skupine PPE. – (IT) Gospa predsednica, komisar, gospe in gospodje, tudi jaz se želim v imenu Poslanske skupine Evropske ljudske stranke (Krščanskih demokratov) zahvaliti poročevalcu gospodu Scotti za izjemno delo, ki ga je opravil, hkrati pa želim poudariti, da politike kakovosti nimajo le izjemne zunanje vrednosti zaradi tega, kar lahko ponudimo potrošnikom; ampak so izjemno pomembne zaradi tega, kar lahko dajo proizvajalcem.Kot ste vsi opazili, lahko ima konkurenčnost na trgih številne oblike. Na tako veliki in raznoliki celini, kot je Evropa, ki je veliko bolj opredeljena s stroški proizvodnje, kot pa s konkurenčnostjo, bo težko konkurirati z vidika cene in bomo lahko konkurenčni le z vidika raznolikosti proizvodov.Na politiko kakovosti moramo gledati ravno z vidika raznolikosti, s katero lahko ponudimo in damo na trg proizvod, ki se razlikuje od konkurence, proizvod, ki ga je mogoče prodati tudi brez točnega in posebnega sklicevanja na ceno, ki je nižja v primerjavi s ceno konkurence.Zato smo naklonjeni nadaljnjemu izvajanju prakse označb Skupnosti, ki že poteka, hkrati pa poudarjamo potrebo po ohranjanju razlike med geografskimi označbami in označevanjem porekla. Kljub temu pa moramo poudariti, da mora Unija mednarodno in na ravni pogajanj o mednarodni trgovini, odigrati svoj del pri zaščiti oznak porekla in politik označevanja porekla, da bi se lahko izognili politiki zamenjave oznak, kar bi škodilo našim proizvodom.Izpostaviti želim še eno končno stališče, ki se nanaša na označevanje. Že smo zahtevali in to moramo zahtevati tudi jutri, prek posebne spremembe, da Parlament glasuje o možnosti navajanja porekla surovin, ne samo za sveže, nepredelane proizvode, ampak tudi za predelane proizvode z eno samo sestavino; se pravi tiste, katerih značilni element predstavlja surovina. ","Giovanni La Via,",5,276,not_available,"['ita', 'ita', 'ita', 'ita', 'ita']","['  Giovanni La Via,  v imenu skupine PPE. – (IT) Gospa predsednica, komisar, gospe in gospodje, tudi jaz se želim v imenu Poslanske skupine Evropske ljudske stranke (Krščanskih demokratov) zahvaliti poročevalcu gospodu Scotti za izjemno delo, ki ga je opravil, hkrati pa želim poudariti, da politike kakovosti nimajo le izjemne zunanje vrednosti zaradi tega, kar lahko ponudimo potrošnikom; ampak so izjemno pomembne zaradi tega, kar lahko dajo proizvajalcem.', 'Kot ste vsi opazili, lahko ima konkurenčnost na trgih številne oblike. Na tako veliki in raznoliki celini, kot je Evropa, ki je veliko bolj opredeljena s stroški proizvodnje, kot pa s konkurenčnostjo, bo težko konkurirati z vidika cene in bomo lahko konkurenčni le z vidika raznolikosti proizvodov.', 'Na politiko kakovosti moramo gledati ravno z vidika raznolikosti, s katero lahko ponudimo in damo na trg proizvod, ki se razlikuje od konkurence, proizvod, ki ga je mogoče prodati tudi brez točnega in posebnega sklicevanja na ceno, ki je nižja v primerjavi s ceno konkurence.', 'Zato smo naklonjeni nadaljnjemu izvajanju prakse označb Skupnosti, ki že poteka, hkrati pa poudarjamo potrebo po ohranjanju razlike med geografskimi označbami in označevanjem porekla. Kljub temu pa moramo poudariti, da mora Unija mednarodno in na ravni pogajanj o mednarodni trgovini, odigrati svoj del pri zaščiti oznak porekla in politik označevanja porekla, da bi se lahko izognili politiki zamenjave oznak, kar bi škodilo našim proizvodom.', 'Izpostaviti želim še eno končno stališče, ki se nanaša na označevanje. Že smo zahtevali in to moramo zahtevati tudi jutri, prek posebne spremembe, da Parlament glasuje o možnosti navajanja porekla surovin, ne samo za sveže, nepredelane proizvode, ampak tudi za predelane proizvode z eno samo sestavino; se pravi tiste, katerih značilni element predstavlja surovina. ']"
218, 18. Politika kakovosti kmetijskih proizvodov: katera strategija je prava? (razprava) ,"  Csaba Sándor Tabajdi,  v imenu skupine S&D. – (HU) komisar, kolegi poslanci, v imenu Skupine naprednega zavezništva socialistov in demokratov v Evropskem parlamentu, menimo, da je poročilo, ki ga je pripravil gospod Scottà, izjemno pomembno in se v osnovi strinjamo z njim. Poročilo vsebuje štiri oziroma pet točk, o katerih moramo razpravljati. Prvič, skupni logotip Evropske unije. Številni ljudje ne razumejo, da skupni logotip EU ne predstavlja korak k federalizmu, ampak dokazuje potrošniku, da proizvod izpolnjuje posebne zahteve varnosti živil EU, istočasno pa ga razlikuje od sveta izven meja EU. Zato pozivam, da podpremo poseben logotip EU.Druga točka je vprašanje kraja izvora. Zelo dobro je, da ima EU sedaj komisarja za kmetijstvo, gospoda Daciana Cioloşa, ki razume in podpira pomembnost lokalnih trgov, saj bomo le tako lahko ohranili lokalne posebnosti, regionalne posebnosti in raznolikost hrane v Evropi, prav tako pa je jasno, da ključno vlogo pri tem igrajo politika kakovosti hrane, kraj porekla izvora in označba porekla. Bilo je nekaj nesoglasij s Komisijo in močno upam, da novi komisar ne podpira več prejšnjega stališča, da bi morali vsa zaščitena geografska porekla združiti z zaščitenimi geografskimi označbami. Občasno to vzbuja zaskrbljenost, nazadnje v primeru vina Tokaj. Zahvaljujem se komisarju, da so bili ti problemi deloma odpravljeni, medtem ko je nekatere še treba rešiti.Četrti element: logotip za ekološke izdelke. Glede tega se popolnoma strinjamo. In na koncu peti element: nekateri člani Odbora za kmetijstvo in razvoj podeželja so pozvali k ponovni uvedbi prejšnjih strogih standardov za zelenjavo in sadje. Rad bi se vrnil na izvorno obliko poročila gospoda Scotte. Ne vračajo se v obdobje prekomerne regulacije, ko smo določali, kakšne oblike naj bo kumara. ","Csaba Sándor Tabajdi,",3,274,not_available,"['hun', 'hun', 'hun']","['  Csaba Sándor Tabajdi,  v imenu skupine S&D. – (HU) komisar, kolegi poslanci, v imenu Skupine naprednega zavezništva socialistov in demokratov v Evropskem parlamentu, menimo, da je poročilo, ki ga je pripravil gospod Scottà, izjemno pomembno in se v osnovi strinjamo z njim. Poročilo vsebuje štiri oziroma pet točk, o katerih moramo razpravljati. Prvič, skupni logotip Evropske unije. Številni ljudje ne razumejo, da skupni logotip EU ne predstavlja korak k federalizmu, ampak dokazuje potrošniku, da proizvod izpolnjuje posebne zahteve varnosti živil EU, istočasno pa ga razlikuje od sveta izven meja EU. Zato pozivam, da podpremo poseben logotip EU.', 'Druga točka je vprašanje kraja izvora. Zelo dobro je, da ima EU sedaj komisarja za kmetijstvo, gospoda Daciana Cioloşa, ki razume in podpira pomembnost lokalnih trgov, saj bomo le tako lahko ohranili lokalne posebnosti, regionalne posebnosti in raznolikost hrane v Evropi, prav tako pa je jasno, da ključno vlogo pri tem igrajo politika kakovosti hrane, kraj porekla izvora in označba porekla. Bilo je nekaj nesoglasij s Komisijo in močno upam, da novi komisar ne podpira več prejšnjega stališča, da bi morali vsa zaščitena geografska porekla združiti z zaščitenimi geografskimi označbami. Občasno to vzbuja zaskrbljenost, nazadnje v primeru vina Tokaj. Zahvaljujem se komisarju, da so bili ti problemi deloma odpravljeni, medtem ko je nekatere še treba rešiti.', 'Četrti element: logotip za ekološke izdelke. Glede tega se popolnoma strinjamo. In na koncu peti element: nekateri člani Odbora za kmetijstvo in razvoj podeželja so pozvali k ponovni uvedbi prejšnjih strogih standardov za zelenjavo in sadje. Rad bi se vrnil na izvorno obliko poročila gospoda Scotte. Ne vračajo se v obdobje prekomerne regulacije, ko smo določali, kakšne oblike naj bo kumara. ']"
219, 18. Politika kakovosti kmetijskih proizvodov: katera strategija je prava? (razprava) ,"  George Lyon,  v imenu skupine ALDE. – Gospa predsednica, ali se lahko najprej tudi jaz zahvalim gospodu Scotti za njegovo poročilo.Vsebuje veliko pohvalnih stvari. Žal ga sam in moji kolegi iz skupine ALDE ne moremo podpreti v trenutni obliki, ne da bi pred tem prišlo do ene ali dveh sprememb.Ne moremo podpreti odstavka 19, tako imenovanega odstavka „manjvrednega sadja“. Verjamem, da je neumno, če birokrati v Bruslju pravijo potrošnikom, da lahko kupijo samo ravne banane ali ravne kumare.Seveda so potrošniki tisti, ki sprejemajo odločitve, kaj želijo kupiti, torej upam, da bo Parlament uporabil zdravo pamet in podprl skupno spremembo, ki sta jo predložili skupina Zelenih in ECR, da bi odpravili pravila o ravnih bananah in prepustili potrošnikom, da se svobodno odločijo ali želijo jesti ukrivljeno ali zvito sadje in zelenjavo. Vsekakor je to odločitev potrošnikov.Marianne Fischer-Boel, prejšnja komisarka, se je odločila za odpravo standardov in upam, da bomo še naprej podpirali to odločitev.Prav tako si želim nekaj sprememb v odstavku 16. Razumem poziv k logotipu EU, vendar če je brez pomena za potrošnike in ne prinaša dodane vrednosti za kmete, potem gre za nesmiselno delovanje. Doseči mora odziv pri potrošnikih, kmečkemu prebivalstvu pa zagotoviti nekakšno povračilo. Sicer je nekoristen. Ni vreden napora in ne vidim nobenega dokaza, ki bi nakazoval na to, da si evropski potrošniki želijo takšnega logotipa EU.Iz odstavka 62 izhaja kritika sistema zasebnega certificiranja, ki je bil na Škotskem zelo uspešen. Zdi se mi, da je za kmete dobro, če na prostovoljni osnovi, dodajo vrednost svojim proizvodom preko načrtov zagotavljanja kakovosti in morali bi jih podpirati, ne pa odvračati od tega.Upam, da bomo na jutrišnjem glasovanju doživeli nekaj sprememb tega poročila, saj ga bomo lahko podprli le s spremembami, o katerih bomo jutri glasovali. ","George Lyon,",8,294,not_available,"['slv', 'slv', 'slv', 'slv', 'slv', 'slv', 'slv', 'slv']","['  George Lyon,  v imenu skupine ALDE. – Gospa predsednica, ali se lahko najprej tudi jaz zahvalim gospodu Scotti za njegovo poročilo.', 'Vsebuje veliko pohvalnih stvari. Žal ga sam in moji kolegi iz skupine ALDE ne moremo podpreti v trenutni obliki, ne da bi pred tem prišlo do ene ali dveh sprememb.', 'Ne moremo podpreti odstavka 19, tako imenovanega odstavka „manjvrednega sadja“. Verjamem, da je neumno, če birokrati v Bruslju pravijo potrošnikom, da lahko kupijo samo ravne banane ali ravne kumare.', 'Seveda so potrošniki tisti, ki sprejemajo odločitve, kaj želijo kupiti, torej upam, da bo Parlament uporabil zdravo pamet in podprl skupno spremembo, ki sta jo predložili skupina Zelenih in ECR, da bi odpravili pravila o ravnih bananah in prepustili potrošnikom, da se svobodno odločijo ali želijo jesti ukrivljeno ali zvito sadje in zelenjavo. Vsekakor je to odločitev potrošnikov.', 'Marianne Fischer-Boel, prejšnja komisarka, se je odločila za odpravo standardov in upam, da bomo še naprej podpirali to odločitev.', 'Prav tako si želim nekaj sprememb v odstavku 16. Razumem poziv k logotipu EU, vendar če je brez pomena za potrošnike in ne prinaša dodane vrednosti za kmete, potem gre za nesmiselno delovanje. Doseči mora odziv pri potrošnikih, kmečkemu prebivalstvu pa zagotoviti nekakšno povračilo. Sicer je nekoristen. Ni vreden napora in ne vidim nobenega dokaza, ki bi nakazoval na to, da si evropski potrošniki želijo takšnega logotipa EU.', 'Iz odstavka 62 izhaja kritika sistema zasebnega certificiranja, ki je bil na Škotskem zelo uspešen. Zdi se mi, da je za kmete dobro, če na prostovoljni osnovi, dodajo vrednost svojim proizvodom preko načrtov zagotavljanja kakovosti in morali bi jih podpirati, ne pa odvračati od tega.', 'Upam, da bomo na jutrišnjem glasovanju doživeli nekaj sprememb tega poročila, saj ga bomo lahko podprli le s spremembami, o katerih bomo jutri glasovali. ']"
