,agenda_item,text,speaker,number_p,number_w,chair,language_ps,ps
0, 1. Nadaljevanje zasedanja,PREDSEDSTVO: GOSPOD BUZEK predsednik (Seja se je začela ob 15.05) ,PREDSEDSTVO: GOSPOD BUZEK,2,11,not_available,"['slv', 'slv']","['PREDSEDSTVO: GOSPOD BUZEK predsednik', ' (Seja se je začela ob 15.05) ']"
1, 1. Nadaljevanje zasedanja,"  Predsednik. -   Razglašam, da se zasedanje Evropskega parlamenta, ki je bilo prekinjeno v četrtek, 11. marca 2010, nadaljuje. ",Predsednik. -,1,17,not_available,['slv'],"['  Predsednik. -   Razglašam, da se zasedanje Evropskega parlamenta, ki je bilo prekinjeno v četrtek, 11. marca 2010, nadaljuje. ']"
2, 10. Razpored dela,"  Predsednik. -   Končni osnutek dnevnega reda, ki ga je 11. marca 2010 pripravila konferenca predsednikov v skladu s členom 137 Poslovnika, je bil razdeljen.V soglasju s političnimi skupinami bi rad predlagal naslednje spremembe:***",Predsednik. -,3,33,not_available,"['slv', 'slv', 'slv']","['  Predsednik. -   Končni osnutek dnevnega reda, ki ga je 11. marca 2010 pripravila konferenca predsednikov v skladu s členom 137 Poslovnika, je bil razdeljen.', 'V soglasju s političnimi skupinami bi rad predlagal naslednje spremembe:', '***']"
3, 10. Razpored dela,"  Mario Borghezio  (EFD).   – (IT) Želel bi obvestiti predsednika – kot sem že storil v pismu – da je izredni odbor za finančno krizo nepravilno izločil strokovnjaka, priznanega demografa profesorja Bourcierja de Carbona, brez pravega razloga, in ga opisal kot neprimerno osebo.Mislim, da imamo opravka z izjemno resnim primerom, ko je nekdo bil izločen s položaja strokovnjaka na podlagi ideoloških razlogov v enem od odborov Evropskega parlamenta… (Predsednik je prekinil govornika) ",Mario Borghezio  (EFD).,3,69,not_available,"['ita', 'ita', 'ita']","['  Mario Borghezio  (EFD).   – (IT) Želel bi obvestiti predsednika – kot sem že storil v pismu – da je izredni odbor za finančno krizo nepravilno izločil strokovnjaka, priznanega demografa profesorja Bourcierja de Carbona, brez pravega razloga, in ga opisal kot neprimerno osebo.', 'Mislim, da imamo opravka z izjemno resnim primerom, ko je nekdo bil izločen s položaja strokovnjaka na podlagi ideoloških razlogov v enem od odborov Evropskega parlamenta… ', '(Predsednik je prekinil govornika) ']"
4, 10. Razpored dela,"  Predsednik. -   Gospod Borghezio, to ni vprašanje pravilnosti postopka, saj govorimo o plenarnem zasedanju. Prosim, ta vprašanja postavljajte med srečanji odbora, ko se ta zadeva lahko obravnava, med plenarnim zasedanjem pa se morajo vprašanja glede pravilnosti postopka nanašati na naše delo na plenarnih zasedanjih in ne na delo odborov. ",Predsednik. -,1,48,not_available,['slv'],"['  Predsednik. -   Gospod Borghezio, to ni vprašanje pravilnosti postopka, saj govorimo o plenarnem zasedanju. Prosim, ta vprašanja postavljajte med srečanji odbora, ko se ta zadeva lahko obravnava, med plenarnim zasedanjem pa se morajo vprašanja glede pravilnosti postopka nanašati na naše delo na plenarnih zasedanjih in ne na delo odborov. ']"
5, 10. Razpored dela,"  William (The Earl of) Dartmouth  (EFD).   – Gospod predsednik, 11. marca mi je na razpravi o politiki za Arktiko, ko sem imel na razpolago še četrtino dodeljenega časa, predsednik, ki pripada skupini ALDE/liberalnim demokratom, ugasnil mikrofon. To se do zdaj skorajda še ni zgodilo.Gospod predsednik, poslal sem vam že pismo – na katero nisem prejel odgovora – in rad bi vas vprašal, v skladu s katerim pravilom je bil mikrofon izključen in zakaj je bilo treba uporabiti to pravilo. Navajal sem zakonite – in resnične – politične pripombe, s katerimi se predsednik, poslanec skupine ALDE, ni strinjal. Zato je bil mikrofon izključen. Če Evropski parlament cenzurira politične pripombe, potem to ni več parlament. ",William (The Earl of) Dartmouth  (EFD).,2,110,not_available,"['slv', 'slv']","['  William (The Earl of) Dartmouth  (EFD).   – Gospod predsednik, 11. marca mi je na razpravi o politiki za Arktiko, ko sem imel na razpolago še četrtino dodeljenega časa, predsednik, ki pripada skupini ALDE/liberalnim demokratom, ugasnil mikrofon. To se do zdaj skorajda še ni zgodilo.', 'Gospod predsednik, poslal sem vam že pismo – na katero nisem prejel odgovora – in rad bi vas vprašal, v skladu s katerim pravilom je bil mikrofon izključen in zakaj je bilo treba uporabiti to pravilo. Navajal sem zakonite – in resnične – politične pripombe, s katerimi se predsednik, poslanec skupine ALDE, ni strinjal. Zato je bil mikrofon izključen. Če Evropski parlament cenzurira politične pripombe, potem to ni več parlament. ']"
6, 10. Razpored dela,"  Predsednik. -   Podpredsednik Parlamenta, ki je takrat vodil zasedanje, je pravilno uporabil postopek v skladu s členom 20(2) Poslovnika. Pisno bom odgovoril na pismo, ki ste mi ga poslali.***ČetrtekSkupina Evropske ljudske stranke (Krščanskih demokratov) je zaprosila za odlog glasovanja o predlogu resolucije konference predsednikov glede prehoda na Lizbonsko pogodbo za še nedokončane medinstitucionalne zakonodajne postopke. Torej gre za preložitev glasovanja. ",Predsednik. -,4,61,not_available,"['slv', 'slv', 'slv', 'slv']","['  Predsednik. -   Podpredsednik Parlamenta, ki je takrat vodil zasedanje, je pravilno uporabil postopek v skladu s členom 20(2) Poslovnika. Pisno bom odgovoril na pismo, ki ste mi ga poslali.', '***', 'Četrtek', 'Skupina Evropske ljudske stranke (Krščanskih demokratov) je zaprosila za odlog glasovanja o predlogu resolucije konference predsednikov glede prehoda na Lizbonsko pogodbo za še nedokončane medinstitucionalne zakonodajne postopke. Torej gre za preložitev glasovanja. ']"
7, 10. Razpored dela,"  József Szájer  (PPE).   – Gospod predsednik, zaprosili smo za preložitev glasovanja glede tega predloga v interesu Parlamenta. Sprva smo se strinjali, da ga uvrstimo na dnevni red, ker smo predpostavljali, da je vse v redu. Vendar pa je šlo za hitri postopek in v tem času smo izvedeli, da vsi odbori glede tega vprašanja niso bili pravilno vprašani za mnenje. To je predlog skupine PPE, vendar nekateri odbori želijo več časa glede te pomembne in zapletene zadeve, naj bo še tako nujna. Zato prosimo, da se glasovanje glede te zadeve preloži. ",József Szájer  (PPE).,1,90,not_available,['slv'],"['  József Szájer  (PPE).   – Gospod predsednik, zaprosili smo za preložitev glasovanja glede tega predloga v interesu Parlamenta. Sprva smo se strinjali, da ga uvrstimo na dnevni red, ker smo predpostavljali, da je vse v redu. Vendar pa je šlo za hitri postopek in v tem času smo izvedeli, da vsi odbori glede tega vprašanja niso bili pravilno vprašani za mnenje. To je predlog skupine PPE, vendar nekateri odbori želijo več časa glede te pomembne in zapletene zadeve, naj bo še tako nujna. Zato prosimo, da se glasovanje glede te zadeve preloži. ']"
8, 11. Dobrodošlica,"  Predsednik. -   Za vas imam posebno obvestilo. Toplo bi želel pozdraviti delegacijo vseafriškega parlamenta, ki jo vodi njena podpredsednica, gospa Mugyenyi. Z nami so na zasedanju. Prosimo, pozdravite jih.(Aplavz)Druga podpredsednica vseafriškega parlamenta in predsednica delegacije za odnose z Evropskim parlamentom. Naša parlamenta tesno sodelujeta in vaša prisotnost danes nam je v veliko zadovoljstvo.Želel bi izkoristiti to priložnost, da se vam zahvalim za povabilo, da spregovorim na zasedanju vseafriškega parlamenta, ki bo čez tri tedne. Na žalost ne bom mogel biti tam, vendar vam bom ob tej priložnosti poslal pismo. Prepričan sem, da se bomo ob priložnosti znova srečali.Še enkrat vas vse toplo pozdravljam. ",Predsednik. -,5,106,not_available,"['slv', 'slv', 'slv', 'slv', 'slv']","['  Predsednik. -   Za vas imam posebno obvestilo. Toplo bi želel pozdraviti delegacijo vseafriškega parlamenta, ki jo vodi njena podpredsednica, gospa Mugyenyi. Z nami so na zasedanju. Prosimo, pozdravite jih.', '(Aplavz)', 'Druga podpredsednica vseafriškega parlamenta in predsednica delegacije za odnose z Evropskim parlamentom. Naša parlamenta tesno sodelujeta in vaša prisotnost danes nam je v veliko zadovoljstvo.', 'Želel bi izkoristiti to priložnost, da se vam zahvalim za povabilo, da spregovorim na zasedanju vseafriškega parlamenta, ki bo čez tri tedne. Na žalost ne bom mogel biti tam, vendar vam bom ob tej priložnosti poslal pismo. Prepričan sem, da se bomo ob priložnosti znova srečali.', 'Še enkrat vas vse toplo pozdravljam. ']"
9, 12. Priprave na Evropski svet (25. - 26. marec 2010) (razprava) ,  Predsednik. -   Naslednja točka je razprava glede izjave Sveta in Komisije v zvezi s pripravo na Evropski svet (25. - 26. marec 2010). ,Predsednik. -,1,21,not_available,['slv'],['  Predsednik. -   Naslednja točka je razprava glede izjave Sveta in Komisije v zvezi s pripravo na Evropski svet (25. - 26. marec 2010). ']
10, 12. Priprave na Evropski svet (25. - 26. marec 2010) (razprava) ,"  Diego López Garrido,  predsedujoči Svetu. – (ES) Gospod predsednik, v teh prvih mesecih leta 2010 smo priča izredno močni dinamiki v Evropski uniji, in to na sred najresnejše gospodarske krize v zadnjih osemdesetih letih. Istočasno izvajamo novo pogodbo, Lizbonsko pogodbo, ustanavljamo nove institucije in opravljamo zelo obsežno preurejanje ureditve naših gospodarskih sistemov. To se včasih dogaja na nekoliko neorganiziran način zaradi odzivanja na velike izzive, ki jih sproti srečujemo; trenutno na primer na položaj grškega finančnega sistema. Vendar se Evropa spopada s tem položajem z ustvarjanjem novih orodij gospodarske politike na vseh področjih.Zato včasih ne razločimo gozda zaradi dreves, vendar ustvarjamo popolnoma novo pot za reševanje izjemno zapletenega gospodarstva 21. stoletja, in to z evropskim pristopom.Na takšen način smo se odzvali na zelo resno krizo in prva reakcija je bilo vlaganje javnega denarja v gospodarstvo Evrope, kar je privedlo v velike primanjkljaje.Na tak način smo se odzvali z obravnavo – in tukaj smo, da jo odobrimo – popolne reforme nadzora finančnega sistema.Na tak način se odzivamo, in to z usklajevanjem gospodarskih politik. Komisija je navedla, da bo v zvezi s tem predložila predlog za usklajevanje gospodarskih politik, zlasti v območju evra. Poleg tega se prav tako srečujemo z zelo odločnimi in jasnimi ukrepi Evropske unije v podporo finančni stabilnosti na območju evra. Ta politična zaveza je bila sprejeta 11. februarja, da bi utrdila in ohranila finančno stabilnost na območju evra.Obstaja še ena pobuda, ki je nedvomno del tega svežnja: zaveza za novo strategijo za rast in ustvarjanje visokokakovostnih delovnih mest. To je glavna delovna tema Evropskega sveta ta konec tedna; strategija, ki jo je opredelila in razširila Evropska komisija v dokumentu z dne 3. marca in ki jo bodo podrobno preučili voditelji držav ali vlad na spomladanskem Svetu, zlasti s stališča tako imenovanih „strateških ciljev“. To so strateški cilji, ki jih je Evropska komisija navedla v svojem dokumentu, kot so vprašanja zaposlitve, vlaganj v raziskave in razvoj, podnebnih sprememb in energijo, zgodnjega zapuščanja šole, izobraževanja na splošno in revščine. Poleg tega bo Evropski svet prav tako obravnaval vprašanje vodenja, ki je po našem mnenju ena od pomanjkljivosti tako imenovane Lizbonske strategije. Svet si želi, da bi se to vodenje vrtelo okrog njegovega lastnega političnega vodenja ter ukrepov Komisije pri nadziranju izpolnjevanja zavez, ki so jih sprejele države članice. To se bo seveda odvijalo v tesnem sodelovanju z in ob nadzoru Parlamenta ter seveda institucij Unije kot celote.To bo osnovni namen zasedanj Evropskega sveta ta konec tedna, poleg enako pomembnega področja boja proti podnebnim spremembam, pri katerem je EU še zmeraj vodilna. Evropska unija bo obdržala svojo vodilno vlogo na svetu v boju zoper podnebne spremembe; to mora storiti, še naprej mora imeti pri tem vodilno vlogo. Poleg tega imamo merljivo zavezo za tako imenovan „hiter začetek“. Zato upajmo, da bo Evropski svet izmeril in ponovno potrdil to zavezo za pomoč državam v razvoju pri boju proti podnebnim spremembam tudi v naslednjih nekaj letih. Zavezo razvitih držav, da bodo na splošno sodelovale s tistimi, ki še niso razvite, da bomo vsi prispeli na zelo pomembno konferenco v Kankunu v najboljšem možnem stanju. Na tej konferenci mora Evropska unija – ponavljam – obdržati svoj vodilni položaj, ki ga ima zdaj, brez katerega københavnskih dogovorov, za katere menimo, da niso zadostni, gotovo ne bi dosegli.Države članice so soglasno potrdile svoje popolno strinjanje s temi cilji in da se želijo odločno premakniti k pravno zavezujočim obvezam na konferenci v Kankunu v Mehiki.Voditelji držav in vlad bodo v veliki meri obravnavali ta vprašanja. Prav tako je mogoče – odvisno od tega, kar se bo zdaj zgodilo, ko se evropske institucije odločajo, kako se lotiti krize, ki se nanaša na tako imenovani grški primer – da se bodo ukvarjali z vprašanjem finančnega položaja v Grčiji in ponovnega financiranja javnega dolga te države. Tudi to vprašanje se bo nedvomno pojavilo tam, ker predstavlja del politične zaveze, ki jo je Evropska unija sprejela 11. februarja na ravni voditeljev držav in vlad. To je bila politična zaveza za podporo finančne stabilnosti območja evra v smislu, da če je treba sprejeti posebne ukrepe za vzdrževanje te finančne stabilnosti, bodo takšni ukrepi sprejeti.To je vsekakor načelo, ki bo zelo prisotno na srečanju Evropskega sveta ta konec tedna. ","Diego López Garrido,",11,698,not_available,"['spa', 'spa', 'spa', 'spa', 'spa', 'spa', 'spa', 'spa', 'spa', 'spa', 'spa']","['  Diego López Garrido,  predsedujoči Svetu. – (ES) Gospod predsednik, v teh prvih mesecih leta 2010 smo priča izredno močni dinamiki v Evropski uniji, in to na sred najresnejše gospodarske krize v zadnjih osemdesetih letih. Istočasno izvajamo novo pogodbo, Lizbonsko pogodbo, ustanavljamo nove institucije in opravljamo zelo obsežno preurejanje ureditve naših gospodarskih sistemov. ', 'To se včasih dogaja na nekoliko neorganiziran način zaradi odzivanja na velike izzive, ki jih sproti srečujemo; trenutno na primer na položaj grškega finančnega sistema. Vendar se Evropa spopada s tem položajem z ustvarjanjem novih orodij gospodarske politike na vseh področjih.', 'Zato včasih ne razločimo gozda zaradi dreves, vendar ustvarjamo popolnoma novo pot za reševanje izjemno zapletenega gospodarstva 21. stoletja, in to z evropskim pristopom.', 'Na takšen način smo se odzvali na zelo resno krizo in prva reakcija je bilo vlaganje javnega denarja v gospodarstvo Evrope, kar je privedlo v velike primanjkljaje.', 'Na tak način smo se odzvali z obravnavo – in tukaj smo, da jo odobrimo – popolne reforme nadzora finančnega sistema.', 'Na tak način se odzivamo, in to z usklajevanjem gospodarskih politik. Komisija je navedla, da bo v zvezi s tem predložila predlog za usklajevanje gospodarskih politik, zlasti v območju evra. Poleg tega se prav tako srečujemo z zelo odločnimi in jasnimi ukrepi Evropske unije v podporo finančni stabilnosti na območju evra. Ta politična zaveza je bila sprejeta 11. februarja, da bi utrdila in ohranila finančno stabilnost na območju evra.', 'Obstaja še ena pobuda, ki je nedvomno del tega svežnja: zaveza za novo strategijo za rast in ustvarjanje visokokakovostnih delovnih mest. To je glavna delovna tema Evropskega sveta ta konec tedna; strategija, ki jo je opredelila in razširila Evropska komisija v dokumentu z dne 3. marca in ki jo bodo podrobno preučili voditelji držav ali vlad na spomladanskem Svetu, zlasti s stališča tako imenovanih „strateških ciljev“. To so strateški cilji, ki jih je Evropska komisija navedla v svojem dokumentu, kot so vprašanja zaposlitve, vlaganj v raziskave in razvoj, podnebnih sprememb in energijo, zgodnjega zapuščanja šole, izobraževanja na splošno in revščine. Poleg tega bo Evropski svet prav tako obravnaval vprašanje vodenja, ki je po našem mnenju ena od pomanjkljivosti tako imenovane Lizbonske strategije. Svet si želi, da bi se to vodenje vrtelo okrog njegovega lastnega političnega vodenja ter ukrepov Komisije pri nadziranju izpolnjevanja zavez, ki so jih sprejele države članice. To se bo seveda odvijalo v tesnem sodelovanju z in ob nadzoru Parlamenta ter seveda institucij Unije kot celote.', 'To bo osnovni namen zasedanj Evropskega sveta ta konec tedna, poleg enako pomembnega področja boja proti podnebnim spremembam, pri katerem je EU še zmeraj vodilna. Evropska unija bo obdržala svojo vodilno vlogo na svetu v boju zoper podnebne spremembe; to mora storiti, še naprej mora imeti pri tem vodilno vlogo. Poleg tega imamo merljivo zavezo za tako imenovan „hiter začetek“. Zato upajmo, da bo Evropski svet izmeril in ponovno potrdil to zavezo za pomoč državam v razvoju pri boju proti podnebnim spremembam tudi v naslednjih nekaj letih. Zavezo razvitih držav, da bodo na splošno sodelovale s tistimi, ki še niso razvite, da bomo vsi prispeli na zelo pomembno konferenco v Kankunu v najboljšem možnem stanju. Na tej konferenci mora Evropska unija – ponavljam – obdržati svoj vodilni položaj, ki ga ima zdaj, brez katerega københavnskih dogovorov, za katere menimo, da niso zadostni, gotovo ne bi dosegli.', 'Države članice so soglasno potrdile svoje popolno strinjanje s temi cilji in da se želijo odločno premakniti k pravno zavezujočim obvezam na konferenci v Kankunu v Mehiki.', 'Voditelji držav in vlad bodo v veliki meri obravnavali ta vprašanja. Prav tako je mogoče – odvisno od tega, kar se bo zdaj zgodilo, ko se evropske institucije odločajo, kako se lotiti krize, ki se nanaša na tako imenovani grški primer – da se bodo ukvarjali z vprašanjem finančnega položaja v Grčiji in ponovnega financiranja javnega dolga te države. Tudi to vprašanje se bo nedvomno pojavilo tam, ker predstavlja del politične zaveze, ki jo je Evropska unija sprejela 11. februarja na ravni voditeljev držav in vlad. To je bila politična zaveza za podporo finančne stabilnosti območja evra v smislu, da če je treba sprejeti posebne ukrepe za vzdrževanje te finančne stabilnosti, bodo takšni ukrepi sprejeti.', 'To je vsekakor načelo, ki bo zelo prisotno na srečanju Evropskega sveta ta konec tedna. ']"
