,agenda_item,text,speaker,number_p,number_w,chair,language_ps,ps
131, 14. Razmere v Tibetu (razprava) ,"  Tunne Kelam  (PPE).   – Gospa predsednica, Tibet in njegova kulturna dediščina sta naš skupni zaklad. V našem skupnem interesu je, da se tibetanska identiteta, vera in jezik ohranita in razvijata v najboljših možnih pogojih.Na žalost temu ni tako. Pod krinko industrijskega razvoja se odvija kulturni genocid in Tibetanci so na robu tega, da v lastni deželi postanejo manjšina. To se lahko prepreči le, če se jim podeli resnično neodvisen status. EU lahko s svojim vplivom prispeva k temu, da se začne nepristranski in konstruktiven dialog, ki bi spoštoval obe strani.Komisar, omenil bi vašo izjavo, da je Tibet naša utemeljena skrb. Kot rezultat takega dialoga in z odprtjem Tibeta za tuje medije in strokovnjake ZN za človekove pravice lahko kitajska vlada predvsem pridobi, ne le v notranjem smislu, pač pa predvsem v mednarodnem smislu. Kitajska lahko postane resnično mogočna le, če pokaže spoštovanje do manjšin. Gesta dobre volje bi bila, če bi dalajlami, katerega avtoriteta se priznava po vsem svetu, dovolili, da obišče svojo domovino.EU bi morala popolnoma izkoristiti Lizbonsko pogodbo in pokazati aktivno solidarnost – preko konkretnih dejanj – z usodo naroda, katerega obstoj je ogrožen in katerega naravna pravica do neodvisnosti in varovanja lastne kulture je ostro zatirana. Podpiram idejo, da bi se baronica Ashton morala srečati z dalajlamo in EU bi navsezadnje morala zagotoviti posebnega predstavnika za Tibet. ",Tunne Kelam  (PPE).,4,220,not_available,"['slv', 'slv', 'slv', 'slv']","['  Tunne Kelam  (PPE).   – Gospa predsednica, Tibet in njegova kulturna dediščina sta naš skupni zaklad. V našem skupnem interesu je, da se tibetanska identiteta, vera in jezik ohranita in razvijata v najboljših možnih pogojih.', 'Na žalost temu ni tako. Pod krinko industrijskega razvoja se odvija kulturni genocid in Tibetanci so na robu tega, da v lastni deželi postanejo manjšina. To se lahko prepreči le, če se jim podeli resnično neodvisen status. EU lahko s svojim vplivom prispeva k temu, da se začne nepristranski in konstruktiven dialog, ki bi spoštoval obe strani.', 'Komisar, omenil bi vašo izjavo, da je Tibet naša utemeljena skrb. Kot rezultat takega dialoga in z odprtjem Tibeta za tuje medije in strokovnjake ZN za človekove pravice lahko kitajska vlada predvsem pridobi, ne le v notranjem smislu, pač pa predvsem v mednarodnem smislu. Kitajska lahko postane resnično mogočna le, če pokaže spoštovanje do manjšin. Gesta dobre volje bi bila, če bi dalajlami, katerega avtoriteta se priznava po vsem svetu, dovolili, da obišče svojo domovino.', 'EU bi morala popolnoma izkoristiti Lizbonsko pogodbo in pokazati aktivno solidarnost – preko konkretnih dejanj – z usodo naroda, katerega obstoj je ogrožen in katerega naravna pravica do neodvisnosti in varovanja lastne kulture je ostro zatirana. Podpiram idejo, da bi se baronica Ashton morala srečati z dalajlamo in EU bi navsezadnje morala zagotoviti posebnega predstavnika za Tibet. ']"
132, 14. Razmere v Tibetu (razprava) ,"  Peter Šťastný  (PPE).   – (SK) 10. marca obeležujemo 51. obletnico vstaje v Tibetu, pa tudi drugo obletnico protestov, in oboje so kitajske oborožene sile nasilno zatrle.Glavno vprašanje je nepripravljenost Kitajske za pogovore z zakonitimi predstavniki tibetanske manjšine in poskus postopne asimilacije in uničenja kulture in religije v Tibetu. Osebno vem, česa je brezbožni in materialistični komunistični režim sposoben. Ena od najstarejših kultur in ena od najstarejših religij, ki sta preživeli več tisočletij, sta resno ogroženi. Svetovna javnost ne more ostati tiho. Sam sem član skupine Prijatelji Tibeta pri Evropskem parlamentu. Takšne skupine zdaj delujejo v številnih parlamentih po svetu, na primer v ZDA, Nemčiji, Avstraliji, Indiji, Češki republiki in drugod.Ponosno oznanjam, da bo od 9. marca skupina Prijatelji Tibeta prav tako delovala v Nacionalnem svetu Republike Slovaške. Verjamem, da lahko pomagamo rešiti tibetanski problem z mediacijo pogajanj med najvišjimi kitajskimi predstavniki in Njegovo svetostjo, štirinajstim dalajlamo. To je prav tako možen način za uspešen zaključek in razrešitev problema tibetanskih beguncev, saj večina med njimi živi v težkih pogojih v sosednjih državah. Pozivam Komisijo, naj v svojih programih ne pozabi na to zelo zatirano skupino ljudi. ",Peter Šťastný  (PPE).,3,186,not_available,"['slo', 'slo', 'slo']","['  Peter Šťastný  (PPE).   – (SK) 10. marca obeležujemo 51. obletnico vstaje v Tibetu, pa tudi drugo obletnico protestov, in oboje so kitajske oborožene sile nasilno zatrle.', 'Glavno vprašanje je nepripravljenost Kitajske za pogovore z zakonitimi predstavniki tibetanske manjšine in poskus postopne asimilacije in uničenja kulture in religije v Tibetu. Osebno vem, česa je brezbožni in materialistični komunistični režim sposoben. Ena od najstarejših kultur in ena od najstarejših religij, ki sta preživeli več tisočletij, sta resno ogroženi. Svetovna javnost ne more ostati tiho. Sam sem član skupine Prijatelji Tibeta pri Evropskem parlamentu. Takšne skupine zdaj delujejo v številnih parlamentih po svetu, na primer v ZDA, Nemčiji, Avstraliji, Indiji, Češki republiki in drugod.', 'Ponosno oznanjam, da bo od 9. marca skupina Prijatelji Tibeta prav tako delovala v Nacionalnem svetu Republike Slovaške. Verjamem, da lahko pomagamo rešiti tibetanski problem z mediacijo pogajanj med najvišjimi kitajskimi predstavniki in Njegovo svetostjo, štirinajstim dalajlamo. To je prav tako možen način za uspešen zaključek in razrešitev problema tibetanskih beguncev, saj večina med njimi živi v težkih pogojih v sosednjih državah. Pozivam Komisijo, naj v svojih programih ne pozabi na to zelo zatirano skupino ljudi. ']"
133, 14. Razmere v Tibetu (razprava) ,"  Jarosław Leszek Wałęsa  (PPE).   – (PL) Gospa predsednica, optimistični smo glede današnje razprave, ker se mi zdi, da obstaja veliko soglasje. Po drugi strani pa je tukaj že bilo veliko takšnih razprav in pri govorjenju smo zelo dobri. Ne želim, da me pograbi sveta jeza, ker sem hinavec, tako kot so v bistvi vsi v tej dvorani. Hinavec, ki je odvisen od nečesa – od tiste poceni kitajske robe. V tem trenutku pa bi morda morali imeti dovolj samospoštovanja, da govorimo kategorično in nasprotujemo določenim stvarem ter spoštujemo tiste ideale, ki so nam dragi.Morda bo prvi in najpomembnejši korak nekaj, kar je že bilo omenjeno tukaj, nekaj, o čemer smo govorili. V mislih imam imenovanje posebnega koordinatorja za Tibet. Nekoga, ki bo vodil proces, nekoga, ki bo prevzel odgovornost v našem imenu za izziv, ki ga predstavlja problem Tibeta, tako da ne bomo neopredeljeni in tako da bomo trdno in prepričljivo rekli, da so nam človekove pravice in državljanske svoboščine pomembne. Napravimo to. Napravimo to zdaj. ",Jarosław Leszek Wałęsa  (PPE).,2,165,not_available,"['pol', 'pol']","['  Jarosław Leszek Wałęsa  (PPE).   – (PL) Gospa predsednica, optimistični smo glede današnje razprave, ker se mi zdi, da obstaja veliko soglasje. Po drugi strani pa je tukaj že bilo veliko takšnih razprav in pri govorjenju smo zelo dobri. Ne želim, da me pograbi sveta jeza, ker sem hinavec, tako kot so v bistvi vsi v tej dvorani. Hinavec, ki je odvisen od nečesa – od tiste poceni kitajske robe. V tem trenutku pa bi morda morali imeti dovolj samospoštovanja, da govorimo kategorično in nasprotujemo določenim stvarem ter spoštujemo tiste ideale, ki so nam dragi.', 'Morda bo prvi in najpomembnejši korak nekaj, kar je že bilo omenjeno tukaj, nekaj, o čemer smo govorili. V mislih imam imenovanje posebnega koordinatorja za Tibet. Nekoga, ki bo vodil proces, nekoga, ki bo prevzel odgovornost v našem imenu za izziv, ki ga predstavlja problem Tibeta, tako da ne bomo neopredeljeni in tako da bomo trdno in prepričljivo rekli, da so nam človekove pravice in državljanske svoboščine pomembne. Napravimo to. Napravimo to zdaj. ']"
134, 14. Razmere v Tibetu (razprava) ,"  Raül Romeva i Rueda  (Verts/ALE).   – (ES) Gospa predsednica, govor o Tibetu danes tukaj je stvar pravičnosti in stvar odgovornosti. Zato se ne strinjam s tistimi, ki menijo, da nas to vprašanje ne zadeva.O tej zadevi poročamo že vrsto let in z zaskrbljenostjo opažam, da kljub ogromnim prizadevanjem tibetanske delegacije, zlasti dalajlame, za spodbujanje dialoga, za približanje kitajskim oblastem, za najdbo pravične in trajne rešitve za ta konflikt, blokado položaja vedno znova povzročajo kitajske oblasti.Mi v Evropski uniji ne moremo še naprej tolerirati te igre, še manj pa jo podžigati. Zato se mi zdi bistveno, ne le da vas še enkrat spomnim na nujnost in pomembnost te razprave, temveč da vas tudi ponovno spomnim, da je tista, ki trenutno stoji na poti do rešitve, Kitajska.Prav tako moramo biti jasni v tem pogledu. Edini način, kako je Evropska unija lahko dosledna, ko reče, da je zavezana človekovim pravicam, je, da sprejme, da mora prav tako nositi stroške v poslovnem in gospodarskem smislu. Drugače nič ne bo verodostojno v smislu človekovih pravic. ",Raül Romeva i Rueda  (Verts/ALE).,4,173,not_available,"['spa', 'spa', 'spa', 'spa']","['  Raül Romeva i Rueda  (Verts/ALE).   – (ES) Gospa predsednica, govor o Tibetu danes tukaj je stvar pravičnosti in stvar odgovornosti. Zato se ne strinjam s tistimi, ki menijo, da nas to vprašanje ne zadeva.', 'O tej zadevi poročamo že vrsto let in z zaskrbljenostjo opažam, da kljub ogromnim prizadevanjem tibetanske delegacije, zlasti dalajlame, za spodbujanje dialoga, za približanje kitajskim oblastem, za najdbo pravične in trajne rešitve za ta konflikt, blokado položaja vedno znova povzročajo kitajske oblasti.', 'Mi v Evropski uniji ne moremo še naprej tolerirati te igre, še manj pa jo podžigati. Zato se mi zdi bistveno, ne le da vas še enkrat spomnim na nujnost in pomembnost te razprave, temveč da vas tudi ponovno spomnim, da je tista, ki trenutno stoji na poti do rešitve, Kitajska.', 'Prav tako moramo biti jasni v tem pogledu. Edini način, kako je Evropska unija lahko dosledna, ko reče, da je zavezana človekovim pravicam, je, da sprejme, da mora prav tako nositi stroške v poslovnem in gospodarskem smislu. Drugače nič ne bo verodostojno v smislu človekovih pravic. ']"
135, 14. Razmere v Tibetu (razprava) ,"  László Tőkés  (PPE).   – Gospa predsednica, 10. marca smo praznovali 51. obletnico ljudske vstaje v Tibetu. Od takrat je preko dosledne in vztrajne zavezanosti za pridobitev prave neodvisnosti za svoj narod dalajlama svetu ponudil model, kako si prizadevati za demokracijo preko nenasilnih sredstev.Evropejci se učimo od Njegove svetosti, dalajlame. Nedavno je izrazil svojo solidarnost z etnično ujgursko manjšino in stopil na stran Aung San Suu Kyi in ostalih demokratičnih disidentov. Tukaj v Evropskem parlamentu smo zavezani zagotavljanju varovanja človekovih pravic in pravic manjšin po vsem svetu.(Predsednica je prekinila govornika) ",László Tőkés  (PPE).,3,90,not_available,"['slv', 'slv', 'slv']","['  László Tőkés  (PPE).   – Gospa predsednica, 10. marca smo praznovali 51. obletnico ljudske vstaje v Tibetu. Od takrat je preko dosledne in vztrajne zavezanosti za pridobitev prave neodvisnosti za svoj narod dalajlama svetu ponudil model, kako si prizadevati za demokracijo preko nenasilnih sredstev.', 'Evropejci se učimo od Njegove svetosti, dalajlame. Nedavno je izrazil svojo solidarnost z etnično ujgursko manjšino in stopil na stran Aung San Suu Kyi in ostalih demokratičnih disidentov. Tukaj v Evropskem parlamentu smo zavezani zagotavljanju varovanja človekovih pravic in pravic manjšin po vsem svetu.', '(Predsednica je prekinila govornika) ']"
136, 14. Razmere v Tibetu (razprava) ,"  Franz Obermayr  (NI).   – (DE) Gospa predsednica, takoj se bom obrnil h komisarju za razjasnitev. Zame je Tibet okupirana država in menim, da se mnogi poslanci Parlamenta iz vseh skupin strinjajo z mano. Celo vi, komisar, ne morete mednarodnega prava razglasiti za ničnega in neveljavnega. Mislim, da je to skrb, ki resnično teži vsakega evropskega državljana. Vsi se zavedamo gorja in kulturnega genocida v Tibetu in vsi sočustvujemo in edino prav je, da zastavimo pomembno vprašanje: kje je EU pri vsem tem? Zelo hitro obsodimo male države, ki storijo kršitve. Močno se odzovemo in zelo hitro obsodimo male države. Ko pa gre za obsojanje velikih držav, gospodarsko pomembnih držav, kot je Kitajska, smo politično zelo previdni. Skrajno smo previdni, tako politično kot v diplomatskem smislu. Ni znak poguma in hrbtenice, da raztrgamo male kršitelje in si zatisnemo oči, ko gre za Kitajsko. Prav tako nismo sposobni izvajati pritiska na Kitajsko preko milijonov, ki gredo za razvojno pomoč Zato pričakujem od visoke predstavnice...(Predsednica je prekinila govornika) ",Franz Obermayr  (NI).,2,165,not_available,"['ger', 'ger']","['  Franz Obermayr  (NI).   – (DE) Gospa predsednica, takoj se bom obrnil h komisarju za razjasnitev. Zame je Tibet okupirana država in menim, da se mnogi poslanci Parlamenta iz vseh skupin strinjajo z mano. Celo vi, komisar, ne morete mednarodnega prava razglasiti za ničnega in neveljavnega. Mislim, da je to skrb, ki resnično teži vsakega evropskega državljana. Vsi se zavedamo gorja in kulturnega genocida v Tibetu in vsi sočustvujemo in edino prav je, da zastavimo pomembno vprašanje: kje je EU pri vsem tem? Zelo hitro obsodimo male države, ki storijo kršitve. Močno se odzovemo in zelo hitro obsodimo male države. Ko pa gre za obsojanje velikih držav, gospodarsko pomembnih držav, kot je Kitajska, smo politično zelo previdni. Skrajno smo previdni, tako politično kot v diplomatskem smislu. Ni znak poguma in hrbtenice, da raztrgamo male kršitelje in si zatisnemo oči, ko gre za Kitajsko. Prav tako nismo sposobni izvajati pritiska na Kitajsko preko milijonov, ki gredo za razvojno pomoč Zato pričakujem od visoke predstavnice...', '(Predsednica je prekinila govornika) ']"
137, 14. Razmere v Tibetu (razprava) ,"  Ivo Vajgl  (ALDE).   – (SL) Jaz sem med tistimi redkimi, ki mu je bila pred kratkim dana možnost, da obišče Tibet.Tja prihaja napredek. Napredek, ki prinaša s seboj več slabega kot dobrega, ki odnaša tradicionalne vrednote kulturne, ki marginalizira tradicionalno tibetsko arhitekturo, ki meče neko modernizirano sliko na duhovno življenje Tibeta. Reke so umazane, pojavljajo se neke avtoceste, ki v bistvu kazijo podobo Tibeta.Vendar tja prihaja napredek, ki se mu ni mogoče izogniti, in mislim, da je treba naše zahteve do Kitajske, naša pričakovanja, uskladiti z zahtevo, da Tibeta, da tudi on nekaj dobi od napredka, in da se tudi tam življenje ne odvija kot v muzeju. ",Ivo Vajgl  (ALDE).,3,108,not_available,"['slv', 'slv', 'slv']","['  Ivo Vajgl  (ALDE).   – (SL) Jaz sem med tistimi redkimi, ki mu je bila pred kratkim dana možnost, da obišče Tibet.', 'Tja prihaja napredek. Napredek, ki prinaša s seboj več slabega kot dobrega, ki odnaša tradicionalne vrednote kulturne, ki marginalizira tradicionalno tibetsko arhitekturo, ki meče neko modernizirano sliko na duhovno življenje Tibeta. Reke so umazane, pojavljajo se neke avtoceste, ki v bistvu kazijo podobo Tibeta.', 'Vendar tja prihaja napredek, ki se mu ni mogoče izogniti, in mislim, da je treba naše zahteve do Kitajske, naša pričakovanja, uskladiti z zahtevo, da Tibeta, da tudi on nekaj dobi od napredka, in da se tudi tam življenje ne odvija kot v muzeju. ']"
138, 14. Razmere v Tibetu (razprava) ,"  Maroš Šefčovič,  član Komisije. – Gospa predsednica, mislim, da je razprava danes ponovno pokazala, da nas resnično skrbi položaj v Tibetu. Menim, da so govori poudarili, da ta zaskrbljenost ostaja pristna in upravičena še več kot 50 let po tibetanski vstaji 10. marca 1959. Poleg tega pa je naša razprava izpostavila, kako nujno je za obe strani, da takoj nadaljujeta z dialogom.Sporočim vam lahko, da Evropska unija pozdravlja ponovno vzpostavitev dialoga med poslaniki dalajlame in kitajsko oblastjo, ki se je ponovno začel septembra 2002. Od takrat močno podpiramo ta dialog in upamo, da bo ta proces vodil do pozitivnih rezultatov in do rešitve nerešenih vprašanj na miren in trajnosten način za Tibet.V svojem političnem dialogu in nadaljnjimi stiki s Kitajsko predstavniki EU redno spodbujajo Kitajsko, da ta proces pragmatično uporabi za obravnavanje vseh nerešenih vprašanj v zvezi s Tibetom. Medtem ko Kitajska to šteje za notranjo zadevo, je vzela na znanje poglede in zaskrbljenost EU ter EU sporočila svoje stališče v zadevi.Poudariti moram, da EU v svojem političnem dialogu in dialogu o človekovih pravicah s Kitajsko prav tako izpostavlja položaj človekovih pravic v Tibetu. Še več, EU dosledno poudarja pomen, ki ga daje spoštovanju svobode do izražanja in vere v Tibetu.Tesno smo spremljali najnovejše dogodke v tem dialogu in dialog med kitajsko vlado in predstavniki dalajlame poteka. Obvestim vas lahko, da sta nas v preteklem mesecu obe strani obvestili glede zadnjega kroga pogajanj in ponovno smo ju spodbudili k znatnemu napredku.Na koncu mi dovolite, da izrazim svoje prepričanje, da je ta razprava tukaj danes prav tako potrdila našo nepretrgano zavezo za sodelovanje s Kitajsko glede tega vprašanja in delo, ki ga bomo skupaj opravljali s ciljem, da bi dosegli večje spoštovanje človekovih pravic in svoboščin v Tibetu. ","Maroš Šefčovič,",6,291,not_available,"['slv', 'slv', 'slv', 'slv', 'slv', 'slv']","['  Maroš Šefčovič,  član Komisije. – Gospa predsednica, mislim, da je razprava danes ponovno pokazala, da nas resnično skrbi položaj v Tibetu. Menim, da so govori poudarili, da ta zaskrbljenost ostaja pristna in upravičena še več kot 50 let po tibetanski vstaji 10. marca 1959. Poleg tega pa je naša razprava izpostavila, kako nujno je za obe strani, da takoj nadaljujeta z dialogom.', 'Sporočim vam lahko, da Evropska unija pozdravlja ponovno vzpostavitev dialoga med poslaniki dalajlame in kitajsko oblastjo, ki se je ponovno začel septembra 2002. Od takrat močno podpiramo ta dialog in upamo, da bo ta proces vodil do pozitivnih rezultatov in do rešitve nerešenih vprašanj na miren in trajnosten način za Tibet.', 'V svojem političnem dialogu in nadaljnjimi stiki s Kitajsko predstavniki EU redno spodbujajo Kitajsko, da ta proces pragmatično uporabi za obravnavanje vseh nerešenih vprašanj v zvezi s Tibetom. Medtem ko Kitajska to šteje za notranjo zadevo, je vzela na znanje poglede in zaskrbljenost EU ter EU sporočila svoje stališče v zadevi.', 'Poudariti moram, da EU v svojem političnem dialogu in dialogu o človekovih pravicah s Kitajsko prav tako izpostavlja položaj človekovih pravic v Tibetu. Še več, EU dosledno poudarja pomen, ki ga daje spoštovanju svobode do izražanja in vere v Tibetu.', 'Tesno smo spremljali najnovejše dogodke v tem dialogu in dialog med kitajsko vlado in predstavniki dalajlame poteka. Obvestim vas lahko, da sta nas v preteklem mesecu obe strani obvestili glede zadnjega kroga pogajanj in ponovno smo ju spodbudili k znatnemu napredku.', 'Na koncu mi dovolite, da izrazim svoje prepričanje, da je ta razprava tukaj danes prav tako potrdila našo nepretrgano zavezo za sodelovanje s Kitajsko glede tega vprašanja in delo, ki ga bomo skupaj opravljali s ciljem, da bi dosegli večje spoštovanje človekovih pravic in svoboščin v Tibetu. ']"
139, 14. Razmere v Tibetu (razprava) ,  Predsednica. -   Razprava je zaključena.Pisne izjave (člen 149) ,Predsednica. -,2,8,not_available,"['slv', 'slv']","['  Predsednica. -   Razprava je zaključena.', 'Pisne izjave (člen 149) ']"
140, 14. Razmere v Tibetu (razprava) ,"  Lidia Joanna Geringer de Oedenberg  (S&D),  v pisni obliki. – (PL) Gospa predsednica, gospe in gospodje, pred dvema letoma so številni menihi v Lhasi miroljubno protestirali, na kar so se kitajske oblasti odzvale z brutalnim posredovanjem policije in vojske. Na ducate civilistov je bilo ubitih in več sto jih je bilo ranjenih. Od takrat so Tibetanci organizirali več kot 200 miroljubnih protestov, ki so vključevali številne socialne skupine, med njimi učitelje, študente in intelektualce.V prejšnjem parlamentarnem obdobju je Evropski parlament sprejel osem resolucij o Tibetu in večkrat razpravljal o zadevi. Rezultati teh prizadevanj še vedno niso zadovoljujoči. Nedavno so kitajske oblasti pridržale 30 učencev šole v Machu, ki so ob drugi obletnici dogodkov v Lhasi na začetku marca še enkrat izrazili svoje prepričanje in miroljubno protestirali. Ne dvomim, da za mnoge podobne incidente sploh nismo slišali.Zato predlagam, da se ta problem vključi med odgovornosti visoke predstavnice Unije za zunanje zadeve in varnostno politiko in se mu da širšo perspektivo. Temu bi sledili posebni ukrepi in, upam, vidni rezultati. Zahvaljujem se vam za pozornost. ","Lidia Joanna Geringer de Oedenberg  (S&D),",3,175,not_available,"['pol', 'pol', 'pol']","['  Lidia Joanna Geringer de Oedenberg  (S&D),  v pisni obliki. – (PL) Gospa predsednica, gospe in gospodje, pred dvema letoma so številni menihi v Lhasi miroljubno protestirali, na kar so se kitajske oblasti odzvale z brutalnim posredovanjem policije in vojske. Na ducate civilistov je bilo ubitih in več sto jih je bilo ranjenih. Od takrat so Tibetanci organizirali več kot 200 miroljubnih protestov, ki so vključevali številne socialne skupine, med njimi učitelje, študente in intelektualce.', 'V prejšnjem parlamentarnem obdobju je Evropski parlament sprejel osem resolucij o Tibetu in večkrat razpravljal o zadevi. Rezultati teh prizadevanj še vedno niso zadovoljujoči. Nedavno so kitajske oblasti pridržale 30 učencev šole v Machu, ki so ob drugi obletnici dogodkov v Lhasi na začetku marca še enkrat izrazili svoje prepričanje in miroljubno protestirali. Ne dvomim, da za mnoge podobne incidente sploh nismo slišali.', 'Zato predlagam, da se ta problem vključi med odgovornosti visoke predstavnice Unije za zunanje zadeve in varnostno politiko in se mu da širšo perspektivo. Temu bi sledili posebni ukrepi in, upam, vidni rezultati. Zahvaljujem se vam za pozornost. ']"
141, 14. Razmere v Tibetu (razprava) ,"  Danuta Jazłowiecka  (PPE),  v pisni obliki. – (PL) Danes so mediji polni informacij o Kitajski. Poročila, članki in knjige nenehno pišejo o razvoju Kitajske in njeni modernizaciji ter o gospodarskem čudežu, ki se tamkaj dogaja. V tem kontekstu so mediji nedavno prav tako pisali o Tibetu.Ameriška revija Newsweek je v nedavnem poročilu navedla, da „Kitajska dela veliko dobrega za Tibetance“, ker pomaga eni od najrevnejših regij, da bi izšla iz svoje nerazvitosti. Poročilo izpostavlja kitajska vlaganja v prometno in telekomunikacijsko infrastrukturo, izobraževanje, zdravstvo in dostop do vode in elektrike. Tako se zdi, da se uresničuje načrt predsednika Hu Jintaa, ki izboljšuje življenjski standard Tibetancev in jih hkrati želi prisiliti, da se odpovejo svoji svobodi govora, svobodi do verske izpovedi in željam po neodvisnosti. Toda ali je lahko njegova strategija uspešna?Nemiri v Lhasi, ki so izbruhnili pred dvema letoma ob obletnici protikitajske vstaje ter dogodki izpred dveh tednov so najbolje pokazali, da se Tibetanci čutijo preganjane v lastni deželi. Zgodovina moje države me je naučila, da je za svobodo in dostojanstvo vredno plačati vsako ceno. Gospodarski interesi ne morejo postati razlog, da se pozabi na preganjane in trpeče.Zdi se mi, da je Evropski parlament organ, ki bi posebej močno moral pozivati k pravici Tibetancev, naj ohranijo svojo identiteto. Mi, ki smo prisotni tukaj, narodi Evropske unije, in v njihovem imenu bi morali Tibetancem zagotoviti našo solidarnost. ","Danuta Jazłowiecka  (PPE),",4,227,not_available,"['pol', 'pol', 'pol', 'pol']","['  Danuta Jazłowiecka  (PPE),  v pisni obliki. – (PL) Danes so mediji polni informacij o Kitajski. Poročila, članki in knjige nenehno pišejo o razvoju Kitajske in njeni modernizaciji ter o gospodarskem čudežu, ki se tamkaj dogaja. V tem kontekstu so mediji nedavno prav tako pisali o Tibetu.', 'Ameriška revija Newsweek je v nedavnem poročilu navedla, da „Kitajska dela veliko dobrega za Tibetance“, ker pomaga eni od najrevnejših regij, da bi izšla iz svoje nerazvitosti. Poročilo izpostavlja kitajska vlaganja v prometno in telekomunikacijsko infrastrukturo, izobraževanje, zdravstvo in dostop do vode in elektrike. Tako se zdi, da se uresničuje načrt predsednika Hu Jintaa, ki izboljšuje življenjski standard Tibetancev in jih hkrati želi prisiliti, da se odpovejo svoji svobodi govora, svobodi do verske izpovedi in željam po neodvisnosti. Toda ali je lahko njegova strategija uspešna?', 'Nemiri v Lhasi, ki so izbruhnili pred dvema letoma ob obletnici protikitajske vstaje ter dogodki izpred dveh tednov so najbolje pokazali, da se Tibetanci čutijo preganjane v lastni deželi. Zgodovina moje države me je naučila, da je za svobodo in dostojanstvo vredno plačati vsako ceno. Gospodarski interesi ne morejo postati razlog, da se pozabi na preganjane in trpeče.', 'Zdi se mi, da je Evropski parlament organ, ki bi posebej močno moral pozivati k pravici Tibetancev, naj ohranijo svojo identiteto. Mi, ki smo prisotni tukaj, narodi Evropske unije, in v njihovem imenu bi morali Tibetancem zagotoviti našo solidarnost. ']"
