,agenda_item,text,speaker,number_p,number_w,chair,language_ps,ps
0, 1. Opening van de vergadering,VOORZITTER: MIGUEL ANGEL MARTÍNEZ MARTÍNEZ Ondervoorzitter,VOORZITTER: MIGUEL ANGEL MARTÍNEZ MARTÍNEZ,1,6,not_available,['dut'],['VOORZITTER: MIGUEL ANGEL MARTÍNEZ MARTÍNEZ Ondervoorzitter']
1, 4. Beperkte beschikbaarheid van vaccins voor ontwikkelingslanden (debat) ,"  De Voorzitter.   – Aan de orde is de mondelinge vraag (O-0100/2009) van Charles Goerens, namens de ALDE-Fractie, aan de Commissie: Beperkte beschikbaarheid van vaccins voor ontwikkelingslanden (B7-0214/2009). ",De Voorzitter.,1,31,not_available,['dut'],"['  De Voorzitter.   – Aan de orde is de mondelinge vraag (O-0100/2009) van Charles Goerens, namens de ALDE-Fractie, aan de Commissie: Beperkte beschikbaarheid van vaccins voor ontwikkelingslanden (B7-0214/2009). ']"
2, 4. Beperkte beschikbaarheid van vaccins voor ontwikkelingslanden (debat) ,"  Charles Goerens,  vraagsteller. – (FR) Mijnheer de Voorzitter, via deze vraag aan de Commissie wilde ik graag helpen na te gaan langs welke wegen we een einde kunnen maken aan de onrechtvaardigheid dat 80 procent van de wereldbevolking verstoken blijft van het vaccin tegen de Mexicaanse griep (A/H1N1) in het bijzonder en van vaccins in het algemeen.Het probleem is niet nieuw. De vraag komt namelijk elk jaar weer aan de orde in verband met het griepseizoen. Over het algemeen duiken nieuwe griepvirussen het eerst op in ontwikkelingslanden. Vanaf dat moment gaan laboratoria in geïndustrialiseerde landen een nieuw vaccin produceren. Ze kunnen daarmee pas beginnen zodra ze beschikken over stammen uit de landen – doorgaans een ontwikkelingsland – waar het nieuwe griepvirus als eerste is opgedoken. Eenmaal ontwikkeld zijn er van het vaccin net genoeg doses om de bevolkingen van de industrielanden te beschermen. Hieruit volgt dat de bevolkingen van het zuidelijk halfrond niet beschermd worden tegen pandemieën.Ik richt me tot de Commissie om haar te vragen wat ze denkt te gaan doen om deze onrechtvaardige situatie een halt toe te roepen. Is het moreel verdedigbaar om de mate van gezondheidsbescherming van een volk afhankelijk te stellen van de financiële middelen waarover het bewuste land beschikt? Ook zou ik graag willen weten of de Commissie ons kan vertellen welke middelen ze in staat is te mobiliseren om deze leemte op te vullen. Wat zou, als de nood aan de man komt, de strategie van de Commissie zijn, en welke partnerschappen zou ze aangaan met de betreffende landen en met de instellingen van de Verenigde Naties, of met de particuliere sector, om vaccins beschikbaar te stellen aan burgers in ontwikkelingslanden?Vormt het systeem van de WHO voor de bescherming van intellectueel eigendom, dat ik niet heb genoemd in mijn schriftelijke versie, een obstakel voor de productie van vaccins door ontwikkelingslanden? Zo ja, zou de Europese Unie dan bereid zijn binnen de WHO een debat op gang te brengen om dat obstakel te verwijderen?Ik wilde tot slot nog één laatste vraag stellen. Kan de Commissie een overzicht geven van de maatregelen die moeten worden genomen om de kwaliteit van de zorgvoorzieningen in ontwikkelingslanden te verbeteren, hetgeen een essentiële voorwaarde is voor een eerlijkere verdeling van vaccins? ","Charles Goerens,",5,374,not_available,"['fra', 'fra', 'fra', 'fra', 'fra']","['  Charles Goerens,  vraagsteller. – (FR) Mijnheer de Voorzitter, via deze vraag aan de Commissie wilde ik graag helpen na te gaan langs welke wegen we een einde kunnen maken aan de onrechtvaardigheid dat 80 procent van de wereldbevolking verstoken blijft van het vaccin tegen de Mexicaanse griep (A/H1N1) in het bijzonder en van vaccins in het algemeen.', 'Het probleem is niet nieuw. De vraag komt namelijk elk jaar weer aan de orde in verband met het griepseizoen. Over het algemeen duiken nieuwe griepvirussen het eerst op in ontwikkelingslanden. Vanaf dat moment gaan laboratoria in geïndustrialiseerde landen een nieuw vaccin produceren. Ze kunnen daarmee pas beginnen zodra ze beschikken over stammen uit de landen – doorgaans een ontwikkelingsland – waar het nieuwe griepvirus als eerste is opgedoken. Eenmaal ontwikkeld zijn er van het vaccin net genoeg doses om de bevolkingen van de industrielanden te beschermen. Hieruit volgt dat de bevolkingen van het zuidelijk halfrond niet beschermd worden tegen pandemieën.', 'Ik richt me tot de Commissie om haar te vragen wat ze denkt te gaan doen om deze onrechtvaardige situatie een halt toe te roepen. Is het moreel verdedigbaar om de mate van gezondheidsbescherming van een volk afhankelijk te stellen van de financiële middelen waarover het bewuste land beschikt? Ook zou ik graag willen weten of de Commissie ons kan vertellen welke middelen ze in staat is te mobiliseren om deze leemte op te vullen. Wat zou, als de nood aan de man komt, de strategie van de Commissie zijn, en welke partnerschappen zou ze aangaan met de betreffende landen en met de instellingen van de Verenigde Naties, of met de particuliere sector, om vaccins beschikbaar te stellen aan burgers in ontwikkelingslanden?', 'Vormt het systeem van de WHO voor de bescherming van intellectueel eigendom, dat ik niet heb genoemd in mijn schriftelijke versie, een obstakel voor de productie van vaccins door ontwikkelingslanden? Zo ja, zou de Europese Unie dan bereid zijn binnen de WHO een debat op gang te brengen om dat obstakel te verwijderen?', 'Ik wilde tot slot nog één laatste vraag stellen. Kan de Commissie een overzicht geven van de maatregelen die moeten worden genomen om de kwaliteit van de zorgvoorzieningen in ontwikkelingslanden te verbeteren, hetgeen een essentiële voorwaarde is voor een eerlijkere verdeling van vaccins? ']"
3, 4. Beperkte beschikbaarheid van vaccins voor ontwikkelingslanden (debat) ,"  Leonard Orban,  lid van de Commissie. – (RO) Ik dank de afgevaardigde Charles Goerens voor zijn vraag, die mij de gelegenheid biedt om de aspecten die rechtstreeks betrekking hebben op de influenza A/H1N1-pandemie te behandelen, alsmede de verdere aspecten met betrekking tot de bijdrage van de Europese Commissie aan de verbetering van de gezondheidsinfrastructuur in ontwikkelingslanden.De Gemeenschap heeft zowel intern als extern actie tegen de influenza A/H1N1-pandemie ondernomen. We hebben te maken met een crisis waarvoor een mondiale aanpak vereist is, zowel met het oog op effectiviteit van de bescherming van onze burgers als vanuit het standpunt dat we solidair moeten zijn met de minder ontwikkelde landen.Als we het over effectiviteit hebben, gaat het om de snelle waarschuwingssystemen, het op de voet volgen van de pandemie en het virus zelf, en de beoordeling van de effectiviteit van de preventieve en curatieve maatregelen in de landen waar de pandemie is begonnen, wat allemaal essentiële elementen zijn in de voorbereiding en aanpassing van onze eigen reacties. We hebben het echter ook over solidariteit, omdat de Europese Unie, als voornaamste financier van publieke ontwikkelingshulp en belangrijke partner van een groot aantal ontwikkelingslanden, deze landen in de aanpak van de nieuwe dreigingen moet steunen.In onze reactie op deze dreigingen, beginnen wij, de Commissie en de Europese Unie als geheel, onze inspanningen niet helemaal vanuit het niets. De EU heeft, samen met instanties als de Wereldgezondheidsorganisatie (WHO), de Wereldbank en andere organisaties, op grond van de eerdere vogelgriep die voortkwam uit het H5N1-virus, effectieve procedures kunnen invoeren voor informatie-uitwisseling en coördinatie van technische bijstand, alsmede financiële instrumenten zoals een trustfonds bij de Wereldbank. De wereld is nog nooit zo goed voorbereid geweest op een pandemie, zoals mevrouw Chan, directeur-generaal van de WHO, zegt. In deze systemen, waarvan de bestanddelen nu zijn uitgebreid om iedere soort griep te kunnen aanpakken, heeft de Commissie al een bijzonder belangrijke rol gespeeld en zij zal dit blijven doen.Met betrekking tot de algemene beschikbaarheid van vaccins voor ontwikkelingslanden kan gezegd worden dat de nieuwe grieppandemie het debat heeft doen opleven dat al ruim twee jaar gaande is binnen de WHO en binnen de werkgroep die voorbereidingen voor de grieppandemie treft en die is opgezet op verzoek van de Wereldgezondheidsvergadering, na de beslissing van Indonesië – waar de heer Goerens op heeft gewezen.Deze week presenteert de WHO in Genève de eerste aanbevelingen van de groep waarin de Gemeenschap een actieve rol heeft gespeeld. Volgens de resolutie van de Wereldgezondheidsvergadering moeten de uiteindelijke aanbevelingen worden voorgelegd aan de Uitvoerende Raad van de WHO, die eind januari bij elkaar komt. Op dat moment moet een zo goed mogelijk evenwicht worden gevonden tussen enerzijds het stimuleren van het onderzoek naar geneesmiddelen en een snelle ontwikkeling van nieuwe medische producten die grotendeels uit onderzoek in de particuliere sector voortkomen – waarvoor intellectuele eigendomsrechten tegenwoordig een belangrijke stimulans vormen – en anderzijds een eerlijke toegang tot de producten die op basis van dit onderzoek zijn geproduceerd.De Europese Gemeenschap heeft haar bedenkingen bij een beperking op de uitwisseling van biologisch materiaal dat voor de relevante onderzoeksactiviteiten nodig is. Voor een snelle ontwikkeling en verspreiding van mogelijke maatregelen tegen de pandemie is een actieve internationale samenwerking, die transparant is en wordt gecoördineerd door erkende instellingen zoals de WHO en haar netwerk, van cruciaal belang.In het specifieke geval van influenza A/H1N1, waarvoor geen vaccinvoorraad bestond, is ook gesproken over de kwestie van de productiecapaciteit en over wie de eerste optie op deze capaciteit heeft wanneer er enorme bestellingen worden gedaan door landen die over de benodigde middelen beschikken. Een bemoedigend teken van mondiale solidariteit is de toezegging van sommige vaccinproducenten en meer recent, van sommige landen, om 10 procent van hun productie of bestellingen aan ontwikkelingslanden te doneren of tegen een gereduceerde prijs te verkopen.Wat de Commissie betreft, is steun aan derde landen bij de aanpak van de pandemie van essentieel belang en deze steun moet niet beperkt blijven tot de toegang tot vaccins wanneer deze beschikbaar zijn. Het is van het grootste belang dat de op consolidering van gezondheidsinfrastructuren gerichte steun van de Commissie en de lidstaten in verschillende vormen blijft bestaan, naast hulp bij projecten, sectorale of algemene begrotingssteun voor partnerlanden en zelfs hulp voor internationale organisaties.Met name door ervoor te zorgen dat de aandacht gericht zal blijven op prioritaire ziekten en interventies moet gegarandeerd worden dat het principe dat landen verantwoordelijk zijn voor hun eigen ontwikkeling in acht wordt genomen en dat de beloften om effectieve steun te bieden worden nagekomen. De basis voor de reactie op een pandemie is in de allereerste plaats de aanwezigheid van gezondheidsinfrastructuren die beter toegerust zijn en waarin gevallen vroegtijdig worden behandeld, opdat preventieve middelen op een eerlijke manier beschikbaar gesteld kunnen worden, wanneer deze beschikbaar zijn.Wanneer zich een ernstige crisis voordoet, zal de Europese Commissie haar middelen voor humanitaire steun en noodinterventie kunnen mobiliseren en zal zij ook flexibel gebruik kunnen maken van de middelen die reeds aan de om hulp vragende partnerlanden zijn toegewezen. Tijdens een dergelijke ernstige crisis zullen non-gouvernementele organisaties en, niet te vergeten, de grotere institutionele netwerken zeker een belangrijke rol spelen. De Commissie weet dat zij erop kan rekenen dat deze instanties ook daadwerkelijk in actie zullen komen. ","Leonard Orban,",11,879,not_available,"['rum', 'rum', 'rum', 'rum', 'rum', 'rum', 'rum', 'rum', 'rum', 'rum', 'rum']","['  Leonard Orban,  lid van de Commissie. – (RO) Ik dank de afgevaardigde Charles Goerens voor zijn vraag, die mij de gelegenheid biedt om de aspecten die rechtstreeks betrekking hebben op de influenza A/H1N1-pandemie te behandelen, alsmede de verdere aspecten met betrekking tot de bijdrage van de Europese Commissie aan de verbetering van de gezondheidsinfrastructuur in ontwikkelingslanden.', 'De Gemeenschap heeft zowel intern als extern actie tegen de influenza A/H1N1-pandemie ondernomen. We hebben te maken met een crisis waarvoor een mondiale aanpak vereist is, zowel met het oog op effectiviteit van de bescherming van onze burgers als vanuit het standpunt dat we solidair moeten zijn met de minder ontwikkelde landen.', 'Als we het over effectiviteit hebben, gaat het om de snelle waarschuwingssystemen, het op de voet volgen van de pandemie en het virus zelf, en de beoordeling van de effectiviteit van de preventieve en curatieve maatregelen in de landen waar de pandemie is begonnen, wat allemaal essentiële elementen zijn in de voorbereiding en aanpassing van onze eigen reacties. We hebben het echter ook over solidariteit, omdat de Europese Unie, als voornaamste financier van publieke ontwikkelingshulp en belangrijke partner van een groot aantal ontwikkelingslanden, deze landen in de aanpak van de nieuwe dreigingen moet steunen.', 'In onze reactie op deze dreigingen, beginnen wij, de Commissie en de Europese Unie als geheel, onze inspanningen niet helemaal vanuit het niets. De EU heeft, samen met instanties als de Wereldgezondheidsorganisatie (WHO), de Wereldbank en andere organisaties, op grond van de eerdere vogelgriep die voortkwam uit het H5N1-virus, effectieve procedures kunnen invoeren voor informatie-uitwisseling en coördinatie van technische bijstand, alsmede financiële instrumenten zoals een trustfonds bij de Wereldbank. De wereld is nog nooit zo goed voorbereid geweest op een pandemie, zoals mevrouw Chan, directeur-generaal van de WHO, zegt. In deze systemen, waarvan de bestanddelen nu zijn uitgebreid om iedere soort griep te kunnen aanpakken, heeft de Commissie al een bijzonder belangrijke rol gespeeld en zij zal dit blijven doen.', 'Met betrekking tot de algemene beschikbaarheid van vaccins voor ontwikkelingslanden kan gezegd worden dat de nieuwe grieppandemie het debat heeft doen opleven dat al ruim twee jaar gaande is binnen de WHO en binnen de werkgroep die voorbereidingen voor de grieppandemie treft en die is opgezet op verzoek van de Wereldgezondheidsvergadering, na de beslissing van Indonesië – waar de heer Goerens op heeft gewezen.', 'Deze week presenteert de WHO in Genève de eerste aanbevelingen van de groep waarin de Gemeenschap een actieve rol heeft gespeeld. Volgens de resolutie van de Wereldgezondheidsvergadering moeten de uiteindelijke aanbevelingen worden voorgelegd aan de Uitvoerende Raad van de WHO, die eind januari bij elkaar komt. Op dat moment moet een zo goed mogelijk evenwicht worden gevonden tussen enerzijds het stimuleren van het onderzoek naar geneesmiddelen en een snelle ontwikkeling van nieuwe medische producten die grotendeels uit onderzoek in de particuliere sector voortkomen – waarvoor intellectuele eigendomsrechten tegenwoordig een belangrijke stimulans vormen – en anderzijds een eerlijke toegang tot de producten die op basis van dit onderzoek zijn geproduceerd.', 'De Europese Gemeenschap heeft haar bedenkingen bij een beperking op de uitwisseling van biologisch materiaal dat voor de relevante onderzoeksactiviteiten nodig is. Voor een snelle ontwikkeling en verspreiding van mogelijke maatregelen tegen de pandemie is een actieve internationale samenwerking, die transparant is en wordt gecoördineerd door erkende instellingen zoals de WHO en haar netwerk, van cruciaal belang.', 'In het specifieke geval van influenza A/H1N1, waarvoor geen vaccinvoorraad bestond, is ook gesproken over de kwestie van de productiecapaciteit en over wie de eerste optie op deze capaciteit heeft wanneer er enorme bestellingen worden gedaan door landen die over de benodigde middelen beschikken. Een bemoedigend teken van mondiale solidariteit is de toezegging van sommige vaccinproducenten en meer recent, van sommige landen, om 10 procent van hun productie of bestellingen aan ontwikkelingslanden te doneren of tegen een gereduceerde prijs te verkopen.', 'Wat de Commissie betreft, is steun aan derde landen bij de aanpak van de pandemie van essentieel belang en deze steun moet niet beperkt blijven tot de toegang tot vaccins wanneer deze beschikbaar zijn. Het is van het grootste belang dat de op consolidering van gezondheidsinfrastructuren gerichte steun van de Commissie en de lidstaten in verschillende vormen blijft bestaan, naast hulp bij projecten, sectorale of algemene begrotingssteun voor partnerlanden en zelfs hulp voor internationale organisaties.', 'Met name door ervoor te zorgen dat de aandacht gericht zal blijven op prioritaire ziekten en interventies moet gegarandeerd worden dat het principe dat landen verantwoordelijk zijn voor hun eigen ontwikkeling in acht wordt genomen en dat de beloften om effectieve steun te bieden worden nagekomen. De basis voor de reactie op een pandemie is in de allereerste plaats de aanwezigheid van gezondheidsinfrastructuren die beter toegerust zijn en waarin gevallen vroegtijdig worden behandeld, opdat preventieve middelen op een eerlijke manier beschikbaar gesteld kunnen worden, wanneer deze beschikbaar zijn.', 'Wanneer zich een ernstige crisis voordoet, zal de Europese Commissie haar middelen voor humanitaire steun en noodinterventie kunnen mobiliseren en zal zij ook flexibel gebruik kunnen maken van de middelen die reeds aan de om hulp vragende partnerlanden zijn toegewezen. Tijdens een dergelijke ernstige crisis zullen non-gouvernementele organisaties en, niet te vergeten, de grotere institutionele netwerken zeker een belangrijke rol spelen. De Commissie weet dat zij erop kan rekenen dat deze instanties ook daadwerkelijk in actie zullen komen. ']"
4, 4. Beperkte beschikbaarheid van vaccins voor ontwikkelingslanden (debat) ,"  Gay Mitchell,  namens de PPE-Fractie. – (EN) Mijnheer de Voorzitter, de onvermijdelijke komst en het steeds opnieuw terugkeren van de grieppandemie heeft de kwestie van de vaccinatie in het middelpunt van de publieke belangstelling geplaatst. Maar voor de ontwikkelingslanden is dit een reeds lang bestaand en hardnekkig probleem. De mondelinge vraag van vanmorgen geeft op overduidelijke wijze aan hoe hypocriet en onrechtvaardig de westerse wereld is, die van ontwikkelingslanden materiaal voor vaccins vraagt om haar rijke burgers te beschermen en vervolgens het lef heeft om diezelfde vaccins terug te verkopen aan de armen.Niet alleen is het noodzakelijk dat ontwikkelingslanden dezelfde toegang tot griepvaccinatie hebben, maar bovendien moeten we ons inspannen om een systeem in te voeren waarbij de armste mensen in de wereld, die bijna altijd veel meer blootstaan aan ziekten, de kans krijgen zich te beschermen tegen ziekten die te voorkomen zijn – iets wat wij in het westen als een vanzelfsprekendheid beschouwen. Tuberculose is een goed voorbeeld van de tegenstelling tussen ons en onze buren in de ontwikkelingslanden. In Europa is het regel dat kinderen de BCG-vaccinatie ontvangen, waarvan de werkzaamheid meer dan 80 procent is. Dit heeft ertoe geleid dat tuberculose in Europa niet langer de voortdurende bedreiging is die de ziekte eens was.Vergelijk dit eens met de ontwikkelingslanden, waar 26 procent van de onnodige sterfgevallen is toe te schrijven aan tuberculose. De gevolgen van tuberculose in deze landen worden nog versterkt door het feit dat het een uiterst besmettelijke ziekte is die zich gemakkelijk door de lucht verspreidt binnen besloten ruimten zoals die voorkomen in de erbarmelijke krottenwijken die in veel ontwikkelingslanden zo talrijk zijn. Voeg daar nog bij het feit dat 50 procent van de aidspatiënten in Afrika bezuiden de Sahara, waar hiv/aids wijdverbreid is, tuberculose zal krijgen, en we beseffen hoe gelukkig we zijn om in een relatief goed beschermd gebied te leven met de vaccinatieprogramma’s die we hebben.Voor een echt succesverhaal over wat vaccinatie vermag en de noodzaak van ontwikkelingshulp in het algemeen, hoeven we niet verder te zoeken dan het voorbeeld van de mazelen in Afrika, waar, grotendeels dankzij vaccinatieprogramma’s, het aantal sterfgevallen ten gevolge van deze ziekte tussen 2000 en 2006 met 90 procent is afgenomen.Mijnheer de Voorzitter, het is duidelijk dat vaccinatie werkt en het is duidelijk dat we een verantwoordelijkheid hebben ten opzichte van de mensen die de rampzalige gevolgen ondervinden van de afwezigheid van vaccinaties. Ik pleit er sterk voor dat we in dit Parlement de druk op de ketel houden om ervoor te zorgen dat deze voorziening beschikbaar komt voor de armsten van de armen.Voordat ik weer ga zitten, wil ik graag een punt van orde naar voren brengen: doe alstublieft iets aan de liften in dit gebouw. Ik ging in de lift omhoog en omlaag, toen de deuren geblokkeerd raakten en ik kwam hier maar net op tijd aan voor het debat. Iedereen klaagt erover. Er moet iets aan gedaan worden. ","Gay Mitchell,",6,493,not_available,"['eng', 'eng', 'eng', 'eng', 'eng', 'eng']","['  Gay Mitchell,  namens de PPE-Fractie. – (EN) Mijnheer de Voorzitter, de onvermijdelijke komst en het steeds opnieuw terugkeren van de grieppandemie heeft de kwestie van de vaccinatie in het middelpunt van de publieke belangstelling geplaatst. Maar voor de ontwikkelingslanden is dit een reeds lang bestaand en hardnekkig probleem. De mondelinge vraag van vanmorgen geeft op overduidelijke wijze aan hoe hypocriet en onrechtvaardig de westerse wereld is, die van ontwikkelingslanden materiaal voor vaccins vraagt om haar rijke burgers te beschermen en vervolgens het lef heeft om diezelfde vaccins terug te verkopen aan de armen.', 'Niet alleen is het noodzakelijk dat ontwikkelingslanden dezelfde toegang tot griepvaccinatie hebben, maar bovendien moeten we ons inspannen om een systeem in te voeren waarbij de armste mensen in de wereld, die bijna altijd veel meer blootstaan aan ziekten, de kans krijgen zich te beschermen tegen ziekten die te voorkomen zijn – iets wat wij in het westen als een vanzelfsprekendheid beschouwen. Tuberculose is een goed voorbeeld van de tegenstelling tussen ons en onze buren in de ontwikkelingslanden. In Europa is het regel dat kinderen de BCG-vaccinatie ontvangen, waarvan de werkzaamheid meer dan 80 procent is. Dit heeft ertoe geleid dat tuberculose in Europa niet langer de voortdurende bedreiging is die de ziekte eens was.', 'Vergelijk dit eens met de ontwikkelingslanden, waar 26 procent van de onnodige sterfgevallen is toe te schrijven aan tuberculose. De gevolgen van tuberculose in deze landen worden nog versterkt door het feit dat het een uiterst besmettelijke ziekte is die zich gemakkelijk door de lucht verspreidt binnen besloten ruimten zoals die voorkomen in de erbarmelijke krottenwijken die in veel ontwikkelingslanden zo talrijk zijn. Voeg daar nog bij het feit dat 50 procent van de aidspatiënten in Afrika bezuiden de Sahara, waar hiv/aids wijdverbreid is, tuberculose zal krijgen, en we beseffen hoe gelukkig we zijn om in een relatief goed beschermd gebied te leven met de vaccinatieprogramma’s die we hebben.', 'Voor een echt succesverhaal over wat vaccinatie vermag en de noodzaak van ontwikkelingshulp in het algemeen, hoeven we niet verder te zoeken dan het voorbeeld van de mazelen in Afrika, waar, grotendeels dankzij vaccinatieprogramma’s, het aantal sterfgevallen ten gevolge van deze ziekte tussen 2000 en 2006 met 90 procent is afgenomen.', 'Mijnheer de Voorzitter, het is duidelijk dat vaccinatie werkt en het is duidelijk dat we een verantwoordelijkheid hebben ten opzichte van de mensen die de rampzalige gevolgen ondervinden van de afwezigheid van vaccinaties. Ik pleit er sterk voor dat we in dit Parlement de druk op de ketel houden om ervoor te zorgen dat deze voorziening beschikbaar komt voor de armsten van de armen.', 'Voordat ik weer ga zitten, wil ik graag een punt van orde naar voren brengen: doe alstublieft iets aan de liften in dit gebouw. Ik ging in de lift omhoog en omlaag, toen de deuren geblokkeerd raakten en ik kwam hier maar net op tijd aan voor het debat. Iedereen klaagt erover. Er moet iets aan gedaan worden. ']"
5, 4. Beperkte beschikbaarheid van vaccins voor ontwikkelingslanden (debat) ,"  De Voorzitter.   – Mijnheer Mitchell, met betrekking tot het door u naar voren gebrachte punt met betrekking tot de liften wil ik iets onthullen dat mogelijk een geheim onderdeel is van de discussies in het Bureau. Tijdens de laatste vergadering van het Bureau heb ik het zojuist beschreven probleem aan de kaak gesteld, dat helaas niet alleen in Straatsburg optreedt. Ook in Brussel was het wekenlang werkelijk onmogelijk je door de doolhof van Parlementsgebouwen te verplaatsen omdat de liften het niet deden.Het Bureau zal deze kwestie toespelen aan de betrokken diensten, zodat de liften op de een of andere manier beter kunnen functioneren. ",De Voorzitter.,2,103,not_available,"['dut', 'dut']","['  De Voorzitter.   – Mijnheer Mitchell, met betrekking tot het door u naar voren gebrachte punt met betrekking tot de liften wil ik iets onthullen dat mogelijk een geheim onderdeel is van de discussies in het Bureau. Tijdens de laatste vergadering van het Bureau heb ik het zojuist beschreven probleem aan de kaak gesteld, dat helaas niet alleen in Straatsburg optreedt. Ook in Brussel was het wekenlang werkelijk onmogelijk je door de doolhof van Parlementsgebouwen te verplaatsen omdat de liften het niet deden.', 'Het Bureau zal deze kwestie toespelen aan de betrokken diensten, zodat de liften op de een of andere manier beter kunnen functioneren. ']"
