,agenda_item,text,speaker,number_p,number_w,chair,language_ps,ps
42, 6. Rapport van de onafhankelijke internationale onderzoeksmissie voor het conflict in Georgië (debat) ,"  Leonard Orban,  lid van de Commissie. – (RO) Ik ben verheugd dat ik vandaag de gelegenheid krijg met u over Georgië te spreken. Nog geen jaar na het gewapende conflict met Rusland wordt Georgië geconfronteerd met een groot aantal uitdagingen die een raakvlak met de Europese Unie hebben. We moeten dit land nu alle aandacht schenken.Het rapport van de onafhankelijke internationale onderzoeksmissie inzake het conflict in Georgië is na een beslissing van de Raad op verzoek van de Europese Unie onder leiding van de Zwitserse ambassadrice Heidi Tagliavini opgesteld. Het gaat hier om een onafhankelijk rapport: de Europese Unie is bij het opstellen ervan niet betrokken geweest, en heeft de inhoud ervan op geen enkele wijze beïnvloed. Ik hoef op de resultaten van dit onderzoek dus niet uitvoerig in te gaan.Wij menen dat dit rapport aan zijn belangrijkste doelstelling voldoet en verklaringen aandraagt voor de gebeurtenissen van augustus 2008. En het geeft aan wat de belangrijkste oorzaken van dit conflict waren. Het rapport maakt duidelijk dat – zoals zo vaak bij een conflict – geen der partijen alle schuld voor het conflict draagt. Zowel Rusland als Georgië krijgen kritiek te verduren voor hun optreden. Een andere belangrijke les van dit verslag is dat de internationale gemeenschap sneller en doortastender moet optreden in bijzonder gespannen situaties die in geweld kunnen ontaarden.De Europese Unie houdt zich aan de verplichtingen die ze met betrekking tot de territoriale integriteit van Georgië op zich heeft genomen. We moeten onze inspanningen nu vooral richten op het verhinderen van nieuwe conflicten en het vreedzaam beslechten van – nog steeds voortdurende – geschillen. Dat is de enige manier om stabiliteit en welvaart in deze regio te garanderen.Dames en heren, de oorlog heeft diepe indruk gemaakt op de Georgiërs. Het land kampt nog steeds met een aantal fundamentele problemen, zoals het voorzien in de basisbehoeften van duizenden ontheemden. Het verheugt mij u in dit verband mede te kunnen delen dat de tenuitvoerlegging van het pakket van noodsteun na een conflictsituatie, zoals dat door de Europese Commissie met hulp van de lidstaten en andere partijen is samengesteld, goed functioneert. Zoals u weet, houdt het pakket van de Europese Commissie steun ter waarde van tot 500 miljoen euro voor de periode 2008-2010 in. De hulp is op een aantal aspecten gericht, waaronder steun aan intern ontheemden. Het pakket bevat verder economische maatregelen om groei en banen te genereren. De Europese Commissie heeft bovendien voorgesteld om Georgië 46 miljoen euro macro-economische steun te geven en het land zo te helpen met de gevolgen van de economische en financiële crisis om te gaan.De EU-waarnemingsmissie in Georgië is op dit moment de enige internationale missie waarmee de toestand in dit land in de gaten wordt gehouden. De EU-missie speelt een belangrijke rol, maar we zouden graag willen dat de werkzaamheden van deze missie in het gehele gebied uitgevoerd konden worden. De onderhandelingen in Genève, onder het gedeelde voorzitterschap van de Europese Unie, de OVSE en de VN, bieden een unieke gelegenheid voor een politieke dialoog met alle partners. We zullen al het nodige blijven ondernemen om een constructieve, tot concrete resultaten leidende discussie te bevorderen.De werkgroep die zich onder gedeeld voorzitterschap van de Europese Commissie en de UNHCR bezighoudt met humanitaire aspecten en ontheemden binnen Georgië, bespreekt nu een reeks maatregelen om vluchtelingen en al dan niet intern ontheemden naar hun regio’s terug te brengen. Verder blijken in Abchazië en Zuid-Ossetië de twee mechanismen voor het voorkomen van en reageren op incidenten redelijk te functioneren, in die zin dat het aantal incidenten afneemt en de grensoversteek door mensen uit deze landen eenvoudiger is geworden.Het is, gelet op de gebeurtenissen uit het recente verleden, van belang dat we de stabiliteit, de veiligheid en de welvaart in Georgië vergroten. Het land heeft meer dan ooit behoefte aan economische en politieke hervormingen. Het Oostelijk Partnerschap, dat in mei in Praag is opgezet, vormt een belangrijk kader voor het opvoeren van onze steun aan Georgië, of dat nu bilateraal geschiedt of via multilaterale samenwerking met andere partners in de regio. Eén sleutelelement is het voorstel om sterkere politieke en handelsbetrekkingen te ontwikkelen. De Raad buitenlandse betrekkingen heeft in september in de context van het Oostelijk Partnerschap beslist dat er richtsnoeren voor onderhandelingen met alle drie de landen in de zuidelijke Kaukasus – waaronder Georgië – moeten worden ontwikkeld.We willen de politieke betrekkingen dus versterken, maar we gaan nu ook voorstellen dat in de nieuwe overeenkomst met Georgië bepalingen over het opzetten van een grotere en uitgebreide vrijhandelszone worden opgenomen. Het is van belang te vermelden dat een dergelijke vrijhandelszone zal garanderen dat de economie van Georgië geleidelijk aan op de interne markt van de EU zal aansluiten. Het behoeft geen betoog dat Georgië voor het realiseren van deze ambitieuze langetermijndoelstelling nog altijd inspanningen zal moeten leveren en hulpmaatregelen zal moeten steunen om hervormingen door te voeren. De onderhandelingen over een grotere en uitgebreide vrijhandelszone kunnen pas van start gaan als aan de vereiste voorwaarden is voldaan.Ik zou hier wat de betrekkingen met Georgië betreft graag aan toevoegen dat onze acties om het contact tussen mensen te vergemakkelijken vruchten beginnen af te werpen. De Commissie heeft de onderhandelingen over een akkoord voor het vergemakkelijken van visumvrijstelling en garanties voor terugkeer zojuist afgesloten. De tekst van dat akkoord is nu voor de Raad beschikbaar. We hopen dat deze procedure zo spoedig mogelijk kan worden afgerond.Dames en heren, ik geloof dat we het er allemaal over eens zijn dat Georgië een sleutelrol vervult in ons deel van de wereld. Het is daarom van groot belang dat we de verplichtingen die we jegens dit land zijn aangegaan gestand doen om het zo te helpen een antwoord te formuleren op de talrijke uitdagingen waarmee het wordt geconfronteerd. En dat geldt zeker voor de tenuitvoerlegging van het programma voor hervormingen. Nu Georgië werkelijk vorderingen maakt met de tenuitvoerlegging van die politieke en economische hervormingen zullen de betrekkingen tussen de EU en Georgië steeds nauwer worden. ","Leonard Orban,",11,1000,not_available,"['rum', 'rum', 'rum', 'rum', 'rum', 'rum', 'rum', 'rum', 'rum', 'rum', 'rum']","['  Leonard Orban,  lid van de Commissie. – (RO) Ik ben verheugd dat ik vandaag de gelegenheid krijg met u over Georgië te spreken. Nog geen jaar na het gewapende conflict met Rusland wordt Georgië geconfronteerd met een groot aantal uitdagingen die een raakvlak met de Europese Unie hebben. We moeten dit land nu alle aandacht schenken.', 'Het rapport van de onafhankelijke internationale onderzoeksmissie inzake het conflict in Georgië is na een beslissing van de Raad op verzoek van de Europese Unie onder leiding van de Zwitserse ambassadrice Heidi Tagliavini opgesteld. Het gaat hier om een onafhankelijk rapport: de Europese Unie is bij het opstellen ervan niet betrokken geweest, en heeft de inhoud ervan op geen enkele wijze beïnvloed. Ik hoef op de resultaten van dit onderzoek dus niet uitvoerig in te gaan.', 'Wij menen dat dit rapport aan zijn belangrijkste doelstelling voldoet en verklaringen aandraagt voor de gebeurtenissen van augustus 2008. En het geeft aan wat de belangrijkste oorzaken van dit conflict waren. Het rapport maakt duidelijk dat – zoals zo vaak bij een conflict – geen der partijen alle schuld voor het conflict draagt. Zowel Rusland als Georgië krijgen kritiek te verduren voor hun optreden. Een andere belangrijke les van dit verslag is dat de internationale gemeenschap sneller en doortastender moet optreden in bijzonder gespannen situaties die in geweld kunnen ontaarden.', 'De Europese Unie houdt zich aan de verplichtingen die ze met betrekking tot de territoriale integriteit van Georgië op zich heeft genomen. We moeten onze inspanningen nu vooral richten op het verhinderen van nieuwe conflicten en het vreedzaam beslechten van – nog steeds voortdurende – geschillen. Dat is de enige manier om stabiliteit en welvaart in deze regio te garanderen.', 'Dames en heren, de oorlog heeft diepe indruk gemaakt op de Georgiërs. Het land kampt nog steeds met een aantal fundamentele problemen, zoals het voorzien in de basisbehoeften van duizenden ontheemden. Het verheugt mij u in dit verband mede te kunnen delen dat de tenuitvoerlegging van het pakket van noodsteun na een conflictsituatie, zoals dat door de Europese Commissie met hulp van de lidstaten en andere partijen is samengesteld, goed functioneert. Zoals u weet, houdt het pakket van de Europese Commissie steun ter waarde van tot 500 miljoen euro voor de periode 2008-2010 in. De hulp is op een aantal aspecten gericht, waaronder steun aan intern ontheemden. Het pakket bevat verder economische maatregelen om groei en banen te genereren. De Europese Commissie heeft bovendien voorgesteld om Georgië 46 miljoen euro macro-economische steun te geven en het land zo te helpen met de gevolgen van de economische en financiële crisis om te gaan.', 'De EU-waarnemingsmissie in Georgië is op dit moment de enige internationale missie waarmee de toestand in dit land in de gaten wordt gehouden. De EU-missie speelt een belangrijke rol, maar we zouden graag willen dat de werkzaamheden van deze missie in het gehele gebied uitgevoerd konden worden. De onderhandelingen in Genève, onder het gedeelde voorzitterschap van de Europese Unie, de OVSE en de VN, bieden een unieke gelegenheid voor een politieke dialoog met alle partners. We zullen al het nodige blijven ondernemen om een constructieve, tot concrete resultaten leidende discussie te bevorderen.', 'De werkgroep die zich onder gedeeld voorzitterschap van de Europese Commissie en de UNHCR bezighoudt met humanitaire aspecten en ontheemden binnen Georgië, bespreekt nu een reeks maatregelen om vluchtelingen en al dan niet intern ontheemden naar hun regio’s terug te brengen. Verder blijken in Abchazië en Zuid-Ossetië de twee mechanismen voor het voorkomen van en reageren op incidenten redelijk te functioneren, in die zin dat het aantal incidenten afneemt en de grensoversteek door mensen uit deze landen eenvoudiger is geworden.', 'Het is, gelet op de gebeurtenissen uit het recente verleden, van belang dat we de stabiliteit, de veiligheid en de welvaart in Georgië vergroten. Het land heeft meer dan ooit behoefte aan economische en politieke hervormingen. Het Oostelijk Partnerschap, dat in mei in Praag is opgezet, vormt een belangrijk kader voor het opvoeren van onze steun aan Georgië, of dat nu bilateraal geschiedt of via multilaterale samenwerking met andere partners in de regio. Eén sleutelelement is het voorstel om sterkere politieke en handelsbetrekkingen te ontwikkelen. De Raad buitenlandse betrekkingen heeft in september in de context van het Oostelijk Partnerschap beslist dat er richtsnoeren voor onderhandelingen met alle drie de landen in de zuidelijke Kaukasus – waaronder Georgië – moeten worden ontwikkeld.', 'We willen de politieke betrekkingen dus versterken, maar we gaan nu ook voorstellen dat in de nieuwe overeenkomst met Georgië bepalingen over het opzetten van een grotere en uitgebreide vrijhandelszone worden opgenomen. Het is van belang te vermelden dat een dergelijke vrijhandelszone zal garanderen dat de economie van Georgië geleidelijk aan op de interne markt van de EU zal aansluiten. Het behoeft geen betoog dat Georgië voor het realiseren van deze ambitieuze langetermijndoelstelling nog altijd inspanningen zal moeten leveren en hulpmaatregelen zal moeten steunen om hervormingen door te voeren. De onderhandelingen over een grotere en uitgebreide vrijhandelszone kunnen pas van start gaan als aan de vereiste voorwaarden is voldaan.', 'Ik zou hier wat de betrekkingen met Georgië betreft graag aan toevoegen dat onze acties om het contact tussen mensen te vergemakkelijken vruchten beginnen af te werpen. De Commissie heeft de onderhandelingen over een akkoord voor het vergemakkelijken van visumvrijstelling en garanties voor terugkeer zojuist afgesloten. De tekst van dat akkoord is nu voor de Raad beschikbaar. We hopen dat deze procedure zo spoedig mogelijk kan worden afgerond.', 'Dames en heren, ik geloof dat we het er allemaal over eens zijn dat Georgië een sleutelrol vervult in ons deel van de wereld. Het is daarom van groot belang dat we de verplichtingen die we jegens dit land zijn aangegaan gestand doen om het zo te helpen een antwoord te formuleren op de talrijke uitdagingen waarmee het wordt geconfronteerd. En dat geldt zeker voor de tenuitvoerlegging van het programma voor hervormingen. Nu Georgië werkelijk vorderingen maakt met de tenuitvoerlegging van die politieke en economische hervormingen zullen de betrekkingen tussen de EU en Georgië steeds nauwer worden. ']"
43, 6. Rapport van de onafhankelijke internationale onderzoeksmissie voor het conflict in Georgië (debat) ,"  Ioannis Kasoulides,  namens de PPE-Fractie. – (EN) Mevrouw de Voorzitter, allereerst nemen we nota van het rapport van de onafhankelijke onderzoeksmissie dat zojuist is uitgebracht. In omstandigheden als deze is het uiterst moeilijk te zeggen wie er is begonnen en wie volgde. Wat van belang is, is dat de feiten een jaar na dit conflict nog overeind blijven en dat ze een aantal beginselen schenden die de Europese Unie hoog dient te houden.Op de eerste plaats is er, zoals u, mijnheer de Commissaris, al zei, het beginsel van steun voor de territoriale integriteit van Georgië. Bij al onze diplomatieke en andere acties dienen we ons verre te houden van het stimuleren van eenzijdige onafhankelijkheidsverklaringen of separatisme. Situaties die tot stand zijn gebracht door het gebruik van geweld zijn onaanvaardbaar en kunnen nooit aanvaardbaar zijn.Op de tweede plaats is er het recht van vluchtelingen om naar hun woningen en eigendommen terug te keren: het grondrecht van vrij verkeer, zoals u zei, om de scheidingslijnen te overschrijden. Het recht op het bezitten van een woning en het oplossen van conflictsituaties dienen in ons beleid centraal te staan en er dienen initiatieven te worden genomen om deze humanitaire en mensenrechtenzaken aan te pakken, onafhankelijk van de uitkomst van enige politieke regeling.Op de derde plaats laten de vijandelijkheden in Zuid-Ossetië duidelijk zien dat zoiets als een bevroren conflict niet bestaat. De term ‘bevroren’ heeft het idee van appeasement in zich. Gebrek aan belangstelling van de kant van de internationale gemeenschap kan leiden tot een chronische situatie, en een onopgelost conflict is een potentiële bedreiging voor vrede en stabiliteit. Een jaar na het conflict onderstreep ik eens te meer de succesvolle rol van de Europese Unie en het Franse voorzitterschap bij de totstandkoming van een snel staakt-het-vuren en de missie die toeziet op naleving daarvan. De aanwezigheid van Europese waarnemers is een garantie dat geen van beide partijen van nu af aan eigenmachtig kan claimen dat de andere partij met de vijandelijkheden is begonnen. De inspanningen dienen nu gericht te zijn op een politieke regeling, hoe moeilijk dat ook is, en de onmiddellijk na de vijandelijkheden in Genève begonnen politieke onderhandelingen moeten vooral doorgaan.We steunen de inspanningen om te komen tot een nieuwe associatieovereenkomst, in het kader van het Oostelijk Partnerschap, die verder gaat dan mogelijkheden voor handel en investeringen. Tevens steunen we een overeenkomst ter vergemakkelijking van de procedures voor het uitgeven van visa voor kort verblijf en aangaande overname tussen de Europese Gemeenschap en Georgië, en zijn we tevreden over het pakket van noodsteun na een conflictsituatie, dat goed werkt. ","Ioannis Kasoulides,",5,434,not_available,"['eng', 'eng', 'eng', 'eng', 'eng']","['  Ioannis Kasoulides,  namens de PPE-Fractie. – (EN) Mevrouw de Voorzitter, allereerst nemen we nota van het rapport van de onafhankelijke onderzoeksmissie dat zojuist is uitgebracht. In omstandigheden als deze is het uiterst moeilijk te zeggen wie er is begonnen en wie volgde. Wat van belang is, is dat de feiten een jaar na dit conflict nog overeind blijven en dat ze een aantal beginselen schenden die de Europese Unie hoog dient te houden.', 'Op de eerste plaats is er, zoals u, mijnheer de Commissaris, al zei, het beginsel van steun voor de territoriale integriteit van Georgië. Bij al onze diplomatieke en andere acties dienen we ons verre te houden van het stimuleren van eenzijdige onafhankelijkheidsverklaringen of separatisme. Situaties die tot stand zijn gebracht door het gebruik van geweld zijn onaanvaardbaar en kunnen nooit aanvaardbaar zijn.', 'Op de tweede plaats is er het recht van vluchtelingen om naar hun woningen en eigendommen terug te keren: het grondrecht van vrij verkeer, zoals u zei, om de scheidingslijnen te overschrijden. Het recht op het bezitten van een woning en het oplossen van conflictsituaties dienen in ons beleid centraal te staan en er dienen initiatieven te worden genomen om deze humanitaire en mensenrechtenzaken aan te pakken, onafhankelijk van de uitkomst van enige politieke regeling.', 'Op de derde plaats laten de vijandelijkheden in Zuid-Ossetië duidelijk zien dat zoiets als een bevroren conflict niet bestaat. De term ‘bevroren’ heeft het idee van appeasement in zich. Gebrek aan belangstelling van de kant van de internationale gemeenschap kan leiden tot een chronische situatie, en een onopgelost conflict is een potentiële bedreiging voor vrede en stabiliteit. Een jaar na het conflict onderstreep ik eens te meer de succesvolle rol van de Europese Unie en het Franse voorzitterschap bij de totstandkoming van een snel staakt-het-vuren en de missie die toeziet op naleving daarvan. De aanwezigheid van Europese waarnemers is een garantie dat geen van beide partijen van nu af aan eigenmachtig kan claimen dat de andere partij met de vijandelijkheden is begonnen. De inspanningen dienen nu gericht te zijn op een politieke regeling, hoe moeilijk dat ook is, en de onmiddellijk na de vijandelijkheden in Genève begonnen politieke onderhandelingen moeten vooral doorgaan.', 'We steunen de inspanningen om te komen tot een nieuwe associatieovereenkomst, in het kader van het Oostelijk Partnerschap, die verder gaat dan mogelijkheden voor handel en investeringen. Tevens steunen we een overeenkomst ter vergemakkelijking van de procedures voor het uitgeven van visa voor kort verblijf en aangaande overname tussen de Europese Gemeenschap en Georgië, en zijn we tevreden over het pakket van noodsteun na een conflictsituatie, dat goed werkt. ']"
44, 6. Rapport van de onafhankelijke internationale onderzoeksmissie voor het conflict in Georgië (debat) ,"  Zoran Thaler,  namens de S&D-Fractie. – (SL) Mevrouw de Voorzitter, dames en heren, vertegenwoordigers van de Commissie, we verwelkomen het onpartijdige en onafhankelijke onderzoek en het latere rapport over het conflict in Georgië in 2008, opgesteld in het kader van de internationale onderzoeksmissie met aan het hoofd de Zwitserse diplomate Heidi Tagliavini. Voor de uitbarsting van de vijandelijkheden in Zuid-Ossetië tijdens de nacht van 7 op 8 augustus 2008, die vele burgers het leven kostten, waren we maandenlang getuige van provocaties van alle kanten. De Russische militaire interventie, inclusief de invasie van Georgië, was niet in verhouding en ongeoorloofd. Beide conflictpartijen hebben het internationale humanitaire recht geschonden, wat ook in het verslag en door verschillende organisaties, zoals Human Rights Watch, werd bevestigd.Wat moeten we nu doen? Rusland moet de wapenstilstand volledig naleven. Het land moet zich vooral terugtrekken uit de gebieden die het sinds 7 augustus 2008 heeft bezet. Het moet onmiddellijk vrije en onbeperkte toegang tot Zuid-Ossetië verschaffen aan de leden van de Europese waarnemingsmissie en aan internationale organisaties, onder andere aan de Verenigde Naties, zodat die de wapenstilstand kunnen controleren en humanitaire hulp kunnen verlenen. Nog steeds zijn ongeveer 25 000 tot 30 000 Georgiërs verdreven uit Zuid-Ossetië en feitelijk moeten de autoriteiten van Zuid-Ossetië de terugkeer naar hun huizen mogelijk maken.De territoriale integriteit van Georgië mag niet worden betwist. Er zijn echter onrustwekkende tekenen van een autoritair systeem in Georgië. Het misbruik van het rechtssysteem door de president, de toenemende onverdraagzaamheid ten opzichte van andere meningen, de steeds geringere vrijheid meningsuiting en de soms confronterende nationalistische retoriek verslechteren de toestand van Georgië. Het land zal enkel opnieuw de pro-Europese en democratische weg kunnen bewandelen en aantrekkelijk worden voor andere landen in de regio wanneer het de idealen handhaaft die het tijdens de Rozenrevolutie heeft gesteund. Alle betrokkenen moeten op eerlijke wijze de kansen benutten die de onderhandelingen van Genève geven. De situatie in de Kaukasus moet op de volgende Europees-Russische top serieuze aandacht krijgen. ","Zoran Thaler,",3,336,not_available,"['slv', 'slv', 'slv']","['  Zoran Thaler,  namens de S&D-Fractie. – (SL) Mevrouw de Voorzitter, dames en heren, vertegenwoordigers van de Commissie, we verwelkomen het onpartijdige en onafhankelijke onderzoek en het latere rapport over het conflict in Georgië in 2008, opgesteld in het kader van de internationale onderzoeksmissie met aan het hoofd de Zwitserse diplomate Heidi Tagliavini. Voor de uitbarsting van de vijandelijkheden in Zuid-Ossetië tijdens de nacht van 7 op 8 augustus 2008, die vele burgers het leven kostten, waren we maandenlang getuige van provocaties van alle kanten. De Russische militaire interventie, inclusief de invasie van Georgië, was niet in verhouding en ongeoorloofd. Beide conflictpartijen hebben het internationale humanitaire recht geschonden, wat ook in het verslag en door verschillende organisaties, zoals Human Rights Watch, werd bevestigd.', 'Wat moeten we nu doen? Rusland moet de wapenstilstand volledig naleven. Het land moet zich vooral terugtrekken uit de gebieden die het sinds 7 augustus 2008 heeft bezet. Het moet onmiddellijk vrije en onbeperkte toegang tot Zuid-Ossetië verschaffen aan de leden van de Europese waarnemingsmissie en aan internationale organisaties, onder andere aan de Verenigde Naties, zodat die de wapenstilstand kunnen controleren en humanitaire hulp kunnen verlenen. Nog steeds zijn ongeveer 25 000 tot 30 000 Georgiërs verdreven uit Zuid-Ossetië en feitelijk moeten de autoriteiten van Zuid-Ossetië de terugkeer naar hun huizen mogelijk maken.', 'De territoriale integriteit van Georgië mag niet worden betwist. Er zijn echter onrustwekkende tekenen van een autoritair systeem in Georgië. Het misbruik van het rechtssysteem door de president, de toenemende onverdraagzaamheid ten opzichte van andere meningen, de steeds geringere vrijheid meningsuiting en de soms confronterende nationalistische retoriek verslechteren de toestand van Georgië. Het land zal enkel opnieuw de pro-Europese en democratische weg kunnen bewandelen en aantrekkelijk worden voor andere landen in de regio wanneer het de idealen handhaaft die het tijdens de Rozenrevolutie heeft gesteund. Alle betrokkenen moeten op eerlijke wijze de kansen benutten die de onderhandelingen van Genève geven. De situatie in de Kaukasus moet op de volgende Europees-Russische top serieuze aandacht krijgen. ']"
