,agenda_item,text,speaker,number_p,number_w,chair,language_ps,ps
13, 5. Jaarverslag 2008 over de werkzaamheden van de Europese ombudsman (debat) ,"  Erminia Mazzoni  (PPE). -  (IT) Mijnheer de Voorzitter, dames en heren, als voorzitter van de Commissie verzoekschriften en namens alle leden van de commissie wil ik de ombudsman bedanken voor zijn geleverde werk en zijn nauwkeurige verslag. Ik wil mevrouw Paliadeli bedanken voor de uitmuntende bijdrage die ze aan het werk van onze commissie heeft geleverd en ik dank iedereen die aan het debat heeft deelgenomen, omdat ze belangstelling en aandacht tonen met als doelstelling dat deze instrumenten van democratie en deelname worden toegepast en het doel bereiken dat in de verdragen is vastgelegd.De analyse van het verslag over 2008 van de Europese ombudsman laat helaas zien dat het doel van de toepassing van het beginsel dat in artikel 41 van het Handvest van de grondrechten is bekrachtigd nog lang niet is bereikt. Dat 3 406 Europese burgers in 2008 hun recht hebben uitgeoefend om bij de ombudsman over gevallen van wanbestuur te klagen laat zien dat de mate van ontevredenheid toeneemt, in aanmerking nemend dat het in 2007 om 3 211 burgers ging. Ik denk dat dit getal moet worden afgezet tegen de mate van bekendheid en bewustwording en dus stel ik — in tegenstelling tot wat de collega beweert die eerder heeft gesproken — dat deze getallen getuigen van een grotere mate van ontevredenheid bij de Europeanen. En het is een gedeeltelijke troost om te zien dat slechts een deel van deze klachten bleek te vallen onder de bevoegdheid van de Europese ombudsman, omdat een groot deel van de klachten die de Europese ombudsman niet in behandeling heeft genomen is overgedragen aan andere organisaties, waaronder ook de Commissie verzoekschriften, waarvan ik de voorzitter ben.Waar wij, als Europese instellingen, en in het bijzonder als Parlement, ook verantwoordelijkheid voor moeten nemen is, denk ik, de perceptie van bestuurlijke correctheid, in hoeverre onze instellingen als correct worden gezien. Ondanks de positieve bevestiging dat de rol van de Europese ombudsman steeds functioneler wordt, gezien het grotere aantal zaken dat met succes is opgelost, moeten wij als Parlement, dat ongeveer 10 procent van de klachten heeft ontvangen, en als Commissie verzoekschriften, dat 60 procent heeft ontvangen...(Spreekster wordt door de Voorzitter verzocht af te ronden)Mag ik daar in dat geval alleen nog aan toevoegen – aangezien u wat meer spreektijd aan iemand anders had gegeven dacht ik het me te kunnen veroorloven om een paar seconden langer te spreken, mijnheer de Voorzitter, ook vanwege mijn hoedanigheid als voorzitter – dat deze instellingen de plicht hebben om deze instrumenten van democratie en deelname te verbeteren, omdat we ook een Verdrag van Lissabon hebben, dat het recht van volksinitiatief introduceert. Ik denk dat we de functies van deze organisaties moeten verbeteren, zonder ze te veranderen; we hebben de plicht om de doeltreffendheid en productiviteit van de instrumenten die we de burgers hebben gegeven te verbeteren als we werkelijk willen bijdragen aan de opbouw van het Europa van de volken. ",Erminia Mazzoni  (PPE). -,5,482,not_available,"['ita', 'ita', 'ita', 'ita', 'ita']","['  Erminia Mazzoni  (PPE). -  (IT) Mijnheer de Voorzitter, dames en heren, als voorzitter van de Commissie verzoekschriften en namens alle leden van de commissie wil ik de ombudsman bedanken voor zijn geleverde werk en zijn nauwkeurige verslag. Ik wil mevrouw Paliadeli bedanken voor de uitmuntende bijdrage die ze aan het werk van onze commissie heeft geleverd en ik dank iedereen die aan het debat heeft deelgenomen, omdat ze belangstelling en aandacht tonen met als doelstelling dat deze instrumenten van democratie en deelname worden toegepast en het doel bereiken dat in de verdragen is vastgelegd.', 'De analyse van het verslag over 2008 van de Europese ombudsman laat helaas zien dat het doel van de toepassing van het beginsel dat in artikel 41 van het Handvest van de grondrechten is bekrachtigd nog lang niet is bereikt. Dat 3 406 Europese burgers in 2008 hun recht hebben uitgeoefend om bij de ombudsman over gevallen van wanbestuur te klagen laat zien dat de mate van ontevredenheid toeneemt, in aanmerking nemend dat het in 2007 om 3 211 burgers ging. Ik denk dat dit getal moet worden afgezet tegen de mate van bekendheid en bewustwording en dus stel ik — in tegenstelling tot wat de collega beweert die eerder heeft gesproken — dat deze getallen getuigen van een grotere mate van ontevredenheid bij de Europeanen. En het is een gedeeltelijke troost om te zien dat slechts een deel van deze klachten bleek te vallen onder de bevoegdheid van de Europese ombudsman, omdat een groot deel van de klachten die de Europese ombudsman niet in behandeling heeft genomen is overgedragen aan andere organisaties, waaronder ook de Commissie verzoekschriften, waarvan ik de voorzitter ben.', 'Waar wij, als Europese instellingen, en in het bijzonder als Parlement, ook verantwoordelijkheid voor moeten nemen is, denk ik, de perceptie van bestuurlijke correctheid, in hoeverre onze instellingen als correct worden gezien. Ondanks de positieve bevestiging dat de rol van de Europese ombudsman steeds functioneler wordt, gezien het grotere aantal zaken dat met succes is opgelost, moeten wij als Parlement, dat ongeveer 10 procent van de klachten heeft ontvangen, en als Commissie verzoekschriften, dat 60 procent heeft ontvangen...', '(Spreekster wordt door de Voorzitter verzocht af te ronden)', 'Mag ik daar in dat geval alleen nog aan toevoegen – aangezien u wat meer spreektijd aan iemand anders had gegeven dacht ik het me te kunnen veroorloven om een paar seconden langer te spreken, mijnheer de Voorzitter, ook vanwege mijn hoedanigheid als voorzitter – dat deze instellingen de plicht hebben om deze instrumenten van democratie en deelname te verbeteren, omdat we ook een Verdrag van Lissabon hebben, dat het recht van volksinitiatief introduceert. Ik denk dat we de functies van deze organisaties moeten verbeteren, zonder ze te veranderen; we hebben de plicht om de doeltreffendheid en productiviteit van de instrumenten die we de burgers hebben gegeven te verbeteren als we werkelijk willen bijdragen aan de opbouw van het Europa van de volken. ']"
14, 5. Jaarverslag 2008 over de werkzaamheden van de Europese ombudsman (debat) ,"  Kinga Göncz  (S&D).   – (HU) Als lid van de Commissie verzoekschriften wil ik ook graag een paar woorden zeggen. Enerzijds steun ik de aanneming van het verslag van de Europese ombudsman volledig. Ook als lid van de commissie zie ik dat hij zich op zeer evenwichtige wijze van zijn taak heeft gekweten.Wat ik van bijzonder groot belang vind, is dat hij heeft geprobeerd de behandelingstijd van zaken te verkorten. We weten immers dat als iemand een klacht heeft, het voor het vertrouwen van cruciaal belang is hoe snel deze klacht in behandeling wordt genomen en hoe snel de indiener antwoord krijgt. We weten dat een groot gedeelte van de klachten niet door de ombudsman in behandeling kan worden genomen. In dit opzicht zal het in de nabije toekomst bij uitstek belangrijk worden dat we de onderdanen van de Europese Unie zo veel mogelijk informatie verschaffen over tot welke instelling ze zich kunnen wenden met al hun verschillende vragen.De samenwerking tussen de commissie en de ombudsman was uitstekend en ik hoop dat dit ook in de nabije toekomst het geval zal zijn. ",Kinga Göncz  (S&D).,3,183,not_available,"['hun', 'hun', 'hun']","['  Kinga Göncz  (S&D).   – (HU) Als lid van de Commissie verzoekschriften wil ik ook graag een paar woorden zeggen. Enerzijds steun ik de aanneming van het verslag van de Europese ombudsman volledig. Ook als lid van de commissie zie ik dat hij zich op zeer evenwichtige wijze van zijn taak heeft gekweten.', 'Wat ik van bijzonder groot belang vind, is dat hij heeft geprobeerd de behandelingstijd van zaken te verkorten. We weten immers dat als iemand een klacht heeft, het voor het vertrouwen van cruciaal belang is hoe snel deze klacht in behandeling wordt genomen en hoe snel de indiener antwoord krijgt. We weten dat een groot gedeelte van de klachten niet door de ombudsman in behandeling kan worden genomen. In dit opzicht zal het in de nabije toekomst bij uitstek belangrijk worden dat we de onderdanen van de Europese Unie zo veel mogelijk informatie verschaffen over tot welke instelling ze zich kunnen wenden met al hun verschillende vragen.', 'De samenwerking tussen de commissie en de ombudsman was uitstekend en ik hoop dat dit ook in de nabije toekomst het geval zal zijn. ']"
15, 5. Jaarverslag 2008 over de werkzaamheden van de Europese ombudsman (debat) ,"  Marian Harkin  (ALDE). -  (EN) Mijnheer de Voorzitter, ik wil de rapporteur lof toezwaaien voor een zeer uitgebreid verslag, alsmede de ombudsman en diens medewerkers. De dienst wordt elk jaar beter. Er is goed werk verricht.Als u echter het verslag leest en instemt met de inhoud en u in de toelichting een lange paragraaf aantreft die over uzelf gaat, dan kunt u die niet negeren.Waarop ik doel is natuurlijk de alinea waarin de ombudsman het Parlement bekritiseert omdat het in 2005 een verzoek om informatie heeft afgewezen over de aan Maltese leden uitgekeerde vergoedingen. Waar het in werkelijkheid om ging was natuurlijk dat als deze informatie was vrijgegeven, er over al onze vergoedingen opening van zaken had moeten worden gegeven.Wat mij betreft gaat het hier om gemeenschapsgeld en heeft de gemeenschap het recht te weten hoe het wordt besteed. Wij hebben de bedragen gepubliceerd die uit hoofde van het GLB aan boeren zijn betaald, maar onze reisdeclaraties en andere vergoedingen maken wij niet openbaar. Wat mij betreft zijn dit legitieme kosten. Ze zijn gemaakt tijdens de uitoefening van ons werk, ten behoeve van onze burgers. Nogmaals, mijn toelagen voor mijn medewerkers, kantoor, reizen, enzovoort, alles om mijn kiezers te vertegenwoordigen, zijn volkomen legitiem. Ik hoef me er niet voor te verontschuldigen en ik hoef ze niet te verbergen.Ik suggereer niet dat de persoonlijke levenssfeer van mijn medewerkers op enigerlei wijze moet worden aangetast: dat is niet nodig. Maar ik zeg heel duidelijk dat zolang wij geen vrijheid van informatie over onze toelagen en uitgaven toestaan, de burgers het Parlement zullen zien als een instelling die transparantie predikt maar niet toepast waar het haarzelf betreft.Ik weet dat afzonderlijke leden hun uitgaven op hun websites kunnen publiceren en dat ze dit ook doen, maar wij als Parlement hebben een gemeenschappelijke verantwoordelijkheid om deze informatie beschikbaar te maken. Misschien klink ik als een moraalridder; dat ben ik niet. Ik zeg in hoofdzaak dat het toch zal gebeuren; en dan is het beter dat het Parlement eraan meewerkt in plaats van dat het ertoe wordt gedwongen. ",Marian Harkin  (ALDE). -,6,346,not_available,"['eng', 'eng', 'eng', 'eng', 'eng', 'eng']","['  Marian Harkin  (ALDE). -  (EN) Mijnheer de Voorzitter, ik wil de rapporteur lof toezwaaien voor een zeer uitgebreid verslag, alsmede de ombudsman en diens medewerkers. De dienst wordt elk jaar beter. Er is goed werk verricht.', 'Als u echter het verslag leest en instemt met de inhoud en u in de toelichting een lange paragraaf aantreft die over uzelf gaat, dan kunt u die niet negeren.', 'Waarop ik doel is natuurlijk de alinea waarin de ombudsman het Parlement bekritiseert omdat het in 2005 een verzoek om informatie heeft afgewezen over de aan Maltese leden uitgekeerde vergoedingen. Waar het in werkelijkheid om ging was natuurlijk dat als deze informatie was vrijgegeven, er over al onze vergoedingen opening van zaken had moeten worden gegeven.', 'Wat mij betreft gaat het hier om gemeenschapsgeld en heeft de gemeenschap het recht te weten hoe het wordt besteed. Wij hebben de bedragen gepubliceerd die uit hoofde van het GLB aan boeren zijn betaald, maar onze reisdeclaraties en andere vergoedingen maken wij niet openbaar. Wat mij betreft zijn dit legitieme kosten. Ze zijn gemaakt tijdens de uitoefening van ons werk, ten behoeve van onze burgers. Nogmaals, mijn toelagen voor mijn medewerkers, kantoor, reizen, enzovoort, alles om mijn kiezers te vertegenwoordigen, zijn volkomen legitiem. Ik hoef me er niet voor te verontschuldigen en ik hoef ze niet te verbergen.', 'Ik suggereer niet dat de persoonlijke levenssfeer van mijn medewerkers op enigerlei wijze moet worden aangetast: dat is niet nodig. Maar ik zeg heel duidelijk dat zolang wij geen vrijheid van informatie over onze toelagen en uitgaven toestaan, de burgers het Parlement zullen zien als een instelling die transparantie predikt maar niet toepast waar het haarzelf betreft.', 'Ik weet dat afzonderlijke leden hun uitgaven op hun websites kunnen publiceren en dat ze dit ook doen, maar wij als Parlement hebben een gemeenschappelijke verantwoordelijkheid om deze informatie beschikbaar te maken. Misschien klink ik als een moraalridder; dat ben ik niet. Ik zeg in hoofdzaak dat het toch zal gebeuren; en dan is het beter dat het Parlement eraan meewerkt in plaats van dat het ertoe wordt gedwongen. ']"
16, 5. Jaarverslag 2008 over de werkzaamheden van de Europese ombudsman (debat) ,"  Oriol Junqueras Vies  (Verts/ALE). -  (ES) Mijnheer de Voorzitter, als lid van de Commissie verzoekschriften zou ik een paar kanttekeningen willen plaatsen bij het amendement dat door onze fractie werd ingediend inzake het verslag Paliadeli over het jaarverslag van de werkzaamheden van de Europese ombudsman.Volgens ons kan de definitie van wanbestuur die in de resolutie voorkomt, in plaats van de rol van de ombudsman te versterken of te ondersteunen, wel eens het omgekeerde effect hebben. Ten eerste is de voorgestelde definitie veel te vrijblijvend en te vaag, waardoor het moeilijk is om te bepalen in welke gevallen de ombudsman kan of moet optreden, wat zijn vermogen om tussenbeide te komen verzwakt. Ten tweede, en dat is misschien nog belangrijker, kent de huidige definitie de ombudsman een mogelijkheid tot interventie toe die andere instellingen gemakkelijk als discretionair kunnen beschouwen, omdat ze niet voldoende gedefinieerd en gereguleerd is.Daarom zijn wij van mening dat de meer gedetailleerde en bondige definitie van wanbestuur die voorkomt in ons amendement, in het amendement van de Fractie De Groenen/Vrije Europese Alliantie, een veel geschiktere basis vormt voor een actieve en doeltreffende interventie, en bovendien veel begrijpelijker is voor de instellingen en de burgers. ",Oriol Junqueras Vies  (Verts/ALE). -,3,199,not_available,"['spa', 'spa', 'spa']","['  Oriol Junqueras Vies  (Verts/ALE). -  (ES) Mijnheer de Voorzitter, als lid van de Commissie verzoekschriften zou ik een paar kanttekeningen willen plaatsen bij het amendement dat door onze fractie werd ingediend inzake het verslag Paliadeli over het jaarverslag van de werkzaamheden van de Europese ombudsman.', 'Volgens ons kan de definitie van wanbestuur die in de resolutie voorkomt, in plaats van de rol van de ombudsman te versterken of te ondersteunen, wel eens het omgekeerde effect hebben. Ten eerste is de voorgestelde definitie veel te vrijblijvend en te vaag, waardoor het moeilijk is om te bepalen in welke gevallen de ombudsman kan of moet optreden, wat zijn vermogen om tussenbeide te komen verzwakt. Ten tweede, en dat is misschien nog belangrijker, kent de huidige definitie de ombudsman een mogelijkheid tot interventie toe die andere instellingen gemakkelijk als discretionair kunnen beschouwen, omdat ze niet voldoende gedefinieerd en gereguleerd is.', 'Daarom zijn wij van mening dat de meer gedetailleerde en bondige definitie van wanbestuur die voorkomt in ons amendement, in het amendement van de Fractie De Groenen/Vrije Europese Alliantie, een veel geschiktere basis vormt voor een actieve en doeltreffende interventie, en bovendien veel begrijpelijker is voor de instellingen en de burgers. ']"
17, 5. Jaarverslag 2008 over de werkzaamheden van de Europese ombudsman (debat) ,"  Oldřich Vlasák  (ECR). -  (CS) Geachte Voorzitter, geachte ombudsman, dames en heren. Ik heb grote waardering voor de activiteiten van de Europese publieke hoeder van het recht, maar kan er niet omheen dat die activiteiten drie grote zwaktes vertonen. Allereerst zitten we met de geïnformeerdheid van het publiek. Het overgrote deel van de EU-bevolking weet namelijk niet dat er überhaupt zoiets als een Europese ombudsman bestaat en dus al helemaal niet wat die doet en ook niet dat zij zich tot hem wenden kunnen. De feiten spreken voor zich. Bijna 90 procent van de door mijn Tsjechische landgenoten ingediende klachten viel buiten de bevoegdheid van de Europese ombudsman en in andere lidstaten is dat niet veel anders. Het Europees Parlement stelt daarom voor een uitgebreide informatiecampagne te voeren, maar ik ben er niet al te zeker van of dat wel het juiste medicijn voor de juiste ziekte is.Het tweede pijnpunt betreft de kosten. Elke publieke instelling kost geld. Met elke nieuwe instelling dijt de bureaucratie waaraan de burger het hoofd moet zien te bieden en waarin deze zich een weg moet zien te banen, verder uit. Het is dan ook nodig eens goed na te denken over de vraag of het geld van de belastingbetalers wel de gewenste resultaten oplevert. Vorig jaar werden er door mijn landgenoten 66 klachten ingediend bij de Europese publieke hoeder van het recht. EU-wijd ging het om bijna 800 binnen de bevoegdheid van de Europese ombudsman vallende klachten. Deze zijn in behandeling genomen door zeventig ambtenaren, wat de belastingbetaler 9 miljoen euro gekost heeft. Dat is per ontvankelijk geval meer dan 10 000 euro. Dat is niet niks als u het mij vraagt.En dan ten derde zitten we met de subsidiariteit. Als voormalig burgemeester sloeg de schrik mij om het hart toen ik las dat een van de weinige gevallen waarover de ombudsman zich gebogen heeft het bestemmingsplan betrof voor het kleine Břeclavska-gebied, in samenhang met een autoweg aldaar. Ik acht dat volstrekt buiten de orde, aangezien lokale problemen in de allereerste plaats op lokaal niveau opgelost moeten worden en niet hier in Brussel of Straatsburg. Dames en heren, nu we deze instelling eenmaal opgericht hebben, dient erop toegezien te worden dat deze zijn taken op een redelijke manier ten uitvoer legt tegen een zo laag mogelijke prijs, maar eerst en vooral dat deze geen misbruik maakt van haar bevoegdheden, noch deze kunstmatig uitbreidt en nog meer bureaucratie creëert. Ik wens de ombudsman hierbij veel succes toe. ",Oldřich Vlasák  (ECR). -,3,416,not_available,"['cze', 'cze', 'cze']","['  Oldřich Vlasák  (ECR). -  (CS) Geachte Voorzitter, geachte ombudsman, dames en heren. Ik heb grote waardering voor de activiteiten van de Europese publieke hoeder van het recht, maar kan er niet omheen dat die activiteiten drie grote zwaktes vertonen. Allereerst zitten we met de geïnformeerdheid van het publiek. Het overgrote deel van de EU-bevolking weet namelijk niet dat er überhaupt zoiets als een Europese ombudsman bestaat en dus al helemaal niet wat die doet en ook niet dat zij zich tot hem wenden kunnen. De feiten spreken voor zich. Bijna 90 procent van de door mijn Tsjechische landgenoten ingediende klachten viel buiten de bevoegdheid van de Europese ombudsman en in andere lidstaten is dat niet veel anders. Het Europees Parlement stelt daarom voor een uitgebreide informatiecampagne te voeren, maar ik ben er niet al te zeker van of dat wel het juiste medicijn voor de juiste ziekte is.', 'Het tweede pijnpunt betreft de kosten. Elke publieke instelling kost geld. Met elke nieuwe instelling dijt de bureaucratie waaraan de burger het hoofd moet zien te bieden en waarin deze zich een weg moet zien te banen, verder uit. Het is dan ook nodig eens goed na te denken over de vraag of het geld van de belastingbetalers wel de gewenste resultaten oplevert. Vorig jaar werden er door mijn landgenoten 66 klachten ingediend bij de Europese publieke hoeder van het recht. EU-wijd ging het om bijna 800 binnen de bevoegdheid van de Europese ombudsman vallende klachten. Deze zijn in behandeling genomen door zeventig ambtenaren, wat de belastingbetaler 9 miljoen euro gekost heeft. Dat is per ontvankelijk geval meer dan 10 000 euro. Dat is niet niks als u het mij vraagt.', 'En dan ten derde zitten we met de subsidiariteit. Als voormalig burgemeester sloeg de schrik mij om het hart toen ik las dat een van de weinige gevallen waarover de ombudsman zich gebogen heeft het bestemmingsplan betrof voor het kleine Břeclavska-gebied, in samenhang met een autoweg aldaar. Ik acht dat volstrekt buiten de orde, aangezien lokale problemen in de allereerste plaats op lokaal niveau opgelost moeten worden en niet hier in Brussel of Straatsburg. Dames en heren, nu we deze instelling eenmaal opgericht hebben, dient erop toegezien te worden dat deze zijn taken op een redelijke manier ten uitvoer legt tegen een zo laag mogelijke prijs, maar eerst en vooral dat deze geen misbruik maakt van haar bevoegdheden, noch deze kunstmatig uitbreidt en nog meer bureaucratie creëert. Ik wens de ombudsman hierbij veel succes toe. ']"
18, 5. Jaarverslag 2008 over de werkzaamheden van de Europese ombudsman (debat) ,"  Nikolaos Chountis  (GUE/NGL).   – (EL) Mijnheer de Voorzitter, ik geef steun aan en stem voor het verslag van mevrouw Paliadeli. Ook wil ik de heer Diamandouros van harte gelukwensen met het werk dat hij heeft verricht. Ik wilde benadrukken dat vele Europese burgers geconfronteerd worden met verschijnselen die eufemistisch ‘wanbestuur’ worden genoemd maar er uiteindelijk toe leiden dat zij van hun grondrechten worden beroofd. Mijns inziens zijn deze verschijnselen niet zozeer te wijten aan bureaucratie of nalatigheid maar aan het verkeerde en onrechtvaardige beleid dat de instellingen van de Europese Unie uitvoeren. Daarom is het recht om een verzoekschrift in te dienen bij de Europese ombudsman voor de Europese burger een mogelijkheid om eerbiediging van zijn rechten af te dwingen.Daarom is het ook zo belangrijk, mijnheer de Voorzitter, dat het Europees Parlement – de enige rechtstreeks gekozen en representatieve instelling van de Europese Unie – politieke steun geeft aan de Europese ombudsman en ervoor zorgt dat dergelijke verschijnselen in de mate van het mogelijke worden ingedamd. Het verslag van de ombudsman maar ook zijn concrete werkzaamheden tonen aan dat als de ombudsman steun heeft van het Europees Parlement hij zich op efficiëntere wijze van zijn taken kan kwijten.Tot slot is het voor mij noodzakelijk om de Europese burgers beter te informeren over de rol en de mogelijkheden van de Europese ombudsman. Dan zullen zij in geval van schending van hun grondrechten snel een beroep op hem kunnen doen. ",Nikolaos Chountis  (GUE/NGL).,3,238,not_available,"['gre', 'gre', 'gre']","['  Nikolaos Chountis  (GUE/NGL).   – (EL) Mijnheer de Voorzitter, ik geef steun aan en stem voor het verslag van mevrouw Paliadeli. Ook wil ik de heer Diamandouros van harte gelukwensen met het werk dat hij heeft verricht. Ik wilde benadrukken dat vele Europese burgers geconfronteerd worden met verschijnselen die eufemistisch ‘wanbestuur’ worden genoemd maar er uiteindelijk toe leiden dat zij van hun grondrechten worden beroofd. Mijns inziens zijn deze verschijnselen niet zozeer te wijten aan bureaucratie of nalatigheid maar aan het verkeerde en onrechtvaardige beleid dat de instellingen van de Europese Unie uitvoeren. Daarom is het recht om een verzoekschrift in te dienen bij de Europese ombudsman voor de Europese burger een mogelijkheid om eerbiediging van zijn rechten af te dwingen.', 'Daarom is het ook zo belangrijk, mijnheer de Voorzitter, dat het Europees Parlement – de enige rechtstreeks gekozen en representatieve instelling van de Europese Unie – politieke steun geeft aan de Europese ombudsman en ervoor zorgt dat dergelijke verschijnselen in de mate van het mogelijke worden ingedamd. Het verslag van de ombudsman maar ook zijn concrete werkzaamheden tonen aan dat als de ombudsman steun heeft van het Europees Parlement hij zich op efficiëntere wijze van zijn taken kan kwijten.', 'Tot slot is het voor mij noodzakelijk om de Europese burgers beter te informeren over de rol en de mogelijkheden van de Europese ombudsman. Dan zullen zij in geval van schending van hun grondrechten snel een beroep op hem kunnen doen. ']"
