,agenda_item,text,speaker,number_p,number_w,chair,language_ps,ps
106, 9. Stemverklaringen,"  Syed Kamall  (ECR).   – (EN) Mijnheer de Voorzitter, ik wil alle aanwezigen bedanken voor hun geduld, de tolken inbegrepen, die uitnemend werk leveren. Wij zijn het allen eens over het belang van de betrekkingen tussen de EU en de VS en ik denk dat wij allemaal uitzien naar de topbijeenkomsten en naar de discussies op TEC-niveau en diverse andere trans-Atlantische dialogen. Maar het is echt van het grootste belang dat wij beseffen hoezeer de hele wereld uitkijkt naar deze topbijeenkomsten en naar het morele leiderschap dat wij kunnen bieden, niet alleen op EU-niveau, maar ook door de Amerikaanse regering. Een van de beste manieren om onze economieën te stimuleren, vooral in deze tijd van crisis, is toch zeker dat wij ervoor zorgen dat wij vrijhandel niet alleen met de mond belijden, maar ook in de praktijk brengen. Het verontrust mij zeer dat wanneer wij ons gemeenschappelijk landbouwbeleid bezien, wij dit gemeenschappelijk landbouwbeleid opwaarderen en dat wij nog protectionistischer worden, wat zeer nadelig is voor boeren in ontwikkelingslanden. Ook de recente tarieven van de regering van Obama ten aanzien van Chinese banden duiden erop dat wij een neerwaartse spiraal van protectionisme hebben ingezet. Het is tijd dat wij terugkeren naar ons beginsel van vrijhandel om de wereldeconomie te stimuleren. ",Syed Kamall  (ECR).,2,210,not_available,"['eng', 'eng']","['  Syed Kamall  (ECR).   – (EN) Mijnheer de Voorzitter, ik wil alle aanwezigen bedanken voor hun geduld, de tolken inbegrepen, die uitnemend werk leveren. Wij zijn het allen eens over het belang van de betrekkingen tussen de EU en de VS en ik denk dat wij allemaal uitzien naar de topbijeenkomsten en naar de discussies op TEC-niveau en diverse andere trans-Atlantische dialogen. Maar het is echt van het grootste belang dat wij beseffen hoezeer de hele wereld uitkijkt naar deze topbijeenkomsten en naar het morele leiderschap dat wij kunnen bieden, niet alleen op EU-niveau, maar ook door de Amerikaanse regering. Een van de beste manieren om onze economieën te stimuleren, vooral in deze tijd van crisis, is toch zeker dat wij ervoor zorgen dat wij vrijhandel niet alleen met de mond belijden, maar ook in de praktijk brengen. ', 'Het verontrust mij zeer dat wanneer wij ons gemeenschappelijk landbouwbeleid bezien, wij dit gemeenschappelijk landbouwbeleid opwaarderen en dat wij nog protectionistischer worden, wat zeer nadelig is voor boeren in ontwikkelingslanden. Ook de recente tarieven van de regering van Obama ten aanzien van Chinese banden duiden erop dat wij een neerwaartse spiraal van protectionisme hebben ingezet. Het is tijd dat wij terugkeren naar ons beginsel van vrijhandel om de wereldeconomie te stimuleren. ']"
107, 9. Stemverklaringen,"  Maria Da Graça Carvalho  (PPE),  schriftelijk. − (PT) De bijdrage van de Europese begroting voor 2010 aan de bevordering van de economische groei, het concurrentievermogen, de cohesie en de bescherming van de werkgelegenheid is van vitaal belang als antwoord op de huidige economische crisis.Ik wil hier de nadruk leggen op een specifieke stimulans voor de Europese economie, namelijk het Europees economisch herstelplan, dat onder meer steun verleent voor projecten in de energiesector (elektriciteitsnet, aardgasnet en projecten voor koolstofafvang en -opslag), maatregelen inzake breedbandinternet financiert om te waarborgen dat ook plattelandsgemeenschappen op de zogenaamde informatiesnelwegen worden aangesloten en voorziet in een fonds voor de zuivelsector als nieuwe uitdaging voor het gemeenschappelijk landbouwbeleid. Ook andere communautaire steunprogramma’s zoals de schoolfruitregeling en de schoolmelkregeling verdienen een bijzondere vermelding.Ik wil hier met name uw aandacht vragen voor het amendement op het ontwerp van algemene begroting voor 2010 van de Fractie van de Europese Volkspartij (Christendemocraten) waarin het bevorderen van de toegang van jongeren tot een eerste baan via in samenwerking met bedrijven opgezette trainingen, stages en cursussen in ondernemerschap een bijkomende doelstelling van het Erasmus-programma wordt. ","Maria Da Graça Carvalho  (PPE),",3,185,not_available,"['por', 'por', 'por']","['  Maria Da Graça Carvalho  (PPE),  schriftelijk. − (PT) De bijdrage van de Europese begroting voor 2010 aan de bevordering van de economische groei, het concurrentievermogen, de cohesie en de bescherming van de werkgelegenheid is van vitaal belang als antwoord op de huidige economische crisis.', 'Ik wil hier de nadruk leggen op een specifieke stimulans voor de Europese economie, namelijk het Europees economisch herstelplan, dat onder meer steun verleent voor projecten in de energiesector (elektriciteitsnet, aardgasnet en projecten voor koolstofafvang en -opslag), maatregelen inzake breedbandinternet financiert om te waarborgen dat ook plattelandsgemeenschappen op de zogenaamde informatiesnelwegen worden aangesloten en voorziet in een fonds voor de zuivelsector als nieuwe uitdaging voor het gemeenschappelijk landbouwbeleid. Ook andere communautaire steunprogramma’s zoals de schoolfruitregeling en de schoolmelkregeling verdienen een bijzondere vermelding.', 'Ik wil hier met name uw aandacht vragen voor het amendement op het ontwerp van algemene begroting voor 2010 van de Fractie van de Europese Volkspartij (Christendemocraten) waarin het bevorderen van de toegang van jongeren tot een eerste baan via in samenwerking met bedrijven opgezette trainingen, stages en cursussen in ondernemerschap een bijkomende doelstelling van het Erasmus-programma wordt. ']"
108, 9. Stemverklaringen,"  Lena Ek  (ALDE),  schriftelijk. − (SV) De groep amendementen op de EU-begroting 2010 die het zogenaamde “blok 3” vormt, bevat interventies en begeleidende maatregelen waar ik uit principe tegen gekant bent. Het gaat bijvoorbeeld om verschillende opslagmaatregelen, onder andere voor alcohol, en om aanzienlijke Europese steun aan de wijnsector. Het gaat ook om Europese steun voor schoolmelk en schoolfruit, wat dan wel belangrijk kan zijn, maar niet iets is waar de EU over moet beslissen. Tezelfdertijd bevat de groep amendementen belangrijke investeringen in onder andere dierenbescherming en controle op het vervoer van dieren, waar ik mee ingenomen ben. Omdat de stemprocedure mij echter dwingt om een standpunt in te nemen ten aanzien van de groep amendementen in zijn geheel, heb ik ervoor gekozen om me met betrekking tot blok 3 van stemming te onthouden.Amendement 886 heeft een lovenswaardig doel: investeringen in sport. Dat is echter een aangelegenheid die niet op het Europees niveau thuishoort. Daarom heb ik tegengestemd.Amendement 905 is gebaseerd op een houding ten aanzien van migranten die ik uit principe niet kan aanvaarden. Er werd bijvoorbeeld geld uitgetrokken om mensen die in Afrika wonen te vertellen hoe gevaarlijk het is om naar Europa te trekken. We mogen geen muren rond ons continent bouwen. Daarom heb ik tegen dit amendement gestemd.Amendement 909 bevat middelen voor het toezicht op Europese burgers. Dat is iets wat ik niet kan aanvaarden en daarom heb ik tegengestemd. ","Lena Ek  (ALDE),",4,237,not_available,"['swe', 'swe', 'swe', 'swe']","['  Lena Ek  (ALDE),  schriftelijk. − (SV) De groep amendementen op de EU-begroting 2010 die het zogenaamde “blok 3” vormt, bevat interventies en begeleidende maatregelen waar ik uit principe tegen gekant bent. Het gaat bijvoorbeeld om verschillende opslagmaatregelen, onder andere voor alcohol, en om aanzienlijke Europese steun aan de wijnsector. Het gaat ook om Europese steun voor schoolmelk en schoolfruit, wat dan wel belangrijk kan zijn, maar niet iets is waar de EU over moet beslissen. Tezelfdertijd bevat de groep amendementen belangrijke investeringen in onder andere dierenbescherming en controle op het vervoer van dieren, waar ik mee ingenomen ben. Omdat de stemprocedure mij echter dwingt om een standpunt in te nemen ten aanzien van de groep amendementen in zijn geheel, heb ik ervoor gekozen om me met betrekking tot blok 3 van stemming te onthouden.', 'Amendement 886 heeft een lovenswaardig doel: investeringen in sport. Dat is echter een aangelegenheid die niet op het Europees niveau thuishoort. Daarom heb ik tegengestemd.', 'Amendement 905 is gebaseerd op een houding ten aanzien van migranten die ik uit principe niet kan aanvaarden. Er werd bijvoorbeeld geld uitgetrokken om mensen die in Afrika wonen te vertellen hoe gevaarlijk het is om naar Europa te trekken. We mogen geen muren rond ons continent bouwen. Daarom heb ik tegen dit amendement gestemd.', 'Amendement 909 bevat middelen voor het toezicht op Europese burgers. Dat is iets wat ik niet kan aanvaarden en daarom heb ik tegengestemd. ']"
109, 9. Stemverklaringen,"  Nigel Farage  (EFD),  schriftelijk. – (EN) De leden van de Britse Onafhankelijkheidspartij hebben voor deze amendementen gestemd, in hoofdzaak omdat wij uitdrukkelijk tegen elke verhoging van de begroting zijn en omdat een beperking van het gebruik van deze begrotingsonderdelen, zoals voorgesteld door de ECR-Fractie, kan uitmonden in een vermindering van betalingen uit de begroting. Wij willen echter benadrukken dat het EU-geld, waaraan de Britse belastingbetaler een ruime bijdrage levert, niet mag worden gebruikt om beleid zoals verplichte abortus op te leggen aan minderheden en andere bevolkingsgroepen die zuchten onder ondemocratische regimes. Een dergelijke praktijk is onwettig in het Verenigd Koninkrijk. Het is ook onwettig in andere satellietstaten van de EU, in strijd met de Universele Verklaring van de Rechten van de Mens van de Verenigde Naties, dat mede door het Verenigd Koninkrijk is ondertekend, en in strijd met het Europese Verdrag voor de Rechten van de Mens, dat eveneens mede is ondertekend door het Verenigd Koninkrijk. Of het onderhavige bedrag nu wel of niet in de miljoenen loopt, de betrokken lokale bevolkingen zouden de Britse Onafhankelijkheidspartij terecht met de tirannie van hun eigen regeringen kunnen vereenzelvigen, wanneer de delegatie van de Britse Onafhankelijkheidspartij tegen deze amendementen had gestemd. ","Nigel Farage  (EFD),",1,199,not_available,['eng'],"['  Nigel Farage  (EFD),  schriftelijk. – (EN) De leden van de Britse Onafhankelijkheidspartij hebben voor deze amendementen gestemd, in hoofdzaak omdat wij uitdrukkelijk tegen elke verhoging van de begroting zijn en omdat een beperking van het gebruik van deze begrotingsonderdelen, zoals voorgesteld door de ECR-Fractie, kan uitmonden in een vermindering van betalingen uit de begroting. Wij willen echter benadrukken dat het EU-geld, waaraan de Britse belastingbetaler een ruime bijdrage levert, niet mag worden gebruikt om beleid zoals verplichte abortus op te leggen aan minderheden en andere bevolkingsgroepen die zuchten onder ondemocratische regimes. Een dergelijke praktijk is onwettig in het Verenigd Koninkrijk. Het is ook onwettig in andere satellietstaten van de EU, in strijd met de Universele Verklaring van de Rechten van de Mens van de Verenigde Naties, dat mede door het Verenigd Koninkrijk is ondertekend, en in strijd met het Europese Verdrag voor de Rechten van de Mens, dat eveneens mede is ondertekend door het Verenigd Koninkrijk. Of het onderhavige bedrag nu wel of niet in de miljoenen loopt, de betrokken lokale bevolkingen zouden de Britse Onafhankelijkheidspartij terecht met de tirannie van hun eigen regeringen kunnen vereenzelvigen, wanneer de delegatie van de Britse Onafhankelijkheidspartij tegen deze amendementen had gestemd. ']"
110, 9. Stemverklaringen,"  Patrick Le Hyaric  (GUE/NGL),  schriftelijk. – (FR) Ik heb vóór amendement 812 van blok 3 gestemd om de steun aan melkveehouders, hoe belachelijk deze ook moge zijn (280 miljoen euro), niet tegen te werken. Het is echter onaanvaardbaar dat de aanneming van dit amendement leidt tot de verwerping van amendement 70, dat conform de wens van de Commissie landbouw en plattelandsontwikkeling van het Parlement 600 miljoen euro in plaats van 280 miljoen euro aan steun toekent. Ik kan me niet vinden in deze regel van “wie het eerst komt, wie het laagste biedt”, waarvan boeren de dupe worden. ","Patrick Le Hyaric  (GUE/NGL),",1,98,not_available,['fra'],"['  Patrick Le Hyaric  (GUE/NGL),  schriftelijk. – (FR) Ik heb vóór amendement 812 van blok 3 gestemd om de steun aan melkveehouders, hoe belachelijk deze ook moge zijn (280 miljoen euro), niet tegen te werken. Het is echter onaanvaardbaar dat de aanneming van dit amendement leidt tot de verwerping van amendement 70, dat conform de wens van de Commissie landbouw en plattelandsontwikkeling van het Parlement 600 miljoen euro in plaats van 280 miljoen euro aan steun toekent. Ik kan me niet vinden in deze regel van “wie het eerst komt, wie het laagste biedt”, waarvan boeren de dupe worden. ']"
111, 9. Stemverklaringen,"  Maria do Céu Patrão Neves  (PPE),  schriftelijk. − (PT) Ik ben van oordeel dat de maatregelen die commissaris Fischer Boel aan het eind van de vergadering van de Landbouwraad in Luxemburg en ten overstaan van de Commissie landbouw en plattelandsontwikkeling in Straatsburg (op 19 oktober) heeft aangekondigd, ontoereikend zijn. Het pakket, dat op 19 november nog door de Raad Ecofin moet worden goedgekeurd, bedraagt 280 miljoen euro en zal aan de lidstaten worden overgemaakt in de vorm van een financiële enveloppe, op basis van de productie en de jaarlijkse quota. Volgens de berekeningen zal Portugal een financiële enveloppe van 6 à 7 miljoen euro ontvangen ter bestrijding van de instorting van de productieprijzen, die meer dan 50 procent bedraagt ten opzichte van de prijzen van 2007-2008. Ik ben van mening dat 0,003 euro per liter in Portugal geproduceerde melk (volgens de berekeningen van de producenten) een onbevredigende oplossing is voor een probleem dat al maanden aansleept, vooral als het ministerie van Landbouw dit geld denkt te gebruiken voor vervroegde pensionering, zoals het al heeft aangekondigd.Ofschoon de Europese Commissie met deze 280 miljoen euro een belangrijk signaal afgeeft, staat het bedrag niet in verhouding tot wat de producenten werkelijk nodig hebben om de crisis te overwinnen. ","Maria do Céu Patrão Neves  (PPE),",2,207,not_available,"['por', 'por']","['  Maria do Céu Patrão Neves  (PPE),  schriftelijk. − (PT) Ik ben van oordeel dat de maatregelen die commissaris Fischer Boel aan het eind van de vergadering van de Landbouwraad in Luxemburg en ten overstaan van de Commissie landbouw en plattelandsontwikkeling in Straatsburg (op 19 oktober) heeft aangekondigd, ontoereikend zijn. Het pakket, dat op 19 november nog door de Raad Ecofin moet worden goedgekeurd, bedraagt 280 miljoen euro en zal aan de lidstaten worden overgemaakt in de vorm van een financiële enveloppe, op basis van de productie en de jaarlijkse quota. Volgens de berekeningen zal Portugal een financiële enveloppe van 6 à 7 miljoen euro ontvangen ter bestrijding van de instorting van de productieprijzen, die meer dan 50 procent bedraagt ten opzichte van de prijzen van 2007-2008. Ik ben van mening dat 0,003 euro per liter in Portugal geproduceerde melk (volgens de berekeningen van de producenten) een onbevredigende oplossing is voor een probleem dat al maanden aansleept, vooral als het ministerie van Landbouw dit geld denkt te gebruiken voor vervroegde pensionering, zoals het al heeft aangekondigd.', 'Ofschoon de Europese Commissie met deze 280 miljoen euro een belangrijk signaal afgeeft, staat het bedrag niet in verhouding tot wat de producenten werkelijk nodig hebben om de crisis te overwinnen. ']"
112, 9. Stemverklaringen,"  Nuno Teixeira  (PPE),  schriftelijk. − (PT) De onderhandelingen over de begroting zijn een van de belangrijkste communautaire procedures waarin het Parlement, de Commissie en de Raad gezamenlijk de beslissingsbevoegdheid uitoefenen. Vandaag, na afloop van de eerste lezing, heeft het Parlement zijn rol als begrotingsautoriteit versterkt door een verhoging van zowel de vastleggingskredieten als de betalingskredieten door te zetten ten opzichte van het voorstel van de Raad, al liggen de bedragen nog altijd lager dan we zouden willen. De Fractie van de Europese Volkspartij (Christendemocraten) stelt vast dat rekening is gehouden met cruciale kwesties die zij al lange tijd bepleit met het oog op het herstel van de economische economieën in de context van de huidige crisis. Zo wordt extra aandacht besteed aan het cohesiebeleid, dat de groei en het concurrentievermogen moet bevorderen, met name van het MKB (kleine en middelgrote ondernemingen), de belangrijkste motor voor het scheppen van werkgelegenheid.Als lid van de Portugese Sociaaldemocratische Partij in het Europees Parlement heb ik alle reden om blij te zijn met de goedkeuring, bij ruime meerderheid, van een amendement van onze delegatie waarin wordt gepleit voor een Erasmus-programma dat de toegang van jongeren tot een eerste baan vergemakkelijkt. Het gaat hier om een van de voorstellen die we hebben gelanceerd tijdens de jongste Europese verkiezingen. Ook de steun voor melkproducenten en het bieden van meer zekerheid aan onze burgers, onder meer op het gebied van de energievoorziening, zijn gewaarborgd. Hiermee is de procedure echter niet ten einde. De drie instellingen moeten nu een gemeenschappelijk standpunt vaststellen waarover in december in tweede lezing zal worden gestemd. ","Nuno Teixeira  (PPE),",2,263,not_available,"['por', 'por']","['  Nuno Teixeira  (PPE),  schriftelijk. − (PT) De onderhandelingen over de begroting zijn een van de belangrijkste communautaire procedures waarin het Parlement, de Commissie en de Raad gezamenlijk de beslissingsbevoegdheid uitoefenen. Vandaag, na afloop van de eerste lezing, heeft het Parlement zijn rol als begrotingsautoriteit versterkt door een verhoging van zowel de vastleggingskredieten als de betalingskredieten door te zetten ten opzichte van het voorstel van de Raad, al liggen de bedragen nog altijd lager dan we zouden willen. De Fractie van de Europese Volkspartij (Christendemocraten) stelt vast dat rekening is gehouden met cruciale kwesties die zij al lange tijd bepleit met het oog op het herstel van de economische economieën in de context van de huidige crisis. Zo wordt extra aandacht besteed aan het cohesiebeleid, dat de groei en het concurrentievermogen moet bevorderen, met name van het MKB (kleine en middelgrote ondernemingen), de belangrijkste motor voor het scheppen van werkgelegenheid.', 'Als lid van de Portugese Sociaaldemocratische Partij in het Europees Parlement heb ik alle reden om blij te zijn met de goedkeuring, bij ruime meerderheid, van een amendement van onze delegatie waarin wordt gepleit voor een Erasmus-programma dat de toegang van jongeren tot een eerste baan vergemakkelijkt. Het gaat hier om een van de voorstellen die we hebben gelanceerd tijdens de jongste Europese verkiezingen. Ook de steun voor melkproducenten en het bieden van meer zekerheid aan onze burgers, onder meer op het gebied van de energievoorziening, zijn gewaarborgd. Hiermee is de procedure echter niet ten einde. De drie instellingen moeten nu een gemeenschappelijk standpunt vaststellen waarover in december in tweede lezing zal worden gestemd. ']"
113, 9. Stemverklaringen,"  Regina Bastos  (PPE),  schriftelijk. − (PT) Gelet op de huidige economische, financiële en sociale crisis is het essentieel dat bij het ontwerpen van de begroting van de Europese Unie voor 2010 aan deze situatie extra aandacht wordt besteed en dat deze zich profileert als een doeltreffend instrument om de crisis te overwinnen. Daarom heb ik voor de ontwerpbegroting van de Europese Unie voor 2010 gestemd, in de overtuiging dat over het geheel genomen aan deze doelstellingen is voldaan.Het Europees Parlement is vastbesloten al het mogelijke te doen om garanties te bieden voor een adequate financiering van alle activiteiten en beleidsacties die de groei en de werkgelegenheid bevorderen en de Europese burgers oplossingen aanreiken. Concreet betekent dat meer energiezekerheid, toename van de steun voor onderzoek en ontwikkeling, met name op het gebied van schone technologieën, bevordering van de kleine en middelgrote ondernemingen (het MKB) en meer steun voor levenslang leren. In dit verband wil ik nogmaals het belang onderstrepen van de oprichting van een Erasmus-programma ter bevordering van de werkgelegenheid dat bestemd is voor jongeren die op zoek zijn naar een eerste baan, zoals is voorgesteld door de leden van de Portugese Sociaaldemocratische Partij in het Europees Parlement. Dit initiatief zal ongetwijfeld bijdragen aan de verwezenlijking van de voornoemde doelstellingen.Tot slot moet ik benadrukken dat ik niet akkoord ga met de extra bezuinigingen van de Raad op de begrotingsrubrieken die de strategie van Lissabon ondersteunen, aangezien die besnoeiingen haaks staan op wat gedaan moet worden om de groei en het economisch herstel te stimuleren. ","Regina Bastos  (PPE),",3,255,not_available,"['por', 'por', 'por']","['  Regina Bastos  (PPE),  schriftelijk. − (PT) Gelet op de huidige economische, financiële en sociale crisis is het essentieel dat bij het ontwerpen van de begroting van de Europese Unie voor 2010 aan deze situatie extra aandacht wordt besteed en dat deze zich profileert als een doeltreffend instrument om de crisis te overwinnen. Daarom heb ik voor de ontwerpbegroting van de Europese Unie voor 2010 gestemd, in de overtuiging dat over het geheel genomen aan deze doelstellingen is voldaan.', 'Het Europees Parlement is vastbesloten al het mogelijke te doen om garanties te bieden voor een adequate financiering van alle activiteiten en beleidsacties die de groei en de werkgelegenheid bevorderen en de Europese burgers oplossingen aanreiken. Concreet betekent dat meer energiezekerheid, toename van de steun voor onderzoek en ontwikkeling, met name op het gebied van schone technologieën, bevordering van de kleine en middelgrote ondernemingen (het MKB) en meer steun voor levenslang leren. In dit verband wil ik nogmaals het belang onderstrepen van de oprichting van een Erasmus-programma ter bevordering van de werkgelegenheid dat bestemd is voor jongeren die op zoek zijn naar een eerste baan, zoals is voorgesteld door de leden van de Portugese Sociaaldemocratische Partij in het Europees Parlement. Dit initiatief zal ongetwijfeld bijdragen aan de verwezenlijking van de voornoemde doelstellingen.', 'Tot slot moet ik benadrukken dat ik niet akkoord ga met de extra bezuinigingen van de Raad op de begrotingsrubrieken die de strategie van Lissabon ondersteunen, aangezien die besnoeiingen haaks staan op wat gedaan moet worden om de groei en het economisch herstel te stimuleren. ']"
114, 9. Stemverklaringen,"  Sophie Briard Auconie  (PPE),  schriftelijk. – (FR) Ofschoon het cohesiebeleid een cruciale rol speelt in de strijd tegen de economische crisis en de klimaatverandering, had de Raad voorgesteld om de daaraan toegekende betalingskredieten in 2010 drastisch te verlagen. Daar we ons bewust zijn van het belang van Europese fondsen en van de verwachtingen die er in de praktijk bestaan, was het essentieel dat wij als leden van het Parlement de vooraf door de Europese Commissie geopperde bedragen herstelden, en in sommige gevallen zelfs verhoogden.Deze stemming geeft uiting aan het politieke Europa dat we nodig hebben, het Europa dat in staat is begrotingsbesluiten te nemen die solidariteit, concurrentievermogen en groei een goede toekomst bieden, ten gunste van zijn burgers. Vandaag hebben de Europese afgevaardigden opnieuw hun steun kenbaar gemaakt voor een Europees cohesiebeleid dat echt de middelen heeft om zijn ambities te verwezenlijken. Aangezien ik me tevens kan vinden in de algemene koers die wordt uitgestippeld door de verslagen van de heer Surján en de heer Maňka over de ontwerpbegroting van de Europese Unie voor het boekjaar 2010, heb ik vastberaden vóór de aanneming ervan gestemd. ","Sophie Briard Auconie  (PPE),",2,185,not_available,"['fra', 'fra']","['  Sophie Briard Auconie  (PPE),  schriftelijk. – (FR) Ofschoon het cohesiebeleid een cruciale rol speelt in de strijd tegen de economische crisis en de klimaatverandering, had de Raad voorgesteld om de daaraan toegekende betalingskredieten in 2010 drastisch te verlagen. Daar we ons bewust zijn van het belang van Europese fondsen en van de verwachtingen die er in de praktijk bestaan, was het essentieel dat wij als leden van het Parlement de vooraf door de Europese Commissie geopperde bedragen herstelden, en in sommige gevallen zelfs verhoogden.', 'Deze stemming geeft uiting aan het politieke Europa dat we nodig hebben, het Europa dat in staat is begrotingsbesluiten te nemen die solidariteit, concurrentievermogen en groei een goede toekomst bieden, ten gunste van zijn burgers. Vandaag hebben de Europese afgevaardigden opnieuw hun steun kenbaar gemaakt voor een Europees cohesiebeleid dat echt de middelen heeft om zijn ambities te verwezenlijken. Aangezien ik me tevens kan vinden in de algemene koers die wordt uitgestippeld door de verslagen van de heer Surján en de heer Maňka over de ontwerpbegroting van de Europese Unie voor het boekjaar 2010, heb ik vastberaden vóór de aanneming ervan gestemd. ']"
