,agenda_item,text,speaker,number_p,number_w,chair,language_ps,ps
42, 6. Tijdelijke procedurele richtsnoeren inzake begrotingskwesties met het oog op de inwerkingtreding van het Verdrag van Lissabon (debat) ,"  Göran Färm,  namens de S&D-Fractie. - (SV) Mijnheer de Voorzitter, het Verdrag van Lissabon brengt grote veranderingen met zich mee, niet in het minst op het gebied van de begroting. Zoals velen al hebben gezegd, is de belangrijkste verandering de verdwijning van het onderscheid tussen verplichte en niet-verplichte uitgaven. Het Europees Parlement wordt daarmee medebeslisser over de hele begroting en wij krijgen een nieuwe, vereenvoudigde begrotingsprocedure. Het Verdrag is nu klaar en goedgekeurd, maar dat betekent niet dat wij meteen op de nieuwe procedure kunnen overstappen.Ten eerste zijn wij het volledig met elkaar eens dat wij de begrotingsprocedure van dit jaar volgens de oude regels moeten uitvoeren, omdat het tot chaos zou leiden als wij hier tijdens de behandeling van de begroting wijzigingen in zouden aanbrengen. Ten tweede hebben wij een nieuw interinstitutioneel akkoord nodig, voordat wij het nieuwe Verdrag volledig kunnen toepassen. Wij hebben een herzien Financieel Reglement nodig en een nieuwe, heronderhandelde langetermijnbegroting, het meerjarig financieel kader, als onderdeel van deze nieuwe regelgeving.Dit zal tijd in beslag nemen. Om in 2010 met het begrotingswerk te kunnen beginnen, hebben wij daarom een aantal overgangsbepalingen nodig. Ik wil van de gelegenheid gebruik maken om mijn dank uit te spreken aan de voorzitter van de Begrotingscommissie, de heer Lamassoure, die zeer snel het initiatief voor dit verslag nam en het in recordtijd opstelde, maar daarbij toch zeer nauw met de verscheidene fracties in de commissie heeft samengewerkt. Dank u wel.Wij hebben in het verslag ook een aantal standpunten over de aard van de nieuwe permanente oplossingen opgenomen. Vooral wij sociaaldemocraten hebben enkele standpunten naar voren gebracht. De belangrijkste hiervan zijn dat de nieuwe bevoegdheden van het Parlement al tijdens de overgangsperiode moeten gelden, dat de voorstellen die moeten worden ingediend leiden tot een nieuw interinstitutioneel akkoord in de toekomst en dat een herzien Financieel Reglement als één pakket moet worden beschouwd, zodat wij een functionerend geheel krijgen zonder overlappingen en interpretatieproblemen.Ik hoop dat wij het in de trialoog van vandaag ook eens kunnen worden over de eerste elementen hiervan. Tot slot wil ik zeggen dat de verandering die dit inhoudt voor de begrotingsprocedure een goed voorbeeld is van vereenvoudigde en minder bureaucratische procedures waar de hele Europese Unie grote behoefte aan heeft. ","Göran Färm,",5,377,not_available,"['swe', 'swe', 'swe', 'swe', 'swe']","['  Göran Färm,  namens de S&D-Fractie. - (SV) Mijnheer de Voorzitter, het Verdrag van Lissabon brengt grote veranderingen met zich mee, niet in het minst op het gebied van de begroting. Zoals velen al hebben gezegd, is de belangrijkste verandering de verdwijning van het onderscheid tussen verplichte en niet-verplichte uitgaven. Het Europees Parlement wordt daarmee medebeslisser over de hele begroting en wij krijgen een nieuwe, vereenvoudigde begrotingsprocedure. Het Verdrag is nu klaar en goedgekeurd, maar dat betekent niet dat wij meteen op de nieuwe procedure kunnen overstappen.', 'Ten eerste zijn wij het volledig met elkaar eens dat wij de begrotingsprocedure van dit jaar volgens de oude regels moeten uitvoeren, omdat het tot chaos zou leiden als wij hier tijdens de behandeling van de begroting wijzigingen in zouden aanbrengen. Ten tweede hebben wij een nieuw interinstitutioneel akkoord nodig, voordat wij het nieuwe Verdrag volledig kunnen toepassen. Wij hebben een herzien Financieel Reglement nodig en een nieuwe, heronderhandelde langetermijnbegroting, het meerjarig financieel kader, als onderdeel van deze nieuwe regelgeving.', 'Dit zal tijd in beslag nemen. Om in 2010 met het begrotingswerk te kunnen beginnen, hebben wij daarom een aantal overgangsbepalingen nodig. Ik wil van de gelegenheid gebruik maken om mijn dank uit te spreken aan de voorzitter van de Begrotingscommissie, de heer Lamassoure, die zeer snel het initiatief voor dit verslag nam en het in recordtijd opstelde, maar daarbij toch zeer nauw met de verscheidene fracties in de commissie heeft samengewerkt. Dank u wel.', 'Wij hebben in het verslag ook een aantal standpunten over de aard van de nieuwe permanente oplossingen opgenomen. Vooral wij sociaaldemocraten hebben enkele standpunten naar voren gebracht. De belangrijkste hiervan zijn dat de nieuwe bevoegdheden van het Parlement al tijdens de overgangsperiode moeten gelden, dat de voorstellen die moeten worden ingediend leiden tot een nieuw interinstitutioneel akkoord in de toekomst en dat een herzien Financieel Reglement als één pakket moet worden beschouwd, zodat wij een functionerend geheel krijgen zonder overlappingen en interpretatieproblemen.', 'Ik hoop dat wij het in de trialoog van vandaag ook eens kunnen worden over de eerste elementen hiervan. Tot slot wil ik zeggen dat de verandering die dit inhoudt voor de begrotingsprocedure een goed voorbeeld is van vereenvoudigde en minder bureaucratische procedures waar de hele Europese Unie grote behoefte aan heeft. ']"
43, 6. Tijdelijke procedurele richtsnoeren inzake begrotingskwesties met het oog op de inwerkingtreding van het Verdrag van Lissabon (debat) ,"  Anne E. Jensen,  namens de ALDE-Fractie. – (DA) Mijnheer de Voorzitter, ook ik wil beginnen met te zeggen dat het me verheugt dat het Verdrag van Lissabon nu in werking is getreden, waardoor het Parlement meer macht heeft gekregen ten aanzien van de begroting en de manier is gewijzigd waarop we de jaarbegroting van de EU goedkeuren. We bevinden ons in een overgangsfase, waarin de begroting voor 2010 wordt behandeld overeenkomstig het oude verdrag en waarin de controle op en follow-up van de uitvoering van de begroting overeenkomstig het nieuwe verdrag zal plaatsvinden. Hoe we dit ook in de praktijk gaan oplossen, met het verslag van de heer Lamassoure hebben we er in ieder geval een begin mee gemaakt, en ik ben de heer Lamassoure er dankbaar voor dat hij zo snel het initiatief heeft genomen. De Fractie Alliantie van Liberalen en Democraten voor Europa geeft haar volmondige steun aan het verslag, dat aangeeft hoe we moeten omgaan met gewijzigde begrotingen en overschrijvingen en de andere kwesties die reeds zijn genoemd.De Fractie Europa van vrijheid en democratie heeft een aantal amendementen ingediend waarin wordt voorgesteld om gewijzigde begrotingen en overschrijvingen af te schaffen. Ik kan u zeggen dat de Fractie Alliantie van Liberalen en Democraten voor Europa tegen alle voorstellen van de Fractie Europa van vrijheid en democratie zal stemmen. Wij zijn het met de heer Lamassoure eens dat het aantal gewijzigde begrotingen moet worden teruggebracht. Niettemin gebeuren er in de loop van een jaar nu eenmaal onverwachte dingen en daarom hebben we behoefte aan een dergelijk instrument. Nationale parlementen kunnen daar immers ook over beschikken. Het is mogelijk om in de loop van het jaar wijzigingen door te voeren. Alleen al het toenemende aantal verzoeken om geld uit het Europees fonds voor aanpassing aan de globalisering zal in verband met het grote aantal ontslagen natuurlijk leiden tot een aantal gewijzigde begrotingen. Evenmin moeten we de mogelijkheid van overschrijvingen tussen rekeningen afschaffen. Er zijn zeer strikte regels die bepalen op welke manier en hoeveel de Commissie kan overschrijven; de Commissie kan dit niet naar eigen goeddunken doen en moet het Parlement en de Raad er eerst om vragen.Het verslag wijst er ook op dat het Financieel Reglement en het Interinstitutioneel Akkoord nu gewijzigd moeten worden en ik hoop dat we in dit verband spoedig een voorstel van de Commissie zullen ontvangen. ","Anne E. Jensen,",3,394,not_available,"['dan', 'dan', 'dan']","['  Anne E. Jensen,  namens de ALDE-Fractie. – (DA) Mijnheer de Voorzitter, ook ik wil beginnen met te zeggen dat het me verheugt dat het Verdrag van Lissabon nu in werking is getreden, waardoor het Parlement meer macht heeft gekregen ten aanzien van de begroting en de manier is gewijzigd waarop we de jaarbegroting van de EU goedkeuren. We bevinden ons in een overgangsfase, waarin de begroting voor 2010 wordt behandeld overeenkomstig het oude verdrag en waarin de controle op en follow-up van de uitvoering van de begroting overeenkomstig het nieuwe verdrag zal plaatsvinden. Hoe we dit ook in de praktijk gaan oplossen, met het verslag van de heer Lamassoure hebben we er in ieder geval een begin mee gemaakt, en ik ben de heer Lamassoure er dankbaar voor dat hij zo snel het initiatief heeft genomen. De Fractie Alliantie van Liberalen en Democraten voor Europa geeft haar volmondige steun aan het verslag, dat aangeeft hoe we moeten omgaan met gewijzigde begrotingen en overschrijvingen en de andere kwesties die reeds zijn genoemd.', 'De Fractie Europa van vrijheid en democratie heeft een aantal amendementen ingediend waarin wordt voorgesteld om gewijzigde begrotingen en overschrijvingen af te schaffen. Ik kan u zeggen dat de Fractie Alliantie van Liberalen en Democraten voor Europa tegen alle voorstellen van de Fractie Europa van vrijheid en democratie zal stemmen. Wij zijn het met de heer Lamassoure eens dat het aantal gewijzigde begrotingen moet worden teruggebracht. Niettemin gebeuren er in de loop van een jaar nu eenmaal onverwachte dingen en daarom hebben we behoefte aan een dergelijk instrument. Nationale parlementen kunnen daar immers ook over beschikken. Het is mogelijk om in de loop van het jaar wijzigingen door te voeren. Alleen al het toenemende aantal verzoeken om geld uit het Europees fonds voor aanpassing aan de globalisering zal in verband met het grote aantal ontslagen natuurlijk leiden tot een aantal gewijzigde begrotingen. Evenmin moeten we de mogelijkheid van overschrijvingen tussen rekeningen afschaffen. Er zijn zeer strikte regels die bepalen op welke manier en hoeveel de Commissie kan overschrijven; de Commissie kan dit niet naar eigen goeddunken doen en moet het Parlement en de Raad er eerst om vragen.', 'Het verslag wijst er ook op dat het Financieel Reglement en het Interinstitutioneel Akkoord nu gewijzigd moeten worden en ik hoop dat we in dit verband spoedig een voorstel van de Commissie zullen ontvangen. ']"
44, 6. Tijdelijke procedurele richtsnoeren inzake begrotingskwesties met het oog op de inwerkingtreding van het Verdrag van Lissabon (debat) ,"  Helga Trüpel,  namens de Verts/ALE-Fractie. – (DE) Mijnheer de Voorzitter, mijnheer de commissaris, namens de Fractie De Groenen spreek ik mij uitdrukkelijk uit voor het mandaat voor de voorzitter van de Begrotingscommissie, Alain Lamassoure. Wij zijn ervan overtuigd dat hij de onderhandelingen in de overgangsperiode waarin we ons bevinden, op een zeer zelfbewuste en vastberaden manier zal voeren. We weten dat we tijdens de overgang van de toepassing van het Verdrag van Nice naar die van het Verdrag van Lissabon – waar wij allen naar uitzien en dat we nodig hebben om Europa democratischer en transparanter te maken – duidelijke regels moeten hebben.De Begrotingscommissie is naast de Raad een van de beide verantwoordelijken bij de opstelling van de Europese begroting, en we maken de Raad er duidelijk op attent dat wij de rechten van het Parlement zullen handhaven en versterken. We zullen niet toelaten – ook niet met de heer Lamassoure aan het roer bij de onderhandelingen – dat daaraan op de een of andere manier afbreuk wordt gedaan, omdat wij ervan overtuigd zijn dat er geen machtsverschuiving ten gunste van de Raad mag plaatsvinden.Ik wil u eraan herinneren dat het wat betreft de begrotingen voor de komende jaren absoluut noodzakelijk is dat de Europese begroting door de lidstaten in samenwerking met het Parlement in een echte Europese geest wordt opgesteld. Alleen dan kunnen we ervoor zorgen dat Europa klaar is voor de toekomst. Wat de financiële regelgeving betreft wil ik er ook aan herinneren dat het geld onder de Europese staten en in die staten natuurlijk op een manier moet worden verdeeld die misbruik uitsluit. Er mogen zich geen schandalen en er mag zich geen fraude voordoen, maar de financiële regelgeving moet eenvoudiger en transparanter worden, zodat we met onze Europese programma’s bij het publiek geen ergernis oproepen, maar de mensen werkelijk bereiken. In deze zin moeten we in de komende jaren gestalte geven aan ons Europese begrotingsbeleid. ","Helga Trüpel,",3,319,not_available,"['ger', 'ger', 'ger']","['  Helga Trüpel,  namens de Verts/ALE-Fractie. – (DE) Mijnheer de Voorzitter, mijnheer de commissaris, namens de Fractie De Groenen spreek ik mij uitdrukkelijk uit voor het mandaat voor de voorzitter van de Begrotingscommissie, Alain Lamassoure. Wij zijn ervan overtuigd dat hij de onderhandelingen in de overgangsperiode waarin we ons bevinden, op een zeer zelfbewuste en vastberaden manier zal voeren. We weten dat we tijdens de overgang van de toepassing van het Verdrag van Nice naar die van het Verdrag van Lissabon – waar wij allen naar uitzien en dat we nodig hebben om Europa democratischer en transparanter te maken – duidelijke regels moeten hebben.', 'De Begrotingscommissie is naast de Raad een van de beide verantwoordelijken bij de opstelling van de Europese begroting, en we maken de Raad er duidelijk op attent dat wij de rechten van het Parlement zullen handhaven en versterken. We zullen niet toelaten – ook niet met de heer Lamassoure aan het roer bij de onderhandelingen – dat daaraan op de een of andere manier afbreuk wordt gedaan, omdat wij ervan overtuigd zijn dat er geen machtsverschuiving ten gunste van de Raad mag plaatsvinden.', 'Ik wil u eraan herinneren dat het wat betreft de begrotingen voor de komende jaren absoluut noodzakelijk is dat de Europese begroting door de lidstaten in samenwerking met het Parlement in een echte Europese geest wordt opgesteld. Alleen dan kunnen we ervoor zorgen dat Europa klaar is voor de toekomst. Wat de financiële regelgeving betreft wil ik er ook aan herinneren dat het geld onder de Europese staten en in die staten natuurlijk op een manier moet worden verdeeld die misbruik uitsluit. Er mogen zich geen schandalen en er mag zich geen fraude voordoen, maar de financiële regelgeving moet eenvoudiger en transparanter worden, zodat we met onze Europese programma’s bij het publiek geen ergernis oproepen, maar de mensen werkelijk bereiken. In deze zin moeten we in de komende jaren gestalte geven aan ons Europese begrotingsbeleid. ']"
45, 6. Tijdelijke procedurele richtsnoeren inzake begrotingskwesties met het oog op de inwerkingtreding van het Verdrag van Lissabon (debat) ,"  Marta Andreasen,  namens de EFD-Fractie. – (EN) Mijnheer de Voorzitter, in vervolg op het verslag van het achtenswaardige lid mevrouw Guy-Quint van april 2008 zou het nieuwe wettelijke kader voor begrotingszaken nu gereed moeten zijn om te worden aangenomen. Alle instellingen waren het hierover eens, teneinde een juridisch vacuüm te voorkomen. Tijdelijke richtsnoeren voor begrotingszaken zouden daarom overbodig moeten zijn.Het verslag van het achtenswaardige lid de heer Lamassoure richt zich op het goedkeuren van wijzigingen van begrotingen en overschrijvingen. Beide zijn riskante en ongeschikte praktijken die blijk geven van een gebrek aan professionalisme op het gebied van begrotings- en planningsprocessen en voorbestemd zijn om nog riskanter te worden in overgangsperioden.Het huidige aantal gewijzigde begrotingen is buitensporig en voldoet zelfs niet aan de voorwaarden in artikel 37 van het Financieel Reglement.Het huidige aantal overdrachten is eveneens excessief. Dit zou niet het geval zijn als de begroting met een beter begrip van de noden van de verschillende sectoren in de verschillende landen werd gepland.Als lid van de Begrotingscommissie wekt het mijn afschuw dat bijna de gehele commissie, op mijzelf na, instemt met al deze verzoeken om overschrijvingen.Daarom zouden er geen gewijzigde begrotingen mogen worden aangenomen tijdens de overgangsperiode en zouden alle inspanningen erop moeten zijn gericht om verdere schade aan de belangen van belastingbetalers te voorkomen. ","Marta Andreasen,",6,220,not_available,"['eng', 'eng', 'eng', 'eng', 'eng', 'eng']","['  Marta Andreasen,  namens de EFD-Fractie. – (EN) Mijnheer de Voorzitter, in vervolg op het verslag van het achtenswaardige lid mevrouw Guy-Quint van april 2008 zou het nieuwe wettelijke kader voor begrotingszaken nu gereed moeten zijn om te worden aangenomen. Alle instellingen waren het hierover eens, teneinde een juridisch vacuüm te voorkomen. Tijdelijke richtsnoeren voor begrotingszaken zouden daarom overbodig moeten zijn.', 'Het verslag van het achtenswaardige lid de heer Lamassoure richt zich op het goedkeuren van wijzigingen van begrotingen en overschrijvingen. Beide zijn riskante en ongeschikte praktijken die blijk geven van een gebrek aan professionalisme op het gebied van begrotings- en planningsprocessen en voorbestemd zijn om nog riskanter te worden in overgangsperioden.', 'Het huidige aantal gewijzigde begrotingen is buitensporig en voldoet zelfs niet aan de voorwaarden in artikel 37 van het Financieel Reglement.', 'Het huidige aantal overdrachten is eveneens excessief. Dit zou niet het geval zijn als de begroting met een beter begrip van de noden van de verschillende sectoren in de verschillende landen werd gepland.', 'Als lid van de Begrotingscommissie wekt het mijn afschuw dat bijna de gehele commissie, op mijzelf na, instemt met al deze verzoeken om overschrijvingen.', 'Daarom zouden er geen gewijzigde begrotingen mogen worden aangenomen tijdens de overgangsperiode en zouden alle inspanningen erop moeten zijn gericht om verdere schade aan de belangen van belastingbetalers te voorkomen. ']"
46, 6. Tijdelijke procedurele richtsnoeren inzake begrotingskwesties met het oog op de inwerkingtreding van het Verdrag van Lissabon (debat) ,"  Daniël van der Stoep  (NI). -   Voorzitter, de Partij voor de Vrijheid zit nu voor het eerst in het Europees Parlement en is geschokt over de geldbeluste houding van de leden van het Parlement. In die zin lijkt het Parlement wel een anti-parlement. Het doel lijkt om zoveel mogelijk geld uit de zakken van de hardwerkende Europese, maar vooral ook de hardwerkende Nederlandse burger te kloppen.Miljarden worden aan linkse hobby's als klimaat en ontwikkelingshulp besteed, terwijl in Nederland de mensen niet worden behandeld in verzorgingstehuizen, de AOW naar 67 jaar wordt verhoogd en de politie moet bezuinigen. Voorzitter, dit Parlement zou er moeten zijn voor de burger, maar is er alleen maar om de eigen politiek correcte, verkwistende plannetjes en die van hun elitaire vriendjes te bewerkstelligen.Voorzitter, helaas hebben de Ieren hun goedkeuring gegeven aan het verfoeide Verdrag van Lissabon, maar zij hebben tenminste de keus gehad. De Partij voor de Vrijheid vindt het dieptreurig dat het verschrikkelijke verdrag door de strot van de Nederlandse burger is geduwd. Maar helaas, het is er en ook wij zullen er jammer genoeg mee moeten leren leven.Voorzitter, de Partij voor de Vrijheid werkt constructief mee in dit Huis. We kunnen alleen niet akkoord gaan met het onderhavige verslag. Nederland is de grootste nettobetaler per burger en we willen daar snel verandering in zien. Mijn vraag is aan de rapporteur om aan het verslag een uitspraak toe te voegen waarin het Europees Parlement de Raad oproept om zo spoedig mogelijk een einde te maken aan de voortdurende positie van Nederland als grootste nettobetaler per burger.Voorzitter, als dat in het verslag wordt vermeld, gaan er vandaag bij de stemming vier extra lampjes op groen in deze zaal. Dat lijkt me dus een buitenkansje voor de rapporteur. Verder wil ik nog vermelden dat wij alle amendementen van de EFD zullen steunen. ",Daniël van der Stoep  (NI). -,5,310,not_available,"['dut', 'dut', 'dut', 'dut', 'dut']","['  Daniël van der Stoep  (NI). -   Voorzitter, de Partij voor de Vrijheid zit nu voor het eerst in het Europees Parlement en is geschokt over de geldbeluste houding van de leden van het Parlement. In die zin lijkt het Parlement wel een anti-parlement. Het doel lijkt om zoveel mogelijk geld uit de zakken van de hardwerkende Europese, maar vooral ook de hardwerkende Nederlandse burger te kloppen.', ""Miljarden worden aan linkse hobby's als klimaat en ontwikkelingshulp besteed, terwijl in Nederland de mensen niet worden behandeld in verzorgingstehuizen, de AOW naar 67 jaar wordt verhoogd en de politie moet bezuinigen. Voorzitter, dit Parlement zou er moeten zijn voor de burger, maar is er alleen maar om de eigen politiek correcte, verkwistende plannetjes en die van hun elitaire vriendjes te bewerkstelligen."", 'Voorzitter, helaas hebben de Ieren hun goedkeuring gegeven aan het verfoeide Verdrag van Lissabon, maar zij hebben tenminste de keus gehad. De Partij voor de Vrijheid vindt het dieptreurig dat het verschrikkelijke verdrag door de strot van de Nederlandse burger is geduwd. Maar helaas, het is er en ook wij zullen er jammer genoeg mee moeten leren leven.', 'Voorzitter, de Partij voor de Vrijheid werkt constructief mee in dit Huis. We kunnen alleen niet akkoord gaan met het onderhavige verslag. Nederland is de grootste nettobetaler per burger en we willen daar snel verandering in zien. Mijn vraag is aan de rapporteur om aan het verslag een uitspraak toe te voegen waarin het Europees Parlement de Raad oproept om zo spoedig mogelijk een einde te maken aan de voortdurende positie van Nederland als grootste nettobetaler per burger.', 'Voorzitter, als dat in het verslag wordt vermeld, gaan er vandaag bij de stemming vier extra lampjes op groen in deze zaal. Dat lijkt me dus een buitenkansje voor de rapporteur. Verder wil ik nog vermelden dat wij alle amendementen van de EFD zullen steunen. ']"
47, 6. Tijdelijke procedurele richtsnoeren inzake begrotingskwesties met het oog op de inwerkingtreding van het Verdrag van Lissabon (debat) ,"  László Surján  (PPE).   – (HU) Dames en heren, na de Eerste Wereldoorlog werden er in Hongarije tijdelijke barakken gebouwd in Boedapest om de ziekenhuisbehandeling van terugkerende krijgsgevangenen te garanderen. Deze tijdelijke barakken functioneren nu nog.We willen tijdelijke procedurele richtsnoeren opstellen om het begrotingsproces zeker te stellen. Ik ben van mening dat de heer Lamassoure, rapporteur en voorzitter van de commissie, zich heeft beroepen op beginselen die hij gerealiseerd wil zien, die ten minste even duurzaam zijn als de zojuist genoemde tijdelijke barakken die al negentig jaar in functie zijn. Het is van groot belang dat we een hoge prijs hebben betaald voor het Verdrag van Lissabon. We hebben principes opgegeven en de bevolking van een heel land, Tsjechië, zal in mindere mate kunnen profiteren van de mensenrechten dan de meerderheid van de Europeanen. Het is onze fundamentele plicht om dit duur betaalde verdrag zo soepel, vlot en effectief mogelijk van kracht te laten worden. Het lijkt me dat de voorstellen voor de uitvoering waarvan de rapporteur nu een volmacht vraagt, dit doel meer dan dienen. Daarom zou mijn fractie graag zien dat een aanzienlijke meerderheid van het Parlement deze voorstellen zonder wijzigingen zou steunen.Ten slotte, over tijdelijke zaken gesproken, verscheen er een paar decennia geleden een advertentie dat de woningen van de Sovjetofficieren die tijdelijk in ons land waren gestationeerd, klaar waren. Dat betekent dat hoe duurzaam iets ons ook toeschijnt, dat na een tijd toch verouderd zal zijn. Ik hoop dat tegen de tijd dat deze regels niet meer van kracht zijn, er nog betere voor in de plaats komen. Met deze hoop in het achterhoofd wil ik iedereen vragen dit voorstel te steunen. ",László Surján  (PPE).,3,276,not_available,"['hun', 'hun', 'hun']","['  László Surján  (PPE).   – (HU) Dames en heren, na de Eerste Wereldoorlog werden er in Hongarije tijdelijke barakken gebouwd in Boedapest om de ziekenhuisbehandeling van terugkerende krijgsgevangenen te garanderen. Deze tijdelijke barakken functioneren nu nog.', 'We willen tijdelijke procedurele richtsnoeren opstellen om het begrotingsproces zeker te stellen. Ik ben van mening dat de heer Lamassoure, rapporteur en voorzitter van de commissie, zich heeft beroepen op beginselen die hij gerealiseerd wil zien, die ten minste even duurzaam zijn als de zojuist genoemde tijdelijke barakken die al negentig jaar in functie zijn. Het is van groot belang dat we een hoge prijs hebben betaald voor het Verdrag van Lissabon. We hebben principes opgegeven en de bevolking van een heel land, Tsjechië, zal in mindere mate kunnen profiteren van de mensenrechten dan de meerderheid van de Europeanen. Het is onze fundamentele plicht om dit duur betaalde verdrag zo soepel, vlot en effectief mogelijk van kracht te laten worden. Het lijkt me dat de voorstellen voor de uitvoering waarvan de rapporteur nu een volmacht vraagt, dit doel meer dan dienen. Daarom zou mijn fractie graag zien dat een aanzienlijke meerderheid van het Parlement deze voorstellen zonder wijzigingen zou steunen.', 'Ten slotte, over tijdelijke zaken gesproken, verscheen er een paar decennia geleden een advertentie dat de woningen van de Sovjetofficieren die tijdelijk in ons land waren gestationeerd, klaar waren. Dat betekent dat hoe duurzaam iets ons ook toeschijnt, dat na een tijd toch verouderd zal zijn. Ik hoop dat tegen de tijd dat deze regels niet meer van kracht zijn, er nog betere voor in de plaats komen. Met deze hoop in het achterhoofd wil ik iedereen vragen dit voorstel te steunen. ']"
