,agenda_item,text,speaker,number_p,number_w,chair,language_ps,ps
0, 1. Opening van de vergadering,VOORZITTER: LIBOR ROUČEK Ondervoorzitter,VOORZITTER: LIBOR ROUČEK,1,4,not_available,['dut'],['VOORZITTER: LIBOR ROUČEK Ondervoorzitter']
1, 5. Jaarverslag 2008 over de werkzaamheden van de Europese ombudsman (debat) ,"  De Voorzitter.   – Aan de orde is het verslag (A7-0020/2009) van Chrysoula Paliadeli, namens de Commissie verzoekschriften, over het jaarverslag 2008 over de werkzaamheden van de Europese ombudsman (2009/2088(INI)). ",De Voorzitter.,1,32,not_available,['dut'],"['  De Voorzitter.   – Aan de orde is het verslag (A7-0020/2009) van Chrysoula Paliadeli, namens de Commissie verzoekschriften, over het jaarverslag 2008 over de werkzaamheden van de Europese ombudsman (2009/2088(INI)). ']"
2, 5. Jaarverslag 2008 over de werkzaamheden van de Europese ombudsman (debat) ,"  Chrysoula Paliadeli,  rapporteur. – (EL) Mijnheer de Voorzitter, mijnheer de commissaris, geachte collega’s, op 21 april 2009 heeft de Europese ombudsman, de heer Nikoforos Diamandouros, de Voorzitter van het Europees Parlement, de heer Hans-Gert Pöttering, het jaarverslag over zijn werkzaamheden in het jaar 2008 voorgelegd. Op 14 september 2008 heeft hij zijn verslag gepresenteerd in de Commissie verzoekschriften, die mij reeds had belast met de opstelling van een verslag hierover. Mijn verslag is toen op 1 oktober 2009 unaniem goedgekeurd in de Commissie verzoekschriften.Het verslag bestaat uit twee documenten: een beknopt overzicht van zes bladzijden en een uitgebreide versie waarin gedetailleerd wordt ingegaan op de werkzaamheden van de ombudsman en statistieken worden gepresenteerd en toegelicht. Het doel hiervan was de procedure te verbeteren en een ‘goede praktijk’ tot stand te brengen.In beide documenten worden de statistieken en bevindingen op een lezersvriendelijke manier gepresenteerd en aan de hand van voorbeelden toegelicht, waardoor de tekst niet alleen begrijpelijker wordt maar ook beter beoordeeld en gebruikt kan worden.Dankzij deze nieuwe presentatie van de statistieken en de nieuwe beoordeling van de bevindingen is het verslag niet alleen begrijpelijker maar vooral ook nuttiger geworden. Hierin worden niet enkel meer klachten op een rijtje gezet, maar ook beleidsproblemen aangepakt en verbeteringen voorgesteld.In 2008 werd een recordaantal onderzoeken afgesloten. De behandelde gevallen betroffen voor het merendeel de Europese Commissie en in veel mindere mate de administratie van het Europees Parlement. De meest voorkomende vorm van wanbestuur was een gebrek aan doorzichtigheid. In een derde van de gevallen werd een voor de betrokkenen gunstig resultaat bereikt via een minnelijke schikking. In een kleiner aantal zaken moest de ombudsman kritische opmerkingen maken aan het adres van de betrokken administratieve instanties en in een nog kleiner aantal zaken werd gevraagd om een uitgebreid antwoord. In één geval heeft het Parlement een speciaal verslag opgesteld en een speciale resolutie aangenomen ter ondersteuning van de gelaedeerde partij. In 2008 heeft de ombudsman een initiatiefonderzoek verricht naar late betaling door de Commissie en ervoor gezorgd dat maatregelen werden genomen om het verschijnsel in te dammen. Tevens heeft hij aangekondigd het vraagstuk opnieuw te zullen onderzoeken. De fundamentele prioriteit van de ombudsman was te waarborgen dat de rechten van de burger werden geëerbiedigd en aldus het vertrouwen van de Europese burgers in de Europese instellingen werd versterkt.Met dat doel voor ogen heeft de ombudsman besloten om de voorlichting van de burgers over hun rechten via het Europees netwerk van ombudsmannen te verbeteren. Afgezien van de werkzaamheden die de ombudsman uit hoofde van zijn institutionele functie moet verrichten om zaken op te kunnen lossen, heeft hij gezorgd voor een verbetering van de contacten met de leden en ambtenaren van de Europese instellingen. Aldus heeft hij een cultuur van dienstbaarheid binnen de administratieve diensten van de Unie kunnen bevorderen en onbetwistbaar bijgedragen aan de verwezenlijking van het algemene doel, te weten wederzijds respect tussen de Europese burgers en de Europese instellingen. Een tastbaar resultaat van deze campagne was dat in 2008 het aantal ingediende verzoekschriften steeg. Deze stijging toont immers aan dat een groter aantal Europese burgers op de hoogte is van het bestaan van de Europese ombudsman en besloten heeft deze instelling te gebruiken om vraagstukken aan de kaak te stellen met betrekking tot goed bestuur en de werking van - onder andere - de administratieve diensten van de Europese Unie.De website van de ombudsman werd gedurende 2008 regelmatig bijgewerkt teneinde hiervan een moderne, dynamische en interactieve dienstverlening te kunnen maken. Nu de eerste fase van dit verslag en dit debat over het jaarverslag van de Europese ombudsman wordt afgesloten, verwachten wij dat de opbouwende samenwerking met het Europees Parlement onveranderd wordt voortgezet, dat de manier van werken van de ombudsman onder de nationale overheden als een voorbeeld van behoorlijk bestuur wordt gepromoot en dat de Europese ombudsman een communicatiekanaal blijft tussen de Europese instellingen en de Europese burgers. ","Chrysoula Paliadeli,",7,649,not_available,"['gre', 'gre', 'gre', 'gre', 'gre', 'gre', 'gre']","['  Chrysoula Paliadeli,  rapporteur. – (EL) Mijnheer de Voorzitter, mijnheer de commissaris, geachte collega’s, op 21 april 2009 heeft de Europese ombudsman, de heer Nikoforos Diamandouros, de Voorzitter van het Europees Parlement, de heer Hans-Gert Pöttering, het jaarverslag over zijn werkzaamheden in het jaar 2008 voorgelegd. Op 14 september 2008 heeft hij zijn verslag gepresenteerd in de Commissie verzoekschriften, die mij reeds had belast met de opstelling van een verslag hierover. Mijn verslag is toen op 1 oktober 2009 unaniem goedgekeurd in de Commissie verzoekschriften.', 'Het verslag bestaat uit twee documenten: een beknopt overzicht van zes bladzijden en een uitgebreide versie waarin gedetailleerd wordt ingegaan op de werkzaamheden van de ombudsman en statistieken worden gepresenteerd en toegelicht. Het doel hiervan was de procedure te verbeteren en een ‘goede praktijk’ tot stand te brengen.', 'In beide documenten worden de statistieken en bevindingen op een lezersvriendelijke manier gepresenteerd en aan de hand van voorbeelden toegelicht, waardoor de tekst niet alleen begrijpelijker wordt maar ook beter beoordeeld en gebruikt kan worden.', 'Dankzij deze nieuwe presentatie van de statistieken en de nieuwe beoordeling van de bevindingen is het verslag niet alleen begrijpelijker maar vooral ook nuttiger geworden. Hierin worden niet enkel meer klachten op een rijtje gezet, maar ook beleidsproblemen aangepakt en verbeteringen voorgesteld.', 'In 2008 werd een recordaantal onderzoeken afgesloten. De behandelde gevallen betroffen voor het merendeel de Europese Commissie en in veel mindere mate de administratie van het Europees Parlement. De meest voorkomende vorm van wanbestuur was een gebrek aan doorzichtigheid. In een derde van de gevallen werd een voor de betrokkenen gunstig resultaat bereikt via een minnelijke schikking. In een kleiner aantal zaken moest de ombudsman kritische opmerkingen maken aan het adres van de betrokken administratieve instanties en in een nog kleiner aantal zaken werd gevraagd om een uitgebreid antwoord. In één geval heeft het Parlement een speciaal verslag opgesteld en een speciale resolutie aangenomen ter ondersteuning van de gelaedeerde partij. In 2008 heeft de ombudsman een initiatiefonderzoek verricht naar late betaling door de Commissie en ervoor gezorgd dat maatregelen werden genomen om het verschijnsel in te dammen. Tevens heeft hij aangekondigd het vraagstuk opnieuw te zullen onderzoeken. De fundamentele prioriteit van de ombudsman was te waarborgen dat de rechten van de burger werden geëerbiedigd en aldus het vertrouwen van de Europese burgers in de Europese instellingen werd versterkt.', 'Met dat doel voor ogen heeft de ombudsman besloten om de voorlichting van de burgers over hun rechten via het Europees netwerk van ombudsmannen te verbeteren. Afgezien van de werkzaamheden die de ombudsman uit hoofde van zijn institutionele functie moet verrichten om zaken op te kunnen lossen, heeft hij gezorgd voor een verbetering van de contacten met de leden en ambtenaren van de Europese instellingen. Aldus heeft hij een cultuur van dienstbaarheid binnen de administratieve diensten van de Unie kunnen bevorderen en onbetwistbaar bijgedragen aan de verwezenlijking van het algemene doel, te weten wederzijds respect tussen de Europese burgers en de Europese instellingen. Een tastbaar resultaat van deze campagne was dat in 2008 het aantal ingediende verzoekschriften steeg. Deze stijging toont immers aan dat een groter aantal Europese burgers op de hoogte is van het bestaan van de Europese ombudsman en besloten heeft deze instelling te gebruiken om vraagstukken aan de kaak te stellen met betrekking tot goed bestuur en de werking van - onder andere - de administratieve diensten van de Europese Unie.', 'De website van de ombudsman werd gedurende 2008 regelmatig bijgewerkt teneinde hiervan een moderne, dynamische en interactieve dienstverlening te kunnen maken. Nu de eerste fase van dit verslag en dit debat over het jaarverslag van de Europese ombudsman wordt afgesloten, verwachten wij dat de opbouwende samenwerking met het Europees Parlement onveranderd wordt voortgezet, dat de manier van werken van de ombudsman onder de nationale overheden als een voorbeeld van behoorlijk bestuur wordt gepromoot en dat de Europese ombudsman een communicatiekanaal blijft tussen de Europese instellingen en de Europese burgers. ']"
