,agenda_item,text,speaker,number_p,number_w,chair,language_ps,ps
164, 12.1. Guinee,"  Véronique De Keyser,  auteur. – (FR) Mijnheer de Voorzitter, ik denk dat de mensenmenigte die hedenmiddag naar deze vergaderzaal is gesneld geenszins recht doet aan de belangstelling voor deze kwestie, hetgeen ik namens mijn fractie en namens de andere eens te meer betreur.Mijnheer de Voorzitter, Guinee-Conakry heeft de steun van de internationale gemeenschap nodig. Bij de dood van president Conté heeft een militaire junta de macht overgenomen. Ondanks de kritiek van de internationale gemeenschap kreeg deze de steun van het volk, omdat de junta een snelle overgang naar een burgerbewind met vrije verkiezingen in het vooruitzicht stelde. Kapitein Dadis Camara, die de junta aanvoert, had plechtig beloofd zich niet kandidaat te stellen voor de presidentsverkiezingen, maar na het land op rampzalige wijze te hebben bestuurd – geen begroting, geen aanbesteding van overheidsopdrachten, geen basisvoorzieningen voor de bevolking –, heeft hij de smaak van de macht nu te pakken en zich er zozeer aan vastgeklampt dat hij zich nu verkiesbaar stelt. Bij zijn verkiezingscampagne bedient hij zich van alle organisatorische, mediale en economische middelen waarover het land beschikt. Uit protest tegen het feit dat de junta eerdere toezeggingen niet nakomt heeft de oppositie een manifestatie georganiseerd die door de presidentiële garde op wrede wijze is onderdrukt. Daarbij zijn 150 mensen om het leven gekomen, meer dan duizend mensen gewond geraakt en talloze vrouwen verkracht en verminkt.De reactie van het Europees Parlement, en naar ik hoop van de Europese Unie, zal duidelijk zijn. Wij roepen op tot de opschorting van het visserijakkoord van de Europese Unie. Wij roepen de Afrikaanse Unie op sancties op te leggen aan de militaire junta en binnen een verzoeningscommissie een dialoog op gang te brengen. Wij roepen op tot de aanstelling van een overgangsregering om de presidents- en parlementsverkiezingen voor te bereiden, nu de junta definitief in de ban is gedaan door de internationale gemeenschap.Ik hoop dat deze reacties, die passend zijn met het oog op de tragedie die zich heeft voltrokken, een precedent zullen scheppen en dat de Europese Unie in andere gevallen van flagrante mensenrechtenschendingen de moed zal hebben net zo voortvarend op te treden. ","Véronique De Keyser,",4,351,not_available,"['fra', 'fra', 'fra', 'fra']","['  Véronique De Keyser,  auteur. – (FR) Mijnheer de Voorzitter, ik denk dat de mensenmenigte die hedenmiddag naar deze vergaderzaal is gesneld geenszins recht doet aan de belangstelling voor deze kwestie, hetgeen ik namens mijn fractie en namens de andere eens te meer betreur.', 'Mijnheer de Voorzitter, Guinee-Conakry heeft de steun van de internationale gemeenschap nodig. Bij de dood van president Conté heeft een militaire junta de macht overgenomen. Ondanks de kritiek van de internationale gemeenschap kreeg deze de steun van het volk, omdat de junta een snelle overgang naar een burgerbewind met vrije verkiezingen in het vooruitzicht stelde. Kapitein Dadis Camara, die de junta aanvoert, had plechtig beloofd zich niet kandidaat te stellen voor de presidentsverkiezingen, maar na het land op rampzalige wijze te hebben bestuurd – geen begroting, geen aanbesteding van overheidsopdrachten, geen basisvoorzieningen voor de bevolking –, heeft hij de smaak van de macht nu te pakken en zich er zozeer aan vastgeklampt dat hij zich nu verkiesbaar stelt. Bij zijn verkiezingscampagne bedient hij zich van alle organisatorische, mediale en economische middelen waarover het land beschikt. Uit protest tegen het feit dat de junta eerdere toezeggingen niet nakomt heeft de oppositie een manifestatie georganiseerd die door de presidentiële garde op wrede wijze is onderdrukt. Daarbij zijn 150 mensen om het leven gekomen, meer dan duizend mensen gewond geraakt en talloze vrouwen verkracht en verminkt.', 'De reactie van het Europees Parlement, en naar ik hoop van de Europese Unie, zal duidelijk zijn. Wij roepen op tot de opschorting van het visserijakkoord van de Europese Unie. Wij roepen de Afrikaanse Unie op sancties op te leggen aan de militaire junta en binnen een verzoeningscommissie een dialoog op gang te brengen. Wij roepen op tot de aanstelling van een overgangsregering om de presidents- en parlementsverkiezingen voor te bereiden, nu de junta definitief in de ban is gedaan door de internationale gemeenschap.', 'Ik hoop dat deze reacties, die passend zijn met het oog op de tragedie die zich heeft voltrokken, een precedent zullen scheppen en dat de Europese Unie in andere gevallen van flagrante mensenrechtenschendingen de moed zal hebben net zo voortvarend op te treden. ']"
165, 12.1. Guinee,"  Renate Weber,  auteur. – (EN) Mijnheer de Voorzitter, wanneer u de situatie in Guinee in ogenschouw neemt en kennis neemt van de gruwelijkheden die daar de laatste maanden hebben plaatsgevonden, is de eerste legitieme vraag: waarom hebben de media er zo weinig aandacht aan besteed? Hier en daar verscheen er een berichtje, alsof er geen honderden mensen zijn vermoord, alsof er zich geen verschrikkelijke martelingen en afschuwelijke verkrachtingen, gericht op de vernietiging van de menselijke waardigheid, hebben voltrokken.Het is waar dat verscheidene internationale instellingen de militaire junta die na een staatgreep de macht heeft gegrepen, hebben veroordeeld, maar ik meen dat er veel meer had moeten worden gedaan om gewone burgers, Europese burgers inbegrepen, hiervan bewust te maken. Daarom verheugt het me dat het Europees Parlement, namens de burgers die ons hier hebben neergezet, ten minste blijk geeft van een juiste reactie, die passend wordt behandeld met de resolutie waarover wij vandaag zullen stemmen.Ik vind het echter van het allergrootste belang dat het niet blijft bij het bekritiseren en veroordelen van het huidige regime. Ook moet elke kans op misbruik van Europees hulpgeld aan de bevolking van Guinee worden uitgesloten. ","Renate Weber,",3,191,not_available,"['eng', 'eng', 'eng']","['  Renate Weber,  auteur. – (EN) Mijnheer de Voorzitter, wanneer u de situatie in Guinee in ogenschouw neemt en kennis neemt van de gruwelijkheden die daar de laatste maanden hebben plaatsgevonden, is de eerste legitieme vraag: waarom hebben de media er zo weinig aandacht aan besteed? Hier en daar verscheen er een berichtje, alsof er geen honderden mensen zijn vermoord, alsof er zich geen verschrikkelijke martelingen en afschuwelijke verkrachtingen, gericht op de vernietiging van de menselijke waardigheid, hebben voltrokken.', 'Het is waar dat verscheidene internationale instellingen de militaire junta die na een staatgreep de macht heeft gegrepen, hebben veroordeeld, maar ik meen dat er veel meer had moeten worden gedaan om gewone burgers, Europese burgers inbegrepen, hiervan bewust te maken. Daarom verheugt het me dat het Europees Parlement, namens de burgers die ons hier hebben neergezet, ten minste blijk geeft van een juiste reactie, die passend wordt behandeld met de resolutie waarover wij vandaag zullen stemmen.', 'Ik vind het echter van het allergrootste belang dat het niet blijft bij het bekritiseren en veroordelen van het huidige regime. Ook moet elke kans op misbruik van Europees hulpgeld aan de bevolking van Guinee worden uitgesloten. ']"
166, 12.1. Guinee,"  Cristian Dan Preda,  auteur. – (RO) 28 september is een belangrijke datum voor de bevolking van Guinee, omdat het referendum over onafhankelijkheid op die dag heeft plaatsgevonden. Van nu af aan zal diezelfde 28ste september echter voortleven als de dag waarop de met wapengeweld geïnstalleerde regering in Conakry een bloedbad heeft laten aanrichten onder haar tegenstanders.Deze militaire junta in het zadel houden is geen optie. Kapitein Dadis Camara, die de macht heeft gegrepen, heeft de hele tijd volgehouden dat hij niet aan de verkiezingen zal deelnemen en zich niet kandidaat zal stellen. De deadline om zijn woord gestand te doen is nu verstreken, en dat zal spoedig ook het geval zijn met het ultimatum dat de Afrikaanse Unie hem heeft gesteld.Het is duidelijk dat de militairen die aan de macht zijn liegen: we kunnen ze niet op hun woord vertrouwen. Daarom moet er een democratische regering komen, samengesteld op basis van verkiezingsuitslagen. De internationale gemeenschap moet druk uitoefenen om dat te bewerkstelligen. ","Cristian Dan Preda,",3,163,not_available,"['rum', 'rum', 'rum']","['  Cristian Dan Preda,  auteur. – (RO) 28 september is een belangrijke datum voor de bevolking van Guinee, omdat het referendum over onafhankelijkheid op die dag heeft plaatsgevonden. Van nu af aan zal diezelfde 28ste september echter voortleven als de dag waarop de met wapengeweld geïnstalleerde regering in Conakry een bloedbad heeft laten aanrichten onder haar tegenstanders.', 'Deze militaire junta in het zadel houden is geen optie. Kapitein Dadis Camara, die de macht heeft gegrepen, heeft de hele tijd volgehouden dat hij niet aan de verkiezingen zal deelnemen en zich niet kandidaat zal stellen. De deadline om zijn woord gestand te doen is nu verstreken, en dat zal spoedig ook het geval zijn met het ultimatum dat de Afrikaanse Unie hem heeft gesteld.', 'Het is duidelijk dat de militairen die aan de macht zijn liegen: we kunnen ze niet op hun woord vertrouwen. Daarom moet er een democratische regering komen, samengesteld op basis van verkiezingsuitslagen. De internationale gemeenschap moet druk uitoefenen om dat te bewerkstelligen. ']"
167, 12.1. Guinee,"  Marie-Christine Vergiat  , auteur. – (FR) Mijnheer de Voorzitter, geachte collega’s, ik heb twee weken geleden reeds het woord gevoerd bij het debat tijdens de minizitting in Brussel. Ik zal dan ook niet terugkomen op mijn toespraak daar.Mijn collega’s hebben al een aantal zaken aan de orde gesteld. Op mijn beurt wilde ik aangeven hoeveel deugd het me doet dat alle politieke fracties binnen het Parlement gezamenlijk gehoor geven aan de oproep van de civiele samenleving in Guinee door de onderdrukking door de in december jongstleden aan de macht gekomen militaire junta te veroordelen, een onderdrukking van de vreedzame betoging die was georganiseerd om de onafhankelijkheid van Guinee te herdenken.Deze civiele samenleving in Guinee vraagt ons om hulp, en het zou inderdaad volstrekt onaanvaardbaar zijn dat de Europese Unie in het kader van het visserijakkoord bedragen zou toekennen waarvan we maar al te goed weten dat ze regelrecht in de zakken van de regerende militaire junta verdwijnen en niet worden gebruikt om de Guinese vissers te helpen, zoals de teksten beogen.Het regime in Guinee is het meest corrupte regime ter wereld. Dat zijn niet mijn woorden, maar die van de instanties die belast zijn met het toezicht hierop.Ik hoop dan ook van harte dat wij samen de gemeenschappelijke resolutie in haar geheel kunnen aannemen, met inbegrip van de paragraaf die oproept tot de opschorting van het visserijakkoord, en ik hoop dat de Raad en de Commissie ons op dit punt zullen steunen. ",Marie-Christine Vergiat,5,247,not_available,"['fra', 'fra', 'fra', 'fra', 'fra']","['  Marie-Christine Vergiat  , auteur. – (FR) Mijnheer de Voorzitter, geachte collega’s, ik heb twee weken geleden reeds het woord gevoerd bij het debat tijdens de minizitting in Brussel. Ik zal dan ook niet terugkomen op mijn toespraak daar.', 'Mijn collega’s hebben al een aantal zaken aan de orde gesteld. Op mijn beurt wilde ik aangeven hoeveel deugd het me doet dat alle politieke fracties binnen het Parlement gezamenlijk gehoor geven aan de oproep van de civiele samenleving in Guinee door de onderdrukking door de in december jongstleden aan de macht gekomen militaire junta te veroordelen, een onderdrukking van de vreedzame betoging die was georganiseerd om de onafhankelijkheid van Guinee te herdenken.', 'Deze civiele samenleving in Guinee vraagt ons om hulp, en het zou inderdaad volstrekt onaanvaardbaar zijn dat de Europese Unie in het kader van het visserijakkoord bedragen zou toekennen waarvan we maar al te goed weten dat ze regelrecht in de zakken van de regerende militaire junta verdwijnen en niet worden gebruikt om de Guinese vissers te helpen, zoals de teksten beogen.', 'Het regime in Guinee is het meest corrupte regime ter wereld. Dat zijn niet mijn woorden, maar die van de instanties die belast zijn met het toezicht hierop.', 'Ik hoop dan ook van harte dat wij samen de gemeenschappelijke resolutie in haar geheel kunnen aannemen, met inbegrip van de paragraaf die oproept tot de opschorting van het visserijakkoord, en ik hoop dat de Raad en de Commissie ons op dit punt zullen steunen. ']"
168, 12.1. Guinee,"  Adam Bielan,  auteur. − (PL) Mijnheer de Voorzitter, toen kapitein Camara eind vorig jaar aan het hoofd kwam te staan van de militaire junta die na de dood van president Conté in Guinee de macht heeft gegrepen, was de internationale gemeenschap zo naïef te geloven dat kapitein Camara vrije en democratische presidentsverkiezingen zou organiseren waaraan hij zelf niet zou deelnemen. Nu weten we dat kapitein Camara troepen heeft ingezet, toen op 28 september laatstleden meer dan 50 000 aanhangers van de oppositie in het nationale stadion zijn samengekomen om te protesteren tegen de koerswijziging van kapitein Camara en tegen het feit dat hij zijn beloften niet is nagekomen. Bij deze confrontatie zijn meer dan 150 mensen omgekomen en raakten meer dan 1 200 personen gewond. Er is tevens melding gemaakt van talrijke verkrachtingen.Ik ben verheugd dat Javier Solana, de hoge vertegenwoordiger van de Unie voor buitenlandse zaken en veiligheidsbeleid, zo snel heeft gereageerd. Ik zou de Franse regering willen bedanken omdat ze de militaire samenwerking met Guinee heeft opgeschort. Er zijn sinds dit bloedbad echter al drie weken verstreken en deze acties hebben nog geen tastbare resultaten opgeleverd. Daarom vind ik dat het optreden van de Europese Unie in de eerste plaats gericht zou moeten zijn op het uitoefenen van druk op Guinee, samen met de Verenigde Naties en de Afrikaanse Unie, en het opleggen van zo streng mogelijke sancties. Alleen dan kan er sprake zijn van een mogelijke machtsoverdracht door kapitein Camara. ","Adam Bielan,",2,243,not_available,"['pol', 'pol']","['  Adam Bielan,  auteur. − (PL) Mijnheer de Voorzitter, toen kapitein Camara eind vorig jaar aan het hoofd kwam te staan van de militaire junta die na de dood van president Conté in Guinee de macht heeft gegrepen, was de internationale gemeenschap zo naïef te geloven dat kapitein Camara vrije en democratische presidentsverkiezingen zou organiseren waaraan hij zelf niet zou deelnemen. Nu weten we dat kapitein Camara troepen heeft ingezet, toen op 28 september laatstleden meer dan 50 000 aanhangers van de oppositie in het nationale stadion zijn samengekomen om te protesteren tegen de koerswijziging van kapitein Camara en tegen het feit dat hij zijn beloften niet is nagekomen. Bij deze confrontatie zijn meer dan 150 mensen omgekomen en raakten meer dan 1 200 personen gewond. Er is tevens melding gemaakt van talrijke verkrachtingen.', 'Ik ben verheugd dat Javier Solana, de hoge vertegenwoordiger van de Unie voor buitenlandse zaken en veiligheidsbeleid, zo snel heeft gereageerd. Ik zou de Franse regering willen bedanken omdat ze de militaire samenwerking met Guinee heeft opgeschort. Er zijn sinds dit bloedbad echter al drie weken verstreken en deze acties hebben nog geen tastbare resultaten opgeleverd. Daarom vind ik dat het optreden van de Europese Unie in de eerste plaats gericht zou moeten zijn op het uitoefenen van druk op Guinee, samen met de Verenigde Naties en de Afrikaanse Unie, en het opleggen van zo streng mogelijke sancties. Alleen dan kan er sprake zijn van een mogelijke machtsoverdracht door kapitein Camara. ']"
169, 12.1. Guinee,"  Isabella Lövin,  auteur. − (SV) Mijnheer de Voorzitter, ik ben ingenomen met het besluit dat de commissaris voor visserij, de heer Borg, eergisteren bekendmaakte, namelijk dat de Commissie haar voorstel voor een visserijovereenkomst met Guinee intrekt. De Commissie visserij heeft al tegen zo een overeenkomst gestemd. Dat deden we twee dagen na het bloedbad in Conakry waarbij meer dan 150 personen werden doodgeschoten door regeringstroepen die onder bevel staan van kapitein Camara.Ik hoop dat dit de eerste stap is naar een herziening van het handelsbeleid met de ontwikkelingslanden door de Europese Unie. Als één van de belangrijkste en grootste spelers op het gebied van handel en ontwikkeling ter wereld hebben we een enorme verantwoordelijkheid. Er moet samenhang zijn tussen onze handel en onze betrekkingen die we met dat soort regimes hebben. In de loop der jaren hebben we geprobeerd om de visserijovereenkomst te verbeteren door te zeggen dat een deel van het geld uit de overeenkomst naar steun voor de lokale visserij moet gaan. Uit de evaluaties door de Commissie zelf is echter gebleken dat het geld in de realiteit niet wordt gebruikt voor de in de overeenkomst vastgelegde doelen, maar dat het rechtstreeks wordt gebruikt om dit soort regimes te steunen. De Europese Unie moet ophouden met het verstrekken van die steun. ","Isabella Lövin,",2,213,not_available,"['swe', 'swe']","['  Isabella Lövin,  auteur. − (SV) Mijnheer de Voorzitter, ik ben ingenomen met het besluit dat de commissaris voor visserij, de heer Borg, eergisteren bekendmaakte, namelijk dat de Commissie haar voorstel voor een visserijovereenkomst met Guinee intrekt. De Commissie visserij heeft al tegen zo een overeenkomst gestemd. Dat deden we twee dagen na het bloedbad in Conakry waarbij meer dan 150 personen werden doodgeschoten door regeringstroepen die onder bevel staan van kapitein Camara.', 'Ik hoop dat dit de eerste stap is naar een herziening van het handelsbeleid met de ontwikkelingslanden door de Europese Unie. Als één van de belangrijkste en grootste spelers op het gebied van handel en ontwikkeling ter wereld hebben we een enorme verantwoordelijkheid. Er moet samenhang zijn tussen onze handel en onze betrekkingen die we met dat soort regimes hebben. In de loop der jaren hebben we geprobeerd om de visserijovereenkomst te verbeteren door te zeggen dat een deel van het geld uit de overeenkomst naar steun voor de lokale visserij moet gaan. Uit de evaluaties door de Commissie zelf is echter gebleken dat het geld in de realiteit niet wordt gebruikt voor de in de overeenkomst vastgelegde doelen, maar dat het rechtstreeks wordt gebruikt om dit soort regimes te steunen. De Europese Unie moet ophouden met het verstrekken van die steun. ']"
170, 12.1. Guinee,"  Filip Kaczmarek,  namens de PPE-Fractie. – (PL) Mijnheer de Voorzitter, we hebben twee weken geleden al over Guinee gesproken. Desalniettemin verdient de situatie in het land onze voortdurende aandacht en een passende reactie. De Commissie ontwikkelingssamenwerking heeft afgelopen maandag aandachtig geluisterd naar het ooggetuigenverslag van de heer Diallo, de voormalige premier en leider van de oppositiepartij UFDG, over de gebeurtenissen die zich op 28 september hebben voorgedaan.Naar mijn mening volstaat het niet dat we de junta oproepen de vrijheid van meningsuiting, de vrijheid van vergadering of de mensenrechten in het algemeen te eerbiedigen. Als de junta deze beginselen, deze waarden zou respecteren, zou er immers geen sprake zijn van een junta. We kunnen er dus niet van uitgaan dat de junta gehoor zal geven aan onze oproepen. Een man van daden – en dat is kapitein Dadis Camara zonder twijfel – kan alleen worden gestopt met daden en niet met woorden. Daarom roep ik de Europese Commissie op om meteen de daad bij het woord te voegen. ","Filip Kaczmarek,",2,166,not_available,"['pol', 'pol']","['  Filip Kaczmarek,  namens de PPE-Fractie. – (PL) Mijnheer de Voorzitter, we hebben twee weken geleden al over Guinee gesproken. Desalniettemin verdient de situatie in het land onze voortdurende aandacht en een passende reactie. De Commissie ontwikkelingssamenwerking heeft afgelopen maandag aandachtig geluisterd naar het ooggetuigenverslag van de heer Diallo, de voormalige premier en leider van de oppositiepartij UFDG, over de gebeurtenissen die zich op 28 september hebben voorgedaan.', 'Naar mijn mening volstaat het niet dat we de junta oproepen de vrijheid van meningsuiting, de vrijheid van vergadering of de mensenrechten in het algemeen te eerbiedigen. Als de junta deze beginselen, deze waarden zou respecteren, zou er immers geen sprake zijn van een junta. We kunnen er dus niet van uitgaan dat de junta gehoor zal geven aan onze oproepen. Een man van daden – en dat is kapitein Dadis Camara zonder twijfel – kan alleen worden gestopt met daden en niet met woorden. Daarom roep ik de Europese Commissie op om meteen de daad bij het woord te voegen. ']"
171, 12.1. Guinee,"  Patrice Tirolien  , namens de S&D-Fractie. – (FR) Mijnheer de Voorzitter, geachte collega’s, Guinee wordt momenteel geteisterd door tragische gebeurtenissen die de internationale opinie hebben geschokt en waarbij het recht met voeten wordt getreden.Op 28 september 2009 heeft de militaire junta onder leiding van Dadis Camara namelijk een vreedzame manifestatie van alle oppositiepartijen op bloedige wijze neergeslagen.De Overeenkomst van Cotonou stelt dat de betrekkingen van de Europese Unie en zijn ACS-partners gebaseerd moeten zijn op het eerbiedigen van de mensenrechten en democratische beginselen. Het eenzijdige besluit van kapitein Dadis Camara om de verkiezingen uit te stellen en te weigeren de kwestie van zijn kandidatuur voor het presidentschap van Guinee aan de orde te stellen, vormen een ernstig verzuim om binnen een jaar de beloofde vrije en transparante verkiezingen te houden.De Europese Unie moet dan ook onmiddellijk ingrijpen, overeenkomstig de beginselen en de permanente waarden die ten grondslag liggen aan haar optreden, om een einde te maken aan dit geweld, dat zich vertaalt in talloze mensenrechtenschendingen.Voorzitter, dames en heren, ik ben blij dat de compromisresolutie volledig overeenstemt met onze waarden en onze beginselen, maar ik wilde hier bijzondere nadruk leggen op artikel 10 van deze tekst, namelijk de opschorting van het in een protocol vastgelegd visserijakkoord tussen de Europese Unie en Guinee zolang het democratische proces niet is begonnen.Ik hoor sommigen zich afvragen of een dergelijk besluit geen sociaaleconomische consequenties zou hebben voor de bevolking. Maar tegenover de gewelddadigheden van 28 september jongstleden moeten wij erkennen dat het bewind in Guinee zich nauwelijks iets aantrekt van de leefomstandigheden van zijn burgers en ons geen andere keus laat dan standvastigheid.Sinds zijn onafhankelijkheid in 1958 heeft Guinee alleen maar dictatoriale regimes gekend. ",Patrice Tirolien,7,287,not_available,"['fra', 'fra', 'fra', 'fra', 'fra', 'fra', 'fra']","['  Patrice Tirolien  , namens de S&D-Fractie. – (FR) Mijnheer de Voorzitter, geachte collega’s, Guinee wordt momenteel geteisterd door tragische gebeurtenissen die de internationale opinie hebben geschokt en waarbij het recht met voeten wordt getreden.', 'Op 28 september 2009 heeft de militaire junta onder leiding van Dadis Camara namelijk een vreedzame manifestatie van alle oppositiepartijen op bloedige wijze neergeslagen.', 'De Overeenkomst van Cotonou stelt dat de betrekkingen van de Europese Unie en zijn ACS-partners gebaseerd moeten zijn op het eerbiedigen van de mensenrechten en democratische beginselen. Het eenzijdige besluit van kapitein Dadis Camara om de verkiezingen uit te stellen en te weigeren de kwestie van zijn kandidatuur voor het presidentschap van Guinee aan de orde te stellen, vormen een ernstig verzuim om binnen een jaar de beloofde vrije en transparante verkiezingen te houden.', 'De Europese Unie moet dan ook onmiddellijk ingrijpen, overeenkomstig de beginselen en de permanente waarden die ten grondslag liggen aan haar optreden, om een einde te maken aan dit geweld, dat zich vertaalt in talloze mensenrechtenschendingen.', 'Voorzitter, dames en heren, ik ben blij dat de compromisresolutie volledig overeenstemt met onze waarden en onze beginselen, maar ik wilde hier bijzondere nadruk leggen op artikel 10 van deze tekst, namelijk de opschorting van het in een protocol vastgelegd visserijakkoord tussen de Europese Unie en Guinee zolang het democratische proces niet is begonnen.', 'Ik hoor sommigen zich afvragen of een dergelijk besluit geen sociaaleconomische consequenties zou hebben voor de bevolking. Maar tegenover de gewelddadigheden van 28 september jongstleden moeten wij erkennen dat het bewind in Guinee zich nauwelijks iets aantrekt van de leefomstandigheden van zijn burgers en ons geen andere keus laat dan standvastigheid.', 'Sinds zijn onafhankelijkheid in 1958 heeft Guinee alleen maar dictatoriale regimes gekend. ']"
