,agenda_item,text,speaker,number_p,number_w,chair,language_ps,ps
100, 11. Stemverklaringen (voortzetting) ,"  Andreas Mölzer  (NI),  schriftelijk. − (DE) Ik heb voor de ontwerpresolutie over het ontwerpbesluit van de Commissie inzake de Progress-microfinancieringsfaciliteit gestemd omdat het mijns inziens van essentieel belang is om de wetgevingsprocedure af te ronden alvorens verdere stappen te zetten. Inhoudelijk sta ik natuurlijk achter de instelling van een microfinancieringsfaciliteit. ","Andreas Mölzer  (NI),",1,50,not_available,['ger'],"['  Andreas Mölzer  (NI),  schriftelijk. − (DE) Ik heb voor de ontwerpresolutie over het ontwerpbesluit van de Commissie inzake de Progress-microfinancieringsfaciliteit gestemd omdat het mijns inziens van essentieel belang is om de wetgevingsprocedure af te ronden alvorens verdere stappen te zetten. Inhoudelijk sta ik natuurlijk achter de instelling van een microfinancieringsfaciliteit. ']"
101, 11. Stemverklaringen (voortzetting) ,"  Derek Vaughan  (S&D),  schriftelijk. − (EN) Ik heb besloten deze ontwerpresolutie te steunen, aangezien ik gekant ben tegen de suggestie van de Commissie om het bedrag dat bestemd is voor het communautaire programma voor werkgelegenheid en sociale solidariteit – Progress, met 100 miljoen euro te verlagen en dit geld toe te wijzen aan de Europese microfinancieringsfaciliteit voor werkgelegenheid en sociale integratie. Het Progress-programma loopt nu drie jaar en heeft over het algemeen een positief effect. Ik juich het voorstel om een microfinancieringsfaciliteit in te stellen toe, aangezien ik meen dat het sommigen van de minst bedeelde groepen in Europa zal helpen een nieuwe start te maken, door de beschikbaarheid en toegankelijkheid van microleningen te verhogen en in ruil daarvoor mensen te helpen een eigen bedrijfje op te zetten. Ik vind echter niet dat het Progress-programma in gevaar mag worden gebracht door een nieuwe toewijzing van middelen, ten gunste van de microfinancieringsfaciliteit. Ik wil graag dat beide programma’s volledig ten uitvoer worden gelegd en daarom heb ik voor deze ontwerpresolutie gestemd. ","Derek Vaughan  (S&D),",1,172,not_available,['eng'],"['  Derek Vaughan  (S&D),  schriftelijk. − (EN) Ik heb besloten deze ontwerpresolutie te steunen, aangezien ik gekant ben tegen de suggestie van de Commissie om het bedrag dat bestemd is voor het communautaire programma voor werkgelegenheid en sociale solidariteit – Progress, met 100 miljoen euro te verlagen en dit geld toe te wijzen aan de Europese microfinancieringsfaciliteit voor werkgelegenheid en sociale integratie. Het Progress-programma loopt nu drie jaar en heeft over het algemeen een positief effect. Ik juich het voorstel om een microfinancieringsfaciliteit in te stellen toe, aangezien ik meen dat het sommigen van de minst bedeelde groepen in Europa zal helpen een nieuwe start te maken, door de beschikbaarheid en toegankelijkheid van microleningen te verhogen en in ruil daarvoor mensen te helpen een eigen bedrijfje op te zetten. Ik vind echter niet dat het Progress-programma in gevaar mag worden gebracht door een nieuwe toewijzing van middelen, ten gunste van de microfinancieringsfaciliteit. Ik wil graag dat beide programma’s volledig ten uitvoer worden gelegd en daarom heb ik voor deze ontwerpresolutie gestemd. ']"
102, 11. Stemverklaringen (voortzetting) ,"  Silvia-Adriana Ţicău  (S&D),  schriftelijk. – (RO) Ik heb voor de resolutie van het Europees Parlement gestemd betreffende het Jaarlijkse activiteitenprogramma Progress voor 2010 en overzicht van werkzaamheden per beleidssector. Ik denk dat het belangrijk is voor het Parlement, de Raad en de Commissie om in de eerste plaats tot overeenstemming te komen over het voorstel om Progress, een Europese microfinancieringsfaciliteit voor werkgelegenheid en sociale solidariteit, op te zetten. Daarnaast moet men het eens worden over het voorstel om het communautair programma Progress te wijzigen. Volgens deze voorstellen moet 100 miljoen euro worden overgeheveld ter financiering van Progress, de nieuwe Europese microfinancieringsfaciliteit voor werkgelegenheid en sociale solidariteit, ter invulling van het 'gezamenlijk engagement voor de werkgelegenheid' genoemd in de Commissiemededeling COM(2009)257. Ik denk dat het bedrag van 100 miljoen euro niet voldoende is om de voorgestelde doelen te bereiken. Daarom heb ik ervoor gestemd dat de Commissie de ontwerpbeschikking betreffende het jaarlijkse activiteitenprogramma Progress voor 2010 en overzicht van werkzaamheden per beleidssector intrekt, en dat de toekomstige Commissie een nieuw voorstel indient nadat het Verdrag van Lissabon in werking is getreden en het Europees Parlement, de Raad en de Commissie overeenstemming hebben bereikt over het voorstel dat de Commissie bij het Europees Parlement en de Raad heeft ingediend (COM(2009)0333) en het gewijzigde voorstel (COM(2009)0340). ","Silvia-Adriana Ţicău  (S&D),",1,220,not_available,['rum'],"[""  Silvia-Adriana Ţicău  (S&D),  schriftelijk. – (RO) Ik heb voor de resolutie van het Europees Parlement gestemd betreffende het Jaarlijkse activiteitenprogramma Progress voor 2010 en overzicht van werkzaamheden per beleidssector. Ik denk dat het belangrijk is voor het Parlement, de Raad en de Commissie om in de eerste plaats tot overeenstemming te komen over het voorstel om Progress, een Europese microfinancieringsfaciliteit voor werkgelegenheid en sociale solidariteit, op te zetten. Daarnaast moet men het eens worden over het voorstel om het communautair programma Progress te wijzigen. Volgens deze voorstellen moet 100 miljoen euro worden overgeheveld ter financiering van Progress, de nieuwe Europese microfinancieringsfaciliteit voor werkgelegenheid en sociale solidariteit, ter invulling van het 'gezamenlijk engagement voor de werkgelegenheid' genoemd in de Commissiemededeling COM(2009)257. Ik denk dat het bedrag van 100 miljoen euro niet voldoende is om de voorgestelde doelen te bereiken. Daarom heb ik ervoor gestemd dat de Commissie de ontwerpbeschikking betreffende het jaarlijkse activiteitenprogramma Progress voor 2010 en overzicht van werkzaamheden per beleidssector intrekt, en dat de toekomstige Commissie een nieuw voorstel indient nadat het Verdrag van Lissabon in werking is getreden en het Europees Parlement, de Raad en de Commissie overeenstemming hebben bereikt over het voorstel dat de Commissie bij het Europees Parlement en de Raad heeft ingediend (COM(2009)0333) en het gewijzigde voorstel (COM(2009)0340). ""]"
103, 11. Stemverklaringen (voortzetting) ,"  Maria da Graça Carvalho  (PPE),  schriftelijk. − (PT) Ik ben blij met de inspanningen die de Europese Unie levert om haar betrekkingen met Rusland te intensiveren en op deze manier bij te dragen aan meer stabiliteit, veiligheid en welvaart in Europa. Energie en het zekerstellen van de energievoorziening is een van de belangrijkste en meest cruciale terreinen van samenwerking tussen de EU en Rusland. Het is van fundamenteel belang dat de stabiliteit gecreëerd wordt die nodig is om de energievoorziening aan de lidstaten van de EU en aan haar consumenten zeker te stellen.Ik hoop dat de energiedialoog en de afspraken die tijdens de komende Top EU-Rusland gemaakt worden, zullen bijdragen aan grotere transparantie en levensvatbaarheid van de energiesector op lange termijn en dat deze sector op zijn beurt kan bijdragen aan het tot stand brengen van nieuwe structurele betrekkingen tussen de twee blokken door middel van een verdere samenwerking op het gebied van handel en economie. Minstens zo belangrijk is de samenwerking tussen de EU en Rusland op het gebied van de klimaatverandering, om tijdens de Conferentie van Kopenhagen tot een breed akkoord te kunnen komen. Ik wil nogmaals het strategisch belang onderstrepen van de betrekkingen tussen de EU en Rusland en de bijdrage die deze samenwerking kan leveren aan het opbouwen van wederzijds begrip en vertrouwen, zaken die van essentieel belang zijn voor de vrede en stabiliteit op het hele Europese continent. ","Maria da Graça Carvalho  (PPE),",2,234,not_available,"['por', 'por']","['  Maria da Graça Carvalho  (PPE),  schriftelijk. − (PT) Ik ben blij met de inspanningen die de Europese Unie levert om haar betrekkingen met Rusland te intensiveren en op deze manier bij te dragen aan meer stabiliteit, veiligheid en welvaart in Europa. Energie en het zekerstellen van de energievoorziening is een van de belangrijkste en meest cruciale terreinen van samenwerking tussen de EU en Rusland. Het is van fundamenteel belang dat de stabiliteit gecreëerd wordt die nodig is om de energievoorziening aan de lidstaten van de EU en aan haar consumenten zeker te stellen.', 'Ik hoop dat de energiedialoog en de afspraken die tijdens de komende Top EU-Rusland gemaakt worden, zullen bijdragen aan grotere transparantie en levensvatbaarheid van de energiesector op lange termijn en dat deze sector op zijn beurt kan bijdragen aan het tot stand brengen van nieuwe structurele betrekkingen tussen de twee blokken door middel van een verdere samenwerking op het gebied van handel en economie. Minstens zo belangrijk is de samenwerking tussen de EU en Rusland op het gebied van de klimaatverandering, om tijdens de Conferentie van Kopenhagen tot een breed akkoord te kunnen komen. Ik wil nogmaals het strategisch belang onderstrepen van de betrekkingen tussen de EU en Rusland en de bijdrage die deze samenwerking kan leveren aan het opbouwen van wederzijds begrip en vertrouwen, zaken die van essentieel belang zijn voor de vrede en stabiliteit op het hele Europese continent. ']"
104, 11. Stemverklaringen (voortzetting) ,"  David Casa  (PPE),  schriftelijk. − (EN) Op 18 november 2009 vindt er een Top EU-Rusland plaats. De afgelopen jaren hebben de Europese Unie en Rusland nauwe betrekkingen ontwikkeld. Sommige aspecten dienen echter nog te worden versterkt. Ik ben van mening dat in de onderhavige resolutie deze aspecten goed aan de orde worden gesteld en ik heb daarom vóór deze resolutie gestemd. ","David Casa  (PPE),",1,61,not_available,['eng'],"['  David Casa  (PPE),  schriftelijk. − (EN) Op 18 november 2009 vindt er een Top EU-Rusland plaats. De afgelopen jaren hebben de Europese Unie en Rusland nauwe betrekkingen ontwikkeld. Sommige aspecten dienen echter nog te worden versterkt. Ik ben van mening dat in de onderhavige resolutie deze aspecten goed aan de orde worden gesteld en ik heb daarom vóór deze resolutie gestemd. ']"
105, 11. Stemverklaringen (voortzetting) ,"  Edite Estrela  (S&D),  schriftelijk. − (PT) Ik heb voor deze resolutie gestemd omdat ik deze Top, die net voor de Conferentie van Kopenhangen plaatsvindt, van bijzonder groot belang vind en van mening ben dat deze een uitstekende gelegenheid biedt om de betrekkingen tussen de EU en Rusland te versterken. Dit partnerschap kan een rol van doorslaggevende betekenis spelen op het wereldtoneel, ten aanzien van de economische en financiële crisis, de voorbereidingen voor Kopenhangen en de ondertekening van een toekomstig akkoord tussen de Europese Unie en Rusland over de instelling van een mechanisme voor vroegtijdige waarschuwing op het gebied van de continuïteit van de energievoorziening, waardoor de samenwerking op dit gebied bevorderd wordt. ","Edite Estrela  (S&D),",1,112,not_available,['por'],"['  Edite Estrela  (S&D),  schriftelijk. − (PT) Ik heb voor deze resolutie gestemd omdat ik deze Top, die net voor de Conferentie van Kopenhangen plaatsvindt, van bijzonder groot belang vind en van mening ben dat deze een uitstekende gelegenheid biedt om de betrekkingen tussen de EU en Rusland te versterken. Dit partnerschap kan een rol van doorslaggevende betekenis spelen op het wereldtoneel, ten aanzien van de economische en financiële crisis, de voorbereidingen voor Kopenhangen en de ondertekening van een toekomstig akkoord tussen de Europese Unie en Rusland over de instelling van een mechanisme voor vroegtijdige waarschuwing op het gebied van de continuïteit van de energievoorziening, waardoor de samenwerking op dit gebied bevorderd wordt. ']"
106, 11. Stemverklaringen (voortzetting) ,"  Diogo Feio  (PPE),  schriftelijk. − (PT) Op een moment waarop het verenigde Europa de twintigste verjaardag van de val van de Berlijnse muur viert, zijn de betrekkingen tussen de EU en Rusland van bijzonder groot belang en dient hierover goed nagedacht te worden.Inmiddels is de golf van optimisme over vrijheid en democratie waarvan vlak na de val van het IJzeren Gordijn sprake was, verschillende keren wat verder afgezwakt en blijkt Rusland niet echt de democratische rechtsstaat te zijn die toen zo geïdealiseerd werd en die iedereen wenst. Het is logisch dat mensen ontgoocheld zijn geraakt over de traagheid waarmee de veranderingen plaatsvinden.Dit gezegd hebbende, hecht ik eraan de revisionistische pogingen te veroordelen van links Europa, die een poging zijn de afschuwelijke misdaden van het communisme te verbloemen en over perfecte werelden in het verleden te fantaseren. Dit is een belediging voor de nagedachtenis aan hen die ervoor gevochten hebben de mensen te bevrijden van het totalitaire systeem van de Sovjet-Unie.Deze Top biedt een gelegenheid om de betrekkingen tussen de EU en Rusland te versterken en om dit op een samenhangende manier te doen die voor beide partijen productief is, zonder ons standpunt inzake kwesties als energie, defensie, democratie en mensenrechten af te zwakken of onze aandacht daarvoor te laten verslappen.Het toekennen van de Sacharovprijs aan ""Memorial"" laat zien hoeveel er nog gedaan moet worden en dat dit Parlement de ontwikkelingen in Rusland nauwlettend blijft volgen. Ik hoop dat de overige Europese instellingen dit voorbeeld zullen volgen. ","Diogo Feio  (PPE),",5,250,not_available,"['por', 'por', 'por', 'por', 'por']","['  Diogo Feio  (PPE),  schriftelijk. − (PT) Op een moment waarop het verenigde Europa de twintigste verjaardag van de val van de Berlijnse muur viert, zijn de betrekkingen tussen de EU en Rusland van bijzonder groot belang en dient hierover goed nagedacht te worden.', 'Inmiddels is de golf van optimisme over vrijheid en democratie waarvan vlak na de val van het IJzeren Gordijn sprake was, verschillende keren wat verder afgezwakt en blijkt Rusland niet echt de democratische rechtsstaat te zijn die toen zo geïdealiseerd werd en die iedereen wenst. Het is logisch dat mensen ontgoocheld zijn geraakt over de traagheid waarmee de veranderingen plaatsvinden.', 'Dit gezegd hebbende, hecht ik eraan de revisionistische pogingen te veroordelen van links Europa, die een poging zijn de afschuwelijke misdaden van het communisme te verbloemen en over perfecte werelden in het verleden te fantaseren. Dit is een belediging voor de nagedachtenis aan hen die ervoor gevochten hebben de mensen te bevrijden van het totalitaire systeem van de Sovjet-Unie.', 'Deze Top biedt een gelegenheid om de betrekkingen tussen de EU en Rusland te versterken en om dit op een samenhangende manier te doen die voor beide partijen productief is, zonder ons standpunt inzake kwesties als energie, defensie, democratie en mensenrechten af te zwakken of onze aandacht daarvoor te laten verslappen.', 'Het toekennen van de Sacharovprijs aan ""Memorial"" laat zien hoeveel er nog gedaan moet worden en dat dit Parlement de ontwikkelingen in Rusland nauwlettend blijft volgen. Ik hoop dat de overige Europese instellingen dit voorbeeld zullen volgen. ']"
107, 11. Stemverklaringen (voortzetting) ,"  Ian Hudghton  (Verts/ALE),  schriftelijk. − (EN) Ik heb voor de resolutie over Rusland gestemd. Rusland is een van de belangrijkste partners van de EU en het is essentieel dat de EU en Rusland nauw samenwerken. Tijdens de komende top in Stockholm zal over een reeks zaken worden gesproken die belangrijk zijn voor de EU, Rusland en, welzeker, de internationale gemeenschap. Het Parlement heeft vandaag een eensgezinde boodschap gestuurd waarin de kwesties worden uitgelicht die het belangrijkst zijn en aanleiding geven tot de meeste zorg. ","Ian Hudghton  (Verts/ALE),",1,84,not_available,['eng'],"['  Ian Hudghton  (Verts/ALE),  schriftelijk. − (EN) Ik heb voor de resolutie over Rusland gestemd. Rusland is een van de belangrijkste partners van de EU en het is essentieel dat de EU en Rusland nauw samenwerken. Tijdens de komende top in Stockholm zal over een reeks zaken worden gesproken die belangrijk zijn voor de EU, Rusland en, welzeker, de internationale gemeenschap. Het Parlement heeft vandaag een eensgezinde boodschap gestuurd waarin de kwesties worden uitgelicht die het belangrijkst zijn en aanleiding geven tot de meeste zorg. ']"
108, 11. Stemverklaringen (voortzetting) ,"  Jean-Marie Le Pen  (NI),  schriftelijk. – (FR) Mijnheer de Voorzitter, geachte collega's, Rusland is ongetwijfeld het enige land ter wereld dat nooit genade vindt in uw ogen en wiens eisen, behoeften en gevoeligheid u stelselmatig onder het tapijt veegt. Het is waar dat de helft van Europa bijna vijftig jaar lang gebukt ging onder het juk van de Sovjets, dat tanks het streven naar vrijheid op bloedige wijze onderdrukten, in Boedapest in 1956, in Praag in 1968, in Polen...In die tijd gaf u echter op veel discretere wijze uiting aan uw afkeuring – als daar al sprake van was! En zelfs toen de Berlijnse muur in 1989 viel: hoeveel Europese leiders hoopten toen niet vurig dat het communisme eenvoudigweg hervormd zou worden en dat de status-quo zou worden gehandhaafd? Alsof de meest bloedige dictatuur van de twintigste eeuw met zijn 150 miljoen doden hervormd kon worden!Rusland is echter niet de Sovjet-Unie. Het is een geweldig land waarmee wij geprivilegieerde betrekkingen tot stand moeten brengen, omdat deze betrekkingen ons gemeenschappelijke belangen en wederzijdse voordelen kunnen opleveren, maar vooral omdat Rusland, in tegenstelling tot Turkije, ontegenzeglijk deel uitmaakt van Europa's geografie, cultuur, geestelijk leven en beschaving. ","Jean-Marie Le Pen  (NI),",3,199,not_available,"['fra', 'fra', 'fra']","[""  Jean-Marie Le Pen  (NI),  schriftelijk. – (FR) Mijnheer de Voorzitter, geachte collega's, Rusland is ongetwijfeld het enige land ter wereld dat nooit genade vindt in uw ogen en wiens eisen, behoeften en gevoeligheid u stelselmatig onder het tapijt veegt. Het is waar dat de helft van Europa bijna vijftig jaar lang gebukt ging onder het juk van de Sovjets, dat tanks het streven naar vrijheid op bloedige wijze onderdrukten, in Boedapest in 1956, in Praag in 1968, in Polen..."", 'In die tijd gaf u echter op veel discretere wijze uiting aan uw afkeuring – als daar al sprake van was! En zelfs toen de Berlijnse muur in 1989 viel: hoeveel Europese leiders hoopten toen niet vurig dat het communisme eenvoudigweg hervormd zou worden en dat de status-quo zou worden gehandhaafd? Alsof de meest bloedige dictatuur van de twintigste eeuw met zijn 150 miljoen doden hervormd kon worden!', ""Rusland is echter niet de Sovjet-Unie. Het is een geweldig land waarmee wij geprivilegieerde betrekkingen tot stand moeten brengen, omdat deze betrekkingen ons gemeenschappelijke belangen en wederzijdse voordelen kunnen opleveren, maar vooral omdat Rusland, in tegenstelling tot Turkije, ontegenzeglijk deel uitmaakt van Europa's geografie, cultuur, geestelijk leven en beschaving. ""]"
109, 11. Stemverklaringen (voortzetting) ,"  Nuno Melo  (PPE),  schriftelijk. − (PT) De komende Top EU-Rusland vindt plaats op het moment dat het twintig jaar geleden is dat de Berlijnse Muur viel. De symboliek van deze gebeurtenis wijst ons nog eens op het belang van twee fundamentele ideeën.Ten eerste dat waarden als vrijheid, het respecteren van de mensenrechten, van democratie, van vrede en van de soevereiniteit van staten nog helemaal actueel zijn en de Europese Unie tot richtsnoer dienen in haar interne en externe beleid, en ook een land als Rusland, dat een fundamentele rol speelt - en moet spelen - op het internationale vlak, tot richtsnoer zouden moeten dienen. Ik moet echter met zorg vaststellen dat Rusland zich niet heeft opgesteld als een land dat zich door deze waarden laat leiden.Nu we stilstaan bij de afgelopen twintig jaar, realiseren we ons echter ook dat de betrekkingen tussen Europa en Rusland veranderd zijn, want ze zijn nu gebaseerd op de dialoog. Rusland is niet een bondgenoot van Europa die onze waarden deelt, maar een buurland waarmee we een geografisch gebied, verschillen en gezamenlijke belangen delen, zoals bijvoorbeeld in het geval van Afghanistan. Deze realiteit moet in de toekomst ons vertrekpunt zijn bij het tot stand brengen van een nieuwe samenwerkingsovereenkomst. De val van het communisme betekent niet het einde van de verschillen, maar het betekent in deze betrekkingen het einde van de confrontatie. ","Nuno Melo  (PPE),",3,227,not_available,"['por', 'por', 'por']","['  Nuno Melo  (PPE),  schriftelijk. − (PT) De komende Top EU-Rusland vindt plaats op het moment dat het twintig jaar geleden is dat de Berlijnse Muur viel. De symboliek van deze gebeurtenis wijst ons nog eens op het belang van twee fundamentele ideeën.', 'Ten eerste dat waarden als vrijheid, het respecteren van de mensenrechten, van democratie, van vrede en van de soevereiniteit van staten nog helemaal actueel zijn en de Europese Unie tot richtsnoer dienen in haar interne en externe beleid, en ook een land als Rusland, dat een fundamentele rol speelt - en moet spelen - op het internationale vlak, tot richtsnoer zouden moeten dienen. Ik moet echter met zorg vaststellen dat Rusland zich niet heeft opgesteld als een land dat zich door deze waarden laat leiden.', 'Nu we stilstaan bij de afgelopen twintig jaar, realiseren we ons echter ook dat de betrekkingen tussen Europa en Rusland veranderd zijn, want ze zijn nu gebaseerd op de dialoog. Rusland is niet een bondgenoot van Europa die onze waarden deelt, maar een buurland waarmee we een geografisch gebied, verschillen en gezamenlijke belangen delen, zoals bijvoorbeeld in het geval van Afghanistan. Deze realiteit moet in de toekomst ons vertrekpunt zijn bij het tot stand brengen van een nieuwe samenwerkingsovereenkomst. De val van het communisme betekent niet het einde van de verschillen, maar het betekent in deze betrekkingen het einde van de confrontatie. ']"
110, 11. Stemverklaringen (voortzetting) ,"  Willy Meyer  (GUE/NGL),  schriftelijk. − (ES) De EU en Rusland dragen een grote verantwoordelijkheid op het vlak van de stabiliteit, de veiligheid en de welvaart in heel Europa.De samenwerking tussen de EU en Rusland binnen het Kwartet moet er onder andere voor zorgen dat Israël onder druk wordt gezet om de overeenkomsten te respecteren, de bouw van nederzettingen stop te zetten en de onderhandelingen te hernemen om een snelle oplossing te vinden voor de oprichting van een onafhankelijke Palestijnse staat. Wij vinden dat de buitenlandse betrekkingen gebaseerd moeten zijn op respect voor de soevereiniteit en de territoriale integriteit van alle lidstaten en niet op het creëren van invloedssferen.We verwelkomen de voortdurende gedachtewisseling die plaatsvindt over de mensenrechten in Rusland, maar we nemen nota van de bezorgdheid die Rusland heeft geuit over de schending van de mensenrechten in de EU, in het bijzonder wat betreft de Russischtalige minderheden in de Baltische staten.Ik heb me onthouden bij de stemming van deze resolutie omdat de GUE-NGL-Fractie zich verzet tegen ieder initiatief dat zou kunnen leiden tot een nieuwe wapenwedloop. We zijn tegen de plannen van de Verenigde Staten om een raketschild te bouwen op grondgebied van lidstaten van de EU. We verwerpen eveneens elke vorm van samenwerking tussen de VS, Rusland, de EU en de NAVO met betrekking tot het optrekken van een raketafweersysteem. ","Willy Meyer  (GUE/NGL),",4,226,not_available,"['spa', 'spa', 'spa', 'spa']","['  Willy Meyer  (GUE/NGL),  schriftelijk. − (ES) De EU en Rusland dragen een grote verantwoordelijkheid op het vlak van de stabiliteit, de veiligheid en de welvaart in heel Europa.', 'De samenwerking tussen de EU en Rusland binnen het Kwartet moet er onder andere voor zorgen dat Israël onder druk wordt gezet om de overeenkomsten te respecteren, de bouw van nederzettingen stop te zetten en de onderhandelingen te hernemen om een snelle oplossing te vinden voor de oprichting van een onafhankelijke Palestijnse staat. Wij vinden dat de buitenlandse betrekkingen gebaseerd moeten zijn op respect voor de soevereiniteit en de territoriale integriteit van alle lidstaten en niet op het creëren van invloedssferen.', 'We verwelkomen de voortdurende gedachtewisseling die plaatsvindt over de mensenrechten in Rusland, maar we nemen nota van de bezorgdheid die Rusland heeft geuit over de schending van de mensenrechten in de EU, in het bijzonder wat betreft de Russischtalige minderheden in de Baltische staten.', 'Ik heb me onthouden bij de stemming van deze resolutie omdat de GUE-NGL-Fractie zich verzet tegen ieder initiatief dat zou kunnen leiden tot een nieuwe wapenwedloop. We zijn tegen de plannen van de Verenigde Staten om een raketschild te bouwen op grondgebied van lidstaten van de EU. We verwerpen eveneens elke vorm van samenwerking tussen de VS, Rusland, de EU en de NAVO met betrekking tot het optrekken van een raketafweersysteem. ']"
