,agenda_item,text,speaker,number_p,number_w,chair,language_ps,ps
0, 1. Istunnon avaaminen,Puhetta johti  puhemies Hans-Gert PÖTTERING,Puhetta johti,1,6,not_available,['fin'],['Puhetta johti  puhemies Hans-Gert PÖTTERING']
1, 1. Istunnon avaaminen,"  Puhemies. −  (DE) Hyvät parlamentin jäsenet, pahoittelen, että olen muutaman minuutin myöhässä. Entinen kollegamme Otto von Habsburg täyttää tänään 96 vuotta. Hän oli Euroopan parlamentin jäsen vuosina 1979–1999. Hänen läsnäolonsa parlamentin istunnoissa ja hänen toimintansa ovat olleet esimerkillisiä. Olen muutaman minuutin myöhässä, koska puhuin äsken puhelimessa hänen kanssaan. Toivon, ettei kenelläkään ole mitään sitä vastaan, että esitin hänelle lämpimät onnittelut 96-vuotispäivän johdosta teidän kaikkien puolestanne ja erityisesti hänen baijerilaisten poliittisten ystäviensä puolesta. ",Puhemies. −,1,73,not_available,['ger'],"['  Puhemies. −  (DE) Hyvät parlamentin jäsenet, pahoittelen, että olen muutaman minuutin myöhässä. Entinen kollegamme Otto von Habsburg täyttää tänään 96 vuotta. Hän oli Euroopan parlamentin jäsen vuosina 1979–1999. Hänen läsnäolonsa parlamentin istunnoissa ja hänen toimintansa ovat olleet esimerkillisiä. Olen muutaman minuutin myöhässä, koska puhuin äsken puhelimessa hänen kanssaan. Toivon, ettei kenelläkään ole mitään sitä vastaan, että esitin hänelle lämpimät onnittelut 96-vuotispäivän johdosta teidän kaikkien puolestanne ja erityisesti hänen baijerilaisten poliittisten ystäviensä puolesta. ']"
2, 3. Tilintarkastustuomioistuimen vuosikertomuksen esittely - 2007,  Puhemies. −  (DE) Esityslistalla on seuraavana tilintarkastustuomioistuimen vuoden 2007 vuosikertomuksen esittely.,Puhemies. −,1,10,not_available,['ger'],['  Puhemies. −  (DE) Esityslistalla on seuraavana tilintarkastustuomioistuimen vuoden 2007 vuosikertomuksen esittely.']
3, 3. Tilintarkastustuomioistuimen vuosikertomuksen esittely - 2007,"  Vítor Manuel da Silva Caldeira,  Euroopan tilintarkastustuomioistuimen presidentti. − (EN) Arvoisa puhemies, minulle on kunnia saada osallistua keskusteluun Euroopan tilintarkastustuomioistuimen vuoden 2007 vuosikertomuksesta, jonka esittelin talousarvion valvontavaliokunnalle 10. marraskuuta.Tilejä koskeva tilintarkastustuomioistuimen lausuma ei tällä kertaa sisällä huomautuksia, mitä voidaan pitää myönteisenä. Tilien perustana olevia toimia koskeva lausuma on kuitenkin pitkälti samanlainen kuin viime vuonna.Tilintarkastustuomioistuin toteaa, että tilinpäätös antaa olennaisilta osiltaan oikeat ja riittävät tiedot Euroopan yhteisöjen taloudellisesta asemasta ja rahavirroista vuoden lopussa. Viimevuotiset huomautukset eivät ole enää tarpeen, koska on saatu aikaan parannuksia. Tilintarkastustuomioistuin antaa huomautuksia sisältämättömät lausumat tilien perustana olevien toimien laillisuudesta ja asianmukaisuudesta ""talous- ja rahoitusasioihin"" sekä ""hallintomenoihin ja muihin menoihin"" liittyvien tulojen, sitoumusten ja maksujen osalta. Tilintarkastustuomioistuin panee merkille Euroopan parlamentin ja muiden toimielinten tekemät päätökset ja toteuttamat toimet, joilla pyritään parantamaan varainhoitoa tilintarkastustuomioistuimen antamien suositusten perusteella ""hallintomenojen ja muiden menojen"" alalla, jonka osuus oli 8 miljardia euroa vuonna 2007. Tilintarkastustuomioistuin arvioi tulevina vuosina näiden päätösten ja toimien vaikutuksia.Tilintarkastustuomioistuin toteaa, että ""maatalouden ja luonnonvarojen"", ""koheesiopolitiikan"", ""tutkimuksen, energian ja liikenteen"", ""yhteisön ulkopuolelle suunnatun tuen sekä kehitys- ja laajentumisasioiden"", ja ""koulutuksen ja kansalaisuuden"" aloilla maksuihin liittyi edelleen olennaisessa määrin virheitä – vaikkakin niiden taso vaihteli. Valvontajärjestelmien katsotaan näillä aloilla olevan parhaimmillaankin vain osittain vaikuttavia, vaikka tilintarkistustuomioistuin toteaa joitakin parannuksia valvontajärjestelmissä ""tutkimuksen"" alalla ja komissiossa tehtyjä parannuksia ""yhteisön ulkopuolelle suunnatun tuen sekä kehitys- ja laajentumisasioiden"" alalla.""Koheesiopolitiikan alan"" osuus talousarviomenoista on 42 miljardia euroa. Tilintarkastustuomioistuin arvioi tapahtumista poimitun edustavan otoksen tarkastuksen perusteella, että vähintään 11:tä prosenttia ilmoitetuista menoista ei olisi pitänyt korvata tällä alalla. Yleisimpiä syitä virheisiin olivat tukeen oikeuttamattomat kustannukset, menojen ilmoittaminen liian suuriksi sekä vakavat puutteet hankintoja koskevien sääntöjen noudattamisessa.""Maatalouden ja luonnonvarojen"" alalla menot olivat yhteensä 52 miljardia euroa. Tilintarkastustuomioistuin katsoi tällä alalla, että ""maaseudun kehittämisen"" osa-alueen yleinen virhetaso on edelleen suhteettoman korkea. Euroopan maatalouden tukirahaston menojen virhetason arvioidaan sen sijaan olevan hieman olennaisuusrajan alapuolella.Miksi tämä tilanne sitten jatkuu samana ja miksi tilien perustana olevat toimet ovat pitkälti samanlaisia kuin viime vuonna? Virheitä on edelleen olennainen määrä, koska Euroopan unionin varainkäytön moniin aloihin ja valvonnan puutteellisuuteen liittyy huomattavia riskejä. Talousarvio jaetaan esimerkiksi yhteisen hallinnoinnin piiriin kuuluvilla aloilla suureksi osaksi miljoonille eri edunsaajille koko yhteisön alueella. Jakamiseen sovelletaan usein monimutkaisia sääntöjä ja asetuksia, ja se perustuu rahoituksen saajien omiin ilmoituksiin. Niin rahoituksen saajat kuin maksajatkin tekevät helposti virheitä näissä luonnostaan riskialttiissa olosuhteissa.Näitä riskejä ehkäistään useilla valvonnan tasoilla: ensimmäinen valvontataso on edunsaajien taso; toisella tasolla varmistetaan ilmoitusten tarkastuksen kehittäminen ja tehokas toiminta; kolmannella tasolla komissio valvoo kaikkien järjestelmien muodostaman kokonaisuuden toimivuutta. Koska valtaosa virheistä tehdään lopullisten edunsaajien tasolla, ne voidaan havaita luotettavasti usein vain paikalla toimitetuilla perusteellisilla tarkastuksilla. Tällaiset tarkastukset ovat kalliita, joten yleensä vain pieni osa yksittäisistä ilmoituksista tarkastetaan.Tilintarkastustuomioistuimen varainhoitovuotta 2007 koskevan tarkastustyön perusteella havaittiin jälleen, että jäsenvaltiot eivät aina pysty tehokkaasti havaitsemaan puutteita, joita on yksittäisten ilmoitusten tarkastuksessa käytettävissä menettelyissä. Tilintarkastustuomioistuin havaitsi puutteita myös maatalousalan sääntöjenmukaisuutta koskevissa komission tarkastuksissa. Useilla talousarvioaloilla on mekanismeja, joilla virheellisesti maksettuja varoja voidaan periä takaisin edunsaajilta tai joilla voidaan ""hylätä"" menoja eli evätä niiden rahoittaminen talousarviosta, jos jäsenvaltio on tehnyt virheitä meno-ohjelmien hallinnoinnissa.Korjaavien toimien vaikutuksesta ei kuitenkaan vielä ole luotettavia tietoja, ja tilintarkastustuomioistuin totesi, että korjaavien toimien ei voida vielä katsoa vaikuttaneen virheitä lieventävästi.Tämän sanottuani haluaisin korostaa, että komissio on vuodesta 2000 lähtien pyrkinyt ponnekkaasti korjaamaan valvonnan puutteita kehittämällä ja panemalla täytäntöön sisäisen uudistusohjelman ja käynnistämällä vuonna 2006 toimintasuunnitelman, jolla parannetaan valvontajärjestelmiä unionissa.Toimintakertomukset ja lausumat, joista osa koskee koheesiopolitiikkaa ja maataloutta, ovat olennainen osa uudistusohjelmaa. Niiden antama kuva vastaa nyt entistä paremmin tilintarkastustuomioistuimen omia arvioita, vaikka joissakin varaumissa ongelmat esitetään edelleen todellista lievempinä.Tilintarkastustuomioistuin katsoo komission vuoden 2006 toimintasuunnitelman osalta, että vaikka komissio on todennut edistystä tapahtuneen, ei vaikutusta tilien perustana olevien toimien laillisuuteen ja asianmukaisuuteen ole vielä havaittavissa. Esimerkkinä tästä voidaan todeta, että vuonna 2007 jäsenvaltioiden oli ensimmäistä kertaa laadittava vuotuinen yhteenveto tehdyistä tarkastuksista ja ilmoituksista. Nämä yhteenvedot voisivat ajan myötä parantaa EU-varojen hallinnointia ja valvontaa, kuten tilintarkastustuomioistuimen lausunnossa nro 6/2007 todetaan. Niillä ei kuitenkaan vielä voida arvioida luotettavalla tavalla valvontajärjestelmien toimintaa ja vaikuttavuutta.Tähän mennessä olen kuvannut nykytilannetta. Tulevaisuutta ajatellen on kuitenkin pohdittava, onko tarvetta lisätoimiin ja mitä toimenpiteitä olisi mahdollisesti toteutettava tulevaisuudessa. Tilintarkastustuomioistuin esittää, että kaikissa tällaisissa toimenpiteissä on otettava huomioon seuraavat seikat.Ensinnäkin on arvioitava virheiden vähentämisestä saatavaa hyötyä suhteessa kustannuksiin.Toiseksi kaikkien talousarvioprosessiin osallistujien on hyväksyttävä, ettei virheriskiä voida välttää kokonaan. Kolmanneksi talousarvion eri aloilla hyväksyttävistä riskitasoista on sovittava poliittisella tasolla siten, että talousarvio-/vastuuvapausviranomaiset tekevät päätöksen kansalaisten puolesta.Neljänneksi olisi harkittava uudelleen sellaisten järjestelmien käyttöä, joita ei voida panna täytäntöön tyydyttävällä tavalla siten, että menot olisivat hyväksyttävällä tasolla ja riski siedettävä.Lopuksi on kiinnitettävä erityistä huomiota yksinkertaistamiseen esimerkiksi juuri maaseudun kehittämisen ja tutkimuksen alalla, sillä hyvin suunnitelluilla säännöillä ja asetuksilla, jotka ovat selkeästi tulkittavissa ja joiden soveltaminen on yksinkertaista, vähennetään virheriskiä, kevennetään hallinnointi- ja valvontajärjestelyjä ja parannetaan niiden kustannustehokkuutta.Tämän vuoksi tilintarkastustuomioistuin kannustaa komissiota saattamaan päätökseen analyysinsä, joka koskee valvontamenettelyjen kustannuksia ja eri menoalojen toimintariskitasoja. Tilintarkastustuomioistuin suosittaa myös, että komissio jatkaa seurannan ja raportoinnin parantamiseen tähtääviä toimia, joihin kuuluu yhteistyö jäsenvaltioiden kanssa sen varmistamiseksi, että vuotuisia yhteenvetoja voidaan käyttää tehokkaasti vuotuisissa toimintakertomuksissa, ja joiden ansiosta takaisinperintäjärjestelmien parantamistoimia voidaan seurata. Tilintarkastustuomioistuin esittää vastauksessaan komission tiedonantoon ""Reforming the Budget, Changing Europe"", että Euroopan unionin varainkäytön suunnitteluun sovellettaisiin yksinkertaistamisen ja hyväksyttävän riskin käsitteen lisäksi selkeiden tavoitteiden, realismin, avoimuuden ja tilivelvollisuuden periaatteita. Tilintarkastustuomioistuin myös kannustaa poliittisia päätöksentekijöitä tutkimaan, mitä mahdollisuuksia olisi laatia meno-ohjelmat tuotosten mukaan, ja arvioimaan kriittisesti, mikä on sopiva kansallisen, alueellisen ja paikallisen päätäntävallan taso ohjelmien hallinnoinnissa.Lopuksi totean, että tilintarkastustuomioistuin antaa tunnustusta edistymiselle mutta painottaa, että lisäparannukset Euroopan unionin varainhoitoon riippuvat niiden parhaillaan toteutettavien ja tulevien toimenpiteiden onnistumisesta, joilla pyritään vähentämään riskejä hyväksyttävälle tasolle ja kehittämään kustannustehokkaita järjestelmiä riskienhallintaan.Rahoitusalan myllerryksen ja talouden epävakauden aikana tilintarkastustuomioistuimen merkitys ja painoarvo kasvaa entisestään. Euroopan unionin ulkoisena tarkastajana velvollisuutemme on toimia unionin kansalaisten taloudellisten etujen riippumattomana valvojana. Kun esittelemme tämän kertomuksen, tavoitteenamme on edistää osaltamme avoimuutta ja tilivelvollisuutta. Niitä pidetään välttämättömänä perustana Euroopan unionin kansalaisten luottamukselle toimielimiin, jotka pitävät unionin toiminnassa ja ohjaavat sitä oikeaan suuntaan. ","Vítor Manuel da Silva Caldeira,",30,979,not_available,"['fin', 'fin', 'fin', 'fin', 'fin', 'fin', 'fin', 'fin', 'fin', 'fin', 'fin', 'fin', 'fin', 'fin', 'fin', 'fin', 'fin', 'fin', 'fin', 'fin', 'fin', 'fin', 'fin', 'fin', 'fin', 'fin', 'fin', 'fin', 'fin', 'fin']","['  Vítor Manuel da Silva Caldeira,  Euroopan tilintarkastustuomioistuimen presidentti. − (EN) Arvoisa puhemies, minulle on kunnia saada osallistua keskusteluun Euroopan tilintarkastustuomioistuimen vuoden 2007 vuosikertomuksesta, jonka esittelin talousarvion valvontavaliokunnalle 10. marraskuuta.', 'Tilejä koskeva tilintarkastustuomioistuimen lausuma ei tällä kertaa sisällä huomautuksia, mitä voidaan pitää myönteisenä. Tilien perustana olevia toimia koskeva lausuma on kuitenkin pitkälti samanlainen kuin viime vuonna.', 'Tilintarkastustuomioistuin toteaa, että tilinpäätös antaa olennaisilta osiltaan oikeat ja riittävät tiedot Euroopan yhteisöjen taloudellisesta asemasta ja rahavirroista vuoden lopussa. Viimevuotiset huomautukset eivät ole enää tarpeen, koska on saatu aikaan parannuksia. ', 'Tilintarkastustuomioistuin antaa huomautuksia sisältämättömät lausumat tilien perustana olevien toimien laillisuudesta ja asianmukaisuudesta ""talous- ja rahoitusasioihin"" sekä ""hallintomenoihin ja muihin menoihin"" liittyvien tulojen, sitoumusten ja maksujen osalta. ', 'Tilintarkastustuomioistuin panee merkille Euroopan parlamentin ja muiden toimielinten tekemät päätökset ja toteuttamat toimet, joilla pyritään parantamaan varainhoitoa tilintarkastustuomioistuimen antamien suositusten perusteella ""hallintomenojen ja muiden menojen"" alalla, jonka osuus oli 8 miljardia euroa vuonna 2007. Tilintarkastustuomioistuin arvioi tulevina vuosina näiden päätösten ja toimien vaikutuksia.', 'Tilintarkastustuomioistuin toteaa, että ""maatalouden ja luonnonvarojen"", ""koheesiopolitiikan"", ""tutkimuksen, energian ja liikenteen"", ""yhteisön ulkopuolelle suunnatun tuen sekä kehitys- ja laajentumisasioiden"", ja ""koulutuksen ja kansalaisuuden"" aloilla maksuihin liittyi edelleen olennaisessa määrin virheitä – vaikkakin niiden taso vaihteli. Valvontajärjestelmien katsotaan näillä aloilla olevan parhaimmillaankin vain osittain vaikuttavia, vaikka tilintarkistustuomioistuin toteaa joitakin parannuksia valvontajärjestelmissä ""tutkimuksen"" alalla ja komissiossa tehtyjä parannuksia ""yhteisön ulkopuolelle suunnatun tuen sekä kehitys- ja laajentumisasioiden"" alalla.', '""Koheesiopolitiikan alan"" osuus talousarviomenoista on 42 miljardia euroa. Tilintarkastustuomioistuin arvioi tapahtumista poimitun edustavan otoksen tarkastuksen perusteella, että vähintään 11:tä prosenttia ilmoitetuista menoista ei olisi pitänyt korvata tällä alalla. Yleisimpiä syitä virheisiin olivat tukeen oikeuttamattomat kustannukset, menojen ilmoittaminen liian suuriksi sekä vakavat puutteet hankintoja koskevien sääntöjen noudattamisessa.', '""Maatalouden ja luonnonvarojen"" alalla menot olivat yhteensä 52 miljardia euroa. Tilintarkastustuomioistuin katsoi tällä alalla, että ""maaseudun kehittämisen"" osa-alueen yleinen virhetaso on edelleen suhteettoman korkea. Euroopan maatalouden tukirahaston menojen virhetason arvioidaan sen sijaan olevan hieman olennaisuusrajan alapuolella.', 'Miksi tämä tilanne sitten jatkuu samana ja miksi tilien perustana olevat toimet ovat pitkälti samanlaisia kuin viime vuonna? Virheitä on edelleen olennainen määrä, koska Euroopan unionin varainkäytön moniin aloihin ja valvonnan puutteellisuuteen liittyy huomattavia riskejä. ', 'Talousarvio jaetaan esimerkiksi yhteisen hallinnoinnin piiriin kuuluvilla aloilla suureksi osaksi miljoonille eri edunsaajille koko yhteisön alueella. Jakamiseen sovelletaan usein monimutkaisia sääntöjä ja asetuksia, ja se perustuu rahoituksen saajien omiin ilmoituksiin. Niin rahoituksen saajat kuin maksajatkin tekevät helposti virheitä näissä luonnostaan riskialttiissa olosuhteissa.', 'Näitä riskejä ehkäistään useilla valvonnan tasoilla: ensimmäinen valvontataso on edunsaajien taso; toisella tasolla varmistetaan ilmoitusten tarkastuksen kehittäminen ja tehokas toiminta; kolmannella tasolla komissio valvoo kaikkien järjestelmien muodostaman kokonaisuuden toimivuutta. ', 'Koska valtaosa virheistä tehdään lopullisten edunsaajien tasolla, ne voidaan havaita luotettavasti usein vain paikalla toimitetuilla perusteellisilla tarkastuksilla. Tällaiset tarkastukset ovat kalliita, joten yleensä vain pieni osa yksittäisistä ilmoituksista tarkastetaan.', 'Tilintarkastustuomioistuimen varainhoitovuotta 2007 koskevan tarkastustyön perusteella havaittiin jälleen, että jäsenvaltiot eivät aina pysty tehokkaasti havaitsemaan puutteita, joita on yksittäisten ilmoitusten tarkastuksessa käytettävissä menettelyissä. Tilintarkastustuomioistuin havaitsi puutteita myös maatalousalan sääntöjenmukaisuutta koskevissa komission tarkastuksissa. ', 'Useilla talousarvioaloilla on mekanismeja, joilla virheellisesti maksettuja varoja voidaan periä takaisin edunsaajilta tai joilla voidaan ""hylätä"" menoja eli evätä niiden rahoittaminen talousarviosta, jos jäsenvaltio on tehnyt virheitä meno-ohjelmien hallinnoinnissa.', 'Korjaavien toimien vaikutuksesta ei kuitenkaan vielä ole luotettavia tietoja, ja tilintarkastustuomioistuin totesi, että korjaavien toimien ei voida vielä katsoa vaikuttaneen virheitä lieventävästi.', 'Tämän sanottuani haluaisin korostaa, että komissio on vuodesta 2000 lähtien pyrkinyt ponnekkaasti korjaamaan valvonnan puutteita kehittämällä ja panemalla täytäntöön sisäisen uudistusohjelman ja käynnistämällä vuonna 2006 toimintasuunnitelman, jolla parannetaan valvontajärjestelmiä unionissa.', 'Toimintakertomukset ja lausumat, joista osa koskee koheesiopolitiikkaa ja maataloutta, ovat olennainen osa uudistusohjelmaa. Niiden antama kuva vastaa nyt entistä paremmin tilintarkastustuomioistuimen omia arvioita, vaikka joissakin varaumissa ongelmat esitetään edelleen todellista lievempinä.', 'Tilintarkastustuomioistuin katsoo komission vuoden 2006 toimintasuunnitelman osalta, että vaikka komissio on todennut edistystä tapahtuneen, ei vaikutusta tilien perustana olevien toimien laillisuuteen ja asianmukaisuuteen ole vielä havaittavissa. Esimerkkinä tästä voidaan todeta, että vuonna 2007 jäsenvaltioiden oli ensimmäistä kertaa laadittava vuotuinen yhteenveto tehdyistä tarkastuksista ja ilmoituksista. ', 'Nämä yhteenvedot voisivat ajan myötä parantaa EU-varojen hallinnointia ja valvontaa, kuten tilintarkastustuomioistuimen lausunnossa nro 6/2007 todetaan.', ' Niillä ei kuitenkaan vielä voida arvioida luotettavalla tavalla valvontajärjestelmien toimintaa ja vaikuttavuutta.', 'Tähän mennessä olen kuvannut nykytilannetta. Tulevaisuutta ajatellen on kuitenkin pohdittava, onko tarvetta lisätoimiin ja mitä toimenpiteitä olisi mahdollisesti toteutettava tulevaisuudessa. Tilintarkastustuomioistuin esittää, että kaikissa tällaisissa toimenpiteissä on otettava huomioon seuraavat seikat.', 'Ensinnäkin on arvioitava virheiden vähentämisestä saatavaa hyötyä suhteessa kustannuksiin.', 'Toiseksi kaikkien talousarvioprosessiin osallistujien on hyväksyttävä, ettei virheriskiä voida välttää kokonaan. ', 'Kolmanneksi talousarvion eri aloilla hyväksyttävistä riskitasoista on sovittava poliittisella tasolla siten, että talousarvio-/vastuuvapausviranomaiset tekevät päätöksen kansalaisten puolesta.', 'Neljänneksi olisi harkittava uudelleen sellaisten järjestelmien käyttöä, joita ei voida panna täytäntöön tyydyttävällä tavalla siten, että menot olisivat hyväksyttävällä tasolla ja riski siedettävä.', 'Lopuksi on kiinnitettävä erityistä huomiota yksinkertaistamiseen esimerkiksi juuri maaseudun kehittämisen ja tutkimuksen alalla, sillä hyvin suunnitelluilla säännöillä ja asetuksilla, jotka ovat selkeästi tulkittavissa ja joiden soveltaminen on yksinkertaista, vähennetään virheriskiä, kevennetään hallinnointi- ja valvontajärjestelyjä ja parannetaan niiden kustannustehokkuutta.', 'Tämän vuoksi tilintarkastustuomioistuin kannustaa komissiota saattamaan päätökseen analyysinsä, joka koskee valvontamenettelyjen kustannuksia ja eri menoalojen toimintariskitasoja. Tilintarkastustuomioistuin suosittaa myös, että komissio jatkaa seurannan ja raportoinnin parantamiseen tähtääviä toimia, joihin kuuluu yhteistyö jäsenvaltioiden kanssa sen varmistamiseksi, että vuotuisia yhteenvetoja voidaan käyttää tehokkaasti vuotuisissa toimintakertomuksissa, ja joiden ansiosta takaisinperintäjärjestelmien parantamistoimia voidaan seurata. ', 'Tilintarkastustuomioistuin esittää vastauksessaan komission tiedonantoon ""Reforming the Budget, Changing Europe"", että Euroopan unionin varainkäytön suunnitteluun sovellettaisiin yksinkertaistamisen ja hyväksyttävän riskin käsitteen lisäksi selkeiden tavoitteiden, realismin, avoimuuden ja tilivelvollisuuden periaatteita. Tilintarkastustuomioistuin myös kannustaa poliittisia päätöksentekijöitä tutkimaan, mitä mahdollisuuksia olisi laatia meno-ohjelmat tuotosten mukaan, ja arvioimaan kriittisesti, mikä on sopiva kansallisen, alueellisen ja paikallisen päätäntävallan taso ohjelmien hallinnoinnissa.', 'Lopuksi totean, että tilintarkastustuomioistuin antaa tunnustusta edistymiselle mutta painottaa, että lisäparannukset Euroopan unionin varainhoitoon riippuvat niiden parhaillaan toteutettavien ja tulevien toimenpiteiden onnistumisesta, joilla pyritään vähentämään riskejä hyväksyttävälle tasolle ja kehittämään kustannustehokkaita järjestelmiä riskienhallintaan.', 'Rahoitusalan myllerryksen ja talouden epävakauden aikana tilintarkastustuomioistuimen merkitys ja painoarvo kasvaa entisestään. Euroopan unionin ulkoisena tarkastajana velvollisuutemme on toimia unionin kansalaisten taloudellisten etujen riippumattomana valvojana. Kun esittelemme tämän kertomuksen, tavoitteenamme on edistää osaltamme avoimuutta ja tilivelvollisuutta. Niitä pidetään välttämättömänä perustana Euroopan unionin kansalaisten luottamukselle toimielimiin, jotka pitävät unionin toiminnassa ja ohjaavat sitä oikeaan suuntaan. ']"
4, 3. Tilintarkastustuomioistuimen vuosikertomuksen esittely - 2007,"  Puhemies. −  (EN) Arvoisa presidentti Silva Caldeira, haluaisin kiittää teitä kertomuksestanne sekä teidän, tilintarkastustuomioistuimen ja Euroopan parlamentin välisestä yhteistyöstä, jota tehdään aina erittäin rakentavassa hengessä. ",Puhemies. −,1,24,not_available,['eng'],"['  Puhemies. −  (EN) Arvoisa presidentti Silva Caldeira, haluaisin kiittää teitä kertomuksestanne sekä teidän, tilintarkastustuomioistuimen ja Euroopan parlamentin välisestä yhteistyöstä, jota tehdään aina erittäin rakentavassa hengessä. ']"
