,agenda_item,text,speaker,number_p,number_w,chair,language_ps,ps
164, 7. Äänestysselitykset,"  Luca Romagnoli  (NI),  kirjallinen. − (IT) Arvoisa puhemies, hyvät kollegat, äänestin rypäleammuksia koskevan yleissopimuksen ratifiointitarpeesta ennen vuoden 2008 loppua laaditun päätöslauselmaesityksen puolesta. Tässä ehdotuksessa, jota kannatan täysin, halutaan kieltää rypäleammusten käyttö, valmistus, varastointi ja siirto koko aseluokan osalta.Hyväksyn myös sen, että rypäleaseita käyttäneiden EU:n jäsenvaltioiden on pakko antaa teknistä ja rahallista apua rypäleammusten jäänteiden raivaamiseen ja tuhoamiseen. Lopuksi suhtaudun myönteisesti kollegojeni aloitteeseen, jonka mukaan kaikkia jäsenvaltioita kehotetaan pidättäytymään rypäleammusten käyttämisestä, niihin investoimisesta, niiden varastoinnista, valmistuksesta, siirtämisestä sekä niiden viennistä riippumatta yleissopimuksen ratifioinnista. ","Luca Romagnoli  (NI),",2,83,not_available,"['ita', 'ita']","['  Luca Romagnoli  (NI),  kirjallinen. − (IT) Arvoisa puhemies, hyvät kollegat, äänestin rypäleammuksia koskevan yleissopimuksen ratifiointitarpeesta ennen vuoden 2008 loppua laaditun päätöslauselmaesityksen puolesta. Tässä ehdotuksessa, jota kannatan täysin, halutaan kieltää rypäleammusten käyttö, valmistus, varastointi ja siirto koko aseluokan osalta.', 'Hyväksyn myös sen, että rypäleaseita käyttäneiden EU:n jäsenvaltioiden on pakko antaa teknistä ja rahallista apua rypäleammusten jäänteiden raivaamiseen ja tuhoamiseen. Lopuksi suhtaudun myönteisesti kollegojeni aloitteeseen, jonka mukaan kaikkia jäsenvaltioita kehotetaan pidättäytymään rypäleammusten käyttämisestä, niihin investoimisesta, niiden varastoinnista, valmistuksesta, siirtämisestä sekä niiden viennistä riippumatta yleissopimuksen ratifioinnista. ']"
165, 7. Äänestysselitykset,"  Geoffrey Van Orden  (PPE-DE),  kirjallinen. − (EN) Yhdistyneen kuningaskunnan konservatiivien valtuuskunta äänesti tämän päätöslauselman puolesta suorana tukena hiljattain neuvottelujen jälkeen solmitulle YK:n rypäleammuksia koskevalle yleissopimukselle. Meidän mielestämme yleissopimuksessa yhdistyvät onnistuneesti periaatteellinen ja käytännöllinen humanitaarisuus ja vastuullisten asevoimien sotilaallisten vaatimusten ymmärtäminen.Olemme koko ajan pysyneet kannassamme siitä, että kaikentyyppisten rypäleammusten umpimähkäinen kielto vaikuttaisi kielteisesti asevoimiemme toiminnan tehokkuuteen. Siksi me kiinnitämme erityistä huomiota yleissopimuksessa selvästi määritettyyn poikkeukseen, joka koskee seuraavan sukupolven ""älykkäämpiä"" ammuksia, jotka on suunniteltu itsestään hajoavaksi ja aiheuttavat siviileille minimaalisen riskin. Yhdistyneen kuningaskunnan puolustusministeriö kehittää parhaillaan ammusta, joka täyttää tämän poikkeuksen ehdot.Meidän mielestämme on yleisesti ottaen tärkeää säilyttää suhteellisuudentaju asevoimiemme riskinhallinnan suhteen. Yhdistyneen kuningaskunnan armeija pyrkii aina minimoimaan siviiliväestöön kohdistuvat haitat ja rajoittamaan siviilikohteiden vahingot, mutta emme saa unohtaa sitä tosiasiaa, että vastassamme on terroristeja ja kumouksellista ainesta, jotka eivät epäröi käyttää kaikkia keinoja syyttömien ihmisten hengen viemiseen. Meidän pitäisi kohdistaa suuttumuksemme näihin aineksiin. ","Geoffrey Van Orden  (PPE-DE),",3,146,not_available,"['eng', 'eng', 'eng']","['  Geoffrey Van Orden  (PPE-DE),  kirjallinen. − (EN) Yhdistyneen kuningaskunnan konservatiivien valtuuskunta äänesti tämän päätöslauselman puolesta suorana tukena hiljattain neuvottelujen jälkeen solmitulle YK:n rypäleammuksia koskevalle yleissopimukselle. Meidän mielestämme yleissopimuksessa yhdistyvät onnistuneesti periaatteellinen ja käytännöllinen humanitaarisuus ja vastuullisten asevoimien sotilaallisten vaatimusten ymmärtäminen.', 'Olemme koko ajan pysyneet kannassamme siitä, että kaikentyyppisten rypäleammusten umpimähkäinen kielto vaikuttaisi kielteisesti asevoimiemme toiminnan tehokkuuteen. Siksi me kiinnitämme erityistä huomiota yleissopimuksessa selvästi määritettyyn poikkeukseen, joka koskee seuraavan sukupolven ""älykkäämpiä"" ammuksia, jotka on suunniteltu itsestään hajoavaksi ja aiheuttavat siviileille minimaalisen riskin. Yhdistyneen kuningaskunnan puolustusministeriö kehittää parhaillaan ammusta, joka täyttää tämän poikkeuksen ehdot.', 'Meidän mielestämme on yleisesti ottaen tärkeää säilyttää suhteellisuudentaju asevoimiemme riskinhallinnan suhteen. Yhdistyneen kuningaskunnan armeija pyrkii aina minimoimaan siviiliväestöön kohdistuvat haitat ja rajoittamaan siviilikohteiden vahingot, mutta emme saa unohtaa sitä tosiasiaa, että vastassamme on terroristeja ja kumouksellista ainesta, jotka eivät epäröi käyttää kaikkia keinoja syyttömien ihmisten hengen viemiseen. Meidän pitäisi kohdistaa suuttumuksemme näihin aineksiin. ']"
166, 7. Äänestysselitykset,"  Alessandro Battilocchio  (PSE),  kirjallinen. − (IT) Arvoisa puhemies, hyvät kollegat, äänestin tämän päätöslauselmaesityksen puolesta. Varhainen toteaminen ja tutkimus ovat terveydensuojelun vankka perusta. Hi-viruksen tapauksessa viime vuosien tulokset osoittavat, kuinka tärkeää on edistää tutkimusta. Tästä näkökulmasta meidän on siksi poistettava esteet kaikenlaiselta tutkimukselta, mikä tuo hiv-tartunnan saaneille todellista toivoa laadullisesti tyydyttävämmästä elämästä.Tätä vaatimusta pitäisi tukea konkreettisesti komission poliittisilla, taloudellisilla ja rahoituksellisilla resursseilla. Samanaikaisesti neuvoston ja komission pitäisi varmistaa, että hiv-tartunnan saaneiden syrjintä julistetaan laittomaksi kaikissa EU:n jäsenvaltioissa. ","Alessandro Battilocchio  (PSE),",2,80,not_available,"['ita', 'ita']","['  Alessandro Battilocchio  (PSE),  kirjallinen. − (IT) Arvoisa puhemies, hyvät kollegat, äänestin tämän päätöslauselmaesityksen puolesta. Varhainen toteaminen ja tutkimus ovat terveydensuojelun vankka perusta. Hi-viruksen tapauksessa viime vuosien tulokset osoittavat, kuinka tärkeää on edistää tutkimusta. Tästä näkökulmasta meidän on siksi poistettava esteet kaikenlaiselta tutkimukselta, mikä tuo hiv-tartunnan saaneille todellista toivoa laadullisesti tyydyttävämmästä elämästä.', 'Tätä vaatimusta pitäisi tukea konkreettisesti komission poliittisilla, taloudellisilla ja rahoituksellisilla resursseilla. Samanaikaisesti neuvoston ja komission pitäisi varmistaa, että hiv-tartunnan saaneiden syrjintä julistetaan laittomaksi kaikissa EU:n jäsenvaltioissa. ']"
167, 7. Äänestysselitykset,"  Carlos Coelho  (PPE-DE),  kirjallinen. – (PT) Portugalin sosiaalidemokraattisen puolueen valitsemat Euroopan parlamentin jäsenet tukevat päätöslauselmaa, joka kannustaa edistämään hiv-tartuntojen varhaista toteamista ja hoitoa kaikissa jäsenvaltioissa. Tuoreimmat tilastot osoittavat, että hiv-tartuntojen määrä on lisääntynyt EU:ssa ja että suuri osa hiv-tartunnoista jää edelleen toteamatta.Yksi syy hiv-tartuntojen nopeaan leviämiseen monissa EU-maissa on se, että monet suonensisäisten huumeiden käyttäjät ovat saaneet tartunnan ja levittävät tautia käyttäessään yhteisiä neuloja. EuroHIVin vuosikertomuksessa huumeidenkäytön suuntauksista Euroopan unionissa todetaan Portugalissa olevan eniten havaittuja hiv-/aids-tapauksia huumeidenkäyttäjien joukossa.Vuotuisen terveyspalvelututkimuksen Euro Health Consumer Indexin (EHCI) 2008 mukaan Portugalin terveydenhuoltojärjestelmä on paremmuusjärjestyksessä Euroopan viimeisten joukossa. Yksi Portugalin terveydenhuoltojärjestelmään kohdistettu kritiikki on se, että siinä ei vieläkään ole ratkaistu hoitoon pääsyn ja odotusaikojen ongelmaa. Eurostatin mukaan Portugalissa aidsiin liittyvien kuolemien määrä on yhä suurin. Portugalin ja sen EU-kumppaneiden vertailuanalyysi osoittaa, että maamme strategiassa on jotain vialla. Meidän on tunnistettava ja analysoitava, mikä siinä menee vikaan. ","Carlos Coelho  (PPE-DE),",3,153,not_available,"['por', 'por', 'por']","['  Carlos Coelho  (PPE-DE),  kirjallinen. – (PT) Portugalin sosiaalidemokraattisen puolueen valitsemat Euroopan parlamentin jäsenet tukevat päätöslauselmaa, joka kannustaa edistämään hiv-tartuntojen varhaista toteamista ja hoitoa kaikissa jäsenvaltioissa. Tuoreimmat tilastot osoittavat, että hiv-tartuntojen määrä on lisääntynyt EU:ssa ja että suuri osa hiv-tartunnoista jää edelleen toteamatta.', 'Yksi syy hiv-tartuntojen nopeaan leviämiseen monissa EU-maissa on se, että monet suonensisäisten huumeiden käyttäjät ovat saaneet tartunnan ja levittävät tautia käyttäessään yhteisiä neuloja. EuroHIVin vuosikertomuksessa huumeidenkäytön suuntauksista Euroopan unionissa todetaan Portugalissa olevan eniten havaittuja hiv-/aids-tapauksia huumeidenkäyttäjien joukossa.', 'Vuotuisen terveyspalvelututkimuksen Euro Health Consumer Indexin (EHCI) 2008 mukaan Portugalin terveydenhuoltojärjestelmä on paremmuusjärjestyksessä Euroopan viimeisten joukossa. Yksi Portugalin terveydenhuoltojärjestelmään kohdistettu kritiikki on se, että siinä ei vieläkään ole ratkaistu hoitoon pääsyn ja odotusaikojen ongelmaa. Eurostatin mukaan Portugalissa aidsiin liittyvien kuolemien määrä on yhä suurin. Portugalin ja sen EU-kumppaneiden vertailuanalyysi osoittaa, että maamme strategiassa on jotain vialla. Meidän on tunnistettava ja analysoitava, mikä siinä menee vikaan. ']"
168, 7. Äänestysselitykset,"  Edite Estrela  (PSE),  kirjallinen. – (PT) Äänestin hi-viruksen/aidsin varhaista toteamista ja hoitoa koskevan yhteisen päätöslauselmaesityksen puolesta, koska mielestäni meidän on pikaisesti tehostettava tämän taudin toteamiseen ja hoitoon liittyviä toimenpiteitä ja toimia hiv-tartuntojen määrän noustessa hälyttävästi Euroopan unionissa.Taudin ehkäisy- ja hoitotoimet ovat ratkaisevia, jotta voidaan tyrehdyttää tartuntojen kasvava tulva. Siksi on mielestäni oleellisen tärkeää helpottaa tiedon, neuvonnan sekä terveydenhuollon ja sosiaalipalvelujen saantia.Lisäksi on tärkeää, että jäsenvaltiot antavat määräyksiä, jotka kieltävät tehokkaasti hi-viruksen/aidsin kantajien syrjinnän ja rajoitukset, jotka vaikuttavat heidän liikkumisvapauteensa toimivaltansa alueella. ","Edite Estrela  (PSE),",3,87,not_available,"['por', 'por', 'por']","['  Edite Estrela  (PSE),  kirjallinen. – (PT) Äänestin hi-viruksen/aidsin varhaista toteamista ja hoitoa koskevan yhteisen päätöslauselmaesityksen puolesta, koska mielestäni meidän on pikaisesti tehostettava tämän taudin toteamiseen ja hoitoon liittyviä toimenpiteitä ja toimia hiv-tartuntojen määrän noustessa hälyttävästi Euroopan unionissa.', 'Taudin ehkäisy- ja hoitotoimet ovat ratkaisevia, jotta voidaan tyrehdyttää tartuntojen kasvava tulva. Siksi on mielestäni oleellisen tärkeää helpottaa tiedon, neuvonnan sekä terveydenhuollon ja sosiaalipalvelujen saantia.', 'Lisäksi on tärkeää, että jäsenvaltiot antavat määräyksiä, jotka kieltävät tehokkaasti hi-viruksen/aidsin kantajien syrjinnän ja rajoitukset, jotka vaikuttavat heidän liikkumisvapauteensa toimivaltansa alueella. ']"
169, 7. Äänestysselitykset,"  Luca Romagnoli  (NI),  kirjallinen. − (IT) Arvoisa puhemies, hyvät kollegat, olen tyytyväinen voidessani todeta, että äänestin hi-viruksen varhaisesta toteamisesta ja varhaisesta hoidosta annetun päätöslauselmaesityksen puolesta. Euroopan kansalaisten ja heidän terveytensä suojelemiseksi komissio on velvollinen edistämään varhaista toteamista ja vähentämään tämän taudin testaamisen esteitä.Koska EuroHIVin ja UNAIDSin raporteissa vahvistetaan se, että uusien hi-virustapausten määrä kasvaa hälyttävän nopeasti Euroopan unionissa ja naapurimassa ja että joissakin maissa hi-virustartunnan saaneiden määrän on arvioitu olevan lähes kolminkertainen virallisiin lukuihin verrattuna, olen tyytyväinen tähän ehdotukseen, jossa kehotetaan myös komissiota perustamaan huumeriippuvaisten ja suonensisäisiä huumeita käyttävien hivin/aidsin vähentämistä koskeva strategia. ","Luca Romagnoli  (NI),",2,97,not_available,"['ita', 'ita']","['  Luca Romagnoli  (NI),  kirjallinen. − (IT) Arvoisa puhemies, hyvät kollegat, olen tyytyväinen voidessani todeta, että äänestin hi-viruksen varhaisesta toteamisesta ja varhaisesta hoidosta annetun päätöslauselmaesityksen puolesta. Euroopan kansalaisten ja heidän terveytensä suojelemiseksi komissio on velvollinen edistämään varhaista toteamista ja vähentämään tämän taudin testaamisen esteitä.', 'Koska EuroHIVin ja UNAIDSin raporteissa vahvistetaan se, että uusien hi-virustapausten määrä kasvaa hälyttävän nopeasti Euroopan unionissa ja naapurimassa ja että joissakin maissa hi-virustartunnan saaneiden määrän on arvioitu olevan lähes kolminkertainen virallisiin lukuihin verrattuna, olen tyytyväinen tähän ehdotukseen, jossa kehotetaan myös komissiota perustamaan huumeriippuvaisten ja suonensisäisiä huumeita käyttävien hivin/aidsin vähentämistä koskeva strategia. ']"
170, 7. Äänestysselitykset,"  Ilda Figueiredo  (GUE/NGL),  kirjallinen. – (PT) Me haluamme korostaa erityisesti seuraavia päätöslauselman kohtia, joista olemme samaa mieltä: ""kolmansissa maissa tuotettujen, yhteisön markkinoille tuotavien tuotteiden aiheuttama vilpillinen kilpailu"" ja ""mehiläisyhdyskuntien vakava vähenemisuhka siitepöly- ja mesiresurssien voimakkaan vähenemisen seurauksena"". Nämä ongelmat on ratkaistava soveltamalla yhteisön etuuskohtelua ja torjumalla kolmansista maista tuotavien mehiläistuotteiden aiheuttama vilpillinen kilpailu. Mehiläisiä vaivaavia loisia ja tauteja sekä niiden alkuperää koskevaa tutkimusta, johon kuuluu vastuu geenimuunnelluista tuotteista, pitäisi heti tehostaa antamalla sitä varten lisää talousarviomäärärahoja.Yksi päätöslauselmasta puuttuva asia on se, että koko ongelman syynä ovat yhteisen maatalouspolitiikan uudistukset. Maaseudun autioituminen, tuotannon lopettaminen laajoilla alueilla ja geneettisesti muunneltujen lajien käyttöönotto ovat vähentäneet biologista monimuotoisuutta. Samoin on tuettu tuotantomenetelmiä, joissa ei oteta huomioon kunkin alueen maaperän kuntoa ja ilmasto-olosuhteita.Tämän suuntauksen kääntävä maatalouspolitiikka sekä edellä mainitut toimenpiteet auttaisivat mehiläisalan ongelmien ratkaisemisessa huomattavasti. ","Ilda Figueiredo  (GUE/NGL),",3,133,not_available,"['por', 'por', 'por']","['  Ilda Figueiredo  (GUE/NGL),  kirjallinen. – (PT) Me haluamme korostaa erityisesti seuraavia päätöslauselman kohtia, joista olemme samaa mieltä: ""kolmansissa maissa tuotettujen, yhteisön markkinoille tuotavien tuotteiden aiheuttama vilpillinen kilpailu"" ja ""mehiläisyhdyskuntien vakava vähenemisuhka siitepöly- ja mesiresurssien voimakkaan vähenemisen seurauksena"". Nämä ongelmat on ratkaistava soveltamalla yhteisön etuuskohtelua ja torjumalla kolmansista maista tuotavien mehiläistuotteiden aiheuttama vilpillinen kilpailu. Mehiläisiä vaivaavia loisia ja tauteja sekä niiden alkuperää koskevaa tutkimusta, johon kuuluu vastuu geenimuunnelluista tuotteista, pitäisi heti tehostaa antamalla sitä varten lisää talousarviomäärärahoja.', 'Yksi päätöslauselmasta puuttuva asia on se, että koko ongelman syynä ovat yhteisen maatalouspolitiikan uudistukset. Maaseudun autioituminen, tuotannon lopettaminen laajoilla alueilla ja geneettisesti muunneltujen lajien käyttöönotto ovat vähentäneet biologista monimuotoisuutta. Samoin on tuettu tuotantomenetelmiä, joissa ei oteta huomioon kunkin alueen maaperän kuntoa ja ilmasto-olosuhteita.', 'Tämän suuntauksen kääntävä maatalouspolitiikka sekä edellä mainitut toimenpiteet auttaisivat mehiläisalan ongelmien ratkaisemisessa huomattavasti. ']"
171, 7. Äänestysselitykset,"  Christofer Fjellner  (PPE-DE),  kirjallinen. − (SV) Tässä päätöslauselmassa on kyse siitä, että mehiläiset kuolevat selittämättömistä syistä. Olemme samaa mieltä siitä, että tämän ongelman ratkaisemiseen tarvitaan tutkimusta.Olemme kuitenkin eri mieltä siitä, olisiko välttämätöntä antaa mehiläishoitajille lisää tukia ja suojelua ympäröivältä maailmalta (protektionismia). ","Christofer Fjellner  (PPE-DE),",2,42,not_available,"['swe', 'swe']","['  Christofer Fjellner  (PPE-DE),  kirjallinen. − (SV) Tässä päätöslauselmassa on kyse siitä, että mehiläiset kuolevat selittämättömistä syistä. Olemme samaa mieltä siitä, että tämän ongelman ratkaisemiseen tarvitaan tutkimusta.', 'Olemme kuitenkin eri mieltä siitä, olisiko välttämätöntä antaa mehiläishoitajille lisää tukia ja suojelua ympäröivältä maailmalta (protektionismia). ']"
172, 7. Äänestysselitykset,"  Hélène Goudin ja Nils Lundgren  (IND/DEM),  kirjallinen. − (SV) Euroopan parlamentin maatalouden ja maaseudun kehittämisen valiokunnan laatimassa ehdotuksessa on joitakin hyviä ja joitakin huonoja näkökohtia. Kannatamme komission käynnistämää tutkimusta mehiläisiä vaivaavista loisista ja taudeista.Päätöslauselmassa on kuitenkin ehdotuksia, joita emme voi tukea. Esimerkiksi se, että Euroopan parlamentti ""kehottaa komissiota esittämään taloudellista avustusmekanismia mehiläiskuolemien vuoksi vaikeuksissa oleville tiloille"" (11 kohta). Me emme voi tukea mitään tällaisia menoja EU:n talousarvioon, eikä Euroopan parlamentin federalistisen enemmistön pitäisi ilmaista tukeaan tälle tunnustamatta tällaisen kannan taloudellisia seurauksia.Siksi me äänestimme koko päätöslauselmaa vastaan. ","Hélène Goudin ja Nils Lundgren  (IND/DEM),",3,89,not_available,"['swe', 'swe', 'swe']","['  Hélène Goudin ja Nils Lundgren  (IND/DEM),  kirjallinen. − (SV) Euroopan parlamentin maatalouden ja maaseudun kehittämisen valiokunnan laatimassa ehdotuksessa on joitakin hyviä ja joitakin huonoja näkökohtia. Kannatamme komission käynnistämää tutkimusta mehiläisiä vaivaavista loisista ja taudeista.', 'Päätöslauselmassa on kuitenkin ehdotuksia, joita emme voi tukea. Esimerkiksi se, että Euroopan parlamentti ""kehottaa komissiota esittämään taloudellista avustusmekanismia mehiläiskuolemien vuoksi vaikeuksissa oleville tiloille"" (11 kohta). Me emme voi tukea mitään tällaisia menoja EU:n talousarvioon, eikä Euroopan parlamentin federalistisen enemmistön pitäisi ilmaista tukeaan tälle tunnustamatta tällaisen kannan taloudellisia seurauksia.', 'Siksi me äänestimme koko päätöslauselmaa vastaan. ']"
173, 7. Äänestysselitykset,"  Daciana Octavia Sârbu  (PSE),  kirjallinen. – (RO) Mehiläisten ja sen seurauksena pölyttämisen jyrkkä väheneminen vaarantaa hedelmien, vihannesten ja viljan tuotannon Euroopan unionissa. Mehiläisten määrän pudotus johtuu eri loisista ja sienitaudeista, joita on ilmakehässä ja ruiskutettavissa torjunta-aineissa. Suurin ongelma on Varroa spp. -loisten aiheuttama infektio, joka ilmenee epämuodostumina mehiläisten siivissä ja takaruumissa. Kehittymättömät mehiläiset eivät pysty lentämään ja ne ovat hyvin lyhytikäisiä. Jos varroaa ei hoideta, se voi johtaa koko mehiläisyhdyskunnan häviämiseen muutamassa kuukaudessa. Myös torjunta-aineiden pitkäaikainen käyttö on johtanut mehiläisten vähenemiseen, vaikka torjunta-aineita käytettäisiin sienitautien ja loisten tuhoamiseen. Jotkut tutkijat ovat sitä mieltä, että toinen syy tälle ilmiölle on matkapuhelinten lähettämä sähkömagneettinen säteily, joka tunkeutuu mehiläisten suunnistusjärjestelmään ja estää niiden palaamisen pesään. Tämän alueen tutkimusta on kehitettävä, jotta löydetään ratkaisuja mehiläisiä vaivaavien tautien torjuntaan. Lisäksi maanviljelijöiden pyrkimykset vähentää kasvinsuojeluaineiden käyttökertoja kukinta-aikaan auttavat myös pysäyttämään näiden hyönteisten vähenemisen. ","Daciana Octavia Sârbu  (PSE),",1,140,not_available,['rum'],"['  Daciana Octavia Sârbu  (PSE),  kirjallinen. – (RO) Mehiläisten ja sen seurauksena pölyttämisen jyrkkä väheneminen vaarantaa hedelmien, vihannesten ja viljan tuotannon Euroopan unionissa. Mehiläisten määrän pudotus johtuu eri loisista ja sienitaudeista, joita on ilmakehässä ja ruiskutettavissa torjunta-aineissa. Suurin ongelma on Varroa spp. -loisten aiheuttama infektio, joka ilmenee epämuodostumina mehiläisten siivissä ja takaruumissa. Kehittymättömät mehiläiset eivät pysty lentämään ja ne ovat hyvin lyhytikäisiä. Jos varroaa ei hoideta, se voi johtaa koko mehiläisyhdyskunnan häviämiseen muutamassa kuukaudessa. Myös torjunta-aineiden pitkäaikainen käyttö on johtanut mehiläisten vähenemiseen, vaikka torjunta-aineita käytettäisiin sienitautien ja loisten tuhoamiseen. Jotkut tutkijat ovat sitä mieltä, että toinen syy tälle ilmiölle on matkapuhelinten lähettämä sähkömagneettinen säteily, joka tunkeutuu mehiläisten suunnistusjärjestelmään ja estää niiden palaamisen pesään. Tämän alueen tutkimusta on kehitettävä, jotta löydetään ratkaisuja mehiläisiä vaivaavien tautien torjuntaan. Lisäksi maanviljelijöiden pyrkimykset vähentää kasvinsuojeluaineiden käyttökertoja kukinta-aikaan auttavat myös pysäyttämään näiden hyönteisten vähenemisen. ']"
174, 7. Äänestysselitykset,"  Christel Schaldemose  (PSE),  kirjallinen. − (DA) Ole Christensenin, Poul Nyrup Rasmussenin, Dan Jørgensenin, Britta Thomsenin ja Christel Schaldemosen puolesta.Euroopan parlamentin sosiaalidemokraattisen ryhmän tanskalaisten valtuuskunta on äänestänyt mehiläisalan tilannetta koskevaa päätöslauselmaa vastaan. Mielestämme tässä päätöslauselmassa on protektionismin tunnusmerkit ja siinä yritetään luoda lisää tukijärjestelmiä EU:n maanviljelijöille.Olemme sitä mieltä, että mehiläiskuolemat ovat valtava ongelma, joka pitäisi ratkaista EU:n tasolla mutta oikeilla mekanismeilla. Niitä ovat esimerkiksi lisätutkimus ja keskittyminen ekosysteemiemme suojeluun sekä torjunta-aineiden käytön vähentäminen. ","Christel Schaldemose  (PSE),",3,76,not_available,"['dan', 'dan', 'dan']","['  Christel Schaldemose  (PSE),  kirjallinen. − (DA) Ole Christensenin, Poul Nyrup Rasmussenin, Dan Jørgensenin, Britta Thomsenin ja Christel Schaldemosen puolesta.', 'Euroopan parlamentin sosiaalidemokraattisen ryhmän tanskalaisten valtuuskunta on äänestänyt mehiläisalan tilannetta koskevaa päätöslauselmaa vastaan. Mielestämme tässä päätöslauselmassa on protektionismin tunnusmerkit ja siinä yritetään luoda lisää tukijärjestelmiä EU:n maanviljelijöille.', 'Olemme sitä mieltä, että mehiläiskuolemat ovat valtava ongelma, joka pitäisi ratkaista EU:n tasolla mutta oikeilla mekanismeilla. Niitä ovat esimerkiksi lisätutkimus ja keskittyminen ekosysteemiemme suojeluun sekä torjunta-aineiden käytön vähentäminen. ']"
175, 7. Äänestysselitykset,"  Avril Doyle  (PPE-DE),  kirjallinen. − (EN) Äänestin ympäristötarkastuksille asetettavista vähimmäisvaatimuksista annetun suosituksen 2001/331/EY uudelleentarkastelusta annetun päätöslauselman puolesta (B6-0580/2008). Yhteisön ympäristölainsäädännön hyvä ja tasapuolinen täytäntöönpano on olennaisen tärkeää eikä vähempi täytä yleisön odotuksia vaan heikentää yhteisön mainetta tehokkaana ympäristön suojelijana. Jotta lainsäädäntömme olisi uskottavaa, sen täytäntöönpanon on oltava tehokasta. ","Avril Doyle  (PPE-DE),",1,52,not_available,['eng'],"['  Avril Doyle  (PPE-DE),  kirjallinen. − (EN) Äänestin ympäristötarkastuksille asetettavista vähimmäisvaatimuksista annetun suosituksen 2001/331/EY uudelleentarkastelusta annetun päätöslauselman puolesta (B6-0580/2008). Yhteisön ympäristölainsäädännön hyvä ja tasapuolinen täytäntöönpano on olennaisen tärkeää eikä vähempi täytä yleisön odotuksia vaan heikentää yhteisön mainetta tehokkaana ympäristön suojelijana. Jotta lainsäädäntömme olisi uskottavaa, sen täytäntöönpanon on oltava tehokasta. ']"
