,agenda_item,text,speaker,number_p,number_w,chair,language_ps,ps
38, 3. Tilintarkastustuomioistuimen vuosikertomuksen esittely - 2007,"  Vítor Manuel da Silva Caldeira,  tilintarkastustuomioistuimen presidentti. − (EN) Arvoisa puhemies, haluan aluksi kiittää kaikkia kauniista sanoista, jotka koskivat tilintarkastustuomioistuimen työntekijöitä ja kaikkia niitä, jotka ovat olleet mukana luomassa tänä aamuna käsiteltyä kertomusta. Kiitän kaikkien Euroopan tilintarkastustuomioistuimen työntekijöiden puolesta parlamentin jäseniä siitä, että he arvostavat meidän panostamme Euroopan parlamentin tukemisessa perustamissopimuksessa määrätyllä tavalla. Tämä on meidän tehtävämme. Se on meidän roolimme.Panemme tarkasti merkille huomautukset ja ehdotukset, jotka olette osoittaneet tilintarkastustuomioistuimelle. Tilintarkastustuomioistuin pyrkii niiden avulla parantamaan edelleen tapaa, jolla se esittelee tuloksensa ja havaintonsa ja välittää ne teille sekä Euroopan unionin kansalaisille. Pyrimme noudattamaan tiukasti kansainvälisiä tilinpäätösstandardeja kaikilla aloilla sekä ottamaan huomioon muiden tarkastajien eli jäsenvaltioissa toimivien Euroopan unionin varojen tarkastajien työn. Lopuksi haluan sanoa lyhyesti, että aion jatkaa Euroopan parlamentin ja sen talousarvion valvontavaliokunnan tukemista vastuuvapausmenettelyn aikana ja että pyrimme jälleen täysipainoiseen yhteistyöhön kaikkien toimielinten kanssa. Loppujen lopuksi on tärkeää, että työmme tulos, kuten sanoin puheessanikin, viestii siitä, että Euroopan toimielimet ovat vastuullisia ja avoimia ja että Euroopan unioniin voi luottaa. ","Vítor Manuel da Silva Caldeira,",3,161,not_available,"['eng', 'eng', 'eng']","['  Vítor Manuel da Silva Caldeira,  tilintarkastustuomioistuimen presidentti. − (EN) Arvoisa puhemies, haluan aluksi kiittää kaikkia kauniista sanoista, jotka koskivat tilintarkastustuomioistuimen työntekijöitä ja kaikkia niitä, jotka ovat olleet mukana luomassa tänä aamuna käsiteltyä kertomusta. Kiitän kaikkien Euroopan tilintarkastustuomioistuimen työntekijöiden puolesta parlamentin jäseniä siitä, että he arvostavat meidän panostamme Euroopan parlamentin tukemisessa perustamissopimuksessa määrätyllä tavalla. Tämä on meidän tehtävämme. Se on meidän roolimme.', 'Panemme tarkasti merkille huomautukset ja ehdotukset, jotka olette osoittaneet tilintarkastustuomioistuimelle. Tilintarkastustuomioistuin pyrkii niiden avulla parantamaan edelleen tapaa, jolla se esittelee tuloksensa ja havaintonsa ja välittää ne teille sekä Euroopan unionin kansalaisille. Pyrimme noudattamaan tiukasti kansainvälisiä tilinpäätösstandardeja kaikilla aloilla sekä ottamaan huomioon muiden tarkastajien eli jäsenvaltioissa toimivien Euroopan unionin varojen tarkastajien työn. ', 'Lopuksi haluan sanoa lyhyesti, että aion jatkaa Euroopan parlamentin ja sen talousarvion valvontavaliokunnan tukemista vastuuvapausmenettelyn aikana ja että pyrimme jälleen täysipainoiseen yhteistyöhön kaikkien toimielinten kanssa. Loppujen lopuksi on tärkeää, että työmme tulos, kuten sanoin puheessanikin, viestii siitä, että Euroopan toimielimet ovat vastuullisia ja avoimia ja että Euroopan unioniin voi luottaa. ']"
39, 3. Tilintarkastustuomioistuimen vuosikertomuksen esittely - 2007,"  Siim Kallas,  komission varapuheenjohtaja. − (EN) Arvoisa puhemies, on tehty monia huomautuksia. Edessämme on pitkä vastuuvapausmenettely ja keskusteluja, joiden aikana kaikkiin näihin huomautuksiin on määrä antaa vastauksia ja/tai kommentteja.Haluaisin vain esittää huomautuksen yksinkertaistamisesta, joka on otettu esiin useita kertoja. Kaikki sanovat kannattavansa yksinkertaistamista, mutta tosiasiassa taustalla on kaksi eri mielipidettä. Ensimmäinen niistä on, että varojen vastaanottajat haluavat vapaammat kädet, kun taas varojen antajat haluavat selvittää hyvin tarkasti, mihin varat käytetään. Tässä on siis jatkuva ristiriita. Toiseksi olemme aina tähän asti – paria viimeksi kulunutta muutoksen vuotta lukuun ottamatta – olettaneet, että virheiden suhteen vallitsee nollatoleranssi. Sen vuoksi laaditaan sääntöjä, joilla pyritään ehkäisemään virheitä miljoonissa toteutettavissa toimissa. Näin on syntynyt myös jonkinlainen myyttinen käsitys kuuluisasta tarkastuslausumasta, jonka mukaan kaikkien tilien perustana olevissa toimissa on virheitä. Tosiasiassa, kuten tilintarkastustuomioistuimen kertomuksessa sanotaan, 95 prosentissa kaikista menoista ei ole virheitä, paitsi rakennerahastoissa, joissa virhetaso on suurempi. Näin ollen valtaosa varoista on käytetty sääntöjen mukaisesti.Aiomme kuitenkin lähiaikoina käsitellä virheiden nollatoleranssia. Hyväksyttävää riskiä koskeva kysymys on myös tuotu useita kertoja esiin täällä parlamentissa, ja me esitämme lähiaikoina parlamentille tiedonannon tiiviistä keskusteluista, joita käydään parhaillaan komissiossa. Meillä on malleja, jotka osoittavat selvästi, että jos esimerkiksi halutaan nollatoleranssi eli sataprosenttinen virheettömyys, valvontamenettelyjen kustannukset ovat valtavat. Jossakin on olemassa piste, jossa virheet, kustannukset ja riskit kohtaavat. Arvostamme tässä yhteydessä suuresti tilintarkastustuomioistuimen lähestymistapaa. Se on ennen kaikkea esitellyt tällaisen valaisevan ja kvantitatiivista tietoa sisältävän paketin, josta saa entistä paremman yleiskuvan. Sitten huolehdimme siitä – kuten eräs parlamentin jäsen sanoi – että ehkä joillakin aloilla pitäisi olla alhaisempi olennaisuusraja ja joillakin toisilla taas korkeampi. Silloin toimien laillisuuden ja asianmukaisuuden vaatimusta voidaan tulkita järkevämmin. ","Siim Kallas,",3,260,not_available,"['eng', 'eng', 'eng']","['  Siim Kallas,  komission varapuheenjohtaja. − (EN) Arvoisa puhemies, on tehty monia huomautuksia. Edessämme on pitkä vastuuvapausmenettely ja keskusteluja, joiden aikana kaikkiin näihin huomautuksiin on määrä antaa vastauksia ja/tai kommentteja.', 'Haluaisin vain esittää huomautuksen yksinkertaistamisesta, joka on otettu esiin useita kertoja. Kaikki sanovat kannattavansa yksinkertaistamista, mutta tosiasiassa taustalla on kaksi eri mielipidettä. Ensimmäinen niistä on, että varojen vastaanottajat haluavat vapaammat kädet, kun taas varojen antajat haluavat selvittää hyvin tarkasti, mihin varat käytetään. Tässä on siis jatkuva ristiriita. Toiseksi olemme aina tähän asti – paria viimeksi kulunutta muutoksen vuotta lukuun ottamatta – olettaneet, että virheiden suhteen vallitsee nollatoleranssi. Sen vuoksi laaditaan sääntöjä, joilla pyritään ehkäisemään virheitä miljoonissa toteutettavissa toimissa. Näin on syntynyt myös jonkinlainen myyttinen käsitys kuuluisasta tarkastuslausumasta, jonka mukaan kaikkien tilien perustana olevissa toimissa on virheitä. Tosiasiassa, kuten tilintarkastustuomioistuimen kertomuksessa sanotaan, 95 prosentissa kaikista menoista ei ole virheitä, paitsi rakennerahastoissa, joissa virhetaso on suurempi. Näin ollen valtaosa varoista on käytetty sääntöjen mukaisesti.', 'Aiomme kuitenkin lähiaikoina käsitellä virheiden nollatoleranssia. Hyväksyttävää riskiä koskeva kysymys on myös tuotu useita kertoja esiin täällä parlamentissa, ja me esitämme lähiaikoina parlamentille tiedonannon tiiviistä keskusteluista, joita käydään parhaillaan komissiossa. Meillä on malleja, jotka osoittavat selvästi, että jos esimerkiksi halutaan nollatoleranssi eli sataprosenttinen virheettömyys, valvontamenettelyjen kustannukset ovat valtavat. Jossakin on olemassa piste, jossa virheet, kustannukset ja riskit kohtaavat. Arvostamme tässä yhteydessä suuresti tilintarkastustuomioistuimen lähestymistapaa. Se on ennen kaikkea esitellyt tällaisen valaisevan ja kvantitatiivista tietoa sisältävän paketin, josta saa entistä paremman yleiskuvan. Sitten huolehdimme siitä – kuten eräs parlamentin jäsen sanoi – että ehkä joillakin aloilla pitäisi olla alhaisempi olennaisuusraja ja joillakin toisilla taas korkeampi. Silloin toimien laillisuuden ja asianmukaisuuden vaatimusta voidaan tulkita järkevämmin. ']"
40, 3. Tilintarkastustuomioistuimen vuosikertomuksen esittely - 2007,  Puhemies.   − (ES) Keskustelu on päättynyt. ,Puhemies.,1,5,not_available,['spa'],['  Puhemies.   − (ES) Keskustelu on päättynyt. ']
41, 4. Euroopan petostentorjuntaviraston (OLAF) tutkimuksista annetun asetuksen (EY) N:o 1073/1999 muuttaminen (keskustelu) ,  Puhemies.   – (ES) Esityslistalla on seuraavana Ingeborg Gräßlen talousarvion valvontavaliokunnan puolesta laatima mietintö (A6-0394/2008) ehdotuksesta Euroopan parlamentin ja neuvoston asetukseksi Euroopan petostentorjuntaviraston (OLAF) tutkimuksista annetun asetuksen (EY) N:o 1073/1999 muuttamisesta (KOM(2006)0244 – C6-0228/2006 – 2006/0084(COD)). ,Puhemies.,1,42,not_available,['spa'],['  Puhemies.   – (ES) Esityslistalla on seuraavana Ingeborg Gräßlen talousarvion valvontavaliokunnan puolesta laatima mietintö (A6-0394/2008) ehdotuksesta Euroopan parlamentin ja neuvoston asetukseksi Euroopan petostentorjuntaviraston (OLAF) tutkimuksista annetun asetuksen (EY) N:o 1073/1999 muuttamisesta (KOM(2006)0244 – C6-0228/2006 – 2006/0084(COD)). ']
42, 4. Euroopan petostentorjuntaviraston (OLAF) tutkimuksista annetun asetuksen (EY) N:o 1073/1999 muuttaminen (keskustelu) ,"  Ingeborg Gräßle,  esittelijä. – (DE) Arvoisa puhemies, arvoisa komission jäsen, hyvät kollegat, odotus palkitaan. Mietinnön esittelijänä esittelen teille tänään 92 tarkistusta OLAF-asetuksen muuttamiseksi ja pyydän teitä hyväksymään ne. Tämä on petostentorjuntaviraston ensimmäinen uudistus sen perustamisen jälkeen ja vaikuttaa viraston kannalta keskeiseen asiaan eli asetukseen, joka ohjaa OLAFin oleellisia toimintoja.Euroopan parlamentti on antanut itselleen kaksi vuotta aikaa tarkistaa asetusta, koska OLAFin asiat ovat meille aina vaikeaa maaperää. Olen ylpeä siitä, että me Euroopan parlamentissa ja talousarvion valvontavaliokunnassa pääsimme todella yksimielisyyteen ja olemme edelleen yksimielisiä. Me emme ole riidelleet pikkuseikoista emmekä ylipäätään seonneet sanoissamme, kuten neuvosto usein tekee. Olemme samaa mieltä uudistuksen tavoitteesta, joka on tehokkaamman ja tehtävänsä paremmin suorittavan viraston luominen.Me tuemme tätä virastoa. Me haluamme sen jatkavan toimintaansa ja haluamme sen myös pystyvään suorittamaan tehtävänsä. Haluan kiittää kaikkia OLAFin työntekijöitä pääjohtaja mukaan lukien heidän työstään ja vakuuttaa heille, että me tarvitsemme heidän työtään. Haluan myös kiittää kaikkia muita parlamentin jäseniä, varjoesittelijöitä, asiantuntijoita, valiokunnan sihteeristöä ja tietysti myös omia työntekijöitäni, jotka ovat osoittaneet todella sitoutuneensa tähän asiaan. Haluan kiittää teitä kaikkia laajasta tuestanne tälle työlle, koska tämä tuki tarkoittaa parlamentin onnistumista ja on myös välttämätöntä onnistumisen varmistamiseksi.Olemme yhdessä kehittäneet komission jo vanhentunutta luonnostekstiä loogisesti ja parantaneet sitä joillakin todella innovatiivisilla osatekijöillä, kuten valituksia käsittelevällä neuvoa-antavalla tarkastajalla. Näin voimme estää sen, että OLAF lamaantuisi ja muuttuisi toimintakyvyttömäksi sisäisten ristiriitojen vuoksi. Olemme ottaneet ensisijaiseksi tavoitteeksemme jäsenvaltioiden petosten torjuntatavan parantamisen.Hyvät neuvoston jäsenet, jotka loistatte jälleen tänään poissaolollanne, me haluamme pakottaa teidät kiinnittämään tähän huomiota ja me aiomme pakottaa teidät kiinnittämään tähän huomiota. Haluamme, että petosten torjunta on meille yhteinen aihe. Me emme halua käydä yksinpuhelua. Me haluamme käydä vuoropuhelua. Haluamme pitää kerran vuodessa yhteisen kokouksen, jossa keskustellaan tärkeimmistä petostentorjuntaan ja jäsenvaltioiden ongelmiin liittyvistä asioista.Me haluamme parantaa oikeudenkäynteihin osallistuvien oikeudellista suojaa ja taata tämä suoja koko OLAFin suorittaman tutkimuksen ajan. Tämän vuoksi olemme siirtäneet koko vastuun OLAFille, sen tuomareille ja syyttäjille. Me haluamme varmistaa, että OLAFin tutkimusten tulokset pitävät oikeudessa. Me haluamme varmistaa, että kansallinen lainsäädäntö otetaan huomioon tutkimusten alusta lähtien ja että todisteiden hankinnassa noudatetaan kansallista lakia.Meidän mielestämme on erittäin valitettavaa, että jotkin jäsenvaltiot, kuten Luxemburg, eivät koskaan ole vieneet yhtään OLAFin tutkimusta oikeuteen. Luxemburgin kansalaisilla, jotka käyttävät EU:n varoja epärehellisesti, on hyvät mahdollisuudet päästä pälkähästä. Se vaikuttaa tuhoisasti lain kunnioittamiseen, ja siksi kiinnitämme niin paljon huomiota OLAFin tutkimusten kohteeksi joutuneiden tasavertaiseen kohteluun. EU:n virkamiehiä ei pidä kohdella eri tavoin kuin muita kansalaisia, eikä tavallisia kansalaisia pidä kohdella eri tavoin kuin EU:n virkamiehiä.Komission ei kannata edes antaa sellaista vaikutelmaa, että se yrittäisi tehdä niin. Arvoisa komission jäsen, olen tässä asiassa sotajalalla. Tiedän, että hylkäätte tämän kohdan myöhemmin ei-hyväksyttävänä ja vaaditte sitä tiukasti. Mielestäni se on vahinko! Parlamentti ei varmasti aseta teitä kiusaukseen lakaista EU:n työntekijöitä koskevien tutkimusten tulokset komission maton alle.Meidän on nyt vakuutettava neuvosto. Neuvosto ei ole valmis neuvottelemaan kanssamme tästä asetuksesta vaan vaatii sen sijaan yhdistämään OLAFin kolme oikeusperustaa. Se tarkoittaa, että hukkaamme paljon aikaa epävarman tuloksen saamiseksi ja menetämme mahdollisuuden tehdä sen, mikä on tehtävissä nyt, eli parantaa viraston työoloja ja suojella virastoa oikeudenkäynteihin osallistuvia koskevalta arvostelulta.Me haluaisimme, että neuvosto antaisi meidän ottaa ne askeleet, jotka voimme ottaa nyt yhdessä. Sen sijaan, että ottaisimme kolmannen askeleen ennen ensimmäistä, meidän pitäisi aloittaa alusta. Mietinnön esittelijänä ole valmis tekemään puheenjohtajavaltio Tšekin kanssa sopimuksen aikaisesta toisesta käsittelystä. Jos on tahtoa, löytyy myös keino, ja olen varma, että me löydämme yhteisen ratkaisun. ","Ingeborg Gräßle,",10,562,not_available,"['ger', 'ger', 'ger', 'ger', 'ger', 'ger', 'ger', 'ger', 'ger', 'ger']","['  Ingeborg Gräßle,  esittelijä. – (DE) Arvoisa puhemies, arvoisa komission jäsen, hyvät kollegat, odotus palkitaan. Mietinnön esittelijänä esittelen teille tänään 92 tarkistusta OLAF-asetuksen muuttamiseksi ja pyydän teitä hyväksymään ne. Tämä on petostentorjuntaviraston ensimmäinen uudistus sen perustamisen jälkeen ja vaikuttaa viraston kannalta keskeiseen asiaan eli asetukseen, joka ohjaa OLAFin oleellisia toimintoja.', 'Euroopan parlamentti on antanut itselleen kaksi vuotta aikaa tarkistaa asetusta, koska OLAFin asiat ovat meille aina vaikeaa maaperää. Olen ylpeä siitä, että me Euroopan parlamentissa ja talousarvion valvontavaliokunnassa pääsimme todella yksimielisyyteen ja olemme edelleen yksimielisiä. Me emme ole riidelleet pikkuseikoista emmekä ylipäätään seonneet sanoissamme, kuten neuvosto usein tekee. Olemme samaa mieltä uudistuksen tavoitteesta, joka on tehokkaamman ja tehtävänsä paremmin suorittavan viraston luominen.', 'Me tuemme tätä virastoa. Me haluamme sen jatkavan toimintaansa ja haluamme sen myös pystyvään suorittamaan tehtävänsä. Haluan kiittää kaikkia OLAFin työntekijöitä pääjohtaja mukaan lukien heidän työstään ja vakuuttaa heille, että me tarvitsemme heidän työtään. Haluan myös kiittää kaikkia muita parlamentin jäseniä, varjoesittelijöitä, asiantuntijoita, valiokunnan sihteeristöä ja tietysti myös omia työntekijöitäni, jotka ovat osoittaneet todella sitoutuneensa tähän asiaan. Haluan kiittää teitä kaikkia laajasta tuestanne tälle työlle, koska tämä tuki tarkoittaa parlamentin onnistumista ja on myös välttämätöntä onnistumisen varmistamiseksi.', 'Olemme yhdessä kehittäneet komission jo vanhentunutta luonnostekstiä loogisesti ja parantaneet sitä joillakin todella innovatiivisilla osatekijöillä, kuten valituksia käsittelevällä neuvoa-antavalla tarkastajalla. Näin voimme estää sen, että OLAF lamaantuisi ja muuttuisi toimintakyvyttömäksi sisäisten ristiriitojen vuoksi. Olemme ottaneet ensisijaiseksi tavoitteeksemme jäsenvaltioiden petosten torjuntatavan parantamisen.', 'Hyvät neuvoston jäsenet, jotka loistatte jälleen tänään poissaolollanne, me haluamme pakottaa teidät kiinnittämään tähän huomiota ja me aiomme pakottaa teidät kiinnittämään tähän huomiota. Haluamme, että petosten torjunta on meille yhteinen aihe. Me emme halua käydä yksinpuhelua. Me haluamme käydä vuoropuhelua. Haluamme pitää kerran vuodessa yhteisen kokouksen, jossa keskustellaan tärkeimmistä petostentorjuntaan ja jäsenvaltioiden ongelmiin liittyvistä asioista.', 'Me haluamme parantaa oikeudenkäynteihin osallistuvien oikeudellista suojaa ja taata tämä suoja koko OLAFin suorittaman tutkimuksen ajan. Tämän vuoksi olemme siirtäneet koko vastuun OLAFille, sen tuomareille ja syyttäjille. Me haluamme varmistaa, että OLAFin tutkimusten tulokset pitävät oikeudessa. Me haluamme varmistaa, että kansallinen lainsäädäntö otetaan huomioon tutkimusten alusta lähtien ja että todisteiden hankinnassa noudatetaan kansallista lakia.', 'Meidän mielestämme on erittäin valitettavaa, että jotkin jäsenvaltiot, kuten Luxemburg, eivät koskaan ole vieneet yhtään OLAFin tutkimusta oikeuteen. Luxemburgin kansalaisilla, jotka käyttävät EU:n varoja epärehellisesti, on hyvät mahdollisuudet päästä pälkähästä. Se vaikuttaa tuhoisasti lain kunnioittamiseen, ja siksi kiinnitämme niin paljon huomiota OLAFin tutkimusten kohteeksi joutuneiden tasavertaiseen kohteluun. EU:n virkamiehiä ei pidä kohdella eri tavoin kuin muita kansalaisia, eikä tavallisia kansalaisia pidä kohdella eri tavoin kuin EU:n virkamiehiä.', 'Komission ei kannata edes antaa sellaista vaikutelmaa, että se yrittäisi tehdä niin. Arvoisa komission jäsen, olen tässä asiassa sotajalalla. Tiedän, että hylkäätte tämän kohdan myöhemmin ei-hyväksyttävänä ja vaaditte sitä tiukasti. Mielestäni se on vahinko! Parlamentti ei varmasti aseta teitä kiusaukseen lakaista EU:n työntekijöitä koskevien tutkimusten tulokset komission maton alle.', 'Meidän on nyt vakuutettava neuvosto. Neuvosto ei ole valmis neuvottelemaan kanssamme tästä asetuksesta vaan vaatii sen sijaan yhdistämään OLAFin kolme oikeusperustaa. Se tarkoittaa, että hukkaamme paljon aikaa epävarman tuloksen saamiseksi ja menetämme mahdollisuuden tehdä sen, mikä on tehtävissä nyt, eli parantaa viraston työoloja ja suojella virastoa oikeudenkäynteihin osallistuvia koskevalta arvostelulta.', 'Me haluaisimme, että neuvosto antaisi meidän ottaa ne askeleet, jotka voimme ottaa nyt yhdessä. Sen sijaan, että ottaisimme kolmannen askeleen ennen ensimmäistä, meidän pitäisi aloittaa alusta. Mietinnön esittelijänä ole valmis tekemään puheenjohtajavaltio Tšekin kanssa sopimuksen aikaisesta toisesta käsittelystä. Jos on tahtoa, löytyy myös keino, ja olen varma, että me löydämme yhteisen ratkaisun. ']"
