,agenda_item,text,speaker,number_p,number_w,chair,language_ps,ps
83, 6.9. EU ja matkustajarekisteritiedot (äänestys) ,"  Jean-Pierre Jouyet,  neuvoston puheenjohtaja. − (FR) Arvoisa puhemies, arvoisa Euroopan komission varapuheenjohtaja, arvoisat ryhmien puheenjohtajat ja parlamentin jäsenet, puheenvuoroni teille äänestysten aikana on varsin tunnepitoinen.Olen iloinen siitä, että puheenjohtajavaltiona toimivalle Ranskalle on annettu mahdollisuus puhua parlamentille EU:n matkustajarekisteritiedoista. Tämä hanke herättää paljon kysymyksiä, pelkoja ja odotuksia, joita kaikkia kannattaa tarkastella lähemmin.Siihen osallistuu useita julkisia ja yksityisiä tahoja, ja siinä on kyse Euroopan unionin sisäisestä turvallisuudesta, sen perusvapauksien ja -oikeuksien käsitteestä ja tietyistä näkökulmista, jopa sen kansainvälisestä politiikasta.Siksi tähän ohjelmaan tarvitaan järjestelmällinen, yhteinen ja asteittainen lähestymistapa.Olemme kuuden viime kuukauden aikana käyneet avoimia, hyvin perusteltuja keskusteluja tietyistä konkreettisista kysymyksistä. Olemme kuulleet lentomatkailualan yrityksistä, jäsenvaltioiden turvallisuudesta vastaavista laitoksista ja EU:n terrorismin torjunnan koordinaattorista. Olemme toimineet täysin avoimesti tietosuojaviranomaisten kanssa ja minun täytyy sanoa, että Euroopan tietosuojavaltuutetun apu oli äärimmäisen hyödyllistä.Puheenjohtajavaltio Ranska sai perusoikeusvirastolta lausunnon, ja tämä aloite oli ensimmäinen.Samassa avoimuuden hengessä neuvosto esitti toiveensa hyvin tiiviistä yhteistyöstä tämän parlamentin kanssa riippumatta siitä, mikä oikeusperusta tai institutionaalinen kehys on voimassa. Siksi ehdotin tälle parlamentille ohjelmaa koskevien näkemysten vaihtamista mahdollisimman usein. Esittelijänne sai myös epävirallisesti yksityiskohtaisia tietoja työn jokaisessa vaiheessa kuuden viime kuukauden aikana.Ensi viikolla puheenjohtajavaltio esittää oikeus- ja sisäasioiden neuvostolle hyväksyttäväksi kirjallisen edistymiskertomuksen. Lupaan parlamentille, että tämä yhteenveto lähetetään teille.Meidän on pystyttävä käsittelemään keskustelussamme kaikkia ohjelmassa heränneitä kysymyksiä. Niitä on kolmenlaisia.Ensimmäinen on se, että tämä väline on korvaamaton, minkä todistaa esimerkiksi sen käyttö huumeiden torjunnassa. Ranskassa ohjelman ansiosta lentoasemilla pysäytettyjen huumeiden osuus on 60–80 prosenttia. Puolitoista tonnia huumeita vuodessa on selvä todiste, ja mikä on hyödyllistä huumeiden torjunnassa on hyödyllistä myös terrorismin torjunnassa. EU:n terrorismin torjunnan koordinaattorille, joka työskentelee tiiviissä yhteistyössä jäsenvaltioiden asiasta vastaavien laitosten kanssa, tämän ohjelman tiedot ovat selvästi hyödyllisiä lähinnä siksi, että terroristit ovat erityisen haavoittuvia rajanylityspaikoilla.Toinen tärkeä kysymys on, että me tarvitsemme ilmiselvästi oikeuksien ja vapauksien suojelemisen periaatteet, joita on kunnioitettava koko Euroopassa aina tietoja käytettäessä. Näitä tietoja kerätään ja käsitellään nyt hyvin erilaisilla menetelmillä, mikä ei ole Euroopan unionin mittakaavassa riittävää. Tarvitsemme yhdenmukaistetut standardit, ja kaikki hyödytön tai suhteeton on tietysti hylättävä tai siitä on rangaistava.Kolmas tärkeä kysymys on kansainvälistä laatua. Tietyt tahot haluavat kehittää kokonaisvaltaisen politiikan, Amerikan mallille vaihtoehtoisen mallin, ja Euroopan täytyy pystyä edistämään tätä mallia kansainvälisellä tasolla.Euroopan unionilla on valtuudet puuttua yhteiseen maailmanlaajuiseen toimintaan, jotta se voi vaikuttaa tapaan, jolla näitä tietoja ja ohjelmia käytetään ja säädellään. Siinä on vaikutusvallan lisäksi kysymys myös arvojemme kunnioittamisesta. Meidän lentoyhtiömme ja kansalaisemme pyytävät meitä tekemään tämän, jotta liian moninaisten kansallisten vaatimusten aiheuttamat rajoitukset vähenisivät.Arvoisa puhemies, valiokunnan puheenjohtajat ja parlamentin jäsenet, sitä meidän on pohdittava yhdessä.(Suosionosoituksia) ","Jean-Pierre Jouyet,",15,424,not_available,"['fra', 'fra', 'fra', 'fra', 'fra', 'fra', 'fra', 'fra', 'fra', 'fra', 'fra', 'fra', 'fra', 'fra', 'fra']","['  Jean-Pierre Jouyet,  neuvoston puheenjohtaja. − (FR) Arvoisa puhemies, arvoisa Euroopan komission varapuheenjohtaja, arvoisat ryhmien puheenjohtajat ja parlamentin jäsenet, puheenvuoroni teille äänestysten aikana on varsin tunnepitoinen.', 'Olen iloinen siitä, että puheenjohtajavaltiona toimivalle Ranskalle on annettu mahdollisuus puhua parlamentille EU:n matkustajarekisteritiedoista. Tämä hanke herättää paljon kysymyksiä, pelkoja ja odotuksia, joita kaikkia kannattaa tarkastella lähemmin.', 'Siihen osallistuu useita julkisia ja yksityisiä tahoja, ja siinä on kyse Euroopan unionin sisäisestä turvallisuudesta, sen perusvapauksien ja -oikeuksien käsitteestä ja tietyistä näkökulmista, jopa sen kansainvälisestä politiikasta.', 'Siksi tähän ohjelmaan tarvitaan järjestelmällinen, yhteinen ja asteittainen lähestymistapa.', 'Olemme kuuden viime kuukauden aikana käyneet avoimia, hyvin perusteltuja keskusteluja tietyistä konkreettisista kysymyksistä. Olemme kuulleet lentomatkailualan yrityksistä, jäsenvaltioiden turvallisuudesta vastaavista laitoksista ja EU:n terrorismin torjunnan koordinaattorista. Olemme toimineet täysin avoimesti tietosuojaviranomaisten kanssa ja minun täytyy sanoa, että Euroopan tietosuojavaltuutetun apu oli äärimmäisen hyödyllistä.', 'Puheenjohtajavaltio Ranska sai perusoikeusvirastolta lausunnon, ja tämä aloite oli ensimmäinen.', 'Samassa avoimuuden hengessä neuvosto esitti toiveensa hyvin tiiviistä yhteistyöstä tämän parlamentin kanssa riippumatta siitä, mikä oikeusperusta tai institutionaalinen kehys on voimassa. Siksi ehdotin tälle parlamentille ohjelmaa koskevien näkemysten vaihtamista mahdollisimman usein. Esittelijänne sai myös epävirallisesti yksityiskohtaisia tietoja työn jokaisessa vaiheessa kuuden viime kuukauden aikana.', 'Ensi viikolla puheenjohtajavaltio esittää oikeus- ja sisäasioiden neuvostolle hyväksyttäväksi kirjallisen edistymiskertomuksen. Lupaan parlamentille, että tämä yhteenveto lähetetään teille.', 'Meidän on pystyttävä käsittelemään keskustelussamme kaikkia ohjelmassa heränneitä kysymyksiä. Niitä on kolmenlaisia.', 'Ensimmäinen on se, että tämä väline on korvaamaton, minkä todistaa esimerkiksi sen käyttö huumeiden torjunnassa. Ranskassa ohjelman ansiosta lentoasemilla pysäytettyjen huumeiden osuus on 60–80 prosenttia. Puolitoista tonnia huumeita vuodessa on selvä todiste, ja mikä on hyödyllistä huumeiden torjunnassa on hyödyllistä myös terrorismin torjunnassa. EU:n terrorismin torjunnan koordinaattorille, joka työskentelee tiiviissä yhteistyössä jäsenvaltioiden asiasta vastaavien laitosten kanssa, tämän ohjelman tiedot ovat selvästi hyödyllisiä lähinnä siksi, että terroristit ovat erityisen haavoittuvia rajanylityspaikoilla.', 'Toinen tärkeä kysymys on, että me tarvitsemme ilmiselvästi oikeuksien ja vapauksien suojelemisen periaatteet, joita on kunnioitettava koko Euroopassa aina tietoja käytettäessä. Näitä tietoja kerätään ja käsitellään nyt hyvin erilaisilla menetelmillä, mikä ei ole Euroopan unionin mittakaavassa riittävää. Tarvitsemme yhdenmukaistetut standardit, ja kaikki hyödytön tai suhteeton on tietysti hylättävä tai siitä on rangaistava.', 'Kolmas tärkeä kysymys on kansainvälistä laatua. Tietyt tahot haluavat kehittää kokonaisvaltaisen politiikan, Amerikan mallille vaihtoehtoisen mallin, ja Euroopan täytyy pystyä edistämään tätä mallia kansainvälisellä tasolla.', 'Euroopan unionilla on valtuudet puuttua yhteiseen maailmanlaajuiseen toimintaan, jotta se voi vaikuttaa tapaan, jolla näitä tietoja ja ohjelmia käytetään ja säädellään. Siinä on vaikutusvallan lisäksi kysymys myös arvojemme kunnioittamisesta. Meidän lentoyhtiömme ja kansalaisemme pyytävät meitä tekemään tämän, jotta liian moninaisten kansallisten vaatimusten aiheuttamat rajoitukset vähenisivät.', 'Arvoisa puhemies, valiokunnan puheenjohtajat ja parlamentin jäsenet, sitä meidän on pohdittava yhdessä.', '(Suosionosoituksia) ']"
84, 6.9. EU ja matkustajarekisteritiedot (äänestys) ,"  Sophia in 't Veld  (ALDE).  – (EN) Arvoisa puhemies, puhun hyvin lyhyesti. Kiitän neuvostoa lausunnosta. Haluaisin – myös muiden ryhmien varjoesittelijöiden puolesta – sanoa, että Euroopan parlamentti on vakavasti otettava kumppani ja täysin valmis osallistumaan tähän prosessiin. Me ilmaisemme kuitenkin virallisen kantamme vasta sitten, kun kaikkiin Euroopan parlamentin, Euroopan tietosuojavaltuutetun, kansallisten tietosuojaviranomaisten, perusoikeusvirastojen ja lentoyhtiöiden esittämiin kysymyksiin ja vastalauseisiin on annettu täydelliset, tyydyttävät ja yksityiskohtaiset vastaukset, koska ne kaikki ovat oikeutettuja asianmukaiseen vastaukseen.Neuvosto on usein luvannut sitoutua Lissabonin sopimuksen uudistuksiin. Näiden uudistusten puuttuessa pyydän neuvostoa toimimaan Lissabonin sopimuksen hengen mukaisesti ja noudattamaan tämän parlamentin suosituksia tai selittämään asian ei niinkään Euroopan parlamentille vaan EU:n kansalaisille.Kahdeksan vuotta Nizzan jälkeen näiden poliisi- ja oikeusalan yhteistyöhön liittyvistä asioista päätetään valitettavasti edelleen suljettujen ovien takana ilman merkittävää demokraattista valvontaa. Siksi toivon, että jäsenvaltiot osoittaisivat samaa määrätietoisuutta, rohkeutta ja päättäväisyyttä demokraattisissa uudistuksissa, niin kuin ne tekivät talouskriisissä.Lopuksi vetoan kollegoihini, että he tukisivat tätä päätöslauselmaa ja antaisivat neuvostolle selvän poliittisen viestin.(Suosionosoituksia) ",Sophia in 't Veld  (ALDE).,5,157,not_available,"['eng', 'eng', 'eng', 'eng', 'eng']","[""  Sophia in 't Veld  (ALDE).  – (EN) Arvoisa puhemies, puhun hyvin lyhyesti. Kiitän neuvostoa lausunnosta. Haluaisin – myös muiden ryhmien varjoesittelijöiden puolesta – sanoa, että Euroopan parlamentti on vakavasti otettava kumppani ja täysin valmis osallistumaan tähän prosessiin. Me ilmaisemme kuitenkin virallisen kantamme vasta sitten, kun kaikkiin Euroopan parlamentin, Euroopan tietosuojavaltuutetun, kansallisten tietosuojaviranomaisten, perusoikeusvirastojen ja lentoyhtiöiden esittämiin kysymyksiin ja vastalauseisiin on annettu täydelliset, tyydyttävät ja yksityiskohtaiset vastaukset, koska ne kaikki ovat oikeutettuja asianmukaiseen vastaukseen."", 'Neuvosto on usein luvannut sitoutua Lissabonin sopimuksen uudistuksiin. Näiden uudistusten puuttuessa pyydän neuvostoa toimimaan Lissabonin sopimuksen hengen mukaisesti ja noudattamaan tämän parlamentin suosituksia tai selittämään asian ei niinkään Euroopan parlamentille vaan EU:n kansalaisille.', 'Kahdeksan vuotta Nizzan jälkeen näiden poliisi- ja oikeusalan yhteistyöhön liittyvistä asioista päätetään valitettavasti edelleen suljettujen ovien takana ilman merkittävää demokraattista valvontaa. Siksi toivon, että jäsenvaltiot osoittaisivat samaa määrätietoisuutta, rohkeutta ja päättäväisyyttä demokraattisissa uudistuksissa, niin kuin ne tekivät talouskriisissä.', 'Lopuksi vetoan kollegoihini, että he tukisivat tätä päätöslauselmaa ja antaisivat neuvostolle selvän poliittisen viestin.', '(Suosionosoituksia) ']"
85, 6.9. EU ja matkustajarekisteritiedot (äänestys) ,"  Daniel Cohn-Bendit  (Verts/ALE). -  (FR) Arvoisa puhemies, koska ministeri Jouyet on poistumassa, parlamentin pitäisi mielestäni kiittää häntä. Hän on ollut yksi uutterimmista tuntemistamme ministereistä. Toivotan hänelle onnea.(Kovaäänisiä suosionosoituksia) ",Daniel Cohn-Bendit  (Verts/ALE). -,2,30,not_available,"['fra', 'fra']","['  Daniel Cohn-Bendit  (Verts/ALE). -  (FR) Arvoisa puhemies, koska ministeri Jouyet on poistumassa, parlamentin pitäisi mielestäni kiittää häntä. Hän on ollut yksi uutterimmista tuntemistamme ministereistä. Toivotan hänelle onnea.', '(Kovaäänisiä suosionosoituksia) ']"
86, 6.9. EU ja matkustajarekisteritiedot (äänestys) ,"  Puhemies. −  (EN) Kiitos paljon, jäsen Cohn-Bendit. Ollaanpa sitä hyvällä tuulella tänään! ",Puhemies. −,1,12,not_available,['eng'],"['  Puhemies. −  (EN) Kiitos paljon, jäsen Cohn-Bendit. Ollaanpa sitä hyvällä tuulella tänään! ']"
87, 6.11. EU:n reagointi Kongon demokraattisen tasavallan itäosan pahenevaan tilanteeseen (äänestys) ,– Ennen tarkistuksesta 1 toimitettua äänestystä: ,unknown,1,5,not_available,['fin'],['– Ennen tarkistuksesta 1 toimitettua äänestystä: ']
88, 6.11. EU:n reagointi Kongon demokraattisen tasavallan itäosan pahenevaan tilanteeseen (äänestys) ,"  Pasqualina Napoletano  (PSE). -  (IT) Arvoisa puhemies, hyvät kollegat, poliittiset ryhmät ovat käsittääkseni samaa mieltä sanan ""erikois"" poistamisesta puhuttaessa unionin erikoisjoukoista. Siispä: poistetaan sana ""erikois"".",Pasqualina Napoletano  (PSE). -,1,24,not_available,['ita'],"['  Pasqualina Napoletano  (PSE). -  (IT) Arvoisa puhemies, hyvät kollegat, poliittiset ryhmät ovat käsittääkseni samaa mieltä sanan ""erikois"" poistamisesta puhuttaessa unionin erikoisjoukoista. Siispä: poistetaan sana ""erikois"".']"
89, 7. Äänestysselitykset,Suulliset äänestysselitykset,Suulliset äänestysselitykset,1,2,not_available,['fin'],['Suulliset äänestysselitykset']
90, 7. Äänestysselitykset,"  Astrid Lulling  (PPE-DE). -  (FR) Arvoisa puhemies, työllisyyden ja sosiaaliasioiden valiokunta yrittää epätoivoisesti kyseenalaistaa naisten oikeuksien ja sukupuolten tasa-arvon valiokunnan toimivallan, kun on kyse miesten ja naisten tasa-arvosta työpaikalla. Se on kaapannut aloitteemme mietinnön laatimisesta palkkaerojen ja muiden eriarvoisuuksien syrjivistä vaikutuksista naisten eläkkeisiin ja suuntauksesta kohti sosiaaliturvan yksilöllistämisestä.Tuloksena on sekava mietintö, jossa yhdistetään yleisesti tunnettuja yleiskäsityksiä. Se on kaukana naisten epätasa-arvoista kohtelua eläkeasioissa ja parannuskeinoista koskevista kysymyksistä, joihin naisten oikeuksien ja sukupuolten tasa-arvon valiokunta halusi keskittyä mietinnössään. Naisten oikeuksien valiokunnan lausunnon valmistelijana työjärjestyksen 47 artiklan mukaisesti yritin naisten oikeuksien valiokunnan yksimielisellä tuella tehdä parhaani tiettyjen korjausten ehdottamiseksi eläkejärjestelmäuudistuksen yhteydessä. Lausunnossa on kuusi hyvin tarkkaa korjausta, joiden tarkoituksena on täyttää naisten vakuutuksissa esimerkiksi äitiyden tai perhesitoumusten vuoksi olevat aukot.Voitteko uskoa, että työllisyyden valiokunta nimenomaan hylkäsi ne, mikä on räikeästi ristiriidassa työjärjestyksen 47 artiklan velvollisuuksien kanssa? Olen pahoillani, että me hävisimme yhden taistelun, mutta sota ja meidän kamppailumme jatkuu. ",Astrid Lulling  (PPE-DE). -,3,153,not_available,"['fra', 'fra', 'fra']","['  Astrid Lulling  (PPE-DE). -  (FR) Arvoisa puhemies, työllisyyden ja sosiaaliasioiden valiokunta yrittää epätoivoisesti kyseenalaistaa naisten oikeuksien ja sukupuolten tasa-arvon valiokunnan toimivallan, kun on kyse miesten ja naisten tasa-arvosta työpaikalla. Se on kaapannut aloitteemme mietinnön laatimisesta palkkaerojen ja muiden eriarvoisuuksien syrjivistä vaikutuksista naisten eläkkeisiin ja suuntauksesta kohti sosiaaliturvan yksilöllistämisestä.', 'Tuloksena on sekava mietintö, jossa yhdistetään yleisesti tunnettuja yleiskäsityksiä. Se on kaukana naisten epätasa-arvoista kohtelua eläkeasioissa ja parannuskeinoista koskevista kysymyksistä, joihin naisten oikeuksien ja sukupuolten tasa-arvon valiokunta halusi keskittyä mietinnössään. Naisten oikeuksien valiokunnan lausunnon valmistelijana työjärjestyksen 47 artiklan mukaisesti yritin naisten oikeuksien valiokunnan yksimielisellä tuella tehdä parhaani tiettyjen korjausten ehdottamiseksi eläkejärjestelmäuudistuksen yhteydessä. Lausunnossa on kuusi hyvin tarkkaa korjausta, joiden tarkoituksena on täyttää naisten vakuutuksissa esimerkiksi äitiyden tai perhesitoumusten vuoksi olevat aukot.', 'Voitteko uskoa, että työllisyyden valiokunta nimenomaan hylkäsi ne, mikä on räikeästi ristiriidassa työjärjestyksen 47 artiklan velvollisuuksien kanssa? Olen pahoillani, että me hävisimme yhden taistelun, mutta sota ja meidän kamppailumme jatkuu. ']"
91, 7. Äänestysselitykset,"  Philip Claeys  (NI). -  (NL) Arvoisa puhemies, äänestin Klamtin mietintöä vastaan siitä yksinkertaisesta syystä, että koko taloudellisista syistä tapahtuvan maahanmuuton käsite ja se, josta käytetään nimitystä ""sininen kortti"", ovat todisteita lyhyen tähtäimen ajattelusta. Meidän pitäisi sen sijaan soveltaa politiikkaa, joka tähtää koulutukseen, uudelleenkoulutukseen ja Euroopan unionissa tällä hetkellä olevien noin 20 miljoonan työttömän saamiseen takaisin töihin. Meidän pitäisi sen sijaan ottaa oppia aiemmista virheistämme. Malliesimerkki on vierastyöläisten ja heidän perheidensä maahantuonti 1970- ja 1980-luvuilla, mistä sukeutui suuri sosiaalinen ongelma.He yrittävät nyt rauhoittaa ihmisiä lupaamalla, että tämä koskee vain korkeasti päteviä ja väliaikaisia maahanmuuttajia, mutta mikä minä olen epäilemään Louis Michelin puhetta, kun hän sanoo, että myös muut maahanmuuttajat olisivat yhä tervetulleita. Tulvaportit pysyvät siis auki. He eivät tee muuta kuin perustavat uuden. Tässä on kyse yhteiskunnan vastaisesta liittoutumasta. Isot yritykset haluavat halpaa työvoimaa ja yhdistävät voimansa monikulttuurisen vasemmiston kanssa, ja yhteiskunta saa maksaa laskun. ",Philip Claeys  (NI). -,2,145,not_available,"['dut', 'dut']","['  Philip Claeys  (NI). -  (NL) Arvoisa puhemies, äänestin Klamtin mietintöä vastaan siitä yksinkertaisesta syystä, että koko taloudellisista syistä tapahtuvan maahanmuuton käsite ja se, josta käytetään nimitystä ""sininen kortti"", ovat todisteita lyhyen tähtäimen ajattelusta. Meidän pitäisi sen sijaan soveltaa politiikkaa, joka tähtää koulutukseen, uudelleenkoulutukseen ja Euroopan unionissa tällä hetkellä olevien noin 20 miljoonan työttömän saamiseen takaisin töihin. Meidän pitäisi sen sijaan ottaa oppia aiemmista virheistämme. Malliesimerkki on vierastyöläisten ja heidän perheidensä maahantuonti 1970- ja 1980-luvuilla, mistä sukeutui suuri sosiaalinen ongelma.', 'He yrittävät nyt rauhoittaa ihmisiä lupaamalla, että tämä koskee vain korkeasti päteviä ja väliaikaisia maahanmuuttajia, mutta mikä minä olen epäilemään Louis Michelin puhetta, kun hän sanoo, että myös muut maahanmuuttajat olisivat yhä tervetulleita. Tulvaportit pysyvät siis auki. He eivät tee muuta kuin perustavat uuden. Tässä on kyse yhteiskunnan vastaisesta liittoutumasta. Isot yritykset haluavat halpaa työvoimaa ja yhdistävät voimansa monikulttuurisen vasemmiston kanssa, ja yhteiskunta saa maksaa laskun. ']"
92, 7. Äänestysselitykset,"  Astrid Lulling  (PPE-DE). -  (FR) Arvoisa puhemies, äänestin Parishin viinin yhteisen markkinajärjestelyn yhdentämistä koskevan mietinnön puolesta raskain mielin, koska mielestäni yhteinen markkinajärjestely ei tarkoita yksinkertaistamista eikä lisää avoimuutta. Se tekee viininkasvattajien ja koko viinialan elämästä monimutkaisempaa.Komission jäsen yritti saada meidät eilen illalla vakuuttuneiksi asiasta. Toivon, että komissio pitää sanansa ja, mikä vielä tärkeämpää, että ammattiala on edelleen asianmukaisesti edustettuna neuvoa-antavassa komiteassa, kuten se on ollut ensimmäisestä viinin yhteisestä markkinajärjestelystä lähtien. ",Astrid Lulling  (PPE-DE). -,2,72,not_available,"['fra', 'fra']","['  Astrid Lulling  (PPE-DE). -  (FR) Arvoisa puhemies, äänestin Parishin viinin yhteisen markkinajärjestelyn yhdentämistä koskevan mietinnön puolesta raskain mielin, koska mielestäni yhteinen markkinajärjestely ei tarkoita yksinkertaistamista eikä lisää avoimuutta. Se tekee viininkasvattajien ja koko viinialan elämästä monimutkaisempaa.', 'Komission jäsen yritti saada meidät eilen illalla vakuuttuneiksi asiasta. Toivon, että komissio pitää sanansa ja, mikä vielä tärkeämpää, että ammattiala on edelleen asianmukaisesti edustettuna neuvoa-antavassa komiteassa, kuten se on ollut ensimmäisestä viinin yhteisestä markkinajärjestelystä lähtien. ']"
93, 7. Äänestysselitykset,"  Anja Weisgerber  (PPE-DE).   – (DE) Arvoisa puhemies, äänestin tänään aamupäivällä hieman epäröiden Neil Parishin yhteisen markkinajärjestelyn luomista laajalle erilaisten maataloustuotteiden valikoimalle koskevan mietinnön puolesta. Olen tyytyväinen komission tavoitteeseen yksinkertaistaa EU:n maatalouspolitiikkaa. Se tarkoittaa, että tulevaisuudessa on vain yksi markkinajärjestely, joka korvaa 21 nykyistä, esimerkiksi hedelmiä, vihanneksia, maitoa ja viiniä koskevaa markkinajärjestelyä. Tuloksena olevaan erittäin monimutkaiseen asiakirjaan liittyvää hallintoa on kuitenkin yksinkertaistettava mahdollisimman paljon. Siksi olen hyvin tyytyväinen siihen, että komissio vakuutti eilisessä keskustelussa, että se hyväksyy ajatukseni ja sisällyttää EU:n EUR-Lex-hakukoneeseen toiminnon, jonka avulla käyttäjät voivat hakea vain ne artiklat, jotka liittyvät johonkin tiettyyn maataloustuotteeseen.Komissio on myös vahvistanut, että viinin markkinajärjestely, josta käytiin melko hankalat neuvottelut ja joka sisältää monia parlamentin vaatimuksia, säilyy muuttumattomana. Vain siitä syystä pystyin äänestämään mietinnön puolesta. ",Anja Weisgerber  (PPE-DE).,2,126,not_available,"['ger', 'ger']","['  Anja Weisgerber  (PPE-DE).   – (DE) Arvoisa puhemies, äänestin tänään aamupäivällä hieman epäröiden Neil Parishin yhteisen markkinajärjestelyn luomista laajalle erilaisten maataloustuotteiden valikoimalle koskevan mietinnön puolesta. Olen tyytyväinen komission tavoitteeseen yksinkertaistaa EU:n maatalouspolitiikkaa. Se tarkoittaa, että tulevaisuudessa on vain yksi markkinajärjestely, joka korvaa 21 nykyistä, esimerkiksi hedelmiä, vihanneksia, maitoa ja viiniä koskevaa markkinajärjestelyä. Tuloksena olevaan erittäin monimutkaiseen asiakirjaan liittyvää hallintoa on kuitenkin yksinkertaistettava mahdollisimman paljon. Siksi olen hyvin tyytyväinen siihen, että komissio vakuutti eilisessä keskustelussa, että se hyväksyy ajatukseni ja sisällyttää EU:n EUR-Lex-hakukoneeseen toiminnon, jonka avulla käyttäjät voivat hakea vain ne artiklat, jotka liittyvät johonkin tiettyyn maataloustuotteeseen.', 'Komissio on myös vahvistanut, että viinin markkinajärjestely, josta käytiin melko hankalat neuvottelut ja joka sisältää monia parlamentin vaatimuksia, säilyy muuttumattomana. Vain siitä syystä pystyin äänestämään mietinnön puolesta. ']"
94, 7. Äänestysselitykset,"  Milan Gaľa  (PPE-DE).  – (SK) Olen iloinen siitä, että me käsittelemme tätä maailmanlaajuista ongelmaa muutama päivä ennen 1. joulukuuta vietettävää maailman aids-päivää. Hiv-tartunnan saaneiden määrä on kasvussa. Tällä hetkellä tartunnan saaneita on 14 000, joista 2 000 on alle 15-vuotiaita lapsia.Tavallisten ongelmapaikkojen, kuten Afrikan ja Lähi-idän, lisäksi tartunnan saaneiden määrä on kasvanut Itä-Euroopassa ja Keski-Aasiassa. Vuonna 2006 tartunnan saaneiden määrä näillä alueilla nousi 1,7 miljoonaan. Suurin lisäys kirjattiin Venäjällä ja Ukrainassa, missä HIV-tartunnan sai noin 270 000 ihmistä. HIV:n leviäminen näillä alueilla johtuu pääosin huumeidenkäytöstä ja likaisista neuloista. Ukrainan tapauksessa luvut ovat vieläkin hälyttävämpiä, koska on kyse Euroopan unionin rajanaapurista.Koska HIV-ongelmaa ei ole onnistuttu saamaan hallintaan maailmanlaajuisista ehkäisyohjelmista huolimatta, ohjelmat pitäisi arvioida uudelleen ja tehostaa ehkäisytoimenpiteitä ja tehokkaiden hoitojen kehittämistä. ",Milan Gaľa  (PPE-DE).,3,132,not_available,"['slo', 'slo', 'slo']","['  Milan Gaľa  (PPE-DE).  – (SK) Olen iloinen siitä, että me käsittelemme tätä maailmanlaajuista ongelmaa muutama päivä ennen 1. joulukuuta vietettävää maailman aids-päivää. Hiv-tartunnan saaneiden määrä on kasvussa. Tällä hetkellä tartunnan saaneita on 14 000, joista 2 000 on alle 15-vuotiaita lapsia.', 'Tavallisten ongelmapaikkojen, kuten Afrikan ja Lähi-idän, lisäksi tartunnan saaneiden määrä on kasvanut Itä-Euroopassa ja Keski-Aasiassa. Vuonna 2006 tartunnan saaneiden määrä näillä alueilla nousi 1,7 miljoonaan. Suurin lisäys kirjattiin Venäjällä ja Ukrainassa, missä HIV-tartunnan sai noin 270 000 ihmistä. HIV:n leviäminen näillä alueilla johtuu pääosin huumeidenkäytöstä ja likaisista neuloista. Ukrainan tapauksessa luvut ovat vieläkin hälyttävämpiä, koska on kyse Euroopan unionin rajanaapurista.', 'Koska HIV-ongelmaa ei ole onnistuttu saamaan hallintaan maailmanlaajuisista ehkäisyohjelmista huolimatta, ohjelmat pitäisi arvioida uudelleen ja tehostaa ehkäisytoimenpiteitä ja tehokkaiden hoitojen kehittämistä. ']"
