,agenda_item,text,speaker,number_p,number_w,chair,language_ps,ps
0, 1. Istunnon avaaminen,Puhetta johti  varapuhemies Alejo VIDAL-QUADRAS,Puhetta johti,1,6,not_available,['fin'],['Puhetta johti  varapuhemies Alejo VIDAL-QUADRAS']
1, 6. Kolmansien maiden ammattilaisten kanssa toteutettava audiovisuaalialan MEDIA Mundus -yhteistyöohjelma (keskustelu) ,  Puhemies.   – (ES) Esityslistalla on seuraavana Ruth Hieronymin kulttuuri- ja koulutusvaliokunnan puolesta laatima mietintö (A6-0260/2009) ehdotuksesta Euroopan parlamentin ja neuvoston päätökseksi kolmansien maiden ammattilaisten kanssa toteutettavan audiovisuaalialan MEDIA Mundus yhteistyöohjelman perustamisesta (KOM(2008)0892 – C6-0011/2009 – 2008/0258(COD)) ,Puhemies.,1,41,not_available,['spa'],['  Puhemies.   – (ES) Esityslistalla on seuraavana Ruth Hieronymin kulttuuri- ja koulutusvaliokunnan puolesta laatima mietintö (A6-0260/2009) ehdotuksesta Euroopan parlamentin ja neuvoston päätökseksi kolmansien maiden ammattilaisten kanssa toteutettavan audiovisuaalialan MEDIA Mundus yhteistyöohjelman perustamisesta (KOM(2008)0892 – C6-0011/2009 – 2008/0258(COD)) ']
2, 6. Kolmansien maiden ammattilaisten kanssa toteutettava audiovisuaalialan MEDIA Mundus -yhteistyöohjelma (keskustelu) ,"  Ruth Hieronymi,  esittelijä. − (DE) Arvoisa puhemies, arvoisa komission jäsen, hyvät parlamentin jäsenet, olen erityisen iloinen siitä, että olemme onnistuneet laatimaan ja hyväksymään eurooppalaiselle elokuvalle uuden tukiohjelman, Euroopan unionin ja maailmanlaajuisen kulttuurin ja talouden hyväksi, näin lyhyessä ajassa – vain kuudessa kuukaudessa – ja ennen tämän vaalikauden loppua.Tämä oli mahdollista ainoastaan poikkeuksellisen hyvän yhteistyön ansiosta, mistä haluaisin ilmaista lämpimimmät kiitokseni. Paljon kiitoksia komission jäsenelle. Komission ehdotus MEDIA Mundus -ohjelman perustamiseksi oli erinomainen. Yhteistyö Tšekin puheenjohtajakaudella oli erinomaista ja yhteistyö kulttuuri- ja koulutusvaliokunnan kanssa oli kaikkein parasta. Vain tämän ansiosta oli mahdollista saavuttaa päämäärämme näinkin lyhyessä ajassa.Eurooppalaisten elokuvien myynninedistäminen MEDIA-ohjelman kautta on ollut hyvin menestyksekästä Euroopan unionissa jo noin 15 vuoden ajan. MEDIA-ohjelma on tukenut 90 prosenttia kaikista eurooppalaisista elokuvista, joita on esitetty niiden valmistusmaan ulkopuolella. Tähän asti ohjelma on kuitenkin tukenut hankkeita ainoastaan Euroopan sisällä, eikä tämä edistämisohjelma ole enää riittävä markkinoiden kansainvälistymisen ja uusien teknologioiden aikana.Kansainvälistyminen tuo uusia mahdollisuuksia mutta myös uusia haasteita. MEDIA Mundus -ohjelma, josta tänään keskustelemme, on upea vastaus. Se on vastaus niihin mahdollisuuksiin, joita uudet Euroopan ulkopuoliset markkinat tarjoavat Euroopan elokuvateollisuudelle. Se on myös vastaus tarpeeseen ja mahdollisuuksiin käyttää elokuvien myynninedistämistä ja elokuvia itsessään kulttuurienvälisen vuoropuhelun tukemiseen ja eteenpäin viemiseen.Sen vuoksi haluaisinkin ilmaista kiitokseni MEDIA Mundus -pilottihankkeiden käynnistämisestä. Niille varattiin seitsemän miljoonaa euroa, ja kävi ilmi, että kysyntä oli suunnaton. Pilottihankkeet tukivat koulutusta, markkinointia ja jakelua kansainvälisissä verkostoissa, ja erityisesti esiin nousevat audiovisuaaliset markkinat maista kuten Intia, Brasilia, Etelä-Korea ja Kanada ovat esittäneet merkittäviä hankkeita.Tämä huomioon ottaen puollamme mielellämme tätä ehdotusta kulttuuri- ja koulutusvaliokunnan äänellä. Haluaisin pyytää koko parlamenttia äänestämään tämän ohjelman puolesta, jotta sitä tuettaisiin sopivalla rahoitussummalla tulevina vuosina ja jotta saavuttaisimme päämäärämme ja tukisimme eurooppalaisten elokuvien myynninedistämistä toimien näin kulttuuriarvojemme lähettiläinä maailmalla.Tämä on viimeinen puheeni Euroopan parlamentissa. Tunnen olevani hyvin onnekas, koska olen voinut saattaa tämän ohjelman loppuun teidän tukenne avulla, ja haluaisin antaa oman viestini eteenpäin vietäväksi. Ottakaa huomioon tulevissa töissänne, että Euroopan kulttuurihyödykkeiden ei tulisi olla pelkästään taloudellisia, vaan niiden tulee pysyä sekä kulttuurisina että taloudellisina hyödykkeinä.Haluaisin erityisesti kiittää kaikkia kollegojani kulttuuri- ja koulutusvaliokunnassa, sihteeristöissä ja teitä, arvoisa komission jäsen, sekä teidän pääjohtajaanne, Gregory Paulgeria, joka piti peräsintä, kymmenen vuoden erinomaisesta yhteistyöstä audiovisuaalialalla. Paljon kiitoksia. ","Ruth Hieronymi,",8,361,not_available,"['ger', 'ger', 'ger', 'ger', 'ger', 'ger', 'ger', 'ger']","['  Ruth Hieronymi,  esittelijä. − (DE) Arvoisa puhemies, arvoisa komission jäsen, hyvät parlamentin jäsenet, olen erityisen iloinen siitä, että olemme onnistuneet laatimaan ja hyväksymään eurooppalaiselle elokuvalle uuden tukiohjelman, Euroopan unionin ja maailmanlaajuisen kulttuurin ja talouden hyväksi, näin lyhyessä ajassa – vain kuudessa kuukaudessa – ja ennen tämän vaalikauden loppua.', 'Tämä oli mahdollista ainoastaan poikkeuksellisen hyvän yhteistyön ansiosta, mistä haluaisin ilmaista lämpimimmät kiitokseni. Paljon kiitoksia komission jäsenelle. Komission ehdotus MEDIA Mundus -ohjelman perustamiseksi oli erinomainen. Yhteistyö Tšekin puheenjohtajakaudella oli erinomaista ja yhteistyö kulttuuri- ja koulutusvaliokunnan kanssa oli kaikkein parasta. Vain tämän ansiosta oli mahdollista saavuttaa päämäärämme näinkin lyhyessä ajassa.', 'Eurooppalaisten elokuvien myynninedistäminen MEDIA-ohjelman kautta on ollut hyvin menestyksekästä Euroopan unionissa jo noin 15 vuoden ajan. MEDIA-ohjelma on tukenut 90 prosenttia kaikista eurooppalaisista elokuvista, joita on esitetty niiden valmistusmaan ulkopuolella. Tähän asti ohjelma on kuitenkin tukenut hankkeita ainoastaan Euroopan sisällä, eikä tämä edistämisohjelma ole enää riittävä markkinoiden kansainvälistymisen ja uusien teknologioiden aikana.', 'Kansainvälistyminen tuo uusia mahdollisuuksia mutta myös uusia haasteita. MEDIA Mundus -ohjelma, josta tänään keskustelemme, on upea vastaus. Se on vastaus niihin mahdollisuuksiin, joita uudet Euroopan ulkopuoliset markkinat tarjoavat Euroopan elokuvateollisuudelle. Se on myös vastaus tarpeeseen ja mahdollisuuksiin käyttää elokuvien myynninedistämistä ja elokuvia itsessään kulttuurienvälisen vuoropuhelun tukemiseen ja eteenpäin viemiseen.', 'Sen vuoksi haluaisinkin ilmaista kiitokseni MEDIA Mundus -pilottihankkeiden käynnistämisestä. Niille varattiin seitsemän miljoonaa euroa, ja kävi ilmi, että kysyntä oli suunnaton. Pilottihankkeet tukivat koulutusta, markkinointia ja jakelua kansainvälisissä verkostoissa, ja erityisesti esiin nousevat audiovisuaaliset markkinat maista kuten Intia, Brasilia, Etelä-Korea ja Kanada ovat esittäneet merkittäviä hankkeita.', 'Tämä huomioon ottaen puollamme mielellämme tätä ehdotusta kulttuuri- ja koulutusvaliokunnan äänellä. Haluaisin pyytää koko parlamenttia äänestämään tämän ohjelman puolesta, jotta sitä tuettaisiin sopivalla rahoitussummalla tulevina vuosina ja jotta saavuttaisimme päämäärämme ja tukisimme eurooppalaisten elokuvien myynninedistämistä toimien näin kulttuuriarvojemme lähettiläinä maailmalla.', 'Tämä on viimeinen puheeni Euroopan parlamentissa. Tunnen olevani hyvin onnekas, koska olen voinut saattaa tämän ohjelman loppuun teidän tukenne avulla, ja haluaisin antaa oman viestini eteenpäin vietäväksi. Ottakaa huomioon tulevissa töissänne, että Euroopan kulttuurihyödykkeiden ei tulisi olla pelkästään taloudellisia, vaan niiden tulee pysyä sekä kulttuurisina että taloudellisina hyödykkeinä.', 'Haluaisin erityisesti kiittää kaikkia kollegojani kulttuuri- ja koulutusvaliokunnassa, sihteeristöissä ja teitä, arvoisa komission jäsen, sekä teidän pääjohtajaanne, Gregory Paulgeria, joka piti peräsintä, kymmenen vuoden erinomaisesta yhteistyöstä audiovisuaalialalla. Paljon kiitoksia. ']"
3, 6. Kolmansien maiden ammattilaisten kanssa toteutettava audiovisuaalialan MEDIA Mundus -yhteistyöohjelma (keskustelu) ,"  Viviane Reding,  komission jäsen. − (EN) Arvoisa puhemies, olen täysin samaa mieltä siitä, mitä Ruth Hieronymi sanoi. Nuo kymmenen vuotta, jotka työskentelimme yhdessä hänen kanssaan ja muiden kulttuuri- ja koulutusvaliokunnan jäsenten kanssa, olivat hyvin tehokkaita ja henkilökohtaisesta näkökulmasta katsottuna hyvin hedelmällisiä. Joten kiitos teille kaikille, puolueeseen katsomatta, jotka olette tehneet todella kovasti töitä sen eteen, että kulttuuri tulisi tärkeämmäksi ja että se voisi puhutella ihmisiä.Olen hyvin iloinen siitä, että parlamentti ehdotti mietintöön selvennyksiä ja yksinkertaistuksia, jotka paransivat käsiteltäväksi jättämääni ehdotusta.Kuten tiedätte, MEDIA International -valmistelutoimi on ollut MEDIA Munduksen kehittämisen perustana, ja tässä asiayhteydessä olen myös kiitollinen parlamentille siitä, että he myönsivät kaksi miljoonaa euroa vuonna 2008 ja viisi miljoonaa euroa vuonna 2009 valmistelutoimen rahoittamiseksi.MEDIA Mundus käynnistyy vuonna 2011 ja se jatkaa siitä, mihin MEDIA International jäi. Sen tavoitteena on vahvistaa kulttuurisia ja kaupallisia suhteita eurooppalaisten ja muun maailman elokuvateollisuuden ammattilaisten välillä. Ajatus MEDIA Munduksen takana on uudenlainen, kunnianhimoinen ja innovatiivinen, koska se edistää yhteistyötä ammattilaisten välillä, mitä eurooppalaiset ohjelmat eivät ole yleensä tehneet. Lisäksi, poiketen olemassa olevista ohjelmista, sen perustana on molemminpuolinen etu eri osa-alueilla, ei ainoastaan meidän elokuvantekijöillemme, vaan myös kolmansien maiden elokuvantekijöille. Ensimmäinen osa-alue on koulutus sisältäen koulutettavia ja kouluttajia Euroopasta ja kolmansista maista. Se helpottaa pääsyä kolmansien maiden markkinoille ja rakentaa luottamusta ja pitkäaikaisia kaupallisia suhteita; tämä on luonnollista. Kun on istuttu yhdessä koulussa opiskellen elokuva-alaa jonkun aasialaisen, afrikkalaisen tai amerikkalaisen kanssa, on selvää, että myöhemmin ammattielämässä halutaan työskennellä yhdessä.Tämä on myös yksi syy sille, miksi tuemme foorumien järjestämistä kansainvälisille yhteistuotannoille. Koulutamme heidät yhdessä ja sen jälkeen odotamme heidän alkavan työskennellä yhdessä. Joten kansainvälisille yhteistuotannoille tarvitaan foorumeita.Sen jälkeen meidän täytyy kehittää eurooppalaisten audiovisuaalisten taiteiden jakelua, levitystä ja näkyvyyttä kolmansissa maissa. Euroopassa asuville kolmansista maista tulleille ihmisille se tarkoittaa aina tilannetta, jossa kaikki voittavat. Tässä on erittäin hyvä esimerkki Euroopasta, joka ei ole linnake vaan avoin Eurooppa; Eurooppa, joka antaa, joka ottaa, joka jakaa.Meidän tulee lisätä kulttuurisesti monimuotoisen audiovisuaalisen sisällön yleistä kysyntää, mikä on hyvin tärkeää, joten meidän täytyy saada nuoret, nuori yleisö ennen kaikkea, katsomaan eurooppalaisia elokuvia.Olen vakuuttunut siitä, että MEDIA Mundus lisää kuluttajien valinnanvaraa niin, että ihmiset saavat mahdollisuuden katsoa eurooppalaisia elokuvia. Tämä lisää kulttuurista monimuotoisuutta Euroopan markkinoilla tuomalla Eurooppaan enemmän laatuelokuvia Euroopan ulkopuolisilta, pienemmiltä markkinoilta, ja se antaa eurooppalaisille elokuville mahdollisuuden menestyä kansainvälisillä markkinoilla. Joten se luo uusia liiketoiminnan mahdollisuuksia Euroopan ja koko maailman ammattilaisille. Tällä on tietysti hyvin tärkeä taloudellinen vaikutus. Kyse on kilpailukyvystä, mutta ennen kaikkea kyse on kulttuurisesta monimuotoisuudesta – meidän kulttuurisesta monimuotoisuudestamme – joka on arvokkain hyödykkeemme, ja muissa maanosissa asuvien kulttuurisesta monimuotoisuudesta, joka on heidän tärkein hyödykkeensä. Näiden jakaminen on suurenmoinen mahdollisuus, jota MEDIA Mundus vahvistaa. ","Viviane Reding,",8,433,not_available,"['eng', 'eng', 'eng', 'eng', 'eng', 'eng', 'eng', 'eng']","['  Viviane Reding,  komission jäsen. − (EN) Arvoisa puhemies, olen täysin samaa mieltä siitä, mitä Ruth Hieronymi sanoi. Nuo kymmenen vuotta, jotka työskentelimme yhdessä hänen kanssaan ja muiden kulttuuri- ja koulutusvaliokunnan jäsenten kanssa, olivat hyvin tehokkaita ja henkilökohtaisesta näkökulmasta katsottuna hyvin hedelmällisiä. Joten kiitos teille kaikille, puolueeseen katsomatta, jotka olette tehneet todella kovasti töitä sen eteen, että kulttuuri tulisi tärkeämmäksi ja että se voisi puhutella ihmisiä.', 'Olen hyvin iloinen siitä, että parlamentti ehdotti mietintöön selvennyksiä ja yksinkertaistuksia, jotka paransivat käsiteltäväksi jättämääni ehdotusta.', 'Kuten tiedätte, MEDIA International -valmistelutoimi on ollut MEDIA Munduksen kehittämisen perustana, ja tässä asiayhteydessä olen myös kiitollinen parlamentille siitä, että he myönsivät kaksi miljoonaa euroa vuonna 2008 ja viisi miljoonaa euroa vuonna 2009 valmistelutoimen rahoittamiseksi.', 'MEDIA Mundus käynnistyy vuonna 2011 ja se jatkaa siitä, mihin MEDIA International jäi. Sen tavoitteena on vahvistaa kulttuurisia ja kaupallisia suhteita eurooppalaisten ja muun maailman elokuvateollisuuden ammattilaisten välillä. Ajatus MEDIA Munduksen takana on uudenlainen, kunnianhimoinen ja innovatiivinen, koska se edistää yhteistyötä ammattilaisten välillä, mitä eurooppalaiset ohjelmat eivät ole yleensä tehneet. Lisäksi, poiketen olemassa olevista ohjelmista, sen perustana on molemminpuolinen etu eri osa-alueilla, ei ainoastaan meidän elokuvantekijöillemme, vaan myös kolmansien maiden elokuvantekijöille. Ensimmäinen osa-alue on koulutus sisältäen koulutettavia ja kouluttajia Euroopasta ja kolmansista maista. Se helpottaa pääsyä kolmansien maiden markkinoille ja rakentaa luottamusta ja pitkäaikaisia kaupallisia suhteita; tämä on luonnollista. Kun on istuttu yhdessä koulussa opiskellen elokuva-alaa jonkun aasialaisen, afrikkalaisen tai amerikkalaisen kanssa, on selvää, että myöhemmin ammattielämässä halutaan työskennellä yhdessä.', 'Tämä on myös yksi syy sille, miksi tuemme foorumien järjestämistä kansainvälisille yhteistuotannoille. Koulutamme heidät yhdessä ja sen jälkeen odotamme heidän alkavan työskennellä yhdessä. Joten kansainvälisille yhteistuotannoille tarvitaan foorumeita.', 'Sen jälkeen meidän täytyy kehittää eurooppalaisten audiovisuaalisten taiteiden jakelua, levitystä ja näkyvyyttä kolmansissa maissa. Euroopassa asuville kolmansista maista tulleille ihmisille se tarkoittaa aina tilannetta, jossa kaikki voittavat. Tässä on erittäin hyvä esimerkki Euroopasta, joka ei ole linnake vaan avoin Eurooppa; Eurooppa, joka antaa, joka ottaa, joka jakaa.', 'Meidän tulee lisätä kulttuurisesti monimuotoisen audiovisuaalisen sisällön yleistä kysyntää, mikä on hyvin tärkeää, joten meidän täytyy saada nuoret, nuori yleisö ennen kaikkea, katsomaan eurooppalaisia elokuvia.', 'Olen vakuuttunut siitä, että MEDIA Mundus lisää kuluttajien valinnanvaraa niin, että ihmiset saavat mahdollisuuden katsoa eurooppalaisia elokuvia. Tämä lisää kulttuurista monimuotoisuutta Euroopan markkinoilla tuomalla Eurooppaan enemmän laatuelokuvia Euroopan ulkopuolisilta, pienemmiltä markkinoilta, ja se antaa eurooppalaisille elokuville mahdollisuuden menestyä kansainvälisillä markkinoilla. Joten se luo uusia liiketoiminnan mahdollisuuksia Euroopan ja koko maailman ammattilaisille. Tällä on tietysti hyvin tärkeä taloudellinen vaikutus. Kyse on kilpailukyvystä, mutta ennen kaikkea kyse on kulttuurisesta monimuotoisuudesta – meidän kulttuurisesta monimuotoisuudestamme – joka on arvokkain hyödykkeemme, ja muissa maanosissa asuvien kulttuurisesta monimuotoisuudesta, joka on heidän tärkein hyödykkeensä. Näiden jakaminen on suurenmoinen mahdollisuus, jota MEDIA Mundus vahvistaa. ']"
4, 6. Kolmansien maiden ammattilaisten kanssa toteutettava audiovisuaalialan MEDIA Mundus -yhteistyöohjelma (keskustelu) ,"  Doris Pack,  PPE-DE-ryhmän puolesta. – (DE)Arvoisa puhemies, arvoisa komission jäsen, hyvä Ruth Hieronymi, MEDIA Mundus -ohjelma on hanke, joka perustuu meidän valiokunnastamme, kulttuuri- ja koulutusvaliokunnasta lähtöisin olevaan ajatukseen. Siellä se niin sanoakseni näki päivänvalon. Ennen kaikkea me annoimme hankkeelle vankan kannatuksemme, ja tietysti siinä näkyy tunnusmerkkejä, ei ainoastaan komission jäsenen vaikutuksesta, vaan myös Ruth Hieronymin, jota me kaikki kulttuuri- ja koulutusvaliokunnassa tuimme mielellämme.Olemme oppineet huomattavan paljon Erasmus Mundus -hankkeesta, joka avasi ovet opiskelijoillemme, jotka halusivat lähteä kolmansiin maihin opiskelemaan ja päinvastoin. Maailman kansainvälistyessä tämä on itse asiassa välttämätöntä, ja MEDIA Mundus kulkee samaan suuntaan elokuvantekijöiden suhteen. Se on hieno esimerkki siitä, miten tällä alalla voidaan järjestää kulttuurienvälistä vuoropuhelua, millä on tietysti myös kaupallinen puolensa mutta mikä on myös, ja ennen kaikkea, kulttuurista vuoropuhelua.MEDIA Mundus myös tukee ja toteuttaa Unescon yleissopimusta, joka edistää kulttuurista monimuotoisuutta Euroopassa ja ympäri maailmaa, edistää vuoropuhelua ja yrittää löytää tasapainon taloudellisesti kannattavien ja säästäväisten pyrkimysten välille.MEDIA Mundus -ohjelman avulla vahvistamme luonnollisesti elokuviemme, elokuvantekijöidemme ja opiskelijoidemme liikkuvuutta, ja lopulta tapahtuu se, mitä Wim Wenders muistuttaa meitä tekemään, eli annamme Euroopalle uudet kasvot, teemme eurooppalaisesta unelmasta todellisuutta. Amerikkalainen unelma on välittynyt meille elokuvien kautta jo vuosikymmenien ajan, ja näin tapahtuu yhä tänäkin päivänä. Jos menemme lopulta niin pitkälle, että viemme eurooppalaisen unelman maailmalle yhteistyössä kolmansien maiden kanssa kuvien kautta, olemme tehneet paljon enemmän Euroopan unionin vakauttamiseksi, kuin mitä olisimme monilla muilla tavoilla voineet tehdä.Jos työskentelemme yhdessä tämän päivän kansainvälistyneessä maailmassa, pystymme jossain määrin ajamaan amerikkalaisia taaksepäin maailman markkinoilla ja kuvaamaan omaa unelmaamme hieman paremmin. Olen varma, että kolmannet maat antavat meille tukensa, ehkä Etelä-Korea tai Etelä-Amerikan maat, joita haluamme itse asiassa auttaa antamalla niiden pienimuotoisille tuotannoille enemmän näkyvyyttä Euroopan markkinoilla.Kaiken kaikkiaan tämä hanke auttaa kaikkia osapuolia. Se auttaa kolmansia maita ja eurooppalaista elokuvateollisuutta. Oli jo korkea aika, että tämä tapahtui. MEDIA Mundus on mielestäni soveltuva vastaus yleismaailmallisiin teknisiin ja sosioekonomisiin haasteisiin. Haluaisin lopettaa sanomalla: ""Mikä edistää monimuotoisuuttamme, vahvistaa identiteettiämme"".  ","Doris Pack,",6,320,not_available,"['ger', 'ger', 'ger', 'ger', 'ger', 'ger']","['  Doris Pack,  PPE-DE-ryhmän puolesta. – (DE)Arvoisa puhemies, arvoisa komission jäsen, hyvä Ruth Hieronymi, MEDIA Mundus -ohjelma on hanke, joka perustuu meidän valiokunnastamme, kulttuuri- ja koulutusvaliokunnasta lähtöisin olevaan ajatukseen. Siellä se niin sanoakseni näki päivänvalon. Ennen kaikkea me annoimme hankkeelle vankan kannatuksemme, ja tietysti siinä näkyy tunnusmerkkejä, ei ainoastaan komission jäsenen vaikutuksesta, vaan myös Ruth Hieronymin, jota me kaikki kulttuuri- ja koulutusvaliokunnassa tuimme mielellämme.', 'Olemme oppineet huomattavan paljon Erasmus Mundus -hankkeesta, joka avasi ovet opiskelijoillemme, jotka halusivat lähteä kolmansiin maihin opiskelemaan ja päinvastoin. Maailman kansainvälistyessä tämä on itse asiassa välttämätöntä, ja MEDIA Mundus kulkee samaan suuntaan elokuvantekijöiden suhteen. Se on hieno esimerkki siitä, miten tällä alalla voidaan järjestää kulttuurienvälistä vuoropuhelua, millä on tietysti myös kaupallinen puolensa mutta mikä on myös, ja ennen kaikkea, kulttuurista vuoropuhelua.', 'MEDIA Mundus myös tukee ja toteuttaa Unescon yleissopimusta, joka edistää kulttuurista monimuotoisuutta Euroopassa ja ympäri maailmaa, edistää vuoropuhelua ja yrittää löytää tasapainon taloudellisesti kannattavien ja säästäväisten pyrkimysten välille.', 'MEDIA Mundus -ohjelman avulla vahvistamme luonnollisesti elokuviemme, elokuvantekijöidemme ja opiskelijoidemme liikkuvuutta, ja lopulta tapahtuu se, mitä Wim Wenders muistuttaa meitä tekemään, eli annamme Euroopalle uudet kasvot, teemme eurooppalaisesta unelmasta todellisuutta. Amerikkalainen unelma on välittynyt meille elokuvien kautta jo vuosikymmenien ajan, ja näin tapahtuu yhä tänäkin päivänä. Jos menemme lopulta niin pitkälle, että viemme eurooppalaisen unelman maailmalle yhteistyössä kolmansien maiden kanssa kuvien kautta, olemme tehneet paljon enemmän Euroopan unionin vakauttamiseksi, kuin mitä olisimme monilla muilla tavoilla voineet tehdä.', 'Jos työskentelemme yhdessä tämän päivän kansainvälistyneessä maailmassa, pystymme jossain määrin ajamaan amerikkalaisia taaksepäin maailman markkinoilla ja kuvaamaan omaa unelmaamme hieman paremmin. Olen varma, että kolmannet maat antavat meille tukensa, ehkä Etelä-Korea tai Etelä-Amerikan maat, joita haluamme itse asiassa auttaa antamalla niiden pienimuotoisille tuotannoille enemmän näkyvyyttä Euroopan markkinoilla.', 'Kaiken kaikkiaan tämä hanke auttaa kaikkia osapuolia. Se auttaa kolmansia maita ja eurooppalaista elokuvateollisuutta. Oli jo korkea aika, että tämä tapahtui. MEDIA Mundus on mielestäni soveltuva vastaus yleismaailmallisiin teknisiin ja sosioekonomisiin haasteisiin. Haluaisin lopettaa sanomalla: ""Mikä edistää monimuotoisuuttamme, vahvistaa identiteettiämme"".  ']"
