,agenda_item,text,speaker,number_p,number_w,chair,language_ps,ps
160, 10. Äänestysselitykset,"  Martin Callanan  (PPE-DE),  kirjallinen. − (EN) Rikosoikeus on aivan oikein EU:n jäsenvaltioiden vastuulla. Voin hyväksyä sen, että jäsenvaltioiden on tehtävä yhteistyötä rikosoikeuteen liittyvissä rajatylittävissä asioissa, mutta en hyväksy EU:n rikosoikeudellisen alueen kehittämistä. EU:n niin kutsutun toimivallan laajentaminen rikosoikeuteen olisi tarpeeton tunkeutuminen Yhdistyneen kuningaskunnan itsemääräämisoikeuteen, mitä on mahdotonta hyväksyä. Alueeni Koillis-Englannin ihmiset haluavat, että Yhdistyneen kuningaskunnan parlamentin jäsenet ovat vastuussa rikosoikeudesta ja että Yhdistyneen kuningaskunnan tuomarit soveltavat sitä.Se, että EU pyrkii laajentamaan valtuuksiaan tähän mennessä yksinomaan jäsenvaltioille varatuille aloille, osoittaa EU:n todellisen päämäärän: luoda federalistinen supervaltio. Alueeni ihmiset eivät halua sen tapahtuvan. He torjuvat sopimuksen mukaisen viisauden koko ajan tiiviimmästä unionista ja haluavat löyhemmän ja joustavamman hallitustenvälisen yhteistyön järjestelmän. Toivon, että uusi ryhmä, johon Yhdistyneen kuningaskunnan konservatiivit ensi parlamentissa kuuluvat, pystyy saamaan aikaan sen, mitä useimmat britit Euroopasta haluavat. ","Martin Callanan  (PPE-DE),",2,134,not_available,"['eng', 'eng']","['  Martin Callanan  (PPE-DE),  kirjallinen. − (EN) Rikosoikeus on aivan oikein EU:n jäsenvaltioiden vastuulla. Voin hyväksyä sen, että jäsenvaltioiden on tehtävä yhteistyötä rikosoikeuteen liittyvissä rajatylittävissä asioissa, mutta en hyväksy EU:n rikosoikeudellisen alueen kehittämistä. EU:n niin kutsutun toimivallan laajentaminen rikosoikeuteen olisi tarpeeton tunkeutuminen Yhdistyneen kuningaskunnan itsemääräämisoikeuteen, mitä on mahdotonta hyväksyä. Alueeni Koillis-Englannin ihmiset haluavat, että Yhdistyneen kuningaskunnan parlamentin jäsenet ovat vastuussa rikosoikeudesta ja että Yhdistyneen kuningaskunnan tuomarit soveltavat sitä.', 'Se, että EU pyrkii laajentamaan valtuuksiaan tähän mennessä yksinomaan jäsenvaltioille varatuille aloille, osoittaa EU:n todellisen päämäärän: luoda federalistinen supervaltio. Alueeni ihmiset eivät halua sen tapahtuvan. He torjuvat sopimuksen mukaisen viisauden koko ajan tiiviimmästä unionista ja haluavat löyhemmän ja joustavamman hallitustenvälisen yhteistyön järjestelmän. Toivon, että uusi ryhmä, johon Yhdistyneen kuningaskunnan konservatiivit ensi parlamentissa kuuluvat, pystyy saamaan aikaan sen, mitä useimmat britit Euroopasta haluavat. ']"
161, 10. Äänestysselitykset,"  Carl Lang  (NI),  kirjallinen. − (FR) Mafiajärjestöjen ja yleisesti järjestäytyneen rikollisuuden torjumisen varjolla Brysselin eurokraatit haluavat tyrkyttää yhä enemmän federalistisia näkemyksiään, joilla tuhotaan kansakunnat, kansat ja identiteetit.Vaikka kaikki todellakin tietävät, että jokaisella EU:n jäsenvaltiolla on omat lakinsa, oikeusperinteensä ja säännöstönsä, nämä fanaattiset eurofederalistit hyökkäävät jälleen kerran halullaan luoda ""eurooppalainen oikeuskulttuuri"".Tämän kulttuurin luomiseksi pitäisi perustaa tuomareita, syyttäjiä, puolustusasianajajia ja muita oikeudenkäyttöön osallistuvia henkilöitä varten Euroopan oikeusalan oppilaitos.Entä kansalliset oikeusalan oppilaitokset? Entä ylittämättömät erot tapaoikeudesta ja kirjoitetusta lainsäädännöstä johdettujen lainsäädäntöjen välillä?Vastauksia ei tietenkään anneta.Käytännössä koko jäsenvaltioiden oikeus- ja rangaistusjärjestelmät katoavat tämän pakotetun yhtenäistämisen – alaspäin menevän yhtenäistämisen – myötä.Nämä Euroopan noidan oppipojat eivät ole ymmärtäneet yhtä asiaa; vain kansallisvaltiot, Euroopan tärkeimmät osat, voivat rikastaa sitä ja palauttaa sen oikeaan asemaansa maailmassa.EU:ta ei pidä rakentaa sen maiden ja kansojen kustannuksella. ","Carl Lang  (NI),",8,133,not_available,"['fra', 'fra', 'fra', 'fra', 'fra', 'fra', 'fra', 'fra']","['  Carl Lang  (NI),  kirjallinen. − (FR) Mafiajärjestöjen ja yleisesti järjestäytyneen rikollisuuden torjumisen varjolla Brysselin eurokraatit haluavat tyrkyttää yhä enemmän federalistisia näkemyksiään, joilla tuhotaan kansakunnat, kansat ja identiteetit.', 'Vaikka kaikki todellakin tietävät, että jokaisella EU:n jäsenvaltiolla on omat lakinsa, oikeusperinteensä ja säännöstönsä, nämä fanaattiset eurofederalistit hyökkäävät jälleen kerran halullaan luoda ""eurooppalainen oikeuskulttuuri"".', 'Tämän kulttuurin luomiseksi pitäisi perustaa tuomareita, syyttäjiä, puolustusasianajajia ja muita oikeudenkäyttöön osallistuvia henkilöitä varten Euroopan oikeusalan oppilaitos.', 'Entä kansalliset oikeusalan oppilaitokset? Entä ylittämättömät erot tapaoikeudesta ja kirjoitetusta lainsäädännöstä johdettujen lainsäädäntöjen välillä?', 'Vastauksia ei tietenkään anneta.', 'Käytännössä koko jäsenvaltioiden oikeus- ja rangaistusjärjestelmät katoavat tämän pakotetun yhtenäistämisen – alaspäin menevän yhtenäistämisen – myötä.', 'Nämä Euroopan noidan oppipojat eivät ole ymmärtäneet yhtä asiaa; vain kansallisvaltiot, Euroopan tärkeimmät osat, voivat rikastaa sitä ja palauttaa sen oikeaan asemaansa maailmassa.', 'EU:ta ei pidä rakentaa sen maiden ja kansojen kustannuksella. ']"
162, 10. Äänestysselitykset,"  Jan Andersson, Göran Färm, Inger Segelström ja Åsa Westlund  (PSE),  kirjallinen. − (SV) Parlamentti äänesti tänään Lissabonin sopimuksen vaikutuksesta Euroopan unionin institutionaalisen tasapainon kehittymiseen laaditusta mietinnöstä. Mietinnössä ehdotetaan, että uudet jäsenet, joita Ruotsi ja muut jäsenvaltiot saavat, jos Lissabonin sopimus tulee voimaan, valitaan jo tulevissa Euroopan parlamentin vaaleissa, ja että heille annetaan parlamentissa tarkkailijan asema. Mietinnössä myös ehdotetaan, että komission uuden puheenjohtajan nimittäminen tehdään Lissabonin sopimuksen mukaisesti. Se tarkoittaa, että puheenjohtajan valinnassa pitäisi näkyä Euroopan parlamentin poliittinen enemmistö ja että neuvoston ja parlamentin poliittisten ryhmien pitäisi keskustella ennen ehdokkaan valintaa.Olemme päättäneet äänestää tämän mietinnön puolesta, koska Euroopan parlamentin on valmistauduttava siihen, että se pystyy panemaan täytäntöön muutokset, jotka sen työssä tapahtuvat, jos Lissabonin sopimus tulee voimaan. Ääniemme perusteella ei kuitenkaan missään nimessä pitäisi päätellä, että teemme tyhjäksi yksittäisten jäsenvaltioiden ratifiointiprosessin. Kunnioitamme täysimääräisesti kaikkien jäsenvaltioiden oikeutta päättää itse, ratifioivatko ne Lissabonin sopimuksen. ","Jan Andersson, Göran Färm, Inger Segelström ja Åsa Westlund  (PSE),",2,141,not_available,"['swe', 'swe']","['  Jan Andersson, Göran Färm, Inger Segelström ja Åsa Westlund  (PSE),  kirjallinen. − (SV) Parlamentti äänesti tänään Lissabonin sopimuksen vaikutuksesta Euroopan unionin institutionaalisen tasapainon kehittymiseen laaditusta mietinnöstä. Mietinnössä ehdotetaan, että uudet jäsenet, joita Ruotsi ja muut jäsenvaltiot saavat, jos Lissabonin sopimus tulee voimaan, valitaan jo tulevissa Euroopan parlamentin vaaleissa, ja että heille annetaan parlamentissa tarkkailijan asema. Mietinnössä myös ehdotetaan, että komission uuden puheenjohtajan nimittäminen tehdään Lissabonin sopimuksen mukaisesti. Se tarkoittaa, että puheenjohtajan valinnassa pitäisi näkyä Euroopan parlamentin poliittinen enemmistö ja että neuvoston ja parlamentin poliittisten ryhmien pitäisi keskustella ennen ehdokkaan valintaa.', 'Olemme päättäneet äänestää tämän mietinnön puolesta, koska Euroopan parlamentin on valmistauduttava siihen, että se pystyy panemaan täytäntöön muutokset, jotka sen työssä tapahtuvat, jos Lissabonin sopimus tulee voimaan. Ääniemme perusteella ei kuitenkaan missään nimessä pitäisi päätellä, että teemme tyhjäksi yksittäisten jäsenvaltioiden ratifiointiprosessin. Kunnioitamme täysimääräisesti kaikkien jäsenvaltioiden oikeutta päättää itse, ratifioivatko ne Lissabonin sopimuksen. ']"
163, 10. Äänestysselitykset,"  Edite Estrela  (PSE),  kirjallinen. (SV) Äänestin Lissabonin sopimuksen vaikutuksesta Euroopan unionin institutionaalisen tasapainon kehittymiseen laaditun mietinnön puolesta. Tässä mietinnössä tarkastellaan Lissabonin sopimuksen vaikutusta EU:n institutionaalisen tasapainon kehitykseen. Siinä korostetaan uusien säännösten täytäntöönpanon ja ensimmäisten nimitysten tekemisen merkitystä.Lissabonin sopimuksen mahdollinen voimaantulo vuoden 2009 loppuun mennessä edellyttää neuvoston ja Euroopan parlamentin välistä poliittista sopimusta, jotta voidaan varmistaa, että komission seuraavan puheenjohtajan valintaa ja tulevan komission nimitystä koskevassa menettelyssä kunnioitetaan joka tapauksessa uusia valtuuksia, joita Lissabonin sopimuksella tässä asiassa annetaan Euroopan parlamentille.Sen tuloksena mietinnössä esitetään monia suosituksia, joilla pyritään kehittämään institutionaalista tasapainoa ja korostetaan, että Lissabonin sopimuksella vahvistetaan kutakin EU:n toimielintä sen toimivallan alueella. ","Edite Estrela  (PSE),",3,105,not_available,"['swe', 'swe', 'swe']","['  Edite Estrela  (PSE),  kirjallinen. (SV) Äänestin Lissabonin sopimuksen vaikutuksesta Euroopan unionin institutionaalisen tasapainon kehittymiseen laaditun mietinnön puolesta. Tässä mietinnössä tarkastellaan Lissabonin sopimuksen vaikutusta EU:n institutionaalisen tasapainon kehitykseen. Siinä korostetaan uusien säännösten täytäntöönpanon ja ensimmäisten nimitysten tekemisen merkitystä.', 'Lissabonin sopimuksen mahdollinen voimaantulo vuoden 2009 loppuun mennessä edellyttää neuvoston ja Euroopan parlamentin välistä poliittista sopimusta, jotta voidaan varmistaa, että komission seuraavan puheenjohtajan valintaa ja tulevan komission nimitystä koskevassa menettelyssä kunnioitetaan joka tapauksessa uusia valtuuksia, joita Lissabonin sopimuksella tässä asiassa annetaan Euroopan parlamentille.', 'Sen tuloksena mietinnössä esitetään monia suosituksia, joilla pyritään kehittämään institutionaalista tasapainoa ja korostetaan, että Lissabonin sopimuksella vahvistetaan kutakin EU:n toimielintä sen toimivallan alueella. ']"
164, 10. Äänestysselitykset,"  Pedro Guerreiro  (GUE/NGL),  kirjallinen. − (PT) Tämä päätöslauselma on osa parlamentin enemmistön tänään hyväksymää viiden päätöslauselman pakettia, joka osoittaa suurinta mahdollista halveksuntaa EU:n perustuslain ja sen kaksoisveljen, niin kutsutun Lissabonin sopimuksen, hylänneiden Ranskan, Alankomaiden ja Irlannin kansojen demokraattisesti ja itsenäisesti ilmaisemaa tahtoa kohtaan. Se on myös yksi monista aloitteista, joilla pyritään tyrkyttämään tätä sopimusluonnosta, jota on mahdotonta hyväksyä.Sen sijaan, että Lissabonin sopimus haudattaisiin lopullisesti, Euroopan parlamentti antaa jälleen päätöslauselman, jossa ylistetään päätöslauselmassa esitettyä Euroopan unionin demokratian vastaista institutionaalista tasapainoa, ja salataan muun muassa, että sillä– siirretään Portugalin kansan itsenäiset valtuudet suurten voimien hallitsemille EU:n ylikansallisille toimielimille, mistä on esimerkkinä biologisten merivarojen hoito kalastusvyöhykkeellämme– laajennetaan enemmistöpäätöksen soveltamista päätöksenteossa, millä vahvistetaan suurten voimien hallintaa ja estetään Portugalia käyttämästä veto-oikeuttaan päätöksissä, jotka ovat kansallisen edun vastaisia– lisätään valtuuksien poistamista kansallisilta demokraattisilta laitoksilta (ainoilta, jotka ovat suoraan tuloksena kansan demokraattisesta tahdosta), mistä on esimerkkinä valtuuksien siirto kansallisilta parlamenteilta, jotka ovat menettämässä valtuuksiaan tehdä päätöksiä perusaloilla ja joista on tulossa jonkinlainen neuvoa-antava elin ilman veto-oikeutta yhteisön päätöksiin, jotka ovat kansallisten etujen vastaisia. ","Pedro Guerreiro  (GUE/NGL),",5,173,not_available,"['por', 'por', 'por', 'por', 'por']","['  Pedro Guerreiro  (GUE/NGL),  kirjallinen. − (PT) Tämä päätöslauselma on osa parlamentin enemmistön tänään hyväksymää viiden päätöslauselman pakettia, joka osoittaa suurinta mahdollista halveksuntaa EU:n perustuslain ja sen kaksoisveljen, niin kutsutun Lissabonin sopimuksen, hylänneiden Ranskan, Alankomaiden ja Irlannin kansojen demokraattisesti ja itsenäisesti ilmaisemaa tahtoa kohtaan. Se on myös yksi monista aloitteista, joilla pyritään tyrkyttämään tätä sopimusluonnosta, jota on mahdotonta hyväksyä.', 'Sen sijaan, että Lissabonin sopimus haudattaisiin lopullisesti, Euroopan parlamentti antaa jälleen päätöslauselman, jossa ylistetään päätöslauselmassa esitettyä Euroopan unionin demokratian vastaista institutionaalista tasapainoa, ja salataan muun muassa, että sillä', '– siirretään Portugalin kansan itsenäiset valtuudet suurten voimien hallitsemille EU:n ylikansallisille toimielimille, mistä on esimerkkinä biologisten merivarojen hoito kalastusvyöhykkeellämme', '– laajennetaan enemmistöpäätöksen soveltamista päätöksenteossa, millä vahvistetaan suurten voimien hallintaa ja estetään Portugalia käyttämästä veto-oikeuttaan päätöksissä, jotka ovat kansallisen edun vastaisia', '– lisätään valtuuksien poistamista kansallisilta demokraattisilta laitoksilta (ainoilta, jotka ovat suoraan tuloksena kansan demokraattisesta tahdosta), mistä on esimerkkinä valtuuksien siirto kansallisilta parlamenteilta, jotka ovat menettämässä valtuuksiaan tehdä päätöksiä perusaloilla ja joista on tulossa jonkinlainen neuvoa-antava elin ilman veto-oikeutta yhteisön päätöksiin, jotka ovat kansallisten etujen vastaisia. ']"
165, 10. Äänestysselitykset,"  Nils Lundgren  (IND/DEM),  kirjallinen. − (SV) Lissabonin sopimus, joka on 96-prosenttisesti samanlainen kuin perustuslakiluonnos, hylättiin Irlannin kansanäänestyksessä. Sitä ennen perustuslakiluonnos hylättiin Ranskan ja Alankomaiden kansanäänestyksissä.Tämän parlamentin enemmistö kieltäytyy tunnustamasta poliittisia häviöitään. Tämä on törkeä rikos demokratian periaatteita vastaan ja samoin törkeä esimerkki vallan ylimielisyydestä, joka on luonteenomaista yhteistyölle EU:ssa.Kannattaa panna merkille, että Jean-Luc Dehaenen mietinnön 4 kohdassa sanotaan (lainaus), että Euroopan parlamentti ""pitää tervetulleena, että Lissabonin sopimuksen mukaan Eurooppa-neuvosto voi yksimielisellä päätöksellä ja Euroopan parlamentin hyväksynnällä, edellyttäen, ettei mikään kansallisista parlamenteista vastusta asiaa, laajentaa määräenemmistöpäätöksenteon ja tavallisen lainsäätämisjärjestyksen soveltamisalaa aloille, joilla niitä ei vielä sovelleta"".Huolimatta siitä, että monet äänestäjät monissa jäsenvaltioissa suhtautuvat selkeästi epäilevästi unionin lisääntyvään ylikansallisuuteen, Euroopan parlamentin federalistinen enemmistö viittaa mahdollisuuteen tehdä unionista vielä ylikansallisempi Lissabonin sopimuksen nojalla ja siirtää vielä enemmän valtaa EU:lle ilman, että uudesta sopimuksesta pitäisi sopia.Olen äänestänyt mietintöä vastaan. ","Nils Lundgren  (IND/DEM),",5,144,not_available,"['swe', 'swe', 'swe', 'swe', 'swe']","['  Nils Lundgren  (IND/DEM),  kirjallinen. − (SV) Lissabonin sopimus, joka on 96-prosenttisesti samanlainen kuin perustuslakiluonnos, hylättiin Irlannin kansanäänestyksessä. Sitä ennen perustuslakiluonnos hylättiin Ranskan ja Alankomaiden kansanäänestyksissä.', 'Tämän parlamentin enemmistö kieltäytyy tunnustamasta poliittisia häviöitään. Tämä on törkeä rikos demokratian periaatteita vastaan ja samoin törkeä esimerkki vallan ylimielisyydestä, joka on luonteenomaista yhteistyölle EU:ssa.', 'Kannattaa panna merkille, että Jean-Luc Dehaenen mietinnön 4 kohdassa sanotaan (lainaus), että Euroopan parlamentti ""pitää tervetulleena, että Lissabonin sopimuksen mukaan Eurooppa-neuvosto voi yksimielisellä päätöksellä ja Euroopan parlamentin hyväksynnällä, edellyttäen, ettei mikään kansallisista parlamenteista vastusta asiaa, laajentaa määräenemmistöpäätöksenteon ja tavallisen lainsäätämisjärjestyksen soveltamisalaa aloille, joilla niitä ei vielä sovelleta"".', 'Huolimatta siitä, että monet äänestäjät monissa jäsenvaltioissa suhtautuvat selkeästi epäilevästi unionin lisääntyvään ylikansallisuuteen, Euroopan parlamentin federalistinen enemmistö viittaa mahdollisuuteen tehdä unionista vielä ylikansallisempi Lissabonin sopimuksen nojalla ja siirtää vielä enemmän valtaa EU:lle ilman, että uudesta sopimuksesta pitäisi sopia.', 'Olen äänestänyt mietintöä vastaan. ']"
166, 10. Äänestysselitykset,"  Jan Andersson, Göran Färm, Inger Segelström ja Åsa Westlund  (PSE),  kirjallinen. − (SV) Parlamentti äänesti tänään Euroopan parlamentin ja kansallisten parlamenttien välisten suhteiden kehityksestä Lissabonin sopimuksen tultua voimaan laaditusta mietinnöstä. Tässä mietinnössä pidetään myönteisenä uusia valtuuksia, joita kansallisille parlamenteille annetaan Lissabonin sopimuksen nojalla. Siinä myös tutkitaan mahdollisuuksia Euroopan parlamentin ja kansallisten parlamenttien välisten suhteiden tulevalle kehitykselle.Olemme päättäneet äänestää tämän mietinnön puolesta, koska Euroopan parlamentin on valmistauduttava siihen, että se pystyy panemaan täytäntöön muutokset, jotka sen työssä tapahtuvat, jos Lissabonin sopimus tulee voimaan. Ääniemme perusteella ei kuitenkaan missään nimessä pitäisi päätellä, että teemme tyhjäksi yksittäisten jäsenvaltioiden ratifiointiprosessin. Kunnioitamme täysimääräisesti kaikkien jäsenvaltioiden oikeutta päättää itse, ratifioivatko ne Lissabonin sopimuksen. ","Jan Andersson, Göran Färm, Inger Segelström ja Åsa Westlund  (PSE),",2,107,not_available,"['swe', 'swe']","['  Jan Andersson, Göran Färm, Inger Segelström ja Åsa Westlund  (PSE),  kirjallinen. − (SV) Parlamentti äänesti tänään Euroopan parlamentin ja kansallisten parlamenttien välisten suhteiden kehityksestä Lissabonin sopimuksen tultua voimaan laaditusta mietinnöstä. Tässä mietinnössä pidetään myönteisenä uusia valtuuksia, joita kansallisille parlamenteille annetaan Lissabonin sopimuksen nojalla. Siinä myös tutkitaan mahdollisuuksia Euroopan parlamentin ja kansallisten parlamenttien välisten suhteiden tulevalle kehitykselle.', 'Olemme päättäneet äänestää tämän mietinnön puolesta, koska Euroopan parlamentin on valmistauduttava siihen, että se pystyy panemaan täytäntöön muutokset, jotka sen työssä tapahtuvat, jos Lissabonin sopimus tulee voimaan. Ääniemme perusteella ei kuitenkaan missään nimessä pitäisi päätellä, että teemme tyhjäksi yksittäisten jäsenvaltioiden ratifiointiprosessin. Kunnioitamme täysimääräisesti kaikkien jäsenvaltioiden oikeutta päättää itse, ratifioivatko ne Lissabonin sopimuksen. ']"
167, 10. Äänestysselitykset,"  Edite Estrela  (PSE),  kirjallinen. − (PT) Äänestin Elmar Brokin mietinnön puolesta. Tässä mietinnössä pidetään myönteisenä uusia valtuuksia, joita kansallisille parlamenteille annetaan Lissabonin sopimuksen nojalla, ja tutkitaan mahdollisuuksia kansallisten parlamenttien ja Euroopan parlamentille väliselle tulevalle yhteistyölle.Lissabonin sopimuksen hyväksyminen Tšekin tasavallassa on tärkeä askel nopeaa voimaantuloa kohti. Tämä mietintö osoittaa, miten tärkeä tämä uusi sopimus on Euroopan unionille. ","Edite Estrela  (PSE),",2,56,not_available,"['por', 'por']","['  Edite Estrela  (PSE),  kirjallinen. − (PT) Äänestin Elmar Brokin mietinnön puolesta. Tässä mietinnössä pidetään myönteisenä uusia valtuuksia, joita kansallisille parlamenteille annetaan Lissabonin sopimuksen nojalla, ja tutkitaan mahdollisuuksia kansallisten parlamenttien ja Euroopan parlamentille väliselle tulevalle yhteistyölle.', 'Lissabonin sopimuksen hyväksyminen Tšekin tasavallassa on tärkeä askel nopeaa voimaantuloa kohti. Tämä mietintö osoittaa, miten tärkeä tämä uusi sopimus on Euroopan unionille. ']"
168, 10. Äänestysselitykset,"  Bruno Gollnisch  (NI),  kirjallinen. − (FR) Me äänestimme tätä mietintöä vastaan ensinnäkin siksi, että se on tarkoitukseton: Lissabonin sopimusta ei ole olemassa; se hylättiin kolmessa kansanäänestyksessä.Äänestimme sitä vastaan toiseksi siksi, että siinä suositellaan kansallisten parlamenttien alistamista Euroopan parlamentille: viimeksi mainittu, varma ylivoimaisuudestaan ja epäilemättä kestämättömässä ylimielisyydessään, tarjoaisi tukeaan kansallisille parlamenteille – jotka sen mielestä on epäilemättä koottu poroporvareista ja idiooteista – EU:n tekstien käsittelyssä. Onko se tukea vai painostusta? Se kutsuisi itsensä kansallisten parlamenttien täysistuntoihin; se esittäisi neuvonantajan osaa; se vaikuttaisi tapaan, jolla parlamentit saattavat tekstejä osaksi kansallista lainsäädäntöä, edistääkseen yhtenäisyyttä; se väittäisi varmistavansa, että puolustusbudjeteista keskustellaan... sanelisiko se myös niille tavan, joilla niiden pitäisi valvoa hallituksia ja niiden toimintaa neuvostossa?Viimeiseksi, äänestimme sitä vastaan, koska se perustuu kaksinkertaiseen tekopyhyyteen: kansalliset parlamentit ovat saaneet vain vaikeasti täytäntöönpantavan ja siten tehottoman oikeuden valvoa toissijaisuusperiaatteen noudattamista; tämä periaate on harhakuva, koska monet oletettavasti yksinomaiset EU:n valtuudet on rauhoitettu, ja perustamissopimusten mukaisella toissijaisuuden määritelmällä edistetään itse asiassa Brysselin valtuuksia. ","Bruno Gollnisch  (NI),",3,156,not_available,"['fra', 'fra', 'fra']","['  Bruno Gollnisch  (NI),  kirjallinen. − (FR) Me äänestimme tätä mietintöä vastaan ensinnäkin siksi, että se on tarkoitukseton: Lissabonin sopimusta ei ole olemassa; se hylättiin kolmessa kansanäänestyksessä.', 'Äänestimme sitä vastaan toiseksi siksi, että siinä suositellaan kansallisten parlamenttien alistamista Euroopan parlamentille: viimeksi mainittu, varma ylivoimaisuudestaan ja epäilemättä kestämättömässä ylimielisyydessään, tarjoaisi tukeaan kansallisille parlamenteille – jotka sen mielestä on epäilemättä koottu poroporvareista ja idiooteista – EU:n tekstien käsittelyssä. Onko se tukea vai painostusta? Se kutsuisi itsensä kansallisten parlamenttien täysistuntoihin; se esittäisi neuvonantajan osaa; se vaikuttaisi tapaan, jolla parlamentit saattavat tekstejä osaksi kansallista lainsäädäntöä, edistääkseen yhtenäisyyttä; se väittäisi varmistavansa, että puolustusbudjeteista keskustellaan... sanelisiko se myös niille tavan, joilla niiden pitäisi valvoa hallituksia ja niiden toimintaa neuvostossa?', 'Viimeiseksi, äänestimme sitä vastaan, koska se perustuu kaksinkertaiseen tekopyhyyteen: kansalliset parlamentit ovat saaneet vain vaikeasti täytäntöönpantavan ja siten tehottoman oikeuden valvoa toissijaisuusperiaatteen noudattamista; tämä periaate on harhakuva, koska monet oletettavasti yksinomaiset EU:n valtuudet on rauhoitettu, ja perustamissopimusten mukaisella toissijaisuuden määritelmällä edistetään itse asiassa Brysselin valtuuksia. ']"
