,agenda_item,text,speaker,number_p,number_w,chair,language_ps,ps
35, 8. Lähtö- ja saapumisaikojen jakamista yhteisön lentoasemilla koskevat yhteiset säännöt (keskustelu) ,  Puhemies.  – (ES) Esityslistalla on seuraavana Paolo Costan liikenne- ja matkailuvaliokunnan puolesta laatima mietintö (A6-0274/2009) ehdotuksesta Euroopan parlamentin ja neuvoston asetukseksi lähtö- ja saapumisaikojen jakamista yhteisön lentoasemilla koskevista yhteisistä säännöistä annetun neuvoston asetuksen (ETY) N:o 95/93 muuttamisesta (KOM(2009)0121 – C6-0097/2009 – 2009/0042(COD)) ,Puhemies.,1,49,not_available,['spa'],['  Puhemies.  – (ES) Esityslistalla on seuraavana Paolo Costan liikenne- ja matkailuvaliokunnan puolesta laatima mietintö (A6-0274/2009) ehdotuksesta Euroopan parlamentin ja neuvoston asetukseksi lähtö- ja saapumisaikojen jakamista yhteisön lentoasemilla koskevista yhteisistä säännöistä annetun neuvoston asetuksen (ETY) N:o 95/93 muuttamisesta (KOM(2009)0121 – C6-0097/2009 – 2009/0042(COD)) ']
36, 8. Lähtö- ja saapumisaikojen jakamista yhteisön lentoasemilla koskevat yhteiset säännöt (keskustelu) ,"  Paolo Costa,  esittelijä. – (IT) Arvoisa puhemies, arvoisa varapuheenjohtaja Tajani, hyvät kuulijat, aloitan keskustelun johtopäätöksellä. Suosittelen, että parlamentti hyväksyy tarkistuksen, jonka olemme valiokunnassa istuvien ryhmäni jäsenten kanssa esittäneet. Näin mietintö saataisiin valmiiksi ensimmäisessä käsittelyssä ja asetus hyväksyttyä.Teemme niin, koska olemme hyvin vastuuntuntoisia. Varapuheenjohtaja Tajani on varmasti yhtä mieltä siitä, että toimenpide, jolla olemme pyrkineet reagoimaan lentoyhtiöiden objektiiviseen tarpeeseen ja tämänhetkiseen hankalaan tilanteeseen – antamalla lentoyhtiöille mahdollisuuden säilyttää lähtö- ja saapumisaikansa, vaikka nuo ajat jäisivät käyttämättä tällä kesäkaudella – on tarpeellinen mutta hyvin raju toimenpide, jota on paranneltava.Toimenpidettä on paranneltava myös siksi, että asiasta käytyjen lyhyiden keskustelujen aikana olemme havainneet lentoyhtiöiden ajavan hyvin erilaisia etuja, jotka ovat kuitenkin kaikki täysin oikeutettuja. On yhtiöitä, jotka tulisivat mielellään aiempien tilalle, jos nämä eivät kykene täyttämään sitoumuksiaan. Myös lentoyhtiöiden ja lentoasemien edut eroavat nykyään toisistaan, toisin kuin vielä jokin aika sitten. Ja ennen kaikkea on ajateltava matkustajien etuja, erityisesti niiden matkustajien etuja, jotka käyttävät syrjäisimmillä alueilla toimivien lentoyhtiöiden ja lentoasemien palveluja. Nämä matkustajat olisivat suurimmassa vaarassa, jos lähtö- ja saapumisaikojen ylläpitäminen tai lopettaminen riippuisi pelkästään niiden kannattavuudesta kyseisille yhtiöille.Olemme kyenneet reagoimaan kaikkiin näihin asioihin hyvin nopeasti, mutta nyt keskustelemme niistä. Koimme myös, että meidän on tehtävä jotain perusongelmalle, joka liittyy siihen, että lähtö- ja saapumisaikoihin suhtaudutaan, niin kuin niihin pitäisi suhtautua, kuin julkisiin hyödykkeisiin, joita voidaan jakaa tai myöntää yksityisille toimijoille, kuten lentoyhtiöille ja lentoasemille, mutta joita ei voi siirtää omaisuutena.Tämä on hyvin arkaluontoinen asia, ja meidän pitää mielestäni tarkastella sitä uudelleen. Minun on todettava, että syy, tai oikeastaan merkittävä kompromissi, jonka perusteella hyväksyimme niin nopeasti ehdotuksen siinä muodossa kuin se täällä esitellään, onkin juuri tässä. Uskomme nimittäin komission pitävän lupauksensa tuoda asia tarkempaan ja syvällisempään käsittelyyn. Sitten voimme lopullisesti selvittää tämän asian, joka on ratkaisevan tärkeä tämänhetkisestä kriisistä ylipääsemiseksi, maailmanlaajuisten ilmailumarkkinoiden uudistamisen ja vapauttamisen loppuun viemiseksi sekä unionin ilmailumarkkinoiden parantamiseksi.Tämänhetkiset vaatimukset ja pitkän aikavälin tarpeet huomioon ottaen voin mielestäni suositella mietinnön hyväksymistä.Myös minä, minulla on vielä 20 sekuntia aikaa jäljellä, arvoisa puhemies, haluan hyödyntää tämän viimeistä koulupäivää muistuttavan ilmapiirin ja kiittää luokkatovereitani ja kaikkia niitä, joiden kanssa olen saanut työskennellä viimeisten kymmenen vuoden aikana. Saan päättää tämän viimeisen päiväni täällä Strasbourgissa viimeisimpään, muttei varmastikaan vähäisimpään saavutukseeni. ","Paolo Costa,",7,356,not_available,"['ita', 'ita', 'ita', 'ita', 'ita', 'ita', 'ita']","['  Paolo Costa,  esittelijä. – (IT) Arvoisa puhemies, arvoisa varapuheenjohtaja Tajani, hyvät kuulijat, aloitan keskustelun johtopäätöksellä. Suosittelen, että parlamentti hyväksyy tarkistuksen, jonka olemme valiokunnassa istuvien ryhmäni jäsenten kanssa esittäneet. Näin mietintö saataisiin valmiiksi ensimmäisessä käsittelyssä ja asetus hyväksyttyä.', 'Teemme niin, koska olemme hyvin vastuuntuntoisia. Varapuheenjohtaja Tajani on varmasti yhtä mieltä siitä, että toimenpide, jolla olemme pyrkineet reagoimaan lentoyhtiöiden objektiiviseen tarpeeseen ja tämänhetkiseen hankalaan tilanteeseen – antamalla lentoyhtiöille mahdollisuuden säilyttää lähtö- ja saapumisaikansa, vaikka nuo ajat jäisivät käyttämättä tällä kesäkaudella – on tarpeellinen mutta hyvin raju toimenpide, jota on paranneltava.', 'Toimenpidettä on paranneltava myös siksi, että asiasta käytyjen lyhyiden keskustelujen aikana olemme havainneet lentoyhtiöiden ajavan hyvin erilaisia etuja, jotka ovat kuitenkin kaikki täysin oikeutettuja. On yhtiöitä, jotka tulisivat mielellään aiempien tilalle, jos nämä eivät kykene täyttämään sitoumuksiaan. Myös lentoyhtiöiden ja lentoasemien edut eroavat nykyään toisistaan, toisin kuin vielä jokin aika sitten. Ja ennen kaikkea on ajateltava matkustajien etuja, erityisesti niiden matkustajien etuja, jotka käyttävät syrjäisimmillä alueilla toimivien lentoyhtiöiden ja lentoasemien palveluja. Nämä matkustajat olisivat suurimmassa vaarassa, jos lähtö- ja saapumisaikojen ylläpitäminen tai lopettaminen riippuisi pelkästään niiden kannattavuudesta kyseisille yhtiöille.', 'Olemme kyenneet reagoimaan kaikkiin näihin asioihin hyvin nopeasti, mutta nyt keskustelemme niistä. Koimme myös, että meidän on tehtävä jotain perusongelmalle, joka liittyy siihen, että lähtö- ja saapumisaikoihin suhtaudutaan, niin kuin niihin pitäisi suhtautua, kuin julkisiin hyödykkeisiin, joita voidaan jakaa tai myöntää yksityisille toimijoille, kuten lentoyhtiöille ja lentoasemille, mutta joita ei voi siirtää omaisuutena.', 'Tämä on hyvin arkaluontoinen asia, ja meidän pitää mielestäni tarkastella sitä uudelleen. Minun on todettava, että syy, tai oikeastaan merkittävä kompromissi, jonka perusteella hyväksyimme niin nopeasti ehdotuksen siinä muodossa kuin se täällä esitellään, onkin juuri tässä. Uskomme nimittäin komission pitävän lupauksensa tuoda asia tarkempaan ja syvällisempään käsittelyyn. Sitten voimme lopullisesti selvittää tämän asian, joka on ratkaisevan tärkeä tämänhetkisestä kriisistä ylipääsemiseksi, maailmanlaajuisten ilmailumarkkinoiden uudistamisen ja vapauttamisen loppuun viemiseksi sekä unionin ilmailumarkkinoiden parantamiseksi.', 'Tämänhetkiset vaatimukset ja pitkän aikavälin tarpeet huomioon ottaen voin mielestäni suositella mietinnön hyväksymistä.', 'Myös minä, minulla on vielä 20 sekuntia aikaa jäljellä, arvoisa puhemies, haluan hyödyntää tämän viimeistä koulupäivää muistuttavan ilmapiirin ja kiittää luokkatovereitani ja kaikkia niitä, joiden kanssa olen saanut työskennellä viimeisten kymmenen vuoden aikana. Saan päättää tämän viimeisen päiväni täällä Strasbourgissa viimeisimpään, muttei varmastikaan vähäisimpään saavutukseeni. ']"
37, 8. Lähtö- ja saapumisaikojen jakamista yhteisön lentoasemilla koskevat yhteiset säännöt (keskustelu) ,"  Puhemies.   – (ES) Kiitos, hyvä Paolo Costa, ja onnittelut hienosta työstänne. Nimenne yhdistetään lukuisiin tärkeisiin mietintöihin, ja työnne on näin ollen ollut hyvin merkittävää parlamentin lähihistoriassa. ",Puhemies.,1,25,not_available,['spa'],"['  Puhemies.   – (ES) Kiitos, hyvä Paolo Costa, ja onnittelut hienosta työstänne. Nimenne yhdistetään lukuisiin tärkeisiin mietintöihin, ja työnne on näin ollen ollut hyvin merkittävää parlamentin lähihistoriassa. ']"
38, 8. Lähtö- ja saapumisaikojen jakamista yhteisön lentoasemilla koskevat yhteiset säännöt (keskustelu) ,"  Antonio Tajani,  komission varapuheenjohtaja. – (IT) Arvoisa puhemies, hyvät Euroopan parlamentin jäsenet, haluaisin vielä kerran entisenä Euroopan parlamentin jäsenenä kiittää liikenne- ja matkailuvaliokuntaa ja sen puheenjohtajaa tuloksekkaasta työstä silloin, kun olin itsekin Euroopan parlamentin jäsen, sekä yhteistyöstä, jota kanssani on tehty sen jälkeen, kun minut nimitettiin tämän parlamentin tuella liikenneasioista vastaavaksi komission jäseneksi. Hyvät kuulijat, antoisa kumppanuutemme on nähtävissä tänäänkin, ja haluan kiittää vielä kerran parlamenttia ja erityisesti Paolo Costan johtamaa liikenne- ja matkailuvaliokuntaa siitä, että se käsitteli Euroopan komission ehdotuksen lähtö- ja saapumisajoista niin nopeasti.Monet tapahtumat – talouskriisi, rahoituskriisi, uusi A-tyypin influenssavirus – pahentavat ilmailualan tilannetta entisestään. Vallitseva tilanne osoittaa, kuinka tärkeitä ja välttämättömiä tukitoimet ovat sekä lentoyhtiöitä että niiden työntekijöitä ajatellen.Tämän huomioon ottaen jaan Paolo Costan huolen. Komission ehdotus ei ole lopullinen ratkaisu. Kyse on ratkaisusta kriisitilanteeseen reagoimiseksi, ja sitä on arvioitava myöhemmin yksityiskohtaisemmin koko järjestelmän uudistamiseksi. Itse asiassa vastasin 15. huhtikuuta Paolo Costan esiin tuomiin huoliin ja huomioihin kertomalla hänelle, valiokunnan puheenjohtajalle, että komission energian ja liikenteen pääosastolla valmistaudutaan esittelemään ehdotus asetuksen muuttamiseksi mahdollisimman pian.Lähtö- ja saapumisaikojen käyttöä koskevan säännöksen soveltaminen on keskeytetty tätä ennen kaksi kertaa kriisin vuoksi. Kyse on yleisestä reaktiosta maailmanlaajuiseen kriisiin, eivätkä sen vaikutukset rajoitu pelkästään yhteen tai kahteen jäsenvaltioon, vaan se vaikuttaa lentoliikenteen järjestelmään kaikkialla Euroopan unionissa. Erityisen hankalissa olosuhteissa – kuten syyskuun 11. päivän iskujen sekä SARS-kriisin (vakava äkillinen hengitystieoireyhtymä) yhteydessä – toteutettiin samankaltaisia toimenpiteitä. Ilmailualan toimintaa tällä hetkellä hankaloittava kriisi on todennäköisesti aiempia vakavampi, eikä meillä ole toistaiseksi mitään havaintoa parempien aikojen alkamisesta.Tosiasia on, että lentoliikenne supistuu jatkuvasti. Käytä tai menetä -säännön soveltamisen keskeyttäminen kesäkauden ajaksi hyödyttää kaikkia yhtiöitä, sekä eurooppalaisia että muita, eikä se syrji mitään tahoa, kuten IATA ja monet unionin ulkopuoliset yhtiöt ovat todenneet. Olen varma, että tämä kestoltaan rajattu ja poikkeuksellinen toimenpide – keskeyttäminen on voimassa 29. maaliskuuta ja 26. lokakuuta välisenä aikana tänä vuonna, ja sen mukaisesti yhtiöt voivat säilyttää lähtö- ja saapumisaikansa seuraavaksi kesäkaudeksi – antaa kaikille yhtiöille hieman happea, jotta ne voivat reagoida kysynnän laskemiseen.Toimenpiteellä estetään myös ristiriitaiset tilanteet, joissa lentoyhtiöiden on pakko lentää tyhjällä koneella vain säilyttääkseen lähtö- ja saapumisaikansa. Tällaista ei voida mielestäni mitenkään hyväksyä pitkälti ympäristösyistä mutta myös lentoyhtiöiden taloudelle aiheutuvien haittojen vuoksi. Ja mehän kaikki tiedämme, että yrityksen vaikeudet heijastuvat myös sen työntekijöihin.Olen vakuuttunut tämän toimenpiteen tarpeellisuudesta ja kiireellisyydestä, ja minun on siksi tuettava parlamentin ja neuvoston saavuttamaa kompromissia, jonka ansiosta ehdotus on mahdollista hyväksyä välittömästi. Näin ollen haluan vielä kiittää liikenne- ja matkailuvaliokunnan puheenjohtajaa sekä koko parlamenttia. ","Antonio Tajani,",7,400,not_available,"['ita', 'ita', 'ita', 'ita', 'ita', 'ita', 'ita']","['  Antonio Tajani,  komission varapuheenjohtaja. – (IT) Arvoisa puhemies, hyvät Euroopan parlamentin jäsenet, haluaisin vielä kerran entisenä Euroopan parlamentin jäsenenä kiittää liikenne- ja matkailuvaliokuntaa ja sen puheenjohtajaa tuloksekkaasta työstä silloin, kun olin itsekin Euroopan parlamentin jäsen, sekä yhteistyöstä, jota kanssani on tehty sen jälkeen, kun minut nimitettiin tämän parlamentin tuella liikenneasioista vastaavaksi komission jäseneksi. Hyvät kuulijat, antoisa kumppanuutemme on nähtävissä tänäänkin, ja haluan kiittää vielä kerran parlamenttia ja erityisesti Paolo Costan johtamaa liikenne- ja matkailuvaliokuntaa siitä, että se käsitteli Euroopan komission ehdotuksen lähtö- ja saapumisajoista niin nopeasti.', 'Monet tapahtumat – talouskriisi, rahoituskriisi, uusi A-tyypin influenssavirus – pahentavat ilmailualan tilannetta entisestään. Vallitseva tilanne osoittaa, kuinka tärkeitä ja välttämättömiä tukitoimet ovat sekä lentoyhtiöitä että niiden työntekijöitä ajatellen.', 'Tämän huomioon ottaen jaan Paolo Costan huolen. Komission ehdotus ei ole lopullinen ratkaisu. Kyse on ratkaisusta kriisitilanteeseen reagoimiseksi, ja sitä on arvioitava myöhemmin yksityiskohtaisemmin koko järjestelmän uudistamiseksi. Itse asiassa vastasin 15. huhtikuuta Paolo Costan esiin tuomiin huoliin ja huomioihin kertomalla hänelle, valiokunnan puheenjohtajalle, että komission energian ja liikenteen pääosastolla valmistaudutaan esittelemään ehdotus asetuksen muuttamiseksi mahdollisimman pian.', 'Lähtö- ja saapumisaikojen käyttöä koskevan säännöksen soveltaminen on keskeytetty tätä ennen kaksi kertaa kriisin vuoksi. Kyse on yleisestä reaktiosta maailmanlaajuiseen kriisiin, eivätkä sen vaikutukset rajoitu pelkästään yhteen tai kahteen jäsenvaltioon, vaan se vaikuttaa lentoliikenteen järjestelmään kaikkialla Euroopan unionissa. Erityisen hankalissa olosuhteissa – kuten syyskuun 11. päivän iskujen sekä SARS-kriisin (vakava äkillinen hengitystieoireyhtymä) yhteydessä – toteutettiin samankaltaisia toimenpiteitä. Ilmailualan toimintaa tällä hetkellä hankaloittava kriisi on todennäköisesti aiempia vakavampi, eikä meillä ole toistaiseksi mitään havaintoa parempien aikojen alkamisesta.', 'Tosiasia on, että lentoliikenne supistuu jatkuvasti. Käytä tai menetä -säännön soveltamisen keskeyttäminen kesäkauden ajaksi hyödyttää kaikkia yhtiöitä, sekä eurooppalaisia että muita, eikä se syrji mitään tahoa, kuten IATA ja monet unionin ulkopuoliset yhtiöt ovat todenneet. Olen varma, että tämä kestoltaan rajattu ja poikkeuksellinen toimenpide – keskeyttäminen on voimassa 29. maaliskuuta ja 26. lokakuuta välisenä aikana tänä vuonna, ja sen mukaisesti yhtiöt voivat säilyttää lähtö- ja saapumisaikansa seuraavaksi kesäkaudeksi – antaa kaikille yhtiöille hieman happea, jotta ne voivat reagoida kysynnän laskemiseen.', 'Toimenpiteellä estetään myös ristiriitaiset tilanteet, joissa lentoyhtiöiden on pakko lentää tyhjällä koneella vain säilyttääkseen lähtö- ja saapumisaikansa. Tällaista ei voida mielestäni mitenkään hyväksyä pitkälti ympäristösyistä mutta myös lentoyhtiöiden taloudelle aiheutuvien haittojen vuoksi. Ja mehän kaikki tiedämme, että yrityksen vaikeudet heijastuvat myös sen työntekijöihin.', 'Olen vakuuttunut tämän toimenpiteen tarpeellisuudesta ja kiireellisyydestä, ja minun on siksi tuettava parlamentin ja neuvoston saavuttamaa kompromissia, jonka ansiosta ehdotus on mahdollista hyväksyä välittömästi. Näin ollen haluan vielä kiittää liikenne- ja matkailuvaliokunnan puheenjohtajaa sekä koko parlamenttia. ']"
39, 8. Lähtö- ja saapumisaikojen jakamista yhteisön lentoasemilla koskevat yhteiset säännöt (keskustelu) ,"  Georg Jarzembowski,  PPE-DE-ryhmän puolesta. – (DE) Arvoisa puhemies, arvoisa varapuheenjohtaja Tajani, hyvät kollegat, Euroopan kansanpuolueen (kristillisdemokraatit) ja Euroopan demokraattien ryhmä tukee sitä, että 80 prosentin käyttöä koskevan säännön soveltaminen keskeytetään tilapäisesti lentoasemilla niiden nousu- ja laskeutumisoikeuksien osalta, jotka on myönnetty lentoyhtiöille kesäkaudeksi 2010. Ryhmämme kiittää myös esittelijä Paolo Costaa ripeästä ja tehokkaasta työstä tämän asian käsittelyssä.Keskeyttämisen ansiosta lentoyhtiöt voivat kysynnän laskiessa vähentää lentojensa määrää suunnitellun minimikäytön alapuolelle menettämättä kuitenkaan lähtö- ja saapumisaikoja koskevia oikeuksiaan seuraavalla kaudella. Minun mielestäni tämä on perusteltua yksittäisenä, tietyn aikaa kestävänä toimenpiteenä, kuten varapuheenjohtaja totesi, sillä matkustajamäärät ovat romahtaneet ennalta arvaamattomasti kansainvälisen rahoitus- ja talouskriisin vuoksi, eikä lentoyhtiöillä ole vielä mahdollisuutta arvioida matkustajamäärien kehitystä jatkossa. Keskeyttäminen edistää myös ympäristönsuojelua, koska muuten lentoyhtiöt saattaisivat kokea, että niiden on lennettävä puolityhjillä koneilla vain säilyttääkseen lähtö- ja saapumisaikansa.Arvoisa puhemies, hyvä varapuheenjohtaja, aluksi PPE-DE-ryhmä hylkäsi ehdottamanne asetuksen, jolla komissiolle annettiin valtuudet – ilman kunnollista yhteispäätöstä, jossa parlamentti olisi ollut mukana – pyytää säännön soveltamisen keskeyttämistä komiteamenettelyn kautta. Olemme sitä mieltä, että jos aiotte ehdottaa vastaavaa talvikaudelle, parlamentin on tutkittava ehdotus huolellisesti. Tämä johtuu siitä, että meidän on huomioitava paremmin monien hyvin erityyppisten lentoyhtiöiden edut yhtä lailla kuin lentoasemien ja matkustajien edut. Sanomme ""kyllä"" tilapäiselle keskeyttämiselle mutta ""ei"" mahdollisuudelle jatkaa sitä parlamenttia kuulematta.Rehellisesti sanottuna olen kyllä sitä mieltä, koska sikainfluenssaepidemiasta ei näytä tulevan yhtä paha kuin mitä aluksi pelättiin, että lentoyhtiöiden pitäisi viime kädessä kyetä ennustamaan matkustajamäärien ja yhteyksien kehitystä tulevina vuosina. Meidän on odotettava lentoyhtiöiltä realistisia suunnitelmia, jotta lentoasemat voivat tarjota käyttämättä jääviä lähtö- ja saapumisaikoja muille lentoyhtiöille. On myös omien etujemme mukaista, että lentoasemat voivat käyttää kapasiteettinsa asiakkaidensa, eli matkustajien parhaaksi. Minulla ei ole muuta sanottavaa lähtö- ja saapumisaikoja koskevan direktiivin uudesta, perusteellisesta tarkistamisesta. Mielestäni lähtö- ja saapumisajat kuuluvat kansalaisille, eivät lentoasemille tai lentoyhtiöille. Tämän takia meidän on kiinnitettävä asiaan erityistä huomiota jatkossa.Arvoisa puhemies, hyvät kollegat, koska tämä keskustelu, tämä täysistunto sekä toimintani tässä parlamentissa ovat päättymässä, haluan vilpittömästi kiittää kollegoitani liikenne- ja matkailuvaliokunnassa ja sen sihteeristössä, liikenne- ja matkailuvaliokunnan puheenjohtajaa sekä komission varapuheenjohtajaa ja koko hänen tiimiään energian ja liikenteen pääosastossa. Olemme tehneet viimeiset viisi vuotta yhteistyötä Euroopan unionin kansalaisten hyväksi. Pidän peukkuja, että seuraavat viisi vuotta ovat teille vieläkin parempia. Liikenne- ja matkailuvaliokunta on tärkeä valiokunta, ja kiitän teitä erinomaisesta yhteistyöstä. ","Georg Jarzembowski,",5,369,not_available,"['ger', 'ger', 'ger', 'ger', 'ger']","['  Georg Jarzembowski,  PPE-DE-ryhmän puolesta. – (DE) Arvoisa puhemies, arvoisa varapuheenjohtaja Tajani, hyvät kollegat, Euroopan kansanpuolueen (kristillisdemokraatit) ja Euroopan demokraattien ryhmä tukee sitä, että 80 prosentin käyttöä koskevan säännön soveltaminen keskeytetään tilapäisesti lentoasemilla niiden nousu- ja laskeutumisoikeuksien osalta, jotka on myönnetty lentoyhtiöille kesäkaudeksi 2010. Ryhmämme kiittää myös esittelijä Paolo Costaa ripeästä ja tehokkaasta työstä tämän asian käsittelyssä.', 'Keskeyttämisen ansiosta lentoyhtiöt voivat kysynnän laskiessa vähentää lentojensa määrää suunnitellun minimikäytön alapuolelle menettämättä kuitenkaan lähtö- ja saapumisaikoja koskevia oikeuksiaan seuraavalla kaudella. Minun mielestäni tämä on perusteltua yksittäisenä, tietyn aikaa kestävänä toimenpiteenä, kuten varapuheenjohtaja totesi, sillä matkustajamäärät ovat romahtaneet ennalta arvaamattomasti kansainvälisen rahoitus- ja talouskriisin vuoksi, eikä lentoyhtiöillä ole vielä mahdollisuutta arvioida matkustajamäärien kehitystä jatkossa. Keskeyttäminen edistää myös ympäristönsuojelua, koska muuten lentoyhtiöt saattaisivat kokea, että niiden on lennettävä puolityhjillä koneilla vain säilyttääkseen lähtö- ja saapumisaikansa.', 'Arvoisa puhemies, hyvä varapuheenjohtaja, aluksi PPE-DE-ryhmä hylkäsi ehdottamanne asetuksen, jolla komissiolle annettiin valtuudet – ilman kunnollista yhteispäätöstä, jossa parlamentti olisi ollut mukana – pyytää säännön soveltamisen keskeyttämistä komiteamenettelyn kautta. Olemme sitä mieltä, että jos aiotte ehdottaa vastaavaa talvikaudelle, parlamentin on tutkittava ehdotus huolellisesti. Tämä johtuu siitä, että meidän on huomioitava paremmin monien hyvin erityyppisten lentoyhtiöiden edut yhtä lailla kuin lentoasemien ja matkustajien edut. Sanomme ""kyllä"" tilapäiselle keskeyttämiselle mutta ""ei"" mahdollisuudelle jatkaa sitä parlamenttia kuulematta.', 'Rehellisesti sanottuna olen kyllä sitä mieltä, koska sikainfluenssaepidemiasta ei näytä tulevan yhtä paha kuin mitä aluksi pelättiin, että lentoyhtiöiden pitäisi viime kädessä kyetä ennustamaan matkustajamäärien ja yhteyksien kehitystä tulevina vuosina. Meidän on odotettava lentoyhtiöiltä realistisia suunnitelmia, jotta lentoasemat voivat tarjota käyttämättä jääviä lähtö- ja saapumisaikoja muille lentoyhtiöille. On myös omien etujemme mukaista, että lentoasemat voivat käyttää kapasiteettinsa asiakkaidensa, eli matkustajien parhaaksi. Minulla ei ole muuta sanottavaa lähtö- ja saapumisaikoja koskevan direktiivin uudesta, perusteellisesta tarkistamisesta. Mielestäni lähtö- ja saapumisajat kuuluvat kansalaisille, eivät lentoasemille tai lentoyhtiöille. Tämän takia meidän on kiinnitettävä asiaan erityistä huomiota jatkossa.', 'Arvoisa puhemies, hyvät kollegat, koska tämä keskustelu, tämä täysistunto sekä toimintani tässä parlamentissa ovat päättymässä, haluan vilpittömästi kiittää kollegoitani liikenne- ja matkailuvaliokunnassa ja sen sihteeristössä, liikenne- ja matkailuvaliokunnan puheenjohtajaa sekä komission varapuheenjohtajaa ja koko hänen tiimiään energian ja liikenteen pääosastossa. Olemme tehneet viimeiset viisi vuotta yhteistyötä Euroopan unionin kansalaisten hyväksi. Pidän peukkuja, että seuraavat viisi vuotta ovat teille vieläkin parempia. Liikenne- ja matkailuvaliokunta on tärkeä valiokunta, ja kiitän teitä erinomaisesta yhteistyöstä. ']"
40, 8. Lähtö- ja saapumisaikojen jakamista yhteisön lentoasemilla koskevat yhteiset säännöt (keskustelu) ,"  Puhemies.   − (ES) Kiitän teitä, hyvä kollega Jarzembowski, ja toivotan teille onnea ja menestystä tulevia vuosia ja tulevia haasteita varten. ",Puhemies.,1,19,not_available,['spa'],"['  Puhemies.   − (ES) Kiitän teitä, hyvä kollega Jarzembowski, ja toivotan teille onnea ja menestystä tulevia vuosia ja tulevia haasteita varten. ']"
