,agenda_item,text,speaker,number_p,number_w,chair,language_ps,ps
186, 17. Ochrana dětí využívajících Internet a další komunikační technologie (rozprava) ,"  Czesław Adam Siekierski  (PPE-DE),  písemně. – (PL) Současná situace je taková, že mladí lidé bývají zběhlejší v používání nových technologií než starší generace. Pro děti a mládež Internet neskrývá žádná tajemství a obecně lépe než jejich rodiče rozumí tomu, jak funguje. Zároveň však právě děti a mladiství jsou nejvíce ohroženi psychologickým násilím na Internetu.Podle údajů shromážděných v rámci kampaně zaměřené na používání Internetu dětmi polovina všech Poláků používajících Internet zažila na síti urážky, ponižování a hrozby.Situace je ještě vážnější, pokud jde o děti. Více než 70 % mladých uživatelů Internetu se dostalo k pornografickému či erotickému materiálu a více než polovina z nich sledovala kruté a násilné scény.Je však třeba zdůraznit, že velká většina těchto mladých se k tomuto materiálu dostala náhodně a záměrně ho nevyhledávala. Pouze 12 % dětí přiznalo, že tyto stránky si vyhledalo.Uvádím zde ve sněmovně tuto statistiku, aby si poslanci uvědomili, jak závažným hrozbám je naše nejmladší generace vystavena, a jako příklad uvádím svou zemi.Podle mě je proto naprosto nezbytné, aby plánovaný program na ochranu dětí byl realizován. ","Czesław Adam Siekierski  (PPE-DE),",6,175,not_available,"['pol', 'pol', 'pol', 'pol', 'pol', 'pol']","['  Czesław Adam Siekierski  (PPE-DE),  písemně. – (PL) Současná situace je taková, že mladí lidé bývají zběhlejší v používání nových technologií než starší generace. Pro děti a mládež Internet neskrývá žádná tajemství a obecně lépe než jejich rodiče rozumí tomu, jak funguje. Zároveň však právě děti a mladiství jsou nejvíce ohroženi psychologickým násilím na Internetu.', 'Podle údajů shromážděných v rámci kampaně zaměřené na používání Internetu dětmi polovina všech Poláků používajících Internet zažila na síti urážky, ponižování a hrozby.', 'Situace je ještě vážnější, pokud jde o děti. Více než 70 % mladých uživatelů Internetu se dostalo k pornografickému či erotickému materiálu a více než polovina z nich sledovala kruté a násilné scény.', 'Je však třeba zdůraznit, že velká většina těchto mladých se k tomuto materiálu dostala náhodně a záměrně ho nevyhledávala. Pouze 12 % dětí přiznalo, že tyto stránky si vyhledalo.', 'Uvádím zde ve sněmovně tuto statistiku, aby si poslanci uvědomili, jak závažným hrozbám je naše nejmladší generace vystavena, a jako příklad uvádím svou zemi.', 'Podle mě je proto naprosto nezbytné, aby plánovaný program na ochranu dětí byl realizován. ']"
187, 17. Ochrana dětí využívajících Internet a další komunikační technologie (rozprava) ,"  Silvia-Adriana Ţicău  (PSE),  písemně. – (RO) Děti ve stále větší míře používají Internet pro komunikaci, vyhledávání informací, přístup ke znalostem a tráví s ním volný čas. Děti a jejich rodiny si musí být vědomy nebezpečí, které je s tím spojené, a především musí dodržovat určitá pravidla, která při používání Internetu zajišťují jejich ochranu.Internet musí zůstat otevřeným, ale zároveň bezpečným médiem. Program pro bezpečnější Internet je pokračováním a vylepšením předchozích programů Bezpečnější Internet a Bezpečnější Internet plus. Chci vás však upozornit na to, že jeho účinnost záleží na zvyšování povědomí obyvatelstva a na způsobu prosazování konkrétních právních předpisů na vnitrostátní úrovni. Každý případ, kdy se dítě nebo nezletilá osoba na Internetu setká s nevhodnými žádostmi, nebo dokonce šikanou, je nutno brát vážně, ohlásit jej a přiměřeným způsobem řešit.Jedna zpráva z poslední doby uvádí, že dva ze tří mladých lidí obdrželi při používání Internetu nevhodné žádosti a 25 % si prohlíželo materiál s neslušným obsahem. Bohužel mnozí rodiče a učitelé nejsou v kontaktu s digitální technikou a nedělají nic, aby děti na Internetu chránili. Vyzývám Komisi, aby spojila síly s členskými státy a společně prosadily zřízení vzájemně spolupracujících středisek pro ohlašování a řešení případů souvisejících s bezpečností Internetu.","Silvia-Adriana Ţicău  (PSE),",3,197,not_available,"['rum', 'rum', 'rum']","['  Silvia-Adriana Ţicău  (PSE),  písemně. – (RO) Děti ve stále větší míře používají Internet pro komunikaci, vyhledávání informací, přístup ke znalostem a tráví s ním volný čas. Děti a jejich rodiny si musí být vědomy nebezpečí, které je s tím spojené, a především musí dodržovat určitá pravidla, která při používání Internetu zajišťují jejich ochranu.', 'Internet musí zůstat otevřeným, ale zároveň bezpečným médiem. Program pro bezpečnější Internet je pokračováním a vylepšením předchozích programů Bezpečnější Internet a Bezpečnější Internet plus. Chci vás však upozornit na to, že jeho účinnost záleží na zvyšování povědomí obyvatelstva a na způsobu prosazování konkrétních právních předpisů na vnitrostátní úrovni. Každý případ, kdy se dítě nebo nezletilá osoba na Internetu setká s nevhodnými žádostmi, nebo dokonce šikanou, je nutno brát vážně, ohlásit jej a přiměřeným způsobem řešit.', 'Jedna zpráva z poslední doby uvádí, že dva ze tří mladých lidí obdrželi při používání Internetu nevhodné žádosti a 25 % si prohlíželo materiál s neslušným obsahem. Bohužel mnozí rodiče a učitelé nejsou v kontaktu s digitální technikou a nedělají nic, aby děti na Internetu chránili. Vyzývám Komisi, aby spojila síly s členskými státy a společně prosadily zřízení vzájemně spolupracujících středisek pro ohlašování a řešení případů souvisejících s bezpečností Internetu.']"
188, 18. Obnova stavů tresky (rozprava) ,"  Předsedající. -   Dalším bodem je zpráva (A6-0340/2008) pana Buska předložená jménem Výboru pro rybolov o návrhu nařízení Rady, kterým se mění nařízení (ES) č. 423/2004 o obnově populací tresky a nařízení (EHS) č.  2847/93 (KOM(2008)0162 – C6-0183/2008 – 2008/0063(CNS)) ",Předsedající. -,1,46,not_available,['cze'],"['  Předsedající. -   Dalším bodem je zpráva (A6-0340/2008) pana Buska předložená jménem Výboru pro rybolov o návrhu nařízení Rady, kterým se mění nařízení (ES) č. 423/2004 o obnově populací tresky a nařízení (EHS) č.  2847/93 (KOM(2008)0162 – C6-0183/2008 – 2008/0063(CNS)) ']"
189, 18. Obnova stavů tresky (rozprava) ,"  Niels Busk,  zpravodaj. - (DA) Pane předsedající, paní komisařko, dámy a pánové, Komise předložila dobrý konstruktivní návrh na změnu stávajícího plánu obnovy stavů tresky, například ve Skagerraku a Kattegatu v Severním moři. Navzdory stávajícímu plánu obnovy se i nadále loví mnohem větší množství tresek, než jaká je jejich přirozená reprodukce. Do plánu obnovy bylo zahrnuto i Keltské moře, protože nová hodnocení naznačují, že populace tresek jsou také zde loveny v nadměrném množství a nejsou v dobrém stavu.Cílem těchto pozměňovacích návrhů je dosáhnout v příštích pěti až deseti letech obnovy stavů tresky. Tohoto cíle má být dosaženo snížením míry úmrtnosti ryb o 10 % až 25 %, podle stavu rybí populace. To je třeba doplnit regulací intenzity rybolovu a také sledováním a kontrolou. Cíle je třeba upravit tak, aby bylo dosaženo nejvyššího udržitelného výnosu, třebaže se podmínky v oceánech mění v důsledku celosvětového oteplování. Je třeba zjednodušit systém řízení intenzity rybolovu. Ten se totiž postupně stal tak složitým, že je nutno zavést nový systém založený na stanovených stropech intenzity rybolovu řízené členskými státy, které budou mít větší pružnost, a dosáhnou tak účinnějšího provádění.Plán je třeba přizpůsobit různé úrovni obnovy, a proto se zavádí modulární strategie, kde úprava míry úmrtnosti ryb je funkcí dosažené úrovně obnovy. Jsou stanovena jasná pravidla, která jsou uplatňována, když vědci nemohou poskytnout přesné odhady stavu populace. Je třeba omezit výměty zavedením nových mechanismů, které budou rybáře pobízet k účasti na programech pro zamezení odlovu tresky. Celkově si Komise přeje upravit stávající plán obnovy stavů tresky tak, aby byl úplnější, aktualizovaný podle posledního vývoje, jednodušší, účinnější a snáze proveditelný, sledovatelný a kontrolovatelný.TAC: zavádějí se nová pravidla pro stanovení celkových přípustných odlovů, kde se velikost rybích populací měří buď ve vztahu k minimálnímu množství, nebo k cílovému množství. Při stanovování TAC má Rada odvodit také množství tresek, které odpovídá objemu předpokládaného výmětu vypočítaného na základě celkového množství ulovených tresek. Po zavedení TAC také další faktory přispívající k úmrtnosti ryb povedou k převratné změně v celkovém odlovu tresky.Každé tři roky Vědeckotechnický a hospodářský výbor Komise pro rybářství vyhodnotí obnovu stavů tresky. Pokud se vývoj rybí populace ukáže jako nedostatečný, Rada stanoví nižší celkový přípustný odlov, než jak byl vymezen ve výše uvedených pravidlech, spolu s nižší intenzitou rybolovu.Jako zpravodaj jsem k návrhu Komise předložil řadu pozměňovacích návrhů a některé pozměňovací návrhy předložili také moji kolegové. Nejdůležitější pozměňovací návrh se týká změny rozhodného období 2005-2007 na období 2004-2006, neboť údaje pro rok 2007 jsou tak nové, že si jimi nemůžeme být jisti, a proto je lepší použít údaje, které jsou zaručené.V úvahu se bere skutečnost, že populace tresky se v jistém okamžiku znovu obnovují, a proto nemůžeme jednoduše snižovat kvóty, ale potřebujeme spíše změny. Je zajištěn pružnější systém přecházení z jednoho typu zařízení na jiný, aby bylo možné reagovat na vnější okolnosti, jako je vzestup cen paliv, které jsou i po jejich určitém snížení v posledních několika týdnech zvláště vysoké. Je třeba co nejvíce zapojit regionální poradní sbory. Je třeba pobízet rybáře i členské státy, aby zavedly opatření na snížení úmrtnosti ryb a výmětů.Na závěr bych chtěl poděkovat francouzskému předsednictví za jeho zvláště konstruktivní spolupráci. ","Niels Busk,",8,520,not_available,"['dan', 'dan', 'dan', 'dan', 'dan', 'dan', 'dan', 'dan']","['  Niels Busk,  zpravodaj. - (DA) Pane předsedající, paní komisařko, dámy a pánové, Komise předložila dobrý konstruktivní návrh na změnu stávajícího plánu obnovy stavů tresky, například ve Skagerraku a Kattegatu v Severním moři. Navzdory stávajícímu plánu obnovy se i nadále loví mnohem větší množství tresek, než jaká je jejich přirozená reprodukce. Do plánu obnovy bylo zahrnuto i Keltské moře, protože nová hodnocení naznačují, že populace tresek jsou také zde loveny v nadměrném množství a nejsou v dobrém stavu.', 'Cílem těchto pozměňovacích návrhů je dosáhnout v příštích pěti až deseti letech obnovy stavů tresky. Tohoto cíle má být dosaženo snížením míry úmrtnosti ryb o 10 % až 25 %, podle stavu rybí populace. To je třeba doplnit regulací intenzity rybolovu a také sledováním a kontrolou. Cíle je třeba upravit tak, aby bylo dosaženo nejvyššího udržitelného výnosu, třebaže se podmínky v oceánech mění v důsledku celosvětového oteplování. Je třeba zjednodušit systém řízení intenzity rybolovu. Ten se totiž postupně stal tak složitým, že je nutno zavést nový systém založený na stanovených stropech intenzity rybolovu řízené členskými státy, které budou mít větší pružnost, a dosáhnou tak účinnějšího provádění.', 'Plán je třeba přizpůsobit různé úrovni obnovy, a proto se zavádí modulární strategie, kde úprava míry úmrtnosti ryb je funkcí dosažené úrovně obnovy. Jsou stanovena jasná pravidla, která jsou uplatňována, když vědci nemohou poskytnout přesné odhady stavu populace. Je třeba omezit výměty zavedením nových mechanismů, které budou rybáře pobízet k účasti na programech pro zamezení odlovu tresky. Celkově si Komise přeje upravit stávající plán obnovy stavů tresky tak, aby byl úplnější, aktualizovaný podle posledního vývoje, jednodušší, účinnější a snáze proveditelný, sledovatelný a kontrolovatelný.', 'TAC: zavádějí se nová pravidla pro stanovení celkových přípustných odlovů, kde se velikost rybích populací měří buď ve vztahu k minimálnímu množství, nebo k cílovému množství. Při stanovování TAC má Rada odvodit také množství tresek, které odpovídá objemu předpokládaného výmětu vypočítaného na základě celkového množství ulovených tresek. Po zavedení TAC také další faktory přispívající k úmrtnosti ryb povedou k převratné změně v celkovém odlovu tresky.', 'Každé tři roky Vědeckotechnický a hospodářský výbor Komise pro rybářství vyhodnotí obnovu stavů tresky. Pokud se vývoj rybí populace ukáže jako nedostatečný, Rada stanoví nižší celkový přípustný odlov, než jak byl vymezen ve výše uvedených pravidlech, spolu s nižší intenzitou rybolovu.', 'Jako zpravodaj jsem k návrhu Komise předložil řadu pozměňovacích návrhů a některé pozměňovací návrhy předložili také moji kolegové. Nejdůležitější pozměňovací návrh se týká změny rozhodného období 2005-2007 na období 2004-2006, neboť údaje pro rok 2007 jsou tak nové, že si jimi nemůžeme být jisti, a proto je lepší použít údaje, které jsou zaručené.', 'V úvahu se bere skutečnost, že populace tresky se v jistém okamžiku znovu obnovují, a proto nemůžeme jednoduše snižovat kvóty, ale potřebujeme spíše změny. Je zajištěn pružnější systém přecházení z jednoho typu zařízení na jiný, aby bylo možné reagovat na vnější okolnosti, jako je vzestup cen paliv, které jsou i po jejich určitém snížení v posledních několika týdnech zvláště vysoké. Je třeba co nejvíce zapojit regionální poradní sbory. Je třeba pobízet rybáře i členské státy, aby zavedly opatření na snížení úmrtnosti ryb a výmětů.', 'Na závěr bych chtěl poděkovat francouzskému předsednictví za jeho zvláště konstruktivní spolupráci. ']"
190, 18. Obnova stavů tresky (rozprava) ,"  Joe Borg,  člen Komise. - Pane předsedající, rád bych poděkoval Výboru pro rybolov, zejména jeho zpravodaji panu Buskovi za jeho důkladnou a dobře promyšlenou zprávu.Jsem rád, že Parlament sdílí názory Komise na obnovu populací tresky. Úmrtnost ryb je příliš vysoká. Výskyt tresky je příliš nízký. I když v některých oblastech je v moři více mladých ryb než v minulých letech, je to spíše příležitost než obnova.Mám radost také z toho, že se Parlament shodl na nutnosti zahrnout do plánu obnovy Keltské moře a rovněž na nutnosti významně snížit míru úmrtnosti ryb prostřednictvím TAC a omezit intenzitu rybolovu. Souhlasím s mnoha pozměňovacími návrhy předloženými Parlamentem, ale nemohu souhlasit s jejich konkrétním zněním. A to pouze z toho důvodu, že obdobné právní texty již existují nebo jsou připravovány a konzultovány s členskými státy a já nechci předjímat výsledky probíhajících odborných jednání.A teď konkrétně. Souhlasím s vašimi pozměňovacími návrhy 1, 4, 5, 6, 7, 9, 13, 14 a 16. Pokud jde o pozměňovací návrh 2, v podstatě s ním souhlasím, ale pravomoci Komise a Rady jsou již stanoveny ve Smlouvě o Evropském společenství a úloha regionálních sborů je uvedena v článku 31 základního nařízení.Pokud jde o pozměňovací návrh 3 týkající se snížení výmětů, pracuji na samostatné iniciativě. Určitě znáte sdělení Komise z jara 2007 o vyhazování mrtvých nežádoucích ryb. V dohledné době bude následovat návrh na úpravu.Pokud jde o pozměňovací návrh 7, souhlasím s tím, že pro rybí populace v situaci vysokého ohrožení je třeba uplatnit 15% omezení zyšování celkových přípustných odlovů. Ale Rada by měla zvolit snížení o více než 15 %.Pokud jde o pozměňovací návrh 8, souhlasím, aby při revizi plánu byl jako příklad zahrnut odkaz na úmrtnost tuleňů a zohledněn vliv změny klimatu na tresku.Pokud jde o pozměňovací návrh 10, kapitola přímo odkazuje na omezení intenzity rybolovu. Odkaz na stanovené kvóty by znamenal, že intenzita rybolovu by byla pouze odhadnuta, nikoli řízena. Tuto změnu proto nemohu přijmout.Pokud jde o pozměňovací návrh 11, mohu znovu zvážit základ pro výpočet kilowatt-dní. Členské státy se však musí do této diskuse zapojit.Pokud jde o pozměňovací návrh 12, text navrhovaného článku 8a, odstavec 3, byl vskutku matoucí a v zájmu větší srozumitelnosti bude přepracován.Pokud jde o pozměňovací návrh 15, návrh týkající se vyhrazení kapacity byl příliš omezující a mohl by zabránit reorganizaci činnosti rybářských loďstev. S členskými státy stále vedu diskusi o tom, jak zajistit vhodnou míru flexibility a zároveň nezvyšovat intenzitu rybolovu. Dávám proto přednost úpravě stávajícího textu, nikoli jeho vypuštění.Pokud jde o pozměňovací návrh 17, mohu přistoupit na zásadu přenosů intenzity rybolovu podléhající korekčnímu činiteli, který odráží důležitost odlovu tresky v různých sektorech. Ale věc je složitá a je nutné ji dále zkoumat.Pokud jde o pozměňovací návrh 18, z právních důvodů nemohu přistoupit na vypuštění odkazu na proces rozhodování. Proces, na který je odkazováno, vyžaduje Smlouva o Evropském společenství.Děkuji vám za pozornost a za vaše konstruktivní příspěvky k tomuto tématu. ","Joe Borg,",14,489,not_available,"['cze', 'cze', 'cze', 'cze', 'cze', 'cze', 'cze', 'cze', 'cze', 'cze', 'cze', 'cze', 'cze', 'cze']","['  Joe Borg,  člen Komise. - Pane předsedající, rád bych poděkoval Výboru pro rybolov, zejména jeho zpravodaji panu Buskovi za jeho důkladnou a dobře promyšlenou zprávu.', 'Jsem rád, že Parlament sdílí názory Komise na obnovu populací tresky. Úmrtnost ryb je příliš vysoká. Výskyt tresky je příliš nízký. I když v některých oblastech je v moři více mladých ryb než v minulých letech, je to spíše příležitost než obnova.', 'Mám radost také z toho, že se Parlament shodl na nutnosti zahrnout do plánu obnovy Keltské moře a rovněž na nutnosti významně snížit míru úmrtnosti ryb prostřednictvím TAC a omezit intenzitu rybolovu. Souhlasím s mnoha pozměňovacími návrhy předloženými Parlamentem, ale nemohu souhlasit s jejich konkrétním zněním. A to pouze z toho důvodu, že obdobné právní texty již existují nebo jsou připravovány a konzultovány s členskými státy a já nechci předjímat výsledky probíhajících odborných jednání.', 'A teď konkrétně. Souhlasím s vašimi pozměňovacími návrhy 1, 4, 5, 6, 7, 9, 13, 14 a 16. Pokud jde o pozměňovací návrh 2, v podstatě s ním souhlasím, ale pravomoci Komise a Rady jsou již stanoveny ve Smlouvě o Evropském společenství a úloha regionálních sborů je uvedena v článku 31 základního nařízení.', 'Pokud jde o pozměňovací návrh 3 týkající se snížení výmětů, pracuji na samostatné iniciativě. Určitě znáte sdělení Komise z jara 2007 o vyhazování mrtvých nežádoucích ryb. V dohledné době bude následovat návrh na úpravu.', 'Pokud jde o pozměňovací návrh 7, souhlasím s tím, že pro rybí populace v situaci vysokého ohrožení je třeba uplatnit 15% omezení zyšování celkových přípustných odlovů. Ale Rada by měla zvolit snížení o více než 15 %.', 'Pokud jde o pozměňovací návrh 8, souhlasím, aby při revizi plánu byl jako příklad zahrnut odkaz na úmrtnost tuleňů a zohledněn vliv změny klimatu na tresku.', 'Pokud jde o pozměňovací návrh 10, kapitola přímo odkazuje na omezení intenzity rybolovu. Odkaz na stanovené kvóty by znamenal, že intenzita rybolovu by byla pouze odhadnuta, nikoli řízena. Tuto změnu proto nemohu přijmout.', 'Pokud jde o pozměňovací návrh 11, mohu znovu zvážit základ pro výpočet kilowatt-dní. Členské státy se však musí do této diskuse zapojit.', 'Pokud jde o pozměňovací návrh 12, text navrhovaného článku 8a, odstavec 3, byl vskutku matoucí a v zájmu větší srozumitelnosti bude přepracován.', 'Pokud jde o pozměňovací návrh 15, návrh týkající se vyhrazení kapacity byl příliš omezující a mohl by zabránit reorganizaci činnosti rybářských loďstev. S členskými státy stále vedu diskusi o tom, jak zajistit vhodnou míru flexibility a zároveň nezvyšovat intenzitu rybolovu. Dávám proto přednost úpravě stávajícího textu, nikoli jeho vypuštění.', 'Pokud jde o pozměňovací návrh 17, mohu přistoupit na zásadu přenosů intenzity rybolovu podléhající korekčnímu činiteli, který odráží důležitost odlovu tresky v různých sektorech. Ale věc je složitá a je nutné ji dále zkoumat.', 'Pokud jde o pozměňovací návrh 18, z právních důvodů nemohu přistoupit na vypuštění odkazu na proces rozhodování. Proces, na který je odkazováno, vyžaduje Smlouva o Evropském společenství.', 'Děkuji vám za pozornost a za vaše konstruktivní příspěvky k tomuto tématu. ']"
