,agenda_item,text,speaker,number_p,number_w,chair,language_ps,ps
122, 15. Hodnocení dohody o PNR mezi Austrálií a EU - Evropská unie a PNR (rozprava) ,"  Jacques Barrot,  člen Komise. - (FR) Pane předsedající, chtěl bych poděkovat všem poslancům EP, kteří hovořili, a mohu vás ujistit, že na zasedání Rady, které se má konat tento týden, budu určitě přítomen a vaše připomínky, které zde zazněly, tam přednesu.Chci vám v první řadě připomenout, že podle našeho názoru nelze užitečnost systému PNR v souvislosti s bojem proti terorismu a organizovanému zločinu ignorovat. Několik z vás to otevřeně potvrdilo. Bez systému PNR se proto neobejdeme a musím vám říci, že komisař odpovědný za boj proti organizovanému zločinu není ochoten se vzdát užitečných zdrojů. Zároveň však musíme tento systém využívat vhodným způsobem a v tom se s vámi shoduji: rozhodující je účel a přiměřenost. Účel použití je nutno dodržovat, a jak řekla paní in 't Veldová, tento účel je nutno přesně vymezit a musí být zaručena přiměřenost. Musím dát jednu konkrétní odpověď panu Lambrinidisovi, který byl velice razantní: v dohodě mezi Spojenými státy a Evropou je účelem terorismus a trestná činnost, tečka. Nejprve je tedy nutno zajistit přiměřenost a účel.Paní Ludfordová, úplně jsem to chápal, když mnozí z vás hovořili o nutnosti zajistit, aby se údaje, poté co byly využity pro stanovené účely, už dále neuchovávaly. Máte pravdu v tom, že musíme zabránit jakémukoli jejich uchovávání, které by z hlediska našich základních práv mohlo následně vést k jejich nepřijatelnému použití.Nyní bych se chtěl věnovat demokratické kontrole, nejprve pokud jde o jednání se zeměmi, které nejsou členy EU. Mělo by nám být zcela jasné, že články 24 a 38 Smlouvy o Evropské unii uvádějí, že v mezinárodních jednáních bude předsednictví řídit jednání v případě potřeby za pomoci Komise. Článek 24 neukládá předsednictví povinnost informovat Parlament nebo se s ním radit, a je tedy na předsednictví, aby tam, kde je to možné, o stavu jednání informovalo. Nicméně po konzultaci s předsednictvím, a naskytne-li se vhodná příležitost, může Komise Parlament o vývoji v těchto otázkách informovat. Chci vás ujistit, že v současnosti žádná další země, která není členem EU, nepožádala o jednání o PNR, a tak je situace jasná. Kdyby k tomu došlo, jako nový komisař pro tuto oblast bych při zahájení nových jednání nepochybně požádal předsednictví, aby mě pověřilo informováním příslušného parlamentního výboru o stavu jednání. K tomu bych se vám chtěl zavázat.Za třetí – a pan Weber se o tom právě zmínil – ano, je zde 27 vnitrostátních systémů, ale tyto systémy se navzájem příliš neliší a s parlamenty jednotlivých států byla tato věc konzultována. Pokud vím, národní parlamenty měly možnost vyjádřit své stanovisko a zaslat nám své připomínky. Pane předsedající, jsem si dobře vědom toho, že jsem neodpověděl na všechny připomínky, ale některé dobře odůvodněné poznámky budou vzaty v úvahu. Mám za to, chcete-li, že se nedokážeme – a věrně tlumočím hlavní myšlenku této rozpravy – připravit o zdroj, pokud by tento zdroj mohl být užitečný Bylo řečeno, že tato účinnost nebyla prokázána. I když je to pravda, některé důkazy nicméně byly předloženy a, jak jsem před malou chvílí uvedl, při poskytování informací s vyloučením veřejnosti byla řada svědků, kteří uváděli, že systém PNR by mohl být užitečný. Jsem přesvědčen o tom, že v boji proti organizovanému zločinu může být velmi prospěšný.Je tomu tak, účely je nutno dodržovat. Musíme zabránit ukládání dat, a potřebujeme tudíž velice přísnou kontrolu. Proto musíme podle mého názoru zapojit – jak jsem uvedl v závěru – všechny orgány pro ochranu údajů. Ve čtvrtek jsem se zúčastnil jednání na téma ochrany údajů, které uspořádala většina orgánů odpovědných za ochranu údajů v Evropě, a měl jsem dojem, že skutečně stále více lidí v členských státech si nyní přeje svěřit ochranu údajů nezávislým orgánům, jejichž hlas bude pravděpodobně opravdu slyšet.To jsem chtěl říci na závěr rozpravy, která pro mě byla velice zajímavá a užitečná a o které budu informovat členské státy a jejich ministry. To udělám, slibuji. ","Jacques Barrot,",7,630,not_available,"['fra', 'fra', 'fra', 'fra', 'fra', 'fra', 'fra']","['  Jacques Barrot,  člen Komise. - (FR) Pane předsedající, chtěl bych poděkovat všem poslancům EP, kteří hovořili, a mohu vás ujistit, že na zasedání Rady, které se má konat tento týden, budu určitě přítomen a vaše připomínky, které zde zazněly, tam přednesu.', ""Chci vám v první řadě připomenout, že podle našeho názoru nelze užitečnost systému PNR v souvislosti s bojem proti terorismu a organizovanému zločinu ignorovat. Několik z vás to otevřeně potvrdilo. Bez systému PNR se proto neobejdeme a musím vám říci, že komisař odpovědný za boj proti organizovanému zločinu není ochoten se vzdát užitečných zdrojů. Zároveň však musíme tento systém využívat vhodným způsobem a v tom se s vámi shoduji: rozhodující je účel a přiměřenost. Účel použití je nutno dodržovat, a jak řekla paní in 't Veldová, tento účel je nutno přesně vymezit a musí být zaručena přiměřenost. Musím dát jednu konkrétní odpověď panu Lambrinidisovi, který byl velice razantní: v dohodě mezi Spojenými státy a Evropou je účelem terorismus a trestná činnost, tečka. Nejprve je tedy nutno zajistit přiměřenost a účel."", 'Paní Ludfordová, úplně jsem to chápal, když mnozí z vás hovořili o nutnosti zajistit, aby se údaje, poté co byly využity pro stanovené účely, už dále neuchovávaly. Máte pravdu v tom, že musíme zabránit jakémukoli jejich uchovávání, které by z hlediska našich základních práv mohlo následně vést k jejich nepřijatelnému použití.', 'Nyní bych se chtěl věnovat demokratické kontrole, nejprve pokud jde o jednání se zeměmi, které nejsou členy EU. Mělo by nám být zcela jasné, že články 24 a 38 Smlouvy o Evropské unii uvádějí, že v mezinárodních jednáních bude předsednictví řídit jednání v případě potřeby za pomoci Komise. Článek 24 neukládá předsednictví povinnost informovat Parlament nebo se s ním radit, a je tedy na předsednictví, aby tam, kde je to možné, o stavu jednání informovalo. Nicméně po konzultaci s předsednictvím, a naskytne-li se vhodná příležitost, může Komise Parlament o vývoji v těchto otázkách informovat. Chci vás ujistit, že v současnosti žádná další země, která není členem EU, nepožádala o jednání o PNR, a tak je situace jasná. Kdyby k tomu došlo, jako nový komisař pro tuto oblast bych při zahájení nových jednání nepochybně požádal předsednictví, aby mě pověřilo informováním příslušného parlamentního výboru o stavu jednání. K tomu bych se vám chtěl zavázat.', 'Za třetí – a pan Weber se o tom právě zmínil – ano, je zde 27 vnitrostátních systémů, ale tyto systémy se navzájem příliš neliší a s parlamenty jednotlivých států byla tato věc konzultována. Pokud vím, národní parlamenty měly možnost vyjádřit své stanovisko a zaslat nám své připomínky. Pane předsedající, jsem si dobře vědom toho, že jsem neodpověděl na všechny připomínky, ale některé dobře odůvodněné poznámky budou vzaty v úvahu. Mám za to, chcete-li, že se nedokážeme – a věrně tlumočím hlavní myšlenku této rozpravy – připravit o zdroj, pokud by tento zdroj mohl být užitečný Bylo řečeno, že tato účinnost nebyla prokázána. I když je to pravda, některé důkazy nicméně byly předloženy a, jak jsem před malou chvílí uvedl, při poskytování informací s vyloučením veřejnosti byla řada svědků, kteří uváděli, že systém PNR by mohl být užitečný. Jsem přesvědčen o tom, že v boji proti organizovanému zločinu může být velmi prospěšný.', 'Je tomu tak, účely je nutno dodržovat. Musíme zabránit ukládání dat, a potřebujeme tudíž velice přísnou kontrolu. Proto musíme podle mého názoru zapojit – jak jsem uvedl v závěru – všechny orgány pro ochranu údajů. Ve čtvrtek jsem se zúčastnil jednání na téma ochrany údajů, které uspořádala většina orgánů odpovědných za ochranu údajů v Evropě, a měl jsem dojem, že skutečně stále více lidí v členských státech si nyní přeje svěřit ochranu údajů nezávislým orgánům, jejichž hlas bude pravděpodobně opravdu slyšet.', 'To jsem chtěl říci na závěr rozpravy, která pro mě byla velice zajímavá a užitečná a o které budu informovat členské státy a jejich ministry. To udělám, slibuji. ']"
123, 15. Hodnocení dohody o PNR mezi Austrálií a EU - Evropská unie a PNR (rozprava) ,"  Sophia in 't Veld,  zpravodajka. - Pane předsedající, chtěla bych poděkovat panu komisaři za odpověď. Velice ráda si s ním sednu a projednám všechny detaily. V krátkosti se ještě vrátím k účelu, protože je zde řada nepochopení, pokud jde o to, co můžeme nebo nemůžeme s údaji PNR dělat. Údaje PNR jsou dnes již k dispozici i bez plánu EU o údajích PNR, stačí oprávnění a patřičné zdůvodnění. Ale nutnost dalších neomezených pravomocí nebyla prokázána. Nezpochybňuji tak užitečnost vlastních údajů PNR, zpochybňuji pouze užitečnost tohoto masového shromažďování dat a automatizované analýzy.Nejsem jediná, kdo zastává tento názor; jsem v dobré společnosti. Stejný názor mají i orgány pro ochranu údajů, ale jsou ignorovány. Totéž slyšíme od leteckých dopravců. Totéž nám říkají bezpečnostní specialisté z letištní bezpečnostní služby a budu vám citovat ze zprávy, kterou si nechalo vypracovat ministerstvo pro vnitřní bezpečnost. Velmi ráda vám ji věnuji. Uvádí se zde: „automatizovaná identifikace teroristů prostřednictvím dolování údajů nebo jakékoli jiné známé metodologie není přijatelným cílem“. Nevymyslela jsem si to. Jedná se o bezpečnostní specialisty pověřené ministerstvem pro vnitřní bezpečnost.Existuje důkaz pro užitečnost, jak jste, pane komisaři, uvedl, ale pro užitečnost v boji proti obchodu s drogami či nelegální migraci a pro další účely. Možná vás to překvapí, ale proti používání údajů PNR pro tyto účely v zásadě nejsem. Musíme však tyto účely velice přesně vymezit, aby byla zajištěna přiměřenost a vhodná právní ochrana.Dovolte mi, abych zakončila ve velice osobním duchu. Je mi velmi smutno z toho, jakým způsobem se o systému PNR již pět let dohadujeme, a Rada a Komise jsou nakročeny vpřed jako vlak, který ujel. Ráda bych řekla svých irským spoluobčanům v EU, že pokud si stejně jako já přejete ukončit toto nedemokratické a neprůhledné rozhodování, pak nové smlouvě o EU řekněte prosím své „Ano“. ","Sophia in 't Veld,",4,295,not_available,"['cze', 'cze', 'cze', 'cze']","[""  Sophia in 't Veld,  zpravodajka. - Pane předsedající, chtěla bych poděkovat panu komisaři za odpověď. Velice ráda si s ním sednu a projednám všechny detaily. V krátkosti se ještě vrátím k účelu, protože je zde řada nepochopení, pokud jde o to, co můžeme nebo nemůžeme s údaji PNR dělat. Údaje PNR jsou dnes již k dispozici i bez plánu EU o údajích PNR, stačí oprávnění a patřičné zdůvodnění. Ale nutnost dalších neomezených pravomocí nebyla prokázána. Nezpochybňuji tak užitečnost vlastních údajů PNR, zpochybňuji pouze užitečnost tohoto masového shromažďování dat a automatizované analýzy."", 'Nejsem jediná, kdo zastává tento názor; jsem v dobré společnosti. Stejný názor mají i orgány pro ochranu údajů, ale jsou ignorovány. Totéž slyšíme od leteckých dopravců. Totéž nám říkají bezpečnostní specialisté z letištní bezpečnostní služby a budu vám citovat ze zprávy, kterou si nechalo vypracovat ministerstvo pro vnitřní bezpečnost. Velmi ráda vám ji věnuji. Uvádí se zde: „automatizovaná identifikace teroristů prostřednictvím dolování údajů nebo jakékoli jiné známé metodologie není přijatelným cílem“. Nevymyslela jsem si to. Jedná se o bezpečnostní specialisty pověřené ministerstvem pro vnitřní bezpečnost.', 'Existuje důkaz pro užitečnost, jak jste, pane komisaři, uvedl, ale pro užitečnost v boji proti obchodu s drogami či nelegální migraci a pro další účely. Možná vás to překvapí, ale proti používání údajů PNR pro tyto účely v zásadě nejsem. Musíme však tyto účely velice přesně vymezit, aby byla zajištěna přiměřenost a vhodná právní ochrana.', 'Dovolte mi, abych zakončila ve velice osobním duchu. Je mi velmi smutno z toho, jakým způsobem se o systému PNR již pět let dohadujeme, a Rada a Komise jsou nakročeny vpřed jako vlak, který ujel. Ráda bych řekla svých irským spoluobčanům v EU, že pokud si stejně jako já přejete ukončit toto nedemokratické a neprůhledné rozhodování, pak nové smlouvě o EU řekněte prosím své „Ano“. ']"
124, 15. Hodnocení dohody o PNR mezi Austrálií a EU - Evropská unie a PNR (rozprava) ,  Předsedající. -   Rozprava je ukončena.Hlasování se bude konat ve středu. ,Předsedající. -,2,10,not_available,"['cze', 'cze']","['  Předsedající. -   Rozprava je ukončena.', 'Hlasování se bude konat ve středu. ']"
125, 16. Program Erasmus Mundus (2009-2013) (rozprava) ,"  Předsedající. -   Dalším bodem je zpráva (A6-0294/2008) paní De Sarnezové předložená jménem Výboru pro kulturu a vzdělávání o návrhu rozhodnutí Evropského parlamentu a Rady, kterým se zavádí akční program pro zlepšování kvality vysokoškolského vzdělávání a pro podporu mezikulturního porozumění prostřednictvím spolupráce se třetími zeměmi (Erasmus Mundus) (2009-2013). [KOM(2007)0395 – C6-0228/2007 – 2007/0145)COD)] ",Předsedající. -,1,58,not_available,['cze'],"['  Předsedající. -   Dalším bodem je zpráva (A6-0294/2008) paní De Sarnezové předložená jménem Výboru pro kulturu a vzdělávání o návrhu rozhodnutí Evropského parlamentu a Rady, kterým se zavádí akční program pro zlepšování kvality vysokoškolského vzdělávání a pro podporu mezikulturního porozumění prostřednictvím spolupráce se třetími zeměmi (Erasmus Mundus) (2009-2013). [KOM(2007)0395 – C6-0228/2007 – 2007/0145)COD)] ']"
126, 16. Program Erasmus Mundus (2009-2013) (rozprava) ,"  Marielle De Sarnez,  zpravodajka. - (FR) Pane předsedající, dnes večer diskutujeme o programu Erasmus Mundus 2009-2013, na kterém jsme se nakonec s Radou shodli. Bude proto možné, aby tento program vstoupil v platnost v lednu 2009, a studenti tak  mohli nastoupit hned na začátku akademického roku v září. Zde bych chtěla poděkovat všem svým kolegům, kteří byli navrhovateli stanovisek Výboru pro zaměstnanost a sociální věci, Výboru pro práva žen a rovnost pohlaví, Rozpočtovému výboru, Výboru pro rozvoj a Výboru pro zahraniční záležitosti, a rovněž svým kolegům z Výboru pro kulturu a vzdělávání. Děkuji samozřejmě také Evropské komisi. A děkuji také předsedovi Asociace Erasmus Mundus a výkonným agenturám, že nám pomohly svými odbornými znalostmi, a především svými zkušenostmi.Pět let po přijetí programu Erasmus Mundus, téměř na den, jsem ráda, že vám mohu představit tento program druhé generace, jehož cílem zůstává podpora špičkové úrovně evropského vysokoškolského vzdělávání a který umožňuje těm nejtalentovanějším studentům ze zemí mimo EU i z Evropy využívat společné programy na vysoké úrovni minimálně na třech univerzitách a těžit z vysoce kvalitního studia a významných stipendií.Statistická čísla předchozího programu hovoří sama za sebe: v letech 2004 až 2008 bylo ve 103 případech vybráno a schváleno magisterské studium, více než 6 000 studentů získalo v rámci programu Erasmus Mundus stipendia, na evropské univerzity přišla více než tisícovka učitelů ze zemí mimo EU a zapojilo se více než 400 vysokoškolských zařízení z Evropy i mimo Evropu.Nový program obsahuje tři aktivity. První otevírá program k získání doktorátu a evropským studentům zároveň umožní získat stipendia, i když na nižší úrovni. Druhá je věnována výhradně partnerství s vysokoškolskými institucemi v zemích, které nejsou členy EU, a třetí zahrnuje informační kampaň vedenou v mezinárodním měřítku. Rozpočet činí 950 milionů EUR. První program měl ve srovnání s tím rozpočet pouhých 230 milionů EUR.Parlament v tomto programu provedl některá velice významná zlepšení. Na ně bych vás chtěla upozornit a v určitém smyslu vám tak vzdát hold. Prvním zlepšením je to, že výběr studentů se nyní provádí na základě vysokých akademických kritérii, a to platí rovněž v rámci partnerství. Za druhé budou respektována kritéria zeměpisného rozložení, aby zastoupení bylo co nejvyváženější. Za třetí budou dodržovány zásady rovnosti mezi muži a ženami a nediskriminace. Za čtvrté bude nutno odstranit administrativní překážky a postupy, zejména v souvislosti s vízy. Členské státy budou muset podniknout nezbytné kroky umožňující vydávání víz studentům ze zemí mimo EU, kteří se pohybují v řadě členských států. Této věci přikládáme zvláštní význam, třebaže bylo poněkud obtížné tuto situaci na našich jednáních s Radou vyřešit.Dále bude podporována výuka cizích jazyků v hostitelských univerzitách. Doktoráty budou zahrnovat stáže na vysokých školách alespoň ve třech různých evropských zemích. To povede k velké rozmanitosti předmětů výzkumu a disertačních prací a poskytne mnohem širší možnosti mobility. Stipendia budou lépe přizpůsobena a budou zohledňovat výši školného i odhadované výdaje studentů na studium. Práce probíhala v těsné spolupráci s dánským stálým zastoupením a s odborníkem v oblasti školného z dánského ministerstva školství a to nám umožnilo dosáhnout kompromisu přijatelného pro všechny. Partnerství veřejného a soukromého sektoru s univerzitami bude povzbuzováno a zvláštní pozornost bude věnována otázce odlivu mozků. V rámci aktivity 2 budou finanční prostředky směrovány a využívány v souladu s cíli rozvoje a nástroji vnějších vztahů. Informace poskytované na univerzitách budou jasnější. A konečně, hodnotící zpráva, která bude dokončena za dva roky, bude podrobnější a členěná podle aktivit a zeměpisných oblastí.Dámy a pánové, abych to uzavřela: Erasmus Mundus je dobrý program a v této těžké době ukazuje Evropu v příznivém světle. Proto věřím, že Parlament ho přijme, a splní tak přání mnoha studentů a akademických a výzkumných pracovníků v Evropě a na celém světě. ","Marielle De Sarnez,",7,608,not_available,"['fra', 'fra', 'fra', 'fra', 'fra', 'fra', 'fra']","['  Marielle De Sarnez,  zpravodajka. - (FR) Pane předsedající, dnes večer diskutujeme o programu Erasmus Mundus 2009-2013, na kterém jsme se nakonec s Radou shodli. Bude proto možné, aby tento program vstoupil v platnost v lednu 2009, a studenti tak  mohli nastoupit hned na začátku akademického roku v září. Zde bych chtěla poděkovat všem svým kolegům, kteří byli navrhovateli stanovisek Výboru pro zaměstnanost a sociální věci, Výboru pro práva žen a rovnost pohlaví, Rozpočtovému výboru, Výboru pro rozvoj a Výboru pro zahraniční záležitosti, a rovněž svým kolegům z Výboru pro kulturu a vzdělávání. Děkuji samozřejmě také Evropské komisi. A děkuji také předsedovi Asociace Erasmus Mundus a výkonným agenturám, že nám pomohly svými odbornými znalostmi, a především svými zkušenostmi.', 'Pět let po přijetí programu Erasmus Mundus, téměř na den, jsem ráda, že vám mohu představit tento program druhé generace, jehož cílem zůstává podpora špičkové úrovně evropského vysokoškolského vzdělávání a který umožňuje těm nejtalentovanějším studentům ze zemí mimo EU i z Evropy využívat společné programy na vysoké úrovni minimálně na třech univerzitách a těžit z vysoce kvalitního studia a významných stipendií.', 'Statistická čísla předchozího programu hovoří sama za sebe: v letech 2004 až 2008 bylo ve 103 případech vybráno a schváleno magisterské studium, více než 6 000 studentů získalo v rámci programu Erasmus Mundus stipendia, na evropské univerzity přišla více než tisícovka učitelů ze zemí mimo EU a zapojilo se více než 400 vysokoškolských zařízení z Evropy i mimo Evropu.', 'Nový program obsahuje tři aktivity. První otevírá program k získání doktorátu a evropským studentům zároveň umožní získat stipendia, i když na nižší úrovni. Druhá je věnována výhradně partnerství s vysokoškolskými institucemi v zemích, které nejsou členy EU, a třetí zahrnuje informační kampaň vedenou v mezinárodním měřítku. Rozpočet činí 950 milionů EUR. První program měl ve srovnání s tím rozpočet pouhých 230 milionů EUR.', 'Parlament v tomto programu provedl některá velice významná zlepšení. Na ně bych vás chtěla upozornit a v určitém smyslu vám tak vzdát hold. Prvním zlepšením je to, že výběr studentů se nyní provádí na základě vysokých akademických kritérii, a to platí rovněž v rámci partnerství. Za druhé budou respektována kritéria zeměpisného rozložení, aby zastoupení bylo co nejvyváženější. Za třetí budou dodržovány zásady rovnosti mezi muži a ženami a nediskriminace. Za čtvrté bude nutno odstranit administrativní překážky a postupy, zejména v souvislosti s vízy. Členské státy budou muset podniknout nezbytné kroky umožňující vydávání víz studentům ze zemí mimo EU, kteří se pohybují v řadě členských států. Této věci přikládáme zvláštní význam, třebaže bylo poněkud obtížné tuto situaci na našich jednáních s Radou vyřešit.', 'Dále bude podporována výuka cizích jazyků v hostitelských univerzitách. Doktoráty budou zahrnovat stáže na vysokých školách alespoň ve třech různých evropských zemích. To povede k velké rozmanitosti předmětů výzkumu a disertačních prací a poskytne mnohem širší možnosti mobility. Stipendia budou lépe přizpůsobena a budou zohledňovat výši školného i odhadované výdaje studentů na studium. Práce probíhala v těsné spolupráci s dánským stálým zastoupením a s odborníkem v oblasti školného z dánského ministerstva školství a to nám umožnilo dosáhnout kompromisu přijatelného pro všechny. Partnerství veřejného a soukromého sektoru s univerzitami bude povzbuzováno a zvláštní pozornost bude věnována otázce odlivu mozků. V rámci aktivity 2 budou finanční prostředky směrovány a využívány v souladu s cíli rozvoje a nástroji vnějších vztahů. Informace poskytované na univerzitách budou jasnější. A konečně, hodnotící zpráva, která bude dokončena za dva roky, bude podrobnější a členěná podle aktivit a zeměpisných oblastí.', 'Dámy a pánové, abych to uzavřela: Erasmus Mundus je dobrý program a v této těžké době ukazuje Evropu v příznivém světle. Proto věřím, že Parlament ho přijme, a splní tak přání mnoha studentů a akademických a výzkumných pracovníků v Evropě a na celém světě. ']"
