,agenda_item,text,speaker,number_p,number_w,chair,language_ps,ps
139, 7. Vysvětlení hlasování,"  Koenraad Dillen   (NI), písemně. − (NL) Hlasoval jsem ve prospěch tohoto usnesení. Evropský parlament vítá skutečnost, že omezení svobody tisku se v Bělorusku poněkud zmírnila a že bylo propuštěno několik politických vězňů. Také ovšem upozorňuje, že jiní disidenti jsou stále za mřížemi. Toto usnesení říká, že v zájmu zlepšení vztahů by se Bělorusko mělo stát zemí bez politických vězňů, že by vláda měla zaručit svobodu vyjadřování názorů atd. Také by se měly změnit právní předpisy a Bělorusové by měli mít svobodu pohybu.Přestože s tímto každý souhlasí, rád bych vám navrhnul následující. Neměl by Evropský parlament otevřít tato usnesení zemím, s nimiž Evropa udržuje srdečné vztahy? Nabízí se Čína, kde je situace v oblasti lidských práv přinejmenším stejně dramatická jako v Bělorusku. A nebo nás od toho odradí obchodní úvahy? ",Koenraad Dillen,2,129,not_available,"['dut', 'dut']","['  Koenraad Dillen   (NI), písemně. − (NL) Hlasoval jsem ve prospěch tohoto usnesení. Evropský parlament vítá skutečnost, že omezení svobody tisku se v Bělorusku poněkud zmírnila a že bylo propuštěno několik politických vězňů. Také ovšem upozorňuje, že jiní disidenti jsou stále za mřížemi. Toto usnesení říká, že v zájmu zlepšení vztahů by se Bělorusko mělo stát zemí bez politických vězňů, že by vláda měla zaručit svobodu vyjadřování názorů atd. Také by se měly změnit právní předpisy a Bělorusové by měli mít svobodu pohybu.', 'Přestože s tímto každý souhlasí, rád bych vám navrhnul následující. Neměl by Evropský parlament otevřít tato usnesení zemím, s nimiž Evropa udržuje srdečné vztahy? Nabízí se Čína, kde je situace v oblasti lidských práv přinejmenším stejně dramatická jako v Bělorusku. A nebo nás od toho odradí obchodní úvahy? ']"
140, 7. Vysvětlení hlasování,"  Alexandru Nazare  (PPE-DE),  písemně. – (RO) Usnesení pokračuje v trvalém a produktivním dialogu s vládou v Minsku a svědčí o zájmu Evropského parlamentu a občanů, které zastupuje, o situaci v oblasti lidských práv a o vývoj v Bělorusku obecně.Běloruské úřady udělaly jisté pokroky, což je chvályhodné, ale my doufáme, že zahájí proces demokratizace, a ne že udělají jen jakési dočasné kosmetické gesto. Toto usnesení je dostatečně přísné, ale také jemně odstíněné, takže vyjadřuje naši spokojenost s první otázkou, stejně jako naše znepokojení ohledně druhé otázky.Současné události v regionu znovu zdůrazňují význam transparentnosti ve věcech vlády a demokratické odpovědnosti vlád vůči občanům, které zastupují. Demokratické hodnoty, které byly přijaty, jsou spojeny se stabilitou a rozvojem, a to jak společnosti, tak trhů, včetně trhů s energiemi. Toto usnesení je krokem k potvrzení těchto hodnot. ","Alexandru Nazare  (PPE-DE),",3,134,not_available,"['rum', 'rum', 'rum']","['  Alexandru Nazare  (PPE-DE),  písemně. – (RO) Usnesení pokračuje v trvalém a produktivním dialogu s vládou v Minsku a svědčí o zájmu Evropského parlamentu a občanů, které zastupuje, o situaci v oblasti lidských práv a o vývoj v Bělorusku obecně.', 'Běloruské úřady udělaly jisté pokroky, což je chvályhodné, ale my doufáme, že zahájí proces demokratizace, a ne že udělají jen jakési dočasné kosmetické gesto. Toto usnesení je dostatečně přísné, ale také jemně odstíněné, takže vyjadřuje naši spokojenost s první otázkou, stejně jako naše znepokojení ohledně druhé otázky.', 'Současné události v regionu znovu zdůrazňují význam transparentnosti ve věcech vlády a demokratické odpovědnosti vlád vůči občanům, které zastupují. Demokratické hodnoty, které byly přijaty, jsou spojeny se stabilitou a rozvojem, a to jak společnosti, tak trhů, včetně trhů s energiemi. Toto usnesení je krokem k potvrzení těchto hodnot. ']"
141, 7. Vysvětlení hlasování,"  Zdzisław Zbigniew Podkański  (UEN),  písemně. – (PL) Vztahy mezi Evropskou unií a Běloruskem závisejí na obou stranách. Pokud je zde společná dobrá vůle, pak bude dialog možný, stejně jako vhodná politika sousedství a východní partnerství. Partnerství nemůže být postaveno na omezeních a příkazech, a proto vítám nedávnou iniciativu Evropské komise zlepšit vztahy s Běloruskem. Objektivně musíme uznat, že Bělorusko také udělalo mnoho pro rozvoj porozumění. Mezi příklady patří registrace hnutí „Za svobodu“, povolení vydávání a distribuce opozičních novin a otevřenost iniciativě Východní partnerství. Evropská unie očekává víc. A má proto samozřejmě dobré důvody. Nicméně existují i dobré důvody pro mnohá očekávání ze strany Běloruska.Je třeba, aby mezi partnery v mnoha oblastech vládla vyváženost a porozumění. Například když vyžadujeme po běloruských úřadech, aby přestaly svým občanům, zejména dětem a studentům, vydávat výjezdní víza, proč Evropská unie nepřijme opatření pro zjednodušení a uvolnění postupů ke získání víz pro občany Běloruska? Tyto problémy jsou obzvláště důležité pro ty, kdo žijí v příhraničních regionech, které jsou propojeny jak kulturními, tak rodinnými vazbami.Kromě kulturních záležitostí a otázky národnosti je důležité také hospodářství a přeshraniční spolupráce. I zde by Komise a Rada mohly a měly udělat více. ","Zdzisław Zbigniew Podkański  (UEN),",3,192,not_available,"['pol', 'pol', 'pol']","['  Zdzisław Zbigniew Podkański  (UEN),  písemně. – (PL) Vztahy mezi Evropskou unií a Běloruskem závisejí na obou stranách. Pokud je zde společná dobrá vůle, pak bude dialog možný, stejně jako vhodná politika sousedství a východní partnerství. Partnerství nemůže být postaveno na omezeních a příkazech, a proto vítám nedávnou iniciativu Evropské komise zlepšit vztahy s Běloruskem. Objektivně musíme uznat, že Bělorusko také udělalo mnoho pro rozvoj porozumění. Mezi příklady patří registrace hnutí „Za svobodu“, povolení vydávání a distribuce opozičních novin a otevřenost iniciativě Východní partnerství. Evropská unie očekává víc. A má proto samozřejmě dobré důvody. Nicméně existují i dobré důvody pro mnohá očekávání ze strany Běloruska.', 'Je třeba, aby mezi partnery v mnoha oblastech vládla vyváženost a porozumění. Například když vyžadujeme po běloruských úřadech, aby přestaly svým občanům, zejména dětem a studentům, vydávat výjezdní víza, proč Evropská unie nepřijme opatření pro zjednodušení a uvolnění postupů ke získání víz pro občany Běloruska? Tyto problémy jsou obzvláště důležité pro ty, kdo žijí v příhraničních regionech, které jsou propojeny jak kulturními, tak rodinnými vazbami.', 'Kromě kulturních záležitostí a otázky národnosti je důležité také hospodářství a přeshraniční spolupráce. I zde by Komise a Rada mohly a měly udělat více. ']"
142, 7. Vysvětlení hlasování,"  Luís Queiró  (PPE-DE),  písemně. − (PT) Současné pozadí a budoucnost vztahů s Běloruskem představují výzvu pro zahraniční politiku Evropské unie. Některé kroky Minsku ospravedlňují nové navázání některých vztahů. Je však zjevné, že v současné situaci hraje významnou úlohu v tomto procesu faktor energie. To je pochopitelné. Realismus je nedílnou součástí zahraniční politiky. Nicméně realismus se nemůže, nemusí a neměl by se oddělovat od hodnot a strategie. Prosazování demokracie v Bělorusku je otázka jak hodnot, tak strategie. Tento pohled na střednědobé a dlouhodobé evropské zájmy musí být v této nové fázi vztahu ústřední. Jinak způsobíme budoucí závislost, v níž hodnoty ustoupí krátkodobým strategiím s omezeným úspěchem. ","Luís Queiró  (PPE-DE),",1,105,not_available,['por'],"['  Luís Queiró  (PPE-DE),  písemně. − (PT) Současné pozadí a budoucnost vztahů s Běloruskem představují výzvu pro zahraniční politiku Evropské unie. Některé kroky Minsku ospravedlňují nové navázání některých vztahů. Je však zjevné, že v současné situaci hraje významnou úlohu v tomto procesu faktor energie. To je pochopitelné. Realismus je nedílnou součástí zahraniční politiky. Nicméně realismus se nemůže, nemusí a neměl by se oddělovat od hodnot a strategie. Prosazování demokracie v Bělorusku je otázka jak hodnot, tak strategie. Tento pohled na střednědobé a dlouhodobé evropské zájmy musí být v této nové fázi vztahu ústřední. Jinak způsobíme budoucí závislost, v níž hodnoty ustoupí krátkodobým strategiím s omezeným úspěchem. ']"
143, 7. Vysvětlení hlasování,"  Luca Romagnoli  (NI),  písemně. – (IT) Pane předsedající, dámy a pánové, rád bych oznámil, že jsem hlasoval ve prospěch návrhu usnesení ohledně postoje Evropské unie v jednání s Běloruskem.Těší mě, že běloruský ministr zahraničí potvrdil, že jeho země má v úmyslu podílet se na východním partnerství s dalšími východoevropskými zeměmi. Je ovšem nezbytné, aby Bělorusko pečlivě dodržovalo mezinárodní bezpečnostní normy a požadavky při stavbě nové jaderné elektrárny a aby vyhovělo Úmluvě o jaderné bezpečnosti.A konečně, rmoutí mě skutečnost, že Bělorusko zůstává jedinou zemí v Evropě, která si ponechává trest smrti. Pokud se bude uvažovat o budoucím rozšíření Unie, tento barbarský trest musí být zrušen. ","Luca Romagnoli  (NI),",3,105,not_available,"['ita', 'ita', 'ita']","['  Luca Romagnoli  (NI),  písemně. – (IT) Pane předsedající, dámy a pánové, rád bych oznámil, že jsem hlasoval ve prospěch návrhu usnesení ohledně postoje Evropské unie v jednání s Běloruskem.', 'Těší mě, že běloruský ministr zahraničí potvrdil, že jeho země má v úmyslu podílet se na východním partnerství s dalšími východoevropskými zeměmi. Je ovšem nezbytné, aby Bělorusko pečlivě dodržovalo mezinárodní bezpečnostní normy a požadavky při stavbě nové jaderné elektrárny a aby vyhovělo Úmluvě o jaderné bezpečnosti.', 'A konečně, rmoutí mě skutečnost, že Bělorusko zůstává jedinou zemí v Evropě, která si ponechává trest smrti. Pokud se bude uvažovat o budoucím rozšíření Unie, tento barbarský trest musí být zrušen. ']"
144, 7. Vysvětlení hlasování,"  Flaviu Călin Rus  (PPE-DE),  písemně. – (RO) Hlasoval jsem ve prospěch usnesení EU o Bělorusku, protože se domnívám, že každý krok, který může zavést více demokracie do jakékoli země na světě, je pozitivní.Proces demokratizace v Bělorusku podpoří respektování práv a svobod obyvatel této země.Toto usnesení je vítané, protože doufám, že prostřednictvím tohoto opatření bude mít stále větší počet běloruských občanů přístup k vízům do států Evropské unie, takže se od nás mohou dozvědět o našich hodnotách a tradicích. Také doufám, že Bělorusko velmi brzy nebude mít žádné politické vězně nebo lidi držené v domácím vězení. ","Flaviu Călin Rus  (PPE-DE),",3,97,not_available,"['rum', 'rum', 'rum']","['  Flaviu Călin Rus  (PPE-DE),  písemně. – (RO) Hlasoval jsem ve prospěch usnesení EU o Bělorusku, protože se domnívám, že každý krok, který může zavést více demokracie do jakékoli země na světě, je pozitivní.', 'Proces demokratizace v Bělorusku podpoří respektování práv a svobod obyvatel této země.', 'Toto usnesení je vítané, protože doufám, že prostřednictvím tohoto opatření bude mít stále větší počet běloruských občanů přístup k vízům do států Evropské unie, takže se od nás mohou dozvědět o našich hodnotách a tradicích. Také doufám, že Bělorusko velmi brzy nebude mít žádné politické vězně nebo lidi držené v domácím vězení. ']"
145, 7. Vysvětlení hlasování,"  Charles Tannock  (PPE-DE),  písemně. − Já a moji kolegové britští konzervativci plně podporujeme potřebu, aby se demokratická opozice v Bělorusku zapojila do procesu postupného obnovení vztahů mezi EU a Běloruskem. Současný prezident Lukašenko, který je místní vládce a vede autoritářský režim, dává EU přátelské nabídky a distancuje se od Moskvy, což je proces, který bychom měli podpořit vylepšením svých politických vztahů s Minskem.Také podporujeme výzvy vládě Běloruska, aby prosazovala a respektovala lidská práva, což je důležitá součást procesu vylepšování vztahů mezi EU a Běloruskem.Z těchto důvodů a abychom zdůraznili význam, který přikládáme demokratické budoucnosti pro Bělorusko, jsme se rozhodli podpořit toto společné usnesení. Také chceme vyjasnit, že, s ohledem na odstavec 16 tohoto společného usnesení, otázka trestu smrti je pro britské konzervativní poslance EP věcí přesvědčení. ","Charles Tannock  (PPE-DE),",3,128,not_available,"['cze', 'cze', 'cze']","['  Charles Tannock  (PPE-DE),  písemně. − Já a moji kolegové britští konzervativci plně podporujeme potřebu, aby se demokratická opozice v Bělorusku zapojila do procesu postupného obnovení vztahů mezi EU a Běloruskem. Současný prezident Lukašenko, který je místní vládce a vede autoritářský režim, dává EU přátelské nabídky a distancuje se od Moskvy, což je proces, který bychom měli podpořit vylepšením svých politických vztahů s Minskem.', 'Také podporujeme výzvy vládě Běloruska, aby prosazovala a respektovala lidská práva, což je důležitá součást procesu vylepšování vztahů mezi EU a Běloruskem.', 'Z těchto důvodů a abychom zdůraznili význam, který přikládáme demokratické budoucnosti pro Bělorusko, jsme se rozhodli podpořit toto společné usnesení. Také chceme vyjasnit, že, s ohledem na odstavec 16 tohoto společného usnesení, otázka trestu smrti je pro britské konzervativní poslance EP věcí přesvědčení. ']"
146, 7. Vysvětlení hlasování,"  Alessandro Battilocchio  (PSE),  písemně. – (IT) Hlasoval jsem pro.Srebrenica je rána, která zanechala na historii Evropy hlubokou jizvu. Ti, kteří přežili, stále vyprávějí, jak se mezi dubnem 1992 a dubnem 1993 tisíce uprchlíků, ve snaze zachránit se před nájezdy bosenských Srbů, schovávali ve sklepích, garážích i domech, které opustili Srbové; jak měli k jídlu pouze kořínky; jak byli zamořeni blechami; jak se zmrzlí během dlouhé zimy roku 1992 zahřívali při pálení pneumatik a plastových lahví; a jak těla těch, kteří zemřeli hlady nebo zimou, pojídali psi. Sedmnáct let po masakru stále zbývají stovky těl, která mají být identifikována.Proto věřím, že zavedení dne vzpomínky by zajistilo, že nezapomeneme, vyjádřilo by soustrast s rodinnými příslušníky obětí tohoto nesmyslného masakru a přesvědčivějším způsobem by oživilo naše politiky pro Evropu míru, sociální spravedlnosti a svobody s jistotou, že respektu k rovnosti může být dosaženo pouze poznáním rozdílností. ","Alessandro Battilocchio  (PSE),",3,144,not_available,"['ita', 'ita', 'ita']","['  Alessandro Battilocchio  (PSE),  písemně. – (IT) Hlasoval jsem pro.', 'Srebrenica je rána, která zanechala na historii Evropy hlubokou jizvu. Ti, kteří přežili, stále vyprávějí, jak se mezi dubnem 1992 a dubnem 1993 tisíce uprchlíků, ve snaze zachránit se před nájezdy bosenských Srbů, schovávali ve sklepích, garážích i domech, které opustili Srbové; jak měli k jídlu pouze kořínky; jak byli zamořeni blechami; jak se zmrzlí během dlouhé zimy roku 1992 zahřívali při pálení pneumatik a plastových lahví; a jak těla těch, kteří zemřeli hlady nebo zimou, pojídali psi. Sedmnáct let po masakru stále zbývají stovky těl, která mají být identifikována.', 'Proto věřím, že zavedení dne vzpomínky by zajistilo, že nezapomeneme, vyjádřilo by soustrast s rodinnými příslušníky obětí tohoto nesmyslného masakru a přesvědčivějším způsobem by oživilo naše politiky pro Evropu míru, sociální spravedlnosti a svobody s jistotou, že respektu k rovnosti může být dosaženo pouze poznáním rozdílností. ']"
147, 7. Vysvětlení hlasování,"  Glyn Ford  (PSE),  písemně. − Toto usnesení nám tragicky připomíná, že krutost člověka k člověku neskončila po holokaustu 2. světové války. Pokračovala v Evropě Srebrenicí a dnes pokračuje v Gaze! ","Glyn Ford  (PSE),",1,29,not_available,['cze'],"['  Glyn Ford  (PSE),  písemně. − Toto usnesení nám tragicky připomíná, že krutost člověka k člověku neskončila po holokaustu 2. světové války. Pokračovala v Evropě Srebrenicí a dnes pokračuje v Gaze! ']"
148, 7. Vysvětlení hlasování,"  Erik Meijer  (GUE/NGL),  písemně. − (NL) Souhlasím s každoročním dnem vzpomínky na genocidu ve Srebrenici, právě proto, že zásah EU a jejích členských států vyvolal falešný pocit bezpečnosti, jehož následkem obyvatelé nedokázali prchnout včas. Ti, kteří mají v oblibě vojenské zásahy, neuslyší rádi tuto kritiku. Během mé včerejší řeči jsem byl v polovině umlčen panem předsedou, možná kvůli podrážděné reakci na obsah mé řeči. Poslední část, která byla sotva slyšet, protože pan předseda tloukl svým kladívkem, se hodí k této zprávě.Srebrenica je také symbolem pro nedostatek optimistických pohledů na humanitární intervence a uprchlické tábory. Mělo být od začátku vyjasněno, že přítomnost zahraničních vojsk mohla nabídnout pouze falešné iluze. Změnila Srebrenici v provozní základnu na srbském pozadí, přičemž bylo nevyhnutelné, že ji nakonec totéž pozadí pohltí.Bez nizozemské armády v Srebrenici by nebyla válečná situace a nebylo by třeba odplaty ze strany Srbů. Oběti nejsou jen důvodem, proč předvést Mladiće a Karadžiće před soud, ale také důvodem, proč se hovoří o neúspěchu vojenských zásahů a všech pokusů přinést jednotu do etnicky rozdělené Bosny. ","Erik Meijer  (GUE/NGL),",3,173,not_available,"['dut', 'dut', 'dut']","['  Erik Meijer  (GUE/NGL),  písemně. − (NL) Souhlasím s každoročním dnem vzpomínky na genocidu ve Srebrenici, právě proto, že zásah EU a jejích členských států vyvolal falešný pocit bezpečnosti, jehož následkem obyvatelé nedokázali prchnout včas. Ti, kteří mají v oblibě vojenské zásahy, neuslyší rádi tuto kritiku. Během mé včerejší řeči jsem byl v polovině umlčen panem předsedou, možná kvůli podrážděné reakci na obsah mé řeči. Poslední část, která byla sotva slyšet, protože pan předseda tloukl svým kladívkem, se hodí k této zprávě.', 'Srebrenica je také symbolem pro nedostatek optimistických pohledů na humanitární intervence a uprchlické tábory. Mělo být od začátku vyjasněno, že přítomnost zahraničních vojsk mohla nabídnout pouze falešné iluze. Změnila Srebrenici v provozní základnu na srbském pozadí, přičemž bylo nevyhnutelné, že ji nakonec totéž pozadí pohltí.', 'Bez nizozemské armády v Srebrenici by nebyla válečná situace a nebylo by třeba odplaty ze strany Srbů. Oběti nejsou jen důvodem, proč předvést Mladiće a Karadžiće před soud, ale také důvodem, proč se hovoří o neúspěchu vojenských zásahů a všech pokusů přinést jednotu do etnicky rozdělené Bosny. ']"
149, 7. Vysvětlení hlasování,"  Athanasios Pafilis  (GUE/NGL),  písemně. – (EL) Společné usnesení Evropského parlamentu o Srebrenici je pokusem o překroucení historie a o skrytí nebo přesunutí odpovědnosti za zločiny amerických a evropských imperialistů, rozdělení země a barbarskou válku, kterou proti ní rozpoutalo NATO s pomocí EU, na oběti v bývalé Jugoslávii.Zároveň se pokouší zlepšit postavení opovrhovaného, Amerikou inspirovaného zvláštního soudu v Haagu, před nímž chtějí imperialisté soudit své oběti a který již byl využit k fyzické likvidaci jugoslávského vůdce Slobodana Miloševiče.Nazývat události v Srebrenici největším poválečným zločinem a navrhovat uznání dne pro uctění jejich památky v členských státech EU, zatímco stále existují závažné otázky o tom, co se tam vlastně stalo, je hrubé zkreslování dějin, protože ve skutečnosti dosud největším poválečným zločinem v Evropě je vraždění obyvatel Jugoslávie americkými a evropskými imperialisty.Komunistická strana Řecka odmítá podporovat přijetí takových nepřijatelných usnesení, zejména v době, kdy jsme všichni svědky každodenního zabíjení stovek dětí a civilistů Izraelci v Palestině, s podporou stejných imperialistických vojenských sil, které nyní přivírají oči, a obyvatelé Jugoslávie nebyli součástí probíraného usnesení. ","Athanasios Pafilis  (GUE/NGL),",4,172,not_available,"['gre', 'gre', 'gre', 'gre']","['  Athanasios Pafilis  (GUE/NGL),  písemně. – (EL) Společné usnesení Evropského parlamentu o Srebrenici je pokusem o překroucení historie a o skrytí nebo přesunutí odpovědnosti za zločiny amerických a evropských imperialistů, rozdělení země a barbarskou válku, kterou proti ní rozpoutalo NATO s pomocí EU, na oběti v bývalé Jugoslávii.', 'Zároveň se pokouší zlepšit postavení opovrhovaného, Amerikou inspirovaného zvláštního soudu v Haagu, před nímž chtějí imperialisté soudit své oběti a který již byl využit k fyzické likvidaci jugoslávského vůdce Slobodana Miloševiče.', 'Nazývat události v Srebrenici největším poválečným zločinem a navrhovat uznání dne pro uctění jejich památky v členských státech EU, zatímco stále existují závažné otázky o tom, co se tam vlastně stalo, je hrubé zkreslování dějin, protože ve skutečnosti dosud největším poválečným zločinem v Evropě je vraždění obyvatel Jugoslávie americkými a evropskými imperialisty.', 'Komunistická strana Řecka odmítá podporovat přijetí takových nepřijatelných usnesení, zejména v době, kdy jsme všichni svědky každodenního zabíjení stovek dětí a civilistů Izraelci v Palestině, s podporou stejných imperialistických vojenských sil, které nyní přivírají oči, a obyvatelé Jugoslávie nebyli součástí probíraného usnesení. ']"
150, 7. Vysvětlení hlasování,"  Luís Queiró  (PPE-DE),  písemně. − (PT) Ponurá historie Evropy, lidská schopnost odhalit to nejhorší ze sebe, ještě neskončila. Srebrenica a její strašná tragédie nejsou jen nedávným příkladem lidské hrůzy. Jsou připomínkou, pokud jsou takové vůbec potřeba, že destrukce je vždy možná, že lidskou dispozicí je neustálá snaha o mír a že nic, čeho dosáhneme, není trvalé. Ovšem památka tohoto masakru, připomínka této tragédie, je také pocta, kterou zlo vzdává dobru.Pro nás Portugalce, kteří jsme geograficky a kulturně vzdálení od míst, kde se udály hlavní evropské hrůzy 20. století, a kteří máme jinou historii, je ještě důležitější si je připomínat. Geografie a kultura nám poskytují různé historie, ale nerozlišují naše lidské dispozice. Připomínka toho, čeho jsme mohli být svědky, by měla být nedílnou součástí našeho dědictví. ","Luís Queiró  (PPE-DE),",2,126,not_available,"['por', 'por']","['  Luís Queiró  (PPE-DE),  písemně. − (PT) Ponurá historie Evropy, lidská schopnost odhalit to nejhorší ze sebe, ještě neskončila. Srebrenica a její strašná tragédie nejsou jen nedávným příkladem lidské hrůzy. Jsou připomínkou, pokud jsou takové vůbec potřeba, že destrukce je vždy možná, že lidskou dispozicí je neustálá snaha o mír a že nic, čeho dosáhneme, není trvalé. Ovšem památka tohoto masakru, připomínka této tragédie, je také pocta, kterou zlo vzdává dobru.', 'Pro nás Portugalce, kteří jsme geograficky a kulturně vzdálení od míst, kde se udály hlavní evropské hrůzy 20. století, a kteří máme jinou historii, je ještě důležitější si je připomínat. Geografie a kultura nám poskytují různé historie, ale nerozlišují naše lidské dispozice. Připomínka toho, čeho jsme mohli být svědky, by měla být nedílnou součástí našeho dědictví. ']"
