,agenda_item,text,speaker,number_p,number_w,chair,language_ps,ps
0, 1. Zahájení zasedání,PŘEDSEDAJÍCÍ: PAN COCILOVO Místopředseda,PŘEDSEDAJÍCÍ: PAN COCILOVO,1,4,not_available,['cze'],['PŘEDSEDAJÍCÍ: PAN COCILOVO Místopředseda']
1, 2. Přeprava zvířat (rozprava),"  Předsedající.   – Dalším bodem je rozprava o ústní otázce pro Komisi, kterou pokládá pan Parish jménem Výboru pro zemědělství a rozvoj venkova, týkající se přepravy zvířat (O-0134/2008 - B6-0496/2008). ",Předsedající.,1,31,not_available,['cze'],"['  Předsedající.   – Dalším bodem je rozprava o ústní otázce pro Komisi, kterou pokládá pan Parish jménem Výboru pro zemědělství a rozvoj venkova, týkající se přepravy zvířat (O-0134/2008 - B6-0496/2008). ']"
2, 2. Přeprava zvířat (rozprava),"  Neil Parish,  autor. − Pane předsedající, vznáším dnes tuto ústní otázku nejen jménem Výboru pro zemědělství a rozvoj venkova, ale také jménem pracovní skupiny pro dobré životní podmínky zvířat, protože jsem přesvědčen, že máme v Evropské unii velmi silné zemědělství. Ale abychom mohli mít silné zemědělství, musíme mít také silnou politiku dobrých podmínek, protože se domnívám, že budoucnost evropského zemědělství spočívá do velké míry ve vysoce kvalitních výrobcích a ve velmi dobrých normách pro životní podmínky zvířat. Tak můžeme pozitivně propagovat své výrobky, a proto přeprava zvířat není jen motivem, ale je nezbytné zavést správné právní předpisy.Dnes se chci zaměřit na skutečnost, že máme zavedeny právní předpisy. Můžeme se dohadovat, zda jsou dostatečné či nikoli, ale hlavním úkolem je nyní tyto předpisy zkontrolovat a ujistit se, že se jimi členské státy řídí, protože víme, že například v některých členských státech mají vnitrostátní vlády potíže při zavádění těchto předpisů a regionální vlády při jejich provádění. Pak se vyskytují problémy. A nakonec tím trpí zvířata.Mohl bych zdůraznit mnoho věcí, ale specifickou oblastí, s níž máme v Evropě potíže, je přeprava koní. Mnoho koní končí svou životní dráhu v salámu v Itálii a rozhodně se nepřepravují v nejlepších podmínkách. Mnohé tyto vozy jsme v našich členských státech, které nedodržují pravidla, sledovali. Přepravci nezastavují ve správnou dobu, nepoužívají vozy předepsaných typů a nezajišťují řádnou klimatizaci a napájení a to nesmí pokračovat.Často říkám Komisi, aby nenavyšovala náklady, ale když jedou zvířata na porážku a náklady na dopravu se zvýší, protože je třeba odvádět dobrou práci, protože je třeba mít správné vozy, které nesmějí být přeplněné, pak říkám, správně, tak to má být! Protože často místo toho, aby byla zvířata na porážku převážena do vzdálených míst, měla by být zabita v daném členském státě a být převážena jako chlazené maso. Proto máme v této oblasti ještě mnoho práce.Také bych vám rád řekl, že pan Kyprianou, minulý komisař za GŘ SANCO, nás ujistil, v době, kdy byl komisařem, že bude nejen řádně provádět stávající právní předpisy, ale také že na konci volebního období situaci zreviduje. Blížíme se velmi rychle ke konci tohoto parlamentního zasedání a ke konci této stávající Komise a já bych chtěl vyzvat paní Vassiliouovou, která pana Kyprianoua velmi dobře nahradila, aby dostála tomuto závazku, protože přeprava zvířat patří mezi věci, které musíme brát nesmírně vážně.Na tyto problémy jsme již mnohokrát upozorňovali, ale jsme civilizovaná společnost a civilizovaná společnost je v mnoha ohledech souzena podle toho, jak zachází nejen se svými lidmi, ale také se svými zvířaty. Proto nemohu, jak jsem řekl, tuto problematiku vyzdvihnout dostatečně.Mé poslední poznámky se týkají samotné ústní otázky a toho, že nařízení o přepravě zvířat vstoupilo v platnost v roce 2007. Proto by Komise měla obdržet první výroční zprávy z členských států o vymáhání nařízení. Může Komise sdělit, které členské státy poskytly tyto zprávy? Provedla již Komise předběžnou analýzu zpráv, která by umožnila zhodnocení nedostatků a obtíží, ale také hlavních úspěchů při vymáhání právních předpisů? Připraví Komise následnou zprávu o postupu vymáhání nařízení v členských státech? Tato analýza bude nezbytná v souvislosti s plánováním revize nařízení o přepravě zvířat. Proto bych, pane komisaři, rád slyšel odpovědi na tyto otázky. ","Neil Parish,",7,524,not_available,"['cze', 'cze', 'cze', 'cze', 'cze', 'cze', 'cze']","['  Neil Parish,  autor. − Pane předsedající, vznáším dnes tuto ústní otázku nejen jménem Výboru pro zemědělství a rozvoj venkova, ale také jménem pracovní skupiny pro dobré životní podmínky zvířat, protože jsem přesvědčen, že máme v Evropské unii velmi silné zemědělství. Ale abychom mohli mít silné zemědělství, musíme mít také silnou politiku dobrých podmínek, protože se domnívám, že budoucnost evropského zemědělství spočívá do velké míry ve vysoce kvalitních výrobcích a ve velmi dobrých normách pro životní podmínky zvířat. Tak můžeme pozitivně propagovat své výrobky, a proto přeprava zvířat není jen motivem, ale je nezbytné zavést správné právní předpisy.', 'Dnes se chci zaměřit na skutečnost, že máme zavedeny právní předpisy. Můžeme se dohadovat, zda jsou dostatečné či nikoli, ale hlavním úkolem je nyní tyto předpisy zkontrolovat a ujistit se, že se jimi členské státy řídí, protože víme, že například v některých členských státech mají vnitrostátní vlády potíže při zavádění těchto předpisů a regionální vlády při jejich provádění. Pak se vyskytují problémy. A nakonec tím trpí zvířata.', 'Mohl bych zdůraznit mnoho věcí, ale specifickou oblastí, s níž máme v Evropě potíže, je přeprava koní. Mnoho koní končí svou životní dráhu v salámu v Itálii a rozhodně se nepřepravují v nejlepších podmínkách. Mnohé tyto vozy jsme v našich členských státech, které nedodržují pravidla, sledovali. Přepravci nezastavují ve správnou dobu, nepoužívají vozy předepsaných typů a nezajišťují řádnou klimatizaci a napájení a to nesmí pokračovat.', 'Často říkám Komisi, aby nenavyšovala náklady, ale když jedou zvířata na porážku a náklady na dopravu se zvýší, protože je třeba odvádět dobrou práci, protože je třeba mít správné vozy, které nesmějí být přeplněné, pak říkám, správně, tak to má být! Protože často místo toho, aby byla zvířata na porážku převážena do vzdálených míst, měla by být zabita v daném členském státě a být převážena jako chlazené maso. Proto máme v této oblasti ještě mnoho práce.', 'Také bych vám rád řekl, že pan Kyprianou, minulý komisař za GŘ SANCO, nás ujistil, v době, kdy byl komisařem, že bude nejen řádně provádět stávající právní předpisy, ale také že na konci volebního období situaci zreviduje. Blížíme se velmi rychle ke konci tohoto parlamentního zasedání a ke konci této stávající Komise a já bych chtěl vyzvat paní Vassiliouovou, která pana Kyprianoua velmi dobře nahradila, aby dostála tomuto závazku, protože přeprava zvířat patří mezi věci, které musíme brát nesmírně vážně.', 'Na tyto problémy jsme již mnohokrát upozorňovali, ale jsme civilizovaná společnost a civilizovaná společnost je v mnoha ohledech souzena podle toho, jak zachází nejen se svými lidmi, ale také se svými zvířaty. Proto nemohu, jak jsem řekl, tuto problematiku vyzdvihnout dostatečně.', 'Mé poslední poznámky se týkají samotné ústní otázky a toho, že nařízení o přepravě zvířat vstoupilo v platnost v roce 2007. Proto by Komise měla obdržet první výroční zprávy z členských států o vymáhání nařízení. Může Komise sdělit, které členské státy poskytly tyto zprávy? Provedla již Komise předběžnou analýzu zpráv, která by umožnila zhodnocení nedostatků a obtíží, ale také hlavních úspěchů při vymáhání právních předpisů? Připraví Komise následnou zprávu o postupu vymáhání nařízení v členských státech? Tato analýza bude nezbytná v souvislosti s plánováním revize nařízení o přepravě zvířat. Proto bych, pane komisaři, rád slyšel odpovědi na tyto otázky. ']"
3, 2. Přeprava zvířat (rozprava),"  Vladimír Špidla,  člen Komise. − Vážený pane předsedo, vážený pane poslanče, vážené dámy, vážení pánové, souhlasím naprosto s názorem pana poslance, že způsob, kterým zacházíme se zvířaty, a to i hospodářskými zvířaty, je současně i etickou otázkou a otázkou civilizace nepochybně. Komise si je vědoma, že přeprava zvířat pro obchodní účely může zvířatům přivodit vážné utrpení. Takovému utrpení jsou zejména vystavena tzv. zvířata nízké hodnoty, jako jsou jatečná zvířata. Prosazování právních předpisů v oblasti přepravy na dlouhé vzdálenosti není uspokojivé. V uplynulých měsících Komise obdržela zprávy o případech krutého zacházení se zvířaty. Komise nadále podporuje nejlepší dostupné možnosti ke zlepšení situace. Konečným cílem je lepší prosazování právních předpisů Evropské unie, a tudíž zlepšení zdraví zvířat a dobrých životních podmínek dotčených zvířat. Ve studii provedené společným výzkumným střediskem se dospělo k závěru, že nové a účinnější systémy kontroly, jako je sledování přepravy pomocí družicových systémů pro určování polohy, by mohly přispět ke zlepšení situace a umožnit transparentnější provádění pravidel. Použití těchto nových technologií by rovněž přispělo ke snížení administrativní zátěže vnitrostátních orgánů a subjektů.Komise také posuzuje možnost navrhnout, a to ještě do konce tohoto mandátu, nové normy na základě výsledků vědeckého výzkumu týkajícího se doby trvání přepravy, počtu naložených zvířat a počtu naložených zvířat ve vozidlech. Komise posuzuje provádění právních předpisů Evropské unie na základě zpráv poskytnutých členskými státy v souladu se stávajícím nařízením EU. Informace obsažené v těchto zprávách jsou sloučeny s výsledky kontrol na místě prováděných v členských státech veterinárními znalci. Výsledky těchto kontrol provedených znalci Komise jsou zveřejňovány prostřednictvím internetových stránek Komise. Údaje jsou rovněž posuzovány v souvislosti se zprávami vydanými mezinárodními nevládními organizacemi, které působí v této oblasti.Velká většina členských států již předala Komisi zprávy o přepravě zvířat za rok 2007. Do konce roku 2008 své zprávy ještě nezaslaly Kypr, Litva, Malta, Bulharsko a Lucembursko. Komise je upozornila na jejich povinnost a nadále bude situaci pozorně sledovat. Nařízení (ES) č. 1/2005 však nevyžaduje, aby Komise vypracovala zprávu o postupu prosazování nařízení v členských státech. Komise souhlasí s tím, že vynutitelnost je klíčovým aspektem jakéhokoliv navrhovaného právního předpisu. V důsledku toho by Komise přihlédla k analýze zpráv členských států pro případné budoucí revize právních předpisů Společenství v této oblasti. ","Vladimír Špidla,",3,363,not_available,"['cze', 'cze', 'cze']","['  Vladimír Špidla,  člen Komise. − Vážený pane předsedo, vážený pane poslanče, vážené dámy, vážení pánové, souhlasím naprosto s názorem pana poslance, že způsob, kterým zacházíme se zvířaty, a to i hospodářskými zvířaty, je současně i etickou otázkou a otázkou civilizace nepochybně. Komise si je vědoma, že přeprava zvířat pro obchodní účely může zvířatům přivodit vážné utrpení. Takovému utrpení jsou zejména vystavena tzv. zvířata nízké hodnoty, jako jsou jatečná zvířata. Prosazování právních předpisů v oblasti přepravy na dlouhé vzdálenosti není uspokojivé. V uplynulých měsících Komise obdržela zprávy o případech krutého zacházení se zvířaty. Komise nadále podporuje nejlepší dostupné možnosti ke zlepšení situace. Konečným cílem je lepší prosazování právních předpisů Evropské unie, a tudíž zlepšení zdraví zvířat a dobrých životních podmínek dotčených zvířat. Ve studii provedené společným výzkumným střediskem se dospělo k závěru, že nové a účinnější systémy kontroly, jako je sledování přepravy pomocí družicových systémů pro určování polohy, by mohly přispět ke zlepšení situace a umožnit transparentnější provádění pravidel. Použití těchto nových technologií by rovněž přispělo ke snížení administrativní zátěže vnitrostátních orgánů a subjektů.', 'Komise také posuzuje možnost navrhnout, a to ještě do konce tohoto mandátu, nové normy na základě výsledků vědeckého výzkumu týkajícího se doby trvání přepravy, počtu naložených zvířat a počtu naložených zvířat ve vozidlech. Komise posuzuje provádění právních předpisů Evropské unie na základě zpráv poskytnutých členskými státy v souladu se stávajícím nařízením EU. Informace obsažené v těchto zprávách jsou sloučeny s výsledky kontrol na místě prováděných v členských státech veterinárními znalci. Výsledky těchto kontrol provedených znalci Komise jsou zveřejňovány prostřednictvím internetových stránek Komise. Údaje jsou rovněž posuzovány v souvislosti se zprávami vydanými mezinárodními nevládními organizacemi, které působí v této oblasti.', 'Velká většina členských států již předala Komisi zprávy o přepravě zvířat za rok 2007. Do konce roku 2008 své zprávy ještě nezaslaly Kypr, Litva, Malta, Bulharsko a Lucembursko. Komise je upozornila na jejich povinnost a nadále bude situaci pozorně sledovat. Nařízení (ES) č. 1/2005 však nevyžaduje, aby Komise vypracovala zprávu o postupu prosazování nařízení v členských státech. Komise souhlasí s tím, že vynutitelnost je klíčovým aspektem jakéhokoliv navrhovaného právního předpisu. V důsledku toho by Komise přihlédla k analýze zpráv členských států pro případné budoucí revize právních předpisů Společenství v této oblasti. ']"
4, 2. Přeprava zvířat (rozprava),"  Struan Stevenson,  jménem skupiny PPE-DE. – Pane předsedající, podívejme se nejprve na pozadí tohoto problému. Tento povinný osmihodinový časový limit pro přepravu zvířat byl dohodnut v prosinci 2004 a vstoupil v platnost v lednu 2007 ve všech 27 členských státech se zvláštními výjimkami pro delší cesty, kde je možné dokázat, že vozidlo bylo vhodně upraveno a poskytuje zvířatům přístup k vodě, umožňuje kontrolu teploty, řádnou ventilaci, a pokud se do cesty začlení pravidelné odpočívací pauzy.Zvláštní výjimky byly také povoleny odlehlým venkovským oblastem a ostrovům, jako jsou v mém volebním obvodu například Orkneje a Shetlandy, kde jsou dlouhé přepravní časy nevyhnutelné. Pro tyto případy byly ovšem navrženy zvláštní jednotky vybavené lůžky a přístupem k vodě, takže zvířata mohou být přepravována v relativním pohodlí. Navíc byl uvalen úplný zákaz převážení některých zvířat, jako jsou telata mladší 10 dnů a jehňata mladší jednoho týdne.S jistým uspokojením oznamuji, že tato přepravní pravidla byla přísně dodržována, zejména v zemích, jako je Skotsko, kde udržujeme osvědčené postupy na úrovni, která patří mezi nejlepší v celé EU. Ale znepokojují mě zprávy, že, jak nám sdělil Neil Parish, v jiných částech EU se tato pravidla nedodržují stejnou měrou, zejména v některých jižních středomořských členských státech a v některých nově přidružených východoevropských státech, zejména, jak zdůraznil Neil Parish, v těch, které se zabývají přepravou koní na porážku.Nevládní organizace zabývající se dobrými životními podmínkami zvířat stále podávají důkazy otřesného týrání, kdy jsou koně a někdy i jiná hospodářská zvířata přepravována na ohromné vzdálenosti v úmorném horku, bez přístupu k vodě a bez řádné ventilace, bez pauz na odpočinek, namačkána do přeplněných nákladních vozů. Při převozu trpí stále větším vyčerpáním a dehydratací, některá podléhají náporu horka a zoufale supí a lapají po dechu a v nejhorších případech mnohá z nich uhynou. Tyto praktiky musí být zastaveny a všechny členské státy musí dbát na přísné dodržování nařízení.Podporuji požadavky dnešní ústní otázky Neila Parishe, která chce prozkoumat úroveň dodržování těchto opatření. Doufám, že Komise nám nyní může poskytnout informace a ujistit nás, že jsou přijímána opatření pro zajištění pečlivého provádění osmihodinového limitu pro převoz zvířat, s vhodnými výjimkami, které jsem zmínil, a pro zastavení hrubého porušování stávajících nařízení EU, k němuž stále dochází. ","Struan Stevenson,",5,364,not_available,"['cze', 'cze', 'cze', 'cze', 'cze']","['  Struan Stevenson,  jménem skupiny PPE-DE. – Pane předsedající, podívejme se nejprve na pozadí tohoto problému. Tento povinný osmihodinový časový limit pro přepravu zvířat byl dohodnut v prosinci 2004 a vstoupil v platnost v lednu 2007 ve všech 27 členských státech se zvláštními výjimkami pro delší cesty, kde je možné dokázat, že vozidlo bylo vhodně upraveno a poskytuje zvířatům přístup k vodě, umožňuje kontrolu teploty, řádnou ventilaci, a pokud se do cesty začlení pravidelné odpočívací pauzy.', 'Zvláštní výjimky byly také povoleny odlehlým venkovským oblastem a ostrovům, jako jsou v mém volebním obvodu například Orkneje a Shetlandy, kde jsou dlouhé přepravní časy nevyhnutelné. Pro tyto případy byly ovšem navrženy zvláštní jednotky vybavené lůžky a přístupem k vodě, takže zvířata mohou být přepravována v relativním pohodlí. Navíc byl uvalen úplný zákaz převážení některých zvířat, jako jsou telata mladší 10 dnů a jehňata mladší jednoho týdne.', 'S jistým uspokojením oznamuji, že tato přepravní pravidla byla přísně dodržována, zejména v zemích, jako je Skotsko, kde udržujeme osvědčené postupy na úrovni, která patří mezi nejlepší v celé EU. Ale znepokojují mě zprávy, že, jak nám sdělil Neil Parish, v jiných částech EU se tato pravidla nedodržují stejnou měrou, zejména v některých jižních středomořských členských státech a v některých nově přidružených východoevropských státech, zejména, jak zdůraznil Neil Parish, v těch, které se zabývají přepravou koní na porážku.', 'Nevládní organizace zabývající se dobrými životními podmínkami zvířat stále podávají důkazy otřesného týrání, kdy jsou koně a někdy i jiná hospodářská zvířata přepravována na ohromné vzdálenosti v úmorném horku, bez přístupu k vodě a bez řádné ventilace, bez pauz na odpočinek, namačkána do přeplněných nákladních vozů. Při převozu trpí stále větším vyčerpáním a dehydratací, některá podléhají náporu horka a zoufale supí a lapají po dechu a v nejhorších případech mnohá z nich uhynou. Tyto praktiky musí být zastaveny a všechny členské státy musí dbát na přísné dodržování nařízení.', 'Podporuji požadavky dnešní ústní otázky Neila Parishe, která chce prozkoumat úroveň dodržování těchto opatření. Doufám, že Komise nám nyní může poskytnout informace a ujistit nás, že jsou přijímána opatření pro zajištění pečlivého provádění osmihodinového limitu pro převoz zvířat, s vhodnými výjimkami, které jsem zmínil, a pro zastavení hrubého porušování stávajících nařízení EU, k němuž stále dochází. ']"
5, 2. Přeprava zvířat (rozprava),"  Rosa Miguélez Ramos,  jménem skupiny PSE. – (ES) Pane předsedající, dámy a pánové, pro některé evropské země, v závislosti na jejich geografické poloze – jak naznačil pan Stevenson – a také na jejich rozloze a objemu jejich obchodního toku, je přeprava zvířat obzvláště důležitým tématem.Pane komisaři, ráda bych se zmínila o dvou zvláštních otázkách. Zaprvé, stále se mi zdá, že Komise má potíže s vedením analýzy situace na celém území Společenství. Přestože na základě současného nařízení by členské státy měly – jak jsme viděli – každý rok vydávat zprávu o kontrolách provedených v uplynulém roce, nařízení nestanoví minimální počet kontrol a zdá se, že zde není ani jednotnost ohledně statistického základu. To brání srovnání údajů z různých zemí. Pane komisaři, domnívám se, že tento stav by měl být v zájmu všech zúčastněných co nejdříve napraven.Znepokojuje mě však ještě jedna věc. Ve své řeči jste hovořil o zvířatech přepravovaných na jatka jako o zvířatech nízké hodnoty. V tom s vámi, pane komisaři, naprosto nesouhlasím. Osobně je považuji za zvířata s vysokou hospodářskou hodnotou a jsem si jistá, že průmysl se mnou souhlasí. Protože je to tak a toto maso má vysokou hospodářskou hodnotu, správné přepravní podmínky jsou nezbytné bez ohledu na to, jaké je místo určení – i když se jedná o jatka – a o jakou jde vzdálenost. Jinými slovy, přeprava těchto zvířat v příznivých podmínkách je významný, ba dokonce hlavní úkol.Proto vás žádám o přihlédnutí k těmto postřehům v navrhovaných změnách nařízení, na nichž Komise právě pracuje. Víme, že reforma, stejně jako nové technologie, vyřeší změny týkající s maximální doby převozu – jak již zde bylo řečeno – a maximálních a minimálních teplot při přepravě zvířat.Znovu vás žádám, pane komisaři, a žádám Komisi, aby před provedením navrhovaných změn v tak zásadních otázkách byl nalezen pevný vědecký základ. Kromě toho vás žádám, dokud tento pevný vědecký základ, který momentálně v některých otázkách chybí, nemáme, měli bychom upustit od podloudného zavádění navrhovaných změn stávajících nařízení ve zprávách, které nemají nic společného s dopravou – mluvím o ochraně zvířat v době porážky, o zprávě, na které právě pracujeme. Domnívám se, že v takto důležitých a významných záležitostech bychom všichni – Komise i Parlament – měli vyložit své karty na stůl. ","Rosa Miguélez Ramos,",5,360,not_available,"['spa', 'spa', 'spa', 'spa', 'spa']","['  Rosa Miguélez Ramos,  jménem skupiny PSE. – (ES) Pane předsedající, dámy a pánové, pro některé evropské země, v závislosti na jejich geografické poloze – jak naznačil pan Stevenson – a také na jejich rozloze a objemu jejich obchodního toku, je přeprava zvířat obzvláště důležitým tématem.', 'Pane komisaři, ráda bych se zmínila o dvou zvláštních otázkách. Zaprvé, stále se mi zdá, že Komise má potíže s vedením analýzy situace na celém území Společenství. Přestože na základě současného nařízení by členské státy měly – jak jsme viděli – každý rok vydávat zprávu o kontrolách provedených v uplynulém roce, nařízení nestanoví minimální počet kontrol a zdá se, že zde není ani jednotnost ohledně statistického základu. To brání srovnání údajů z různých zemí. Pane komisaři, domnívám se, že tento stav by měl být v zájmu všech zúčastněných co nejdříve napraven.', 'Znepokojuje mě však ještě jedna věc. Ve své řeči jste hovořil o zvířatech přepravovaných na jatka jako o zvířatech nízké hodnoty. V tom s vámi, pane komisaři, naprosto nesouhlasím. Osobně je považuji za zvířata s vysokou hospodářskou hodnotou a jsem si jistá, že průmysl se mnou souhlasí. Protože je to tak a toto maso má vysokou hospodářskou hodnotu, správné přepravní podmínky jsou nezbytné bez ohledu na to, jaké je místo určení – i když se jedná o jatka – a o jakou jde vzdálenost. Jinými slovy, přeprava těchto zvířat v příznivých podmínkách je významný, ba dokonce hlavní úkol.', 'Proto vás žádám o přihlédnutí k těmto postřehům v navrhovaných změnách nařízení, na nichž Komise právě pracuje. Víme, že reforma, stejně jako nové technologie, vyřeší změny týkající s maximální doby převozu – jak již zde bylo řečeno – a maximálních a minimálních teplot při přepravě zvířat.', 'Znovu vás žádám, pane komisaři, a žádám Komisi, aby před provedením navrhovaných změn v tak zásadních otázkách byl nalezen pevný vědecký základ. Kromě toho vás žádám, dokud tento pevný vědecký základ, který momentálně v některých otázkách chybí, nemáme, měli bychom upustit od podloudného zavádění navrhovaných změn stávajících nařízení ve zprávách, které nemají nic společného s dopravou – mluvím o ochraně zvířat v době porážky, o zprávě, na které právě pracujeme. Domnívám se, že v takto důležitých a významných záležitostech bychom všichni – Komise i Parlament – měli vyložit své karty na stůl. ']"
