,agenda_item,text,speaker,number_p,number_w,chair,language_ps,ps
0, 1. Zahájení zasedání,PŘEDSEDAJÍCÍ: PAN VIDAL-QUADRAS Místopředseda,PŘEDSEDAJÍCÍ: PAN VIDAL-QUADRAS,1,5,not_available,['cze'],['PŘEDSEDAJÍCÍ: PAN VIDAL-QUADRAS Místopředseda']
1, 3. Uvádění na trh a používání krmiv (rozprava) ,  Předsedající.   – Dalším bodem programu je zpráva (A6-0407/2008) pana Graefe zu Baringdorf za Výbor pro zemědělství a rozvoj venkova o návrhu nařízení Evropského parlamentu a Rady o uvádění na trh a používání krmiv (KOM(2008)0124 – C6-0128/2008 – 2008/0050(COD)). ,Předsedající.,1,43,not_available,['cze'],['  Předsedající.   – Dalším bodem programu je zpráva (A6-0407/2008) pana Graefe zu Baringdorf za Výbor pro zemědělství a rozvoj venkova o návrhu nařízení Evropského parlamentu a Rady o uvádění na trh a používání krmiv (KOM(2008)0124 – C6-0128/2008 – 2008/0050(COD)). ']
2, 3. Uvádění na trh a používání krmiv (rozprava) ,"  Friedrich-Wilhelm Graefe zu Baringdorf,  zpravodaj. – (DE) Pane předsedající, paní komisařko, dnes projednáváme tzv. „otevřené prohlášení“. Týká se transparentnosti v oblasti krmiv, které je základem zdravých potravin pro spotřebitele, a poskytuje těm, kdo používají krmné směsi, přehled o tom, co kupují.Urazili jsme dlouhý kus cesty, ale pokud dnes přijmeme toto nařízení, přivedeme, jak doufám, celou záležitost ke zdárnému konci, a rád bych poděkoval Komisi, která nám svým konstruktivním přístupem k této záležitosti významně pomohla. Komise se setkala v Parlamentu s bezvýhradnou politickou vůlí prosadit toto otevřené prohlášení a rovněž podstoupila neústupnou, i když čestnou rozpravu s Radou. Na výsledky můžeme být hrdí.Dovolte mi krátký pohled do historie. V roce 1997 vydal v důsledku krize související s BSE dočasný vyšetřovací výbor závěrečnou zprávu, v níž Parlament vyzývá k zavedení tohoto „otevřeného prohlášení“. Komise předložila návrh, z něhož se později stala směrnice 2002/2/ES. Po dojednání kompromisu s Radou – který prošel všemi orgány – bylo prostřednictvím směrnice zavedeno otevřené prohlášení, z něhož vyplývá, že údaje na etiketě musí uvádět složky s tolerancí ± 15 %, přičemž informace o přesném složení se poskytují na požádání.Jednalo se o směrnici a nikoli o nařízení a členské státy ji uplatňovaly jen zdráhavě, pokud vůbec. Výrobci krmiv podali žalobu u Evropského soudního dvora, který vydal potvrzení prvního stupně: kromě přesného uvádění informací je zákonnost této směrnice nesporná. Rozsudek jsme následně zohlednili v dalším projednávání v Parlamentu a celou záležitost jsme nyní uzavřeli ve formě tohoto nařízení. Pokaždé se mi dostalo cti být zpravodajem a po celou tu dlouhou dobu jsem se těšil z usilovné spolupráce s Komisí založené na důvěře.Nyní máme před sebou výsledek tvrdého, ale čestného boje, na který můžeme být hrdí. Je rovněž zřejmé, že se těší z podpory této sněmovny i jednotlivých skupin. Ze skutečnosti, že nejsou předloženy žádné pozměňovací návrhy, usuzuji, že toto nařízení bude přijato velkou většinou. Máme tedy kvalitní nařízení, které zavádí otevřené prohlášení ve třech krocích – víte, o které se jedná – za prvé, uvádění složek v sestupném pořadí podle jejich hmotnostních podílů; za druhé, poskytování informací ze strany výrobců krmiv s tolerancí ± 15 %  –v této souvislosti jsme v této právní úpravě nestanovili výhradu práv duševního vlastnictví, ale odkázali jsme na obecné právní předpisy –; a za třetí, ustanovení o poskytování přesných informací orgánům.Dále bych rád zdůraznil, že jsme zavedli registr. V Evropské unii od nynějška nebude zkrmována ani přimíchávána žádná složka, aniž by nebyla zveřejněna, protože tyto složky musí být zahrnuty do registru. To je důležité nejen pro dozorčí orgány, ale i pro veřejnost a spotřebitele. Mohu proto prohlásit, že z hlediska zpravodaje jsem s celkovými výsledky velmi spokojen. ","Friedrich-Wilhelm Graefe zu Baringdorf,",6,431,not_available,"['ger', 'ger', 'ger', 'ger', 'ger', 'ger']","['  Friedrich-Wilhelm Graefe zu Baringdorf,  zpravodaj. – (DE) Pane předsedající, paní komisařko, dnes projednáváme tzv. „otevřené prohlášení“. Týká se transparentnosti v oblasti krmiv, které je základem zdravých potravin pro spotřebitele, a poskytuje těm, kdo používají krmné směsi, přehled o tom, co kupují.', 'Urazili jsme dlouhý kus cesty, ale pokud dnes přijmeme toto nařízení, přivedeme, jak doufám, celou záležitost ke zdárnému konci, a rád bych poděkoval Komisi, která nám svým konstruktivním přístupem k této záležitosti významně pomohla. Komise se setkala v Parlamentu s bezvýhradnou politickou vůlí prosadit toto otevřené prohlášení a rovněž podstoupila neústupnou, i když čestnou rozpravu s Radou. Na výsledky můžeme být hrdí.', 'Dovolte mi krátký pohled do historie. V roce 1997 vydal v důsledku krize související s BSE dočasný vyšetřovací výbor závěrečnou zprávu, v níž Parlament vyzývá k zavedení tohoto „otevřeného prohlášení“. Komise předložila návrh, z něhož se později stala směrnice 2002/2/ES. Po dojednání kompromisu s Radou – který prošel všemi orgány – bylo prostřednictvím směrnice zavedeno otevřené prohlášení, z něhož vyplývá, že údaje na etiketě musí uvádět složky s tolerancí ± 15 %, přičemž informace o přesném složení se poskytují na požádání.', 'Jednalo se o směrnici a nikoli o nařízení a členské státy ji uplatňovaly jen zdráhavě, pokud vůbec. Výrobci krmiv podali žalobu u Evropského soudního dvora, který vydal potvrzení prvního stupně: kromě přesného uvádění informací je zákonnost této směrnice nesporná. Rozsudek jsme následně zohlednili v dalším projednávání v Parlamentu a celou záležitost jsme nyní uzavřeli ve formě tohoto nařízení. Pokaždé se mi dostalo cti být zpravodajem a po celou tu dlouhou dobu jsem se těšil z usilovné spolupráce s Komisí založené na důvěře.', 'Nyní máme před sebou výsledek tvrdého, ale čestného boje, na který můžeme být hrdí. Je rovněž zřejmé, že se těší z podpory této sněmovny i jednotlivých skupin. Ze skutečnosti, že nejsou předloženy žádné pozměňovací návrhy, usuzuji, že toto nařízení bude přijato velkou většinou. Máme tedy kvalitní nařízení, které zavádí otevřené prohlášení ve třech krocích – víte, o které se jedná – za prvé, uvádění složek v sestupném pořadí podle jejich hmotnostních podílů; za druhé, poskytování informací ze strany výrobců krmiv s tolerancí ± 15 %  –v této souvislosti jsme v této právní úpravě nestanovili výhradu práv duševního vlastnictví, ale odkázali jsme na obecné právní předpisy –; a za třetí, ustanovení o poskytování přesných informací orgánům.', 'Dále bych rád zdůraznil, že jsme zavedli registr. V Evropské unii od nynějška nebude zkrmována ani přimíchávána žádná složka, aniž by nebyla zveřejněna, protože tyto složky musí být zahrnuty do registru. To je důležité nejen pro dozorčí orgány, ale i pro veřejnost a spotřebitele. Mohu proto prohlásit, že z hlediska zpravodaje jsem s celkovými výsledky velmi spokojen. ']"
3, 3. Uvádění na trh a používání krmiv (rozprava) ,"  Androulla Vassiliou,  členka Komise. − Pane předsedající, v první řadě bych ráda poděkovala Výboru pro zemědělství a rozvoj venkova za práci na tomto materiálu a zejména zpravodaji, panu Graefe zu Baringdorfovi, stejně jako stínovým zpravodajům, kteří všichni sehráli významnou úlohu.Pan Graefe zu Baringdorf dokázal řídit jednání velmi obratně, za což jsme mu velmi vděční.Kompromisní balíček zachovává vysokou úroveň bezpečnosti potravin, které bylo v EU dosaženo. Vytváří vhodnou rovnováhu mezi ochranou spotřebitele a právy duševního vlastnictví. Odstraňuje břemeno povolovacího řízení před uvedením výrobku na trh pro bio-proteiny, modernizuje označování krmiv prostřednictvím odpovídajících informací zákazníkovi a jádrem legislativního procesu se stává společná regulace. Zvyšuje transparentnost trhu prostřednictvím systému oznamování o nových krmných surovinách, usnadňuje inovace a konkurenceschopnost odvětví výroby krmiv EU a představuje konkrétní opatření v boji proti klamání spotřebitelů krmiv – ať už se jedná o zemědělce, nebo majitele domácích zvířat.Výsledkem jednání je kompromisní balíček, o kterém budete hlasovat a který představuje zjednodušení a modernizaci stávajícího právního rámce. Ustanovení o tzv. „otevřeném prohlášení“ umožňují modernější označování. Krmné suroviny zapracované do krmných směsí pro zvířata, určená k produkci potravin, se budou uvádět na etiketě v sestupném pořadí podle hmotnosti.K tomu u stanovených krmných surovin a u dobrovolného označování musí být uváděn přesný hmotností podíl.Navíc ustanovení, že některé informace týkající se krmných směsí mohou  v naléhavých případech příslušné orgány poskytnout kupujícímu, zlepšuje informovanost uživatele např. v případě kontaminace krmiv.V této souvislosti činí Komise tato prohlášení. Za prvé, v zájmu přijetí přílohy III o tolerancích při označování složení krmných surovin a krmných směsí pro vědecký a technický rozvoj Komise a její služby předpokládají zkoumání této přílohy. V této souvislosti bude Komise uvažovat i o některých krmných surovinách s obsahem vody větším než 50 %.Za druhé, pokud jde o označování doplňkových látek, Komise zváží, zda se zásada informování prostřednictvím označování krmiv může vztahovat i na doplňkové látky a premixy schválené podle nařízení o doplňkových látkách používaných ve výživě zvířat.Za třetí, Komise chápe, že naléhavé situace v oblasti zdraví lidí a zvířat a v oblasti životního prostředí mohou zahrnovat naléhavé situace způsobené mimo jiné nedbalostí, mezinárodním podvodem nebo trestným činem. ","Androulla Vassiliou,",9,350,not_available,"['cze', 'cze', 'cze', 'cze', 'cze', 'cze', 'cze', 'cze', 'cze']","['  Androulla Vassiliou,  členka Komise. − Pane předsedající, v první řadě bych ráda poděkovala Výboru pro zemědělství a rozvoj venkova za práci na tomto materiálu a zejména zpravodaji, panu Graefe zu Baringdorfovi, stejně jako stínovým zpravodajům, kteří všichni sehráli významnou úlohu.', 'Pan Graefe zu Baringdorf dokázal řídit jednání velmi obratně, za což jsme mu velmi vděční.', 'Kompromisní balíček zachovává vysokou úroveň bezpečnosti potravin, které bylo v EU dosaženo. Vytváří vhodnou rovnováhu mezi ochranou spotřebitele a právy duševního vlastnictví. Odstraňuje břemeno povolovacího řízení před uvedením výrobku na trh pro bio-proteiny, modernizuje označování krmiv prostřednictvím odpovídajících informací zákazníkovi a jádrem legislativního procesu se stává společná regulace. Zvyšuje transparentnost trhu prostřednictvím systému oznamování o nových krmných surovinách, usnadňuje inovace a konkurenceschopnost odvětví výroby krmiv EU a představuje konkrétní opatření v boji proti klamání spotřebitelů krmiv – ať už se jedná o zemědělce, nebo majitele domácích zvířat.', 'Výsledkem jednání je kompromisní balíček, o kterém budete hlasovat a který představuje zjednodušení a modernizaci stávajícího právního rámce. Ustanovení o tzv. „otevřeném prohlášení“ umožňují modernější označování. Krmné suroviny zapracované do krmných směsí pro zvířata, určená k produkci potravin, se budou uvádět na etiketě v sestupném pořadí podle hmotnosti.', 'K tomu u stanovených krmných surovin a u dobrovolného označování musí být uváděn přesný hmotností podíl.', 'Navíc ustanovení, že některé informace týkající se krmných směsí mohou  v naléhavých případech příslušné orgány poskytnout kupujícímu, zlepšuje informovanost uživatele např. v případě kontaminace krmiv.', 'V této souvislosti činí Komise tato prohlášení. Za prvé, v zájmu přijetí přílohy III o tolerancích při označování složení krmných surovin a krmných směsí pro vědecký a technický rozvoj Komise a její služby předpokládají zkoumání této přílohy. V této souvislosti bude Komise uvažovat i o některých krmných surovinách s obsahem vody větším než 50 %.', 'Za druhé, pokud jde o označování doplňkových látek, Komise zváží, zda se zásada informování prostřednictvím označování krmiv může vztahovat i na doplňkové látky a premixy schválené podle nařízení o doplňkových látkách používaných ve výživě zvířat.', 'Za třetí, Komise chápe, že naléhavé situace v oblasti zdraví lidí a zvířat a v oblasti životního prostředí mohou zahrnovat naléhavé situace způsobené mimo jiné nedbalostí, mezinárodním podvodem nebo trestným činem. ']"
4, 3. Uvádění na trh a používání krmiv (rozprava) ,"  Albert Deß,  jménem skupiny PPE-DE. – (DE) Pane předsedající, paní komisařko, dámy a pánové, jménem skupiny Evropské lidové strany (Křesťanských demokratů) a Evropských demokratů i jménem svým bych rád vyjádřil co nejvřelejší poděkování našemu zpravodaji, panu Graefe zu Baringdorf. Jsem přesvědčen, že způsob, jak přistupoval k této zprávě, je vzorem parlamentní práce v této sněmovně.Dnešní hlasování nezahrnuje žádné pozměňovací návrhy, protože práce na tomto návrhu byla velmi důkladná a zahrnovala celé politické spektrum. Jsem přesvědčen, že na tento výsledek je možné být hrdý. Je to vyvážený výsledek, který zajišťuje zájmy zemědělců a uživatelů krmiv, výrobců krmiv i všech dalších článků potravinového řetězce.Zlepšuje transparentnost, a zejména moje skupina přikládá značný význam zavedení registru, kde musejí být registrovány veškeré suroviny přimíchané do krmiv. Čas od času se objevují skandály v souvislosti s potravinami a ani nová právní úprava tomu nedokáže zabránit, protože úkolem žádných evropských předpisů není předcházet trestné činnosti; tyto předpisy však pomohou zajistit, aby v případě, že k nějakému skandálu dojde, bylo snadnější zjistit, které látky byly do směsi přidány.Rovněž se domnívám, že je dobré, když výrobci mohou poskytovat další informace dobrovolně, a za skvělý návrh považuji, aby informace, které poskytují, musely být vědecky podloženy. Jsem toho názoru, že nový právní předpis o krmivech významně zlepšuje ochranu a že sestupné pořadí umožní zemědělcům zjistit podíl každé krmivové složky a zvolit si nejvhodnější krmivo pro svá zvířata.Opakuji své poděkování všem, kteří svým podílem přispěli ke vzniku tak dobré zprávy. ","Albert Deß,",5,242,not_available,"['ger', 'ger', 'ger', 'ger', 'ger']","['  Albert Deß,  jménem skupiny PPE-DE. – (DE) Pane předsedající, paní komisařko, dámy a pánové, jménem skupiny Evropské lidové strany (Křesťanských demokratů) a Evropských demokratů i jménem svým bych rád vyjádřil co nejvřelejší poděkování našemu zpravodaji, panu Graefe zu Baringdorf. Jsem přesvědčen, že způsob, jak přistupoval k této zprávě, je vzorem parlamentní práce v této sněmovně.', 'Dnešní hlasování nezahrnuje žádné pozměňovací návrhy, protože práce na tomto návrhu byla velmi důkladná a zahrnovala celé politické spektrum. Jsem přesvědčen, že na tento výsledek je možné být hrdý. Je to vyvážený výsledek, který zajišťuje zájmy zemědělců a uživatelů krmiv, výrobců krmiv i všech dalších článků potravinového řetězce.', 'Zlepšuje transparentnost, a zejména moje skupina přikládá značný význam zavedení registru, kde musejí být registrovány veškeré suroviny přimíchané do krmiv. Čas od času se objevují skandály v souvislosti s potravinami a ani nová právní úprava tomu nedokáže zabránit, protože úkolem žádných evropských předpisů není předcházet trestné činnosti; tyto předpisy však pomohou zajistit, aby v případě, že k nějakému skandálu dojde, bylo snadnější zjistit, které látky byly do směsi přidány.', 'Rovněž se domnívám, že je dobré, když výrobci mohou poskytovat další informace dobrovolně, a za skvělý návrh považuji, aby informace, které poskytují, musely být vědecky podloženy. Jsem toho názoru, že nový právní předpis o krmivech významně zlepšuje ochranu a že sestupné pořadí umožní zemědělcům zjistit podíl každé krmivové složky a zvolit si nejvhodnější krmivo pro svá zvířata.', 'Opakuji své poděkování všem, kteří svým podílem přispěli ke vzniku tak dobré zprávy. ']"
5, 3. Uvádění na trh a používání krmiv (rozprava) ,"  Rosa Miguélez Ramos,  jménem skupiny PSE. – (ES) Pane předsedající, paní komisařko, stejně jako jsem to už učinila na půdě Výboru pro zemědělství a rozvoj venkova, chtěla bych v první řadě poblahopřát zpravodaji, stínovým zpravodajům z ostatních politických skupin a rovněž Radě k odvedené práci.Díky této práci jsme mohli dosáhnout dohody v prvním čtení a navíc se jednalo o skvělý záběhový proces postupu spolurozhodování, který se stane v blízké budoucnosti běžnou praxí.Dámy a pánové, v současnosti je pohyb surovin pro krmiva a krmné směsi pro zvířata, včetně domácích zvířat – odvětví v hodnotě 50 miliard EUR v obchodování v rámci Společenství – regulován řadou směrnic a zhruba 50 změnami a prováděcími akty.Hlavním cílem, kterého bude bezpochyby tímto nařízením dosaženo, bude zjednodušení právních předpisů a jejich harmonizované uplatňování.Výbor Parlamentu pro zemědělství a rozvoj venkova již projednával umisťování krmiv na trh v roce 2006. Všichni si jistě vzpomeneme, že jsme jednomyslně žádali Evropskou komisi, aby se při příštím přezkumu snažila nalézt rovnováhu mezi zájmy zemědělců na získání podrobných informací o složení krmiv a zájmy průmyslového odvětví na zajištění dostatečné ochrany svého know-how.Podle mého názoru dosažený kompromis ohledně návrhu Komise v hlavních otázkách – otevřené prohlášení o surovinách a vytvoření seznamu surovin ES – tuto rovnováhu dobře odráží. Důkazem je souhlas, s nímž se tento kompromis setkal u všech zúčastněných.Prostřednictvím otevřeného prohlášení ve skutečnosti tento kompromis chrání práva kupujících být informován a práva výrobců uchovat si vlastnictví svého  know-how tím, že stanoví, že poskytováním informací nejsou dotčena ustanovení směrnice z roku 2004 o právech duševního vlastnictví.Není pochyb o tom, dámy a pánové, že v rámci důvěry mezi dodavatelem a uživatelem by mělo být složení známé, bylo by však nelogické být povinen předávat recept prvnímu zákazníkovi, který vstoupí do dveří. Mnozí z nás pijí již léta Coca-Colu. I když neznáme její recept, neznamená to, že bychom měli pochybnosti, že vlastnosti tohoto produktu jsou sledovány a že splňuje zdravotní normy.Zmíněný rozsudek Evropského soudního dvora jednoznačně stanoví, že povinnost informovat zákazníky o přesném složení krmiva – pokud o to požádají – není odůvodněna zamýšleným cílem ochrany zdraví.K tomu je třeba připomenout, že příslušný orgán bude mít stále přístup k přesnému složení, a jak stanoví dosažený kompromis, v případě jakékoli naléhavé situace související se zdravím člověka nebo zvířat nebo se životním prostředím bude mít kupující přístup k přesným informacím o složení příslušného krmiva, jakmile budou zváženy legitimní nároky výrobce i kupujících.Pokud jde o seznam osvědčených postupů při označování, jedná se o dobrovolný seznam pro odborníky v odvětví, který se nikdy nestane úplným seznamem surovin pro výrobce krmných směsí, neboť tak požadavek nezní.Tato právní úprava bude na žádost Evropského parlamentu obsahovat novou přílohu zahrnující seznam surovin pro krmiva, jejichž umístění na trh nebo používání je zakázáno nebo omezeno. Tyto informace, ať už v příloze nebo v seznamu, může Komise aktualizovat.Skupina sociálních demokratů v Evropském parlamentu, kterou zastupuji, podporuje dosažený kompromis a nepředložila do pléna žádné pozměňovací návrhy. Plně podporujeme stanovisko přednesené v této sněmovně a také pro ně budeme hlasovat. ","Rosa Miguélez Ramos,",13,500,not_available,"['spa', 'spa', 'spa', 'spa', 'spa', 'spa', 'spa', 'spa', 'spa', 'spa', 'spa', 'spa', 'spa']","['  Rosa Miguélez Ramos,  jménem skupiny PSE. – (ES) Pane předsedající, paní komisařko, stejně jako jsem to už učinila na půdě Výboru pro zemědělství a rozvoj venkova, chtěla bych v první řadě poblahopřát zpravodaji, stínovým zpravodajům z ostatních politických skupin a rovněž Radě k odvedené práci.', 'Díky této práci jsme mohli dosáhnout dohody v prvním čtení a navíc se jednalo o skvělý záběhový proces postupu spolurozhodování, který se stane v blízké budoucnosti běžnou praxí.', 'Dámy a pánové, v současnosti je pohyb surovin pro krmiva a krmné směsi pro zvířata, včetně domácích zvířat – odvětví v hodnotě 50 miliard EUR v obchodování v rámci Společenství – regulován řadou směrnic a zhruba 50 změnami a prováděcími akty.', 'Hlavním cílem, kterého bude bezpochyby tímto nařízením dosaženo, bude zjednodušení právních předpisů a jejich harmonizované uplatňování.', 'Výbor Parlamentu pro zemědělství a rozvoj venkova již projednával umisťování krmiv na trh v roce 2006. Všichni si jistě vzpomeneme, že jsme jednomyslně žádali Evropskou komisi, aby se při příštím přezkumu snažila nalézt rovnováhu mezi zájmy zemědělců na získání podrobných informací o složení krmiv a zájmy průmyslového odvětví na zajištění dostatečné ochrany svého know-how.', 'Podle mého názoru dosažený kompromis ohledně návrhu Komise v hlavních otázkách – otevřené prohlášení o surovinách a vytvoření seznamu surovin ES – tuto rovnováhu dobře odráží. Důkazem je souhlas, s nímž se tento kompromis setkal u všech zúčastněných.', 'Prostřednictvím otevřeného prohlášení ve skutečnosti tento kompromis chrání práva kupujících být informován a práva výrobců uchovat si vlastnictví svého  know-how tím, že stanoví, že poskytováním informací nejsou dotčena ustanovení směrnice z roku 2004 o právech duševního vlastnictví.', 'Není pochyb o tom, dámy a pánové, že v rámci důvěry mezi dodavatelem a uživatelem by mělo být složení známé, bylo by však nelogické být povinen předávat recept prvnímu zákazníkovi, který vstoupí do dveří. Mnozí z nás pijí již léta Coca-Colu. I když neznáme její recept, neznamená to, že bychom měli pochybnosti, že vlastnosti tohoto produktu jsou sledovány a že splňuje zdravotní normy.', 'Zmíněný rozsudek Evropského soudního dvora jednoznačně stanoví, že povinnost informovat zákazníky o přesném složení krmiva – pokud o to požádají – není odůvodněna zamýšleným cílem ochrany zdraví.', 'K tomu je třeba připomenout, že příslušný orgán bude mít stále přístup k přesnému složení, a jak stanoví dosažený kompromis, v případě jakékoli naléhavé situace související se zdravím člověka nebo zvířat nebo se životním prostředím bude mít kupující přístup k přesným informacím o složení příslušného krmiva, jakmile budou zváženy legitimní nároky výrobce i kupujících.', 'Pokud jde o seznam osvědčených postupů při označování, jedná se o dobrovolný seznam pro odborníky v odvětví, který se nikdy nestane úplným seznamem surovin pro výrobce krmných směsí, neboť tak požadavek nezní.', 'Tato právní úprava bude na žádost Evropského parlamentu obsahovat novou přílohu zahrnující seznam surovin pro krmiva, jejichž umístění na trh nebo používání je zakázáno nebo omezeno. Tyto informace, ať už v příloze nebo v seznamu, může Komise aktualizovat.', 'Skupina sociálních demokratů v Evropském parlamentu, kterou zastupuji, podporuje dosažený kompromis a nepředložila do pléna žádné pozměňovací návrhy. Plně podporujeme stanovisko přednesené v této sněmovně a také pro ně budeme hlasovat. ']"
