,agenda_item,text,speaker,number_p,number_w,chair,language_ps,ps
96, 6. Vysvětlení hlasování,"  Athanasios Pafilis  (GUE/NGL),  písemně. – (EL) Zpráva neodráží skutečný rozsah špatných podmínek, v nichž žijí uprchlíci a přistěhovalci v přijímacích a zadržovacích střediscích členských států EU. Omezuje se na konstatování, že podmínky, v nichž přežívají, jsou tragické, ale připisuje je špatnému uplatňování směrnic EU.Tím na jedné straně podporuje anti-imigrační právní úpravu a politiku EU a jednotlivých vlád, jak je stanoví Evropský pakt o přistěhovalectví a azylu a Dublinský azylový systém, na straně druhé protestuje proti jeho nelidským důsledkům. Je to přinejmenším urážlivé, když politické síly „jednosměrné ulice“ v Evropě, které hlasovaly v Evropském parlamentu pro směrnici, která stanoví až 18 měsíční sazbu pro „ilegální“ přistěhovalce, vyjadřují v této zprávě své údajné politování nad nelidskými podmínkami zadržování a žádají, aby nebyli uprchlíci zadržováni.„Krokodýlí slzy“ Evropského parlamentu nemohou zprostit EU její nelidské vykořisťovatelské politiky. I ta nejzákladnější opatření, natož opatření na řádnou podporu přistěhovalců a uprchlíků a jejich práv, lze realizovat pouze za předpokladu, že zpochybníme a změníme politiku EU a samotnou strukturu EU. ","Athanasios Pafilis  (GUE/NGL),",3,165,not_available,"['gre', 'gre', 'gre']","['  Athanasios Pafilis  (GUE/NGL),  písemně. – (EL) Zpráva neodráží skutečný rozsah špatných podmínek, v nichž žijí uprchlíci a přistěhovalci v přijímacích a zadržovacích střediscích členských států EU. Omezuje se na konstatování, že podmínky, v nichž přežívají, jsou tragické, ale připisuje je špatnému uplatňování směrnic EU.', 'Tím na jedné straně podporuje anti-imigrační právní úpravu a politiku EU a jednotlivých vlád, jak je stanoví Evropský pakt o přistěhovalectví a azylu a Dublinský azylový systém, na straně druhé protestuje proti jeho nelidským důsledkům. Je to přinejmenším urážlivé, když politické síly „jednosměrné ulice“ v Evropě, které hlasovaly v Evropském parlamentu pro směrnici, která stanoví až 18 měsíční sazbu pro „ilegální“ přistěhovalce, vyjadřují v této zprávě své údajné politování nad nelidskými podmínkami zadržování a žádají, aby nebyli uprchlíci zadržováni.', '„Krokodýlí slzy“ Evropského parlamentu nemohou zprostit EU její nelidské vykořisťovatelské politiky. I ta nejzákladnější opatření, natož opatření na řádnou podporu přistěhovalců a uprchlíků a jejich práv, lze realizovat pouze za předpokladu, že zpochybníme a změníme politiku EU a samotnou strukturu EU. ']"
97, 6. Vysvětlení hlasování,"  Dimitrios Papadimoulis  (GUE/NGL),  písemně. – (EL) Členské státy včetně Řecka musí učinit více pro uplatňování požadavků a návrhů Evropského parlamentu. Evropský parlament odsuzuje přístup vlád k chudým přistěhovalcům, kteří denně procházejí branami EU a riskují přitom své životy.Země, jako je Řecko, které leží na vnějších hranicích EU, by měly využít potenciální pomoci nabízené EU a v souladu s právy uprchlíků a žadatelů o azyl se pokusit zajistit lidské podmínky pro jejich přijímání.Navzdory nepřijatelnému „znevážení“, kterému se nedávno dostalo právům přistěhovalců, kteří nadále přicházejí do „pevnosti Evropa“, ze strany Komise a Rady, nesplňuje Řecko normy Společenství na ochranu základních práv. ","Dimitrios Papadimoulis  (GUE/NGL),",3,101,not_available,"['gre', 'gre', 'gre']","['  Dimitrios Papadimoulis  (GUE/NGL),  písemně. – (EL) Členské státy včetně Řecka musí učinit více pro uplatňování požadavků a návrhů Evropského parlamentu. Evropský parlament odsuzuje přístup vlád k chudým přistěhovalcům, kteří denně procházejí branami EU a riskují přitom své životy.', 'Země, jako je Řecko, které leží na vnějších hranicích EU, by měly využít potenciální pomoci nabízené EU a v souladu s právy uprchlíků a žadatelů o azyl se pokusit zajistit lidské podmínky pro jejich přijímání.', 'Navzdory nepřijatelnému „znevážení“, kterému se nedávno dostalo právům přistěhovalců, kteří nadále přicházejí do „pevnosti Evropa“, ze strany Komise a Rady, nesplňuje Řecko normy Společenství na ochranu základních práv. ']"
98, 6. Vysvětlení hlasování,"  Luís Queiró  (PPE-DE),  písemně. – (PT) Udělení azylu je vrcholným gestem státu a celého Společenství, kterým přijímají svou neschopnost uhájit lidská práva na celém světě a na druhé straně svou vůli podle těchto práv jednat.Systém, kterým se azyl řídí, musí být proto jednoznačně oddělen od přistěhovalectví. Čím více se budeme snažit tento pojem rozšířit, včetně oblastí, které se jej netýkají, tím bude mít menší hodnotu a nejasnosti mohou pouze poškodit legitimní žadatele o azyl. Je proto důležité za všech okolností uplatňovat jednoznačná pravidla, rychlé postupy a důstojné zacházení. I když je třeba jednotlivá opatření a možnosti koordinovat, azyl nepředstavuje z hlediska počtu, rozsahu a pojetí stejný problém jako přistěhovalectví, ani v oblasti bez hranic. Jednotlivé členské státy mají vlastní tradice v oblasti azylu a v rámci výše zmíněné koordinace nesmějí být tyto rozdíly přehlíženy.Pokud jde o žadatele o azyl, jejichž žádosti jsou nebo musejí být odmítnuty, nesmí tato kategorie – výsledek velkorysého, avšak úzkého chápání azylu – nijak omezovat lidskost v přijímání a zacházení s lidmi, kteří budou vždy zranitelní z povahy svého stavu. ","Luís Queiró  (PPE-DE),",3,174,not_available,"['por', 'por', 'por']","['  Luís Queiró  (PPE-DE),  písemně. – (PT) Udělení azylu je vrcholným gestem státu a celého Společenství, kterým přijímají svou neschopnost uhájit lidská práva na celém světě a na druhé straně svou vůli podle těchto práv jednat.', 'Systém, kterým se azyl řídí, musí být proto jednoznačně oddělen od přistěhovalectví. Čím více se budeme snažit tento pojem rozšířit, včetně oblastí, které se jej netýkají, tím bude mít menší hodnotu a nejasnosti mohou pouze poškodit legitimní žadatele o azyl. Je proto důležité za všech okolností uplatňovat jednoznačná pravidla, rychlé postupy a důstojné zacházení. I když je třeba jednotlivá opatření a možnosti koordinovat, azyl nepředstavuje z hlediska počtu, rozsahu a pojetí stejný problém jako přistěhovalectví, ani v oblasti bez hranic. Jednotlivé členské státy mají vlastní tradice v oblasti azylu a v rámci výše zmíněné koordinace nesmějí být tyto rozdíly přehlíženy.', 'Pokud jde o žadatele o azyl, jejichž žádosti jsou nebo musejí být odmítnuty, nesmí tato kategorie – výsledek velkorysého, avšak úzkého chápání azylu – nijak omezovat lidskost v přijímání a zacházení s lidmi, kteří budou vždy zranitelní z povahy svého stavu. ']"
99, 6. Vysvětlení hlasování,"  Luca Romagnoli  (NI),  písemně. – (IT) Hlasoval jsem proti zprávě paní Roureové o uplatňování směrnice 2003/9/ES, kterou se stanoví minimální normy pro přijímání žadatelů o azyl v Evropské unii. I když odsuzuji skutečnost, že některé inspekce ukázaly, že stávající směrnice nebyly v některých členských státech řádně uplatňovány, nesouhlasím s tvrzeními zpravodajky, že je řada nedostatků v oblasti přijímacích podmínek.Navíc nesouhlasím s tím, že otevřená ubytovací střediska, která zřídily některé členské státy, mají malou kapacitu a neodpovídají potřebám migrantů. Konečně nesouhlasím s tím, aby bylo upřednostňováno přijímání žadatelů o azyl v otevřených přijímacích střediscích namísto uzavřených celků. ","Luca Romagnoli  (NI),",2,98,not_available,"['ita', 'ita']","['  Luca Romagnoli  (NI),  písemně. – (IT) Hlasoval jsem proti zprávě paní Roureové o uplatňování směrnice 2003/9/ES, kterou se stanoví minimální normy pro přijímání žadatelů o azyl v Evropské unii. I když odsuzuji skutečnost, že některé inspekce ukázaly, že stávající směrnice nebyly v některých členských státech řádně uplatňovány, nesouhlasím s tvrzeními zpravodajky, že je řada nedostatků v oblasti přijímacích podmínek.', 'Navíc nesouhlasím s tím, že otevřená ubytovací střediska, která zřídily některé členské státy, mají malou kapacitu a neodpovídají potřebám migrantů. Konečně nesouhlasím s tím, aby bylo upřednostňováno přijímání žadatelů o azyl v otevřených přijímacích střediscích namísto uzavřených celků. ']"
100, 6. Vysvětlení hlasování,"  Michel Teychenné  (PSE),  písemně. – (FR) Díky této zprávě Evropský parlament opětovně potvrzuje svůj závazek vůči základním právům, jako je právo na důstojnost. Je nepřijatelné, aby v samotné Evropské unii nebyly podmínky přijímání migrantů a žadatelů o azyl příkladné.Inspekce zadržovacích středisek poslanci Evropského parlamentu v letech 2005 a 2008 umožnily vypracovat návrh této zprávy pod vedením paní Roureové. Zpráva ukazuje rozsah nesrovnalostí v systému zadržování migrantů v Evropě a poukazuje na problémy související s právním poradenstvím, lékařskou péčí, hygienou, promiskuitou a informacemi.Evropský parlament dnes zvoní na poplach. Členské státy si toho musejí být vědomy a v případě potřeby musí co nejdříve zavést směrnice o „přijímání“ a „řízení“, nebo urychlit zavádění. ","Michel Teychenné  (PSE),",3,111,not_available,"['fra', 'fra', 'fra']","['  Michel Teychenné  (PSE),  písemně. – (FR) Díky této zprávě Evropský parlament opětovně potvrzuje svůj závazek vůči základním právům, jako je právo na důstojnost. Je nepřijatelné, aby v samotné Evropské unii nebyly podmínky přijímání migrantů a žadatelů o azyl příkladné.', 'Inspekce zadržovacích středisek poslanci Evropského parlamentu v letech 2005 a 2008 umožnily vypracovat návrh této zprávy pod vedením paní Roureové. Zpráva ukazuje rozsah nesrovnalostí v systému zadržování migrantů v Evropě a poukazuje na problémy související s právním poradenstvím, lékařskou péčí, hygienou, promiskuitou a informacemi.', 'Evropský parlament dnes zvoní na poplach. Členské státy si toho musejí být vědomy a v případě potřeby musí co nejdříve zavést směrnice o „přijímání“ a „řízení“, nebo urychlit zavádění. ']"
101, 6. Vysvětlení hlasování,"  Glyn Ford  (PSE),  písemně. − Labouristická strana v Evropském parlamentu se zdržela hlasování o této zprávě nikoli proto, že bychom nesouhlasili s posílením role malých a středních podniků EU v mezinárodním obchodu, ale proto, že paní Muscardiniová vytvořila trojského koně, který v sobě obsahuje nepřijatelné stanovisko nástroje ochrany obchodu.Jsme nespokojeni s tím, ž Evropská komise odsunula přezkum z důvodu problémů se zajišťováním konsensu. Dle našeho soudu je naléhavě třeba změnit režim ochrany obchodu Společenství tak, aby lépe zohledňoval vývoj světového hospodářství. Pokud neprovedeme reformu, nebude náš průmysl schopen využít výhod globalizace. I když vítáme zařazení zlepšení transparentnosti nástrojů ochrany obchodu do pracovního programu ze strany českého předsednictví, je to málo. ","Glyn Ford  (PSE),",2,110,not_available,"['cze', 'cze']","['  Glyn Ford  (PSE),  písemně. − Labouristická strana v Evropském parlamentu se zdržela hlasování o této zprávě nikoli proto, že bychom nesouhlasili s posílením role malých a středních podniků EU v mezinárodním obchodu, ale proto, že paní Muscardiniová vytvořila trojského koně, který v sobě obsahuje nepřijatelné stanovisko nástroje ochrany obchodu.', 'Jsme nespokojeni s tím, ž Evropská komise odsunula přezkum z důvodu problémů se zajišťováním konsensu. Dle našeho soudu je naléhavě třeba změnit režim ochrany obchodu Společenství tak, aby lépe zohledňoval vývoj světového hospodářství. Pokud neprovedeme reformu, nebude náš průmysl schopen využít výhod globalizace. I když vítáme zařazení zlepšení transparentnosti nástrojů ochrany obchodu do pracovního programu ze strany českého předsednictví, je to málo. ']"
102, 6. Vysvětlení hlasování,"  Bruno Gollnisch  (NI),  písemně. – (FR) Hlasovali jsme pro přijetí zprávy paní Muscardiniové o malých a středních podnicích. Je to neradostná kritika obchodní politiky Evropské unie, i když je formulována v umírněném a technokratickém stylu, který je této sněmovně tak blízký.Zahrnuje vše: politiky zaměřené na potřeby velkých podniků; slabost opatření podporujících přístup na zahraniční trhy a zajišťujících reciprocitu ze strany třetích zemí; problémy v přístupu k nástrojům ochrany obchodu ze strany malých podniků; neúčinnost opatření na ochranu proti padělání a nezákonnému či podvodnému zeměpisnému označení původu atd.Je na čase, aby Evropská unie přestala obětovat své podniky a své pracovníky na oltář oné formy konkurenceschopnosti a volného obchodu, které jako jediné mohou být ve světě realizovány. Je na čase podporovat malé a střední podniky podnikající v oblasti vývozu, chránit je proti nespravedlivé konkurenci a dělat to, co je rozumné z hlediska ochrany našich trhů.Skutečností je, že tím, že zpravodajka zůstává oddána globalizaci podniků jakožto cíli, pokračuje v podpoře systému, který je založen na naprosté svobodě pohybu zboží, služeb, kapitálu a pracovní síly, tedy systému, který nás zavedl do hluboké hospodářské, finanční a sociální krize, systém, kterého se musí Evropská unie naprosto zříci. ","Bruno Gollnisch  (NI),",4,193,not_available,"['fra', 'fra', 'fra', 'fra']","['  Bruno Gollnisch  (NI),  písemně. – (FR) Hlasovali jsme pro přijetí zprávy paní Muscardiniové o malých a středních podnicích. Je to neradostná kritika obchodní politiky Evropské unie, i když je formulována v umírněném a technokratickém stylu, který je této sněmovně tak blízký.', 'Zahrnuje vše: politiky zaměřené na potřeby velkých podniků; slabost opatření podporujících přístup na zahraniční trhy a zajišťujících reciprocitu ze strany třetích zemí; problémy v přístupu k nástrojům ochrany obchodu ze strany malých podniků; neúčinnost opatření na ochranu proti padělání a nezákonnému či podvodnému zeměpisnému označení původu atd.', 'Je na čase, aby Evropská unie přestala obětovat své podniky a své pracovníky na oltář oné formy konkurenceschopnosti a volného obchodu, které jako jediné mohou být ve světě realizovány. Je na čase podporovat malé a střední podniky podnikající v oblasti vývozu, chránit je proti nespravedlivé konkurenci a dělat to, co je rozumné z hlediska ochrany našich trhů.', 'Skutečností je, že tím, že zpravodajka zůstává oddána globalizaci podniků jakožto cíli, pokračuje v podpoře systému, který je založen na naprosté svobodě pohybu zboží, služeb, kapitálu a pracovní síly, tedy systému, který nás zavedl do hluboké hospodářské, finanční a sociální krize, systém, kterého se musí Evropská unie naprosto zříci. ']"
103, 6. Vysvětlení hlasování,"  Pedro Guerreiro  (GUE/NGL),  písemně. − (PT) Není náhodou, že s blížícími se volbami do Parlamentu se objevují usnesení, jejichž cílem je zříci se odpovědnosti za politiky přijaté v EU (zejména v posledních pěti letech) týkající se velmi vážné situace, v níž se nacházejí mikropodniky a malé a střední podniky obecně, a zejména v Portugalsku.Oběťmi tržní liberalizace, kterou tak podporuje EU, jsou malé a střední podniky a nikoli nadnárodní společnosti (jako kdyby systém, kde přežijí jen ti nejschopnější, jim mohl pomoci). Je řada malých a středních podniků, které mají „podíl“ na „mezinárodním obchodu“ díky své závislosti na velkých nadnárodních společnostech, pro které vyrábějí za ceny, které často neodpovídají ani výrobním nákladům.Bezesporu je nezbytné zajistit (a uplatňovat) nástroje ochrany obchodu, práva duševního vlastnictví, označování původu a zeměpisné údaje o zemědělských produktech a internacionalizaci malých a středních podniků.Proč tedy většina sil zastoupených v tomto Parlamentu, která odpovídá většině zastoupené v Komisi a v Radě EU, nepřijme nařízení o původu označování, neuplatňuje na dovážené produkty stejné normy bezpečnosti a ochrany, jaké se vyžadují u produktů vyráběných v EU a neuplatňuje finanční rámec 2007-2013 k ochraně výroby a zaměstnanosti a k podpoře malých a středních podniků? ","Pedro Guerreiro  (GUE/NGL),",4,195,not_available,"['por', 'por', 'por', 'por']","['  Pedro Guerreiro  (GUE/NGL),  písemně. − (PT) Není náhodou, že s blížícími se volbami do Parlamentu se objevují usnesení, jejichž cílem je zříci se odpovědnosti za politiky přijaté v EU (zejména v posledních pěti letech) týkající se velmi vážné situace, v níž se nacházejí mikropodniky a malé a střední podniky obecně, a zejména v Portugalsku.', 'Oběťmi tržní liberalizace, kterou tak podporuje EU, jsou malé a střední podniky a nikoli nadnárodní společnosti (jako kdyby systém, kde přežijí jen ti nejschopnější, jim mohl pomoci). Je řada malých a středních podniků, které mají „podíl“ na „mezinárodním obchodu“ díky své závislosti na velkých nadnárodních společnostech, pro které vyrábějí za ceny, které často neodpovídají ani výrobním nákladům.', 'Bezesporu je nezbytné zajistit (a uplatňovat) nástroje ochrany obchodu, práva duševního vlastnictví, označování původu a zeměpisné údaje o zemědělských produktech a internacionalizaci malých a středních podniků.', 'Proč tedy většina sil zastoupených v tomto Parlamentu, která odpovídá většině zastoupené v Komisi a v Radě EU, nepřijme nařízení o původu označování, neuplatňuje na dovážené produkty stejné normy bezpečnosti a ochrany, jaké se vyžadují u produktů vyráběných v EU a neuplatňuje finanční rámec 2007-2013 k ochraně výroby a zaměstnanosti a k podpoře malých a středních podniků? ']"
104, 6. Vysvětlení hlasování,"  Małgorzata Handzlik  (PPE-DE),  písemně. – (PL) Jsem velmi ráda, že Evropský parlament přijal zprávu paní Muscardiniové, na níž jsem měla příležitost se podílet jako poradce za Výbor pro vnitřní trh a ochranu spotřebitelů. Často se nyní hovoří o zlepšování podmínek pro malé a střední podniky na vnitřním trhu Evropské unie, zejména v kontextu navrhovaného zákona o malých podnicích.Malé a střední podniky tvoří více než 99 % všech podniků v Evropě. Avšak obchodní činnost, která překračuje vnitrostátní hranice, je spíše oborem velkých podniků. Pouhých 8 % malých a středních podniků vyváží své zboží mimo své vnitrostátní hranice. A hovoříme-li o obchodní činnosti přesahující hranice Evropské unie, podniků, které se odhodlají k tomuto kroku, jsou pouhá 3 %.Nesmíme zapomínat, že internacionalizované podniky vykazují značnou schopnost inovace. Inovace je klíčem ke konkurenceschopnosti a růstu evropského hospodářství. Doufám proto, že politiky vnitřního trhu zprostředkují malým a středním podnikům značný přínos, který přináší společný trh, a pokud je to možné, položí základy internacionalizace činností malých a středních podniků. Malým a středním podnikům by se mělo rovněž dostávat větší podpory ze strany členských států a Evropské komise v oblastech, jako je propagace vývozu nebo hledání potenciálních obchodních partnerů, zejména pokud jde výrobky, zaujímající přední místo na trhu, a služby a nové technologie. ","Małgorzata Handzlik  (PPE-DE),",3,206,not_available,"['pol', 'pol', 'pol']","['  Małgorzata Handzlik  (PPE-DE),  písemně. – (PL) Jsem velmi ráda, že Evropský parlament přijal zprávu paní Muscardiniové, na níž jsem měla příležitost se podílet jako poradce za Výbor pro vnitřní trh a ochranu spotřebitelů. Často se nyní hovoří o zlepšování podmínek pro malé a střední podniky na vnitřním trhu Evropské unie, zejména v kontextu navrhovaného zákona o malých podnicích.', 'Malé a střední podniky tvoří více než 99 % všech podniků v Evropě. Avšak obchodní činnost, která překračuje vnitrostátní hranice, je spíše oborem velkých podniků. Pouhých 8 % malých a středních podniků vyváží své zboží mimo své vnitrostátní hranice. A hovoříme-li o obchodní činnosti přesahující hranice Evropské unie, podniků, které se odhodlají k tomuto kroku, jsou pouhá 3 %.', 'Nesmíme zapomínat, že internacionalizované podniky vykazují značnou schopnost inovace. Inovace je klíčem ke konkurenceschopnosti a růstu evropského hospodářství. Doufám proto, že politiky vnitřního trhu zprostředkují malým a středním podnikům značný přínos, který přináší společný trh, a pokud je to možné, položí základy internacionalizace činností malých a středních podniků. Malým a středním podnikům by se mělo rovněž dostávat větší podpory ze strany členských států a Evropské komise v oblastech, jako je propagace vývozu nebo hledání potenciálních obchodních partnerů, zejména pokud jde výrobky, zaujímající přední místo na trhu, a služby a nové technologie. ']"
