,agenda_item,text,speaker,number_p,number_w,chair,language_ps,ps
145, 6. Vysvětlení hlasování,"  Luís Queiró  (PPE-DE),  písemně. − (PT) Rozprava o obchodních vztazích s Čínou nás stále vrací k otázce lidských práv v této zemi. Je to pochopitelné. Námitky, které vyvolává vztah s Čínou, jsou pochopitelné s ohledem na různá hodnocení, která jsou v řadě případů oprávněná.Mínění, že čínskému hospodářskému růstu neodpovídá míra dodržování lidských práv a demokracie v této zemi, ani její jednání na mezinárodní úrovni, vykořisťování pracovníků, regulační rámec v oblasti práce, který je podstatně méně náročný, lhostejnost vůči problematice životního prostředí a vůči předpisům v oblasti duševního vlastnictví a patentů, všechny tyto činitele jsou překážkou otevřených obchodních vztahů, které se vyznačují respektováním mezinárodních osvědčených postupů. Nicméně obchod funguje a rostoucí úloha Číny v moderním světovém hospodářství nemá obdoby a její podíl na překonání současné krize je nezbytný.Je proto nezbytné, abychom trvali na dodržování pravidel a zásad mezinárodního obchodu a rovného přístupu na trhy a ochrany demokracie lidských práv, aniž bychom odmítali realitu a naši narůstající vzájemnou závislost. Musíme této situace co nejlépe využít s cílem zlepšit vliv na tuto velkou zemi. ","Luís Queiró  (PPE-DE),",3,173,not_available,"['por', 'por', 'por']","['  Luís Queiró  (PPE-DE),  písemně. − (PT) Rozprava o obchodních vztazích s Čínou nás stále vrací k otázce lidských práv v této zemi. Je to pochopitelné. Námitky, které vyvolává vztah s Čínou, jsou pochopitelné s ohledem na různá hodnocení, která jsou v řadě případů oprávněná.', 'Mínění, že čínskému hospodářskému růstu neodpovídá míra dodržování lidských práv a demokracie v této zemi, ani její jednání na mezinárodní úrovni, vykořisťování pracovníků, regulační rámec v oblasti práce, který je podstatně méně náročný, lhostejnost vůči problematice životního prostředí a vůči předpisům v oblasti duševního vlastnictví a patentů, všechny tyto činitele jsou překážkou otevřených obchodních vztahů, které se vyznačují respektováním mezinárodních osvědčených postupů. Nicméně obchod funguje a rostoucí úloha Číny v moderním světovém hospodářství nemá obdoby a její podíl na překonání současné krize je nezbytný.', 'Je proto nezbytné, abychom trvali na dodržování pravidel a zásad mezinárodního obchodu a rovného přístupu na trhy a ochrany demokracie lidských práv, aniž bychom odmítali realitu a naši narůstající vzájemnou závislost. Musíme této situace co nejlépe využít s cílem zlepšit vliv na tuto velkou zemi. ']"
146, 6. Vysvětlení hlasování,"  Bogusław Rogalski  (UEN),  písemně. – (PL) Při hlasování o zprávě o obchodních a hospodářských vztazích s Čínou jsem hlasoval pro její přijetí.Čína je druhým největším obchodním partnerem EU a EU je největším obchodním partnerem Číny od roku 2006. Tato země je hnací silou světového hospodářského růstu. Je velmi důležité, aby obchodní vztahy evropských zemí s Čínou byly založeny především na zásadách reciprocity, udržitelného rozvoje, dodržování ekologických limitů a spravedlivé hospodářské soutěže.Rozvíjení obchodních vztahů s Čínou by měl doprovázet politický dialog, který by měl zahrnovat i otázky lidských práv. Čína by měla posílit své snahy v oblasti vymáhání práv duševního vlastnictví a řešit problémy související s výrobou padělaného a pirátského zboží v Číně.Znepokojivá je rovněž vysoká míra znečištění způsobeného čínským průmyslem a rostoucí spotřeba přírodních zdrojů ze strany Číny.Přerušení jednání s vyslanci dalajlámy vrhá stín na vztahy s Čínou. Čína by měla zmírnit všechny formy pronásledování tibetského lidu.Máme-li zajistit správnou úroveň obchodních vztahů s Čínou, musí být tyto vztahy založeny na angažovanosti a strategickém partnerství zahrnujícím zásady reciprocity, spravedlivé hospodářské soutěže a obchodu v souladu s našimi společnými hodnotami a dodržováním pravidel WTO. ","Bogusław Rogalski  (UEN),",6,187,not_available,"['pol', 'pol', 'pol', 'pol', 'pol', 'pol']","['  Bogusław Rogalski  (UEN),  písemně. – (PL) Při hlasování o zprávě o obchodních a hospodářských vztazích s Čínou jsem hlasoval pro její přijetí.', 'Čína je druhým největším obchodním partnerem EU a EU je největším obchodním partnerem Číny od roku 2006. Tato země je hnací silou světového hospodářského růstu. Je velmi důležité, aby obchodní vztahy evropských zemí s Čínou byly založeny především na zásadách reciprocity, udržitelného rozvoje, dodržování ekologických limitů a spravedlivé hospodářské soutěže.', 'Rozvíjení obchodních vztahů s Čínou by měl doprovázet politický dialog, který by měl zahrnovat i otázky lidských práv. Čína by měla posílit své snahy v oblasti vymáhání práv duševního vlastnictví a řešit problémy související s výrobou padělaného a pirátského zboží v Číně.', 'Znepokojivá je rovněž vysoká míra znečištění způsobeného čínským průmyslem a rostoucí spotřeba přírodních zdrojů ze strany Číny.', 'Přerušení jednání s vyslanci dalajlámy vrhá stín na vztahy s Čínou. Čína by měla zmírnit všechny formy pronásledování tibetského lidu.', 'Máme-li zajistit správnou úroveň obchodních vztahů s Čínou, musí být tyto vztahy založeny na angažovanosti a strategickém partnerství zahrnujícím zásady reciprocity, spravedlivé hospodářské soutěže a obchodu v souladu s našimi společnými hodnotami a dodržováním pravidel WTO. ']"
147, 6. Vysvětlení hlasování,"  Luca Romagnoli  (NI),  písemně. – (IT) Nevítám zprávu paní Wortmann-Koolové o obchodních a hospodářských vztazích s Čínou, protože s řadou tvrzení v této zprávě nesouhlasím.Pokud jde o budoucí opatření ze strany Evropské unie, nesouhlasím například s tím, že je nezbytné předcházet problémům prostřednictvím dvoustranného dialogu. Skutečností je, že setkání vysokých odpovědných činitelů z čínského vedení a jejich protějšků v Evropské komisi nemůže odpovídajícím způsobem řešit vzájemné problémy zejména v oblasti investic, přístupu na trh a ochrany práv duševního vlastnictví i dalších strategických otázek v oblasti obchodu. Důvodem je, že čínská vláda porušuje hospodářské dohody schválené Evropskou unií. ","Luca Romagnoli  (NI),",2,98,not_available,"['ita', 'ita']","['  Luca Romagnoli  (NI),  písemně. – (IT) Nevítám zprávu paní Wortmann-Koolové o obchodních a hospodářských vztazích s Čínou, protože s řadou tvrzení v této zprávě nesouhlasím.', 'Pokud jde o budoucí opatření ze strany Evropské unie, nesouhlasím například s tím, že je nezbytné předcházet problémům prostřednictvím dvoustranného dialogu. Skutečností je, že setkání vysokých odpovědných činitelů z čínského vedení a jejich protějšků v Evropské komisi nemůže odpovídajícím způsobem řešit vzájemné problémy zejména v oblasti investic, přístupu na trh a ochrany práv duševního vlastnictví i dalších strategických otázek v oblasti obchodu. Důvodem je, že čínská vláda porušuje hospodářské dohody schválené Evropskou unií. ']"
148, 6. Vysvětlení hlasování,"  Charles Tannock  (PPE-DE),  písemně. − Tato zpráva hovoří o rostoucím obchodě Číny s Tchaj-wanem, což vítám. Během působení prezidenta Maa učinil Tchaj-wan značné pokroky, pokud jde o normalizaci obchodních vztahů s Čínou a snahu změnit dosavadní obstrukcionistický přístup komunistických vládců v Pekingu vůči obchodním vztahům s Tchaj-wanem.Pokud se však Tchaj-wan má plně začlenit mezi regionální ekonomiky jihovýchodní Asie, musí být přijat do mezinárodních organizací bez ohledu na to, zda bude uznán jako nezávislý svrchovaný stát.Vzhledem k řadě zdravotních obav, které se objevily ve východní Asii v nedávných letech v souvislosti s pohybem zboží a osob – jako například nemoc SARS, ptačí chřipka a skandál s melaninem obsaženým v mléku –, je nezbytné, aby byl Tchaj-wanu přiznán status pozorovatele ve Světovém zdravotnickém shromáždění. Tento krok by prospěl obchodu na obou stranách průlivu, zvýšil by standardy kvality v regionu a posílil by postavení Tchaj-wanu na mezinárodní scéně.Způsob, jakým Čína používá své neshody s Tchaj-wanem k politickým hrám s veřejným zdravím, je třeba odmítnout. Stejně tak ostudné je mlčení řady lidí v Evropě v reakci na čínský tlak.Hlasoval jsem pro přijetí této zprávy. ","Charles Tannock  (PPE-DE),",5,189,not_available,"['cze', 'cze', 'cze', 'cze', 'cze']","['  Charles Tannock  (PPE-DE),  písemně. − Tato zpráva hovoří o rostoucím obchodě Číny s Tchaj-wanem, což vítám. Během působení prezidenta Maa učinil Tchaj-wan značné pokroky, pokud jde o normalizaci obchodních vztahů s Čínou a snahu změnit dosavadní obstrukcionistický přístup komunistických vládců v Pekingu vůči obchodním vztahům s Tchaj-wanem.', 'Pokud se však Tchaj-wan má plně začlenit mezi regionální ekonomiky jihovýchodní Asie, musí být přijat do mezinárodních organizací bez ohledu na to, zda bude uznán jako nezávislý svrchovaný stát.', 'Vzhledem k řadě zdravotních obav, které se objevily ve východní Asii v nedávných letech v souvislosti s pohybem zboží a osob – jako například nemoc SARS, ptačí chřipka a skandál s melaninem obsaženým v mléku –, je nezbytné, aby byl Tchaj-wanu přiznán status pozorovatele ve Světovém zdravotnickém shromáždění. Tento krok by prospěl obchodu na obou stranách průlivu, zvýšil by standardy kvality v regionu a posílil by postavení Tchaj-wanu na mezinárodní scéně.', 'Způsob, jakým Čína používá své neshody s Tchaj-wanem k politickým hrám s veřejným zdravím, je třeba odmítnout. Stejně tak ostudné je mlčení řady lidí v Evropě v reakci na čínský tlak.', 'Hlasoval jsem pro přijetí této zprávy. ']"
149, 7. Opravy hlasování a sdělení o úmyslu hlasovat: viz zápis,(Zasedání bylo přerušeno ve 12:35 a obnoveno v 15:00) ,unknown,1,11,not_available,['cze'],['(Zasedání bylo přerušeno ve 12:35 a obnoveno v 15:00) ']
150, 7. Opravy hlasování a sdělení o úmyslu hlasovat: viz zápis,PŘEDSEDAJÍCÍ: PANÍ KRATSA-TSAGAROPOULOUOVÁ místopředsedkyně,PŘEDSEDAJÍCÍ: PANÍ KRATSA-TSAGAROPOULOUOVÁ,1,5,not_available,['cze'],['PŘEDSEDAJÍCÍ: PANÍ KRATSA-TSAGAROPOULOUOVÁ místopředsedkyně']
151, 11.1. Situace na Srí Lance,  Předsedající.   – Dalším bodem je rozprava o čtyřech návrzích usnesení k situaci na Srí Lance.(1),Předsedající.,1,15,not_available,['cze'],['  Předsedající.   – Dalším bodem je rozprava o čtyřech návrzích usnesení k situaci na Srí Lance.(1)']
152, 11.1. Situace na Srí Lance,"  Tobias Pflüger,  autor. – (DE) Paní předsedající, na severu Srí Lanky v současnosti dochází k humanitární katastrofě, které se dostává relativně malé pozornosti. Srílanská armáda provádí útoky na civilní obyvatele, které můžeme popsat jako masakry. Pod palbu se dokonce dostala i nemocnice humanitární organizace popisující celou situaci jako katastrofální. Červený kříž volá na poplach.Situace na Srí Lance se vystupňovala a Evropská unie není zcela bez viny, protože zmařila jednání, která byla vedena pod vedením Norska tím, že umístila organizaci LTTE na evropský seznam teroristických organizací. V důsledku toho nejsou již jednání v rámci Evropské unie možná.Na samotné Srí Lance již neexistuje svoboda tisku. Nedávno byl zabit jeden novinář. O německém velvyslanci, který promluvil na jeho pohřbu, prohlásil prezident, že by měl opustit zemi. Dopustil se pouze toho, že přesně popsal situaci v zemi.Hovoří se o tisících uprchlíků na severu a musím zcela jasně říct, že celé této situaci bychom měli věnovat mnohem více pozornosti. Evropská unie by měla mnohem jasněji vystoupit proti tomu, co v současnosti dělá srílanská vláda. Útoky ze strany srílanské armády a LTTE jsou špatné; je jasné, že postiženi jsou především civilisté.Musíme pomoci lidem, kteří jsou uvězněni na severu, a musíme dosáhnout okamžitého příměří, protože je zcela jasné, že je zde zabíjeno značné množství civilistů. Je to nepřijatelné a část viny bude spočívat i na Evropské unii, pokud mnohem zřetelněji neprohlásí, že je třeba ukončit podporu srílanské vládě. ","Tobias Pflüger,",5,234,not_available,"['ger', 'ger', 'ger', 'ger', 'ger']","['  Tobias Pflüger,  autor. – (DE) Paní předsedající, na severu Srí Lanky v současnosti dochází k humanitární katastrofě, které se dostává relativně malé pozornosti. Srílanská armáda provádí útoky na civilní obyvatele, které můžeme popsat jako masakry. Pod palbu se dokonce dostala i nemocnice humanitární organizace popisující celou situaci jako katastrofální. Červený kříž volá na poplach.', 'Situace na Srí Lance se vystupňovala a Evropská unie není zcela bez viny, protože zmařila jednání, která byla vedena pod vedením Norska tím, že umístila organizaci LTTE na evropský seznam teroristických organizací. V důsledku toho nejsou již jednání v rámci Evropské unie možná.', 'Na samotné Srí Lance již neexistuje svoboda tisku. Nedávno byl zabit jeden novinář. O německém velvyslanci, který promluvil na jeho pohřbu, prohlásil prezident, že by měl opustit zemi. Dopustil se pouze toho, že přesně popsal situaci v zemi.', 'Hovoří se o tisících uprchlíků na severu a musím zcela jasně říct, že celé této situaci bychom měli věnovat mnohem více pozornosti. Evropská unie by měla mnohem jasněji vystoupit proti tomu, co v současnosti dělá srílanská vláda. Útoky ze strany srílanské armády a LTTE jsou špatné; je jasné, že postiženi jsou především civilisté.', 'Musíme pomoci lidem, kteří jsou uvězněni na severu, a musíme dosáhnout okamžitého příměří, protože je zcela jasné, že je zde zabíjeno značné množství civilistů. Je to nepřijatelné a část viny bude spočívat i na Evropské unii, pokud mnohem zřetelněji neprohlásí, že je třeba ukončit podporu srílanské vládě. ']"
153, 11.1. Situace na Srí Lance,"  Charles Tannock,  autor. − Paní předsedající, krvavá občanská válka na Srí Lance se snad konečně chýlí ke konci. LTTE, kterou EU označila za teroristickou organizaci, bude už konečně muset složit zbraně a vzdát se. EU a další spolupředsedové k tomu LTTE vyzvali. Odpověď LTTE nám ukáže, zda mají skutečně na srdci nejlepší zájmy Tamilů.LTTE používá své frontové organizace v Evropě s cílem co nejvíce podpořit účinek své propagandy a získat peníze prostřednictvím vydírání v mezinárodním měřítku. Někteří bojovníci LTTE se mohou dokonce pokoušet získat azyl v Evropské unii.Během 26 krutých let občanské války se LTTE stala průkopníkem teroristické taktiky, jako například sebevražedných bombových útoků, které jsou dnes bohužel používány v řadě jiných částí světa. Srílanská armáda musela proto použít všechny prostředky, které měla k dispozici, k potlačení tohoto krutého povstání. Je však zřejmé, že zprávy o počtu obětí ze strany LTTE jsou přehnané. Některé zprávy jsou nyní odvolávány – např. zpráva agentury Agence Presse o 300 zabitých civilistech, poté, co údajný autor své autorství popřel. Nicméně smrt civilistů ve válečné oblasti je tragédií bez ohledu na to, kdy a kde k ní dojde.Srílanská armáda není rozhodně také bez úhony, nesnaží se však záměrně zneužívat civilní obyvatele a vystavovat je nebezpečí, jak to údajně činí LTTE.Jestliže se podaří válku skutečně brzy ukončit, je nezbytné, aby nyní Srí Lanka obrátila svou pozornost na poválečné odzbrojení, demobilizaci a znovuzačlenění vojáků do společnosti. Opomíjení Tamilů na úkor většinových Sinhálců je třeba řešit naléhavě a soustavně s cílem zajistit vytvoření stabilní a udržitelné mnohonárodnostní společnosti s regionálním zastoupením.EU by měla rovněž zajistit, že srílanská vláda bude mít k dispozici zdroje na udržení poválečného rozvoje. I když je důležité, abychom podpořili nabídku ze strany vlády na amnestii pro většinu bojovníků LTTE, je nezbytné, aby nikdo z těch, kdo jsou odpovědní za nejzávažnější válečné zločiny, nezůstal nepotrestán. ","Charles Tannock,",6,303,not_available,"['cze', 'cze', 'cze', 'cze', 'cze', 'cze']","['  Charles Tannock,  autor. − Paní předsedající, krvavá občanská válka na Srí Lance se snad konečně chýlí ke konci. LTTE, kterou EU označila za teroristickou organizaci, bude už konečně muset složit zbraně a vzdát se. EU a další spolupředsedové k tomu LTTE vyzvali. Odpověď LTTE nám ukáže, zda mají skutečně na srdci nejlepší zájmy Tamilů.', 'LTTE používá své frontové organizace v Evropě s cílem co nejvíce podpořit účinek své propagandy a získat peníze prostřednictvím vydírání v mezinárodním měřítku. Někteří bojovníci LTTE se mohou dokonce pokoušet získat azyl v Evropské unii.', 'Během 26 krutých let občanské války se LTTE stala průkopníkem teroristické taktiky, jako například sebevražedných bombových útoků, které jsou dnes bohužel používány v řadě jiných částí světa. Srílanská armáda musela proto použít všechny prostředky, které měla k dispozici, k potlačení tohoto krutého povstání. Je však zřejmé, že zprávy o počtu obětí ze strany LTTE jsou přehnané. Některé zprávy jsou nyní odvolávány – např. zpráva agentury Agence Presse o 300 zabitých civilistech, poté, co údajný autor své autorství popřel. Nicméně smrt civilistů ve válečné oblasti je tragédií bez ohledu na to, kdy a kde k ní dojde.', 'Srílanská armáda není rozhodně také bez úhony, nesnaží se však záměrně zneužívat civilní obyvatele a vystavovat je nebezpečí, jak to údajně činí LTTE.', 'Jestliže se podaří válku skutečně brzy ukončit, je nezbytné, aby nyní Srí Lanka obrátila svou pozornost na poválečné odzbrojení, demobilizaci a znovuzačlenění vojáků do společnosti. Opomíjení Tamilů na úkor většinových Sinhálců je třeba řešit naléhavě a soustavně s cílem zajistit vytvoření stabilní a udržitelné mnohonárodnostní společnosti s regionálním zastoupením.', 'EU by měla rovněž zajistit, že srílanská vláda bude mít k dispozici zdroje na udržení poválečného rozvoje. I když je důležité, abychom podpořili nabídku ze strany vlády na amnestii pro většinu bojovníků LTTE, je nezbytné, aby nikdo z těch, kdo jsou odpovědní za nejzávažnější válečné zločiny, nezůstal nepotrestán. ']"
154, 11.1. Situace na Srí Lance,"  Marios Matsakis,  autor. − Paní předsedající, Srí Lanka trpí vnitřními konflikty po celá desetiletí. Tato tragická situace je především důsledkem ozbrojeného konfliktu mezi separatistickými povstalci na severu a srílanskou armádou. Během těchto bojů byly zabity a zraněny tisíce nevinných civilistů a bylo spácháno mnoho škod na majetku, infrastruktuře a životním prostředí.Tyto politováníhodné poměry se v posledních měsících zhoršily díky rozsáhlé vládní ofenzívě proti Tamilským tygrům. Ze zpráv, které přicházejí ze Srí Lanky, vyplývá, že situace v některých oblastech se v posledních týdnech tragicky zhoršila, přičemž jsou vyháněny stovky lidí a zaplétány do bojů. Podle organizace Amnesty International dochází k porušování mezinárodních úmluv a lidských práv jak ze strany vlády, tak ze strany sil Tamilských tygrů.Za těchto okolností je pochopitelně obtížné jednoznačně určit, kdo je vinen některými z těchto tragických událostí, k nimž dochází na Srí Lance, vyzýváme však obě strany k umírněnosti a k tomu, aby braly co největší ohledy na civilní obyvatelstvo a respektovaly je a aby dodržovaly válečné zvyklosti.Jelikož kontrolu nad situací má srílanská vláda a jelikož je také mezinárodně uznávaným orgánem země, musí naše výzvy logicky směřovat především k ní. Zároveň však musíme vyzvat také vůdce Tamilských tygrů, aby dodrželi výzvy mezinárodního společenství a využili nabídky vlády k amnestii, odsoudili násilí a snažili se dosáhnout svých cílů prostřednictvím politického dialogu.Musíme opětovně zdůraznit, že bojem se žádné problémy neřeší a že trvalého míru a stability lze dosáhnout pouze u jednacího stolu, k čemuž musí dříve či později dojít. Během těchto jednání budou muset učinit ústupky obě strany a bude třeba nalézt řešení, které bude ve prospěch občanů této nádherné země. Doufáme, že prostřednictvím tohoto usnesení dokážeme pomoci ke zmírnění utrpení obyvatel Srí Lanky a k nastolení tolik potřebného míru v této zemi. ","Marios Matsakis,",5,287,not_available,"['cze', 'cze', 'cze', 'cze', 'cze']","['  Marios Matsakis,  autor. − Paní předsedající, Srí Lanka trpí vnitřními konflikty po celá desetiletí. Tato tragická situace je především důsledkem ozbrojeného konfliktu mezi separatistickými povstalci na severu a srílanskou armádou. Během těchto bojů byly zabity a zraněny tisíce nevinných civilistů a bylo spácháno mnoho škod na majetku, infrastruktuře a životním prostředí.', 'Tyto politováníhodné poměry se v posledních měsících zhoršily díky rozsáhlé vládní ofenzívě proti Tamilským tygrům. Ze zpráv, které přicházejí ze Srí Lanky, vyplývá, že situace v některých oblastech se v posledních týdnech tragicky zhoršila, přičemž jsou vyháněny stovky lidí a zaplétány do bojů. Podle organizace Amnesty International dochází k porušování mezinárodních úmluv a lidských práv jak ze strany vlády, tak ze strany sil Tamilských tygrů.', 'Za těchto okolností je pochopitelně obtížné jednoznačně určit, kdo je vinen některými z těchto tragických událostí, k nimž dochází na Srí Lance, vyzýváme však obě strany k umírněnosti a k tomu, aby braly co největší ohledy na civilní obyvatelstvo a respektovaly je a aby dodržovaly válečné zvyklosti.', 'Jelikož kontrolu nad situací má srílanská vláda a jelikož je také mezinárodně uznávaným orgánem země, musí naše výzvy logicky směřovat především k ní. Zároveň však musíme vyzvat také vůdce Tamilských tygrů, aby dodrželi výzvy mezinárodního společenství a využili nabídky vlády k amnestii, odsoudili násilí a snažili se dosáhnout svých cílů prostřednictvím politického dialogu.', 'Musíme opětovně zdůraznit, že bojem se žádné problémy neřeší a že trvalého míru a stability lze dosáhnout pouze u jednacího stolu, k čemuž musí dříve či později dojít. Během těchto jednání budou muset učinit ústupky obě strany a bude třeba nalézt řešení, které bude ve prospěch občanů této nádherné země. Doufáme, že prostřednictvím tohoto usnesení dokážeme pomoci ke zmírnění utrpení obyvatel Srí Lanky a k nastolení tolik potřebného míru v této zemi. ']"
