,agenda_item,text,speaker,number_p,number_w,chair,language_ps,ps
38, 4. Informační a propagační opatření na podporu zemědělských produktů na vnitřním trhu a ve třetích zemích (rozprava) ,"  Ilda Figueiredo,  jménem skupiny GUE/NGL. – (PT) Pane předsedající, paní komisařko, dámy a pánové, musíme mít na paměti, že je důležité zlepšit podmínky podpory informačních a propagačních opatření na podporu zemědělských produktů na vnitřním trhu a ve třetích zemích a rozšířit oblast působnosti návrhů, které Evropská komise předložila.Podporujeme proto návrhy zpravodaje a Výboru pro zemědělství a rozvoj venkova, konkrétně návrhy zaměřené na větší intervenci a posílení úlohy obchodních organizací a organizací působících v daném odvětví, a to s ohledem na jejich odborné zkušenosti a významnou úlohu, kterou rovněž sehrávají při zajišťování kontroly jakosti, včetně sdružení a organizací členských států, které vypracovávají programy, stejně jako zvýšení podílu finanční účasti Společenství. Je důležité, aby existovala dodatečná podpora, zejména pro projekty vybrané členskými státy.Stejně tak je důležité, aby z propagace a reklamy ve třetích zemích měli prospěch i další významné produkty a nejen olivový olej a olivy, zejména vína s chráněným označením původu nebo s chráněným zeměpisným označením. V této souvislosti zde uvedu významnou úlohu zemědělských sdružení, družstevních vinných sklepů a dalších sdružení malých a středních zemědělců, jejichž existence má zásadní význam pro zajištění toku produkce zemědělců, kteří by nebyli sami schopni obstát.Opětovně vyzývám k větší podpoře těchto organizací zemědělců, aby mohly plnit svou úlohu: podporovat rodinné zemědělství a vysoce kvalitní produkty, nezbytné z hlediska zajištění zdravé stravy pro obyvatelstvo našich zemí.Budeme proto hlasovat pro přijetí této zprávy. ","Ilda Figueiredo,",5,229,not_available,"['por', 'por', 'por', 'por', 'por']","['  Ilda Figueiredo,  jménem skupiny GUE/NGL. – (PT) Pane předsedající, paní komisařko, dámy a pánové, musíme mít na paměti, že je důležité zlepšit podmínky podpory informačních a propagačních opatření na podporu zemědělských produktů na vnitřním trhu a ve třetích zemích a rozšířit oblast působnosti návrhů, které Evropská komise předložila.', 'Podporujeme proto návrhy zpravodaje a Výboru pro zemědělství a rozvoj venkova, konkrétně návrhy zaměřené na větší intervenci a posílení úlohy obchodních organizací a organizací působících v daném odvětví, a to s ohledem na jejich odborné zkušenosti a významnou úlohu, kterou rovněž sehrávají při zajišťování kontroly jakosti, včetně sdružení a organizací členských států, které vypracovávají programy, stejně jako zvýšení podílu finanční účasti Společenství. Je důležité, aby existovala dodatečná podpora, zejména pro projekty vybrané členskými státy.', 'Stejně tak je důležité, aby z propagace a reklamy ve třetích zemích měli prospěch i další významné produkty a nejen olivový olej a olivy, zejména vína s chráněným označením původu nebo s chráněným zeměpisným označením. V této souvislosti zde uvedu významnou úlohu zemědělských sdružení, družstevních vinných sklepů a dalších sdružení malých a středních zemědělců, jejichž existence má zásadní význam pro zajištění toku produkce zemědělců, kteří by nebyli sami schopni obstát.', 'Opětovně vyzývám k větší podpoře těchto organizací zemědělců, aby mohly plnit svou úlohu: podporovat rodinné zemědělství a vysoce kvalitní produkty, nezbytné z hlediska zajištění zdravé stravy pro obyvatelstvo našich zemí.', 'Budeme proto hlasovat pro přijetí této zprávy. ']"
39, 4. Informační a propagační opatření na podporu zemědělských produktů na vnitřním trhu a ve třetích zemích (rozprava) ,"  Witold Tomczak,  jménem skupiny IND/DEM. – (PL) Pane předsedající, paní komisařko, Evropská unie je významným vývozcem řady zemědělských produktů, avšak budoucnost zemědělství EU bude záviset na spotřebě v rámci vnitřního trhu. Jeho oživení může prospět zemědělcům, spotřebitelům a celému hospodářství.V řadě členských států není spotřeba potravin důležitých pro zdraví vysoká a její zvýšení prostřednictvím dobrých informací a propagace je velmi žádoucí. Je však důležité, aby zemědělci v EU mohli využívat programů, o nichž vedeme tuto rozpravu, a zejména malí a střední zemědělci, kteří představují 95 % všech hospodářství.Tyto programy by měly obohatit znalost spotřebitelů o zdravé výživě a zároveň jim umožnit výběr. Z toho důvodu má smysl přijmout tato opatření: pořádat konzultace s odborníky na zdravou výživu a odborné přípravy prodejců, kteří by měli být poradci spotřebitelů na zdravou výživu. Vhodné předkládání informací o zdraví propagovaných produktů a o způsobu jejich výroby má zásadní význam. Informace na etiketách jsou nedostatečné.Tyto programy mohou být ohroženy propagací hromadně vyráběných potravin velkými společnostmi, které mohou připravit účinné programy a které mají k dispozici nejlepší odborníky. Nemůže to však ohrozit propagaci vysoce kvalitních produktů?Čitelnost doby trvanlivosti produktu je rovněž velmi důležitá, stejně jako zvýšení povědomí spotřebitelů o významu všech informací, které se nacházejí na etiketách produktu. ","Witold Tomczak,",5,205,not_available,"['pol', 'pol', 'pol', 'pol', 'pol']","['  Witold Tomczak,  jménem skupiny IND/DEM. – (PL) Pane předsedající, paní komisařko, Evropská unie je významným vývozcem řady zemědělských produktů, avšak budoucnost zemědělství EU bude záviset na spotřebě v rámci vnitřního trhu. Jeho oživení může prospět zemědělcům, spotřebitelům a celému hospodářství.', 'V řadě členských států není spotřeba potravin důležitých pro zdraví vysoká a její zvýšení prostřednictvím dobrých informací a propagace je velmi žádoucí. Je však důležité, aby zemědělci v EU mohli využívat programů, o nichž vedeme tuto rozpravu, a zejména malí a střední zemědělci, kteří představují 95 % všech hospodářství.', 'Tyto programy by měly obohatit znalost spotřebitelů o zdravé výživě a zároveň jim umožnit výběr. Z toho důvodu má smysl přijmout tato opatření: pořádat konzultace s odborníky na zdravou výživu a odborné přípravy prodejců, kteří by měli být poradci spotřebitelů na zdravou výživu. Vhodné předkládání informací o zdraví propagovaných produktů a o způsobu jejich výroby má zásadní význam. Informace na etiketách jsou nedostatečné.', 'Tyto programy mohou být ohroženy propagací hromadně vyráběných potravin velkými společnostmi, které mohou připravit účinné programy a které mají k dispozici nejlepší odborníky. Nemůže to však ohrozit propagaci vysoce kvalitních produktů?', 'Čitelnost doby trvanlivosti produktu je rovněž velmi důležitá, stejně jako zvýšení povědomí spotřebitelů o významu všech informací, které se nacházejí na etiketách produktu. ']"
40, 4. Informační a propagační opatření na podporu zemědělských produktů na vnitřním trhu a ve třetích zemích (rozprava) ,"  Maria Petre  (PPE-DE).   – (RO) Nejprve bych ráda poblahopřála svému kolegovi k usilovné práci, kterou vykonal jako zpravodaj zjednodušením právní úpravy EU pro snížení administrativní zátěže, což musíme činit všichni.Informační opatření ze strany Evropské unie jsou reakcí na skutečnou potřebu členských států na podporu obrazu jejich zemědělských produktů, a to jak mezi evropskými spotřebiteli, tak mezi spotřebiteli z jiných zemí, zejména pokud jde o jakost a nutriční hodnotu, stejně jako bezpečnost potravin a bezpečnost výrobních metod. Jako zpravodajka pro oblast kvality vítám tuto konkurenční přednost, kterou naše evropské produkty mají.Tento legislativní návrh nabídne zainteresovaným členským státům možnost navrhovat informační programy, včetně programů pro třetí země, pokud již nebyly přijaty. Díky tomuto návrhu budou mít členské státy možnost rozšířit oblast uplatňování opatření, na něž se tyto programy zaměřují, a využívat pomoci mezinárodních organizací při realizaci těchto opatření. Podíl finanční účasti Evropské unie se musí zvýšit s cílem poskytnout dodatečnou podporu pro projekty vybrané členskými státy v době obecně se zhoršujících podmínek, v nichž se vnitrostátní organizace a orgány snaží získat částky potřebné ke spolufinancování.Podporuje představu, že organizace, která je pověřena realizací vybraných programů, by měla být v některé mezinárodní organizaci, zejména v případě programů zaměřených na propagaci odvětví olivového oleje a stolních oliv, nemluvě o odvětví vína a vín s chráněným označením původu a vín s chráněným zeměpisným označením, ve třetích zemích.Zároveň musíme mít na paměti významnou úlohu, kterou sehrávají profesní organizace a organizace působící v cílovém odvětví členských států při přípravě informačních programů pro zemědělské produkty. Závěrem bych ráda ještě jednou poděkovala zpravodaji a především paní komisařce Vassiliouové za to, že přijala všechny návrhy, které jsme jí ve zprávě předložili. ",Maria Petre  (PPE-DE).,5,274,not_available,"['rum', 'rum', 'rum', 'rum', 'rum']","['  Maria Petre  (PPE-DE).   – (RO) Nejprve bych ráda poblahopřála svému kolegovi k usilovné práci, kterou vykonal jako zpravodaj zjednodušením právní úpravy EU pro snížení administrativní zátěže, což musíme činit všichni.', 'Informační opatření ze strany Evropské unie jsou reakcí na skutečnou potřebu členských států na podporu obrazu jejich zemědělských produktů, a to jak mezi evropskými spotřebiteli, tak mezi spotřebiteli z jiných zemí, zejména pokud jde o jakost a nutriční hodnotu, stejně jako bezpečnost potravin a bezpečnost výrobních metod. Jako zpravodajka pro oblast kvality vítám tuto konkurenční přednost, kterou naše evropské produkty mají.', 'Tento legislativní návrh nabídne zainteresovaným členským státům možnost navrhovat informační programy, včetně programů pro třetí země, pokud již nebyly přijaty. Díky tomuto návrhu budou mít členské státy možnost rozšířit oblast uplatňování opatření, na něž se tyto programy zaměřují, a využívat pomoci mezinárodních organizací při realizaci těchto opatření. Podíl finanční účasti Evropské unie se musí zvýšit s cílem poskytnout dodatečnou podporu pro projekty vybrané členskými státy v době obecně se zhoršujících podmínek, v nichž se vnitrostátní organizace a orgány snaží získat částky potřebné ke spolufinancování.', 'Podporuje představu, že organizace, která je pověřena realizací vybraných programů, by měla být v některé mezinárodní organizaci, zejména v případě programů zaměřených na propagaci odvětví olivového oleje a stolních oliv, nemluvě o odvětví vína a vín s chráněným označením původu a vín s chráněným zeměpisným označením, ve třetích zemích.', 'Zároveň musíme mít na paměti významnou úlohu, kterou sehrávají profesní organizace a organizace působící v cílovém odvětví členských států při přípravě informačních programů pro zemědělské produkty. Závěrem bych ráda ještě jednou poděkovala zpravodaji a především paní komisařce Vassiliouové za to, že přijala všechny návrhy, které jsme jí ve zprávě předložili. ']"
41, 4. Informační a propagační opatření na podporu zemědělských produktů na vnitřním trhu a ve třetích zemích (rozprava) ,"  Alessandro Battilocchio  (PSE).   – (IT) Pane předsedající, dámy a pánové, v posledních několika měsících, a především během tohoto volebního období, jsme svědky postupného úbytku přímých podpor pro naše zemědělce a předpisů, které chránily náš průmysl před levnými dovozy ze zemí mimo EU, s cílem uvolnit prostředky potřebné pro ekologické, hospodářské a sociální úkoly tohoto tisíciletí a s cílem splnit mezinárodní obchodní dohody.Jako člen Výboru pro zemědělství a rozvoj venkova a především jako zástupce země, které se dostává světového uznání a respektu pro kvalitu její zemědělské produkce – mám na mysli olivový olej, víno a sýry –, nemohu než souhlasit s každým opatřením, které Komise navrhne v zájmu zachování vysoké kvality evropské produkce a na podporu – pokud je to možné – uvádění této produkce jak na vnitřní trh, tak na zahraniční trhy.Tento informační program je ve skutečnosti zvláště významný, neboť jeho úkolem je objasnit evropským a dalším spotřebitelům, že naše produkce není konkurencí možná levnější produkce z jiných zemí, ale představuje spíše alternativu, která se soustředí na kvalitu a produkční model šetrný k životnímu prostředí a zachovávající sociální normy a dobré životní podmínky zvířat, což na druhé straně přirozeně prospívá lidskému zdraví.Právní předpisy, o nichž v této sněmovně každý den hlasujeme, mohou především naše výrobce někdy zatěžovat. Proto jim musíme poskytovat veškerou pomoc, kterou můžeme, aby se neztratilo bohatství a kvalita naší produkce a nerozplynulo se v ještě homogennějším světovém trhu. Z tohoto důvodu podporuji návrhy zpravodaje, jejichž cílem je větší spolufinancování ze strany Komise, rozšíření činností, kterým je možné poskytnout prostředky, a co je nejdůležitější posílení účasti sdružení výrobců, která nejlépe mohou definovat kritéria kvality své produkce pro stále náročnější spotřebitele. ",Alessandro Battilocchio  (PSE).,4,270,not_available,"['ita', 'ita', 'ita', 'ita']","['  Alessandro Battilocchio  (PSE).   – (IT) Pane předsedající, dámy a pánové, v posledních několika měsících, a především během tohoto volebního období, jsme svědky postupného úbytku přímých podpor pro naše zemědělce a předpisů, které chránily náš průmysl před levnými dovozy ze zemí mimo EU, s cílem uvolnit prostředky potřebné pro ekologické, hospodářské a sociální úkoly tohoto tisíciletí a s cílem splnit mezinárodní obchodní dohody.', 'Jako člen Výboru pro zemědělství a rozvoj venkova a především jako zástupce země, které se dostává světového uznání a respektu pro kvalitu její zemědělské produkce – mám na mysli olivový olej, víno a sýry –, nemohu než souhlasit s každým opatřením, které Komise navrhne v zájmu zachování vysoké kvality evropské produkce a na podporu – pokud je to možné – uvádění této produkce jak na vnitřní trh, tak na zahraniční trhy.', 'Tento informační program je ve skutečnosti zvláště významný, neboť jeho úkolem je objasnit evropským a dalším spotřebitelům, že naše produkce není konkurencí možná levnější produkce z jiných zemí, ale představuje spíše alternativu, která se soustředí na kvalitu a produkční model šetrný k životnímu prostředí a zachovávající sociální normy a dobré životní podmínky zvířat, což na druhé straně přirozeně prospívá lidskému zdraví.', 'Právní předpisy, o nichž v této sněmovně každý den hlasujeme, mohou především naše výrobce někdy zatěžovat. Proto jim musíme poskytovat veškerou pomoc, kterou můžeme, aby se neztratilo bohatství a kvalita naší produkce a nerozplynulo se v ještě homogennějším světovém trhu. Z tohoto důvodu podporuji návrhy zpravodaje, jejichž cílem je větší spolufinancování ze strany Komise, rozšíření činností, kterým je možné poskytnout prostředky, a co je nejdůležitější posílení účasti sdružení výrobců, která nejlépe mohou definovat kritéria kvality své produkce pro stále náročnější spotřebitele. ']"
42, 4. Informační a propagační opatření na podporu zemědělských produktů na vnitřním trhu a ve třetích zemích (rozprava) ,"  Alexandru Nazare  (PPE-DE)  . – (RO) Dnes projednáváme zprávu, která je zvláště významná pro evropské zemědělství. Jak sám zpravodaj zdůraznil, kvalita a bezpečnost evropské produkce představují konkurenční výhodu, které není dostatečně využíváno.Opatření určená k poskytování informací o těchto produktech, jejich kvalitě a bezpečnostních standardech, které splňují, a k jejich propagaci, mohou spustit řetězovou reakci posílením poptávky, zvýšené produkce a vyšších zisků i tvorby nových pracovních míst, což v důsledku znamená hospodářský růst. Tato opatření musí být zaměřena jak na spotřebitele na vnitřním trhu, tak na spotřebitele ve třetích zemích.Nesmíme zapomínat na konkurenci, které čelíme ze strany výrobců z jiných zemí, kteří nabízejí mnohdy lacinější produkty, často však v mnohem nižší kvalitě a s mnohem nižšími bezpečnostními standardy. Spotřebitelé musí poznat produkty vyrobené ve Společenství a musí vědět, proč jsou zdravější než jiné. V neposlední řadě musí vědět, že koupí těchto produktů podporují evropské zemědělce a výrobce zemědělských potravin, a tím i evropské hospodářství.Zejména oceňuji iniciativu zpravodaje na uznání významné úlohy, kterou sehrávají profesní sdružení a organizace, protože ty mají většinou zkušenosti, které vnitrostátní orgány nemají. Znají rovněž mnohem lépe situaci na trhu a jeho požadavky. Zároveň jsem přesvědčen, že návrh na zvýšení podílu spolufinancování je v současné úvěrové krizi absolutní nutnost. Jsem rozhodně přesvědčen, že se tím zvýší míra využití těchto fondů.Na závěr bych rád poblahopřál zpravodaji panu Dumitriuovi k usilovné práci, kterou vykonal na svých návrzích, což je postoj, který dle mého soudu sdílí všichni kolegové poslanci. ",Alexandru Nazare  (PPE-DE),5,241,not_available,"['rum', 'rum', 'rum', 'rum', 'rum']","['  Alexandru Nazare  (PPE-DE)  . – (RO) Dnes projednáváme zprávu, která je zvláště významná pro evropské zemědělství. Jak sám zpravodaj zdůraznil, kvalita a bezpečnost evropské produkce představují konkurenční výhodu, které není dostatečně využíváno.', 'Opatření určená k poskytování informací o těchto produktech, jejich kvalitě a bezpečnostních standardech, které splňují, a k jejich propagaci, mohou spustit řetězovou reakci posílením poptávky, zvýšené produkce a vyšších zisků i tvorby nových pracovních míst, což v důsledku znamená hospodářský růst. Tato opatření musí být zaměřena jak na spotřebitele na vnitřním trhu, tak na spotřebitele ve třetích zemích.', 'Nesmíme zapomínat na konkurenci, které čelíme ze strany výrobců z jiných zemí, kteří nabízejí mnohdy lacinější produkty, často však v mnohem nižší kvalitě a s mnohem nižšími bezpečnostními standardy. Spotřebitelé musí poznat produkty vyrobené ve Společenství a musí vědět, proč jsou zdravější než jiné. V neposlední řadě musí vědět, že koupí těchto produktů podporují evropské zemědělce a výrobce zemědělských potravin, a tím i evropské hospodářství.', 'Zejména oceňuji iniciativu zpravodaje na uznání významné úlohy, kterou sehrávají profesní sdružení a organizace, protože ty mají většinou zkušenosti, které vnitrostátní orgány nemají. Znají rovněž mnohem lépe situaci na trhu a jeho požadavky. Zároveň jsem přesvědčen, že návrh na zvýšení podílu spolufinancování je v současné úvěrové krizi absolutní nutnost. Jsem rozhodně přesvědčen, že se tím zvýší míra využití těchto fondů.', 'Na závěr bych rád poblahopřál zpravodaji panu Dumitriuovi k usilovné práci, kterou vykonal na svých návrzích, což je postoj, který dle mého soudu sdílí všichni kolegové poslanci. ']"
43, 4. Informační a propagační opatření na podporu zemědělských produktů na vnitřním trhu a ve třetích zemích (rozprava) ,"  Silvia-Adriana Ţicău  (PSE).   – (RO) Ráda bych poblahopřála zpravodaji, panu Dumitriuovi. Odvětví zemědělství je významné pro hospodářství členských států, protože zajišťuje potraviny pro obyvatelstvo, zemědělskou produkci na vývoz, nemluvě o značném počtu pracovním míst. Evropská unie musí být schopna vyprodukovat dostatečné množství potravin pro své obyvatelstvo za dostupnou cenu.Je zřejmé, že na konkurenčním trhu se stávají informační a propagační opatření v oblasti zemědělské produkce na vnitřním trhu a ve třetích zemích stále důležitějšími. Při přípravě programů na propagaci zemědělských produktů je třeba konzultovat profesní sdružení a organizace. Jsem přesvědčen, že toto nařízení povzbudí evropské zemědělce k podpoře jejich zemědělských produktů.Rumunsko nabízí značné množství zemědělsko-potravinářských produktů, s nimiž se bohužel na evropských trzích nesetkáváme, i když mnohé z nich jsou produkty šetrné k životnímu prostředí. Kampaň na podporu evropských produktů by prospěla jak evropským spotřebitelům, tak rumunským zemědělským výrobcům. Zejména v období hospodářské krize je zemědělství jedním z odvětví, na které je třeba zaměřit zvláštní pozornost spolu s odpovídajícími programy a s financováním.V situaci krize musí členské státy věnovat větší pozornost stanovení priorit. A proto jsem přesvědčen, že zemědělství musí zůstat jednou z oblastí, která bude podporována, protože je to důležité pro evropské hospodářství. ",Silvia-Adriana Ţicău  (PSE).,4,197,not_available,"['rum', 'rum', 'rum', 'rum']","['  Silvia-Adriana Ţicău  (PSE).   – (RO) Ráda bych poblahopřála zpravodaji, panu Dumitriuovi. Odvětví zemědělství je významné pro hospodářství členských států, protože zajišťuje potraviny pro obyvatelstvo, zemědělskou produkci na vývoz, nemluvě o značném počtu pracovním míst. Evropská unie musí být schopna vyprodukovat dostatečné množství potravin pro své obyvatelstvo za dostupnou cenu.', 'Je zřejmé, že na konkurenčním trhu se stávají informační a propagační opatření v oblasti zemědělské produkce na vnitřním trhu a ve třetích zemích stále důležitějšími. Při přípravě programů na propagaci zemědělských produktů je třeba konzultovat profesní sdružení a organizace. Jsem přesvědčen, že toto nařízení povzbudí evropské zemědělce k podpoře jejich zemědělských produktů.', 'Rumunsko nabízí značné množství zemědělsko-potravinářských produktů, s nimiž se bohužel na evropských trzích nesetkáváme, i když mnohé z nich jsou produkty šetrné k životnímu prostředí. Kampaň na podporu evropských produktů by prospěla jak evropským spotřebitelům, tak rumunským zemědělským výrobcům. Zejména v období hospodářské krize je zemědělství jedním z odvětví, na které je třeba zaměřit zvláštní pozornost spolu s odpovídajícími programy a s financováním.', 'V situaci krize musí členské státy věnovat větší pozornost stanovení priorit. A proto jsem přesvědčen, že zemědělství musí zůstat jednou z oblastí, která bude podporována, protože je to důležité pro evropské hospodářství. ']"
