,agenda_item,text,speaker,number_p,number_w,chair,language_ps,ps
34, 2. Přeprava zvířat (rozprava),"  Neil Parish  (PPE-DE).   – Pane předsedající, budu velmi stručný, protože jsem autor dotazu. Rád bych jen řekl panu komisaři, než přednese své shrnutí, že ze tří otázek již první zodpověděl tím, že zmínil státy, které dosud nevypracovaly zprávu. Co mě však skutečně zajímá: vypracovala již Komise předběžnou analýzu zpráv a situace? Dále, hodlá Komise v budoucnu předložit zprávu o nařízení? Právě tu naléhavě potřebujeme.Také potřebujeme mít osvědčené postupy, protože například Slovinsko sleduje vozy po celé zemi. Stručně řečeno, mnohé země si vedou dobře, jiné špatně. Hodlá Komise provést řádnou analýzu všech těchto problémů, a kdy ji hodlá předložit? ",Neil Parish  (PPE-DE).,2,99,not_available,"['cze', 'cze']","['  Neil Parish  (PPE-DE).   – Pane předsedající, budu velmi stručný, protože jsem autor dotazu. Rád bych jen řekl panu komisaři, než přednese své shrnutí, že ze tří otázek již první zodpověděl tím, že zmínil státy, které dosud nevypracovaly zprávu. Co mě však skutečně zajímá: vypracovala již Komise předběžnou analýzu zpráv a situace? Dále, hodlá Komise v budoucnu předložit zprávu o nařízení? Právě tu naléhavě potřebujeme.', 'Také potřebujeme mít osvědčené postupy, protože například Slovinsko sleduje vozy po celé zemi. Stručně řečeno, mnohé země si vedou dobře, jiné špatně. Hodlá Komise provést řádnou analýzu všech těchto problémů, a kdy ji hodlá předložit? ']"
35, 2. Přeprava zvířat (rozprava),"  Vladimír Špidla,  člen Komise. − (CS) Vážený pane předsedo, dámy a pánové, římské právo ve své definici zvířete konstatovalo, že zvíře je věc. Vzpomínám si na jeden vojenský předpis, který pro transport určoval, že jeden vagón může přepravovat 8 koní nebo 48 mužů. To znamená, že v průběhu civilizace se začalo uvažovat o tom, že existuje jistá větší blízkost mezi zvířetem a lidskou bytostí než mezi lidskou bytostí a věcí. Myslím si, že vývojem civilizace jsme dospěli k názoru, že zvíře není věc, že je to existující bytost, která má svá imanentní práva, a tento názor jsme vyjádřili ve svých předpisech. Myslím si, že se dá konstatovat, že evropské předpisy v tomto okamžiku jsou formulovány a jsou nepochybným civilizačním pokrokem. Na druhé straně z debaty jednoznačně vyplynulo, že jsou nedůsledně uplatňovány a že v jejich konstrukci můžeme nalézt důvody pro další zlepšení.Komise souhlasí s těmito obecnými konstatováními a ve své činnosti se také bude snažit zlepšit systém uplatňování kontroly a sledování situace. Stejně tak jsme právě v procesu přípravy nových předpisů, které se snaží vzít v úvahu nejnovější vědecké poznatky z nejrůznějších oborů, protože to, co bylo z této diskuze také naprosto zřejmé, je komplexita tohoto problému. Není to jednoduchá věc, nestačí říct dobře, udělá se jedno nebo dvě opatření a věc bude vyřešena. Myslím si také, že z debaty jasně vyplynulo, že koncept ochrany hospodářských zvířat a zvířat obecně je koncept, který nevychází jenom z čistě praktického hlediska ochrany konzumentů. Že bychom k určitým ochranným věcem přistoupili i tehdy, kdyby to pro konzumenty neznamenalo žádný reálný význam, žádný reálný přínos, protože je to prostě eticky velmi významná věc.Dovolte mi, abych se pokusil odpovědět na některé konkrétní otázky. Byla jich položena celá řada a samozřejmě, že jsme připraveni jednotlivým poslancům odpovědět podrobněji na ty otázky, kterých se nedotknu. Jedna z otázek byla, které země nezaslaly své zprávy, ve své úvodní řeči jsem to sdělil, ale protože to je mimořádně důležitá věc, konstatuji, že to byl Kypr, Litva, Malta, Bulharsko a Lucembursko. Čili Irska se tato otázka netýkala, Irsko splnilo svoji povinnost. V debatě také zazněly otázky o způsobu přístupu k informacím, chci konstatovat, že teoreticky je možné zveřejnit jednotlivé národní zprávy, nařízení sice umožňuje členskému státu učinit výhradu důvěrnosti, avšak žádný členský stát to neučinil. Čili bude-li požadavek na uveřejnění zprávy, Komise se dotáže členského státu, zda tuto výhradu důvěrnosti chce uplatňovat, nepředpokládám, že by se tak stalo, a pak může být zpráva v plném znění uveřejněna a myslím si, že to může být velkým podnětem k další diskuzi. Výroční zprávy jsou analyzovány Komisí, a to znalci Komise a současně jsou doplňovány o poznatky, které získali úředníci Komise z terénu, a tak se vytváří základní podklad pro další konstatování plnění podmínek nařízení a pro další úvahy o rozvoji právního a organizačního systému Evropské unie v této oblasti.Pokud jde o otázku dalšího návrhu na směrnici, na změnu právního systému, již jsem konstatoval, že Komise pracuje na takovýchto návrzích a snaží se uplatnit ty nejaktuálnější vědecké poznatky. Byla formulována otázka, kolik v současnosti probíhá procedur infrakcí, jsou to dvě procedury infrakce, které jsou v současné době v procesu, jsou dvě, tři reklamace, které jsou vázány na Andalusii, čili Španělsko a celkově šest členských států bylo podrobeno inspekci v roce 2008. To jsou tedy konkrétnější údaje k otázkám, které byly položeny. Dámy a pánové, dovolte mi tedy ještě jednou, abych poděkoval za debatu, která byla komplexní, která naprosto jasně ukazovala, že pozice Komise a názory Parlamentu jsou velmi blízké, a to je podle mého názoru dobrým signálem pro další pokrok v této mimořádně citlivé oblasti. ","Vladimír Špidla,",4,595,not_available,"['cze', 'cze', 'cze', 'cze']","['  Vladimír Špidla,  člen Komise. − (CS) Vážený pane předsedo, dámy a pánové, římské právo ve své definici zvířete konstatovalo, že zvíře je věc. Vzpomínám si na jeden vojenský předpis, který pro transport určoval, že jeden vagón může přepravovat 8 koní nebo 48 mužů. To znamená, že v průběhu civilizace se začalo uvažovat o tom, že existuje jistá větší blízkost mezi zvířetem a lidskou bytostí než mezi lidskou bytostí a věcí. Myslím si, že vývojem civilizace jsme dospěli k názoru, že zvíře není věc, že je to existující bytost, která má svá imanentní práva, a tento názor jsme vyjádřili ve svých předpisech. Myslím si, že se dá konstatovat, že evropské předpisy v tomto okamžiku jsou formulovány a jsou nepochybným civilizačním pokrokem. Na druhé straně z debaty jednoznačně vyplynulo, že jsou nedůsledně uplatňovány a že v jejich konstrukci můžeme nalézt důvody pro další zlepšení.', 'Komise souhlasí s těmito obecnými konstatováními a ve své činnosti se také bude snažit zlepšit systém uplatňování kontroly a sledování situace. Stejně tak jsme právě v procesu přípravy nových předpisů, které se snaží vzít v úvahu nejnovější vědecké poznatky z nejrůznějších oborů, protože to, co bylo z této diskuze také naprosto zřejmé, je komplexita tohoto problému. Není to jednoduchá věc, nestačí říct dobře, udělá se jedno nebo dvě opatření a věc bude vyřešena. Myslím si také, že z debaty jasně vyplynulo, že koncept ochrany hospodářských zvířat a zvířat obecně je koncept, který nevychází jenom z čistě praktického hlediska ochrany konzumentů. Že bychom k určitým ochranným věcem přistoupili i tehdy, kdyby to pro konzumenty neznamenalo žádný reálný význam, žádný reálný přínos, protože je to prostě eticky velmi významná věc.', 'Dovolte mi, abych se pokusil odpovědět na některé konkrétní otázky. Byla jich položena celá řada a samozřejmě, že jsme připraveni jednotlivým poslancům odpovědět podrobněji na ty otázky, kterých se nedotknu. Jedna z otázek byla, které země nezaslaly své zprávy, ve své úvodní řeči jsem to sdělil, ale protože to je mimořádně důležitá věc, konstatuji, že to byl Kypr, Litva, Malta, Bulharsko a Lucembursko. Čili Irska se tato otázka netýkala, Irsko splnilo svoji povinnost. V debatě také zazněly otázky o způsobu přístupu k informacím, chci konstatovat, že teoreticky je možné zveřejnit jednotlivé národní zprávy, nařízení sice umožňuje členskému státu učinit výhradu důvěrnosti, avšak žádný členský stát to neučinil. Čili bude-li požadavek na uveřejnění zprávy, Komise se dotáže členského státu, zda tuto výhradu důvěrnosti chce uplatňovat, nepředpokládám, že by se tak stalo, a pak může být zpráva v plném znění uveřejněna a myslím si, že to může být velkým podnětem k další diskuzi. Výroční zprávy jsou analyzovány Komisí, a to znalci Komise a současně jsou doplňovány o poznatky, které získali úředníci Komise z terénu, a tak se vytváří základní podklad pro další konstatování plnění podmínek nařízení a pro další úvahy o rozvoji právního a organizačního systému Evropské unie v této oblasti.', 'Pokud jde o otázku dalšího návrhu na směrnici, na změnu právního systému, již jsem konstatoval, že Komise pracuje na takovýchto návrzích a snaží se uplatnit ty nejaktuálnější vědecké poznatky. Byla formulována otázka, kolik v současnosti probíhá procedur infrakcí, jsou to dvě procedury infrakce, které jsou v současné době v procesu, jsou dvě, tři reklamace, které jsou vázány na Andalusii, čili Španělsko a celkově šest členských států bylo podrobeno inspekci v roce 2008. To jsou tedy konkrétnější údaje k otázkám, které byly položeny. Dámy a pánové, dovolte mi tedy ještě jednou, abych poděkoval za debatu, která byla komplexní, která naprosto jasně ukazovala, že pozice Komise a názory Parlamentu jsou velmi blízké, a to je podle mého názoru dobrým signálem pro další pokrok v této mimořádně citlivé oblasti. ']"
36, 2. Přeprava zvířat (rozprava),  Předsedající.   – Rozprava je ukončena.Písemné prohlášení (článek 142) ,Předsedající.,2,8,not_available,"['cze', 'cze']","['  Předsedající.   – Rozprava je ukončena.', 'Písemné prohlášení (článek 142) ']"
37, 2. Přeprava zvířat (rozprava),"  Neena Gill  (PSE),  písemně. – Pane předsedající, znovu se zdá, že zákony, které zde schvalujeme, nejsou prováděny ve všech členských státech. Nařízení o přepravě zvířat je nyní v účinnosti 2 roky, přesto jsou stále vážně porušována práva zvířat, zejména při přepravě a porážce koní. Ráda bych se zeptala Komise, co podniká pro zajištění, aby se koně poráželi v zemích svého původu a nemuseli podstupovat dlouhé a stresující cesty do zemí spotřeby.Nejvíce mě a lidi, které zastupuji, znepokojuje, že tato zvířata cestují v nehumánních, stísněných, nečistých podmínkách s omezenými zásobami potravy a vody. To je zbytečné. Protože nemůžeme zamezit tomu, aby bylo konzumováno jejich maso, pokud musí být zvířata porážena, musí být porážena v zemích svého původu a do jiných zemí přepravována až poté. Navíc spotřebitelé musí být informováni, pokud maso, které jedí, není místní a pochází z místa stovky mil vzdáleného. Pane předsedající, v zájmu dobrých životních podmínek koní nesmí být naše snahy vynaložené zde v Parlamentu nadále přehlíženy. ","Neena Gill  (PSE),",3,159,not_available,"['cze', 'cze', 'cze']","['  Neena Gill  (PSE),  písemně. – Pane předsedající, znovu se zdá, že zákony, které zde schvalujeme, nejsou prováděny ve všech členských státech. Nařízení o přepravě zvířat je nyní v účinnosti 2 roky, přesto jsou stále vážně porušována práva zvířat, zejména při přepravě a porážce koní. Ráda bych se zeptala Komise, co podniká pro zajištění, aby se koně poráželi v zemích svého původu a nemuseli podstupovat dlouhé a stresující cesty do zemí spotřeby.', 'Nejvíce mě a lidi, které zastupuji, znepokojuje, že tato zvířata cestují v nehumánních, stísněných, nečistých podmínkách s omezenými zásobami potravy a vody. To je zbytečné. Protože nemůžeme zamezit tomu, aby bylo konzumováno jejich maso, pokud musí být zvířata porážena, musí být porážena v zemích svého původu a do jiných zemí přepravována až poté. Navíc spotřebitelé musí být informováni, pokud maso, které jedí, není místní a pochází z místa stovky mil vzdáleného. ', 'Pane předsedající, v zájmu dobrých životních podmínek koní nesmí být naše snahy vynaložené zde v Parlamentu nadále přehlíženy. ']"
38, 3. Středomořská strava (rozprava) ,"  Předsedající.   – Dalším bodem je ústní dotaz Komisi, který pokládá pan Parish jménem Výboru pro zemědělství a rozvoj venkova, o středomořské stravě, způsobu stravování, který mimochodem předsedající tohoto plenárního zasedání poměrně striktně dodržuje, a to s více než přijatelnými výsledky. ",Předsedající.,1,39,not_available,['cze'],"['  Předsedající.   – Dalším bodem je ústní dotaz Komisi, který pokládá pan Parish jménem Výboru pro zemědělství a rozvoj venkova, o středomořské stravě, způsobu stravování, který mimochodem předsedající tohoto plenárního zasedání poměrně striktně dodržuje, a to s více než přijatelnými výsledky. ']"
39, 3. Středomořská strava (rozprava) ,"  Neil Parish,  autor. − Pane předsedající, těší mě, že se řídíte zásadami středomořské stravy, a vidím, že s ní dosahujete úspěchů!Dnes jsem zde jako předseda Výboru pro zemědělství a rozvoj venkova zjistil, že máme velmi rozmanitou řadu témat k rozpravě. V jedné minutě hovoříme o přepravě zvířat – to je velmi důležité téma – a nyní se bavíme o dalším velmi důležitém námětu: středomořská strava.Jedním z úkolů, který mi jako předsedovi Výboru pro zemědělství připadl a s nímž se zvláště snažíme vypořádat, je, že u příležitosti zasedání Rady ministrů pořádaného v Bruselu dne 16. července 2007 zopakovala svou plnou podporu tomu, aby UNESCO nominovalo středomořskou dietu na zapsání jako nemateriální kulturní dědictví lidstva. Tato nominace bude v roce 2009 prozkoumána – vlastně již byla – odpovědným výborem UNESCO. Má Komise v úmyslu určit konkrétní a koordinovanou strategii na podporu této nominace, protože nyní pokračujeme velice rychle?Jak jsem řekl, zastupuji zde Výbor pro zemědělství, ale pravděpodobně zastupuji všechny poslance, když hovořím o stravě, protože jednou ze skvělých věcí na Evropě je její rozmanitost a kultura a částí této rozmanitosti a kultury je samozřejmě naše potrava.Středomořská strava je velmi dobrá. A co je středomořská strava? Jsem si jist, že o tom bychom mohli dnes hovořit velmi dlouho, ale obecně je to strava bohatá na tučné ryby, olivový olej, ovoce a zeleninu. Není pochyb, že je to velmi chutná strava, a podle mé velikosti můžete uhodnout, že jsem jejím velkým příznivcem. Je to také zdravá strava: je bohatým zdrojem nezbytných mastných kyselin a antioxidantů, což je kombinace, která zlepšuje hladiny cholesterolu a chrání zdraví srdce. Nedávné lékařské studie také naznačují, že může pomáhat snižování nebezpečí takových stavů, jako je demence.Když přijedete do středomořských zemí, vidíte, že lidé si tam užívají života, a to nejen ti, kteří tam žijí, ale také mnozí z nás, kteří do středomořských zemí cestujeme, zvláště když zatoužíme po slunci a také velmi dobrém jídle.To je věc, kterou je třeba ve světě, kde se vše jeví jako jednotvárné, brát vážně. Vidíme, jak je mladá generace bombardována řetězci rychlého občerstvení – nebudu je zde dnes všechny jmenovat –, které se šíří po celé Evropské unii. Měli bychom pamatovat, že řetězce rychlého občerstvení tu mají své místo, ale bylo by strašné, kdybychom v budoucnu na cestách Evropou našli pouze rychlá občerstvení. Když cestujete částmi Ameriky – zejména na západním pobřeží –, zdá se, že tam není nic jiného než řetězce rychlého občerstvení, a to je to poslední, co bychom zde v Evropské unii chtěli.Jak jsem řekl, je třeba, abychom středozemní stravu podporovali, což je velmi dobrý plán pro kulturu a rozmanitost. Domnívám se, že v budoucnosti se budeme muset zaměřit i na ostatní druhy stravy z celé Evropské unie, protože dnes vám chci jasně říci, že přestože jsem velkým zastáncem středomořské stravy, nepřicházím sem jako předseda Výboru pro zemědělství jen proto, abych podpořil středomořskou stravu, protože v Evropě existují i jiné druhy stravy, které jsou stejně dobré, ale mají jiné přednosti a skládají se z jiných potravin.Takže toto je začátek mnoha nových věcí, a jak jsem řekl, chci skutečně od Komise vědět, jak v tomto roce hodlá aktivně tuto snahu podporovat, protože se těšíme, až bude středozemní strava oceněna, a také se těšíme na nějaké velmi dobré středomořské potraviny do budoucna. ","Neil Parish,",9,538,not_available,"['cze', 'cze', 'cze', 'cze', 'cze', 'cze', 'cze', 'cze', 'cze']","['  Neil Parish,  autor. − Pane předsedající, těší mě, že se řídíte zásadami středomořské stravy, a vidím, že s ní dosahujete úspěchů!', 'Dnes jsem zde jako předseda Výboru pro zemědělství a rozvoj venkova zjistil, že máme velmi rozmanitou řadu témat k rozpravě. V jedné minutě hovoříme o přepravě zvířat – to je velmi důležité téma – a nyní se bavíme o dalším velmi důležitém námětu: středomořská strava.', 'Jedním z úkolů, který mi jako předsedovi Výboru pro zemědělství připadl a s nímž se zvláště snažíme vypořádat, je, že u příležitosti zasedání Rady ministrů pořádaného v Bruselu dne 16. července 2007 zopakovala svou plnou podporu tomu, aby UNESCO nominovalo středomořskou dietu na zapsání jako nemateriální kulturní dědictví lidstva. Tato nominace bude v roce 2009 prozkoumána – vlastně již byla – odpovědným výborem UNESCO. Má Komise v úmyslu určit konkrétní a koordinovanou strategii na podporu této nominace, protože nyní pokračujeme velice rychle?', 'Jak jsem řekl, zastupuji zde Výbor pro zemědělství, ale pravděpodobně zastupuji všechny poslance, když hovořím o stravě, protože jednou ze skvělých věcí na Evropě je její rozmanitost a kultura a částí této rozmanitosti a kultury je samozřejmě naše potrava.', 'Středomořská strava je velmi dobrá. A co je středomořská strava? Jsem si jist, že o tom bychom mohli dnes hovořit velmi dlouho, ale obecně je to strava bohatá na tučné ryby, olivový olej, ovoce a zeleninu. Není pochyb, že je to velmi chutná strava, a podle mé velikosti můžete uhodnout, že jsem jejím velkým příznivcem. Je to také zdravá strava: je bohatým zdrojem nezbytných mastných kyselin a antioxidantů, což je kombinace, která zlepšuje hladiny cholesterolu a chrání zdraví srdce. Nedávné lékařské studie také naznačují, že může pomáhat snižování nebezpečí takových stavů, jako je demence.', 'Když přijedete do středomořských zemí, vidíte, že lidé si tam užívají života, a to nejen ti, kteří tam žijí, ale také mnozí z nás, kteří do středomořských zemí cestujeme, zvláště když zatoužíme po slunci a také velmi dobrém jídle.', 'To je věc, kterou je třeba ve světě, kde se vše jeví jako jednotvárné, brát vážně. Vidíme, jak je mladá generace bombardována řetězci rychlého občerstvení – nebudu je zde dnes všechny jmenovat –, které se šíří po celé Evropské unii. Měli bychom pamatovat, že řetězce rychlého občerstvení tu mají své místo, ale bylo by strašné, kdybychom v budoucnu na cestách Evropou našli pouze rychlá občerstvení. Když cestujete částmi Ameriky – zejména na západním pobřeží –, zdá se, že tam není nic jiného než řetězce rychlého občerstvení, a to je to poslední, co bychom zde v Evropské unii chtěli.', 'Jak jsem řekl, je třeba, abychom středozemní stravu podporovali, což je velmi dobrý plán pro kulturu a rozmanitost. Domnívám se, že v budoucnosti se budeme muset zaměřit i na ostatní druhy stravy z celé Evropské unie, protože dnes vám chci jasně říci, že přestože jsem velkým zastáncem středomořské stravy, nepřicházím sem jako předseda Výboru pro zemědělství jen proto, abych podpořil středomořskou stravu, protože v Evropě existují i jiné druhy stravy, které jsou stejně dobré, ale mají jiné přednosti a skládají se z jiných potravin.', 'Takže toto je začátek mnoha nových věcí, a jak jsem řekl, chci skutečně od Komise vědět, jak v tomto roce hodlá aktivně tuto snahu podporovat, protože se těšíme, až bude středozemní strava oceněna, a také se těšíme na nějaké velmi dobré středomořské potraviny do budoucna. ']"
40, 3. Středomořská strava (rozprava) ,"  Vladimír Špidla,  člen Komise. − (CS) Vážený pane předsedo, vážené dámy poslankyně, vážení páni poslanci, úvodem bych rád zdůraznil význam zdravé stravy pro prevenci nemocí. Jako poslancům Evropského parlamentu je vám známo, že Bílá kniha „Strategie pro Evropu týkající se zdravotních problémů souvisejících s výživou, nadváhou a obezitou“, kterou přijala Evropská komise dne 30. května 2007, slučuje všechny politiky Společenství, jež mohou přispět ke zlepšení stravovacích návyků a k prevenci obezity. Jedná se zejména o opatření v oblasti veřejného zdraví, stravování, dopravy, regionální politiky, sportu, vzdělávání, statistiky, jakož i zemědělské politiky.Jedním z nejlepších příkladů je iniciativa Komise spočívající v celoevropském programu dodávání ovoce a zeleniny do škol. Cílem tohoto programu je přispět k tomu, abychom našim dětem usnadnili zdravější start do života. Bude zahájen na začátku školního roku 2009/2010 s ročním rozpočtem 90 milionů EUR na nákup a dodávku čerstvého ovoce a zeleniny do škol.Pokud jde o specifickou otázku, která byla vznesena jedním z poslanců Parlamentu, totiž o žádost o zařazení středomořské stravy na seznam světového kulturního dědictví UNESCO, předchůdce paní komisařky Markos Kyprianou vyzvedl toto téma na zasedání Rady ve složení pro zemědělství v červenci 2007. Komise tuto iniciativu vítá, neboť může přispět k podpoře zdravých stravovacích návyků v celé Evropské unii.Evropská komise ovšem nemá formální pravomoc k podpoře takové žádosti v rámci organizace UNESCO, jelikož není jejím členem, a tudíž se nemůže účastnit rozhodovacího procesu. Přesto doufám, že účastnické státy se svou žádostí v UNESCO uspějí a že se jim dostane náležité podpory ostatních členských států Evropské unie. ","Vladimír Špidla,",4,253,not_available,"['cze', 'cze', 'cze', 'cze']","['  Vladimír Špidla,  člen Komise. − (CS) Vážený pane předsedo, vážené dámy poslankyně, vážení páni poslanci, úvodem bych rád zdůraznil význam zdravé stravy pro prevenci nemocí. Jako poslancům Evropského parlamentu je vám známo, že Bílá kniha „Strategie pro Evropu týkající se zdravotních problémů souvisejících s výživou, nadváhou a obezitou“, kterou přijala Evropská komise dne 30. května 2007, slučuje všechny politiky Společenství, jež mohou přispět ke zlepšení stravovacích návyků a k prevenci obezity. Jedná se zejména o opatření v oblasti veřejného zdraví, stravování, dopravy, regionální politiky, sportu, vzdělávání, statistiky, jakož i zemědělské politiky.', 'Jedním z nejlepších příkladů je iniciativa Komise spočívající v celoevropském programu dodávání ovoce a zeleniny do škol. Cílem tohoto programu je přispět k tomu, abychom našim dětem usnadnili zdravější start do života. Bude zahájen na začátku školního roku 2009/2010 s ročním rozpočtem 90 milionů EUR na nákup a dodávku čerstvého ovoce a zeleniny do škol.', 'Pokud jde o specifickou otázku, která byla vznesena jedním z poslanců Parlamentu, totiž o žádost o zařazení středomořské stravy na seznam světového kulturního dědictví UNESCO, předchůdce paní komisařky Markos Kyprianou vyzvedl toto téma na zasedání Rady ve složení pro zemědělství v červenci 2007. Komise tuto iniciativu vítá, neboť může přispět k podpoře zdravých stravovacích návyků v celé Evropské unii.', 'Evropská komise ovšem nemá formální pravomoc k podpoře takové žádosti v rámci organizace UNESCO, jelikož není jejím členem, a tudíž se nemůže účastnit rozhodovacího procesu. Přesto doufám, že účastnické státy se svou žádostí v UNESCO uspějí a že se jim dostane náležité podpory ostatních členských států Evropské unie. ']"
