,agenda_item,text,speaker,number_p,number_w,chair,language_ps,ps
93, 7. Vysvětlení hlasování,"  Luca Romagnoli  (NI),  písemně. – (IT) Pane předsedající, dámy a pánové, hlasoval jsem ve prospěch zprávy paní Mathieuové o rozpočtové kontrole fondů EU v Afghánistánu.Zpráva poskytuje velmi jasné závěry ohledně výsledků dosažených prostřednictvím pomoci Společenství od podepsání dohody do současnosti: přestože mohly být dalekosáhlejší, jsou to výsledky pozitivní a pozoruhodné. Mám na mysli především snížení četnosti dětské úmrtnosti, zlepšení přístupu k základní zdravotní péči a významný nárůst počtu dětí navštěvujících školu. Také se připojuji k paní zpravodajce v názoru, že bychom se měli více snažit o zlepšení koordinace mezi Společenstvím a mezinárodními dárci, abychom zabránili zdvojování a možným zdrojům korupce v zemi. Kromě toho je víc než kdy jindy důležité, aby tam, kde je nabízena finanční pomoc zemi těžce stiženou sociálními a politickými problémy, byl systém účinný; jinak je riziko, že se situace spíše zhorší, než aby se zlepšila. Z toho důvodu doufám, že systém kontroly, zejména ex-ante, bude vylepšen a uplatňován uceleněji, než tomu bylo doposud. ","Luca Romagnoli  (NI),",3,158,not_available,"['ita', 'ita', 'ita']","['  Luca Romagnoli  (NI),  písemně. – (IT) Pane předsedající, dámy a pánové, hlasoval jsem ve prospěch zprávy paní Mathieuové o rozpočtové kontrole fondů EU v Afghánistánu.', 'Zpráva poskytuje velmi jasné závěry ohledně výsledků dosažených prostřednictvím pomoci Společenství od podepsání dohody do současnosti: přestože mohly být dalekosáhlejší, jsou to výsledky pozitivní a pozoruhodné. Mám na mysli především snížení četnosti dětské úmrtnosti, zlepšení přístupu k základní zdravotní péči a významný nárůst počtu dětí navštěvujících školu. Také se připojuji k paní zpravodajce v názoru, že bychom se měli více snažit o zlepšení koordinace mezi Společenstvím a mezinárodními dárci, abychom zabránili zdvojování a možným zdrojům korupce v zemi. ', 'Kromě toho je víc než kdy jindy důležité, aby tam, kde je nabízena finanční pomoc zemi těžce stiženou sociálními a politickými problémy, byl systém účinný; jinak je riziko, že se situace spíše zhorší, než aby se zlepšila. Z toho důvodu doufám, že systém kontroly, zejména ex-ante, bude vylepšen a uplatňován uceleněji, než tomu bylo doposud. ']"
94, 7. Vysvětlení hlasování,"  Robert Atkins  (PPE-DE),  písemně. − Já a mí britští konzervativní kolegové plně podporujeme zásadu rovného zacházení pro muže a ženy ve všech aspektech života, včetně přístupu k zaměstnání, odborné přípravě a pracovnímu postupu a pracovních podmínek.Nicméně se domníváme, že těmto záležitostem se mají věnovat především členské státy, a nikoli Evropská unie. Proto jsme se rozhodli zdržet se hlasování o této zprávě. ","Robert Atkins  (PPE-DE),",2,62,not_available,"['cze', 'cze']","['  Robert Atkins  (PPE-DE),  písemně. − Já a mí britští konzervativní kolegové plně podporujeme zásadu rovného zacházení pro muže a ženy ve všech aspektech života, včetně přístupu k zaměstnání, odborné přípravě a pracovnímu postupu a pracovních podmínek.', 'Nicméně se domníváme, že těmto záležitostem se mají věnovat především členské státy, a nikoli Evropská unie. Proto jsme se rozhodli zdržet se hlasování o této zprávě. ']"
95, 7. Vysvětlení hlasování,"  Gerard Batten, Godfrey Bloom, Derek Roland Clark, Nigel Farage, Michael Henry Nattrass a John Whittaker  (IND/DEM),  písemně. − Strana UKIP plně podporuje rovnost mužů a žen. Nicméně Spojené království již má právní předpisy pro rovnoprávnost a může je měnit, jak a kdy náš parlament a lidé vyžadují. Proto jsou další právní předpisy a byrokracie uvalená ze strany EU zbytečná. Kromě toho EU je nedemokratický a nedostatečně bezpečný strážce práv kohokoli, včetně právě žen. ","Gerard Batten, Godfrey Bloom, Derek Roland Clark, Nigel Farage, Michael Henry Nattrass a John Whittaker  (IND/DEM),",1,73,not_available,['cze'],"['  Gerard Batten, Godfrey Bloom, Derek Roland Clark, Nigel Farage, Michael Henry Nattrass a John Whittaker  (IND/DEM),  písemně. − Strana UKIP plně podporuje rovnost mužů a žen. Nicméně Spojené království již má právní předpisy pro rovnoprávnost a může je měnit, jak a kdy náš parlament a lidé vyžadují. Proto jsou další právní předpisy a byrokracie uvalená ze strany EU zbytečná. Kromě toho EU je nedemokratický a nedostatečně bezpečný strážce práv kohokoli, včetně právě žen. ']"
96, 7. Vysvětlení hlasování,"  Koenraad Dillen  (NI)  , písemně. − (NL) Hlasoval jsem proti této politicky korektní zprávě – již xté v řadě –, která nám byla zde v Parlamentu předložena ke schválení. Předně bych rád zdůraznil, že vzhledem k tomu, že rovnost pohlaví je již mnoho let v EU zavedena, je tato zpráva naprosto zbytečná. Kromě toho mám námitky vůči obrácení důkazního břemene, které tato zpráva schvaluje (odstavec 20) a které se nehodí žádné zemi s právním řádem, zatímco organizacím, které jsou požádány o vypracování této směrnice, je poskytována naprostá všemocnost (odstavec 19).Skutečnost, že členské státy budou nuceny vyžadovat po podnicích, aby vytvářely roční obchodní plány pro rovnost pohlaví a zajišťovaly vyvážené rozdělování obou pohlaví v představenstvu podniků, zcela odporuje svobodě vedení podniku. Pro podniky potýkající se s nesnázemi způsobenými finanční krizí by se další administrativa, kterou by tento požadavek znamenal, mohla ukázat jako ničivá. Na volném trhu zdravých podniků bude vždy, jak jsme již mnohokrát viděli, vítězit kvalita, ať se jedná o muže či ženu. ",Koenraad Dillen  (NI),2,160,not_available,"['dut', 'dut']","['  Koenraad Dillen  (NI)  , písemně. − (NL) Hlasoval jsem proti této politicky korektní zprávě – již xté v řadě –, která nám byla zde v Parlamentu předložena ke schválení. Předně bych rád zdůraznil, že vzhledem k tomu, že rovnost pohlaví je již mnoho let v EU zavedena, je tato zpráva naprosto zbytečná. Kromě toho mám námitky vůči obrácení důkazního břemene, které tato zpráva schvaluje (odstavec 20) a které se nehodí žádné zemi s právním řádem, zatímco organizacím, které jsou požádány o vypracování této směrnice, je poskytována naprostá všemocnost (odstavec 19).', 'Skutečnost, že členské státy budou nuceny vyžadovat po podnicích, aby vytvářely roční obchodní plány pro rovnost pohlaví a zajišťovaly vyvážené rozdělování obou pohlaví v představenstvu podniků, zcela odporuje svobodě vedení podniku. Pro podniky potýkající se s nesnázemi způsobenými finanční krizí by se další administrativa, kterou by tento požadavek znamenal, mohla ukázat jako ničivá. Na volném trhu zdravých podniků bude vždy, jak jsme již mnohokrát viděli, vítězit kvalita, ať se jedná o muže či ženu. ']"
97, 7. Vysvětlení hlasování,"  Constantin Dumitriu  (PPE-DE),  písemně. – (RO) V současné hospodářské krizi patří ženy mezi ty, které nejvíce postihla nezaměstnanost nebo snižování mezd. Na evropské úrovni je třeba, aby členské státy prováděly nařízení směrnice 2002/73/ES a Evropská komise tato opatření monitorovala a pravidelně informovala Evropský parlament.Jak naznačuje také zpráva paní Madurellové, jedním z největších problémů v boji proti diskriminaci pohlaví na trhu práce je také nedostatek informací o právech, která mají oběti diskriminace. Za to nesou odpovědnost společně členské státy, evropské orgány, stejně jako Evropský institut pro rovnost pohlaví a zaměstnavatelé. Důležitou úlohu zde zastávají také organizace občanské společnosti. Ty mohou k vyvážení nedostatečné aktivity na vnitrostátní nebo evropské úrovni používat informační kampaně a zprávy o sledování.Komise je povinna sledovat, zda členské státy přijímají opatření zaměřená na vytvoření rovnováhy mezi prací a soukromým životem, snižování rozdílu ve výši mezd mezi ženami a muži, stejně jako na poskytnutí ženám přístup na manažerské posty. V Rumunsku nám pomohla zavést institucionální systém zaručující, že „práva pro muže znamenají také práva pro ženy“. ","Constantin Dumitriu  (PPE-DE),",3,171,not_available,"['rum', 'rum', 'rum']","['  Constantin Dumitriu  (PPE-DE),  písemně. – (RO) V současné hospodářské krizi patří ženy mezi ty, které nejvíce postihla nezaměstnanost nebo snižování mezd. Na evropské úrovni je třeba, aby členské státy prováděly nařízení směrnice 2002/73/ES a Evropská komise tato opatření monitorovala a pravidelně informovala Evropský parlament.', 'Jak naznačuje také zpráva paní Madurellové, jedním z největších problémů v boji proti diskriminaci pohlaví na trhu práce je také nedostatek informací o právech, která mají oběti diskriminace. Za to nesou odpovědnost společně členské státy, evropské orgány, stejně jako Evropský institut pro rovnost pohlaví a zaměstnavatelé. Důležitou úlohu zde zastávají také organizace občanské společnosti. Ty mohou k vyvážení nedostatečné aktivity na vnitrostátní nebo evropské úrovni používat informační kampaně a zprávy o sledování.', 'Komise je povinna sledovat, zda členské státy přijímají opatření zaměřená na vytvoření rovnováhy mezi prací a soukromým životem, snižování rozdílu ve výši mezd mezi ženami a muži, stejně jako na poskytnutí ženám přístup na manažerské posty. V Rumunsku nám pomohla zavést institucionální systém zaručující, že „práva pro muže znamenají také práva pro ženy“. ']"
98, 7. Vysvětlení hlasování,"  Edite Estrela  (PSE),  písemně. − (PT) Hlasovala jsem ve prospěch zprávy paní Rieraové Madurellové o provedení a uplatňování směrnice 2002/73/ES o provádění zásady rovného zacházení pro muže a ženy, pokud jde o přístup k zaměstnání, odbornému vzdělávání a postupu v zaměstnání a o pracovní podmínky, protože považuji za důležité uplatňování zásady rovného zacházení pro muže a ženy v záležitostech obsažených v této směrnici. Z různých chyb v provádění směrnice bych vyzdvihla skutečnost, že právní předpisy různých členských států se nezmiňují konkrétně o diskriminaci pohlaví. Jak zmiňuje paní zpravodajka, rozdíl ve výši mezd zůstává velký, přičemž ženy dostávají mzdy, které jsou v průměru o 15 % nižší než mzdy mužů. Tento rozdíl se mezi lety 2000 a 2006 snížil, ale jen o 1 %. V souvislosti s Lisabonskou strategií je nezbytné, aby se tento status quo změnil, a proto souhlasím s paní zpravodajkou ohledně toho, že je důležité doporučit Evropské komisi, aby aktivně kontrolovala provádění směrnice a s nimi plnění vnitrostátních právních předpisů. ","Edite Estrela  (PSE),",2,161,not_available,"['por', 'por']","['  Edite Estrela  (PSE),  písemně. − (PT) Hlasovala jsem ve prospěch zprávy paní Rieraové Madurellové o provedení a uplatňování směrnice 2002/73/ES o provádění zásady rovného zacházení pro muže a ženy, pokud jde o přístup k zaměstnání, odbornému vzdělávání a postupu v zaměstnání a o pracovní podmínky, protože považuji za důležité uplatňování zásady rovného zacházení pro muže a ženy v záležitostech obsažených v této směrnici. ', 'Z různých chyb v provádění směrnice bych vyzdvihla skutečnost, že právní předpisy různých členských států se nezmiňují konkrétně o diskriminaci pohlaví. Jak zmiňuje paní zpravodajka, rozdíl ve výši mezd zůstává velký, přičemž ženy dostávají mzdy, které jsou v průměru o 15 % nižší než mzdy mužů. Tento rozdíl se mezi lety 2000 a 2006 snížil, ale jen o 1 %. V souvislosti s Lisabonskou strategií je nezbytné, aby se tento status quo změnil, a proto souhlasím s paní zpravodajkou ohledně toho, že je důležité doporučit Evropské komisi, aby aktivně kontrolovala provádění směrnice a s nimi plnění vnitrostátních právních předpisů. ']"
99, 7. Vysvětlení hlasování,"  Mieczysław Edmund Janowski  (UEN) , písemně. − (PL) Hlasoval jsem ve prospěch zprávy paní Madurellové o rovném zacházení pro muže a ženy, pokud jde o přístup k zaměstnání, odbornému vzdělávání a postupu v zaměstnání. Rovné zacházení, bez ohledu na pohlaví, rasu, vyznání atd. je základním lidským právem. Samozřejmě nemůžeme zapomínat na přirozené biologické rozdíly, které existují mezi muži a ženami.Podle mého názoru automatické plošné uplatňování politiky vyváženosti pohlaví 50/50 není skutečnou známkou toho, že nám jde o rovnost pohlaví. V případech fyzicky náročných zaměstnání, jako je hornictví, práce v ocelárnách atd., vede tento přístup k absurdním situacím, stejně jako v případech zdravotních sester nebo učitelů. Stejně tak nemůžeme nutit děvčata, aby se věnovala studiu technických oborů, jen aby byla zachována vyváženost 50/50. Mezi základní problémy patří přístup ke vzdělání na všech úrovních, naplňování manažerských funkcí (včetně funkcí v politických institucích), provádění zásady „stejná odměna za rovnocennou práci“, dostatečný přístup k sociálnímu zabezpečení a příspěvkům, stejně jako ke zdravotní péči (s přihlédnutím k mateřské dovolené). Důležitou roli by v této oblasti měly hrát odborové organizace. Je to důležitá otázka jak na místní, regionální a vnitrostátní úrovni, tak na úrovni institucí Evropské unie. Rád bych využil této příležitosti a upozornil vás na soudní rozhodnutí, která diskriminují muže tím, že téměř vždy v rozvodových řízeních automaticky svěří ženám opatrovnictví dětí. ",Mieczysław Edmund Janowski  (UEN),3,218,not_available,"['pol', 'pol', 'pol']","['  Mieczysław Edmund Janowski  (UEN) , písemně. − (PL) Hlasoval jsem ve prospěch zprávy paní Madurellové o rovném zacházení pro muže a ženy, pokud jde o přístup k zaměstnání, odbornému vzdělávání a postupu v zaměstnání. Rovné zacházení, bez ohledu na pohlaví, rasu, vyznání atd. je základním lidským právem. Samozřejmě nemůžeme zapomínat na přirozené biologické rozdíly, které existují mezi muži a ženami.', 'Podle mého názoru automatické plošné uplatňování politiky vyváženosti pohlaví 50/50 není skutečnou známkou toho, že nám jde o rovnost pohlaví. V případech fyzicky náročných zaměstnání, jako je hornictví, práce v ocelárnách atd., vede tento přístup k absurdním situacím, stejně jako v případech zdravotních sester nebo učitelů. Stejně tak nemůžeme nutit děvčata, aby se věnovala studiu technických oborů, jen aby byla zachována vyváženost 50/50. Mezi základní problémy patří přístup ke vzdělání na všech úrovních, naplňování manažerských funkcí (včetně funkcí v politických institucích), provádění zásady „stejná odměna za rovnocennou práci“, dostatečný přístup k sociálnímu zabezpečení a příspěvkům, stejně jako ke zdravotní péči (s přihlédnutím k mateřské dovolené). Důležitou roli by v této oblasti měly hrát odborové organizace. Je to důležitá otázka jak na místní, regionální a vnitrostátní úrovni, tak na úrovni institucí Evropské unie. ', 'Rád bych využil této příležitosti a upozornil vás na soudní rozhodnutí, která diskriminují muže tím, že téměř vždy v rozvodových řízeních automaticky svěří ženám opatrovnictví dětí. ']"
100, 7. Vysvětlení hlasování,"  Jörg Leichtfried  (PSE),  písemně. − (DE) Hlasoval jsem ve prospěch zprávy paní Rieraové Madurellové o provedení směrnice o rovném zacházení.Podle mého názoru je nejvyšší čas, aby se ženám dostalo rovnocenného zacházení jako mužům, a to ve všech ohledech, nejen v některých.Nelze říci – ani zdaleka –, že existují rovné příležitosti v přístupu ke kariéře nebo dennímu pracovnímu životu. Co se týče rozdílů v příjmech mezi pohlavími, v některých členských státech se velmi váhavě zmenšují, zatímco v jiných se dokonce znovu zvětšují.Provádění této směrnice je pro mě obzvláště důležité kvůli těmto zjevným křivdám a zejména proto, že jako rodinný typ člověka si žen velmi cením a vážím. ","Jörg Leichtfried  (PSE),",4,106,not_available,"['ger', 'ger', 'ger', 'ger']","['  Jörg Leichtfried  (PSE),  písemně. − (DE) Hlasoval jsem ve prospěch zprávy paní Rieraové Madurellové o provedení směrnice o rovném zacházení.', 'Podle mého názoru je nejvyšší čas, aby se ženám dostalo rovnocenného zacházení jako mužům, a to ve všech ohledech, nejen v některých.', 'Nelze říci – ani zdaleka –, že existují rovné příležitosti v přístupu ke kariéře nebo dennímu pracovnímu životu. Co se týče rozdílů v příjmech mezi pohlavími, v některých členských státech se velmi váhavě zmenšují, zatímco v jiných se dokonce znovu zvětšují.', 'Provádění této směrnice je pro mě obzvláště důležité kvůli těmto zjevným křivdám a zejména proto, že jako rodinný typ člověka si žen velmi cením a vážím. ']"
101, 7. Vysvětlení hlasování,"  Astrid Lulling  (PPE-DE),  písemně. – (FR) Výbor pro práva žen a rovnost pohlaví je znepokojen ohledně vymáhání směrnice o provádění zásady rovného zacházení pro muže a ženy, pokud jde o přístup k zaměstnání, odbornému vzdělávání a postupu v zaměstnání a o pracovní podmínky.Vzhledem k tomu, že neexistuje zpráva Evropské komise, náš výbor provedl vlastní průzkum mezi vnitrostátními parlamenty a organizacemi pro rovnoprávnost. Rozeslali jsme výzvu dopisem 22 členským státům. V 15 členských státech byly některé definice provedeny nesprávně. Do 5. října 2008 mělo Komisi uvědomit o opatřeních přijatých pro provedení směrnice.Naše zpráva z vlastní iniciativy je výstražným zvoněním a varováním pro členské státy. Ve výboru bohužel zazněla přehnaná prohlášení a tvrzení. Proto jsem předložila alternativní usnesení.Dokázali jsme se shodnout na společném usnesení, pro které jsem hlasovala, přičemž očekávám zprávu o provádění, kterou obdržíme v první polovině roku 2009. To umožní, aby byla provedena podrobná analýza, takže mohou být určena následná opatření nezbytná pro zajištění souladu se Smlouvou a právními předpisy v oblasti rovného zacházení a příležitostí pro muže a ženy. ","Astrid Lulling  (PPE-DE),",4,173,not_available,"['fra', 'fra', 'fra', 'fra']","['  Astrid Lulling  (PPE-DE),  písemně. – (FR) Výbor pro práva žen a rovnost pohlaví je znepokojen ohledně vymáhání směrnice o provádění zásady rovného zacházení pro muže a ženy, pokud jde o přístup k zaměstnání, odbornému vzdělávání a postupu v zaměstnání a o pracovní podmínky.', 'Vzhledem k tomu, že neexistuje zpráva Evropské komise, náš výbor provedl vlastní průzkum mezi vnitrostátními parlamenty a organizacemi pro rovnoprávnost. Rozeslali jsme výzvu dopisem 22 členským státům. V 15 členských státech byly některé definice provedeny nesprávně. Do 5. října 2008 mělo Komisi uvědomit o opatřeních přijatých pro provedení směrnice.', 'Naše zpráva z vlastní iniciativy je výstražným zvoněním a varováním pro členské státy. Ve výboru bohužel zazněla přehnaná prohlášení a tvrzení. Proto jsem předložila alternativní usnesení.', 'Dokázali jsme se shodnout na společném usnesení, pro které jsem hlasovala, přičemž očekávám zprávu o provádění, kterou obdržíme v první polovině roku 2009. To umožní, aby byla provedena podrobná analýza, takže mohou být určena následná opatření nezbytná pro zajištění souladu se Smlouvou a právními předpisy v oblasti rovného zacházení a příležitostí pro muže a ženy. ']"
102, 7. Vysvětlení hlasování,"  Nils Lundgren  (IND/DEM),  písemně. − (SV) Diskriminace a obtěžování nemají ve svobodné společnosti místo. Tato zpráva nám připomíná děsivou skutečnost, že mnohé členské státy mají před sebou stále dlouhou cestu, než učiní muže a ženy rovnocennými v životě a zaměstnání. Nicméně odpovědnost například za boj proti křivdám na trhu práce nespočívá na orgánech EU, ale je, a měla by zůstat, záležitostí odpovědných občanů a jejich politických a odborových zástupců v členských státech. Naprosto nesouhlasím s texty, které se snaží používat tyto křivdy jako argumenty pro supranacionalismus na úkor sebeurčení členských států. Zvyšování odstupu mezi těmi, kteří vládnou, a těmi, komu vládnou, není cesta ke svobodné společnosti založené na zásadě rovnosti všech lidí.Hlavním cílem zprávy ovšem je ukázat, jak diskriminace a obtěžování mohou zničit příležitosti lidí v životě a vyhlídky na pevnější postavení. To je natolik důležité, že jsem se navzdory všem výhradám rozhodl hlasovat ve prospěch alternativního návrhu usnesení. ","Nils Lundgren  (IND/DEM),",2,150,not_available,"['cze', 'cze']","['  Nils Lundgren  (IND/DEM),  písemně. − (SV) Diskriminace a obtěžování nemají ve svobodné společnosti místo. Tato zpráva nám připomíná děsivou skutečnost, že mnohé členské státy mají před sebou stále dlouhou cestu, než učiní muže a ženy rovnocennými v životě a zaměstnání. Nicméně odpovědnost například za boj proti křivdám na trhu práce nespočívá na orgánech EU, ale je, a měla by zůstat, záležitostí odpovědných občanů a jejich politických a odborových zástupců v členských státech. Naprosto nesouhlasím s texty, které se snaží používat tyto křivdy jako argumenty pro supranacionalismus na úkor sebeurčení členských států. Zvyšování odstupu mezi těmi, kteří vládnou, a těmi, komu vládnou, není cesta ke svobodné společnosti založené na zásadě rovnosti všech lidí.', 'Hlavním cílem zprávy ovšem je ukázat, jak diskriminace a obtěžování mohou zničit příležitosti lidí v životě a vyhlídky na pevnější postavení. To je natolik důležité, že jsem se navzdory všem výhradám rozhodl hlasovat ve prospěch alternativního návrhu usnesení. ']"
103, 7. Vysvětlení hlasování,"  Iosif Matula  (PPE-DE),  písemně. – (RO) Hlasoval jsem ve prospěch zprávy o provádění zásady rovného zacházení pro muže a ženy, pokud jde o přístup k zaměstnání, odbornému vzdělávání a postupu v zaměstnání a o pracovní podmínky.Přestože rovnost pohlaví je v Evropské unii základním právem, oficiální statistiky ukazují, že stále existují rozdíly z hlediska zaměstnanosti, zejména v zemích, které přistoupily k Evropské unii v nedávné době.Vzhledem k tomu, že rovné zacházení pro ženy a muže je stále zásadním problémem, zasedání Evropské rady v Lisabonu v březnu 2000 určilo pro Evropskou unii cíl zvýšit do roku 2010 zaměstnanost žen na více než 60 %, což je třeba v nových členských státech bedlivě sledovat.Domnívám se, že v době, kdy je třeba snažit se o změnu postoje k tomuto problému, je nezbytné, abychom prováděli evropskou směrnici a zajistili odstranění diskriminace žen na pracovním trhu. ","Iosif Matula  (PPE-DE),",4,142,not_available,"['rum', 'rum', 'rum', 'rum']","['  Iosif Matula  (PPE-DE),  písemně. – (RO) Hlasoval jsem ve prospěch zprávy o provádění zásady rovného zacházení pro muže a ženy, pokud jde o přístup k zaměstnání, odbornému vzdělávání a postupu v zaměstnání a o pracovní podmínky.', 'Přestože rovnost pohlaví je v Evropské unii základním právem, oficiální statistiky ukazují, že stále existují rozdíly z hlediska zaměstnanosti, zejména v zemích, které přistoupily k Evropské unii v nedávné době.', 'Vzhledem k tomu, že rovné zacházení pro ženy a muže je stále zásadním problémem, zasedání Evropské rady v Lisabonu v březnu 2000 určilo pro Evropskou unii cíl zvýšit do roku 2010 zaměstnanost žen na více než 60 %, což je třeba v nových členských státech bedlivě sledovat.', 'Domnívám se, že v době, kdy je třeba snažit se o změnu postoje k tomuto problému, je nezbytné, abychom prováděli evropskou směrnici a zajistili odstranění diskriminace žen na pracovním trhu. ']"
