,agenda_item,text,speaker,number_p,number_w,chair,language_ps,ps
0, 1. Sēdes atklāšana,SĒDI VADA: M. SIWIEC Priekšsēdētāja vietnieks,SĒDI VADA: M. SIWIEC,1,6,not_available,['lav'],['SĒDI VADA: M. SIWIEC Priekšsēdētāja vietnieks']
1, 4. Tiesību aktu pakete sociālajā jomā (otrā daļa: pārrobežu veselības aprūpe) (debates) ,  Priekšsēdētājs. −   Darba kārtības nākamais punkts ir Padomes un Komisijas paziņojumi: Tiesību aktu pakete sociālajā jomā (otrā daļa: pārrobežu veselības aprūpe). ,Priekšsēdētājs. −,1,20,not_available,['lav'],['  Priekšsēdētājs. −   Darba kārtības nākamais punkts ir Padomes un Komisijas paziņojumi: Tiesību aktu pakete sociālajā jomā (otrā daļa: pārrobežu veselības aprūpe). ']
2, 4. Tiesību aktu pakete sociālajā jomā (otrā daļa: pārrobežu veselības aprūpe) (debates) ,"  Roselyne Bachelot-Narquin,  Padomes priekšsēdētāja. − (FR) Priekšsēdētāja kungs, komisāre Vassiliou kundze, Bowis kungs, „ēnu” referenti, atzinumu sagatavotāji, dāmas un kungi! Pateicos Eiropas Parlamentam par piekrišanu pārcelt mūsu darba sanāksmi, ko sākotnēji bija paredzēts rīkot šā mēneša sākumā!Kā jūs zināt, Francijas prezidentūra piešķir lielu nozīmi tiesību aktu apspriešanai un dialogam. Man šķiet, ka bija svarīgi vispirms apspriesties ar kolēģiem ministriem neoficiālajā sanāksmē, kas 8. un 9. septembrī notika Anžērā, un tikai tad stāties jūsu priekšā, lai izklāstītu, bez šaubām, ne jau Francijas, bet Veselības aizsardzības 27 ministru padomes viedokli.Pirmā viedokļu apmaiņa un tāpat arī sākotnējais darbs, ko veikusi Padomes Veselības darba grupa, nedos man iespēju atbildēt uz visiem jūsu jautājumiem par šo ārkārtīgi sarežģīto un daudzpusīgo tematu, taču esmu pārliecināta, ka mūsu šodienas sēde sniegs veselības komisārei izdevību paskaidrot Eiropas Komisijas galvenos lēmumus un ļaus man pastāstīt jums par Padomes pirmajiem iespaidiem.Padome atbalsta direktīvas pieņemšanu par pārrobežu veselības aprūpi un pacientu tiesībām. Būtu kaut kas neiedomājams, ja lēmumus šajā jomā atstātu tikai Eiropas Kopienu Tiesas kompetencē. Manuprāt, — un tā domā arī mani kolēģi — tas nav jāuztver kā uzbrukums Tiesai vai pat tās spriedumiem, kas nereti nosaka lielas priekšrocības pacientiem. Tomēr būtu vēlams, lai Eiropas veselības aizsardzības politiku izstrādātu divi likumdevēji — jūs un mēs — kā politiskā dialoga un demokrātiskā procesa rezultātu. Mūsu kopīgajam mērķim ir jābūt tāda tiesiskā regulējuma izveidei, kas veicina tiesisko noteiktību. Otrais punkts: Anžērā visu divdesmit septiņu valstu delegācijas slavēja iepriekšējos mēnešos veikto darbu un piekrita tam, ka nesenajās apspriešanās viņu viedoklis ir uzklausīts. Neoficiālajā Padomes sanāksmē komisāre Vassiliou kundze saņēma sirsnīgu pateicību. Tiešām, Slovēnijas prezidentūra, bez šaubām, jūs ir informējusi, ka Komisija ļoti šaubījās par teksta sākotnējo variantu, ar kura vispārējām nostādnēm Nodarbinātības, sociālās politikas, veselības un patērētāju tiesību aizsardzības (EPSCO) padome tika iepazīstināta 2007. gada 19. decembrī. Šo variantu atbalstīja tikai dažas valstis. Patiesībā tikpat liela opozīcija bija arī jūsu Parlamentā, kā man stāstīja EP deputāti sagatavošanas apspriedēs ar Francijas prezidentūru Strasbūrā, Briselē un Parīzē. Nav šaubu par to, ka politiskais dialogs, kuru komisāre Vassiliou kundze uzsāka uzreiz pēc stāšanās amatā, palīdzēja izveidot stingru pamatu sarunām, un Padome to atzinīgi novērtē.Trešais punkts: runājot par grafiku, šis priekšlikums, kuru Komisāru kolēģija apstiprināja 2. jūlijā, bija novēlots, lai varētu paredzēt pirmo lasījumu mūsu prezidentūras laikā, bet mēs cik vien iespējams steidzināsim sarunas Padomē, iesaistoties politiskā dialogā ar Eiropas Parlamentu. Šādā veidā Sabiedrības veselības darba grupa jau vairākas reizes ir izskatījusi šo direktīvu. Tā atkal sanāks kopā rīt, lai turpinātu teksta apspriešanu pantu pa pantam. Šajā jomā tāpat kā citās mūsu politiskajās prioritātēs Francija spēlēs savu partiju prezidentūru trio, cieši sadarbojoties ar Čehiju un Zviedriju. Starp citu, atļaujiet atgādināt, ka mūsu kopīgās 18 mēnešu programmas prioritāte bija jautājums par Eiropas veselības aizsardzību pacientu labā.Ceturtais punkts: attiecībā uz direktīvas projekta darbības jomu sarunās ar EP deputātiem no Iekšējā tirgus un patērētāju aizsardzības komitejas, kad viņi apmeklēja Parīzi pagājušā gada maijā, es uzzināju, ka daudzi no jums pauž nožēlu par lēmumu attiecināt šo tekstu tikai uz pacientu mobilitāti un nepieskarties jautājumam par veselības aprūpes nozares darbinieku mobilitāti. Tā kā es pati biju EP deputāte, kad notika balsojums par Evelyne Gebhardt ziņojumu, un aizgāju no Parlamenta tikai dažas dienas pirms debatēm par Bernadette Vergnaud ziņojumu, es lieliski saprotu šīs nožēlas cēloņus. Veselības pakalpojumu izslēgšana no direktīvas par pakalpojumiem iekšējā tirgū rada pelēko zonu, ko nepietiekami aptver pašreizējais direktīvas priekšlikums, kas attiecas tikai uz pacientu mobilitāti. Varētu pat teikt, ka direktīvas priekšlikums ir vairāk saistīts ar vēlmi iekļaut un pieņemt Tiesas praksi nekā ar veselības pakalpojumu izslēgšanu no Pakalpojumu direktīvas un tādējādi ar dažu EP deputātu prasību pēc īpaša nozaru tiesību akta, kas attiecas uz veselības pakalpojumiem. Veselības aizsardzības ministri šo jautājumu neapsprieda. Turklāt šeit viss ir saistīts ar jautājumu par grafikiem, un Eiropas Komisijas lēmumu var izskaidrot ar nepieciešamību iespējami ātri reaģēt uz problēmām pacientu mobilitātē, kas jau ir aptvērusi ļoti plašu jomu. Skaidrs, ka nebūtu nekādu izredžu pieņemt plašāku direktīvu, kurā būtu iekļauta aprūpes nozares darbinieku mobilitāte, pirms vēlēšanām nākamā gada jūnijā.Piektais punkts: attiecībā uz teksta saturu — mēs vēl neesam izskatījuši visus ierosinātos noteikumus. Tomēr šajā posmā prezidentūra var teikt, ka dalībvalstīm galvenais jautājums ir Padomes viedoklis pirms stacionārās aprūpes atļaušanas. To pat var nosaukt par veselības aizsardzības ministru galveno darbu. Par šo jautājumu rīkotajās darba pusdienās, kas notika 9. septembrī Anžērā, ministri, kuri runāja, izteicās par virzību uz labāku līdzsvaru starp pacientu individuālajām tiesībām uz mobilitāti un dalībvalstu regulatīvās un plānošanas kompetences saglabāšanu, kas nāktu par labu visiem.Tekstā šis uzlabotais līdzsvars it īpaši izpaužas, atkal nosakot, ka pirms stacionārās aprūpes saņemšanas ir vajadzīga atļauja. Šeit netiek apšaubīta Tiesas prakse, kas ir noteikusi, kā Līgumā izklāstītos pārvietošanās brīvības principus piemēro veselības aizsardzības jomā, bet gan noteikta nepieciešamība iekļaut pozitīvos tiesību aktos Tiesas praksē jau izveidoto līdzsvaru starp pārvietošanās brīvību un dalībvalstu regulatīvo kompetenci. Patiesībā tā nosaka atšķirību starp nestacionāro aprūpi, kurā piederības sistēma nevar pieprasīt iepriekšēju atļauju, un stacionāro aprūpi, kurā iepriekšējas atļaujas pieprasīšana šķiet vajadzīgs un pamatots pasākums.Nopietnu budžeta ierobežojumu — attiecībā uz novecošanos, tehnisko progresu — laikā dalībvalstīm ir jāspēj pilnā mērā vadīt attiecīgi sniegto aprūpi, it sevišķi slimnīcu plānošanā. Kā atzina pati Tiesa, viens no šīs plānošanas mērķiem ir nodrošināt pietiekamu un nepārtrauktu piekļuvi līdzsvarotam augstas kvalitātes stacionārās aprūpes diapazonam. Tā ir arī daļa no centieniem kontrolēt izmaksas un, kur tas iespējams, novērst jebkādu cilvēku, finanšu vai tehnisko resursu izšķērdēšanu.Es gribu norādīt arī to, ka prasība pēc iepriekšējas atļaujas nodrošina iespēju sniegt pārrobežu aprūpi, tiklīdz tā ir medicīniski pamatota. Patiesībā tas jau ir atzīts regulā par sociālas nodrošināšanas sistēmu koordināciju: atļauju nedrīkst atteikt, ja saprātīgā laikā nav pieejama tāda pati aprūpe. Turklāt mēs nedrīkstam aizmirst to, ka iepriekšēja atļauja ir arī pacientu aizsardzības pasākums, kas nodrošina visas citā dalībvalstī sniegtās aprūpes atlīdzināšanu.Visbeidzot, pat ja mēs saglabājam to, ko uzskatām par Tiesas prakses pareizu interpretāciju, direktīva joprojām dos lielu pievienoto vērtību, noskaidrojot pacientu tiesības, sniedzot viņiem vajadzīgo informāciju un nodrošinot šīs tiesu prakses vienotu interpretāciju un tādējādi vispārēju un konsekventu piemērošanu visās Eiropas Savienības dalībvalstīs.Paldies par uzmanību! Debašu nobeigumā es runāšu vēlreiz, lai atbildētu uz jūsu jautājumiem. ","Roselyne Bachelot-Narquin,",13,996,not_available,"['fra', 'fra', 'fra', 'fra', 'fra', 'fra', 'fra', 'fra', 'fra', 'fra', 'fra', 'fra', 'fra']","['  Roselyne Bachelot-Narquin,  Padomes priekšsēdētāja. − (FR) Priekšsēdētāja kungs, komisāre Vassiliou kundze, Bowis kungs, „ēnu” referenti, atzinumu sagatavotāji, dāmas un kungi! Pateicos Eiropas Parlamentam par piekrišanu pārcelt mūsu darba sanāksmi, ko sākotnēji bija paredzēts rīkot šā mēneša sākumā!', 'Kā jūs zināt, Francijas prezidentūra piešķir lielu nozīmi tiesību aktu apspriešanai un dialogam. Man šķiet, ka bija svarīgi vispirms apspriesties ar kolēģiem ministriem neoficiālajā sanāksmē, kas 8. un 9. septembrī notika Anžērā, un tikai tad stāties jūsu priekšā, lai izklāstītu, bez šaubām, ne jau Francijas, bet Veselības aizsardzības 27 ministru padomes viedokli.', 'Pirmā viedokļu apmaiņa un tāpat arī sākotnējais darbs, ko veikusi Padomes Veselības darba grupa, nedos man iespēju atbildēt uz visiem jūsu jautājumiem par šo ārkārtīgi sarežģīto un daudzpusīgo tematu, taču esmu pārliecināta, ka mūsu šodienas sēde sniegs veselības komisārei izdevību paskaidrot Eiropas Komisijas galvenos lēmumus un ļaus man pastāstīt jums par Padomes pirmajiem iespaidiem.', 'Padome atbalsta direktīvas pieņemšanu par pārrobežu veselības aprūpi un pacientu tiesībām. Būtu kaut kas neiedomājams, ja lēmumus šajā jomā atstātu tikai Eiropas Kopienu Tiesas kompetencē. Manuprāt, — un tā domā arī mani kolēģi — tas nav jāuztver kā uzbrukums Tiesai vai pat tās spriedumiem, kas nereti nosaka lielas priekšrocības pacientiem. Tomēr būtu vēlams, lai Eiropas veselības aizsardzības politiku izstrādātu divi likumdevēji — jūs un mēs — kā politiskā dialoga un demokrātiskā procesa rezultātu. Mūsu kopīgajam mērķim ir jābūt tāda tiesiskā regulējuma izveidei, kas veicina tiesisko noteiktību. ', 'Otrais punkts: Anžērā visu divdesmit septiņu valstu delegācijas slavēja iepriekšējos mēnešos veikto darbu un piekrita tam, ka nesenajās apspriešanās viņu viedoklis ir uzklausīts. Neoficiālajā Padomes sanāksmē komisāre Vassiliou kundze saņēma sirsnīgu pateicību. Tiešām, Slovēnijas prezidentūra, bez šaubām, jūs ir informējusi, ka Komisija ļoti šaubījās par teksta sākotnējo variantu, ar kura vispārējām nostādnēm Nodarbinātības, sociālās politikas, veselības un patērētāju tiesību aizsardzības (EPSCO) padome tika iepazīstināta 2007. gada 19. decembrī. Šo variantu atbalstīja tikai dažas valstis. Patiesībā tikpat liela opozīcija bija arī jūsu Parlamentā, kā man stāstīja EP deputāti sagatavošanas apspriedēs ar Francijas prezidentūru Strasbūrā, Briselē un Parīzē. Nav šaubu par to, ka politiskais dialogs, kuru komisāre Vassiliou kundze uzsāka uzreiz pēc stāšanās amatā, palīdzēja izveidot stingru pamatu sarunām, un Padome to atzinīgi novērtē.', 'Trešais punkts: runājot par grafiku, šis priekšlikums, kuru Komisāru kolēģija apstiprināja 2. jūlijā, bija novēlots, lai varētu paredzēt pirmo lasījumu mūsu prezidentūras laikā, bet mēs cik vien iespējams steidzināsim sarunas Padomē, iesaistoties politiskā dialogā ar Eiropas Parlamentu. Šādā veidā Sabiedrības veselības darba grupa jau vairākas reizes ir izskatījusi šo direktīvu. Tā atkal sanāks kopā rīt, lai turpinātu teksta apspriešanu pantu pa pantam. Šajā jomā tāpat kā citās mūsu politiskajās prioritātēs Francija spēlēs savu partiju prezidentūru trio, cieši sadarbojoties ar Čehiju un Zviedriju. Starp citu, atļaujiet atgādināt, ka mūsu kopīgās 18 mēnešu programmas prioritāte bija jautājums par Eiropas veselības aizsardzību pacientu labā.', 'Ceturtais punkts: attiecībā uz direktīvas projekta darbības jomu sarunās ar EP deputātiem no Iekšējā tirgus un patērētāju aizsardzības komitejas, kad viņi apmeklēja Parīzi pagājušā gada maijā, es uzzināju, ka daudzi no jums pauž nožēlu par lēmumu attiecināt šo tekstu tikai uz pacientu mobilitāti un nepieskarties jautājumam par veselības aprūpes nozares darbinieku mobilitāti. Tā kā es pati biju EP deputāte, kad notika balsojums par Evelyne Gebhardt ziņojumu, un aizgāju no Parlamenta tikai dažas dienas pirms debatēm par Bernadette Vergnaud ziņojumu, es lieliski saprotu šīs nožēlas cēloņus. Veselības pakalpojumu izslēgšana no direktīvas par pakalpojumiem iekšējā tirgū rada pelēko zonu, ko nepietiekami aptver pašreizējais direktīvas priekšlikums, kas attiecas tikai uz pacientu mobilitāti. Varētu pat teikt, ka direktīvas priekšlikums ir vairāk saistīts ar vēlmi iekļaut un pieņemt Tiesas praksi nekā ar veselības pakalpojumu izslēgšanu no Pakalpojumu direktīvas un tādējādi ar dažu EP deputātu prasību pēc īpaša nozaru tiesību akta, kas attiecas uz veselības pakalpojumiem. Veselības aizsardzības ministri šo jautājumu neapsprieda. Turklāt šeit viss ir saistīts ar jautājumu par grafikiem, un Eiropas Komisijas lēmumu var izskaidrot ar nepieciešamību iespējami ātri reaģēt uz problēmām pacientu mobilitātē, kas jau ir aptvērusi ļoti plašu jomu. Skaidrs, ka nebūtu nekādu izredžu pieņemt plašāku direktīvu, kurā būtu iekļauta aprūpes nozares darbinieku mobilitāte, pirms vēlēšanām nākamā gada jūnijā.', 'Piektais punkts: attiecībā uz teksta saturu — mēs vēl neesam izskatījuši visus ierosinātos noteikumus. Tomēr šajā posmā prezidentūra var teikt, ka dalībvalstīm galvenais jautājums ir Padomes viedoklis pirms stacionārās aprūpes atļaušanas. To pat var nosaukt par veselības aizsardzības ministru galveno darbu. Par šo jautājumu rīkotajās darba pusdienās, kas notika 9. septembrī Anžērā, ministri, kuri runāja, izteicās par virzību uz labāku līdzsvaru starp pacientu individuālajām tiesībām uz mobilitāti un dalībvalstu regulatīvās un plānošanas kompetences saglabāšanu, kas nāktu par labu visiem.', 'Tekstā šis uzlabotais līdzsvars it īpaši izpaužas, atkal nosakot, ka pirms stacionārās aprūpes saņemšanas ir vajadzīga atļauja. Šeit netiek apšaubīta Tiesas prakse, kas ir noteikusi, kā Līgumā izklāstītos pārvietošanās brīvības principus piemēro veselības aizsardzības jomā, bet gan noteikta nepieciešamība iekļaut pozitīvos tiesību aktos Tiesas praksē jau izveidoto līdzsvaru starp pārvietošanās brīvību un dalībvalstu regulatīvo kompetenci. Patiesībā tā nosaka atšķirību starp nestacionāro aprūpi, kurā piederības sistēma nevar pieprasīt iepriekšēju atļauju, un stacionāro aprūpi, kurā iepriekšējas atļaujas pieprasīšana šķiet vajadzīgs un pamatots pasākums.', 'Nopietnu budžeta ierobežojumu — attiecībā uz novecošanos, tehnisko progresu — laikā dalībvalstīm ir jāspēj pilnā mērā vadīt attiecīgi sniegto aprūpi, it sevišķi slimnīcu plānošanā. Kā atzina pati Tiesa, viens no šīs plānošanas mērķiem ir nodrošināt pietiekamu un nepārtrauktu piekļuvi līdzsvarotam augstas kvalitātes stacionārās aprūpes diapazonam. Tā ir arī daļa no centieniem kontrolēt izmaksas un, kur tas iespējams, novērst jebkādu cilvēku, finanšu vai tehnisko resursu izšķērdēšanu.', 'Es gribu norādīt arī to, ka prasība pēc iepriekšējas atļaujas nodrošina iespēju sniegt pārrobežu aprūpi, tiklīdz tā ir medicīniski pamatota. Patiesībā tas jau ir atzīts regulā par sociālas nodrošināšanas sistēmu koordināciju: atļauju nedrīkst atteikt, ja saprātīgā laikā nav pieejama tāda pati aprūpe. Turklāt mēs nedrīkstam aizmirst to, ka iepriekšēja atļauja ir arī pacientu aizsardzības pasākums, kas nodrošina visas citā dalībvalstī sniegtās aprūpes atlīdzināšanu.', 'Visbeidzot, pat ja mēs saglabājam to, ko uzskatām par Tiesas prakses pareizu interpretāciju, direktīva joprojām dos lielu pievienoto vērtību, noskaidrojot pacientu tiesības, sniedzot viņiem vajadzīgo informāciju un nodrošinot šīs tiesu prakses vienotu interpretāciju un tādējādi vispārēju un konsekventu piemērošanu visās Eiropas Savienības dalībvalstīs.', 'Paldies par uzmanību! Debašu nobeigumā es runāšu vēlreiz, lai atbildētu uz jūsu jautājumiem. ']"
