,agenda_item,text,speaker,number_p,number_w,chair,language_ps,ps
142, 8. Balsojumu skaidrojumi,"  Duarte Freitas  (PPE-DE),  rakstiski. − (PT) Ar lieko svaru un aptaukošanos saistītās slimības ir nopietna veselības problēma, un tas nozīmē, ka cīņai pret aptaukošanos ir jābūt prioritātei jau kopš agrīna dzīves posma.Foglietta kunga ziņojums ir ļoti pamatots aicinājums dalībvalstīm, vietējām struktūrām, kā arī par skolām atbildīgajām iestādēm uzraudzīt un uzlabot uzturvielu standartus maltītēm skolās.Es uzskatu, ka uz pārtikas iepakojuma vienmēr ir jāsniedz informācija par uzturvērtību, jo īpaši jāizceļ mākslīgās transtaukskābes, jo tām ir daudz negatīvāka ietekme uz veselību. Nespēja atšķirt mākslīgās transtaukskābes no dabiskajiem taukiem maldinās patērētājus un radīs tikai negatīvu iespaidu par atsevišķiem dzīvnieku izcelsmes pārtikas produktiem, kas satur dabīgos taukus, piemēram, gaļas un piena produktiem.Es arī balsoju par tādu Eiropas rādītāju izstrādāšanu kas attiecas uz vidukļa apkārtmēru un citiem ar aptaukošanos saistītiem riska faktoriem, jo es uzskatu, ka tie nākotnē var būt noderīgi, lai novērtētu riskus, ar kuriem saskaras iedzīvotāji, un īstenoto pasākumu panākumus. ","Duarte Freitas  (PPE-DE),",4,149,not_available,"['por', 'por', 'por', 'por']","['  Duarte Freitas  (PPE-DE),  rakstiski. − (PT) Ar lieko svaru un aptaukošanos saistītās slimības ir nopietna veselības problēma, un tas nozīmē, ka cīņai pret aptaukošanos ir jābūt prioritātei jau kopš agrīna dzīves posma.', 'Foglietta kunga ziņojums ir ļoti pamatots aicinājums dalībvalstīm, vietējām struktūrām, kā arī par skolām atbildīgajām iestādēm uzraudzīt un uzlabot uzturvielu standartus maltītēm skolās.', 'Es uzskatu, ka uz pārtikas iepakojuma vienmēr ir jāsniedz informācija par uzturvērtību, jo īpaši jāizceļ mākslīgās transtaukskābes, jo tām ir daudz negatīvāka ietekme uz veselību. Nespēja atšķirt mākslīgās transtaukskābes no dabiskajiem taukiem maldinās patērētājus un radīs tikai negatīvu iespaidu par atsevišķiem dzīvnieku izcelsmes pārtikas produktiem, kas satur dabīgos taukus, piemēram, gaļas un piena produktiem.', 'Es arī balsoju par tādu Eiropas rādītāju izstrādāšanu kas attiecas uz vidukļa apkārtmēru un citiem ar aptaukošanos saistītiem riska faktoriem, jo es uzskatu, ka tie nākotnē var būt noderīgi, lai novērtētu riskus, ar kuriem saskaras iedzīvotāji, un īstenoto pasākumu panākumus. ']"
143, 8. Balsojumu skaidrojumi,"  Marian Harkin  (ALDE),  rakstiski  − Es nevaru atbalstīt šo ziņojumu un tā grozījumu Nr. 6, jo, manuprāt, ir nepareizi jautājumus, kuru pamatā ir nodokļi vai PVN, iekļaut ziņojumā, kurš ir par veselības jautājumiem. ","Marian Harkin  (ALDE),",1,32,not_available,['lav'],"['  Marian Harkin  (ALDE),  rakstiski  − Es nevaru atbalstīt šo ziņojumu un tā grozījumu Nr. 6, jo, manuprāt, ir nepareizi jautājumus, kuru pamatā ir nodokļi vai PVN, iekļaut ziņojumā, kurš ir par veselības jautājumiem. ']"
144, 8. Balsojumu skaidrojumi,"  Ian Hudghton  (Verts/ALE),  rakstiski. − Es balsoju par Foglietta kunga ziņojumu un atzinīgi novērtēju Balto grāmatu par Eiropas stratēģiju jautājumos, kas saistīti ar uzturu, lieko svaru un aptaukošanos. Aptaukošanās ir liela problēma visā Eiropas Savienībā; ar aptaukošanos un sliktu uzturu saistītie apstākļi rada nopietnas sekas visā sabiedrībā. Manā valstī Skotijas valdība ir veikusi pozitīvus pasākumus, lai uzlabotu uzturu tādās sabiedriskās iestādēs kā skolas un slimnīcas, un šādas iniciatīvas ir jāveicina visā ES. ","Ian Hudghton  (Verts/ALE),",1,72,not_available,['lav'],"['  Ian Hudghton  (Verts/ALE),  rakstiski. − Es balsoju par Foglietta kunga ziņojumu un atzinīgi novērtēju Balto grāmatu par Eiropas stratēģiju jautājumos, kas saistīti ar uzturu, lieko svaru un aptaukošanos. Aptaukošanās ir liela problēma visā Eiropas Savienībā; ar aptaukošanos un sliktu uzturu saistītie apstākļi rada nopietnas sekas visā sabiedrībā. Manā valstī Skotijas valdība ir veikusi pozitīvus pasākumus, lai uzlabotu uzturu tādās sabiedriskās iestādēs kā skolas un slimnīcas, un šādas iniciatīvas ir jāveicina visā ES. ']"
145, 8. Balsojumu skaidrojumi,"  Eija-Riitta Korhola  (PPE-DE),  rakstiski. − (FI) Es balsoju par Pārtikas komitejas pieņemto Foglietta kunga patstāvīgo ziņojumu par stratēģiju jautājumos, kas saistīti ar uzturu, lieko svaru un aptaukošanos.  Es ļoti augstu vērtēju pamatviedokli, ka pārtikas rūpniecībai ir jādod iespēja censties samazināt veselības problēmas, ko izraisa liekais svars vai aptaukošanās, izmantojot pašregulāciju, bet arī Komisijai ir jābūt tiesīgai nodrošināt, piemēram, saprātīgus un atbildīgus reklamēšanas mēģinājumus (jo īpaši attiecībā uz bērniem), kā arī lai iedzīvotāju uzturā patērētā sāls, tauku un cukura daudzuma samazināšanu realizē praksē.. Ir svarīgi patērētājiem nodrošināt pilnvērtīgu informāciju pārtikas iepakojumu marķējumā, lai viņi zinātu, ko izvēlēties starp labiem, labākiem un sliktākiem pārtikas produktiem. Manuprāt, kā arī pretēji pašreizējai praksei mākslīgo transtaukskābju sastāvs ir obligāti jānorāda pārtikas produkta aprakstā. Es šajā jautājumā balsoju pretēji mūsu grupas pieņemtajai nostājai.Tomēr es atbalstīju mūsu grupas viedokli par krāsu kodu izmantošanu pārtikas marķēšanā. Etiķetes ar krāsu kodiem, kuru nolūks ir skaidri norādīt, cik veselīgs ir pārtikas produkts — šis jautājums Eiropas Savienībā ir izraisījis plašas diskusijas — nereti ir maldinošas, un tādēļ tām nav nekādas vērtības. Šī iemesla dēļ daudzas AK lielveikalu ķēdes ir nolēmušas atteikties no šīs iepriekš pieņemtās prakses. ","Eija-Riitta Korhola  (PPE-DE),",3,186,not_available,"['fin', 'fin', 'fin']","['  Eija-Riitta Korhola  (PPE-DE),  rakstiski. − (FI) Es balsoju par Pārtikas komitejas pieņemto Foglietta kunga patstāvīgo ziņojumu par stratēģiju jautājumos, kas saistīti ar uzturu, lieko svaru un aptaukošanos.  Es ļoti augstu vērtēju pamatviedokli, ka pārtikas rūpniecībai ir jādod iespēja censties samazināt veselības problēmas, ko izraisa liekais svars vai aptaukošanās, izmantojot pašregulāciju, bet arī Komisijai ir jābūt tiesīgai nodrošināt, piemēram, saprātīgus un atbildīgus reklamēšanas mēģinājumus (jo īpaši attiecībā uz bērniem), kā arī lai iedzīvotāju uzturā patērētā sāls, tauku un cukura daudzuma samazināšanu realizē praksē.. ', 'Ir svarīgi patērētājiem nodrošināt pilnvērtīgu informāciju pārtikas iepakojumu marķējumā, lai viņi zinātu, ko izvēlēties starp labiem, labākiem un sliktākiem pārtikas produktiem. Manuprāt, kā arī pretēji pašreizējai praksei mākslīgo transtaukskābju sastāvs ir obligāti jānorāda pārtikas produkta aprakstā. Es šajā jautājumā balsoju pretēji mūsu grupas pieņemtajai nostājai.', 'Tomēr es atbalstīju mūsu grupas viedokli par krāsu kodu izmantošanu pārtikas marķēšanā. Etiķetes ar krāsu kodiem, kuru nolūks ir skaidri norādīt, cik veselīgs ir pārtikas produkts — šis jautājums Eiropas Savienībā ir izraisījis plašas diskusijas — nereti ir maldinošas, un tādēļ tām nav nekādas vērtības. Šī iemesla dēļ daudzas AK lielveikalu ķēdes ir nolēmušas atteikties no šīs iepriekš pieņemtās prakses. ']"
146, 8. Balsojumu skaidrojumi,"  Jörg Leichtfried  (PSE),  rakstiski. − (DE) Es balsošu par Alessandro Foglietta ziņojumu par Balto grāmatu par Eiropas stratēģiju jautājumos, kas saistīti ar uzturu, lieko svaru un aptaukošanos.Es piekrītu referentam par nepieciešamību pārstrukturēt veselībai, sportam un uzturam veltītos pasākumus. Tādas problēmas kā liekais svars un neveselīgi ēšanas paradumi visbiežāk ir sastopami sabiedrības sociāli un ekonomiski trūcīgajās iedzīvotāju grupās. Vienu no pirmajiem soļiem problēmas risināšanā var īstenot skolās. Vairāk fiziskās audzināšanas stundu un sabalansēta diēta bērniem un jauniešiem varētu būt vieni no pirmajiem soļiem uz veselīgāku dzīvesveidu, un veselības mācībai vajadzētu būt obligātam priekšmetam katrā Eiropas Savienības skolā. Turklāt pārtikas produktu marķēšana būtu apsveicama, jo tā dotu iespēju patērētājiem salīdzināt produktus un atšķirt labu pārtiku no mazvērtīgākas.Ziņojums nepiedāvā izcilu risinājumu, taču tas iesaka dažus ļoti labus pasākumus. Šie pasākumi var daudz ko vērst uz labu, tādēļ es tos vērtēju kā labvēlīgus. ","Jörg Leichtfried  (PSE),",3,140,not_available,"['ger', 'ger', 'ger']","['  Jörg Leichtfried  (PSE),  rakstiski. − (DE) Es balsošu par Alessandro Foglietta ziņojumu par Balto grāmatu par Eiropas stratēģiju jautājumos, kas saistīti ar uzturu, lieko svaru un aptaukošanos.', 'Es piekrītu referentam par nepieciešamību pārstrukturēt veselībai, sportam un uzturam veltītos pasākumus. Tādas problēmas kā liekais svars un neveselīgi ēšanas paradumi visbiežāk ir sastopami sabiedrības sociāli un ekonomiski trūcīgajās iedzīvotāju grupās. Vienu no pirmajiem soļiem problēmas risināšanā var īstenot skolās. Vairāk fiziskās audzināšanas stundu un sabalansēta diēta bērniem un jauniešiem varētu būt vieni no pirmajiem soļiem uz veselīgāku dzīvesveidu, un veselības mācībai vajadzētu būt obligātam priekšmetam katrā Eiropas Savienības skolā. Turklāt pārtikas produktu marķēšana būtu apsveicama, jo tā dotu iespēju patērētājiem salīdzināt produktus un atšķirt labu pārtiku no mazvērtīgākas.', 'Ziņojums nepiedāvā izcilu risinājumu, taču tas iesaka dažus ļoti labus pasākumus. Šie pasākumi var daudz ko vērst uz labu, tādēļ es tos vērtēju kā labvēlīgus. ']"
147, 8. Balsojumu skaidrojumi,"  Astrid Lulling  (PPE-DE),  rakstiski. – (FR) Ir apsveicami, ka Eiropas Komisija rūpējas par veselīgu pārtiku un par to, lai visi pilsoņi vingrotu, lai uzmanītos no liekā svara, aptaukošanās un hroniskām slimībām. Es noteikti atbalstu nodomu celt trauksmi par aptaukošanās epidēmiju, kas ir skārusi trīs miljonus bērnu un 20–30 % pieaugušo, un liekā svara problēmu 14 miljoniem bērnu un pusei no pieaugušajiem iedzīvotājiem.Es atzinīgi vērtēju, ka tiek apzināta un pētīta daudzos gatavotajos ēdienos un rūpnieciski ražotajos pārtikas produktos milzīgos daudzumos pievienoto garšas un krāsas pastiprinātāju, piemēram, glutamātu, guanilātu un inozinātu, ietekme uz patērētāju rīcību.Tomēr man ir žēl, ka netika pieņemts mans ierosinājums, kas tapa sadarbībā ar Euro-Toques — šefpavāru asociāciju, kura stingri ievēro goda kodeksu un atbalsta produktu patiesu kvalitāti un vietējo ražošanu, — un kura nolūks bija veicināt veselīgas ēšanas paradumus,  Es uzskatu, ka mēs rīkotos saprātīgi, ja izmantotu viņu zināšanas, lai skolu ēdnīcās veicinātu labāko praksi un attīstītu jauniešiem tieksmi pēc kvalitatīva ēdiena un veselīgiem ēšanas paradumiem. ","Astrid Lulling  (PPE-DE),",3,159,not_available,"['fra', 'fra', 'fra']","['  Astrid Lulling  (PPE-DE),  rakstiski. – (FR) Ir apsveicami, ka Eiropas Komisija rūpējas par veselīgu pārtiku un par to, lai visi pilsoņi vingrotu, lai uzmanītos no liekā svara, aptaukošanās un hroniskām slimībām. Es noteikti atbalstu nodomu celt trauksmi par aptaukošanās epidēmiju, kas ir skārusi trīs miljonus bērnu un 20–30 % pieaugušo, un liekā svara problēmu 14 miljoniem bērnu un pusei no pieaugušajiem iedzīvotājiem.', 'Es atzinīgi vērtēju, ka tiek apzināta un pētīta daudzos gatavotajos ēdienos un rūpnieciski ražotajos pārtikas produktos milzīgos daudzumos pievienoto garšas un krāsas pastiprinātāju, piemēram, glutamātu, guanilātu un inozinātu, ietekme uz patērētāju rīcību.', 'Tomēr man ir žēl, ka netika pieņemts mans ierosinājums, kas tapa sadarbībā ar Euro-Toques — šefpavāru asociāciju, kura stingri ievēro goda kodeksu un atbalsta produktu patiesu kvalitāti un vietējo ražošanu, — un kura nolūks bija veicināt veselīgas ēšanas paradumus,  Es uzskatu, ka mēs rīkotos saprātīgi, ja izmantotu viņu zināšanas, lai skolu ēdnīcās veicinātu labāko praksi un attīstītu jauniešiem tieksmi pēc kvalitatīva ēdiena un veselīgiem ēšanas paradumiem. ']"
148, 8. Balsojumu skaidrojumi,"  David Martin  (PSE),  rakstiski. − Es apsveicu Alessandro Foglietta ziņojumu par Balto grāmatu par Eiropas stratēģiju jautājumos, kas saistīti ar uzturu, lieko svaru un aptaukošanos. Ziņojumā ir iekļauti vairāki labi ieteikumi, piemēram, visā ES aizliegt transtaukskābju lietošanu, jo ir konstatēta to saistība ar sirds slimībām un sieviešu neauglību. Tomēr es pievienošos kolēģiem, atbalstot tālejošus pasākumus. Skolām, piemēram, nevajadzētu nonākt tādā situācijā, ka tām jāapsver, vai ļaut vai neļaut reklamēt savās ēkās neveselīgu pārtiku. Mans balsojums parāda šos uzskatus. ","David Martin  (PSE),",1,77,not_available,['lav'],"['  David Martin  (PSE),  rakstiski. − Es apsveicu Alessandro Foglietta ziņojumu par Balto grāmatu par Eiropas stratēģiju jautājumos, kas saistīti ar uzturu, lieko svaru un aptaukošanos. Ziņojumā ir iekļauti vairāki labi ieteikumi, piemēram, visā ES aizliegt transtaukskābju lietošanu, jo ir konstatēta to saistība ar sirds slimībām un sieviešu neauglību. Tomēr es pievienošos kolēģiem, atbalstot tālejošus pasākumus. Skolām, piemēram, nevajadzētu nonākt tādā situācijā, ka tām jāapsver, vai ļaut vai neļaut reklamēt savās ēkās neveselīgu pārtiku. Mans balsojums parāda šos uzskatus. ']"
149, 8. Balsojumu skaidrojumi,"  Dimitrios Papadimoulis  (GUE/NGL),  rakstiski. – (EL) Aptaukošanās ir sasniegusi epidēmijas apmērus. Eiropas Savienībā visvairāk cilvēku ar aptaukošanās problēmām dzīvo Grieķijā, kur trim cilvēkiem no četriem ir palielināts svars un kur ātrās ēdināšanas apgrozījums ir palielinājies par 956 %.Lai mazinātu aptaukošanos, nekavējoties ir jāveic radikāli pasākumi:-	PVN augļiem un dārzeņiem ir jāsamazina;-	PVN veselīgiem produktiem un tradicionālo produktu aizsardzība ir jāsamazina;-	Veselīgs uzturs jānodrošina jau no agras bērnības;-	Ēdiens skolu ēdnīcās ir jāpārbauda; skolās ir jānodrošina fiziski vingrinājumi;-	Reklāma un maldinoša informācija attiecībā uz produktiem ar augstu tauku, cukura vai sāls sastāvu ir jāaizliedz;-	Skaidrai informācijai par uzturvērtību uz etiķetēm ir jābūt obligātai, lai patērētāji savu izvēli varētu izdarīt par labu veselīgam uzturam;-	Sintētiskas transtaukskābes un pievienotie garšas pastiprinātāji rūpnieciski ražotajos pārtikas produktos ir jāaizliedz.2009. gada sākumā darbu sāks Eiropas Komisijas programma skolu bezmaksas apgādei ar augļiem un dārzeņiem. To finansēs no Eiropas Savienības līdzekļiem par 90 miljoniem eiro gadā, un finansējumu papildinās valstu līdzekļi. Grieķijas valdībai nekavējoties ir jānodrošina līdzekļi šīs programmas uzsākšanai. ","Dimitrios Papadimoulis  (GUE/NGL),",10,164,not_available,"['gre', 'gre', 'gre', 'gre', 'gre', 'gre', 'gre', 'gre', 'gre', 'gre']","['  Dimitrios Papadimoulis  (GUE/NGL),  rakstiski. – (EL) Aptaukošanās ir sasniegusi epidēmijas apmērus. Eiropas Savienībā visvairāk cilvēku ar aptaukošanās problēmām dzīvo Grieķijā, kur trim cilvēkiem no četriem ir palielināts svars un kur ātrās ēdināšanas apgrozījums ir palielinājies par 956 %.', 'Lai mazinātu aptaukošanos, nekavējoties ir jāveic radikāli pasākumi:', '-\tPVN augļiem un dārzeņiem ir jāsamazina;', '-\tPVN veselīgiem produktiem un tradicionālo produktu aizsardzība ir jāsamazina;', '-\tVeselīgs uzturs jānodrošina jau no agras bērnības;', '-\tĒdiens skolu ēdnīcās ir jāpārbauda; skolās ir jānodrošina fiziski vingrinājumi;', '-\tReklāma un maldinoša informācija attiecībā uz produktiem ar augstu tauku, cukura vai sāls sastāvu ir jāaizliedz;', '-\tSkaidrai informācijai par uzturvērtību uz etiķetēm ir jābūt obligātai, lai patērētāji savu izvēli varētu izdarīt par labu veselīgam uzturam;', '-\tSintētiskas transtaukskābes un pievienotie garšas pastiprinātāji rūpnieciski ražotajos pārtikas produktos ir jāaizliedz.', '2009. gada sākumā darbu sāks Eiropas Komisijas programma skolu bezmaksas apgādei ar augļiem un dārzeņiem. To finansēs no Eiropas Savienības līdzekļiem par 90 miljoniem eiro gadā, un finansējumu papildinās valstu līdzekļi. Grieķijas valdībai nekavējoties ir jānodrošina līdzekļi šīs programmas uzsākšanai. ']"
150, 8. Balsojumu skaidrojumi,"  Catherine Stihler  (PSE),  rakstiski. − Skaidri saprotama pārtikas produktu marķēšana palīdzēs mūsu cīņā pret aptaukošanos. Es biju ļoti vīlusies, redzot, ka šajā ziņojumā ir noraidīta prasība par obligātu krāsu kodu marķējumu iepakojuma priekšpusē. Es stingri atbalstu šo prasību. Aicinājumi noteikt visā ES aizliegumu mākslīgajām transtaukskābēm manā skatījumā ir apsveicami. ","Catherine Stihler  (PSE),",1,48,not_available,['lav'],"['  Catherine Stihler  (PSE),  rakstiski. − Skaidri saprotama pārtikas produktu marķēšana palīdzēs mūsu cīņā pret aptaukošanos. Es biju ļoti vīlusies, redzot, ka šajā ziņojumā ir noraidīta prasība par obligātu krāsu kodu marķējumu iepakojuma priekšpusē. Es stingri atbalstu šo prasību. Aicinājumi noteikt visā ES aizliegumu mākslīgajām transtaukskābēm manā skatījumā ir apsveicami. ']"
151, 8. Balsojumu skaidrojumi,"  Proinsias De Rossa  (PSE),  rakstiski. − Ir vairāki pamatprincipi, kas jāpiemēro ES pacientu tiesībām ārstēties citā dalībvalstī, kura nav pacienta mītnes zeme.Mēs nedrīkstam pieļaut, ka EKT pakāpeniski veido politiku šajā jomā, izvērtējot katru gadījumu atsevišķi. Viņi pieņems lēmumus, pamatojoties vienīgi uz tirgus apsvērumiem un neņemot vērā veselības aprūpes kā vispārēja ārpustirgus pakalpojuma unikalitāti.Tiesību aktos, ko mēs izstrādājam šajā jomā, pacientu veselībai un labklājībai ir jābūt galvenajam aspektam.Līdz laikam, kamēr ir vienošanās, ka mēs varam saskaņot mūsu valstu veselības aprūpes pakalpojumus, sasniedzot augstākos standartus, dalībvalstīm ir jādod iespēja brīvi plānot, finansēt un pārvaldīt pakalpojumus, lai savas valstī nodrošinātu kvalitatīvu sabiedrības veselības aprūpi.Šo tiesību aktu piemērošana nedrīkst radīt konkurenci valstu veselības aprūpes dienestu starpā. Pacientu patiesās vajadzības netiks apmierinātas, ja pret veselību izturēsies kā pret vienkārši vēl vienu pērkamu un pārdodamu patēriņa priekšmetu. Šāda izturēšanās, manuprāt, pazeminātu standartus. ","Proinsias De Rossa  (PSE),",5,139,not_available,"['lav', 'lav', 'lav', 'lav', 'lav']","['  Proinsias De Rossa  (PSE),  rakstiski. − Ir vairāki pamatprincipi, kas jāpiemēro ES pacientu tiesībām ārstēties citā dalībvalstī, kura nav pacienta mītnes zeme.', 'Mēs nedrīkstam pieļaut, ka EKT pakāpeniski veido politiku šajā jomā, izvērtējot katru gadījumu atsevišķi. Viņi pieņems lēmumus, pamatojoties vienīgi uz tirgus apsvērumiem un neņemot vērā veselības aprūpes kā vispārēja ārpustirgus pakalpojuma unikalitāti.', 'Tiesību aktos, ko mēs izstrādājam šajā jomā, pacientu veselībai un labklājībai ir jābūt galvenajam aspektam.', 'Līdz laikam, kamēr ir vienošanās, ka mēs varam saskaņot mūsu valstu veselības aprūpes pakalpojumus, sasniedzot augstākos standartus, dalībvalstīm ir jādod iespēja brīvi plānot, finansēt un pārvaldīt pakalpojumus, lai savas valstī nodrošinātu kvalitatīvu sabiedrības veselības aprūpi.', 'Šo tiesību aktu piemērošana nedrīkst radīt konkurenci valstu veselības aprūpes dienestu starpā. Pacientu patiesās vajadzības netiks apmierinātas, ja pret veselību izturēsies kā pret vienkārši vēl vienu pērkamu un pārdodamu patēriņa priekšmetu. Šāda izturēšanās, manuprāt, pazeminātu standartus. ']"
152, 8. Balsojumu skaidrojumi,"  Hélčne Goudin un Nils Lundgren  (IND/DEM),  rakstiski. – (SV) Šajā rezolūcijā ir izklāstīti viedokļi attiecībā uz piemērotiem politikas pasākumiem, kas aptver tādus jautājumus kā aizsardzība nodarbinātības jomā, cīņa pret nabadzību, darba tirgus pasākumi, gados vecāku cilvēku iesaistīšana darba tirgū, profesionālā mobilitāte un atalgojuma atšķirības. Šādus svarīgus darba tirgus jautājumus nekādā gadījumā nedrīkst regulēt ES iestādžu lekciju veidā. Veiksmīgas politikas veidošanai šajās jomās dalībvalstīm ir izdevīgāks stāvoklis nekā ES iestādēm. Ja ir vajadzīga kaut kāda starptautiska koordinācija, tā jāveido ar tādām plašas demokrātiskās leģitimitātes pasaules organizācijām kā SDO. Tādēļ mēs galīgajā balsojumā balsojām pret šo rezolūciju. ","Hélčne Goudin un Nils Lundgren  (IND/DEM),",1,95,not_available,['swe'],"['  Hélčne Goudin un Nils Lundgren  (IND/DEM),  rakstiski. – (SV) Šajā rezolūcijā ir izklāstīti viedokļi attiecībā uz piemērotiem politikas pasākumiem, kas aptver tādus jautājumus kā aizsardzība nodarbinātības jomā, cīņa pret nabadzību, darba tirgus pasākumi, gados vecāku cilvēku iesaistīšana darba tirgū, profesionālā mobilitāte un atalgojuma atšķirības. Šādus svarīgus darba tirgus jautājumus nekādā gadījumā nedrīkst regulēt ES iestādžu lekciju veidā. Veiksmīgas politikas veidošanai šajās jomās dalībvalstīm ir izdevīgāks stāvoklis nekā ES iestādēm. Ja ir vajadzīga kaut kāda starptautiska koordinācija, tā jāveido ar tādām plašas demokrātiskās leģitimitātes pasaules organizācijām kā SDO. Tādēļ mēs galīgajā balsojumā balsojām pret šo rezolūciju. ']"
153, 8. Balsojumu skaidrojumi,"  Marianne Thyssen  (PPE-DE),  rakstiski. – (NL) Mēs joprojām priecājamies par to, ka Eiropas Parlaments izslēdza veselības aprūpes pakalpojumus no vispārējās pakalpojumu direktīvas. Galu galā veselības aprūpe ir specifiska joma, kurai ir vajadzīga specifiska pieeja.Priekšlikuma galvenajam priekšnoteikumam saskaņā ar tiesu praksi jābūt šādam — veselības aprūpes organizācija un finansējums ir dalībvalstu kompetencē. No vienas puses, tas nozīmē, ka pacientu mobilitāti nevar padarīt par absolūtām tiesībām, bet, no otras puses, nav attaisnojuma tam, ka netiek veikti ieguldījumi pašas valsts veselības aprūpes sistēmā. Šis priekšnoteikums nozīmē arī to, ka dalībvalstīm ir jāļauj iekasēt reālas izmaksas no pacienta.Ir jābūt solidaritātei, bet ir arī jābūt iespējai atšķirīgi izturēties pret pacientiem, kas ir veikuši iemaksas savas valsts sociālās apdrošināšanas un nodokļu sistēmā, un pret pacientiem no ārvalstīm, kas to nav darījuši.Tas ir labi, ka mums ir direktīva, taču ikvienam, kas šo jomu pārzina, šķiet, ka joprojām ir daudz darāmā. Manuprāt, veselības aprūpes kvalitāte, pieejamība un finansiālā ilgtspējība, kuras pamatā ir sociāli atbildīga solidaritāte, joprojām ir galvenais kritērijs. ","Marianne Thyssen  (PPE-DE),",6,163,not_available,"['dut', 'dut', 'dut', 'dut', 'dut', 'dut']","['  Marianne Thyssen  (PPE-DE),  rakstiski. – (NL) Mēs joprojām priecājamies par to, ka Eiropas Parlaments izslēdza veselības aprūpes pakalpojumus no vispārējās pakalpojumu direktīvas. Galu galā veselības aprūpe ir specifiska joma, kurai ir vajadzīga specifiska pieeja.', 'Priekšlikuma galvenajam priekšnoteikumam saskaņā ar tiesu praksi jābūt šādam — veselības aprūpes organizācija un finansējums ir dalībvalstu kompetencē. ', 'No vienas puses, tas nozīmē, ka pacientu mobilitāti nevar padarīt par absolūtām tiesībām, bet, no otras puses, nav attaisnojuma tam, ka netiek veikti ieguldījumi pašas valsts veselības aprūpes sistēmā.', ' Šis priekšnoteikums nozīmē arī to, ka dalībvalstīm ir jāļauj iekasēt reālas izmaksas no pacienta.', 'Ir jābūt solidaritātei, bet ir arī jābūt iespējai atšķirīgi izturēties pret pacientiem, kas ir veikuši iemaksas savas valsts sociālās apdrošināšanas un nodokļu sistēmā, un pret pacientiem no ārvalstīm, kas to nav darījuši.', 'Tas ir labi, ka mums ir direktīva, taču ikvienam, kas šo jomu pārzina, šķiet, ka joprojām ir daudz darāmā. Manuprāt, veselības aprūpes kvalitāte, pieejamība un finansiālā ilgtspējība, kuras pamatā ir sociāli atbildīga solidaritāte, joprojām ir galvenais kritērijs. ']"
154, 9. Balsojumu labojumi un nodomi balsot: sk. protokolu,(Sēde tika pārtraukta plkst. 13.00 un atsākta 15.00) ,unknown,1,10,not_available,['lav'],['(Sēde tika pārtraukta plkst. 13.00 un atsākta 15.00) ']
155, 9. Balsojumu labojumi un nodomi balsot: sk. protokolu,"SĒDI VADA: Diana WALLIS, Priekšsēdētāja vietniece","SĒDI VADA: Diana WALLIS,",1,6,not_available,['lav'],"['SĒDI VADA: Diana WALLIS, Priekšsēdētāja vietniece']"
