,agenda_item,text,speaker,number_p,number_w,chair,language_ps,ps
72," 7.4. Plašsaziņas līdzekļu koncentrēšanās un plurālisms Eiropas Savienībā (A6-0303/2008, Marianne Mikko) (balsošana) ","  Ignasi Guardans Cambó  (ALDE). -  (ES) Es lūdzu vārdu saskaņā ar Reglamenta 166. pantu un saistībā ar Parlamenta Reglamenta 45. panta 2. punktu.45. panta 2. punkts tika nesen grozīts, aizliedzot iesniegt grozījumus pašiniciatīvas ziņojumos iekļautajos rezolūciju priekšlikumos.Rezultāts, kā mēs redzēsim gaidāmajā balsošanā, ir tāds, ka tad, ja parlamentārā grupa vēlas grozīt vienu rindiņu vai punktu pašiniciatīvas ziņojumā, tai prasa iesniegt pilnīgi jaunu alternatīvu rezolūcijas priekšlikumu, kurā vienīgā atšķirība ir viens komats vai kāds ievietots vai svītrots vārds.Varbūt noteikuma grozīšanas laikā tā šķita laba ideja, bet tagad tas apgrūtina vienošanos šajā plenārsēžu zālē, un panākt vienošanos – tam taču ir jābūt vienam no mūsu galvenajiem mērķiem. Ir neiespējami panākt vienošanos starp politiskajām grupām, ja vienīgais, ko mēs varam darīt, ir iesniegt atsevišķu tekstu, kā mēs drīz redzēsim balošanā.Priekšsēdētāja kungs, es lūdzu pārskatīt 45. panta 2. punkta grozījumu, jo tā ietekme ir absurda, un tas ir traucē Parlamenta grupu politiskajām attiecībām.(Aplausi) ",Ignasi Guardans Cambó  (ALDE). -,6,152,not_available,"['spa', 'spa', 'spa', 'spa', 'spa', 'spa']","['  Ignasi Guardans Cambó  (ALDE). -  (ES) Es lūdzu vārdu saskaņā ar Reglamenta 166. pantu un saistībā ar Parlamenta Reglamenta 45. panta 2. punktu.', '45. panta 2. punkts tika nesen grozīts, aizliedzot iesniegt grozījumus pašiniciatīvas ziņojumos iekļautajos rezolūciju priekšlikumos.', 'Rezultāts, kā mēs redzēsim gaidāmajā balsošanā, ir tāds, ka tad, ja parlamentārā grupa vēlas grozīt vienu rindiņu vai punktu pašiniciatīvas ziņojumā, tai prasa iesniegt pilnīgi jaunu alternatīvu rezolūcijas priekšlikumu, kurā vienīgā atšķirība ir viens komats vai kāds ievietots vai svītrots vārds.', 'Varbūt noteikuma grozīšanas laikā tā šķita laba ideja, bet tagad tas apgrūtina vienošanos šajā plenārsēžu zālē, un panākt vienošanos – tam taču ir jābūt vienam no mūsu galvenajiem mērķiem. Ir neiespējami panākt vienošanos starp politiskajām grupām, ja vienīgais, ko mēs varam darīt, ir iesniegt atsevišķu tekstu, kā mēs drīz redzēsim balošanā.', 'Priekšsēdētāja kungs, es lūdzu pārskatīt 45. panta 2. punkta grozījumu, jo tā ietekme ir absurda, un tas ir traucē Parlamenta grupu politiskajām attiecībām.', '(Aplausi) ']"
73," 7.4. Plašsaziņas līdzekļu koncentrēšanās un plurālisms Eiropas Savienībā (A6-0303/2008, Marianne Mikko) (balsošana) ","  Priekšsēdētājs. −   Esmu spiests norādīt, ka šo lēmumu savā gudrībā pieņēma Eiropas Parlaments.(Pack kundzes iebildumi)Baidos, ka tā ir, Pack kundze, bet to nevar mainīt. Pašlaik mums ir jāievēro likums. ",Priekšsēdētājs. −,3,30,not_available,"['lav', 'lav', 'lav']","['  Priekšsēdētājs. −   Esmu spiests norādīt, ka šo lēmumu savā gudrībā pieņēma Eiropas Parlaments.', '(Pack kundzes iebildumi)', 'Baidos, ka tā ir, Pack kundze, bet to nevar mainīt. Pašlaik mums ir jāievēro likums. ']"
74," 7.4. Plašsaziņas līdzekļu koncentrēšanās un plurālisms Eiropas Savienībā (A6-0303/2008, Marianne Mikko) (balsošana) ","  Monica Frassoni  (Verts/ALE). -  (IT) Priekšsēdētāja kungs, dāmas un kungi! Varbūt Guardans kungam vajadzētu jautāt savai grupai, jo viņi bija vieni no šī noteikuma ierosinātājiem. Tomēr es gribētu pateikt, lūk, ko: ziņojums, par kuru mēs šodien balsojam – M. Mikko ziņojums par plašsaziņas līdzekļu plurālismu un koncentrēšanos, ir pirmais ziņojums, kuru mēs pieņemam saskaņā ar šo procedūru, kad mums nedrīkst būt plašu debašu, mēs nedrīkstam iesniegt grozījumus, un vēl tādā dienā, kad Itālijā noticis nopietns, ļoti nopietns uzbrukums vārda brīvībai – ir paziņots par 25 žurnālistu atlaišanu no darba vienīgajā televīzijas kanālā, pār kuru pašlaik nevalda S. Berlusconi. Manuprāt, tas, kā mēs apspriežam šīs problēmas, arī liecina, ka šis Parlaments negrib izdot Eiropas Savienībai neatliekami vajadzīgos likumus, noteikumus vai norādījumus par plašsaziņas līdzekļu koncentrēšanos un plurālismu.(Kreiso un centristu aplausi) ",Monica Frassoni  (Verts/ALE). -,2,128,not_available,"['ita', 'ita']","['  Monica Frassoni  (Verts/ALE). -  (IT) Priekšsēdētāja kungs, dāmas un kungi! Varbūt Guardans kungam vajadzētu jautāt savai grupai, jo viņi bija vieni no šī noteikuma ierosinātājiem. Tomēr es gribētu pateikt, lūk, ko: ziņojums, par kuru mēs šodien balsojam – M. Mikko ziņojums par plašsaziņas līdzekļu plurālismu un koncentrēšanos, ir pirmais ziņojums, kuru mēs pieņemam saskaņā ar šo procedūru, kad mums nedrīkst būt plašu debašu, mēs nedrīkstam iesniegt grozījumus, un vēl tādā dienā, kad Itālijā noticis nopietns, ļoti nopietns uzbrukums vārda brīvībai – ir paziņots par 25 žurnālistu atlaišanu no darba vienīgajā televīzijas kanālā, pār kuru pašlaik nevalda S. Berlusconi. Manuprāt, tas, kā mēs apspriežam šīs problēmas, arī liecina, ka šis Parlaments negrib izdot Eiropas Savienībai neatliekami vajadzīgos likumus, noteikumus vai norādījumus par plašsaziņas līdzekļu koncentrēšanos un plurālismu.', '(Kreiso un centristu aplausi) ']"
75," 7.4. Plašsaziņas līdzekļu koncentrēšanās un plurālisms Eiropas Savienībā (A6-0303/2008, Marianne Mikko) (balsošana) ","  Marianne Mikko  (PSE). -   Priekšsēdētāja kungs! Es gribētu pateikties visiem, kuri runāja par šo ārkārtīgi svarīgo un atbildīgo ziņojumu par plašsaziņas līdzekļu plurālismu un koncentrēšanos Eiropas Savienībā. Ziņojumā ir runa par demokrātijas aizsardzību. Mēs mēģinājām iekļaut šajā ziņojumā visu, kas nostiprina demokrātiju. Tādēļ jums pirms balsošanas ir jāmēģina koncentrēties un pārdomāt. Ko jūs atbalstāt un pret ko jūs iebilstat? Šodien mēs raidām mūsu iedzīvotājiem šo vēstījumu. Lūdzu, domājiet!(Aplausi) ",Marianne Mikko  (PSE). -,2,68,not_available,"['lav', 'lav']","['  Marianne Mikko  (PSE). -   Priekšsēdētāja kungs! Es gribētu pateikties visiem, kuri runāja par šo ārkārtīgi svarīgo un atbildīgo ziņojumu par plašsaziņas līdzekļu plurālismu un koncentrēšanos Eiropas Savienībā. Ziņojumā ir runa par demokrātijas aizsardzību. Mēs mēģinājām iekļaut šajā ziņojumā visu, kas nostiprina demokrātiju. Tādēļ jums pirms balsošanas ir jāmēģina koncentrēties un pārdomāt. Ko jūs atbalstāt un pret ko jūs iebilstat? Šodien mēs raidām mūsu iedzīvotājiem šo vēstījumu. Lūdzu, domājiet!', '(Aplausi) ']"
76," 7.4. Plašsaziņas līdzekļu koncentrēšanās un plurālisms Eiropas Savienībā (A6-0303/2008, Marianne Mikko) (balsošana) ","  Pál Schmitt,  PPE-DE grupas vārdā. – (HU) Priekšsēdētāja kungs! Kā ēnu referents par šo tematu es vēlos pievienoties tiem, kuri apgalvo, ka šī sistēma pašreizējā veidā nav laba. Es būtu gribējis izteikt Tautas partijas viedokli Parlamenta debatēs, taču kā ēnu referentam man nedeva vārdu.Es gribētu jautāt, kāpēc tad, ja plašsaziņas līdzekļu plurālisms ir tik svarīgs, nav svarīgs viedokļu plurālisms? Es būtu gribējis paskaidrot, ka mēs nepiekrītam dažām lietām, bet man nedeva vārdu. Tikai divi cilvēki no visa Parlamenta drīkstēja runāt par šo tematu – referente un komisāre. Mums noteikti ir jāapsver, vai šī sistēma ir laba, jo mēs gribam zināt viens otra viedokli, un tas ir tā dēvētais viedokļu plurālisms. Priekšsēdētāja kungs, lūdzu, palīdziet mums to īstenot!(Labējo aplausi) ","Pál Schmitt,",3,119,not_available,"['hun', 'hun', 'hun']","['  Pál Schmitt,  PPE-DE grupas vārdā. – (HU) Priekšsēdētāja kungs! Kā ēnu referents par šo tematu es vēlos pievienoties tiem, kuri apgalvo, ka šī sistēma pašreizējā veidā nav laba. Es būtu gribējis izteikt Tautas partijas viedokli Parlamenta debatēs, taču kā ēnu referentam man nedeva vārdu.', 'Es gribētu jautāt, kāpēc tad, ja plašsaziņas līdzekļu plurālisms ir tik svarīgs, nav svarīgs viedokļu plurālisms? Es būtu gribējis paskaidrot, ka mēs nepiekrītam dažām lietām, bet man nedeva vārdu. Tikai divi cilvēki no visa Parlamenta drīkstēja runāt par šo tematu – referente un komisāre. Mums noteikti ir jāapsver, vai šī sistēma ir laba, jo mēs gribam zināt viens otra viedokli, un tas ir tā dēvētais viedokļu plurālisms. Priekšsēdētāja kungs, lūdzu, palīdziet mums to īstenot!', '(Labējo aplausi) ']"
77," 7.4. Plašsaziņas līdzekļu koncentrēšanās un plurālisms Eiropas Savienībā (A6-0303/2008, Marianne Mikko) (balsošana) ","  Priekšsēdētājs. −   Dāmas un kungi! Es vēl došu vārdu Cohn-Bendit kungam, bet pēc tam mums ir jāturpina balsošana. Mēs varam izdarīt attiecīgus secinājumus par mūsu pašu pieņemtā lēmuma sekām. Ja mēs esam pieņēmuši apšaubāmu lēmumu, mums ir tiesības to mainīt, taču grozījumi ir jāizdara saskaņā ar noteiktajām procedūrām. ",Priekšsēdētājs. −,1,48,not_available,['lav'],"['  Priekšsēdētājs. −   Dāmas un kungi! Es vēl došu vārdu Cohn-Bendit kungam, bet pēc tam mums ir jāturpina balsošana. Mēs varam izdarīt attiecīgus secinājumus par mūsu pašu pieņemtā lēmuma sekām. Ja mēs esam pieņēmuši apšaubāmu lēmumu, mums ir tiesības to mainīt, taču grozījumi ir jāizdara saskaņā ar noteiktajām procedūrām. ']"
78," 7.4. Plašsaziņas līdzekļu koncentrēšanās un plurālisms Eiropas Savienībā (A6-0303/2008, Marianne Mikko) (balsošana) ","  Daniel Cohn-Bendit  (Verts/ALE). -  (DE) Priekšsēdētāja kungs! Kā jūs tikko teicāt, tieši šo nejēdzību ir pieņēmis šī Parlamenta vairākums, kaut gan mēs balsojām pret to. Tas bija jūsu lēmums! Sakuriet kārtīgu pirti savam priekšsēdētājam, lai viņš panāk lēmuma grozījumu!(Centristu un kreiso aplausi) ",Daniel Cohn-Bendit  (Verts/ALE). -,2,44,not_available,"['ger', 'ger']","['  Daniel Cohn-Bendit  (Verts/ALE). -  (DE) Priekšsēdētāja kungs! Kā jūs tikko teicāt, tieši šo nejēdzību ir pieņēmis šī Parlamenta vairākums, kaut gan mēs balsojām pret to. Tas bija jūsu lēmums! Sakuriet kārtīgu pirti savam priekšsēdētājam, lai viņš panāk lēmuma grozījumu!', '(Centristu un kreiso aplausi) ']"
79," 7.4. Plašsaziņas līdzekļu koncentrēšanās un plurālisms Eiropas Savienībā (A6-0303/2008, Marianne Mikko) (balsošana) ","  Priekšsēdētājs. −   Mēs gluži negrasāmies sakurt pirti, taču secinājumus var izdarīt, ja tā vēlas šā Parlamenta vairākums. ",Priekšsēdētājs. −,1,16,not_available,['lav'],"['  Priekšsēdētājs. −   Mēs gluži negrasāmies sakurt pirti, taču secinājumus var izdarīt, ja tā vēlas šā Parlamenta vairākums. ']"
80," 7.4. Plašsaziņas līdzekļu koncentrēšanās un plurālisms Eiropas Savienībā (A6-0303/2008, Marianne Mikko) (balsošana) ","  Stefano Zappalà  (PPE-DE). -  (IT) Priekšsēdētāja kungs, dāmas un kungi! Man nav nodoma detalizēti iztirzāt Frassoni kundzes neprecīzos apgalvojumus, tomēr man šķiet, ka ir jāsniedz paskaidrojums Parlamentam. Itālijas televīzijas kanāli pieder nevis prezidentam S. Berlusconi, bet gan citām grupām. Priekšsēdētāja kungs, Itālijā ir trīs valsts televīzijas kanāli: Rai 1, Rai 2 un Rai 3, ir Mediaset grupa, un vēl ir LA7 ...(Centristu un kreiso protesti) ",Stefano Zappalà  (PPE-DE). -,2,65,not_available,"['ita', 'ita']","['  Stefano Zappalà  (PPE-DE). -  (IT) Priekšsēdētāja kungs, dāmas un kungi! Man nav nodoma detalizēti iztirzāt Frassoni kundzes neprecīzos apgalvojumus, tomēr man šķiet, ka ir jāsniedz paskaidrojums Parlamentam. Itālijas televīzijas kanāli pieder nevis prezidentam S. Berlusconi, bet gan citām grupām. Priekšsēdētāja kungs, Itālijā ir trīs valsts televīzijas kanāli: Rai 1, Rai 2 un Rai 3, ir Mediaset grupa, un vēl ir LA7 ...', '(Centristu un kreiso protesti) ']"
81," 7.4. Plašsaziņas līdzekļu koncentrēšanās un plurālisms Eiropas Savienībā (A6-0303/2008, Marianne Mikko) (balsošana) ","  Priekšsēdētājs. −   Dāmas un kungi! Nav iemesla satraukties. Jūs esat pieņēmuši lēmumu.Ja Parlaments ir pieņēmis lēmumu, kuru vairākums varbūt uzskata par nesaprātīgu, to var mainīt, bet kamēr noteikumi nav mainīti, tie ir jāievēro. Tāds ir šī Parlamenta princips.(Aplausi) ",Priekšsēdētājs. −,3,39,not_available,"['lav', 'lav', 'lav']","['  Priekšsēdētājs. −   Dāmas un kungi! Nav iemesla satraukties. Jūs esat pieņēmuši lēmumu.', 'Ja Parlaments ir pieņēmis lēmumu, kuru vairākums varbūt uzskata par nesaprātīgu, to var mainīt, bet kamēr noteikumi nav mainīti, tie ir jāievēro. Tāds ir šī Parlamenta princips.', '(Aplausi) ']"
82, 7.5. Enerģijas cenu problēmas risināšana (balsošana) ,– Pirms balsojuma par 1. grozījumu,unknown,1,5,not_available,['lav'],['– Pirms balsojuma par 1. grozījumu']
83, 7.5. Enerģijas cenu problēmas risināšana (balsošana) ,"  Urszula Gacek  (PPE-DE). -   Priekšsēdētāja kungs! Man ir jautājums tikai par jaunā Reglamenta procedūru. Tā kā debates tika saīsinātas, mums teica, ka tagad mēs drīkstam iesniegt vairāk nekā vienu rakstisku paziņojumu, kā tas bija pirms jaunā Reglamenta stāšanās spēkā. Šodien es mēģināju iesniegt divus rakstiskus paziņojumus, un tīmekļa vietne to neatļāva. Tādēļ nekur nav reģistrēta mana balss debatēs par enerģijas kontroli.Vai jūs varat noskaidrot, vai šī tehniskā problēma ir atrisināta? Pārskatītais Reglaments netiek ievērots. ",Urszula Gacek  (PPE-DE). -,2,75,not_available,"['lav', 'lav']","['  Urszula Gacek  (PPE-DE). -   Priekšsēdētāja kungs! Man ir jautājums tikai par jaunā Reglamenta procedūru. Tā kā debates tika saīsinātas, mums teica, ka tagad mēs drīkstam iesniegt vairāk nekā vienu rakstisku paziņojumu, kā tas bija pirms jaunā Reglamenta stāšanās spēkā. Šodien es mēģināju iesniegt divus rakstiskus paziņojumus, un tīmekļa vietne to neatļāva. Tādēļ nekur nav reģistrēta mana balss debatēs par enerģijas kontroli.', 'Vai jūs varat noskaidrot, vai šī tehniskā problēma ir atrisināta? Pārskatītais Reglaments netiek ievērots. ']"
84, 7.5. Enerģijas cenu problēmas risināšana (balsošana) ,"  Priekšsēdētājs. −   Jūs varat iesniegt rakstisku deklarāciju, Gacek kundze, bet šis nebija īstais laiks par to runāt. ",Priekšsēdētājs. −,1,16,not_available,['lav'],"['  Priekšsēdētājs. −   Jūs varat iesniegt rakstisku deklarāciju, Gacek kundze, bet šis nebija īstais laiks par to runāt. ']"
85, 7.8. IASCF: Struktūras pārskats - IASB pārskatatbildība un sastāvs - pārmaiņu ierosinājumi (balsošana) ,"  Piia-Noora Kauppi,  PPE-DE grupas vārdā. – Priekšsēdētāja kungs! Kā jau jūs teicāt, PPE-DE grupa vēlētos lūgt atlikt balsošanu par šo rezolūciju. Bez šaubām, Starptautiskās grāmatvedības standartu padomes pārvaldību nevar izlemt nākamajās divās nedēļās, tādēļ mums ir laiks balsošanai par šo rezolūciju nākamajā mazajā plenārsēdē šeit Briselē.Iemesls tāds, ka mēs esam saņēmuši dažus jaunus Eiropas Komisijas priekšlikumus, un varbūt ir iespējams uzlabot kādu rezolūcijas formulējumu.Termiņš bija ļoti īss, un tādēļ mēs gribam iegūt vairāk laika un balsot par to nākamajā sesijā Briselē. ","Piia-Noora Kauppi,",3,85,not_available,"['lav', 'lav', 'lav']","['  Piia-Noora Kauppi,  PPE-DE grupas vārdā. – Priekšsēdētāja kungs! Kā jau jūs teicāt, PPE-DE grupa vēlētos lūgt atlikt balsošanu par šo rezolūciju. Bez šaubām, Starptautiskās grāmatvedības standartu padomes pārvaldību nevar izlemt nākamajās divās nedēļās, tādēļ mums ir laiks balsošanai par šo rezolūciju nākamajā mazajā plenārsēdē šeit Briselē.', 'Iemesls tāds, ka mēs esam saņēmuši dažus jaunus Eiropas Komisijas priekšlikumus, un varbūt ir iespējams uzlabot kādu rezolūcijas formulējumu.', 'Termiņš bija ļoti īss, un tādēļ mēs gribam iegūt vairāk laika un balsot par to nākamajā sesijā Briselē. ']"
86, 7.8. IASCF: Struktūras pārskats - IASB pārskatatbildība un sastāvs - pārmaiņu ierosinājumi (balsošana) ,"  Pervenche Berès,  ECON komitejas priekšsēdētāja. – (FR) Priekšsēdētāja kungs, es runāju kā Ekonomikas un monetārās komitejas priekšsēdētāja. Pašreizējās finanšu krīzes laikā ikviens saprot, ka grāmatvedības standarti un to iespējamais cikliskums ir liela problēma. To struktūru pārvaldība, kuras izstrādā šos grāmatvedības standartus, ir ļoti svarīgs jautājums.Eiropas Komisija, kura jau risināja šos jautājumus A. Radwan ziņojumā, ir nolēmusi veidot priekšlikumu, kurā nav iesaistīti tie, kuri atbild par finanšu tirgus stabilitāti, priekšlikumu, kas tika veidots steigā kopā ar amerikāņu iestādēm – šo iestāžu pilnvaras bija galā, un tās noraidīja visi ASV prezidenta vēlēšanu kandidāti, – un neapspriežoties ar Padomi vai Eiropas Parlamentu.Kompromisa un atklātības vārdā mēs esam ar mieru atjaunot šo diskusiju, ja Komisija, savukārt, piekrīt pārskatīt šo priekšlikumu un uzklausīt Eiropas Parlamenta ierosinājumus. Tādēļ es gribētu, lai Komisija nāk klajā ar paziņojumu un apņemas pārskatīt šo priekšlikumu. Tādā gadījumā mēs varēsim atbalstīt Kauppi kundzes priekšlikumu. ","Pervenche Berès,",3,142,not_available,"['fra', 'fra', 'fra']","['  Pervenche Berès,  ECON komitejas priekšsēdētāja. – (FR) Priekšsēdētāja kungs, es runāju kā Ekonomikas un monetārās komitejas priekšsēdētāja. Pašreizējās finanšu krīzes laikā ikviens saprot, ka grāmatvedības standarti un to iespējamais cikliskums ir liela problēma. To struktūru pārvaldība, kuras izstrādā šos grāmatvedības standartus, ir ļoti svarīgs jautājums.', 'Eiropas Komisija, kura jau risināja šos jautājumus A. Radwan ziņojumā, ir nolēmusi veidot priekšlikumu, kurā nav iesaistīti tie, kuri atbild par finanšu tirgus stabilitāti, priekšlikumu, kas tika veidots steigā kopā ar amerikāņu iestādēm – šo iestāžu pilnvaras bija galā, un tās noraidīja visi ASV prezidenta vēlēšanu kandidāti, – un neapspriežoties ar Padomi vai Eiropas Parlamentu.', 'Kompromisa un atklātības vārdā mēs esam ar mieru atjaunot šo diskusiju, ja Komisija, savukārt, piekrīt pārskatīt šo priekšlikumu un uzklausīt Eiropas Parlamenta ierosinājumus. Tādēļ es gribētu, lai Komisija nāk klajā ar paziņojumu un apņemas pārskatīt šo priekšlikumu. Tādā gadījumā mēs varēsim atbalstīt Kauppi kundzes priekšlikumu. ']"
87, 7.8. IASCF: Struktūras pārskats - IASB pārskatatbildība un sastāvs - pārmaiņu ierosinājumi (balsošana) ,"  Androula Vassiliou,  Komisijas locekle. − Priekšsēdētāja kungs, Komisijai nav nostājas šajā jautājumā. ","Androula Vassiliou,",1,11,not_available,['lav'],"['  Androula Vassiliou,  Komisijas locekle. − Priekšsēdētāja kungs, Komisijai nav nostājas šajā jautājumā. ']"
88, 7.8. IASCF: Struktūras pārskats - IASB pārskatatbildība un sastāvs - pārmaiņu ierosinājumi (balsošana) ,"  Priekšsēdētājs. −   Komisija nav izteikusi viedokli.Berès kundze, vai es pareizi sapratu, ka jūs šajos apstākļos atbalstīsit šā priekšlikuma autori Kauppi kundzi? Tad  mēs balsosim par šo priekšlikumu.(Parlaments pieņēma priekšlikumu par balsošanas atlikšanu) ",Priekšsēdētājs. −,4,33,not_available,"['lav', 'lav', 'lav', 'lav']","['  Priekšsēdētājs. −   Komisija nav izteikusi viedokli.', 'Berès kundze, vai es pareizi sapratu, ka jūs šajos apstākļos atbalstīsit šā priekšlikuma autori Kauppi kundzi? ', 'Tad  mēs balsosim par šo priekšlikumu.', '(Parlaments pieņēma priekšlikumu par balsošanas atlikšanu) ']"
89, 7.9. Tiesību aktu pakete sociālajā jomā (balsojums) ,– Pirms balsošanas,unknown,1,2,not_available,['lav'],['– Pirms balsošanas']
90, 7.9. Tiesību aktu pakete sociālajā jomā (balsojums) ,"  Philip Bushill-Matthews,  PPE-DE grupas vārdā. – Priekšsēdētāja kungs! Vēlos tikai īsi apstiprināt, ka PPE-DE grupa ir atsaukusi savu rezolūciju par tiesību aktu paketi sociālajā jomā. Iepriekšējā sesijā mums bija ļoti vērienīgas diskusijas, kurās visas grupas ļoti plaši izteica savus viedokļus. Pa šo laiku mūsu grupa ir nodrošinājusi tiesības referēt par atjaunoto sociālo programmu, kas parāda, cik ārkārtīgi svarīgi mums ir sociālie jautājumi, un nākamajos mēnešos mēs ar prieku gaidām pārdomātus komentārus no visām politiskajām grupām, lai kopīgi izveidotu ziņojumu, ar kuru varētu lepoties viss Parlaments.(PPE-DE grupas aplausi) ","Philip Bushill-Matthews,",2,91,not_available,"['lav', 'lav']","['  Philip Bushill-Matthews,  PPE-DE grupas vārdā. – Priekšsēdētāja kungs! Vēlos tikai īsi apstiprināt, ka PPE-DE grupa ir atsaukusi savu rezolūciju par tiesību aktu paketi sociālajā jomā. Iepriekšējā sesijā mums bija ļoti vērienīgas diskusijas, kurās visas grupas ļoti plaši izteica savus viedokļus. Pa šo laiku mūsu grupa ir nodrošinājusi tiesības referēt par atjaunoto sociālo programmu, kas parāda, cik ārkārtīgi svarīgi mums ir sociālie jautājumi, un nākamajos mēnešos mēs ar prieku gaidām pārdomātus komentārus no visām politiskajām grupām, lai kopīgi izveidotu ziņojumu, ar kuru varētu lepoties viss Parlaments.', '(PPE-DE grupas aplausi) ']"
91, 8. Balsojumu skaidrojumi,"  Zuzana Roithová  (PPE-DE).   – (CS) Priekšsēdētāja kungs! Es tikai lūdzu reģistrēt, ka es balsoju par Foglietta kunga ziņojumu, taču mana balsošanas ierīce nedarbojās. ",Zuzana Roithová  (PPE-DE).,1,23,not_available,['cze'],"['  Zuzana Roithová  (PPE-DE).   – (CS) Priekšsēdētāja kungs! Es tikai lūdzu reģistrēt, ka es balsoju par Foglietta kunga ziņojumu, taču mana balsošanas ierīce nedarbojās. ']"
92, 8. Balsojumu skaidrojumi,Balsojuma mutiski skaidrojumi,Balsojuma mutiski skaidrojumi,1,3,not_available,['lav'],['Balsojuma mutiski skaidrojumi']
93, 8. Balsojumu skaidrojumi,"  Simon Busuttil  (PPE-DE).   – (MT) Protams, ir grūti panākt, lai tevi saprot šajā haotiskajā situācijā. Es lūdzu vārdu, lai paskaidrotu, kādēļ balsoju par tikko pieņemto rezolūciju par ikgadējo diskusija par panākto progresu brīvības, drošības un tiesiskuma telpas jomā. Šodien notiek Tieslietu un iekšlietu ministru padomes sanāksme, lai apspriestu un pieņemtu Eiropas Imigrācijas un patvēruma paktu. Padomē tiek apspriests ļoti svarīgs jautājums un ļoti svarīgs priekšlikums, un es ceru, ka pēc diskusijas, kas šodien notiek Padomē, paktā tiks iekļauta deklarācija par nepieciešamību taisnīgāk un vienlīdzīgāk sadalīt imigrācijas nastu. Ceru, ka ministri šodien pieņems šo paktu un ka tajā būs norāde uz šo kopīgo atbildību. ",Simon Busuttil  (PPE-DE).,1,103,not_available,['mlt'],"['  Simon Busuttil  (PPE-DE).   – (MT) Protams, ir grūti panākt, lai tevi saprot šajā haotiskajā situācijā. Es lūdzu vārdu, lai paskaidrotu, kādēļ balsoju par tikko pieņemto rezolūciju par ikgadējo diskusija par panākto progresu brīvības, drošības un tiesiskuma telpas jomā. Šodien notiek Tieslietu un iekšlietu ministru padomes sanāksme, lai apspriestu un pieņemtu Eiropas Imigrācijas un patvēruma paktu. Padomē tiek apspriests ļoti svarīgs jautājums un ļoti svarīgs priekšlikums, un es ceru, ka pēc diskusijas, kas šodien notiek Padomē, paktā tiks iekļauta deklarācija par nepieciešamību taisnīgāk un vienlīdzīgāk sadalīt imigrācijas nastu. Ceru, ka ministri šodien pieņems šo paktu un ka tajā būs norāde uz šo kopīgo atbildību. ']"
94, 8. Balsojumu skaidrojumi,SĒDI VADA: M. A. DOS SANTOS Priekšsēdētāja vietnieks,SĒDI VADA: M. A. DOS SANTOS,1,8,not_available,['lav'],['SĒDI VADA: M. A. DOS SANTOS Priekšsēdētāja vietnieks']
