,agenda_item,text,speaker,number_p,number_w,chair,language_ps,ps
24, 4. Tiesību aktu pakete sociālajā jomā (otrā daļa: pārrobežu veselības aprūpe) (debates) ,"  Jiří Maštálka  (GUE/NGL).   – (CS) Dāmas un kungi! Esmu pārliecināts, ka jūs zināt gaidāmās Čehijas prezidentūras lozungu „Eiropa bez barjerām”. Saistībā ar to es priecājos, ka Komisija sadarbībā ar Eiropas Kopienu Tiesu spēja izvirzīt priekšlikumu, kas lauž vienu no barjerām, proti, veselības aprūpes sniegšanu. Es atzinīgi vērtēju to, ka, pateicoties līdz šim notikušajām sarunām, iedzīvotāji ir nonākuši tuvāk risinājumam. Es kā ārsts vēlos, lai vajadzīgos dokumentus pieņem pēc iespējas drīzāk, tomēr es saprotu, ka šis jautājums ir tik sarežģīts, ka šeit īsti vietā ir senā romiešu paruna „Steidzies lēnām!”. Pašlaik, manuprāt, ir jāapspriež šādi galvenie jautājumi. Pirmkārt, mēs visi esam vienisprātis, ka ir jānodrošina to pacientu tiesiskā aizsardzība, kuriem ir tiesības uz veselības aprūpi Eiropas Savienībā, ievērojot Eiropas Kopienu Tiesas spriedumus. Otrkārt, šajā direktīvā nav iespējams noteikt jaunas atbildības jomas Komisijai, jo tās nav svarīgas. Treškārt, es uzskatu par kļūdu to, ka direktīvas teksts galvenokārt ir vērsts uz to pacientu pārvietošanos, kuriem nav vajadzīga neatliekama veselības aprūpe, kaut gan direktīvas galvenais mērķis bija nodrošināt medicīnas pakalpojumu brīvu apriti. Turpmākās debates dod iespēju ne tikai Čehijas prezidentūrai, bet arī Eiropai. ",Jiří Maštálka  (GUE/NGL).,1,179,not_available,['cze'],"['  Jiří Maštálka  (GUE/NGL).   – (CS) Dāmas un kungi! Esmu pārliecināts, ka jūs zināt gaidāmās Čehijas prezidentūras lozungu „Eiropa bez barjerām”. Saistībā ar to es priecājos, ka Komisija sadarbībā ar Eiropas Kopienu Tiesu spēja izvirzīt priekšlikumu, kas lauž vienu no barjerām, proti, veselības aprūpes sniegšanu. Es atzinīgi vērtēju to, ka, pateicoties līdz šim notikušajām sarunām, iedzīvotāji ir nonākuši tuvāk risinājumam. Es kā ārsts vēlos, lai vajadzīgos dokumentus pieņem pēc iespējas drīzāk, tomēr es saprotu, ka šis jautājums ir tik sarežģīts, ka šeit īsti vietā ir senā romiešu paruna „Steidzies lēnām!”. Pašlaik, manuprāt, ir jāapspriež šādi galvenie jautājumi. Pirmkārt, mēs visi esam vienisprātis, ka ir jānodrošina to pacientu tiesiskā aizsardzība, kuriem ir tiesības uz veselības aprūpi Eiropas Savienībā, ievērojot Eiropas Kopienu Tiesas spriedumus. Otrkārt, šajā direktīvā nav iespējams noteikt jaunas atbildības jomas Komisijai, jo tās nav svarīgas. Treškārt, es uzskatu par kļūdu to, ka direktīvas teksts galvenokārt ir vērsts uz to pacientu pārvietošanos, kuriem nav vajadzīga neatliekama veselības aprūpe, kaut gan direktīvas galvenais mērķis bija nodrošināt medicīnas pakalpojumu brīvu apriti. Turpmākās debates dod iespēju ne tikai Čehijas prezidentūrai, bet arī Eiropai. ']"
25, 4. Tiesību aktu pakete sociālajā jomā (otrā daļa: pārrobežu veselības aprūpe) (debates) ,"  Kathy Sinnott  (IND/DEM). -   Priekšsēdētāja kungs! Es gan ar prieku gaidu, gan baidos no pārrobežu veselības aprūpes direktīvas.Es to gaidu, jo pazīstu tik daudz cilvēku, kuri ir vēl smagāk sakropļoti, un tik daudz cilvēku, kuri ir miruši, jo viņiem nācās ilgi gaidīt ārstēšanu Īrijas valsts slimnīcās. Tāpēc doma, ka mani vēlētāji varēs ņemt savas slimības vēstures un ceļot bez pašreizējās iepriekšējās atļaujas – šķēršļa, ko rada E112 sistēma, – lai nekavējoties ārstētos, ir brīnišķīga. Es noteikti ieteikšu tā rīkoties tiem maniem vēlētājiem, kuri spēj ceļot.Taču es zinu arī to, ka tas saasinās problēmas Īrijas veselības aprūpes sistēmā, un es baidos par tiem, kuri nevar ceļot un kuriem ir jāpaļaujas uz šo veselības aprūpes sistēmu. ",Kathy Sinnott  (IND/DEM). -,3,114,not_available,"['lav', 'lav', 'lav']","['  Kathy Sinnott  (IND/DEM). -   Priekšsēdētāja kungs! Es gan ar prieku gaidu, gan baidos no pārrobežu veselības aprūpes direktīvas.', 'Es to gaidu, jo pazīstu tik daudz cilvēku, kuri ir vēl smagāk sakropļoti, un tik daudz cilvēku, kuri ir miruši, jo viņiem nācās ilgi gaidīt ārstēšanu Īrijas valsts slimnīcās. Tāpēc doma, ka mani vēlētāji varēs ņemt savas slimības vēstures un ceļot bez pašreizējās iepriekšējās atļaujas – šķēršļa, ko rada E112 sistēma, – lai nekavējoties ārstētos, ir brīnišķīga. Es noteikti ieteikšu tā rīkoties tiem maniem vēlētājiem, kuri spēj ceļot.', 'Taču es zinu arī to, ka tas saasinās problēmas Īrijas veselības aprūpes sistēmā, un es baidos par tiem, kuri nevar ceļot un kuriem ir jāpaļaujas uz šo veselības aprūpes sistēmu. ']"
26, 4. Tiesību aktu pakete sociālajā jomā (otrā daļa: pārrobežu veselības aprūpe) (debates) ,"  Gunnar Hökmark  (PPE-DE).   – (SV) Priekšsēdētāja kungs! Šis ir jautājums par personas tiesībām meklēt veselības aprūpi tur, kur ir pieejama laba aprūpe. Šodien Eiropas Apvienotās kreiso grupas pārstāve Eva-Britt Svensson šeit teica, ka tas radīs veselības aprūpes tūrismu. Es vēlētos viņai pateikt, ka tad, kad slimi cilvēki meklē aprūpi, viņi to dara tādēļ, ka viņiem sāp, viņi cieš, viņiem ir bojāta veselība, un viņiem vajadzīga aprūpe. Tam nav nekāda sakara ar tūrismu.Galu galā, tas ir jautājums par birokrātijas varas pretnostatījumu cilvēka tiesībām. Tas ir jautājums par to, vai vecās robežas ir jāizmanto kā barjeras cilvēkiem, kuri meklē veselības aprūpi, vai arī mūsdienu Eiropas atvērtība ir jāizmanto visiem Eiropas iedzīvotājiem, lai saņemtu vislabāko iespējamo aprūpi. Bija derīgi dzirdēt kreiso grupas domas, bet tā kā manā priekšā sēž sociāldemokrātu pārstāvis Jan Andersson, un viņš ir runātāju sarakstā tieši aiz manis, būtu interesanti dzirdēt, vai viņš piekrīt Eva-Britt Svensson viedoklim, ka slimi cilvēki, kuri lūdz aprūpi, nodarbojas ar veselības aprūpes tūrismu. Vai viņš tāpat kā Eva-Britt Svensson grib uzbūvēt dažādus šķēršļus, vai arī jūs, sociāldemokrāti, strādāsit, lai nodrošinātu mums iespējami vislielāko atvērtību, kad pacientiem nav jālūdz varas iestādēm atļauja ārstēties? Šis, Jan Andersson, ir jautājums par sociālu Eiropu. Runa ir nevis par to, kā atsevišķiem lēmējiem noteikt, ko citi drīkst darīt, bet gan par to, kā cilvēks var saņemt vislabāko veselības aprūpi. Jūsu kārta, Jan Andersson! ",Gunnar Hökmark  (PPE-DE).,2,227,not_available,"['swe', 'swe']","['  Gunnar Hökmark  (PPE-DE).   – (SV) Priekšsēdētāja kungs! Šis ir jautājums par personas tiesībām meklēt veselības aprūpi tur, kur ir pieejama laba aprūpe. Šodien Eiropas Apvienotās kreiso grupas pārstāve Eva-Britt Svensson šeit teica, ka tas radīs veselības aprūpes tūrismu. Es vēlētos viņai pateikt, ka tad, kad slimi cilvēki meklē aprūpi, viņi to dara tādēļ, ka viņiem sāp, viņi cieš, viņiem ir bojāta veselība, un viņiem vajadzīga aprūpe. Tam nav nekāda sakara ar tūrismu.', 'Galu galā, tas ir jautājums par birokrātijas varas pretnostatījumu cilvēka tiesībām. Tas ir jautājums par to, vai vecās robežas ir jāizmanto kā barjeras cilvēkiem, kuri meklē veselības aprūpi, vai arī mūsdienu Eiropas atvērtība ir jāizmanto visiem Eiropas iedzīvotājiem, lai saņemtu vislabāko iespējamo aprūpi. Bija derīgi dzirdēt kreiso grupas domas, bet tā kā manā priekšā sēž sociāldemokrātu pārstāvis Jan Andersson, un viņš ir runātāju sarakstā tieši aiz manis, būtu interesanti dzirdēt, vai viņš piekrīt Eva-Britt Svensson viedoklim, ka slimi cilvēki, kuri lūdz aprūpi, nodarbojas ar veselības aprūpes tūrismu. Vai viņš tāpat kā Eva-Britt Svensson grib uzbūvēt dažādus šķēršļus, vai arī jūs, sociāldemokrāti, strādāsit, lai nodrošinātu mums iespējami vislielāko atvērtību, kad pacientiem nav jālūdz varas iestādēm atļauja ārstēties? Šis, Jan Andersson, ir jautājums par sociālu Eiropu. Runa ir nevis par to, kā atsevišķiem lēmējiem noteikt, ko citi drīkst darīt, bet gan par to, kā cilvēks var saņemt vislabāko veselības aprūpi. Jūsu kārta, Jan Andersson! ']"
27, 4. Tiesību aktu pakete sociālajā jomā (otrā daļa: pārrobežu veselības aprūpe) (debates) ,"  Jan Andersson  (PSE).   – (SV) Priekšsēdētāja kungs, komisāres kundze! Atļaujiet man īpaši sveikt Bachelot-Narquin kundzi! Agrāk mēs labi sastrādājāmies, un es ceru, ka mēs to darīsim arī turpmāk. Laipni lūdzam Parlamentā! Īsa piezīme Hökmark kungam – šīs nav vietējās debates. Es nesaskaņoju savu viedokli ar Svensson kundzi, man labāk patīk veidot to pašam.Es atzinīgi vērtēju šo direktīvu vairāku iemeslu dēļ. Mums ir vajadzīga skaidrība tiesiskajā ziņā. Man šķiet, ka tā ir labāka nekā iepriekšējais projekts. Ievērojamas priekšrocības ir piešķirtas tieši tiem cilvēkiem, kuri dzīvo pierobežas apgabalos – tādiem kā es. Tādējādi es gribētu norādīt arī to, ka ir svarīgi piesaistīt šos regulējumus dažādām sistēmām visā Eiropā attiecībā uz organizāciju, finansējumu un tamlīdzīgiem aspektiem.Ir viens aspekts, kuram jāpievērš īpaša uzmanība. Tā ir vienlīdzība. Mēs zinām, ka veselības aprūpē pastāv prioritāšu noteikšana, tomēr ir svarīgi, lai visi cilvēki tiktu ārstēti vienlīdzīgi un lai kādam nebūtu priekšrocību līdzekļu dēļ, un ir svarīgi, lai mēs varētu apvienot šos aspektus pārrobežu aprūpē. Nozīmīgs ir arī jautājums par iepriekšēju atļauju. Šis jautājums ir jāapspriež turpmāk. Direktīvā noteiktais limits nav labs. Stacionārā aprūpe, nestacionārā aprūpe – atšķirības starp valstīm ir ievērojamas, un modelis laika gaitā mainās. Mums ir jāatrod citi kritēriji. Es ar prieku gaidu sadarbību. Mūsu komiteja nodarbosies ar sociālās drošības sistēmas finansējuma jautājumiem, kas ir daļa no šīs sadarbības. Es ceru uz sadarbību ar citām komitejām šajā jautājumā. ",Jan Andersson  (PSE).,3,222,not_available,"['swe', 'swe', 'swe']","['  Jan Andersson  (PSE).   – (SV) Priekšsēdētāja kungs, komisāres kundze! Atļaujiet man īpaši sveikt Bachelot-Narquin kundzi! Agrāk mēs labi sastrādājāmies, un es ceru, ka mēs to darīsim arī turpmāk. Laipni lūdzam Parlamentā! Īsa piezīme Hökmark kungam – šīs nav vietējās debates. Es nesaskaņoju savu viedokli ar Svensson kundzi, man labāk patīk veidot to pašam.', 'Es atzinīgi vērtēju šo direktīvu vairāku iemeslu dēļ. Mums ir vajadzīga skaidrība tiesiskajā ziņā. Man šķiet, ka tā ir labāka nekā iepriekšējais projekts. Ievērojamas priekšrocības ir piešķirtas tieši tiem cilvēkiem, kuri dzīvo pierobežas apgabalos – tādiem kā es. Tādējādi es gribētu norādīt arī to, ka ir svarīgi piesaistīt šos regulējumus dažādām sistēmām visā Eiropā attiecībā uz organizāciju, finansējumu un tamlīdzīgiem aspektiem.', 'Ir viens aspekts, kuram jāpievērš īpaša uzmanība. Tā ir vienlīdzība. Mēs zinām, ka veselības aprūpē pastāv prioritāšu noteikšana, tomēr ir svarīgi, lai visi cilvēki tiktu ārstēti vienlīdzīgi un lai kādam nebūtu priekšrocību līdzekļu dēļ, un ir svarīgi, lai mēs varētu apvienot šos aspektus pārrobežu aprūpē. Nozīmīgs ir arī jautājums par iepriekšēju atļauju. Šis jautājums ir jāapspriež turpmāk. Direktīvā noteiktais limits nav labs. Stacionārā aprūpe, nestacionārā aprūpe – atšķirības starp valstīm ir ievērojamas, un modelis laika gaitā mainās. Mums ir jāatrod citi kritēriji. Es ar prieku gaidu sadarbību. Mūsu komiteja nodarbosies ar sociālās drošības sistēmas finansējuma jautājumiem, kas ir daļa no šīs sadarbības. Es ceru uz sadarbību ar citām komitejām šajā jautājumā. ']"
28, 4. Tiesību aktu pakete sociālajā jomā (otrā daļa: pārrobežu veselības aprūpe) (debates) ,"  Anneli Jäätteenmäki  (ALDE). -  (FI) Priekšsēdētāja kungs! Pacientiem vissvarīgākais ir saņemt labu, drošu un lētu aprūpi, un visbiežāk viņi vēlas to saņemt iespējami tuvu mājām. Citiem vārdiem sakot, ir pienācīgi jāsniedz valsts veselības aprūpes pakalpojumi.Tomēr mums iesniegto Komisijas priekšlikumu vajadzētu vērtēt atzinīgi. Ir svarīgi, lai aprūpe un ārstēšana būtu pieejama arī citā valstī. Tas nodrošinātu lielāku izvēles brīvību, norādījumi un ieteikumi kļūtu skaidrāki, un vienlaikus noskaidrotos arī drošības un veselības jautājumi. Tātad pacientiem tas nāktu par labu.Dalībvalstīm šis jautājums ir mazliet sarežģītāks, jo direktīva nevar labi darboties, kamēr Eiropas Savienības dalībvalstu sociālās labklājības un veselības aprūpes elektroniskās sistēmas nav savstarpēji sakritīgas. Mēs zinām, ka pašlaik tās tādas nav, un direktīvas īstenošana dalībvalstīm prasīs daudz. Mums jānodrošina, lai tad, kad direktīva būs pieņemta, tas nozīmētu arī to, ka pacientu dati var brīvi pāriet no vienas sistēmas otrā un tiek garantēta informācijas aizsardzība un pacienta drošība. Pacients ir vissvarīgākais. ",Anneli Jäätteenmäki  (ALDE). -,3,148,not_available,"['fin', 'fin', 'fin']","['  Anneli Jäätteenmäki  (ALDE). -  (FI) Priekšsēdētāja kungs! Pacientiem vissvarīgākais ir saņemt labu, drošu un lētu aprūpi, un visbiežāk viņi vēlas to saņemt iespējami tuvu mājām. Citiem vārdiem sakot, ir pienācīgi jāsniedz valsts veselības aprūpes pakalpojumi.', 'Tomēr mums iesniegto Komisijas priekšlikumu vajadzētu vērtēt atzinīgi. Ir svarīgi, lai aprūpe un ārstēšana būtu pieejama arī citā valstī. Tas nodrošinātu lielāku izvēles brīvību, norādījumi un ieteikumi kļūtu skaidrāki, un vienlaikus noskaidrotos arī drošības un veselības jautājumi. Tātad pacientiem tas nāktu par labu.', 'Dalībvalstīm šis jautājums ir mazliet sarežģītāks, jo direktīva nevar labi darboties, kamēr Eiropas Savienības dalībvalstu sociālās labklājības un veselības aprūpes elektroniskās sistēmas nav savstarpēji sakritīgas. Mēs zinām, ka pašlaik tās tādas nav, un direktīvas īstenošana dalībvalstīm prasīs daudz. Mums jānodrošina, lai tad, kad direktīva būs pieņemta, tas nozīmētu arī to, ka pacientu dati var brīvi pāriet no vienas sistēmas otrā un tiek garantēta informācijas aizsardzība un pacienta drošība. Pacients ir vissvarīgākais. ']"
29, 4. Tiesību aktu pakete sociālajā jomā (otrā daļa: pārrobežu veselības aprūpe) (debates) ,"  Søren Bo Søndergaard  (GUE/NGL). -  (DA) Priekšsēdētāja kungs! Ceļš uz elli ir bruģēts ar labiem nodomiem, un nav jābūt profesoram, lai paredzētu, kāds rezultāts būs šim priekšlikumam tā pašreizējā formā. No vienas puses, būs „A komanda”, kurā tiks iekļauti turīgie, labi izglītotie un tie, kuriem ir tiesības uz sakariem – vispārēji runājot, viss šis Parlaments. Mēs varam apiet gaidītāju rindu mūsu dzimtajā valstī un izvēlēties ES labākos speciālistus – jo mēs varam atļauties tērēt naudu par ārstēšanu, mēs varam atļauties ceļojumu un citus papildu izdevumus. Otrajā pusē būs nabadzīgie un nepriviliģētie. Viņiem atļauts stāvēt rindas beigās, un kad beidzot pienāk viņu kārta, viņi saņem ārstēšanu, kuru mēs, bagātākie, neesam gribējuši. Īpašos gadījumos ES dēvē sevi par Amerikas Savienoto Valstu alternatīvu, taču lieta tāda, ka ES arvien vairāk līdzinās Amerikas Savienotajām Valstīm – tajā skaitā arī veselības aprūpes jomā. Mūsu grupa atbalsta cilvēku brīvu un vienlīdzīgu piekļuvi vajadzīgajai ārstēšanai, tādēļ mēs noraidām šo priekšlikumu. ",Søren Bo Søndergaard  (GUE/NGL). -,1,150,not_available,['dan'],"['  Søren Bo Søndergaard  (GUE/NGL). -  (DA) Priekšsēdētāja kungs! Ceļš uz elli ir bruģēts ar labiem nodomiem, un nav jābūt profesoram, lai paredzētu, kāds rezultāts būs šim priekšlikumam tā pašreizējā formā. No vienas puses, būs „A komanda”, kurā tiks iekļauti turīgie, labi izglītotie un tie, kuriem ir tiesības uz sakariem – vispārēji runājot, viss šis Parlaments. Mēs varam apiet gaidītāju rindu mūsu dzimtajā valstī un izvēlēties ES labākos speciālistus – jo mēs varam atļauties tērēt naudu par ārstēšanu, mēs varam atļauties ceļojumu un citus papildu izdevumus. Otrajā pusē būs nabadzīgie un nepriviliģētie. Viņiem atļauts stāvēt rindas beigās, un kad beidzot pienāk viņu kārta, viņi saņem ārstēšanu, kuru mēs, bagātākie, neesam gribējuši. Īpašos gadījumos ES dēvē sevi par Amerikas Savienoto Valstu alternatīvu, taču lieta tāda, ka ES arvien vairāk līdzinās Amerikas Savienotajām Valstīm – tajā skaitā arī veselības aprūpes jomā. Mūsu grupa atbalsta cilvēku brīvu un vienlīdzīgu piekļuvi vajadzīgajai ārstēšanai, tādēļ mēs noraidām šo priekšlikumu. ']"
30, 4. Tiesību aktu pakete sociālajā jomā (otrā daļa: pārrobežu veselības aprūpe) (debates) ,"  Alojz Peterle  (PPE-DE). -  (SL) Eiropas sociālā ainava ir mainījusies. Mēs sastopamies ar jauniem izaicinājumiem, kuriem vajadzīga Eiropas sociālā modeļa maiņa. Mainās arī Eiropas veselības aprūpes aina. Pieaug gan dažu slimību veiksmīgas izārstēšanas gadījumu skaits, gan pašreizējo veselības aprūpes sistēmu finansējums. Tomēr iedzīvotāji sastopas ar milzīgām atšķirībām veselības aprūpes kvalitātē gan starp dalībvalstīm, gan starp cilvēkiem. Vēža slimnieku izdzīvošanas gadījumu skaits dažādās dalībvalstīs atšķiras gandrīz par 10 %.Es atzinīgi vērtēju Eiropas Komisijas nodomu rūpīgāk izpētīt veselības aprūpes jautājumu saistībā ar atjaunoto sociālo programmu. Taču tajā pašā laikā man žēl, ka arvien pieaugošā uzmanība, kas pievērsta ar iedzīvotāju veselību saistītajām tiesībām, ir radusies tikai Eiropas Kopienu Tiesas sprieduma rezultātā. Es runāju kā cilvēks, kurš pats ir pārcietis vēzi un kurš zina gadījumus, kad vienā valstī pacientam pasaka „mēs neko vairs nevaram darīt jūsu labā”, bet viņš saņem efektīvu palīdzību citā valstī.Pārvietošanās brīvība nozīmē iespēju izvēlēties. Iespēja izvēlēties rada lielāku konkurenci un tādējādi arī labāku kvalitāti, un, iespējams, mazākus izdevumus. Esmu pārliecināts, ka direktīva par pacientu mobilitāti uzmundrinās Eiropu un tai būs labvēlīga ietekme daudzējādā ziņā. Mūsu kopīgais mērķis ir veselība visiem. Direktīva par pārrobežu veselības aprūpi, bez šaubām, nozīmē ciešāku tuvību ar iedzīvotājiem, kurus interesē ne tik daudz diskusijas par kompetences jomām, cik visīsākais ceļš uz veselību – protams, skaidri norādīts ceļš.Vislielākos panākumus gūst tāda Eiropas politika, kuru iedzīvotāji jūt savās kabatās, kā tas bija ar direktīvu par viesabonēšanu. Direktīvu par pārrobežu veselības aprūpi iedzīvotāji kabatā nejutīs, vismaz sākumā nē, taču viņiem būs lielāka izvēle par to pašu naudu. Un tā nav slikta sajūta it īpaši tad, ja tā ir saistīta ar veselību. ",Alojz Peterle  (PPE-DE). -,4,263,not_available,"['slv', 'slv', 'slv', 'slv']","['  Alojz Peterle  (PPE-DE). -  (SL) Eiropas sociālā ainava ir mainījusies. Mēs sastopamies ar jauniem izaicinājumiem, kuriem vajadzīga Eiropas sociālā modeļa maiņa. Mainās arī Eiropas veselības aprūpes aina. Pieaug gan dažu slimību veiksmīgas izārstēšanas gadījumu skaits, gan pašreizējo veselības aprūpes sistēmu finansējums. Tomēr iedzīvotāji sastopas ar milzīgām atšķirībām veselības aprūpes kvalitātē gan starp dalībvalstīm, gan starp cilvēkiem. Vēža slimnieku izdzīvošanas gadījumu skaits dažādās dalībvalstīs atšķiras gandrīz par 10 %.', 'Es atzinīgi vērtēju Eiropas Komisijas nodomu rūpīgāk izpētīt veselības aprūpes jautājumu saistībā ar atjaunoto sociālo programmu. Taču tajā pašā laikā man žēl, ka arvien pieaugošā uzmanība, kas pievērsta ar iedzīvotāju veselību saistītajām tiesībām, ir radusies tikai Eiropas Kopienu Tiesas sprieduma rezultātā. Es runāju kā cilvēks, kurš pats ir pārcietis vēzi un kurš zina gadījumus, kad vienā valstī pacientam pasaka „mēs neko vairs nevaram darīt jūsu labā”, bet viņš saņem efektīvu palīdzību citā valstī.', 'Pārvietošanās brīvība nozīmē iespēju izvēlēties. Iespēja izvēlēties rada lielāku konkurenci un tādējādi arī labāku kvalitāti, un, iespējams, mazākus izdevumus. Esmu pārliecināts, ka direktīva par pacientu mobilitāti uzmundrinās Eiropu un tai būs labvēlīga ietekme daudzējādā ziņā. Mūsu kopīgais mērķis ir veselība visiem. Direktīva par pārrobežu veselības aprūpi, bez šaubām, nozīmē ciešāku tuvību ar iedzīvotājiem, kurus interesē ne tik daudz diskusijas par kompetences jomām, cik visīsākais ceļš uz veselību – protams, skaidri norādīts ceļš.', 'Vislielākos panākumus gūst tāda Eiropas politika, kuru iedzīvotāji jūt savās kabatās, kā tas bija ar direktīvu par viesabonēšanu. Direktīvu par pārrobežu veselības aprūpi iedzīvotāji kabatā nejutīs, vismaz sākumā nē, taču viņiem būs lielāka izvēle par to pašu naudu. Un tā nav slikta sajūta it īpaši tad, ja tā ir saistīta ar veselību. ']"
31, 4. Tiesību aktu pakete sociālajā jomā (otrā daļa: pārrobežu veselības aprūpe) (debates) ,"  Evelyne Gebhardt  (PSE). -  (DE) Priekšsēdētāja kungs, ministres kundze, komisāres kundze! Runājot par sociālu Eiropu, mums vienmēr jāizvirza priekšplānā cilvēki un viņu rūpes. Izvirzīt priekšplānā nozīmē – mūsu galvenajai prioritātei ir jābūt veselības aprūpes sistēmai, kas nodrošina cilvēkiem iespējami labāko aprūpi uz vietas. Tā ir pirmā prioritāte. Tas ir nosacījums, kam ir jābūt mūsu pieejas pamatā šai direktīvai.Tomēr pastāv daudzi citi apsvērumi, kuriem arī vajadzīgi citi risinājumi vai nu tāpēc, ka cilvēki ceļo vai strādā citās valstīs, vai tāpēc, ka viņiem ir retāk sastopamas slimības, vai tāpēc, ka viņi saņems labāku aprūpi citās valstīs. Tas nozīmē, ka šādos gadījumos ir jālikvidē šķēršļi mobilitātei un jānodrošina tiesiskās noteiktības izveide. Tā ir otrā prioritāte.Trešā prioritāte – mums atkal un atkal ir jāatceras, ka saskaņā ar Eiropas līgumiem veselības aprūpe dalībvalstīs ir dalībvalstu iekšējā lieta, un mums tas ir jārespektē. Citiem vārdiem sakot, dalībvalstis ir atbildīgas par veselības aprūpes sistēmu organizāciju un finansējumu, un mūsu tiesību akti nevar darīt neko, lai to mainītu. Tas nav iespējams, mēs to nevaram, un mums nav nodoma to darīt, ja vien mēs kādreiz nākotnē nevienosimies par kopējas veselības politikas izveidi. Tas būtu ideālais scenārijs, taču baidos, ka mēs vēl esam ļoti tālu no tā, lai spertu šādu soli. ",Evelyne Gebhardt  (PSE). -,3,200,not_available,"['ger', 'ger', 'ger']","['  Evelyne Gebhardt  (PSE). -  (DE) Priekšsēdētāja kungs, ministres kundze, komisāres kundze! Runājot par sociālu Eiropu, mums vienmēr jāizvirza priekšplānā cilvēki un viņu rūpes. Izvirzīt priekšplānā nozīmē – mūsu galvenajai prioritātei ir jābūt veselības aprūpes sistēmai, kas nodrošina cilvēkiem iespējami labāko aprūpi uz vietas. Tā ir pirmā prioritāte. Tas ir nosacījums, kam ir jābūt mūsu pieejas pamatā šai direktīvai.', 'Tomēr pastāv daudzi citi apsvērumi, kuriem arī vajadzīgi citi risinājumi vai nu tāpēc, ka cilvēki ceļo vai strādā citās valstīs, vai tāpēc, ka viņiem ir retāk sastopamas slimības, vai tāpēc, ka viņi saņems labāku aprūpi citās valstīs. Tas nozīmē, ka šādos gadījumos ir jālikvidē šķēršļi mobilitātei un jānodrošina tiesiskās noteiktības izveide. Tā ir otrā prioritāte.', 'Trešā prioritāte – mums atkal un atkal ir jāatceras, ka saskaņā ar Eiropas līgumiem veselības aprūpe dalībvalstīs ir dalībvalstu iekšējā lieta, un mums tas ir jārespektē. Citiem vārdiem sakot, dalībvalstis ir atbildīgas par veselības aprūpes sistēmu organizāciju un finansējumu, un mūsu tiesību akti nevar darīt neko, lai to mainītu. Tas nav iespējams, mēs to nevaram, un mums nav nodoma to darīt, ja vien mēs kādreiz nākotnē nevienosimies par kopējas veselības politikas izveidi. Tas būtu ideālais scenārijs, taču baidos, ka mēs vēl esam ļoti tālu no tā, lai spertu šādu soli. ']"
