,agenda_item,text,speaker,number_p,number_w,chair,language_ps,ps
197, 19. Vienas minūtes runas par politiski svarīgiem jautājumiem,"  Kyriacos Triantaphyllides  (GUE/NGL).   – Priekšsēdētājas kundze! Es šodien lūdzu vārdu, lai informētu jūs par diezgan traucējošu faktu, par kuru es uzzināju, viesojoties Vašingtonā Pilsoņu brīvību, tieslietu un iekšlietu komitejas delegācijas sastāvā.Balansējot uz esošo transatlantijas sarunu par datu aizsardzību (SWIFT, PRN) robežas, Savienotās Valstis paplašina savas Nacionālās drošības aģentūras datu vākšanas iespējas tā, lai pārtvertu visus elektroniskos ziņojumus tās teritorijā, kā arī saņemtos un nosūtītos ziņojumus.Kā ASV var izlikties, ka tā ievēro tiesības uz privāto dzīvi, ja tā veido milzīgu slepenas noklausīšanās aģentūru, un kā mēs varam vienkārši sēdēt malā un ļaut tam notikt?Mūsu pienākums ir informēt par šo rupjo varas ļaunprātīgo izmantošanu un mūsu pamattiesību pārkāpšanu. Es ceru, ka jūs man palīdzēsiet par to informēt mūsu vēlētājus un pilsoņus mūsu zemēs ar deklarāciju un rakstu palīdzību presē. ",Kyriacos Triantaphyllides  (GUE/NGL).,4,130,not_available,"['lav', 'lav', 'lav', 'lav']","['  Kyriacos Triantaphyllides  (GUE/NGL).   – Priekšsēdētājas kundze! Es šodien lūdzu vārdu, lai informētu jūs par diezgan traucējošu faktu, par kuru es uzzināju, viesojoties Vašingtonā Pilsoņu brīvību, tieslietu un iekšlietu komitejas delegācijas sastāvā.', 'Balansējot uz esošo transatlantijas sarunu par datu aizsardzību (SWIFT, PRN) robežas, Savienotās Valstis paplašina savas Nacionālās drošības aģentūras datu vākšanas iespējas tā, lai pārtvertu visus elektroniskos ziņojumus tās teritorijā, kā arī saņemtos un nosūtītos ziņojumus.', 'Kā ASV var izlikties, ka tā ievēro tiesības uz privāto dzīvi, ja tā veido milzīgu slepenas noklausīšanās aģentūru, un kā mēs varam vienkārši sēdēt malā un ļaut tam notikt?', 'Mūsu pienākums ir informēt par šo rupjo varas ļaunprātīgo izmantošanu un mūsu pamattiesību pārkāpšanu. Es ceru, ka jūs man palīdzēsiet par to informēt mūsu vēlētājus un pilsoņus mūsu zemēs ar deklarāciju un rakstu palīdzību presē. ']"
198, 19. Vienas minūtes runas par politiski svarīgiem jautājumiem,"  Nick Griffin  (NI).   – Priekšsēdētājas kundze! Pēdējos divos mēnešos es esmu kļuvis par upuri Apvienotās Karalistes leiboristu režīmam, tostarp man atņēma manu Apakšnama caurlaidi, atteica ieeju Sellafīldas kodoldegvielas pārstrādes rūpnīcā, neskatoties uz manu amatu Vides, sabiedrības veselības un pārtikas drošības komitejas apakškomitejā, un Pilsoņu konsultāciju birojs man atteicās pārdot informācijas datu bāzi, kas tika atklāti reklamēta pārdošanai visiem pārējiem Parlamenta deputātiem.Priekšsēdētājas kundze! Vai jūs piekristu, ka politiska diskriminācija ir ne tikai nelikumīga, bet uzskatāma gan par uzbrukumu man personīgi, gan šīs vietas funkcionalitātei un, vissvarīgāk, vēlētājiem un visam demokrātijas procesam? ",Nick Griffin  (NI).,2,90,not_available,"['lav', 'lav']","['  Nick Griffin  (NI).   – Priekšsēdētājas kundze! Pēdējos divos mēnešos es esmu kļuvis par upuri Apvienotās Karalistes leiboristu režīmam, tostarp man atņēma manu Apakšnama caurlaidi, atteica ieeju Sellafīldas kodoldegvielas pārstrādes rūpnīcā, neskatoties uz manu amatu Vides, sabiedrības veselības un pārtikas drošības komitejas apakškomitejā, un Pilsoņu konsultāciju birojs man atteicās pārdot informācijas datu bāzi, kas tika atklāti reklamēta pārdošanai visiem pārējiem Parlamenta deputātiem.', 'Priekšsēdētājas kundze! Vai jūs piekristu, ka politiska diskriminācija ir ne tikai nelikumīga, bet uzskatāma gan par uzbrukumu man personīgi, gan šīs vietas funkcionalitātei un, vissvarīgāk, vēlētājiem un visam demokrātijas procesam? ']"
199, 19. Vienas minūtes runas par politiski svarīgiem jautājumiem,"  João Ferreira  (GUE/NGL)   – (PT) Eiropas Darba drošības un veselības aizsardzības aģentūras veiktajā pētījumā ir izdarīti daži satraucoši secinājumi — ir norādīts, ka vispārējam bezdarbam, ir negatīvas sekas uz darba ņēmēju drošību un veselību. Atbilstoši šim pētījumam, kurā tika aptaujāti 27 000 respondentu 28 dalībvalstīs, seši no katriem 10 darba ņēmējiem uzskata, ka ekonomikas krīzes un pieaugošā bezdarba dēļ pasliktinās darba apstākļi. 75 % respondentu apgalvoja, ka viņu veselības stāvokļa pasliktināšanās iemesls ir viņu darbs. Šī informācija apstiprina datus, kas tika iegūti Eiropas Kopienu Statistikas biroja pētījumā, kas liecina, ka 27 miljoni darba ņēmēju cieš nelaimes gadījumos vai slimo ar arodslimībām un ka ikdienā riskam ir pakļauti 137 miljoni darba ņēmēju. Tieši šonedēļ vēl vienā nopietnā nelaimes gadījumā darbā Andorā gāja bojā pieci portugāļu strādnieki.Uz šo situāciju ir ātri jāreaģē gan Eiropas Savienībai, gan dalībvalstīm. Atbildes reakcijai jāietver tādu darbavietu radīšana, kurās strādājošajiem būtu tiesības, darba un darba ņēmēju stimulēšana un sodi tiem darba devējiem, kas samazina profilakses un aizsardzības pasākumus darba ņēmējiem, lai palielinātu savu peļņu. ",João Ferreira  (GUE/NGL),2,166,not_available,"['por', 'por']","['  João Ferreira  (GUE/NGL)   – (PT) Eiropas Darba drošības un veselības aizsardzības aģentūras veiktajā pētījumā ir izdarīti daži satraucoši secinājumi — ir norādīts, ka vispārējam bezdarbam, ir negatīvas sekas uz darba ņēmēju drošību un veselību. Atbilstoši šim pētījumam, kurā tika aptaujāti 27 000 respondentu 28 dalībvalstīs, seši no katriem 10 darba ņēmējiem uzskata, ka ekonomikas krīzes un pieaugošā bezdarba dēļ pasliktinās darba apstākļi. 75 % respondentu apgalvoja, ka viņu veselības stāvokļa pasliktināšanās iemesls ir viņu darbs. Šī informācija apstiprina datus, kas tika iegūti Eiropas Kopienu Statistikas biroja pētījumā, kas liecina, ka 27 miljoni darba ņēmēju cieš nelaimes gadījumos vai slimo ar arodslimībām un ka ikdienā riskam ir pakļauti 137 miljoni darba ņēmēju. Tieši šonedēļ vēl vienā nopietnā nelaimes gadījumā darbā Andorā gāja bojā pieci portugāļu strādnieki.', 'Uz šo situāciju ir ātri jāreaģē gan Eiropas Savienībai, gan dalībvalstīm. Atbildes reakcijai jāietver tādu darbavietu radīšana, kurās strādājošajiem būtu tiesības, darba un darba ņēmēju stimulēšana un sodi tiem darba devējiem, kas samazina profilakses un aizsardzības pasākumus darba ņēmējiem, lai palielinātu savu peļņu. ']"
200, 19. Vienas minūtes runas par politiski svarīgiem jautājumiem,"  Priekšsēdētāja. -   Radās neskaidrības, kam tiek piešķirts mikrofons. Man vajadzēja dot vārdu Teixeira kungam. Iespējams, es nepareizi izrunāju jūsu vārdu un tādēļ radās sajukums. ",Priekšsēdētāja. -,1,23,not_available,['lav'],"['  Priekšsēdētāja. -   Radās neskaidrības, kam tiek piešķirts mikrofons. Man vajadzēja dot vārdu Teixeira kungam. Iespējams, es nepareizi izrunāju jūsu vārdu un tādēļ radās sajukums. ']"
201, 19. Vienas minūtes runas par politiski svarīgiem jautājumiem,"  Nuno Teixeira  (PPE).   – (PT) Eiropas Komisija nesen iesniedza projektu paziņojumam par budžeta reformu, kurā bija atsauces uz kohēzijas politiku, kas radīja bažas un apjukumu, jo īpaši attiecībā uz attālākajiem reģioniem.Steidzami jārīko debates par Kopienas budžetu, bet es uzskatu, ka pēc 2013. gada finanšu shēmas pamatā jābūt solidaritātei un teritoriālajai kohēzijai, un tas ir būtiski svarīgi tādiem reģioniem kā Madeira, kuriem pastāvīgi rodas grūtības un tādēļ vajadzīgs pastāvīgs atbalsts.Ir nepieņemams nodoms mainīt kohēzijas politikas uzsvaru no pašreizējās reģionāli pamatotās pieejas uz pieeju, kuras pamatā būtu pievienotās vērtības sektori. Šādu izmaiņu dēļ tiktu iznīcināts 2. mērķis, no kura pašlaik labumu gūst aptuveni divas trešdaļas Eiropas reģionu.Ir nesaprotami, kāpēc Komisija ir nodomājusi līdzekļus piešķirt nevis reģioniem, bet valstīm, vai pat Eiropas līmenī, atsakoties no tuvuma kritērija, kas vienmēr ir bijis kohēzijas politikas pamatā. Ir nepieļaujami, ka ilggadēja ES dalībvalsts būs mainīgais lielums struktūrfondu piešķīrumu aprēķināšanas formulā, dalot dalībvalstis jaunajās un vecajās dalībvalstīs, tādējādi EK līguma 299. panta 2. punkts zaudētu jēgu attiecībā uz struktūrfondu pieejamību attālākajiem reģioniem. ",Nuno Teixeira  (PPE).,4,167,not_available,"['por', 'por', 'por', 'por']","['  Nuno Teixeira  (PPE).   – (PT) Eiropas Komisija nesen iesniedza projektu paziņojumam par budžeta reformu, kurā bija atsauces uz kohēzijas politiku, kas radīja bažas un apjukumu, jo īpaši attiecībā uz attālākajiem reģioniem.', 'Steidzami jārīko debates par Kopienas budžetu, bet es uzskatu, ka pēc 2013. gada finanšu shēmas pamatā jābūt solidaritātei un teritoriālajai kohēzijai, un tas ir būtiski svarīgi tādiem reģioniem kā Madeira, kuriem pastāvīgi rodas grūtības un tādēļ vajadzīgs pastāvīgs atbalsts.', 'Ir nepieņemams nodoms mainīt kohēzijas politikas uzsvaru no pašreizējās reģionāli pamatotās pieejas uz pieeju, kuras pamatā būtu pievienotās vērtības sektori. Šādu izmaiņu dēļ tiktu iznīcināts 2. mērķis, no kura pašlaik labumu gūst aptuveni divas trešdaļas Eiropas reģionu.', 'Ir nesaprotami, kāpēc Komisija ir nodomājusi līdzekļus piešķirt nevis reģioniem, bet valstīm, vai pat Eiropas līmenī, atsakoties no tuvuma kritērija, kas vienmēr ir bijis kohēzijas politikas pamatā. Ir nepieļaujami, ka ilggadēja ES dalībvalsts būs mainīgais lielums struktūrfondu piešķīrumu aprēķināšanas formulā, dalot dalībvalstis jaunajās un vecajās dalībvalstīs, tādējādi EK līguma 299. panta 2. punkts zaudētu jēgu attiecībā uz struktūrfondu pieejamību attālākajiem reģioniem. ']"
202, 19. Vienas minūtes runas par politiski svarīgiem jautājumiem,"  Estelle Grelier  (S&D).   – (FR) Priekšsēdētājas kundze! Es esmu Parlamenta deputāte no Normandijas, tādēļ es vēlos pievērst Komisijas un Parlamenta uzmanību priekšlikumiem par Natura 2000 teritorijām jūras piekrastes zonā, kuru Francijas valdība tikko iesniedza Eiropas iestādēm. Šajos priekšlikumos nav iekļauts Antifer dambis pie Etretat, bet, to kompensējot, perimetrs ir pagarināts par 12 jūras jūdzēm.Šis lēmums atvieglo Poweo metāna termināla uzstādīšanu Antifer un nosaka ierobežojumus projektam, kas paredz izveidot piekrasta vēja ģeneratoru pie Fēkānas, neskatoties uz atbalstu, ko šim projektam izteica vietējie ievēlētie pārstāvji, iedzīvotāji un pat zvejnieki. Šim reģionam ir izstrādāts zinātnisks un konsekvents priekšlikums, kuru atbalsta vietējie uzņēmumi. Saskaņā ar šo priekšlikumu gar visu krasta līniju, tostarp gar Antifer, tiks izveidota sešas jūdzes plata zona.Man ir trīs jautājumi. Cik tālu Komisija ir pavirzījusies, izskatot zonēšanas priekšlikumus? Vai tā apstiprina tos, kaut arī tie ir pretrunā ar zinātniskiem atzinumiem un reģiona sabiedriskajiem, ekonomikas un kultūras pasākumiem? Vai, ņemot vērā gaidāmo Kopenhāgenas augstākā līmeņa sanāksmi, Eiropa var pamatoti apstiprināt lēmumu, kas vecina gāzes izmantošanu, nevis paredz attīstīt atjaunojamo enerģiju? ",Estelle Grelier  (S&D).,3,170,not_available,"['fra', 'fra', 'fra']","['  Estelle Grelier  (S&D).   – (FR) Priekšsēdētājas kundze! Es esmu Parlamenta deputāte no Normandijas, tādēļ es vēlos pievērst Komisijas un Parlamenta uzmanību priekšlikumiem par Natura 2000 teritorijām jūras piekrastes zonā, kuru Francijas valdība tikko iesniedza Eiropas iestādēm. Šajos priekšlikumos nav iekļauts Antifer dambis pie Etretat, bet, to kompensējot, perimetrs ir pagarināts par 12 jūras jūdzēm.', 'Šis lēmums atvieglo Poweo metāna termināla uzstādīšanu Antifer un nosaka ierobežojumus projektam, kas paredz izveidot piekrasta vēja ģeneratoru pie Fēkānas, neskatoties uz atbalstu, ko šim projektam izteica vietējie ievēlētie pārstāvji, iedzīvotāji un pat zvejnieki. Šim reģionam ir izstrādāts zinātnisks un konsekvents priekšlikums, kuru atbalsta vietējie uzņēmumi. Saskaņā ar šo priekšlikumu gar visu krasta līniju, tostarp gar Antifer, tiks izveidota sešas jūdzes plata zona.', 'Man ir trīs jautājumi. Cik tālu Komisija ir pavirzījusies, izskatot zonēšanas priekšlikumus? Vai tā apstiprina tos, kaut arī tie ir pretrunā ar zinātniskiem atzinumiem un reģiona sabiedriskajiem, ekonomikas un kultūras pasākumiem? Vai, ņemot vērā gaidāmo Kopenhāgenas augstākā līmeņa sanāksmi, Eiropa var pamatoti apstiprināt lēmumu, kas vecina gāzes izmantošanu, nevis paredz attīstīt atjaunojamo enerģiju? ']"
203, 19. Vienas minūtes runas par politiski svarīgiem jautājumiem,"  Elżbieta Katarzyna Łukacijewska  (PPE).   – (PL) Priekšsēdētājas kundze! Es vēlos pievērst uzmanību veselības stāvoklim Ukrainā. Pieejamie dati parāda, ka ir ziņots par vairāk nekā miljonu saslimšanas ar gripu gadījumu, tostarp vairāki desmiti saslimšanas ar AH1N1 vīrusu. Ukraina ir lūgusi starptautisko atbalstu, konkrētāk, vakcīnām, zālēm, dezinfekcijas līdzekļiem, maskām, cimdiem un laboratorijas materiāliem.Mēs zinām, ka Komisija ir izveidojusi īpašu civilā atbalsta mehānismu, uzraudzības un informācijas centru, lai koordinētu atbalstu, ko ES valstis sniedz Ukrainai. Kāda ir šī koordinācija? Kāds atbalsts tiek sniegts? Kā darbojas uzraudzības sistēma? Uz uzskatu, ka sabiedrība vēlētos saņemt atbildes uz šiem jautājumiem. ",Elżbieta Katarzyna Łukacijewska  (PPE).,2,94,not_available,"['pol', 'pol']","['  Elżbieta Katarzyna Łukacijewska  (PPE).   – (PL) Priekšsēdētājas kundze! Es vēlos pievērst uzmanību veselības stāvoklim Ukrainā. Pieejamie dati parāda, ka ir ziņots par vairāk nekā miljonu saslimšanas ar gripu gadījumu, tostarp vairāki desmiti saslimšanas ar AH1N1 vīrusu. Ukraina ir lūgusi starptautisko atbalstu, konkrētāk, vakcīnām, zālēm, dezinfekcijas līdzekļiem, maskām, cimdiem un laboratorijas materiāliem.', 'Mēs zinām, ka Komisija ir izveidojusi īpašu civilā atbalsta mehānismu, uzraudzības un informācijas centru, lai koordinētu atbalstu, ko ES valstis sniedz Ukrainai. Kāda ir šī koordinācija? Kāds atbalsts tiek sniegts? Kā darbojas uzraudzības sistēma? Uz uzskatu, ka sabiedrība vēlētos saņemt atbildes uz šiem jautājumiem. ']"
204, 19. Vienas minūtes runas par politiski svarīgiem jautājumiem,"  Kinga Gál  (PPE).   – (HU) Priekšsēdētājas kundze, dāmas un kungi! Ir pagājuši 20 gadi kopš Berlīnes mūra sabrukuma, kura 20. gadadienu mēs atzīmējām, un kopš Dzelzs priekškara noraušanas. Tomēr par šiem 20 gadiem ir maz ko parādīt, jo daudzās valstīs, kas atbrīvotas no komunisma, mēs joprojām neesam pilnībā atbrīvojušies no agrākās sistēmas ieradumiem.2006. gada rudenī policija pilnībā ignorēja tiesības uz brīvu pulcēšanos Budapeštas ielās, kā arī tiesības uz taisnīgu tiesu. Šā pasākuma upuri joprojām nesekmīgi meklē taisnīgumu un iespēju īstenot savas tiesības. Šā gada martā Budapeštā uz pieprasījumu ministru prezidentam iznākt laukā atbildēja ar aizturēšanu un nehumānu, pazemojošu attieksmi. Pat šodien Eiropas Savienībā joprojām var notikt tā, ka cilvēkiem neatļauj lietot viņu valodu dzimtajā zemē, piemēram, Slovākijā, vai īstenot tiesības, ko nodrošina demokrātija, ja vēsturiski viņiem ir noteikts minoritātes liktenis. Palūkosimies arī uz Rumāniju, kur viņi gatavojas uzstādīt statuju agrākajam ģenerālim, kurš izdeva pavēli atklāt uguni uz demonstrantiem. ",Kinga Gál  (PPE).,2,148,not_available,"['hun', 'hun']","['  Kinga Gál  (PPE).   – (HU) Priekšsēdētājas kundze, dāmas un kungi! Ir pagājuši 20 gadi kopš Berlīnes mūra sabrukuma, kura 20. gadadienu mēs atzīmējām, un kopš Dzelzs priekškara noraušanas. Tomēr par šiem 20 gadiem ir maz ko parādīt, jo daudzās valstīs, kas atbrīvotas no komunisma, mēs joprojām neesam pilnībā atbrīvojušies no agrākās sistēmas ieradumiem.', '2006. gada rudenī policija pilnībā ignorēja tiesības uz brīvu pulcēšanos Budapeštas ielās, kā arī tiesības uz taisnīgu tiesu. Šā pasākuma upuri joprojām nesekmīgi meklē taisnīgumu un iespēju īstenot savas tiesības. Šā gada martā Budapeštā uz pieprasījumu ministru prezidentam iznākt laukā atbildēja ar aizturēšanu un nehumānu, pazemojošu attieksmi. Pat šodien Eiropas Savienībā joprojām var notikt tā, ka cilvēkiem neatļauj lietot viņu valodu dzimtajā zemē, piemēram, Slovākijā, vai īstenot tiesības, ko nodrošina demokrātija, ja vēsturiski viņiem ir noteikts minoritātes liktenis. Palūkosimies arī uz Rumāniju, kur viņi gatavojas uzstādīt statuju agrākajam ģenerālim, kurš izdeva pavēli atklāt uguni uz demonstrantiem. ']"
205, 19. Vienas minūtes runas par politiski svarīgiem jautājumiem,"  José Manuel Fernandes  (PPE).   – (PT) Pašreizējās ekonomiskās krīzes dēļ ir radusies nedrošība par darbavietu. Ekonomiskas grūtības spiež darba ņēmējus piekrist, dažreiz akli, tādu darba devēju darba piedāvājumiem, kuri neievēro darba tiesību aktus un izvairās no tiesību aizsardzības iestāžu un valdības iestāžu pārraudzības. Diemžēl mēs Eiropas Savienībā jau esam pieredzējuši vairākus darbaspēka izmantošanas gadījumus, kas bieži vien ir īsta verdzība neatkarīgi no tā, vai tā vērsta pret Eiropas pilsoņiem vai ārpuseiropas valstu pilsoņiem. Turklāt mēs esam pieredzējuši neparasti augstu migrējošo darba ņēmēju, tostarp daudzu manu tautiešu un daudzu Portugāles pilsoņu, nāves gadījumu skaitu pat, ja tie bijuši nodarbināti legāli. Šie nelaimes gadījumi ir notikuši darbavietā un jo īpaši civilās būvniecības sektorā.Tādēļ es mudinu un aicinu Eiropas Savienību un tās iestādes, kā arī visas dalībvalstis aktīvi un efektīvi sadarboties, lai nepieļautu šādas situācijas. ",José Manuel Fernandes  (PPE).,2,132,not_available,"['por', 'por']","['  José Manuel Fernandes  (PPE).   – (PT) Pašreizējās ekonomiskās krīzes dēļ ir radusies nedrošība par darbavietu. Ekonomiskas grūtības spiež darba ņēmējus piekrist, dažreiz akli, tādu darba devēju darba piedāvājumiem, kuri neievēro darba tiesību aktus un izvairās no tiesību aizsardzības iestāžu un valdības iestāžu pārraudzības. Diemžēl mēs Eiropas Savienībā jau esam pieredzējuši vairākus darbaspēka izmantošanas gadījumus, kas bieži vien ir īsta verdzība neatkarīgi no tā, vai tā vērsta pret Eiropas pilsoņiem vai ārpuseiropas valstu pilsoņiem. Turklāt mēs esam pieredzējuši neparasti augstu migrējošo darba ņēmēju, tostarp daudzu manu tautiešu un daudzu Portugāles pilsoņu, nāves gadījumu skaitu pat, ja tie bijuši nodarbināti legāli. Šie nelaimes gadījumi ir notikuši darbavietā un jo īpaši civilās būvniecības sektorā.', 'Tādēļ es mudinu un aicinu Eiropas Savienību un tās iestādes, kā arī visas dalībvalstis aktīvi un efektīvi sadarboties, lai nepieļautu šādas situācijas. ']"
206, 19. Vienas minūtes runas par politiski svarīgiem jautājumiem,"  Sophie Briard Auconie  (PPE).   – (FR) Priekšsēdētājas kundze, dāmas un kungi! Es vēlos skandināt trauksmes zvanu attiecībā uz ERAF, ESF un kohēzijas fonda piešķīrumu lēno plānošanas un izmaksu tempu.Mēs joprojām neesam saplānojuši pat ne tuvu pusei no visiem pieejamiem līdzekļiem. Runājot par maksājumiem, projektu vadītājiem ir izmaksāti tikai 9,62 % no EUR 347 miljardiem, kas piešķirti reģionālajai politikai. Tas skar visas valstis, dažas pat vēl vairāk nekā citas. Runājot par Eiropas fondu maksājumiem, Spānijai, Luksemburgai un Zviedrijai ir jādara viss iespējamais, lai panāktu vadošās valstis, piemēram, Baltijas valstis, Īriju un Slovēniju.Eiropas Savienības reģionālā politika ir viena no vislietderīgākajām politikām mūsu līdzpilsoņiem. Patiešām, tā garantē ekonomisku, sociālu un teritoriālu kohēziju, līdzfinansējot praktiskus un ļoti bieži būtiski svarīgus projektus.Tāpēc es aicinu valstu pārvaldes iestādes iesaistīties. Tajā pašā laikā es uzskatu, ka ir būtiski svarīgi, lai ekonomiskās krīzes laikā Eiropas noteikumi tiktu pielāgoti lielākajām problēmām. ",Sophie Briard Auconie  (PPE).,4,144,not_available,"['fra', 'fra', 'fra', 'fra']","['  Sophie Briard Auconie  (PPE).   – (FR) Priekšsēdētājas kundze, dāmas un kungi! Es vēlos skandināt trauksmes zvanu attiecībā uz ERAF, ESF un kohēzijas fonda piešķīrumu lēno plānošanas un izmaksu tempu.', 'Mēs joprojām neesam saplānojuši pat ne tuvu pusei no visiem pieejamiem līdzekļiem. Runājot par maksājumiem, projektu vadītājiem ir izmaksāti tikai 9,62 % no EUR 347 miljardiem, kas piešķirti reģionālajai politikai. Tas skar visas valstis, dažas pat vēl vairāk nekā citas. Runājot par Eiropas fondu maksājumiem, Spānijai, Luksemburgai un Zviedrijai ir jādara viss iespējamais, lai panāktu vadošās valstis, piemēram, Baltijas valstis, Īriju un Slovēniju.', 'Eiropas Savienības reģionālā politika ir viena no vislietderīgākajām politikām mūsu līdzpilsoņiem. Patiešām, tā garantē ekonomisku, sociālu un teritoriālu kohēziju, līdzfinansējot praktiskus un ļoti bieži būtiski svarīgus projektus.', 'Tāpēc es aicinu valstu pārvaldes iestādes iesaistīties. Tajā pašā laikā es uzskatu, ka ir būtiski svarīgi, lai ekonomiskās krīzes laikā Eiropas noteikumi tiktu pielāgoti lielākajām problēmām. ']"
207, 19. Vienas minūtes runas par politiski svarīgiem jautājumiem,"  Bogusław Sonik  (PPE).   – (PL) Priekšsēdētājas kundze! Šodien mēs atzīmējām 20. gadadienu kopš demokrātiskajām izmaiņām Centrāleiropā un Austrumeiropā. Notika ļoti atbilstoša un vērtīga ceremonija, kurā piedalījās Havel kungs un Buzek kungs, un Eiropas Parlamentā ir apskatāmas izstādes. Tā arī vajadzētu būt, bet Eiropas iestādēm nevajadzētu šādus notikumus rīkot tikai reizi daudzu gadu laikā.Tam būtu jābūt mūsu vēsturē, patiesība par šīm izmaiņām būtu jāatspoguļo mūsu izglītības pasākumos, un iniciatoriem būtu jābūt Eiropas iestādēm. Mums ir vajadzīga kopīga vēstures mācību grāmata par tiem laikiem, kurā būtu pastāstīts, kā Eiropa apvienojās, lai bērni mūsu skolās uzzinātu šo patiesību un iegūtu šīs zināšanas.No otras puses, var minēt daudzus piemērus, kad nauda ir iztērēta nevajadzīgi. Lielbritānijas organizācija Open Europe saka, ka EUR 7 miljoni tika iztērēti, lai finansētu kādu emuāru par Nīderlandes apceļošanu ar ēzeli. Ir laiks Eiropai naudu tērēt efektīvāk. ",Bogusław Sonik  (PPE).,3,137,not_available,"['pol', 'pol', 'pol']","['  Bogusław Sonik  (PPE).   – (PL) Priekšsēdētājas kundze! Šodien mēs atzīmējām 20. gadadienu kopš demokrātiskajām izmaiņām Centrāleiropā un Austrumeiropā. Notika ļoti atbilstoša un vērtīga ceremonija, kurā piedalījās Havel kungs un Buzek kungs, un Eiropas Parlamentā ir apskatāmas izstādes. Tā arī vajadzētu būt, bet Eiropas iestādēm nevajadzētu šādus notikumus rīkot tikai reizi daudzu gadu laikā.', 'Tam būtu jābūt mūsu vēsturē, patiesība par šīm izmaiņām būtu jāatspoguļo mūsu izglītības pasākumos, un iniciatoriem būtu jābūt Eiropas iestādēm. Mums ir vajadzīga kopīga vēstures mācību grāmata par tiem laikiem, kurā būtu pastāstīts, kā Eiropa apvienojās, lai bērni mūsu skolās uzzinātu šo patiesību un iegūtu šīs zināšanas.', 'No otras puses, var minēt daudzus piemērus, kad nauda ir iztērēta nevajadzīgi. Lielbritānijas organizācija Open Europe saka, ka EUR 7 miljoni tika iztērēti, lai finansētu kādu emuāru par Nīderlandes apceļošanu ar ēzeli. Ir laiks Eiropai naudu tērēt efektīvāk. ']"
208, 19. Vienas minūtes runas par politiski svarīgiem jautājumiem,"  Priekšsēdētāja. -   Dāmas un kungi! Diemžēl mums tagad ir jābeidz vienas minūtes runas saskaņā ar Reglamenta 150. pantu. Atbilstoši 150. pantam mēs šādi debatēt varam ne ilgāk kā 30 minūtes. Šīs runas ir ieilgušas gandrīz 40 minūtes, jo diemžēl daudzi runātāji neiekļāvās vienā minūtē.Es centos priekšroku dot tiem, kuriem nebija iespējas izteikties kādā no divām pēdējām debatēm, un es ceru, ka jūs jutāt, ka tās bija diezgan līdzsvarotas. Kā jūs jau zināt, šovakar mums vēl ir četras debates. Sēdi jāslēdz vēlākais pusnaktī. ",Priekšsēdētāja. -,2,82,not_available,"['lav', 'lav']","['  Priekšsēdētāja. -   Dāmas un kungi! Diemžēl mums tagad ir jābeidz vienas minūtes runas saskaņā ar Reglamenta 150. pantu. Atbilstoši 150. pantam mēs šādi debatēt varam ne ilgāk kā 30 minūtes. Šīs runas ir ieilgušas gandrīz 40 minūtes, jo diemžēl daudzi runātāji neiekļāvās vienā minūtē.', 'Es centos priekšroku dot tiem, kuriem nebija iespējas izteikties kādā no divām pēdējām debatēm, un es ceru, ka jūs jutāt, ka tās bija diezgan līdzsvarotas. Kā jūs jau zināt, šovakar mums vēl ir četras debates. Sēdi jāslēdz vēlākais pusnaktī. ']"
