,agenda_item,text,speaker,number_p,number_w,chair,language_ps,ps
115, 16. ES un Krievijas 2009. gada 18. novembra augstākā līmeņa sanāksme Stokholmā (debates),"  Marek Henryk Migalski  (ECR).   – (PL) Priekšsēdētājas kundze, vispirms es vēlos ko teikt Ferrero-Waldner kundzei. Varbūt jūsu šeit nebija, kad runāja prezidents Havel. Tāpat kā Ojuland kundze un Schulz kungs es vēlos atsaukties uz prezidenta Havel teikto, ka Eiropas Savienības uzdevums ir cīnīties par demokrātiju un cilvēktiesību ievērošanu.To pieminēja arī Malmström kundze, par ko es viņai pateicos. Jūs runājāt tā, it kā Eiropas Savienība gatavotos augstākā līmeņa sanāksmei ar Šveici. Jūs runājāt par tirdzniecību, uzņēmējdarbību, klimata pārmaiņām un pilnīgi aizmirsāt par svarīgiem jautājumiem — tiem, kas, iespējams, ir paši svarīgākie Eiropas Savienībai. Mans novēlējums jums, mums un galvenokārt Krievijas Federācijas pilsoņiem ir tāds, lai ES biežāk ieņemtu Malmström kundzes šodien pausto nostāju, nevis to, ko ieņēmāt jūs. ",Marek Henryk Migalski  (ECR).,2,117,not_available,"['pol', 'pol']","['  Marek Henryk Migalski  (ECR).   – (PL) Priekšsēdētājas kundze, vispirms es vēlos ko teikt Ferrero-Waldner kundzei. Varbūt jūsu šeit nebija, kad runāja prezidents Havel. Tāpat kā Ojuland kundze un Schulz kungs es vēlos atsaukties uz prezidenta Havel teikto, ka Eiropas Savienības uzdevums ir cīnīties par demokrātiju un cilvēktiesību ievērošanu.', 'To pieminēja arī Malmström kundze, par ko es viņai pateicos. Jūs runājāt tā, it kā Eiropas Savienība gatavotos augstākā līmeņa sanāksmei ar Šveici. Jūs runājāt par tirdzniecību, uzņēmējdarbību, klimata pārmaiņām un pilnīgi aizmirsāt par svarīgiem jautājumiem — tiem, kas, iespējams, ir paši svarīgākie Eiropas Savienībai. Mans novēlējums jums, mums un galvenokārt Krievijas Federācijas pilsoņiem ir tāds, lai ES biežāk ieņemtu Malmström kundzes šodien pausto nostāju, nevis to, ko ieņēmāt jūs. ']"
116, 16. ES un Krievijas 2009. gada 18. novembra augstākā līmeņa sanāksme Stokholmā (debates),"  Andrew Henry William Brons  (NI).   – Priekšsēdētājas kundze, pirms mēs kritizējam Krieviju par cilvēktiesību pārkāpumiem, palūkosimies uz līdzīgiem pārkāpumiem pašā Eiropas Savienībā — valstīs, kur pret opozīcijas partijām tiek vērsti fiziski uzbrukumi, piemēram, Ungārijā, vai kurām uzbrūk valdošās partijas miliču armija, kā, piemēram, pat Apvienotajā Karalistē, vai valstīs, kur cilvēki tiek apcietināti par nevardarbīgu protestēšanu vai ir aizliegtas politiskās partijas, piemēram, Beļģijā.Mums jāveido attiecības ar Krieviju, balstoties uz savu dalībvalstu interesēm, nevis liekulīgiem jūtu uzplūdiem. ",Andrew Henry William Brons  (NI).,2,74,not_available,"['lav', 'lav']","['  Andrew Henry William Brons  (NI).   – Priekšsēdētājas kundze, pirms mēs kritizējam Krieviju par cilvēktiesību pārkāpumiem, palūkosimies uz līdzīgiem pārkāpumiem pašā Eiropas Savienībā — valstīs, kur pret opozīcijas partijām tiek vērsti fiziski uzbrukumi, piemēram, Ungārijā, vai kurām uzbrūk valdošās partijas miliču armija, kā, piemēram, pat Apvienotajā Karalistē, vai valstīs, kur cilvēki tiek apcietināti par nevardarbīgu protestēšanu vai ir aizliegtas politiskās partijas, piemēram, Beļģijā.', 'Mums jāveido attiecības ar Krieviju, balstoties uz savu dalībvalstu interesēm, nevis liekulīgiem jūtu uzplūdiem. ']"
117, 16. ES un Krievijas 2009. gada 18. novembra augstākā līmeņa sanāksme Stokholmā (debates),"  Cecilia Malmström,  Padomes priekšsēdētāja. – (SV) Priekšsēdētājas kundze, padies par ļoti konstruktīvajām debatēm. Domāju, vairums piekritīs, ka Krievija ir stratēģisks Eiropas Savienības partneris un mūsu attiecības ar šo valsti ir svarīgas. Šai partnerībai jābalstās uz savstarpēju cieņu, kopīgo saistību ievērošanu, kā arī Eiropas Savienības pausto vērtību respektēšanu attiecībā uz cilvēktiesībām, demokrātiju un tiesiskuma principu.Tādēļ mums jāizsakās ļoti skaidri, un es domāju, ka tie, kas mani kritizēja, piemēram, Rosbach kundze, varbūt nedzirdēja manu ievadrunu, kurā es ļoti skaidri teicu, ka esam nobažījušies par cilvēktiesību situācijas attīstību Krievijā. Krievija ir svarīga kaimiņvalsts. Protams, mums ir daudz neatrisinātu jautājumu, un droši vien neviens no mums necer, ka Stokholmas samitā mēs tos visus atrisināsim. Tomēr tā būs vērtīga iespēja satikties un par šiem jautājumiem diskutēt.Mums ir kopīgi jautājumi, kuros mēs varbūt spēsim nedaudz pietuvoties risinājumam. Te ir jautājums par Tuvajiem Austrumiem un Afganistānu, un šobrīd, protams, ļoti aktuāls ir klimata pārmaiņām veltītais samits Kopenhāgenā. Tad ir finanšu un ekonomiskā krīze un mūsu kopīgās saistības šajā ziņā, kā arī mūsu attiecības saistībā ar enerģētikas jomu, iestāšanos PTO un dažādiem ārpolitikas un drošības politikas jautājumiem. Mums jāsadarbojas, risinot konfliktus mūsu kopējā telpā. Tas ietver tādu specifisku jautājumu noteikšanu, attiecībā uz kuriem no šīs sadarbības ieguvējas būs abas puses. Mums tas jādara korekti un cieņpilnā veidā, neatsakoties no savām vērtībām.Ceru, ka šis samits mums palīdzēs arī stiprināt savas stratēģiskās partnerattiecības un dos mums iespēju veidot konstruktīvu sadarbību. Tas būtu pozitīvs iznākums. Esmu iepazinusies ar rezolūciju, kuru daudzi no jums pieminēja un par kuru, kā es sapratu, jūs rīt balsosiet. Es domāju, ka tā ir ļoti laba rezolūcija, un es arī uzskatu, ka ir patiešām lieliski, ka Komisijā, kā arī Padomē un Eiropas Parlamentā par šiem jautājumiem kopumā ir tik liela uzskatu vienprātība.Kā jau tik daudzi no jums teica, runājot ar Krieviju, mums jāpauž vienota nostāja. Ja mēs būsim vienoti un ja mums būs skaidrs un konstruktīvs dialogs, ieguvēja būs gan Krievija, gan Eiropas Savienība, un tas nāks par labu arī daudziem svarīgiem jautājumiem Eiropas un pasaules mērogā. ","Cecilia Malmström,",5,333,not_available,"['swe', 'swe', 'swe', 'swe', 'swe']","['  Cecilia Malmström,  Padomes priekšsēdētāja. – (SV) Priekšsēdētājas kundze, padies par ļoti konstruktīvajām debatēm. Domāju, vairums piekritīs, ka Krievija ir stratēģisks Eiropas Savienības partneris un mūsu attiecības ar šo valsti ir svarīgas. Šai partnerībai jābalstās uz savstarpēju cieņu, kopīgo saistību ievērošanu, kā arī Eiropas Savienības pausto vērtību respektēšanu attiecībā uz cilvēktiesībām, demokrātiju un tiesiskuma principu.', 'Tādēļ mums jāizsakās ļoti skaidri, un es domāju, ka tie, kas mani kritizēja, piemēram, Rosbach kundze, varbūt nedzirdēja manu ievadrunu, kurā es ļoti skaidri teicu, ka esam nobažījušies par cilvēktiesību situācijas attīstību Krievijā. Krievija ir svarīga kaimiņvalsts. Protams, mums ir daudz neatrisinātu jautājumu, un droši vien neviens no mums necer, ka Stokholmas samitā mēs tos visus atrisināsim. Tomēr tā būs vērtīga iespēja satikties un par šiem jautājumiem diskutēt.', 'Mums ir kopīgi jautājumi, kuros mēs varbūt spēsim nedaudz pietuvoties risinājumam. Te ir jautājums par Tuvajiem Austrumiem un Afganistānu, un šobrīd, protams, ļoti aktuāls ir klimata pārmaiņām veltītais samits Kopenhāgenā. Tad ir finanšu un ekonomiskā krīze un mūsu kopīgās saistības šajā ziņā, kā arī mūsu attiecības saistībā ar enerģētikas jomu, iestāšanos PTO un dažādiem ārpolitikas un drošības politikas jautājumiem. Mums jāsadarbojas, risinot konfliktus mūsu kopējā telpā. Tas ietver tādu specifisku jautājumu noteikšanu, attiecībā uz kuriem no šīs sadarbības ieguvējas būs abas puses. Mums tas jādara korekti un cieņpilnā veidā, neatsakoties no savām vērtībām.', 'Ceru, ka šis samits mums palīdzēs arī stiprināt savas stratēģiskās partnerattiecības un dos mums iespēju veidot konstruktīvu sadarbību. Tas būtu pozitīvs iznākums. Esmu iepazinusies ar rezolūciju, kuru daudzi no jums pieminēja un par kuru, kā es sapratu, jūs rīt balsosiet. Es domāju, ka tā ir ļoti laba rezolūcija, un es arī uzskatu, ka ir patiešām lieliski, ka Komisijā, kā arī Padomē un Eiropas Parlamentā par šiem jautājumiem kopumā ir tik liela uzskatu vienprātība.', 'Kā jau tik daudzi no jums teica, runājot ar Krieviju, mums jāpauž vienota nostāja. Ja mēs būsim vienoti un ja mums būs skaidrs un konstruktīvs dialogs, ieguvēja būs gan Krievija, gan Eiropas Savienība, un tas nāks par labu arī daudziem svarīgiem jautājumiem Eiropas un pasaules mērogā. ']"
118, 16. ES un Krievijas 2009. gada 18. novembra augstākā līmeņa sanāksme Stokholmā (debates),"  Benita Ferrero-Waldner,  Komisijas locekle. – Priekšsēdētājas kundze, no vienas puses, Krievija ir stratēģisks partneris, bet no otras — kaimiņvalsts, un attiecībā uz kaimiņvalsti situācija ir sarežģītāka. Tomēr es domāju, ko jo īpaši šajā ekonomiskās nenoteiktības laikā svarīgi ir tas, lai attiecības starp Eiropu un Krieviju būtu pēc iespējas efektīvākas, sniedzot drošību, stabilitāti un labklājību gan mūsu, gan arī Krievijas pilsoņiem. Tādēļ mums jāpastiprina savi centieni, lai panāktu vienošanos jautājumos, kur mūsu uzskati atšķiras, piemēram, cilvēktiesību vai kopējo kaimiņattiecību jomā, taču jādod arī iespēja veidot dialogu un diskutēt, ņemot vērā mūsu atšķirības, tomēr respektējot arī mūsu kopīgās saistības. Tas bija tā vispārēji.Tagad atļaujiet man pateikt dažas konkrētas lietas. Krievijas iestāšanās PTO ir un paliek mūsu galvenais mērķis. To sakot, es domāju, ka ir laiks atrisināt vairākus jautājumus, kas šajās tirdzniecības attiecībās palikuši neatrisināti. Daži no tiem, piemēram, Piedņestras pārlidojumu maksas, mūsu programmā atrodas jau daudzus gadus. Tās vienmēr tikušas pieminētas visos daudzajos samitos, kuros esmu piedalījusies. Citi jautājumi, piemēram, ierosinātais dekrēts par konteineru pārvadājumu ierobežošanu pa sauszemes ceļiem, ir nesenāki, un es pati, kā arī visi Komisijas dienesti šos jautājumus uzdodam ik reizi, kad runājam ar Krieviju. Patiešām, mums tikko bija pastāvīgā partnerības padome, bet, protams, mēs to varam darīt atkal.Otrs jautājums, ko gribu pieminēt, ir enerģētika. Kā jau teicu, Eiropas Savienība un Krievija ir svarīgi partneri arī enerģētikas jomā. Šīs ir savstarpēji atkarīgas attiecības, kas abām pusēm dod spēcīgu motivāciju tās balstīt uz paredzama un arī konkrēta pamata. Tādēļ ļoti svarīgi ir nodrošināt netraucētu un nepārtrauktu enerģijas piegādi Eiropas Savienībai, tādējādi nepieļaujot un pārvarot ārkārtas situācijas. Tieši to mēs vēlamies panākt ar, piemēram, agrīnās brīdināšanas mehānismu, pie kura mēs tagad strādājam un kur būtu svarīgi, lai mēs strādātu kopā ar Krievijas Federācijas Enerģētikas ministriju. Mēs šo jautājumu esam pārrunājuši, un es patiešām ceru, ka varēsim šo darbu turpināt.Attiecībā uz Ukrainu un jo īpaši gāzes tranzītu — mēs Komisijā strādājam kopā ar Ukrainas varas iestādēm, kā arī starptautiskajām finanšu iestādēm pie aizdevuma paketes, kas atrisinātu finanšu problēmas saistībā ar Krievijas gāzes uzglabāšanu un Ukrainas gāzes nozares reformēšanu un modernizēšanu.Jūlija beigās tika panākta vienošanās, kas deva iespēju, izpildot vairākus nosacījumus, no starptautiskām finanšu iestādēm saņemt finansiālu palīdzību. Ceram, ka tas patiešām darbosies, un mums ir arī jāpārliecinās, ka attiecības enerģētikas jomā balstās uz ļoti skaidra un atklāta tiesiskā pamata. Uz to mēs arī tiecamies, īpaši mūsu jaunajā nolīgumā.Attiecībā uz cilvēktiesībām — es runāju gan par cilvētiesībām! Mēs runājam par cilvēktiesībām katrā samitā. Vēlos teikt dažus vārdus par nāvessodu, jo, protams, saskaņā ar mūsu vērtību kopienu mums tas nav pieņemams. Jā, Krievijas konstitucionālā tiesa šobrīd šo jautājumu apspriež, bet, kā mēs uzzinājām, pazīmes liecina, ka tiesas spriedums būs tāds, ka Krievijai jāievēro Eiropas Cilvēktiesību konvencijas 6. protokols, ko tā parakstījusi, tādēļ, visticamāk, nāvessods netiks atjaunots. Cerēsim, kas tas tā patiešām arī būs.Kā minēju iepriekš, Krievija kā ANO, EDSO un Eiropas Padomes dalībvalsts ir uzņēmusies ļoti nopietnas saistības cilvēktiesību jomā. Tās vienmēr tiek pārrunātas ES un Krievijas konsultācijās par cilvēktiesību jautājumiem. Tā kā šādas konsultācijas tikko, 5. novembrī, notika Stokholmā, es pārāk sīki par to nerunāju, taču visi, kas ir informēti, to zina.Mana pēdējā piebilde būs pozitīva — tā ir jauniešu sadarbība zinātnes un tehnoloģijas jomā. Es piekrītu Fleckenstein kungam, ka apmaiņas un sadarbības veicināšana starp Eiropas Savienības un Krievijas jauniešiem mums ir ļoti svarīga, un mēs šim nolūkam piedāvājam savas programmas. Tās ir izrādījušās veiksmīgas arī pašā Eiropas Savienībā, piemēram, programmas TEMPUS un Erasmus Mundus, un tas ir arī ceļš, kas mums jāturpina.Šajā kontekstā mēs esam uzsākuši sarunas par Krievijas pievienošanos Eiropas Kopienas pētniecības un tehnoloģiju attīstības pamatprogrammai. Tas ir saistīts arī ar milzīgu ekonomisko potenciālu.Domāju, ka mūsu attiecību spektrs ir ļoti plašs. Mums ir daudz ko pārrunāt, un mūsu uzskati ar Krieviju reizēm nesakrīt, bet mēs vienmēr varam debatēt par katru jautājumu, un tieši to mēs arī darām. ","Benita Ferrero-Waldner,",10,631,not_available,"['lav', 'lav', 'lav', 'lav', 'lav', 'lav', 'lav', 'lav', 'lav', 'lav']","['  Benita Ferrero-Waldner,  Komisijas locekle. – Priekšsēdētājas kundze, no vienas puses, Krievija ir stratēģisks partneris, bet no otras — kaimiņvalsts, un attiecībā uz kaimiņvalsti situācija ir sarežģītāka. Tomēr es domāju, ko jo īpaši šajā ekonomiskās nenoteiktības laikā svarīgi ir tas, lai attiecības starp Eiropu un Krieviju būtu pēc iespējas efektīvākas, sniedzot drošību, stabilitāti un labklājību gan mūsu, gan arī Krievijas pilsoņiem. Tādēļ mums jāpastiprina savi centieni, lai panāktu vienošanos jautājumos, kur mūsu uzskati atšķiras, piemēram, cilvēktiesību vai kopējo kaimiņattiecību jomā, taču jādod arī iespēja veidot dialogu un diskutēt, ņemot vērā mūsu atšķirības, tomēr respektējot arī mūsu kopīgās saistības. Tas bija tā vispārēji.', 'Tagad atļaujiet man pateikt dažas konkrētas lietas. Krievijas iestāšanās PTO ir un paliek mūsu galvenais mērķis. To sakot, es domāju, ka ir laiks atrisināt vairākus jautājumus, kas šajās tirdzniecības attiecībās palikuši neatrisināti. Daži no tiem, piemēram, Piedņestras pārlidojumu maksas, mūsu programmā atrodas jau daudzus gadus. Tās vienmēr tikušas pieminētas visos daudzajos samitos, kuros esmu piedalījusies. Citi jautājumi, piemēram, ierosinātais dekrēts par konteineru pārvadājumu ierobežošanu pa sauszemes ceļiem, ir nesenāki, un es pati, kā arī visi Komisijas dienesti šos jautājumus uzdodam ik reizi, kad runājam ar Krieviju. Patiešām, mums tikko bija pastāvīgā partnerības padome, bet, protams, mēs to varam darīt atkal.', 'Otrs jautājums, ko gribu pieminēt, ir enerģētika. Kā jau teicu, Eiropas Savienība un Krievija ir svarīgi partneri arī enerģētikas jomā. Šīs ir savstarpēji atkarīgas attiecības, kas abām pusēm dod spēcīgu motivāciju tās balstīt uz paredzama un arī konkrēta pamata. Tādēļ ļoti svarīgi ir nodrošināt netraucētu un nepārtrauktu enerģijas piegādi Eiropas Savienībai, tādējādi nepieļaujot un pārvarot ārkārtas situācijas. Tieši to mēs vēlamies panākt ar, piemēram, agrīnās brīdināšanas mehānismu, pie kura mēs tagad strādājam un kur būtu svarīgi, lai mēs strādātu kopā ar Krievijas Federācijas Enerģētikas ministriju. Mēs šo jautājumu esam pārrunājuši, un es patiešām ceru, ka varēsim šo darbu turpināt.', 'Attiecībā uz Ukrainu un jo īpaši gāzes tranzītu — mēs Komisijā strādājam kopā ar Ukrainas varas iestādēm, kā arī starptautiskajām finanšu iestādēm pie aizdevuma paketes, kas atrisinātu finanšu problēmas saistībā ar Krievijas gāzes uzglabāšanu un Ukrainas gāzes nozares reformēšanu un modernizēšanu.', 'Jūlija beigās tika panākta vienošanās, kas deva iespēju, izpildot vairākus nosacījumus, no starptautiskām finanšu iestādēm saņemt finansiālu palīdzību. Ceram, ka tas patiešām darbosies, un mums ir arī jāpārliecinās, ka attiecības enerģētikas jomā balstās uz ļoti skaidra un atklāta tiesiskā pamata. Uz to mēs arī tiecamies, īpaši mūsu jaunajā nolīgumā.', 'Attiecībā uz cilvēktiesībām — es runāju gan par cilvētiesībām! Mēs runājam par cilvēktiesībām katrā samitā. Vēlos teikt dažus vārdus par nāvessodu, jo, protams, saskaņā ar mūsu vērtību kopienu mums tas nav pieņemams. Jā, Krievijas konstitucionālā tiesa šobrīd šo jautājumu apspriež, bet, kā mēs uzzinājām, pazīmes liecina, ka tiesas spriedums būs tāds, ka Krievijai jāievēro Eiropas Cilvēktiesību konvencijas 6. protokols, ko tā parakstījusi, tādēļ, visticamāk, nāvessods netiks atjaunots. Cerēsim, kas tas tā patiešām arī būs.', 'Kā minēju iepriekš, Krievija kā ANO, EDSO un Eiropas Padomes dalībvalsts ir uzņēmusies ļoti nopietnas saistības cilvēktiesību jomā. Tās vienmēr tiek pārrunātas ES un Krievijas konsultācijās par cilvēktiesību jautājumiem. Tā kā šādas konsultācijas tikko, 5. novembrī, notika Stokholmā, es pārāk sīki par to nerunāju, taču visi, kas ir informēti, to zina.', 'Mana pēdējā piebilde būs pozitīva — tā ir jauniešu sadarbība zinātnes un tehnoloģijas jomā. Es piekrītu Fleckenstein kungam, ka apmaiņas un sadarbības veicināšana starp Eiropas Savienības un Krievijas jauniešiem mums ir ļoti svarīga, un mēs šim nolūkam piedāvājam savas programmas. Tās ir izrādījušās veiksmīgas arī pašā Eiropas Savienībā, piemēram, programmas TEMPUS un Erasmus Mundus, un tas ir arī ceļš, kas mums jāturpina.', 'Šajā kontekstā mēs esam uzsākuši sarunas par Krievijas pievienošanos Eiropas Kopienas pētniecības un tehnoloģiju attīstības pamatprogrammai. Tas ir saistīts arī ar milzīgu ekonomisko potenciālu.', 'Domāju, ka mūsu attiecību spektrs ir ļoti plašs. Mums ir daudz ko pārrunāt, un mūsu uzskati ar Krieviju reizēm nesakrīt, bet mēs vienmēr varam debatēt par katru jautājumu, un tieši to mēs arī darām. ']"
119, 16. ES un Krievijas 2009. gada 18. novembra augstākā līmeņa sanāksme Stokholmā (debates),"  Priekšsēdētāja.   – Esmu saņēmusi sešus rezolūciju priekšlikumus(1), kas iesniegti saskaņā ar Reglamenta 110. panta 2. punktu.Debates tiek slēgtas.Balsojums notiks rīt, ceturtdien, 2009. gada 12. novembrī.Rakstiskas deklarācijas (Reglamenta 149. pants) ",Priekšsēdētāja.,4,32,not_available,"['lav', 'lav', 'lav', 'lav']","['  Priekšsēdētāja.   – Esmu saņēmusi sešus rezolūciju priekšlikumus(1), kas iesniegti saskaņā ar Reglamenta 110. panta 2. punktu.', 'Debates tiek slēgtas.', 'Balsojums notiks rīt, ceturtdien, 2009. gada 12. novembrī.', 'Rakstiskas deklarācijas (Reglamenta 149. pants) ']"
120, 16. ES un Krievijas 2009. gada 18. novembra augstākā līmeņa sanāksme Stokholmā (debates),"  Sebastian Valentin Bodu  (PPE),  rakstiski. – (RO) Sākoties ziemai, Eiropu apdraud gāzes krīze, līdzīga tai, kas izcēlās šā gada sākumā, kad atkarība no Krievijas bija izteiktāka nekā jebkad agrāk. Iespējams, ka šogad atkārtosies arī pagājušās ziemas scenārijs, uz kuru nesen norādīja premjerministrs Putin un kura pamatā atkal ir nesaskaņas ar Ukrainu. Šajā kontekstā alternatīva Krievijas gāzei — Nabucco projekts — kļūst par absolūtu nepieciešamību. Gāzes piegāde Eiropai nedrīkst būt atkarīga no konfliktiem starp Krieviju un Ukrainu. Visām ES organizācijām Nabucco projekts jāatzīst par prioritāti, tieši tā, kā martā to jau nolēma Eiropadome. Attiecībā uz Nabucco projektu ES jāieņem vienota nostāja. Krievijas interesēs ir piekļūt Kaspijas gāzei, un apņēmīga, vienota Eiropas pārstāvju grupa aicinās Krieviju pie tā paša sarunu galda. Mēs neiesaistīsimies konkurences cīņā starp projektiem. Mēs nesalīdzinām Nord Stream un South Stream projektus. Mēs runājam par kopīgām interesēm attiecībā uz alternatīvu gāzes avotu. Visbeidzot, kas nav mazāk svarīgi, Eiropas institūcijām jāaicina Krievija un Ukraina neļaut savam ģeopolitisko vai elektorālo interešu diktētajam lepnumam apdraudēt ES iedzīvotāju un tautsaimniecību drošību. ","Sebastian Valentin Bodu  (PPE),",1,165,not_available,['rum'],"['  Sebastian Valentin Bodu  (PPE),  rakstiski. – (RO) Sākoties ziemai, Eiropu apdraud gāzes krīze, līdzīga tai, kas izcēlās šā gada sākumā, kad atkarība no Krievijas bija izteiktāka nekā jebkad agrāk. Iespējams, ka šogad atkārtosies arī pagājušās ziemas scenārijs, uz kuru nesen norādīja premjerministrs Putin un kura pamatā atkal ir nesaskaņas ar Ukrainu. Šajā kontekstā alternatīva Krievijas gāzei — Nabucco projekts — kļūst par absolūtu nepieciešamību. Gāzes piegāde Eiropai nedrīkst būt atkarīga no konfliktiem starp Krieviju un Ukrainu. Visām ES organizācijām Nabucco projekts jāatzīst par prioritāti, tieši tā, kā martā to jau nolēma Eiropadome. Attiecībā uz Nabucco projektu ES jāieņem vienota nostāja. Krievijas interesēs ir piekļūt Kaspijas gāzei, un apņēmīga, vienota Eiropas pārstāvju grupa aicinās Krieviju pie tā paša sarunu galda. Mēs neiesaistīsimies konkurences cīņā starp projektiem. Mēs nesalīdzinām Nord Stream un South Stream projektus. Mēs runājam par kopīgām interesēm attiecībā uz alternatīvu gāzes avotu. Visbeidzot, kas nav mazāk svarīgi, Eiropas institūcijām jāaicina Krievija un Ukraina neļaut savam ģeopolitisko vai elektorālo interešu diktētajam lepnumam apdraudēt ES iedzīvotāju un tautsaimniecību drošību. ']"
121, 16. ES un Krievijas 2009. gada 18. novembra augstākā līmeņa sanāksme Stokholmā (debates),"  András Gyürk  (PPE)  , rakstiski. – (HU) Atkārtotas sarunas par ES un Krievijas partnerības un sadarbības nolīgumu ir laba iespēja abām pusēm pārskatīt jautājumus, kas visskaidrāk definē to attiecības. Pēc dažu pēdējo gadu notikumiem nav nekāda nejaušība, ka šo sarunu programma atspoguļo enerģijas apmaiņas aizvien pieaugošo nozīmi. Spriežot pēc preses sniegtās informācijas, mēs nekādā ziņā nevaram būt droši, ka šogad izbēgsim no gāzes krīzes, kas kļuvusi par regulāru parādību. ES Direktīvai par gāzes piegādi, kas vēl nav pieņemta, diemžēl nebūs nekādas jēgas, ja ES dalībvalstīm būs atkal jāceļas, lai aizgrieztu krānus. Tieši tādēļ Eiropas Savienībai jācenšas panākt, lai Krievijā vēl ratificējamās Enerģētikas hartas pamatprincipi kļūtu par jaunā sadarbības nolīguma neatņemamu daļu. Šobrīd gan enerģijas tranzīta, gan arī tirgus pieejamības jautājums ir pretrunu pilns. Patiešām, kamēr vien Krievija, izmantojot tirgus atvērtību, joprojām būs iesaistīta kā investors vairumā ES dalībvalstu, tā konsekventi slēgs savu tirgu rietumu uzņēmumiem. Enerģētikas harta šo pretrunu var atrisināt. Arī tirgus principu fiksēšana rakstveidā turmāko gāzes piegādes ilgtermiņa līgumu sarunu laikā var būt noderīga. Ja pārredzamas attiecības ar tiem izveidot neizdosies, tad turpmāk joprojām būs iespējams dalībvalstis noskaņot vienu pret otru, jo tās turpinās par gāzi maksāt dažādas cenas. ",András Gyürk  (PPE),1,189,not_available,['hun'],"['  András Gyürk  (PPE)  , rakstiski. – (HU) Atkārtotas sarunas par ES un Krievijas partnerības un sadarbības nolīgumu ir laba iespēja abām pusēm pārskatīt jautājumus, kas visskaidrāk definē to attiecības. Pēc dažu pēdējo gadu notikumiem nav nekāda nejaušība, ka šo sarunu programma atspoguļo enerģijas apmaiņas aizvien pieaugošo nozīmi. Spriežot pēc preses sniegtās informācijas, mēs nekādā ziņā nevaram būt droši, ka šogad izbēgsim no gāzes krīzes, kas kļuvusi par regulāru parādību. ES Direktīvai par gāzes piegādi, kas vēl nav pieņemta, diemžēl nebūs nekādas jēgas, ja ES dalībvalstīm būs atkal jāceļas, lai aizgrieztu krānus. Tieši tādēļ Eiropas Savienībai jācenšas panākt, lai Krievijā vēl ratificējamās Enerģētikas hartas pamatprincipi kļūtu par jaunā sadarbības nolīguma neatņemamu daļu. Šobrīd gan enerģijas tranzīta, gan arī tirgus pieejamības jautājums ir pretrunu pilns. Patiešām, kamēr vien Krievija, izmantojot tirgus atvērtību, joprojām būs iesaistīta kā investors vairumā ES dalībvalstu, tā konsekventi slēgs savu tirgu rietumu uzņēmumiem. Enerģētikas harta šo pretrunu var atrisināt. Arī tirgus principu fiksēšana rakstveidā turmāko gāzes piegādes ilgtermiņa līgumu sarunu laikā var būt noderīga. Ja pārredzamas attiecības ar tiem izveidot neizdosies, tad turpmāk joprojām būs iespējams dalībvalstis noskaņot vienu pret otru, jo tās turpinās par gāzi maksāt dažādas cenas. ']"
