,agenda_item,text,speaker,number_p,number_w,chair,language_ps,ps
0, 1. Svinīgā sēde – Centrāleiropas un Austrumeiropas demokrātisko pārmaiņu divdesmitā gadadiena,SĒDI VADA: J. BUZEK Priekšsēdētājs (Svinīgo sēdi atklāja plkst. 15.05) ,SĒDI VADA: J. BUZEK,2,11,not_available,"['lav', 'lav']","['SĒDI VADA: J. BUZEK Priekšsēdētājs', ' (Svinīgo sēdi atklāja plkst. 15.05) ']"
1, 1. Svinīgā sēde – Centrāleiropas un Austrumeiropas demokrātisko pārmaiņu divdesmitā gadadiena,"  Priekšsēdētājs.   – Pirms mēs sākam es vēlos pateikt, ka mēs ar prezidentu Havel kungu apmainījāmies viedokļiem, un es jums varu apgalvot, ka pirms 25 gadiem mēs ko tādu nevarējām iedomāties!(Aplausi) ",Priekšsēdētājs.,2,30,not_available,"['lav', 'lav']","['  Priekšsēdētājs.   – Pirms mēs sākam es vēlos pateikt, ka mēs ar prezidentu Havel kungu apmainījāmies viedokļiem, un es jums varu apgalvot, ka pirms 25 gadiem mēs ko tādu nevarējām iedomāties!', '(Aplausi) ']"
