,agenda_item,text,speaker,number_p,number_w,chair,language_ps,ps
15, 12. Vienas minūtes runas par politiski svarīgiem jautājumiem,"  Sylvie Guillaume  (S&D).   – (FR) Priekšsēdētāja kungs, dāmas un kungi, es vēlētos komentēt jautājumu par ķermeņa skeneru uzstādīšanu lidostās. Patlaban tas mums tiek piedāvāts kā risinājums terorisma draudiem, taču vienlaikus tas arī veicina bailes.Dažas dalībvalstis tos strauji ievieš, pat neizpētot šāda pasākuma ietekmi uz sabiedrības veselību, drošību un galvenokārt uz cilvēka brīvību. Būsim reālistiski — absolūta drošība nepastāv. Uz brīdi var zust koncentrēšanās, cilvēki var kļūdīties.Turklāt Amsterdamas–Detroitas lidojumam novērstais uzbrukums īpaši labi parādīja informācijas sistēmu nepilnības. Tādēļ mums ir jāmeklē risinājumi tieši šajā jomā, lai veicinātu kultūru, kas balstās uz apmaiņu un uzticēšanos starp dažādām iesaistītajām varas iestādēm un pusēm.Un visbeidzot — koncentrēšanās uz lidostām nozīmē pilnīgi ignorēt ļaunprātīgu grupu veiktu terora aktu iespējamību dzelzceļa stacijās, pazemes sistēmās vai jebkurā citā cilvēku pulcēšanās vietā, un tādu ir daudz.Tādēļ, pirms pieņemam sasteigtus un dārgus lēmumus, atgūsim vispirms objektīvu un neemocionālu skatījumu, izmantojot plašas un pārredzamas debates! ",Sylvie Guillaume  (S&D).,5,148,not_available,"['fra', 'fra', 'fra', 'fra', 'fra']","['  Sylvie Guillaume  (S&D).   – (FR) Priekšsēdētāja kungs, dāmas un kungi, es vēlētos komentēt jautājumu par ķermeņa skeneru uzstādīšanu lidostās. Patlaban tas mums tiek piedāvāts kā risinājums terorisma draudiem, taču vienlaikus tas arī veicina bailes.', 'Dažas dalībvalstis tos strauji ievieš, pat neizpētot šāda pasākuma ietekmi uz sabiedrības veselību, drošību un galvenokārt uz cilvēka brīvību. Būsim reālistiski — absolūta drošība nepastāv. Uz brīdi var zust koncentrēšanās, cilvēki var kļūdīties.', 'Turklāt Amsterdamas–Detroitas lidojumam novērstais uzbrukums īpaši labi parādīja informācijas sistēmu nepilnības. Tādēļ mums ir jāmeklē risinājumi tieši šajā jomā, lai veicinātu kultūru, kas balstās uz apmaiņu un uzticēšanos starp dažādām iesaistītajām varas iestādēm un pusēm.', 'Un visbeidzot — koncentrēšanās uz lidostām nozīmē pilnīgi ignorēt ļaunprātīgu grupu veiktu terora aktu iespējamību dzelzceļa stacijās, pazemes sistēmās vai jebkurā citā cilvēku pulcēšanās vietā, un tādu ir daudz.', 'Tādēļ, pirms pieņemam sasteigtus un dārgus lēmumus, atgūsim vispirms objektīvu un neemocionālu skatījumu, izmantojot plašas un pārredzamas debates! ']"
16, 12. Vienas minūtes runas par politiski svarīgiem jautājumiem,"  Gianni Vattimo  (ALDE).   – (IT) Priekšsēdētāja kungs, dāmas un kungi, būdams Eiropas Parlamenta deputāts, kurš pārstāv Itālijas ziemeļrietumus, es vēlētos Parlamentam un Komisijai norādīt uz dažiem līgumu un demokrātijas tiesību iespējamiem pārkāpumiem, ko pieļauj Itālijas valdība un Pjemontas vietējās varas iestādes saistībā ar jaunas Lionas–Turīnas dzelzceļa līnijas projektu.Ievērojamais ES finansējums šim projektam tika piešķirts ar noteikumu, ka to atbalsta vietējie iedzīvotāji un ka finansējumu nodrošina arī ar privātiem Itālijas ieguldījumiem. Neviens no šiem noteikumiem nav ievērots, jo, pirmkārt, nav privāta Itālijas finansējuma un, otrkārt, vietējās kopienas ir apklusinājis valdības rīkojums, kas tām ļauj izteikties tikai tad, ja tās piekrīt dzelzceļa līnijas izbūvei.Tā kā šie abi noteikumi netiek ievēroti, ir aizdomas, ka Itālija savā ziņā izkrāpj finansējumu no Eiropas Savienības. ",Gianni Vattimo  (ALDE).,3,121,not_available,"['ita', 'ita', 'ita']","['  Gianni Vattimo  (ALDE).   – (IT) Priekšsēdētāja kungs, dāmas un kungi, būdams Eiropas Parlamenta deputāts, kurš pārstāv Itālijas ziemeļrietumus, es vēlētos Parlamentam un Komisijai norādīt uz dažiem līgumu un demokrātijas tiesību iespējamiem pārkāpumiem, ko pieļauj Itālijas valdība un Pjemontas vietējās varas iestādes saistībā ar jaunas Lionas–Turīnas dzelzceļa līnijas projektu.', 'Ievērojamais ES finansējums šim projektam tika piešķirts ar noteikumu, ka to atbalsta vietējie iedzīvotāji un ka finansējumu nodrošina arī ar privātiem Itālijas ieguldījumiem. Neviens no šiem noteikumiem nav ievērots, jo, pirmkārt, nav privāta Itālijas finansējuma un, otrkārt, vietējās kopienas ir apklusinājis valdības rīkojums, kas tām ļauj izteikties tikai tad, ja tās piekrīt dzelzceļa līnijas izbūvei.', 'Tā kā šie abi noteikumi netiek ievēroti, ir aizdomas, ka Itālija savā ziņā izkrāpj finansējumu no Eiropas Savienības. ']"
17, 12. Vienas minūtes runas par politiski svarīgiem jautājumiem,"  Sandrine Bélier  (Verts/ALE).   – (FR) Es atvainojos, priekšsēdētāja kungs. Šī man ir pirmā reize, es pārbaudīju procedūras pareizību, un tikmēr.. lūdzu mani atvainot.Priekšsēdētāja kungs, dāmas un kungi, šā gada, ko ANO pasludinājusi par Starptautisko bioloģiskās daudzveidības gadu, sākumā es vēlētos pievērst jūsu uzmanību neveiksmei, kuru cietusi Eiropas stratēģija 2004.–2010. gada periodam bioloģiskās daudzveidības izzušanas apturēšanai.40 % mūsu dabas mantojuma ir apdraudēti. Bioloģiskās daudzveidības stāvoklis ir planētas veselības stāvokļa un mūsu attīstības sistēmas drošuma mērs, un krīze arvien padziļinās.Tādēļ es ceru, ka šodien un rīt Eiropas Savienība un Eiropas Parlaments spēs stāties pretī šīm problēmām un 2010. gadā visās nozaru politikas jomās noteiks vērienīgus un vispusīgus mērķus bioloģiskās daudzveidības samazināšanās apturēšanai.Mums ir jārīkojas, vēl ir laiks, un 2010. gadā iespējams ir viss. Es ceru, ka mums veiksies labāk nekā Kopenhāgenā. ",Sandrine Bélier  (Verts/ALE).,5,133,not_available,"['fra', 'fra', 'fra', 'fra', 'fra']","['  Sandrine Bélier  (Verts/ALE).   – (FR) Es atvainojos, priekšsēdētāja kungs. Šī man ir pirmā reize, es pārbaudīju procedūras pareizību, un tikmēr.. lūdzu mani atvainot.', 'Priekšsēdētāja kungs, dāmas un kungi, šā gada, ko ANO pasludinājusi par Starptautisko bioloģiskās daudzveidības gadu, sākumā es vēlētos pievērst jūsu uzmanību neveiksmei, kuru cietusi Eiropas stratēģija 2004.–2010. gada periodam bioloģiskās daudzveidības izzušanas apturēšanai.', '40 % mūsu dabas mantojuma ir apdraudēti. Bioloģiskās daudzveidības stāvoklis ir planētas veselības stāvokļa un mūsu attīstības sistēmas drošuma mērs, un krīze arvien padziļinās.', 'Tādēļ es ceru, ka šodien un rīt Eiropas Savienība un Eiropas Parlaments spēs stāties pretī šīm problēmām un 2010. gadā visās nozaru politikas jomās noteiks vērienīgus un vispusīgus mērķus bioloģiskās daudzveidības samazināšanās apturēšanai.', 'Mums ir jārīkojas, vēl ir laiks, un 2010. gadā iespējams ir viss. Es ceru, ka mums veiksies labāk nekā Kopenhāgenā. ']"
18, 12. Vienas minūtes runas par politiski svarīgiem jautājumiem,"  Søren Bo Søndergaard  (GUE/NGL).   – (DA) Priekšsēdētāja kungs, kopš Turcija aizliedza kurdu DTP partiju, daudzi partijas locekļi ir apcietināti, ieskaitot arī demokrātiski ievēlētus mērus un agrākos parlamenta deputātus. Es pats apmeklēju Turciju laikā starp Ziemassvētkiem un Jauno gadu, lai būtu klāt tiesas procesā pret DTP priekšsēdētāju Ahmet Türk. Viņam pakaļ bija nosūtīta policija, kaut gan viņa deputāta imunitāte nebija anulēta. Pagājušajā nedēļā Diyarbakir mēram Osman Baydemir tika aizliegts atstāt valsti. Tādēļ viņš nevar apmeklēt konferenci par kurdu jautājumiem, kura 3. un 4. februārī notiks šajā Parlamentā.Es aicinu priekšsēdētāju — un ceru, ka viņam būs laiks uzklausīt manu lūgumu, — iesniegt protestu Turcijas varas iestādēm un pieprasīt, lai demokrātiski ievēlētajam Diyarbakir mēram ļauj nākamnedēļ apmeklēt Eiropas Parlamentu. ",Søren Bo Søndergaard  (GUE/NGL).,2,115,not_available,"['dan', 'dan']","['  Søren Bo Søndergaard  (GUE/NGL).   – (DA) Priekšsēdētāja kungs, kopš Turcija aizliedza kurdu DTP partiju, daudzi partijas locekļi ir apcietināti, ieskaitot arī demokrātiski ievēlētus mērus un agrākos parlamenta deputātus. Es pats apmeklēju Turciju laikā starp Ziemassvētkiem un Jauno gadu, lai būtu klāt tiesas procesā pret DTP priekšsēdētāju Ahmet Türk. Viņam pakaļ bija nosūtīta policija, kaut gan viņa deputāta imunitāte nebija anulēta. Pagājušajā nedēļā Diyarbakir mēram Osman Baydemir tika aizliegts atstāt valsti. Tādēļ viņš nevar apmeklēt konferenci par kurdu jautājumiem, kura 3. un 4. februārī notiks šajā Parlamentā.', 'Es aicinu priekšsēdētāju — un ceru, ka viņam būs laiks uzklausīt manu lūgumu, — iesniegt protestu Turcijas varas iestādēm un pieprasīt, lai demokrātiski ievēlētajam Diyarbakir mēram ļauj nākamnedēļ apmeklēt Eiropas Parlamentu. ']"
19, 12. Vienas minūtes runas par politiski svarīgiem jautājumiem,"  Priekšsēdētājs.   Paldies par šo informāciju. Lūdzu, atsūtiet vēstuli par šo problēmu uz manu e-pasta adresi, lai es precīzi zinātu, par kādu situāciju jūs runājat. ",Priekšsēdētājs.,1,25,not_available,['lav'],"['  Priekšsēdētājs.   Paldies par šo informāciju. Lūdzu, atsūtiet vēstuli par šo problēmu uz manu e-pasta adresi, lai es precīzi zinātu, par kādu situāciju jūs runājat. ']"
20, 12. Vienas minūtes runas par politiski svarīgiem jautājumiem,"  Barry Madlener  (NI).   – (NL) Priekšsēdētāja kungs, dāmas un kungi, Nīderlandē tiek smagi apspiesta vārda brīvība. Mūsu partijas vadītājam Geert Wilders nākamajā nedēļā jāierodas Nīderlandes tiesā. Ne tādēļ, ka viņš būtu pastrādājis kādu noziegumu, bet gan savu politisko uzskatu dēļ. Brīvības partija brīdina par islamizācijas sekām. Islāms nav reliģija, tā ir ideoloģija, kuras mērķis ir mūs pārņemt. Islāms necieš Rietumu brīvību un demokrātiju. Fundamentālistu draudu dēļ islāma kritizēšana politiķiem un viedokļa paudējiem bieži vien izmaksā dārgi. Tas, ka Nīderlandes politiķiem tagad par islāma kritiku pat uzrīdīs Valsts prokuratūru un tiesas un ka viņi var nonākt cietumā, ir katastrofa mūsu brīvībai un demokrātijai. Mēs to nedrīkstam pieļaut, un tādēļ mēs skandinām trauksmes zvanus Nīderlandei un brīvajai Rietumu pasaulei. Pārtrauciet islamizāciju un pārtrauciet politiķu vajāšanu viņu politisko uzskatu dēļ! Trešdien mēs būsim Nīderlandē, lai piedalītos demonstrācijā par mūsu brīvību. Atbalstiet Geert Wilders un esiet klāt šajā nepamatotajā tiesas sēdē pret drosmīgu politiķi — Geert Wilders! ",Barry Madlener  (NI).,1,151,not_available,['dut'],"['  Barry Madlener  (NI).   – (NL) Priekšsēdētāja kungs, dāmas un kungi, Nīderlandē tiek smagi apspiesta vārda brīvība. Mūsu partijas vadītājam Geert Wilders nākamajā nedēļā jāierodas Nīderlandes tiesā. Ne tādēļ, ka viņš būtu pastrādājis kādu noziegumu, bet gan savu politisko uzskatu dēļ. Brīvības partija brīdina par islamizācijas sekām. Islāms nav reliģija, tā ir ideoloģija, kuras mērķis ir mūs pārņemt. Islāms necieš Rietumu brīvību un demokrātiju. Fundamentālistu draudu dēļ islāma kritizēšana politiķiem un viedokļa paudējiem bieži vien izmaksā dārgi. Tas, ka Nīderlandes politiķiem tagad par islāma kritiku pat uzrīdīs Valsts prokuratūru un tiesas un ka viņi var nonākt cietumā, ir katastrofa mūsu brīvībai un demokrātijai. Mēs to nedrīkstam pieļaut, un tādēļ mēs skandinām trauksmes zvanus Nīderlandei un brīvajai Rietumu pasaulei. Pārtrauciet islamizāciju un pārtrauciet politiķu vajāšanu viņu politisko uzskatu dēļ! Trešdien mēs būsim Nīderlandē, lai piedalītos demonstrācijā par mūsu brīvību. Atbalstiet Geert Wilders un esiet klāt šajā nepamatotajā tiesas sēdē pret drosmīgu politiķi — Geert Wilders! ']"
21, 12. Vienas minūtes runas par politiski svarīgiem jautājumiem,"  Marian-Jean Marinescu  (PPE).   – (RO) Es apsveicu to, ka Spānijas prezidentūra saskaņā ar tās piedāvāto programmu uzņemas projektus, kuri ar inovāciju un leģitimizācijas palīdzību stiprinās un pārveidos Eiropas Savienību. Tomēr man žēl, ka Spānijas prezidentūras programmā nav nekā par iekšzemes ūdensceļiem, jo īpaši par Reinas–Mainas–Donavas ūdensceļu, kaut gan pērn Eiropas Komisija uzņēmās 2010. gadā izveidot stratēģiju Donavai.Es apzinos, ka Spānijas prezidentūrai ir jāatrisina daudzas citas prioritāras problēmas, piemēram, Lisabonas līguma stāšanās spēkā un izmaiņas judikatūrā, institucionālie grozījumi, krīzes atvieglošanas procesa vadība un ilgtspējīgas izaugsmes atjaunošana.Tomēr es uzskatu, ka transporta infrastruktūra — galvenokārt iekšzemes ūdensceļu, arī Donavas, infrastruktūra —, kā arī transporta veidu dažādība ir specifiski, reāli faktori, ar ko nodrošināt ilgtspējīgu attīstību un jaunas darbavietas. Tādēļ, manuprāt, šāda jautājuma neiekļaušana Spānijas prezidentūras programmā ir trūkums, kas steidzami jālabo. ",Marian-Jean Marinescu  (PPE).,3,130,not_available,"['rum', 'rum', 'rum']","['  Marian-Jean Marinescu  (PPE).   – (RO) Es apsveicu to, ka Spānijas prezidentūra saskaņā ar tās piedāvāto programmu uzņemas projektus, kuri ar inovāciju un leģitimizācijas palīdzību stiprinās un pārveidos Eiropas Savienību. Tomēr man žēl, ka Spānijas prezidentūras programmā nav nekā par iekšzemes ūdensceļiem, jo īpaši par Reinas–Mainas–Donavas ūdensceļu, kaut gan pērn Eiropas Komisija uzņēmās 2010. gadā izveidot stratēģiju Donavai.', 'Es apzinos, ka Spānijas prezidentūrai ir jāatrisina daudzas citas prioritāras problēmas, piemēram, Lisabonas līguma stāšanās spēkā un izmaiņas judikatūrā, institucionālie grozījumi, krīzes atvieglošanas procesa vadība un ilgtspējīgas izaugsmes atjaunošana.', 'Tomēr es uzskatu, ka transporta infrastruktūra — galvenokārt iekšzemes ūdensceļu, arī Donavas, infrastruktūra —, kā arī transporta veidu dažādība ir specifiski, reāli faktori, ar ko nodrošināt ilgtspējīgu attīstību un jaunas darbavietas. Tādēļ, manuprāt, šāda jautājuma neiekļaušana Spānijas prezidentūras programmā ir trūkums, kas steidzami jālabo. ']"
22, 12. Vienas minūtes runas par politiski svarīgiem jautājumiem,"  Maria do Céu Patrão Neves  (PPE).   – (PT) Priekšsēdētāja kungs, kolēģi deputāti, vairākas dalībvalstis ir smagi cietušas sliktu laika apstākļu dēļ, it sevišķi pagājušā gada decembrī, un tam ir bijušas katastrofālas sekas lauksaimniecībā. Portugāle ir viena no šādām valstīm — 23. decembrī tā piedzīvoja smagas lietusgāzes, krusu un sniega vētras, kas izpostīja rietumu un Algarves reģionu. Tas nodarījis zaudējumus vairāk nekā 80 miljonu eiro apmērā un ietekmējis aptuveni tūkstoš lauksaimnieku, kuru labība gājusi bojā un kuriem nav nekādu iespēju turpmākajos mēnešos atsākt ražošanu. Piemēram, siltumnīcas stādījumu 2010. gada ražas sezona ir neatgriezeniski iznīcināta, un 90 % infrastruktūras nav iespējams savest kārtībā.Ņemot vērā, ka, pirmkārt, dabas katastrofas ir cikliskas parādības, kurām klimata pārmaiņu dēļ paredz pieaugumu gan biežumā, gan intensitātē, ka, otrkārt, zaudējumu segšanai vienmēr nepieciešamās kompensācijas ir nepietiekamas un ka, treškārt, šādu katastrofu radītos zaudējumus nesedz Eiropas Savienības Solidaritātes fonds, mēs uzskatām — obligāti un steidzami jāizveido Eiropas nodrošinājuma sistēma, lai…(Priekšsēdētājs pārtrauca runātāju) ",Maria do Céu Patrão Neves  (PPE).,3,151,not_available,"['por', 'por', 'por']","['  Maria do Céu Patrão Neves  (PPE).   – (PT) Priekšsēdētāja kungs, kolēģi deputāti, vairākas dalībvalstis ir smagi cietušas sliktu laika apstākļu dēļ, it sevišķi pagājušā gada decembrī, un tam ir bijušas katastrofālas sekas lauksaimniecībā. Portugāle ir viena no šādām valstīm — 23. decembrī tā piedzīvoja smagas lietusgāzes, krusu un sniega vētras, kas izpostīja rietumu un Algarves reģionu. Tas nodarījis zaudējumus vairāk nekā 80 miljonu eiro apmērā un ietekmējis aptuveni tūkstoš lauksaimnieku, kuru labība gājusi bojā un kuriem nav nekādu iespēju turpmākajos mēnešos atsākt ražošanu. Piemēram, siltumnīcas stādījumu 2010. gada ražas sezona ir neatgriezeniski iznīcināta, un 90 % infrastruktūras nav iespējams savest kārtībā.', 'Ņemot vērā, ka, pirmkārt, dabas katastrofas ir cikliskas parādības, kurām klimata pārmaiņu dēļ paredz pieaugumu gan biežumā, gan intensitātē, ka, otrkārt, zaudējumu segšanai vienmēr nepieciešamās kompensācijas ir nepietiekamas un ka, treškārt, šādu katastrofu radītos zaudējumus nesedz Eiropas Savienības Solidaritātes fonds, mēs uzskatām — obligāti un steidzami jāizveido Eiropas nodrošinājuma sistēma, lai…', '(Priekšsēdētājs pārtrauca runātāju) ']"
23, 12. Vienas minūtes runas par politiski svarīgiem jautājumiem,"  Ricardo Cortés Lastra  (S&D).   – (ES) Priekšsēdētāja kungs, es vispirms vēlētos izteikt līdzjūtību un solidaritāti Haiti zemestrīces upuriem.Šai postošajai zemestrīcei, kas sekoja pēc četrām viesuļvētrām pērn, nevajadzētu likt mums aizmirst, kādā stāvoklī valsts bija pirms tam — 80 % iedzīvotāju dzīvoja nabadzībā. Haiti, kur ir visaugstākais zīdaiņu mirstības rādītājs Amerikā, lielas iedzīvotāju daļas ikdienu jau tā veidoja nabadzība, vardarbība un masveida emigrācija.Šādos apstākļos mums ir ne tikai jāsūta humānā palīdzība, bet arī jānodrošina, ka darbi turpinās pēc tam, kad Haiti vairs nebūs plašsaziņas līdzekļu uzmanības centrā, un ka Haiti attīstība ir ilgtspējīga, saskaņota un līdzsvarota. ",Ricardo Cortés Lastra  (S&D).,3,95,not_available,"['spa', 'spa', 'spa']","['  Ricardo Cortés Lastra  (S&D).   – (ES) Priekšsēdētāja kungs, es vispirms vēlētos izteikt līdzjūtību un solidaritāti Haiti zemestrīces upuriem.', 'Šai postošajai zemestrīcei, kas sekoja pēc četrām viesuļvētrām pērn, nevajadzētu likt mums aizmirst, kādā stāvoklī valsts bija pirms tam — 80 % iedzīvotāju dzīvoja nabadzībā. Haiti, kur ir visaugstākais zīdaiņu mirstības rādītājs Amerikā, lielas iedzīvotāju daļas ikdienu jau tā veidoja nabadzība, vardarbība un masveida emigrācija.', 'Šādos apstākļos mums ir ne tikai jāsūta humānā palīdzība, bet arī jānodrošina, ka darbi turpinās pēc tam, kad Haiti vairs nebūs plašsaziņas līdzekļu uzmanības centrā, un ka Haiti attīstība ir ilgtspējīga, saskaņota un līdzsvarota. ']"
24, 12. Vienas minūtes runas par politiski svarīgiem jautājumiem,"  Corina Creţu  (S&D).   – (RO) Trīs gadus pēc pievienošanās Eiropas Savienībai Rumānijas un Bulgārijas valstspiederīgie joprojām nav pilntiesīgi Eiropas Savienības pilsoņi. Kaut gan darbaspēka brīva pārvietošanās ir svarīgs Eiropas integrācijas princips, 10 dalībvalstīs joprojām ir spēkā ierobežojumi Rumānijas un Bulgārijas pilsoņiem.Ir pieņemts lēmums pagarināt termiņu noteikumiem, kas ierobežo piekļuvi iekšzemes darba tirgiem, kaut gan Eiropas Komisijas sagatavotajās rekomendācijās ir norādīts, ka Austrumeiropas darba ņēmēju pārvietošanās nav nelabvēlīgi ietekmējusi darba tirgus un faktiski ir veicinājusi ekonomisko izaugsmi. Diemžēl ekonomisko krīzi tagad izmanto kā argumentu šo ierobežojumu saglabāšanai, atsaucoties uz pašmāju bezdarba līmeni un imigrantu radīto spiedienu uz darba tirgiem.Taču īstenība ir tāda, ka iespējamās sekas darba ņēmēju pieplūdumam no jaunajām dalībvalstīm tiek pārspīlētas, turklāt šķēršļu saglabāšana kavē izmantot darba ņēmēju pilno potenciālu, lai izietu no pašreizējās krīzes un veicinātu Eiropas ekonomikas atveseļošanos. Tādēļ es ceru, ka jaunā Eiropas Komisija pārliecinošāk vērsīsies pret šiem protekcionisma pasākumiem, kuri diskriminējoši ierobežo darbaspēka brīvu pārvietošanos Eiropas Savienībā. ",Corina Creţu  (S&D).,3,154,not_available,"['rum', 'rum', 'rum']","['  Corina Creţu  (S&D).   – (RO) Trīs gadus pēc pievienošanās Eiropas Savienībai Rumānijas un Bulgārijas valstspiederīgie joprojām nav pilntiesīgi Eiropas Savienības pilsoņi. Kaut gan darbaspēka brīva pārvietošanās ir svarīgs Eiropas integrācijas princips, 10 dalībvalstīs joprojām ir spēkā ierobežojumi Rumānijas un Bulgārijas pilsoņiem.', 'Ir pieņemts lēmums pagarināt termiņu noteikumiem, kas ierobežo piekļuvi iekšzemes darba tirgiem, kaut gan Eiropas Komisijas sagatavotajās rekomendācijās ir norādīts, ka Austrumeiropas darba ņēmēju pārvietošanās nav nelabvēlīgi ietekmējusi darba tirgus un faktiski ir veicinājusi ekonomisko izaugsmi. Diemžēl ekonomisko krīzi tagad izmanto kā argumentu šo ierobežojumu saglabāšanai, atsaucoties uz pašmāju bezdarba līmeni un imigrantu radīto spiedienu uz darba tirgiem.', 'Taču īstenība ir tāda, ka iespējamās sekas darba ņēmēju pieplūdumam no jaunajām dalībvalstīm tiek pārspīlētas, turklāt šķēršļu saglabāšana kavē izmantot darba ņēmēju pilno potenciālu, lai izietu no pašreizējās krīzes un veicinātu Eiropas ekonomikas atveseļošanos. Tādēļ es ceru, ka jaunā Eiropas Komisija pārliecinošāk vērsīsies pret šiem protekcionisma pasākumiem, kuri diskriminējoši ierobežo darbaspēka brīvu pārvietošanos Eiropas Savienībā. ']"
25, 12. Vienas minūtes runas par politiski svarīgiem jautājumiem,"  Izaskun Bilbao Barandica  (ALDE).   – (ES) Ko gan jūs domātu, dāmas un kungi, ja policisti un valsts galveno televīzijas kanālu pārstāvji ar kamerām pārraidītu jūsu arestu tiešajā ēterā?Kā gan jūs justos, ja jūs apsūdzētu par piederību bruņotam grupējumam, arestētu un noturētu izolatorā piecas dienas, pēc tam uzliktu arestu jūsu mantai, bet jūs pašu ieliktu cietumā uz laiku līdz pusotram gadam par to vien, ka esat galvenais redaktors vienīgajam laikrakstam, kurš tolaik tika publicēts basku valodā un kurš tika slēgts bez lietas izskatīšanas tiesā?Turklāt lielākā daļa cietumnieku ir atzinuši, ka tika spīdzināti. Ko gan jūs domātu, ja pēc septiņiem gadiem jūs vēl joprojām gaidītu tiesu, kaut gan prokurors ir pieprasījis lietu slēgt pierādījumu trūkuma dēļ? Ko jūs domājat par to, ka šai lietai ir arī cita daļa, lietas finansiālā puse, un ka arī tajā tiek gaidīta tiesas izskatīšana?Šādā situācijā jau kopš 2003. gada februāra, kad Spānijas Augstākā tiesa nolēma bez lietas izskatīšanas slēgt laikrakstu „Egunkaria”, ir desmit cilvēki, vairums no viņiem — žurnālisti. Pēc visa iepriekš minētā pašreiz notiek tiesvedība, kas, ņemot vērā laiku, kurš jau ir pagājis, un aprakstītos apstākļus, ir netaisnīga pret apsūdzētajiem un viņu tiesībām. ",Izaskun Bilbao Barandica  (ALDE).,4,188,not_available,"['spa', 'spa', 'spa', 'spa']","['  Izaskun Bilbao Barandica  (ALDE).   – (ES) Ko gan jūs domātu, dāmas un kungi, ja policisti un valsts galveno televīzijas kanālu pārstāvji ar kamerām pārraidītu jūsu arestu tiešajā ēterā?', 'Kā gan jūs justos, ja jūs apsūdzētu par piederību bruņotam grupējumam, arestētu un noturētu izolatorā piecas dienas, pēc tam uzliktu arestu jūsu mantai, bet jūs pašu ieliktu cietumā uz laiku līdz pusotram gadam par to vien, ka esat galvenais redaktors vienīgajam laikrakstam, kurš tolaik tika publicēts basku valodā un kurš tika slēgts bez lietas izskatīšanas tiesā?', 'Turklāt lielākā daļa cietumnieku ir atzinuši, ka tika spīdzināti. Ko gan jūs domātu, ja pēc septiņiem gadiem jūs vēl joprojām gaidītu tiesu, kaut gan prokurors ir pieprasījis lietu slēgt pierādījumu trūkuma dēļ? Ko jūs domājat par to, ka šai lietai ir arī cita daļa, lietas finansiālā puse, un ka arī tajā tiek gaidīta tiesas izskatīšana?', 'Šādā situācijā jau kopš 2003. gada februāra, kad Spānijas Augstākā tiesa nolēma bez lietas izskatīšanas slēgt laikrakstu „Egunkaria”, ir desmit cilvēki, vairums no viņiem — žurnālisti. Pēc visa iepriekš minētā pašreiz notiek tiesvedība, kas, ņemot vērā laiku, kurš jau ir pagājis, un aprakstītos apstākļus, ir netaisnīga pret apsūdzētajiem un viņu tiesībām. ']"
