,agenda_item,text,speaker,number_p,number_w,chair,language_ps,ps
175, 12. Обяснение на вот (продължение),"  Aldo Patriciello  (PPE),  в писмена форма. − (IT) През юли 2002 г. Комисията прие регламент за групово освобождаване за моторните превозни средства по отношение на споразуменията за разпространение, който замени Регламент (ЕО) № 1475/95.Главната цел на политиката на Комисията в областта на конкуренцията е да позволи на засегнатите дружества да се възползват от зона за безопасност чрез приемане на регламенти за групово освобождаване, предназначени да гарантират правилен надзор на пазара. Следователно груповите освобождавания допринасят за правната сигурност и последователното прилагане на европейските правила. Трябва да изтъкна, че значението на това разискване се състои, фактически, в очертаване на насоките, определящи бъдещата правна рамка, която след изтичане на срока на регламента следва да урежда споразуменията за разпространение на моторни превозни средства и свързаните с тях следпродажбени услуги.Следователно, за да се вземе решение за подходящ обхват на груповото освобождаване, приложимо спрямо автомобилната промишленост, настоятелно призовавам Комисията да вземе предвид условията за конкуренция на големите пазари и необходимостта да се направи основно разграничение между пазарите за продажба на нови моторни превозни средства и тези за услуги, свързани с ремонтни дейности и поддръжка, и/или за разпространение на резервни части. Бих искал да подчертая отново значението на подкрепата за такива предложения. Те обезсърчават индивидуалната инициатива в полза на конкуренцията между дилърите и извършващите ремонтни дейности и насърчават развитието на сектора. ","Aldo Patriciello  (PPE),",3,216,not_available,"['ita', 'ita', 'ita']","['  Aldo Patriciello  (PPE),  в писмена форма. − (IT) През юли 2002 г. Комисията прие регламент за групово освобождаване за моторните превозни средства по отношение на споразуменията за разпространение, който замени Регламент (ЕО) № 1475/95.', 'Главната цел на политиката на Комисията в областта на конкуренцията е да позволи на засегнатите дружества да се възползват от зона за безопасност чрез приемане на регламенти за групово освобождаване, предназначени да гарантират правилен надзор на пазара. Следователно груповите освобождавания допринасят за правната сигурност и последователното прилагане на европейските правила. Трябва да изтъкна, че значението на това разискване се състои, фактически, в очертаване на насоките, определящи бъдещата правна рамка, която след изтичане на срока на регламента следва да урежда споразуменията за разпространение на моторни превозни средства и свързаните с тях следпродажбени услуги.', 'Следователно, за да се вземе решение за подходящ обхват на груповото освобождаване, приложимо спрямо автомобилната промишленост, настоятелно призовавам Комисията да вземе предвид условията за конкуренция на големите пазари и необходимостта да се направи основно разграничение между пазарите за продажба на нови моторни превозни средства и тези за услуги, свързани с ремонтни дейности и поддръжка, и/или за разпространение на резервни части. Бих искал да подчертая отново значението на подкрепата за такива предложения. Те обезсърчават индивидуалната инициатива в полза на конкуренцията между дилърите и извършващите ремонтни дейности и насърчават развитието на сектора. ']"
176, 12. Обяснение на вот (продължение),"  Robert Rochefort  (ALDE),  в писмена форма. – (FR) Скоро изтича срокът на така наречения регламент за „групово освобождаване“, въведен на европейско равнище през 2002 г. за засилване на конкуренцията в сектора на моторните превозни средства и за предоставяне на реални ползи за потребителите. В своето предложение за преработка Комисията въвежда промени, които ще имат тревожни последици за потребителите по отношение на възможностите за избор, качеството и цената. Ето защо ние използваме това предложение за резолюция, което аз подкрепих, за да изразим ясно нашите резерви по отношение на някои от внесените предложения. По-конкретно, имам предвид задължението за „предлагане на една марка“, което ще има отрицателен ефект върху избора на потребителите и независимостта на дилърите по отношение на производителите. Бих искал също така да изразя загрижеността си по отношение липсата на гаранции за подходящ достъп на всички заинтересовани страни до техническа информация и резервни части, което всъщност ще ограничи свободата на избора на дилъра или собственика на гараж, към когото биха се обърнали потребителите. Накрая, нека си припомним, че Комисията трябва спешно да се заеме с новите форми на антиконкурентно обвързване на потребителите, като условието следпродажбеното обслужване да зависи от ремонта или поддръжката на МПС изключително в мрежата на конкретната марка. ","Robert Rochefort  (ALDE),",1,199,not_available,['fra'],"['  Robert Rochefort  (ALDE),  в писмена форма. – (FR) Скоро изтича срокът на така наречения регламент за „групово освобождаване“, въведен на европейско равнище през 2002 г. за засилване на конкуренцията в сектора на моторните превозни средства и за предоставяне на реални ползи за потребителите. В своето предложение за преработка Комисията въвежда промени, които ще имат тревожни последици за потребителите по отношение на възможностите за избор, качеството и цената. Ето защо ние използваме това предложение за резолюция, което аз подкрепих, за да изразим ясно нашите резерви по отношение на някои от внесените предложения. По-конкретно, имам предвид задължението за „предлагане на една марка“, което ще има отрицателен ефект върху избора на потребителите и независимостта на дилърите по отношение на производителите. Бих искал също така да изразя загрижеността си по отношение липсата на гаранции за подходящ достъп на всички заинтересовани страни до техническа информация и резервни части, което всъщност ще ограничи свободата на избора на дилъра или собственика на гараж, към когото биха се обърнали потребителите. Накрая, нека си припомним, че Комисията трябва спешно да се заеме с новите форми на антиконкурентно обвързване на потребителите, като условието следпродажбеното обслужване да зависи от ремонта или поддръжката на МПС изключително в мрежата на конкретната марка. ']"
177, 12. Обяснение на вот (продължение),"  Raül Romeva i Rueda  (Verts/ALE),  в писмена форма. − (EN) Аз гласувах „за“ тази резолюция, заедно с голямото мнозинство в Парламента. ","Raül Romeva i Rueda  (Verts/ALE),",1,21,not_available,['eng'],"['  Raül Romeva i Rueda  (Verts/ALE),  в писмена форма. − (EN) Аз гласувах „за“ тази резолюция, заедно с голямото мнозинство в Парламента. ']"
178, 12. Обяснение на вот (продължение),"  Regina Bastos  (PPE),  в писмена форма. − (PT) Ракът е сред най-големите предизвикателства за здравеопазването в Европа: това е втората най-важна причина за смъртност в ЕС, като 3 милиона души заболяват всяка година, а 1,7 милиона умират. Според Световната здравна организация най-малко една-трета от всички случаи на рак се предотвратими. Следователно изключително важно е съответните заинтересовани страни в рамките на Европейския съюз да се ангажират с колективни усилия срещу рака. Една от целите на предложението, представено от Комисията, за „Европейско партньорство за действия за борба с рака за периода 2009-2013 г.“ е да бъдат подкрепени държавите-членки в усилията им да се справят с рака чрез предоставяне на рамка за набелязване и съвместно ползване на информация, капацитет и експертни познания в сферата на профилактиката и контрола на раковите заболявания и посредством включване на съответните заинтересовани страни на в целия Европейски съюз в съвместни действия. Приветствам целта за намаляване на тежестта, свързана с раковите заболявания, чрез въвеждане на 100% скрининг сред населението за рак на гърдата, шийката на матката и колоректалния рак до 2013 г. и настоятелно призовавам държавите-членки да изпълнят гореспоменатите насоки. Поради изтъкнатите причини гласувах в подкрепа на доклада „Действия срещу рака: европейско партньорство“. ","Regina Bastos  (PPE),",1,201,not_available,['por'],"['  Regina Bastos  (PPE),  в писмена форма. − (PT) Ракът е сред най-големите предизвикателства за здравеопазването в Европа: това е втората най-важна причина за смъртност в ЕС, като 3 милиона души заболяват всяка година, а 1,7 милиона умират. Според Световната здравна организация най-малко една-трета от всички случаи на рак се предотвратими. Следователно изключително важно е съответните заинтересовани страни в рамките на Европейския съюз да се ангажират с колективни усилия срещу рака. Една от целите на предложението, представено от Комисията, за „Европейско партньорство за действия за борба с рака за периода 2009-2013 г.“ е да бъдат подкрепени държавите-членки в усилията им да се справят с рака чрез предоставяне на рамка за набелязване и съвместно ползване на информация, капацитет и експертни познания в сферата на профилактиката и контрола на раковите заболявания и посредством включване на съответните заинтересовани страни на в целия Европейски съюз в съвместни действия. Приветствам целта за намаляване на тежестта, свързана с раковите заболявания, чрез въвеждане на 100% скрининг сред населението за рак на гърдата, шийката на матката и колоректалния рак до 2013 г. и настоятелно призовавам държавите-членки да изпълнят гореспоменатите насоки. Поради изтъкнатите причини гласувах в подкрепа на доклада „Действия срещу рака: европейско партньорство“. ']"
179, 12. Обяснение на вот (продължение),"  Vilija Blinkevičiūtė  (S&D),  в писмена форма. − (LT) Гласувах в подкрепа на доклада, защото Европейското партньорство за действия срещу рака за периода 2009-2013 г., предложено от Европейската комисия, е отлична инициатива за по-ефективна борба с това ужасно заболяване. Ракът е една от главните сфери на действие от страна на Комисията в областта на общественото здраве, тъй като всяка година 3,2 милиона европейци получават диагнозата рак, което го прави втората най-честа причина за смърт след сърдечно-съдовите заболявания. Предложеното от Комисията партньорство има за цел подкрепа за държавите-членки в усилията им да се справят с рака чрез предоставяне на рамка за набелязване и съвместно ползване на информация, капацитет и експертни познания в сферата на профилактиката и контрола на раковите заболявания. Бих искала да подчертая, че само чрез ангажиране на всички съответни заинтересовани страни в Европейския съюз с колективни усилия можем значително да намалим броя на случаите на това заболяване в Европа. Съгласна съм с призива на Европейския парламент към Комисията и държавите-членки за понататъшно разработване и утвърждаване на инициативи, които предоставят на раково болните подкрепа както пряко, така и непряко. Съгласна съм също, че Комисията и държавите-членки трябва да гарантират, че във всички държави-членки е налице равен достъп до лекарства за лечение на рака за всички, нуждаещи се от тях пациенти. Следователно настоящото партньорство за борба срещу рака по инициатива на Комисията е много важна крачка към постигането на общото социално и политическо партньорство за цяла Европа, което има за цел намаляването на тежестта, свързана с раковите заболявания в Европа. ","Vilija Blinkevičiūtė  (S&D),",1,257,not_available,['lit'],"['  Vilija Blinkevičiūtė  (S&D),  в писмена форма. − (LT) Гласувах в подкрепа на доклада, защото Европейското партньорство за действия срещу рака за периода 2009-2013 г., предложено от Европейската комисия, е отлична инициатива за по-ефективна борба с това ужасно заболяване. Ракът е една от главните сфери на действие от страна на Комисията в областта на общественото здраве, тъй като всяка година 3,2 милиона европейци получават диагнозата рак, което го прави втората най-честа причина за смърт след сърдечно-съдовите заболявания. Предложеното от Комисията партньорство има за цел подкрепа за държавите-членки в усилията им да се справят с рака чрез предоставяне на рамка за набелязване и съвместно ползване на информация, капацитет и експертни познания в сферата на профилактиката и контрола на раковите заболявания. Бих искала да подчертая, че само чрез ангажиране на всички съответни заинтересовани страни в Европейския съюз с колективни усилия можем значително да намалим броя на случаите на това заболяване в Европа. Съгласна съм с призива на Европейския парламент към Комисията и държавите-членки за понататъшно разработване и утвърждаване на инициативи, които предоставят на раково болните подкрепа както пряко, така и непряко. Съгласна съм също, че Комисията и държавите-членки трябва да гарантират, че във всички държави-членки е налице равен достъп до лекарства за лечение на рака за всички, нуждаещи се от тях пациенти. Следователно настоящото партньорство за борба срещу рака по инициатива на Комисията е много важна крачка към постигането на общото социално и политическо партньорство за цяла Европа, което има за цел намаляването на тежестта, свързана с раковите заболявания в Европа. ']"
