,agenda_item,text,speaker,number_p,number_w,chair,language_ps,ps
0, 1. Откриване на заседанието,ПОД ПРЕДСЕДАТЕЛСТВОТО НА: г-н MARTÍNEZ MARTÍNEZ Заместник-председател,ПОД ПРЕДСЕДАТЕЛСТВОТО НА: г-н MARTÍNEZ MARTÍNEZ,1,9,not_available,['bul'],['ПОД ПРЕДСЕДАТЕЛСТВОТО НА: г-н MARTÍNEZ MARTÍNEZ Заместник-председател']
1, 3. Европейска инвестиционна банка (ЕИБ) – Годишен доклад за 2008 г. (разискване),"  Председател.   – Първата точка е доклада (A7-0062/2010) на г-н Deutsch, от името на комисията по бюджетен контрол, относно годишния доклад на Европейската инвестиционна банка за 2008 г. (2009/2166 (INI). ",Председател.,1,32,not_available,['bul'],"['  Председател.   – Първата точка е доклада (A7-0062/2010) на г-н Deutsch, от името на комисията по бюджетен контрол, относно годишния доклад на Европейската инвестиционна банка за 2008 г. (2009/2166 (INI). ']"
2, 3. Европейска инвестиционна банка (ЕИБ) – Годишен доклад за 2008 г. (разискване),"  Tamás Deutsch,  докладчик. – (HU) Г-н председател, госпожи и господа, г-н Мейщад, „Европейска инвестиционна банка – Годишен доклад за 2008 г.“. Това е наименованието на настоящата точка от дневния ред. Този доклад обаче е много повече от анализ на дейността на Европейската инвестиционна банка преди две години.Госпожи и господа, ние чуваме това ден след ден и считам, че трябва да укрепим Съюза, за да достигнем края на една епоха и началото на нова. Влизането в сила преди около шест месеца на Договора от Лисабон, от една страна, и световната финансова и икономическа криза, нейните последици и реакцията на Европейския съюз, от друга, определено означават, че сме достигнали края на една епоха в съществуването на ЕС и че започва нова ера.С други думи, през второто десетилетие на 21-и век започва нова ера в съществуването на Европейския съюз. Този доклад е изготвен през тази нова епоха и считам, че Европейският парламент и Европейската инвестиционна банка ще трябва да отговорят на нейните най-съществени въпроси и предизвикателства. Докладът се отнася за дейността на една банка, на една финансова институция преди две години и е необичайно, че въпреки условията на глобална финансова и икономическа криза, можем да кажем, че сме удовлетворени от дейността на тази банка и институция. Преди две години Европейската инвестиционна банка реагира бързо и ефективно на разгръщащата се световна финансова и икономическа криза чрез засилване на кредитната си дейност, най-вече увеличавайки кредитите, предоставяни на малки и средни предприятия, и, от друга страна, чрез участие с целия си наличен потенциал в прилагането на Европейския план за икономическо възстановяване.Договорът от Лисабон влезе в сила преди шест месеца. Той осигурява средства и възможности за по-нататъшно засилване на процеса на обновяване на организационната, надзорната и същностната структура на Европейската инвестиционна банка. В началото на 2008 г., преди Договорът от Лисабон да влезе в сила, банката отбеляза значителен напредък в това отношение. Също толкова забележимо е, че Европейската инвестиционна банка съзнателно се подготвя за финансовите перспективи след 2014 г. с възможност да се включи във финансирането на регионални макроикономически стратегии и подпомагайки развитието на селските райони, на нови енергоизточници и на природосъобразни инвестиции, както и развитието на инфраструктурата. Друг аспект, който според нас е съществен и поради това е отразен в доклада, е, че Европейската инвестиционна банка следва да участва във финансирането на Стратегия „ЕС 2020“, чиято ратификация предстои и която е съсредоточена върху създаването на работни места. Всъщност именно съображението да се подпомогне създаването на работни места доведе до финансирането от страна на Европейската инвестиционна банка на малки и средни предприятия.Накрая, бих искал да привлека вниманието ви върху два въпроса. Считам за съществено, че Европейската инвестиционна банка продължава да подкрепя премахването на неравенството по отношение на инфраструктурата в рамките на Европейския съюз. Важно е да се подпомагат програми, съдействащи за изравняване в ЕС на стандартите в областта на инфраструктурата.И не на последно място, през последните години Европейската инвестиционна банка винаги е получавала необходимата за дейността й подкрепа от страна на Европейския парламент. Въз основа на подготвителната работа, проведена през последните няколко месеца, считам, че вземайки предвид конструктивния критичен дух, присъстващ в доклада, банката ще продължи да бъде подкрепяна от Европейския парламент в своята дейност. Благодаря за вниманието и очаквам разискването с интерес. ","Tamás Deutsch,",6,535,not_available,"['hun', 'hun', 'hun', 'hun', 'hun', 'hun']","['  Tamás Deutsch,  докладчик. – (HU) Г-н председател, госпожи и господа, г-н Мейщад, „Европейска инвестиционна банка – Годишен доклад за 2008 г.“. Това е наименованието на настоящата точка от дневния ред. Този доклад обаче е много повече от анализ на дейността на Европейската инвестиционна банка преди две години.', 'Госпожи и господа, ние чуваме това ден след ден и считам, че трябва да укрепим Съюза, за да достигнем края на една епоха и началото на нова. Влизането в сила преди около шест месеца на Договора от Лисабон, от една страна, и световната финансова и икономическа криза, нейните последици и реакцията на Европейския съюз, от друга, определено означават, че сме достигнали края на една епоха в съществуването на ЕС и че започва нова ера.', 'С други думи, през второто десетилетие на 21-и век започва нова ера в съществуването на Европейския съюз. Този доклад е изготвен през тази нова епоха и считам, че Европейският парламент и Европейската инвестиционна банка ще трябва да отговорят на нейните най-съществени въпроси и предизвикателства. Докладът се отнася за дейността на една банка, на една финансова институция преди две години и е необичайно, че въпреки условията на глобална финансова и икономическа криза, можем да кажем, че сме удовлетворени от дейността на тази банка и институция. Преди две години Европейската инвестиционна банка реагира бързо и ефективно на разгръщащата се световна финансова и икономическа криза чрез засилване на кредитната си дейност, най-вече увеличавайки кредитите, предоставяни на малки и средни предприятия, и, от друга страна, чрез участие с целия си наличен потенциал в прилагането на Европейския план за икономическо възстановяване.', 'Договорът от Лисабон влезе в сила преди шест месеца. Той осигурява средства и възможности за по-нататъшно засилване на процеса на обновяване на организационната, надзорната и същностната структура на Европейската инвестиционна банка. В началото на 2008 г., преди Договорът от Лисабон да влезе в сила, банката отбеляза значителен напредък в това отношение. Също толкова забележимо е, че Европейската инвестиционна банка съзнателно се подготвя за финансовите перспективи след 2014 г. с възможност да се включи във финансирането на регионални макроикономически стратегии и подпомагайки развитието на селските райони, на нови енергоизточници и на природосъобразни инвестиции, както и развитието на инфраструктурата. Друг аспект, който според нас е съществен и поради това е отразен в доклада, е, че Европейската инвестиционна банка следва да участва във финансирането на Стратегия „ЕС 2020“, чиято ратификация предстои и която е съсредоточена върху създаването на работни места. Всъщност именно съображението да се подпомогне създаването на работни места доведе до финансирането от страна на Европейската инвестиционна банка на малки и средни предприятия.', 'Накрая, бих искал да привлека вниманието ви върху два въпроса. Считам за съществено, че Европейската инвестиционна банка продължава да подкрепя премахването на неравенството по отношение на инфраструктурата в рамките на Европейския съюз. Важно е да се подпомагат програми, съдействащи за изравняване в ЕС на стандартите в областта на инфраструктурата.', 'И не на последно място, през последните години Европейската инвестиционна банка винаги е получавала необходимата за дейността й подкрепа от страна на Европейския парламент. Въз основа на подготвителната работа, проведена през последните няколко месеца, считам, че вземайки предвид конструктивния критичен дух, присъстващ в доклада, банката ще продължи да бъде подкрепяна от Европейския парламент в своята дейност. Благодаря за вниманието и очаквам разискването с интерес. ']"
