,agenda_item,text,speaker,number_p,number_w,chair,language_ps,ps
34, 4. Jocurile de noroc on-line în contextul unor hotărâri recente ale Curţii de Justiţie (dezbatere),"  Lara Comi  (PPE).   – (IT) Dle preşedinte, doamnelor şi domnilor, aş dori să încep cu hotărârea Curţii Europene de Justiţie, deoarece posibilitatea ca un stat membru să le interzică operatorilor privaţi să ofere servicii de jocuri de noroc online subliniază necesitatea de a standardiza o piaţă care este foarte profitabilă, dar şi foarte riscantă pentru consumatori.Prin urmare, în lipsa unei armonizări la nivel european a jocurilor de noroc, fiecare ţară are libertatea de a alege propriul nivel de protecţie. De multe ori, este imposibil să se identifice unde începe şi unde se termină aplicarea unei astfel de restricţii. De fapt, în timp ce Comisia a lansat o serie de proceduri privind încălcarea dreptului comunitar împotriva unor ţări – printre care se numără şi Italia – pentru că au încălcat principiul liberei circulaţii a serviciilor, Curtea Europeană, dimpotrivă, a susţinut decizia restrictivă a Portugaliei.În acest context, instituţiile europene au atribuţia fundamentală de a orienta sectorul jocurilor de noroc printr-un proces de reglementare care este pe deplin armonizat în toate statele membre la nivelul UE. Prin urmare, este necesară depăşirea intereselor economice individuale şi asigurarea unui nivel semnificativ de protecţie a consumatorilor, în special a copiilor, care sunt principalele victime ale infracţiunilor şi fraudei în astfel de situaţii. ",Lara Comi  (PPE).,3,206,not_available,"['ita', 'ita', 'ita']","['  Lara Comi  (PPE).   – (IT) Dle preşedinte, doamnelor şi domnilor, aş dori să încep cu hotărârea Curţii Europene de Justiţie, deoarece posibilitatea ca un stat membru să le interzică operatorilor privaţi să ofere servicii de jocuri de noroc online subliniază necesitatea de a standardiza o piaţă care este foarte profitabilă, dar şi foarte riscantă pentru consumatori.', 'Prin urmare, în lipsa unei armonizări la nivel european a jocurilor de noroc, fiecare ţară are libertatea de a alege propriul nivel de protecţie. De multe ori, este imposibil să se identifice unde începe şi unde se termină aplicarea unei astfel de restricţii. De fapt, în timp ce Comisia a lansat o serie de proceduri privind încălcarea dreptului comunitar împotriva unor ţări – printre care se numără şi Italia – pentru că au încălcat principiul liberei circulaţii a serviciilor, Curtea Europeană, dimpotrivă, a susţinut decizia restrictivă a Portugaliei.', 'În acest context, instituţiile europene au atribuţia fundamentală de a orienta sectorul jocurilor de noroc printr-un proces de reglementare care este pe deplin armonizat în toate statele membre la nivelul UE. Prin urmare, este necesară depăşirea intereselor economice individuale şi asigurarea unui nivel semnificativ de protecţie a consumatorilor, în special a copiilor, care sunt principalele victime ale infracţiunilor şi fraudei în astfel de situaţii. ']"
35, 4. Jocurile de noroc on-line în contextul unor hotărâri recente ale Curţii de Justiţie (dezbatere),"  António Fernando Correia De Campos  (S&D).  – (PT) Dle preşedinte, doamnelor şi domnilor, ne aflăm în mijlocul unui conflict între două politici preţuite de Uniunea Europeană: pe de o parte, protecţia consumatorului şi ordinea publică şi, pe de altă parte, libertatea circulaţiei şi a furnizării serviciilor. În conformitate cu jurisprudenţa Curţii de Justiţie în această privinţă, statele membre ar trebui să îşi menţină autonomia şi legitimitatea în ceea ce priveşte reglementarea activităţii furnizorilor de jocuri de noroc convenţionale şi online. Acesta este un domeniu sensibil care afectează valorile sociale privind devierile de comportament legate de jocurile de noroc şi, de asemenea, afectează tradiţiile naţionale de direcţionare a sumelor primite din cadrul acestei pieţe către finanţarea domeniilor sociale. În ultimii câţiva ani, jurisprudenţa de la Luxemburg a formulat o linie coerentă şi consecventă de gândire judiciară, care ar trebui să determine instituţiile europene şi în special Comisia Europeană, să adopte o poziţie mai explicită. Acest lucru presupune crearea unui cadru de reglementare, care ţine cont de preocupările universale ale tuturor statelor membre în ceea ce priveşte prevenirea crimei organizate transfrontaliere, care utilizează aceste jocuri ca modalitate de extindere, precum şi în ceea ce priveşte asigurarea unei protecţii corespunzătoare a consumatorilor vulnerabili faţă de acest tip de jocuri de noroc online.Dle comisar Barnier, aşteptăm ca noua Comisie, care îşi începe acum mandatul, să se ocupe de această problemă în mod prioritar pe ordinea de zi. ",António Fernando Correia De Campos  (S&D).,4,234,not_available,"['por', 'por', 'por', 'por']","['  António Fernando Correia De Campos  (S&D).  – (PT) Dle preşedinte, doamnelor şi domnilor, ne aflăm în mijlocul unui conflict între două politici preţuite de Uniunea Europeană: pe de o parte, protecţia consumatorului şi ordinea publică şi, pe de altă parte, libertatea circulaţiei şi a furnizării serviciilor. ', 'În conformitate cu jurisprudenţa Curţii de Justiţie în această privinţă, statele membre ar trebui să îşi menţină autonomia şi legitimitatea în ceea ce priveşte reglementarea activităţii furnizorilor de jocuri de noroc convenţionale şi online. Acesta este un domeniu sensibil care afectează valorile sociale privind devierile de comportament legate de jocurile de noroc şi, de asemenea, afectează tradiţiile naţionale de direcţionare a sumelor primite din cadrul acestei pieţe către finanţarea domeniilor sociale. ', 'În ultimii câţiva ani, jurisprudenţa de la Luxemburg a formulat o linie coerentă şi consecventă de gândire judiciară, care ar trebui să determine instituţiile europene şi în special Comisia Europeană, să adopte o poziţie mai explicită. Acest lucru presupune crearea unui cadru de reglementare, care ţine cont de preocupările universale ale tuturor statelor membre în ceea ce priveşte prevenirea crimei organizate transfrontaliere, care utilizează aceste jocuri ca modalitate de extindere, precum şi în ceea ce priveşte asigurarea unei protecţii corespunzătoare a consumatorilor vulnerabili faţă de acest tip de jocuri de noroc online.', 'Dle comisar Barnier, aşteptăm ca noua Comisie, care îşi începe acum mandatul, să se ocupe de această problemă în mod prioritar pe ordinea de zi. ']"
36, 4. Jocurile de noroc on-line în contextul unor hotărâri recente ale Curţii de Justiţie (dezbatere),"  Oldřich Vlasák  (ECR).  – (CS) Doamnelor şi domnilor, după cum ştim cu toţii, jocurile de noroc au fost în mod tradiţional reglementate strict în majoritatea ţărilor UE. Bineînţeles, situaţia s-a schimbat de când internetul a devenit cea mai mare reţea de jocuri de noroc din lume. Este o realitate că evoluţiile tehnice legate de jocurile de noroc au avansat foarte rapid în întreaga lume, iar între timp, dispoziţiile juridice corespunzătoare nu pot reacţiona suficient de rapid.Cauzele privind jocurile de noroc online sunt trimise în mod frecvent în faţa Curţii Europene de Justiţie, ceea ce arată în mod clar că interpretarea şi aplicarea legislaţiei comunitare în domeniul jocurilor de noroc sunt ambigue. În plus, jocurile de noroc pe internet sunt privite ca „un domeniu gri” al legislaţiei.Consider că trebuie să respectăm faptul că fiecare stat a emis autorizaţii de jocuri de noroc în cadrul propriei jurisdicţii. În acelaşi timp, suntem de acord, la nivel general, că legislaţia naţională nu trebuie să încalce principiile UE privind activităţile comerciale şi furnizarea de servicii în cadrul UE. Totuşi, acest lucru presupune, în mod paradoxal, că, de exemplu, legislaţia cehă nu trebuie să le permită firmelor cehe să obţină o autorizaţie pentru a desfăşura jocuri de noroc online, însă Republica Cehă nu poate interzice firmelor de jocuri de noroc să îşi desfăşoare activitatea pe teritoriul său. Nu putem accepta o astfel de situaţie, la care se adaugă riscurile sociale, privind sănătatea şi siguranţa aferente jocurilor de noroc online sau aspectele fiscale conexe. ",Oldřich Vlasák  (ECR).,3,249,not_available,"['cze', 'cze', 'cze']","['  Oldřich Vlasák  (ECR).  – (CS) Doamnelor şi domnilor, după cum ştim cu toţii, jocurile de noroc au fost în mod tradiţional reglementate strict în majoritatea ţărilor UE. Bineînţeles, situaţia s-a schimbat de când internetul a devenit cea mai mare reţea de jocuri de noroc din lume. Este o realitate că evoluţiile tehnice legate de jocurile de noroc au avansat foarte rapid în întreaga lume, iar între timp, dispoziţiile juridice corespunzătoare nu pot reacţiona suficient de rapid.', 'Cauzele privind jocurile de noroc online sunt trimise în mod frecvent în faţa Curţii Europene de Justiţie, ceea ce arată în mod clar că interpretarea şi aplicarea legislaţiei comunitare în domeniul jocurilor de noroc sunt ambigue. În plus, jocurile de noroc pe internet sunt privite ca „un domeniu gri” al legislaţiei.', 'Consider că trebuie să respectăm faptul că fiecare stat a emis autorizaţii de jocuri de noroc în cadrul propriei jurisdicţii. În acelaşi timp, suntem de acord, la nivel general, că legislaţia naţională nu trebuie să încalce principiile UE privind activităţile comerciale şi furnizarea de servicii în cadrul UE. Totuşi, acest lucru presupune, în mod paradoxal, că, de exemplu, legislaţia cehă nu trebuie să le permită firmelor cehe să obţină o autorizaţie pentru a desfăşura jocuri de noroc online, însă Republica Cehă nu poate interzice firmelor de jocuri de noroc să îşi desfăşoare activitatea pe teritoriul său. Nu putem accepta o astfel de situaţie, la care se adaugă riscurile sociale, privind sănătatea şi siguranţa aferente jocurilor de noroc online sau aspectele fiscale conexe. ']"
37, 4. Jocurile de noroc on-line în contextul unor hotărâri recente ale Curţii de Justiţie (dezbatere),"  Sari Essayah  (PPE).   – (FI) Dle preşedinte, după cum vă amintiţi foarte bine, dle comisar Barnier, Parlamentul European a fost consecvent în politica sa când s-a opus includerii jocurilor de noroc în Directiva privind serviciile, întrucât jocurile de noroc nu sunt servicii ca atare: acestea sunt asociate cu riscul de dependenţă şi cu costurile sociale aferente acesteia. Integritatea sporturilor este, de asemenea, un aspect care, în opinia Parlamentului European, trebuie protejat, în special acum, după adoptarea Tratatului de la Lisabona, când avem competenţa de a aborda această problemă. Cu cât jocurile de noroc sunt mai puţin reglementate, cu atât mai mult sportul devine un mijloc de a acumula profituri şi devine predispus, de exemplu, la infracţiuni sub forma spălării de bani.Comisia trebuie să propună o soluţie care să ţină cont de politica consecventă a Parlamentului de a menţine jocurile de noroc în cadrul competenţei statelor membre, datorită naturii lor speciale. Cel puţin 12 cauze s-au prezentat în faţa Curţii de Justiţie a Uniunii Europene, ultima fiind cauza Liga Portuguesa. Cu toate acestea, nu este corect ca aceste cauze să avanseze numai sub formă de hotărâri ale Curţii sau ca urmare a procedurilor privind încălcarea dreptului comunitar. Este necesară o decizie politică privind aceste probleme, dar una care nu produce armonizare, deoarece în orice caz, statele membre sunt responsabile de costurile sociale şi de alte consecinţe adverse ale jocurilor de noroc.Trebuie să existe o politică logică şi cuprinzătoare privind jocurile de noroc, deoarece jocurile de noroc online reprezintă numai o facilitate şi nu presupun în sine că orice politică privind jocurile de noroc este o politică transfrontalieră. Dezvoltarea domeniului jocurilor de noroc online nu reprezintă o forţă a naturii care avansează în mod inexorabil. Există numeroase produse pe care magazinele online nu le pot vinde dincolo de graniţe, deci companiile de jocuri de noroc online trebuie, de asemenea, să respecte legislaţia din diferitele state membre.Dle comisar, aş dori să vă încurajez să redactaţi o carte verde privind jocurile de noroc. Aceasta ne-ar oferi, fără îndoială, mijloacele de combatere a jocurilor de noroc online care provin din afara Europei şi a problemelor provocate de jocurile de noroc. ",Sari Essayah  (PPE).,5,360,not_available,"['fin', 'fin', 'fin', 'fin', 'fin']","['  Sari Essayah  (PPE).   – (FI) Dle preşedinte, după cum vă amintiţi foarte bine, dle comisar Barnier, Parlamentul European a fost consecvent în politica sa când s-a opus includerii jocurilor de noroc în Directiva privind serviciile, întrucât jocurile de noroc nu sunt servicii ca atare: acestea sunt asociate cu riscul de dependenţă şi cu costurile sociale aferente acesteia. ', 'Integritatea sporturilor este, de asemenea, un aspect care, în opinia Parlamentului European, trebuie protejat, în special acum, după adoptarea Tratatului de la Lisabona, când avem competenţa de a aborda această problemă. Cu cât jocurile de noroc sunt mai puţin reglementate, cu atât mai mult sportul devine un mijloc de a acumula profituri şi devine predispus, de exemplu, la infracţiuni sub forma spălării de bani.', 'Comisia trebuie să propună o soluţie care să ţină cont de politica consecventă a Parlamentului de a menţine jocurile de noroc în cadrul competenţei statelor membre, datorită naturii lor speciale. Cel puţin 12 cauze s-au prezentat în faţa Curţii de Justiţie a Uniunii Europene, ultima fiind cauza Liga Portuguesa. Cu toate acestea, nu este corect ca aceste cauze să avanseze numai sub formă de hotărâri ale Curţii sau ca urmare a procedurilor privind încălcarea dreptului comunitar. Este necesară o decizie politică privind aceste probleme, dar una care nu produce armonizare, deoarece în orice caz, statele membre sunt responsabile de costurile sociale şi de alte consecinţe adverse ale jocurilor de noroc.', 'Trebuie să existe o politică logică şi cuprinzătoare privind jocurile de noroc, deoarece jocurile de noroc online reprezintă numai o facilitate şi nu presupun în sine că orice politică privind jocurile de noroc este o politică transfrontalieră. Dezvoltarea domeniului jocurilor de noroc online nu reprezintă o forţă a naturii care avansează în mod inexorabil. Există numeroase produse pe care magazinele online nu le pot vinde dincolo de graniţe, deci companiile de jocuri de noroc online trebuie, de asemenea, să respecte legislaţia din diferitele state membre.', 'Dle comisar, aş dori să vă încurajez să redactaţi o carte verde privind jocurile de noroc. Aceasta ne-ar oferi, fără îndoială, mijloacele de combatere a jocurilor de noroc online care provin din afara Europei şi a problemelor provocate de jocurile de noroc. ']"
38, 4. Jocurile de noroc on-line în contextul unor hotărâri recente ale Curţii de Justiţie (dezbatere),"  Catherine Stihler  (S&D).   – Dle preşedinte, aş dori să le mulţumesc vorbitorilor anteriori pentru contribuţiile lor şi colegei mele, Christel Schaldemose, pentru eforturile depuse în acest domeniu.După cum s-a menţionat anterior, jocurile de noroc nu sunt ca orice serviciu normal. Nu se exagerează subliniind consecinţele negative ale jocurilor de noroc, după cum au spus numeroşi colegi în această dimineaţă. Există două scale recunoscute la nivel internaţional care pot măsura un comportament problematic privind jocurile de noroc. Una se numeşte Scala gravităţii diagnostice statistice şi cealaltă Scala canadiană a gravităţii problemelor jocurilor de noroc. Aceasta a fost utilizată în regatul Unit şi se estimează că numai în Regatul Unit – un coleg olandez a spus că 1 % din populaţie este afectată – există între 236 000 şi 284 000 de adulţi care au probleme legate de jocurile de noroc.Care ar fi cifra în întreaga Uniune Europeană? Când ne gândim la acest lucru, dacă se redactează cartea verde, aş dori ca Comisia să obţină statistici corespunzătoare – un studiu privind efectele jocurilor de noroc şi ale jocurilor de noroc online asupra cetăţenilor UE. Consider că acestea ar reprezenta date utile, care ar aduce mai multe informaţii dezbaterii şi pe care le-am avea la îndemână. În ceea ce priveşte hotărârile CEJ, când analizăm cuvintele, „pentru a preveni desfăşurarea de jocuri de noroc pe internet în scopuri frauduloase sau de comitere de infracţiuni” şi predominanţa cartelurilor pe piaţa unică, subliniate de raportul privind concurenţa, trebuie să ne asigurăm că societăţile de jocuri de noroc online nu se înregistrează în altă ţară decât cea în care îşi desfăşoară activitatea pentru a ascunde practicile ilegale.Aştept cu nerăbdare să aflu noutăţi din partea dlui comisar Barnier. Dle comisar, vă urez noroc în noul rol. ",Catherine Stihler  (S&D).,5,289,not_available,"['rum', 'rum', 'rum', 'rum', 'rum']","['  Catherine Stihler  (S&D).   – Dle preşedinte, aş dori să le mulţumesc vorbitorilor anteriori pentru contribuţiile lor şi colegei mele, Christel Schaldemose, pentru eforturile depuse în acest domeniu.', 'După cum s-a menţionat anterior, jocurile de noroc nu sunt ca orice serviciu normal. Nu se exagerează subliniind consecinţele negative ale jocurilor de noroc, după cum au spus numeroşi colegi în această dimineaţă. Există două scale recunoscute la nivel internaţional care pot măsura un comportament problematic privind jocurile de noroc. Una se numeşte Scala gravităţii diagnostice statistice şi cealaltă Scala canadiană a gravităţii problemelor jocurilor de noroc. Aceasta a fost utilizată în regatul Unit şi se estimează că numai în Regatul Unit – un coleg olandez a spus că 1 % din populaţie este afectată – există între 236 000 şi 284 000 de adulţi care au probleme legate de jocurile de noroc.', 'Care ar fi cifra în întreaga Uniune Europeană? Când ne gândim la acest lucru, dacă se redactează cartea verde, aş dori ca Comisia să obţină statistici corespunzătoare – un studiu privind efectele jocurilor de noroc şi ale jocurilor de noroc online asupra cetăţenilor UE. Consider că acestea ar reprezenta date utile, care ar aduce mai multe informaţii dezbaterii şi pe care le-am avea la îndemână. ', 'În ceea ce priveşte hotărârile CEJ, când analizăm cuvintele, „pentru a preveni desfăşurarea de jocuri de noroc pe internet în scopuri frauduloase sau de comitere de infracţiuni” şi predominanţa cartelurilor pe piaţa unică, subliniate de raportul privind concurenţa, trebuie să ne asigurăm că societăţile de jocuri de noroc online nu se înregistrează în altă ţară decât cea în care îşi desfăşoară activitatea pentru a ascunde practicile ilegale.', 'Aştept cu nerăbdare să aflu noutăţi din partea dlui comisar Barnier. Dle comisar, vă urez noroc în noul rol. ']"
39, 4. Jocurile de noroc on-line în contextul unor hotărâri recente ale Curţii de Justiţie (dezbatere),"  Mairead McGuinness  (PPE).   – Dle preşedinte, doresc, de asemenea, să îl felicit pe dl comisar Barnier. Dle comisar, acesta nu este cel mai uşor subiect cu care să vă începeţi cariera în Comisie, dar aş îndrăzni să spun că predecesorul dvs., dl McCreevy, nu s-ar supăra dacă spun că îi plăcea agitaţia. Îi plăceau cursele şi este o persoană care poate paria.În mod evident, în această privinţă există două teorii diferite. Cu toate acestea, opinia Parlamentului este destul de clară în rezoluţia sa din 10 martie 2009 şi consider că merită să citez trei rânduri din această rezoluţie, care prevede că „statele membre au interesul şi dreptul de să-şi reglementeze şi să-şi controleze pieţele jocurilor de noroc”. De asemenea, prevede foarte clar că „operatorii de jocuri de noroc online trebuie să respecte legislaţia statelor membre în care prestează aceste servicii” şi că „o abordare exclusiv din perspectiva pieţei interne nu este adecvată în acest domeniu extrem de sensibil”.Problema pentru noi, în calitate de legiuitori, şi pentru statele membre, este că piaţa este cu mult înaintea noastră: evoluţiile din acest domeniu au depăşit legislaţia în vigoare şi vor continua să facă acest lucru. Indiferent dacă ne place sau nu, oamenilor le plac jocurile de noroc. Personal, aş prefera să cumpăr pantofi, dar altor persoane le plac alte lucruri. Sunt absolut de acord cu cei care au vorbit foarte clar despre problemele jocurilor de noroc, indiferent dacă sunt online sau nu. Intervin aspecte sociale foarte importante în momentul în care persoanele dependente merg prea departe. Dar să ne amintim, de asemenea, că statele membre promovează loteriile şi poate acest lucru este o formă legalizată de promovare a unei posibile dependenţe.Aşadar, acest aspect nu este clarificat dar, încă o dată, problema Parlamentului European şi a UE în general este că nu există consecvenţă între statele membre şi totuşi, cetăţenii noştri accesează servicii din afara ţării lor şi doresc să facă acest lucru. Cartea verde ar fi bine-venită: este o mare provocare să reuniţi toate informaţiile legate de acest subiect. Consider că problema constă imensul decalaj de informaţie şi cunoaştere şi este la latitudinea Comisiei să înainteze un document pentru a aborda această problemă. ",Mairead McGuinness  (PPE).,6,366,not_available,"['rum', 'rum', 'rum', 'rum', 'rum', 'rum']","['  Mairead McGuinness  (PPE).   – Dle preşedinte, doresc, de asemenea, să îl felicit pe dl comisar Barnier. Dle comisar, acesta nu este cel mai uşor subiect cu care să vă începeţi cariera în Comisie, dar aş îndrăzni să spun că predecesorul dvs., dl McCreevy, nu s-ar supăra dacă spun că îi plăcea agitaţia. Îi plăceau cursele şi este o persoană care poate paria.', 'În mod evident, în această privinţă există două teorii diferite. Cu toate acestea, opinia Parlamentului este destul de clară în rezoluţia sa din 10 martie 2009 şi consider că merită să citez trei rânduri din această rezoluţie, care prevede că „statele membre au interesul şi dreptul de să-şi reglementeze şi să-şi controleze pieţele jocurilor de noroc”. De asemenea, prevede foarte clar că „operatorii de jocuri de noroc online trebuie să respecte legislaţia statelor membre în care prestează aceste servicii” şi că „o abordare exclusiv din perspectiva pieţei interne nu este adecvată în acest domeniu extrem de sensibil”.', 'Problema pentru noi, în calitate de legiuitori, şi pentru statele membre, este că piaţa este cu mult înaintea noastră: evoluţiile din acest domeniu au depăşit legislaţia în vigoare şi vor continua să facă acest lucru. Indiferent dacă ne place sau nu, oamenilor le plac jocurile de noroc. Personal, aş prefera să cumpăr pantofi, dar altor persoane le plac alte lucruri. ', 'Sunt absolut de acord cu cei care au vorbit foarte clar despre problemele jocurilor de noroc, indiferent dacă sunt online sau nu. Intervin aspecte sociale foarte importante în momentul în care persoanele dependente merg prea departe. Dar să ne amintim, de asemenea, că statele membre promovează loteriile şi poate acest lucru este o formă legalizată de promovare a unei posibile dependenţe.', 'Aşadar, acest aspect nu este clarificat dar, încă o dată, problema Parlamentului European şi a UE în general este că nu există consecvenţă între statele membre şi totuşi, cetăţenii noştri accesează servicii din afara ţării lor şi doresc să facă acest lucru. ', 'Cartea verde ar fi bine-venită: este o mare provocare să reuniţi toate informaţiile legate de acest subiect. Consider că problema constă imensul decalaj de informaţie şi cunoaştere şi este la latitudinea Comisiei să înainteze un document pentru a aborda această problemă. ']"
