,agenda_item,text,speaker,number_p,number_w,chair,language_ps,ps
163, 7. Explicaţii privind votul,"  Elisabeth Morin-Chartier  (PPE),  în scris. – (FR) Am votat în favoarea acestei propuneri de rezoluţie pentru a proteja personalul care lucrează în clinici şi spitale. De fapt, prea mulţi angajaţi din spitale şi lucrători în sănătate cad încă victime infecţiilor provocate de răniri din cauza folosirii seringilor şi a instrumentelor ascuţite. În calitate de deputat european, trebuie să lupt pentru prevenirea acestei situaţii. Această propunere de rezoluţie solicită, de asemenea, îmbunătăţirea condiţiilor de instruire şi de muncă ale lucrătorilor din serviciile de sănătate care înfruntă acest pericol: instrumente medicale mai sigure cu elemente de protecţie integrate sunt necesare în toată Uniunea Europeană. Cu convingerile mele sociale şi cunoştinţele mele despre mediul spitalicesc, solicit adoptarea rapidă şi aplicarea urgentă a măsurilor prevăzute în propunerea de directivă. ","Elisabeth Morin-Chartier  (PPE),",1,125,not_available,['fra'],"['  Elisabeth Morin-Chartier  (PPE),  în scris. – (FR) Am votat în favoarea acestei propuneri de rezoluţie pentru a proteja personalul care lucrează în clinici şi spitale. De fapt, prea mulţi angajaţi din spitale şi lucrători în sănătate cad încă victime infecţiilor provocate de răniri din cauza folosirii seringilor şi a instrumentelor ascuţite. În calitate de deputat european, trebuie să lupt pentru prevenirea acestei situaţii. Această propunere de rezoluţie solicită, de asemenea, îmbunătăţirea condiţiilor de instruire şi de muncă ale lucrătorilor din serviciile de sănătate care înfruntă acest pericol: instrumente medicale mai sigure cu elemente de protecţie integrate sunt necesare în toată Uniunea Europeană. Cu convingerile mele sociale şi cunoştinţele mele despre mediul spitalicesc, solicit adoptarea rapidă şi aplicarea urgentă a măsurilor prevăzute în propunerea de directivă. ']"
164, 7. Explicaţii privind votul,"  Evelyn Regner  (S&D),  în scris. − (DE) Am votat în favoarea propunerii de rezoluţie a Parlamentului European, deoarece sunt o susţinătoare a acordurilor de parteneriat social. Parteneri sociali europeni existenţi au ajuns la un acord în cazul de faţă, iar eu susţin ca acest acord-cadru să fie imediat încorporat în legislaţia europeană aplicabilă de către Consiliu, prin adoptarea fără întârziere a unei directive. ","Evelyn Regner  (S&D),",1,64,not_available,['ger'],"['  Evelyn Regner  (S&D),  în scris. − (DE) Am votat în favoarea propunerii de rezoluţie a Parlamentului European, deoarece sunt o susţinătoare a acordurilor de parteneriat social. Parteneri sociali europeni existenţi au ajuns la un acord în cazul de faţă, iar eu susţin ca acest acord-cadru să fie imediat încorporat în legislaţia europeană aplicabilă de către Consiliu, prin adoptarea fără întârziere a unei directive. ']"
165, 7. Explicaţii privind votul,"  Derek Vaughan  (S&D),  în scris. − Acesta a fost un vot important care solicită o directivă europeană pentru îmbunătăţirea protecţiei lucrătorilor afectaţi de răni provocate de înţepături cu ace. Trebuie adoptate măsuri cât mai curând posibil pentru a-i proteja pe cei care lucrează în sectorul asistenţei medicale de contactarea bolilor cu potenţial letal precum HIV/SIDA şi hepatită, prin răni provocate de ace folosite. Rănile provocate de înţepături cu ace reprezintă unul dintre cele mai obişnuite şi mai grave riscuri pentru lucrătorii din serviciile de sănătate din întreaga Europă, cu un milion de răni estimate, de acest tip, în fiecare an, în toată Europa. Sper că se vor adopta măsuri rapide pentru îmbunătăţirea instruirii şi siguranţei celor care lucrează cu ace şi cu instrumente ascuţite, astfel încât numărul rănilor provocate să fie redus drastic, iar stresul emoţional cauzat celor implicaţi să fie limitat. În plus, sper că utilizarea instrumentelor medicale mai sigure va ajuta la prevenirea rănilor care pot fi evitate, pentru cei care lucrează zilnic cu ace. ","Derek Vaughan  (S&D),",1,169,not_available,['rum'],"['  Derek Vaughan  (S&D),  în scris. − Acesta a fost un vot important care solicită o directivă europeană pentru îmbunătăţirea protecţiei lucrătorilor afectaţi de răni provocate de înţepături cu ace. Trebuie adoptate măsuri cât mai curând posibil pentru a-i proteja pe cei care lucrează în sectorul asistenţei medicale de contactarea bolilor cu potenţial letal precum HIV/SIDA şi hepatită, prin răni provocate de ace folosite. Rănile provocate de înţepături cu ace reprezintă unul dintre cele mai obişnuite şi mai grave riscuri pentru lucrătorii din serviciile de sănătate din întreaga Europă, cu un milion de răni estimate, de acest tip, în fiecare an, în toată Europa. Sper că se vor adopta măsuri rapide pentru îmbunătăţirea instruirii şi siguranţei celor care lucrează cu ace şi cu instrumente ascuţite, astfel încât numărul rănilor provocate să fie redus drastic, iar stresul emoţional cauzat celor implicaţi să fie limitat. În plus, sper că utilizarea instrumentelor medicale mai sigure va ajuta la prevenirea rănilor care pot fi evitate, pentru cei care lucrează zilnic cu ace. ']"
166, 8. Corectările voturilor şi intenţiile de vot: a se vedea procesul-verbal,(Şedinţa a fost suspendată la ora 12.50 şi reluată la ora 15.00). ,unknown,1,14,not_available,['rum'],['(Şedinţa a fost suspendată la ora 12.50 şi reluată la ora 15.00). ']
167, 8. Corectările voturilor şi intenţiile de vot: a se vedea procesul-verbal,PREZIDEAZĂ: DL WIELAND Vicepreşedinte,PREZIDEAZĂ: DL WIELAND,1,4,not_available,['rum'],['PREZIDEAZĂ: DL WIELAND Vicepreşedinte']
168, 10.1. Venezuela,  Președintele.   − Următorul punct pe ordinea de zi este dezbaterea asupra celor şase propuneri de rezoluţie referitoare la Venezuela(1).,Președintele.,1,19,not_available,['rum'],['  Președintele.   − Următorul punct pe ordinea de zi este dezbaterea asupra celor şase propuneri de rezoluţie referitoare la Venezuela(1).']
169, 10.1. Venezuela,"  Tunne Kelam,  autor. − Dle preşedinte, deputaţii au fost foarte îngrijoraţi cu privire la recenta limitare a libertăţii presei de către guvernul venezuelean.După cum ştiţi, libertatea presei este unul dintre fundamentele unei societăţi democratice. Aceasta include fără îndoială dreptul de a primi informaţii din surse multiple, pluraliste. Recent, au existat atacuri la adresa libertăţii presei, întreprinse de către preşedintele Hugo Chávez. În luna august a anului trecut, a ordonat închiderea a 34 de posturi de radio, refuzând reînnoirea licenţelor acestora. În luna ianuarie a anului curent, preşedintele Chávez a interzis dreptul de emisie al RCTV International şi al altor cinci canale de televiziune prin cablu şi satelit care nu au transmis discursul său oficial. De asemenea, a calificat drept activităţi teroriste utilizarea unor site-uri precum Twitter şi a internetului pentru a difuza informaţii antiguvernamentale. Protestăm contra uciderii a doi studenţi venezueleni care au protestat împotriva închiderii mijloacelor de informare libere...(Preşedintele întrerupe vorbitorul.) ","Tunne Kelam,",3,154,not_available,"['rum', 'rum', 'rum']","['  Tunne Kelam,  autor. − Dle preşedinte, deputaţii au fost foarte îngrijoraţi cu privire la recenta limitare a libertăţii presei de către guvernul venezuelean.', 'După cum ştiţi, libertatea presei este unul dintre fundamentele unei societăţi democratice. Aceasta include fără îndoială dreptul de a primi informaţii din surse multiple, pluraliste. Recent, au existat atacuri la adresa libertăţii presei, întreprinse de către preşedintele Hugo Chávez. În luna august a anului trecut, a ordonat închiderea a 34 de posturi de radio, refuzând reînnoirea licenţelor acestora. În luna ianuarie a anului curent, preşedintele Chávez a interzis dreptul de emisie al RCTV International şi al altor cinci canale de televiziune prin cablu şi satelit care nu au transmis discursul său oficial. De asemenea, a calificat drept activităţi teroriste utilizarea unor site-uri precum Twitter şi a internetului pentru a difuza informaţii antiguvernamentale. Protestăm contra uciderii a doi studenţi venezueleni care au protestat împotriva închiderii mijloacelor de informare libere...', '(Preşedintele întrerupe vorbitorul.) ']"
170, 10.1. Venezuela,"  Renate Weber,  autor. – (ES) Dle preşedinte, doamnelor şi domnilor, libertatea de expresie nu este un drept virtual asupra căruia să se poată cădea de acord fără a se lua în consideraţie realitatea politică şi socială a unei ţări. Libertatea presei de a exprima puncte de vedere critice asupra guvernului sau politicienilor, fie că aceştia sunt chiar preşedintele, membrii guvernului sau ai opoziţiei, este cea mai importantă garanţie pe care o pot avea oamenii. Este vorba aici despre accesul la informaţia transmisă de surse pluraliste, astfel încât dreptul de vot să fie unul veritabil.Din nefericire, realitatea din Venezuela este că, după multe acte antidemocratice întreprinse de guvernul preşedintelui Chávez contra opoziţiei, se pare că acum urmează să se suprime şi presa. Nu ne referim doar la cazul recent al RCTV International, asupra căruia autoritatea audiovizuală din Venezuela a impus o lege retroactivă, ci de asemenea şi la faptul că, din 2003, 34 dintre cele mai ascultate posturi de radio din Venezuela au fost închise.De asemenea, Globovisión, care mai păstrează încă o linie editorială independentă de guvern, este supus unor presiuni în vederea încetării acestei situaţii. Să nu uităm că cel mai pervers mod de eliminare a mass mediei este crearea autocenzurii.Ca urmare a închiderii a 34 de posturi de radio, guvernul lui Hugo Chávez a anunţat în mod oficial că mai există o listă cu alte posturi, care vor fi de asemenea închise: o listă pe care nu o cunoaşte nimeni, deoarece procedurile nu sunt deschise şi transparente, o listă asupra căreia planează multe incertitudini, singurul scop al acesteia fiind promovarea autocenzurii. Toate aceste încălcări au loc în absenţa unui răspuns al curţilor de justiţie competente la acţiunile înaintate în cadrul lor.Într-o ţară în care un principiu universal cum este cel al neretroactivităţii nu este respectat, în care autorităţile judiciare nu răspund la apeluri decât dacă preşedintele le spune să facă acest lucru, nu mai există statul de drept şi nici separarea puterilor în stat. Democraţia pur şi simplu nu mai există. Din păcate, aceasta este Venezuela din ziua de astăzi. ","Renate Weber,",5,345,not_available,"['spa', 'spa', 'spa', 'spa', 'spa']","['  Renate Weber,  autor. – (ES) Dle preşedinte, doamnelor şi domnilor, libertatea de expresie nu este un drept virtual asupra căruia să se poată cădea de acord fără a se lua în consideraţie realitatea politică şi socială a unei ţări. Libertatea presei de a exprima puncte de vedere critice asupra guvernului sau politicienilor, fie că aceştia sunt chiar preşedintele, membrii guvernului sau ai opoziţiei, este cea mai importantă garanţie pe care o pot avea oamenii. Este vorba aici despre accesul la informaţia transmisă de surse pluraliste, astfel încât dreptul de vot să fie unul veritabil.', 'Din nefericire, realitatea din Venezuela este că, după multe acte antidemocratice întreprinse de guvernul preşedintelui Chávez contra opoziţiei, se pare că acum urmează să se suprime şi presa. Nu ne referim doar la cazul recent al RCTV International, asupra căruia autoritatea audiovizuală din Venezuela a impus o lege retroactivă, ci de asemenea şi la faptul că, din 2003, 34 dintre cele mai ascultate posturi de radio din Venezuela au fost închise.', 'De asemenea, Globovisión, care mai păstrează încă o linie editorială independentă de guvern, este supus unor presiuni în vederea încetării acestei situaţii. Să nu uităm că cel mai pervers mod de eliminare a mass mediei este crearea autocenzurii.', 'Ca urmare a închiderii a 34 de posturi de radio, guvernul lui Hugo Chávez a anunţat în mod oficial că mai există o listă cu alte posturi, care vor fi de asemenea închise: o listă pe care nu o cunoaşte nimeni, deoarece procedurile nu sunt deschise şi transparente, o listă asupra căreia planează multe incertitudini, singurul scop al acesteia fiind promovarea autocenzurii. Toate aceste încălcări au loc în absenţa unui răspuns al curţilor de justiţie competente la acţiunile înaintate în cadrul lor.', 'Într-o ţară în care un principiu universal cum este cel al neretroactivităţii nu este respectat, în care autorităţile judiciare nu răspund la apeluri decât dacă preşedintele le spune să facă acest lucru, nu mai există statul de drept şi nici separarea puterilor în stat. Democraţia pur şi simplu nu mai există. Din păcate, aceasta este Venezuela din ziua de astăzi. ']"
171, 10.1. Venezuela,"  Véronique De Keyser,  autoare. – (FR) Dle preşedinte, îmi pare rău, însă propunerea de rezoluţie privind Venezuela înaintată în principal de către Grupul Partidului Popular European (Creştin Democrat) este o farsă care nu vrea decât să exploateze dezbaterea de urgenţă în scopuri politice şi să încerce să-l discrediteze pe dl Chávez.Voi relua ceea ce spuneam deoarece nu este cazul să pierdem timpul. Patru staţii naţionale nu şi-au respectat cerinţele statutare cu privire la înregistrare. Au fost suspendate temporar şi în momentul de faţă respectă aceste cerinţe şi sper că vor fi curând în regulă.Într-o propunere de rezoluţie comună, alături de Grupul Verzilor/Alianţa Liberă Europeană şi Grupul Confederal al Stângii Unite Europene - Stânga Verde Nordică, grupul meu îşi reiterează suportul fără echivoc în favoarea libertăţii de expresie şi a pluralităţii. Sunt surprinsă, totuşi, de marea varietate de vederi manifestată de Grupul PPE cu privire la libertatea de expresie. Nu dumneavoastră aţi votat împotriva rezoluţiei privind libertatea presei în Italia, în apărarea lui Berlusconi? Dacă doriţi să vă faceţi de râs astăzi, nu aveţi decât. Vor fi mulţi dintre dumneavoastră în momentul votării, aşadar profitaţi la maximum de aceasta. ","Véronique De Keyser,",3,192,not_available,"['fra', 'fra', 'fra']","['  Véronique De Keyser,  autoare. – (FR) Dle preşedinte, îmi pare rău, însă propunerea de rezoluţie privind Venezuela înaintată în principal de către Grupul Partidului Popular European (Creştin Democrat) este o farsă care nu vrea decât să exploateze dezbaterea de urgenţă în scopuri politice şi să încerce să-l discrediteze pe dl Chávez.', 'Voi relua ceea ce spuneam deoarece nu este cazul să pierdem timpul. Patru staţii naţionale nu şi-au respectat cerinţele statutare cu privire la înregistrare. Au fost suspendate temporar şi în momentul de faţă respectă aceste cerinţe şi sper că vor fi curând în regulă.', 'Într-o propunere de rezoluţie comună, alături de Grupul Verzilor/Alianţa Liberă Europeană şi Grupul Confederal al Stângii Unite Europene - Stânga Verde Nordică, grupul meu îşi reiterează suportul fără echivoc în favoarea libertăţii de expresie şi a pluralităţii. Sunt surprinsă, totuşi, de marea varietate de vederi manifestată de Grupul PPE cu privire la libertatea de expresie. Nu dumneavoastră aţi votat împotriva rezoluţiei privind libertatea presei în Italia, în apărarea lui Berlusconi? Dacă doriţi să vă faceţi de râs astăzi, nu aveţi decât. Vor fi mulţi dintre dumneavoastră în momentul votării, aşadar profitaţi la maximum de aceasta. ']"
172, 10.1. Venezuela,"  Raül Romeva i Rueda,  autor. − (ES) Dle preşedinte, şi eu am două probleme privind Venezuela. Una este de formă şi cealaltă este de fond. Din punct de vedere al formei, trebuie să spun că deputaţii aici prezenţi, care sunt membri ai Grupului Partidului Popular European (Creştin Democrat) şi care, de ceva vreme, au abuzat în mod activ de această sesiune de urgenţă privitoare la încălcarea drepturilor omului pentru a ţine o dezbatere politică de partid, creează o situaţie complexă.Este destul de legitim pentru dumnealor să dorească să desfăşoare activităţi politice de partid. Totuşi, nu ne aflăm în locul potrivit pentru aceasta. Dacă doresc să facă o declaraţie de susţinere a prietenilor lor sau dacă doresc să critice guvernele care nu le sunt pe plac, nu este nici momentul şi nici locul să facă aceasta.Totuşi, haideţi să luăm această sesiune de urgenţă în care discutăm despre încălcarea drepturilor omului şi democraţie cu mult mai serios, deoarece, dacă nu, ne vom pierde toată credibilitatea pe care o avem în acest moment şi care este foarte greu de redobândit la nivel internaţional.Există multe cazuri flagrante de încălcări ale drepturilor omului în America Latină. Haideţi să fim şi mai consecvenţi. Dorim să discutăm despre drepturile omului în America Latină? Atunci haideţi să discutăm despre Columbia şi Honduras. Cum se face că aceste chestiuni nu ajung niciodată să fie discutate aici în sesiunile plenare? De ce avem întotdeauna această problemă şi totuşi, în cazuri ca cel de astăzi, în care se tratează o problemă administrativă, suntem martorii unei astfel de prezenţe şi susţineri? Aşa ceva este inacceptabil. Este inacceptabil deoarece, insist, ne pierdem toată credibilitatea şi legitimitatea de a fi capabili să exprimăm o opinie cu privire la aceste tipuri de cazuri.Permiteţi-mi să fiu foarte clar. Nu sunt un adept al lui Chávez. Sunt în favoarea libertăţii de expresie, chiar şi pentru aceia ale căror opinii sunt radical opuse opiniilor mele, fie că aceştia sunt aici, în Italia sau în Honduras. Totuşi, acesta nu este obiectul dezbaterii de astăzi. Problema discutată astăzi este în principal o chestiune de natură administrativă, o chestiune privitoare la ordinea internă din Venezuela, o chestiune care este în curs de rezolvare şi chiar, din informaţiile pe care le avem, a şi fost rezolvată.Prin urmare, nici măcar nu mai este un caz. Nu mai are niciun rost. Dacă dorim să continuăm să ridiculizăm această sesiune de urgenţă, atunci haideţi să continuăm în acelaşi mod şi vom ajunge să nu mai discutăm nimic, niciodată, deoarece ne vom fi pierdut orice credibilitate.De aceea, îi îndemn pe membrii Grupului PPE să ne permită să tratăm această sesiune de urgenţă cu mai multă seriozitate, sau vom sfârşi fără îndoială să nu mai avem niciun rost. ","Raül Romeva i Rueda,",7,457,not_available,"['spa', 'spa', 'spa', 'spa', 'spa', 'spa', 'spa']","['  Raül Romeva i Rueda,  autor. − (ES) Dle preşedinte, şi eu am două probleme privind Venezuela. Una este de formă şi cealaltă este de fond. Din punct de vedere al formei, trebuie să spun că deputaţii aici prezenţi, care sunt membri ai Grupului Partidului Popular European (Creştin Democrat) şi care, de ceva vreme, au abuzat în mod activ de această sesiune de urgenţă privitoare la încălcarea drepturilor omului pentru a ţine o dezbatere politică de partid, creează o situaţie complexă.', 'Este destul de legitim pentru dumnealor să dorească să desfăşoare activităţi politice de partid. Totuşi, nu ne aflăm în locul potrivit pentru aceasta. Dacă doresc să facă o declaraţie de susţinere a prietenilor lor sau dacă doresc să critice guvernele care nu le sunt pe plac, nu este nici momentul şi nici locul să facă aceasta.', 'Totuşi, haideţi să luăm această sesiune de urgenţă în care discutăm despre încălcarea drepturilor omului şi democraţie cu mult mai serios, deoarece, dacă nu, ne vom pierde toată credibilitatea pe care o avem în acest moment şi care este foarte greu de redobândit la nivel internaţional.', 'Există multe cazuri flagrante de încălcări ale drepturilor omului în America Latină. Haideţi să fim şi mai consecvenţi. Dorim să discutăm despre drepturile omului în America Latină? Atunci haideţi să discutăm despre Columbia şi Honduras. Cum se face că aceste chestiuni nu ajung niciodată să fie discutate aici în sesiunile plenare? De ce avem întotdeauna această problemă şi totuşi, în cazuri ca cel de astăzi, în care se tratează o problemă administrativă, suntem martorii unei astfel de prezenţe şi susţineri? Aşa ceva este inacceptabil. Este inacceptabil deoarece, insist, ne pierdem toată credibilitatea şi legitimitatea de a fi capabili să exprimăm o opinie cu privire la aceste tipuri de cazuri.', 'Permiteţi-mi să fiu foarte clar. Nu sunt un adept al lui Chávez. Sunt în favoarea libertăţii de expresie, chiar şi pentru aceia ale căror opinii sunt radical opuse opiniilor mele, fie că aceştia sunt aici, în Italia sau în Honduras. Totuşi, acesta nu este obiectul dezbaterii de astăzi. Problema discutată astăzi este în principal o chestiune de natură administrativă, o chestiune privitoare la ordinea internă din Venezuela, o chestiune care este în curs de rezolvare şi chiar, din informaţiile pe care le avem, a şi fost rezolvată.', 'Prin urmare, nici măcar nu mai este un caz. Nu mai are niciun rost. Dacă dorim să continuăm să ridiculizăm această sesiune de urgenţă, atunci haideţi să continuăm în acelaşi mod şi vom ajunge să nu mai discutăm nimic, niciodată, deoarece ne vom fi pierdut orice credibilitate.', 'De aceea, îi îndemn pe membrii Grupului PPE să ne permită să tratăm această sesiune de urgenţă cu mai multă seriozitate, sau vom sfârşi fără îndoială să nu mai avem niciun rost. ']"
