,agenda_item,text,speaker,number_p,number_w,chair,language_ps,ps
90, 7. Explicaţii privind votul,"  Gerard Batten  (EFD).   – Dle preşedinte, aş dori să prezint o explicaţie a votului asupra raportului Hennis-Plasschaert – aşa-numitul „raport SWIFT” – cu privire la monitorizarea finanţării terorismului.Cred că votul a creat confuzie, chiar şi după standardele acestei instituţii. Cred că am votat pentru a nu vota, iar apoi am votat pentru a trimite raportul înapoi la comisie. Am dorit să votez pentru a-mi exprima dezacordul faţă de încheierea acordului. Cu toate acestea, cu siguranţă nu am dorit să votez în favoarea punctului 2 al raportului care prevede înaintarea de recomandări pentru un acord pe termen lung, în conformitate cu cadrul juridic al Tratatului de la Lisabona.Nu doresc nici un acord sau acorduri în baza Tratatului de la Lisabona. Tratatul de la Lisabona contravine Bill of Rights din 1689 şi altor acte constituţionale ale Angliei care nu au fost abrogate expres şi care rămân în vigoare. Din acest motiv, Anglia – şi, în fapt, Regatul Unit – se află acum sub conducerea unui guvern constituit ilegal. ",Gerard Batten  (EFD).,3,166,not_available,"['rum', 'rum', 'rum']","['  Gerard Batten  (EFD).   – Dle preşedinte, aş dori să prezint o explicaţie a votului asupra raportului Hennis-Plasschaert – aşa-numitul „raport SWIFT” – cu privire la monitorizarea finanţării terorismului.', 'Cred că votul a creat confuzie, chiar şi după standardele acestei instituţii. Cred că am votat pentru a nu vota, iar apoi am votat pentru a trimite raportul înapoi la comisie. Am dorit să votez pentru a-mi exprima dezacordul faţă de încheierea acordului. Cu toate acestea, cu siguranţă nu am dorit să votez în favoarea punctului 2 al raportului care prevede înaintarea de recomandări pentru un acord pe termen lung, în conformitate cu cadrul juridic al Tratatului de la Lisabona.', 'Nu doresc nici un acord sau acorduri în baza Tratatului de la Lisabona. Tratatul de la Lisabona contravine Bill of Rights din 1689 şi altor acte constituţionale ale Angliei care nu au fost abrogate expres şi care rămân în vigoare. Din acest motiv, Anglia – şi, în fapt, Regatul Unit – se află acum sub conducerea unui guvern constituit ilegal. ']"
91, 7. Explicaţii privind votul,"  Charalampos Angourakis  (GUE/NGL)  . – (EL) Dle preşedinte, aş dori să spun că am votat în favoarea raportului dnei Hennis-Plasschaert, dar aş dori să ofer o explicaţie a votului, şi anume: Partidul Comunist Grec respinge „acordul terorii” dintre Uniunea Europeană şi Statele Unite ale Americii, încheiat în numele luptei împotriva finanţării terorismului.Denunţăm eforturile forţelor de centru stânga şi de centru dreapta, ale forţelor pentru un sens unic european, de a-şi curăţa conştiinţa faţă de oameni în privinţa „acordurilor terorii” încheiate cu Statele Unite. Cu toate că rezoluţia Parlamentului European nu aprobă acordul interimar semnat deja de Uniunea Europeană şi de SUA, aceasta solicită Consiliului să încheie un acord permanent cu Statele Unite, care se presupune că va respecta protecţia datelor cu caracter personal.Considerăm aceasta o minciună sfruntată. În opinia noastră, nu poate exista o protecţie a datelor cu caracter personal atâta timp cât se află în mâinile CIA şi ale altor servicii secrete. Terorismul este folosit de Uniunea Europeană, de SUA şi de alte forţe imperialiste ca pretext pentru a încălca libertăţile şi drepturile fundamentale, pentru a lovi în mişcarea populară şi pentru a justifica propriile războaie imperialiste.Nu există „legi teroriste” care să respecte libertăţile fundamentale, de aceea oamenii trebuie să le respingă, alături de toate „acordurile terorii” asociate acestora. ",Charalampos Angourakis  (GUE/NGL),4,214,not_available,"['gre', 'gre', 'gre', 'gre']","['  Charalampos Angourakis  (GUE/NGL)  . – (EL) Dle preşedinte, aş dori să spun că am votat în favoarea raportului dnei Hennis-Plasschaert, dar aş dori să ofer o explicaţie a votului, şi anume: Partidul Comunist Grec respinge „acordul terorii” dintre Uniunea Europeană şi Statele Unite ale Americii, încheiat în numele luptei împotriva finanţării terorismului.', 'Denunţăm eforturile forţelor de centru stânga şi de centru dreapta, ale forţelor pentru un sens unic european, de a-şi curăţa conştiinţa faţă de oameni în privinţa „acordurilor terorii” încheiate cu Statele Unite. Cu toate că rezoluţia Parlamentului European nu aprobă acordul interimar semnat deja de Uniunea Europeană şi de SUA, aceasta solicită Consiliului să încheie un acord permanent cu Statele Unite, care se presupune că va respecta protecţia datelor cu caracter personal.', 'Considerăm aceasta o minciună sfruntată. În opinia noastră, nu poate exista o protecţie a datelor cu caracter personal atâta timp cât se află în mâinile CIA şi ale altor servicii secrete. Terorismul este folosit de Uniunea Europeană, de SUA şi de alte forţe imperialiste ca pretext pentru a încălca libertăţile şi drepturile fundamentale, pentru a lovi în mişcarea populară şi pentru a justifica propriile războaie imperialiste.', 'Nu există „legi teroriste” care să respecte libertăţile fundamentale, de aceea oamenii trebuie să le respingă, alături de toate „acordurile terorii” asociate acestora. ']"
92, 7. Explicaţii privind votul,"  Daniel Hannan  (ECR).   – Dle preşedinte, acesta a fost un subiect destul de echilibrat şi invidiez siguranţa morală exprimată de persoane aparţinând ambelor părţi. Au fost ridicate probleme legitime legate de libertăţile civile; îngrijorări care ar fi împărtăşite de oameni atât din Statele Unite cât şi din Uniunea Europeană. Cu toate acestea, cred că administraţia americană a depăşit aşteptările în întâmpinarea îngrijorărilor exprimate de această parte a Atlanticului şi a înaintat o propunere proporţionată care ţine cont de echilibrul dintre securitate şi libertate.În ultimii zece ani am respins vehement multe dintre măsurile care au fost introduse în acest loc sub pretextul măsurilor de securitate şi care urmăreau, de fapt, doar extinderea puterilor statului. Dar, în acest caz, nu cred că ne aflăm într-o astfel de situaţie; avem în faţă o măsură care a avut anumite reuşite în privinţa prevenirii atrocităţilor teroriste. Mă tem că unii dintre criticii din acest Parlament nu au fost interesaţi, cu adevărat, de libertăţile civile. Aceştia au avut alte două motive: în primul rând, să afirme puterea parlamentului federal asupra statelor naţiune şi, în al doilea rând, convingerea lor reflexă că America greşeşte întotdeauna şi oriunde. Este păcat. După alegerea lui Barack Obama, mulţi dintre cei de stânga din acest Parlament vorbeau cu plăcere despre un nou parteneriat peste Atlantic. Astăzi observăm ce credit putem acorda afirmaţiilor lor. ",Daniel Hannan  (ECR).,2,223,not_available,"['rum', 'rum']","['  Daniel Hannan  (ECR).   – Dle preşedinte, acesta a fost un subiect destul de echilibrat şi invidiez siguranţa morală exprimată de persoane aparţinând ambelor părţi. Au fost ridicate probleme legitime legate de libertăţile civile; îngrijorări care ar fi împărtăşite de oameni atât din Statele Unite cât şi din Uniunea Europeană. Cu toate acestea, cred că administraţia americană a depăşit aşteptările în întâmpinarea îngrijorărilor exprimate de această parte a Atlanticului şi a înaintat o propunere proporţionată care ţine cont de echilibrul dintre securitate şi libertate.', 'În ultimii zece ani am respins vehement multe dintre măsurile care au fost introduse în acest loc sub pretextul măsurilor de securitate şi care urmăreau, de fapt, doar extinderea puterilor statului. Dar, în acest caz, nu cred că ne aflăm într-o astfel de situaţie; avem în faţă o măsură care a avut anumite reuşite în privinţa prevenirii atrocităţilor teroriste. Mă tem că unii dintre criticii din acest Parlament nu au fost interesaţi, cu adevărat, de libertăţile civile. Aceştia au avut alte două motive: în primul rând, să afirme puterea parlamentului federal asupra statelor naţiune şi, în al doilea rând, convingerea lor reflexă că America greşeşte întotdeauna şi oriunde. Este păcat. După alegerea lui Barack Obama, mulţi dintre cei de stânga din acest Parlament vorbeau cu plăcere despre un nou parteneriat peste Atlantic. Astăzi observăm ce credit putem acorda afirmaţiilor lor. ']"
93, 7. Explicaţii privind votul,"  Jaroslav Paška  (EFD).  – (SK) Comisia Europeană a încheiat cu Statele Unite un acord cu privire la transferul datelor cu caracter personal ale cetăţenilor UE către serviciile de informaţii ale SUA. Acordul este foarte dezavantajos şi inegal pentru UE. Credem că acest acord, în versiunea prezentată Parlamentului European, nu poate fi acceptat deoarece suntem răspunzători de protecţia drepturilor cetăţenilor UE şi nu putem permite ca datele lor să fie la îndemâna serviciilor de informaţii ale SUA pentru o perioadă de 99 de ani.Structura acestui acord a fost absurdă şi inegală şi, în opinia mea, a permis ca datele cu caracter personal ale cetăţenilor UE să fie folosite în mod inadecvat. Prin urmare, este un lucru bun că Parlamentul European a decis să respingă acest acord şi a obligat Comisia Europeană să înceapă să lucreze la un nou acord, care va fi echilibrat şi care va trata în mod egal drepturile cetăţenilor SUA şi pe cele ale cetăţenilor UE. ",Jaroslav Paška  (EFD).,2,158,not_available,"['slo', 'slo']","['  Jaroslav Paška  (EFD).  – (SK) Comisia Europeană a încheiat cu Statele Unite un acord cu privire la transferul datelor cu caracter personal ale cetăţenilor UE către serviciile de informaţii ale SUA. Acordul este foarte dezavantajos şi inegal pentru UE. Credem că acest acord, în versiunea prezentată Parlamentului European, nu poate fi acceptat deoarece suntem răspunzători de protecţia drepturilor cetăţenilor UE şi nu putem permite ca datele lor să fie la îndemâna serviciilor de informaţii ale SUA pentru o perioadă de 99 de ani.', 'Structura acestui acord a fost absurdă şi inegală şi, în opinia mea, a permis ca datele cu caracter personal ale cetăţenilor UE să fie folosite în mod inadecvat. Prin urmare, este un lucru bun că Parlamentul European a decis să respingă acest acord şi a obligat Comisia Europeană să înceapă să lucreze la un nou acord, care va fi echilibrat şi care va trata în mod egal drepturile cetăţenilor SUA şi pe cele ale cetăţenilor UE. ']"
94, 7. Explicaţii privind votul,"  Zuzana Roithová  (PPE).  – (CS) Am votat pentru amânarea votului asupra acordului şi, de asemenea, împotriva propunerii de respingere a ratificării sale. Faptul că mândria a învins responsabilitatea în acest Parlament nu este un semn bun, deşi Consiliul a avut o comunicare foarte deficitară cu Parlamentul European. Totuşi, analiza acestor date a făcut posibilă detectarea în timp util a atacurilor teroriste îndreptate împotriva cetăţenilor europeni. Cei care au respins acordul provizoriu pe motiv că acesta nu oferea o protecţie mai bună datelor financiare ale cetăţenilor europeni, probabil că nu au citit acest acord, pentru că oferă un cadru mai bun decât a existat în practică în baza vechiului acord din 2003, deşi nu se cunosc situaţii privind folosirea greşită a acestor date. Dimpotrivă, în acordul provizoriu există chiar mai multe garanţii noi, cum ar fi, de exemplu, faptul că solicitările de date pot fi făcute doar de Secretarul pentru Justiţie al SUA, la fel ca în cazul Europol, şi doar pe baza unei descrieri clare a investigaţiei pentru care ar fi folosite datele. Prin urmare, nu pot să înţeleg ce s-a întâmplat aici. În opinia mea, Parlamentul European a adoptat o poziţie arogantă şi fără precedent. ",Zuzana Roithová  (PPE).,1,196,not_available,['cze'],"['  Zuzana Roithová  (PPE).  – (CS) Am votat pentru amânarea votului asupra acordului şi, de asemenea, împotriva propunerii de respingere a ratificării sale. Faptul că mândria a învins responsabilitatea în acest Parlament nu este un semn bun, deşi Consiliul a avut o comunicare foarte deficitară cu Parlamentul European. Totuşi, analiza acestor date a făcut posibilă detectarea în timp util a atacurilor teroriste îndreptate împotriva cetăţenilor europeni. Cei care au respins acordul provizoriu pe motiv că acesta nu oferea o protecţie mai bună datelor financiare ale cetăţenilor europeni, probabil că nu au citit acest acord, pentru că oferă un cadru mai bun decât a existat în practică în baza vechiului acord din 2003, deşi nu se cunosc situaţii privind folosirea greşită a acestor date. Dimpotrivă, în acordul provizoriu există chiar mai multe garanţii noi, cum ar fi, de exemplu, faptul că solicitările de date pot fi făcute doar de Secretarul pentru Justiţie al SUA, la fel ca în cazul Europol, şi doar pe baza unei descrieri clare a investigaţiei pentru care ar fi folosite datele. Prin urmare, nu pot să înţeleg ce s-a întâmplat aici. În opinia mea, Parlamentul European a adoptat o poziţie arogantă şi fără precedent. ']"
95, 7. Explicaţii privind votul,"  Seán Kelly  (PPE).   – Dle preşedinte, în primul rând aş dori să spun că accept în totalitate decizia democratică adoptată de Parlament dar, referitor la această temă, am fost onorat să votez în concordanţă cu grupul nostru şi cu poziţia exprimată de liderul nostru, dl Daul. Totuşi, cred că au existat doi factori care au contribuit la înfrângerea cu 15 voturi – unul, incapacitatea de a răspunde întrebării adresate de dl Schulz şi, al doilea, cred că a fost un element de confuzie cu privire la obiectul votului.Pentru viitor, cred că, atunci când vor mai fi propuneri din sală, va trebui să se precizeze foarte clar pentru toată lumea ce anume se votează în momentul respectiv. Poate că am sau nu am dreptate în această privinţă, dar aceasta este opinia mea. ",Seán Kelly  (PPE).,2,130,not_available,"['rum', 'rum']","['  Seán Kelly  (PPE).   – Dle preşedinte, în primul rând aş dori să spun că accept în totalitate decizia democratică adoptată de Parlament dar, referitor la această temă, am fost onorat să votez în concordanţă cu grupul nostru şi cu poziţia exprimată de liderul nostru, dl Daul. Totuşi, cred că au existat doi factori care au contribuit la înfrângerea cu 15 voturi – unul, incapacitatea de a răspunde întrebării adresate de dl Schulz şi, al doilea, cred că a fost un element de confuzie cu privire la obiectul votului.', 'Pentru viitor, cred că, atunci când vor mai fi propuneri din sală, va trebui să se precizeze foarte clar pentru toată lumea ce anume se votează în momentul respectiv. Poate că am sau nu am dreptate în această privinţă, dar aceasta este opinia mea. ']"
96, 7. Explicaţii privind votul,"  Miroslav Mikolášik  (PPE).   – (SK) Aş dori să vorbesc despre votul care tocmai a avut loc cu privire la obiectele ascuţite şi la rănile provocate în spitale şi în timpul intervenţiilor chirurgicale ale medicilor. Trebuie spus că această problemă a fost mult timp subestimată. Au loc multe răniri, fie în timpul operaţiilor, fie în intervenţiile medicilor generalişti sau în intervenţiile chirurgicale ale medicilor specialişti, fie o asistentă sau un medic se rănesc cu un ac sau cu un bisturiu care sunt contaminate cu probe de la un pacient infectat cu o boală contagioasă.Vedem cum tot mai multe asistente medicale, în special, sunt infectate cu hepatită, dar nu este neobişnuit ca în activitatea lor să fie infectate chiar şi cu virusul HIV şi să se îmbolnăvească de SIDA. Aş dori să sprijin eforturile Parlamentului European şi eforturile noastre de a proteja medicii şi asistentele medicale prin măsuri preventive şi, de asemenea, dacă solicită compensaţii, să li se acorde acest drept. ",Miroslav Mikolášik  (PPE).,2,159,not_available,"['slo', 'slo']","['  Miroslav Mikolášik  (PPE).   – (SK) Aş dori să vorbesc despre votul care tocmai a avut loc cu privire la obiectele ascuţite şi la rănile provocate în spitale şi în timpul intervenţiilor chirurgicale ale medicilor. Trebuie spus că această problemă a fost mult timp subestimată. Au loc multe răniri, fie în timpul operaţiilor, fie în intervenţiile medicilor generalişti sau în intervenţiile chirurgicale ale medicilor specialişti, fie o asistentă sau un medic se rănesc cu un ac sau cu un bisturiu care sunt contaminate cu probe de la un pacient infectat cu o boală contagioasă.', 'Vedem cum tot mai multe asistente medicale, în special, sunt infectate cu hepatită, dar nu este neobişnuit ca în activitatea lor să fie infectate chiar şi cu virusul HIV şi să se îmbolnăvească de SIDA. Aş dori să sprijin eforturile Parlamentului European şi eforturile noastre de a proteja medicii şi asistentele medicale prin măsuri preventive şi, de asemenea, dacă solicită compensaţii, să li se acorde acest drept. ']"
97, 7. Explicaţii privind votul,"  Marian Harkin  (ALDE).   – Dle preşedinte, sunt mulţumit de rezultatul votului de astăzi deoarece, în 2006, Comisia pentru ocuparea forţei de muncă şi afaceri sociale a adoptat un raport cu privire la protecţia lucrătorilor europeni din serviciile de sănătate împotriva infecţiilor transmise prin sânge ca urmare a rănilor provocate de ace şi obiecte ascuţite. Desigur, în iulie anul trecut a fost încheiat acordul cadru între partenerii sociali, iar astăzi avem această rezoluţie. Această rezoluţie va fi primită favorabil de către lucrătorii din serviciile de sănătate din întreaga UE, deoarece rănile provocate de ace şi obiecte ascuţite reprezintă unul dintre riscurile cele mai răspândite şi mai grave pentru lucrătorii din sănătate. Într-adevăr, s-a estimat că există aproximativ un milion de astfel de răni în fiecare an.Acum este foarte important ca măsurile prevăzute în directiva propusă să fie mai întâi adoptate şi apoi puse urgent în aplicare. Lucrătorii din serviciile de sănătate au aşteptat deja prea mult; nu este rezonabil să li se ceară să mai aştepte şi mai mult. Munca lor este suficient de dificilă şi de stresantă în sine, şi ştiu că va fi binevenit orice am putea să facem, pentru a le îmbunătăţi situaţia. ",Marian Harkin  (ALDE).,2,197,not_available,"['rum', 'rum']","['  Marian Harkin  (ALDE).   – Dle preşedinte, sunt mulţumit de rezultatul votului de astăzi deoarece, în 2006, Comisia pentru ocuparea forţei de muncă şi afaceri sociale a adoptat un raport cu privire la protecţia lucrătorilor europeni din serviciile de sănătate împotriva infecţiilor transmise prin sânge ca urmare a rănilor provocate de ace şi obiecte ascuţite. Desigur, în iulie anul trecut a fost încheiat acordul cadru între partenerii sociali, iar astăzi avem această rezoluţie. Această rezoluţie va fi primită favorabil de către lucrătorii din serviciile de sănătate din întreaga UE, deoarece rănile provocate de ace şi obiecte ascuţite reprezintă unul dintre riscurile cele mai răspândite şi mai grave pentru lucrătorii din sănătate. Într-adevăr, s-a estimat că există aproximativ un milion de astfel de răni în fiecare an.', 'Acum este foarte important ca măsurile prevăzute în directiva propusă să fie mai întâi adoptate şi apoi puse urgent în aplicare. Lucrătorii din serviciile de sănătate au aşteptat deja prea mult; nu este rezonabil să li se ceară să mai aştepte şi mai mult. Munca lor este suficient de dificilă şi de stresantă în sine, şi ştiu că va fi binevenit orice am putea să facem, pentru a le îmbunătăţi situaţia. ']"
98, 7. Explicaţii privind votul,Explicaţii scrise privind votul,Explicaţii scrise privind votul,1,4,not_available,['rum'],['Explicaţii scrise privind votul']
99, 7. Explicaţii privind votul,"  Andreas Mölzer  (NI),  în scris. − (DE) Islanda, care a înaintat Consiliului cererea sa de aderare la Uniunea Europeană la data de 16 iulie 2009, nu ar trebui, desigur, să fie dezavantajată faţă de alte ţări candidate sau potenţial candidate. Acestea fiind spuse, am votat pentru adaptarea şi modificarea reglementărilor existente cu privire la asistenţa pentru preaderare. După cum ştim, Islanda este deja membru al SEE şi este o naţiune foarte bine dezvoltată, de aceea plăţile acordate din această asistenţă ar trebui limitate. Cu toate acestea, în general, acest instrument pentru preaderare ar trebui revizuit din nou. De exemplu, nu este deloc clar de ce ţări non-europene, precum Turcia, primesc sute de milioane de euro din banii contribuabililor europeni, bani de care este nevoie urgentă în Europa. ","Andreas Mölzer  (NI),",1,127,not_available,['ger'],"['  Andreas Mölzer  (NI),  în scris. − (DE) Islanda, care a înaintat Consiliului cererea sa de aderare la Uniunea Europeană la data de 16 iulie 2009, nu ar trebui, desigur, să fie dezavantajată faţă de alte ţări candidate sau potenţial candidate. Acestea fiind spuse, am votat pentru adaptarea şi modificarea reglementărilor existente cu privire la asistenţa pentru preaderare. După cum ştim, Islanda este deja membru al SEE şi este o naţiune foarte bine dezvoltată, de aceea plăţile acordate din această asistenţă ar trebui limitate. Cu toate acestea, în general, acest instrument pentru preaderare ar trebui revizuit din nou. De exemplu, nu este deloc clar de ce ţări non-europene, precum Turcia, primesc sute de milioane de euro din banii contribuabililor europeni, bani de care este nevoie urgentă în Europa. ']"
100, 7. Explicaţii privind votul,"  Vilija Blinkevičiūtė  (S&D),  în scris. − (LT) Am votat pentru acest raport întrucât Convenţia de la Haga din 2003 privind obţinerea pensiei de întreţinere în străinătate pentru copii şi alţi membri ai familiei este, înainte de toate, o măsură de protecţie a copiilor, întrucât marea majoritate a acestor solicitări se referă la pensia de întreţinere a copiilor. Această convenţie îşi propune să uşureze recuperarea plăţilor de către cetăţeni şi să se asigure că solicitările pentru întreţinere în afara graniţelor sunt recunoscute şi soluţionate în mod eficient. Sunt mulţumită că Parlamentul European a fost consultat de Consiliu, care urmează să adopte o decizie cu privire la această convenţie, întrucât, datorită posibilităţilor de liberă circulaţie în statele membre UE şi în alte ţări, şi din cauza numărului ridicat de divorţuri, există şi o creştere a numărului de cazuri internaţionale care implică recuperarea întreţinerii.Aş dori să subliniez că, din moment ce propunerea Comisiei cu privire la recuperarea întreţinerii va fi aprobată, va fi mai uşor şi mai simplu ca o persoană care trăieşte pe teritoriul unuia din statele contractante să recupereze întreţinerea (alocaţia) de la o persoană aflată sub jurisdicţia unui alt stat contractant. Astfel, odată ce această propunere va fi fost adoptată, relaţiile dintre ţările semnatare ale convenţiei şi statele membre ale Uniunii Europene în această privinţă vor fi întărite din punct de vedere legal şi reglementate armonios. ","Vilija Blinkevičiūtė  (S&D),",2,227,not_available,"['lit', 'lit']","['  Vilija Blinkevičiūtė  (S&D),  în scris. − (LT) Am votat pentru acest raport întrucât Convenţia de la Haga din 2003 privind obţinerea pensiei de întreţinere în străinătate pentru copii şi alţi membri ai familiei este, înainte de toate, o măsură de protecţie a copiilor, întrucât marea majoritate a acestor solicitări se referă la pensia de întreţinere a copiilor. Această convenţie îşi propune să uşureze recuperarea plăţilor de către cetăţeni şi să se asigure că solicitările pentru întreţinere în afara graniţelor sunt recunoscute şi soluţionate în mod eficient. Sunt mulţumită că Parlamentul European a fost consultat de Consiliu, care urmează să adopte o decizie cu privire la această convenţie, întrucât, datorită posibilităţilor de liberă circulaţie în statele membre UE şi în alte ţări, şi din cauza numărului ridicat de divorţuri, există şi o creştere a numărului de cazuri internaţionale care implică recuperarea întreţinerii.', 'Aş dori să subliniez că, din moment ce propunerea Comisiei cu privire la recuperarea întreţinerii va fi aprobată, va fi mai uşor şi mai simplu ca o persoană care trăieşte pe teritoriul unuia din statele contractante să recupereze întreţinerea (alocaţia) de la o persoană aflată sub jurisdicţia unui alt stat contractant. Astfel, odată ce această propunere va fi fost adoptată, relaţiile dintre ţările semnatare ale convenţiei şi statele membre ale Uniunii Europene în această privinţă vor fi întărite din punct de vedere legal şi reglementate armonios. ']"
