,agenda_item,text,speaker,number_p,number_w,chair,language_ps,ps
0, 1. Deschiderea şedinţei,PREZIDEAZĂ: DL McMILLAN-SCOTT Vicepreşedinte,PREZIDEAZĂ: DL McMILLAN-SCOTT,1,5,not_available,['rum'],['PREZIDEAZĂ: DL McMILLAN-SCOTT Vicepreşedinte']
1," 3. Propunere de directivă a Consiliului privind aplicarea Acordului-cadru privind prevenirea rănilor provocate de obiecte ascuțite în sectorul spitalicesc și în cel al asistenței medicale, încheiat între HOSPEEM și EPSU (dezbatere)","  Preşedintele. −   Următorul punct pe ordinea de zi este dezbaterea privind propunerea de rezoluţie depusă de Elizabeth Lynne şi Pervenche Berès, în numele Comisiei EMPL referitoare la propunerea de directivă a Consiliului de punere în aplicare a acordului-cadru privind prevenirea rănilor provocate de obiecte ascuţite în sectorul spitalicesc şi în cel al asistenţei medicale, încheiat între HOSPEEM şi EPSU (B7-0063/2010). ",Preşedintele. −,1,62,not_available,['rum'],"['  Preşedintele. −   Următorul punct pe ordinea de zi este dezbaterea privind propunerea de rezoluţie depusă de Elizabeth Lynne şi Pervenche Berès, în numele Comisiei EMPL referitoare la propunerea de directivă a Consiliului de punere în aplicare a acordului-cadru privind prevenirea rănilor provocate de obiecte ascuţite în sectorul spitalicesc şi în cel al asistenţei medicale, încheiat între HOSPEEM şi EPSU (B7-0063/2010). ']"
2," 3. Propunere de directivă a Consiliului privind aplicarea Acordului-cadru privind prevenirea rănilor provocate de obiecte ascuțite în sectorul spitalicesc și în cel al asistenței medicale, încheiat între HOSPEEM și EPSU (dezbatere)","  Elizabeth Lynne,  autoare. − Dle preşedinte, în fiecare an, în întreaga UE se înregistrează peste un milion de răni provocate de ace şi care pot fi prevenite, în rândul lucrătorilor din sectorul serviciilor de sănătate. Mulţi din cei care se rănesc şi familiile lor trec printr-o perioadă de agonie, aşteptând să afle dacă au contractat o infecţie transmisibilă prin sânge, cum ar fi HIV sau hepatita C.Riscurile unei infecţii în urma unui accident nu sunt nesemnificative. Experţii susţin că una din trei persoane riscă să contracteze hepatită B, una din 30 hepatită C şi 1 din 300 HIV. Să luăm exemplul lui Juliet Young. Juliet era o asistentă care a murit în 2008, la şapte ani după ce a contractat HIV în timp ce recolta sânge de la un pacient infectat într-un spital londonez. Din greşeală, Juliet s-a înţepat la degetul mare cu acul, după ce acesta a alunecat în timp ce recolta o probă. Sau cazul unei asistente de stomatologie care lucra într-o închisoare şi care s-a înţepat cu un ac care fusese utilizat la un deţinut care avea hepatită A, B şi C şi era HIV pozitiv. Imaginaţi-vă agonia prin care a trecut aşteptând rezultatele; acum a descoperit că a contractat hepatită C. Această asistentă, ca şi multe altele în aceeaşi situaţie, continuă să militeze cu privire la această problemă.M-am implicat pentru prima dată în 2004, când am vizitat un spital din circumscripţia mea la îndemnul Health First Europe şi apoi, la 1 decembrie acelaşi an, de Ziua Mondială a Luptei împotriva SIDA, am găzduit o expoziţie împreună cu Stephen Hughes în acest Parlament. Lucrători din sectorul serviciilor de sănătate din întreaga Uniune Europeană ne-au vizitat, au vizitat Parlamentul, disperaţi să primească ajutor. Cei dintre dvs. care au avut posibilitatea de a se întâlni cu asistentele respective şi cu alţi lucrători din sectorul serviciilor de sănătate nu au putut să nu fie impresionaţi de situaţia acestora, iar în 2006 am adoptat o rezoluţie parlamentară referitoare la protecţia lucrătorilor din serviciile de sănătate europene împotriva infecţiilor transmisibile prin sânge cauzate de rănile provocate de ace. Această rezoluţie a solicitat Comisiei să înainteze o propunere legislativă de modificare a Directivei 2000/54/CE privind expunerea la agenţi biologici în termen de trei luni. Această propunere nu a mai sosit, dar Stephen Hughes şi cu mine nu am renunţat la luptă.Personal, am prezentat amendamente la numeroase rapoarte şi rezoluţii care solicită acţiuni, am vorbit de multe ori în plen cu privire la această problemă şi am depus nenumărate întrebări parlamentare. În urma reuniunilor cu dl comisar Špidla, în 2008 ni s-a spus că o propunere este în curs de elaborare de către Comisie şi eram pe punctul de a realiza acest lucru. Totuşi, în ultimul moment, aceasta a fost blocată, pe măsură ce partenerii sociali promiteau că vor încerca, în cele din urmă, să ajungă la un acord, spre frustrarea noastră.În sfârşit, în vara lui 2009, partenerii sociali au ajuns la un acord cuprinzător privind cerinţele necesare. Rezoluţia mea susţine întru totul acordul. Consiliul trebuie să adopte de urgenţă directiva propusă, astfel încât Comisia să se asigure că este pusă în aplicare eficient şi neîntârziat. Lucrătorii din serviciile de sănătate din întreaga Europă depind de noi. Aceşti lucrători nu pot aştepta şi nu ar trebui să fie în continuare în pericol. Acum a sosit momentul să luăm măsuri decisive. ","Elizabeth Lynne,",5,570,not_available,"['rum', 'rum', 'rum', 'rum', 'rum']","['  Elizabeth Lynne,  autoare. − Dle preşedinte, în fiecare an, în întreaga UE se înregistrează peste un milion de răni provocate de ace şi care pot fi prevenite, în rândul lucrătorilor din sectorul serviciilor de sănătate. Mulţi din cei care se rănesc şi familiile lor trec printr-o perioadă de agonie, aşteptând să afle dacă au contractat o infecţie transmisibilă prin sânge, cum ar fi HIV sau hepatita C.', 'Riscurile unei infecţii în urma unui accident nu sunt nesemnificative. Experţii susţin că una din trei persoane riscă să contracteze hepatită B, una din 30 hepatită C şi 1 din 300 HIV. Să luăm exemplul lui Juliet Young. Juliet era o asistentă care a murit în 2008, la şapte ani după ce a contractat HIV în timp ce recolta sânge de la un pacient infectat într-un spital londonez. Din greşeală, Juliet s-a înţepat la degetul mare cu acul, după ce acesta a alunecat în timp ce recolta o probă. Sau cazul unei asistente de stomatologie care lucra într-o închisoare şi care s-a înţepat cu un ac care fusese utilizat la un deţinut care avea hepatită A, B şi C şi era HIV pozitiv. Imaginaţi-vă agonia prin care a trecut aşteptând rezultatele; acum a descoperit că a contractat hepatită C. Această asistentă, ca şi multe altele în aceeaşi situaţie, continuă să militeze cu privire la această problemă.', 'M-am implicat pentru prima dată în 2004, când am vizitat un spital din circumscripţia mea la îndemnul Health First Europe şi apoi, la 1 decembrie acelaşi an, de Ziua Mondială a Luptei împotriva SIDA, am găzduit o expoziţie împreună cu Stephen Hughes în acest Parlament. Lucrători din sectorul serviciilor de sănătate din întreaga Uniune Europeană ne-au vizitat, au vizitat Parlamentul, disperaţi să primească ajutor. Cei dintre dvs. care au avut posibilitatea de a se întâlni cu asistentele respective şi cu alţi lucrători din sectorul serviciilor de sănătate nu au putut să nu fie impresionaţi de situaţia acestora, iar în 2006 am adoptat o rezoluţie parlamentară referitoare la protecţia lucrătorilor din serviciile de sănătate europene împotriva infecţiilor transmisibile prin sânge cauzate de rănile provocate de ace. Această rezoluţie a solicitat Comisiei să înainteze o propunere legislativă de modificare a Directivei 2000/54/CE privind expunerea la agenţi biologici în termen de trei luni. Această propunere nu a mai sosit, dar Stephen Hughes şi cu mine nu am renunţat la luptă.', 'Personal, am prezentat amendamente la numeroase rapoarte şi rezoluţii care solicită acţiuni, am vorbit de multe ori în plen cu privire la această problemă şi am depus nenumărate întrebări parlamentare. În urma reuniunilor cu dl comisar Špidla, în 2008 ni s-a spus că o propunere este în curs de elaborare de către Comisie şi eram pe punctul de a realiza acest lucru. Totuşi, în ultimul moment, aceasta a fost blocată, pe măsură ce partenerii sociali promiteau că vor încerca, în cele din urmă, să ajungă la un acord, spre frustrarea noastră.', 'În sfârşit, în vara lui 2009, partenerii sociali au ajuns la un acord cuprinzător privind cerinţele necesare. Rezoluţia mea susţine întru totul acordul. Consiliul trebuie să adopte de urgenţă directiva propusă, astfel încât Comisia să se asigure că este pusă în aplicare eficient şi neîntârziat. Lucrătorii din serviciile de sănătate din întreaga Europă depind de noi. Aceşti lucrători nu pot aştepta şi nu ar trebui să fie în continuare în pericol. Acum a sosit momentul să luăm măsuri decisive. ']"
3," 3. Propunere de directivă a Consiliului privind aplicarea Acordului-cadru privind prevenirea rănilor provocate de obiecte ascuțite în sectorul spitalicesc și în cel al asistenței medicale, încheiat între HOSPEEM și EPSU (dezbatere)","  Stephen Hughes,  autor. − Dle preşedinte, acesta este un act legislativ foarte important în domeniul sănătăţii şi al siguranţei. Liz a subliniat o parte din contextul acestuia. Acesta este în curs de elaborare de mult timp – au trecut şase ani de la prima reuniune pe care am avut-o, după cum a menţionat şi ea. Îmi pare bine că participă şi dl comisar Andor la reuniune însă, într-un fel, este păcat că dl comisar Špidla nu se află aici. De multe ori l-am criticat în Parlament, însă în această dimineaţă l-am fi putut felicita pentru că a luat în cele din urmă iniţiativa de a înainta această propunere privind prevenirea rănilor provocate de ace şi de obiecte ascuţite.A durat până când l-am convins să acţioneze. De fapt, serviciile sale erau cele care îl sfătuiau în continuare să nu ia nicio măsură, pentru că directiva convenită în 2000 privind protecţia lucrătorilor împotriva riscurilor legate de expunerea la agenţi biologici la locul de muncă, alături de elementele de evaluare a riscurilor din directiva-cadru din 1989, erau suficiente pentru a preveni acest gen de răni, însă, în cele din urmă, am convins serviciile respective că, având în vedere că se înregistrează un milion de răni pe an, ceva nu este în regulă. Aveam nevoie de legislaţie specifică pentru a aborda această problemă, aşa cum există în Statele Unite şi în unele părţi ale Spaniei, unde funcţionează foarte eficient.În cele din urmă, dl comisar a fost de acord să acţioneze, iar în 2008, aşa cum a spus Liz, a redactat o modificare a directivei din 2000, însă ulterior, HOSPEEM şi EPSU, sindicatele din serviciile publice, şi-au semnalat intenţia de a formula un acord. Acestea au formulat acordul respectiv. Mă bucură acest fapt. Este un acord bun, dar este puţin ambiguu în anumite locuri. De aceea, am depus un amendament asupra căruia s-a convenit în cadrul Comisiei pentru ocuparea forţei de muncă, pentru a obţine publicarea, de către Comisie, a unor orientări care să însoţească directiva, în vederea asigurării transpunerii armonioase şi uniforme a acesteia în legislaţie în toate statele membre.Susţinem pe deplin propunerea de directivă a Comisiei şi înţelegem că nu ne putem atinge de acordul din partea partenerilor sociali. Nu îl putem modifica. Consiliul nu îl poate modifica. Este acordul lor. Cu toate acestea, partea cea mai importantă a acordului, clauza 6, care se referă la eliminare, prevenire şi protecţie, cuprinde, din păcate, o oarecare ambiguitate legată de evaluarea riscului, mai precis care elementele de prevenire care trebuie puse în aplicare de angajatori şi momentul punerii în aplicare a acestora.Dacă această ambiguitate nu este clarificată, riscăm o variabilitate dramatică în aplicarea directivei. Din acest motiv, solicităm Comisiei să redacteze orientări privind punerea în aplicare, pentru a ajuta angajatorii să înţeleagă riscurile şi măsurile necesare de prevenire în vederea asigurării unei aplicări consecvente a directivei.Rănile provocate de ace sunt forma cea mai întâlnită şi cea mai periculoasă de răni provocate de obiecte ascuţite în domeniul medical. De fiecare dată când se utilizează un ac tubular la un pacient, există riscul unei răni provocate de ac, care ar putea produce o infecţie gravă a unui lucrător în sectorul serviciilor de sănătate, deoarece acul tubular acţionează ca un rezervor pentru sânge sau pentru alte lichide din corpul pacientului.Există numeroase probe independente care au dovedit că introducerea unei instruiri îmbunătăţite, practici de lucru mai sigure şi utilizarea de dispozitive medicale care incorporează mecanisme de protecţie menite să asigure siguranţa vor preveni majoritatea rănilor provocate de ace. Toate aceste lucruri sunt necesare, nu doar unul sau două – toate sunt necesare.Studiile au demonstrat, de asemenea, că nepunerea în aplicare a oricăruia din aceste trei elemente produce un impact cu mult mai redus. În aceeaşi măsură, încercările de punere în aplicare a unor dispozitive medicale care incorporează mecanisme de protecţie menite să asigure siguranţa numai în anumite domenii sau în cazul anumitor pacienţi nu ar fi nici practice, nici eficiente.În ţările în care există legislaţie eficientă în vigoare, precum America, Canada şi unele părţi ale Spaniei, se prevede clar că toate cele trei elemente trebuie puse în aplicare în vederea prevenirii rănilor provocate de ace. Nu este o coincidenţă că toate sunt la fel în această privinţă. Prin urmare, aceasta este ambiguitatea din clauza 6, pe care dorim să o eliminăm prin publicarea unor orientări.Liz a menţionat trauma cu care se confruntă persoanele afectate de răni provocate de ace. În ultimii şase ani în care am lucrat la acest proiect, am întâlnit persoane care au suferit răni provocate de ace şi aş dori să pun accent pe această traumă. Am întâlnit un doctor care a renunţat la practica medicală din cauza unei răni provocate de ace. Am întâlnit o persoană care are HIV în urma unei răni provocate de ace. Am întâlnit persoane care s-au dovedit a nu fi infectate, însă au aflat acest lucru numai după luni de zile de nesiguranţă legată de rezultat. De asemenea, am întâlnit gunoieri şi ofiţeri de închisoare care au suferit de răni provocate de ace. Acordul nu se referă la aceştia. Este un alt domeniu la care trebuie să ne gândim în viitor.Cu toate acestea, este un acord bun şi cred că dacă avem orientări bune care să îl însoţească, pentru a asigura aplicarea uniformă în întreaga Uniune Europeană, ne vom face bine datoria şi sper că vom reduce în mod radical cifra de un milion de răni provocate de ace pe an. ","Stephen Hughes,",11,917,not_available,"['rum', 'rum', 'rum', 'rum', 'rum', 'rum', 'rum', 'rum', 'rum', 'rum', 'rum']","['  Stephen Hughes,  autor. − Dle preşedinte, acesta este un act legislativ foarte important în domeniul sănătăţii şi al siguranţei. Liz a subliniat o parte din contextul acestuia. Acesta este în curs de elaborare de mult timp – au trecut şase ani de la prima reuniune pe care am avut-o, după cum a menţionat şi ea. Îmi pare bine că participă şi dl comisar Andor la reuniune însă, într-un fel, este păcat că dl comisar Špidla nu se află aici. De multe ori l-am criticat în Parlament, însă în această dimineaţă l-am fi putut felicita pentru că a luat în cele din urmă iniţiativa de a înainta această propunere privind prevenirea rănilor provocate de ace şi de obiecte ascuţite.', 'A durat până când l-am convins să acţioneze. De fapt, serviciile sale erau cele care îl sfătuiau în continuare să nu ia nicio măsură, pentru că directiva convenită în 2000 privind protecţia lucrătorilor împotriva riscurilor legate de expunerea la agenţi biologici la locul de muncă, alături de elementele de evaluare a riscurilor din directiva-cadru din 1989, erau suficiente pentru a preveni acest gen de răni, însă, în cele din urmă, am convins serviciile respective că, având în vedere că se înregistrează un milion de răni pe an, ceva nu este în regulă. Aveam nevoie de legislaţie specifică pentru a aborda această problemă, aşa cum există în Statele Unite şi în unele părţi ale Spaniei, unde funcţionează foarte eficient.', 'În cele din urmă, dl comisar a fost de acord să acţioneze, iar în 2008, aşa cum a spus Liz, a redactat o modificare a directivei din 2000, însă ulterior, HOSPEEM şi EPSU, sindicatele din serviciile publice, şi-au semnalat intenţia de a formula un acord. Acestea au formulat acordul respectiv. Mă bucură acest fapt. Este un acord bun, dar este puţin ambiguu în anumite locuri. De aceea, am depus un amendament asupra căruia s-a convenit în cadrul Comisiei pentru ocuparea forţei de muncă, pentru a obţine publicarea, de către Comisie, a unor orientări care să însoţească directiva, în vederea asigurării transpunerii armonioase şi uniforme a acesteia în legislaţie în toate statele membre.', 'Susţinem pe deplin propunerea de directivă a Comisiei şi înţelegem că nu ne putem atinge de acordul din partea partenerilor sociali. Nu îl putem modifica. Consiliul nu îl poate modifica. Este acordul lor. Cu toate acestea, partea cea mai importantă a acordului, clauza 6, care se referă la eliminare, prevenire şi protecţie, cuprinde, din păcate, o oarecare ambiguitate legată de evaluarea riscului, mai precis care elementele de prevenire care trebuie puse în aplicare de angajatori şi momentul punerii în aplicare a acestora.', 'Dacă această ambiguitate nu este clarificată, riscăm o variabilitate dramatică în aplicarea directivei. Din acest motiv, solicităm Comisiei să redacteze orientări privind punerea în aplicare, pentru a ajuta angajatorii să înţeleagă riscurile şi măsurile necesare de prevenire în vederea asigurării unei aplicări consecvente a directivei.', 'Rănile provocate de ace sunt forma cea mai întâlnită şi cea mai periculoasă de răni provocate de obiecte ascuţite în domeniul medical. De fiecare dată când se utilizează un ac tubular la un pacient, există riscul unei răni provocate de ac, care ar putea produce o infecţie gravă a unui lucrător în sectorul serviciilor de sănătate, deoarece acul tubular acţionează ca un rezervor pentru sânge sau pentru alte lichide din corpul pacientului.', 'Există numeroase probe independente care au dovedit că introducerea unei instruiri îmbunătăţite, practici de lucru mai sigure şi utilizarea de dispozitive medicale care incorporează mecanisme de protecţie menite să asigure siguranţa vor preveni majoritatea rănilor provocate de ace. Toate aceste lucruri sunt necesare, nu doar unul sau două – toate sunt necesare.', 'Studiile au demonstrat, de asemenea, că nepunerea în aplicare a oricăruia din aceste trei elemente produce un impact cu mult mai redus. În aceeaşi măsură, încercările de punere în aplicare a unor dispozitive medicale care incorporează mecanisme de protecţie menite să asigure siguranţa numai în anumite domenii sau în cazul anumitor pacienţi nu ar fi nici practice, nici eficiente.', 'În ţările în care există legislaţie eficientă în vigoare, precum America, Canada şi unele părţi ale Spaniei, se prevede clar că toate cele trei elemente trebuie puse în aplicare în vederea prevenirii rănilor provocate de ace. Nu este o coincidenţă că toate sunt la fel în această privinţă. Prin urmare, aceasta este ambiguitatea din clauza 6, pe care dorim să o eliminăm prin publicarea unor orientări.', 'Liz a menţionat trauma cu care se confruntă persoanele afectate de răni provocate de ace. În ultimii şase ani în care am lucrat la acest proiect, am întâlnit persoane care au suferit răni provocate de ace şi aş dori să pun accent pe această traumă. Am întâlnit un doctor care a renunţat la practica medicală din cauza unei răni provocate de ace. Am întâlnit o persoană care are HIV în urma unei răni provocate de ace. Am întâlnit persoane care s-au dovedit a nu fi infectate, însă au aflat acest lucru numai după luni de zile de nesiguranţă legată de rezultat. De asemenea, am întâlnit gunoieri şi ofiţeri de închisoare care au suferit de răni provocate de ace. Acordul nu se referă la aceştia. Este un alt domeniu la care trebuie să ne gândim în viitor.', 'Cu toate acestea, este un acord bun şi cred că dacă avem orientări bune care să îl însoţească, pentru a asigura aplicarea uniformă în întreaga Uniune Europeană, ne vom face bine datoria şi sper că vom reduce în mod radical cifra de un milion de răni provocate de ace pe an. ']"
