,agenda_item,text,speaker,number_p,number_w,chair,language_ps,ps
32, 3. Európska verejná listina – Elektronická justícia – Právna ochrana dospelých osôb: cezhraničné dôsledky (rozprava) ,"  Bogusław Rogalski  (UEN).   – (PL) Vážený pán predsedajúci, Európska únia sa musí zaoberať problémom výrazného starnutia obyvateľstva členských štátov, súvisiaceho s výrazným nárastom priemernej dĺžky života. Výsledkom toho bude mať okolo roku 2050 približne 40 % obyvateľov Európy vyše 60 rokov a 10 % z nich bude starších než 80 rokov.Tieto demografické zmeny významným spôsobom ovplyvnia naše hospodárstvo, našu spoločnosť, zdravie a náš rozpočet. Musíme teda zaviesť vhodné a konkrétne ochranné mechanizmy, ktoré zaručia rovnaké práva a povinnosti pre všetkých. Chránené osoby trávia čoraz viac času mimo krajiny, v ktorej majú trvalý pobyt, alebo sú v nemocničnej starostlivosti v zahraničí, teda nie v krajine, v ktorej sa nachádza ich majetok. Preto musí systém právnej ochrany zabezpečiť kontinuitu súdnych rozhodnutí, správnych rozhodnutí a rozhodnutí, ktoré prijímajú osoby samotné. Vzťahuje sa to najmä na plnú moc vo vzťahu k budúcej právnej ochrane, ktorú treba uplatniť v členských štátoch EÚ.Musíme preto vytvoriť mechanizmy na účinný prenos dokumentov, najmä v núdzových prípadoch, napríklad keď chránená osoba potrebuje nemocničnú starostlivosť a dočasne sa nachádza mimo krajiny, z ktorej pochádza. Takto by sa Európania mohli bez prekážok zdržiavať alebo bývať v členskom štáte EÚ, ktorý nie je krajinou ich pôvodu, a to bez straty účinného a rýchleho prístupu k zdravotnej starostlivosti. ",Bogusław Rogalski  (UEN).,3,204,not_available,"['pol', 'pol', 'pol']","['  Bogusław Rogalski  (UEN).   – (PL) Vážený pán predsedajúci, Európska únia sa musí zaoberať problémom výrazného starnutia obyvateľstva členských štátov, súvisiaceho s výrazným nárastom priemernej dĺžky života. Výsledkom toho bude mať okolo roku 2050 približne 40 % obyvateľov Európy vyše 60 rokov a 10 % z nich bude starších než 80 rokov.', 'Tieto demografické zmeny významným spôsobom ovplyvnia naše hospodárstvo, našu spoločnosť, zdravie a náš rozpočet. Musíme teda zaviesť vhodné a konkrétne ochranné mechanizmy, ktoré zaručia rovnaké práva a povinnosti pre všetkých. Chránené osoby trávia čoraz viac času mimo krajiny, v ktorej majú trvalý pobyt, alebo sú v nemocničnej starostlivosti v zahraničí, teda nie v krajine, v ktorej sa nachádza ich majetok. Preto musí systém právnej ochrany zabezpečiť kontinuitu súdnych rozhodnutí, správnych rozhodnutí a rozhodnutí, ktoré prijímajú osoby samotné. Vzťahuje sa to najmä na plnú moc vo vzťahu k budúcej právnej ochrane, ktorú treba uplatniť v členských štátoch EÚ.', 'Musíme preto vytvoriť mechanizmy na účinný prenos dokumentov, najmä v núdzových prípadoch, napríklad keď chránená osoba potrebuje nemocničnú starostlivosť a dočasne sa nachádza mimo krajiny, z ktorej pochádza. Takto by sa Európania mohli bez prekážok zdržiavať alebo bývať v členskom štáte EÚ, ktorý nie je krajinou ich pôvodu, a to bez straty účinného a rýchleho prístupu k zdravotnej starostlivosti. ']"
33, 3. Európska verejná listina – Elektronická justícia – Právna ochrana dospelých osôb: cezhraničné dôsledky (rozprava) ,"  Dushana Zdravkova  (PPE-DE)  . – (BG) Vážená pani ministerka, pán komisár, dámy a páni, rada by som vás ubezpečila, že dnešná rozprava o týchto troch správach veľmi zaujíma občanov Európskej únie a mojich kolegov právnikov. Preto by som rada zablahoželala spravodajcom týchto troch správ.Doteraz som pracovala výlučne v systéme súdnictva ako predsedníčka jedného z najväčších súdov v Bulharsku, ktorý ako prvý zaviedol technológiu spracúvania prípadov online, a do roku 2000 ako predsedníčka výboru expertov Rady Európy pre informačné technológie a právo. Preto témy súvisiace s elektronickou justíciou veľmi dobre poznám. Keď sme v roku 1995 zavádzali informačné technológie, nebolo by mi ani napadlo, že táto téma vyvolá v Európskom parlamente taký rozruch. Preto som veľmi rada, že o nej dnes môžem hovoriť.Rada by som zablahoželala najmä pani Wallisovej k správe o elektronickej justícii, lebo si myslím, že využitie informačných technológií a nových komunikačných technológií v oblasti spravodlivosti ešte viac podporí rozvoj cezhraničnej súdnej spolupráce a zároveň uľahčí obyvateľom Európskej únie prístup k systému justície.Rada by som však zdôraznila, že pre dosiahnutie účinného európskeho systému v tejto oblasti je veľmi dôležité vytvoriť všeobecnú stratégiu na inštitucionálnej úrovni a vypracovať všeobecné normy na podporu účinnejšej komunikácie medzi národnými systémami, pričom treba myslieť aj na potrebu mnohých kvalitne vzdelaných odborníkov.Až po splnení týchto podmienok budeme vedieť využiť potenciál nových technológií v boji proti cezhraničnému zločinu a zabezpečiť občanom lepšiu prístupnosť k justičnému systému v občianskoprávnych a obchodných záležitostiach.Vzhľadom na to nalieham, aby sa podporili všetky relevantné projekty, či už ide o sieť registrov trestov online, register neplatičov alebo Európsku súdnu sieť v občianskoprávnych a obchodných veciach. Toto je jediný spôsob, ako môžeme dosiahnuť jeden zo základných cieľov Európskej únie, ktorým je väčšia interakcia s jej občanmi. ",Dushana Zdravkova  (PPE-DE),6,287,not_available,"['bul', 'bul', 'bul', 'bul', 'bul', 'bul']","['  Dushana Zdravkova  (PPE-DE)  . – (BG) Vážená pani ministerka, pán komisár, dámy a páni, rada by som vás ubezpečila, že dnešná rozprava o týchto troch správach veľmi zaujíma občanov Európskej únie a mojich kolegov právnikov. Preto by som rada zablahoželala spravodajcom týchto troch správ.', 'Doteraz som pracovala výlučne v systéme súdnictva ako predsedníčka jedného z najväčších súdov v Bulharsku, ktorý ako prvý zaviedol technológiu spracúvania prípadov online, a do roku 2000 ako predsedníčka výboru expertov Rady Európy pre informačné technológie a právo. Preto témy súvisiace s elektronickou justíciou veľmi dobre poznám. Keď sme v roku 1995 zavádzali informačné technológie, nebolo by mi ani napadlo, že táto téma vyvolá v Európskom parlamente taký rozruch. Preto som veľmi rada, že o nej dnes môžem hovoriť.', 'Rada by som zablahoželala najmä pani Wallisovej k správe o elektronickej justícii, lebo si myslím, že využitie informačných technológií a nových komunikačných technológií v oblasti spravodlivosti ešte viac podporí rozvoj cezhraničnej súdnej spolupráce a zároveň uľahčí obyvateľom Európskej únie prístup k systému justície.', 'Rada by som však zdôraznila, že pre dosiahnutie účinného európskeho systému v tejto oblasti je veľmi dôležité vytvoriť všeobecnú stratégiu na inštitucionálnej úrovni a vypracovať všeobecné normy na podporu účinnejšej komunikácie medzi národnými systémami, pričom treba myslieť aj na potrebu mnohých kvalitne vzdelaných odborníkov.', 'Až po splnení týchto podmienok budeme vedieť využiť potenciál nových technológií v boji proti cezhraničnému zločinu a zabezpečiť občanom lepšiu prístupnosť k justičnému systému v občianskoprávnych a obchodných záležitostiach.', 'Vzhľadom na to nalieham, aby sa podporili všetky relevantné projekty, či už ide o sieť registrov trestov online, register neplatičov alebo Európsku súdnu sieť v občianskoprávnych a obchodných veciach. Toto je jediný spôsob, ako môžeme dosiahnuť jeden zo základných cieľov Európskej únie, ktorým je väčšia interakcia s jej občanmi. ']"
34, 3. Európska verejná listina – Elektronická justícia – Právna ochrana dospelých osôb: cezhraničné dôsledky (rozprava) ,"  Lidia Joanna Geringer de Oedenberg  (PSE).   – (PL) Vážený pán predsedajúci, v oznámení z 10. mája 2005 o Haagskom programe, ktoré bolo určené Parlamentu a Rade, Komisia ako jednu zo svojich konkrétnych priorít uviedla, že do roku 2011 chce zaručiť účinný európsky priestor spravodlivosti pre občianske právo, najmä v oblasti uznávania a vykonávania rozhodnutí súdu a zásady vzájomného uznávania, keďže tieto opatrenia zabezpečujú občanom Európskej únie cezhraničnú právnu ochranu.Európska únia sa rozširuje a podporuje sa čoraz väčšia mobilita jej občanov. Pohyb osôb v rámci Spoločenstva zatiaľ spôsobuje problémy v súvislosti s prenosom verejných listín. Množstvo riešení, ktoré členské štáty uplatňujú na problém vzájomného uznávania verejných listín, znamená, že v súčasnosti je obeh týchto dokumentov komplikovanou záležitosťou, pričom existujú obmedzenia počtu a druhu dokumentov, ktoré možno prenášať.Komisia musí podniknúť konkrétne kroky na okamžité zavedenie jedného a jednotného systému vytvoreného na mieru, ktorý bude platiť pre vykonávanie a vzájomné uznávanie verejných listín vo všetkých členských štátoch. Tento systém výrazne uľahčí občanom aj podnikom ich každodenný život.Z tohto nástroja Spoločenstva by zároveň vzhľadom na rozdiely v štruktúre a organizácii systémov verejných registrov v oblasti vlastníctva nehnuteľností mali byť vylúčené zápisy do verejných registrov pozemkov a nehnuteľností. Okrem tejto výnimky sa uznanie pravosti, dôkaznej hodnoty a vykonateľnosti verejnej listiny za účelom jej použitia v členskom štáte, ktorý ju vyžaduje, môže odmietnuť iba v prípade, že existujú vážne a odôvodnené pochybnosti o jej pravosti, alebo ak je jej uznanie v rozpore s právnym poriadkom členského štátu, ktorý ju vyžaduje.Na záver by som rada poďakovala spravodajcovi pánovi Medinovi Ortegovi za veľmi dobre pripravený dokument. ",Lidia Joanna Geringer de Oedenberg  (PSE).,5,261,not_available,"['pol', 'pol', 'pol', 'pol', 'pol']","['  Lidia Joanna Geringer de Oedenberg  (PSE).   – (PL) Vážený pán predsedajúci, v oznámení z 10. mája 2005 o Haagskom programe, ktoré bolo určené Parlamentu a Rade, Komisia ako jednu zo svojich konkrétnych priorít uviedla, že do roku 2011 chce zaručiť účinný európsky priestor spravodlivosti pre občianske právo, najmä v oblasti uznávania a vykonávania rozhodnutí súdu a zásady vzájomného uznávania, keďže tieto opatrenia zabezpečujú občanom Európskej únie cezhraničnú právnu ochranu.', 'Európska únia sa rozširuje a podporuje sa čoraz väčšia mobilita jej občanov. Pohyb osôb v rámci Spoločenstva zatiaľ spôsobuje problémy v súvislosti s prenosom verejných listín. Množstvo riešení, ktoré členské štáty uplatňujú na problém vzájomného uznávania verejných listín, znamená, že v súčasnosti je obeh týchto dokumentov komplikovanou záležitosťou, pričom existujú obmedzenia počtu a druhu dokumentov, ktoré možno prenášať.', 'Komisia musí podniknúť konkrétne kroky na okamžité zavedenie jedného a jednotného systému vytvoreného na mieru, ktorý bude platiť pre vykonávanie a vzájomné uznávanie verejných listín vo všetkých členských štátoch. Tento systém výrazne uľahčí občanom aj podnikom ich každodenný život.', 'Z tohto nástroja Spoločenstva by zároveň vzhľadom na rozdiely v štruktúre a organizácii systémov verejných registrov v oblasti vlastníctva nehnuteľností mali byť vylúčené zápisy do verejných registrov pozemkov a nehnuteľností. Okrem tejto výnimky sa uznanie pravosti, dôkaznej hodnoty a vykonateľnosti verejnej listiny za účelom jej použitia v členskom štáte, ktorý ju vyžaduje, môže odmietnuť iba v prípade, že existujú vážne a odôvodnené pochybnosti o jej pravosti, alebo ak je jej uznanie v rozpore s právnym poriadkom členského štátu, ktorý ju vyžaduje.', 'Na záver by som rada poďakovala spravodajcovi pánovi Medinovi Ortegovi za veľmi dobre pripravený dokument. ']"
35, 3. Európska verejná listina – Elektronická justícia – Právna ochrana dospelých osôb: cezhraničné dôsledky (rozprava) ,"  Toomas Savi  (ALDE).   – Vážený pán predsedajúci, s potešením vítam myšlienku, že Komisia pripraví akčný plán o elektronickej justícii. Bol som dosť prekvapený, keď som sa dozvedel, že taká iniciatíva ešte nebola zavedená. Chcel by som poďakovať kolegyni Diane Wallisovej, že si s touto naliehavou záležitosťou poradila mimoriadne vhodným spôsobom. Rýchly technologický rozvoj nám poskytuje nové efektívne nástroje, s využitím ktorých by sme nemali váhať.Priniesol nám však aj nové problémy vrátane počítačovej kriminality ako nepovolené sledovanie, podvod, kybernetické súboje a mnohé iné. Je najvyšší čas, aby Európska únia zaviedla právne predpisy týkajúce sa definovania, vyšetrovania a trestania počítačovej kriminality. Počítačová kriminalita presahuje štátne hranice, a preto by sme na ňu mali reagovať na nadnárodnej úrovni. Očakávam, že Komisia urýchlene prijme legislatívnu iniciatívu v tejto oblasti. ",Toomas Savi  (ALDE).,2,125,not_available,"['slo', 'slo']","['  Toomas Savi  (ALDE).   – Vážený pán predsedajúci, s potešením vítam myšlienku, že Komisia pripraví akčný plán o elektronickej justícii. Bol som dosť prekvapený, keď som sa dozvedel, že taká iniciatíva ešte nebola zavedená. Chcel by som poďakovať kolegyni Diane Wallisovej, že si s touto naliehavou záležitosťou poradila mimoriadne vhodným spôsobom. Rýchly technologický rozvoj nám poskytuje nové efektívne nástroje, s využitím ktorých by sme nemali váhať.', 'Priniesol nám však aj nové problémy vrátane počítačovej kriminality ako nepovolené sledovanie, podvod, kybernetické súboje a mnohé iné. Je najvyšší čas, aby Európska únia zaviedla právne predpisy týkajúce sa definovania, vyšetrovania a trestania počítačovej kriminality. Počítačová kriminalita presahuje štátne hranice, a preto by sme na ňu mali reagovať na nadnárodnej úrovni. Očakávam, že Komisia urýchlene prijme legislatívnu iniciatívu v tejto oblasti. ']"
36, 3. Európska verejná listina – Elektronická justícia – Právna ochrana dospelých osôb: cezhraničné dôsledky (rozprava) ,"  Costas Botopoulos  (PSE).   – Vážený pán predsedajúci, môžeme povedať, že niečo ako elektronická justícia je možné v činnostiach podmienených ľudskou slabosťou a ľudskými cnosťami, ktoré predstavujú základné črty ľudstva? Nie! Môže existovať spravodlivosť bez hraníc? Nie, ako ste povedali! Ide totiž o ľudskú činnosť, ktorá je v každej časti sveta iná.Znamenajú tieto dve „nie“, že sa máme obrátiť chrbtom k technologickým inováciám? Samozrejme, odpoveď je opäť „nie“! Musíme sa pokúsiť využiť ľudské inovácie. Informačný portál? Áno! Výmena údajov? Áno! Uvedomenie si vzájomného prepojenia justičných systémov? Áno! Príspevok k vytvoreniu európskeho dema? Áno! Ale spoločná bezmenná justícia, pričom nehovorím, že to požadujete v správe? Nie!Môj otec, ktorý bol sudcom, by sa veľmi netešil, keby som v Európskom parlamente obhajoval elektronickú justíciu. Ak sa mám z Európskeho parlamentu prihovoriť svojmu otcovi v nebi, môžem mu povedať, že viem, že justícia, to bude vždy iba človek, jeho obhajca a sudca – nie pred Bohom, ale pred vlastným svedomím. ",Costas Botopoulos  (PSE).,3,155,not_available,"['slo', 'slo', 'slo']","['  Costas Botopoulos  (PSE).   – Vážený pán predsedajúci, môžeme povedať, že niečo ako elektronická justícia je možné v činnostiach podmienených ľudskou slabosťou a ľudskými cnosťami, ktoré predstavujú základné črty ľudstva? Nie! Môže existovať spravodlivosť bez hraníc? Nie, ako ste povedali! Ide totiž o ľudskú činnosť, ktorá je v každej časti sveta iná.', 'Znamenajú tieto dve „nie“, že sa máme obrátiť chrbtom k technologickým inováciám? Samozrejme, odpoveď je opäť „nie“! Musíme sa pokúsiť využiť ľudské inovácie. Informačný portál? Áno! Výmena údajov? Áno! Uvedomenie si vzájomného prepojenia justičných systémov? Áno! Príspevok k vytvoreniu európskeho dema? Áno! Ale spoločná bezmenná justícia, pričom nehovorím, že to požadujete v správe? Nie!', 'Môj otec, ktorý bol sudcom, by sa veľmi netešil, keby som v Európskom parlamente obhajoval elektronickú justíciu. Ak sa mám z Európskeho parlamentu prihovoriť svojmu otcovi v nebi, môžem mu povedať, že viem, že justícia, to bude vždy iba človek, jeho obhajca a sudca – nie pred Bohom, ale pred vlastným svedomím. ']"
37, 3. Európska verejná listina – Elektronická justícia – Právna ochrana dospelých osôb: cezhraničné dôsledky (rozprava) ,"  Nicolae Vlad Popa  (PPE-DE).   – (RO) Rád by som zablahoželal k iniciatíve o obehu verejných listín v Európe, pretože rozvinie voľný pohyb osôb a obchodných podnikov v Európskej únii. Štátne hranice boli odstránené, právne hranice však zostali. Dôkazom toho sú komplexné postupy pri uplatňovaní zmlúv podpisovaných za prítomnosti verejných orgánov, ktoré sú v každej krajine iné.Našou povinnosťou je ponúknuť každému občanovi možnosť uplatnenia ustanovení európskej verejnej listiny bez dodatočných postupov v členskom štáte Európskej únie, aj keď bola verejná listina vyhotovená v inom členskom štáte.Vítam iniciatívu a správu pani Wallisovej o elektronickej justícii, pretože si myslím, že prijatím tejto správy sa zabezpečí, aby mali európski občania prostredníctvom informačných a komunikačných technológií prístup k právnemu a justičnému systému Európy. Urýchlená správa dôkazov za minimálne náklady a zjednodušenie súdnych konaní pomocou využitia jednoduchých a praktických nástrojov uľahčí občanom v prípade cezhraničných súdnych sporov prístup k súdnemu systému. V záujme dosiahnutia týchto… ",Nicolae Vlad Popa  (PPE-DE).,3,151,not_available,"['rum', 'rum', 'rum']","['  Nicolae Vlad Popa  (PPE-DE).   – (RO) Rád by som zablahoželal k iniciatíve o obehu verejných listín v Európe, pretože rozvinie voľný pohyb osôb a obchodných podnikov v Európskej únii. Štátne hranice boli odstránené, právne hranice však zostali. Dôkazom toho sú komplexné postupy pri uplatňovaní zmlúv podpisovaných za prítomnosti verejných orgánov, ktoré sú v každej krajine iné.', 'Našou povinnosťou je ponúknuť každému občanovi možnosť uplatnenia ustanovení európskej verejnej listiny bez dodatočných postupov v členskom štáte Európskej únie, aj keď bola verejná listina vyhotovená v inom členskom štáte.', 'Vítam iniciatívu a správu pani Wallisovej o elektronickej justícii, pretože si myslím, že prijatím tejto správy sa zabezpečí, aby mali európski občania prostredníctvom informačných a komunikačných technológií prístup k právnemu a justičnému systému Európy. Urýchlená správa dôkazov za minimálne náklady a zjednodušenie súdnych konaní pomocou využitia jednoduchých a praktických nástrojov uľahčí občanom v prípade cezhraničných súdnych sporov prístup k súdnemu systému. V záujme dosiahnutia týchto… ']"
38, 3. Európska verejná listina – Elektronická justícia – Právna ochrana dospelých osôb: cezhraničné dôsledky (rozprava) ,"  Armando França  (PSE).   – (PT) Vážený pán predsedajúci, pán komisár, pani Datiová, elektronická justícia je dôležitým krokom v zabezpečení prístupu k právu, spravodlivosti a súdom. Vítam túto iniciatívu a blahoželám pani spravodajkyni a francúzskemu predsedníctvu. Elektronická justícia bola jedným z projektov, o ktorých sa diskutovalo počas portugalského predsedníctva, a preto pripadla Portugalsku úloha viesť vývoj a realizáciu pilotného projektu, ktorý umožní všetkým občanom prístup k službám v iných členských štátoch jednoduchším, lacnejším a pohodlnejším spôsobom a v ich jazyku.Tento mnohojazyčný portál by mal byť navrhnutý tak, aby pomohol občanom a podnikom hľadajúcim právnu pomoc a počiatočné právne poradenstvo o cezhraničných právnych problémoch. Portál elektronickej justície by mal koordinovať a riadiť útvar, ktorý bude zodpovedný aj za koordináciu príspevkov rôznych členských štátov a zabezpečenie ich vzájomného prepojenia. Projekt elektronickej justície bude slúžiť občanom a posilní našu demokraciu. Vítam spustenie portálu, ktoré sa uskutoční v decembri 2009. ",Armando França  (PSE).,2,145,not_available,"['por', 'por']","['  Armando França  (PSE).   – (PT) Vážený pán predsedajúci, pán komisár, pani Datiová, elektronická justícia je dôležitým krokom v zabezpečení prístupu k právu, spravodlivosti a súdom. Vítam túto iniciatívu a blahoželám pani spravodajkyni a francúzskemu predsedníctvu. Elektronická justícia bola jedným z projektov, o ktorých sa diskutovalo počas portugalského predsedníctva, a preto pripadla Portugalsku úloha viesť vývoj a realizáciu pilotného projektu, ktorý umožní všetkým občanom prístup k službám v iných členských štátoch jednoduchším, lacnejším a pohodlnejším spôsobom a v ich jazyku.', 'Tento mnohojazyčný portál by mal byť navrhnutý tak, aby pomohol občanom a podnikom hľadajúcim právnu pomoc a počiatočné právne poradenstvo o cezhraničných právnych problémoch. Portál elektronickej justície by mal koordinovať a riadiť útvar, ktorý bude zodpovedný aj za koordináciu príspevkov rôznych členských štátov a zabezpečenie ich vzájomného prepojenia. Projekt elektronickej justície bude slúžiť občanom a posilní našu demokraciu. Vítam spustenie portálu, ktoré sa uskutoční v decembri 2009. ']"
39, 3. Európska verejná listina – Elektronická justícia – Právna ochrana dospelých osôb: cezhraničné dôsledky (rozprava) ,"  Marcin Libicki  (UEN).   – (PL) Vážený pán predsedajúci, v prvom rade chcem zablahoželať pani Wallisovej k jej skvelej správe a upozorniť vás na dve veci. Ako predseda Výboru pre petície viem, ako často si občania Európskej únie nie sú vedomí svojich práv a naopak, niekedy sa snažia zasahovať do vecí, do ktorých nemajú právo zasahovať. Preto tento internetový portál, nazývaný aj portál elektronickej justície, nepochybne pomôže občanom Európskej únie pri kontaktovaní Európskeho parlamentu a jeho Výboru pre petície.Rád by som vás upozornil aj na inú vec, ktorú pani Wallisová počas svojho vystúpenia spomenula, a to na skutočnosť, že musíme rešpektovať miestne právo. Touto vecou sa pred 250 rokmi začal zaoberať známy francúzsky filozof Charles de Montesqieu, ktorý povedal, že pri tvorbe právnych predpisov na vyššej územnej úrovni vždy treba pamätať na to, že menšie regióny a územia, v tomto prípade členské štáty Európskej únie, majú svoje tradície, ktoré sa musia rešpektovať. ",Marcin Libicki  (UEN).,2,151,not_available,"['pol', 'pol']","['  Marcin Libicki  (UEN).   – (PL) Vážený pán predsedajúci, v prvom rade chcem zablahoželať pani Wallisovej k jej skvelej správe a upozorniť vás na dve veci. Ako predseda Výboru pre petície viem, ako často si občania Európskej únie nie sú vedomí svojich práv a naopak, niekedy sa snažia zasahovať do vecí, do ktorých nemajú právo zasahovať. Preto tento internetový portál, nazývaný aj portál elektronickej justície, nepochybne pomôže občanom Európskej únie pri kontaktovaní Európskeho parlamentu a jeho Výboru pre petície.', 'Rád by som vás upozornil aj na inú vec, ktorú pani Wallisová počas svojho vystúpenia spomenula, a to na skutočnosť, že musíme rešpektovať miestne právo. Touto vecou sa pred 250 rokmi začal zaoberať známy francúzsky filozof Charles de Montesqieu, ktorý povedal, že pri tvorbe právnych predpisov na vyššej územnej úrovni vždy treba pamätať na to, že menšie regióny a územia, v tomto prípade členské štáty Európskej únie, majú svoje tradície, ktoré sa musia rešpektovať. ']"
40, 3. Európska verejná listina – Elektronická justícia – Právna ochrana dospelých osôb: cezhraničné dôsledky (rozprava) ,"  Predsedajúci.   – Dámy a páni, počas nedávnej diskusie predsedníctva Parlamentu bolo povedané, že by sa slovo v rozprave nemalo udeľovať poslancom, ktorí už raz prehovorili. Ale v rámci toho, čo v Španielsku nazývame vianočnou náladou, urobíme výnimku a opäť udelíme slovo pánovi Romagnolimu. ",Predsedajúci.,1,42,not_available,['slo'],"['  Predsedajúci.   – Dámy a páni, počas nedávnej diskusie predsedníctva Parlamentu bolo povedané, že by sa slovo v rozprave nemalo udeľovať poslancom, ktorí už raz prehovorili. Ale v rámci toho, čo v Španielsku nazývame vianočnou náladou, urobíme výnimku a opäť udelíme slovo pánovi Romagnolimu. ']"
