,agenda_item,text,speaker,number_p,number_w,chair,language_ps,ps
0, 1. Otvorenie rokovania,PREDSEDÁ: PÁN BIELAN podpredseda,PREDSEDÁ: PÁN BIELAN,1,4,not_available,['slo'],['PREDSEDÁ: PÁN BIELAN podpredseda']
1, 2. Požiadavky na zverejnenie pre stredné podniky a povinnosť zostavovať konsolidovanú účtovnú závierku – Povinnosti týkajúce sa účtovníctva stredných podnikov (rozprava) ,"  Predsedajúci.   – Ďalším bodom programu je spoločná rozprava o správe pani Ieke van den Burgovej v mene Výboru pre právne veci o návrhu smernice Európskeho parlamentu a Rady, ktorou sa menia a dopĺňajú smernice Rady 78/660/EHS a 83/349/EHS, pokiaľ ide o určité požiadavky na zverejnenie pre stredné podniky a povinnosť zostavovať konsolidovanú účtovnú závierku (KOM(2008)0195 – C6-0173/2008 – 2008/0084(COD)) (A6-0462/2008), ako aj vyhlásenie Komisie o povinnostiach týkajúcich sa účtovníctva stredných podnikov.",Predsedajúci.,1,80,not_available,['slo'],"['  Predsedajúci.   – Ďalším bodom programu je spoločná rozprava o správe pani Ieke van den Burgovej v mene Výboru pre právne veci o návrhu smernice Európskeho parlamentu a Rady, ktorou sa menia a dopĺňajú smernice Rady 78/660/EHS a 83/349/EHS, pokiaľ ide o určité požiadavky na zverejnenie pre stredné podniky a povinnosť zostavovať konsolidovanú účtovnú závierku (KOM(2008)0195 – C6-0173/2008 – 2008/0084(COD)) (A6-0462/2008), ako aj vyhlásenie Komisie o povinnostiach týkajúcich sa účtovníctva stredných podnikov.']"
2, 2. Požiadavky na zverejnenie pre stredné podniky a povinnosť zostavovať konsolidovanú účtovnú závierku – Povinnosti týkajúce sa účtovníctva stredných podnikov (rozprava) ,"  Ieke van den Burg,  spravodajkyňa. – (NL) Vážený pán predsedajúci, ospravedlňujem sa za meškanie. Pre malé a stredné podniky nastali ťažké časy. Kríza nepostihla len banky a kótované spoločnosti, ale zasahuje celé hospodárstvo a spôsobuje úbytok pracovných miest v MSP. Preto by sme v Európe urobili dobre, keby sme tomuto odvetviu pomohli.Tak vznikol aj súbor opatrení, ktoré boli predstavené minulé leto ako iniciatíva Small Business Act. Tvrdo pracujem na množstve návrhov z tohto súboru vrátane štatútu európskej verejnej obchodnej spoločnosti, väčšieho dôrazu na mikroúvery a rozvíjania možnosti nízkej sadzby DPH pre poskytovateľov služieb, ktorí slúžia súkromným osobám v rámci miestneho trhu.Dôležitým problémom malých podnikov je administratívna záťaž, ktorú prinášajú prevažne národné a decentralizované vlády. V oblastiach, na ktoré majú vplyv európske právne predpisy, sme však začali aktívne konať a znižovať túto záťaž. Platí to v podstate aj pre tento dokument. Povinnosť informovať, a týka sa to oboch smerníc, ktoré majú už 25 a 30 rokov a boli mnohokrát zmenené a doplnené, sa teraz upravuje a zjednodušuje prostredníctvom takzvaného zrýchleného postupu.Tieto opatrenia sú však iba malým krokom smerom k zníženiu záťaže. Treba urobiť omnoho viac. V tejto súvislosti sme výslovne vyjadrili našu netrpezlivosť vo Výbore Parlamentu pre právne veci. Z tohto dôvodu sme spolu s legislatívnym dokumentom predložili uznesenie, v ktorom naliehame na výbor, aby urýchlil začatie omnoho podrobnejšej revízie právnych predpisov týkajúcich sa malých a stredných podnikov. Ukázalo sa, že výbor sa tým už zaoberá. Zámerom je dosiahnuť väčšiu harmonizáciu, pokiaľ ide o európske pravidlá pre malé a stredné podniky.Keď sme pred časom preberali túto tému a správu pána Radwana vo Výbore pre hospodárske a menové veci, osobitne sme zdôrazňovali, že to nie je Rada pre medzinárodné účtovné štandardy, ktorá sa podieľala na príprave Medzinárodných štandardov pre finančné vykazovanie (IFRS) pre malé a stredné podniky, kto by mal ukazovať cestu vpred, ale že ďalšiu harmonizáciu v rámci Európy by sme mali dosiahnuť na základe existujúcich právnych predpisov.Počas tejto diskusie to bol najmä pán Lehne, tieňový spravodajca tejto správy, kto navrhoval, že členské štáty by mali mať v tomto štádiu možnosť vyčleniť mikropodniky, teda veľmi malé podniky, z týchto európskych právnych predpisov. Podľa môjho názoru to je núdzové opatrenie, ktoré napriek tomu, že ho navrhla skupina pána Stoibera, nebude viesť k základnému zjednodušeniu z dlhodobého hľadiska, pretože keďže ide o nepovinné opatrenie, spôsobí veľké rozdiely medzi jednotlivými členskými štátmi.Hlavným cieľom a možnosťou by malo byť dosiahnuť rozsiahlu harmonizáciu v takom rozsahu, že aj spoločnosti, ktoré nespĺňajú kritériá na mikropodniky, by mohli využívať podobný, veľmi jednoduchý systém. Pokiaľ ide o tento jednoduchý systém, chcela by som vám pripomenúť možnosti, ktoré ponúka rozšíriteľný jazyk podnikových správ (XBRL), čo je systém umožňujúci rôznym subjektom veľmi jednoduchým spôsobom zadávať údaje a využívať ich. Výrazne by sa tým zjednodušilo poskytovanie takéhoto typu údajov spoločnosťami a tieto údaje by sa dali využiť na mnohé účely.Jednoducho povedané, čoskoro musíme začať primeranú diskusiu o odpore, ktorý prevláda vo svete účtovníctva voči vyčleneniu týchto mikropodnikov. Výbor by mal prísť s návrhmi. Následne by sme mali preskúmať najlepšie riešenie pre stredné podniky, ale aj pre tieto najmenšie podniky, aby sme zabezpečili transparentnosť a dobrý účtovný systém, čo im pomôže v určitých veciach bez toho, aby boli zavalené nadmernou administratívnou záťažou. ","Ieke van den Burg,",8,535,not_available,"['dut', 'dut', 'dut', 'dut', 'dut', 'dut', 'dut', 'dut']","['  Ieke van den Burg,  spravodajkyňa. – (NL) Vážený pán predsedajúci, ospravedlňujem sa za meškanie. Pre malé a stredné podniky nastali ťažké časy. Kríza nepostihla len banky a kótované spoločnosti, ale zasahuje celé hospodárstvo a spôsobuje úbytok pracovných miest v MSP. Preto by sme v Európe urobili dobre, keby sme tomuto odvetviu pomohli.', 'Tak vznikol aj súbor opatrení, ktoré boli predstavené minulé leto ako iniciatíva Small Business Act. Tvrdo pracujem na množstve návrhov z tohto súboru vrátane štatútu európskej verejnej obchodnej spoločnosti, väčšieho dôrazu na mikroúvery a rozvíjania možnosti nízkej sadzby DPH pre poskytovateľov služieb, ktorí slúžia súkromným osobám v rámci miestneho trhu.', 'Dôležitým problémom malých podnikov je administratívna záťaž, ktorú prinášajú prevažne národné a decentralizované vlády. V oblastiach, na ktoré majú vplyv európske právne predpisy, sme však začali aktívne konať a znižovať túto záťaž. Platí to v podstate aj pre tento dokument. Povinnosť informovať, a týka sa to oboch smerníc, ktoré majú už 25 a 30 rokov a boli mnohokrát zmenené a doplnené, sa teraz upravuje a zjednodušuje prostredníctvom takzvaného zrýchleného postupu.', 'Tieto opatrenia sú však iba malým krokom smerom k zníženiu záťaže. Treba urobiť omnoho viac. V tejto súvislosti sme výslovne vyjadrili našu netrpezlivosť vo Výbore Parlamentu pre právne veci. Z tohto dôvodu sme spolu s legislatívnym dokumentom predložili uznesenie, v ktorom naliehame na výbor, aby urýchlil začatie omnoho podrobnejšej revízie právnych predpisov týkajúcich sa malých a stredných podnikov. Ukázalo sa, že výbor sa tým už zaoberá. Zámerom je dosiahnuť väčšiu harmonizáciu, pokiaľ ide o európske pravidlá pre malé a stredné podniky.', 'Keď sme pred časom preberali túto tému a správu pána Radwana vo Výbore pre hospodárske a menové veci, osobitne sme zdôrazňovali, že to nie je Rada pre medzinárodné účtovné štandardy, ktorá sa podieľala na príprave Medzinárodných štandardov pre finančné vykazovanie (IFRS) pre malé a stredné podniky, kto by mal ukazovať cestu vpred, ale že ďalšiu harmonizáciu v rámci Európy by sme mali dosiahnuť na základe existujúcich právnych predpisov.', 'Počas tejto diskusie to bol najmä pán Lehne, tieňový spravodajca tejto správy, kto navrhoval, že členské štáty by mali mať v tomto štádiu možnosť vyčleniť mikropodniky, teda veľmi malé podniky, z týchto európskych právnych predpisov. Podľa môjho názoru to je núdzové opatrenie, ktoré napriek tomu, že ho navrhla skupina pána Stoibera, nebude viesť k základnému zjednodušeniu z dlhodobého hľadiska, pretože keďže ide o nepovinné opatrenie, spôsobí veľké rozdiely medzi jednotlivými členskými štátmi.', 'Hlavným cieľom a možnosťou by malo byť dosiahnuť rozsiahlu harmonizáciu v takom rozsahu, že aj spoločnosti, ktoré nespĺňajú kritériá na mikropodniky, by mohli využívať podobný, veľmi jednoduchý systém. Pokiaľ ide o tento jednoduchý systém, chcela by som vám pripomenúť možnosti, ktoré ponúka rozšíriteľný jazyk podnikových správ (XBRL), čo je systém umožňujúci rôznym subjektom veľmi jednoduchým spôsobom zadávať údaje a využívať ich. Výrazne by sa tým zjednodušilo poskytovanie takéhoto typu údajov spoločnosťami a tieto údaje by sa dali využiť na mnohé účely.', 'Jednoducho povedané, čoskoro musíme začať primeranú diskusiu o odpore, ktorý prevláda vo svete účtovníctva voči vyčleneniu týchto mikropodnikov. Výbor by mal prísť s návrhmi. Následne by sme mali preskúmať najlepšie riešenie pre stredné podniky, ale aj pre tieto najmenšie podniky, aby sme zabezpečili transparentnosť a dobrý účtovný systém, čo im pomôže v určitých veciach bez toho, aby boli zavalené nadmernou administratívnou záťažou. ']"
3, 2. Požiadavky na zverejnenie pre stredné podniky a povinnosť zostavovať konsolidovanú účtovnú závierku – Povinnosti týkajúce sa účtovníctva stredných podnikov (rozprava) ,"  Jacques Barrot,  podpredseda Komisie. – (FR) Vážený pán predsedajúci, pani van den Burgová, dámy a páni, Európsky parlament dnes rozhodne o návrhu na zjednodušenie. Tento návrh je prvým z troch návrhov právnych predpisov v oblasti účtovníctva. Jeho cieľom je zjednodušiť hospodárske prostredie na úrovni Spoločenstva, najmä pokiaľ ide o malé a stredné podniky.Tento prvý návrh je dobrým východiskovým bodom. Je dobrou príležitosťou pre zákonodarcov, zainteresované strany a Komisiu na výmenu stanovísk a na diskusiu o prvkoch, ktoré by mali byť súčasťou ďalších dvoch návrhov.Ako bolo ohlásené v pláne hospodárskej obnovy Európy pred niekoľkými týždňami, ďalší návrh bude zameraný na zníženie administratívnej záťaže najmenších podnikov, ktoré sú zároveň najčastejším typom podnikov v Európe.V priebehu prvého štvrťroka roku 2009 predloží Komisia návrh, ktorý umožní členským štátom vyňať tieto mikropodniky spod povinnosti vypracovávať ročné účtovné závierky. Chcel by som zdôrazniť, že návrh Komisie úspešne zníži administratívnu záťaž, len ak budú členské štáty ochotné túto novú možnosť využívať, keďže ide len o možnosť.Externí konzultanti odhadujú, že toto opatrenie by mohlo ušetriť až 5,8 miliardy EUR ročne. K takémuto šetreniu však dôjde len vtedy, ak všetky členské štáty uplatnia túto možnosť výnimky a nezavedú nové a nepotrebné reštriktívne opatrenia.Druhou iniciatívou, ktorú som ohlásil na konci septembra, bola revízia a aktualizácia štvrtej a siedmej smernice o účtovníctve. Prvé technické prípravy na túto revíziu sa už začali. Verejná konzultácia o smere, ktorým sa bude uberať, bude zverejnená v priebehu prvého štvrťroka roku 2009.Mnohých z vás poteší, že sa do čo možno najväčšej miery zohľadnia odporúčania skupiny na vysokej úrovni, ktorej predsedá pán Stoiber.Vrátim sa k tomuto návrhu, ktorý bol nedávno predmetom zrýchleného postupu – veľmi nás teší, že spolupráca medzi inštitúciami umožnila také rýchle riešenie otázky tejto iniciatívy.Dnes vás preto vyzývam, aby ste hlasovali v prospech záverov tohto postupu. Ďakujem vám za pozornosť. ","Jacques Barrot,",9,303,not_available,"['fra', 'fra', 'fra', 'fra', 'fra', 'fra', 'fra', 'fra', 'fra']","['  Jacques Barrot,  podpredseda Komisie. – (FR) Vážený pán predsedajúci, pani van den Burgová, dámy a páni, Európsky parlament dnes rozhodne o návrhu na zjednodušenie. Tento návrh je prvým z troch návrhov právnych predpisov v oblasti účtovníctva. Jeho cieľom je zjednodušiť hospodárske prostredie na úrovni Spoločenstva, najmä pokiaľ ide o malé a stredné podniky.', 'Tento prvý návrh je dobrým východiskovým bodom. Je dobrou príležitosťou pre zákonodarcov, zainteresované strany a Komisiu na výmenu stanovísk a na diskusiu o prvkoch, ktoré by mali byť súčasťou ďalších dvoch návrhov.', 'Ako bolo ohlásené v pláne hospodárskej obnovy Európy pred niekoľkými týždňami, ďalší návrh bude zameraný na zníženie administratívnej záťaže najmenších podnikov, ktoré sú zároveň najčastejším typom podnikov v Európe.', 'V priebehu prvého štvrťroka roku 2009 predloží Komisia návrh, ktorý umožní členským štátom vyňať tieto mikropodniky spod povinnosti vypracovávať ročné účtovné závierky. Chcel by som zdôrazniť, že návrh Komisie úspešne zníži administratívnu záťaž, len ak budú členské štáty ochotné túto novú možnosť využívať, keďže ide len o možnosť.', 'Externí konzultanti odhadujú, že toto opatrenie by mohlo ušetriť až 5,8 miliardy EUR ročne. K takémuto šetreniu však dôjde len vtedy, ak všetky členské štáty uplatnia túto možnosť výnimky a nezavedú nové a nepotrebné reštriktívne opatrenia.', 'Druhou iniciatívou, ktorú som ohlásil na konci septembra, bola revízia a aktualizácia štvrtej a siedmej smernice o účtovníctve. Prvé technické prípravy na túto revíziu sa už začali. Verejná konzultácia o smere, ktorým sa bude uberať, bude zverejnená v priebehu prvého štvrťroka roku 2009.', 'Mnohých z vás poteší, že sa do čo možno najväčšej miery zohľadnia odporúčania skupiny na vysokej úrovni, ktorej predsedá pán Stoiber.', 'Vrátim sa k tomuto návrhu, ktorý bol nedávno predmetom zrýchleného postupu – veľmi nás teší, že spolupráca medzi inštitúciami umožnila také rýchle riešenie otázky tejto iniciatívy.', 'Dnes vás preto vyzývam, aby ste hlasovali v prospech záverov tohto postupu. Ďakujem vám za pozornosť. ']"
4, 2. Požiadavky na zverejnenie pre stredné podniky a povinnosť zostavovať konsolidovanú účtovnú závierku – Povinnosti týkajúce sa účtovníctva stredných podnikov (rozprava) ,"  Kristian Vigenin,  spravodajca Výboru pre hospodárske a menové veci požiadaného o stanovisko. – (BG) Vážený pán komisár, podľa nášho hodnotenia nie sú návrhy spojené s touto legislatívnou iniciatívou dostatočne ambiciózne. Hospodársky výbor preto nalieha na Komisiu a na vás osobne, aby ste v tejto súvislosti prijali aktívnejšiu politiku.Chápem, že to, o čom ste hovorili, je dôležitým krokom, my však od Komisie očakávame ešte aktívnejšie opatrenia, samozrejme, s plnou podporou Európskeho parlamentu, pretože táto záležitosť je pre malé a stredné podniky mimoriadne dôležitá, najmä v súvislosti so súčasnou finančnou krízou.Ako spravodajca Výboru pre hospodárske a menové veci chcem povedať, že plne podporujeme iniciatívu Komisie znížiť množstvo byrokracie pre stredné podniky. Je to náš spoločný cieľ a podporili sme zrýchlený postup. Dnes podporíme tento návrh. Veríme, že odteraz budeme môcť plne podporiť všetky opatrenia, ktoré pripravíte na prijatie. ","Kristian Vigenin,",3,137,not_available,"['bul', 'bul', 'bul']","['  Kristian Vigenin,  spravodajca Výboru pre hospodárske a menové veci požiadaného o stanovisko. – (BG) Vážený pán komisár, podľa nášho hodnotenia nie sú návrhy spojené s touto legislatívnou iniciatívou dostatočne ambiciózne. Hospodársky výbor preto nalieha na Komisiu a na vás osobne, aby ste v tejto súvislosti prijali aktívnejšiu politiku.', 'Chápem, že to, o čom ste hovorili, je dôležitým krokom, my však od Komisie očakávame ešte aktívnejšie opatrenia, samozrejme, s plnou podporou Európskeho parlamentu, pretože táto záležitosť je pre malé a stredné podniky mimoriadne dôležitá, najmä v súvislosti so súčasnou finančnou krízou.', 'Ako spravodajca Výboru pre hospodárske a menové veci chcem povedať, že plne podporujeme iniciatívu Komisie znížiť množstvo byrokracie pre stredné podniky. Je to náš spoločný cieľ a podporili sme zrýchlený postup. Dnes podporíme tento návrh. Veríme, že odteraz budeme môcť plne podporiť všetky opatrenia, ktoré pripravíte na prijatie. ']"
5, 2. Požiadavky na zverejnenie pre stredné podniky a povinnosť zostavovať konsolidovanú účtovnú závierku – Povinnosti týkajúce sa účtovníctva stredných podnikov (rozprava) ,"  Jean-Paul Gauzès,  v mene skupiny PPE-DE. – (FR) Vážený pán predsedajúci, pán podpredseda Komisie, pán komisár, dámy a páni, naša skupina bude, samozrejme, hlasovať za správu, ktorú predložila pani van den Burgová. Blahoželám jej k práci, ktorá je, ako vieme, vždy veľmi kvalitná.Chcem však upozorniť na skutočnosť, že malé a stredné podniky nie sú nevyhnutne za zrušenie povinností týkajúcich sa účtovníctva. Dostávame v tejto súvislosti množstvo listov, ktoré nás upozorňujú, aby sme boli opatrní, že zjednodušenie je užitočné, ale môže mať aj nepriaznivé dôsledky. Vysvetlím vám, čo tým myslím. Účtovníctvo sa musí zjednodušiť, a to je zmyslom uznesenia, v ktorom sa hovorí, že Komisia nám musí čo najskôr, konkrétne do konca roka 2009, predložiť účtovný rámec vhodný pre malé a stredné podniky. To však neznamená úplnú výnimku.Prečo? Po prvé preto, lebo účtovníctvo je príležitosťou pre riaditeľov zhodnotiť aspoň raz za rok situáciu podniku. Účtovníctvo je tiež dôležitým prvkom z hľadiska požičiavania medzi podnikmi. Žiadajú oň aj banky, aby mohli poskytnúť úvery. Sú tu daňové povinnosti. Neklamme teda riaditeľov malých podnikov, že ušetria obrovské množstvo času a peňazí, keď si nebudú musieť viesť žiadne účtovníctvo. Povedie to ku katastrofe.Čo potrebujeme, je realizácia účtovného rámca vhodného pre malé podniky, pre ktoré sa musí znížiť objem nadmerných a zbytočných povinností. Pán komisár, podľa môjho názoru by najlepším zjednodušením bolo, keby sme raz a navždy prijali pravidlo, že v každom členskom štáte sa informácie budú žiadať len raz a že sa od podnikov nebude vyžadovať, aby pravidelne vypracovávali tie isté vyhlásenia, tie isté formuláre, a to len preto, aby úradom poskytli informácie, ktoré už majú.Takýmto spôsobom môžeme pomôcť riaditeľom spoločností – vytvorením účtovných pravidiel, ktoré im umožnia mať prehľad o situácii svojich podnikov, a odstránením absolútne nezmyselných administratívnych povinností. ","Jean-Paul Gauzès,",5,289,not_available,"['fra', 'fra', 'fra', 'fra', 'fra']","['  Jean-Paul Gauzès,  v mene skupiny PPE-DE. – (FR) Vážený pán predsedajúci, pán podpredseda Komisie, pán komisár, dámy a páni, naša skupina bude, samozrejme, hlasovať za správu, ktorú predložila pani van den Burgová. Blahoželám jej k práci, ktorá je, ako vieme, vždy veľmi kvalitná.', 'Chcem však upozorniť na skutočnosť, že malé a stredné podniky nie sú nevyhnutne za zrušenie povinností týkajúcich sa účtovníctva. Dostávame v tejto súvislosti množstvo listov, ktoré nás upozorňujú, aby sme boli opatrní, že zjednodušenie je užitočné, ale môže mať aj nepriaznivé dôsledky. Vysvetlím vám, čo tým myslím. Účtovníctvo sa musí zjednodušiť, a to je zmyslom uznesenia, v ktorom sa hovorí, že Komisia nám musí čo najskôr, konkrétne do konca roka 2009, predložiť účtovný rámec vhodný pre malé a stredné podniky. To však neznamená úplnú výnimku.', 'Prečo? Po prvé preto, lebo účtovníctvo je príležitosťou pre riaditeľov zhodnotiť aspoň raz za rok situáciu podniku. Účtovníctvo je tiež dôležitým prvkom z hľadiska požičiavania medzi podnikmi. Žiadajú oň aj banky, aby mohli poskytnúť úvery. Sú tu daňové povinnosti. Neklamme teda riaditeľov malých podnikov, že ušetria obrovské množstvo času a peňazí, keď si nebudú musieť viesť žiadne účtovníctvo. Povedie to ku katastrofe.', 'Čo potrebujeme, je realizácia účtovného rámca vhodného pre malé podniky, pre ktoré sa musí znížiť objem nadmerných a zbytočných povinností. Pán komisár, podľa môjho názoru by najlepším zjednodušením bolo, keby sme raz a navždy prijali pravidlo, že v každom členskom štáte sa informácie budú žiadať len raz a že sa od podnikov nebude vyžadovať, aby pravidelne vypracovávali tie isté vyhlásenia, tie isté formuláre, a to len preto, aby úradom poskytli informácie, ktoré už majú.', 'Takýmto spôsobom môžeme pomôcť riaditeľom spoločností – vytvorením účtovných pravidiel, ktoré im umožnia mať prehľad o situácii svojich podnikov, a odstránením absolútne nezmyselných administratívnych povinností. ']"
6, 2. Požiadavky na zverejnenie pre stredné podniky a povinnosť zostavovať konsolidovanú účtovnú závierku – Povinnosti týkajúce sa účtovníctva stredných podnikov (rozprava) ,"  Sharon Bowles,  v mene skupiny ALDE. – Vážený pán predsedajúci, vítam zníženie záťaže MSP v súvislosti s finančným výkazníctvom. Menšie spoločnosti nie sú len malými verziami veľkých korporácií, takže niektoré výkazy potrebné pre veľké spoločnosti sa ich vôbec netýkajú. Iné spôsobujú nadmerné odčerpávanie zdrojov, nezodpovedajú realite veľkého počtu rozličných menších spoločností, ktoré máme v Európe, a následne tak neslúžia verejnému záujmu. Zbytočné výkazy spôsobujú oveľa viac škôd ako úžitku, takže som rada, že sa niektorých zbavíme. Pokračujme v dobrej práci.Naša skupina spolu s niektorými ďalšími však nesúhlasí s časťou konečného textu správy, ktorá sa týka tabuliek zhody. Komisia chcela, aby boli tabuľky zhody pri transpozícii povinné, a to aj v prípade tejto malej smernice, a to je aj naša pozícia. Rada nebude súhlasiť, pretože tvrdí, že to je zbytočná záťaž. Moja odpoveď je, že by nemala byť. Musíme nájsť spôsob, ako transpozíciu právnych predpisov EÚ sprístupniť. V tomto ohľade je tu obrovský demokratický deficit. Zodpovedné sú členské štáty, obviňuje sa však Európa.Sú tu isté podobnosti s kritikou Lisabonskej zmluvy, pretože ako samostatný dokument je nečitateľná. Verejnosť by však mala protestovať ešte viac, pretože práve toto robia deň čo deň vlády mnohých členských štátov svojim občanom a podnikom pri transpozícii. Povedzme to na rovinu. Toto nie je problémom EÚ. Je to problémom vlád členských štátov a musí sa to skončiť. ","Sharon Bowles,",3,220,not_available,"['slo', 'slo', 'slo']","['  Sharon Bowles,  v mene skupiny ALDE. – Vážený pán predsedajúci, vítam zníženie záťaže MSP v súvislosti s finančným výkazníctvom. Menšie spoločnosti nie sú len malými verziami veľkých korporácií, takže niektoré výkazy potrebné pre veľké spoločnosti sa ich vôbec netýkajú. Iné spôsobujú nadmerné odčerpávanie zdrojov, nezodpovedajú realite veľkého počtu rozličných menších spoločností, ktoré máme v Európe, a následne tak neslúžia verejnému záujmu. Zbytočné výkazy spôsobujú oveľa viac škôd ako úžitku, takže som rada, že sa niektorých zbavíme. Pokračujme v dobrej práci.', 'Naša skupina spolu s niektorými ďalšími však nesúhlasí s časťou konečného textu správy, ktorá sa týka tabuliek zhody. Komisia chcela, aby boli tabuľky zhody pri transpozícii povinné, a to aj v prípade tejto malej smernice, a to je aj naša pozícia. Rada nebude súhlasiť, pretože tvrdí, že to je zbytočná záťaž. Moja odpoveď je, že by nemala byť. Musíme nájsť spôsob, ako transpozíciu právnych predpisov EÚ sprístupniť. V tomto ohľade je tu obrovský demokratický deficit. Zodpovedné sú členské štáty, obviňuje sa však Európa.', 'Sú tu isté podobnosti s kritikou Lisabonskej zmluvy, pretože ako samostatný dokument je nečitateľná. Verejnosť by však mala protestovať ešte viac, pretože práve toto robia deň čo deň vlády mnohých členských štátov svojim občanom a podnikom pri transpozícii. Povedzme to na rovinu. Toto nie je problémom EÚ. Je to problémom vlád členských štátov a musí sa to skončiť. ']"
