,agenda_item,text,speaker,number_p,number_w,chair,language_ps,ps
123, 9. Vysvetlenia hlasovania,"  Luís Queiró  (PPE-DE),  písomne. – (PT) Nárast cien potravín v rozvojových krajinách je mimoriadne dôležitým problémom, ktorý si vyžaduje rýchlu reakciu EÚ na zmiernenie škodlivých vplyvov na najviac postihnuté obyvateľstvo. Parlament preto v tejto správe navrhuje financovanie rýchlej reakcie na následky tejto situácie vo výške 420 miliónov EUR. Konkrétne sa plánuje mobilizácia nástroja pružnosti ustanoveného medziinštitucionálnou dohodou z roku 2006. EÚ v nej ustanovila možnosť mobilizácie nástroja pružnosti na umožnenie financovania špecificky určených výdavkov, ktoré nie je možné financovať v rámci stropu jednotlivých kapitol viacročného finančného rámca.Daná situácia spĺňa všetky inštitucionálne požiadavky a bez najmenšieho tieňa pochybnosti je jej riešenie v rámci politiky solidarity EÚ opodstatnené. V dôsledku toho subjekty s rozhodovacou právomocou vzhľadom na vážnosť situácie nevzniesli žiadne otázky.Čas tlačí a naša pohotová reakcia a urýchlené opatrenia by mohli znamenať rozdiel medzi nehodou a ľudskou tragédiou s nevyčísliteľnými dôsledkami pre budúci rozvoj tohto obyvateľstva. ","Luís Queiró  (PPE-DE),",3,147,not_available,"['por', 'por', 'por']","['  Luís Queiró  (PPE-DE),  písomne. – (PT) Nárast cien potravín v rozvojových krajinách je mimoriadne dôležitým problémom, ktorý si vyžaduje rýchlu reakciu EÚ na zmiernenie škodlivých vplyvov na najviac postihnuté obyvateľstvo. Parlament preto v tejto správe navrhuje financovanie rýchlej reakcie na následky tejto situácie vo výške 420 miliónov EUR. Konkrétne sa plánuje mobilizácia nástroja pružnosti ustanoveného medziinštitucionálnou dohodou z roku 2006. EÚ v nej ustanovila možnosť mobilizácie nástroja pružnosti na umožnenie financovania špecificky určených výdavkov, ktoré nie je možné financovať v rámci stropu jednotlivých kapitol viacročného finančného rámca.', 'Daná situácia spĺňa všetky inštitucionálne požiadavky a bez najmenšieho tieňa pochybnosti je jej riešenie v rámci politiky solidarity EÚ opodstatnené. V dôsledku toho subjekty s rozhodovacou právomocou vzhľadom na vážnosť situácie nevzniesli žiadne otázky.', 'Čas tlačí a naša pohotová reakcia a urýchlené opatrenia by mohli znamenať rozdiel medzi nehodou a ľudskou tragédiou s nevyčísliteľnými dôsledkami pre budúci rozvoj tohto obyvateľstva. ']"
124, 9. Vysvetlenia hlasovania,"  Derek Roland Clark  (IND/DEM),  písomne. – Politická strana UKIP hlasovala za túto správu, lebo nevynaložené finančné prostriedky v sume 4,9 miliardy EUR sa vrátia národným vládam. ","Derek Roland Clark  (IND/DEM),",1,27,not_available,['slo'],"['  Derek Roland Clark  (IND/DEM),  písomne. – Politická strana UKIP hlasovala za túto správu, lebo nevynaložené finančné prostriedky v sume 4,9 miliardy EUR sa vrátia národným vládam. ']"
125, 9. Vysvetlenia hlasovania,"  Pedro Guerreiro  (GUE/NGL),  písomne. – (PT) V súčasnom finančnom období (roky 2007 a 2008) bol Fond solidarity mobilizovaný deväťkrát (Nemecko: 166,9 milióna EUR, Spojené kráľovstvo: 162,3 milióna EUR, Grécko: 99 miliónov EUR, Francúzsko: 17,1 milióna EUR, Maďarsko: 15 miliónov EUR, Slovinsko: 8,2 milióna EUR, Cyprus: 7,6 milióna EUR), spolu v sume okolo 477,3 milióna EUR v porovnaní s ročným stropom 1 miliarda EUR.Ak aj nebudeme spochybňovať zjavnú potrebu tejto podpory a nebudeme sa zaoberať postupom na aktivovanie a uvoľnenie tejto podpory (ktorý trvá príliš dlho), je tu otázka týkajúca sa pôvodu zmobilizovaných prostriedkov najmä vzhľadom na súčasný návrh opravného rozpočtu.Inými slovami, zatiaľ čo naliehavá potreba poskytovať podporu v prípade prírodných katastrof je nepochybná, pôvod týchto prostriedkov by mohol byť spochybnený o to viac, ak sú „odpočítané“ z politiky súdržnosti a nie napríklad z finančných zdrojov vyčlenených na postupnú militarizáciu EÚ. Sme presvedčení, že politiku súdržnosti je potrebné zachovať.Na záver by sme podobne, ako sme to už urobili pri iných príležitostiach, chceli upozorniť na potrebu zmien vo Fonde solidarity, aby sa zrýchlili postupy na jeho mobilizáciu a zároveň sa zabezpečilo, že regionálne katastrofy budú naďalej oprávnenými výdavkami, a účinne sa reagovalo na špecifickú povahu prírodných katastrof v oblasti Stredozemia, napríklad sucha a požiarov. ","Pedro Guerreiro  (GUE/NGL),",4,211,not_available,"['por', 'por', 'por', 'por']","['  Pedro Guerreiro  (GUE/NGL),  písomne. – (PT) V súčasnom finančnom období (roky 2007 a 2008) bol Fond solidarity mobilizovaný deväťkrát (Nemecko: 166,9 milióna EUR, Spojené kráľovstvo: 162,3 milióna EUR, Grécko: 99 miliónov EUR, Francúzsko: 17,1 milióna EUR, Maďarsko: 15 miliónov EUR, Slovinsko: 8,2 milióna EUR, Cyprus: 7,6 milióna EUR), spolu v sume okolo 477,3 milióna EUR v porovnaní s ročným stropom 1 miliarda EUR.', 'Ak aj nebudeme spochybňovať zjavnú potrebu tejto podpory a nebudeme sa zaoberať postupom na aktivovanie a uvoľnenie tejto podpory (ktorý trvá príliš dlho), je tu otázka týkajúca sa pôvodu zmobilizovaných prostriedkov najmä vzhľadom na súčasný návrh opravného rozpočtu.', 'Inými slovami, zatiaľ čo naliehavá potreba poskytovať podporu v prípade prírodných katastrof je nepochybná, pôvod týchto prostriedkov by mohol byť spochybnený o to viac, ak sú „odpočítané“ z politiky súdržnosti a nie napríklad z finančných zdrojov vyčlenených na postupnú militarizáciu EÚ. Sme presvedčení, že politiku súdržnosti je potrebné zachovať.', 'Na záver by sme podobne, ako sme to už urobili pri iných príležitostiach, chceli upozorniť na potrebu zmien vo Fonde solidarity, aby sa zrýchlili postupy na jeho mobilizáciu a zároveň sa zabezpečilo, že regionálne katastrofy budú naďalej oprávnenými výdavkami, a účinne sa reagovalo na špecifickú povahu prírodných katastrof v oblasti Stredozemia, napríklad sucha a požiarov. ']"
126, 9. Vysvetlenia hlasovania,"  Hélène Goudin a Nils Lundgren  (IND/DEM),  písomne. - (SV) Júnové hnutie verí, že príspevky členských štátov na EÚ je možné znížiť o polovicu. Najväčšia časť finančných prostriedkov EÚ sa vynakladá na aktivity, ktoré sú nepotrebné alebo poškodzujú sociálno-ekonomické prostredie. Ide napríklad o poľnohospodársku politiku, Kohézny fond, politiku rybného hospodárstva a dotovanie informačných kampaní rôzneho druhu. K tomu sa pridávajú náklady na presuny Európskeho parlamentu medzi Štrasburgom a Bruselom a na inštitúcie ako Európsky hospodársky a sociálny výbor a Výbor regiónov, ktoré by bolo potrebné okamžite zrušiť.Osobitne sa dá namietať proti poľnohospodárskej politike. Peniaze idú od spotrebiteľov často veľmi bohatým príjemcom. Poľnohospodári v chudobných krajinách sveta doplácajú na konkurenciu zo strany dotovaných poľnohospodárov v EÚ.Jednotlivé inštitúcie EÚ neustále vyzývajú členské štáty na znižovanie verejných výdavkov, pretože je to veľmi dôležité. Tento Parlament zároveň neustále požaduje zvyšovanie výdavkov na úrovni EÚ. Je to celé absurdné. Členské štáty vynakladajú verejné financie na školy, zdravotnú starostlivosť, výskum, infraštruktúru a podporu slabých spoločenských skupín, zatiaľ čo väčšina výdavkov EÚ ide na šialenú poľnohospodársku politiku, zle nasmerované štrukturálne fondy a financovanie inštitúcií EÚ, ktoré mali byť už dávno zrušené.Naše „nie“ návrhu opravného rozpočtu je potrebné chápať ako žiadosť o razantné zníženie rozpočtových výdavkov EÚ a zníženie príspevkov členských štátov na EÚ o polovicu. ","Hélène Goudin a Nils Lundgren  (IND/DEM),",4,211,not_available,"['swe', 'swe', 'swe', 'swe']","['  Hélène Goudin a Nils Lundgren  (IND/DEM),  písomne. - (SV) Júnové hnutie verí, že príspevky členských štátov na EÚ je možné znížiť o polovicu. Najväčšia časť finančných prostriedkov EÚ sa vynakladá na aktivity, ktoré sú nepotrebné alebo poškodzujú sociálno-ekonomické prostredie. Ide napríklad o poľnohospodársku politiku, Kohézny fond, politiku rybného hospodárstva a dotovanie informačných kampaní rôzneho druhu. K tomu sa pridávajú náklady na presuny Európskeho parlamentu medzi Štrasburgom a Bruselom a na inštitúcie ako Európsky hospodársky a sociálny výbor a Výbor regiónov, ktoré by bolo potrebné okamžite zrušiť.', 'Osobitne sa dá namietať proti poľnohospodárskej politike. Peniaze idú od spotrebiteľov často veľmi bohatým príjemcom. Poľnohospodári v chudobných krajinách sveta doplácajú na konkurenciu zo strany dotovaných poľnohospodárov v EÚ.', 'Jednotlivé inštitúcie EÚ neustále vyzývajú členské štáty na znižovanie verejných výdavkov, pretože je to veľmi dôležité. Tento Parlament zároveň neustále požaduje zvyšovanie výdavkov na úrovni EÚ. Je to celé absurdné. Členské štáty vynakladajú verejné financie na školy, zdravotnú starostlivosť, výskum, infraštruktúru a podporu slabých spoločenských skupín, zatiaľ čo väčšina výdavkov EÚ ide na šialenú poľnohospodársku politiku, zle nasmerované štrukturálne fondy a financovanie inštitúcií EÚ, ktoré mali byť už dávno zrušené.', 'Naše „nie“ návrhu opravného rozpočtu je potrebné chápať ako žiadosť o razantné zníženie rozpočtových výdavkov EÚ a zníženie príspevkov členských štátov na EÚ o polovicu. ']"
127, 9. Vysvetlenia hlasovania,"  Kader Arif  (PSE),  písomne. – (FR) V rozpočte Spoločenstva na rok 2009 sme my, Socialistická skupina v Európskom parlamente, navrhli a dosiahli prijatie prípravnej akcie na rozvoj sociálneho cestovného ruchu v Európe.Tento projekt je reakciou na zistenie, že ekonomické dôvody mnohým občanom bránia v cestovaní a že túto nerovnosť je potrebné napraviť tým, že sa každému zaručí prístup k dovolenke. Je to však užitočné aj z hľadiska územného plánovania a miestneho rozvoja.Vďaka kombinácii sociálneho miešania a miestneho rozvoja a vďaka poskytnutiu prístupu občanom, pre ktorých je ťažké ísť na dovolenku, sociálny cestovný ruch zvyšuje ziskovosť odvetvia cestovného ruchu. Poskytuje tak príležitosti na rozvoj mimosezónneho cestovného ruchu najmä v oblastiach, kde je toto odvetvie vysoko sezónne, a podporuje vytváranie väčšieho počtu stálych pracovných miest v tomto odvetví hospodárstva. Sociálny a komunitný cestovný ruch je ukážkou toho, že medzi trhom v oblasti rekreácie a nesolventným hospodárstvom skutočne existuje prechodné odvetvie a že hospodársky význam nie je nezlučiteľný s poskytnutím prístupu čo najväčšiemu počtu ľudí. Toto odvetvie prostredníctvom výmen medzi občanmi EÚ prispieva aj k posilneniu európskeho občianstva.Je to dôkaz veľkého významu tohto odvetvia, pokiaľ ide o ekonomickú návratnosť a verejné zdroje. ","Kader Arif  (PSE),",4,191,not_available,"['fra', 'fra', 'fra', 'fra']","['  Kader Arif  (PSE),  písomne. – (FR) V rozpočte Spoločenstva na rok 2009 sme my, Socialistická skupina v Európskom parlamente, navrhli a dosiahli prijatie prípravnej akcie na rozvoj sociálneho cestovného ruchu v Európe.', 'Tento projekt je reakciou na zistenie, že ekonomické dôvody mnohým občanom bránia v cestovaní a že túto nerovnosť je potrebné napraviť tým, že sa každému zaručí prístup k dovolenke. Je to však užitočné aj z hľadiska územného plánovania a miestneho rozvoja.', 'Vďaka kombinácii sociálneho miešania a miestneho rozvoja a vďaka poskytnutiu prístupu občanom, pre ktorých je ťažké ísť na dovolenku, sociálny cestovný ruch zvyšuje ziskovosť odvetvia cestovného ruchu. Poskytuje tak príležitosti na rozvoj mimosezónneho cestovného ruchu najmä v oblastiach, kde je toto odvetvie vysoko sezónne, a podporuje vytváranie väčšieho počtu stálych pracovných miest v tomto odvetví hospodárstva. Sociálny a komunitný cestovný ruch je ukážkou toho, že medzi trhom v oblasti rekreácie a nesolventným hospodárstvom skutočne existuje prechodné odvetvie a že hospodársky význam nie je nezlučiteľný s poskytnutím prístupu čo najväčšiemu počtu ľudí. Toto odvetvie prostredníctvom výmen medzi občanmi EÚ prispieva aj k posilneniu európskeho občianstva.', 'Je to dôkaz veľkého významu tohto odvetvia, pokiaľ ide o ekonomickú návratnosť a verejné zdroje. ']"
128, 9. Vysvetlenia hlasovania,"  Pedro Guerreiro  (GUE/NGL),  písomne. – (PT) Zatiaľ čo hospodárske predpovede poukazujú na recesiu vo viacerých členských štátoch (z ktorých niektoré už sú v technickej recesii), Rada a Parlament schvaľujú rozpočet EÚ na rok 2009, ktorý je nižší ako rozpočet na rok 2008, čo sa týka platieb.Ak však porovnáme aktuálny návrh rozpočtu na rok 2009 so stropom určeným pre tento rok vo viacročnom finančnom rámci na roky 2007 – 2013 (o ktorom sme vtedy tvrdili, že nie je primeraný tomu, aby mohol zaručiť „hospodársku a sociálnu súdržnosť“ rozšírenej 27-člennej EÚ), situácia je ešte horšia a v tomto rozpočte chýba približne 8 miliárd EUR.Rozpočet EÚ na rok 2009 je najnižší, pokiaľ ide o percento (0,89 %) hrubého národného dôchodku (HND) Spoločenstva, odkedy Portugalsko vstúpilo do Európskeho hospodárskeho spoločenstva.Napriek vyjadreniu „znepokojenia“, najmä čo sa týka „možného vplyvu recesie na európskych občanov“ a „extrémne nízkej“ úrovne platieb a plnenia rozpočtových prostriedkov v kohéznej politike, Parlament tento rozpočet podporuje. Nechcem síce spochybňovať základné otázky, ale koreňom toho všetkého je pokus zlepšiť si obraz medzi pracovníkmi a obyvateľmi jednotlivých krajín v nádeji, že v nadchádzajúcich voľbách do Európskeho parlamentu v júni budúceho roka pôjde všetko podľa plánu.Z tohto dôvodu sme hlasovali proti. ","Pedro Guerreiro  (GUE/NGL),",5,200,not_available,"['por', 'por', 'por', 'por', 'por']","['  Pedro Guerreiro  (GUE/NGL),  písomne. – (PT) Zatiaľ čo hospodárske predpovede poukazujú na recesiu vo viacerých členských štátoch (z ktorých niektoré už sú v technickej recesii), Rada a Parlament schvaľujú rozpočet EÚ na rok 2009, ktorý je nižší ako rozpočet na rok 2008, čo sa týka platieb.', 'Ak však porovnáme aktuálny návrh rozpočtu na rok 2009 so stropom určeným pre tento rok vo viacročnom finančnom rámci na roky 2007 – 2013 (o ktorom sme vtedy tvrdili, že nie je primeraný tomu, aby mohol zaručiť „hospodársku a sociálnu súdržnosť“ rozšírenej 27-člennej EÚ), situácia je ešte horšia a v tomto rozpočte chýba približne 8 miliárd EUR.', 'Rozpočet EÚ na rok 2009 je najnižší, pokiaľ ide o percento (0,89 %) hrubého národného dôchodku (HND) Spoločenstva, odkedy Portugalsko vstúpilo do Európskeho hospodárskeho spoločenstva.', 'Napriek vyjadreniu „znepokojenia“, najmä čo sa týka „možného vplyvu recesie na európskych občanov“ a „extrémne nízkej“ úrovne platieb a plnenia rozpočtových prostriedkov v kohéznej politike, Parlament tento rozpočet podporuje. Nechcem síce spochybňovať základné otázky, ale koreňom toho všetkého je pokus zlepšiť si obraz medzi pracovníkmi a obyvateľmi jednotlivých krajín v nádeji, že v nadchádzajúcich voľbách do Európskeho parlamentu v júni budúceho roka pôjde všetko podľa plánu.', 'Z tohto dôvodu sme hlasovali proti. ']"
129, 9. Vysvetlenia hlasovania,"  Czesław Adam Siekierski  (PPE-DE),  písomne. – (PL) Rozpočet na rok 2009 nespĺňa všetky naše očakávania a len čiastočne sa venuje novým úlohám a aktuálnym obavám. Odráža v minulosti prijaté ciele a predpoklady a v tomto zmysle spĺňa nevyhnutné kritériá. Hlasoval som za jeho prijatie. Chcel by som vás však upozorniť na nasledujúce body:1. Je pozitívne, že zvyšujeme financovanie podpory rozvoja poľnohospodárstva v rozvojových krajinách, ktoré trpia nedostatkom potravín. Nemali by sme však zabúdať na to, že v Európskej únii je takmer 80 miliónov osôb ohrozených chudobou a 43 miliónom občanov hrozí podvýživa.2. Príjmy rodín poľnohospodárov sú napriek spoločnej poľnohospodárskej politike (SPP) podstatne nižšie než príjmy rodín, ktoré si na živobytie zarábajú iným spôsobom.3. V Európe sme svedkami systematického úpadku a bankrotu poľnohospodárskych prevádzok. Zásoby poľnohospodárskych výrobkov sa znižujú, čo ohrozuje potravinovú bezpečnosť. Zároveň sa ozývajú hlasy požadujúce zníženie výdavkov na SPP.4. V kohéznej politike i štrukturálnej politike sa spomína územná, hospodárska a sociálna súdržnosť, ako aj vyrovnávanie miery rozvinutosti a vytváranie rovnakých príležitostí na rozvoj predovšetkým v chudobnejších regiónoch. V skutočnosti sa oblasti, v ktorých sú zložité podmienky na poľnohospodárstvo a kde stav infraštruktúr nie je zďaleka uspokojivý, začínajú vyľudňovať. ","Czesław Adam Siekierski  (PPE-DE),",5,194,not_available,"['pol', 'pol', 'pol', 'pol', 'pol']","['  Czesław Adam Siekierski  (PPE-DE),  písomne. – (PL) Rozpočet na rok 2009 nespĺňa všetky naše očakávania a len čiastočne sa venuje novým úlohám a aktuálnym obavám. Odráža v minulosti prijaté ciele a predpoklady a v tomto zmysle spĺňa nevyhnutné kritériá. Hlasoval som za jeho prijatie. Chcel by som vás však upozorniť na nasledujúce body:', '1. Je pozitívne, že zvyšujeme financovanie podpory rozvoja poľnohospodárstva v rozvojových krajinách, ktoré trpia nedostatkom potravín. Nemali by sme však zabúdať na to, že v Európskej únii je takmer 80 miliónov osôb ohrozených chudobou a 43 miliónom občanov hrozí podvýživa.', '2. Príjmy rodín poľnohospodárov sú napriek spoločnej poľnohospodárskej politike (SPP) podstatne nižšie než príjmy rodín, ktoré si na živobytie zarábajú iným spôsobom.', '3. V Európe sme svedkami systematického úpadku a bankrotu poľnohospodárskych prevádzok. Zásoby poľnohospodárskych výrobkov sa znižujú, čo ohrozuje potravinovú bezpečnosť. Zároveň sa ozývajú hlasy požadujúce zníženie výdavkov na SPP.', '4. V kohéznej politike i štrukturálnej politike sa spomína územná, hospodárska a sociálna súdržnosť, ako aj vyrovnávanie miery rozvinutosti a vytváranie rovnakých príležitostí na rozvoj predovšetkým v chudobnejších regiónoch. V skutočnosti sa oblasti, v ktorých sú zložité podmienky na poľnohospodárstvo a kde stav infraštruktúr nie je zďaleka uspokojivý, začínajú vyľudňovať. ']"
130, 9. Vysvetlenia hlasovania,"  Andrzej Jan Szejna  (PSE),  písomne. – (PL) Podporil som prijatie správy o návrhu rozpočtu EÚ na rok 2009, ktorú vypracovali pani Jutta Haugová a pán Janusz Lewandowski. Je dôležité, aby poslanci EP napokon dokázali dospieť ku kompromisu s Radou, pokiaľ ide o financovanie prioritných cieľov Parlamentu, napríklad boja proti dôsledkom hospodárskej recesie a opatrení na podporu hospodárskeho rastu, súdržnosti a zamestnanosti.Parlament zvýši finančné prostriedky vyčlenené na sociálnu politiku a politiku zamestnanosti, najmä na aktivity na podporu hospodárskej súťaže a súdržnosti. Tieto výdavky budú pokryté zo Sociálneho fondu, ktorý získa ďalších 135 miliónov EUR, ako aj z Fondu regionálneho rozvoja a Kohézneho fondu. V momentálnej zložitej situácii v celej Európskej únii sú iniciatívy na podporu rozvoja a zamestnanosti nesmierne dôležité a v rozpočte na rok 2009 sa to musí odraziť. Je chvályhodné, že v rozpočte sa majú vyčleniť aj dodatočné prostriedky na poskytovanie podpory malým a stredným podnikom.Rozvojové krajiny budú môcť rátať s finančnou pomocou na zmiernenie vplyvu náhleho nárastu cien potravín a ďalšia 1 miliarda EUR bude vyčlenená aj na financovanie úsilia zabrániť hladomoru v rozvojových krajinách. Vítam aj skutočnosť, že Parlament má v úmysle obmedziť svoje administratívne náklady a stanoviť pre túto sumu hornú hranicu vo výške 20 % celkových výdavkov. ","Andrzej Jan Szejna  (PSE),",3,202,not_available,"['pol', 'pol', 'pol']","['  Andrzej Jan Szejna  (PSE),  písomne. – (PL) Podporil som prijatie správy o návrhu rozpočtu EÚ na rok 2009, ktorú vypracovali pani Jutta Haugová a pán Janusz Lewandowski. Je dôležité, aby poslanci EP napokon dokázali dospieť ku kompromisu s Radou, pokiaľ ide o financovanie prioritných cieľov Parlamentu, napríklad boja proti dôsledkom hospodárskej recesie a opatrení na podporu hospodárskeho rastu, súdržnosti a zamestnanosti.', 'Parlament zvýši finančné prostriedky vyčlenené na sociálnu politiku a politiku zamestnanosti, najmä na aktivity na podporu hospodárskej súťaže a súdržnosti. Tieto výdavky budú pokryté zo Sociálneho fondu, ktorý získa ďalších 135 miliónov EUR, ako aj z Fondu regionálneho rozvoja a Kohézneho fondu. V momentálnej zložitej situácii v celej Európskej únii sú iniciatívy na podporu rozvoja a zamestnanosti nesmierne dôležité a v rozpočte na rok 2009 sa to musí odraziť. Je chvályhodné, že v rozpočte sa majú vyčleniť aj dodatočné prostriedky na poskytovanie podpory malým a stredným podnikom.', 'Rozvojové krajiny budú môcť rátať s finančnou pomocou na zmiernenie vplyvu náhleho nárastu cien potravín a ďalšia 1 miliarda EUR bude vyčlenená aj na financovanie úsilia zabrániť hladomoru v rozvojových krajinách. Vítam aj skutočnosť, že Parlament má v úmysle obmedziť svoje administratívne náklady a stanoviť pre túto sumu hornú hranicu vo výške 20 % celkových výdavkov. ']"
131, 9. Vysvetlenia hlasovania,"  Alessandro Battilocchio  (PSE),  písomne. – (IT) Vážená pani predsedajúca, dámy a páni, hlasoval som za správu o Európskom akčnom pláne pracovnej mobility (2007 – 2010), ktorú predložila pani Iacobová-Ridziová.Ak chceme vytvoriť skutočný európsky trh práce, musíme tomu prispôsobiť vnútroštátne právne predpisy a zjednodušiť byrokratické postupy, ktoré niekedy pracovníkov odrádzajú od mobility. Únia zohráva základnú úlohu, čo sa týka harmonizácie vnútroštátnych systémov sociálneho zabezpečenia a prenosnosti nárokov z doplnkového dôchodkového poistenia. Okrem toho je dôležité, aby sa vyvíjalo úsilie na zvýšenie miery informovanosti občanov nielen vďaka zdokonaleniu portálu EURES, ale aj prostredníctvom európskych informačných kampaní. ","Alessandro Battilocchio  (PSE),",2,94,not_available,"['ita', 'ita']","['  Alessandro Battilocchio  (PSE),  písomne. – (IT) Vážená pani predsedajúca, dámy a páni, hlasoval som za správu o Európskom akčnom pláne pracovnej mobility (2007 – 2010), ktorú predložila pani Iacobová-Ridziová.', 'Ak chceme vytvoriť skutočný európsky trh práce, musíme tomu prispôsobiť vnútroštátne právne predpisy a zjednodušiť byrokratické postupy, ktoré niekedy pracovníkov odrádzajú od mobility. Únia zohráva základnú úlohu, čo sa týka harmonizácie vnútroštátnych systémov sociálneho zabezpečenia a prenosnosti nárokov z doplnkového dôchodkového poistenia. Okrem toho je dôležité, aby sa vyvíjalo úsilie na zvýšenie miery informovanosti občanov nielen vďaka zdokonaleniu portálu EURES, ale aj prostredníctvom európskych informačných kampaní. ']"
