,agenda_item,text,speaker,number_p,number_w,chair,language_ps,ps
183, 9. Vysvetlenia hlasovania,"  Alessandro Battilocchio  (PSE),  písomne. – (IT) Ďakujem, pani predsedajúca. Hlasoval som za správu pána Devu o perspektívach rozvoja pri nastoľovaní mieru a budovaní národa v situáciách po ukončení konfliktov, ktorá upozorňuje na zodpovednosť medzinárodného spoločenstva voči štátom a miestnym skupinám zaangažovaným v konfliktoch. Teší ma, že pozmeňujúce a doplňujúce návrhy predložené Socialistickou skupinou v Európskom parlamente viedli k výraznému vylepšeniu návrhu, čo sa týka potreby zvýšenia koordinácie medzi činnosťou pri nastoľovaní mieru, humanitárnou pomocou a rozvojom v krajinách po ukončení konfliktov. Rád by som upozornil na situáciu detí v konfliktných oblastiach, predovšetkým tých, ktoré stratili jedného alebo oboch rodičov. V období konfliktov sú navyše nemocnice a školy veľmi často vystavené vojenským útokom. Musíme sa usilovať zabezpečiť, aby deti dokázali prekonať postkonfliktné traumy, a to spoluprácou s fondom UNICEF, ktorý je už prítomný v mnohých rizikových oblastiach na celom svete. Zabezpečíme tak týmto deťom uspokojivé vzdelanie a lepšiu budúcnosť. ","Alessandro Battilocchio  (PSE),",1,147,not_available,['ita'],"['  Alessandro Battilocchio  (PSE),  písomne. – (IT) Ďakujem, pani predsedajúca. Hlasoval som za správu pána Devu o perspektívach rozvoja pri nastoľovaní mieru a budovaní národa v situáciách po ukončení konfliktov, ktorá upozorňuje na zodpovednosť medzinárodného spoločenstva voči štátom a miestnym skupinám zaangažovaným v konfliktoch. Teší ma, že pozmeňujúce a doplňujúce návrhy predložené Socialistickou skupinou v Európskom parlamente viedli k výraznému vylepšeniu návrhu, čo sa týka potreby zvýšenia koordinácie medzi činnosťou pri nastoľovaní mieru, humanitárnou pomocou a rozvojom v krajinách po ukončení konfliktov. Rád by som upozornil na situáciu detí v konfliktných oblastiach, predovšetkým tých, ktoré stratili jedného alebo oboch rodičov. V období konfliktov sú navyše nemocnice a školy veľmi často vystavené vojenským útokom. Musíme sa usilovať zabezpečiť, aby deti dokázali prekonať postkonfliktné traumy, a to spoluprácou s fondom UNICEF, ktorý je už prítomný v mnohých rizikových oblastiach na celom svete. Zabezpečíme tak týmto deťom uspokojivé vzdelanie a lepšiu budúcnosť. ']"
184, 9. Vysvetlenia hlasovania,"  Hélène Goudin a Nils Lundgren  (IND/DEM),  písomne. – (SV) Strana Júnový zoznam si myslí, že nastoľovanie mieru a budovanie národa nie sú záležitosti pre EÚ. Zodpovednosť za ne nesie OSN.V žiadnom prípade nesúhlasíme s vyjadreniami správy, ktoré odporúčajú pokračovať v budovaní vojenských kapacít EÚ, a preto sme hlasovali proti správe. ","Hélène Goudin a Nils Lundgren  (IND/DEM),",2,51,not_available,"['swe', 'swe']","['  Hélène Goudin a Nils Lundgren  (IND/DEM),  písomne. – (SV) Strana Júnový zoznam si myslí, že nastoľovanie mieru a budovanie národa nie sú záležitosti pre EÚ. Zodpovednosť za ne nesie OSN.', 'V žiadnom prípade nesúhlasíme s vyjadreniami správy, ktoré odporúčajú pokračovať v budovaní vojenských kapacít EÚ, a preto sme hlasovali proti správe. ']"
185, 9. Vysvetlenia hlasovania,"  Pedro Guerreiro  (GUE/NGL),  písomne. – (PT) Keďže je nemožné vyjadriť sa k (zámerne vytvorenej) miešanine, z ktorej táto správa pozostáva, sústredíme sa na to, čo považujeme za hlavné ciele správy: bagatelizovať zásahy hlavných mocností EÚ v tretích krajinách pod zámienkou koncepcie „zodpovednosť za ochranu“.Správa zdôrazňuje suverenitu štátov a zároveň uvádza, že „ak vlády nie sú schopné alebo nemajú vôľu poskytnúť takúto ochranu, stáva sa zodpovednosť za vhodné konanie spoločnou zodpovednosťou širšieho medzinárodného spoločenstva“. Potom uvádza, že takéto konanie „by malo byť preventívne a reaktívne a malo by využívať donucovaciu vojenskú silu iba ako úplne poslednú možnosť“. Jazyk správy tomu však vôbec nenasvedčuje.V tejto súvislosti však nemožno mať pochybnosti, lebo správa „žiada“ vykonávanie vyhlásenia, že „zásada nezasahovania musí ustúpiť pred medzinárodnou zodpovednosťou za ochranu“ a je presvedčená, že „existujú dve fázy nastoľovania mieru a budovania národa: fáza stabilizácie, počas ktorej sa kladie dôraz na bezpečnosť, právo a poriadok a poskytovanie základných služieb, a druhá fáza budovania štátu, ktorá sa zameriava na správu vecí verejných a inštitúcie, ktoré ju zabezpečujú”.Preto táto správa predstavuje základ pre zasahovanie a kolonializmus. ","Pedro Guerreiro  (GUE/NGL),",4,179,not_available,"['por', 'por', 'por', 'por']","['  Pedro Guerreiro  (GUE/NGL),  písomne. – (PT) Keďže je nemožné vyjadriť sa k (zámerne vytvorenej) miešanine, z ktorej táto správa pozostáva, sústredíme sa na to, čo považujeme za hlavné ciele správy: bagatelizovať zásahy hlavných mocností EÚ v tretích krajinách pod zámienkou koncepcie „zodpovednosť za ochranu“.', 'Správa zdôrazňuje suverenitu štátov a zároveň uvádza, že „ak vlády nie sú schopné alebo nemajú vôľu poskytnúť takúto ochranu, stáva sa zodpovednosť za vhodné konanie spoločnou zodpovednosťou širšieho medzinárodného spoločenstva“. Potom uvádza, že takéto konanie „by malo byť preventívne a reaktívne a malo by využívať donucovaciu vojenskú silu iba ako úplne poslednú možnosť“. Jazyk správy tomu však vôbec nenasvedčuje.', 'V tejto súvislosti však nemožno mať pochybnosti, lebo správa „žiada“ vykonávanie vyhlásenia, že „zásada nezasahovania musí ustúpiť pred medzinárodnou zodpovednosťou za ochranu“ a je presvedčená, že „existujú dve fázy nastoľovania mieru a budovania národa: fáza stabilizácie, počas ktorej sa kladie dôraz na bezpečnosť, právo a poriadok a poskytovanie základných služieb, a druhá fáza budovania štátu, ktorá sa zameriava na správu vecí verejných a inštitúcie, ktoré ju zabezpečujú”.', 'Preto táto správa predstavuje základ pre zasahovanie a kolonializmus. ']"
186, 9. Vysvetlenia hlasovania,"  Eija-Riitta Korhola  (PPE-DE),  písomne. – (FI) Hlasovala som za správu pána Devu o perspektívach rozvoja pri nastoľovaní mieru a budovaní národa v situáciách po ukončení konfliktov, pretože sa komplexným spôsobom venuje veciam dôležitým pre úspešnú rekonštrukciu. Táto téma je dôležitá, pretože v polovici krajín, v ktorých sa odohrali konflikty, sa v priebehu piatich rokov konflikty obnovujú. Okrem samotnej krajiny, ktorá sa nachádza v chúlostivej situácii, je medzinárodné spoločenstvo významným protagonistom rozvoja budovania národa. Myslím, že je mimoriadne dôležité viesť konzultácie s miestnymi ženskými organizáciami a medzinárodnými sieťami za mier a podporovať ich a trvať na právach a príležitostiach obetí sexuálneho násilia, ktoré by im zabezpečili prístup k spravodlivosti. Musíme mať na pamäti aj to, že mier nie je iba stav bez vojny. Každá úspešná politika obnovy musí vyriešiť príčiny nestability takými sociálno-ekonomickými, politickými a kultúrnymi opatreniami, ktoré urýchlia hospodársky rozvoj a vytvoria inštitučné a správne kapacity. ","Eija-Riitta Korhola  (PPE-DE),",1,148,not_available,['fin'],"['  Eija-Riitta Korhola  (PPE-DE),  písomne. – (FI) Hlasovala som za správu pána Devu o perspektívach rozvoja pri nastoľovaní mieru a budovaní národa v situáciách po ukončení konfliktov, pretože sa komplexným spôsobom venuje veciam dôležitým pre úspešnú rekonštrukciu. Táto téma je dôležitá, pretože v polovici krajín, v ktorých sa odohrali konflikty, sa v priebehu piatich rokov konflikty obnovujú. Okrem samotnej krajiny, ktorá sa nachádza v chúlostivej situácii, je medzinárodné spoločenstvo významným protagonistom rozvoja budovania národa. Myslím, že je mimoriadne dôležité viesť konzultácie s miestnymi ženskými organizáciami a medzinárodnými sieťami za mier a podporovať ich a trvať na právach a príležitostiach obetí sexuálneho násilia, ktoré by im zabezpečili prístup k spravodlivosti. Musíme mať na pamäti aj to, že mier nie je iba stav bez vojny. Každá úspešná politika obnovy musí vyriešiť príčiny nestability takými sociálno-ekonomickými, politickými a kultúrnymi opatreniami, ktoré urýchlia hospodársky rozvoj a vytvoria inštitučné a správne kapacity. ']"
187, 9. Vysvetlenia hlasovania,"  Luca Romagnoli  (NI),  písomne. – (IT) Vážená pani predsedajúca, dámy a páni, hlasoval som za správu pána Devu o perspektívach rozvoja pri nastoľovaní mieru a budovaní národa v situáciách po ukončení konfliktov. Pán Deva načrtol vynikajúci smer ideálneho prechodu od situácie po ukončení konfliktu k normálnemu spoločenskému a hospodárskemu životu.Myslím, že pri riešení príliš početných a násilných vnútorných konfliktov by sa na to malo prihliadať, najmä vo vzťahu k úlohe Európskej únie a medzinárodného spoločenstva. Súhlasím s pánom Devom v tom, že načrtnúť riešenie konfliktu je ľahké, ale jeho presadenie v praxi ťažšie. Nič to však nemení na skutočnosti, že aspoň pokiaľ ide o Európsku úniu, naše konanie by sa malo sústrediť na serióznu podporu krajín, ktoré sa nachádzajú v ťažkostiach, a nemalo by obsahovať pokrytecké ani prospechárske postoje. ","Luca Romagnoli  (NI),",2,129,not_available,"['ita', 'ita']","['  Luca Romagnoli  (NI),  písomne. – (IT) Vážená pani predsedajúca, dámy a páni, hlasoval som za správu pána Devu o perspektívach rozvoja pri nastoľovaní mieru a budovaní národa v situáciách po ukončení konfliktov. Pán Deva načrtol vynikajúci smer ideálneho prechodu od situácie po ukončení konfliktu k normálnemu spoločenskému a hospodárskemu životu.', 'Myslím, že pri riešení príliš početných a násilných vnútorných konfliktov by sa na to malo prihliadať, najmä vo vzťahu k úlohe Európskej únie a medzinárodného spoločenstva. Súhlasím s pánom Devom v tom, že načrtnúť riešenie konfliktu je ľahké, ale jeho presadenie v praxi ťažšie. Nič to však nemení na skutočnosti, že aspoň pokiaľ ide o Európsku úniu, naše konanie by sa malo sústrediť na serióznu podporu krajín, ktoré sa nachádzajú v ťažkostiach, a nemalo by obsahovať pokrytecké ani prospechárske postoje. ']"
188, 11. Predložené dokumenty: pozri zápisnicu,(Rokovanie bolo prerušené o 13.05 hod. a pokračovalo o 15.05 hod.) ,unknown,1,13,not_available,['slo'],['(Rokovanie bolo prerušené o 13.05 hod. a pokračovalo o 15.05 hod.) ']
189, 11. Predložené dokumenty: pozri zápisnicu,PREDSEDÁ: PANI KRATSA-TSAGAROPOULOU podpredsedníčka,PREDSEDÁ: PANI KRATSA-TSAGAROPOULOU,1,5,not_available,['slo'],['PREDSEDÁ: PANI KRATSA-TSAGAROPOULOU podpredsedníčka']
190, 13.1. Zimbabwe,  Predsedajúca.   – Ďalším bodom programu je rozprava o šiestich návrhoch uznesení o Zimbabwe.(1),Predsedajúca.,1,13,not_available,['slo'],['  Predsedajúca.   – Ďalším bodom programu je rozprava o šiestich návrhoch uznesení o Zimbabwe.(1)']
191, 13.1. Zimbabwe,"  Marios Matsakis,  autor. – Vážená pani predsedajúca, politická, hospodárska a humanitárna situácia v Zimbabwe sa neustále zhoršuje, pričom hrozí aj celoplošné vypuknutie cholery a iných možných epidemických chorôb, ktoré ešte zhoršia už aj tak hroznú situáciu, v ktorej sa obyvatelia krajiny nachádzajú.Už je absolútne jasné, že pánovi Mugabemu pramálo záleží na blahu svojich krajanov. Oveľa viac mu záleží na vlastnom živote plnom osobného luxusu a extravagancie. Pán Mugabe dokázal, že je absolútne nevhodný na riadenie krajiny v modernom svete, a nemožno o tom pochybovať. Svoju politickú existenciu ospravedlňuje zámienkou boja proti duchom dávno minulej britskej koloniálnej éry.Neexistuje spôsob, akým by Európa mohla presvedčiť pána Mugabeho, aby zaujal racionálny postoj. Iba úplná zmena postoja Africkej únie by ho mohla donútiť odstúpiť. Je hanba, že táto organizácia ešte nezasiahla oveľa rozhodnejším a ráznejším spôsobom. Myslím, že musíme naše snahy upriamiť na Africkú úniu a na vlády jej členských štátov. Musíme im dať úplne jasne najavo, že ich v plnej miere považujeme za zodpovedné za úbohý stav, v ktorom sa Zimbabwe nachádza, a že od nich aj v tejto neskorej fáze očakávame vhodné rázne konanie, ktoré by prinútilo režim pána Mugabeho, aby odstúpil a išiel domov alebo aby čelil vážnym dôsledkom, ktoré budú zahŕňať aj súdny proces za zločiny proti ľudskosti. ","Marios Matsakis,",3,209,not_available,"['slo', 'slo', 'slo']","['  Marios Matsakis,  autor. – Vážená pani predsedajúca, politická, hospodárska a humanitárna situácia v Zimbabwe sa neustále zhoršuje, pričom hrozí aj celoplošné vypuknutie cholery a iných možných epidemických chorôb, ktoré ešte zhoršia už aj tak hroznú situáciu, v ktorej sa obyvatelia krajiny nachádzajú.', 'Už je absolútne jasné, že pánovi Mugabemu pramálo záleží na blahu svojich krajanov. Oveľa viac mu záleží na vlastnom živote plnom osobného luxusu a extravagancie. Pán Mugabe dokázal, že je absolútne nevhodný na riadenie krajiny v modernom svete, a nemožno o tom pochybovať. Svoju politickú existenciu ospravedlňuje zámienkou boja proti duchom dávno minulej britskej koloniálnej éry.', 'Neexistuje spôsob, akým by Európa mohla presvedčiť pána Mugabeho, aby zaujal racionálny postoj. Iba úplná zmena postoja Africkej únie by ho mohla donútiť odstúpiť. Je hanba, že táto organizácia ešte nezasiahla oveľa rozhodnejším a ráznejším spôsobom. Myslím, že musíme naše snahy upriamiť na Africkú úniu a na vlády jej členských štátov. Musíme im dať úplne jasne najavo, že ich v plnej miere považujeme za zodpovedné za úbohý stav, v ktorom sa Zimbabwe nachádza, a že od nich aj v tejto neskorej fáze očakávame vhodné rázne konanie, ktoré by prinútilo režim pána Mugabeho, aby odstúpil a išiel domov alebo aby čelil vážnym dôsledkom, ktoré budú zahŕňať aj súdny proces za zločiny proti ľudskosti. ']"
192, 13.1. Zimbabwe,"  Catherine Stihler,  autorka. – Vážená pani predsedajúca, ak by naši kolegovia mali chvíľku premýšľať o svojej najhoršej nočnej more, ani náhodou by sa nepriblížili k tomu, čo zažívajú obyvatelia Zimbabwe. Kedysi prosperujúcu krajinu obrátil jej prezident naruby. Krajina kolabuje – chýba správa vecí verejných, pracovné miesta, v krajine panuje hyperinflácia, nedostatok potravín a zdravotných služieb. Kolaps systému sanitácie má za následok vypuknutie cholery.Zimbabwiansky prezident Robert Mugabe pred týždňom povedal, že vypuknutie cholery bolo zastavené. Vyhlásil, že západné mocnosti chcú využiť epidémiu ako zámienku na inváziu do Zimbabwe a zvrhnutie prezidenta. Juhoafrická republika však vyhlásila väčšinu svojej severnej hranice so Zimbabwe za oblasť katastrofy, keďže utečenci rozširujú chorobu, a organizácia Oxfam varovala, že situácia v Zimbabwe by sa mohla ešte veľmi zhoršiť.Podľa dnešných údajov zomrelo 1 111 osôb a choroba sa rozširuje. Zaznamenaných je 20 581 prípadov cholery. Cholera je vysoko infekčná choroba vyvolaná baktériou, ktorá spôsobuje črevnú infekciu. Medzi príznaky cholery patria hnačka a dehydratácia. Najvážnejšia forma cholery, ktorej prejavom je náhla akútna vodnatá hnačka, môže mať za následok smrť v dôsledku vážnej dehydratácie a zlyhania obličiek. Dospelé osoby jej môžu podľahnúť v priebehu niekoľkých hodín.Na vykreslenie vplyvu choroby na obyvateľstvo uvediem jeden príklad. Chcem Parlamentu porozprávať príbeh Munasheho, syna Cynthie Hundeovej. Munashe zomrel na choleru krátko pred svojimi prvými narodeninami. Keďže v Zimbabwe nie sú pracovné príležitosti, odišla Cynthia za prácou do Juhoafrickej republiky, aby poskytla svojmu synovi lepšiu budúcnosť, a Munasheho nechala v opatere svojej mamy. Keď sa do domu svojej mamy vrátila, našla Munasheho umierať v náručí starej mamy. V rozhovore s BBC povedala: „Je to strašné… Nedá sa to opísať. Keď máte syna, niečo si pre neho vysnívate. Očakávala som, že ho pri príchode domov nájdem behať okolo domu, ale nestalo sa.“Prosím vás, vážení kolegovia, podporte toto uznesenie odsudzujúce Zimbabwe a pomôžte nevinným obetiam, ako bol Munashe. ","Catherine Stihler,",5,303,not_available,"['slo', 'slo', 'slo', 'slo', 'slo']","['  Catherine Stihler,  autorka. – Vážená pani predsedajúca, ak by naši kolegovia mali chvíľku premýšľať o svojej najhoršej nočnej more, ani náhodou by sa nepriblížili k tomu, čo zažívajú obyvatelia Zimbabwe. Kedysi prosperujúcu krajinu obrátil jej prezident naruby. Krajina kolabuje – chýba správa vecí verejných, pracovné miesta, v krajine panuje hyperinflácia, nedostatok potravín a zdravotných služieb. Kolaps systému sanitácie má za následok vypuknutie cholery.', 'Zimbabwiansky prezident Robert Mugabe pred týždňom povedal, že vypuknutie cholery bolo zastavené. Vyhlásil, že západné mocnosti chcú využiť epidémiu ako zámienku na inváziu do Zimbabwe a zvrhnutie prezidenta. Juhoafrická republika však vyhlásila väčšinu svojej severnej hranice so Zimbabwe za oblasť katastrofy, keďže utečenci rozširujú chorobu, a organizácia Oxfam varovala, že situácia v Zimbabwe by sa mohla ešte veľmi zhoršiť.', 'Podľa dnešných údajov zomrelo 1 111 osôb a choroba sa rozširuje. Zaznamenaných je 20 581 prípadov cholery. Cholera je vysoko infekčná choroba vyvolaná baktériou, ktorá spôsobuje črevnú infekciu. Medzi príznaky cholery patria hnačka a dehydratácia. Najvážnejšia forma cholery, ktorej prejavom je náhla akútna vodnatá hnačka, môže mať za následok smrť v dôsledku vážnej dehydratácie a zlyhania obličiek. Dospelé osoby jej môžu podľahnúť v priebehu niekoľkých hodín.', 'Na vykreslenie vplyvu choroby na obyvateľstvo uvediem jeden príklad. Chcem Parlamentu porozprávať príbeh Munasheho, syna Cynthie Hundeovej. Munashe zomrel na choleru krátko pred svojimi prvými narodeninami. Keďže v Zimbabwe nie sú pracovné príležitosti, odišla Cynthia za prácou do Juhoafrickej republiky, aby poskytla svojmu synovi lepšiu budúcnosť, a Munasheho nechala v opatere svojej mamy. Keď sa do domu svojej mamy vrátila, našla Munasheho umierať v náručí starej mamy. V rozhovore s BBC povedala: „Je to strašné… Nedá sa to opísať. Keď máte syna, niečo si pre neho vysnívate. Očakávala som, že ho pri príchode domov nájdem behať okolo domu, ale nestalo sa.“', 'Prosím vás, vážení kolegovia, podporte toto uznesenie odsudzujúce Zimbabwe a pomôžte nevinným obetiam, ako bol Munashe. ']"
193, 13.1. Zimbabwe,"  Erik Meijer,  autor. – (NL) Vážená pani predsedajúca, počas predchádzajúcich naliehavých rozpráv na tému Zimbabwe, ktoré sa konali 7. júla 2005 a 24. apríla 2008, som naznačil, ako je možné, že sa pán Mugabe tak dlho udržal pri moci.Obyvatelia Zimbabwe si pamätajú minulosť krajiny plnú násilia. Pre mnohých je prezident Mugabe naďalej hrdinom boja za slobodu. Podľa tohto spôsobu myslenia by sa všetko, čo robí, malo a priori považovať za dobré. Každý, kto mu protirečí, slúži rovnako ako vtedy záujmom iných krajín a v krajine iba privilegovanej väčšine bielych obyvateľov. Ak by pán Mugabe stratil moc, krajina by sa opäť stala kolóniou a väčšina obyvateľov by bola diskriminovaná. Skutočnosť je však iná.Náhly radikalizmus prezidenta Mugabeho spred niekoľkých rokov, keď sa mu vôbec nedarilo zreorganizovať vlastníctvo poľnohospodárskej pôdy a keď dovolil pretrvávanie priepasti medzi bohatými a chudobnými, mu mal najmä zabezpečiť nových prívržencov z mladej generácie a neznepriateliť ešte viac starých druhov.Týmto prístupom síce možno získal viac fanatických a násilných spojencov, ale určite nie podporu väčšiny svojich krajanov. Európa a Amerika roky nesprávne hodnotili situáciu v Zimbabwe, a tým na seba pritiahli podozrenia zo skrytých motívov. Práve tieto nepriateľské postoje umožnili Robertovi Mugabemu zostať pri moci.Teraz, keď si už každý uvedomuje, aká neúčinná a katastrofálna je jeho politika, rastie odpor. Bez zabíjania a zastrašovania by nebol vyhral prezidentské voľby a tesná parlamentná väčšina opozície by sa bola dostala do vlády.Teraz sme sa dostali o krok ďalej než počas predchádzajúcich naliehavých rozpráv. Dodávky pitnej vody skolabovali a cholera žiada obete. To nie je dôvod triumfovať nad slabnúcim protivníkom, ale dôvod pomôcť obyvateľom Zimbabwe. Zaslúžia si lepšiu vládu, ktorú im však nemôže nanútiť nikto zvonka. Jediné, čo môžeme urobiť, je zabrániť pánovi Mugabemu, aby zvonka dostal podporu. ","Erik Meijer,",6,288,not_available,"['dut', 'dut', 'dut', 'dut', 'dut', 'dut']","['  Erik Meijer,  autor. – (NL) Vážená pani predsedajúca, počas predchádzajúcich naliehavých rozpráv na tému Zimbabwe, ktoré sa konali 7. júla 2005 a 24. apríla 2008, som naznačil, ako je možné, že sa pán Mugabe tak dlho udržal pri moci.', 'Obyvatelia Zimbabwe si pamätajú minulosť krajiny plnú násilia. Pre mnohých je prezident Mugabe naďalej hrdinom boja za slobodu. Podľa tohto spôsobu myslenia by sa všetko, čo robí, malo a priori považovať za dobré. Každý, kto mu protirečí, slúži rovnako ako vtedy záujmom iných krajín a v krajine iba privilegovanej väčšine bielych obyvateľov. Ak by pán Mugabe stratil moc, krajina by sa opäť stala kolóniou a väčšina obyvateľov by bola diskriminovaná. Skutočnosť je však iná.', 'Náhly radikalizmus prezidenta Mugabeho spred niekoľkých rokov, keď sa mu vôbec nedarilo zreorganizovať vlastníctvo poľnohospodárskej pôdy a keď dovolil pretrvávanie priepasti medzi bohatými a chudobnými, mu mal najmä zabezpečiť nových prívržencov z mladej generácie a neznepriateliť ešte viac starých druhov.', 'Týmto prístupom síce možno získal viac fanatických a násilných spojencov, ale určite nie podporu väčšiny svojich krajanov. Európa a Amerika roky nesprávne hodnotili situáciu v Zimbabwe, a tým na seba pritiahli podozrenia zo skrytých motívov. Práve tieto nepriateľské postoje umožnili Robertovi Mugabemu zostať pri moci.', 'Teraz, keď si už každý uvedomuje, aká neúčinná a katastrofálna je jeho politika, rastie odpor. Bez zabíjania a zastrašovania by nebol vyhral prezidentské voľby a tesná parlamentná väčšina opozície by sa bola dostala do vlády.', 'Teraz sme sa dostali o krok ďalej než počas predchádzajúcich naliehavých rozpráv. Dodávky pitnej vody skolabovali a cholera žiada obete. To nie je dôvod triumfovať nad slabnúcim protivníkom, ale dôvod pomôcť obyvateľom Zimbabwe. Zaslúžia si lepšiu vládu, ktorú im však nemôže nanútiť nikto zvonka. Jediné, čo môžeme urobiť, je zabrániť pánovi Mugabemu, aby zvonka dostal podporu. ']"
